code,title,size,image_url,torrent_url,tags,actresses,date,page_url
FC2PPV4887481,FC2-PPV-4887481 【無-】先着数量　今春18歳になったばかりの若さ溢れる色白女◯大生　高嶺の花に膣内射精感謝,2.8 GB,https://contents-thumbnail2.fc2.com/w1280/storage201000.contents.fc2.com/file/410/40970911/1777070123.81.jpg,https://onejav.com/torrent/fc2ppv4887481/download/54027717/onejav.com_fc2ppv4887481.torrent,"Amateur, Beautiful Girl, Creampie, FC2, Uncensored",,2026-04-26,https://onejav.com/torrent/fc2ppv4887481
FC2PPV4887487,FC2-PPV-4887487 ※初回数量限定980pt→500pt※【初撮り・顔出し】粉雪の様な綺麗な美白の肌をしている専業主婦の人妻にいきなり全裸でフェラを要求！！,1.4 GB,https://contents-thumbnail2.fc2.com/w1280/storage200000.contents.fc2.com/file/377/37682362/1777070515.36.jpg,https://onejav.com/torrent/fc2ppv4887487/download/92213857/onejav.com_fc2ppv4887487.torrent,"Affair, Amateur, Beautiful Girl, Blow, FC2, Handjob, Married Woman",,2026-04-26,https://onejav.com/torrent/fc2ppv4887487
FC2PPV4887440,FC2-PPV-4887440 ※保管は自己責任【現】巨乳/.系③.年制をﾈｶﾌｪに連れ込み…。いけない事しちゃいました,1.6 GB,https://contents-thumbnail2.fc2.com/w1280/storage200000.contents.fc2.com/file/404/40364366/1777125328.97.jpg,https://onejav.com/torrent/fc2ppv4887440/download/07268390/onejav.com_fc2ppv4887440.torrent,"Amateur, Big Tits, FC2, Outdoors, Uncensored, Uniform",,2026-04-26,https://onejav.com/torrent/fc2ppv4887440
FC2PPV4887513,FC2-PPV-4887513 ポニーテールの正統派美人GAL♡年下彼氏がいるのに裏切りSEX♡ひょっとこフェラでち〇ぽをむさぼるシングルマザー♡,3.5 GB,https://contents-thumbnail2.fc2.com/w1280/storage201000.contents.fc2.com/file/370/36953929/1777074534.87.jpg,https://onejav.com/torrent/fc2ppv4887513/download/09322422/onejav.com_fc2ppv4887513.torrent,"Amateur, Blow, Breasts, Creampie, FC2, Gal, POV, Uncensored",,2026-04-26,https://onejav.com/torrent/fc2ppv4887513
FC2PPV4887618,FC2-PPV-4887618 先着特価【無修正】神スタイルの美女とハメ撮り！中出し★奇跡の美乳・美尻★【顔出し】,3.2 GB,https://contents-thumbnail2.fc2.com/w1280/storage200000.contents.fc2.com/file/410/40970955/1777087681.25.jpg,https://onejav.com/torrent/fc2ppv4887618/download/43338050/onejav.com_fc2ppv4887618.torrent,"Amateur, Beautiful Girl, FC2, POV, Uncensored",,2026-04-26,https://onejav.com/torrent/fc2ppv4887618
STSK221,キャンギャル膣狩り3-狂うほどイカされ精子で汚されたイベントコンパニオン-,7.2 GB,https://pics.dmm.co.jp/mono/movie/adult/h_1605stsk221/h_1605stsk221pl.jpg,https://onejav.com/torrent/stsk221/download/87973626/onejav.com_stsk221.torrent,"3P, 4P, Amateur, Big Tits, Creampie, Evil, Voyeur",,2026-04-26,https://onejav.com/torrent/stsk221
FC2PPV4884534,FC2-PPV-4884534 【無】色白美乳！ウェザーニュース女子アナに居てもおかしくないビジュアル！知的な雰囲気で大人しそうな感じが豹変⤴急に「オ〇サンのチ〇ポ欲しい～」と懇願　ゴックン中だし※特典高画質,4.1 GB,https://contents-thumbnail2.fc2.com/w1280/storage200000.contents.fc2.com/file/381/38003297/1777019759.14.jpg,https://onejav.com/torrent/fc2ppv4884534/download/39799197/onejav.com_fc2ppv4884534.torrent,"Amateur, Beautiful Girl, Big Tits, Blow, Creampie, FC2, POV, Uncensored",,2026-04-25,https://onejav.com/torrent/fc2ppv4884534
FC2PPV4884781,FC2-PPV-4884781 5/7まで990pt!! 彼氏に命令されて仕事帰りに他人チンポにご奉仕　後ろから巨根で何度も突かれて熱々の精液を注ぎ込まれる!,5.4 GB,https://contents-thumbnail2.fc2.com/w1280/storage201000.contents.fc2.com/file/379/37841587/1776671791.9.png,https://onejav.com/torrent/fc2ppv4884781/download/45331283/onejav.com_fc2ppv4884781.torrent,"Amateur, Blow, Breasts, Creampie, FC2, Pregnant, Shaved, Uncensored",,2026-04-25,https://onejav.com/torrent/fc2ppv4884781
FC2PPV4884974,FC2-PPV-4884974 日焼け跡がエロい！【無】【中出し】日焼け跡がエロく、男性経験値の少ない彼氏持ち美女と中出し浮気。電マを当てながら正常位でイっちゃった。※特典あり,2.0 GB,https://contents-thumbnail2.fc2.com/w1280/storage200000.contents.fc2.com/file/393/39207373/1776707067.97.jpg,https://onejav.com/torrent/fc2ppv4884974/download/08530940/onejav.com_fc2ppv4884974.torrent,"Amateur, Beautiful Girl, Blow, Creampie, FC2, OL, POV, Shaved, Uncensored",,2026-04-25,https://onejav.com/torrent/fc2ppv4884974
FC2PPV4885388,FC2-PPV-4885388 【ハメ撮りの快楽】18歳のだ./いが./くせ./いのマシュュマロボディの性欲開放。１周り以上年上のチンポで顔を赤らめイキまくる蜜壺。,7.2 GB,https://contents-thumbnail2.fc2.com/w1280/storage201000.contents.fc2.com/file/286/28519270/1776761553.93.jpg,https://onejav.com/torrent/fc2ppv4885388/download/28816292/onejav.com_fc2ppv4885388.torrent,"Amateur, Black Hair, Breasts, Butt, Creampie, FC2, Long Hair, POV, Shaved, Slender",,2026-04-25,https://onejav.com/torrent/fc2ppv4885388
