code,title,size,image_url,torrent_url,tags,actresses,date,page_url
200GANA3360,【21歳ッッ × 乳で】学校全休、所在なげパンク女子。小陰唇をおっぴろげ、弄られすぎて鉄マ○コもハードコア！ マジ軟派、初撮。 2289,2.2 GB,https://image.mgstage.com/images/nanpatv/200gana/3360/pb_e_200gana-3360.jpg,https://onejav.com/torrent/200gana3360/download/44507536/onejav.com_200gana3360.torrent,"Amateur, Breasts, Female College Student, Nampa, Vibe",,2026-04-27,https://onejav.com/torrent/200gana3360
892OERO002,旦那に内緒でエロがる奥さん。ホテルに入った瞬間「ずっとムラムラしてた…」ってすごい勢いでキス。これからセックスするのに、'こんなモノ(指輪)'いらないよね？俺がどっぷり中出ししてあげるから。【特典映像付き】,3.4 GB,https://image.mgstage.com/images/kyantamaseisouin/892oero/002/pb_e_892oero-002.jpg,https://onejav.com/torrent/892oero002/download/15273368/onejav.com_892oero002.torrent,"Affair, Amateur, Big Tits, Creampie, Married Woman, POV",,2026-04-27,https://onejav.com/torrent/892oero002
FC2PPV4887935,FC2-PPV-4887935 ※5/7まで初回限定70％OFF※【個撮】【AF】桶に嵌っていた人妻を再び桶に嵌め悶絶アナルに極太肉棒挿入,4.0 GB,https://contents-thumbnail2.fc2.com/w1280/storage200000.contents.fc2.com/file/377/37682362/1777130053.15.jpg,https://onejav.com/torrent/fc2ppv4887935/download/24399742/onejav.com_fc2ppv4887935.torrent,"Affair, Amateur, Anal, Big Tits, Blow, Close Up, Creampie, FC2, Married Woman, POV, Shaved",,2026-04-27,https://onejav.com/torrent/fc2ppv4887935
FC2PPV4888016,FC2-PPV-4888016 先着価格【無】身長170cm超え、ファッションモデル体型のまやちゃんをハメ撮り　具合良すぎて過去最高の大量射精【本日限定】,8.0 GB,https://contents-thumbnail2.fc2.com/w1280/storage201000.contents.fc2.com/file/410/40970955/1777172702.27.gif,https://onejav.com/torrent/fc2ppv4888016/download/05569569/onejav.com_fc2ppv4888016.torrent,"Amateur, FC2",,2026-04-27,https://onejav.com/torrent/fc2ppv4888016
FC2PPV4888028,FC2-PPV-4888028 先着価格【無】あきちゃんと初セックス 超美巨乳Hカップ・細身・低身長　～ここにしかないガチ本物素人との本気の性交～【本日限定】,6.9 GB,https://contents-thumbnail2.fc2.com/w1280/storage200000.contents.fc2.com/file/410/40970955/1777172030.29.jpg,https://onejav.com/torrent/fc2ppv4888028/download/00567511/onejav.com_fc2ppv4888028.torrent,"Amateur, FC2, POV, Uncensored",,2026-04-27,https://onejav.com/torrent/fc2ppv4888028
FC2PPV4888175,FC2-PPV-4888175 【個撮】フェラや手コキでぬきぬき！！肉棒を絞り取りまくる！総集編！,3.5 GB,https://contents-thumbnail2.fc2.com/w1280/storage200000.contents.fc2.com/file/403/40214313/1777194085.14.jpg,https://onejav.com/torrent/fc2ppv4888175/download/05985293/onejav.com_fc2ppv4888175.torrent,"Amateur, Blow, FC2",,2026-04-27,https://onejav.com/torrent/fc2ppv4888175
FC2PPV4887669,FC2-PPV-4887669 ブルマコスで爆イキ！白肌Fカップ巨乳をブルブル揺らしてナカイキ懇願！あ”ぁ”…ぐぅ…射精してぇ！！北欧系コスプレイヤーと禁断の中出しハメ撮り！,5.4 GB,https://contents-thumbnail2.fc2.com/w1280/storage200000.contents.fc2.com/file/388/38703450/1777090345.46.jpg,https://onejav.com/torrent/fc2ppv4887669/download/65166151/onejav.com_fc2ppv4887669.torrent,"Amateur, Beautiful Girl, Big Tits, Creampie, FC2, POV, Uncensored",,2026-04-27,https://onejav.com/torrent/fc2ppv4887669
SS147,素人セーラー服生中出し（改） 白木うらら 色白×小乳輪×ツルツルパイパン×笑顔で生中出し,5.8 GB,https://pics.dmm.co.jp/mono/movie/adult/h_113ss147/h_113ss147pl.jpg,https://onejav.com/torrent/ss147/download/37176845/onejav.com_ss147.torrent,"Amateur, Creampie, Masturbation, School Girls, Solowork, Urination",白木うらら,2026-04-27,https://onejav.com/torrent/ss147
CHUC172,天真爛まん20歳差Gカップ巨乳JDとバニーコス生ハメ あずちゃん（23）,2.4 GB,https://pics.dmm.co.jp/mono/movie/adult/h_491chuc172/h_491chuc172pl.jpg,https://onejav.com/torrent/chuc172/download/34818713/onejav.com_chuc172.torrent,"Amateur, Big Tits, Breasts, Creampie, POV",,2026-04-27,https://onejav.com/torrent/chuc172
FC2PPV4887481,FC2-PPV-4887481 【無-】先着数量　今春18歳になったばかりの若さ溢れる色白女◯大生　高嶺の花に膣内射精感謝,2.8 GB,https://contents-thumbnail2.fc2.com/w1280/storage201000.contents.fc2.com/file/410/40970911/1777070123.81.jpg,https://onejav.com/torrent/fc2ppv4887481/download/59584965/onejav.com_fc2ppv4887481.torrent,"Amateur, Beautiful Girl, Creampie, FC2, Uncensored",,2026-04-26,https://onejav.com/torrent/fc2ppv4887481
