code,title,size,image_url,torrent_url,tags,actresses,date,page_url
FC2PPV4897676,FC2-PPV-4897676 【大型新人】初撮り/人生初めての撮影です。※早期特典  上京②ねん.田舎ぽさ残る地味ムスメが応募 、。雨の日・おマン㋙洪水警報発令！！「好きなように使ってください」大量セイエキでご褒美フィニッシュ,4.0 GB,https://contents-thumbnail2.fc2.com/w1280/storage200000.contents.fc2.com/file/359/35808353/1778229404.84.png,https://onejav.com/torrent/fc2ppv4897676/download/59344301/onejav.com_fc2ppv4897676.torrent,"Amateur, Back, Beautiful Girl, Blow, Breasts, Cunnilingus, FC2, POV, Slender",,2026-05-12,https://onejav.com/torrent/fc2ppv4897676
FC2PPV4897688,FC2-PPV-4897688 【初撮り】無修正！！清楚でかわいいせらちゃんはお願いに優しく笑って答えてくれるから孕ませ精子大量中出ししちゃいました♡,4.0 GB,https://contents-thumbnail2.fc2.com/w1280/storage200000.contents.fc2.com/file/407/40685789/1778229734.38.png,https://onejav.com/torrent/fc2ppv4897688/download/06310430/onejav.com_fc2ppv4897688.torrent,"Amateur, Beautiful Girl, FC2, Uncensored",,2026-05-12,https://onejav.com/torrent/fc2ppv4897688
FC2PPV4898104,FC2-PPV-4898104 【合計４発射】趣味のコスプレで夏コミ参戦の長身美女。恥じらいながらも美尻で激しくチンポを締め付け笑顔でオトコの精液を搾り取る。,8.4 GB,https://contents-thumbnail2.fc2.com/w1280/storage200000.contents.fc2.com/file/286/28519270/1778510858.36.jpg,https://onejav.com/torrent/fc2ppv4898104/download/11476904/onejav.com_fc2ppv4898104.torrent,"Amateur, Breasts, Creampie, FC2, Long Hair, POV, Slender, Tall",,2026-05-12,https://onejav.com/torrent/fc2ppv4898104
FC2PPV4898916,FC2-PPV-4898916 70％OFF【初撮り】エロに飢えた彼氏持ち女との初撮り。止まらぬエロスに待ったなしのＮＴＲ！脱がせたらＥカップの綺麗な神乳。ねっとりフェラにたまらず口内射精！最後は中出しフィニッシュ！！,4.8 GB,https://contents-thumbnail2.fc2.com/w1280/storage201000.contents.fc2.com/file/385/38454154/1778433781.71.jpg,https://onejav.com/torrent/fc2ppv4898916/download/73752627/onejav.com_fc2ppv4898916.torrent,"Amateur, Breasts, Creampie, Debut Production, Deep Throating, FC2, POV, Uncensored",,2026-05-12,https://onejav.com/torrent/fc2ppv4898916
FC2PPV4899093,FC2-PPV-4899093 【個人】ハーフ顔の元モデル。妊○４ヶ月で仕事激減、滞納するも過去の栄光から生意気な態度が抜けない、他人棒にも屈しないメンタルを公開中,3.4 GB,https://contents-thumbnail2.fc2.com/w1280/storage200000.contents.fc2.com/file/350/34973626/1778481358.28.jpg,https://onejav.com/torrent/fc2ppv4899093/download/25117542/onejav.com_fc2ppv4899093.torrent,"Amateur, Blow, Breasts, Creampie, FC2, Uncensored",,2026-05-12,https://onejav.com/torrent/fc2ppv4899093
FC2PPV4899139,FC2-PPV-4899139 【無修正】《3日間限定》18歳♡ 配信とかしちゃってる可愛いツルマンにバチボコ生ハメ中出し※未公開特典付き,7.5 GB,https://contents-thumbnail2.fc2.com/w1280/storage200000.contents.fc2.com/file/410/40976927/1778486728.44.jpg,https://onejav.com/torrent/fc2ppv4899139/download/44556281/onejav.com_fc2ppv4899139.torrent,"Amateur, Creampie, FC2, Female College Student, Slender, Uncensored",,2026-05-12,https://onejav.com/torrent/fc2ppv4899139
SDMM231,マジックミラー号 ご夫婦一緒でも構いません！と声をかけ、巷で話題のクイックマッサージを初体験！愛する旦那とはミラー越し30cmの状況で声を我慢すればするほど感じちゃう… 本物人妻が我慢できずにスカートの中で不倫SEX,7.8 GB,https://pics.dmm.co.jp/mono/movie/adult/1sdmm231/1sdmm231pl.jpg,https://onejav.com/torrent/sdmm231/download/33886770/onejav.com_sdmm231.torrent,"Amateur, Blow, Cuckold, Married Woman, Shame",,2026-05-12,https://onejav.com/torrent/sdmm231
390JNT119,【中出し二連発！】【爆潮絶頂】エロい写真をイ●スタにUPしまくる、話題のインフルエンサーanoanoちゃんが降臨！写真よりも何倍も可愛く、そしてどエロい…！揉み心地最高なおっぱいとプリンとしたデカケツ！！そしてHの時はドMに大豹変！「ぼくおま●こおかしくなっちゃったッ！精液でいっぱいにしてぇ」ドスべおねだりしながら、何度も何度も潮吹いてイキまくり！！！！,4.6 GB,https://image.mgstage.com/images/jackson/390jnt/119/pb_e_390jnt-119.jpg,https://onejav.com/torrent/390jnt119/download/22164011/onejav.com_390jnt119.torrent,"Amateur, Big Tits, Creampie, Deep Throating, Masturbation, Squirting",anoano,2026-05-11,https://onejav.com/torrent/390jnt119
SIRO5670,施術より私を責めて...清楚な整体師が桃尻揺らして憧れの男優チ○ポでイキまくる！ 【初撮り】ネットでAV応募→AV体験撮影 2554,2.9 GB,https://image.mgstage.com/images/shirouto/siro/5670/pb_e_siro-5670.jpg,https://onejav.com/torrent/siro5670/download/04151521/onejav.com_siro5670.torrent,"Amateur, Beautiful legs, Debut Production, POV",,2026-05-11,https://onejav.com/torrent/siro5670
FC2PPV4897080,FC2-PPV-4897080 【無】日本男児vs金髪女子 現地で部屋を借りたらポリスが来て疑われたけど、お尻に興奮して思わず入れちゃいました(;'∀') レビューで高画質ＺＩＰ付き 釣り人,2.7 GB,https://contents-thumbnail2.fc2.com/w1280/storage201000.contents.fc2.com/file/358/35743745/1778142779.95.jpg,https://onejav.com/torrent/fc2ppv4897080/download/01161773/onejav.com_fc2ppv4897080.torrent,"Amateur, FC2",,2026-05-11,https://onejav.com/torrent/fc2ppv4897080
