code,title,size,image_url,torrent_url,tags,actresses,date,page_url
FC2PPV4857717,FC2-PPV-4857717 本日迄！限定価格【顔出し/無】これで最後！マン毛もっさり清楚黒髪JD。夢に向かって走り出す。本当のラストSEX。最後は求め合うままに大量中出し,3.8 GB,https://contents-thumbnail2.fc2.com/w1280/storage200000.contents.fc2.com/file/379/37807540/1772456115.81.png,https://onejav.com/torrent/fc2ppv4857717/download/62631548/onejav.com_fc2ppv4857717.torrent,"Amateur, Beautiful Girl, Blow, Breasts, Creampie, FC2, Hot Spring, POV, Uncensored",,2026-03-06,https://onejav.com/torrent/fc2ppv4857717
FC2PPV4858867,FC2-PPV-4858867 【完全顔出し】【メンヘラ】FC2初上陸、メンヘラチックでアニメ声の”このみちゃん”、ガクブルする醜態性が詰まった９０分、もう逝きすぎて立てません！,5.5 GB,https://contents-thumbnail2.fc2.com/w1280/storage200000.contents.fc2.com/file/377/37664104/1772641135.21.jpg,https://onejav.com/torrent/fc2ppv4858867/download/28227592/onejav.com_fc2ppv4858867.torrent,"Amateur, Black Hair, Cosplay, Creampie, Electric Massager, FC2, M女, Nasty, Hardcore",,2026-03-06,https://onejav.com/torrent/fc2ppv4858867
FC2PPV4858872,FC2-PPV-4858872 【無修正ｘ個人撮影】★Kerberos番外編★五十路熟女がトレーニングウェアのまま突かれまくり！ダブルおもちゃ責めで悶絶・絶叫でイキまくってノックアウトｗ,5.7 GB,https://contents-thumbnail2.fc2.com/w1280/storage200000.contents.fc2.com/file/316/31589918/1772644074.75.jpg,https://onejav.com/torrent/fc2ppv4858872/download/35231023/onejav.com_fc2ppv4858872.torrent,"Affair, Amateur, Blow, Cosplay, FC2, Married Woman, Mature Woman, POV, Toy, Uncensored",,2026-03-06,https://onejav.com/torrent/fc2ppv4858872
FC2PPV4858878,FC2-PPV-4858878 【ラスト作品】１９歳 青山学院大生、フェロモン溢れる色白スレンダーな奇跡の軟体美脚む./す./め。後輩ハメ撮り師をひと皮剥けさせる本能的SEX映像。,7.9 GB,https://contents-thumbnail2.fc2.com/w1280/storage201000.contents.fc2.com/file/286/28519270/1772646635.48.jpg,https://onejav.com/torrent/fc2ppv4858878/download/78482532/onejav.com_fc2ppv4858878.torrent,"Amateur, Cosplay, Creampie, FC2, Flexible, Long Hair, POV, Slender, Toy",,2026-03-06,https://onejav.com/torrent/fc2ppv4858878
FC2PPV4859003,FC2-PPV-4859003 一週間50%OFF「豪華7発射」都内で医療系企業勤めスタイル抜群の事務員さん。舌使いでチンポをしゃぶりながらマンコがびしょ濡れ大興奮。ごっくん、顔射、中出し総計7発射肉便器調教しっかりコ作り。,4.0 GB,https://contents-thumbnail2.fc2.com/w1280/storage201000.contents.fc2.com/file/373/37213813/1772683239.2.png,https://onejav.com/torrent/fc2ppv4859003/download/27347862/onejav.com_fc2ppv4859003.torrent,"Amateur, Blow, Creampie, Cum, Facials, FC2, Pregnant, Uncensored",,2026-03-06,https://onejav.com/torrent/fc2ppv4859003
FC2PPV4858283,FC2-PPV-4858283 【個撮・屋外フェラ＆セックス】【2ハメ中出し】&lt;どエロ過ぎるパイパン美人妻～ふたたび&gt;こんなどスケベな奥さんとなら、毎日やりたいpart②!本能丸出し絶頂セックスはたまりません!!,7.9 GB,https://contents-thumbnail2.fc2.com/w1280/storage201000.contents.fc2.com/file/375/37456836/1772531637.94.jpg,https://onejav.com/torrent/fc2ppv4858283/download/61091228/onejav.com_fc2ppv4858283.torrent,"Amateur, Blow, Creampie, FC2, Married Woman, POV, Shaved, Uncensored",,2026-03-05,https://onejav.com/torrent/fc2ppv4858283
FC2PPV4858449,FC2-PPV-4858449 【淫乱マゾ】爆乳ヘンタイマゾレイヤーバチボコ涙目歓喜の生中出し【豊満肉マンコ】,8.4 GB,https://contents-thumbnail2.fc2.com/w1280/storage201000.contents.fc2.com/file/376/37528443/1772589395.02.jpg,https://onejav.com/torrent/fc2ppv4858449/download/04083586/onejav.com_fc2ppv4858449.torrent,"Amateur, Big Tits, Cosplay, FC2, Nasty, Hardcore, Sexy, Squirting",,2026-03-05,https://onejav.com/torrent/fc2ppv4858449
FC2PPV4858569,FC2-PPV-4858569 【期間限定50%tオフ・ごっくん】SNSで応募して来た奥様です　ギャラUPで最後はごっくんまでしてくれました,1.0 GB,https://contents-thumbnail2.fc2.com/w1280/storage200000.contents.fc2.com/file/335/33465695/1772599629.66.jpg,https://onejav.com/torrent/fc2ppv4858569/download/64759788/onejav.com_fc2ppv4858569.torrent,"Amateur, Cum, FC2, Married Woman, Uncensored",,2026-03-05,https://onejav.com/torrent/fc2ppv4858569
FC2PPV4858508,FC2-PPV-4858508 【個撮】生理でも呼べばフェラ抜きに来るデカ尻オナホ肉便器【借〇女33弾】,892.8 MB,https://contents-thumbnail2.fc2.com/w1280/storage201000.contents.fc2.com/file/368/36745557/1772593581.19.jpg,https://onejav.com/torrent/fc2ppv4858508/download/78994806/onejav.com_fc2ppv4858508.torrent,"Amateur, BBW, Blow, FC2, Huge Butt, Mature Woman",,2026-03-05,https://onejav.com/torrent/fc2ppv4858508
DROP135,本気の白濁マン汁を垂れ流してイキまくる！！素人娘のおま〇こズボズボ指オナニー11,5.4 GB,https://pics.dmm.co.jp/mono/movie/adult/h_139drop135/h_139drop135pl.jpg,https://onejav.com/torrent/drop135/download/73161496/onejav.com_drop135.torrent,"Amateur, Close Up, Masturbation, Shame, Squirting",,2026-03-05,https://onejav.com/torrent/drop135
