code,title,size,image_url,torrent_url,tags,actresses,date,page_url
PETS064,素人美女装子が初AV出演！！最初で最後かもしれない貴重な生アナルSEX,4.3 GB,https://pics.dmm.co.jp/mono/movie/adult/pets064/pets064pl.jpg,https://onejav.com/torrent/pets064/download/43254389/onejav.com_pets064.torrent,"Amateur, Anal, Cross Dressing, Debut Production, Transsexual",,2026-03-24,https://onejav.com/torrent/pets064
FC2PPV4867184,FC2-PPV-4867184 20日迄1490pt!!【卒業】※フェラチオネキ引退するってよ、。 雑魚マンに玩具鬼攻め・/最後は㋙づくり中だしフィナーレ！,4.2 GB,https://contents-thumbnail2.fc2.com/w1280/storage201000.contents.fc2.com/file/359/35808353/1773994483.39.jpg,https://onejav.com/torrent/fc2ppv4867184/download/98420487/onejav.com_fc2ppv4867184.torrent,"Amateur, Beautiful Girl, Blow, Breasts, FC2, Model, POV, Slender, Uncensored",,2026-03-24,https://onejav.com/torrent/fc2ppv4867184
FC2PPV4867919,FC2-PPV-4867919 ♡4/5日迄半額【無・完全素人・生中出し】クールビューティー！長身でスレンダーな素敵なOLさんはクリを責められるのが大好きなスケベな女性です。後ろからおじさんの太マラでズコズコ突かれ、中出しされる時の,4.2 GB,https://contents-thumbnail2.fc2.com/w1280/storage201000.contents.fc2.com/file/392/39182810/1774160503.67.jpg,https://onejav.com/torrent/fc2ppv4867919/download/25391782/onejav.com_fc2ppv4867919.torrent,"Amateur, Beautiful legs, Blow, Creampie, Cunnilingus, Electric Massager, FC2, OL, POV, Slender, Squirting, Uncensored",,2026-03-24,https://onejav.com/torrent/fc2ppv4867919
FC2PPV4868160,FC2-PPV-4868160 ※29日まで60％OFF※【清楚/素人】バリバリの就◯生をホテルへ連れ込み生ハメSEX,1.9 GB,https://contents-thumbnail2.fc2.com/w1280/storage201000.contents.fc2.com/file/403/40214313/1774230802.17.jpg,https://onejav.com/torrent/fc2ppv4868160/download/28413064/onejav.com_fc2ppv4868160.torrent,"Amateur, Blow, Creampie, FC2, Footjob, Handjob, POV, Shaved",,2026-03-24,https://onejav.com/torrent/fc2ppv4868160
FC2PPV4868343,FC2-PPV-4868343 【無】【街でナンパ第4章】！X中央公園付近で美人妻をキャッチ→即ハメ成功。白人2人と美乳デカ尻の人妻、背面駅弁で分からせ、2本巨根の連続挿入で絶叫イキまくり地獄！特典付,5.9 GB,https://contents-thumbnail2.fc2.com/w1280/storage201000.contents.fc2.com/file/402/40198932/1774255797.38.jpg,https://onejav.com/torrent/fc2ppv4868343/download/10956103/onejav.com_fc2ppv4868343.torrent,"3P, 4P, Amateur, Beautiful Girl, Breasts, Conceived, Creampie, FC2, Married Woman, Nampa, Orgy, Petite, POV, Pregnant, Uncensored",,2026-03-24,https://onejav.com/torrent/fc2ppv4868343
FC2PPV4867741,FC2-PPV-4867741 【期間限定500円】普通だけどエロい子我慢できず無.許可で中出ししたら涙目。初対面のおじさんに種付けされた挙げ句、オナニー指示されて大量潮吹き,2.8 GB,https://contents-thumbnail2.fc2.com/w1280/storage201000.contents.fc2.com/file/404/40323408/1774146371.74.jpg,https://onejav.com/torrent/fc2ppv4867741/download/46389477/onejav.com_fc2ppv4867741.torrent,"Amateur, Big Tits, Creampie, Dirty Words, FC2",,2026-03-24,https://onejav.com/torrent/fc2ppv4867741
FC2PPV4867944,FC2-PPV-4867944 某A大学のミスコン準グランプリに選ばれた陽菜ちゃんの全世界配信エッチ,3.4 GB,https://contents-thumbnail2.fc2.com/w1280/storage201000.contents.fc2.com/file/405/40430759/1774166197.3.png,https://onejav.com/torrent/fc2ppv4867944/download/64984735/onejav.com_fc2ppv4867944.torrent,"Amateur, FC2",,2026-03-24,https://onejav.com/torrent/fc2ppv4867944
FC2PPV4868087,FC2-PPV-4868087 375_【エグい杭打ち騎乗位】透けパンツローションでクリびくびく→ガニ股ガクガク逝き→ちずちゃんに行列になって生ハメ！激ピス乱交で下品に乱れまくる！3連続中出しフィニッシュ！ちずちゃん第2章【海外版】,6.8 GB,https://contents-thumbnail2.fc2.com/w1280/storage200000.contents.fc2.com/file/387/38642595/1774186577.13.jpg,https://onejav.com/torrent/fc2ppv4868087/download/75597737/onejav.com_fc2ppv4868087.torrent,"Amateur, FC2, Shaved",,2026-03-24,https://onejav.com/torrent/fc2ppv4868087
SDMM228,’FREEZE’し続けられたら賞金ゲット！ どんな妨害をされても絶対に動いちゃダメ！ ウブな女子大生限定！ ノーリアクションで快感ガマン耐久チャレンジ！！,5.7 GB,https://pics.dmm.co.jp/mono/movie/adult/1sdmm228/1sdmm228pl.jpg,https://onejav.com/torrent/sdmm228/download/54325014/onejav.com_sdmm228.torrent,"Amateur, Beautiful Girl, BIGセール, Female College Student, Nampa, Prank",,2026-03-24,https://onejav.com/torrent/sdmm228
200GANA3318,清楚系×最高性欲！ 嫌がるくせに、腰はグイグイ求めたがり！カラダも反応も初々しい箱入り娘が、淫らに落ちてヤリまくり！！ マジ軟派、初撮。 2272,2.5 GB,https://image.mgstage.com/images/nanpatv/200gana/3318/pb_e_200gana-3318.jpg,https://onejav.com/torrent/200gana3318/download/21442689/onejav.com_200gana3318.torrent,"Amateur, Beautiful Girl, Miss, Nampa, Slender",,2026-03-23,https://onejav.com/torrent/200gana3318
