code,title,size,image_url,torrent_url,tags,actresses,date,page_url
300MIUM1354,【独占不倫】近寄りがたいレベルの美人社長。いつもは凛とした顔で高嶺の花ぶってるくせに、ベッドの中じゃ、すぐぐちょぐちょに濡れる従順ま●こ。細い腰をくねらせ悶絶絶頂。欲求不満な高音の花にどっぷり種付け。【独身男性×富裕層既婚女性)】 case.21,3.5 GB,https://image.mgstage.com/images/prestigepremium/300mium/1354/pb_e_300mium-1354.jpg,https://onejav.com/torrent/300mium1354/download/92392742/onejav.com_300mium1354.torrent,"Affair, Amateur, Breasts, Creampie, Facials, Married Woman, POV",,2026-05-09,https://onejav.com/torrent/300mium1354
SIRO5668,「エッチな事が大好きです！」こんなに清楚で純粋で育ちが良さそうな大学生がイキまくり！！？大学生の大胆なイキ様をご覧ください。 【初撮り】ネットでAV応募→AV体験撮影 2553,2.7 GB,https://image.mgstage.com/images/shirouto/siro/5668/pb_e_siro-5668.jpg,https://onejav.com/torrent/siro5668/download/26274138/onejav.com_siro5668.torrent,"Amateur, Debut Production, Finger Fuck, POV, Squirting",,2026-05-09,https://onejav.com/torrent/siro5668
REAL988,ドラッグ×首絞めSEX×ガンギマリ絶頂×快楽中毒 ジャンキー達の常軌を逸したパーティ映像が流出。@いつもの溜まり場,6.3 GB,https://pics.dmm.co.jp/mono/movie/adult/real988/real988pl.jpg,https://onejav.com/torrent/real988/download/07694129/onejav.com_real988.torrent,"Amateur, Documentary, Drug, Nasty, Hardcore, Shaved",,2026-05-09,https://onejav.com/torrent/real988
FC2PPV4870688,FC2-PPV-4870688 ※50個限定【神作】1000年に1度のｶﾞﾁ天使降臨part②。遠隔ﾛｰﾀｰで悶える彼女に興奮抑えきれず奇跡の2連続種付け射精,2.2 GB,https://contents-thumbnail2.fc2.com/w1280/storage200000.contents.fc2.com/file/404/40364366/1774680259.2.jpg,https://onejav.com/torrent/fc2ppv4870688/download/89801646/onejav.com_fc2ppv4870688.torrent,"Amateur, Beautiful Girl, Creampie, FC2, POV, Uncensored",,2026-05-09,https://onejav.com/torrent/fc2ppv4870688
FC2PPV4873485,FC2-PPV-4873485 【7日間限定80％OFF】リピート率100％笑顔が素敵な清楚系美人！スタイルも抜群で、傷一つない美しすぎる肉体がエロ過ぎた♡ 【無修正・中出し】,5.7 GB,https://contents-thumbnail2.fc2.com/w1280/storage201000.contents.fc2.com/file/381/38031442/1778235123.01.png,https://onejav.com/torrent/fc2ppv4873485/download/00054290/onejav.com_fc2ppv4873485.torrent,"Amateur, Beautiful Girl, Blow, Breasts, Butt, Creampie, FC2, POV, Slender, Uncensored",,2026-05-09,https://onejav.com/torrent/fc2ppv4873485
FC2PPV4895087,FC2-PPV-4895087 【無】完全三穴中だし！ゴックン、ア〇ル中だし、おま〇こ中だしの三連発！全部の穴に精〇注入⤴ア〇ル挿入されながら自らデンマでクリ刺激のドスケベ！※特典高画質,3.9 GB,https://contents-thumbnail2.fc2.com/w1280/storage200000.contents.fc2.com/file/381/38003297/1777855385.23.jpg,https://onejav.com/torrent/fc2ppv4895087/download/54107306/onejav.com_fc2ppv4895087.torrent,"Amateur, Beautiful Girl, Big Tits, Blow, Creampie, FC2, POV, Uncensored",,2026-05-09,https://onejav.com/torrent/fc2ppv4895087
FC2PPV4896229,FC2-PPV-4896229 【特典付き】【個人撮影】【顔全出し】結婚式場勤務の巨乳美女、オナニーでは解消できない欲求を全開放♡巨根をハメられて豊満敏感ボディがイキまくる！,2.9 GB,https://contents-thumbnail2.fc2.com/w1280/storage201000.contents.fc2.com/file/399/39896198/1778038843.96.png,https://onejav.com/torrent/fc2ppv4896229/download/37073351/onejav.com_fc2ppv4896229.torrent,"Amateur, Back, Beautiful Girl, Blow, Breasts, Cowgirl, Cunnilingus, Facials, FC2, Finger Fuck, POV, Squirting",,2026-05-09,https://onejav.com/torrent/fc2ppv4896229
FC2PPV4896900,FC2-PPV-4896900 5/22まで990pt!!　8頭身色白美人JD、ワンナイトが忘れられず再び股を開いちゃう♡S級ボディに生中出しでマーキング！,4.0 GB,https://contents-thumbnail2.fc2.com/w1280/storage200000.contents.fc2.com/file/379/37841587/1778123763.6.png,https://onejav.com/torrent/fc2ppv4896900/download/74278440/onejav.com_fc2ppv4896900.torrent,"Amateur, Blow, Breasts, Creampie, FC2, Pregnant, Shaved, Uncensored",,2026-05-09,https://onejav.com/torrent/fc2ppv4896900
FC2PPV4897062,FC2-PPV-4897062 【無.中.顔出し】『あ゛ぁ゛…ギモちいい』色白小ぶりな美乳女子！ノリノリソフトSな焦らしプレイでもうイキそう！最後は下品な声を上げながら濃厚子種をプレゼント※特典高画質,4.3 GB,https://contents-thumbnail2.fc2.com/w1280/storage201000.contents.fc2.com/file/408/40702218/1778140277.67.png,https://onejav.com/torrent/fc2ppv4897062/download/10551160/onejav.com_fc2ppv4897062.torrent,"Amateur, Blow, Creampie, FC2, Handjob, Uncensored",,2026-05-09,https://onejav.com/torrent/fc2ppv4897062
FC2PPV4897072,FC2-PPV-4897072 無修正　初撮り！！まりこちゃん♡ガリ細露理な体におじさん興奮して大量中出し&amp;口内発射！！,6.4 GB,https://contents-thumbnail2.fc2.com/w1280/storage200000.contents.fc2.com/file/407/40685789/1778141919.85.png,https://onejav.com/torrent/fc2ppv4897072/download/14003036/onejav.com_fc2ppv4897072.torrent,"Amateur, Beautiful Girl, FC2, Shaved, Uncensored",,2026-05-09,https://onejav.com/torrent/fc2ppv4897072
