code,title,size,image_url,torrent_url,tags,actresses,date,page_url
GAS539,GAS独占 フォロワー数5.6万人Lカップ裏垢女子 霧ちゃんベスト,5.8 GB,https://pics.dmm.co.jp/mono/movie/adult/71gas539/71gas539pl.jpg,https://onejav.com/torrent/gas539/download/09852315/onejav.com_gas539.torrent,"Amateur, BBW, Best, Omnibus, Big Tits, Titty Fuck",,2026-04-01,https://onejav.com/torrent/gas539
FC2PPV4873166,FC2-PPV-4873166 【無修正】熟⼥、⼈妻、若妻、5⼈の淫乱妻の⼤乱交！！2本組み1時間52分,8.0 GB,https://contents-thumbnail2.fc2.com/w1280/storage201000.contents.fc2.com/file/395/39456556/1774933786.65.jpg,https://onejav.com/torrent/fc2ppv4873166/download/18115327/onejav.com_fc2ppv4873166.torrent,"Amateur, Beautiful Girl, Blow, Breasts, Creampie, Electric Massager, FC2, Married Woman, Mature Woman, Orgy, POV, Toy, Uncensored",,2026-04-01,https://onejav.com/torrent/fc2ppv4873166
FC2PPV4873205,FC2-PPV-4873205 【顔出しサンプル】『143cm本物清純ローカルアイドル出演』”生中出し×白目絶頂×潮吹き噴射” 衝撃4P映像。※残りわずか,6.4 GB,https://contents-thumbnail2.fc2.com/w1280/storage201000.contents.fc2.com/file/393/39269224/1774949307.23.jpg,https://onejav.com/torrent/fc2ppv4873205/download/24060072/onejav.com_fc2ppv4873205.torrent,"Amateur, Beautiful Girl, Big Tits, Blow, Breasts, Close Up, Creampie, FC2, POV, Slender",,2026-04-01,https://onejav.com/torrent/fc2ppv4873205
FC2PPV4869346,FC2-PPV-4869346 【無】グ〇下の地雷系ギャル！話してみると笑顔が凄く可愛い感じでエッチなことも大好き⤴スレンダーボヂィーとニーハイ美脚　潮吹き　ゴックン　中だし　※特典高画質,2.0 GB,https://contents-thumbnail2.fc2.com/w1280/storage200000.contents.fc2.com/file/381/38003297/1774487312.24.jpg,https://onejav.com/torrent/fc2ppv4869346/download/23652743/onejav.com_fc2ppv4869346.torrent,"Amateur, Beautiful Girl, Big Tits, Blow, Creampie, FC2, POV, Uncensored",,2026-04-01,https://onejav.com/torrent/fc2ppv4869346
FC2PPV4872007,FC2-PPV-4872007 襲った後に襲っちゃう！エッチ大好き細身■リデカくりぺったんちゃん新人くじらちゃん！艦これミニムマム皐月ちゃんにたっぷり中出してきましたPart５,3.6 GB,https://contents-thumbnail2.fc2.com/w1280/storage201000.contents.fc2.com/file/391/39020690/1774874483.8.jpg,https://onejav.com/torrent/fc2ppv4872007/download/21067986/onejav.com_fc2ppv4872007.torrent,"Amateur, Beautiful Girl, Beautiful legs, Breasts, Butt, Cosplay, Creampie, FC2, POV, Shaved, Uncensored",,2026-04-01,https://onejav.com/torrent/fc2ppv4872007
FC2PPV4872975,FC2-PPV-4872975 【4/6まで期間限定セール1900→1400】【【閲覧注意】ノド奥をデカチンでボコ突きされてエ〇キ汁噴出しながらミ〇メな挿入〇い【救〇ようのないドM女をデカチンに沼らせました】,3.2 GB,https://contents-thumbnail2.fc2.com/w1280/storage200000.contents.fc2.com/file/324/32305252/1774931126.35.jpg,https://onejav.com/torrent/fc2ppv4872975/download/29969394/onejav.com_fc2ppv4872975.torrent,"Amateur, FC2",,2026-04-01,https://onejav.com/torrent/fc2ppv4872975
200GANA3364,Fカップの家庭教師？存在していいわけないだろ！ お堅い職業のくせに押しに弱くて速攻脱がせてやりましたw結局エロい雰囲気になってチ◯コは触ってくるわでかい尻で自分から腰振るわパイ◯リもしてくれるわでノリノリでしたw マジ軟派、初撮。 2277,2.4 GB,https://image.mgstage.com/images/nanpatv/200gana/3364/pb_e_200gana-3364.jpg,https://onejav.com/torrent/200gana3364/download/93218563/onejav.com_200gana3364.torrent,"Amateur, Nampa, POV",,2026-03-31,https://onejav.com/torrent/200gana3364
FC2PPV4872003,FC2-PPV-4872003 【素人初撮り】まお(20) かわいい理系2回生のアナル舐めさせ、中出しし、連続イキ、アナル貫通ATMの別画角と未公開シーンを収録しました,22.6 GB,https://contents-thumbnail2.fc2.com/w1280/storage200000.contents.fc2.com/file/261/26076760/1774873483.66.jpg,https://onejav.com/torrent/fc2ppv4872003/download/59895777/onejav.com_fc2ppv4872003.torrent,"Amateur, Anal, Beautiful Girl, Blow, Creampie, Deep Throating, FC2, Petite, Shaved, Slender, Tall, Toy, Uncensored",,2026-03-31,https://onejav.com/torrent/fc2ppv4872003
FC2PPV4871181,FC2-PPV-4871181 奇跡の再来！原石発掘しちゃいました！Hの経験が少ないあどけない美女に巨根でゴム無し超大量膣内発射！！,3.3 GB,https://contents-thumbnail2.fc2.com/w1280/storage201000.contents.fc2.com/file/399/39880699/1774747638.56.png,https://onejav.com/torrent/fc2ppv4871181/download/19666937/onejav.com_fc2ppv4871181.torrent,"Amateur, FC2",,2026-03-31,https://onejav.com/torrent/fc2ppv4871181
FC2PPV4871379,FC2-PPV-4871379 【5日間限定販売・薄顔モザイク・セット販売】保証人から自ら債務者へ堕ちた33歳人妻 薄顔モザ完全版,1.9 GB,https://contents-thumbnail2.fc2.com/w1280/storage201000.contents.fc2.com/file/335/33465695/1774774920.77.jpg,https://onejav.com/torrent/fc2ppv4871379/download/52264943/onejav.com_fc2ppv4871379.torrent,"Amateur, FC2, Married Woman, Mature Woman, Uncensored",,2026-03-31,https://onejav.com/torrent/fc2ppv4871379
