code,title,size,image_url,torrent_url,tags,actresses,date,page_url
NPJB121,金欠シングルマザー日払いお手当で欲求不満解放SEX4本完全ノーカット140分BEST,6.1 GB,https://pics.dmm.co.jp/mono/movie/adult/npjb121/npjb121pl.jpg,https://onejav.com/torrent/npjb121/download/25625638/onejav.com_npjb121.torrent,"Amateur, Bride, Young Wife, Creampie, Cuckold, Married Woman",,2026-03-11,https://onejav.com/torrent/npjb121
NSODN015,ヒューマ○コメンタリー エロうまい店の美人店主のヌキありサービスに密着！,4.3 GB,https://pics.dmm.co.jp/mono/movie/adult/nsodn015/nsodn015pl.jpg,https://onejav.com/torrent/nsodn015/download/19281992/onejav.com_nsodn015.torrent,"3P, 4P, Amateur, Big Tits, Blow, Documentary",,2026-03-11,https://onejav.com/torrent/nsodn015
300MIUM1341,【心躍る、巨乳と。】女子大生という確かなブランド価値。甘ったるい声を徐々に濁らせていく猛烈な子宮口ピストン。男が悦ぶ身体の最適解が、これ。,2.4 GB,https://image.mgstage.com/images/prestigepremium/300mium/1341/pb_e_300mium-1341.jpg,https://onejav.com/torrent/300mium1341/download/36597175/onejav.com_300mium1341.torrent,"Amateur, Big Tits, Breasts, Deep Throating, Female College Student, Squirting, Titty Fuck",,2026-03-10,https://onejav.com/torrent/300mium1341
SIRO5636,驚異のIカップ！？マゾっ子金髪美女が初めての男優ち●ぽにイカサレまくる！！ 【初撮り】ネットでAV応募→AV体験撮影 2521,2.6 GB,https://image.mgstage.com/images/shirouto/siro/5636/pb_e_siro-5636.jpg,https://onejav.com/torrent/siro5636/download/56717777/onejav.com_siro5636.torrent,"Amateur, Big Tits, Debut Production, Huge Butt, POV",,2026-03-10,https://onejav.com/torrent/siro5636
FC2PPV4860103,FC2-PPV-4860103 【特典あり】元アイドルのみさおちゃんが、新宿界隈にのめり込んだ結果 ハメ撮りまでしちゃいましたPART２,4.6 GB,https://contents-thumbnail2.fc2.com/w1280/storage201000.contents.fc2.com/file/405/40430759/1772813669.94.png,https://onejav.com/torrent/fc2ppv4860103/download/89736013/onejav.com_fc2ppv4860103.torrent,"Amateur, FC2",,2026-03-10,https://onejav.com/torrent/fc2ppv4860103
FC2PPV4860804,FC2-PPV-4860804 3日間！70OFF【ハメ潮】真面目ちゃんな保育士がまさかのハメ潮！？おもちゃで！手マンで！！ちんこで！！！なに挿れても潮噴いちゃう。豪快ハメ潮にたまらず連続中出し！！,4.5 GB,https://contents-thumbnail2.fc2.com/w1280/storage201000.contents.fc2.com/file/385/38454154/1772987972.78.jpg,https://onejav.com/torrent/fc2ppv4860804/download/51207129/onejav.com_fc2ppv4860804.torrent,"Amateur, Big Tits, Breasts, Creampie, FC2, POV, Squirting, Toy, Uncensored",,2026-03-10,https://onejav.com/torrent/fc2ppv4860804
FC2PPV4861197,FC2-PPV-4861197 【無】女体シェア会 第10章！童顔19歳、1000年に1人のFカップ天使ガチアイドル初降臨。黒人解禁で極上フェラ→そのまま生挿入、2人に連続中出し。【海外版】特典付,3.7 GB,https://contents-thumbnail2.fc2.com/w1280/storage201000.contents.fc2.com/file/402/40198932/1773054691.41.jpg,https://onejav.com/torrent/fc2ppv4861197/download/06820259/onejav.com_fc2ppv4861197.torrent,"3P, 4P, Amateur, Beautiful Girl, Big Tits, Blow, Creampie, FC2, POV, Slender, Uncensored",,2026-03-10,https://onejav.com/torrent/fc2ppv4861197
FC2PPV4861053,FC2-PPV-4861053 【5日間限定販売・薄顔モザイク・再編集版】そして夜になっても犯〇れる34歳人妻　2年ぶりの他人棒が感じすぎて何度でも挿入したい・・・  再編集版,1015.9 MB,https://contents-thumbnail2.fc2.com/w1280/storage200000.contents.fc2.com/file/335/33465695/1773039152.66.jpg,https://onejav.com/torrent/fc2ppv4861053/download/52305920/onejav.com_fc2ppv4861053.torrent,"Amateur, FC2, Married Woman, Mature Woman, Uncensored",,2026-03-10,https://onejav.com/torrent/fc2ppv4861053
SDMM227,マジックミラー号 マンスジくっきり 美ジョガーナンパ ジョギング直後の全身から汗が噴き出る美ジョガーさんの股関節へストレッチ…からの電マ！着衣イキしまくりのアラサーオマ○コはデカチ●ポの誘惑を振り切れるのか？,9.0 GB,https://pics.dmm.co.jp/mono/movie/adult/1sdmm227/1sdmm227pl.jpg,https://onejav.com/torrent/sdmm227/download/88096233/onejav.com_sdmm227.torrent,"Amateur, BIGセール, Blow, Shame, Sport, Sweat",,2026-03-10,https://onejav.com/torrent/sdmm227
200GANA3345,どんな相手ともㇱちゃうセックスエンジョイ勢のまりのちゃん！令和のビッチはセフレなんて作らない。『気にピ』の時点でセックス対象ロックオン待ったなし！！長い美脚を活かした大開脚大絶頂手マン！！からの爆突き！ マジ軟派、初撮。 2269,2.8 GB,https://image.mgstage.com/images/nanpatv/200gana/3345/pb_e_200gana-3345.jpg,https://onejav.com/torrent/200gana3345/download/99435770/onejav.com_200gana3345.torrent,"Amateur, Leg Fetish, Nampa, Older Sister, Tall",,2026-03-09,https://onejav.com/torrent/200gana3345
