code,title,size,image_url,torrent_url,tags,actresses,date,page_url
FC2PPV4857395,FC2-PPV-4857395 【前編】『お嬢様はド変態BODY』SSS級神乳Hカップくびれ爆乳ちゃん 爆乳を生揉み健康診断【４Ｋ】,1.7 GB,https://contents-thumbnail2.fc2.com/w1280/storage200000.contents.fc2.com/file/366/36549441/1772375277.79.jpg,https://onejav.com/torrent/fc2ppv4857395/download/70266898/onejav.com_fc2ppv4857395.torrent,"4K, Amateur, Beautiful Girl, Big Tits, Breasts, FC2, Huge Butt, Ultra-Huge Tits",,2026-03-03,https://onejav.com/torrent/fc2ppv4857395
FC2PPV4857398,FC2-PPV-4857398 【後編】『お嬢様はド変態BODY』SSS級神乳Hカップくびれ爆乳ちゃん 潮吹き手マンからのハメちゃいました健康診断【４Ｋ】,1.7 GB,https://contents-thumbnail2.fc2.com/w1280/storage201000.contents.fc2.com/file/366/36549441/1772375636.32.jpg,https://onejav.com/torrent/fc2ppv4857398/download/22785257/onejav.com_fc2ppv4857398.torrent,"4K, Amateur, Beautiful Girl, Big Tits, Breasts, FC2, Finger Fuck, Huge Butt, Squirting",,2026-03-03,https://onejav.com/torrent/fc2ppv4857398
FC2PPV4857487,FC2-PPV-4857487 【無/期間限定再販】水着沖田さんで大勝利！アヘ顔2発射中出し＆イラマ喉奥射精でドMイキ！,1.9 GB,https://contents-thumbnail2.fc2.com/w1280/storage201000.contents.fc2.com/file/407/40623318/1772417471.23.jpg,https://onejav.com/torrent/fc2ppv4857487/download/42259502/onejav.com_fc2ppv4857487.torrent,"Amateur, Big Tits, Blow, Cosplay, Creampie, FC2, POV",,2026-03-03,https://onejav.com/torrent/fc2ppv4857487
FC2PPV4857655,FC2-PPV-4857655 ムスコの元カノ　デリヘル勤務でオジサンのチンポを毎日しゃぶってるみたいですｗｗ,1.5 GB,https://contents-thumbnail2.fc2.com/w1280/storage200000.contents.fc2.com/file/358/35716993/1772452895.34.jpg,https://onejav.com/torrent/fc2ppv4857655/download/68250345/onejav.com_fc2ppv4857655.torrent,"Amateur, FC2",,2026-03-03,https://onejav.com/torrent/fc2ppv4857655
FC2PPV4854979,FC2-PPV-4854979 30日迄1090pt!!【お宝】※大量潮吹き (大洪水警報発令)小柄美女がヌルヌル、イタズラ、　「今日は何でもしてください。。」 最後は濃いめの精液をたっぷり中出しフィニッシュ,4.4 GB,https://contents-thumbnail2.fc2.com/w1280/storage201000.contents.fc2.com/file/359/35808353/1772444932.23.png,https://onejav.com/torrent/fc2ppv4854979/download/01496596/onejav.com_fc2ppv4854979.torrent,"Amateur, Beautiful Girl, Blow, Creampie, FC2, Petite, POV, Squirting",,2026-03-03,https://onejav.com/torrent/fc2ppv4854979
FC2PPV4855093,FC2-PPV-4855093 みいな22歳・競泳水着・色白黒髪・セフレ。俺のわがままで着せた競泳水着。光沢生地が身体に食い込み、色白のカラダを容赦なく際立たせる…反則級の破壊力。ヤバいwww,8.4 GB,https://contents-thumbnail2.fc2.com/w1280/storage201000.contents.fc2.com/file/407/40692365/1772120729.52.png,https://onejav.com/torrent/fc2ppv4855093/download/16245869/onejav.com_fc2ppv4855093.torrent,"Amateur, Beautiful Girl, Big Tits, Blow, Breasts, Cosplay, FC2, POV",,2026-03-03,https://onejav.com/torrent/fc2ppv4855093
FC2PPV4857426,FC2-PPV-4857426 3日間！90OFF【輪●】Kカップ爆乳アメリカ人を代わる代わるまわしちゃいました。感度良すぎてイキまくる姿はまさにアメリカンドリーム。,5.4 GB,https://contents-thumbnail2.fc2.com/w1280/storage201000.contents.fc2.com/file/385/38454154/1772385622.11.jpg,https://onejav.com/torrent/fc2ppv4857426/download/34252858/onejav.com_fc2ppv4857426.torrent,"Amateur, Big Tits, Creampie, FC2, POV, Squirting, Titty Fuck, Uncensored",,2026-03-03,https://onejav.com/torrent/fc2ppv4857426
FC2PPV4857533,FC2-PPV-4857533 【特典付き】【SSS級】【顔全出し】天然清楚JDがベロキスで即豹変！雌猫喘ぎ連発ww 巨根ディープスロート涙目嗚咽→四つん這いアナル舐め→大量顔射＆お掃除フェラで人生初の快楽ﾄﾞ隷化,2.8 GB,https://contents-thumbnail2.fc2.com/w1280/storage200000.contents.fc2.com/file/399/39896198/1772424720.72.png,https://onejav.com/torrent/fc2ppv4857533/download/86680370/onejav.com_fc2ppv4857533.torrent,"Amateur, FC2",,2026-03-03,https://onejav.com/torrent/fc2ppv4857533
FC2PPV4857680,FC2-PPV-4857680 【素人初撮り】えり(18) 素朴な素人のノーメイク撮影の別画角動画となります。中年男の欲望をなされるがまま無心で淡々と受け入れる,9.4 GB,https://contents-thumbnail2.fc2.com/w1280/storage200000.contents.fc2.com/file/261/26076760/1772447928.69.jpg,https://onejav.com/torrent/fc2ppv4857680/download/83288933/onejav.com_fc2ppv4857680.torrent,"Amateur, Anal, Blow, Creampie, Cum, FC2, Petite, Uncensored",,2026-03-03,https://onejav.com/torrent/fc2ppv4857680
FC2PPV4857683,FC2-PPV-4857683 【㊙お宝放出㊙】ふわふわ系初めてのハメ撮り＆ち./いさ./いマンコに注がれるオジサンの精液。,5.5 GB,https://contents-thumbnail2.fc2.com/w1280/storage200000.contents.fc2.com/file/286/28519270/1772453736.48.jpg,https://onejav.com/torrent/fc2ppv4857683/download/16427367/onejav.com_fc2ppv4857683.torrent,"Amateur, Black Hair, Breasts, Creampie, FC2, POV, Slender",,2026-03-03,https://onejav.com/torrent/fc2ppv4857683
