code,title,size,image_url,torrent_url,tags,actresses,date,page_url
FC2PPV4874397,FC2-PPV-4874397 【無・初】【70%OFF】彼氏の前で美女のらちゃんを巨根黒人2人で激しくハメまくり、最後に大量の２連続生中出しのNTR汗だくハードコア3P,8.6 GB,https://contents-thumbnail2.fc2.com/w1280/storage201000.contents.fc2.com/file/372/37151217/1775113166.07.jpg,https://onejav.com/torrent/fc2ppv4874397/download/66099181/onejav.com_fc2ppv4874397.torrent,"Amateur, Beautiful Girl, Breasts, Butt, Creampie, Debut Production, FC2, Orgy, SM, Uncensored",,2026-04-03,https://onejav.com/torrent/fc2ppv4874397
FC2PPV4874089,FC2-PPV-4874089 ※4/8まで初回限定55％OFF※【オナニー】変態旦那に調教されまくった嫁に久々に再開したので、オナニー見せてもらいました。,1.1 GB,https://contents-thumbnail2.fc2.com/w1280/storage200000.contents.fc2.com/file/377/37682362/1775082930.97.jpg,https://onejav.com/torrent/fc2ppv4874089/download/56647117/onejav.com_fc2ppv4874089.torrent,"Amateur, Beautiful Girl, Electric Massager, FC2, Married Woman, Masturbation, Toy",,2026-04-03,https://onejav.com/torrent/fc2ppv4874089
FC2PPV4874618,FC2-PPV-4874618 【無】【70%OFF】黒人巨根で美乳・デカ尻の美女まいちゃん#3に駅弁で分からせ生中出し孕ませファック！,2.0 GB,https://contents-thumbnail2.fc2.com/w1280/storage201000.contents.fc2.com/file/372/37151217/1775139602.44.jpg,https://onejav.com/torrent/fc2ppv4874618/download/80897811/onejav.com_fc2ppv4874618.torrent,"Amateur, Beautiful Girl, Breasts, Butt, Conceived, Creampie, FC2, POV, Uncensored",,2026-04-03,https://onejav.com/torrent/fc2ppv4874618
FC2PPV4870098,FC2-PPV-4870098 5/1迄 1990pt!!【初】※緊急販売！「早期購入特典」歴代ナンバーワン美女です.(無加工) 顔面偏差値.東大レベル,4.0 GB,https://contents-thumbnail2.fc2.com/w1280/storage200000.contents.fc2.com/file/359/35808353/1774949742.25.jpg,https://onejav.com/torrent/fc2ppv4870098/download/27352381/onejav.com_fc2ppv4870098.torrent,"Amateur, Blow, Breasts, Cunnilingus, FC2, Model, POV, Slender",,2026-04-02,https://onejav.com/torrent/fc2ppv4870098
FC2PPV4873144,FC2-PPV-4873144 【個撮・エロ整体師】&lt;巨乳パイパンNTR&gt;普通の施術から陰部に・・・オッパイに・・・きわどいマッサージで股間を疼かせる欲求不満の人妻にチンポぶち込んで中出し交尾!!,2.5 GB,https://contents-thumbnail2.fc2.com/w1280/storage200000.contents.fc2.com/file/375/37456836/1774931966.25.jpg,https://onejav.com/torrent/fc2ppv4873144/download/87597080/onejav.com_fc2ppv4873144.torrent,"Amateur, Big Tits, Blow, Creampie, FC2, Married Woman, POV, Shaved, Uncensored",,2026-04-02,https://onejav.com/torrent/fc2ppv4873144
FC2PPV4873543,FC2-PPV-4873543 ★顔出し★素人さんがえっちな事をしにやってきた！ケース＃126　左乳が若干大きいFカップ巨乳美女が初めての3Pで激エロに！ るりちゃん（23）の場合,3.2 GB,https://contents-thumbnail2.fc2.com/w1280/storage201000.contents.fc2.com/file/368/36773637/1774984476.2.png,https://onejav.com/torrent/fc2ppv4873543/download/47401748/onejav.com_fc2ppv4873543.torrent,"3P, 4P, Amateur, Big Tits, Breasts, Creampie, FC2, Slender, Tsundere, Uncensored",,2026-04-02,https://onejav.com/torrent/fc2ppv4873543
FC2PPV4873623,FC2-PPV-4873623 秩*の断れない性格のマジメ系介護系専門** 無慈悲なバチボコファックでGo to Hell,6.1 GB,https://contents-thumbnail2.fc2.com/w1280/storage201000.contents.fc2.com/file/376/37528443/1775008912.77.jpg,https://onejav.com/torrent/fc2ppv4873623/download/97092006/onejav.com_fc2ppv4873623.torrent,"Amateur, Creampie, FC2, Nasty, Hardcore, Petite",,2026-04-02,https://onejav.com/torrent/fc2ppv4873623
FC2PPV4873628,FC2-PPV-4873628 【無修正】貴方はどっちのおまんこが好きですか？元アイドルで短大生の涼子ちゃん＆歌舞伎町人気キャバ嬢のツンデレ真子ちゃん。秘蔵エロ出し映像！！,8.1 GB,https://contents-thumbnail2.fc2.com/w1280/storage201000.contents.fc2.com/file/382/38189553/1775009722.47.jpg,https://onejav.com/torrent/fc2ppv4873628/download/14654860/onejav.com_fc2ppv4873628.torrent,"Amateur, Beautiful Girl, Breasts, Close Up, Conceived, Cowgirl, Creampie, FC2, Masturbation, Uncensored",,2026-04-02,https://onejav.com/torrent/fc2ppv4873628
FC2PPV4873552,FC2-PPV-4873552 ♀211 おまんこくぱあインタビュー(♀186) 素朴で笑顔あふれる剛毛あすかちゃんが恥部をがっつり晒しながら自分・人生を語る！ 坑打ち騎乗位で中出し★特典で無修正,1.8 GB,https://contents-thumbnail2.fc2.com/w1280/storage201000.contents.fc2.com/file/376/37547480/1774993045.79.jpg,https://onejav.com/torrent/fc2ppv4873552/download/05734652/onejav.com_fc2ppv4873552.torrent,"Amateur, Creampie, FC2, Petite, Uncensored",,2026-04-02,https://onejav.com/torrent/fc2ppv4873552
GOJU314,初めての聖水飲ませ 戸惑い恥じらう奥様たち2,6.7 GB,https://pics.dmm.co.jp/mono/movie/adult/h_1165goju314/h_1165goju314pl.jpg,https://onejav.com/torrent/goju314/download/42646797/onejav.com_goju314.torrent,"Amateur, Big Tits, Huge Butt, Married Woman, Mature Woman, M男, Other Fetish, Shame, Urination",,2026-04-02,https://onejav.com/torrent/goju314
