code,title,size,image_url,torrent_url,tags,actresses,date,page_url
KEED89,「こするだけなら浮気じゃないでしょ？」愛する彼女の家に一泊二日、妖艶すぎる母親の誘惑に抗えなかったボクは自責の念に駆られながらしこたま射精しまくった 槙野礼香,4.6 GB,https://pics.dmm.co.jp/mono/movie/adult/h_086keed89/h_086keed89pl.jpg,https://onejav.com/torrent/keed89/download/03120754/onejav.com_keed89.torrent,"BIGセール, Creampie, Handjob, Married Woman, Mature Woman, Slut, Solowork",槙野礼香,2026-03-12,https://onejav.com/torrent/keed89
PAKO101,昭和生のドスケベハイレグギャル人妻即尺即ハメビーチナンパ,5.8 GB,https://pics.dmm.co.jp/mono/movie/adult/h_1133pako101/h_1133pako101pl.jpg,https://onejav.com/torrent/pako101/download/39882160/onejav.com_pako101.torrent,"Affair, Amateur, BIGセール, Creampie, Cuckold",,2026-03-12,https://onejav.com/torrent/pako101
FC2PPV4854900,FC2-PPV-4854900 【本日迄！初回限定セール3980pt→980pt】前回大好評18歳激エロスレンダー美女、コスプレ撮影初挑戦！「中にちょうだい♡」とおねだりされたので勿論お望み通りにしちゃいました【無修正・中出し】,4.4 GB,https://contents-thumbnail2.fc2.com/w1280/storage201000.contents.fc2.com/file/381/38031442/1772191590.1.png,https://onejav.com/torrent/fc2ppv4854900/download/73267752/onejav.com_fc2ppv4854900.torrent,"Amateur, Beautiful Girl, Blow, Cosplay, Creampie, FC2, POV, Slender, Toy, Uncensored",,2026-03-12,https://onejav.com/torrent/fc2ppv4854900
FC2PPV4861784,FC2-PPV-4861784 【個撮・大ヒット!続編!】&lt;長〇まさみ激似!パイパン超美人妻&gt;2連続ハメ＆中出し!騎乗位ピストンでアナル全開!大開脚オナニーは超興奮!!,4.2 GB,https://contents-thumbnail2.fc2.com/w1280/storage201000.contents.fc2.com/file/375/37456836/1773140142.99.jpg,https://onejav.com/torrent/fc2ppv4861784/download/71982404/onejav.com_fc2ppv4861784.torrent,"Amateur, Anal, Blow, Creampie, FC2, Married Woman, Masturbation, POV, Uncensored",,2026-03-12,https://onejav.com/torrent/fc2ppv4861784
FC2PPV4861832,FC2-PPV-4861832 ★顔出し★素人さんがえっちな事をしにやってきた！ケース＃123　黒髪ロングJDに似合う深紅のセクシーすぎる下着がエロエロだった　さらちゃん（22）の場合,3.6 GB,https://contents-thumbnail2.fc2.com/w1280/storage200000.contents.fc2.com/file/368/36773637/1773148044.26.jpg,https://onejav.com/torrent/fc2ppv4861832/download/50671712/onejav.com_fc2ppv4861832.torrent,"Amateur, Big Tits, Breasts, Cosplay, Creampie, Electric Massager, FC2, Gal, Sexy, Shaved, Slender, Toy, Uncensored",,2026-03-12,https://onejav.com/torrent/fc2ppv4861832
FC2PPV4861874,FC2-PPV-4861874 ※鬼畜【顔晒し】初心な19歳を調教しﾚｼﾞｪﾝﾄﾞ次郎さんに献上。子宮をガン突きで膣奥中出しで黒歴史確定させました。。。,4.6 GB,https://contents-thumbnail2.fc2.com/w1280/storage200000.contents.fc2.com/file/404/40364366/1773164885.53.jpg,https://onejav.com/torrent/fc2ppv4861874/download/57155990/onejav.com_fc2ppv4861874.torrent,"Amateur, Creampie, FC2, POV, SM, Uncensored",,2026-03-12,https://onejav.com/torrent/fc2ppv4861874
FC2PPV4861886,FC2-PPV-4861886 超剛毛スレンダー!お顔も文句なしの美形で終始えちえち雰囲気♪「もうイキそうなの?もっと我慢していっぱい気持ちいい射精しよ?♡」,8.1 GB,https://contents-thumbnail2.fc2.com/w1280/storage201000.contents.fc2.com/file/393/39294413/1773182793.jpg,https://onejav.com/torrent/fc2ppv4861886/download/02283104/onejav.com_fc2ppv4861886.torrent,"Amateur, Creampie, FC2, POV, Slender",,2026-03-12,https://onejav.com/torrent/fc2ppv4861886
HONB473,媚薬治験バイトのギャル軟派33,2.5 GB,https://pics.dmm.co.jp/mono/movie/adult/h_1133honb473/h_1133honb473pl.jpg,https://onejav.com/torrent/honb473/download/45346111/onejav.com_honb473.torrent,"Blow, Creampie, Gal, POV",,2026-03-12,https://onejav.com/torrent/honb473
HONB474,昭和ならセーフ5,3.3 GB,https://pics.dmm.co.jp/mono/movie/adult/h_1133honb474/h_1133honb474pl.jpg,https://onejav.com/torrent/honb474/download/82332039/onejav.com_honb474.torrent,"Big Tits, Blow, Creampie, POV",,2026-03-12,https://onejav.com/torrent/honb474
420HPT048,ミーナ(24)  素人ホイホイ・素人ホイホイペット・素人・清楚・ギャル・スレンダー・ドM・むっつり・セフレ・とびっこ・野外・羞恥・おもちゃ・中出し・ハメ撮り・ドキュメンタリー,4.1 GB,https://image.mgstage.com/images/hoihoiz/420hpt/048/pb_e_420hpt-048.jpg,https://onejav.com/torrent/420hpt048/download/40439076/onejav.com_420hpt048.torrent,"Amateur, Beautiful Girl, Creampie, Gal, Outdoors, POV, Slender",,2026-03-11,https://onejav.com/torrent/420hpt048
