code,title,size,image_url,torrent_url,tags,actresses,date,page_url
CAWD963,「ゴムなくなっちゃった…生でもいいですよ」終電なくなり後輩女子社員の部屋に… 無防備すぎる部屋着と乳首ポッチに興奮した僕は妻ともしたことない人生初中出し 一晩中モウレツにハメ狂った… 松岡美桜,6.6 GB,https://pics.dmm.co.jp/mono/movie/adult/cawd963/cawd963pl.jpg,https://onejav.com/torrent/cawd963/download/38195041/onejav.com_cawd963.torrent,"Creampie, Cuckold, Drama, Kiss, OL, Solowork",松岡美桜,2026-04-03,https://onejav.com/torrent/cawd963
CLUB913,追跡盗撮 地雷系JD人さらいキメセク×姦,4.7 GB,https://pics.dmm.co.jp/mono/movie/adult/club913/club913pl.jpg,https://onejav.com/torrent/club913/download/88118709/onejav.com_club913.torrent,"Creampie, Female College Student, Huge Cock, Otaku, Voyeur",,2026-04-03,https://onejav.com/torrent/club913
MIDA587,先生と二人できました 僕に想いを寄せてるっぽい女子生徒と2人きりで遠出した、その日に―中出し。 奏海麻衣,5.2 GB,https://pics.dmm.co.jp/mono/movie/adult/mida587/mida587pl.jpg,https://onejav.com/torrent/mida587/download/28023379/onejav.com_mida587.torrent,"Beautiful Girl, Creampie, Glasses, Mini, Petite, POV, Solowork",奏海麻衣,2026-04-03,https://onejav.com/torrent/mida587
DVRT073,女子大生アスリート限定！日頃鍛えた下半身をフル活用して素股マッサージしてもらえませんか？発射させたら賞金100万円！ヌケなかったらぬるっとデカチン挿入生中出し！,6.4 GB,https://pics.dmm.co.jp/mono/movie/adult/dvrt073/dvrt073pl.jpg,https://onejav.com/torrent/dvrt073/download/94109868/onejav.com_dvrt073.torrent,"Athlete, Cowgirl, Creampie, Female College Student, Huge Butt",,2026-04-03,https://onejav.com/torrent/dvrt073
WAAA630,北岡果林の凄テクを我慢できれば生★中出しSEX！,7.2 GB,https://pics.dmm.co.jp/mono/movie/adult/waaa630/waaa630pl.jpg,https://onejav.com/torrent/waaa630/download/44873744/onejav.com_waaa630.torrent,"Blow, Creampie, Fan Appreciation, Handjob, Slut, Solowork",北岡果林,2026-04-03,https://onejav.com/torrent/waaa630
FC2PPV4874397,FC2-PPV-4874397 【無・初】【70%OFF】彼氏の前で美女のらちゃんを巨根黒人2人で激しくハメまくり、最後に大量の２連続生中出しのNTR汗だくハードコア3P,8.6 GB,https://contents-thumbnail2.fc2.com/w1280/storage201000.contents.fc2.com/file/372/37151217/1775113166.07.jpg,https://onejav.com/torrent/fc2ppv4874397/download/66099181/onejav.com_fc2ppv4874397.torrent,"Amateur, Beautiful Girl, Breasts, Butt, Creampie, Debut Production, FC2, Orgy, SM, Uncensored",,2026-04-03,https://onejav.com/torrent/fc2ppv4874397
FC2PPV4874618,FC2-PPV-4874618 【無】【70%OFF】黒人巨根で美乳・デカ尻の美女まいちゃん#3に駅弁で分からせ生中出し孕ませファック！,2.0 GB,https://contents-thumbnail2.fc2.com/w1280/storage201000.contents.fc2.com/file/372/37151217/1775139602.44.jpg,https://onejav.com/torrent/fc2ppv4874618/download/80897811/onejav.com_fc2ppv4874618.torrent,"Amateur, Beautiful Girl, Breasts, Butt, Conceived, Creampie, FC2, POV, Uncensored",,2026-04-03,https://onejav.com/torrent/fc2ppv4874618
DVMM376,解禁！色白狭小オマ○コに手加減ナシでメリメリ挿入！ポルチオ直撃ギガチ○ポ！抜かずのガン突き孕ませプレスで精子ダダ漏れ中出しSEX 望月つぼみ 宮野桜,6.0 GB,https://pics.dmm.co.jp/mono/movie/adult/dvmm376/dvmm376pl.jpg,https://onejav.com/torrent/dvmm376/download/91980937/onejav.com_dvmm376.torrent,"Acme · Orgasm, Beautiful Girl, Black Actor, Creampie, Huge Cock","望月つぼみ, 宮野桜",2026-04-03,https://onejav.com/torrent/dvmm376
HZGD333,,6.0 GB,https://pics.dmm.co.jp/mono/movie/adult/h_1100hzgd333r/h_1100hzgd333rpl.jpg,https://onejav.com/torrent/hzgd333/download/52688823/onejav.com_hzgd333.torrent,"Affair, Big Tits, Creampie, Drama, Married Woman, Solowork",Yuki Yoshizawa,2026-04-03,https://onejav.com/torrent/hzgd333
WAAA631,「セックスの練習させてよ！？」男勝りな幼馴染のモカがコンドーム一個だけを持参してまさかのお願い 俺が思ってた以上にモカのカラダは巨乳ですけべでおま○こ気持ちよくって... 初めてのセックスにハマってしまい未熟おま○こに三日三晩の中出しセックス10発 春陽モカ,4.9 GB,https://pics.dmm.co.jp/mono/movie/adult/waaa631/waaa631pl.jpg,https://onejav.com/torrent/waaa631/download/94960604/onejav.com_waaa631.torrent,"Big Tits, Creampie, Gal, School Girls, Slender, Solowork",春陽モカ,2026-04-03,https://onejav.com/torrent/waaa631
