code,title,size,image_url,torrent_url,tags,actresses,date,page_url
FC2PPV4859818,FC2-PPV-4859818 無修正.腹筋.細身な美⚫︎女にお風呂×歯磨き×の中出し性行為※プライベート映像※ 見かけたことがあるBカップちっぱいぱんを都内で発見.,6.5 GB,https://contents-thumbnail2.fc2.com/w1280/storage200000.contents.fc2.com/file/407/40600830/1772869086.84.png,https://onejav.com/torrent/fc2ppv4859818/download/76301710/onejav.com_fc2ppv4859818.torrent,"Amateur, Breasts, Creampie, FC2, Shaved, Slender, Uncensored",,2026-03-08,https://onejav.com/torrent/fc2ppv4859818
FC2PPV4860280,FC2-PPV-4860280 3日間！70OFF【衝撃のレビュー特典】友達同士の美女とキモ臭男9人が『夢』の共演。なんでも有り！！尻穴まんこW舐め、改造ちんぽ登場に悶絶。変態プレイと情報過多の衝撃作。。【マニアック特典有り】,7.8 GB,https://contents-thumbnail2.fc2.com/w1280/storage200000.contents.fc2.com/file/385/38454154/1772861455.76.jpg,https://onejav.com/torrent/fc2ppv4860280/download/51033684/onejav.com_fc2ppv4860280.torrent,"Amateur, Beautiful legs, Breasts, Butt, Creampie, FC2, Orgy, POV, Uncensored",,2026-03-08,https://onejav.com/torrent/fc2ppv4860280
FC2PPV4859187,FC2-PPV-4859187 ※軽./率な判断/.箱入りむ./す./め//巨乳スレンダーな推し活女子///推しの為なら11万で生ハメ了承。中出しも同然な程に我慢汁を子宮口に擦り付けられて生理が来なくなったハメ撮り記録 #06,6.4 GB,https://contents-thumbnail2.fc2.com/w1280/storage201000.contents.fc2.com/file/407/40661237/1772701834.85.jpg,https://onejav.com/torrent/fc2ppv4859187/download/59362087/onejav.com_fc2ppv4859187.torrent,"Amateur, Beautiful Girl, Big Tits, Creampie, FC2, POV, Slender",,2026-03-07,https://onejav.com/torrent/fc2ppv4859187
FC2PPV4859265,FC2-PPV-4859265 &quot;本編顔出し！＆本編１時間１５分！&quot;続ド美人でドスレンダーな新人ちっこいレイヤーさんでブルアカ制服ホシノやっちゃいました！えっち編２,3.8 GB,https://contents-thumbnail2.fc2.com/w1280/storage201000.contents.fc2.com/file/391/39020690/1772721911.21.jpg,https://onejav.com/torrent/fc2ppv4859265/download/14200566/onejav.com_fc2ppv4859265.torrent,"Amateur, Blow, Breasts, Cosplay, Creampie, FC2, POV, Shaved, Uncensored",,2026-03-07,https://onejav.com/torrent/fc2ppv4859265
FC2PPV4859735,FC2-PPV-4859735 【初回50%オフ・妊娠中♡】 0280_018 みずきちゃん21歳 妊娠6週目！エコー検査で双ゴ妊娠が確定してもオジサンチンポのハードファックがやめられないma.ma失格のドスケベ爆乳Iカップグラドル,4.2 GB,https://contents-thumbnail2.fc2.com/w1280/storage200000.contents.fc2.com/file/383/38288919/1772768778.39.jpg,https://onejav.com/torrent/fc2ppv4859735/download/47715237/onejav.com_fc2ppv4859735.torrent,"Amateur, Beautiful Girl, Big Tits, Conceived, Creampie, FC2, Handjob, Huge Butt, Model, POV, Pregnant, Titty Fuck",,2026-03-07,https://onejav.com/torrent/fc2ppv4859735
FC2PPV4859848,FC2-PPV-4859848 小柄でおさな可愛い144cm卒業前の18歳、大人チ◯ポでめちゃくちゃにされて外に出してとお願いするも無惨な孕ませ大量中出し,3.9 GB,https://contents-thumbnail2.fc2.com/w1280/storage201000.contents.fc2.com/file/383/38266892/1772779771.5.jpg,https://onejav.com/torrent/fc2ppv4859848/download/19153611/onejav.com_fc2ppv4859848.torrent,"Amateur, Creampie, Deep Throating, FC2",,2026-03-07,https://onejav.com/torrent/fc2ppv4859848
ALDN566,あの人妻を孕ませたい 赤井美希,5.6 GB,https://pics.dmm.co.jp/mono/movie/adult/aldn566/aldn566pl.jpg,https://onejav.com/torrent/aldn566/download/62136301/onejav.com_aldn566.torrent,"Creampie, Married Woman, Mature Woman, Solowork",赤井美希,2026-03-07,https://onejav.com/torrent/aldn566
BASJ040,夫のNTR性癖に付き合わされて痴女覚醒する妻 通野未帆,5.8 GB,https://pics.dmm.co.jp/mono/movie/adult/basj040/basj040pl.jpg,https://onejav.com/torrent/basj040/download/72166119/onejav.com_basj040.torrent,"Affair, Creampie, Cuckold, Married Woman, Slut, Solowork",Miho Tsuno,2026-03-07,https://onejav.com/torrent/basj040
CEAD734,勃起チ〇コに逆らえない女～生チン侵入SEXでイキまくる淫乱美熟女 『藤咲紫』,6.4 GB,https://pics.dmm.co.jp/mono/movie/adult/cead734/cead734pl.jpg,https://onejav.com/torrent/cead734/download/91414755/onejav.com_cead734.torrent,"Creampie, Drug, Mature Woman, Nasty, Hardcore, POV, Solowork",藤咲紫,2026-03-07,https://onejav.com/torrent/cead734
CEMD816,感じすぎていっぱいおもらしごめんなさい…53 安野由美,5.2 GB,https://pics.dmm.co.jp/mono/movie/adult/cemd816/cemd816pl.jpg,https://onejav.com/torrent/cemd816/download/73715145/onejav.com_cemd816.torrent,"Acme · Orgasm, Creampie, Mature Woman, Shame, Solowork, Urination",安野由美,2026-03-07,https://onejav.com/torrent/cemd816
