code,title,size,image_url,torrent_url,tags,actresses,date,page_url
FC2PPV4865786,FC2-PPV-4865786 超お金持ちの夫を持つスーパーセレブ 贅沢三昧な強欲爆乳人妻と不倫中出しSEX,4.9 GB,https://contents-thumbnail2.fc2.com/w1280/storage200000.contents.fc2.com/file/297/29683723/1773803311.jpg,https://onejav.com/torrent/fc2ppv4865786/download/08535507/onejav.com_fc2ppv4865786.torrent,"Amateur, Big Tits, Breasts, Creampie, FC2, Married Woman, POV, Slender",,2026-03-23,https://onejav.com/torrent/fc2ppv4865786
FC2PPV4867711,FC2-PPV-4867711 【無・顔出し】新卒Fカップ巨乳にファッションアンケートをするつもりが…徐々にエスカレートし最後は2連発中出しセックス！,7.1 GB,https://contents-thumbnail2.fc2.com/w1280/storage200000.contents.fc2.com/file/343/34292857/1774097256.82.jpg,https://onejav.com/torrent/fc2ppv4867711/download/90938545/onejav.com_fc2ppv4867711.torrent,"Amateur, Beautiful Girl, Beautiful legs, Big Tits, Butt, Creampie, FC2, Slender, Titty Fuck, Uncensored",,2026-03-23,https://onejav.com/torrent/fc2ppv4867711
FC2PPV4868037,FC2-PPV-4868037 【完全シークレット版】【淫乱】【音量注意】【FC2初出演】２４歳IカップOL美奈さん、喘ぎ声が大きすぎて止まりません、脳がとろける程に逝きまくる醜態性が晒されます【第２章】,7.7 GB,https://contents-thumbnail2.fc2.com/w1280/storage201000.contents.fc2.com/file/377/37664104/1774174846.57.jpg,https://onejav.com/torrent/fc2ppv4868037/download/29896092/onejav.com_fc2ppv4868037.torrent,"Amateur, Big Tits, Creampie, Cunnilingus, Dildo, Electric Massager, FC2, Nasty, Hardcore, OL, POV, Uncensored",,2026-03-23,https://onejav.com/torrent/fc2ppv4868037
FC2PPV4867770,FC2-PPV-4867770 ※3/22で終了【ガチ素人】芦屋に住む神スレンダーお嬢様Part②。再販予定なしの超限定販売です。,3.4 GB,https://contents-thumbnail2.fc2.com/w1280/storage200000.contents.fc2.com/file/404/40364366/1774132205.23.jpg,https://onejav.com/torrent/fc2ppv4867770/download/65304030/onejav.com_fc2ppv4867770.torrent,"Amateur, Beautiful Girl, Creampie, FC2, Outdoors, POV, Slender, Uncensored",,2026-03-23,https://onejav.com/torrent/fc2ppv4867770
300MIUM1334,「汗も精子も全部舐めていい？///」男女でカラオケ密室、何も起きないはずが無くww黒髪ギャルのイラマ懇願エロすぎるw皆にバレないようにパコパコしてたらビチャビチャですwww【皆寝てるしヤッちゃわない？】,3.5 GB,https://image.mgstage.com/images/prestigepremium/300mium/1334/pb_e_300mium-1334.jpg,https://onejav.com/torrent/300mium1334/download/04930820/onejav.com_300mium1334.torrent,"Amateur, Creampie, Cum, Deep Throating, POV, Squirting",,2026-03-22,https://onejav.com/torrent/300mium1334
FC2PPV4866805,FC2-PPV-4866805 （無）個人撮影　人妻まい２８才旦那には内緒で調教されていきます,1.3 GB,https://contents-thumbnail2.fc2.com/w1280/storage201000.contents.fc2.com/file/378/37723383/1773949538.35.jpg,https://onejav.com/torrent/fc2ppv4866805/download/30501561/onejav.com_fc2ppv4866805.torrent,"Amateur, Creampie, FC2, Married Woman",,2026-03-22,https://onejav.com/torrent/fc2ppv4866805
FC2PPV4867287,FC2-PPV-4867287 有名アパレル広告掲載中の現*○*モデル登場！！誰もが知っている世界ブランドの日本広告にも出演経験あり！！完全初撮影！！キャバ、風俗、援○一切経験なし、個撮５３４人目,11.0 GB,https://contents-thumbnail2.fc2.com/w1280/storage200000.contents.fc2.com/file/371/37077607/1774009229.66.jpg,https://onejav.com/torrent/fc2ppv4867287/download/40479561/onejav.com_fc2ppv4867287.torrent,"Amateur, Breasts, Creampie, Deep Throating, FC2, Model, Petite, Slender",,2026-03-22,https://onejav.com/torrent/fc2ppv4867287
FC2PPV4867426,FC2-PPV-4867426 【無/本数限定価格】セックスが好きすぎるヘ○ティアコスの素人レイヤーがイキまくる中出しハメ撮り映像！口もま○こもドロドロで最高のドスケベ女神が今夜は君を寝かさないぜ？,1.8 GB,https://contents-thumbnail2.fc2.com/w1280/storage201000.contents.fc2.com/file/399/39824904/1774059071.31.jpg,https://onejav.com/torrent/fc2ppv4867426/download/21925273/onejav.com_fc2ppv4867426.torrent,"Amateur, Big Tits, Blow, Cosplay, Creampie, FC2, POV",,2026-03-22,https://onejav.com/torrent/fc2ppv4867426
FC2PPV4867433,FC2-PPV-4867433 ももかちゃん危険日子宮拡張　本気の妊活＃７,3.3 GB,https://contents-thumbnail2.fc2.com/w1280/storage200000.contents.fc2.com/file/370/36924318/1774060291.11.JPG,https://onejav.com/torrent/fc2ppv4867433/download/09692373/onejav.com_fc2ppv4867433.torrent,"Amateur, Creampie, FC2",,2026-03-22,https://onejav.com/torrent/fc2ppv4867433
FC2PPV4867461,FC2-PPV-4867461 【5日間限定500pt・セット販売】溢れて零れ始めた性欲を我慢出来ない26歳人妻 完全版,1.5 GB,https://contents-thumbnail2.fc2.com/w1280/storage200000.contents.fc2.com/file/335/33465695/1774061269.94.jpg,https://onejav.com/torrent/fc2ppv4867461/download/35476057/onejav.com_fc2ppv4867461.torrent,"3P, 4P, Amateur, Creampie, FC2, Married Woman, Orgy",,2026-03-22,https://onejav.com/torrent/fc2ppv4867461
