code,title,size,image_url,torrent_url,tags,actresses,date,page_url
FC2PPV4901891,FC2-PPV-4901891 【オリー●パ在籍中の美女】スタイル抜群の色白スレンダーなエステティシャン！「特別なマッサージでココロも身体も元気にします♡」敏感な身体にじっくりとオトコのカラダを教え込む！,13.0 GB,https://contents-thumbnail2.fc2.com/w1280/storage201000.contents.fc2.com/file/286/28519270/1779542939.8.jpg,https://onejav.com/torrent/fc2ppv4901891/download/33077804/onejav.com_fc2ppv4901891.torrent,"Amateur, Beautiful legs, Breasts, Butt, Creampie, FC2, POV, Slender, Tall",,2026-05-24,https://onejav.com/torrent/fc2ppv4901891
FC2PPV4904521,FC2-PPV-4904521 Gカップ、クビれボイン！神スタイル！完全初撮影！、号泣、後悔、、NTR、イマラチオ、ビ○○、首○○、パイズリ、アナル舐め、猿ぐつわ、鼻の穴舐め、個撮５４５人目,18.2 GB,https://contents-thumbnail2.fc2.com/w1280/storage200000.contents.fc2.com/file/371/37077607/1779428405.77.jpg,https://onejav.com/torrent/fc2ppv4904521/download/04572883/onejav.com_fc2ppv4904521.torrent,"Amateur, Big Tits, Breasts, Creampie, Deep Throating, FC2, Titty Fuck",,2026-05-24,https://onejav.com/torrent/fc2ppv4904521
FC2PPV4906038,FC2-PPV-4906038 顔出し再販！【無】【生ハメ2回戦】藤田ニ〇ル似の美乳JDは神まんこ。中出しはダメなのにちょい出し(笑)奥が好きみたいですぐイッちゃった。※特典あり,3.0 GB,https://contents-thumbnail2.fc2.com/w1280/storage200000.contents.fc2.com/file/393/39207373/1779457131.57.jpg,https://onejav.com/torrent/fc2ppv4906038/download/71666568/onejav.com_fc2ppv4906038.torrent,"Amateur, Beautiful Girl, Breasts, Creampie, FC2, POV, Uncensored",,2026-05-24,https://onejav.com/torrent/fc2ppv4906038
FC2PPV4906161,FC2-PPV-4906161 存在感溢れるハスキーボイス美女が密会でドM開花騎乗位で何度もハメ潮噴きまくりながらイキ散らかす測定不能のイキ地獄♥,5.1 GB,https://contents-thumbnail2.fc2.com/w1280/storage200000.contents.fc2.com/file/388/38703450/1779503324.21.jpg,https://onejav.com/torrent/fc2ppv4906161/download/88700199/onejav.com_fc2ppv4906161.torrent,"Amateur, Beautiful Girl, Creampie, FC2, POV, Uncensored",,2026-05-24,https://onejav.com/torrent/fc2ppv4906161
CEMD838,ラブホにこもって、一切の台本ナシの●っぱらいSEXデート8 黒咲華,6.1 GB,https://pics.dmm.co.jp/mono/movie/adult/cemd838/cemd838pl.jpg,https://onejav.com/torrent/cemd838/download/55495588/onejav.com_cemd838.torrent,"Acme · Orgasm, Creampie, POV, Shaved, Solowork, Urination",黒咲華,2026-05-24,https://onejav.com/torrent/cemd838
JUAN030,隣の変態親子のために二穴解放する美尻めがね妻 戸田美々香,5.1 GB,https://pics.dmm.co.jp/mono/movie/adult/juan030/juan030pl.jpg,https://onejav.com/torrent/juan030/download/74078052/onejav.com_juan030.torrent,"Anal, Creampie, Glasses, Married Woman, Mature Woman, Solowork",戸田美々香,2026-05-24,https://onejav.com/torrent/juan030
MOND305,綺麗な近所の奥さんが 成宮いろは,6.2 GB,https://pics.dmm.co.jp/mono/movie/adult/mond305/mond305pl.jpg,https://onejav.com/torrent/mond305/download/62493407/onejav.com_mond305.torrent,"Creampie, Married Woman, Mature Woman, Solowork",成宮いろは,2026-05-24,https://onejav.com/torrent/mond305
MRSS185,エロすぎシンママのデカBODY！バレたら人生終了、PTA で仲良くなった近所の人妻と中出しSEX 武田怜香,4.9 GB,https://pics.dmm.co.jp/mono/movie/adult/mrss185/mrss185pl.jpg,https://onejav.com/torrent/mrss185/download/04573277/onejav.com_mrss185.torrent,"Big Tits, Busty Fetish, Creampie, Huge Butt, Married Woman, Solowork",武田怜香,2026-05-24,https://onejav.com/torrent/mrss185
PKPD417,ワタシ、素人になりました 柊（仮）,5.5 GB,https://pics.dmm.co.jp/mono/movie/adult/pkpd417/pkpd417pl.jpg,https://onejav.com/torrent/pkpd417/download/71482116/onejav.com_pkpd417.torrent,"Beautiful Girl, Breasts, Creampie, Huge Butt, POV",,2026-05-24,https://onejav.com/torrent/pkpd417
SMKD009,完全昏眠-4名- 雑魚膣プログラマー（23）/吹奏楽部（18）/文学部教育実習生（23）/アイドルセンター（20）全員中出し 夢遊秒,8.1 GB,https://pics.dmm.co.jp/mono/movie/adult/smkd009/smkd009pl.jpg,https://onejav.com/torrent/smkd009/download/81330120/onejav.com_smkd009.torrent,"Amateur, Big Tits, Bukkake, Creampie, Lotion",,2026-05-24,https://onejav.com/torrent/smkd009
