code,title,size,image_url,torrent_url,tags,actresses,date,page_url
FC2PPV4851386,FC2-PPV-4851386 【※無**今回に限り.】美乳系なやや剛毛美女。ひな25さい♡可愛い子と思いっきりハメ撮りした。ひなのアナルがめっちゃドアップ！大量に精子を放出した２回戦！！後半はスク水着てもらってハメ撮り！,4.7 GB,https://contents-thumbnail2.fc2.com/w1280/storage200000.contents.fc2.com/file/407/40692365/1771515052.13.jpg,https://onejav.com/torrent/fc2ppv4851386/download/63204471/onejav.com_fc2ppv4851386.torrent,"Amateur, Anal, Beautiful Girl, Black Hair, Creampie, FC2, Handjob, POV, Uncensored",,2026-02-28,https://onejav.com/torrent/fc2ppv4851386
FC2PPV4853229,FC2-PPV-4853229 【傑作！】十年ぶりの性交に緊張する超美人奥様（天然美巨乳）。すっごく気持ちよかったらしく3回中出しで大満足！,5.9 GB,https://contents-thumbnail2.fc2.com/w1280/storage200000.contents.fc2.com/file/326/32518753/1771850070.04.jpg,https://onejav.com/torrent/fc2ppv4853229/download/39732221/onejav.com_fc2ppv4853229.torrent,"Affair, Amateur, Creampie, FC2, Married Woman, Mature Woman, POV, Uncensored",,2026-02-28,https://onejav.com/torrent/fc2ppv4853229
FC2PPV4853460,FC2-PPV-4853460 【無】長身黒髪清楚系でスタイル抜群美女！おとなしそうな雰囲気なのにカラダは素直なスケベ大好き⤴ゴックン　中だし　※特典高画質,3.5 GB,https://contents-thumbnail2.fc2.com/w1280/storage201000.contents.fc2.com/file/381/38003297/1771896673.54.jpg,https://onejav.com/torrent/fc2ppv4853460/download/67664078/onejav.com_fc2ppv4853460.torrent,"Amateur, Beautiful Girl, Big Tits, Blow, Creampie, FC2, POV, Uncensored",,2026-02-28,https://onejav.com/torrent/fc2ppv4853460
FC2PPV4855100,FC2-PPV-4855100 【無修正ｘ個人撮影】ドキドキ！公開SEXライブ配信にハマっちゃった♡またまた生放送でやっちゃいます！今度は知らない男性が乱入して3P生配信になりましたｗ,4.5 GB,https://contents-thumbnail2.fc2.com/w1280/storage201000.contents.fc2.com/file/316/31589918/1772122376.42.jpg,https://onejav.com/torrent/fc2ppv4855100/download/80083996/onejav.com_fc2ppv4855100.torrent,"3P, 4P, Amateur, Back, Big Tits, Breasts, Cowgirl, Creampie, FC2, Petite, Uncensored",,2026-02-28,https://onejav.com/torrent/fc2ppv4855100
FC2PPV4856207,FC2-PPV-4856207 【無・顔出し】吉◯由里子似爆美女の第2弾！何も知らせず初対面野郎どもと制服姿で大乱交失神寸前汗だく中出し5Pスペシャル,3.6 GB,https://contents-thumbnail2.fc2.com/w1280/storage200000.contents.fc2.com/file/343/34292857/1772173966.97.png,https://onejav.com/torrent/fc2ppv4856207/download/28144869/onejav.com_fc2ppv4856207.torrent,"Amateur, Beautiful Girl, Beautiful legs, Breasts, Butt, Creampie, FC2, Orgy, Slender, Sweat, Uncensored, Uniform",,2026-02-28,https://onejav.com/torrent/fc2ppv4856207
FC2PPV4856210,FC2-PPV-4856210 【ドM覚醒】入社からもうすぐ一年の女子アナ！ストレス発散でカラオケで美声披露にホテルでマン汁垂れ流し♥最後はベッドで中出し強制フィニッシュ♥,4.1 GB,https://contents-thumbnail2.fc2.com/w1280/storage200000.contents.fc2.com/file/388/38703450/1772174055.11.jpg,https://onejav.com/torrent/fc2ppv4856210/download/23495279/onejav.com_fc2ppv4856210.torrent,"Amateur, Anchorwoman, Beautiful Girl, Creampie, FC2, POV, Slender, Uncensored",,2026-02-28,https://onejav.com/torrent/fc2ppv4856210
FC2PPV4854425,FC2-PPV-4854425 ※初回のみ※148cm＊上玉降臨＊透明感が凄まじいアイドル級のめっかわ歯科衛生士さん（２０）をちんぽで突いてたらエロ過ぎるメスになりました（つぼみん）,1.7 GB,https://contents-thumbnail2.fc2.com/w1280/storage200000.contents.fc2.com/file/389/38821312/1772017775.67.jpg,https://onejav.com/torrent/fc2ppv4854425/download/35446058/onejav.com_fc2ppv4854425.torrent,"Amateur, Blow, Breasts, Butt, Creampie, Facials, FC2, Nasty, Hardcore, Petite, POV, Slender, Slut",,2026-02-28,https://onejav.com/torrent/fc2ppv4854425
ADN760,新しいお母さんとセックスした話 森沢かな,4.2 GB,https://pics.dmm.co.jp/mono/movie/adult/adn760/adn760pl.jpg,https://onejav.com/torrent/adn760/download/91987713/onejav.com_adn760.torrent,"Creampie, Drama, Mother, Solowork, Stepmother",飯岡かなこ,2026-02-28,https://onejav.com/torrent/adn760
ALDN564,娘の彼と… 密会中出し続ける日々 美原すみれ,4.2 GB,https://pics.dmm.co.jp/mono/movie/adult/aldn564/aldn564pl.jpg,https://onejav.com/torrent/aldn564/download/12897207/onejav.com_aldn564.torrent,"Big Tits, Creampie, Married Woman, Mature Woman, Solowork",美原すみれ,2026-02-28,https://onejav.com/torrent/aldn564
BAB184,胸糞可愛い褐色泥●美ギャルに即尺・連続中複数プレイ クラブナンパ HANA 黒咲華,4.3 GB,https://pics.dmm.co.jp/mono/movie/adult/bab184/bab184pl.jpg,https://onejav.com/torrent/bab184/download/76902087/onejav.com_bab184.torrent,"Big Tits, Creampie, Gal, Huge Butt, Nampa, Solowork",黒咲華,2026-02-28,https://onejav.com/torrent/bab184
