code,title,size,image_url,torrent_url,tags,actresses,date,page_url
BANK233,ピンクま●こ美少女達とイタズラ温泉旅行,8.5 GB,https://pics.dmm.co.jp/mono/movie/adult/h_1495bank233/h_1495bank233pl.jpg,https://onejav.com/torrent/bank233/download/43829618/onejav.com_bank233.torrent,"3P, 4P, Beautiful Girl, BIGセール, Creampie, Facials, Hot Spring, Pantyhose, School Girls, Shaved, Uniform, Urination",,2026-03-15,https://onejav.com/torrent/bank233
BANK234,巨乳人妻温泉デート 仕方なくカラダを売る新婚妻 葵27歳,5.0 GB,https://pics.dmm.co.jp/mono/movie/adult/h_1495bank234/h_1495bank234pl.jpg,https://onejav.com/torrent/bank234/download/28074597/onejav.com_bank234.torrent,"Big Tits, BIGセール, Creampie, Hot Spring, Kimono, Yukata, Married Woman, Masturbation, Titty Fuck",,2026-03-15,https://onejav.com/torrent/bank234
SKMJ729,週3でママさんバレーに通う欲求不満を隠せない素人ご無沙汰妻が挑戦！？むちむちのデカ尻素股！旦那より若く反り返ったデカチンに赤面発情！そのままヌルっとバックで奥まで挿入＆生中出しSEX！,6.5 GB,https://pics.dmm.co.jp/mono/movie/adult/h_1324skmj729/h_1324skmj729pl.jpg,https://onejav.com/torrent/skmj729/download/06200068/onejav.com_skmj729.torrent,"Amateur, BIGセール, Creampie, Married Woman, Nampa, Planning",,2026-03-15,https://onejav.com/torrent/skmj729
FC2PPV4862980,FC2-PPV-4862980 日体大陸上部で鍛えられた細身スレンダーな美女再び！恥じらいつつも濡れる蜜壺。アスリートの性欲がとまらない！心とカラダを潤すオトコのザーメン。,6.4 GB,https://contents-thumbnail2.fc2.com/w1280/storage200000.contents.fc2.com/file/286/28519270/1773334442.06.jpg,https://onejav.com/torrent/fc2ppv4862980/download/61840749/onejav.com_fc2ppv4862980.torrent,"Amateur, Breasts, Butt, Creampie, FC2, POV, Slender",,2026-03-15,https://onejav.com/torrent/fc2ppv4862980
FC2PPV4863589,FC2-PPV-4863589 良い体！良い声！【無】【中出し】声優を夢見るOLさんは美ボディに美声、そして敏感。どこを責めても気持ち良さそうにするので楽しい。最後は中出し。※特典あり,2.6 GB,https://contents-thumbnail2.fc2.com/w1280/storage201000.contents.fc2.com/file/394/39388805/1773414379.02.jpg,https://onejav.com/torrent/fc2ppv4863589/download/97689945/onejav.com_fc2ppv4863589.torrent,"Amateur, Beautiful legs, Blow, Breasts, Creampie, FC2, OL, POV, Shaved, Slender, Uncensored",,2026-03-15,https://onejav.com/torrent/fc2ppv4863589
FC2PPV4863607,FC2-PPV-4863607 ※凍/〇濃厚【超乳】身分証と職場抑えて無〇やりハメ撮りした動画。声我慢しながら中出しはエロすぎる,2.4 GB,https://contents-thumbnail2.fc2.com/w1280/storage200000.contents.fc2.com/file/404/40364366/1773425395.73.jpg,https://onejav.com/torrent/fc2ppv4863607/download/25689602/onejav.com_fc2ppv4863607.torrent,"Amateur, Big Tits, Breasts, Butt, Creampie, FC2, Outdoors, POV, Ultra-Huge Tits, Uncensored",,2026-03-15,https://onejav.com/torrent/fc2ppv4863607
FC2PPV4863694,FC2-PPV-4863694 何度も遊んだ元生意気金髪ギャルがまさかの清楚黒髪でおしとやかに大変身♥再会記念の生ハメに理性が決壊寸前♥,4.3 GB,https://contents-thumbnail2.fc2.com/w1280/storage201000.contents.fc2.com/file/388/38703450/1773455652.71.jpg,https://onejav.com/torrent/fc2ppv4863694/download/48023682/onejav.com_fc2ppv4863694.torrent,"Amateur, Black Hair, Creampie, FC2, POV, Slender, Uncensored",,2026-03-15,https://onejav.com/torrent/fc2ppv4863694
FC2PPV4863907,FC2-PPV-4863907 【無】【期間限定公開】誕生日に黒人３P！！彼氏の目の前で美人彼女KAO#2と巨根黒人2人で破壊してNTR生中出し3Pしてきた！,5.5 GB,https://contents-thumbnail2.fc2.com/w1280/storage200000.contents.fc2.com/file/372/37151217/1773481055.91.jpg,https://onejav.com/torrent/fc2ppv4863907/download/22033256/onejav.com_fc2ppv4863907.torrent,"Amateur, Beautiful Girl, Breasts, Creampie, FC2, Uncensored",,2026-03-15,https://onejav.com/torrent/fc2ppv4863907
SKMJ726,聖母のように優しくて可愛いナースさん！「早漏に悩む童貞君の暴発改善のお手伝いしてくれませんか？」男性器慣れしているようで意外とウブな看護師さんが早漏すぎる童貞君にムラムラ膣キュンしちゃって生中出し筆おろしSPECIAL！,8.5 GB,https://pics.dmm.co.jp/mono/movie/adult/h_1324skmj726/h_1324skmj726pl.jpg,https://onejav.com/torrent/skmj726/download/67172285/onejav.com_skmj726.torrent,"Amateur, Beautiful Girl, Big Tits, BIGセール, Cowgirl, Creampie, Handjob, Nurse, Slender, Virgin Man",,2026-03-15,https://onejav.com/torrent/skmj726
326FCT216,経験たった3人の元音大生22歳が彼氏に内緒で中出しハメ撮りｗｗ中イキ未体験のド素人女子が自ら腰振り大量潮吹き絶頂！,3.8 GB,https://image.mgstage.com/images/kurofune/326fct/216/pb_e_326fct-216.jpg,https://onejav.com/torrent/326fct216/download/65177768/onejav.com_326fct216.torrent,"Amateur, Big Tits, Creampie, Masturbation, POV, Slender, Squirting",うみ,2026-03-14,https://onejav.com/torrent/326fct216
