code,title,size,image_url,torrent_url,tags,actresses,date,page_url
HMN867,ガチ人妻、旦那公認、本物中出しAV出演。脱いだら凄い。美クビレGカップ巨乳妻の変態ネトラセ性交ドキュメント。,7.6 GB,https://pics.dmm.co.jp/mono/movie/adult/hmn867/hmn867pl.jpg,https://onejav.com/torrent/hmn867/download/86951691/onejav.com_hmn867.torrent,"3P, 4P, Creampie, Cuckold, Debut Production, Married Woman",,2026-05-15,https://onejav.com/torrent/hmn867
C2968,うちの妻・Y梨（34）を寝取ってください133,6.3 GB,https://pics.dmm.co.jp/mono/movie/adult/140c2968/140c2968pl.jpg,https://onejav.com/torrent/c2968/download/25107811/onejav.com_c2968.torrent,"Cuckold, Married Woman",唐木竹史,2026-05-13,https://onejav.com/torrent/c2968
SDMM231,マジックミラー号 ご夫婦一緒でも構いません！と声をかけ、巷で話題のクイックマッサージを初体験！愛する旦那とはミラー越し30cmの状況で声を我慢すればするほど感じちゃう… 本物人妻が我慢できずにスカートの中で不倫SEX,7.8 GB,https://pics.dmm.co.jp/mono/movie/adult/1sdmm231/1sdmm231pl.jpg,https://onejav.com/torrent/sdmm231/download/53779908/onejav.com_sdmm231.torrent,"Amateur, Blow, Cuckold, Married Woman, Shame",,2026-05-12,https://onejav.com/torrent/sdmm231
START545,マジックミラーペアルームNTRエステ 真横に彼氏がいるのに、全身愛撫されて声我慢しながらサイレント絶頂 小笠原菜乃,7.4 GB,https://pics.dmm.co.jp/mono/movie/adult/1start545/1start545pl.jpg,https://onejav.com/torrent/start545/download/32549282/onejav.com_start545.torrent,"Acme · Orgasm, Beauty Shop, Big Tits, Cuckold, Solowork",小笠原菜乃,2026-05-12,https://onejav.com/torrent/start545
GVH843,僕のことが大好きな彼女のメンヘラ妹・夏歩ちゃんにひたすら束縛され続ける喜怒哀楽フェラチオ搾精生活。 花守夏歩,6.8 GB,https://pics.dmm.co.jp/mono/movie/adult/gvh843/gvh843pl.jpg,https://onejav.com/torrent/gvh843/download/11985637/onejav.com_gvh843.torrent,"Beautiful Girl, Blow, Cuckold, Huge Butt, Slut, Solowork",花守夏歩,2026-05-09,https://onejav.com/torrent/gvh843
DVAJ739,バイト先の人妻と不倫性交に燃え上がった日々 黒咲華,5.1 GB,https://pics.dmm.co.jp/mono/movie/adult/dvaj739/dvaj739pl.jpg,https://onejav.com/torrent/dvaj739/download/92630934/onejav.com_dvaj739.torrent,"Affair, Big Tits, Creampie, Cuckold, Drama, Gal, Huge Butt, Married Woman, Solowork, Sun tan",黒咲華,2026-05-09,https://onejav.com/torrent/dvaj739
EKDV817,童貞は幼なじみに奪われました…初めて彼女のできた童貞のボクのためセックスの練習相手になってくれたからかい女神な幼なじみ 逢沢みゆ,6.0 GB,https://pics.dmm.co.jp/mono/movie/adult/ekdv817/ekdv817pl.jpg,https://onejav.com/torrent/ekdv817/download/71767605/onejav.com_ekdv817.torrent,"Big Tits, Childhood Friend, Cowgirl, Creampie, Cuckold, Facials, Footjob, Kiss, Solowork, Uniform, Virgin Man",逢沢みゆ,2026-05-09,https://onejav.com/torrent/ekdv817
DLDSS495,これから親父が義母さんを抱く前に僕が孕ませてあげるからー。 小沢菜穂,5.5 GB,https://pics.dmm.co.jp/mono/movie/adult/1dldss495/1dldss495pl.jpg,https://onejav.com/torrent/dldss495/download/88893714/onejav.com_dldss495.torrent,"Creampie, Cuckold, Married Woman, Mature Woman, Solowork, Stepmother",小沢菜穂,2026-05-09,https://onejav.com/torrent/dldss495
NGOD334,ポリネシアンSEXの妻 ゆっくりねっとり5日間かけ焦らし高める南太平洋発祥の究極スローSEXでねとられて…,6.5 GB,https://pics.dmm.co.jp/mono/movie/adult/ngod334/ngod334pl.jpg,https://onejav.com/torrent/ngod334/download/82858030/onejav.com_ngod334.torrent,"Big Tits, Creampie, Cuckold, Married Woman, Solowork",Nozomi Arimura,2026-05-08,https://onejav.com/torrent/ngod334
NGOD339,人妻女教師 ～背徳の放課後巨根～教え子のデカチンに「ダメ」とわかっているのにイカされて…,4.2 GB,https://pics.dmm.co.jp/mono/movie/adult/ngod339/ngod339pl.jpg,https://onejav.com/torrent/ngod339/download/77393726/onejav.com_ngod339.torrent,"Affair, Cuckold, Female Teacher, Huge Cock, Married Woman, Solowork",安位薫,2026-05-08,https://onejav.com/torrent/ngod339
