code,title,size,image_url,torrent_url,tags,actresses,date,page_url
MIAB665,妊活エステNTR卑猥な施術師の猥褻体質改善メソッド敏感乳首イキ失禁するカラダに変えられた人妻（わたし） 幸村泉希,5.8 GB,https://pics.dmm.co.jp/mono/movie/adult/miab665/miab665pl.jpg,https://onejav.com/torrent/miab665/download/00769683/onejav.com_miab665.torrent,"Beauty Shop, Creampie, Cuckold, Lotion, Married Woman, Solowork",幸村泉希,2026-05-29,https://onejav.com/torrent/miab665
MIDA655,三角関係だった親友に1日限定で彼女を差し出したら身も心も寝取られてしまったお話です。 八木奈々,8.0 GB,https://pics.dmm.co.jp/mono/movie/adult/mida655/mida655pl.jpg,https://onejav.com/torrent/mida655/download/00053893/onejav.com_mida655.torrent,"Beautiful Girl, Cuckold, Drama, POV, Slender, Solowork",Nana Yagi,2026-05-29,https://onejav.com/torrent/mida655
MIDA657,地味めがね巨乳の人妻介護士をいいなり早漏体質にした尿失禁孕ませ痴●電車 天宮花南,7.6 GB,https://pics.dmm.co.jp/mono/movie/adult/mida657/mida657pl.jpg,https://onejav.com/torrent/mida657/download/72701908/onejav.com_mida657.torrent,"Beautiful Girl, Creampie, Cuckold, Married Woman, Solowork, Urination",Kanan Amamiya,2026-05-29,https://onejav.com/torrent/mida657
MIDA659,親友の彼女の悩みを聞くフリして媚薬漬けリモバイ調教とデカチン膣奥ピストンで沼らせるお漏らしザコま●こ開発NTR 川口桜,6.9 GB,https://pics.dmm.co.jp/mono/movie/adult/mida659/mida659pl.jpg,https://onejav.com/torrent/mida659/download/70747867/onejav.com_mida659.torrent,"Beautiful Girl, Cuckold, Huge Cock, Solowork, Toy, Uniform",川口桜,2026-05-29,https://onejav.com/torrent/mida659
MIMK277,抵抗する彼女を無視して無許可中出しをキメた彼氏が頼んでしまったのは… リピート率100％精子掻き出しサービス,4.5 GB,https://pics.dmm.co.jp/mono/movie/adult/mimk277/mimk277pl.jpg,https://onejav.com/torrent/mimk277/download/14994477/onejav.com_mimk277.torrent,"Acme · Orgasm, Creampie, Cuckold, Original Collaboration, Squirting",,2026-05-29,https://onejav.com/torrent/mimk277
SAME236,夫の身代わり肉便器に堕ちた人妻。 種付けプレス串刺し輪●,4.8 GB,https://pics.dmm.co.jp/mono/movie/adult/same236/same236pl.jpg,https://onejav.com/torrent/same236/download/98497728/onejav.com_same236.torrent,"3P, 4P, Creampie, Cuckold, Drama, Married Woman, Solowork",Rio Kuriyama,2026-05-29,https://onejav.com/torrent/same236
ADN777,あなた、許して…。 迷い妻2,5.5 GB,https://pics.dmm.co.jp/mono/movie/adult/adn777/adn777pl.jpg,https://onejav.com/torrent/adn777/download/67610442/onejav.com_adn777.torrent,"Affair, Big Tits, Creampie, Cuckold, Married Woman, Solowork",Marina Shiraishi,2026-05-29,https://onejav.com/torrent/adn777
ATID677,「コンドーム破けてたから責任取ってよ！」酔った勢いで会社の同僚とハメた日から、一夜限りの過ちの筈が何故か僕の彼女になっていて…。,5.2 GB,https://pics.dmm.co.jp/mono/movie/adult/atid677/atid677pl.jpg,https://onejav.com/torrent/atid677/download/69194933/onejav.com_atid677.torrent,"Big Tits, Creampie, Cuckold, Slut, Solowork, Subordinates, Colleagues",美園和花,2026-05-29,https://onejav.com/torrent/atid677
VEC779,スケスケの服をきた隣の人妻～シースルー誘惑の甘い罠～ 流川莉央,4.0 GB,https://pics.dmm.co.jp/mono/movie/adult/vec779/vec779pl.jpg,https://onejav.com/torrent/vec779/download/76063439/onejav.com_vec779.torrent,"Creampie, Cuckold, Married Woman, Mature Woman, Slut, Solowork",Rio Nagarekawa,2026-05-29,https://onejav.com/torrent/vec779
DVRT075,義父のワシを冷遇してきた巨乳嫁が勃起薬でガンギマリ！胸糞エロすぎて思わずズボハメしたら下品すぎるアへ顔でイキまくるんで中出しをヤメられない！！ 美丘さとみ,6.0 GB,https://pics.dmm.co.jp/mono/movie/adult/dvrt075/dvrt075pl.jpg,https://onejav.com/torrent/dvrt075/download/17203341/onejav.com_dvrt075.torrent,"Big Tits, Creampie, Cuckold, Huge Butt, Solowork, Titty Fuck",美丘さとみ,2026-05-29,https://onejav.com/torrent/dvrt075
