code,title,size,image_url,torrent_url,tags,actresses,date,page_url
BASJ040,夫のNTR性癖に付き合わされて痴女覚醒する妻 通野未帆,5.8 GB,https://pics.dmm.co.jp/mono/movie/adult/basj040/basj040pl.jpg,https://onejav.com/torrent/basj040/download/03392745/onejav.com_basj040.torrent,"Affair, Creampie, Cuckold, Married Woman, Slut, Solowork",Miho Tsuno,2026-03-07,https://onejav.com/torrent/basj040
GVH826,【人間失格】さんざんレ×プやぶっかけされた憧れのあの子を見て、クズ射精を何度もキメてしまった僕 虹村ゆみ,6.6 GB,https://pics.dmm.co.jp/mono/movie/adult/gvh826/gvh826pl.jpg,https://onejav.com/torrent/gvh826/download/70187156/onejav.com_gvh826.torrent,"Bloomers, Creampie, Cuckold, Facials, School Girls, Solowork",虹村ゆみ,2026-03-07,https://onejav.com/torrent/gvh826
MADV623,競泳水着NTR 巨乳で美尻な近隣美女のハイレグエロボディにフル勃起 結婚しているにも関わらず濃厚SEXで何度もイカされちゃいました 松本菜奈実,6.0 GB,https://pics.dmm.co.jp/mono/movie/adult/madv623/madv623pl.jpg,https://onejav.com/torrent/madv623/download/39876003/onejav.com_madv623.torrent,"Affair, Big Tits, Butt, Creampie, Cuckold, Facials, Lotion, Masturbation, School Swimsuit, Solowork, Titty Fuck",Nanami Matsumoto,2026-03-07,https://onejav.com/torrent/madv623
DASS909,派遣マッサージ師にきわどい秘部を触られすぎて、快楽に耐え切れず寝取られました。 木村玲衣,6.4 GB,https://pics.dmm.co.jp/mono/movie/adult/dass909/dass909pl.jpg,https://onejav.com/torrent/dass909/download/43871290/onejav.com_dass909.torrent,"Big Tits, Creampie, Cuckold, Massage, Mature Woman, Solowork",木村玲衣,2026-03-06,https://onejav.com/torrent/dass909
DASS928,おらのオ○コに1ッ発2発と並々精子溢れるくらい中出ししてほしいっぺよ。下品マラ中毒の田舎純情イモ娘。 宍戸里帆,6.7 GB,https://pics.dmm.co.jp/mono/movie/adult/dass928/dass928pl.jpg,https://onejav.com/torrent/dass928/download/32621237/onejav.com_dass928.torrent,"Creampie, Cuckold, Married Woman, Nasty, Hardcore, Solowork, Squirting",Riho Shishido,2026-03-06,https://onejav.com/torrent/dass928
NGOD322,人妻の裏アカ 近所の奥様の裏アカを発見して… 普段の表の顔とは正反対な人妻の裏の顔と欲求不満な下半身をさらけ出させました 朝妃りお,5.2 GB,https://pics.dmm.co.jp/mono/movie/adult/ngod322/ngod322pl.jpg,https://onejav.com/torrent/ngod322/download/86834510/onejav.com_ngod322.torrent,"Affair, Creampie, Cuckold, Married Woman, Slender, Solowork",朝妃りお,2026-03-06,https://onejav.com/torrent/ngod322
NGOD325,際-kiwa-指圧師の男に身体中の際どい部分をしつこく責められ感じてしまい他人棒を欲する妻 愛田るか,5.6 GB,https://pics.dmm.co.jp/mono/movie/adult/ngod325/ngod325pl.jpg,https://onejav.com/torrent/ngod325/download/03053123/onejav.com_ngod325.torrent,"Affair, Big Tits, Cuckold, Married Woman, Massage, Solowork",愛田るか,2026-03-06,https://onejav.com/torrent/ngod325
RKI743,図書館で働く地味っこ眼鏡女子を館内痴●してレ●プ！イキ狂わせて完堕ち肉便器化 斉藤帆夏,4.9 GB,https://pics.dmm.co.jp/mono/movie/adult/rki743/rki743pl.jpg,https://onejav.com/torrent/rki743/download/42591476/onejav.com_rki743.torrent,"Beautiful Girl, Creampie, Cuckold, Nasty, Hardcore, Solowork, Voyeur",斉藤帆夏,2026-03-06,https://onejav.com/torrent/rki743
VAGU292,清純そうな人妻が催淫オイルで興奮パニック欲情マックス…卑劣店員の肉棒で羞恥心をぶった斬られいいなりセックス 小椋ひかり,4.0 GB,https://pics.dmm.co.jp/mono/movie/adult/vagu292/vagu292pl.jpg,https://onejav.com/torrent/vagu292/download/65548534/onejav.com_vagu292.torrent,"Creampie, Cuckold, Lotion, Married Woman, Mature Woman, Solowork",小椋ひかり,2026-03-06,https://onejav.com/torrent/vagu292
DASS858,一緒に上京してきた可愛い彼女は俺のために絶倫権力おじさんに種付けセックスされていた。 倉本すみれ,6.1 GB,https://pics.dmm.co.jp/mono/movie/adult/dass858/dass858pl.jpg,https://onejav.com/torrent/dass858/download/83119095/onejav.com_dass858.torrent,"Beautiful Girl, Cosplay, Creampie, Cuckold, Slender, Solowork",倉本すみれ,2026-03-06,https://onejav.com/torrent/dass858
