code,title,size,image_url,torrent_url,tags,actresses,date,page_url
DASS889,【カミングアウト】元女性の男性戸籍。訳あって女に戻った現役AV女優 雄乃ゆめ 本音で話すAVドキュメント,6.4 GB,https://pics.dmm.co.jp/mono/movie/adult/dass889/dass889pl.jpg,https://onejav.com/torrent/dass889/download/76407007/onejav.com_dass889.torrent,"Anal Sex, Big Tits, Creampie, Documentary, POV, Solowork",雄乃ゆめ,2026-03-20,https://onejav.com/torrent/dass889
JUR068,電撃移籍 Madonna専属 矢埜愛茉 美しき芸能人、衝撃の中出し解禁―。,6.6 GB,https://pics.dmm.co.jp/mono/movie/adult/jur068/jur068pl.jpg,https://onejav.com/torrent/jur068/download/19097333/onejav.com_jur068.torrent,"Breasts, Creampie, Documentary, Married Woman, Mature Woman, Solowork",矢埜愛茉,2026-03-20,https://onejav.com/torrent/jur068
JRZE291,初撮り人妻ドキュメント 吉水瞳,5.8 GB,https://pics.dmm.co.jp/mono/movie/adult/h_086jrze291/h_086jrze291pl.jpg,https://onejav.com/torrent/jrze291/download/65013406/onejav.com_jrze291.torrent,"BIGセール, Debut Production, Documentary, Huge Butt, Married Woman, Mature Woman, Solowork",吉水瞳,2026-03-19,https://onejav.com/torrent/jrze291
483DAM066,【新宿】みほちゃん【エステ】,2.4 GB,https://image.mgstage.com/images/hamechan/483dam/066/pb_e_483dam-066.jpg,https://onejav.com/torrent/483dam066/download/13596912/onejav.com_483dam066.torrent,"Amateur, Big Tits, Butt, Documentary, Short Hair, Slender, Voyeur",,2026-03-18,https://onejav.com/torrent/483dam066
390JNT117,【ち●ぽで突かれてビクンッブルンッ】【Jカップ恵体妻×中出し】【大人の背徳ランジェリー性交】「おま●こ壊して下さいッ！！」と他人棒懇願する爆乳Jカップ妻！！奥まで突かれて膣ビクンッ！！！おっぱいブルンッ！！！！！のダイナミック性交【結婚2年目 ほのかさん 28歳】 #35,4.5 GB,https://image.mgstage.com/images/jackson/390jnt/117/pb_e_390jnt-117.jpg,https://onejav.com/torrent/390jnt117/download/35554865/onejav.com_390jnt117.torrent,"Amateur, Big Tits, Creampie, Documentary, Lingerie, Married Woman",,2026-03-16,https://onejav.com/torrent/390jnt117
JUTA191,極上！！四十路奥さま初脱ぎAVドキュメント 江崎奈央,5.5 GB,https://pics.dmm.co.jp/mono/movie/adult/juta191/juta191pl.jpg,https://onejav.com/torrent/juta191/download/77912775/onejav.com_juta191.torrent,"Creampie, Debut Production, Documentary, Married Woman, Mature Woman, Solowork",江崎奈央,2026-03-16,https://onejav.com/torrent/juta191
ACZD249,素人女子30人 ヒクヒク肛門ガン見させてくださいSPECIAL2,10.1 GB,https://pics.dmm.co.jp/mono/movie/adult/h_019aczd249/h_019aczd249pl.jpg,https://onejav.com/torrent/aczd249/download/14167205/onejav.com_aczd249.torrent,"4HR+, Amateur, Anal, BIGセール, Butt, Close Up, Documentary, Shame",,2026-03-15,https://onejav.com/torrent/aczd249
VOD054,本物素人妻第二弾ぷっくりエロ乳輪妻が挑む絶頂鬼連チャン初めての3P中出しセックス 美月香織,4.8 GB,https://pics.dmm.co.jp/mono/movie/adult/vod054/vod054pl.jpg,https://onejav.com/torrent/vod054/download/42880335/onejav.com_vod054.torrent,"3P, 4P, Creampie, Documentary, Married Woman, Mature Woman, Solowork",美月香織,2026-03-13,https://onejav.com/torrent/vod054
EBWH304,「俺の彼女に1，000円で中出ししませんか？w」NTR好きの彼氏に乳まる出し立ちんぼさせられてます… 清宮仁愛,6.7 GB,https://pics.dmm.co.jp/mono/movie/adult/ebwh304/ebwh304pl.jpg,https://onejav.com/torrent/ebwh304/download/02277345/onejav.com_ebwh304.torrent,"Big Tits, Busty Fetish, Creampie, Documentary, Solowork, Titty Fuck",清宮仁愛,2026-03-13,https://onejav.com/torrent/ebwh304
MFYD109,「中に出して、今夜だけー。」 小宮かおる初めての中出し、素でイキまくる不倫デート。,5.1 GB,https://pics.dmm.co.jp/mono/movie/adult/mfyd109/mfyd109pl.jpg,https://onejav.com/torrent/mfyd109/download/19242953/onejav.com_mfyd109.torrent,"Creampie, Date, Documentary, Married Woman, Mature Woman, Solowork",小宮かおる,2026-03-13,https://onejav.com/torrent/mfyd109
