code,title,size,image_url,torrent_url,tags,actresses,date,page_url
ABF334,男だらけのバッティングセンターに七嶋舞、置いてきた。【限定特典映像15分付き】,5.4 GB,https://image.mgstage.com/images/prestige/abf/334/pb_e_abf-334.jpg,https://onejav.com/torrent/abf334/download/84103942/onejav.com_abf334.torrent,"3P, 4P, Documentary, Facials, Shaved, Solowork",Mai Nanashima,2026-03-26,https://onejav.com/torrent/abf334
JURA187,初撮り人妻ドキュメント第三章 古村えりか,5.2 GB,https://pics.dmm.co.jp/mono/movie/adult/h_086jura187/h_086jura187pl.jpg,https://onejav.com/torrent/jura187/download/09873119/onejav.com_jura187.torrent,"BIGセール, Documentary, Lotion, Married Woman, Mature Woman, Soapland, Solowork",古村えりか,2026-03-26,https://onejav.com/torrent/jura187
JURA186,初撮り五十路妻ドキュメント第二章 三国紗英,5.5 GB,https://pics.dmm.co.jp/mono/movie/adult/h_086jura186/h_086jura186pl.jpg,https://onejav.com/torrent/jura186/download/49012998/onejav.com_jura186.torrent,"3P, 4P, BIGセール, Creampie, Documentary, Married Woman, Mature Woman, Solowork",三国紗英,2026-03-26,https://onejav.com/torrent/jura186
ERDM212,カーテン1枚挟んだ夫の横で、人妻が嫌でもイカされる性感マッサージ4時間,10.1 GB,https://pics.dmm.co.jp/mono/movie/adult/erdm212/erdm212pl.jpg,https://onejav.com/torrent/erdm212/download/73323044/onejav.com_erdm212.torrent,"4HR+, Amateur, Cuckold, Documentary, Married Woman, Massage",,2026-03-25,https://onejav.com/torrent/erdm212
SOAN125,廃人一歩手前で更生施設にきた元バレーボール国体選手が更正する素振りすらないのでアヘ顔白目反省イキさせ肉棒で滅多刺し強●社会復帰w スナオ 九井スナオ,5.7 GB,https://pics.dmm.co.jp/mono/movie/adult/soan125/soan125pl.jpg,https://onejav.com/torrent/soan125/download/31980272/onejav.com_soan125.torrent,"Big Tits, Deep Throating, Documentary, Evil, Solowork, Sport",九井スナオ,2026-03-21,https://onejav.com/torrent/soan125
277DCV299,【全国区！ツヨカワ武術女子は恋愛ヨワ女！脱いだらGカップ！ギャップ凄ッSP】恋愛フッ重！SEXフッ軽！白目！赤裸体！エビ反り！硬直！めっちゃイクやん？部活にかけた青春…遅れた初体験…妄想が生んだ敏感モンスター！⇒目隠し！天井知らずの感度！チ●コをマ●コで味わう！極・イキSEX⇒というか、フェラも凄くね？⇒母への謝罪…1人前への第一歩。 家まで送ってイイですか？case.290,2.6 GB,https://image.mgstage.com/images/documentv/277dcv/299/pb_e_277dcv-299.jpg,https://onejav.com/torrent/277dcv299/download/94177354/onejav.com_277dcv299.torrent,"Amateur, Beautiful legs, Butt, Documentary, Planning, Tall",,2026-03-20,https://onejav.com/torrent/277dcv299
DASS889,【カミングアウト】元女性の男性戸籍。訳あって女に戻った現役AV女優 雄乃ゆめ 本音で話すAVドキュメント,6.4 GB,https://pics.dmm.co.jp/mono/movie/adult/dass889/dass889pl.jpg,https://onejav.com/torrent/dass889/download/27661441/onejav.com_dass889.torrent,"Anal Sex, Big Tits, Creampie, Documentary, POV, Solowork",雄乃ゆめ,2026-03-20,https://onejav.com/torrent/dass889
JUR068,電撃移籍 Madonna専属 矢埜愛茉 美しき芸能人、衝撃の中出し解禁―。,6.6 GB,https://pics.dmm.co.jp/mono/movie/adult/jur068/jur068pl.jpg,https://onejav.com/torrent/jur068/download/67155666/onejav.com_jur068.torrent,"Breasts, Creampie, Documentary, Married Woman, Mature Woman, Solowork",矢埜愛茉,2026-03-20,https://onejav.com/torrent/jur068
JRZE291,初撮り人妻ドキュメント 吉水瞳,5.8 GB,https://pics.dmm.co.jp/mono/movie/adult/h_086jrze291/h_086jrze291pl.jpg,https://onejav.com/torrent/jrze291/download/87857999/onejav.com_jrze291.torrent,"BIGセール, Debut Production, Documentary, Huge Butt, Married Woman, Mature Woman, Solowork",吉水瞳,2026-03-19,https://onejav.com/torrent/jrze291
483DAM066,【新宿】みほちゃん【エステ】,2.4 GB,https://image.mgstage.com/images/hamechan/483dam/066/pb_e_483dam-066.jpg,https://onejav.com/torrent/483dam066/download/34529920/onejav.com_483dam066.torrent,"Amateur, Big Tits, Butt, Documentary, Short Hair, Slender, Voyeur",,2026-03-18,https://onejav.com/torrent/483dam066
