code,title,size,image_url,torrent_url,tags,actresses,date,page_url
DASS949,クリエイター支援サイト『男の娘・NH』部門、注目度No.1。電撃専属。天然美少女ニューハーフ 柊もみじ,6.4 GB,https://pics.dmm.co.jp/mono/movie/adult/dass949/dass949pl.jpg,https://onejav.com/torrent/dass949/download/98291799/onejav.com_dass949.torrent,"Anal Sex, Bukkake, Documentary, Orgy, Solowork, Transsexual",柊もみじ,2026-04-24,https://onejav.com/torrent/dass949
MOGI150,【初撮り】京都出身19歳100cmデカ尻ギャル ノリでAV出演するもおっぱいもマ●コもアナルもじっくり観察され絶頂デビュー 天ノ川つむぎ,9.7 GB,https://pics.dmm.co.jp/mono/movie/adult/1mogi150/1mogi150pl.jpg,https://onejav.com/torrent/mogi150/download/59211559/onejav.com_mogi150.torrent,"Debut Production, Documentary, Gal, Nampa, Solowork",天ノ川つむぎ,2026-04-21,https://onejav.com/torrent/mogi150
MFYD115,S級女王様・夢実かなえをM男クン家に派遣します！ド級の痴女テクと美しさで、マゾザーメン20連発ぶっこ抜きドキュメント！,11.5 GB,https://pics.dmm.co.jp/mono/movie/adult/mfyd115/mfyd115pl.jpg,https://onejav.com/torrent/mfyd115/download/75494509/onejav.com_mfyd115.torrent,"4HR+, Creampie, Documentary, M男, Slut","夢実かなえ, 真咲南朋",2026-04-17,https://onejav.com/torrent/mfyd115
GVH835,密着！パイズリ！SEX！男だらけのワケあり大家族で笑いあり射精あり…エロ母ちゃんのパコパコ奮闘SP 波多野結衣,5.6 GB,https://pics.dmm.co.jp/mono/movie/adult/gvh835/gvh835pl.jpg,https://onejav.com/torrent/gvh835/download/57482319/onejav.com_gvh835.torrent,"BBW, Documentary, Incest, Mother, Solowork, Titty Fuck",Yui Hatano,2026-04-11,https://onejav.com/torrent/gvh835
DASS921,闇に溶け合うほどの愛を知らない女たちの依存と溺愛のねっとり深い闇レズセックス† 逢沢みゆ 天羽りりか,8.7 GB,https://pics.dmm.co.jp/mono/movie/adult/dass921/dass921pl.jpg,https://onejav.com/torrent/dass921/download/62052290/onejav.com_dass921.torrent,"Beautiful Girl, Cosplay, Documentary, Lesbian Kiss","逢沢みゆ, 天羽りりか",2026-04-10,https://onejav.com/torrent/dass921
SOAN127,取り違いで更生施設にきた社会人陸上部の現役ランナーが更正する素振りすらないのでアヘ顔寄り目反省イキさせ肉棒で滅多刺し強●復帰劇w 静音 立華静音,5.6 GB,https://pics.dmm.co.jp/mono/movie/adult/soan127/soan127pl.jpg,https://onejav.com/torrent/soan127/download/93127665/onejav.com_soan127.torrent,"Deep Throating, Documentary, Evil, Slender, Solowork, Sport",立華静音,2026-04-04,https://onejav.com/torrent/soan127
277DCV298,【オッパイがデカいミステリアス美女SP】 Hカップが爆揺れ！突然床舐め！一体なぜ？ お墓に入るギリギリまでSEXし続けたい！ ⇒起床、オナニー、ご飯、オナニー、ご飯、オナニー、寝 ⇒デカチン派！デカチン見てヨダレダラダラ ⇒ヒマニ―マスター！フェラ中も勝手にオナニー ⇒亡き友が残した一本…涙の連れタバコ 家まで送ってイイですか？case.291,3.5 GB,https://image.mgstage.com/images/documentv/277dcv/298/pb_e_277dcv-298.jpg,https://onejav.com/torrent/277dcv298/download/06425371/onejav.com_277dcv298.torrent,"Amateur, Big Tits, Documentary, Planning, Squirting",,2026-04-03,https://onejav.com/torrent/277dcv298
JRZE292,初撮り人妻ドキュメント 春日友紀,5.7 GB,https://pics.dmm.co.jp/mono/movie/adult/h_086jrze292/h_086jrze292pl.jpg,https://onejav.com/torrent/jrze292/download/56323024/onejav.com_jrze292.torrent,"Debut Production, Documentary, Huge Butt, Married Woman, Mature Woman, Solowork",春日友紀,2026-03-28,https://onejav.com/torrent/jrze292
ABF334,男だらけのバッティングセンターに七嶋舞、置いてきた。【限定特典映像15分付き】,5.4 GB,https://image.mgstage.com/images/prestige/abf/334/pb_e_abf-334.jpg,https://onejav.com/torrent/abf334/download/38770994/onejav.com_abf334.torrent,"3P, 4P, Documentary, Facials, Shaved, Solowork",Mai Nanashima,2026-03-26,https://onejav.com/torrent/abf334
JURA187,初撮り人妻ドキュメント第三章 古村えりか,5.2 GB,https://pics.dmm.co.jp/mono/movie/adult/h_086jura187/h_086jura187pl.jpg,https://onejav.com/torrent/jura187/download/62972621/onejav.com_jura187.torrent,"BIGセール, Documentary, Lotion, Married Woman, Mature Woman, Soapland, Solowork",古村えりか,2026-03-26,https://onejav.com/torrent/jura187
