code,title,image_url,page_url,views,date_scraped
HUNTB-648-RM,"""Brother, Ochi ○ Chin... It's Okay To Do This, Isn't It?"" ? My Sober Younger Sister Who Was Raised In A Girls' School Has Almost Never Been In Contact With Men Outside Her Family... [Uncensored L**ked]",https://pic.javct.net/poster/20230908/1694150922.jpg,https://javct.net/v/huntb-648-rm,210,2026-05-02
GVH-841,Mother-son R**e Yui Hatano (),https://pic.javct.net/poster/04112026/4a412bc53a.jpg,https://javct.net/v/gvh-841,125,2026-05-02
BKD-366,Mother-c**ld Mating ~Oga-dake Road~ By Chitose Yuki,https://pic.javct.net/poster/04112026/119db3b9bf.jpg,https://javct.net/v/bkd-366,123,2026-05-02
MADV-263-RM,I felt defenseless woman to her sister. [Uncensored L**ked],https://pic.javct.net/poster/04112026/dc2441749a.jpg,https://javct.net/v/madv-263-rm,150,2026-05-02
TERA-001,Hidden Estrus Family Thing. Yuu Shinoda Beautiful Bride K**led While Writhing Ru Press The Pant Voice To A Situation Where Other Family Members Are In Close Proximity,https://pic.javct.net/poster/04112026/769ea2afa3.jpg,https://javct.net/v/tera-001,120,2026-05-02
STAR-960-RM,"Kato Momoka Who Is Cute With The Best Is Becoming A Sister Of You, Love Love Incest Life [Uncensored L**ked]",https://pic.javct.net/poster/04112026/b2837e095a.jpg,https://javct.net/v/star-960-rm,180,2026-05-02
ZEX-359-RM,Once You Eat Into Chi - Po!SUPON Blowjob Sister [Uncensored L**ked],https://pic.javct.net/poster/04112026/de92308a8b.jpg,https://javct.net/v/zex-359-rm,120,2026-05-02
SQIS-085-RM,Young/ripe/beautiful/firm Breast Boobs Rokukei [Uncensored L**ked],https://pic.javct.net/poster/20230908/1694839093.jpg,https://javct.net/v/sqis-085-rm,180,2026-05-02
DVEH-086,"""Hey, You Can... Cum Inside My Pussy,"" Says The Precocious **d From Kansai, Who Is A Convenient Sex Toy Niece, Megumi Minoshima.",https://pic.javct.net/poster/04112026/8883e5f9b0.jpg,https://javct.net/v/dveh-086,140,2026-05-02
DVRT-025-RM,Event Spray Incest Creampie Sister Is My Compliant Doll Maya Kikuchi [Uncensored L**ked],https://pic.javct.net/poster/20230804/1693539505.jpg,https://javct.net/v/dvrt-025-rm,135,2026-05-02
DVMM-392,The Target Was His Sister's Swimsuit And Massive Breasts. The Perverted Brother Who Had Watched Her Development For So Long Finally Had Sex With His Sister While She Was Still In Her Swimsuit. Incestuous Video At Home. Rec-3 Ruka Itoi,https://pic.javct.net/poster/04112026/a4b68c4fd1.jpg,https://javct.net/v/dvmm-392,165,2026-05-02
DVMM-388,"General Male And Female Monitoring AV: A Special Tracking The Aftermath Of Step-Brother And Step-Sister Having Unprotected Sex - On The Other Side Of The Magic Mirror Is The Pregnant Sister (=wife)! The High School Girl Sister And Her Virile Husband Have Forbidden Unprotected Sex In A Private Room! ...Aftermath: Unprotected Infidelity Sex That Is Repeated Many Times Behind The Sister's Back, Secretly Filmed Within The Home",https://pic.javct.net/poster/04112026/c17ca1c17f.jpg,https://javct.net/v/dvmm-388,160,2026-05-02
NACR-156,Father And Daughter 's Immediate Family Sex The Bad Habit Is Bad And I Can Not Separate My Parents Always I Am Troubling My Father.So That Day Too .... Shinoda Yu,https://pic.javct.net/poster/04112026/d618a0e0d0.jpg,https://javct.net/v/nacr-156,120,2026-05-02
NSFS-469-RM,Mature Mother 38 ~A Ripe Body Driven Wild By Her Son's Huge Penis~ Megumi Suzukawa [Uncensored L**ked],https://pic.javct.net/poster/04112026/68623b1ce5.jpg,https://javct.net/v/nsfs-469-rm,91,2026-05-02
DTKM-033-RM,"Because Let Someone Inspire My Mother, Me Yarra To The Kimi Of Mother. Towns And Villages Anna Yuki Midori Summer [Uncensored L**ked]",https://pic.javct.net/poster/20222311/1669808114.jpg,https://javct.net/v/dtkm-033-rm,200,2026-05-02
KIR-029-RM,My Father's Remarriage Partner's Stepc**ld Is An Ulzzang Fashion Gal Sister! Hinako Mori [Uncensored L**ked],https://pic.javct.net/poster/04112026/c4d0fa0f13.jpg,https://javct.net/v/kir-029-rm,90,2026-05-02
DTKM-032-RM,"Because Let Someone Inspire My Mother, Me Yarra To The Kimi Of Mother. Misako Kuroyanagi Midori Takashima [Uncensored L**ked]",https://pic.javct.net/poster/20230104/1680515135.jpg,https://javct.net/v/dtkm-032-rm,200,2026-05-02
ALDN-281-RM,Your Mother-in-law Is Much Better Than My Wife... Riko Tokushima [Uncensored L**ked],https://pic.javct.net/poster/20241902/1708742843.jpg,https://javct.net/v/aldn-281-rm,100,2026-05-02
VOSS-114-RM,"The Mother Of A Troubled Daughter-in-law Who Pretends To Take Away My Thick Sperm Who Accumulated A Month Of Ascetic Life For Pregnancy!Even If I Thought That Tonight 's Supposing To Brush Up A Bride, I Got Stuck Too Much And Turned Into A Ganggee Erection Jumped At The Moment I Saw The Poppy And Sucked Into My Own Car Fo**edly Picked Up Inside!My Wife Can Not Impatient Even When I Go Through!9 [Uncensored L**ked]",https://pic.javct.net/poster/04112026/8f14b5afcd.jpg,https://javct.net/v/voss-114-rm,85,2026-05-02
STARS-190-RM,Sensitive Small Breasts Nipples  A Pretty Girl Is Fucked Every Day As A Sexual Processing Toy Of A Perverted Libido  Nagano Ichika [Uncensored L**ked],https://pic.javct.net/poster/20222410/1668586539.jpg,https://javct.net/v/stars-190-rm,140,2026-05-02
HZ-3825,Beauty Collection Vol.116 - Nako Nagase,https://pic.javct.net/poster/04112026/1776148653.jpg,https://javct.net/v/hz-3825,61,2026-05-02
HZ-3822,Bonus Special Vol.7 - Mirei Imada - Shizuka Oshiro - Akari Satsuki,https://pic.javct.net/poster/06032026/1775794305.jpg,https://javct.net/v/hz-3822,44,2026-05-02
HZ-3813,Beauty Collection Vol.114 - Mirai Minano,https://pic.javct.net/poster/06032026/1774942526.jpg,https://javct.net/v/hz-3813,55,2026-05-02
HZ-3810,Bonus Special Vol.6 - Rina Kashino - Azumi Kirino - Mami Sakai,https://pic.javct.net/poster/06032026/1774585343.jpg,https://javct.net/v/hz-3810,55,2026-05-02
HZ-3806,My Best Friend Cuckolded His Beautiful Big Titted Girlfriend By Me!! - Satomi,https://pic.javct.net/poster/06032026/1773982254.jpg,https://javct.net/v/hz-3806,61,2026-05-02
HZ-3805,Beauty Collection Vol.112 - Shion Mochizuki,https://pic.javct.net/poster/06032026/1773726550.jpg,https://javct.net/v/hz-3805,61,2026-05-02
HZ-3802,Maho Hoshijima Sucks My Cock Deeply Down To Her Throat! - Maho Hoshijima,https://pic.javct.net/poster/06032026/1773376452.jpg,https://javct.net/v/hz-3802,20,2026-05-02
HZ-3801,Beauty Collection Vol.111 - Aya Goto,https://pic.javct.net/poster/06032026/1773121788.jpg,https://javct.net/v/hz-3801,53,2026-05-02
HZ-3800,Thick Sex With A Sadistic Slut MILF Vol.3 - Ayano Kikuchi,https://pic.javct.net/poster/06032026/1772969614.jpg,https://javct.net/v/hz-3800,63,2026-05-02
HZ-3799,Deep Throating Lover! -Masochistic Girl Yuna- - Yuna Mori,https://pic.javct.net/poster/06032026/1772860250.jpg,https://javct.net/v/hz-3799,60,2026-05-02
HZ-3798,Bonus Special Vol.5 - Satomi Inoue - Nana Kamiyama - Momoka Ogawa,https://pic.javct.net/poster/01202026/1772777801.jpg,https://javct.net/v/hz-3798,55,2026-05-02
HZ-3793,Beauty Collection Vol.110 - Tsubaki Honda,https://pic.javct.net/poster/01202026/1772515674.jpg,https://javct.net/v/hz-3793,61,2026-05-02
HZ-3788,Bonus Special Vol.4 - Rena - Emi Sakurai - Sanae Yamaguchi,https://pic.javct.net/poster/01202026/1771629111.jpg,https://javct.net/v/hz-3788,53,2026-05-02
HZ-3785,Beauty Collection Vol.108 - Mio Sakuragi,https://pic.javct.net/poster/01202026/1771319660.jpg,https://javct.net/v/hz-3785,61,2026-05-02
HRM-022-RM,"National Active Female College Student Cosplayer Guide 03 [Tokyo] A 143cm Tall, Sexy, Cute Girl: A Sweet, Sadistic, Premature Ejaculation Training ""Is Your Dick Okay?"" Raw Creampie, Squirting, And Squirting Fuck (Slutty Cat Maid) T Female College Freshman Mina [Uncensored L**ked]",https://pic.javct.net/poster/01202026/1771135015.jpg,https://javct.net/v/hrm-022-rm,76,2026-05-02
HRM-023-RM,"A 144cm Tall, Slutty, Masochistic, Slutty Cat Maid, Cute Cosplayer: ""There’s No Squirting That Doesn’t Stop, There’s No Sperm That Doesn’t Get Pregnant"" Raw Creampie, Impregnation, Squirting, And Facial Fuck [Uncensored L**ked]",https://pic.javct.net/poster/01202026/1771134946.jpg,https://javct.net/v/hrm-023-rm,43,2026-05-02
HZ-3783,"I'll Work Out Your Sexual Problems Explosively! -Just BJ, Not Cheating!?- Vol.5 - Yui Nanase",https://pic.javct.net/poster/01202026/1771042803.jpg,https://javct.net/v/hz-3783,60,2026-05-02
HZ-3781,Beauty Collection Vol.107 - Rin Aizawa,https://pic.javct.net/poster/01202026/1770710545.jpg,https://javct.net/v/hz-3781,63,2026-05-02
HZ-3779,Naughty Wife's Immoral Secret Over Her Husband Vol.20 - Nami Sawaguchi,https://pic.javct.net/poster/01202026/1770438932.jpg,https://javct.net/v/hz-3779,60,2026-05-02
HZ-3778,Bonus Special Vol.3 - Rion - Maria Osawa - Non Suzumiya,https://pic.javct.net/poster/01202026/1770351321.jpg,https://javct.net/v/hz-3778,56,2026-05-02
HZ-3771,Eri Saeki Licks Asshole Relentlessly! - Eri Saeki,https://pic.javct.net/poster/01202026/1769839285.jpg,https://javct.net/v/hz-3771,20,2026-05-02
HZ-3770,Beauty Collection Vol.105 - Rena Hiragi,https://pic.javct.net/poster/01202026/1769493235.jpg,https://javct.net/v/hz-3770,60,2026-05-02
HZ-3768,Cum Swallow Lover - Submissive Girl Tastes Sperm Vol.4 - Mirina Nozomi,https://pic.javct.net/poster/01202026/1769243050.jpg,https://javct.net/v/hz-3768,60,2026-05-02
CEMD-251-RM,Akari Minase Gets Excited By Giving An Old Man Drunk Spit And Pee [Uncensored L**ked],https://pic.javct.net/poster/20222109/1666415263.jpg,https://javct.net/v/cemd-251-rm,132,2026-05-02
UD-821,Every Man Wants To Experience It At Least Once In His Life!! The Best 6 Of Highly Select Horny Mature Woman Babes!! (Beautiful Mature Woman Edition) Part 2 6,https://pic.javct.net/poster/04112026/cd696ca58d.jpg,https://javct.net/v/ud-821,181,2026-05-02
CEFD-015-RM,Reprint Edition First Anal Ban SEX3 Yuri Oshikawa [Uncensored L**ked],https://pic.javct.net/poster/20220707/1657342678.jpg,https://javct.net/v/cefd-015-rm,202,2026-05-02
ADN-780-RM,I Was Embraced By My Daughter's Boyfriend. The Story Of How We Had Sex Non-stop From The Day He Forcibly Pushed Me Down. [Uncensored L**ked],https://pic.javct.net/poster/04112026/55f5fd577f.jpg,https://javct.net/v/adn-780-rm,120,2026-05-02
HDKA-161-RM,"Residents Living In Shinagawa-ku, Hara's Housewives Reiko Kobayakawa (41) [Uncensored L**ked]",https://pic.javct.net/poster/04112026/4283d94ec5.jpg,https://javct.net/v/hdka-161-rm,132,2026-05-02
JUY-298-RM,Liberty Bans Lifted! ! Full Of Carnality Of The Name Rope ... Akira Tomoka [Uncensored L**ked],https://pic.javct.net/poster/04112026/5745a5dfc0.jpg,https://javct.net/v/juy-298-rm,120,2026-05-02
VEC-612-RM,A Married Woman Who Was Vaginal Cum Shot By Her Husband's Friend Unfaithful Fire Play That Fills The Gap Of Her Lonely Body. Kawakami Yuu [Uncensored L**ked],https://pic.javct.net/poster/20230908/1694760651.jpg,https://javct.net/v/vec-612-rm,95,2026-05-02
ANB-224-RM,Natsuki Kisaragi I Devour The Frustrated Sensual Body Of A Beautiful And Dirty Aunt [Uncensored L**ked],https://pic.javct.net/poster/20230804/1693625549.jpg,https://javct.net/v/anb-224-rm,115,2026-05-02
DDH-395-RM,Well [Uncensored L**ked],https://pic.javct.net/poster/04112026/5a1842600a.jpg,https://javct.net/v/ddh-395-rm,59,2026-05-02
JUL-500-RM,"""Hey, Can I Ask You A Question? Are You Really A Cherry Boy?"" - A Married Woman Who Kept Falling For The Cherry Boy Con - Maki Hojo [Uncensored L**ked]",https://static.javct.net/poster/jul-500.jpg,https://javct.net/v/jul-500-rm,127,2026-05-02
CEMD-250-RM,Chisato Shoda Gets Excited By Licking Her Uncle's Face Covered With Saliva [Uncensored L**ked],https://pic.javct.net/poster/20222109/1666415328.jpg,https://javct.net/v/cemd-250-rm,132,2026-05-02
AMBI-160-RM,A Little Love Story Between A Runaway Girl And An Old Man Kurumi Futaba [Uncensored L**ked],https://pic.javct.net/poster/20222109/1664941104.jpg,https://javct.net/v/ambi-160-rm,141,2026-05-02
FOCS-043-RM,"A Certain Major App Gets A Surge Of Bookings When A Rental Girlfriend Is Featured! ""This Is Actually Bad..."" From Recently Matured Guys To Sadistic Guys, They All Wish For Their Ideal Girlfriend With This Super Lewd App. Mai Kagari [Uncensored L**ked]",https://pic.javct.net/poster/20212011/1642142334.jpg,https://javct.net/v/focs-043-rm,123,2026-05-02
HONB-319-RM,"I Was Nervous Because It Was My First Shoot, Seichiro [Uncensored L**ked]",https://pic.javct.net/poster/20230908/1694491332.jpg,https://javct.net/v/honb-319-rm,68,2026-05-02
MIGD-593,Active College Student Virgin AV Tebyu Yamase Misaki,https://pic.javct.net/poster/04112026/0f32b8f853.jpg,https://javct.net/v/migd-593,150,2026-05-02
WAAA-642-RM,"Schoolgirl, Rima Arai, Is Given A Brutal Fuck By A Man With A Huge Cock Who Provides Semen Scraping Services And Is Completely Impregnated. [Uncensored L**ked]",https://pic.javct.net/poster/04112026/2d403858b8.jpg,https://javct.net/v/waaa-642-rm,120,2026-05-02
SOAN-128,"Anal Counseling. After School, You'll Be Taken To A Slum For An Enema. Hairy Ass, Two-hole Dilation And Insertion Are Mandatory. Shinonome Azusa",https://pic.javct.net/poster/04112026/4a1921bd84.jpg,https://javct.net/v/soan-128,130,2026-05-02
FJIN-135,"Brainwashing Enlightenment Mindfucker, Squirting Metamoses, Hehe... If You Drink God's Drink, You Must Pledge Your Loyalty To God... Hehe, I Am God. Hehe Minazuki Hikaru",https://pic.javct.net/poster/04112026/c8f7e76dbe.jpg,https://javct.net/v/fjin-135,125,2026-05-02
MIDA-621-RM,"She Was Away On A Family Trip, So I Switched To Living With Her Busty Female Friend For A Week, Focusing Entirely On Unprotected Sex. - Amamiya Kana [Uncensored L**ked]",https://pic.javct.net/poster/04112026/9bf1d28133.jpg,https://javct.net/v/mida-621-rm,120,2026-05-02
WAAA-640-RM,"The Day After My Wife Refused Sex To Me After I Abstained For A Month In An Attempt To Conceive, I Witnessed My Mother-in-law, Who Lives With Us, Masturbating, And I Lost Control Of Myself And Had Unprotected Sex With Her Repeatedly. My Frustrated Mother-in-law's Naked Body Was That Of A Busty Woman In Her Twenties, JULIA [Uncensored L**ked]",https://pic.javct.net/poster/04112026/0c0053e2b7.jpg,https://javct.net/v/waaa-640-rm,130,2026-05-02
PPPE-317-SUB,"""I Was The Reason He Married My Mother"" One Week After My Wife Returned Home, I Piston-trained My Precocious Big-breasted Stepdaughter With My Insatiable Cock Rima Arai [English Subtitle]",https://pic.javct.net/poster/20250903/1741887874.jpg,https://javct.net/v/pppe-317-sub,150,2026-05-02
MARA-061-RM,"Miu Arioka's Colossal Tits, Theater, I-Cup! 96 cm [Uncensored L**ked]",https://pic.javct.net/poster/20212709/1633176169.jpg,https://javct.net/v/mara-061-rm,122,2026-05-02
ZEX-381-RM,Super Luxury Girl Creampie Soap [Uncensored L**ked],https://pic.javct.net/poster/04112026/845fca95b8.jpg,https://javct.net/v/zex-381-rm,118,2026-05-02
HNAMH-002-RM,Genuine creampie donation for a girl in uniform. Two shots of special thick semen from an old man. [Uncensored L**ked],https://pic.javct.net/poster/04112026/d0ead088d9.jpg,https://javct.net/v/hnamh-002-rm,58,2026-05-02
DLDSS-500-RM,"Newcomer, ""Perverted Age"", Kasuga Oto, 34 Years Old, AV Debut, The ""orthodox"" Real Married Woman Presented By The New DAHLIA. [Uncensored L**ked]",https://pic.javct.net/poster/04112026/d84ad92332.jpg,https://javct.net/v/dldss-500-rm,220,2026-05-02
MIRD-280-RM,I Made The Girls In My Class Do A Group Anal-exposing Pyramid And Had A Harem Orgy With Their Assholes Spread Wide Open. [Uncensored L**ked],https://pic.javct.net/poster/04112026/a2635b38f1.jpg,https://javct.net/v/mird-280-rm,120,2026-05-02
MGMQ-127-RM,"My Best Friend's Girlfriend Is A Perverted Slut, And While My Best Friend Was Away, My Anus Was Developed And I Was Fo**ed To Cum. Satsuki Ena [Uncensored L**ked]",https://pic.javct.net/poster/20241902/1708743385.jpg,https://javct.net/v/mgmq-127-rm,112,2026-05-02
MIRD-280,I Made The Girls In My Class Do A Group Anal-exposing Pyramid And Had A Harem Orgy With Their Assholes Spread Wide Open.,https://pic.javct.net/poster/04112026/a2635b38f1.jpg,https://javct.net/v/mird-280,120,2026-05-02
ATID-682,Loss Of Anal Virginity In School Uniform,https://pic.javct.net/poster/04112026/1d300b6942.jpg,https://javct.net/v/atid-682,120,2026-05-02
AVSA-242-RM,No. MM Amateur Neck Strangulation & Anal To**ure! Mercilessly Find A Genuine M Woman With A Demonic Spanking That Drives You To Fainting! Is There Really A Daughter Who Accepts Anal Sex!? ? [Uncensored L**ked],https://pic.javct.net/poster/20230104/1680925996.jpg,https://javct.net/v/avsa-242-rm,180,2026-05-02
MISM-095-RM,Anal Woman Do M Wife [Uncensored L**ked],https://pic.javct.net/poster/04112026/5cc4f0c0cd.jpg,https://javct.net/v/mism-095-rm,120,2026-05-02
MUDR-053-RM,For Him Who Loves You ... Dedicate Anal With A Smile Squirting Sensitive Girl Two Cum Cum Cum Inside Shin Kotani Minori [Uncensored L**ked],https://pic.javct.net/poster/04112026/127015c6b8.jpg,https://javct.net/v/mudr-053-rm,120,2026-05-02
MISM-088,Submissive Anal Made Collection,https://pic.javct.net/poster/04112026/4bf1d7d027.jpg,https://javct.net/v/mism-088,160,2026-05-02
GVG-761-RM,Amateur Petty Happy Being Kept Anal Pet Shincho Akari [Uncensored L**ked],https://pic.javct.net/poster/04112026/6867200961.jpg,https://javct.net/v/gvg-761-rm,135,2026-05-02
EKW-080-RM,"Today, I Want Her To Jack Me Off. An Mitsumi [Uncensored L**ked]",https://pic.javct.net/poster/20221904/1653628260.jpg,https://javct.net/v/ekw-080-rm,120,2026-05-02
MIST-369-RM,With Kanami Miura At Night... Having Sex Like Crazy With A Beautiful Girl At Night. Kanami Miura [Uncensored L**ked],https://pic.javct.net/poster/20221202/1649322626.jpg,https://javct.net/v/mist-369-rm,150,2026-05-02
WKD-049-RM,Fallen Woman - Himari Kinoshita [Uncensored L**ked],https://pic.javct.net/poster/20212011/1641054004.jpg,https://javct.net/v/wkd-049-rm,52,2026-05-02
JUL-685-RM,31-day Abstinence Life: 3rd Document Showing The Explosive Desire Of A Married Woman Who Just Likes Dick Too Much!! Saori Nagashima [Uncensored L**ked],https://static.javct.net/poster/jul-685.jpg,https://javct.net/v/jul-685-rm,137,2026-05-02
SSIS-261-US,"Breast, Buttocks, Vagina, 171cm, Tasting The Best Style All Over Marin Hinata 's New World Of Acme [English Subtitle, Reducing Mosaic]",https://pic.javct.net/poster/20212011/1639118863.jpg,https://javct.net/v/ssis-261-us,145,2026-05-02
JUY-602-RM,"She Is Unfaithful With Her Clothes Still On, Full Tight Clothing Fuck. Reiko Sawamura [Uncensored L**ked]",https://pic.javct.net/poster/20220707/1660149537.jpg,https://javct.net/v/juy-602-rm,151,2026-05-02
KATU-090-RM,"Sexy Thick Thigh Job Makes You Want To Fuck 2, 5 Thick Dirty Miniskirt Sluts! [Uncensored L**ked]",https://pic.javct.net/poster/20212709/1634971908.jpg,https://javct.net/v/katu-090-rm,181,2026-05-02
FOCS-020-RM,Undiscovered Talent In Hakata! The 171cm Luxuriously Slender And Pure Beautiful Girl. A Lewd Sexual Extravaganza That Goes For 1 Night And 2 Days Without Sleep. Haru Yamaguchi [Uncensored L**ked],https://pic.javct.net/poster/20212308/1631874901.jpg,https://javct.net/v/focs-020-rm,123,2026-05-02
HBAD-619-RM,This Tall Erotic Wicked Woman Is Planning To Seduce A Rich Old Man And Knock Him Off And Clean Him Out Of All His Money But She Ends Up Getting Fucked Instead And Becoming His Sexy Slut. Mirai Sena. [Uncensored L**ked],https://pic.javct.net/poster/20221904/1650519375.jpg,https://javct.net/v/hbad-619-rm,110,2026-05-02
JUY-252-RM,My Big Sister-In-Law's Tight Peachy Ass Was Just Too Sexy... Maya Takeuchi [Uncensored L**ked],https://pic.javct.net/poster/20220406/1655379980.jpg,https://javct.net/v/juy-252-rm,118,2026-05-02
LULU-095-RM,"My Big Stepsister Was Working As A Model, And She Had Such A Beautiful Ass, I Could No Longer Resist, So I Gave Her A Furious Piston-Pounding Quickie, And Continued To Pour Creampie Cum Shots Into Her Ass. Himari Kinoshita [Uncensored L**ked]",https://pic.javct.net/poster/20212709/1633504868.jpg,https://javct.net/v/lulu-095-rm,148,2026-05-02
NGOD-151-RM,Woman At The Convenience Store Headquarters 6 - Chitose Yuki [Uncensored L**ked],https://static.javct.net/poster/ngod-151.jpg,https://javct.net/v/ngod-151-rm,122,2026-05-02
SONE-496-SUB,"After 15 years of dedication to high jumping, she has decided to retire! The world-famous beautiful medalist who can no longer fly is now an addictive sex slave for her sponsor's old man presidents, Kaede Fua [English Subtitle]",https://pic.javct.net/poster/20241115/1732244084.jpg,https://javct.net/v/sone-496-sub,160,2026-05-02
SDNM-515V-RM,"[Bonus Edition] 49 years old... The last spring of her life. 178cm tall, a wife with a model-like figure. AV DEBUT Sanae Kurihara [Uncensored L**ked]",https://pic.javct.net/poster/09052025/1761187138.jpg,https://javct.net/v/sdnm-515v-rm,233,2026-05-02
SSNI-753-SUB,Amu Hanamiya [English Subtitle],https://pic.javct.net/poster/07202025/1756095305.jpg,https://javct.net/v/ssni-753-sub,120,2026-05-02
NAMH-042-RM,H-Cup Big Tits Newcomer [Uncensored L**ked],https://pic.javct.net/poster/09052025/1758090007.jpg,https://javct.net/v/namh-042-rm,107,2026-05-02
NAMH-042,H-Cup Big Tits Newcomer,https://pic.javct.net/poster/09052025/1758090007.jpg,https://javct.net/v/namh-042,107,2026-05-02
EBWH-248-RM,"I'll make her cum until she releases all of her body fluids from her tall, glamorous body. Even after a thick creampie, the pleasure-soaked, obscene sex continues. Kiyomiya Jinai [Uncensored L**ked]",https://pic.javct.net/poster/09052025/1757613856.jpg,https://javct.net/v/ebwh-248-rm,120,2026-05-02
KWC-008-RM,Unexpected explosion! Painful and frustrating sex [Uncensored L**ked],https://pic.javct.net/poster/07202025/1756373230.jpg,https://javct.net/v/kwc-008-rm,55,2026-05-02
KWC-008,Unexpected explosion! Painful and frustrating sex,https://pic.javct.net/poster/07202025/1756373230.jpg,https://javct.net/v/kwc-008,55,2026-05-02
START-391,Koiki Nagisa,https://pic.javct.net/poster/07202025/1756160198.jpg,https://javct.net/v/start-391,110,2026-05-02
URKN-503-RM,Azu Amatsuki [Uncensored L**ked],https://pic.javct.net/poster/07202025/1755018468.jpg,https://javct.net/v/urkn-503-rm,94,2026-05-02
GVH-842,"The World's Most Sadistic Female Boss Who Loves To Make People Drink Her Urine: Holy Water Training, Big Ass Face Riding, Urine Drinking, Cunnilingus, And Re-education Program - Kitano Mina",https://pic.javct.net/poster/04112026/426d849dea.jpg,https://javct.net/v/gvh-842,170,2026-05-02
NKKD-296-RM,An Intelligent Female Boss And A New Graduate I Have A Business-Like Physical Relationship. [Uncensored L**ked],https://pic.javct.net/poster/20230908/1694150157.jpg,https://javct.net/v/nkkd-296-rm,140,2026-05-02
NSFS-215-RM,Younger Female Boss Who Changed Jobs / Re-employed 2 Hazuki Wakamiya [Uncensored L**ked],https://pic.javct.net/poster/20230908/1694233795.jpg,https://javct.net/v/nsfs-215-rm,108,2026-05-02
LUCY-026-RM,"The Secret Of My Female Boss: In Private, She Was A Submissive Masochistic Woman - Yu Kawakami [Uncensored L**ked]",https://pic.javct.net/poster/04112026/1777057213.jpg,https://javct.net/v/lucy-026-rm,118,2026-05-02
CJOD-513-RM,"Saturday Morning, I Was Drunk Last Night And Didn't Notice, But My Female Boss Miyu Aizawa, Wearing Sporty Underwear When She Woke Up, Aroused Me And Gave Me A Slutty Load Of Cum Inside Her As Soon As She Woke Up, With My Rock-hard Morning Cock Going Once, Twice, Three Times. [Uncensored L**ked]",https://pic.javct.net/poster/04112026/1776966471.jpg,https://javct.net/v/cjod-513-rm,120,2026-05-02
MESU-94-RM,Overtime Sex With My Old Lady Boss In The Creampie Office Yukari Mikawa [Uncensored L**ked],https://pic.javct.net/poster/20221202/1647582411.jpg,https://javct.net/v/mesu-94-rm,109,2026-05-02
LUCY-026,"The Secret Of My Female Boss: In Private, She Was A Submissive Masochistic Woman - Yu Kawakami",https://pic.javct.net/poster/04112026/1777057213.jpg,https://javct.net/v/lucy-026,118,2026-05-02
HMN-849-RM,"The Strict, Spartan Female Boss At The Company Is Surprisingly A Smiling Soap Girl!! She's Usually Terrifying But Now She's Completely Accepting And Doting On You Like A Baby, Giving You A Wild 20-shot Cumshot Inside Her. Ayatsuki Nanao [Uncensored L**ked]",https://pic.javct.net/poster/04112026/1776964051.jpg,https://javct.net/v/hmn-849-rm,120,2026-05-02
JUR-686,"The Hidden True Nature Of Department Head Nanba, Who Always Belittles Her Subordinates. Revenge Training To Demote The Power-abusing Female Boss To My Personal Masochistic Slave. Nanba Akika",https://pic.javct.net/poster/04112026/1776965948.jpg,https://javct.net/v/jur-686,110,2026-05-02
CJOD-513,"Saturday Morning, I Was Drunk Last Night And Didn't Notice, But My Female Boss Miyu Aizawa, Wearing Sporty Underwear When She Woke Up, Aroused Me And Gave Me A Slutty Load Of Cum Inside Her As Soon As She Woke Up, With My Rock-hard Morning Cock Going Once, Twice, Three Times.",https://pic.javct.net/poster/04112026/1776966471.jpg,https://javct.net/v/cjod-513,120,2026-05-02
HMN-849,"The Strict, Spartan Female Boss At The Company Is Surprisingly A Smiling Soap Girl!! She's Usually Terrifying But Now She's Completely Accepting And Doting On You Like A Baby, Giving You A Wild 20-shot Cumshot Inside Her. Ayatsuki Nanao",https://pic.javct.net/poster/04112026/1776964051.jpg,https://javct.net/v/hmn-849,120,2026-05-02
AEGE-014-RM,Hairy Pleasure - Amaharu Noa Uses Force To Force An Overbearing Female Manager Down And Turn Her Into A Sex Slave [Uncensored L**ked],https://pic.javct.net/poster/20230908/1695268679.jpg,https://javct.net/v/aege-014-rm,147,2026-05-02
FBOS-007-RM,A Stormy Night Alone With Her Female Boss Trapped In The Company Hazuki Wakamiya [Uncensored L**ked],https://pic.javct.net/poster/20230908/1695459644.jpg,https://javct.net/v/fbos-007-rm,120,2026-05-02
