code,title,image_url,page_url,views,date_scraped
FC2PPV-4867354,"Resuming with a fair-skinned, bristle-haired girl who just moved to Tokyo from Aomori. She begs me to make her pregnant, and while shaking her pink nipples and D-cup beautiful breasts, she twitches and convulses, and the thick cloudy liquid from her big cock explodes into pregnancy.",https://pic.javct.net/poster/06032026/1774153711.jpg,https://javct.net/v/fc2ppv-4867354,56,2026-03-23
FC2PPV-4865696,"[First shot] A guy with a cute smile is getting hot in the sun, and suddenly changes when he sees a cock for the first time in a while, shaking his hips and asking for the semen of an unknown guy he met on an app.",https://pic.javct.net/poster/06032026/1774069630.jpg,https://javct.net/v/fc2ppv-4865696,45,2026-03-23
FC2PPV-4867621,A girlfriend with G breasts who eats a large amount of sperm that is not enough just to have daily creampie with her cohabiting girlfriend,https://pic.javct.net/poster/06032026/1774154467.jpg,https://javct.net/v/fc2ppv-4867621,60,2026-03-23
FC2PPV-4867433,Momoka-chan dangerous day uterine dilation Serious pregnancy #7,https://pic.javct.net/poster/06032026/1774154354.jpg,https://javct.net/v/fc2ppv-4867433,134,2026-03-23
FC2PPV-4867287,"Current **model appearing in a famous apparel ad**pyjpx*jsps Has appeared in a Japanese ad for a world-famous brand that everyone knows.Completely first shooting.No experience in cabaret, adult entertainment, support, 534th solo shoot.",https://pic.javct.net/poster/06032026/1774154258.jpg,https://javct.net/v/fc2ppv-4867287,202,2026-03-23
FC2PPV-4867610,[Neat/Amateur] Introverted 21 year old professional ◯ I fucked raw,https://pic.javct.net/poster/06032026/1774154232.jpg,https://javct.net/v/fc2ppv-4867610,46,2026-03-23
FC2PPV-4867418,"[No] Permission for first shooting NTR Korean half-married woman What's going on with this? It's big. Excited for the first time by a thick black cock, her desire is released, her reason collapses with the sound of pussy farting, and she's very satisfied with the creampie [Overseas version] Bonus included",https://pic.javct.net/poster/06032026/1774154126.jpg,https://javct.net/v/fc2ppv-4867418,43,2026-03-23
FC2PPV-4867426,[None/Number] Creampie video of the amateur layer of Hetiakos who loves sex so much that her mouth and pussy are all muddy and the best lewd goddess won't let you sleep tonight.,https://pic.javct.net/poster/06032026/1774153894.jpg,https://javct.net/v/fc2ppv-4867426,40,2026-03-23
BDA-218-RM,Bound And To**ured Awakening: A Devilish Woman Is Restrained And Imprisoned Hibiki Otsuki [Uncensored L**ked],https://pic.javct.net/poster/06032026/1774059524.jpg,https://javct.net/v/bda-218-rm,154,2026-03-23
AARM-342-RM,Ruthlessly Stimulating The Defenseless Testicles And Underside Of The Muscles! Rejuvenating Salon On All Fours 3 [Uncensored L**ked],https://pic.javct.net/poster/06032026/1774059987.jpg,https://javct.net/v/aarm-342-rm,125,2026-03-23
XVSR-100-RM,Furiously Facials And Gokkun Ban Ogawa Momohate [Uncensored L**ked],https://pic.javct.net/poster/06032026/1774226270.jpg,https://javct.net/v/xvsr-100-rm,120,2026-03-23
EKDV-810-RM,This Bitch Is In The Heat Right Now!? Would You Like To Try It With Nishimoto Meisa? [Uncensored L**ked],https://pic.javct.net/poster/06032026/1774059059.jpg,https://javct.net/v/ekdv-810-rm,150,2026-03-23
FC2PPV-4866254,"[Bonus included] [SSS grade] [Full face exposed] Indoor style neat and clean beauty, violent squirting and violent sex, showing off her terrifying cowgirl sk**ls",https://pic.javct.net/poster/06032026/1774153755.jpg,https://javct.net/v/fc2ppv-4866254,49,2026-03-23
FC2PPV-4867344,"Hairy beauty 3 Kasumi, a 19 year old former member of the rhythmic gymnastics team, has a large amount of naughty sex with a cute girl with a plump beautiful body wearing a cheerleading costume.She has experience as a former rhythmic gymnastics team cheerleader and shows off her competition.",https://pic.javct.net/poster/06032026/1774153857.jpg,https://javct.net/v/fc2ppv-4867344,56,2026-03-23
SSIS-858-RM,"Even Though You're A Teacher, You're Bound To Get Fucked By Us Because You Have Huge Erotic Breasts, You Understand, Right? Nagi Hikaru [Uncensored L**ked]",https://pic.javct.net/poster/20230908/1694714182.jpg,https://javct.net/v/ssis-858-rm,120,2026-03-23
ADN-503-RM,My Father-in-law's Kiss As He Licks Me Miu Shiramine [Uncensored L**ked],https://pic.javct.net/poster/20231011/1699149399.jpg,https://javct.net/v/adn-503-rm,120,2026-03-23
SONE-248-RM,K-cup Secretary Gets Licked And Violated By Her Slug-like Boss Until She Cums Hikaru Nagi [Uncensored L**ked],https://pic.javct.net/poster/20243105/1720146570.jpg,https://javct.net/v/sone-248-rm,120,2026-03-23
JUQ-404-RM,Nude Model NTR Shocking Cheating Video Of A Wife Drowning In Shame With Her Boss Sayuri Hayama [Uncensored L**ked],https://pic.javct.net/poster/20231011/1698144969.jpg,https://javct.net/v/juq-404-rm,120,2026-03-23
FPRE-004-RM,Sleep R**e: Putting My Cocky Son's Big-breasted Wife To Sleep With Sleeping Pills And Raping Her. Mina Kitano [Uncensored L**ked],https://pic.javct.net/poster/20231912/1704020502.jpg,https://javct.net/v/fpre-004-rm,150,2026-03-23
JUQ-943-RM,Nude Model NTR: Shocking Video Of Wife Cheating With Her Boss And Drowning In Shame Meguri [Uncensored L**ked],https://pic.javct.net/poster/20241115/1732243413.jpg,https://javct.net/v/juq-943-rm,140,2026-03-23
SOAN-108-RM,"The Mother Of The Sakuma Family Who Fell Into Masochistic Anal. A Sexless Married Woman Who Is Not Recognized As A Woman By Her Husband Is Publicly Insulted And Inseminated In Two Holes By Another Man's Cock! The Whole Story Of How She Betrayed Her Husband And Fell Into Masochistic Awakening...Kaede, 42 Years Old [Uncensored L**ked]",https://pic.javct.net/poster/20242108/1727490518.jpg,https://javct.net/v/soan-108-rm,143,2026-03-23
JUQ-540-RM,"Wanted To Make My Wife Admit My Love, So I Left Her And My Unfaithful Junior Alone For 3 Hours...My NTR Story About How My Wife Was Stolen From Me With A Total Of 17 Vaginal Cum Shots Without Pulling Out Sayuri Hayama [Uncensored L**ked]",https://pic.javct.net/poster/20231912/1704643413.jpg,https://javct.net/v/juq-540-rm,120,2026-03-23
FSDSS-672-RM,"I keep being r**ed... A beautiful wife from a rural area is trained by a young man from the city near her husband, and she falls into a sexual assault with Nene Yoshitaka. [Uncensored L**ked]",https://pic.javct.net/poster/20231011/1697259924.jpg,https://javct.net/v/fsdss-672-rm,120,2026-03-23
YUJ-008-RM,"You Have A Husband And I Have A Wife, But You And Your Colleagues At Work Asked Each Other Until The Sun Rose. Miu Shiramine [Uncensored L**ked]",https://pic.javct.net/poster/20230908/1695605474.jpg,https://javct.net/v/yuj-008-rm,120,2026-03-23
STARS-923-RM,"5 Situations Where You Can Enjoy Rei Kamiki's ""beautiful Butt"" With A Transcendental Style.Actually, I...not Only My Boobs But Also My Buttocks Are Amazing Rei Kamiki [Uncensored L**ked]",https://pic.javct.net/poster/20231011/1697068491.jpg,https://javct.net/v/stars-923-rm,156,2026-03-23
JUQ-510-RM,The World's Most Luxurious Commemorative Work! ! Madonna 20th Anniversary - First Ever ALL Exclusive Bus Tour With Unlimited Creampie And Steam! ! First Part 4 Hours OVER 2-disc Set! ! [Uncensored L**ked],https://pic.javct.net/poster/20231912/1703554075.jpg,https://javct.net/v/juq-510-rm,290,2026-03-23
FTAV-003-RM,"""I Love Him, But... I'm Getting Wet Just Thinking About What He's Going To Do..."" I-cup Nurse, 22 Years Old, Not Affiliated With Kimitsu City, Chiba Production, A Woman With Natural Big Breasts Who Lives In The Countryside, Still An Amateur, SOFT ON DEMAND Yu Sasamoto's (tentative) Appearance For The Fourth Time In The New House Where Her Married Life Begins And Her Fiancé Works... [Uncensored L**ked]",https://pic.javct.net/poster/20242108/1727115023.jpg,https://javct.net/v/ftav-003-rm,159,2026-03-23
URE-100-RM,"Congratulations! Commemorative Work For 100 Mature Comics Original Work: Purpoison Mother-eating ~Yarichin Travel Edition~ Cumulative Total Of Over 100,000 Downloads Of The Series! ! A Live-action Sequel To The Legendary Popular Doujin Work Starring Madonna! ! Exclusive, Ririko Kinoshita's 6 Gorgeous Performances With Large Volumes! ! [Uncensored L**ked]",https://pic.javct.net/poster/20231711/1702777063.jpg,https://javct.net/v/ure-100-rm,240,2026-03-23
MVSD-471-RM,Remote Control NTS Indecent Pant Of My Beloved Wife Drowning In Another Stick Michiru Kujo [Uncensored L**ked],https://pic.javct.net/poster/20231912/1704622292.jpg,https://javct.net/v/mvsd-471-rm,120,2026-03-23
ADN-564-RM,"I Kept Giving My Son's Wife An Aphrodisiac So That She Wouldn't Find Out, And I Made Her Body, Which Had Become An Erogenous Zone, Go Crazy With Excitement And Climax. Shiramine Miu [Uncensored L**ked]",https://pic.javct.net/poster/20241804/1714707796.jpg,https://javct.net/v/adn-564-rm,160,2026-03-23
MEYD-890-RM,I Spent A Week Having Sex With A Big-breasted Aunt With A Sloppy Personality In A Ch**ing Trash Room. Sayama Love [Uncensored L**ked],https://pic.javct.net/poster/20241703/1710726271.jpg,https://javct.net/v/meyd-890-rm,150,2026-03-23
JUQ-563-RM,Days Of Creampie Ring That Will Never End. Sayuri Hayama [Uncensored L**ked],https://pic.javct.net/poster/20241901/1708307694.jpg,https://javct.net/v/juq-563-rm,120,2026-03-23
FSDSS-673-RM,"My husband isn't here today, so why don't we have another drink at home? I, Yuko Ono, got excited when I saw my ex-girlfriend again at the class reunion, wearing no panties or bra. [Uncensored L**ked]",https://pic.javct.net/poster/20231011/1698379389.jpg,https://javct.net/v/fsdss-673-rm,120,2026-03-23
JUQ-439-RM,"During My Wife's Pregnancy, I Was Forbidden To Even Masturbate, So I Had Sex With My Mother-in-law, Sayuri, Who Had Moved To Tokyo Many Times... Sayuri Hayama [Uncensored L**ked]",https://pic.javct.net/poster/20231011/1699830529.jpg,https://javct.net/v/juq-439-rm,120,2026-03-23
ROE-163-RM,My Aunt's Wet And See-through Body. A Night Alone Under The Same Roof... Sentimental Rain Pattern Yuka Mizuno [Uncensored L**ked],https://pic.javct.net/poster/20230908/1695970848.jpg,https://javct.net/v/roe-163-rm,140,2026-03-23
WAAA-303-RM,I Asked My Plump Wife At My Part-time Job To Be My Tutor... Ai Sayama [Uncensored L**ked],https://pic.javct.net/poster/20230908/1696605519.jpg,https://javct.net/v/waaa-303-rm,120,2026-03-23
ACHJ-030-RM,Madonna Dengeki Exclusive Authentic Slut Sumire Mizukawa Endless Ejaculation Orgasm That Makes Masochist Man's Body And Mind Melt With Deep And Rich Kisses And Stopping Creampie [Uncensored L**ked],https://pic.javct.net/poster/20231711/1700382348.jpg,https://javct.net/v/achj-030-rm,110,2026-03-23
PRED-526-RM,"When I Took Care Of Miu-sensei Who Had Collapsed And Sent Her Home... I Was A Monster Of Sexual Desire, And I Couldn't Stop Getting An Erection Due To Her Plump, Beautiful Legs And Strong Legs, And Ended Up Ejaculating Over And Over Again Until Morning. Shiramine Miu [Uncensored L**ked]",https://pic.javct.net/poster/20231011/1697500675.jpg,https://javct.net/v/pred-526-rm,120,2026-03-23
