code,title,image_url,page_url,views,date_scraped
FC2PPV-4899749,[Amateur's first shot/main feature face] Hana (18) This is a different angle video of an amateur who lives in the countryside and anal penetration ATM and electric massager continuous orgasm.,https://pic.javct.net/poster/04112026/f8fccf5298.jpg,https://javct.net/v/fc2ppv-4899749,166,2026-05-14
FC2PPV-4892365,[Individual camera/kitchen affair] <Erotic breasts/big butt perverted wife> Having sex at home when her husband is away! Cumming all over the place! Cumming with a hard piston on her ahegao face and a cock-loving affair!!,https://pic.javct.net/poster/04112026/52337a06a4.jpg,https://javct.net/v/fc2ppv-4892365,60,2026-05-14
FC2PPV-4899850,"[First shooting] A very rare person with 1 experience, I took a sex video. Even though he looks like a quiet person, it is illegal to be a masochist. He was a pervert who squirted during the deep orgasm.",https://pic.javct.net/poster/04112026/fdfec315d3.jpg,https://javct.net/v/fc2ppv-4899850,77,2026-05-14
FC2PPV-4899427,[Out of print] An 18-year-old girl with a dazzling smile and fair-skinned nude body has sex for the first time in her life ♥️ Massive ejaculation into the love juice-covered pussy of a beautiful woman who is nervous that she might become pregnant ♥️,https://pic.javct.net/poster/04112026/afe37cb3fd.jpg,https://javct.net/v/fc2ppv-4899427,104,2026-05-14
FC2PPV-4899533,"A 23-year-old office lady who came to Tokyo from Kansai, has raw sex without rubber during a high-priced part-time job and cums inside her fair-skinned and petite body.",https://pic.javct.net/poster/04112026/a767e6f8ed.jpg,https://javct.net/v/fc2ppv-4899533,59,2026-05-14
FC2PPV-4899692,"Case #132 where an amateur came to do naughty things with her face exposed Miku-chan (20), a beautiful, fair-skinned and cute girl with an outstanding figure transforms.",https://pic.javct.net/poster/04112026/3f1f029f4e.jpg,https://javct.net/v/fc2ppv-4899692,58,2026-05-14
FC2PPV-4899872,[Complete facial exposure 2-piece set] SSS Icharab delivery with idol-class cute beauty,https://pic.javct.net/poster/04112026/4b0b775446.jpg,https://javct.net/v/fc2ppv-4899872,83,2026-05-14
FC2PPV-4899642,A big-breasted single mother brought her one c**ld to the shooting location. A sex video with no morals is forbidden and a creampie next to the stroller.,https://pic.javct.net/poster/04112026/4ffa9f8b1d.jpg,https://javct.net/v/fc2ppv-4899642,26,2026-05-14
FC2PPV-4899993,The secret face of the beautiful office lady from a cool manufacturer is an unexpectedly P-active job.She gets a hard piss on her slender sensitive body and cums continuously in tight pussy.,https://pic.javct.net/poster/04112026/0c512be5cd.jpg,https://javct.net/v/fc2ppv-4899993,53,2026-05-14
FC2PPV-4900381,"A year after moving to Tokyo, enjoy the innocent sex of a female college student who is still not used to the city.",https://pic.javct.net/poster/04112026/4e25048e28.jpg,https://javct.net/v/fc2ppv-4900381,93,2026-05-14
FC2PPV-4899877,"[With sound] [Individual] A former model with a half-faced face. 4 months pregnant, her work has drastically decreased. Even though she is behind on her payments, she can't let go of her cocky attitude from her past glory. She is showing her mental state of not giving in to the advances of others.",https://pic.javct.net/poster/04112026/8dfb893590.jpg,https://javct.net/v/fc2ppv-4899877,40,2026-05-14
FC2PPV-4713279,"Part 1, slender, black-haired bob, cool beauty, Tashiro-chan uniform cosplay creampie (main story face showing) Uncensored with review bonus",https://pic.javct.net/poster/04112026/7e2f93e3eb.jpg,https://javct.net/v/fc2ppv-4713279,62,2026-05-14
FC2PPV-4719263,"Part 2, slender, black-haired bob, cool beauty, Tashiro-chan bloomers cosplay creampie (main story face out) uncensored with review bonus",https://pic.javct.net/poster/04112026/a4db57b800.jpg,https://javct.net/v/fc2ppv-4719263,67,2026-05-14
420HPT-052,"Ako (22) Amateur Hoi Hoi, Amateur Hoi Hoi Pet, Amateur, Black Hair, Super Masochist, Submissive, Sensitive, Urinating, Wetting, Sex Friend, Jumping, Outdoors, Shame, Toys, Creampie, Gonzo, Documentary",https://pic.javct.net/poster/04112026/e4a2f67150.jpg,https://javct.net/v/420hpt-052,99,2026-05-14
SIMP-019,Kaho,https://pic.javct.net/poster/04112026/eb8b5445f4.jpg,https://javct.net/v/simp-019,69,2026-05-14
FC2PPV-4899053,[Sense of immorality] Exciting married woman's affair creampie & facial cumshot with 4 super thick ejaculations ~ Can you please smear my lascivious self so dirty without telling my husband...,https://pic.javct.net/poster/04112026/8328d27b04.jpg,https://javct.net/v/fc2ppv-4899053,69,2026-05-14
259LUXU-1884,"""Like a thing...I want to be fucked so hard that it breaks..."" [Very wet SEX where a sullen young lady spreads her erotic tide and orgasms wildly] Blindfolded, restrained, fucked, and masochist SP Luxury TV 1870",https://pic.javct.net/poster/04112026/6162d078ab.jpg,https://javct.net/v/259luxu-1884,68,2026-05-14
FC2PPV-4899589,"[Uncensored 2-part set] They told me it was a simple personal photo shoot, and I took them to the room and whether I cried or screamed, my first anal was delicious.",https://pic.javct.net/poster/04112026/72f1c7e52e.jpg,https://javct.net/v/fc2ppv-4899589,67,2026-05-14
FC2PPV-4898794,"Uncensored. It's as if the vagina is breathing... A simple and serious [woman's true nature] 〇〇-kun, who has a boyfriend who masturbates 182 days a year, cheats on me, so I too...",https://pic.javct.net/poster/04112026/6b285f310f.jpg,https://javct.net/v/fc2ppv-4898794,65,2026-05-14
336KNB-411,"[Nationwide Married Woman Ero Illustrated Book Shuuchin's Dirty Clash - Piston-] ""I want to see my husband happy...///"" It was supposed to be a netorare service for my beloved husband who appeared in an AV... but the beautiful wife was so erotic that she burst into tears with continuous orgasms and squirts, so hot that she even blew her glasses wwwwww at Toda City, Saitama Prefecture",https://pic.javct.net/poster/04112026/76eb2f2813.jpg,https://javct.net/v/336knb-411,70,2026-05-14
FC2PPV-4898104,"[Total of 4 shots] A tall beautiful woman participating in a summer comic with her hobby cosplay, she is shy but squeezes the cock violently with her beautiful butt and squeezes the man's semen with a smile",https://pic.javct.net/poster/04112026/952ef5af04.jpg,https://javct.net/v/fc2ppv-4898104,103,2026-05-14
FC2PPV-4899219,"[First shot] 20-year-old F-cup hairdresser's assistant says, ""No, that feels so good... Her fair-skinned beautiful body is violently penetrated by a long-lost big cock, and she trembles continuously and cums in her wet pussy that tightens and cums inside her.",https://pic.javct.net/poster/04112026/7fe145742a.jpg,https://javct.net/v/fc2ppv-4899219,67,2026-05-14
FC2PPV-4891971,"I was so excited about this fair-skinned, beautiful, slender girl with model-class beauty and style who likes close contact, and to be honest, I got a little too erect [Uncensored Creampie]",https://pic.javct.net/poster/04112026/9a6ec53967.jpg,https://javct.net/v/fc2ppv-4891971,63,2026-05-14
FC2PPV-4899575,"[3P continuous creampie] Once again, I think I got caught in the tangle of two young wives brought by the 〇mi company.",https://pic.javct.net/poster/04112026/61c6dfe63a.jpg,https://javct.net/v/fc2ppv-4899575,35,2026-05-14
SSIS-858-RM,"Even Though You're A Teacher, You're Bound To Get Fucked By Us Because You Have Huge Erotic Breasts, You Understand, Right? Nagi Hikaru [Uncensored L**ked]",https://pic.javct.net/poster/20230908/1694714182.jpg,https://javct.net/v/ssis-858-rm,120,2026-05-14
ADN-503-RM,My Father-in-law's Kiss As He Licks Me Miu Shiramine [Uncensored L**ked],https://pic.javct.net/poster/20231011/1699149399.jpg,https://javct.net/v/adn-503-rm,120,2026-05-14
SONE-248-RM,K-cup Secretary Gets Licked And Violated By Her Slug-like Boss Until She Cums Hikaru Nagi [Uncensored L**ked],https://pic.javct.net/poster/20243105/1720146570.jpg,https://javct.net/v/sone-248-rm,120,2026-05-14
JUQ-404-RM,Nude Model NTR Shocking Cheating Video Of A Wife Drowning In Shame With Her Boss Sayuri Hayama [Uncensored L**ked],https://pic.javct.net/poster/20231011/1698144969.jpg,https://javct.net/v/juq-404-rm,120,2026-05-14
FPRE-004-RM,Sleep R**e: Putting My Cocky Son's Big-breasted Wife To Sleep With Sleeping Pills And Raping Her. Mina Kitano [Uncensored L**ked],https://pic.javct.net/poster/20231912/1704020502.jpg,https://javct.net/v/fpre-004-rm,150,2026-05-14
JUQ-943-RM,Nude Model NTR: Shocking Video Of Wife Cheating With Her Boss And Drowning In Shame Meguri [Uncensored L**ked],https://pic.javct.net/poster/20241115/1732243413.jpg,https://javct.net/v/juq-943-rm,140,2026-05-14
SOAN-108-RM,"The Mother Of The Sakuma Family Who Fell Into Masochistic Anal. A Sexless Married Woman Who Is Not Recognized As A Woman By Her Husband Is Publicly Insulted And Inseminated In Two Holes By Another Man's Cock! The Whole Story Of How She Betrayed Her Husband And Fell Into Masochistic Awakening...Kaede, 42 Years Old [Uncensored L**ked]",https://pic.javct.net/poster/20242108/1727490518.jpg,https://javct.net/v/soan-108-rm,143,2026-05-14
JUQ-540-RM,"Wanted To Make My Wife Admit My Love, So I Left Her And My Unfaithful Junior Alone For 3 Hours...My NTR Story About How My Wife Was Stolen From Me With A Total Of 17 Vaginal Cum Shots Without Pulling Out Sayuri Hayama [Uncensored L**ked]",https://pic.javct.net/poster/20231912/1704643413.jpg,https://javct.net/v/juq-540-rm,120,2026-05-14
FSDSS-672-RM,"I keep being r**ed... A beautiful wife from a rural area is trained by a young man from the city near her husband, and she falls into a sexual assault with Nene Yoshitaka. [Uncensored L**ked]",https://pic.javct.net/poster/20231011/1697259924.jpg,https://javct.net/v/fsdss-672-rm,120,2026-05-14
STARS-923-RM,"5 Situations Where You Can Enjoy Rei Kamiki's ""beautiful Butt"" With A Transcendental Style.Actually, I...not Only My Boobs But Also My Buttocks Are Amazing Rei Kamiki [Uncensored L**ked]",https://pic.javct.net/poster/20231011/1697068491.jpg,https://javct.net/v/stars-923-rm,156,2026-05-14
YUJ-008-RM,"You Have A Husband And I Have A Wife, But You And Your Colleagues At Work Asked Each Other Until The Sun Rose. Miu Shiramine [Uncensored L**ked]",https://pic.javct.net/poster/20230908/1695605474.jpg,https://javct.net/v/yuj-008-rm,120,2026-05-14
FTAV-003-RM,"""I Love Him, But... I'm Getting Wet Just Thinking About What He's Going To Do..."" I-cup Nurse, 22 Years Old, Not Affiliated With Kimitsu City, Chiba Production, A Woman With Natural Big Breasts Who Lives In The Countryside, Still An Amateur, SOFT ON DEMAND Yu Sasamoto's (tentative) Appearance For The Fourth Time In The New House Where Her Married Life Begins And Her Fiancé Works... [Uncensored L**ked]",https://pic.javct.net/poster/20242108/1727115023.jpg,https://javct.net/v/ftav-003-rm,159,2026-05-14
JUQ-510-RM,The World's Most Luxurious Commemorative Work! ! Madonna 20th Anniversary - First Ever ALL Exclusive Bus Tour With Unlimited Creampie And Steam! ! First Part 4 Hours OVER 2-disc Set! ! [Uncensored L**ked],https://pic.javct.net/poster/20231912/1703554075.jpg,https://javct.net/v/juq-510-rm,290,2026-05-14
MVSD-471-RM,Remote Control NTS Indecent Pant Of My Beloved Wife Drowning In Another Stick Michiru Kujo [Uncensored L**ked],https://pic.javct.net/poster/20231912/1704622292.jpg,https://javct.net/v/mvsd-471-rm,120,2026-05-14
URE-100-RM,"Congratulations! Commemorative Work For 100 Mature Comics Original Work: Purpoison Mother-eating ~Yarichin Travel Edition~ Cumulative Total Of Over 100,000 Downloads Of The Series! ! A Live-action Sequel To The Legendary Popular Doujin Work Starring Madonna! ! Exclusive, Ririko Kinoshita's 6 Gorgeous Performances With Large Volumes! ! [Uncensored L**ked]",https://pic.javct.net/poster/20231711/1702777063.jpg,https://javct.net/v/ure-100-rm,240,2026-05-14
ADN-564-RM,"I Kept Giving My Son's Wife An Aphrodisiac So That She Wouldn't Find Out, And I Made Her Body, Which Had Become An Erogenous Zone, Go Crazy With Excitement And Climax. Shiramine Miu [Uncensored L**ked]",https://pic.javct.net/poster/20241804/1714707796.jpg,https://javct.net/v/adn-564-rm,160,2026-05-14
MEYD-890-RM,I Spent A Week Having Sex With A Big-breasted Aunt With A Sloppy Personality In A Ch**ing Trash Room. Sayama Love [Uncensored L**ked],https://pic.javct.net/poster/20241703/1710726271.jpg,https://javct.net/v/meyd-890-rm,150,2026-05-14
JUQ-563-RM,Days Of Creampie Ring That Will Never End. Sayuri Hayama [Uncensored L**ked],https://pic.javct.net/poster/20241901/1708307694.jpg,https://javct.net/v/juq-563-rm,120,2026-05-14
FSDSS-673-RM,"My husband isn't here today, so why don't we have another drink at home? I, Yuko Ono, got excited when I saw my ex-girlfriend again at the class reunion, wearing no panties or bra. [Uncensored L**ked]",https://pic.javct.net/poster/20231011/1698379389.jpg,https://javct.net/v/fsdss-673-rm,120,2026-05-14
JUQ-439-RM,"During My Wife's Pregnancy, I Was Forbidden To Even Masturbate, So I Had Sex With My Mother-in-law, Sayuri, Who Had Moved To Tokyo Many Times... Sayuri Hayama [Uncensored L**ked]",https://pic.javct.net/poster/20231011/1699830529.jpg,https://javct.net/v/juq-439-rm,120,2026-05-14
WAAA-303-RM,I Asked My Plump Wife At My Part-time Job To Be My Tutor... Ai Sayama [Uncensored L**ked],https://pic.javct.net/poster/20230908/1696605519.jpg,https://javct.net/v/waaa-303-rm,120,2026-05-14
ROE-163-RM,My Aunt's Wet And See-through Body. A Night Alone Under The Same Roof... Sentimental Rain Pattern Yuka Mizuno [Uncensored L**ked],https://pic.javct.net/poster/20230908/1695970848.jpg,https://javct.net/v/roe-163-rm,140,2026-05-14
ACHJ-030-RM,Madonna Dengeki Exclusive Authentic Slut Sumire Mizukawa Endless Ejaculation Orgasm That Makes Masochist Man's Body And Mind Melt With Deep And Rich Kisses And Stopping Creampie [Uncensored L**ked],https://pic.javct.net/poster/20231711/1700382348.jpg,https://javct.net/v/achj-030-rm,110,2026-05-14
MIMK-217-RM,"Live-action Version: I'm Having Trouble With My Husband's Stepc**ld. I'm Violated By The Insatiable Dick Of A Disgusting, Erotic Sex Monster Every Day... Ai Sayama [Uncensored L**ked]",https://pic.javct.net/poster/20250606/1752167661.jpg,https://javct.net/v/mimk-217-rm,120,2026-05-14
483DAM-065,[Kimees] Black Gal K-san [Massage],https://pic.javct.net/poster/04112026/6308140363.jpg,https://javct.net/v/483dam-065,42,2026-05-14
FC2PPV-4899209,"Kokoro-chan, an innocent 18-year-old, did this to commemorate her graduation.",https://pic.javct.net/poster/04112026/3fd9790ae0.jpg,https://javct.net/v/fc2ppv-4899209,40,2026-05-14
FC2PPV-4899281,"Even though she has a divine style and is thin, she is an E-cup model and I did FGO Bibodi Saber (Collaboration Star Rail Collaboration) Blowjob and doggy style sex edition",https://pic.javct.net/poster/04112026/d6a6a606d5.jpg,https://javct.net/v/fc2ppv-4899281,64,2026-05-14
FC2PPV-4899471,Big tits uniform cosplay titty fuck pincer 3 shots\!!p26,https://pic.javct.net/poster/04112026/18caa0798c.jpg,https://javct.net/v/fc2ppv-4899471,48,2026-05-14
FC2PPV-4897634,"[No] A perfect model style with a threatening inseam of 87 cm and a height of 173 cm, beautiful legs and beautiful breasts ⤴ Gokkun Creampie *Bonus High resolution",https://pic.javct.net/poster/04112026/8e1a68c86c.jpg,https://javct.net/v/fc2ppv-4897634,68,2026-05-14
420HOI-394-RM,"Aomi (23) Amateur Hoi Hoi Z, Amateur, Documentary, Gonzo, Beautiful Girl, Older Sister, Tall, Big Tits, Waist, Facial [Uncensored L**ked]",https://pic.javct.net/poster/04112026/3088b99747.jpg,https://javct.net/v/420hoi-394-rm,113,2026-05-14
XVSR-158-RM,Super Alive In The First Climax! ! JK 4 Production HakuSaki Yuzu Harnessed [Uncensored L**ked],https://pic.javct.net/poster/04112026/ec92beab12.jpg,https://javct.net/v/xvsr-158-rm,120,2026-05-14
SUJI-196-RM,Immorality Doubles Excitement Forbidden Brother And Sister Creampie Incest Shaved Wetting Daughter Alice Mizuki Alice [Uncensored L**ked],https://pic.javct.net/poster/20230804/1691819070.jpg,https://javct.net/v/suji-196-rm,109,2026-05-14
PGD-593-RM,Horny Cabin Attendant Kaori Has the Most Perfect Ass [Uncensored L**ked],https://pic.javct.net/poster/20221108/1660844199.jpg,https://javct.net/v/pgd-593-rm,166,2026-05-14
CHN-218-RM,"New Absolute Beautiful Girl, Lend To You 114 Miu Wakui (AV Actress) 21 Years Old [Uncensored L**ked]",https://pic.javct.net/poster/20222410/1668050713.jpg,https://javct.net/v/chn-218-rm,160,2026-05-14
PA-051426-100,A Horny Mom Who Gets Forcibly Fucked by Her Son's Friend but Can't Help But Enjoy It,https://pic.javct.net/poster/04112026/0f0d04fc49.jpg,https://javct.net/v/pa-051426-100,54,2026-05-14
1P-051426-001,The Professional Sexy Actress's Style: Eri Saeki,https://pic.javct.net/poster/04112026/7009d842af.jpg,https://javct.net/v/1p-051426-001,56,2026-05-14
DIC-064-RM,"Extremely Erotic Professional Dancer In LA LA Natsuki Misa AV Debut A Beautiful Dancer On The Crotch Is Unexplored, Dancing Crazy On The AV Stage! ! [Uncensored L**ked]",https://pic.javct.net/poster/04112026/67f9775194.jpg,https://javct.net/v/dic-064-rm,135,2026-05-14
SUPA-673-RM,"""We Haven't Had Sex Since We Got Married...it's All Built Up."" A Married Woman Overflowing With Sexual Desire Easily Spreads Her Legs And Begs For Cock In Intense Sex That Throws All Reason Out The Window. Amateur Wife's Extreme Slutty Sex BEST [Uncensored L**ked]",https://pic.javct.net/poster/04112026/4c7468bf9e.jpg,https://javct.net/v/supa-673-rm,230,2026-05-14
XVSR-159-RM,Once I'd Love To Experience! ! Pretty Awahime Xanadu Miyu Okura [Uncensored L**ked],https://pic.javct.net/poster/04112026/3d47d1bf1f.jpg,https://javct.net/v/xvsr-159-rm,120,2026-05-14
EBOD-430-RM,Plump Hcup Body Active Duty Beauty Life Saver AV Debut Of Rescue Workers Brown Sea Too Glare! Saijo Sarah [Uncensored L**ked],https://pic.javct.net/poster/06032026/1773803987.jpg,https://javct.net/v/ebod-430-rm,120,2026-05-14
VRNC-084-RM,A Huge Orgy With Beautiful Women With Outstanding Style And A High Sense Of Beauty! Raw Creampie SEX While Wearing Sweaty And Pitchy Lesson Clothes! [Hikaru/Kaho/Rio/Rin] Ver Hikaru & Kaho [Uncensored L**ked],https://pic.javct.net/poster/04112026/7ca5bf21b8.jpg,https://javct.net/v/vrnc-084-rm,84,2026-05-14
DIC-065-RM,18 Years And 7 Months. 14 Innocent 18-year-old Fascinated By SEX Minashino [Uncensored L**ked],https://pic.javct.net/poster/04112026/cfa1a44a23.jpg,https://javct.net/v/dic-065-rm,165,2026-05-14
SCOP-911-RM,"Is Incest On The Rise?! Excited By The Sense Of Transgression, Sperm Explodes... 50 Consecutive Cumshots Inside Female Relatives Being Shamelessly Fucked!! [Uncensored L**ked]",https://pic.javct.net/poster/04112026/16e723d219.jpg,https://javct.net/v/scop-911-rm,240,2026-05-14
URKK-075-RM,The Perverted Landlord Next Door Rubs My Tits And Fucks Me Every Day Shion Yumi [Uncensored L**ked],https://pic.javct.net/poster/20233001/1676086625.jpg,https://javct.net/v/urkk-075-rm,140,2026-05-14
FEM-029-RM,Miraculous GAL♂Debut: Himeno Kamiya [Uncensored L**ked],https://pic.javct.net/poster/04112026/f64be359b7.jpg,https://javct.net/v/fem-029-rm,122,2026-05-14
URKK-073-RM,My Boobs Are Rubbed By The Perverted Landlord Next Door And I Get R**ed Every Day Monami Takarada [Uncensored L**ked],https://pic.javct.net/poster/20222612/1673063341.jpg,https://javct.net/v/urkk-073-rm,140,2026-05-14
TIKB-167-RM,[Pacopako Video] This Icharab Couple! Too Erotic Www Hikaru Konno [Uncensored L**ked],https://pic.javct.net/poster/20230804/1691816160.jpg,https://javct.net/v/tikb-167-rm,145,2026-05-14
NVH-078-RM,A Natural Futanari Beauty's Penis And Clitoris Are Devoured By Her Transsexual Lesbian Tutor Hanamiya Hime/Wakamiya Hazuki [Uncensored L**ked],https://pic.javct.net/poster/04112026/4e204da5db.jpg,https://javct.net/v/nvh-078-rm,160,2026-05-14
SVVRT-034-RM,"Amateur Variety Recruitment Amateur Young Wife Machine Vibrator Challenge If You Don't Squirt Until The End, 1 Million Yen If You Lose, Creampie SEX Vol 4 [Uncensored L**ked]",https://pic.javct.net/poster/20230804/1691638868.jpg,https://javct.net/v/svvrt-034-rm,162,2026-05-14
ONEZ-089-RM,Newcomer AV Debut Why Does A 20-year-old Female College Student Appear In Adult Videos?Mugi-chan (pseudonym) [Uncensored L**ked],https://pic.javct.net/poster/04112026/024664c7c8.jpg,https://javct.net/v/onez-089-rm,120,2026-05-14
MGNL-164-RM,“My Beloved Husband Is On The Other Side Of The Window! A Rich Tongue-chu Challenge Where A Wife Who Hasn't Been A Married Couple For A Long Time Gradually Becomes More Extreme! ” A Tall Beautiful Mother Of Two Has A Deep Kiss With A Stranger Right Next To Her Husband ☆ A Completely Fallen NTR Copulation That Can't Stop Climaxing After A Long Time Of Raw Paco ♪ [Street Corner Amateur Monitoring # Nao # 32 Years Old] [Uncensored L**ked],https://pic.javct.net/poster/04112026/157ae70796.jpg,https://javct.net/v/mgnl-164-rm,86,2026-05-14
MGNL-162-RM,"""Friends Of A Man And Woman Get Closer In Mind And Body Through Mutual Body Measurements!?'' A Modest And Calm JD Deepens Their Bond By Touching Their Bodies With A Male Friend ☆ Unable To Suppress His Growing Excitement, He Finally Crosses The Line... The Unknown True Face Of A Neat And Clean Girl Is Revealed! Forbidden Raw Creampie ♪ [Street Corner Amateur Monitoring #Karin] [Uncensored L**ked]",https://pic.javct.net/poster/04112026/78d939e2b5.jpg,https://javct.net/v/mgnl-162-rm,97,2026-05-14
STAR-976-RM,Takeda Yume The Boy's Appearance Is Gangbanged And Ballet ... [Uncensored L**ked],https://pic.javct.net/poster/20222109/1665495089.jpg,https://javct.net/v/star-976-rm,125,2026-05-14
SEND-008-RM,Akane Sakura Angel Breasts [Uncensored L**ked],https://pic.javct.net/poster/04112026/6bb5fda10e.jpg,https://javct.net/v/send-008-rm,115,2026-05-14
YAG-014-RM,Married 9 Shyness Mio Kuraki Outdoors [Uncensored L**ked],https://pic.javct.net/poster/04112026/bbd7b638c8.jpg,https://javct.net/v/yag-014-rm,120,2026-05-14
SORA-107,Exposure To**ure Holy Water Lesbian Forest Halla × Aoi MurasakiMinoru,https://pic.javct.net/poster/04112026/6d62f31bd4.jpg,https://javct.net/v/sora-107,120,2026-05-14
CRPD-360,Drawing Model Azumi Mizushima Slut Best Exposure Of The Body,https://pic.javct.net/poster/04112026/3076656f66.jpg,https://javct.net/v/crpd-360,120,2026-05-14
MIDE-055,Open SEX Nishikawa Yui on the island of South,https://pic.javct.net/poster/04112026/ec047e04a8.jpg,https://javct.net/v/mide-055,120,2026-05-14
XVSR-154-RM,Yarra To The Shame × Exposure To Blush In Earnest To The Ayano Nana! ! [Uncensored L**ked],https://pic.javct.net/poster/20241804/1715997889.jpg,https://javct.net/v/xvsr-154-rm,120,2026-05-14
SEND-08-RM,Akane Sakura Angel Breasts [Uncensored L**ked],https://pic.javct.net/poster/04112026/d127e93327.jpg,https://javct.net/v/send-08-rm,115,2026-05-14
DAVK-116,"A Busty H-cup Dark-skinned Gal From The Lowest-ranking School Says, ""Stop It, Don't Touch Me,"" But A Group Of Middle-aged Men Punish Her With A 6P Orgy, Silencing Her Arrogant, Disrespectful Speech With Their Huge Cocks And Fucking Her Hard Until She's Covered In Semen.",https://pic.javct.net/poster/04112026/e09d094097.jpg,https://javct.net/v/davk-116,152,2026-05-14
RCT-752-RM,Beach Sand Is Guess Naked Mother If New Panel Lewd Parent And C**ld Incest Son In Naughty Game Turn Knowing In The Sea! [Uncensored L**ked],https://pic.javct.net/poster/20222612/1672267815.jpg,https://javct.net/v/rct-752-rm,120,2026-05-14
CEMD-842-RM,No-bra Mature Big-breasted Voluptuous Titty Date 5 Momono Marina [Uncensored L**ked],https://pic.javct.net/poster/04112026/382dd06231.jpg,https://javct.net/v/cemd-842-rm,174,2026-05-14
PIYO-048,Baby Face Big Breasts J,https://pic.javct.net/poster/04112026/b6551e4460.jpg,https://javct.net/v/piyo-048,200,2026-05-14
GVH-179,Exposure ・ Ring ● ・ Woman Obsessed With Bukkake Desire Himari Kinoshita,https://pic.javct.net/poster/04112026/d7886ca6d4.jpg,https://javct.net/v/gvh-179,120,2026-05-14
BKSP-017-RM,3 Tokyo Metropolitan Exposure Akira Watase [Uncensored L**ked],https://pic.javct.net/poster/04112026/116ad32e64.jpg,https://javct.net/v/bksp-017-rm,125,2026-05-14
CEMD-843-RM,"Humiliation, Sexual Assault, Wearing A Vibrator, And A Date In The Entertainment District! 40 Honami Hazuki [Uncensored L**ked]",https://pic.javct.net/poster/04112026/03840b61ec.jpg,https://javct.net/v/cemd-843-rm,133,2026-05-14
T28-473,Fishing Stupid Uncle Diary - Madonna Otsuki Sound And Rainbow Trout And Trout Fishing Challenge! !~,https://pic.javct.net/poster/04112026/a4df6fb6d6.jpg,https://javct.net/v/t28-473,120,2026-05-14
ABP-179,2014 Tan Girl Prestige Summer Festival. Yuzutsuki Love,https://pic.javct.net/poster/04112026/e3f6ff4fac.jpg,https://javct.net/v/abp-179,160,2026-05-14
MDTM-078,Naivete Lo●ta Umi Picks Up Old Guy Umi,https://pic.javct.net/poster/04112026/ed7773f79d.jpg,https://javct.net/v/mdtm-078,120,2026-05-14
ONED-647-RM,[Reducing Mosaic] Barely Censored Swimsuit Sluts Honoka [Uncensored L**ked],https://pic.javct.net/poster/04112026/ef4c5a0f27.jpg,https://javct.net/v/oned-647-rm,117,2026-05-14
GEBB-043,"Unaware That It Was A Mixed-sex Hot Spring Where Group Sex Was Allowed, Female Customers Came And Began To Moan As Their Big Breasts And Buttocks Were Sexually Assaulted By A Crocodile...3-4 People Included",https://pic.javct.net/poster/04112026/17d64b6a76.jpg,https://javct.net/v/gebb-043,125,2026-05-14
GEBB-045,The Hot Spring Resort Rumored To Be Frequented By Nymphomaniac Wives Who Prey On Virgins Actually Exists! 3 Featuring 4 Nymphomaniac Wives.,https://pic.javct.net/poster/04112026/cf9ce52264.jpg,https://javct.net/v/gebb-045,108,2026-05-14
SCAD-07-RM,Akane Sakura SPECIAL Bye Bye!! [Uncensored L**ked],https://pic.javct.net/poster/04112026/c712dbee14.jpg,https://javct.net/v/scad-07-rm,120,2026-05-14
