code,title,image_url,page_url,views,date_scraped
DASS-940,"Unleashed. First Time Transsexual Sex. With Hearts Pounding, They Kiss Again And Again, Falling In Love And Melting Together. Misao Oguri, Chika Saotome",https://pic.javct.net/poster/04112026/af81e4e563.jpg,https://javct.net/v/dass-940,120,2026-05-14
BOKD-071,Ona Prohibited One Month Transsexual Of Horse Par Firing Became Systemic-sensitive Zone In! Akari Yukino,https://pic.javct.net/poster/04112026/99731f2cfb.jpg,https://javct.net/v/bokd-071,130,2026-05-14
DASS-955,"The Female CEO I Admired Had A Huge Penis. Submitting To Power And Cock, I Betrayed My Fiancé In This Complete NTR (Netorare) Story Featuring Marina Ikeda And Hinako Seto.",https://pic.javct.net/poster/04112026/8ed5522476.jpg,https://javct.net/v/dass-955,120,2026-05-14
SDGY-001,"This Beautiful Woman Is A Male-to-female Transgender Person. ""She's So Beautiful That Her Gender Doesn't Matter Anymore."" [Meeting And Immediately Having Sex, Mutual Anal Insertion] A Documentary Of Two Days Of Non-stop Sex.",https://pic.javct.net/poster/04112026/fadcc58394.jpg,https://javct.net/v/sdgy-001,141,2026-05-14
FEM-029,Miraculous GAL♂Debut: Himeno Kamiya,https://pic.javct.net/poster/04112026/f64be359b7.jpg,https://javct.net/v/fem-029,122,2026-05-14
TCD-329,"Newhalf Lesbians ~Sadism And Masochism Are Two Sides Of The Same Coin~ Himeoka Shia, Shizuku Kokoro",https://pic.javct.net/poster/04112026/2b10d05670.jpg,https://javct.net/v/tcd-329,136,2026-05-14
AVOP-133,Lesbian-orgasm 2 Eba Liu Yukino Akari,https://pic.javct.net/poster/04112026/88573ae95f.jpg,https://javct.net/v/avop-133,160,2026-05-14
DASS-512-RM,Kana Hiiragi's Success Begins. I Tried To Train Her With The Most Theoretically Powerful AV Actress. Featuring Mao Hamasaki [Uncensored L**ked],https://pic.javct.net/poster/20240410/1729222758.jpg,https://javct.net/v/dass-512-rm,220,2026-05-14
KSBJ-074,My Husband Is In The ED ... Eliminating Frustration Is My Husband's Brother ... Hikari Yoshizawa,https://pic.javct.net/poster/04112026/120e847ad9.jpg,https://javct.net/v/ksbj-074,120,2026-05-14
KTKL-090-RM,"Small Devil Slut Girl Fururitan Hinako ""I'm Excited When I Make A Man Look Embarrassed."" [Uncensored L**ked]",https://pic.javct.net/poster/04112026/65b17be1fe.jpg,https://javct.net/v/ktkl-090-rm,125,2026-05-14
PIYO-064,"""Daddy, If You Love Me, Put Me In."" To The Adolescent Daughter And Daddy's Distorted Love Everyday, And Vaginal Cum Shot ... Ichika Matsumoto",https://pic.javct.net/poster/04112026/cb9983aa72.jpg,https://javct.net/v/piyo-064,240,2026-05-14
T28-606-RM,Incest Of An Older Brother Who Was Lustful For A Big-breasted Sister Who Was Wet And Transparent In The Rain [Uncensored L**ked],https://pic.javct.net/poster/20230104/1681748130.jpg,https://javct.net/v/t28-606-rm,120,2026-05-14
AED-256,Incest: Creampie In The Vagina Of A Fifty-year-old Mother Rika Utsugi,https://pic.javct.net/poster/04112026/26a9d8a183.jpg,https://javct.net/v/aed-256,115,2026-05-14
NSFS-477-RM,Mature Mother 39 ~A Mature Body Exposed To The World~ Mikine Ogura [Uncensored L**ked],https://pic.javct.net/poster/04112026/2c2958aa25.jpg,https://javct.net/v/nsfs-477-rm,106,2026-05-14
NSFS-477,Mature Mother 39 ~A Mature Body Exposed To The World~ Mikine Ogura,https://pic.javct.net/poster/04112026/2c2958aa25.jpg,https://javct.net/v/nsfs-477,106,2026-05-14
T28-475,Homecoming And Put Out In Secret Of Incest Sister And Parents Who Met In A Long Time Sexual Intercourse Yuri Asada,https://pic.javct.net/poster/04112026/2e87c3d8f0.jpg,https://javct.net/v/t28-475,120,2026-05-14
RVG-242-RM,Mother-son R**e BEST VOL.7 [Uncensored L**ked],https://pic.javct.net/poster/07202025/1754676373.jpg,https://javct.net/v/rvg-242-rm,240,2026-05-14
FERA-177-RM,Son Gamusha Kunni Is A Strike! Chisato Shoda Was Too Pleasant To Have Sex With Her And Ended Up Having Creampie Incest [Uncensored L**ked],https://pic.javct.net/poster/20230804/1692242601.jpg,https://javct.net/v/fera-177-rm,100,2026-05-14
ALDN-197-RM,I Can't Stand My Patience I'm A Daughter-In-Law But My Uncle Is Rina Ayana [Uncensored L**ked],https://pic.javct.net/poster/20230804/1691206140.jpg,https://javct.net/v/aldn-197-rm,125,2026-05-14
MIDV-852-SUB,"Sleeping R**e: I'm Soaking Wet And Easily Get Hot, So My Sex-crazed Father-in-law Is Licking Me Down... Sakura Miura [English Subtitle]",https://pic.javct.net/poster/20250903/1744310684.jpg,https://javct.net/v/midv-852-sub,120,2026-05-14
REBK-002-RM,"A pervert masochist mother writhes in pleasure as she is trained by her son. Aphrodisiac sex incest, domesticated bitch mother, restrained graffiti toy to**ure 3P Mitsuyo Ikuno, Yumiko Sakura, Mio Saionji [Uncensored L**ked]",https://pic.javct.net/poster/04112026/d87a8fb212.jpg,https://javct.net/v/rebk-002-rm,130,2026-05-14
BKD-314-RM,Mother-to-c**ld Copulation ~Haruna Futatsudake Road~ Reiko Iwai [Uncensored L**ked],https://pic.javct.net/poster/04112026/19a5fe5a09.jpg,https://javct.net/v/bkd-314-rm,121,2026-05-14
FERA-176-RM,"My Mother Became A Practice Table For Sex I Broke Up With My Mother Because Her Sex Was Too Good For Me, I Was Crazy And Cummed Over And Over Again Aika Nagano [Uncensored L**ked]",https://pic.javct.net/poster/20230804/1691638260.jpg,https://javct.net/v/fera-176-rm,100,2026-05-14
KTRA-784,L**i Niece Collection 4 Hours,https://pic.javct.net/poster/04112026/239f933078.jpg,https://javct.net/v/ktra-784,241,2026-05-14
DOCP-001-RM,"My younger sister who has a complex about her nipples tries to apply cream to make them pink, but they are too sensitive (tsuД') and says, ""Brother, apply it.''When I apply the cream, her body trembles as if she can feel it every time you touch her. [Uncensored L**ked]",https://pic.javct.net/poster/04112026/1775883079.jpg,https://javct.net/v/docp-001-rm,130,2026-05-14
HZ-3846,Beauty Collection Vol.120 - Ami Ogura,https://pic.javct.net/poster/04112026/6df9806905.jpg,https://javct.net/v/hz-3846,61,2026-05-14
HZ-3842,Miko Sakura Licks Asshole Relentlessly! - Miko Sakura,https://pic.javct.net/poster/04112026/4aaff769a8.jpg,https://javct.net/v/hz-3842,18,2026-05-14
HZ-3837,Beauty Collection Vol.119 - Rion,https://pic.javct.net/poster/04112026/cbe3dbfa19.jpg,https://javct.net/v/hz-3837,61,2026-05-14
HZ-3825,Beauty Collection Vol.116 - Nako Nagase,https://pic.javct.net/poster/04112026/1776148653.jpg,https://javct.net/v/hz-3825,61,2026-05-14
HZ-3822,Bonus Special Vol.7 - Mirei Imada - Shizuka Oshiro - Akari Satsuki,https://pic.javct.net/poster/06032026/1775794305.jpg,https://javct.net/v/hz-3822,44,2026-05-14
HZ-3813,Beauty Collection Vol.114 - Mirai Minano,https://pic.javct.net/poster/06032026/1774942526.jpg,https://javct.net/v/hz-3813,55,2026-05-14
HZ-3810,Bonus Special Vol.6 - Rina Kashino - Azumi Kirino - Mami Sakai,https://pic.javct.net/poster/06032026/1774585343.jpg,https://javct.net/v/hz-3810,55,2026-05-14
HZ-3806,My Best Friend Cuckolded His Beautiful Big Titted Girlfriend By Me!! - Satomi,https://pic.javct.net/poster/06032026/1773982254.jpg,https://javct.net/v/hz-3806,61,2026-05-14
HZ-3805,Beauty Collection Vol.112 - Shion Mochizuki,https://pic.javct.net/poster/06032026/1773726550.jpg,https://javct.net/v/hz-3805,61,2026-05-14
HZ-3802,Maho Hoshijima Sucks My Cock Deeply Down To Her Throat! - Maho Hoshijima,https://pic.javct.net/poster/06032026/1773376452.jpg,https://javct.net/v/hz-3802,20,2026-05-14
HZ-3801,Beauty Collection Vol.111 - Aya Goto,https://pic.javct.net/poster/06032026/1773121788.jpg,https://javct.net/v/hz-3801,53,2026-05-14
HZ-3800,Thick Sex With A Sadistic Slut MILF Vol.3 - Ayano Kikuchi,https://pic.javct.net/poster/06032026/1772969614.jpg,https://javct.net/v/hz-3800,63,2026-05-14
HZ-3799,Deep Throating Lover! -Masochistic Girl Yuna- - Yuna Mori,https://pic.javct.net/poster/06032026/1772860250.jpg,https://javct.net/v/hz-3799,60,2026-05-14
HZ-3798,Bonus Special Vol.5 - Satomi Inoue - Nana Kamiyama - Momoka Ogawa,https://pic.javct.net/poster/01202026/1772777801.jpg,https://javct.net/v/hz-3798,55,2026-05-14
HZ-3793,Beauty Collection Vol.110 - Tsubaki Honda,https://pic.javct.net/poster/01202026/1772515674.jpg,https://javct.net/v/hz-3793,61,2026-05-14
HZ-3788,Bonus Special Vol.4 - Rena - Emi Sakurai - Sanae Yamaguchi,https://pic.javct.net/poster/01202026/1771629111.jpg,https://javct.net/v/hz-3788,53,2026-05-14
HZ-3785,Beauty Collection Vol.108 - Mio Sakuragi,https://pic.javct.net/poster/01202026/1771319660.jpg,https://javct.net/v/hz-3785,61,2026-05-14
HRM-022-RM,"National Active Female College Student Cosplayer Guide 03 [Tokyo] A 143cm Tall, Sexy, Cute Girl: A Sweet, Sadistic, Premature Ejaculation Training ""Is Your Dick Okay?"" Raw Creampie, Squirting, And Squirting Fuck (Slutty Cat Maid) T Female College Freshman Mina [Uncensored L**ked]",https://pic.javct.net/poster/01202026/1771135015.jpg,https://javct.net/v/hrm-022-rm,76,2026-05-14
HRM-023-RM,"A 144cm Tall, Slutty, Masochistic, Slutty Cat Maid, Cute Cosplayer: ""There’s No Squirting That Doesn’t Stop, There’s No Sperm That Doesn’t Get Pregnant"" Raw Creampie, Impregnation, Squirting, And Facial Fuck [Uncensored L**ked]",https://pic.javct.net/poster/01202026/1771134946.jpg,https://javct.net/v/hrm-023-rm,43,2026-05-14
HZ-3783,"I'll Work Out Your Sexual Problems Explosively! -Just BJ, Not Cheating!?- Vol.5 - Yui Nanase",https://pic.javct.net/poster/01202026/1771042803.jpg,https://javct.net/v/hz-3783,60,2026-05-14
HZ-3781,Beauty Collection Vol.107 - Rin Aizawa,https://pic.javct.net/poster/01202026/1770710545.jpg,https://javct.net/v/hz-3781,63,2026-05-14
HZ-3779,Naughty Wife's Immoral Secret Over Her Husband Vol.20 - Nami Sawaguchi,https://pic.javct.net/poster/01202026/1770438932.jpg,https://javct.net/v/hz-3779,60,2026-05-14
HZ-3778,Bonus Special Vol.3 - Rion - Maria Osawa - Non Suzumiya,https://pic.javct.net/poster/01202026/1770351321.jpg,https://javct.net/v/hz-3778,56,2026-05-14
ALDN-199-RM,Naked Mother-in-law Miki Yoshii [Uncensored L**ked],https://pic.javct.net/poster/20230804/1691206016.jpg,https://javct.net/v/aldn-199-rm,110,2026-05-14
SCD-210-RM,"Super-Amazing, Super-Sexy Hospitality. The Tax Agents VS The Proprietress In See-Through Clothes. Nanao Nakano [Uncensored L**ked]",https://pic.javct.net/poster/20221904/1651304003.jpg,https://javct.net/v/scd-210-rm,116,2026-05-14
TENH-22-RM,"Naive Middle-aged Woman Who Readily Followed A Guy Who Hit On Her Gave Him A No-hands Blowjob!! He Took Her Back To His Place And Ejaculated In Her Mouth. 30 Men, 4 Hours [Uncensored L**ked]",https://pic.javct.net/poster/04112026/120cc309ad.jpg,https://javct.net/v/tenh-22-rm,240,2026-05-14
C-2359,MILF Wife Interview Gonzo [12],https://pic.javct.net/poster/04112026/ea73e2da9c.jpg,https://javct.net/v/c-2359,100,2026-05-14
HONE-296-RM,In Heat!! Erotic Manga Body Mother Nagasawa Fumika [Uncensored L**ked],https://pic.javct.net/poster/04112026/1776159515.jpg,https://javct.net/v/hone-296-rm,105,2026-05-14
JUX-918-RM,Breast Milk Wife Excavation Immediately Take AV Debut! ! Mina Hatano [Uncensored L**ked],https://pic.javct.net/poster/20241901/1707411650.jpg,https://javct.net/v/jux-918-rm,150,2026-05-14
AQSH-102-RM,Father-in-law And Papa Life Small Devil Bride Anna Hanayagi Who Seduces Father-in-law To Want Pocket Money [Uncensored L**ked],https://pic.javct.net/poster/20230804/1691814250.jpg,https://javct.net/v/aqsh-102-rm,120,2026-05-14
JUY-322-RM,Married Nursery Nurse Morality Train ~ An Obscene Commuter Swallowed By Pleasure ~ Kase Kanako [Uncensored L**ked],https://pic.javct.net/poster/20241902/1708907708.jpg,https://javct.net/v/juy-322-rm,140,2026-05-14
JUX-917-RM,Fresh Married Nonfiction Capstone Documentary! ! Motor Nerve Preeminent Fine Constricted Big Wife 35-year-old Ako's [Uncensored L**ked],https://pic.javct.net/poster/06032026/1773225283.jpg,https://javct.net/v/jux-917-rm,140,2026-05-14
VEC-604-RM,The Landlord's Wife Yuko Shiraki [Uncensored L**ked],https://pic.javct.net/poster/20230207/1691126782.jpg,https://javct.net/v/vec-604-rm,95,2026-05-14
420STH-125-RM,TAMALI(39) [Amateur Hoi Hoi Stay Home/Bring home/Amateur/Older sister/Big breasts/Mature woman/Facial/Gonzo/Documentary] [Uncensored L**ked],https://pic.javct.net/poster/04112026/7c3fe59721.jpg,https://javct.net/v/420sth-125-rm,50,2026-05-14
ODVHJ-076-RM,Wives' Hardcore Orgasms Completely Exposed During Dildo Masturbation 18 [Uncensored L**ked],https://pic.javct.net/poster/04112026/cffc888320.jpg,https://javct.net/v/odvhj-076-rm,190,2026-05-14
JUR-231-SUB,The Days Of Never Ending Creampie Gangbang. Yuri Oshikawa [English Subtitle],https://pic.javct.net/poster/20250903/1742488457.jpg,https://javct.net/v/jur-231-sub,140,2026-05-14
HONB-484-RM,"In The Showa Era, It Would Be Safe. [Uncensored L**ked]",https://pic.javct.net/poster/04112026/3025a7f0ac.jpg,https://javct.net/v/honb-484-rm,73,2026-05-14
HONB-483-RM,A 34-year-old Gal Who Flirts While Working A Clinical Trial For An Aphrodisiac. [Uncensored L**ked],https://pic.javct.net/poster/04112026/32453ea02f.jpg,https://javct.net/v/honb-483-rm,58,2026-05-14
ABW-253-RM,Customs Tower Sexual Feeling Full Course 3 Hours SPECIAL ACT.41 An Overwhelming Beautiful Girl Who Captivates Everything You See Will Do Your Best To Meet Your Desires Yuu Ryukawa [Uncensored L**ked],https://pic.javct.net/poster/20220406/1655977700.jpg,https://javct.net/v/abw-253-rm,210,2026-05-14
AARM-348-RM,Leg Fetish Men's Esthetic Salon ~ Legs Shibuya [Uncensored L**ked],https://pic.javct.net/poster/04112026/0ee1634fcd.jpg,https://javct.net/v/aarm-348-rm,130,2026-05-14
200GANA-3069-RM,"Seriously soft, first shot 2066 The president's secretary with a super SSS-class divine waist body that has nothing but sex appeal is obscenely shaking her hips and cumming, her slender limbs, well-shaped face, wonderful curvature, firm breasts, everything is erotic I can't get over the excitement of NTR sex that steals the president's woman which is so erotic [Uncensored L**ked]",https://pic.javct.net/poster/20242108/1725863231.jpg,https://javct.net/v/200gana-3069-rm,62,2026-05-14
SOAV-088-RM,A Married Woman's Cheating Heart. Sumire Kuramoto [Uncensored L**ked],https://pic.javct.net/poster/20221904/1651303763.jpg,https://javct.net/v/soav-088-rm,148,2026-05-14
MILK-179-RM,Landmine Runaway Girl X Unequaled Big Dick Man Sexual Intercourse Record Of Fucking A Sick Kawa Girl Found On SNS With Desire Monaka Sengoku [Uncensored L**ked],https://pic.javct.net/poster/20230804/1691639798.jpg,https://javct.net/v/milk-179-rm,126,2026-05-14
SON-124,AV Contract Kazumi Yanagida Out Married In Apo Without Taking Part,https://pic.javct.net/poster/04112026/f1f828ba0a.jpg,https://javct.net/v/son-124,130,2026-05-14
IPZZ-525-SUB,"""Let's All Have Sex."" A Slutty Unmarried Woman Gets Horny At A Wedding After-party And Eats All The Men. She Milks All The Sperm! Tsumugi Akari [English Subtitle]",https://pic.javct.net/poster/20250903/1743700032.jpg,https://javct.net/v/ipzz-525-sub,120,2026-05-14
MDTM-179-RM,For The First Time Of Anal Training School Girls Miku [Uncensored L**ked],https://pic.javct.net/poster/04112026/f49430c1d3.jpg,https://javct.net/v/mdtm-179-rm,120,2026-05-14
MOPP-121-RM,"A Masochistic Man Is Teased And Played With By A Slut Who Will Make His Brain Melt With Pleasure, And Is Never Allowed To Ejaculate As A Rewarding To**ure Of Masochistic Pleasure - Aoi Miumi [Uncensored L**ked]",https://pic.javct.net/poster/04112026/48a563fe22.jpg,https://javct.net/v/mopp-121-rm,120,2026-05-14
SHKD-263-RM,Roh Scion Slave Sex Toys F ... Kara - Angel 5 Home Helper Mu**er R**e - Anal [Uncensored L**ked],https://pic.javct.net/poster/04112026/56a02a2a68.jpg,https://javct.net/v/shkd-263-rm,150,2026-05-14
OPRD-026-RM,Izumi Hasegawa Lady Cum Anal Virgins 5 Ketsugatchin [Uncensored L**ked],https://pic.javct.net/poster/04112026/656fb84d3b.jpg,https://javct.net/v/oprd-026-rm,120,2026-05-14
MISM-230-RM,Absolute Ass Hole Beautiful Girl DEBUT Kyoka-chan College Student 20 Years Old [Uncensored L**ked],https://pic.javct.net/poster/20221202/1645163826.jpg,https://javct.net/v/mism-230-rm,120,2026-05-14
OTIN-025-RM,"Anal Cumshot Infidelity, Only Offering Her Anus To Her Lover! The Young Wife With Beautiful Breasts Loses Her Mind As She Gets Fucked In Both Holes With An Ahegao Face! Her Masochistic Side Blossoms In Erotic Cosplay! Ball Licking, Ch**ing, Tongue Sticking Out, Ahegao Face, Cumming Like Crazy With Cumshots! 2SEX Kohaku Yaya [Uncensored L**ked]",https://pic.javct.net/poster/04112026/54b57e3b94.jpg,https://javct.net/v/otin-025-rm,102,2026-05-14
MOPP-121,"A Masochistic Man Is Teased And Played With By A Slut Who Will Make His Brain Melt With Pleasure, And Is Never Allowed To Ejaculate As A Rewarding To**ure Of Masochistic Pleasure - Aoi Miumi",https://pic.javct.net/poster/04112026/48a563fe22.jpg,https://javct.net/v/mopp-121,120,2026-05-14
GVG-778-RM,Anal Ballerina 5 Hamasaki Naomi / Yuki Tamaki [Uncensored L**ked],https://pic.javct.net/poster/04112026/dc895279a2.jpg,https://javct.net/v/gvg-778-rm,130,2026-05-14
KNMB-060-RM,Complete Raw STYLE @ Sumire [Uncensored L**ked],https://pic.javct.net/poster/20230804/1693109983.jpg,https://javct.net/v/knmb-060-rm,140,2026-05-14
OTIN-025,"Anal Cumshot Infidelity, Only Offering Her Anus To Her Lover! The Young Wife With Beautiful Breasts Loses Her Mind As She Gets Fucked In Both Holes With An Ahegao Face! Her Masochistic Side Blossoms In Erotic Cosplay! Ball Licking, Ch**ing, Tongue Sticking Out, Ahegao Face, Cumming Like Crazy With Cumshots! 2SEX Kohaku Yaya",https://pic.javct.net/poster/04112026/54b57e3b94.jpg,https://javct.net/v/otin-025,102,2026-05-14
VICD-386,Squirting Big Tits Layer Tearing Anal To**ure,https://pic.javct.net/poster/04112026/e46f27401a.jpg,https://javct.net/v/vicd-386,170,2026-05-14
SAIT-029-RM,Beautiful Girl Agent Chi & Ta X 3 Hole Skewered Fuck X Double Guillotine Creampie Punishment X Massive Semen Bukkake Alice & Mei [Uncensored L**ked],https://pic.javct.net/poster/20230804/1692938611.jpg,https://javct.net/v/sait-029-rm,200,2026-05-14
BCV-003-RM,Wanted Chan TV × PRESTIGE SELECTION 03 [Uncensored L**ked],https://pic.javct.net/poster/04112026/e0801c6049.jpg,https://javct.net/v/bcv-003-rm,240,2026-05-14
MISM-239-RM,Full Awakening. Asshole Princess's Anal Penetration Confession Kyoka -chan [Uncensored L**ked],https://pic.javct.net/poster/20221904/1650612253.jpg,https://javct.net/v/mism-239-rm,139,2026-05-14
VIPR-078-RM,Dripping Wet Daydream Theater. Erika Sato . [Uncensored L**ked],https://pic.javct.net/poster/04112026/0f1129f2c2.jpg,https://javct.net/v/vipr-078-rm,59,2026-05-14
FOCS-048-RM,"38"" G-Cup Colossal Tits X 5'8"" Tall Crazy Girl With A Miraculously Slender Body - The Greatest Hard Rock Creampie Of Your Life Mira Sena [Uncensored L**ked]",https://pic.javct.net/poster/20212011/1644570879.jpg,https://javct.net/v/focs-048-rm,118,2026-05-14
VIPR-066-RM,BODY TO BODY Erika Sato [Uncensored L**ked],https://pic.javct.net/poster/04112026/81b6116248.jpg,https://javct.net/v/vipr-066-rm,58,2026-05-14
EKW-080-RM,"Today, I Want Her To Jack Me Off. An Mitsumi [Uncensored L**ked]",https://pic.javct.net/poster/20221904/1653628260.jpg,https://javct.net/v/ekw-080-rm,120,2026-05-14
JUY-865-RM,Madonna Exclusive Hot Mature Woman!! Married Woman's Lust Fuck Dripping With Immorality!! Husband Doesn't Know -My Dirty Lust And Secret- Maki Hojo [Uncensored L**ked],https://pic.javct.net/poster/20221904/1651553483.jpg,https://javct.net/v/juy-865-rm,119,2026-05-14
MIST-369-RM,With Kanami Miura At Night... Having Sex Like Crazy With A Beautiful Girl At Night. Kanami Miura [Uncensored L**ked],https://pic.javct.net/poster/20221202/1649322626.jpg,https://javct.net/v/mist-369-rm,150,2026-05-14
WKD-049-RM,Fallen Woman - Himari Kinoshita [Uncensored L**ked],https://pic.javct.net/poster/20212011/1641054004.jpg,https://javct.net/v/wkd-049-rm,52,2026-05-14
JUL-685-RM,31-day Abstinence Life: 3rd Document Showing The Explosive Desire Of A Married Woman Who Just Likes Dick Too Much!! Saori Nagashima [Uncensored L**ked],https://static.javct.net/poster/jul-685.jpg,https://javct.net/v/jul-685-rm,137,2026-05-14
SSIS-261-US,"Breast, Buttocks, Vagina, 171cm, Tasting The Best Style All Over Marin Hinata 's New World Of Acme [English Subtitle, Reducing Mosaic]",https://pic.javct.net/poster/20212011/1639118863.jpg,https://javct.net/v/ssis-261-us,145,2026-05-14
JUY-602-RM,"She Is Unfaithful With Her Clothes Still On, Full Tight Clothing Fuck. Reiko Sawamura [Uncensored L**ked]",https://pic.javct.net/poster/20220707/1660149537.jpg,https://javct.net/v/juy-602-rm,151,2026-05-14
KATU-090-RM,"Sexy Thick Thigh Job Makes You Want To Fuck 2, 5 Thick Dirty Miniskirt Sluts! [Uncensored L**ked]",https://pic.javct.net/poster/20212709/1634971908.jpg,https://javct.net/v/katu-090-rm,181,2026-05-14
FOCS-020-RM,Undiscovered Talent In Hakata! The 171cm Luxuriously Slender And Pure Beautiful Girl. A Lewd Sexual Extravaganza That Goes For 1 Night And 2 Days Without Sleep. Haru Yamaguchi [Uncensored L**ked],https://pic.javct.net/poster/20212308/1631874901.jpg,https://javct.net/v/focs-020-rm,123,2026-05-14
HBAD-619-RM,This Tall Erotic Wicked Woman Is Planning To Seduce A Rich Old Man And Knock Him Off And Clean Him Out Of All His Money But She Ends Up Getting Fucked Instead And Becoming His Sexy Slut. Mirai Sena. [Uncensored L**ked],https://pic.javct.net/poster/20221904/1650519375.jpg,https://javct.net/v/hbad-619-rm,110,2026-05-14
JUY-252-RM,My Big Sister-In-Law's Tight Peachy Ass Was Just Too Sexy... Maya Takeuchi [Uncensored L**ked],https://pic.javct.net/poster/20220406/1655379980.jpg,https://javct.net/v/juy-252-rm,118,2026-05-14
LULU-095-RM,"My Big Stepsister Was Working As A Model, And She Had Such A Beautiful Ass, I Could No Longer Resist, So I Gave Her A Furious Piston-Pounding Quickie, And Continued To Pour Creampie Cum Shots Into Her Ass. Himari Kinoshita [Uncensored L**ked]",https://pic.javct.net/poster/20212709/1633504868.jpg,https://javct.net/v/lulu-095-rm,148,2026-05-14
NGOD-151-RM,Woman At The Convenience Store Headquarters 6 - Chitose Yuki [Uncensored L**ked],https://static.javct.net/poster/ngod-151.jpg,https://javct.net/v/ngod-151-rm,122,2026-05-14
SONE-496-SUB,"After 15 years of dedication to high jumping, she has decided to retire! The world-famous beautiful medalist who can no longer fly is now an addictive sex slave for her sponsor's old man presidents, Kaede Fua [English Subtitle]",https://pic.javct.net/poster/20241115/1732244084.jpg,https://javct.net/v/sone-496-sub,160,2026-05-14
SDNM-515V-RM,"[Bonus Edition] 49 years old... The last spring of her life. 178cm tall, a wife with a model-like figure. AV DEBUT Sanae Kurihara [Uncensored L**ked]",https://pic.javct.net/poster/09052025/1761187138.jpg,https://javct.net/v/sdnm-515v-rm,233,2026-05-14
SSNI-753-SUB,Amu Hanamiya [English Subtitle],https://pic.javct.net/poster/07202025/1756095305.jpg,https://javct.net/v/ssni-753-sub,120,2026-05-14
NAMH-042-RM,H-Cup Big Tits Newcomer [Uncensored L**ked],https://pic.javct.net/poster/09052025/1758090007.jpg,https://javct.net/v/namh-042-rm,107,2026-05-14
NAMH-042,H-Cup Big Tits Newcomer,https://pic.javct.net/poster/09052025/1758090007.jpg,https://javct.net/v/namh-042,107,2026-05-14
EBWH-248-RM,"I'll make her cum until she releases all of her body fluids from her tall, glamorous body. Even after a thick creampie, the pleasure-soaked, obscene sex continues. Kiyomiya Jinai [Uncensored L**ked]",https://pic.javct.net/poster/09052025/1757613856.jpg,https://javct.net/v/ebwh-248-rm,120,2026-05-14
URKK-070-RM,"I Missed The Last Train, But My Part-Time Seniors Stayed With Me... I Couldn't Resist My Boobs Popping Out Of My No Bra Loungewear, And I Fucked Until Dawn! Takarada Monami [Uncensored L**ked]",https://pic.javct.net/poster/20222410/1667618777.jpg,https://javct.net/v/urkk-070-rm,134,2026-05-14
NACR-732-RM,My Usually Strict Female Boss Asks Me To Skip Work! Tsundere Sex Friend! ! Hitomi Mochizuki [Uncensored L**ked],https://pic.javct.net/poster/20231711/1700420875.jpg,https://javct.net/v/nacr-732-rm,132,2026-05-14
ALDN-195-RM,Female President's Libido Narimiya Iroha [Uncensored L**ked],https://pic.javct.net/poster/20230804/1691206261.jpg,https://javct.net/v/aldn-195-rm,125,2026-05-14
FBOS-006-RM,"On A Stormy Night, I'm Alone With My Female Boss, Who Is Trapped In The Company Iroha Narumiya [Uncensored L**ked]",https://pic.javct.net/poster/20230804/1692416382.jpg,https://javct.net/v/fbos-006-rm,120,2026-05-14
DVAJ-737-RM,"I Used A 'sucker' To Peel Back And Suck On My Spinster Boss's Clitoris, Sucking And Refusing To Let Go. The Sticky Stimulation Kept Her Clitoris Exposed, And I Played With And Kneaded It Until Her Knees Were Shaking And She Was Squirting Like A Slut, Wanting To Cum. - Morisawa Kana [Uncensored L**ked]",https://pic.javct.net/poster/06032026/1775845146.jpg,https://javct.net/v/dvaj-737-rm,150,2026-05-14
MOND-254-RM,Longing Female Boss And Monami Takarada [Uncensored L**ked],https://pic.javct.net/poster/20230804/1692419915.jpg,https://javct.net/v/mond-254-rm,120,2026-05-14
HDRT-005-RM,The female boss's black pantyhose. [Uncensored L**ked],https://pic.javct.net/poster/04112026/bcbc17e913.jpg,https://javct.net/v/hdrt-005-rm,176,2026-05-14
HODV-21770-RM,"""Would You Like To Have A Drink?"" I Drank And Got Drunk At An Izakaya ... My Female Boss And I Became A Man-woman Relationship With The Momentum Of Alcohol .... [Uncensored L**ked]",https://pic.javct.net/poster/20230205/1685071717.jpg,https://javct.net/v/hodv-21770-rm,240,2026-05-14
HDRT-005,The female boss's black pantyhose.,https://pic.javct.net/poster/04112026/bcbc17e913.jpg,https://javct.net/v/hdrt-005,176,2026-05-14
JUL-603-RM,"""I Missed The Last Train..."" Spending The Night With My Married Female Coworker Who Likes To Seduce Younger Men With A Daring Smile Maki Hojo [Uncensored L**ked]",https://static.javct.net/poster/jul-603.jpg,https://javct.net/v/jul-603-rm,120,2026-05-14
