code,title,image_url,page_url,views,date_scraped
FC2PPV-4867884,"[None] [Public] Secretly from her husband, a beautiful horny married woman with big breasts and a big ass, and two black guys with big cocks, 2 consecutive large bukkake raw sex and squirting NTR hardcore 3P",https://pic.javct.net/poster/06032026/1774240008.jpg,https://javct.net/v/fc2ppv-4867884,108,2026-03-24
FC2PPV-4867711,[No face shown] I was planning to do a fashion survey to a new graduate with F cup big breasts... but it gradually escalated and ended up with two consecutive creampie sex,https://pic.javct.net/poster/06032026/1774239941.jpg,https://javct.net/v/fc2ppv-4867711,102,2026-03-24
FC2PPV-4865786,A super celebrity with a super rich husband. Cheating and creampie sex with a greedy and greedy married woman with huge breasts.,https://pic.javct.net/poster/06032026/1774239799.jpg,https://javct.net/v/fc2ppv-4865786,42,2026-03-24
FC2PPV-4867745,"[Amateur first shot] Sumire (18) 163 cm 47 kg D cup and super cute It seems like she can't really do it, but in the end she accepts kissing, creampie, and anal penetration as a middle-aged woman with metabolic syndrome",https://pic.javct.net/poster/06032026/1774153943.jpg,https://javct.net/v/fc2ppv-4867745,114,2026-03-24
FC2PPV-4867926,"[No] Two-hole simultaneous penetration with black people lifted [Public] In front of her boyfriend, a beautiful girlfriend with big breasts and a big ass is convulsed by two big dicks, made to squirt, and her anus is destroyed. Dangerous SM raw sex NTR hard 3P fuck",https://pic.javct.net/poster/06032026/1774239907.jpg,https://javct.net/v/fc2ppv-4867926,54,2026-03-24
FC2PPV-4867782,(No) Personal shooting married woman Mai 28 years old handheld camera Gonzo!! I called her home and impregnated her with creampie and started training!! A secret from my husband...,https://pic.javct.net/poster/06032026/1774239969.jpg,https://javct.net/v/fc2ppv-4867782,26,2026-03-24
567BEAF-207,"Her hobby is working part-time, saving money, and traveling all over the country by herself. She follows the men she meets and immediately fucks them and cums inside her. A one-night traveling JD with big breasts, Mina-chan, 19 years old.",https://pic.javct.net/poster/06032026/1774173052112.jpg,https://javct.net/v/567beaf-207,65,2026-03-24
300MIUM-1334,"""You can lick all the sweat and semen ///"" There's no way that anything will happen in a karaoke room with a man and a woman lol The black-haired gal's deep pleas are too erotic lol I'm doing it so that everyone won't find out and it's all wet lol [Everyone is sleeping so I can't fuck]",https://pic.javct.net/poster/06032026/1774172982511.jpg,https://javct.net/v/300mium-1334,87,2026-03-24
FC2PPV-4867944,"Hina-chan, who was selected as the runner-up of a beauty pageant at a certain A university, has sex broadcast all over the world.",https://pic.javct.net/poster/06032026/1774326533.jpg,https://javct.net/v/fc2ppv-4867944,79,2026-03-24
FC2PPV-4868037,"[Completely secret version] [Launch] [Volume warning] [First appearance in FC2] 24-year-old I cup office lady Mina, her moaning voice is so loud that she can't stop, her abomination that will melt your brain will be exposed [Chapter 2]",https://pic.javct.net/poster/06032026/1774246101.jpg,https://javct.net/v/fc2ppv-4868037,108,2026-03-24
FC2PPV-4867697,[Amateur/Beautiful Wife] Masturbation housewife's body that can be used anytime vol.23 Ms. Mari [New item buy now campaign/review special bonus gift],https://pic.javct.net/poster/06032026/1774239854.jpg,https://javct.net/v/fc2ppv-4867697,86,2026-03-24
SIRO-5647,"Beautiful Married Woman's Secret Sex A married woman who applied without telling her husband was too erotic. She couldn't hold back the desire that had been building up in the sexless situation, and she learned that the forbidden fruit with her ripe and messy body was the sweetest. [First shot] AV application online AV experience shooting 2529",https://pic.javct.net/poster/06032026/1774173207888.jpg,https://javct.net/v/siro-5647,63,2026-03-24
SABA-975-RM,"The 1st Amateur Blowjob Cinderella Championship ☆ The Slurping Sounds Of 30 Sucking Princesses Resound Throughout The Air Lol. Deep, Deep Throated Blowjobs That Love Dick // Serious No-hands Blowjobs That Combine The Sk**ls And Experience They've Cultivated Over The Course Of A Lifetime // Princesses Swallow The Semen They've Milked With Their Mouths In A Delicious Way ☆ [Uncensored L**ked]",https://pic.javct.net/poster/06032026/1774060717.jpg,https://javct.net/v/saba-975-rm,302,2026-03-24
XVSR-101-RM,Latest Original Movie 4 Hours Cinderella Girl Ayano Nana [Uncensored L**ked],https://pic.javct.net/poster/20241804/1715964073.jpg,https://javct.net/v/xvsr-101-rm,240,2026-03-24
TPNS-036-RM,"A Beautiful Girl Cosplayer With Glasses Who Was Standing In A Long Line At The Event Venue Got A Full Erection And Was Dripping With Pre-cum. This Shy Femboy Refused At First, But Then He Started Giving Her A Handjob And Cumming, Swallowing Everyone's Cum In His Ass And Cumming Repeatedly. [My First Ever 5-way Orgy Was So Erotic] [Uncensored L**ked]",https://pic.javct.net/poster/06032026/1774060655.jpg,https://javct.net/v/tpns-036-rm,159,2026-03-24
SMOM-004-RM,"New Abnormal Sexual Intercourse: Forty-Something Mother And Son, Part 4 - The Mature Mother's Lusty Honeypot That Rehabilitated Her Depressed Son, Honami Hazuki [Uncensored L**ked]",https://pic.javct.net/poster/06032026/1774063152.jpg,https://javct.net/v/smom-004-rm,120,2026-03-24
FLAV-416-RM,"This Week's Lewd Sexual Service Duty For A Voluptuous High School Girl. Yura, The Cutest And Plump Busty Girl In Her Grade, Feels A Stiff Erection Deep In Her Throat While Her Anus Twitches, Peeing As She Begs For Semen, Becoming Everyone's Urinal Idol. [Uncensored L**ked]",https://pic.javct.net/poster/06032026/1774063466.jpg,https://javct.net/v/flav-416-rm,145,2026-03-24
CLUB-280-RM,Shrimp Warp Rezuesute Voyeur To Be Captivated By Drink The Aphrodisiac 8 [Uncensored L**ked],https://pic.javct.net/poster/20233001/1675584563.jpg,https://javct.net/v/club-280-rm,220,2026-03-24
HMN-818-RM,Transfer! A Surprise For The Abstinent And Sweaty Pussy! A Massive Creampie And Awakening Special! Hinata Natsu [Uncensored L**ked],https://pic.javct.net/poster/06032026/1774152755.jpg,https://javct.net/v/hmn-818-rm,120,2026-03-24
STAR-910-RM,Mukichi Pocha Sukko-chan (18) Gnawed In A Depression From Asuka Rin Sister Shit Shit Shiba Chiti Pita Clothes Echts [Uncensored L**ked],https://pic.javct.net/poster/20240807/1723041199.jpg,https://javct.net/v/star-910-rm,135,2026-03-24
390JAC-190,[Daddy activity] Ayano-chan (age unknown) Professional student Do whatever you want for 1 hour with a model-class beautiful style student [Fair-skinned beautiful body],https://pic.javct.net/poster/06032026/1774326460670.jpg,https://javct.net/v/390jac-190,102,2026-03-24
390JAC-184,"[NTR Brain Destruction Ant] ""I'm not going to have sex with my boyfriend anymore..."" A tall, chubby beautiful woman is presented to her boyfriend, and while she is confused, she completely falls in love with his big cock, and the forbidden cuckolding sex... [Haruka, the 36th delusional girl]",https://pic.javct.net/poster/06032026/1774326054749.jpg,https://javct.net/v/390jac-184,99,2026-03-24
SMGN-038,Azu & Moa,https://pic.javct.net/poster/06032026/1774246223636.jpg,https://javct.net/v/smgn-038,55,2026-03-24
SMNN-039,Meisa-san,https://pic.javct.net/poster/06032026/1774246065569.jpg,https://javct.net/v/smnn-039,30,2026-03-24
SSIS-858-RM,"Even Though You're A Teacher, You're Bound To Get Fucked By Us Because You Have Huge Erotic Breasts, You Understand, Right? Nagi Hikaru [Uncensored L**ked]",https://pic.javct.net/poster/20230908/1694714182.jpg,https://javct.net/v/ssis-858-rm,120,2026-03-24
ADN-503-RM,My Father-in-law's Kiss As He Licks Me Miu Shiramine [Uncensored L**ked],https://pic.javct.net/poster/20231011/1699149399.jpg,https://javct.net/v/adn-503-rm,120,2026-03-24
SONE-248-RM,K-cup Secretary Gets Licked And Violated By Her Slug-like Boss Until She Cums Hikaru Nagi [Uncensored L**ked],https://pic.javct.net/poster/20243105/1720146570.jpg,https://javct.net/v/sone-248-rm,120,2026-03-24
JUQ-404-RM,Nude Model NTR Shocking Cheating Video Of A Wife Drowning In Shame With Her Boss Sayuri Hayama [Uncensored L**ked],https://pic.javct.net/poster/20231011/1698144969.jpg,https://javct.net/v/juq-404-rm,120,2026-03-24
FPRE-004-RM,Sleep R**e: Putting My Cocky Son's Big-breasted Wife To Sleep With Sleeping Pills And Raping Her. Mina Kitano [Uncensored L**ked],https://pic.javct.net/poster/20231912/1704020502.jpg,https://javct.net/v/fpre-004-rm,150,2026-03-24
JUQ-943-RM,Nude Model NTR: Shocking Video Of Wife Cheating With Her Boss And Drowning In Shame Meguri [Uncensored L**ked],https://pic.javct.net/poster/20241115/1732243413.jpg,https://javct.net/v/juq-943-rm,140,2026-03-24
SOAN-108-RM,"The Mother Of The Sakuma Family Who Fell Into Masochistic Anal. A Sexless Married Woman Who Is Not Recognized As A Woman By Her Husband Is Publicly Insulted And Inseminated In Two Holes By Another Man's Cock! The Whole Story Of How She Betrayed Her Husband And Fell Into Masochistic Awakening...Kaede, 42 Years Old [Uncensored L**ked]",https://pic.javct.net/poster/20242108/1727490518.jpg,https://javct.net/v/soan-108-rm,143,2026-03-24
JUQ-540-RM,"Wanted To Make My Wife Admit My Love, So I Left Her And My Unfaithful Junior Alone For 3 Hours...My NTR Story About How My Wife Was Stolen From Me With A Total Of 17 Vaginal Cum Shots Without Pulling Out Sayuri Hayama [Uncensored L**ked]",https://pic.javct.net/poster/20231912/1704643413.jpg,https://javct.net/v/juq-540-rm,120,2026-03-24
FSDSS-672-RM,"I keep being r**ed... A beautiful wife from a rural area is trained by a young man from the city near her husband, and she falls into a sexual assault with Nene Yoshitaka. [Uncensored L**ked]",https://pic.javct.net/poster/20231011/1697259924.jpg,https://javct.net/v/fsdss-672-rm,120,2026-03-24
YUJ-008-RM,"You Have A Husband And I Have A Wife, But You And Your Colleagues At Work Asked Each Other Until The Sun Rose. Miu Shiramine [Uncensored L**ked]",https://pic.javct.net/poster/20230908/1695605474.jpg,https://javct.net/v/yuj-008-rm,120,2026-03-24
STARS-923-RM,"5 Situations Where You Can Enjoy Rei Kamiki's ""beautiful Butt"" With A Transcendental Style.Actually, I...not Only My Boobs But Also My Buttocks Are Amazing Rei Kamiki [Uncensored L**ked]",https://pic.javct.net/poster/20231011/1697068491.jpg,https://javct.net/v/stars-923-rm,156,2026-03-24
JUQ-510-RM,The World's Most Luxurious Commemorative Work! ! Madonna 20th Anniversary - First Ever ALL Exclusive Bus Tour With Unlimited Creampie And Steam! ! First Part 4 Hours OVER 2-disc Set! ! [Uncensored L**ked],https://pic.javct.net/poster/20231912/1703554075.jpg,https://javct.net/v/juq-510-rm,290,2026-03-24
FTAV-003-RM,"""I Love Him, But... I'm Getting Wet Just Thinking About What He's Going To Do..."" I-cup Nurse, 22 Years Old, Not Affiliated With Kimitsu City, Chiba Production, A Woman With Natural Big Breasts Who Lives In The Countryside, Still An Amateur, SOFT ON DEMAND Yu Sasamoto's (tentative) Appearance For The Fourth Time In The New House Where Her Married Life Begins And Her Fiancé Works... [Uncensored L**ked]",https://pic.javct.net/poster/20242108/1727115023.jpg,https://javct.net/v/ftav-003-rm,159,2026-03-24
URE-100-RM,"Congratulations! Commemorative Work For 100 Mature Comics Original Work: Purpoison Mother-eating ~Yarichin Travel Edition~ Cumulative Total Of Over 100,000 Downloads Of The Series! ! A Live-action Sequel To The Legendary Popular Doujin Work Starring Madonna! ! Exclusive, Ririko Kinoshita's 6 Gorgeous Performances With Large Volumes! ! [Uncensored L**ked]",https://pic.javct.net/poster/20231711/1702777063.jpg,https://javct.net/v/ure-100-rm,240,2026-03-24
MVSD-471-RM,Remote Control NTS Indecent Pant Of My Beloved Wife Drowning In Another Stick Michiru Kujo [Uncensored L**ked],https://pic.javct.net/poster/20231912/1704622292.jpg,https://javct.net/v/mvsd-471-rm,120,2026-03-24
ADN-564-RM,"I Kept Giving My Son's Wife An Aphrodisiac So That She Wouldn't Find Out, And I Made Her Body, Which Had Become An Erogenous Zone, Go Crazy With Excitement And Climax. Shiramine Miu [Uncensored L**ked]",https://pic.javct.net/poster/20241804/1714707796.jpg,https://javct.net/v/adn-564-rm,160,2026-03-24
MEYD-890-RM,I Spent A Week Having Sex With A Big-breasted Aunt With A Sloppy Personality In A Ch**ing Trash Room. Sayama Love [Uncensored L**ked],https://pic.javct.net/poster/20241703/1710726271.jpg,https://javct.net/v/meyd-890-rm,150,2026-03-24
JUQ-563-RM,Days Of Creampie Ring That Will Never End. Sayuri Hayama [Uncensored L**ked],https://pic.javct.net/poster/20241901/1708307694.jpg,https://javct.net/v/juq-563-rm,120,2026-03-24
FSDSS-673-RM,"My husband isn't here today, so why don't we have another drink at home? I, Yuko Ono, got excited when I saw my ex-girlfriend again at the class reunion, wearing no panties or bra. [Uncensored L**ked]",https://pic.javct.net/poster/20231011/1698379389.jpg,https://javct.net/v/fsdss-673-rm,120,2026-03-24
JUQ-439-RM,"During My Wife's Pregnancy, I Was Forbidden To Even Masturbate, So I Had Sex With My Mother-in-law, Sayuri, Who Had Moved To Tokyo Many Times... Sayuri Hayama [Uncensored L**ked]",https://pic.javct.net/poster/20231011/1699830529.jpg,https://javct.net/v/juq-439-rm,120,2026-03-24
ROE-163-RM,My Aunt's Wet And See-through Body. A Night Alone Under The Same Roof... Sentimental Rain Pattern Yuka Mizuno [Uncensored L**ked],https://pic.javct.net/poster/20230908/1695970848.jpg,https://javct.net/v/roe-163-rm,140,2026-03-24
WAAA-303-RM,I Asked My Plump Wife At My Part-time Job To Be My Tutor... Ai Sayama [Uncensored L**ked],https://pic.javct.net/poster/20230908/1696605519.jpg,https://javct.net/v/waaa-303-rm,120,2026-03-24
ACHJ-030-RM,Madonna Dengeki Exclusive Authentic Slut Sumire Mizukawa Endless Ejaculation Orgasm That Makes Masochist Man's Body And Mind Melt With Deep And Rich Kisses And Stopping Creampie [Uncensored L**ked],https://pic.javct.net/poster/20231711/1700382348.jpg,https://javct.net/v/achj-030-rm,110,2026-03-24
PRED-526-RM,"When I Took Care Of Miu-sensei Who Had Collapsed And Sent Her Home... I Was A Monster Of Sexual Desire, And I Couldn't Stop Getting An Erection Due To Her Plump, Beautiful Legs And Strong Legs, And Ended Up Ejaculating Over And Over Again Until Morning. Shiramine Miu [Uncensored L**ked]",https://pic.javct.net/poster/20231011/1697500675.jpg,https://javct.net/v/pred-526-rm,120,2026-03-24
