code,title,image_url,page_url,views,date_scraped
IBW-929Z-RM,"""I Came To See My Uncle..."" My Uncle Who Lives In The Countryside Loves My Niece Sexual Intercourse Recorded Video 4 Hours [Uncensored L**ked]",https://pic.javct.net/poster/20230908/1695387244.jpg,https://javct.net/v/ibw-929z-rm,240,2026-05-31
KSBJ-093,Slender Wife Ayaka Muto Who Was Cuckold And Fit In The Trap Of Her Husband And Brother-in-law,https://pic.javct.net/poster/05192026/fc262af440.jpg,https://javct.net/v/ksbj-093,120,2026-05-31
BKD-140,Maternal Copulation [Kurohone Path] Shinomiya Chiaki,https://pic.javct.net/poster/05192026/08fb9ac4cd.jpg,https://javct.net/v/bkd-140,110,2026-05-31
SCPX-482-RM,"Incest Father-in-law And Daughter ""Dad Is No Good..."" 6 People 250 Minutes [Uncensored L**ked]",https://pic.javct.net/poster/20230908/1695458782.jpg,https://javct.net/v/scpx-482-rm,250,2026-05-31
GODR-1261-RM,"Incest: The Older Sister, Who Is Generally Unguarded And Has A Low Threshold For Sex, Has A High Chance Of Encountering Her Younger Brother's Penis, And Tends To Secretly Have Sexual Intercourse With Him Without Their Parents Knowing... [Uncensored L**ked]",https://pic.javct.net/poster/05192026/0dc27fc0a0.jpg,https://javct.net/v/godr-1261-rm,220,2026-05-31
HHED-27-RM,Aunt Miki Sato Relatives [Uncensored L**ked],https://pic.javct.net/poster/05192026/5412349047.jpg,https://javct.net/v/hhed-27-rm,80,2026-05-31
HHED-048-RM,Relatives Of Aunt Rieko Hiraoka [Uncensored L**ked],https://pic.javct.net/poster/05192026/2c3d670e0f.jpg,https://javct.net/v/hhed-048-rm,105,2026-05-31
ALDN-185-RM,I Can't Endure My Patience I'm A Daughter-In-Law But My Uncle Is Sakikazu Sasaki [Uncensored L**ked],https://pic.javct.net/poster/20230207/1688785946.jpg,https://javct.net/v/aldn-185-rm,130,2026-05-31
KTRA-542-RM,An Innocent Niece Is A Natural Little Devil! Satsuki Ena [Uncensored L**ked],https://pic.javct.net/poster/20230207/1688790094.jpg,https://javct.net/v/ktra-542-rm,130,2026-05-31
HHH-412,"The Moment Of Incest... Oh, I Wish I Hadn't Seen It... My Grown-up Son's Dick Is Bigger And More Attractive Than My Husband's...",https://pic.javct.net/poster/05192026/de7b61d2cb.jpg,https://javct.net/v/hhh-412,239,2026-05-31
GODR-1261,"Incest: The Older Sister, Who Is Generally Unguarded And Has A Low Threshold For Sex, Has A High Chance Of Encountering Her Younger Brother's Penis, And Tends To Secretly Have Sexual Intercourse With Him Without Their Parents Knowing...",https://pic.javct.net/poster/05192026/0dc27fc0a0.jpg,https://javct.net/v/godr-1261,220,2026-05-31
SPRD-817-RM,Is Rubbed His Son Again And Again Mother Kondo Ikumi [Uncensored L**ked],https://pic.javct.net/poster/20230207/1689120615.jpg,https://javct.net/v/sprd-817-rm,130,2026-05-31
T28-500,"Day Absent Parents, I Earnestly Spear In One Day To My Sister And Sperm Wither. Yuri Asada",https://pic.javct.net/poster/05192026/65ff93153a.jpg,https://javct.net/v/t28-500,140,2026-05-31
SKMJ-750-RM,"Forbidden Real Incest: When A Beautiful Brother And Sister Take On A Sex Mission...the Incredibly Horny Brother Gets Seriously Aroused! Ignoring His Sister's Bewildered Plea Of ""I Can't Tell Mom!"", He Thrusts His Hips Like Crazy! He Mercilessly Attacks His Sister, Who Is Exhausted From Convulsing From Too Many Orgasms, And Ejaculates Inside Her Again And Again And Again! 7 [Uncensored L**ked]",https://pic.javct.net/poster/05192026/9a6d10c9c9.jpg,https://javct.net/v/skmj-750-rm,267,2026-05-31
T28-400-RM,SEX Kawamura Pies Cute Sister And The Sister Of Beauty Every Day Maya × Kan'nami Multi Ichihana [Uncensored L**ked],https://pic.javct.net/poster/20240410/1729813799.jpg,https://javct.net/v/t28-400-rm,160,2026-05-31
OLM-321E,"This Sexy Woman With Fair Skin, G-cup Breasts, And Thick, Bushy Pubic Hair Wants To Cum Like Crazy From The Amazing Techniques Of A Professional Older Male Actor! - Mayu Suzuki",https://pic.javct.net/poster/05192026/ff338067ef.jpg,https://javct.net/v/olm-321e,120,2026-05-31
AARM-025-RM,All New Dirty-Talking Dildo Masturbation. Her Pussy Is Dripping Wet! 3 [Uncensored L**ked],https://pic.javct.net/poster/20212709/1634213056.jpg,https://javct.net/v/aarm-025-rm,125,2026-05-31
MIDA-659-RM,"Pretending To Listen To Her Best Friend's Girlfriend's Troubles, She Drugs Her With Aphrodisiacs, Remotely Vibrates And Trains Her, Then Plunges Her Into A Swamp With Her Huge Cock, Developing Her Peeing, Weak Pussy Into An NTR Kawaguchi Sakura [Uncensored L**ked]",https://pic.javct.net/poster/05192026/add45207a5.jpg,https://javct.net/v/mida-659-rm,140,2026-05-31
NIMA-079-RM,"A Work From The Hugely Popular Circle ""Tama Gou""! Live-action Version! Bullying Deserves Punishment From Mom!! Kinoshita Himari [Uncensored L**ked]",https://pic.javct.net/poster/05192026/418625a9e1.jpg,https://javct.net/v/nima-079-rm,120,2026-05-31
SABA-679-RM,A Permanent Preservation Version Of 10 Cute Amateurs At The Highest Level In History! Zuppoli Unequaled Piston Dildo Masturbation To The Back 7 [Uncensored L**ked],https://pic.javct.net/poster/20242108/1726916326.jpg,https://javct.net/v/saba-679-rm,202,2026-05-31
NACR-753-RM,Breast Meat And Butt Meat Festival! An Unscripted Showdown With Anna Hanayagi! ! [Uncensored L**ked],https://pic.javct.net/poster/20241901/1705680832.jpg,https://javct.net/v/nacr-753-rm,121,2026-05-31
MIDA-659,"Pretending To Listen To Her Best Friend's Girlfriend's Troubles, She Drugs Her With Aphrodisiacs, Remotely Vibrates And Trains Her, Then Plunges Her Into A Swamp With Her Huge Cock, Developing Her Peeing, Weak Pussy Into An NTR Kawaguchi Sakura",https://pic.javct.net/poster/05192026/add45207a5.jpg,https://javct.net/v/mida-659,140,2026-05-31
NIMA-079,"A Work From The Hugely Popular Circle ""Tama Gou""! Live-action Version! Bullying Deserves Punishment From Mom!! Kinoshita Himari",https://pic.javct.net/poster/05192026/418625a9e1.jpg,https://javct.net/v/nima-079,120,2026-05-31
NHDTB-969-RM,Big-breasted Girl's Humiliation Train: Defile Her Developed Breasts With Your Perverted Sexual Desires! [Uncensored L**ked],https://pic.javct.net/poster/20242108/1727362255.jpg,https://javct.net/v/nhdtb-969-rm,180,2026-05-31
10-052826-01,Met this cute girl through the friend who loves Sex vol.2,https://pic.javct.net/poster/05192026/c2408d363d.jpg,https://javct.net/v/10-052826-01,60,2026-05-31
SIRO-5678,"[A girl who loves eroticism and is loved by eroticism] When I to**ured her erotic body with a toy, it became a big problem (lol) [First shot] AV application online AV experience shooting 2563",https://pic.javct.net/poster/05192026/ee14fb9187.jpg,https://javct.net/v/siro-5678,62,2026-05-31
FC2PPV-4908119,That girl who aims to be a weather forecaster I wanted to mess it up.She came to meet me in adult underwear after gaining a little experience.She has a miraculous style with natural K breasts.I'm worried that my breasts are big and clothes don't suit me.,https://pic.javct.net/poster/05192026/7ab0d5062e.jpg,https://javct.net/v/fc2ppv-4908119,76,2026-05-31
MIBB-023-RM,W Beauty Restraint Die [Uncensored L**ked],https://pic.javct.net/poster/20230207/1689392502.jpg,https://javct.net/v/mibb-023-rm,135,2026-05-31
JAN-022-RM,E Nozomin In The Uniform 22 [Uncensored L**ked],https://pic.javct.net/poster/05192026/b02b9f7a10.jpg,https://javct.net/v/jan-022-rm,135,2026-05-31
FSBK-023-RM,"I Inserted My Dick Into The Anus Of A Girl I Met Through Machiap, And She Became My Perverted Sex Friend Who Craved Pleasure From Both Holes At The Same Time. Anal Beauty Yaya Kohaku Yaya [Uncensored L**ked]",https://pic.javct.net/poster/05192026/677f463531.jpg,https://javct.net/v/fsbk-023-rm,140,2026-05-31
ONED-383-RM,Nao Hazuki Tit Barely A Discount [Uncensored L**ked],https://pic.javct.net/poster/05192026/81670c3a79.jpg,https://javct.net/v/oned-383-rm,120,2026-05-31
VGD-153-RM,To Obscene Madonna Shinoda History Journey [Uncensored L**ked],https://pic.javct.net/poster/06032026/1774234335.jpg,https://javct.net/v/vgd-153-rm,140,2026-05-31
HMGL-141-RM,Embarrassing Body Nice Miniskirt Dating Tadakawa Misaki [Uncensored L**ked],https://pic.javct.net/poster/06032026/1775211257.jpg,https://javct.net/v/hmgl-141-rm,130,2026-05-31
BOKO-039,"Just Before The Wedding, NTR Lesbian Esthetician ""Just For Today..."" That Night I Confided My Troubles To You, And We Made Love In A World Just For The Two Of Us, Where We Couldn't Think About Anything Else. Yuri Maina, Minoshima Meguri",https://pic.javct.net/poster/05192026/de9b4a2e95.jpg,https://javct.net/v/boko-039,171,2026-05-31
VANDR-045-RM,Big Wife Of Common Sense Knowing That Wants To Go Out With No Bra Also Vulnerable [Uncensored L**ked],https://pic.javct.net/poster/05192026/c2c71a6fd1.jpg,https://javct.net/v/vandr-045-rm,150,2026-05-31
VIO-076,Face-licking Fetishism: The Excessive Licking Communication Of The Belovian.,https://pic.javct.net/poster/05192026/bcd23d1526.jpg,https://javct.net/v/vio-076,118,2026-05-31
LZDM-063-RM,"[ASMR Lesbian Subjective] On That Day, I Gave In To My Students' Lesbian Temptations And Gave In To Them Once, And Ever Since Then, I've Been Made To Cum Over And Over Again Whenever We Meet... ~An Incident At A Famous Preparatory School For Girls~ [Uncensored L**ked]",https://pic.javct.net/poster/20241804/1716606375.jpg,https://javct.net/v/lzdm-063-rm,145,2026-05-31
WANZ-212-RM,Hanako Full Supervision Otsu Leaf Nanase Minato Riku And Lesbian Anna Rim Job [Uncensored L**ked],https://pic.javct.net/poster/05192026/fb53849292.jpg,https://javct.net/v/wanz-212-rm,120,2026-05-31
WANZ-212,Hanako Full Supervision Otsu Leaf Nanase Minato Riku And Lesbian Anna Rim Job,https://pic.javct.net/poster/05192026/75b70f383f.jpg,https://javct.net/v/wanz-212,120,2026-05-31
REAL-289-RM,Riko Tachibana & Noa Double Dream Super Special Work The Third Anniversary [Uncensored L**ked],https://pic.javct.net/poster/05192026/e85c317649.jpg,https://javct.net/v/real-289-rm,150,2026-05-31
FC2PPV-4880098,I handed the camera to the model and had her do some serious lesbian play.,https://pic.javct.net/poster/05192026/d00980b6a1.jpg,https://javct.net/v/fc2ppv-4880098,60,2026-05-31
HUNTB-589-RM,"""Come Over Here And Let's Have Sex Together"" My C**ldhood Friend Is In The Middle Of A Lesbian With A Tutor! I Thought I Would Be Scolded If I Peeped Involuntarily, But With The Help Of My Tutor God, I Ended Up In A 3P. [Uncensored L**ked]",https://pic.javct.net/poster/20230207/1688705510.jpg,https://javct.net/v/huntb-589-rm,130,2026-05-31
MISM-116-RM,SM Lifting! ! Hard Bizar Bondage All Your Lesbians!I Will Give You The Best Pleasure! Kazumi Kudo Kasumi Horai [Uncensored L**ked],https://pic.javct.net/poster/05192026/631511812f.jpg,https://javct.net/v/mism-116-rm,180,2026-05-31
HUNTB-605-RM,"On A Company Trip, Beautiful Female Employees And Men Have A Big Orgy In My Dream King Game! I Was Able To Get Away From My Daily Life And Experience An Extremely Erotic Experience At A Hot Spring Inn! Arasa Female Employee... [Uncensored L**ked]",https://pic.javct.net/poster/20230207/1689911346.jpg,https://javct.net/v/huntb-605-rm,140,2026-05-31
MIAD-076-RM,"Izumi Hasegawa, Azusa Ayano Slutty Girl And Orgy Blacks And [Uncensored L**ked]",https://pic.javct.net/poster/05192026/e5737f50b5.jpg,https://javct.net/v/miad-076-rm,120,2026-05-31
BBSS-068-RM,Lesbian ♂ Intercourse Strap-on Lesbian SEX Omnibus Part.4 [Uncensored L**ked],https://pic.javct.net/poster/20233001/1675999261.jpg,https://javct.net/v/bbss-068-rm,240,2026-05-31
MIRD-107,Megumi Shino Satomi Yuria SPECIAL Hermaphrodite World,https://pic.javct.net/poster/05192026/3be8d90277.jpg,https://javct.net/v/mird-107,120,2026-05-31
JUY-545-SUB,Farewell Lesbian 2 - Let The Mind And The Body Separate From Men ... - Hatano Yui Hoshikawa Miki [English Subtitle],https://pic.javct.net/poster/04112026/1776158589.jpg,https://javct.net/v/juy-545-sub,120,2026-05-31
IESP-683-RM,Rara Kudo In Open Season For Lesbians: I Fell In Love With The Cameraman's Cousin [Uncensored L**ked],https://static.javct.net/poster/iesp-683.jpg,https://javct.net/v/iesp-683-rm,122,2026-05-31
PPF-001,Impact/Marina Asakura,https://pic.javct.net/poster/05192026/9b736e77a4.jpg,https://javct.net/v/ppf-001,125,2026-05-31
PRIAN-048,O-shi-no-bi/Shino Mayu,https://pic.javct.net/poster/05192026/e432d2880b.jpg,https://javct.net/v/prian-048,90,2026-05-31
PRIAN-050,White Temperature/Hayama Sayuri,https://pic.javct.net/poster/05192026/5e61d6c105.jpg,https://javct.net/v/prian-050,99,2026-05-31
PRIAN-045,Forbidden Fruit -Quietly Unravelling-/Azuma Mika,https://pic.javct.net/poster/05192026/79a894f810.jpg,https://javct.net/v/prian-045,74,2026-05-31
MOSJ-023,An Investigator Corrupted By Pleasure - A Body That Gives In To Lust And Becomes Unruly/Sonoda Mayu,https://pic.javct.net/poster/05192026/1bfc0c6be4.jpg,https://javct.net/v/mosj-023,0,2026-05-31
MBDD-2179,Crimson Arcana / Reina Miyashita,https://pic.javct.net/poster/05192026/4771077b6e.jpg,https://javct.net/v/mbdd-2179,97,2026-05-31
MBDD-2178,Amrita ~A World With Nene~/Misumi Nene,https://pic.javct.net/poster/05192026/550e3f4747.jpg,https://javct.net/v/mbdd-2178,0,2026-05-31
MBDD-2181,Vanilla Sister/Sakura Kawaguchi,https://pic.javct.net/poster/05192026/3381a6ccc8.jpg,https://javct.net/v/mbdd-2181,89,2026-05-31
MBDD-2180,"""Welcome Back."" / Reina Momozono",https://pic.javct.net/poster/05192026/5c64babc84.jpg,https://javct.net/v/mbdd-2180,108,2026-05-31
MBDD-2177,Unpai's Teachings/Unpai,https://pic.javct.net/poster/05192026/6b14835733.jpg,https://javct.net/v/mbdd-2177,0,2026-05-31
AVOP-455,"Momoko, 48 Years Old To AV.Authorized Mono Manufacturer Momoko Kikuichi Debuts AV",https://pic.javct.net/poster/05192026/5b4061bbb0.jpg,https://javct.net/v/avop-455,170,2026-05-31
PRIAN-052,Secret Base / Aki Sasaki,https://pic.javct.net/poster/05192026/c5290e58f4.jpg,https://javct.net/v/prian-052,90,2026-05-31
PRIAN-051,Fluffy Hot Spring Day / Misao Oguri,https://pic.javct.net/poster/05192026/b9e9a49da3.jpg,https://javct.net/v/prian-051,100,2026-05-31
MBRAA-349,Verification! That's Cool! Shiori-chan/Mochizuki Shiori,https://pic.javct.net/poster/05192026/21254dbd3c.jpg,https://javct.net/v/mbraa-349,70,2026-05-31
MBRAQ-075,"Extremely Sexy Goddess. Cute, Pure, Erotic And The Strongest!!!",https://pic.javct.net/poster/05192026/70881e9f47.jpg,https://javct.net/v/mbraq-075,120,2026-05-31
MMRAA-383,18 Kyun! / Okubo Ren,https://pic.javct.net/poster/05192026/5caf648838.jpg,https://javct.net/v/mmraa-383,70,2026-05-31
MMRAA-385,Cosplay! Fall In Love! / Akekawa Kanon,https://pic.javct.net/poster/05192026/aab662aa44.jpg,https://javct.net/v/mmraa-385,70,2026-05-31
JUFE-343-RM,Weak-Willed Busty Nurse Mina Kitano Is In Charge of My Penis [Uncensored L**ked],https://pic.javct.net/poster/20212709/1635488737.jpg,https://javct.net/v/jufe-343-rm,154,2026-05-31
TIKB-116-RM,"My Super Cute Friend With Benefits Hana-tan, Starring Hana Shirato [Uncensored L**ked]",https://static.javct.net/poster/tikb-116.jpg,https://javct.net/v/tikb-116-rm,131,2026-05-31
TIKP-063-RM,"(The Fuck Log) When Ena Satsuki Gets Down To Party, She Unleashes Her Slut Aura Full Throttle, And That's How We Filmed This POV Video! [Uncensored L**ked]",https://pic.javct.net/poster/20212709/1636876662.jpg,https://javct.net/v/tikp-063-rm,118,2026-05-31
SOAV-083-RM,A Married Woman's Cheating Heart. Mei Hosho [Uncensored L**ked],https://pic.javct.net/poster/20212011/1638654795.jpg,https://javct.net/v/soav-083-rm,143,2026-05-31
VENX-008-RM,"""Uh, You're Touching Me With Your Tits..."" Bathing With My Hot Busty Stepmom Maria Nagai [Uncensored L**ked]",https://pic.javct.net/poster/20212011/1638319575.jpg,https://javct.net/v/venx-008-rm,106,2026-05-31
JUY-297-RM,Married Woman Babes Are Hooked On The Pleasure They Get From This Lusty Massage Parlor Ryoko Furusawa [Uncensored L**ked],https://pic.javct.net/poster/20220707/1659839138.jpg,https://javct.net/v/juy-297-rm,147,2026-05-31
EKW-076-RM,Control By Deep Kiss Yuri Honma [Uncensored L**ked],https://pic.javct.net/poster/20212011/1640453387.jpg,https://javct.net/v/ekw-076-rm,99,2026-05-31
VENU-890-RM,A Retired And Bored And Horny Father-In-Law Fucks With His Daughter-In-Law Tsubasa Haneda [Uncensored L**ked],https://pic.javct.net/poster/20221108/1663034250.jpg,https://javct.net/v/venu-890-rm,84,2026-05-31
AVSA-164-RM,"SUPER FISHEYE FETISHISM Impressive, Intimate, Exciting New Feeling Trance Erotic AV Emotional Butt - Big Booty Girl Kana Morisawa [Uncensored L**ked]",https://static.javct.net/poster/avsa-164.jpg,https://javct.net/v/avsa-164-rm,141,2026-05-31
MIST-363-RM,Booty Hell Level 2 Shiori Tsukada [Uncensored L**ked],https://pic.javct.net/poster/20212011/1644494442.jpg,https://javct.net/v/mist-363-rm,167,2026-05-31
NEOB-011-RM,revival! Membership Luxury Three-hole Specialty Customs [Uncensored L**ked],https://pic.javct.net/poster/20230804/1693717672.jpg,https://javct.net/v/neob-011-rm,121,2026-05-31
MIST-351-RM,Ass Hell Level 2 Natsuko Kayama [Uncensored L**ked],https://pic.javct.net/poster/20212709/1633598042.jpg,https://javct.net/v/mist-351-rm,160,2026-05-31
WKD-053-RM,Big Ass And Slut And Fucking. Yuri Honma [Uncensored L**ked],https://pic.javct.net/poster/20221904/1650613658.jpg,https://javct.net/v/wkd-053-rm,56,2026-05-31
WKD-052-RM,Big Ass x Slut x Copulation. Toka Rinne [Uncensored L**ked],https://pic.javct.net/poster/20221202/1648196404.jpg,https://javct.net/v/wkd-052-rm,58,2026-05-31
HJMO-472-RM,"A Married Woman From A Housecleaning Service Takes On The Agonizing Orgasms Vibrator-Installed Challenge, While Wearing Tight Denim Ass-Bulging Jeans Her Pussy Was A Lonely Island After Years Of Neglect, And Now She Had A Powerful Vibrator Left Inside Her Cunt While Cleaning The House! If She Can't Finish Her Cleaning Before Time's Up, She'll Have To Play The Raw Creampie Sex Game [Uncensored L**ked]",https://pic.javct.net/poster/20212308/1631860813.jpg,https://javct.net/v/hjmo-472-rm,200,2026-05-31
JUL-687-RM,"On The 7th Day Of Being Fucked By My Husband's Boss, I Lost My Mind... Hitomi Honda [Uncensored L**ked]",https://static.javct.net/poster/jul-687.jpg,https://javct.net/v/jul-687-rm,139,2026-05-31
XVSR-597-RM,Masked Couple - A Woman Deceiving And Being Deceived - Yui Hatano [Uncensored L**ked],https://static.javct.net/poster/xvsr-597.jpg,https://javct.net/v/xvsr-597-rm,75,2026-05-31
NKKD-228-SUB,"Fondling Sweaty And Sopping Wet See-Thru Colossal Tits NTR A Colossal Tits Housewife Gets Fucked To Dripping Wet, Transparently Sweaty Ecstasy By The Plumber Hana Haruna [English Subtitle]",https://pic.javct.net/poster/20212709/1633777463.jpg,https://javct.net/v/nkkd-228-sub,124,2026-05-31
DASD-925-RM,Anal Guidance - Ayaka Mochidzuki [Uncensored L**ked],https://pic.javct.net/poster/20212709/1633685393.jpg,https://javct.net/v/dasd-925-rm,119,2026-05-31
LULU-131-RM,"To Get Support To Go Meet Her Long Distance Relationship Boyfriend, Beautiful Young Girl With A Juicy Ass Fucks An Older Guy With A Huge Cock And Cums Hard. Natsu Sano. [Uncensored L**ked]",https://pic.javct.net/poster/20221202/1648888994.jpg,https://javct.net/v/lulu-131-rm,160,2026-05-31
259LUXU-1886,"""Adult sex is not enough anymore..."" [Glossy pantyhose beautiful legs and immoral uniform copulation] The exquisite ass and rippling beautiful breasts spilling out of the torn pantyhose, the climax squirting as she distorts her adorable face and moans loudly Luxury TV 1872",https://pic.javct.net/poster/05192026/590ba46096.jpg,https://javct.net/v/259luxu-1886,71,2026-05-31
AKDL-083,"[For those who want their faces stepped on by girls] Completely subjective, intense smell! Foot sole odor to**ure",https://pic.javct.net/poster/05192026/455fb12a64.jpg,https://javct.net/v/akdl-083,94,2026-05-31
259LUXU-1886-RM,"""Adult sex is not enough anymore..."" [Glossy pantyhose beautiful legs and immoral uniform copulation] The exquisite ass and rippling beautiful breasts spilling out of the torn pantyhose, the climax squirting as she distorts her adorable face and moans loudly Luxury TV 1872 [Uncensored L**ked]",https://pic.javct.net/poster/05192026/590ba46096.jpg,https://javct.net/v/259luxu-1886-rm,71,2026-05-31
300MIUM-1356-RM,"A Japanese boy is completely defeated by the tall gal's face, who likes his cock because of her cool appearance. [Uncensored L**ked]",https://pic.javct.net/poster/04112026/6b3d219737.jpg,https://javct.net/v/300mium-1356-rm,82,2026-05-31
300MIUM-1356,"A Japanese boy is completely defeated by the tall gal's face, who likes his cock because of her cool appearance.",https://pic.javct.net/poster/04112026/6b3d219737.jpg,https://javct.net/v/300mium-1356,82,2026-05-31
FW-009-RM,She begins her newlywed life with her Yankee father-in-law who is addicted to gambling. The process of a father-in-law turning his serious stepdaughter into a sex slave Mai Arisu [Uncensored L**ked],https://pic.javct.net/poster/04112026/f653e4e093.jpg,https://javct.net/v/fw-009-rm,153,2026-05-31
FW-009,She begins her newlywed life with her Yankee father-in-law who is addicted to gambling. The process of a father-in-law turning his serious stepdaughter into a sex slave Mai Arisu,https://pic.javct.net/poster/04112026/f653e4e093.jpg,https://javct.net/v/fw-009,153,2026-05-31
VIPR-069-RM,FetishXXXXX! Erika Sato [Uncensored L**ked],https://pic.javct.net/poster/04112026/adbb74f409.jpg,https://javct.net/v/vipr-069-rm,59,2026-05-31
ZEX-407-RM,The Ultimate Slender Beauty. Best Of Rena Aoi. [Uncensored L**ked],https://pic.javct.net/poster/20212308/1631675298.jpg,https://javct.net/v/zex-407-rm,146,2026-05-31
CHN-198-RM,Renting New Beautiful Women 103 Rika Sasaki (Porn Star) 20 Years Old [Uncensored L**ked],https://pic.javct.net/poster/20212308/1632065729.jpg,https://javct.net/v/chn-198-rm,135,2026-05-31
300MIUM-1357-RM,"[Newcomer] Takahashi, if you're aiming to be a career woman, it's better not to have a relationship with a man in the company. If you keep cumming like this and get caught, people will only look at you with erotic eyes. [Uncensored L**ked]",https://pic.javct.net/poster/04112026/1776995940992.jpg,https://javct.net/v/300mium-1357-rm,82,2026-05-31
300MIUM-1357,"[Newcomer] Takahashi, if you're aiming to be a career woman, it's better not to have a relationship with a man in the company. If you keep cumming like this and get caught, people will only look at you with erotic eyes.",https://pic.javct.net/poster/04112026/1776995940992.jpg,https://javct.net/v/300mium-1357,82,2026-05-31
SVVRT-076-RM,"Amateur variety show: A bikini gal who approached me at Shonan Beach gives me a cooling lotion massage experience to cool down my flushed body! Even though the body temperature is supposed to drop, the [secretly mixed aphrodisiac] awakens the sexual desire! Her sensitive nipples and clitoris are played with, and she squirts her crotch incontinence! I succumb to the pleasure and get huge...6 [Uncensored L**ked]",https://pic.javct.net/poster/06032026/1775160938834.jpg,https://javct.net/v/svvrt-076-rm,210,2026-05-31
SVVRT-076,"Amateur variety show: A bikini gal who approached me at Shonan Beach gives me a cooling lotion massage experience to cool down my flushed body! Even though the body temperature is supposed to drop, the [secretly mixed aphrodisiac] awakens the sexual desire! Her sensitive nipples and clitoris are played with, and she squirts her crotch incontinence! I succumb to the pleasure and get huge...6",https://pic.javct.net/poster/06032026/1775160938834.jpg,https://javct.net/v/svvrt-076,210,2026-05-31
SVVRT-074-RM,"Amateur Variety Amateur JD going around the town uses a thick vibrator fishing rod to catch orgasms and immediately gives a blowjob to the hooked fish! Catch a prize fish worth a total of 500,000 yen while being shocked by the punishment game! Enduring the vibrations of the vibrator and the pleasure of the orgasm, the fish turns on! [Uncensored L**ked]",https://pic.javct.net/poster/06032026/1774666597465.jpg,https://javct.net/v/svvrt-074-rm,225,2026-05-31
SVVRT-074,"Amateur Variety Amateur JD going around the town uses a thick vibrator fishing rod to catch orgasms and immediately gives a blowjob to the hooked fish! Catch a prize fish worth a total of 500,000 yen while being shocked by the punishment game! Enduring the vibrations of the vibrator and the pleasure of the orgasm, the fish turns on!",https://pic.javct.net/poster/06032026/1774666597465.jpg,https://javct.net/v/svvrt-074,225,2026-05-31
336KNB-405-RM,"[For the pastime of a wife with beautiful legs and sticky breasts] Before having sex with her husband, she appears in an AV with her boobs swaying and rubbing as an appetizer SEX at Toda Station, Toda City, Saitama Prefecture [Uncensored L**ked]",https://pic.javct.net/poster/06032026/1774513327621.jpg,https://javct.net/v/336knb-405-rm,63,2026-05-31
336KNB-405,"[For the pastime of a wife with beautiful legs and sticky breasts] Before having sex with her husband, she appears in an AV with her boobs swaying and rubbing as an appetizer SEX at Toda Station, Toda City, Saitama Prefecture",https://pic.javct.net/poster/06032026/1774513327621.jpg,https://javct.net/v/336knb-405,63,2026-05-31
MIDE-312-RM,[Reducing Mosaic] Female Teacher in a Tight Skirt Shoko Akiyama [Uncensored L**ked],https://static.javct.net/poster/mide-312.jpg,https://javct.net/v/mide-312-rm,165,2026-05-31
SIRO-5607-RM,Former Underground Idol's Sex Concert Begins Don't miss this lewd idol who is excited by the big dick and clutches the punch microphone and shamelessly shows off her singing voice and moaning voice if it's good [First shot] AV application online AV experience shooting 2524 [Uncensored L**ked],https://pic.javct.net/poster/06032026/1773564629281.jpg,https://javct.net/v/siro-5607-rm,69,2026-05-31
230ORE-460,Suzu-san,https://pic.javct.net/poster/06032026/1773709673.jpg,https://javct.net/v/230ore-460,37,2026-05-31
