code,title,image_url,page_url,views,date_scraped
SSIS-231-US,"Younger Man Unable to Resist Tempting Posing of 8-Headed Beautiful-Legged Married Woman in Far Window After Moving Home! Marin Hinata [English Subtitle, Reducing Mosaic]",https://pic.javct.net/poster/20212709/1636093523.jpg,https://javct.net/v/ssis-231-us,119,2026-03-23
NGOD-171-RM,"The Woman From The Convenience Store Headquarters, 11. Sarina Momonaga [Uncensored L**ked]",https://pic.javct.net/poster/20221904/1651814576.jpg,https://javct.net/v/ngod-171-rm,120,2026-03-23
GNAX-017-RM,New Intruder Ai Mukai [Uncensored L**ked],https://pic.javct.net/poster/20212709/1633769550.jpg,https://javct.net/v/gnax-017-rm,105,2026-03-23
HOMA-093-RM,"I'm Working As A Private Tutor For My Girlfriend's Little Sister (A Neat And Clean J*), But... The Truth Is That She's An Orgasmic Bitch, And Secretly Hitting Me With Siren Reverse NTR Plays When My Girlfriend's Not Looking Yui Nagase [Uncensored L**ked]",https://pic.javct.net/poster/20221108/1660784835.jpg,https://javct.net/v/homa-093-rm,121,2026-03-23
NGOD-170-RM,I Got Fingered By My Husband's Mean Boss... Nene Tanaka [Uncensored L**ked],https://pic.javct.net/poster/20221202/1649409013.jpg,https://javct.net/v/ngod-170-rm,147,2026-03-23
JUY-938-RM,"""My Wife Received Another Suspicious Letter..."" A Married Woman Who Invites Chance Into Her Life - Ai Mukai [Uncensored L**ked]",https://pic.javct.net/poster/20212011/1639973476.jpg,https://javct.net/v/juy-938-rm,120,2026-03-23
JUY-505-RM,Up Close And Personal Sex My Neighbor And I Are Committing Hungry And Ravenous Double Adultery Yuka Oshima [Uncensored L**ked],https://pic.javct.net/poster/20221202/1647503902.jpg,https://javct.net/v/juy-505-rm,120,2026-03-23
SCD-198-RM,She's Good At Getting Fucked A Bus Tour Guide In A Miniskirt Arisa Hanyu [Uncensored L**ked],https://pic.javct.net/poster/20212709/1634400573.jpg,https://javct.net/v/scd-198-rm,122,2026-03-23
JUX-865-RM,But I Still Love You. Nozomi Tanihara [Uncensored L**ked],https://pic.javct.net/poster/20221202/1646177860.jpg,https://javct.net/v/jux-865-rm,119,2026-03-23
JUL-651-RM,"A Shocking Transfer No.2!! Her First True NTR Video!! Husband-And-Wife Swapping NTR Shocking Infidelity Videos Of My Wife And A Friend, Fucking By The Window Rinka Tahara [Uncensored L**ked]",https://static.javct.net/poster/jul-651.jpg,https://javct.net/v/jul-651-rm,120,2026-03-23
PRED-362-US,"My Wife And I Are Bored Of Each Other So Tempted By Karen (Step Sister) And Creampie Her Again And Again. Karen Yuzurihara [English Subtitle, Reducing Mosaic]",https://pic.javct.net/poster/20212011/1639724395.jpg,https://javct.net/v/pred-362-us,121,2026-03-23
JUY-445-RM,My Wife Is Being Fucked By Another Man... Cuckolding Cuckold Fucks Yuka Oshima [Uncensored L**ked],https://pic.javct.net/poster/20221202/1647504034.jpg,https://javct.net/v/juy-445-rm,119,2026-03-23
RKI-625-RM,"Every Time This Older Girl Says ""I Like That,"" She Makes Me Cum So Hard In A Wild Premature Ejaculation Like Pavlov's Dog. Runa Tsukino [Uncensored L**ked]",https://pic.javct.net/poster/20221202/1649401551.jpg,https://javct.net/v/rki-625-rm,152,2026-03-23
IPX-604-US,"I Hate My Boss So Badly, I Would Rather Die Than Fuck Him, But During Our Business Trip, To My Horror, We Were Booked Into The Same Room At A Hot Spring Resort Inn... And This Disgusting, Horny Old Man Made Me Cum, Over And Over Again. Minami Aizawa [English Subtitle, Reducing Mosaic]",https://static.javct.net/poster/ipx-604.jpg,https://javct.net/v/ipx-604-us,125,2026-03-23
AVOP-365-RM,"An Elite Corporate High Power Couple Making 20 Million Yen In Salary Vs A Construction Worker DQN Couple Making Only 3 Million Yen In Salary A Short And Uncircumcised Husband With A Slender And Beautiful Wife A DQN Big Cock Husband With Giant Balloon Titties Colossal Tits Dumb Bitch Wife This Is What Happened When They Swapped Partners Trauma NTR ""Let's Decide, Once And For All, Which Husband Is Better"" Shiori Tsukada Sakura Ario [Uncensored L**ked]",https://pic.javct.net/poster/20221904/1652616269.jpg,https://javct.net/v/avop-365-rm,120,2026-03-23
JUFD-616-RM,"Getting Silently Led To Temptation By My Little Stepbrothers Girlfriend, Because We Couldn't Allow Ourselves To Be Heard FUCK AIKA [Uncensored L**ked]",https://pic.javct.net/poster/20221904/1651027235.jpg,https://javct.net/v/jufd-616-rm,148,2026-03-23
BNSPS-399-RM,The Husband Who Got Back His Cheating Wife Yuka Taniguchi [Uncensored L**ked],https://pic.javct.net/poster/20212011/1643237244.jpg,https://javct.net/v/bnsps-399-rm,84,2026-03-23
NEWM-017-RM,True Abnormal Intercourse 50 Years Old Step-Mother And Step-Son Part 27 Frustrated Step-Mother Enchanted By Tireless Step-Son's Rod Shuri Yamaguchi [Uncensored L**ked],https://pic.javct.net/poster/20212011/1642828638.jpg,https://javct.net/v/newm-017-rm,121,2026-03-23
JUY-602-RM,"She Is Unfaithful With Her Clothes Still On, Full Tight Clothing Fuck. Reiko Sawamura [Uncensored L**ked]",https://pic.javct.net/poster/20220707/1660149537.jpg,https://javct.net/v/juy-602-rm,151,2026-03-23
MEYD-414-US,"I Went To This Sex Club That Didn't Allow Real Fucking, And To My Surprise, Out Came The Bitchy And Beautiful Married Woman From Next Door Now That I Knew Her Secret, I Could Demand Real Fucking And Creampie Sex Too! And I Fucked Her To Be My Obedient Sex Slave Outside Of The Club Too [English Subtitle, Reducing Mosaic]",https://pic.javct.net/poster/20221202/1646268354.jpg,https://javct.net/v/meyd-414-us,117,2026-03-23
SONE-574-SUB,"When your partner is in front of you, you'll be targeted by this beautiful woman who will whisper dirty talk, give you a titjob, and seduces you into an NTR (cuckold) relationship. Hikaru Nagi [English Subtitle]",https://pic.javct.net/poster/20253001/1738866422.jpg,https://javct.net/v/sone-574-sub,123,2026-03-23
SPRD-1050-RM,My Husband Told Me To Fuck Another Man Azusa Yagi [Uncensored L**ked],https://pic.javct.net/poster/20212308/1631552049.jpg,https://javct.net/v/sprd-1050-rm,150,2026-03-23
FSDSS-379-RM,My Friend's Girlfriend Has Lips That Make Me Lose All Reason As We Spend 3 Days French Kissing Deeply And Fucking Passionately While Cumming. Momo Honda [Uncensored L**ked],https://pic.javct.net/poster/20221202/1648100045.jpg,https://javct.net/v/fsdss-379-rm,120,2026-03-23
DASD-852-SUB,My Father In Law Fucks Me Because It's The Only Way My Husband Can Get Off In-House Consensual Cuckholding Yu Shinoda [English Subtitle],https://static.javct.net/poster/dasd-852.jpg,https://javct.net/v/dasd-852-sub,118,2026-03-23
ALDN-572-RM,My Daughter's Boyfriend... Days Of Secret Creampies... Koda Riri [Uncensored L**ked],https://pic.javct.net/poster/06032026/1774059803.jpg,https://javct.net/v/aldn-572-rm,105,2026-03-23
T38-059,Taking My Beloved Son's Virginity To Commemorate His Graduation,https://pic.javct.net/poster/06032026/1774243815.jpg,https://javct.net/v/t38-059,140,2026-03-23
ALDN-570-RM,A Few Days Of Creampie Sex With My Brother's Wife Honami Hazuki [Uncensored L**ked],https://pic.javct.net/poster/06032026/1774063716.jpg,https://javct.net/v/aldn-570-rm,130,2026-03-23
ALDN-573-RM,My Heart Is Impossible... But I Want To Be Tied Up Maiko Kashiwagi [Uncensored L**ked],https://pic.javct.net/poster/06032026/1774059739.jpg,https://javct.net/v/aldn-573-rm,105,2026-03-23
YAG-130,Tsubane Big Breasts Wife 4 P Hentai Acme Outdoor Folding Cum Shell Frost Risa Kamiki (33),https://pic.javct.net/poster/06032026/1774240957.jpg,https://javct.net/v/yag-130,120,2026-03-23
EMOT-005-RM,Newlywed Life With Ai Mukai Enjoying With Complete Subjectivity [Uncensored L**ked],https://pic.javct.net/poster/06032026/1774218633.jpg,https://javct.net/v/emot-005-rm,117,2026-03-23
CAND-152-RM,Chip Away Swap!As A Result Of A Close Friend Couple And Ultra-radical King Game Who Came To Play In The New House ... [Uncensored L**ked],https://pic.javct.net/poster/06032026/1774218762.jpg,https://javct.net/v/cand-152-rm,100,2026-03-23
FC2PPV-4867884,"[None] [Public] Secretly from her husband, a beautiful horny married woman with big breasts and a big ass, and two black guys with big cocks, 2 consecutive large bukkake raw sex and squirting NTR hardcore 3P",https://pic.javct.net/poster/06032026/1774240008.jpg,https://javct.net/v/fc2ppv-4867884,108,2026-03-23
FC2PPV-4867697,[Amateur/Beautiful Wife] Masturbation housewife's body that can be used anytime vol.23 Ms. Mari [New item buy now campaign/review special bonus gift],https://pic.javct.net/poster/06032026/1774239854.jpg,https://javct.net/v/fc2ppv-4867697,86,2026-03-23
HUNTA-476,"Mom's Barre Camping During Camping Some Of My Breather Is Only My Boyfriend! !2 When I Go To Help The Training Camp Run By My Relative, Some Of Mama's Barre Comes Along!Besides, All Of Them Are Tits! !Looking At The Wives Who Were All In Such A Tits, I Was Not Alone In Muramura!Hard Practice & Abstinence Collective Life ...",https://pic.javct.net/poster/06032026/1774229057.jpg,https://javct.net/v/hunta-476,185,2026-03-23
FC2PPV-4867782,(No) Personal shooting married woman Mai 28 years old handheld camera Gonzo!! I called her home and impregnated her with creampie and started training!! A secret from my husband...,https://pic.javct.net/poster/06032026/1774239969.jpg,https://javct.net/v/fc2ppv-4867782,26,2026-03-23
FC2PPV-4865786,A super celebrity with a super rich husband. Cheating and creampie sex with a greedy and greedy married woman with huge breasts.,https://pic.javct.net/poster/06032026/1774239799.jpg,https://javct.net/v/fc2ppv-4865786,42,2026-03-23
VGD-153,To Obscene Madonna Shinoda History Journey,https://pic.javct.net/poster/06032026/1774234335.jpg,https://javct.net/v/vgd-153,140,2026-03-23
ALDN-571-RM,"I Can't Stand My Stepdaughter, But My Uncle Is Azuma Fuuka [Uncensored L**ked]",https://pic.javct.net/poster/06032026/1774059865.jpg,https://javct.net/v/aldn-571-rm,105,2026-03-23
ALDN-569-RM,The Reason Why My Wife Suddenly Asked Me To Cum Inside Her Yuri Kudo [Uncensored L**ked],https://pic.javct.net/poster/06032026/1774063775.jpg,https://javct.net/v/aldn-569-rm,115,2026-03-23
DANDY-893-RM,"""I'm Having Sex With My Son's Tutor Again Today."" Will You Insert It In 10 Seconds When The Two Of You Are Alone? ! A Carnal Education Mom Who Holds The Cock Of A Handsome Tutor Even Though Her Son Is Right Next To Her [Uncensored L**ked]",https://pic.javct.net/poster/20231711/1701905196.jpg,https://javct.net/v/dandy-893-rm,186,2026-03-23
CAND-150-RM,"UtsubotsuOkoshi! When You Borrow Money To Local Junior Became FX Celebrity, In Saddle To See The Plight That The Wife Continues To Be Committed To Loving Me In The Touquet ... Kojima Hiyori [Uncensored L**ked]",https://pic.javct.net/poster/06032026/1774218822.jpg,https://javct.net/v/cand-150-rm,100,2026-03-23
JUKD-557-RM,Juri Yamaguchi R**e Creampie Gangbang Wife [Uncensored L**ked],https://pic.javct.net/poster/06032026/1774218698.jpg,https://javct.net/v/jukd-557-rm,110,2026-03-23
MIDE-143-RM,I was r**ed by your boss today. Nonoka [Uncensored L**ked],https://pic.javct.net/poster/06032026/1774218635.jpg,https://javct.net/v/mide-143-rm,120,2026-03-23
JBD-206,You Are Not Bad Fallen Beautiful Wife To Rope ... Bad My Body Sawamura Reiko,https://pic.javct.net/poster/06032026/1774228462.jpg,https://javct.net/v/jbd-206,120,2026-03-23
JUY-280-RM,My Mother's Best Friend - Tachibana Misuzu [Uncensored L**ked],https://pic.javct.net/poster/06032026/1774226212.jpg,https://javct.net/v/juy-280-rm,120,2026-03-23
JUL-657-RM,The Conversion of a Married Woman. Momoko Isshiki. [Uncensored L**ked],https://static.javct.net/poster/jul-657.jpg,https://javct.net/v/jul-657-rm,119,2026-03-23
DLDSS-479-RM,Agony! Repeated Revolver Creampie Without Pulling Out Mami Yoshiba [Uncensored L**ked],https://pic.javct.net/poster/06032026/1774152252340.jpg,https://javct.net/v/dldss-479-rm,125,2026-03-23
FSDSS-344-RM,"""It's My First Time Doing This..."" 3 Works Of Sexual Development Filled With ""Firsts"" Special!! Mayu Horizawa [Uncensored L**ked]",https://pic.javct.net/poster/20212011/1637815942.jpg,https://javct.net/v/fsdss-344-rm,151,2026-03-23
SOE-510-RM,Erina Shirase 's Cowgirl Special [Uncensored L**ked],https://pic.javct.net/poster/20221202/1645859037.jpg,https://javct.net/v/soe-510-rm,118,2026-03-23
VEC-314-RM,My Friend's Mother Rino Kirishima [Uncensored L**ked],https://pic.javct.net/poster/20220406/1654678916.jpg,https://javct.net/v/vec-314-rm,86,2026-03-23
SDMU-568-RM,SOD Romance. Original Work Of Lotus Kimura Alone In The Elevator With Stepmom (Mama). Yuri Nikaido. [Uncensored L**ked],https://pic.javct.net/poster/20221202/1650259841.jpg,https://javct.net/v/sdmu-568-rm,135,2026-03-23
SONE-556-SUB,"No sex or masturbation allowed! After a month of restraint, she's horny and sensitive, and when she tastes it with her wet body, she convulses with a female face and squirts a lot of juice in this abstinence best-of FUCK Hiyori Nosaka [English Subtitle]",https://pic.javct.net/poster/20253001/1738866612.jpg,https://javct.net/v/sone-556-sub,120,2026-03-23
GVG-549-US,"A Horny P*A Director And A Bad Boy Student Council President Reiko Kobayakawa [English Subtitle, Reducing Mosaic]",https://pic.javct.net/poster/20212011/1640833775.jpg,https://javct.net/v/gvg-549-us,130,2026-03-23
SONE-583-SUB,"Only I (23) know the bitter-sweet taste of my brother's (45) sperm. I feed him, take off his clothes, wash his body, get his dick hard, and support him by milking his sperm. Hana Alice [English Subtitle]",https://pic.javct.net/poster/20253001/1738866063.jpg,https://javct.net/v/sone-583-sub,120,2026-03-23
DLDSS-479,Agony! Repeated Revolver Creampie Without Pulling Out Mami Yoshiba,https://pic.javct.net/poster/06032026/1774152252340.jpg,https://javct.net/v/dldss-479,125,2026-03-23
FCDSS-011-RM,A Horny Big Tits Elder Sister Full Course Service Slut Plays Yuko Ono Best Hits Collection 8 Hours [Uncensored L**ked],https://static.javct.net/poster/fcdss-011.jpg,https://javct.net/v/fcdss-011-rm,483,2026-03-23
JUFD-709-RM,She Thought She Was Leading Her Cherry Boy Little Brother To Temptation... But The Tables Were Turned! An Unsuspecting Colossal Tits Big Sister Gets Fucked By Her Orgasmic Little Brother Saori Yagami [Uncensored L**ked],https://pic.javct.net/poster/20221904/1650842053.jpg,https://javct.net/v/jufd-709-rm,145,2026-03-23
DLDSS-480-RM,"I'm Always Cumming For 1,500 Yen An Hour. A Married Woman, Non Kohana, Who Was Given A Clit-sucking Toy By Her Perverted Store Manager And Had Continuous Clitoral Orgasms During Her Part-time Job At A Convenience Store. [Uncensored L**ked]",https://pic.javct.net/poster/06032026/1774060526592.jpg,https://javct.net/v/dldss-480-rm,120,2026-03-23
EBOD-378-RM,Fucked So Good They Piss Themselves - Openly Horny Schoolgirls  Aoi Nagase [Uncensored L**ked],https://pic.javct.net/poster/20221108/1663503332.jpg,https://javct.net/v/ebod-378-rm,119,2026-03-23
NSPS-437-RM,"The Widow Who Forgot What It Was Like To Be A Woman -A Faithful Wife, 51 Years Old- Sara Yumeka [Uncensored L**ked]",https://pic.javct.net/poster/20220707/1658192738.jpg,https://javct.net/v/nsps-437-rm,84,2026-03-23
JUL-656-RM,Exclusive: Minori Hatsune is Driven to Ecstasy before an Intense Vaginal Creampie!! Secretive Cheating Sex with a Hot Wife and Her Real Estate Agent. [Uncensored L**ked],https://static.javct.net/poster/jul-656.jpg,https://javct.net/v/jul-656-rm,119,2026-03-23
GVG-389-RM,Mom's Real Sex Education Satomi Hibino [Uncensored L**ked],https://pic.javct.net/poster/20221904/1654315205.jpg,https://javct.net/v/gvg-389-rm,126,2026-03-23
FSDSS-343-RM,Fresh Face Practically A Virgin But Strongly Curious About Sex Mayu Horizawa AV Debut [Uncensored L**ked],https://pic.javct.net/poster/20212709/1634792769.jpg,https://javct.net/v/fsdss-343-rm,123,2026-03-23
AVSA-425-RM,"Breaking The Rules And Getting Fucked! Picking Up Girls At The Club, A Drunk And Horny Bitch () [Uncensored L**ked]",https://pic.javct.net/poster/06032026/1774063653.jpg,https://javct.net/v/avsa-425-rm,150,2026-03-23
GQN-010-RM,"If You Remove The Condom, You Too Can Ejaculate A Lot! Mayu Hazuki's How To Real Slut Lesson [Uncensored L**ked]",https://pic.javct.net/poster/06032026/1774058808.jpg,https://javct.net/v/gqn-010-rm,150,2026-03-23
GIRO-62,Armored Heroine Bondage Broken Nifty Domination ANGELA Kayama Yoshisakura,https://pic.javct.net/poster/06032026/1774241056.jpg,https://javct.net/v/giro-62,97,2026-03-23
AGAV-165-RM,A Stinky Woman Smells Of Sex Pheromones And Gets Creampied While She Sleeps. A Wicked Boss Impregnates A Sleeping New Graduate Employee Without Her Knowledge. Hiyori Shiokawa [Uncensored L**ked],https://pic.javct.net/poster/06032026/1774063903.jpg,https://javct.net/v/agav-165-rm,127,2026-03-23
BAZX-036-RM,Miss Lingerie Na III Obscene Lingerie And Dense Sexual Intercourse Four Hours Of High Class Call Girl [Uncensored L**ked],https://pic.javct.net/poster/06032026/1774219010.jpg,https://javct.net/v/bazx-036-rm,240,2026-03-23
FC2PPV-4867926,"[No] Two-hole simultaneous penetration with black people lifted [Public] In front of her boyfriend, a beautiful girlfriend with big breasts and a big ass is convulsed by two big dicks, made to squirt, and her anus is destroyed. Dangerous SM raw sex NTR hard 3P fuck",https://pic.javct.net/poster/06032026/1774239907.jpg,https://javct.net/v/fc2ppv-4867926,54,2026-03-23
FC2PPV-4867711,[No face shown] I was planning to do a fashion survey to a new graduate with F cup big breasts... but it gradually escalated and ended up with two consecutive creampie sex,https://pic.javct.net/poster/06032026/1774239941.jpg,https://javct.net/v/fc2ppv-4867711,102,2026-03-23
HMGL-126,Glamour Unpublished Specials 13,https://pic.javct.net/poster/06032026/1774234766.jpg,https://javct.net/v/hmgl-126,140,2026-03-23
AKDL-017,[Verification AV] What happens if you eat food mixed with aphrodisiacs during a food report?,https://pic.javct.net/poster/06032026/1774241284.jpg,https://javct.net/v/akdl-017,124,2026-03-23
EBOD-438,Soggy Concentrated Kiss And Estrus Berokisu Fuck Yoshitake Tin,https://pic.javct.net/poster/06032026/1774234829.jpg,https://javct.net/v/ebod-438,150,2026-03-23
CEMD-809-RM,No Bra And Nipples Exposed! Embarrassing Play Date With A Lewd Beautiful Mature Woman 2 Aikawa Saki [Uncensored L**ked],https://pic.javct.net/poster/06032026/1774059327.jpg,https://javct.net/v/cemd-809-rm,185,2026-03-23
XVSR-203,Once I'd Love To Experience! !Pretty Awahime Xanadu An Misora,https://pic.javct.net/poster/06032026/1774234275.jpg,https://javct.net/v/xvsr-203,120,2026-03-23
GVH-831-RM,I Met A Local Slutty Gal For The First Time In 10 Years And She Used Her Ultimate Hand Technique To Make Me Cum Endlessly Until I Ejaculated! Kaoru Yasui [Uncensored L**ked],https://pic.javct.net/poster/06032026/1774058680.jpg,https://javct.net/v/gvh-831-rm,120,2026-03-23
MADV-626-RM,"""Don't Say It..."" My Sister-in-law, A Teacher, Came To Our House While My Wife Was Away... I Was Given A Sex Education From Her Teacher's Point Of View, And I Couldn't Resist My Lewd Sister-in-law's Body And Ended Up Cumming Inside Her Over And Over Again... Akane Rei [Uncensored L**ked]",https://pic.javct.net/poster/06032026/1774058302.jpg,https://javct.net/v/madv-626-rm,130,2026-03-23
EKDV-386-RM,Big × Bikini Cheerleader Honda Riko [Uncensored L**ked],https://pic.javct.net/poster/06032026/1774218703.jpg,https://javct.net/v/ekdv-386-rm,120,2026-03-23
DASS-635-SUB,"I Ejaculated Many Times Without Moving My Hips Even Once During The Sweaty, Fully Automatic Pounding Of The Beautiful Breast Trainer Yumi Nijimura [English Subtitle]",https://pic.javct.net/poster/20250903/1743702961.jpg,https://javct.net/v/dass-635-sub,130,2026-03-23
DOKI-033-RM,"Stop Time And Do Whatever You Want! When You Get Horny With A Working Woman, Start Playing Pranks! 2 [Uncensored L**ked]",https://pic.javct.net/poster/06032026/1774059140.jpg,https://javct.net/v/doki-033-rm,130,2026-03-23
BOKD-001-RM,AV Ban!Ya Otowa Anal And Screaming SEX Been Rubbed Plenty Of Aphrodisiac To Cock [Uncensored L**ked],https://pic.javct.net/poster/06032026/1774218948.jpg,https://javct.net/v/bokd-001-rm,120,2026-03-23
APAA-416-RM,Awesome! A Lovely Girl Who Looks Good In Uniform Nana Kisaki [Uncensored L**ked],https://pic.javct.net/poster/20230908/1694231115.jpg,https://javct.net/v/apaa-416-rm,163,2026-03-23
SMGN-038,Azu & Moa,https://pic.javct.net/poster/06032026/1774246223636.jpg,https://javct.net/v/smgn-038,55,2026-03-23
SMNN-039,Meisa-san,https://pic.javct.net/poster/06032026/1774246065569.jpg,https://javct.net/v/smnn-039,30,2026-03-23
DASS-916-RM,"Even If The High-class Beauty Salon Girl Cries And Screams, She Continues To Be Thrust And Stroked Relentlessly Until She Is Made To Climax With An Aphrodisiac And A Follow-up Piston Attack. [Uncensored L**ked]",https://pic.javct.net/poster/06032026/1773970639.jpg,https://javct.net/v/dass-916-rm,130,2026-03-23
DVDMS-316,General Males And Females Monitoring AV W Dating Among College Student Couple Only!First-time Same-room Swapping Cum Shot Project!Couples Exchange!Pile Driving Piston Continuous Cumshot Female Position Battle 2 In Front Of My Favorite Boyfriend Lee's Girlfriend's Boyfriend Is Thought Ikenai But It Can Not Be Inserted And Can Not Endure Big Grim!Cum Shot Total 18 Shots! !,https://pic.javct.net/poster/06032026/1774240013.jpg,https://javct.net/v/dvdms-316,150,2026-03-23
HUNTC-502-RM,"Runaway Girl Is Waiting For God To Come To Her House And Is Told, ""I'll Let You Stay At My House,"" And Is Immediately Pushed Down And Has Sex With Her The Whole Time! She Also Invites Her Friends Over And Takes Turns Having Sex With Them! 2 [Uncensored L**ked]",https://pic.javct.net/poster/06032026/1774058493.jpg,https://javct.net/v/huntc-502-rm,210,2026-03-23
FC2PPV-4867770,[Real Amateur] Godly Slender Lady Living in Ashiya Part 2 This is a super limited sale with no plans for resale.,https://pic.javct.net/poster/06032026/1774239763.jpg,https://javct.net/v/fc2ppv-4867770,54,2026-03-23
MIST-152,Semen Hunt To Cum Dare To Tall High-spec Beautiful Woman Saryu Usui Super De S Knee High Boots Danger Date,https://pic.javct.net/poster/06032026/1774234706.jpg,https://javct.net/v/mist-152,136,2026-03-23
HUNTC-442-RM,School-refusing Girl Is A Monster Of Approval! A Shut-in High School Girl Who Feels Unwanted By Anyone Finds Her Purpose In Life By Fulfilling Her Need For Approval By Broadcasting Her Masturbation. When Her Teacher And Classmates Come To Her Home For A Home Visit And Persuade Her To Stop Broadcasting... [Uncensored L**ked],https://pic.javct.net/poster/06032026/1774058557.jpg,https://javct.net/v/huntc-442-rm,150,2026-03-23
FC2PPV-4867745,"[Amateur first shot] Sumire (18) 163 cm 47 kg D cup and super cute It seems like she can't really do it, but in the end she accepts kissing, creampie, and anal penetration as a middle-aged woman with metabolic syndrome",https://pic.javct.net/poster/06032026/1774153943.jpg,https://javct.net/v/fc2ppv-4867745,114,2026-03-23
SIRO-5647,"Beautiful Married Woman's Secret Sex A married woman who applied without telling her husband was too erotic. She couldn't hold back the desire that had been building up in the sexless situation, and she learned that the forbidden fruit with her ripe and messy body was the sweetest. [First shot] AV application online AV experience shooting 2529",https://pic.javct.net/poster/06032026/1774173207888.jpg,https://javct.net/v/siro-5647,63,2026-03-23
586HNHU-0194,"If you pick them up, a hidden M beauty who wants to be blamed ♡ will appear! Beautiful areola bulging, big breasts licked, saliva covered, blowjob, live insertion, orgasm crazy, creampie, joyful face, sperm dripping, cleaning, nipple licking, handjob, continuous shooting www",https://pic.javct.net/poster/06032026/1774173120790.jpg,https://javct.net/v/586hnhu-0194,66,2026-03-23
567BEAF-207,"Her hobby is working part-time, saving money, and traveling all over the country by herself. She follows the men she meets and immediately fucks them and cums inside her. A one-night traveling JD with big breasts, Mina-chan, 19 years old.",https://pic.javct.net/poster/06032026/1774173052112.jpg,https://javct.net/v/567beaf-207,65,2026-03-23
300MIUM-1334,"""You can lick all the sweat and semen ///"" There's no way that anything will happen in a karaoke room with a man and a woman lol The black-haired gal's deep pleas are too erotic lol I'm doing it so that everyone won't find out and it's all wet lol [Everyone is sleeping so I can't fuck]",https://pic.javct.net/poster/06032026/1774172982511.jpg,https://javct.net/v/300mium-1334,87,2026-03-23
FC2PPV-4867461,A 26-year-old married woman who can't hold back her overflowing sexual desire - complete version,https://pic.javct.net/poster/06032026/1774154427.jpg,https://javct.net/v/fc2ppv-4867461,70,2026-03-23
FC2PPV-4867391,"0206_022 Miku-chan, 19 years old. The training of a masochist woman with no human rights who can do anything from impregnation to exposing her ID continues... This time, she gets her beautiful face dirty with her first facial, which includes raw sex and a super thick semen bukkake.",https://pic.javct.net/poster/06032026/1774154087.jpg,https://javct.net/v/fc2ppv-4867391,46,2026-03-23
FC2PPV-4866793,"Cute anime voice [None] [Creampie] An obedient beauty with an idol face. Immediate blowjob, immediate sex, fuck all you want, creampie and poi *Bonus included",https://pic.javct.net/poster/06032026/1774153788.jpg,https://javct.net/v/fc2ppv-4866793,37,2026-03-23
FC2PPV-4867502,Just turned 18 years old/Private one night hot spring creampie trip with Gcup beautiful big breasts girl/3rd round record,https://pic.javct.net/poster/06032026/1774154389.jpg,https://javct.net/v/fc2ppv-4867502,59,2026-03-23
