code,title,image_url,page_url,views,date_scraped
MIST-194,New Delhi That The Girls Visit Nakedly!Immediate Scale & Instantly Girls Who Work In Customs That Are Too Sketchy Of DK Are Quiet! What?Even If You Insert It Rawly Into The Crotch You Accept It!Cum Shot Repeatedly Using Unlimited Shots In Time!2,https://pic.javct.net/poster/04112026/9912753c2b.jpg,https://javct.net/v/mist-194,160,2026-05-02
IPTD-951-RM,Welcome To Soap Star Rika And The World's Finest [Uncensored L**ked],https://pic.javct.net/poster/04112026/022555fe34.jpg,https://javct.net/v/iptd-951-rm,170,2026-05-02
MARA-056-RM,Yuri Yoshine That Big Breast Theater Mcup! 111 Cm [Uncensored L**ked],https://pic.javct.net/poster/04112026/fcd9e36020.jpg,https://javct.net/v/mara-056-rm,123,2026-05-02
MDBK-300-RM,Sexy Munmun! Enchanting Ero Buddy! Unequaled Bimbo Bit Slut's Triple Colossal Tits Surrounded By Fucking Dirty Lewd Snack Always Bing With Rich Reverse Sexual Harassment Customer Service! ! All-you-can-drink All-you-can-eat Harlem Orgy Tonight Until Morning! ! [Uncensored L**ked],https://pic.javct.net/poster/20230908/1694234360.jpg,https://javct.net/v/mdbk-300-rm,140,2026-05-02
IESP-298-RM,Riko Tachibana Woman A**se Lawyer [Uncensored L**ked],https://pic.javct.net/poster/04112026/6c299c8301.jpg,https://javct.net/v/iesp-298-rm,120,2026-05-02
IESP-212-RM,Riko Tachibana Women Live Out In The Pores [Uncensored L**ked],https://pic.javct.net/poster/04112026/95c80e1664.jpg,https://javct.net/v/iesp-212-rm,115,2026-05-02
STAR-958-RM,# Enomoto Misaki SNS Lespe Popular Mom Model That Broke Happy Days In Adult Sticky Followers [Uncensored L**ked],https://pic.javct.net/poster/04112026/270e95702a.jpg,https://javct.net/v/star-958-rm,130,2026-05-02
IESP-257-RM,Riko Tachibana Cum R**e Insurance Salesman [Uncensored L**ked],https://pic.javct.net/poster/04112026/aa653d66e0.jpg,https://javct.net/v/iesp-257-rm,115,2026-05-02
HAR-067-RM,Estrus In Aphrodisiac! !Escape Mali Sex Shooting In Rokebasu! [Uncensored L**ked],https://pic.javct.net/poster/04112026/807a7a450c.jpg,https://javct.net/v/har-067-rm,125,2026-05-02
XVSR-216-RM,Dirty Gakuen Chapter Ayano Nana [Uncensored L**ked],https://pic.javct.net/poster/06032026/1774751490.jpg,https://javct.net/v/xvsr-216-rm,180,2026-05-02
XRW-629-RM,Aphrodisis Bondage R**ed Being R**ed! [Uncensored L**ked],https://pic.javct.net/poster/04112026/1777038192.jpg,https://javct.net/v/xrw-629-rm,120,2026-05-02
IESP-235-RM,Collection Barrage 100 (Riko Tachibana) Pies [Uncensored L**ked],https://pic.javct.net/poster/04112026/616afdda61.jpg,https://javct.net/v/iesp-235-rm,240,2026-05-02
SAP-019-RM,Yua Aida - If You Were Of Your If If ~ [Uncensored L**ked],https://pic.javct.net/poster/04112026/9164221353.jpg,https://javct.net/v/sap-019-rm,120,2026-05-02
MIAA-092,"Encounter With Hate Woman Boss And Deriheru, Immediate Position Reversal! Time & Launch Unlimited!Intravaginal Ejaculation Fo**ed!The Shop And The Company Made Iinari Cowgirl Pet. Shinoda Yu",https://pic.javct.net/poster/04112026/dca9c8af51.jpg,https://javct.net/v/miaa-092,120,2026-05-02
SOE-040-RM,Asami Ogawa - Young Wife Who Was Violated In Front Of Her Husband's R**e  Risky Mosaic [Uncensored L**ked],https://pic.javct.net/poster/20222410/1666658001.jpg,https://javct.net/v/soe-040-rm,120,2026-05-02
MIGD-071-RM,Misaki Pies Intrinsic [Uncensored L**ked],https://pic.javct.net/poster/04112026/2d8c7e6b2f.jpg,https://javct.net/v/migd-071-rm,120,2026-05-02
RCTD-040-RM,Immediately After The Guerilla Heavy Rain The R**e Rain ○ ○ ○ [Uncensored L**ked],https://pic.javct.net/poster/04112026/daa1f89c50.jpg,https://javct.net/v/rctd-040-rm,120,2026-05-02
IDOL-054-RM,Feel R**ed? ! Riko Tachibana Nurse [Uncensored L**ked],https://pic.javct.net/poster/04112026/a02e30ddc2.jpg,https://javct.net/v/idol-054-rm,115,2026-05-02
MIAD-744-RM,Home Confinement Les -flops Have Been Mother And Daughter - Gangbang Been Mother-in-law And The Pies Have Been School Girls  Aisu Kokoa Camellia Pretty [Uncensored L**ked],https://pic.javct.net/poster/20230302/1678158417.jpg,https://javct.net/v/miad-744-rm,120,2026-05-02
HAR-071-RM,"Being Drunk By A Strange Man With Muriyari Aphrodisiac, An Esthetic Beauty Wife Impatient With A Clothespin Fixed Ironing Stop Play [Uncensored L**ked]",https://pic.javct.net/poster/04112026/0053533ccf.jpg,https://javct.net/v/har-071-rm,130,2026-05-02
MIAD-658-RM,"Teacher Reiko Sawamura, Which Is Occupied Home [Uncensored L**ked]",https://pic.javct.net/poster/20242108/1725834825.jpg,https://javct.net/v/miad-658-rm,120,2026-05-02
FAX-370-RM,"Became Man Assailant /-brother To Marry The Amorous Pieces Of Big Brother ... /-to The Ends Of Love And Hate, History Of Sex Crimes In Japan [Uncensored L**ked]",https://pic.javct.net/poster/04112026/e4eb9cb6fc.jpg,https://javct.net/v/fax-370-rm,110,2026-05-02
FAX-336-RM,Woman Gets Fucked In The Attic In The World Most Erotic Pose [Uncensored L**ked],https://pic.javct.net/poster/04112026/b84367a22a.jpg,https://javct.net/v/fax-336-rm,130,2026-05-02
XV-622-RM,Nao Yoshizaki Soaked [Uncensored L**ked],https://pic.javct.net/poster/04112026/146e51c96c.jpg,https://javct.net/v/xv-622-rm,120,2026-05-02
FAX-364-RM,Meat Puppet To Sleep / Assault In The Lower Body Exposure And Breast / Body Stripped Naked In The Clothes Sexual Assault [Uncensored L**ked],https://pic.javct.net/poster/04112026/de14db23e8.jpg,https://javct.net/v/fax-364-rm,120,2026-05-02
MIGD-585,Pies Only Meat Urinal Itagaki Azusa,https://pic.javct.net/poster/04112026/d9f4b625cf.jpg,https://javct.net/v/migd-585,150,2026-05-02
IESP-142-RM,Riko Tachibana Cum Big Woman Investigation [Uncensored L**ked],https://pic.javct.net/poster/04112026/1777073392.jpg,https://javct.net/v/iesp-142-rm,115,2026-05-02
CLO-054-RM,convulsions! incontinence! ! Gakuburu FUCK! ! ! Ichika Kanhata [Uncensored L**ked],https://pic.javct.net/poster/04112026/1dbabaab68.jpg,https://javct.net/v/clo-054-rm,35,2026-05-02
REAL-597,Blacks Fuck Harnessed HatsuMisa Nozomi ~ Suddenly Black Switch ● Port Fitted ~,https://pic.javct.net/poster/04112026/82b5b90132.jpg,https://javct.net/v/real-597,145,2026-05-02
TCD-326-RM,My Face Is Ruined By My Beloved Irama! Transgender Idol Oryo Rolls Her Eyes Back At The Sight Of A Huge Cock. [Uncensored L**ked],https://pic.javct.net/poster/04112026/48520e822a.jpg,https://javct.net/v/tcd-326-rm,157,2026-05-02
LULU-433,"I Taught Her Shut-in, Introverted, Nerdy, Big-assed, J-pop Idol-type Younger Sister How To Do Lewd Masturbation Poses, And Immediately Reformed Her Into A Submissive, Squirting Sex Doll Through Piston-like Thrusting. - Hinako Matsui",https://pic.javct.net/poster/04112026/542cbfa8ff.jpg,https://javct.net/v/lulu-433,160,2026-05-02
NKKD-295-RM,"The Boss's Wife And The Subordinate's Big Cock The Boss's Wife Who Was Melted By The Thick, Long And Hard Big Cocks Of Her Husband's Young Subordinates Miki Yoshii [Uncensored L**ked]",https://pic.javct.net/poster/20230908/1694150218.jpg,https://javct.net/v/nkkd-295-rm,140,2026-05-02
FC2PPV-4889371,"[No] Without telling her husband, a beautiful wife with big breasts and a big ass has sex with a big black dick, raw NTR, and squirts! SEX",https://pic.javct.net/poster/04112026/c0c113358a.jpg,https://javct.net/v/fc2ppv-4889371,62,2026-05-02
MDVHJ-089-RM,Mothers-in-law Who Are Captivated By Unfaithful Intercourse With Their Husband's Stepc**ld's Big Cock... (4) [Uncensored L**ked],https://pic.javct.net/poster/20230908/1695787016.jpg,https://javct.net/v/mdvhj-089-rm,180,2026-05-02
ATID-485-SUB,Female Detective Eri Takigawa Fell Into A BBP Big Black Penis [English Subtitle],https://pic.javct.net/poster/20212709/1635500963.jpg,https://javct.net/v/atid-485-sub,116,2026-05-02
FC2PPV-4887363,"[No] Beautiful Nora-chan is violently fucked by a black man and a white man with big cocks in front of her boyfriend, and the NTR sweaty hardcore 3P with two consecutive cumshots at the end [Overseas version] Bonus included",https://pic.javct.net/poster/04112026/fb9d296607.jpg,https://javct.net/v/fc2ppv-4887363,41,2026-05-02
EMBM-017-RM,First Shooting Married Woman Kanon (27) [Uncensored L**ked],https://pic.javct.net/poster/20230908/1695181152.jpg,https://javct.net/v/embm-017-rm,133,2026-05-02
XVSR-213-RM,Realistic Sex Kanno Of Ko Sex Sayo Kanno Sayo [Uncensored L**ked],https://pic.javct.net/poster/06032026/1774504247.jpg,https://javct.net/v/xvsr-213-rm,120,2026-05-02
EKDV-814-RM,"My Virginity Was Taken By My C**ldhood Friend... My Fair-skinned, Big-breasted, Caring C**ldhood Friend, Ruka Itoi, Became My Sex Practice Partner When I Got My First Girlfriend. [Uncensored L**ked]",https://pic.javct.net/poster/04112026/1777048182.jpg,https://javct.net/v/ekdv-814-rm,150,2026-05-02
TCD-326,My Face Is Ruined By My Beloved Irama! Transgender Idol Oryo Rolls Her Eyes Back At The Sight Of A Huge Cock.,https://pic.javct.net/poster/04112026/48520e822a.jpg,https://javct.net/v/tcd-326,157,2026-05-02
FC2PPV-4887228,"For the first time, I use a big black cock to make a tight beauty with beautiful breasts and a big ass cum in an ekiben, and then I cum inside her and fuck her.",https://pic.javct.net/poster/04112026/f8c2b9520b2e.jpg,https://javct.net/v/fc2ppv-4887228,43,2026-05-02
KSBJ-265-RM,Sarina Momunaga Is Fascinated By Her Brother-in-law's Big Cock [Uncensored L**ked],https://pic.javct.net/poster/20230908/1696046282.jpg,https://javct.net/v/ksbj-265-rm,120,2026-05-02
EKDV-814,"My Virginity Was Taken By My C**ldhood Friend... My Fair-skinned, Big-breasted, Caring C**ldhood Friend, Ruka Itoi, Became My Sex Practice Partner When I Got My First Girlfriend.",https://pic.javct.net/poster/04112026/1777048182.jpg,https://javct.net/v/ekdv-814,150,2026-05-02
HUNTA-783,"""Is It Okay If My Big Brother's Big Mouth Is Inserted?"" My Sister's Friend Came Over To Stay At Our House, And It's Really A Nighttime Night! ! My Sister's Friend Has A Night Out. First…",https://pic.javct.net/poster/04112026/1777007073.jpg,https://javct.net/v/hunta-783,240,2026-05-02
MIDE-310-SUB,Slurp Vacuum Blow Hatsukawa South [English Subtitle],https://pic.javct.net/poster/06032026/1773573296.jpg,https://javct.net/v/mide-310-sub,120,2026-05-02
JUNY-152-SUB,"Black Man Ban Lifted!! Black Big Cock Artist NTR Voluptuous Busty Wife Reika Takeda, Whose Body And Soul Are Stolen By The Shocking Big Cock Reflected In The Light [English Subtitle]",https://pic.javct.net/poster/20250903/1744305621.jpg,https://javct.net/v/juny-152-sub,130,2026-05-02
CEMD-237-RM,Scream! Faint In Agony! Portio Development! Woman Iku In The Back Of The Womb 7 Akari Minase [Uncensored L**ked],https://pic.javct.net/poster/20222109/1663993888.jpg,https://javct.net/v/cemd-237-rm,133,2026-05-02
CLUB-831-RM,"Even Though My Husband Is Next To Me, I... I... An Unscrupulous Bridal Esthetician Who Only Targets Newlyweds And Seduces The New Wife 70 Cm Next To Her Husband. An Immoral Massage NTR. An Unfaithful Wife Who Learns The Pleasure Of Experiencing Life For The First Time Through Unwanted Sex And Demands A Creampie. [Uncensored L**ked]",https://pic.javct.net/poster/20241902/1709261418.jpg,https://javct.net/v/club-831-rm,210,2026-05-02
FC2PPV-4885285,"[No] Women's Body Sharing Chapter 14, A beautiful woman with a long black hair cut is given a brutal instant blowjob, turned into a meat urinal in 3P, climax acme, skewered FUCK, creampie & ejaculation in the mouth [Overseas version] Bonus included",https://pic.javct.net/poster/04112026/1776824007.jpg,https://javct.net/v/fc2ppv-4885285,59,2026-05-02
BACJ-071-RM,Saliva Lazy Licking W Slut Who Won't Stop Until Chi Po Is Broken [Uncensored L**ked],https://pic.javct.net/poster/20230908/1694232792.jpg,https://javct.net/v/bacj-071-rm,126,2026-05-02
BBSS-103-RM,"Misaki Kanna, A Lesbian Beauty Who Captivates Even Straight Men With Her Dangerously Erotic Face And Lewd Techniques, PREMIUM LESBIAN BEST 4 Hours [Uncensored L**ked]",https://pic.javct.net/poster/04112026/e99b0832b6.jpg,https://javct.net/v/bbss-103-rm,240,2026-05-02
STARS-625-RM,Cheeky J  I Became A Younger Sister's Eccentric Lesbian Pet. Mana Sakura Ichika Matsumoto [Uncensored L**ked],https://pic.javct.net/poster/20220406/1655785176.jpg,https://javct.net/v/stars-625-rm,135,2026-05-02
ATID-675,I Was Held In Kanna's Arms. Please Forgive Me...,https://pic.javct.net/poster/04112026/6ead482233.jpg,https://javct.net/v/atid-675,120,2026-05-02
BBAN-258-SUB,The Coup Failed The Woman Who Was Aiming For A Major Reversal Of Life Fell Into The Trap And Fell Further ... [English Subtitle],https://pic.javct.net/poster/06032026/1774431112.jpg,https://javct.net/v/bban-258-sub,120,2026-05-02
SAN-454-RM,"Four Genuine Lesbian Wives, Neglected By Their Husbands, 250 Minutes [Uncensored L**ked]",https://pic.javct.net/poster/04112026/c753b75ef4.jpg,https://javct.net/v/san-454-rm,250,2026-05-02
HUNTB-486-RM,"""Don't Practice SEX With Us! No Matter How Many Times You Fail! Have Sex And Cheer Up"" A Super Gentle C**ldhood Friend Full Of Hospitality To Me Who Is Worried About Being A Virgin [Uncensored L**ked]",https://pic.javct.net/poster/20230908/1694145334.jpg,https://javct.net/v/huntb-486-rm,140,2026-05-02
PGD-083-RM,"Namba, Yasushi & Apricot Our Premium Beauty [Uncensored L**ked]",https://pic.javct.net/poster/04112026/91e3dc1245.jpg,https://javct.net/v/pgd-083-rm,240,2026-05-02
RKI-024-RM,★ Mature Rope [Uncensored L**ked],https://pic.javct.net/poster/04112026/a7274557c8.jpg,https://javct.net/v/rki-024-rm,230,2026-05-02
LZWM-038-RM,Nipplebian 6: Lesbian Sex With Hard Nipples [Uncensored L**ked],https://pic.javct.net/poster/20253001/1740155712.jpg,https://javct.net/v/lzwm-038-rm,150,2026-05-02
CETD-171-RM,Cum Copulation Ichinose Tin Forbidden With A Physical Relationship With The Father-in-law In The Early Afternoon The Absent Husband Of Venus Files Of Immorality [Uncensored L**ked],https://pic.javct.net/poster/20222612/1674608416.jpg,https://javct.net/v/cetd-171-rm,160,2026-05-02
HAR-073-RM,A Woman With A Daughter And A Woman Tattoos Aphrodisiac And Estrangement & Close-minded & Lesbian 3P In W Creampie Sex 2 [Uncensored L**ked],https://pic.javct.net/poster/04112026/70d6379648.jpg,https://javct.net/v/har-073-rm,125,2026-05-02
SAN-454,"Four Genuine Lesbian Wives, Neglected By Their Husbands, 250 Minutes",https://pic.javct.net/poster/04112026/c753b75ef4.jpg,https://javct.net/v/san-454,250,2026-05-02
AUKG-649,A Married Woman And Her Girlfriend ~Reunion Lesbian Sex~ Unforgettable Caresses From An Ex-girlfriend~,https://pic.javct.net/poster/04112026/e3415ec80e.jpg,https://javct.net/v/aukg-649,120,2026-05-02
DSDP-037-RM,Beautiful Wet Pussy! XXX3 [Uncensored L**ked],https://pic.javct.net/poster/04112026/1776880287.jpg,https://javct.net/v/dsdp-037-rm,240,2026-05-02
FC2PPV-4886791,"381_[Sixtieth birthday uncle] Reward 3P At first, gentle W service 3P From the middle, the two kiss each other, fight for the dick, squirting creampie sex Hotaru-chan 2nd Chapter 12 Moko-chan 2nd Chapter 4 [Overseas version]",https://pic.javct.net/poster/04112026/97e7d137b9.jpg,https://javct.net/v/fc2ppv-4886791,72,2026-05-02
BBSS-103,"Misaki Kanna, A Lesbian Beauty Who Captivates Even Straight Men With Her Dangerously Erotic Face And Lewd Techniques, PREMIUM LESBIAN BEST 4 Hours",https://pic.javct.net/poster/04112026/e99b0832b6.jpg,https://javct.net/v/bbss-103,240,2026-05-02
MVG-159-RM,"Nishida Karina, A Pathetic, Perverted Masochistic Woman Who Gets Turned On By Same-sex Humiliation And Bullying, And Whose Pussy Gets Wet. [Uncensored L**ked]",https://pic.javct.net/poster/04112026/1777047912.jpg,https://javct.net/v/mvg-159-rm,155,2026-05-02
HUNTB-443-RM,"""I'll Keep It A Secret From The Company, So Let's Have Sex One More Time!"" When I Woke Up At An Inn On A Company Trip... [Uncensored L**ked]",https://pic.javct.net/poster/20222612/1672975045.jpg,https://javct.net/v/huntb-443-rm,150,2026-05-02
DASD-677,Solitary Yu Shinoda Hasumi Claire,https://pic.javct.net/poster/04112026/1777090899.jpg,https://javct.net/v/dasd-677,120,2026-05-02
FC2PPV-4878542-RM,"[4th year, Faculty of Economics, Waseda University] Good friend JD, close to graduation, fucked and creampied 4P orgy [Uncensored L**ked]",https://pic.javct.net/poster/04112026/1775953348.jpg,https://javct.net/v/fc2ppv-4878542-rm,83,2026-05-02
JUR-208-SUB,I Thrust My Dick Into My Cheating Wife Kana And Her Partner Misaki And Made Them Understand In Their Uteruses. [English Subtitle],https://pic.javct.net/poster/20250903/1742488765.jpg,https://javct.net/v/jur-208-sub,130,2026-05-02
MVG-159,"Nishida Karina, A Pathetic, Perverted Masochistic Woman Who Gets Turned On By Same-sex Humiliation And Bullying, And Whose Pussy Gets Wet.",https://pic.javct.net/poster/04112026/1777047912.jpg,https://javct.net/v/mvg-159,155,2026-05-02
SVDVD-678,Completion Wife IN Lesbattle,https://pic.javct.net/poster/04112026/1777041842.jpg,https://javct.net/v/svdvd-678,125,2026-05-02
URKK-052-RM,Get Off At Least 10 Times! Aphrodisiac Sex Salon With Big Titty Girls Whose Huge Boobs Shake And Bounce As They Cum! They'll Let You Cum Inside Of Them As Much As You Want! Rino Yuki [Uncensored L**ked],https://pic.javct.net/poster/20212011/1641616600.jpg,https://javct.net/v/urkk-052-rm,136,2026-05-02
HAR-076-RM,Girls Who Are More Liberal Than Ordinary People Athlete People Doubled Pleasant Sensation Due To The Effect Of Aphrodisiac Oil And Sprinkle At The God Wightly Position [Uncensored L**ked],https://pic.javct.net/poster/04112026/5a4eee5d19.jpg,https://javct.net/v/har-076-rm,130,2026-05-02
MIDA-611-RM,"""Is A Cute Kiss Not Enough?"" A Devilish Tongue Kiss That Drives Men Wild, A Love That Leaves Them Drooling, Licking, Sucking, And Drowning In Saliva, A Rejuvenating Reflexology Session With Shiraishi Nami. [Uncensored L**ked]",https://pic.javct.net/poster/04112026/a5f0e6c0d4.jpg,https://javct.net/v/mida-611-rm,120,2026-05-02
MNGS-051-RM,"The Masseuse Massaged My Sensitive Private Parts So Intensely That I Couldn't Control My Pleasure And My Urethra Burst, Spraying A Massive Load Of Orgasmic Fluid Onto The Curtain, And I Got NTR'd... Ayatsuki Nanao [Uncensored L**ked]",https://pic.javct.net/poster/04112026/2037536efc.jpg,https://javct.net/v/mngs-051-rm,170,2026-05-02
URKK-050-RM,Get At Least 10 Shots Off!! Big Tits Aphrodisiac Salon Where Endless Creampies Possible As Big Tits Shake. Misono Mizuhara [Uncensored L**ked],https://pic.javct.net/poster/20212011/1639218234.jpg,https://javct.net/v/urkk-050-rm,123,2026-05-02
WO-025-RM,Masochistic Girl: Toy To**ure Lecture - Sae Niwa [Uncensored L**ked],https://pic.javct.net/poster/04112026/4c4c2215fe.jpg,https://javct.net/v/wo-025-rm,130,2026-05-02
MNGS-051,"The Masseuse Massaged My Sensitive Private Parts So Intensely That I Couldn't Control My Pleasure And My Urethra Burst, Spraying A Massive Load Of Orgasmic Fluid Onto The Curtain, And I Got NTR'd... Ayatsuki Nanao",https://pic.javct.net/poster/04112026/2037536efc.jpg,https://javct.net/v/mngs-051,170,2026-05-02
MIDA-611,"""Is A Cute Kiss Not Enough?"" A Devilish Tongue Kiss That Drives Men Wild, A Love That Leaves Them Drooling, Licking, Sucking, And Drowning In Saliva, A Rejuvenating Reflexology Session With Shiraishi Nami.",https://pic.javct.net/poster/04112026/a5f0e6c0d4.jpg,https://javct.net/v/mida-611,120,2026-05-02
DDH-392-RM,Karen & Saya [Uncensored L**ked],https://pic.javct.net/poster/04112026/269a0d7ad2.jpg,https://javct.net/v/ddh-392-rm,67,2026-05-02
BBTU-014-RM,Writhing Pleasure Bouncing Titty Oil Massage Slow Titty Fucking & Slow Sex Miu Arioka [Uncensored L**ked],https://static.javct.net/poster/1623926716.jpg,https://javct.net/v/bbtu-014-rm,144,2026-05-02
JUY-297-RM,Married Woman Babes Are Hooked On The Pleasure They Get From This Lusty Massage Parlor Ryoko Furusawa [Uncensored L**ked],https://pic.javct.net/poster/20220707/1659839138.jpg,https://javct.net/v/juy-297-rm,147,2026-05-02
MOND-256-RM,The Beautiful Neighborhood Wife Is Sae Fujiki [Uncensored L**ked],https://pic.javct.net/poster/20230908/1694233985.jpg,https://javct.net/v/mond-256-rm,140,2026-05-02
XRW-633-RM,Shock AV Appeared! Sudden Shemale Binika! Japanese Bondage Master Rectangle Chapter 4 KANNA [Uncensored L**ked],https://pic.javct.net/poster/04112026/f2da6c3dae.jpg,https://javct.net/v/xrw-633-rm,125,2026-05-02
URKK-048-RM,"At Least 10 Cum Shots Of Nookie!! Welcome To The Big Tits Aphrodisiac Salon, Where You Can Get As Many Creampie Cum Shots As You Like While They Jiggle And Wiggle Their Big Tits While You Cum Like Crazy Yuria Hakaze [Uncensored L**ked]",https://pic.javct.net/poster/20212709/1636256031.jpg,https://javct.net/v/urkk-048-rm,132,2026-05-02
SAN-450-RM,What If There Was A Men's Spa Where You Could Have A Real Experience Like This? [Uncensored L**ked],https://pic.javct.net/poster/04112026/f7626ccee5.jpg,https://javct.net/v/san-450-rm,115,2026-05-02
FC2PPV-4890878,"Case #130 where an amateur came to do naughty things with her face exposed. The case of Yui-chan (20), a JD who works part-time at a cute bar with a graceful and charming style.",https://pic.javct.net/poster/04112026/a52fe5aece.jpg,https://javct.net/v/fc2ppv-4890878,59,2026-05-02
FC2PPV-4890500,[Individual shooting] Because I don't usually reply.. Raw sex with a married woman who came for an AV interview,https://pic.javct.net/poster/04112026/526fb767a9.jpg,https://javct.net/v/fc2ppv-4890500,28,2026-05-02
CBD-010-RM,Kiyoshi Kayama Badass Than Sitting [Uncensored L**ked],https://pic.javct.net/poster/04112026/deaa5627de.jpg,https://javct.net/v/cbd-010-rm,100,2026-05-02
ONED-268-RM,Maria Ozawa Barely There Mosaic × Number One Style Rookie [Uncensored L**ked],https://pic.javct.net/poster/04112026/b5c3a511ab.jpg,https://javct.net/v/oned-268-rm,120,2026-05-02
JBD-216-RM,Sacrifice Rope. Aki Sasaki [Uncensored L**ked],https://pic.javct.net/poster/20212011/1643592133.jpg,https://javct.net/v/jbd-216-rm,120,2026-05-02
NVH-077-RM,Bound And Imprinted With The Pleasure Of Female Orgasm! Beautiful Madness! Transgender Reverse Anal Sex Saotome Chika [Uncensored L**ked],https://pic.javct.net/poster/04112026/1776445825.jpg,https://javct.net/v/nvh-077-rm,175,2026-05-02
BF-444,Submission Of Bondage M Woman Straightening Club Manami Yoshikawa,https://pic.javct.net/poster/04112026/1776668054.jpg,https://javct.net/v/bf-444,120,2026-05-02
NVH-077,Bound And Imprinted With The Pleasure Of Female Orgasm! Beautiful Madness! Transgender Reverse Anal Sex Saotome Chika,https://pic.javct.net/poster/04112026/1776445825.jpg,https://javct.net/v/nvh-077,175,2026-05-02
OBA-047-RM,Fakecest: Takashi's Mother is a Perverted MILF ( Chiaki Takeshita ) [Uncensored L**ked],https://pic.javct.net/poster/20221202/1646448049.jpg,https://javct.net/v/oba-047-rm,117,2026-05-02
EKDV-604,Mitani Akari's M Man Ejaculation Play,https://pic.javct.net/poster/06032026/1775640099.jpg,https://javct.net/v/ekdv-604,140,2026-05-02
MACB-019,"Dirty Beloved Wife Even Though It Is A Neat And Beautiful Figure, She Wakes Up In A Pervert Play And Ascends Ascendingly Rina Minami",https://pic.javct.net/poster/06032026/1775610627.jpg,https://javct.net/v/macb-019,119,2026-05-02
MACB-015,"""I'm Sorry, This Is The Real Me."" Squeezing Semen With A Beautiful Wife Duero Tongue Who Wants To Train Oji! Hibiki Otsuki",https://pic.javct.net/poster/06032026/1775610554.jpg,https://javct.net/v/macb-015,120,2026-05-02
DRPT-108-RM,Sensory Deprivation: Undercover Agent Hazuki Noa Attempts To Overcome A Crisis By Numbing Herself From The Neck Down. [Uncensored L**ked],https://pic.javct.net/poster/06032026/1775155373.jpg,https://javct.net/v/drpt-108-rm,115,2026-05-02
300MIUM-1326-RM,"[I'll lend you a super masochistic woman] Hey, how long have you been flirting? A masochist woman who can't stop laughing because she's so happy when someone gets mean to her [Uncensored L**ked]",https://pic.javct.net/poster/06032026/1774855001950.jpg,https://javct.net/v/300mium-1326-rm,111,2026-05-02
DRPT-108,Sensory Deprivation: Undercover Agent Hazuki Noa Attempts To Overcome A Crisis By Numbing Herself From The Neck Down.,https://pic.javct.net/poster/06032026/1775155373.jpg,https://javct.net/v/drpt-108,115,2026-05-02
EMBZ-174-RM,Aphrodisiac Oil Bondage Beautiful Wife Shook Shrimp Warp Seizure Squirt! Ripe Crazy Ripe Woman! ! Yagi Azusa [Uncensored L**ked],https://pic.javct.net/poster/20241902/1708345666.jpg,https://javct.net/v/embz-174-rm,130,2026-05-02
300MIUM-1326,"[I'll lend you a super masochistic woman] Hey, how long have you been flirting? A masochist woman who can't stop laughing because she's so happy when someone gets mean to her",https://pic.javct.net/poster/06032026/1774855001950.jpg,https://javct.net/v/300mium-1326,111,2026-05-02
FC2PPV-4871332,"[No] Adorable and cute foreign office lady Reina-chan Chapter 5, bondage training by two people, her special sexual tendencies are released wide open**, her pussy is fully opened, her whole body convulses with electric massager, then raw copulation first part [Overseas version] bonus included",https://pic.javct.net/poster/06032026/1774847610.jpg,https://javct.net/v/fc2ppv-4871332,61,2026-05-02
GVG-697-RM,"Shameful Hot Springs Trip, Rika Mari [Uncensored L**ked]",https://pic.javct.net/poster/20222109/1665658459.jpg,https://javct.net/v/gvg-697-rm,118,2026-05-02
HBAD-378-RM,"He Wants A Sexy And Young Woman, But It Has To Be A Son's Wife This Horny Father-In-Law Has Tied Up His Daughter-In-Law So He Can Satisfy His Lust On Her Yu Konishi [Uncensored L**ked]",https://pic.javct.net/poster/20221904/1652921546.jpg,https://javct.net/v/hbad-378-rm,120,2026-05-02
MUM-185-RM,First Birds From Everyone Ass.Unused Rim Of 138cm.It Is Suddenly Tied Anal R**e. Chiharu PP (shaved) [Uncensored L**ked],https://pic.javct.net/poster/06032026/1774218176.jpg,https://javct.net/v/mum-185-rm,160,2026-05-02
WANZ-128,SEX Forest Nanako Take Self - Portrait Saddle Etch Love Your Sister,https://pic.javct.net/poster/06032026/1774172731.jpg,https://javct.net/v/wanz-128,120,2026-05-02
