code,title,image_url,page_url,views,date_scraped
SONE-634-SUB,"On A Business Trip, She Unexpectedly Shares A Room With Her Middle-aged, Sexually Harassing Boss, Whom She Despises... I-cup Rookie Employee Shino Mayu Is Caught Off Guard By The Intense Sexual Intercourse That Continues Until The Morning [English Subtitle]",https://pic.javct.net/poster/20253001/1741285553.jpg,https://javct.net/v/sone-634-sub,120,2026-05-02
BBTU-017-RM,The Masochist With Shaved Pubes. Chitose Yuki [Uncensored L**ked],https://static.javct.net/poster/1626319203.jpg,https://javct.net/v/bbtu-017-rm,120,2026-05-02
MANX-030-RM,New Ultimate Subjective JOI: 7 Days Of Lewd Language Control And Aching-Focused Version - Ayumi Ryo [Uncensored L**ked],https://pic.javct.net/poster/04112026/1ff93fd59b.jpg,https://javct.net/v/manx-030-rm,100,2026-05-02
CHN-199-RM,I Will Lend You A New Amateur Girl. 96 Pseudonym) Nana Matsuwaka (Professional Student) 21 Years Old. [Uncensored L**ked],https://pic.javct.net/poster/04112026/f68e8cdd74.jpg,https://javct.net/v/chn-199-rm,135,2026-05-02
BOBB-386-RM,"Rental Boobs Mama Has Arrived! 2 Days Of Dreams To Heal With A Huge Breast Surrogate Mom Dispatch Service! Boin ""Rina Ayana"" Box [Uncensored L**ked]",https://pic.javct.net/poster/20230804/1693542705.jpg,https://javct.net/v/bobb-386-rm,120,2026-05-02
VGD-211,Rin RIN Sakura Masarin,https://pic.javct.net/poster/04112026/5879638a91.jpg,https://javct.net/v/vgd-211,130,2026-05-02
BBTU-016-RM,Boobie Gal Bitch Shuri Hazuki [Uncensored L**ked],https://static.javct.net/poster/1626396480.jpg,https://javct.net/v/bbtu-016-rm,105,2026-05-02
AKDL-056,[Off-paco video] A bitch layer who is as cute as an idol but gets naughty when she drinks: Kanon Kanon Kanon,https://pic.javct.net/poster/04112026/13d931ee98.jpg,https://javct.net/v/akdl-056,60,2026-05-02
PRTD-021,Decoy Investigator Yu - Ya Risa Sneak In Case - Yu Shinoda,https://pic.javct.net/poster/04112026/a7c65a7f52.jpg,https://javct.net/v/prtd-021,120,2026-05-02
MIGD-592,Anal Bukkake FUCK NOW! Takizawa Canon,https://pic.javct.net/poster/04112026/e68f3d4fa9.jpg,https://javct.net/v/migd-592,120,2026-05-02
FC2PPV-4890800,"[No repurchase] J cup busty beauty's first shot, intense sex with 2 black and white thick cocks, 2 consecutive creampies in sweaty hardcore 3P [Overseas version] Bonus included",https://pic.javct.net/poster/04112026/bf220c12b1.jpg,https://javct.net/v/fc2ppv-4890800,62,2026-05-02
MIAD-981,Convulsions Climax Silent Les × Up Help Call In Rough Has Been Been Afraid That Being Labeled Fucked K**led Press The Voice Was School Girls Yuri Asada,https://pic.javct.net/poster/04112026/05ec0ba910.jpg,https://javct.net/v/miad-981,150,2026-05-02
MIGD-590,Gangbang Ichinose Tin Out School Girls Human Body During Fixation,https://pic.javct.net/poster/04112026/d5d85d06c3.jpg,https://javct.net/v/migd-590,150,2026-05-02
START-561V-RM,[Bonus Edition] I left Suzu Honjo in my serious university bike racer. [Uncensored L**ked],https://pic.javct.net/poster/04112026/f0044d2a2a.jpg,https://javct.net/v/start-561v-rm,279,2026-05-02
IESP-617-RM,Mihono Home To Assault Visit!Pies 20 Barrage [Uncensored L**ked],https://pic.javct.net/poster/04112026/75e495ba84.jpg,https://javct.net/v/iesp-617-rm,130,2026-05-02
FC2PPV-4888525,[Face showing double creampie pregnancy] A married woman with huge breasts that is beyond measurable K-cups is in agony 3P. She is played with by two cocks and drowns in the pussy juice overflowing from her genitals.,https://pic.javct.net/poster/04112026/a8e51aad83.jpg,https://javct.net/v/fc2ppv-4888525,44,2026-05-02
START-561,I left Suzu Honjo in my real college biker.,https://pic.javct.net/poster/04112026/b34d9d55e6.jpg,https://javct.net/v/start-561,256,2026-05-02
SDAB-110-RM,"7 Hours Until The Curfew, A Long Day That Was Stuck In Twelve Insect Fathers Ji ○ Po And Gathered In A Beautiful Girl Of Exquisite Body [Uncensored L**ked]",https://pic.javct.net/poster/04112026/01b311d463.jpg,https://javct.net/v/sdab-110-rm,130,2026-05-02
AP-576-RM,"""Call Me A Friend You Came With If You Do Not Want To Get Pregnant Inside Out!""Mengoku Juvenile Training School Girls University Student Cumshot Creature Gangbang 10 People Big Chain SP! [Uncensored L**ked]",https://pic.javct.net/poster/07202025/1753935344.jpg,https://javct.net/v/ap-576-rm,220,2026-05-02
MIAD-819-RM,Absolutely The Girl Hunt Trespassing Frightened Fallen Death Gangbang Family Secret Of The Hide-and-seek Natsume Airi [Uncensored L**ked],https://pic.javct.net/poster/04112026/6116bba10c.jpg,https://javct.net/v/miad-819-rm,120,2026-05-02
NMSL-038-RM,"""Please impregnate me... Please..."" Prisoner Creampie Seeding Prison Akari Niimura [Uncensored L**ked]",https://pic.javct.net/poster/04112026/1776988359652.jpg,https://javct.net/v/nmsl-038-rm,150,2026-05-02
SIMW-006-RM,Kaho & Rin [Uncensored L**ked],https://pic.javct.net/poster/04112026/1777082672410.jpg,https://javct.net/v/simw-006-rm,96,2026-05-02
FC2PPV-4886269,Participating in a couple exchange circle Perverted couple fetish Explosive creampie seeding orgy,https://pic.javct.net/poster/04112026/8194f8671a.jpg,https://javct.net/v/fc2ppv-4886269,62,2026-05-02
MEYD-994-SUB,Yumemi Kanae 111 Minutes Of Non-stop Bukkake And 17 Creampies!! Super Climax X Big Orgy SPECIAL [English Subtitle],https://pic.javct.net/poster/20250903/1744304660.jpg,https://javct.net/v/meyd-994-sub,120,2026-05-02
NHDTB-687-RM,"Cafe Girl Chain Slut  4 Beads Tethered Using A Fallen Compliant Clerk In The Store  Plan + That Beautiful Girl Byte Tie After The Job Change, Completely Taken Down SP [Uncensored L**ked]",https://pic.javct.net/poster/20221108/1660193750.jpg,https://javct.net/v/nhdtb-687-rm,240,2026-05-02
MIMK-267-RM,Series Cumulative Sales Of 8 Million Copies: Karamizakari Reunion Edition [MOODYZ 25th Anniversary Work] Mio Ishikawa [Uncensored L**ked],https://pic.javct.net/poster/04112026/4c0c65a83f.jpg,https://javct.net/v/mimk-267-rm,120,2026-05-02
MIDA-623-RM,"When My Tutor, Ms. Sakura, Found Out I'm Abstaining From Masturbation, She Gave Me A Seductive, Wet Look... ""Just A Blowjob Wouldn't Be Cheating, Right?""... And To Make Matters Worse, It Looks Like There's Going To Be A Torrential Downpour Tonight That Will Make It Difficult To Get Home... (crying) Kawaguchi Sakura [Uncensored L**ked]",https://pic.javct.net/poster/04112026/46845ce8a3.jpg,https://javct.net/v/mida-623-rm,120,2026-05-02
ONED-384-RM,Barely One In Six Pakopako Costume! Maria Ozawa [Uncensored L**ked],https://pic.javct.net/poster/04112026/81272659d3.jpg,https://javct.net/v/oned-384-rm,120,2026-05-02
MIGD-521-RM,"Great Tit, MANIAX Cove Manami Injection Amazing Clamping [Uncensored L**ked]",https://pic.javct.net/poster/01202026/1772592258.jpg,https://javct.net/v/migd-521-rm,180,2026-05-02
HALE-029-RM,"Eating Mama's Friends Infinite Loop Vol.24 Mari Female Ana-type Moms Are Intellectual, Fair-skinned And Get Wet Easily... [Uncensored L**ked]",https://pic.javct.net/poster/20230908/1694838650.jpg,https://javct.net/v/hale-029-rm,137,2026-05-02
SVN-002-RM,Blowjob Girl Pacifier Poisoning Uniform Fertilization Miru Machida [Uncensored L**ked],https://pic.javct.net/poster/20230908/1694315350.jpg,https://javct.net/v/svn-002-rm,122,2026-05-02
XVSR-221-RM,61 Days From The Lost Virgin ... Today Is My First Iki Anniversary Yuhanamoe [Uncensored L**ked],https://pic.javct.net/poster/04112026/34e1bc4227.jpg,https://javct.net/v/xvsr-221-rm,120,2026-05-02
CHN-197-RM,I Will Lend You A New Amateur Girl. 95 Pseudonym) Suzune Akimoto (supermarket / Clerk) 20 Years Old [Uncensored L**ked],https://pic.javct.net/poster/04112026/7ca1e24551.jpg,https://javct.net/v/chn-197-rm,135,2026-05-02
MNTL-006-RM,Fifth Perverted H-cup Chubby Flesh-pot Woman: Mito Ririna [Uncensored L**ked],https://pic.javct.net/poster/04112026/ae088c024a.jpg,https://javct.net/v/mntl-006-rm,122,2026-05-02
MIDA-623,"When My Tutor, Ms. Sakura, Found Out I'm Abstaining From Masturbation, She Gave Me A Seductive, Wet Look... ""Just A Blowjob Wouldn't Be Cheating, Right?""... And To Make Matters Worse, It Looks Like There's Going To Be A Torrential Downpour Tonight That Will Make It Difficult To Get Home... (crying) Kawaguchi Sakura",https://pic.javct.net/poster/04112026/46845ce8a3.jpg,https://javct.net/v/mida-623,120,2026-05-02
MIDA-612,"Bullied **ds R**e Each Other ~I Was Relentlessly R**ed By Both The Bully And The Bullied **d Who Was Ordered To Do It, And I Came Over And Over Again While Crying~ Kira Hoshi",https://pic.javct.net/poster/04112026/12f772dd3d.jpg,https://javct.net/v/mida-612,120,2026-05-02
CAWD-977,"Too Erotic, It's Deadly! A Truly Beautiful Girl With An Overwhelming 55cm Waist And Miraculous Natural G-cup Breasts Awakens To A Massive Orgasm In This Pornographic Film Featuring 16 Facial Cumshots. Honma Asami",https://pic.javct.net/poster/04112026/8f9b6b8322.jpg,https://javct.net/v/cawd-977,130,2026-05-02
MIDA-615,"My Serious And Quiet C**ldhood Friend Shyly Tempts Me With A Panty Flash, Blushing And Showing Her Love. My Intense Gaze Makes Her Excited And Wet! Inoue Momo",https://pic.javct.net/poster/04112026/edd4b870f7.jpg,https://javct.net/v/mida-615,150,2026-05-02
MIMK-267,Series Cumulative Sales Of 8 Million Copies: Karamizakari Reunion Edition [MOODYZ 25th Anniversary Work] Mio Ishikawa,https://pic.javct.net/poster/04112026/4c0c65a83f.jpg,https://javct.net/v/mimk-267,120,2026-05-02
PGD-183-RM,Cohabitation And Living With You In The Eye She H Nao Yoshizaki 100%. [Uncensored L**ked],https://pic.javct.net/poster/04112026/d927ea2592.jpg,https://javct.net/v/pgd-183-rm,110,2026-05-02
NHDTB-748-RM,Cafe Girl Chain Slut 5 A Chained Slut Plan That Uses A Satisfied Clerk Who Has Fallen Into The Shop During Business [Uncensored L**ked],https://pic.javct.net/poster/20230207/1688614801.jpg,https://javct.net/v/nhdtb-748-rm,175,2026-05-02
NSFS-052-SUB,The Wife Who Was Creampied By Her Husband's Colleague [English Subtitle],https://pic.javct.net/poster/20212011/1640413569.jpg,https://javct.net/v/nsfs-052-sub,123,2026-05-02
JUX-900-RM,R**ed By Father-In-Law Every Day... Aoi Kasahara [Uncensored L**ked],https://pic.javct.net/poster/20221202/1646614670.jpg,https://javct.net/v/jux-900-rm,118,2026-05-02
MRSS-059-RM,"My Neighbor Was Making Too Much Noise, So My Wife And I Went Over To Complain, And It Turned Out To Be A Hangout For DQN Bad Boys. They Got Super Mad And Started Creampie Fucking My Wife, But I Was Too Scared To Do Anything About It. An Mashiro [Uncensored L**ked]",https://pic.javct.net/poster/20221904/1653273373.jpg,https://javct.net/v/mrss-059-rm,115,2026-05-02
VENX-004-RM,"I Mistook My Stepmom's Booty For My Wife's From Behind, And Stuck My Dick In Her By Accident. Ayane Sezaki [Uncensored L**ked]",https://pic.javct.net/poster/20220707/1657247125.jpg,https://javct.net/v/venx-004-rm,96,2026-05-02
VOSS-187-RM,"This Horny Housewife Lured My Ugly Ass To Temptation Because Her Husband Has Cuckold Fantasies, But She Enjoyed Fucking Me So Much She Decided To Be My Woman! 2 I Was Secretly In Love With Her, So I Was All For It. And I Had Myself A Wild Creampie Good Time, Not Realizing That Her Husband Was Peeping On Us The Whole Time. And Then She Told Me That She Loved Me!! [Uncensored L**ked]",https://pic.javct.net/poster/20212011/1638927256.jpg,https://javct.net/v/voss-187-rm,106,2026-05-02
MRSS-079-RM,"This Horny Housewife Didn't Like Old Men, But She Got Cuckold Fucked By A Dirty Old Man And Creampie Fucked To Oblivion Miho Tono [Uncensored L**ked]",https://pic.javct.net/poster/20222109/1665545758.jpg,https://javct.net/v/mrss-079-rm,127,2026-05-02
VENX-101-RM,He Mistook His Resting Mother-in-law's Ass For His Wife's Ass And Inserted It Immediately Without Knowing She Was His Mother-in-law. Chisato Shoda [Uncensored L**ked],https://pic.javct.net/poster/20212011/1640339394.jpg,https://javct.net/v/venx-101-rm,93,2026-05-02
VENX-042-RM,"I Mistook My Resting Mother-In-Law's Ass For My Wife's, And Stuck My Dick Right In Without Knowing It Was Actually My Mother-In-Law. Yuna Kitano [Uncensored L**ked]",https://static.javct.net/poster/1622869942.jpg,https://javct.net/v/venx-042-rm,106,2026-05-02
VEC-395-RM,Mother Loses Her Pride Being Ravaged By Son's Classmate Rin Chibana [Uncensored L**ked],https://pic.javct.net/poster/20222109/1664709736.jpg,https://javct.net/v/vec-395-rm,100,2026-05-02
GVH-398-RM,"Development Of Vaginal Orgasms. 3 Nights, 4 Days. Ena Satsuki [Uncensored L**ked]",https://pic.javct.net/poster/20221904/1651296863.jpg,https://javct.net/v/gvh-398-rm,132,2026-05-02
VENU-890-RM,A Retired And Bored And Horny Father-In-Law Fucks With His Daughter-In-Law Tsubasa Haneda [Uncensored L**ked],https://pic.javct.net/poster/20221108/1663034250.jpg,https://javct.net/v/venu-890-rm,84,2026-05-02
JUY-865-RM,Madonna Exclusive Hot Mature Woman!! Married Woman's Lust Fuck Dripping With Immorality!! Husband Doesn't Know -My Dirty Lust And Secret- Maki Hojo [Uncensored L**ked],https://pic.javct.net/poster/20221904/1651553483.jpg,https://javct.net/v/juy-865-rm,119,2026-05-02
HOMA-109-RM,"I Was Celibate For A Month, And Now I Was Ready To Burst, And That Night, While My Girlfriend Was Away, My Girlfriend's Best Friend Ran Away From Home With Me, And Together, We Lost Our Minds In A Furious Evening Of Sex Ai Mukai [Uncensored L**ked]",https://pic.javct.net/poster/20212308/1632577046.jpg,https://javct.net/v/homa-109-rm,123,2026-05-02
AMBI-150-RM,I Asked A Friend For Relationship Advice And Ended Up Learning How To Fuck! Starring Urara Kanon [Uncensored L**ked],https://pic.javct.net/poster/20212011/1644065761.jpg,https://javct.net/v/ambi-150-rm,127,2026-05-02
VEC-389-RM,Tits Taken While Supporting - Eri Takikawa's NTR Beloved Big Tits Were Rubbed All Over By My Friend Before He Creampied Her! [Uncensored L**ked],https://pic.javct.net/poster/20212011/1639563882.jpg,https://javct.net/v/vec-389-rm,93,2026-05-02
JUX-891-RM,Her Trampled Chastity AIKA [Uncensored L**ked],https://pic.javct.net/poster/20221904/1651027177.jpg,https://javct.net/v/jux-891-rm,120,2026-05-02
SONE-613-SUB,"Karen Ishida, a terrestrial TV idol who ends up sharing a room with a middle-aged sexually harassing producer she despises on location... She is caught off guard by the intense sexual intercourse that continues until the morning [English Subtitle]",https://pic.javct.net/poster/20253001/1738865833.jpg,https://javct.net/v/sone-613-sub,151,2026-05-02
GVH-285-RM,Fucked By Fans Who Found Out That I Am A Porn Star Ai Mukai [Uncensored L**ked],https://pic.javct.net/poster/20212308/1630471757.jpg,https://javct.net/v/gvh-285-rm,125,2026-05-02
NGOD-037-RM,"Please Listen To My Tale Of Infidelity My Wife And I Had A Fight, And She Ran Out Of The House And Went To My Old Friend(I Thought I Could Trust Him) And Spent 2 Nights Fucking Him Mao Hamasaki [Uncensored L**ked]",https://pic.javct.net/poster/20221108/1661781710.jpg,https://javct.net/v/ngod-037-rm,120,2026-05-02
SSNI-739-RM,My Little Girlfriend With Light Skin Is Getting Ridden Like A Horse By My Horse-Hung Friend And Enjoying Being Cuckold Fucked Shihori Kotoi [Uncensored L**ked],https://pic.javct.net/poster/20221904/1652582839.jpg,https://javct.net/v/ssni-739-rm,117,2026-05-02
HMN-024-RM,Whispered Temptation Leads To Creampie Sex Right Beside Your Girlfriend Ai Mukai [Uncensored L**ked],https://static.javct.net/poster/hmn-024.jpg,https://javct.net/v/hmn-024-rm,177,2026-05-02
DASD-968-RM,"Right Next To Me, My Girlfriend Is Getting Fucked. ""Reverse Rough Fuck By A Cleaner Who Was Made Fun Of"" - Luna Tsukino [Uncensored L**ked]",https://pic.javct.net/poster/20212011/1643954311.jpg,https://javct.net/v/dasd-968-rm,120,2026-05-02
FC2PPV-4884888,[No *High quality Yui 22 years old Nogi◯ beauty's anal licking] Nogi◯ beauty tries anal licking The cute girl licks the anus so much that she gives a blowjob and releases a large amount of the old man's sperm ♡ Anal licking feels so good that the sperm splattered on her face lol,https://pic.javct.net/poster/04112026/1776755796.jpg,https://javct.net/v/fc2ppv-4884888,60,2026-04-25
FC2PPV-4884649,"[Uncensored] Gravure idol Aiko, 24 years old, the distance is too close to show off her beautiful breasts, and on nights when she can't say anything",https://pic.javct.net/poster/04112026/1776755525.jpg,https://javct.net/v/fc2ppv-4884649,25,2026-04-25
10-042126-01,Collects the cum that was sprayed on her face and tastes every drop,https://pic.javct.net/poster/04112026/1776755750.jpg,https://javct.net/v/10-042126-01,09,2026-04-25
HZ-3829,Beauty Collection Vol.117 - Meirin,https://pic.javct.net/poster/04112026/1776755601.jpg,https://javct.net/v/hz-3829,59,2026-04-25
CR-042126-001,The tragedy of a wife who repays her husband's debts with her body,https://pic.javct.net/poster/04112026/1776755732.jpg,https://javct.net/v/cr-042126-001,61,2026-04-25
1P-042126-001,Happy Around in School! : Luxury Spa Club,https://pic.javct.net/poster/04112026/1776755765.jpg,https://javct.net/v/1p-042126-001,60,2026-04-25
FC2PPV-4884772,[Uncensored/Complete amateur/Creampie/Squirting] Neat and innocent 149cm short girl in uniform She's so cute that she inserts herself into a vagina that tightens so tight that you push her back and gives her a rich creampie ♡,https://pic.javct.net/poster/04112026/1776755692.jpg,https://javct.net/v/fc2ppv-4884772,14,2026-04-25
FC2PPV-4884691,"[Uncensored] Big-breasted receptionist Sayaka, 25 years old, her response is not a job, but a sex video record that is destroyed by a too polite distance",https://pic.javct.net/poster/04112026/1776755717.jpg,https://javct.net/v/fc2ppv-4884691,18,2026-04-25
FC2PPV-4884935,[Amateur's first shot] Sumire (18) 163 cm 47 kg D cup and the cutest shooting data was collected from the forehead camera's first person perspective video,https://pic.javct.net/poster/04112026/1776733868.jpg,https://javct.net/v/fc2ppv-4884935,66,2026-04-25
FC2PPV-4884375,"[Slender] A Kansai guy woke up after having sex for the first time in 2 years. He wanted more. He couldn't help but squirt at the overflowing moans. Two consecutive creampies, and a strong squirting finish.",https://pic.javct.net/poster/04112026/1776733779.jpg,https://javct.net/v/fc2ppv-4884375,63,2026-04-25
10-041926-01,Treasured Pussy Selection: Ai Nakano,https://pic.javct.net/poster/04112026/1776669419.jpg,https://javct.net/v/10-041926-01,14,2026-04-25
CR-042026-001,SEX establishment in which staff dress in costumes,https://pic.javct.net/poster/04112026/1776669371.jpg,https://javct.net/v/cr-042026-001,59,2026-04-25
FC2PPV-4883860,"[Limited Uncensored] A hole is made in the official layer condom of the fireworks costume, and she impregnates him on a dangerous day and accepts the invitation and has sex with him...♡ [Fireworks/Collapse Star Rail]",https://pic.javct.net/poster/04112026/1776645835.jpg,https://javct.net/v/fc2ppv-4883860,27,2026-04-25
FC2PPV-4883599,"[Complete secret version] [I cup] [Big breasts] [Creampie] Haruka, a new I cup graduate employee, was fo**ed to leave the company due to escalating harassment from her colleagues and boss [Chapter 1]",https://pic.javct.net/poster/04112026/1776576303.jpg,https://javct.net/v/fc2ppv-4883599,112,2026-04-25
FC2PPV-4883692,"[Uncensored] Hostess Marin, 23 years old, at first it was meant to be light, but before she knew it, the sex had become intense and she couldn't get out of it.",https://pic.javct.net/poster/04112026/1776576339.jpg,https://javct.net/v/fc2ppv-4883692,36,2026-04-25
HZ-3830,Asi-Hame!! Vol.26 - Zhang,https://pic.javct.net/poster/04112026/1776576140.jpg,https://javct.net/v/hz-3830,61,2026-04-25
FC2PPV-4878741,[Uncensored] ** The hidden face of nursery teacher Yumi (22)... Her secret is too neat,https://pic.javct.net/poster/04112026/1776576108.jpg,https://javct.net/v/fc2ppv-4878741,17,2026-04-25
FC2PPV-4882927,[Resale] [Mawashi Project] Here is a divine work full of F-cup beauties whose erotic marshmallow bodies make you irresistible no matter what you wear.,https://pic.javct.net/poster/04112026/1776570068.jpg,https://javct.net/v/fc2ppv-4882927,78,2026-04-25
FC2PPV-4879997,"[Uncensored] Ayame (27) Secretary with big breasts and beautiful breasts, intimate private life that is not usually shown",https://pic.javct.net/poster/04112026/1776576189.jpg,https://javct.net/v/fc2ppv-4879997,16,2026-04-25
FC2PPV-4883529,"380_[Dirty language graffiti] Thank you for her retirement, Runa-chan. Pervert dirty words graffiti on her super dynamite body. At the end, the three actors make Runa-chan enjoy her body to their heart's content. Creampie 4P Runa-chan Chapter 10 [Overseas version]",https://pic.javct.net/poster/04112026/1776569680.jpg,https://javct.net/v/fc2ppv-4883529,58,2026-04-25
HZ-3827,Perverted Maid Turns Into A Nympho With Her Master's Junk - Kaede Takagaki,https://pic.javct.net/poster/04112026/1776487863.jpg,https://javct.net/v/hz-3827,61,2026-04-25
10-041826-01,SEX within seconds of meeting : Ai Nakano,https://pic.javct.net/poster/04112026/1776487893.jpg,https://javct.net/v/10-041826-01,47,2026-04-25
MOOR-062,"Nonoka, Who Loves Being Filmed While Being Violated",https://pic.javct.net/poster/04112026/521e398538.jpg,https://javct.net/v/moor-062,120,2026-05-02
XVSR-877,"The More You Tease Her Nipples, The More Sensitive They Become And The Wetter They Get! Nipple Training Sex With A Perverted Masochistic Woman - Kitano Mina",https://pic.javct.net/poster/04112026/c611d70568.jpg,https://javct.net/v/xvsr-877,110,2026-05-02
MDHR-002-RM,"Cumming Addict! The Most Insane Masochistic Actress In The Industry Gets Her Mouth, Pussy, And Anus Relentlessly Penetrated In All Three Holes!! Don't You Want To See What Happens When Her Anal Sex Is Unleashed And Feels Amazing?! Tsukino Sui [Uncensored L**ked]",https://pic.javct.net/poster/04112026/433e013ea3.jpg,https://javct.net/v/mdhr-002-rm,150,2026-05-02
ENKI-094-RM,"A Solitary Perverted Woman, A Submissive Masochistic Beauty, Kept As A Pet By Her Master, A Blissfully Happy Human Toilet For Cumming Inside - Ichika [Uncensored L**ked]",https://pic.javct.net/poster/04112026/1044b4eb73.jpg,https://javct.net/v/enki-094-rm,225,2026-05-02
NHDTB-336-RM,"Immediately Irama With A Small Girl Who Lives In The Same Apartment With An Aphrodisiac. As A Result, It Becomes Horny With A Neat Face That Is Covered With Ezuki Soup. 6 [Uncensored L**ked]",https://pic.javct.net/poster/04112026/97e025d3b1.jpg,https://javct.net/v/nhdtb-336-rm,240,2026-05-02
NHDTA-562-RM,"Irama Immediately With B**od  Port That Plaster The Aphrodisiac To A Small Girl Who Lives In The Same Apartment.Result, Nasty Of Breath Face Of Juice (s) That Covered Not Kue Thread Take Motto If Ne.2. [Uncensored L**ked]",https://pic.javct.net/poster/20230302/1679252940.jpg,https://javct.net/v/nhdta-562-rm,230,2026-05-02
CAWD-983,"The Tragic Fate Of Idol-level Cute Schoolgirls In Uniforms, Impregnated By A Middle-aged Man With A Foul Odor In His Neighbor's Garbage-filled Apartment After 73 Uninterrupted Ejaculations Inside Them...",https://pic.javct.net/poster/04112026/fe432fe5b5.jpg,https://javct.net/v/cawd-983,120,2026-05-02
HR-012,"[An Anime-loving, Sensitive Blonde Cosplayer From Berlin] El Hanade Meyer (20 Years Old) With Sensitive Nipples Cums Like Crazy, Eyes Rolling Back, Her Erotic Manga Body Going Wild As She Has Sex With A Samurai Penis, Losing Consciousness And Convulsing! [Genuine Cumshot]",https://pic.javct.net/poster/04112026/ba71b76422.jpg,https://javct.net/v/hr-012,120,2026-05-02
NHDTA-731-RM,"Immediately Irama A Small Ji  Port Yelling Painted Aphrodisiac To Girls Who Live In The Same Apartment.Result, Nasty Reduction In The Thread Draw Kue Not Ki Juice Tainted Breath Face Motto If Ne.5 Pies All SP [Uncensored L**ked]",https://pic.javct.net/poster/20222311/1670118881.jpg,https://javct.net/v/nhdta-731-rm,220,2026-05-02
MDHR-002,"Cumming Addict! The Most Insane Masochistic Actress In The Industry Gets Her Mouth, Pussy, And Anus Relentlessly Penetrated In All Three Holes!! Don't You Want To See What Happens When Her Anal Sex Is Unleashed And Feels Amazing?! Tsukino Sui",https://pic.javct.net/poster/04112026/433e013ea3.jpg,https://javct.net/v/mdhr-002,150,2026-05-02
HUNBL-146-RM,Ryo A King's Game A Cruel Order That Makes Even A Self-Proclaimed Masochist Girl Want To Run Away [Uncensored L**ked],https://pic.javct.net/poster/20230908/1694145460.jpg,https://javct.net/v/hunbl-146-rm,150,2026-05-02
BHSP-033-RM,"Juice-soaked, Lustful Bodily Fluids, Sporty Girl Squirting, Clothed Sex, Cum Inside, Insemination 3 Ichika Koko [Uncensored L**ked]",https://pic.javct.net/poster/04112026/f94671243d.jpg,https://javct.net/v/bhsp-033-rm,122,2026-05-02
FC2PPV-4890847,"Sumire (18) This was the second shoot for this super cute girl. Even though she should have known what was going to be done to her, she started to cum again, so I gave her an electric massage, put it in her anus, and used a piston machine.",https://pic.javct.net/poster/04112026/0b23e4cec7.jpg,https://javct.net/v/fc2ppv-4890847,120,2026-05-02
MIAE-227,A Female Teacher Who Strikes DQN And Gets Stuck In All Four Anal Sexes Is Convulsant Lespe Shinoda Yu,https://pic.javct.net/poster/04112026/1c6c0a65b6.jpg,https://javct.net/v/miae-227,120,2026-05-02
MIAE-304,My Wife Was Taken Down By A Part-time Worker ... 2 Shinoda Yu,https://pic.javct.net/poster/04112026/85a75b6621.jpg,https://javct.net/v/miae-304,120,2026-05-02
300MIUM-1330,[I'll lend you a super masochistic woman] Her M index is too high for an average man to satisfy her... She's a genuine desireless masochist woman who holds dick in her mouth and convulses until it's time to cum. Hodai uses Hodai M. She's willing to do anything... [Masochist's home Q-bin],https://pic.javct.net/poster/04112026/7e725045db.jpg,https://javct.net/v/300mium-1330,115,2026-05-02
