code,title,image_url,page_url,views,date_scraped
MEYD-414-US,"I Went To This Sex Club That Didn't Allow Real Fucking, And To My Surprise, Out Came The Bitchy And Beautiful Married Woman From Next Door Now That I Knew Her Secret, I Could Demand Real Fucking And Creampie Sex Too! And I Fucked Her To Be My Obedient Sex Slave Outside Of The Club Too [English Subtitle, Reducing Mosaic]",https://pic.javct.net/poster/20221202/1646268354.jpg,https://javct.net/v/meyd-414-us,117,2026-03-17
SONE-574-SUB,"When your partner is in front of you, you'll be targeted by this beautiful woman who will whisper dirty talk, give you a titjob, and seduces you into an NTR (cuckold) relationship. Hikaru Nagi [English Subtitle]",https://pic.javct.net/poster/20253001/1738866422.jpg,https://javct.net/v/sone-574-sub,123,2026-03-17
SPRD-1050-RM,My Husband Told Me To Fuck Another Man Azusa Yagi [Uncensored L**ked],https://pic.javct.net/poster/20212308/1631552049.jpg,https://javct.net/v/sprd-1050-rm,150,2026-03-17
FSDSS-379-RM,My Friend's Girlfriend Has Lips That Make Me Lose All Reason As We Spend 3 Days French Kissing Deeply And Fucking Passionately While Cumming. Momo Honda [Uncensored L**ked],https://pic.javct.net/poster/20221202/1648100045.jpg,https://javct.net/v/fsdss-379-rm,120,2026-03-17
DASD-852-SUB,My Father In Law Fucks Me Because It's The Only Way My Husband Can Get Off In-House Consensual Cuckholding Yu Shinoda [English Subtitle],https://static.javct.net/poster/dasd-852.jpg,https://javct.net/v/dasd-852-sub,118,2026-03-17
HZGD-189-SUB,"""The Truth Is, Your Step Father Fucks Me Every Week On Tuesday"" An Sasakura [English Subtitle]",https://static.javct.net/poster/hzgd-189.jpg,https://javct.net/v/hzgd-189-sub,130,2026-03-17
JUY-277-RM,A Middle Aged Couple's Love Affair That Starts In The Bathtub The Wet And Wild Room Miyuki Okano [Uncensored L**ked],https://pic.javct.net/poster/20221108/1661969615.jpg,https://javct.net/v/juy-277-rm,116,2026-03-17
JUL-185-US,"A Married Woman Secretary Is Having Sweaty, Kiss-Filled Creampie Sex In The President's Office Nao Jinguji [English Subtitle, Reducing Mosaic]",https://pic.javct.net/poster/20212011/1640274968.jpg,https://javct.net/v/jul-185-us,117,2026-03-17
NGOD-168-RM,"He Was An Old Company Man Who Was Left To Wither In The Office, But When He Shoved His Big Dick Into This Naughty And Haughty Career Woman, She Melted Like Butter In His Hands Mao Hamasaki [Uncensored L**ked]",https://pic.javct.net/poster/20221202/1646376955.jpg,https://javct.net/v/ngod-168-rm,123,2026-03-17
MIAA-099-RM,My Dad Fucked My Faithful Girlfriend And Drove Her Crazy With His G-Spot Press. Sumire Kurokawa [Uncensored L**ked],https://pic.javct.net/poster/20221202/1646654552.jpg,https://javct.net/v/miaa-099-rm,115,2026-03-17
JUL-477-RM,"Madonna Exclusive, Part 2!! Creampie Ban Lifted!! A Mother Made Pregnant By Her Daughter's Boyfriend - Marika Kobayashi [Uncensored L**ked]",https://pic.javct.net/poster/20212011/1638926654.jpg,https://javct.net/v/jul-477-rm,115,2026-03-17
FSDSS-327-RM,My Step-brother Was Away For Three Days. This Is A Record Of Her Moaning And Coming To Life With A Meat Stick Other Than Her Step-Brother's. Kaname Momojiri [Uncensored L**ked],https://pic.javct.net/poster/20212709/1636606722.jpg,https://javct.net/v/fsdss-327-rm,124,2026-03-17
JUY-271-RM,"[Caution Before Viewing] The Worst NTR Story Ever I'm On Post Away From My Family, And I Wanted To Surprise My Wife On Her Birthday By Secretly Coming Home... But Then I Found My Wife Coming Home With My Boss, So I Hid Underneath The Bed And Listened To Them Fuck All Night [Uncensored L**ked]",https://pic.javct.net/poster/20212011/1641470662.jpg,https://javct.net/v/juy-271-rm,119,2026-03-17
FSDSS-326-RM,Looks Like She Likes Me!? Going On A Lovey-dovey Hot Springs Trip With My Company Junior And Shooting My Loads Out In The Water - Momo Honda [Uncensored L**ked],https://pic.javct.net/poster/20212011/1637816059.jpg,https://javct.net/v/fsdss-326-rm,124,2026-03-17
JUL-474-RM,"A Madonna Label Exclusive Mrs. Diamond Hitomi Honda No.2!! She's So Wild, You'll Forget To Breathe, As You Drown In Her Sweet, Dangerous Kisses ... [Uncensored L**ked]",https://pic.javct.net/poster/20212011/1639563961.jpg,https://javct.net/v/jul-474-rm,116,2026-03-17
HODV-21455-RM,Taking A Coworker For Myself During A Company Get Away - The Hottest Young Associate In The Company Goes After The Boss And Has His Way With Her For A Night Full Of Ten Climaxes - Tsubasa Hachino [Uncensored L**ked],https://pic.javct.net/poster/20221202/1645487460.jpg,https://javct.net/v/hodv-21455-rm,120,2026-03-17
VEC-391-RM,"Big Tits Cuckolding - My Best Friend Fucked My Beloved Bride, Fondling Her Massive Tits And Even Cumming Inside Her - Azusa Yagi [Uncensored L**ked]",https://pic.javct.net/poster/20221108/1663635115.jpg,https://javct.net/v/vec-391-rm,105,2026-03-17
WANZ-512-RM,"I'm Going To Have A Baby With My Daughter's Friend, So I Quit Being A Mom. Kaho Shibuya [Uncensored L**ked]",https://pic.javct.net/poster/20212011/1639366338.jpg,https://javct.net/v/wanz-512-rm,146,2026-03-17
JUX-377-RM,The Widow Fucked By Her Father-In-Law. Tied Up In Her Husband's Parents' House... Nana Aida [Uncensored L**ked],https://pic.javct.net/poster/20222109/1664725040.jpg,https://javct.net/v/jux-377-rm,145,2026-03-17
JUL-468-RM,Creampie Sex With My Younger Brother-In-Law At His Bachelor Pad While My Husband's At Work. Miho Aikawa [Uncensored L**ked],https://pic.javct.net/poster/20212011/1638725556.jpg,https://javct.net/v/jul-468-rm,135,2026-03-17
HOMA-017-RM,The Gal Widow: Innocent Wife AIKA Fucked to Service Her Uncle in Front of Husband's Funerary Portrait [Uncensored L**ked],https://pic.javct.net/poster/20221202/1645487518.jpg,https://javct.net/v/homa-017-rm,133,2026-03-17
FSDSS-311-RM,I'll Do It For The Money. My Friend's Girlfriend Finds More Than A Job By Selling Herself For Sex. Kaname Momojiri [Uncensored L**ked],https://pic.javct.net/poster/20212709/1633606225.jpg,https://javct.net/v/fsdss-311-rm,124,2026-03-17
SPRD-1095-RM,Her Husband Doesn't Suspect A Thing... Azusa Yagi [Uncensored L**ked],https://pic.javct.net/poster/20221202/1649725384.jpg,https://javct.net/v/sprd-1095-rm,134,2026-03-17
FSDSS-308-RM,"A Newlywed Returns Home To The Countryside And Has A Reunion With A Neat And Clean Longtime Friend, Leading To A Hot Summer Of Infidelity And Sex. Yui Shirasaka [Uncensored L**ked]",https://pic.javct.net/poster/20212709/1633606282.jpg,https://javct.net/v/fsdss-308-rm,119,2026-03-17
RIX-035,Host Oil Massage Addictive Is Kabukicho Celebrity Lady,https://pic.javct.net/poster/06032026/1773724467.jpg,https://javct.net/v/rix-035,235,2026-03-17
SKMJ-729-RM,"This Amateur Wife, Who Can't Hide Her Frustration From Playing Moms' Volleyball 3 Days A Week, Takes On The Challenge! A Plump, Big-assed Smooch! She Blushes And Gets Turned On By A Big, Curved Cock That's Younger Than Her Husband's! Then, He Slides It In Deep From Behind And Gives Her A Creampie! [Uncensored L**ked]",https://pic.javct.net/poster/06032026/1773549341.jpg,https://javct.net/v/skmj-729-rm,146,2026-03-17
BANK-234-RM,"Busty Married Woman Hot Spring Date: Reluctantly Selling Her Body, Aoi, 27 Years Old [Uncensored L**ked]",https://pic.javct.net/poster/06032026/1773549722.jpg,https://javct.net/v/bank-234-rm,115,2026-03-17
EBOD-372-RM,Hatsudori H Cup Breast Milk Sub-Mari Real Married Woman Lilith [Uncensored L**ked],https://pic.javct.net/poster/06032026/1773712685.jpg,https://javct.net/v/ebod-372-rm,120,2026-03-17
JUL-645-RM,Horny Pregnant Stepmom Rides My Cock For A Creampie Behind The Old Man's Back Ai Mukai [Uncensored L**ked],https://static.javct.net/poster/jul-645.jpg,https://javct.net/v/jul-645-rm,124,2026-03-17
SAN-081-RM,A Married Woman Who Was Unable To Pay The Rent And Dedicated Her Body To A Devil Landlord / Miku Arima [Uncensored L**ked],https://pic.javct.net/poster/20222410/1668479728.jpg,https://javct.net/v/san-081-rm,120,2026-03-17
NPJB-121-RM,A Broke Single Mother Releases Her Frustration With Daily Allowances 4 Uncut Sex Videos 140 Minutes BEST [Uncensored L**ked],https://pic.javct.net/poster/06032026/1773163990.jpg,https://javct.net/v/npjb-121-rm,140,2026-03-17
JUX-866-RM,Neighbor To**ure - Female Dog Of Service Married Woman Has Been Inculcated  Eriko Miura [Uncensored L**ked],https://pic.javct.net/poster/20220406/1656465829.jpg,https://javct.net/v/jux-866-rm,120,2026-03-17
FC2PPV-4864554,[3P continuous creampie] A mature wife takes on two cocks with her libido unleashed. Her body can no longer go back and surrenders to the to**ure of two cocks.,https://pic.javct.net/poster/06032026/1773709155.jpg,https://javct.net/v/fc2ppv-4864554,42,2026-03-17
MVSD-583-US,"A Double Bourgeois Married Woman's Splendid Dick Play. A Man-eater Mature Woman Who Sucks Out The Young Man's Dick. A Lewd Slut Sex Covered In Pheromones. Yuri Oshikawa And Mary Tachibana. [English Subtitle, Reducing Mosaic]",https://pic.javct.net/poster/20241901/1708050769.jpg,https://javct.net/v/mvsd-583-us,140,2026-03-17
AVOP-363-RM,"Too Tender Amateur Wife Keeps Her Husband Secretly A Virgin Brush!Special Edition ""Actually I Like My Younger Brother."" In A Hurry, 'Brother Too' Brushed Down At Home!Famimish Cum Shot SP Eumi 30 Years Old [Uncensored L**ked]",https://pic.javct.net/poster/06032026/1773712317.jpg,https://javct.net/v/avop-363-rm,140,2026-03-17
ALDN-244-RM,"After All, Being A Single Mother Is The Best... Hitomi Mochizuki [Uncensored L**ked]",https://pic.javct.net/poster/20231711/1700889003.jpg,https://javct.net/v/aldn-244-rm,110,2026-03-17
NGOD-018,Japan Netora Are Grand Prize Winners Netora The Fiance Aki Sasaki,https://pic.javct.net/poster/06032026/1773704913.jpg,https://javct.net/v/ngod-018,120,2026-03-17
JRZD-878,First Shooting Fifty Wife Document Akiyoshi Yoshinaga,https://pic.javct.net/poster/06032026/1773703907.jpg,https://javct.net/v/jrzd-878,120,2026-03-17
VENU-953-RM,Do You Get Excited By An Older Woman's Panties? - A Mature Woman Takes Off Her Panties To Jerk Off A Younger Guy - Ririka [Uncensored L**ked],https://pic.javct.net/poster/20212011/1638148646.jpg,https://javct.net/v/venu-953-rm,104,2026-03-17
VOSS-173-RM,My Neighbor Is A Widow With Big Tits! 6 - This Pretty Widow Doesn't Wear A Bra And She Obviously Has Some Built-Up Sexual Frustrations! She Presses Her Tits Against Me And Lets Me Fondle Them! I Rub My Cock Against Her Clit Before Piston-Fucking Her Deep In Her Pussy And Giving Her Multiple Orgasms! [Uncensored L**ked],https://pic.javct.net/poster/20221108/1663646502.jpg,https://javct.net/v/voss-173-rm,95,2026-03-17
VENU-921-RM,"""Are You Getting Horny Over An Old Lady's Underwear?"" This Horny Lady Is Using Her Freshly Stripped-Off Panties To Squeeze Out Every Last Drop Of Semen Ayane Haruka [Uncensored L**ked]",https://pic.javct.net/poster/20212011/1643730734.jpg,https://javct.net/v/venu-921-rm,106,2026-03-17
VENU-892-RM,"""Do Aunty's Panties Excite You?"" Aunty Squeezes Every Drop Of His Sperm With Her Panties Freshly Taken Off: Yuka Mizuno [Uncensored L**ked]",https://pic.javct.net/poster/20212011/1638926325.jpg,https://javct.net/v/venu-892-rm,104,2026-03-17
SUPA-320-RM,I Will Lend You My All-you-can-use Wife Every Day. Kanna 31 Years Old [Uncensored L**ked],https://pic.javct.net/poster/06032026/1773676364.jpg,https://javct.net/v/supa-320-rm,125,2026-03-17
NTR-032-RM,It Came From Abroad Netora Is Desire Married Couple Amelia [Uncensored L**ked],https://pic.javct.net/poster/20230104/1682577560.jpg,https://javct.net/v/ntr-032-rm,118,2026-03-17
START-529,A married woman who has been married for 1 year has a grudge against her creepy father... Supervised creampie Mei Miyajima,https://pic.javct.net/poster/06032026/1773680723376.jpg,https://javct.net/v/start-529,130,2026-03-17
START-534,"The wife who married into my parents' house seems to be in the middle of my family's extremely male-obsessed sex drive, and she was an unfaithful married woman who sneaked into the family and had sex with everyone, so it was a family crush! Mahiro Yuii",https://pic.javct.net/poster/06032026/1773680531487.jpg,https://javct.net/v/start-534,128,2026-03-17
ADN-162-US,"A Cock Assault This Married Woman Housemaid Is Getting R**ed Against Her Will Saeko Matsushita [English Subtitle, Reducing Mosaic]",https://pic.javct.net/poster/20212011/1641971108.jpg,https://javct.net/v/adn-162-us,113,2026-03-17
SORA-174,A celebrity beast wife is trained in the room. Misa Arisawa,https://pic.javct.net/poster/06032026/1773682831.jpg,https://javct.net/v/sora-174,135,2026-03-17
MIMK-079-RM,Hardcore Sex With A Quiet Student Librarian. Mia Nanasawa [Uncensored L**ked],https://static.javct.net/poster/mimk-079.jpg,https://javct.net/v/mimk-079-rm,96,2026-03-17
MUDR-144-RM,I Still Won't Give In... Beautiful Girl Continues To Resist Until She's Gangbanged. Breaking In A Proud Babe With S&M And Confinement - Mitsuki Nagisa [Uncensored L**ked],https://static.javct.net/poster/mudr-144.jpg,https://javct.net/v/mudr-144-rm,120,2026-03-17
KUSE-022-RM,(Older Sister Wants To Showcase Poop) Gorgeous City Office Worker Willingly Signs On For First Ever AV Performance To Show Off Pooping. Makoto (25) [Uncensored L**ked],https://static.javct.net/poster/1628570021.jpg,https://javct.net/v/kuse-022-rm,143,2026-03-17
FSDSS-934-SUB,Merciless facial cumshot from an innocent blowjob Sakazu Yamashita [English Subtitle],https://pic.javct.net/poster/20242012/1736788614.jpg,https://javct.net/v/fsdss-934-sub,120,2026-03-17
MUDR-156-RM,Ever Since That Day ... Breaking In A Beautiful Young Girl In Uniform With Creampie S&M Training Minami Hatsukawa [Uncensored L**ked],https://static.javct.net/poster/mudr-156.jpg,https://javct.net/v/mudr-156-rm,137,2026-03-17
HMGL-188-RM,"Shy Bodies, Black Sun Yumi Saeki [Uncensored L**ked]",https://pic.javct.net/poster/20212308/1632540715.jpg,https://javct.net/v/hmgl-188-rm,131,2026-03-17
JUL-647-RM,"She Turns Into A Completely Different Person With A Cock Inside Her. 34 Years Old, Married, And Cock-Crazed; Saori Nagashima Makes Her AV Debut. [Uncensored L**ked]",https://static.javct.net/poster/jul-647.jpg,https://javct.net/v/jul-647-rm,187,2026-03-17
GVH-337-SUB,Seductive PTA President And Bratty Student Council. Hikari Kisaki [English Subtitle],https://pic.javct.net/poster/20212011/1641014651.jpg,https://javct.net/v/gvh-337-sub,135,2026-03-17
XVSR-199,Secret Asami Nagase Four Hours Of H Milk,https://pic.javct.net/poster/06032026/1773633775.jpg,https://javct.net/v/xvsr-199,240,2026-03-17
LULU-123-RM,"A Boyish Friend From Back In The Day Gets Her Nipples Teased Non-stop, Making Her Face Go Unimaginably Wild As She Squirts With Pleasure! I Get Hard In No Time And Stick It In Her Dripping Pussy For Raw Fucking And Multiple Creampie Loads. Suzu Monami [Uncensored L**ked]",https://pic.javct.net/poster/20212011/1643449898.jpg,https://javct.net/v/lulu-123-rm,160,2026-03-17
SOE-496-RM,M-Cup Tits Want to be Spoiled 3 Hour Special Ruri Saijo [Uncensored L**ked],https://pic.javct.net/poster/20220406/1657157086.jpg,https://javct.net/v/soe-496-rm,176,2026-03-17
RKI-619-RM,The Story Behind How She Became An Obsessive Blowjob Fiend That Sucks Whenever She Can Ever Since She Was Taught How To Suck A Dick. Hotaru Nogi [Uncensored L**ked],https://pic.javct.net/poster/20212709/1633674678.jpg,https://javct.net/v/rki-619-rm,161,2026-03-17
JUL-644-RM,Yuko Shiraki Adult Style Sk**ls Honed By Years Of Experience Documentary Drama Featuring Actress Yuko Shiraki [Uncensored L**ked],https://static.javct.net/poster/jul-644.jpg,https://javct.net/v/jul-644-rm,160,2026-03-17
ADN-203-US,"Immature Adultery: Married Woman Office Lady And Her Younger Subordinate - Saeko Matsushita [English Subtitle, Reducing Mosaic]",https://pic.javct.net/poster/20212011/1641966391.jpg,https://javct.net/v/adn-203-us,115,2026-03-17
SSIS-202-US,"We Seriously Go Undercover At This Dispatch System Reflexology Salon Where The Rumor Is That You Can Get Some Nookie Marin Hinata Is Going All Out To Service You With Super Excessive Secret Optional Services, And We're Going All The Way To Show You Everything That Happens [English Subtitle, Reducing Mosaic]",https://pic.javct.net/poster/20212709/1633676440.jpg,https://javct.net/v/ssis-202-us,153,2026-03-17
NITR-380-RM,"I Went To My Relatives' House To Spend The Night And There I Saw My First Glimpse Of An Adult Naked Body And Even Now, I Remember That Moment As My Most Shocking Memory V Azusa Yagi [Uncensored L**ked]",https://pic.javct.net/poster/20212011/1644199589.jpg,https://javct.net/v/nitr-380-rm,136,2026-03-17
NACR-382-RM,Lady Editor Becomes Older Author's Personal Sex Pet Sumire Mizukawa [Uncensored L**ked],https://pic.javct.net/poster/20212011/1640790570.jpg,https://javct.net/v/nacr-382-rm,120,2026-03-17
SIRO-5640,[*It's so big that it bugs my brain] I don't know how many men have been fascinated by her body until now [First shot] AV application online AV experience shooting 2525,https://pic.javct.net/poster/06032026/1773724764928.jpg,https://javct.net/v/siro-5640,62,2026-03-17
SAN-433,"Middle-aged Men Can't Understand Their Thoughts, But This Is The Video D-side For People Who Want To Have Sex With Young, Cute Amateur Girls.",https://pic.javct.net/poster/06032026/1773727018.jpg,https://javct.net/v/san-433,91,2026-03-17
SMKD-007-RM,Complete Coma - 4 People - Heroine-level Junior (19) / Interior Planner (2●) / Reiwa 8 New Bride (25) / Airsoft Beauty (2●) All Creampie Sleepwalking Seconds [Uncensored L**ked],https://pic.javct.net/poster/06032026/1773422187.jpg,https://javct.net/v/smkd-007-rm,245,2026-03-17
ZIZG-032,"Each Other Devour Seeking Pleasure, Thick SEX Cosplay Busty Beauties Narimiya Harua",https://pic.javct.net/poster/06032026/1773728986.jpg,https://javct.net/v/zizg-032,110,2026-03-17
XRW-339,Using This Woman Ji-Po Wants To Be Scolded Narimiya Haruha,https://pic.javct.net/poster/06032026/1773724230.jpg,https://javct.net/v/xrw-339,97,2026-03-17
TMEM-083,Helpless Young And Such A Body.There Is Only Sex.,https://pic.javct.net/poster/06032026/1773723989.jpg,https://javct.net/v/tmem-083,120,2026-03-17
YAL-118,Please Embarrass Meat With Embarrassing Meat Narimiya Haruha,https://pic.javct.net/poster/06032026/1773724109.jpg,https://javct.net/v/yal-118,101,2026-03-17
NITR-542-RM,Obscene BODY Tongue Kiss Addiction X Ranka [Uncensored L**ked],https://pic.javct.net/poster/20231711/1702096165.jpg,https://javct.net/v/nitr-542-rm,130,2026-03-17
STAR-905-RM,Seductive Female Teacher Who Whispers And Eats The Student's Boyfriend While Whispering At Shiraishi Mariana [Uncensored L**ked],https://pic.javct.net/poster/06032026/1773713205.jpg,https://javct.net/v/star-905-rm,135,2026-03-17
SCOP-535,"If You Want To Be Called ""mom"" By The C**ld Of The Remarried Partner And You Are Shedting Your Back In The Bath, Suddenly The Bath Towel Has Fallen And The Tits Pole! !Wrapped In Her Mother 's Love With Her Sensitive Son' S Boyfriend.",https://pic.javct.net/poster/06032026/1773720892.jpg,https://javct.net/v/scop-535,120,2026-03-17
FC2PPV-4864780,"[With luxury benefits] The fair-skinned, beautiful, big-breasted plump body of an 18-year-old cafe clerk with a baby-faced and cute face, as desired by a romantic gonzo photographer.",https://pic.javct.net/poster/06032026/1773709073.jpg,https://javct.net/v/fc2ppv-4864780,70,2026-03-17
LUKE-030-RM,"Close-up Whispering, Dirty Talk Seduction, Sticky Penis, Teasing Slut Sara Ito [Uncensored L**ked]",https://pic.javct.net/poster/20231711/1702698747.jpg,https://javct.net/v/luke-030-rm,165,2026-03-17
SKMJ-726-RM,"Kind And Cute Nurse Like The Virgin Mary! ""Would You Help This Virgin Boy Who Is Suffering From Premature Ejaculation Improve His Premature Ejaculation?"" This Nurse Seems To Be Used To Men's Penises, But She's Actually Quite Naive. Her Vagina Throbs With Lust For This Premature Ejaculating Virgin Boy, And She Takes His Virginity In This Raw Creampie Special! [Uncensored L**ked]",https://pic.javct.net/poster/06032026/1773507717.jpg,https://javct.net/v/skmj-726-rm,208,2026-03-17
CRNX-292-RM,[4K] Forbidden creampie sex with a student in a swimsuit that violates school regulations Miyu Aizawa [Uncensored L**ked],https://pic.javct.net/poster/06032026/1773508242184.jpg,https://javct.net/v/crnx-292-rm,59,2026-03-17
PKYS-007-RM,"A 18-year-old Woman Who Is OK With Creampie In A Dating Relationship. Meku Tozaki, A Hidden Big-breasted Girl Who Does Creampie Even Though She Has Never Had A Boyfriend. [Uncensored L**ked]",https://pic.javct.net/poster/20231711/1701486292.jpg,https://javct.net/v/pkys-007-rm,130,2026-03-17
EBOD-493,Wet Teca Coating Hcup Tits BODY Yoshitake Tin,https://pic.javct.net/poster/06032026/1773711220.jpg,https://javct.net/v/ebod-493,150,2026-03-17
EBOD-462,Real Figure BODY Cosplayers Yoshitake Tin,https://pic.javct.net/poster/06032026/1773711161.jpg,https://javct.net/v/ebod-462,120,2026-03-17
EBOD-454,My Mercy Hcup Lingerie Maid Yoshitake Tin,https://pic.javct.net/poster/06032026/1773711025.jpg,https://javct.net/v/ebod-454,150,2026-03-17
EBOD-433,First Alive!First Experience Sex 4 Hours SP Yoshitake Tin,https://pic.javct.net/poster/06032026/1773710964.jpg,https://javct.net/v/ebod-433,240,2026-03-17
BOBB-315,I Firmly Grasp The Waist Of God Milk God BODY And Push It From Behind!Shaking Tits!Hoarse Rising!Taste The Busty Beauty To The Depths Of The Womb!,https://pic.javct.net/poster/06032026/1773711102.jpg,https://javct.net/v/bobb-315,120,2026-03-17
FC2PPV-4863787,"[Salt compatible female pt2] A cheeky girl who has been spoiled by the world, intense piss and screaming raw creampie [black hair naive]",https://pic.javct.net/poster/06032026/1773726678.jpg,https://javct.net/v/fc2ppv-4863787,57,2026-03-17
476MLA-272,"Minami, a 21-year-old black-haired slender girl who just broke up with her boyfriend, calls out to her while she's at work, and unexpectedly cums inside her during a cosplay shoot lol.She accepts the unlicensed mid-finish and makes it public.",https://pic.javct.net/poster/06032026/1773724625515.jpg,https://javct.net/v/476mla-272,67,2026-03-17
T28-648-RM,"Beautiful Girl's Panty Shot Seduction That Provokes Me, A Teacher Trainee [Uncensored L**ked]",https://pic.javct.net/poster/06032026/1773713007.jpg,https://javct.net/v/t28-648-rm,130,2026-03-17
YAL-115,I Am Silent Selling My Friend Fukano's Sleeping Face Narimiya Haruha,https://pic.javct.net/poster/06032026/1773724346.jpg,https://javct.net/v/yal-115,100,2026-03-17
SUJI-304-RM,The Immorality Doubles The Excitement. Forbidden Brother And Sister Creampie Incest. Little Shaved Yuna Hinata Yuna [Uncensored L**ked],https://pic.javct.net/poster/06032026/1773456028.jpg,https://javct.net/v/suji-304-rm,112,2026-03-17
SKMJ-725-RM,"Amateur College Students Are Tricked Into Thinking They're In A Magazine Special Titled ""Memorial Nude Photos,"" And A Fake Photoshoot With A Man With An Insatiable Dick Tests Out The Possibility Of A Creampie! The Rock-hard Cock Comes Within 1cm Of The Girl's Pussy, Causing The Amateur Girl To Suddenly Become Aroused! A Raw Creampie To Commemorate Her Graduation From College! 8 Shots! [Uncensored L**ked]",https://pic.javct.net/poster/06032026/1773549402.jpg,https://javct.net/v/skmj-725-rm,141,2026-03-17
RKI-620-RM,I'd Like To Introduce You To A Pretty Slut. Enachi 22 Years Old [Uncensored L**ked],https://pic.javct.net/poster/20212011/1639114748.jpg,https://javct.net/v/rki-620-rm,162,2026-03-17
SYKH-181-RM,"Raw Sex With A Beautiful Witch In Boots. Her Beauty Melts In The Pleasure Of A Quick Dick... Umi-san, 25 Years Old, Hiroi Umi [Uncensored L**ked]",https://pic.javct.net/poster/06032026/1773449429.jpg,https://javct.net/v/sykh-181-rm,110,2026-03-17
BANK-233-RM,Naughty Hot Spring Trip With Beautiful Girls With Pink Pussies [Uncensored L**ked],https://pic.javct.net/poster/06032026/1773549784.jpg,https://javct.net/v/bank-233-rm,195,2026-03-17
SUJI-302-RM,"""I Hate Being Violated, But It Feels So Good... Why?"" Convulsive, Continuous Orgasms, Immature Pussy Fo**ed To Blossom, Shaved Pussy, Student R**e, Nagi Yasaka [Uncensored L**ked]",https://pic.javct.net/poster/06032026/1773456092.jpg,https://javct.net/v/suji-302-rm,100,2026-03-17
PKPD-024-RM,I Can Go To See AV Idol Reservation Can Not Get Kansai Famous Soap Lady Complete Debut Document Nori Erika [Uncensored L**ked],https://pic.javct.net/poster/06032026/1773712620.jpg,https://javct.net/v/pkpd-024-rm,180,2026-03-17
FC2PPV-4864483,"[Uncensored full facial] Miraculously, I was accepted to appear on the show!! She has an outstanding figure and is a beautiful woman with a big butt!?? She is a beautiful dental hygienist and mercilessly gives her first facial and first creampie.",https://pic.javct.net/poster/06032026/1773642282.jpg,https://javct.net/v/fc2ppv-4864483,73,2026-03-17
FC2PPV-4864999,[Amateur first shot] Arisa (19) 152cm 25kg super slender beauty gets creampie and anal penetration ATM A middle-aged man with a weight difference of 65kg does whatever he wants,https://pic.javct.net/poster/06032026/1773709288.jpg,https://javct.net/v/fc2ppv-4864999,119,2026-03-17
FC2PPV-4864810,"[Uncensored] [Public] Two big dick black people make Mai-chan #2, a beautiful woman with beautiful breasts and a big ass, make out with a rear ekiben and creampie hardcore first black 3P",https://pic.javct.net/poster/06032026/1773709317.jpg,https://javct.net/v/fc2ppv-4864810,52,2026-03-17
MFCW-069,"Last night with my unfaithful wife who is leaving due to her husband's job transfer...A bewitching married woman with a G-cup plump big ass who disturbs her lustrous BODY, ""Fuck me until I can't do it anymore."" Creampie and facial cumshot 2 times in a row until my heart and body are covered in other people's sperm with the insemination piston [Sayuri/32 years old/7 years of marriage]",https://pic.javct.net/poster/06032026/1773642164691.jpg,https://javct.net/v/mfcw-069,94,2026-03-17
