code,title,image_url,page_url,views,date_scraped
FC2PPV-4890710,"[Bonus included] [Personal shooting] [Full face exposed] A 28-year-old beautiful conductor has a neat appearance, but her sensitive body makes her squirt easily. Her wet pussy is stirred and she reaches continuous orgasms.",https://pic.javct.net/poster/04112026/06e901a3b3.jpg,https://javct.net/v/fc2ppv-4890710,40,2026-05-02
FC2PPV-4892416,[Pregnancy/Suspension of activities] 19-year-old duo of beautiful influencers 3P creampie sex shot on a dangerous day Urgent release video *Prices will increase sequentially,https://pic.javct.net/poster/04112026/52376497c6.jpg,https://javct.net/v/fc2ppv-4892416,37,2026-05-02
FC2PPV-4892281,"[Two good friends who love sex, Misa-chan and Kasumi-chan reappear, and they can't get enough of them, so they have a live 3P battle with the director]",https://pic.javct.net/poster/04112026/57b7f05d8a.jpg,https://javct.net/v/fc2ppv-4892281,79,2026-05-02
FC2PPV-4892293,I had a secret meeting with a boyish beauty who is a Harajuku idol who looks like Pa◯tan,https://pic.javct.net/poster/04112026/566b3a510a.jpg,https://javct.net/v/fc2ppv-4892293,61,2026-05-02
FC2PPV-4890498,[Individual video] Affair sex with a frustrated slender married woman at a married woman's house,https://pic.javct.net/poster/04112026/e268046dbb.jpg,https://javct.net/v/fc2ppv-4890498,23,2026-05-02
FC2PPV-4891895,"[Uncensored/Complete Amateur/Creampie/Squirting] An ordinary girl in uniform who agreed to a love hotel photoshoot on the condition that she wears a mask. She said she was in the deep end, but once the pheromones started, she got so horny that she had a thick creampie ♡",https://pic.javct.net/poster/04112026/4259712906.jpg,https://javct.net/v/fc2ppv-4891895,20,2026-05-02
SIRO-5033,"[It's moving...] I'm not satisfied with sex in private, I squirt with the fingering of a beauty club actor who has an air of being more mature than his age, and when he inserts a penis, I can't stop my hips and go wild... AV application online AV experience shooting 1953",https://pic.javct.net/poster/04112026/6005ecfa68.jpg,https://javct.net/v/siro-5033,0,2026-05-02
FC2PPV-4891988,A super cute Harajuku idol is made to wear a maid costume and has a creampie play,https://pic.javct.net/poster/04112026/5b241034f4.jpg,https://javct.net/v/fc2ppv-4891988,56,2026-05-02
FC2PPV-4891643,"Early purchase bonus Miraculous fusion with a slender beauty ""Aaah, one high-speed dick thrusts a huge explosion, massive ejaculation finish",https://pic.javct.net/poster/04112026/d23a8f772f.jpg,https://javct.net/v/fc2ppv-4891643,62,2026-05-02
FC2PPV-4892310,"[2 cameras uncensored] SEX addicted funky gal makes her second appearance, this time she goes crazy with machine gun anal fucking",https://pic.javct.net/poster/04112026/4ae7248de3.jpg,https://javct.net/v/fc2ppv-4892310,79,2026-05-02
FC2PPV-4892087,"[Uncensored] **pyjpx*jsps Super cute ~ A lot of love juice oozing out of Rika's panties of 18 years old 〇〇 who has a real face... I can't resist Playing with her nipples with a suction device ~ Naturally, the clitoris is also standing up",https://pic.javct.net/poster/04112026/3209031f26.jpg,https://javct.net/v/fc2ppv-4892087,76,2026-05-02
FC2PPV-4892042,"Mr. JD, who has a calm demeanor and whose eyes droop when he smiles, came to our store with an active approach looking for stimulation.",https://pic.javct.net/poster/04112026/4771eb4a3b.jpg,https://javct.net/v/fc2ppv-4892042,43,2026-05-02
FC2PPV-4892287,"[Silenceless married woman with her face exposed] It's a sight to see her small breasts and slender body being played with.The voice that she had been holding back came out, and she was almost unconscious.",https://pic.javct.net/poster/04112026/1bc9e92ef3.jpg,https://javct.net/v/fc2ppv-4892287,47,2026-05-02
FC2PPV-4892640,"[Account Opening Commemoration Sale] Miu-chan, who is extremely naughty in nature, is willing to give a cleaning blow job ♡ Her true face that is not shown on stage is a must-see",https://pic.javct.net/poster/04112026/4dabb19c75.jpg,https://javct.net/v/fc2ppv-4892640,40,2026-05-02
FC2PPV-4890664,"[Account Opening Commemoration Sale] Idol trainee Kokoa-chan, who has finally completed her debut work after continuing to negotiate for appearances without giving up, tried creampie for the first time in her life.",https://pic.javct.net/poster/04112026/a62fd559ad.jpg,https://javct.net/v/fc2ppv-4890664,37,2026-05-02
FC2PPV-4867757,"[Unreleased treasured record] A secret video of a beautiful girl who aspires to be an innocent idol, her uniform being disturbed by a dirty man's cock! A large amount of semen engraved in her beautiful body and vagina at the end of the lesson",https://pic.javct.net/poster/04112026/397eb081f1.jpg,https://javct.net/v/fc2ppv-4867757,188,2026-05-02
SIRO-5023,"[Slender G breasts] I thought she was a cool beauty, but she trembled while cumming. AV application online AV experience shooting 1951",https://pic.javct.net/poster/04112026/2171a0e0dc.jpg,https://javct.net/v/siro-5023,64,2026-05-02
FC2PPV-4891744,"♯41 When I undressed a plain girl, she had a voluptuous erotic body. Japan's future Mio, who was a current/worker until last month and was almost a virgin, accepts an uncle's raw cock for only 3000 yen",https://pic.javct.net/poster/04112026/e7154800f4.jpg,https://javct.net/v/fc2ppv-4891744,113,2026-05-02
FC2PPV-4891124,"[Complete secret version] [SSS-class beauty] [Creampie] [Facial appearance] [Celebrity resemblance] Tokyo's high-class lounge manager and hostess, Akane-san's abomination [Chapter 3]",https://pic.javct.net/poster/04112026/68d1c0de67.jpg,https://javct.net/v/fc2ppv-4891124,105,2026-05-02
FC2PPV-4889296,[Individual photography / men's esthetics] [Authorized as a secret massage therapist?!] <A well-trained beauty therapist> This erotic esthetician is in trouble. Stimulates the testicles and back muscles with an anal hand job while crawling on all fours! Raw creampie option available!!,https://pic.javct.net/poster/04112026/dee784790d.jpg,https://javct.net/v/fc2ppv-4889296,37,2026-05-02
FC2PPV-4891589,"NTR Squirting sex in a separate room with a G-cup big-breasted, big-ass, hairy nurse from a certain beauty clinic right before the wedding ceremony",https://pic.javct.net/poster/04112026/d5225a3255.jpg,https://javct.net/v/fc2ppv-4891589,16,2026-05-02
FC2PPV-4887454,[19-year-old sex video] I fucked a cute 19-year-old junior at home who was exhausted from her part-time job [Yes],https://pic.javct.net/poster/04112026/ed38c97175.jpg,https://javct.net/v/fc2ppv-4887454,13,2026-05-02
FC2PPV-4891133,"[Urgent Release Breasts] **pyjpx*jsps 0414_001 Kanna-chan, 18 years old, has only one husband, and is already a married young wife who is ready for divorce and completely exposes her idol face, drowning in NTR creampie sex on a dangerous day (explosion)",https://pic.javct.net/poster/04112026/07e6dcfd88.jpg,https://javct.net/v/fc2ppv-4891133,197,2026-05-02
336KNB-410,"[Put it all the way in] No matter how old I am, I want to make love, and I want to be penetrated deep inside, in front of Chiba Koen Station, Chiba City, Saitama Prefecture.",https://pic.javct.net/poster/04112026/2473ebd9fc.jpg,https://javct.net/v/336knb-410,71,2026-05-02
SSIS-858-RM,"Even Though You're A Teacher, You're Bound To Get Fucked By Us Because You Have Huge Erotic Breasts, You Understand, Right? Nagi Hikaru [Uncensored L**ked]",https://pic.javct.net/poster/20230908/1694714182.jpg,https://javct.net/v/ssis-858-rm,120,2026-05-02
ADN-503-RM,My Father-in-law's Kiss As He Licks Me Miu Shiramine [Uncensored L**ked],https://pic.javct.net/poster/20231011/1699149399.jpg,https://javct.net/v/adn-503-rm,120,2026-05-02
SONE-248-RM,K-cup Secretary Gets Licked And Violated By Her Slug-like Boss Until She Cums Hikaru Nagi [Uncensored L**ked],https://pic.javct.net/poster/20243105/1720146570.jpg,https://javct.net/v/sone-248-rm,120,2026-05-02
JUQ-404-RM,Nude Model NTR Shocking Cheating Video Of A Wife Drowning In Shame With Her Boss Sayuri Hayama [Uncensored L**ked],https://pic.javct.net/poster/20231011/1698144969.jpg,https://javct.net/v/juq-404-rm,120,2026-05-02
FPRE-004-RM,Sleep R**e: Putting My Cocky Son's Big-breasted Wife To Sleep With Sleeping Pills And Raping Her. Mina Kitano [Uncensored L**ked],https://pic.javct.net/poster/20231912/1704020502.jpg,https://javct.net/v/fpre-004-rm,150,2026-05-02
JUQ-943-RM,Nude Model NTR: Shocking Video Of Wife Cheating With Her Boss And Drowning In Shame Meguri [Uncensored L**ked],https://pic.javct.net/poster/20241115/1732243413.jpg,https://javct.net/v/juq-943-rm,140,2026-05-02
SOAN-108-RM,"The Mother Of The Sakuma Family Who Fell Into Masochistic Anal. A Sexless Married Woman Who Is Not Recognized As A Woman By Her Husband Is Publicly Insulted And Inseminated In Two Holes By Another Man's Cock! The Whole Story Of How She Betrayed Her Husband And Fell Into Masochistic Awakening...Kaede, 42 Years Old [Uncensored L**ked]",https://pic.javct.net/poster/20242108/1727490518.jpg,https://javct.net/v/soan-108-rm,143,2026-05-02
JUQ-540-RM,"Wanted To Make My Wife Admit My Love, So I Left Her And My Unfaithful Junior Alone For 3 Hours...My NTR Story About How My Wife Was Stolen From Me With A Total Of 17 Vaginal Cum Shots Without Pulling Out Sayuri Hayama [Uncensored L**ked]",https://pic.javct.net/poster/20231912/1704643413.jpg,https://javct.net/v/juq-540-rm,120,2026-05-02
FSDSS-672-RM,"I keep being r**ed... A beautiful wife from a rural area is trained by a young man from the city near her husband, and she falls into a sexual assault with Nene Yoshitaka. [Uncensored L**ked]",https://pic.javct.net/poster/20231011/1697259924.jpg,https://javct.net/v/fsdss-672-rm,120,2026-05-02
YUJ-008-RM,"You Have A Husband And I Have A Wife, But You And Your Colleagues At Work Asked Each Other Until The Sun Rose. Miu Shiramine [Uncensored L**ked]",https://pic.javct.net/poster/20230908/1695605474.jpg,https://javct.net/v/yuj-008-rm,120,2026-05-02
STARS-923-RM,"5 Situations Where You Can Enjoy Rei Kamiki's ""beautiful Butt"" With A Transcendental Style.Actually, I...not Only My Boobs But Also My Buttocks Are Amazing Rei Kamiki [Uncensored L**ked]",https://pic.javct.net/poster/20231011/1697068491.jpg,https://javct.net/v/stars-923-rm,156,2026-05-02
FTAV-003-RM,"""I Love Him, But... I'm Getting Wet Just Thinking About What He's Going To Do..."" I-cup Nurse, 22 Years Old, Not Affiliated With Kimitsu City, Chiba Production, A Woman With Natural Big Breasts Who Lives In The Countryside, Still An Amateur, SOFT ON DEMAND Yu Sasamoto's (tentative) Appearance For The Fourth Time In The New House Where Her Married Life Begins And Her Fiancé Works... [Uncensored L**ked]",https://pic.javct.net/poster/20242108/1727115023.jpg,https://javct.net/v/ftav-003-rm,159,2026-05-02
JUQ-510-RM,The World's Most Luxurious Commemorative Work! ! Madonna 20th Anniversary - First Ever ALL Exclusive Bus Tour With Unlimited Creampie And Steam! ! First Part 4 Hours OVER 2-disc Set! ! [Uncensored L**ked],https://pic.javct.net/poster/20231912/1703554075.jpg,https://javct.net/v/juq-510-rm,290,2026-05-02
MVSD-471-RM,Remote Control NTS Indecent Pant Of My Beloved Wife Drowning In Another Stick Michiru Kujo [Uncensored L**ked],https://pic.javct.net/poster/20231912/1704622292.jpg,https://javct.net/v/mvsd-471-rm,120,2026-05-02
URE-100-RM,"Congratulations! Commemorative Work For 100 Mature Comics Original Work: Purpoison Mother-eating ~Yarichin Travel Edition~ Cumulative Total Of Over 100,000 Downloads Of The Series! ! A Live-action Sequel To The Legendary Popular Doujin Work Starring Madonna! ! Exclusive, Ririko Kinoshita's 6 Gorgeous Performances With Large Volumes! ! [Uncensored L**ked]",https://pic.javct.net/poster/20231711/1702777063.jpg,https://javct.net/v/ure-100-rm,240,2026-05-02
ADN-564-RM,"I Kept Giving My Son's Wife An Aphrodisiac So That She Wouldn't Find Out, And I Made Her Body, Which Had Become An Erogenous Zone, Go Crazy With Excitement And Climax. Shiramine Miu [Uncensored L**ked]",https://pic.javct.net/poster/20241804/1714707796.jpg,https://javct.net/v/adn-564-rm,160,2026-05-02
MEYD-890-RM,I Spent A Week Having Sex With A Big-breasted Aunt With A Sloppy Personality In A Ch**ing Trash Room. Sayama Love [Uncensored L**ked],https://pic.javct.net/poster/20241703/1710726271.jpg,https://javct.net/v/meyd-890-rm,150,2026-05-02
JUQ-563-RM,Days Of Creampie Ring That Will Never End. Sayuri Hayama [Uncensored L**ked],https://pic.javct.net/poster/20241901/1708307694.jpg,https://javct.net/v/juq-563-rm,120,2026-05-02
FSDSS-673-RM,"My husband isn't here today, so why don't we have another drink at home? I, Yuko Ono, got excited when I saw my ex-girlfriend again at the class reunion, wearing no panties or bra. [Uncensored L**ked]",https://pic.javct.net/poster/20231011/1698379389.jpg,https://javct.net/v/fsdss-673-rm,120,2026-05-02
JUQ-439-RM,"During My Wife's Pregnancy, I Was Forbidden To Even Masturbate, So I Had Sex With My Mother-in-law, Sayuri, Who Had Moved To Tokyo Many Times... Sayuri Hayama [Uncensored L**ked]",https://pic.javct.net/poster/20231011/1699830529.jpg,https://javct.net/v/juq-439-rm,120,2026-05-02
WAAA-303-RM,I Asked My Plump Wife At My Part-time Job To Be My Tutor... Ai Sayama [Uncensored L**ked],https://pic.javct.net/poster/20230908/1696605519.jpg,https://javct.net/v/waaa-303-rm,120,2026-05-02
ROE-163-RM,My Aunt's Wet And See-through Body. A Night Alone Under The Same Roof... Sentimental Rain Pattern Yuka Mizuno [Uncensored L**ked],https://pic.javct.net/poster/20230908/1695970848.jpg,https://javct.net/v/roe-163-rm,140,2026-05-02
ACHJ-030-RM,Madonna Dengeki Exclusive Authentic Slut Sumire Mizukawa Endless Ejaculation Orgasm That Makes Masochist Man's Body And Mind Melt With Deep And Rich Kisses And Stopping Creampie [Uncensored L**ked],https://pic.javct.net/poster/20231711/1700382348.jpg,https://javct.net/v/achj-030-rm,110,2026-05-02
MIMK-217-RM,"Live-action Version: I'm Having Trouble With My Husband's Stepc**ld. I'm Violated By The Insatiable Dick Of A Disgusting, Erotic Sex Monster Every Day... Ai Sayama [Uncensored L**ked]",https://pic.javct.net/poster/20250606/1752167661.jpg,https://javct.net/v/mimk-217-rm,120,2026-05-02
200GANA-3374,"A hybrid of angelic visuals and chaotic cumming voice [Nagisa, 20 years old] The gap between her appearance and her appearance is different from that of an erotic woman who cums with a wild voice while jerking her hairy pussy. In the sex room of a seasoned pick-up artist, she is taken in and secretly filmed for sex 438",https://pic.javct.net/poster/04112026/96ee0b96fc.jpg,https://javct.net/v/200gana-3374,62,2026-05-02
DDH-392,Karen & Saya,https://pic.javct.net/poster/04112026/269a0d7ad2.jpg,https://javct.net/v/ddh-392,67,2026-05-02
586HNHU-0200,"Matching super beautiful woman is dissatisfied with her boyfriend and wants it right away www. She can't stand the end of her boyfriend for 10 minutes and wants it right away, squirts and cums continuously, raw sex and continuous creampie perverted pussy",https://pic.javct.net/poster/04112026/9992a7644b.jpg,https://javct.net/v/586hnhu-0200,61,2026-05-02
FC2PPV-4891125,A wife who is called while cleaning the house and plays with two cocks - thin face mosaic set version,https://pic.javct.net/poster/04112026/a00955d162.jpg,https://javct.net/v/fc2ppv-4891125,61,2026-05-02
FC2PPV-4891929,"[Gonzo version of a housewife with no experience in society showing her face] It seems that she has experienced pregnancy, and her breasts are definitely big.",https://pic.javct.net/poster/04112026/e2b156326a.jpg,https://javct.net/v/fc2ppv-4891929,50,2026-05-02
NKKD-297-RM,"This Time, My Wife (30) Was Caught By A Part-time Job (20) (virgin) ... → I'm Sorry, So Please Release The AV As It Is. [Uncensored L**ked]",https://pic.javct.net/poster/20230908/1694150094.jpg,https://javct.net/v/nkkd-297-rm,180,2026-05-02
NACR-726-RM,"Leave It To Shiori Tsukada. Consultation Room For Any Concerns You May Have. ""For Uncut Cherry College Students."" [Uncensored L**ked]",https://pic.javct.net/poster/20231011/1699155376.jpg,https://javct.net/v/nacr-726-rm,120,2026-05-02
MIGD-523-RM,Yoshimi Riina One Shot Out Of The Amount Was Really [Uncensored L**ked],https://pic.javct.net/poster/01202026/1772766342.jpg,https://javct.net/v/migd-523-rm,120,2026-05-02
SAN-128-RM,A Bokeh Unfaithful Wife Who Was Infidelity By A Neighbor's Bitch Man Was Fucked With Restraints Attached And Fucked And Broken / Haru Ogawa [Uncensored L**ked],https://pic.javct.net/poster/20230205/1685604320.jpg,https://javct.net/v/san-128-rm,130,2026-05-02
MARA-062-RM,Hana Haruna Colossal Tits KCups! 108cm [Uncensored L**ked],https://pic.javct.net/poster/20212709/1635740432.jpg,https://javct.net/v/mara-062-rm,119,2026-05-02
PAKO-065-RM,# Minato-ku Video When My Son's Nursery School Mom Friends Ran Into An Affair [Uncensored L**ked],https://pic.javct.net/poster/20230908/1694490616.jpg,https://javct.net/v/pako-065-rm,140,2026-05-02
MIDA-492-RM,"A 21-year-old College Student, 146 Cm Tall, With Only One Friend, And The Only Member Of Japan's ""Erotic Research Club,"" Is Named Hiyori Sasakura. This Is A 150-day Documentary Following An Ordinary Girl Who Is ""just Into Erotica"" Until Her AV Debut. [Uncensored L**ked]",https://pic.javct.net/poster/04112026/f0934738fd.jpg,https://javct.net/v/mida-492-rm,180,2026-05-02
LULU-235-RM,"""You're Not Satisfied With Just One Ejaculation, Are You...?""My Pregnant Wife Is Right By My Side, But She's A Busty Mama Friend Who Keeps Pulling Out With Her Close Whispers And Dirty Talk Is A Master Of Chasing Saaya Kirijo [Uncensored L**ked]",https://pic.javct.net/poster/20230804/1693629758.jpg,https://javct.net/v/lulu-235-rm,160,2026-05-02
KTKC-167-RM,"A Sober Glasses Girl From Fukui, A Miracle Of A National Treasure-class Huge Breasts When She Takes It Off. Ah, I Found A Wonderful Talent In Tokyo Documentary. [Uncensored L**ked]",https://pic.javct.net/poster/20230804/1693626094.jpg,https://javct.net/v/ktkc-167-rm,125,2026-05-02
SCOP-819-RM,"""My Clothes Were Stolen By A Customer..."" An Esthetician Dispatched To A Hotel Unexpectedly Exposes Her Breasts In An SOS! ! The Esthetician Hachi Who Found Out That The Staff Who Went To Help Was A Virgin Drip Oil On This And Turn On The Erotic Switch! ! A Miracle Virgin Graduation At The Woman On Top Posture That Shakes Big Breasts! ! [Uncensored L**ked]",https://pic.javct.net/poster/20230908/1694235098.jpg,https://javct.net/v/scop-819-rm,150,2026-05-02
JUY-301-RM,Congratulation! !Madonna Exclusive Dream Kazama Yumi AV Actress 20th Anniversary Shooting AV Hidden Behind The Guest At A Memorial Party On The Night Before The Shoot! !Further Takeaway Voyeur Video Also L**ked! ! [Uncensored L**ked],https://pic.javct.net/poster/20243105/1718615068.jpg,https://javct.net/v/juy-301-rm,190,2026-05-02
ZEX-383-RM,Overwhelming Cool Beauty Beautiful Girl Shaved Active College Student AV Debut Haru Nagata [Uncensored L**ked],https://pic.javct.net/poster/04112026/ca0cf1a38c.jpg,https://javct.net/v/zex-383-rm,117,2026-05-02
STAR-963-RM,"Dense, Dense, Close, And Rough Melting Brains!Entangling Kissing Sound Even After Ejaculation Sought Fire Continuation Burntuous Intercourse Honjo Bell [Uncensored L**ked]",https://pic.javct.net/poster/20222612/1674067225.jpg,https://javct.net/v/star-963-rm,195,2026-05-02
SOAV-060-RM,Wife's Cheating Heart Yuka Shinohara [Uncensored L**ked],https://pic.javct.net/poster/04112026/66c56db3f7.jpg,https://javct.net/v/soav-060-rm,100,2026-05-02
XVSR-224-RM,Erotic Novel A Young Wife In The Throes Of Womanhood Sweetness In The Palm Of Her Hand Mami Nagase [Uncensored L**ked],https://pic.javct.net/poster/20220406/1656374183.jpg,https://javct.net/v/xvsr-224-rm,121,2026-05-02
MUDR-084-RM,Tsun Emu! ~ Teach And Tie Tightly ~ Live-action Version Rui Hizuki [Uncensored L**ked],https://pic.javct.net/poster/04112026/f8483253d4.jpg,https://javct.net/v/mudr-084-rm,120,2026-05-02
TOTK-019-RM,The Lewd Games Of A Transgender Slut: Climax Domination Asshole Battle - Himeoka Shia [Uncensored L**ked],https://pic.javct.net/poster/04112026/dda1559320.jpg,https://javct.net/v/totk-019-rm,126,2026-05-02
MIST-388-RM,Danger Day Direct Hit! ! Soapland Where You Can Make Babies 42 Noa Eikawa [Uncensored L**ked],https://pic.javct.net/poster/20222311/1670468648.jpg,https://javct.net/v/mist-388-rm,157,2026-05-02
SQTE-496-RM,She Looks Bright But Is Surprisingly Perverted. A God-style Perverted Beauty S-Cute Makes Her Debut! Reia Shiraishi [Uncensored L**ked],https://pic.javct.net/poster/20230908/1694839523.jpg,https://javct.net/v/sqte-496-rm,109,2026-05-02
SOAV-058-RM,Married Woman's Cheating Heart [Uncensored L**ked],https://pic.javct.net/poster/06032026/1773273861.jpg,https://javct.net/v/soav-058-rm,105,2026-05-02
OFKU-242-RM,"The Head Nurse's Wife's Mother Seduces In Her Nurse Uniform. Forbidden Creampie With A Ripe, Busty Stepmother Wrapped In A White Coat And Stockings. Emiko Sugioka [Uncensored L**ked]",https://pic.javct.net/poster/04112026/6d222b514b.jpg,https://javct.net/v/ofku-242-rm,120,2026-05-02
TPPN-024-RM,Reason Collapse In Pleasure. Sakuraena [Uncensored L**ked],https://pic.javct.net/poster/04112026/eaad379b87.jpg,https://javct.net/v/tppn-024-rm,120,2026-05-02
TPPN-021-RM,"Speechless Obscene, Prisoner Of Libido Without End. Rei Aoki [Uncensored L**ked]",https://pic.javct.net/poster/04112026/396d610718.jpg,https://javct.net/v/tppn-021-rm,120,2026-05-02
EMBM-051-RM,Amateur Holstein Milk Wife - Quarter Beautiful Wife's Obscene Big Areola I Cup Nakano Kozue [Uncensored L**ked],https://pic.javct.net/poster/04112026/72eb90b8c8.jpg,https://javct.net/v/embm-051-rm,139,2026-05-02
KOO-009-RM,Hinako [Uncensored L**ked],https://static.javct.net/poster/1624080449.jpg,https://javct.net/v/koo-009-rm,117,2026-05-02
FUNK-042-RM,Honor Student J-kei Are Perverted Exhibitionist J-kee Who Have A Habit Of Exposing Naked In Dangerous Places Such As Schools And School Roads [Uncensored L**ked],https://pic.javct.net/poster/20230804/1693629879.jpg,https://javct.net/v/funk-042-rm,172,2026-05-02
ONED-364-RM,Barely On The Southern Island Pakopako SEX ON THE BEACH ~! Maria Ozawa [Uncensored L**ked],https://pic.javct.net/poster/04112026/68f33969fc.jpg,https://javct.net/v/oned-364-rm,120,2026-05-02
NHDTB-769-RM,Female Camper Who Couldn't Help Her Friend Who Was Brought Into The Tent And Was Turned Around At The Same Time [Uncensored L**ked],https://pic.javct.net/poster/20230205/1683775065.jpg,https://javct.net/v/nhdtb-769-rm,175,2026-05-02
XVSR-222-RM,Sayo Kanno Go! !Assault Streets Reverse Wrecked DX Ueno Ed. [Uncensored L**ked],https://pic.javct.net/poster/06032026/1775142228.jpg,https://javct.net/v/xvsr-222-rm,130,2026-05-02
GMJK-013-RM,"Exposure Aokan-Outdoor, Slapping, Facial, Strangling... M Woman's Pleasure-Anna Suzune [Uncensored L**ked]",https://pic.javct.net/poster/20230908/1694491457.jpg,https://javct.net/v/gmjk-013-rm,120,2026-05-02
MIDD-917,Pear Katsuki Yuu Men Hunt The Exposure Limit,https://pic.javct.net/poster/04112026/d75bc29771.jpg,https://javct.net/v/midd-917,180,2026-05-02
DIC-043-RM,F Cup Single Player AV Debut Orchid 19 Years Old I Came To Earn Money To Aim For Professional Golf History I Have Sex Love Big Babe Beautiful Girls With A Career Of Over 10 Years [Uncensored L**ked],https://pic.javct.net/poster/10232025/1761824877.jpg,https://javct.net/v/dic-043-rm,160,2026-05-02
NHD-001-SUB,Look At My Pork Bowl. Kana Morisawa [English Subtitle],https://pic.javct.net/poster/06032026/1773237740.jpg,https://javct.net/v/nhd-001-sub,120,2026-05-02
420HPT-053-RM,"Shiro (22) Amateur Hoi Hoi, Amateur Hoi Hoi Pet, Amateur, Beautiful Girl, Neat, Junior, Big Breasts, Masochistic Woman, Obedience, Sex Friend, Jumping, Outdoors, Shame, Toy, Creampie, Gonzo, Documentary [Uncensored L**ked]",https://pic.javct.net/poster/04112026/c2c72e0067.jpg,https://javct.net/v/420hpt-053-rm,99,2026-05-02
FSET-581-RM,To Field Tion In Home From School School Girls [Uncensored L**ked],https://pic.javct.net/poster/04112026/100416cc89.jpg,https://javct.net/v/fset-581-rm,135,2026-05-02
SUN-098-RM,Ekiben Exposure I Love Hug Sex! ! Bread Bread Bread Bread Bread Bread Bread Girl! [Uncensored L**ked],https://pic.javct.net/poster/20230908/1694922296.jpg,https://javct.net/v/sun-098-rm,166,2026-05-02
DV-628-RM,Kaede Matsushima Love Paradise [Uncensored L**ked],https://pic.javct.net/poster/20250903/1744212174.jpg,https://javct.net/v/dv-628-rm,120,2026-05-02
SUN-097-RM,Oil Painting (Nuruteka) Titty Fuck Exposure Minimum Big Breasts G Cup And Whole Body Slimy Outdoor Sex [Uncensored L**ked],https://pic.javct.net/poster/20230908/1694922396.jpg,https://javct.net/v/sun-097-rm,176,2026-05-02
CEMD-833-RM,"No-bra Big-breasted, Plump Boobs Date 8 Nishimura Nina [Uncensored L**ked]",https://pic.javct.net/poster/04112026/1777054654.jpg,https://javct.net/v/cemd-833-rm,163,2026-05-02
MAGURO-076,Nikkan Gal Mixed Bathing Carnal Bathhouse Erotic Too Transformation Older Sister And Lewd Men Nishimura Nina,https://pic.javct.net/poster/04112026/c6531c902c.jpg,https://javct.net/v/maguro-076,150,2026-05-02
BLK-071-RM,Big black beauty gal kira ☆ kira BLACK GAL BEACH 2012!Hundred Flower Nishina Jcup ☆ FUCK ON THE BEACH The most comprehensive shake Geki [Uncensored L**ked],https://pic.javct.net/poster/20241115/1734567779.jpg,https://javct.net/v/blk-071-rm,120,2026-05-02
SGM-042-RM,Outdoors ● Psychopathic Strength In The Remote Mountains ● Married Women Who Were Attacked By Demons And Cried In Vain And Covered In Mud ● [Uncensored L**ked],https://pic.javct.net/poster/04112026/1b228793d0.jpg,https://javct.net/v/sgm-042-rm,120,2026-05-02
IPTD-948-RM,SEX on the beach trying to clean! Minori Hatsune [Uncensored L**ked],https://pic.javct.net/poster/04112026/dc04230dc9.jpg,https://javct.net/v/iptd-948-rm,110,2026-05-02
