code,title,image_url,page_url,views,date_scraped
SIRO-5510,A lewd dental hygienist who is an erotic evangelist who feels instinctively has applied. Her whole body gets wet quickly with the erogenous zones. She has orgasmed many times and can't stop shaking her hips. She shakes her hips with the hips trained in dance. [First shot] AV application online AV experience shooting 2412,https://pic.javct.net/poster/06032026/1774587361759.jpg,https://javct.net/v/siro-5510,69,2026-03-27
SIRO-5548,"[Isn't it okay to blow like this...] Even though she has a neat atmosphere, she masturbates every night with NTR AV. She squirts a lot of excitement when she gets fingered for the first time in half a year. [First shot] AV application online AV experience shooting 2424",https://pic.javct.net/poster/06032026/1774585597770.jpg,https://javct.net/v/siro-5548,58,2026-03-27
SIRO-5544,A popular con cafe girl applied because she wanted to have sex. She captivates the customers' hearts with her cute smile. She becomes captivated by the pleasure of her nipples. She cums repeatedly and can't stop the tide from overflowing. [First shot] AV application online AV experience shooting 2433,https://pic.javct.net/poster/06032026/1774585736178.jpg,https://javct.net/v/siro-5544,71,2026-03-27
SIRO-5542,A fresh beauty in her second year in the workforce [Kaho-san] The ultimate SEX where her youthful clear skin and slender curves twist lewdly [First shot] AV application online AV experience shooting 2435,https://pic.javct.net/poster/06032026/1774585878626.jpg,https://javct.net/v/siro-5542,69,2026-03-27
SIRO-5538,Take a look at her wild side that made her dream of having sex with a huge squirting actor come true due to the fingering of a powerful G-cup actor. [First shot] AV application online AV experience shooting 2430,https://pic.javct.net/poster/06032026/1774586167530.jpg,https://javct.net/v/siro-5538,60,2026-03-27
FC2PPV-4869465,"[No] Women's Body Sharing Chapter 11 A neat and clean office lady who plays with a short, masochistic man falls into an extremely thick cock in front of her eyes. She is fo**ed to jerk off while being shown the thick creampie, and finally ejaculates in her own ass. NTR despair development [Overseas version] Bonus included",https://pic.javct.net/poster/06032026/1774573933.jpg,https://javct.net/v/fc2ppv-4869465,48,2026-03-27
FC2PPV-4868478,[First shot] A special cream is poured onto the fair and fine skin of a professional baker who dreams of opening a bakery.,https://pic.javct.net/poster/06032026/1774573818.jpg,https://javct.net/v/fc2ppv-4868478,64,2026-03-27
FC2PPV-4862961,"First time [Face showing/No/Creampie] Short stature, small breasts, young wife who seems to be calm and quiet, uses another man's stick to release her sexual desire, repeating It feels better than my husband's ♡ and being inseminated raw with someone else's semen",https://pic.javct.net/poster/06032026/1774574143.jpg,https://javct.net/v/fc2ppv-4862961,60,2026-03-27
FC2PPV-4869417,"[None] [Public] I took the really cute and tight beauty Ai-chan #5 into the room, creampied her, and had sex with her.",https://pic.javct.net/poster/06032026/1774574100.jpg,https://javct.net/v/fc2ppv-4869417,65,2026-03-27
FC2PPV-4869254,[Festival shock yukata mouth ejaculation] Erotic blowjob time on a festival day What happens at my parents' home without parents...,https://pic.javct.net/poster/06032026/1774573850.jpg,https://javct.net/v/fc2ppv-4869254,32,2026-03-27
FC2PPV-4869188,"[Uncensored x Personal Shooting] **pyjpx*jsps I finally met my boyfriend in private after wooing my favorite hostess in her 30s. I'm already engaged to her, so I don't want him to find out. Still, she readily agreed to appear in the video.",https://pic.javct.net/poster/06032026/1774573966.jpg,https://javct.net/v/fc2ppv-4869188,58,2026-03-27
FC2PPV-1870810,"[If found out, it's dangerous to show your face] [Appearance of a certain O-trend] Model-class beautiful legs perverted *♥** Uniform x black tights A raw piston that penetrates to the root of the shaved pussy w Creampie perverted penis stud (Full HD bonus included)",https://pic.javct.net/poster/06032026/1774568546.jpg,https://javct.net/v/fc2ppv-1870810,55,2026-03-27
SIRO-5649-RM,Sex is a game that can be enjoyed in moderation. A girl who has learned the joy of sex plays with the penis as if it were a game. She is on the verge of exploding from the unstoppable pleasure. [First shot] AV application online AV experience shooting 2530 [Uncensored L**ked],https://pic.javct.net/poster/06032026/1774333793574.jpg,https://javct.net/v/siro-5649-rm,64,2026-03-27
MGMR-011-RM,"A Voluptuous, Tall Queen's Intense, Intense, And Intense Physical Session. Her Freedom, Breathing, And Pleasure Are All Controlled By The Pressure, Bodily Fluids, And Strap-on, Turning Her Into A Real Masochist! Aya [Uncensored L**ked]",https://pic.javct.net/poster/06032026/1774324180.jpg,https://javct.net/v/mgmr-011-rm,146,2026-03-27
483MADO-012-RM,M-ku blonde twinte short stature gal deli girl [Uncensored L**ked],https://pic.javct.net/poster/06032026/1774441907802.jpg,https://javct.net/v/483mado-012-rm,38,2026-03-27
XVSR-105-RM,O'clock Backroom Fuck 24 Mitsui Yuno [Uncensored L**ked],https://pic.javct.net/poster/06032026/1774576674.jpg,https://javct.net/v/xvsr-105-rm,120,2026-03-27
DASD-911-RM,"Woman Genuinely Addicted To Anal Fucking, Asshole Honor Student SP [Uncensored L**ked]",https://static.javct.net/poster/dasd-911.jpg,https://javct.net/v/dasd-911-rm,179,2026-03-27
XRW-577-RM,Horny Sluts' Beloncho Sex [Uncensored L**ked],https://pic.javct.net/poster/06032026/1774576790.jpg,https://javct.net/v/xrw-577-rm,125,2026-03-27
SSIS-858-RM,"Even Though You're A Teacher, You're Bound To Get Fucked By Us Because You Have Huge Erotic Breasts, You Understand, Right? Nagi Hikaru [Uncensored L**ked]",https://pic.javct.net/poster/20230908/1694714182.jpg,https://javct.net/v/ssis-858-rm,120,2026-03-27
ADN-503-RM,My Father-in-law's Kiss As He Licks Me Miu Shiramine [Uncensored L**ked],https://pic.javct.net/poster/20231011/1699149399.jpg,https://javct.net/v/adn-503-rm,120,2026-03-27
SONE-248-RM,K-cup Secretary Gets Licked And Violated By Her Slug-like Boss Until She Cums Hikaru Nagi [Uncensored L**ked],https://pic.javct.net/poster/20243105/1720146570.jpg,https://javct.net/v/sone-248-rm,120,2026-03-27
JUQ-404-RM,Nude Model NTR Shocking Cheating Video Of A Wife Drowning In Shame With Her Boss Sayuri Hayama [Uncensored L**ked],https://pic.javct.net/poster/20231011/1698144969.jpg,https://javct.net/v/juq-404-rm,120,2026-03-27
FPRE-004-RM,Sleep R**e: Putting My Cocky Son's Big-breasted Wife To Sleep With Sleeping Pills And Raping Her. Mina Kitano [Uncensored L**ked],https://pic.javct.net/poster/20231912/1704020502.jpg,https://javct.net/v/fpre-004-rm,150,2026-03-27
JUQ-943-RM,Nude Model NTR: Shocking Video Of Wife Cheating With Her Boss And Drowning In Shame Meguri [Uncensored L**ked],https://pic.javct.net/poster/20241115/1732243413.jpg,https://javct.net/v/juq-943-rm,140,2026-03-27
SOAN-108-RM,"The Mother Of The Sakuma Family Who Fell Into Masochistic Anal. A Sexless Married Woman Who Is Not Recognized As A Woman By Her Husband Is Publicly Insulted And Inseminated In Two Holes By Another Man's Cock! The Whole Story Of How She Betrayed Her Husband And Fell Into Masochistic Awakening...Kaede, 42 Years Old [Uncensored L**ked]",https://pic.javct.net/poster/20242108/1727490518.jpg,https://javct.net/v/soan-108-rm,143,2026-03-27
JUQ-540-RM,"Wanted To Make My Wife Admit My Love, So I Left Her And My Unfaithful Junior Alone For 3 Hours...My NTR Story About How My Wife Was Stolen From Me With A Total Of 17 Vaginal Cum Shots Without Pulling Out Sayuri Hayama [Uncensored L**ked]",https://pic.javct.net/poster/20231912/1704643413.jpg,https://javct.net/v/juq-540-rm,120,2026-03-27
FSDSS-672-RM,"I keep being r**ed... A beautiful wife from a rural area is trained by a young man from the city near her husband, and she falls into a sexual assault with Nene Yoshitaka. [Uncensored L**ked]",https://pic.javct.net/poster/20231011/1697259924.jpg,https://javct.net/v/fsdss-672-rm,120,2026-03-27
YUJ-008-RM,"You Have A Husband And I Have A Wife, But You And Your Colleagues At Work Asked Each Other Until The Sun Rose. Miu Shiramine [Uncensored L**ked]",https://pic.javct.net/poster/20230908/1695605474.jpg,https://javct.net/v/yuj-008-rm,120,2026-03-27
STARS-923-RM,"5 Situations Where You Can Enjoy Rei Kamiki's ""beautiful Butt"" With A Transcendental Style.Actually, I...not Only My Boobs But Also My Buttocks Are Amazing Rei Kamiki [Uncensored L**ked]",https://pic.javct.net/poster/20231011/1697068491.jpg,https://javct.net/v/stars-923-rm,156,2026-03-27
JUQ-510-RM,The World's Most Luxurious Commemorative Work! ! Madonna 20th Anniversary - First Ever ALL Exclusive Bus Tour With Unlimited Creampie And Steam! ! First Part 4 Hours OVER 2-disc Set! ! [Uncensored L**ked],https://pic.javct.net/poster/20231912/1703554075.jpg,https://javct.net/v/juq-510-rm,290,2026-03-27
FTAV-003-RM,"""I Love Him, But... I'm Getting Wet Just Thinking About What He's Going To Do..."" I-cup Nurse, 22 Years Old, Not Affiliated With Kimitsu City, Chiba Production, A Woman With Natural Big Breasts Who Lives In The Countryside, Still An Amateur, SOFT ON DEMAND Yu Sasamoto's (tentative) Appearance For The Fourth Time In The New House Where Her Married Life Begins And Her Fiancé Works... [Uncensored L**ked]",https://pic.javct.net/poster/20242108/1727115023.jpg,https://javct.net/v/ftav-003-rm,159,2026-03-27
URE-100-RM,"Congratulations! Commemorative Work For 100 Mature Comics Original Work: Purpoison Mother-eating ~Yarichin Travel Edition~ Cumulative Total Of Over 100,000 Downloads Of The Series! ! A Live-action Sequel To The Legendary Popular Doujin Work Starring Madonna! ! Exclusive, Ririko Kinoshita's 6 Gorgeous Performances With Large Volumes! ! [Uncensored L**ked]",https://pic.javct.net/poster/20231711/1702777063.jpg,https://javct.net/v/ure-100-rm,240,2026-03-27
MVSD-471-RM,Remote Control NTS Indecent Pant Of My Beloved Wife Drowning In Another Stick Michiru Kujo [Uncensored L**ked],https://pic.javct.net/poster/20231912/1704622292.jpg,https://javct.net/v/mvsd-471-rm,120,2026-03-27
ADN-564-RM,"I Kept Giving My Son's Wife An Aphrodisiac So That She Wouldn't Find Out, And I Made Her Body, Which Had Become An Erogenous Zone, Go Crazy With Excitement And Climax. Shiramine Miu [Uncensored L**ked]",https://pic.javct.net/poster/20241804/1714707796.jpg,https://javct.net/v/adn-564-rm,160,2026-03-27
MEYD-890-RM,I Spent A Week Having Sex With A Big-breasted Aunt With A Sloppy Personality In A Ch**ing Trash Room. Sayama Love [Uncensored L**ked],https://pic.javct.net/poster/20241703/1710726271.jpg,https://javct.net/v/meyd-890-rm,150,2026-03-27
JUQ-563-RM,Days Of Creampie Ring That Will Never End. Sayuri Hayama [Uncensored L**ked],https://pic.javct.net/poster/20241901/1708307694.jpg,https://javct.net/v/juq-563-rm,120,2026-03-27
FSDSS-673-RM,"My husband isn't here today, so why don't we have another drink at home? I, Yuko Ono, got excited when I saw my ex-girlfriend again at the class reunion, wearing no panties or bra. [Uncensored L**ked]",https://pic.javct.net/poster/20231011/1698379389.jpg,https://javct.net/v/fsdss-673-rm,120,2026-03-27
JUQ-439-RM,"During My Wife's Pregnancy, I Was Forbidden To Even Masturbate, So I Had Sex With My Mother-in-law, Sayuri, Who Had Moved To Tokyo Many Times... Sayuri Hayama [Uncensored L**ked]",https://pic.javct.net/poster/20231011/1699830529.jpg,https://javct.net/v/juq-439-rm,120,2026-03-27
ROE-163-RM,My Aunt's Wet And See-through Body. A Night Alone Under The Same Roof... Sentimental Rain Pattern Yuka Mizuno [Uncensored L**ked],https://pic.javct.net/poster/20230908/1695970848.jpg,https://javct.net/v/roe-163-rm,140,2026-03-27
WAAA-303-RM,I Asked My Plump Wife At My Part-time Job To Be My Tutor... Ai Sayama [Uncensored L**ked],https://pic.javct.net/poster/20230908/1696605519.jpg,https://javct.net/v/waaa-303-rm,120,2026-03-27
ACHJ-030-RM,Madonna Dengeki Exclusive Authentic Slut Sumire Mizukawa Endless Ejaculation Orgasm That Makes Masochist Man's Body And Mind Melt With Deep And Rich Kisses And Stopping Creampie [Uncensored L**ked],https://pic.javct.net/poster/20231711/1700382348.jpg,https://javct.net/v/achj-030-rm,110,2026-03-27
PRED-526-RM,"When I Took Care Of Miu-sensei Who Had Collapsed And Sent Her Home... I Was A Monster Of Sexual Desire, And I Couldn't Stop Getting An Erection Due To Her Plump, Beautiful Legs And Strong Legs, And Ended Up Ejaculating Over And Over Again Until Morning. Shiramine Miu [Uncensored L**ked]",https://pic.javct.net/poster/20231011/1697500675.jpg,https://javct.net/v/pred-526-rm,120,2026-03-27
336KNB-405,"[For the pastime of a wife with beautiful legs and sticky breasts] Before having sex with her husband, she appears in an AV with her boobs swaying and rubbing as an appetizer SEX at Toda Station, Toda City, Saitama Prefecture",https://pic.javct.net/poster/06032026/1774513327621.jpg,https://javct.net/v/336knb-405,63,2026-03-27
SIRO-5650,Look at the sex of the Reiwa generation.A 19-year-old who works at a famous theme park has applied for sex.He is very curious about the sex and has an adorable honeycomb face. His erogenous zones are too sensitive. Maybe it's because he's young. His sex potential is too high. [First shot] AV application online AV experience shooting 2530,https://pic.javct.net/poster/06032026/1774513252997.jpg,https://javct.net/v/siro-5650,66,2026-03-27
FC2PPV-4869209,[Creampie] Smooth and perfectly trained bitch wife served with the best technique,https://pic.javct.net/poster/06032026/1774493391.jpg,https://javct.net/v/fc2ppv-4869209,39,2026-03-27
FC2PPV-4868773,"[None] [Publication] When the black ban was lifted, I made the husband wait in front of the room for 3P, and the two big black guys fucked the super beautiful married woman violently until her muscles ached and her pussy tingled, ejaculated a large amount of thick semen into her mouth, and made her swallow.",https://pic.javct.net/poster/06032026/1774422683.jpg,https://javct.net/v/fc2ppv-4868773,119,2026-03-27
FC2PPV-4868871,209 3 creampies in a row on 3 slender beautiful bodies ♡ Even women and A〇 actresses who can hear their voices are uncensored with special benefits,https://pic.javct.net/poster/06032026/1774493579.jpg,https://javct.net/v/fc2ppv-4868871,45,2026-03-27
FC2PPV-4868188,"""Really big raw uncensored gonzo second part **pyjpx*jsps"" Sensitive beautiful breasts and pussy are attacked in cosplay and reach continuous climax",https://pic.javct.net/poster/06032026/1774493492.jpg,https://javct.net/v/fc2ppv-4868188,67,2026-03-27
FC2PPV-4868976,"A 19-year-old black-haired beauty who became addicted to dicks due to deep-throating.Even though she looks neat and clean, she can't stop giving a sucking blow job and creampie.",https://pic.javct.net/poster/06032026/1774493634.jpg,https://javct.net/v/fc2ppv-4868976,80,2026-03-27
FC2PPV-4869095,[First shot] We train an 18-year-old dick with the raw penis of a female gaki Wawasasetai uncle. He squirts a lot and cums in a huge amount in her wet pussy.,https://pic.javct.net/poster/06032026/1774493666.jpg,https://javct.net/v/fc2ppv-4869095,73,2026-03-27
FC2PPV-4869091,[15 shots/facial cum swallowing] *Self-regulation version *Graduation celebration memorial facial cum swallowing party-Beauty and ugliness-2025 (Ayano),https://pic.javct.net/poster/06032026/1774493460.jpg,https://javct.net/v/fc2ppv-4869091,23,2026-03-27
FC2PPV-4866873,"[Uncensored]**pyjpx*jsps Raw creampie for S-class reflexology girl Miku-chan, who is as cute as a celebrity!!",https://pic.javct.net/poster/06032026/1774493609.jpg,https://javct.net/v/fc2ppv-4866873,67,2026-03-27
FC2PPV-4861220,"A slender JD with a lack of sexual desire, who is confused by the first squirt in her life, cums continuously and finally ejaculates in a large amount by begging for creampie from the old man's cock",https://pic.javct.net/poster/06032026/1774493713.jpg,https://javct.net/v/fc2ppv-4861220,65,2026-03-27
MFC-357,"Obedient college student whose pussy is conveniently used × first time sex, exciting SM play close-up of the private part makes me feel embarrassed... But the pleasure wins and it's natural to climax, and the second round of creampie from raw dick insertion is even more powerful SM play with restraints [Sakura (university student)]",https://pic.javct.net/poster/06032026/1774421640726.jpg,https://javct.net/v/mfc-357,74,2026-03-27
FC2PPV-4868949,"A close look at the daily life of a slender beauty I met in Kabukicho, including cosplay, blowjob, and raw creampie.",https://pic.javct.net/poster/06032026/1774493531.jpg,https://javct.net/v/fc2ppv-4868949,59,2026-03-27
483MADO-012,M-ku blonde twinte short stature gal deli girl,https://pic.javct.net/poster/06032026/1774441907802.jpg,https://javct.net/v/483mado-012,38,2026-03-27
200GANA-3349,"A girl who likes the outdoors is teased with an active toy and a dick at the same time, and she cries out loud. In the sex room of a seasoned pick-up artist, she is taken in and secretly filmed for sex 434",https://pic.javct.net/poster/06032026/1774421707580.jpg,https://javct.net/v/200gana-3349,67,2026-03-27
