code,title,image_url,page_url,views,date_scraped
JUY-983-RM,Countdown to Creampie. Leona Kirishima [Uncensored L**ked],https://pic.javct.net/poster/20221202/1646702625.jpg,https://javct.net/v/juy-983-rm,118,2026-03-24
JUY-368-RM,"I Was Continuously R**ed By My Husband's Boss, And On The 7th Day, I Lost My Mind... Mako Oda [Uncensored L**ked]",https://pic.javct.net/poster/20212011/1640937083.jpg,https://javct.net/v/juy-368-rm,115,2026-03-24
PRED-379-SUB,"When My Husband was Away, My Father-in-Law I Hate Made Me Cum Like Never Before...Luna Tsukino [English Subtitle]",https://pic.javct.net/poster/20212011/1644559936.jpg,https://javct.net/v/pred-379-sub,119,2026-03-24
SSIS-231-US,"Younger Man Unable to Resist Tempting Posing of 8-Headed Beautiful-Legged Married Woman in Far Window After Moving Home! Marin Hinata [English Subtitle, Reducing Mosaic]",https://pic.javct.net/poster/20212709/1636093523.jpg,https://javct.net/v/ssis-231-us,119,2026-03-24
NGOD-171-RM,"The Woman From The Convenience Store Headquarters, 11. Sarina Momonaga [Uncensored L**ked]",https://pic.javct.net/poster/20221904/1651814576.jpg,https://javct.net/v/ngod-171-rm,120,2026-03-24
GNAX-017-RM,New Intruder Ai Mukai [Uncensored L**ked],https://pic.javct.net/poster/20212709/1633769550.jpg,https://javct.net/v/gnax-017-rm,105,2026-03-24
HOMA-093-RM,"I'm Working As A Private Tutor For My Girlfriend's Little Sister (A Neat And Clean J*), But... The Truth Is That She's An Orgasmic Bitch, And Secretly Hitting Me With Siren Reverse NTR Plays When My Girlfriend's Not Looking Yui Nagase [Uncensored L**ked]",https://pic.javct.net/poster/20221108/1660784835.jpg,https://javct.net/v/homa-093-rm,121,2026-03-24
NGOD-170-RM,I Got Fingered By My Husband's Mean Boss... Nene Tanaka [Uncensored L**ked],https://pic.javct.net/poster/20221202/1649409013.jpg,https://javct.net/v/ngod-170-rm,147,2026-03-24
JUY-938-RM,"""My Wife Received Another Suspicious Letter..."" A Married Woman Who Invites Chance Into Her Life - Ai Mukai [Uncensored L**ked]",https://pic.javct.net/poster/20212011/1639973476.jpg,https://javct.net/v/juy-938-rm,120,2026-03-24
JUY-505-RM,Up Close And Personal Sex My Neighbor And I Are Committing Hungry And Ravenous Double Adultery Yuka Oshima [Uncensored L**ked],https://pic.javct.net/poster/20221202/1647503902.jpg,https://javct.net/v/juy-505-rm,120,2026-03-24
SCD-198-RM,She's Good At Getting Fucked A Bus Tour Guide In A Miniskirt Arisa Hanyu [Uncensored L**ked],https://pic.javct.net/poster/20212709/1634400573.jpg,https://javct.net/v/scd-198-rm,122,2026-03-24
JUX-865-RM,But I Still Love You. Nozomi Tanihara [Uncensored L**ked],https://pic.javct.net/poster/20221202/1646177860.jpg,https://javct.net/v/jux-865-rm,119,2026-03-24
JUL-651-RM,"A Shocking Transfer No.2!! Her First True NTR Video!! Husband-And-Wife Swapping NTR Shocking Infidelity Videos Of My Wife And A Friend, Fucking By The Window Rinka Tahara [Uncensored L**ked]",https://static.javct.net/poster/jul-651.jpg,https://javct.net/v/jul-651-rm,120,2026-03-24
PRED-362-US,"My Wife And I Are Bored Of Each Other So Tempted By Karen (Step Sister) And Creampie Her Again And Again. Karen Yuzurihara [English Subtitle, Reducing Mosaic]",https://pic.javct.net/poster/20212011/1639724395.jpg,https://javct.net/v/pred-362-us,121,2026-03-24
JUY-445-RM,My Wife Is Being Fucked By Another Man... Cuckolding Cuckold Fucks Yuka Oshima [Uncensored L**ked],https://pic.javct.net/poster/20221202/1647504034.jpg,https://javct.net/v/juy-445-rm,119,2026-03-24
RKI-625-RM,"Every Time This Older Girl Says ""I Like That,"" She Makes Me Cum So Hard In A Wild Premature Ejaculation Like Pavlov's Dog. Runa Tsukino [Uncensored L**ked]",https://pic.javct.net/poster/20221202/1649401551.jpg,https://javct.net/v/rki-625-rm,152,2026-03-24
IPX-604-US,"I Hate My Boss So Badly, I Would Rather Die Than Fuck Him, But During Our Business Trip, To My Horror, We Were Booked Into The Same Room At A Hot Spring Resort Inn... And This Disgusting, Horny Old Man Made Me Cum, Over And Over Again. Minami Aizawa [English Subtitle, Reducing Mosaic]",https://static.javct.net/poster/ipx-604.jpg,https://javct.net/v/ipx-604-us,125,2026-03-24
AVOP-365-RM,"An Elite Corporate High Power Couple Making 20 Million Yen In Salary Vs A Construction Worker DQN Couple Making Only 3 Million Yen In Salary A Short And Uncircumcised Husband With A Slender And Beautiful Wife A DQN Big Cock Husband With Giant Balloon Titties Colossal Tits Dumb Bitch Wife This Is What Happened When They Swapped Partners Trauma NTR ""Let's Decide, Once And For All, Which Husband Is Better"" Shiori Tsukada Sakura Ario [Uncensored L**ked]",https://pic.javct.net/poster/20221904/1652616269.jpg,https://javct.net/v/avop-365-rm,120,2026-03-24
JUFD-616-RM,"Getting Silently Led To Temptation By My Little Stepbrothers Girlfriend, Because We Couldn't Allow Ourselves To Be Heard FUCK AIKA [Uncensored L**ked]",https://pic.javct.net/poster/20221904/1651027235.jpg,https://javct.net/v/jufd-616-rm,148,2026-03-24
BNSPS-399-RM,The Husband Who Got Back His Cheating Wife Yuka Taniguchi [Uncensored L**ked],https://pic.javct.net/poster/20212011/1643237244.jpg,https://javct.net/v/bnsps-399-rm,84,2026-03-24
NEWM-017-RM,True Abnormal Intercourse 50 Years Old Step-Mother And Step-Son Part 27 Frustrated Step-Mother Enchanted By Tireless Step-Son's Rod Shuri Yamaguchi [Uncensored L**ked],https://pic.javct.net/poster/20212011/1642828638.jpg,https://javct.net/v/newm-017-rm,121,2026-03-24
JUY-602-RM,"She Is Unfaithful With Her Clothes Still On, Full Tight Clothing Fuck. Reiko Sawamura [Uncensored L**ked]",https://pic.javct.net/poster/20220707/1660149537.jpg,https://javct.net/v/juy-602-rm,151,2026-03-24
MEYD-414-US,"I Went To This Sex Club That Didn't Allow Real Fucking, And To My Surprise, Out Came The Bitchy And Beautiful Married Woman From Next Door Now That I Knew Her Secret, I Could Demand Real Fucking And Creampie Sex Too! And I Fucked Her To Be My Obedient Sex Slave Outside Of The Club Too [English Subtitle, Reducing Mosaic]",https://pic.javct.net/poster/20221202/1646268354.jpg,https://javct.net/v/meyd-414-us,117,2026-03-24
SONE-574-SUB,"When your partner is in front of you, you'll be targeted by this beautiful woman who will whisper dirty talk, give you a titjob, and seduces you into an NTR (cuckold) relationship. Hikaru Nagi [English Subtitle]",https://pic.javct.net/poster/20253001/1738866422.jpg,https://javct.net/v/sone-574-sub,123,2026-03-24
KSBJ-020,Big Brother Of The Daughter-in-law Chirico Kinosaki,https://pic.javct.net/poster/06032026/1774329763.jpg,https://javct.net/v/ksbj-020,113,2026-03-24
C-2960-RM,Reminiscence: Record Of Married Women Reunited On A Steamy Trip [4] [Uncensored L**ked],https://pic.javct.net/poster/06032026/1774152877.jpg,https://javct.net/v/c-2960-rm,240,2026-03-24
JBD-218,To**ure Unrelated 3 Asu Hojo,https://pic.javct.net/poster/06032026/1774326676.jpg,https://javct.net/v/jbd-218,120,2026-03-24
VEC-769-RM,"I Want To Break Up, But I Still Love Him... My Husband's Dick Is A Perfect Match For Mine, And He Doesn't Do Any Housework Or Work. The Sex After A Fight Is So Good I Can't Escape, So I'm Happy With My Wife Sayuri Hayama [Uncensored L**ked]",https://pic.javct.net/poster/06032026/1774152319.jpg,https://javct.net/v/vec-769-rm,100,2026-03-24
TEM-028-RM,Many Times Racy Place A Business Trip Massage Was Terminated In Microphone Verge Stimulated Married Woman To Crave Out During Insertion Offer Their Own Extended!Five [Uncensored L**ked],https://pic.javct.net/poster/06032026/1774318119.jpg,https://javct.net/v/tem-028-rm,195,2026-03-24
NACT-102-RM,Sexually Enthralled Housewife Begging For Creampies - Hikari Misaki [Uncensored L**ked],https://pic.javct.net/poster/06032026/1774152692.jpg,https://javct.net/v/nact-102-rm,125,2026-03-24
C-2958-RM,Married Woman's Advice [010] () [Uncensored L**ked],https://pic.javct.net/poster/06032026/1774153001.jpg,https://javct.net/v/c-2958-rm,120,2026-03-24
JUY-281-RM,My Husband Does Not Know  My Secret Desires And Secrets  Wakaba Kana [Uncensored L**ked],https://pic.javct.net/poster/20212011/1644320611.jpg,https://javct.net/v/juy-281-rm,120,2026-03-24
GVG-684-RM,The Frustrated Part's Wives Are Always Aiming For A Rookie's Erection While In Estrus!2 [Uncensored L**ked],https://pic.javct.net/poster/06032026/1774317592.jpg,https://javct.net/v/gvg-684-rm,130,2026-03-24
JUL-658-RM,Creampies And Gangbangs Every Day For An Eternity. Rin Okae [Uncensored L**ked],https://static.javct.net/poster/jul-658.jpg,https://javct.net/v/jul-658-rm,118,2026-03-24
SAN-085-RM,A Married Woman Who Was Conceived By Her Father-In-Law Who Loves Women / Sarina Momonaga [Uncensored L**ked],https://pic.javct.net/poster/20222311/1670898809.jpg,https://javct.net/v/san-085-rm,120,2026-03-24
NACR-666-RM,My Brother's Wife Playing With Me Miku Kitagawa [Uncensored L**ked],https://pic.javct.net/poster/20230205/1684555215.jpg,https://javct.net/v/nacr-666-rm,120,2026-03-24
LCW-037-RM,"If You Want To Have Sex, Definitely Go With A Local Married Woman! VOL.37 [Uncensored L**ked]",https://pic.javct.net/poster/20231711/1701489983.jpg,https://javct.net/v/lcw-037-rm,145,2026-03-24
ALDN-248-RM,Old Man Lucky Nami Togawa [Uncensored L**ked],https://pic.javct.net/poster/20231711/1702091488.jpg,https://javct.net/v/aldn-248-rm,130,2026-03-24
JUR-244-SUB,The Kitchen Is A Den Of Domestic Infidelity. [English Subtitle],https://pic.javct.net/poster/20253001/1741281197.jpg,https://javct.net/v/jur-244-sub,140,2026-03-24
VENX-115-RM,Long-distance Incest Once A Month With My Son Who Came To Tokyo I Will Go To Be Embraced By That C**ld Again This Month. Natsu Tojo [Uncensored L**ked],https://pic.javct.net/poster/20221202/1645172104.jpg,https://javct.net/v/venx-115-rm,100,2026-03-24
SDNM-542,"Wife who is defeated, prepares to become pregnant. Secretly having raw creampie sex at my in-laws' house with a SNS follower who wants to have eggs. Kazu Takashima",https://pic.javct.net/poster/06032026/1774286654413.jpg,https://javct.net/v/sdnm-542,169,2026-03-24
SDNM-544,"Kumi Koizumi, 41 years old, a healthy mother raising a 5-year-old daughter in Zushi City, Kanagawa Prefecture, ""I want to be messed up even more'' The liberated sexuality of a married woman, she forgets her husband and daughter and ends up orgasming, stays at home for 1 night and 2 days, and has a masochistic affair",https://pic.javct.net/poster/06032026/1774286573399.jpg,https://javct.net/v/sdnm-544,139,2026-03-24
RCTD-084-RM,R**e Mu VS Doe Slut SEX Which Way Will You Go Down First After Confrontation? [Uncensored L**ked],https://pic.javct.net/poster/20240807/1723017781.jpg,https://javct.net/v/rctd-084-rm,140,2026-03-24
MEYD-463-US,"I went to a mat health session without a real performance, and what came out was the arrogant beautiful wife of my neighbor. I grasped her weakness and fo**ed her to perform the actual act and cum inside her! Yu Shinoda made me a sex slave even outside the store [English Subtitle, Reducing Mosaic]",https://pic.javct.net/poster/01202026/1770165604.jpg,https://javct.net/v/meyd-463-us,119,2026-03-24
CESD-406-RM,My Pet's Mother-in-law 7 Riri Kirishima [Uncensored L**ked],https://pic.javct.net/poster/20222410/1667177865.jpg,https://javct.net/v/cesd-406-rm,138,2026-03-24
START-541,"""I Love My Father-in-law's Stinky Cock."" A Horny Wife, Bored With Sex With Her Husband, Has Awakened To A Life Of Fucking Sweaty Old Men. Sakura Mana",https://pic.javct.net/poster/06032026/1774286361.jpg,https://javct.net/v/start-541,140,2026-03-24
FTN-023-RM,I Wanted To See His Wife Do Not Know Of Me ... 17 [Uncensored L**ked],https://pic.javct.net/poster/06032026/1774280207.jpg,https://javct.net/v/ftn-023-rm,120,2026-03-24
FNS-168,A Big-breasted Snack Mom Who Was Tired Of Always Seeing All The Old Customers Served A Rare Young Customer In A Lustful After-hours Orgy With Sensuous Shaking Rin Yamitsu,https://pic.javct.net/poster/06032026/1774323623276.jpg,https://javct.net/v/fns-168,135,2026-03-24
FSDSS-345-RM,A First Time Escort On Her First Day 120 Minute Multiple Ejaculation Course With A Super High Class Soapland Escort Mayu Horisawa [Uncensored L**ked],https://pic.javct.net/poster/20212011/1640234382.jpg,https://javct.net/v/fsdss-345-rm,120,2026-03-24
LULU-131-RM,"To Get Support To Go Meet Her Long Distance Relationship Boyfriend, Beautiful Young Girl With A Juicy Ass Fucks An Older Guy With A Huge Cock And Cums Hard. Natsu Sano. [Uncensored L**ked]",https://pic.javct.net/poster/20221202/1648888994.jpg,https://javct.net/v/lulu-131-rm,160,2026-03-24
STARS-338-RM,"She's Got Bad Grades But She Gets An A For Her Nookie Technique, So I Told Her, I'll Teach You In Exchange For 12 Cum Shots Mei Miyajima [Uncensored L**ked]",https://pic.javct.net/poster/20212709/1636304199.jpg,https://javct.net/v/stars-338-rm,130,2026-03-24
SDMT-757-US,"First Time Anal Exclusively Contracted to SOD! Two Holes At Once Actual Creampie FUCK Maki Hojo [English Subtitle, Reducing Mosaic]",https://pic.javct.net/poster/20212011/1643419919.jpg,https://javct.net/v/sdmt-757-us,140,2026-03-24
JUY-414-RM,I Got My Cherry Popped By My Girlfriend's Mom As She Whispered Dirty Talk To Me Yuka Oshima [Uncensored L**ked],https://pic.javct.net/poster/20221202/1647504094.jpg,https://javct.net/v/juy-414-rm,146,2026-03-24
JUFD-795-RM,Big Tits Wife Bent Backwards Climax Over and Over Milking Line Super Salon - Mako Oda [Uncensored L**ked],https://pic.javct.net/poster/20220406/1657042426.jpg,https://javct.net/v/jufd-795-rm,151,2026-03-24
GVG-884-RM,A Slutty Wife Who Never Wears Bras Or Panties Moved In Next Door! Rino Kirishima [Uncensored L**ked],https://pic.javct.net/poster/20221904/1652316014.jpg,https://javct.net/v/gvg-884-rm,120,2026-03-24
DLDSS-479-RM,Agony! Repeated Revolver Creampie Without Pulling Out Mami Yoshiba [Uncensored L**ked],https://pic.javct.net/poster/06032026/1774152252340.jpg,https://javct.net/v/dldss-479-rm,125,2026-03-24
FSDSS-344-RM,"""It's My First Time Doing This..."" 3 Works Of Sexual Development Filled With ""Firsts"" Special!! Mayu Horizawa [Uncensored L**ked]",https://pic.javct.net/poster/20212011/1637815942.jpg,https://javct.net/v/fsdss-344-rm,151,2026-03-24
SOE-510-RM,Erina Shirase 's Cowgirl Special [Uncensored L**ked],https://pic.javct.net/poster/20221202/1645859037.jpg,https://javct.net/v/soe-510-rm,118,2026-03-24
JUL-657-RM,The Conversion of a Married Woman. Momoko Isshiki. [Uncensored L**ked],https://static.javct.net/poster/jul-657.jpg,https://javct.net/v/jul-657-rm,119,2026-03-24
VEC-314-RM,My Friend's Mother Rino Kirishima [Uncensored L**ked],https://pic.javct.net/poster/20220406/1654678916.jpg,https://javct.net/v/vec-314-rm,86,2026-03-24
SDMU-568-RM,SOD Romance. Original Work Of Lotus Kimura Alone In The Elevator With Stepmom (Mama). Yuri Nikaido. [Uncensored L**ked],https://pic.javct.net/poster/20221202/1650259841.jpg,https://javct.net/v/sdmu-568-rm,135,2026-03-24
SONE-556-SUB,"No sex or masturbation allowed! After a month of restraint, she's horny and sensitive, and when she tastes it with her wet body, she convulses with a female face and squirts a lot of juice in this abstinence best-of FUCK Hiyori Nosaka [English Subtitle]",https://pic.javct.net/poster/20253001/1738866612.jpg,https://javct.net/v/sone-556-sub,120,2026-03-24
GVG-549-US,"A Horny P*A Director And A Bad Boy Student Council President Reiko Kobayakawa [English Subtitle, Reducing Mosaic]",https://pic.javct.net/poster/20212011/1640833775.jpg,https://javct.net/v/gvg-549-us,130,2026-03-24
HMGL-127,The Out Embarrassing Body During & Cookies Uchimura Rina,https://pic.javct.net/poster/06032026/1774329822.jpg,https://javct.net/v/hmgl-127,120,2026-03-24
AKDL-018,"[Verified AV] The theory that if you have sex blindfolded, you won't know even if the other person changes",https://pic.javct.net/poster/06032026/1774332343.jpg,https://javct.net/v/akdl-018,124,2026-03-24
MIDD-887,Maple Pie Birth Mei Yuki,https://pic.javct.net/poster/06032026/1774329637.jpg,https://javct.net/v/midd-887,180,2026-03-24
EBOD-440,Rookie!Real 18-year-old In 1996 Born Hamaguchi Ena AV Debut,https://pic.javct.net/poster/06032026/1774329885.jpg,https://javct.net/v/ebod-440,120,2026-03-24
AMBI-118-RM,No Way! Erotic Delivery Will Be Caught By The Teacher In Charge! !! Hana Himesaki [Uncensored L**ked],https://pic.javct.net/poster/06032026/1774316921.jpg,https://javct.net/v/ambi-118-rm,121,2026-03-24
10-032426-01,Big-breasted amateur's Blowjob and Titjob,https://pic.javct.net/poster/06032026/1774329011.jpg,https://javct.net/v/10-032426-01,09,2026-03-24
SSIS-963-SUB,To The Best Ejaculation Experience Of Your Life With Ai Hongo ULTRA VIP Sex Industry 10 With 4K [English Subtitle],https://pic.javct.net/poster/20231711/1700797677.jpg,https://javct.net/v/ssis-963-sub,210,2026-03-24
390JAC-203,"[Cheeky G-breasted beautiful girl] ""Made the salty P-life uniform girl understand"" [6th person: Arisa (21)]",https://pic.javct.net/poster/06032026/1774326391242.jpg,https://javct.net/v/390jac-203,67,2026-03-24
390JAC-197,"[Cheeky baby-faced F cup] ""Made the salty P-life uniform girl understand"" [5th person: Yuu (20) ]",https://pic.javct.net/poster/06032026/1774326122626.jpg,https://javct.net/v/390jac-197,71,2026-03-24
390JAC-188,"[Zetsu Inn Fighter] ""When the match is decided,'' he has sweaty hard sex with a big-breasted beauty who is a super authentic fighter with a divine body trained in martial arts, but who is shy and can't stand the gap between his masochist tendencies... [Spoero Journey 31st person Rion-chan]",https://pic.javct.net/poster/06032026/1774326258985.jpg,https://javct.net/v/390jac-188,119,2026-03-24
390JAC-187,"[New series] I made a cheeky girl in uniform who is accommodating to salt ""understand"" [1st person: Ayase (19)]",https://pic.javct.net/poster/06032026/1774326527290.jpg,https://javct.net/v/390jac-187,80,2026-03-24
390JAC-198,"[Cheeky slender big breasts] ""Made the salty P-life uniform girl understand"" [4th person: Nana (22)]",https://pic.javct.net/poster/06032026/1774326188731.jpg,https://javct.net/v/390jac-198,65,2026-03-24
FC2PPV-4867741,"A normal but erotic girl can't hold back and doesn't have it.I cum inside her with permission, and the old man I met for the first time inseminated her with teary eyes, and then she is instructed to masturbate and squirts a lot.",https://pic.javct.net/poster/06032026/1774326218.jpg,https://javct.net/v/fc2ppv-4867741,65,2026-03-24
SCPX-549-RM,"""I'm Such An Old Lady, Are You Sure You Want Me...?"" My Beloved Tutor Was So Touched By His Cute Student's Erect Penis That He Gently Taught Her About Sex. [Uncensored L**ked]",https://pic.javct.net/poster/06032026/1774152381.jpg,https://javct.net/v/scpx-549-rm,160,2026-03-24
NACT-103-RM,"Uncle Gacha!? Draw An Experienced, Erotically Sk**led Uncle! [Uncensored L**ked]",https://pic.javct.net/poster/06032026/1774152627.jpg,https://javct.net/v/nact-103-rm,122,2026-03-24
HDKA-331-RM,Naked Yoga Instructor Kana Shiokawa [Uncensored L**ked],https://pic.javct.net/poster/06032026/1774152817.jpg,https://javct.net/v/hdka-331-rm,123,2026-03-24
SHIND-109-RM,Tracking The Sticky S●●Car M - Home Banned Records #134 & 135 [Uncensored L**ked],https://pic.javct.net/poster/06032026/1774112334.jpg,https://javct.net/v/shind-109-rm,135,2026-03-24
ROYD-299-RM,"When I Woke Up In The Morning, I Found A Female Co-worker In Her Underwear In My Room! She's Always Rude And Abusive, But I've Been Relying On Her... Shishido Riho [Uncensored L**ked]",https://pic.javct.net/poster/06032026/1774152564.jpg,https://javct.net/v/royd-299-rm,120,2026-03-24
758JAPORN-091-RM,Sara-chan [Uncensored L**ked],https://pic.javct.net/poster/06032026/1774317656182.jpg,https://javct.net/v/758japorn-091-rm,93,2026-03-24
420HHL-148-RM,"AKANE (25) Amateur Hoi Hoi Lover, Amateur, Couple POV, Cosplay, Older Sister, Big Tits, Masturbation, Facial [Uncensored L**ked]",https://pic.javct.net/poster/06032026/1773986832729.jpg,https://javct.net/v/420hhl-148-rm,86,2026-03-24
534CRT-096-RM,[Personal shooting] Cosplay NN video of an extremely rare innocent person being fucked [Uncensored L**ked],https://pic.javct.net/poster/06032026/1774317726131.jpg,https://javct.net/v/534crt-096-rm,73,2026-03-24
T28-394,Nanase And Is Urumi!Out Geki River Beautiful Girl And In 3P Of Shortcuts Otoha Nanase × Narumi Urumi,https://pic.javct.net/poster/06032026/1774329388.jpg,https://javct.net/v/t28-394,130,2026-03-24
FC2PPV-4868179,208 Amateur with cute face and plump breasts ♡ She can even get naked for her boyfriend ♡ Plenty of creampie  Face showing and uncensored as a bonus,https://pic.javct.net/poster/06032026/1774326096.jpg,https://javct.net/v/fc2ppv-4868179,68,2026-03-24
FC2PPV-4868160,[Neat/Amateur] Take a student to a hotel and have raw sex,https://pic.javct.net/poster/06032026/1774326351.jpg,https://javct.net/v/fc2ppv-4868160,28,2026-03-24
FC2PPV-4867919,"[Complete Amateur Creampie] A cool beauty, tall and slender office lady is a lewd woman who loves having her clitoris attacked. When she is penetrated from behind by an old man's thick dick and creampied.",https://pic.javct.net/poster/06032026/1774326490.jpg,https://javct.net/v/fc2ppv-4867919,48,2026-03-24
390JAC-196,"[Slender beautiful breasts] [Tempting big ass] [Creampie begging] A healing beauty with a nice smile who is getting married in two months, but it doesn't suit her face and wants to have intense sex. She has a bewitching smile, and with a devoted sweet dirty talk, she licks her nipples and gives a blowjob to the depths of her big cock. It feels so good that she herself begs for raw sex and creampie [Mr. Kawai, 30th young adult]",https://pic.javct.net/poster/06032026/1774326325952.jpg,https://javct.net/v/390jac-196,123,2026-03-24
FC2PPV-4868080,"[NTR] I got a call from a guy while I was filming a real happening, so I asked him to answer (lol) This guy is a pervert who squirts while being scared of being found out.",https://pic.javct.net/poster/06032026/1774326185.jpg,https://javct.net/v/fc2ppv-4868080,58,2026-03-24
SCPX-121-RM,"Tribe Sister To Stimulate Virgin Chi ● Po! !Living Alone And Had My Sister Came Back Suddenly Home! !Always Naked Life Without Anyway To My Brother Is There! ! !Or Became Poor At The Sight, Which Was Instinctively Erection ""? I Want To.""Saying Rainy Day Sloppy! !I Libido Explosion That Went Off In Too Comfortably! ! [Uncensored L**ked]",https://pic.javct.net/poster/06032026/1774318177.jpg,https://javct.net/v/scpx-121-rm,195,2026-03-24
SDAM-012-RM,"""Please Give My Sperm To Your Vagina"" 6 Hours After Ovulation Ovulation Asking For Girls In Their Vagina Ejaculation Themselves After A Graduation Ceremony ○ ○ [Uncensored L**ked]",https://pic.javct.net/poster/06032026/1774317236.jpg,https://javct.net/v/sdam-012-rm,240,2026-03-24
TLDC-048-RM,Female Boss ♡ Immediate Sex Secret Camera In The Office [Uncensored L**ked],https://pic.javct.net/poster/06032026/1774171436322.jpg,https://javct.net/v/tldc-048-rm,68,2026-03-24
TLDC-049-RM,"""I'll Do My Best As A Dick Today Too."" I'm Called To The Peak Of Sexual Desire And It's Like Hell [Uncensored L**ked]",https://pic.javct.net/poster/06032026/1774171374523.jpg,https://javct.net/v/tldc-049-rm,67,2026-03-24
TLDC-047-RM,Bare Sexual Desire Secretly Behind The Scenes With A Circle Sex Friend [Uncensored L**ked],https://pic.javct.net/poster/06032026/1774171498768.jpg,https://javct.net/v/tldc-047-rm,68,2026-03-24
MIST-509-RM,"Obashot: Auntie Sex By Aunties, For Auntie Enthusiasts, Featuring Auntie Mitsuko, Age 58. [Uncensored L**ked]",https://pic.javct.net/poster/06032026/1774112397.jpg,https://javct.net/v/mist-509-rm,184,2026-03-24
FC2PPV-4867765,"I lured her to the hotel and told her there was gorgeous illumination indoors, but I managed to get to the end, but she must have liked my big cock so much that it felt so good again.A story with a woman who can only say it's crazy.",https://pic.javct.net/poster/06032026/1774246151.jpg,https://javct.net/v/fc2ppv-4867765,56,2026-03-24
FC2PPV-4867764,"I invited her to the hotel and told her there was gorgeous illumination indoors, and I was able to make it to the end??? It felt so good! It was amazing! An incredible 80-minute story with a woman who could only say something!!",https://pic.javct.net/poster/06032026/1774246245.jpg,https://javct.net/v/fc2ppv-4867764,84,2026-03-24
200GANA-3318,"Neat type x highest sexual desire. Although she hates it, her waist is very demanding, and her body and reactions are innocent. She falls lewdly and fucks herself. Seriously soft girl, first shoot 2272",https://pic.javct.net/poster/06032026/1774244397916.jpg,https://javct.net/v/200gana-3318,62,2026-03-24
390JAC-231,"[1 liter of shameful juice] A small fry man, 24 years old, bank clerk, who immediately blows the dignity of a sex friend",https://pic.javct.net/poster/06032026/1774243977128.jpg,https://javct.net/v/390jac-231,87,2026-03-24
FC2PPV-4867184,"[Graduation] **pyjpx*jsps I'm retiring as a fellatio fan, I'm attacking small fry men with toy demons/I'm still making a finale.",https://pic.javct.net/poster/06032026/1774326138.jpg,https://javct.net/v/fc2ppv-4867184,58,2026-03-24
MFNA-005,"Playing a prank on my girlfriend without make-up...Just as a return, my morning erection gets played with and we have raw sex on holiday [Couple's Daily Life #05 Rio]",https://pic.javct.net/poster/06032026/1774244118628.jpg,https://javct.net/v/mfna-005,56,2026-03-24
413INSTV-698,"Yuna-chan, a girl who is active as a dad, made a cheeky girl who is rotten in the world understand the fear of adulthood",https://pic.javct.net/poster/06032026/1774244050304.jpg,https://javct.net/v/413instv-698,70,2026-03-24
FC2PPV-4867770,[Real Amateur] Godly Slender Lady Living in Ashiya Part 2 This is a super limited sale with no plans for resale.,https://pic.javct.net/poster/06032026/1774239763.jpg,https://javct.net/v/fc2ppv-4867770,54,2026-03-24
