code,title,image_url,page_url,views,date_scraped
FC2PPV-4861420,"[Uncensored/Beautiful music college student] **pyjpx*jsps Intense sex with a neat and clean young music college student with super beautiful breasts and a slender body, and an erotic beauty who feels it with her right brain and orgasms continuously!!",https://pic.javct.net/poster/06032026/1773278081.jpg,https://javct.net/v/fc2ppv-4861420,50,2026-03-12
FC2PPV-4861886,Super bristly and slender! Her face is impeccably beautiful and has a naughty vibe from start to finish. “Are you about to cum? Hold back more and ejaculate in a satisfying way.♡”,https://pic.javct.net/poster/06032026/1773277601.jpg,https://javct.net/v/fc2ppv-4861886,92,2026-03-12
200GANA-3346,"I've been going to Galba for three months...The woman I finally got is a good-looking woman with a good figure, and she cums every time I change the position during insertion, and I won't let her go as a sex friend.In the sex room of a seasoned pick-up master, I took her in and secretly filmed her having sex 430",https://pic.javct.net/poster/06032026/1773231635466.jpg,https://javct.net/v/200gana-3346,58,2026-03-12
259LUXU-1876,SEX Monster Attacks A natural pervert who loves being tormented and happily licks men's anuses appears in an AV on the orders of his sex friend Luxury TV 1863,https://pic.javct.net/poster/06032026/1773231565426.jpg,https://javct.net/v/259luxu-1876,72,2026-03-12
336KNB-403,"[Unforgettable erotic ass] ""It felt so good that I can't even understand..."" The desire of an older k**ler, a young wife with firm breasts and a peach butt that looks like it's going to burst at any moment, is irresistible. When I inserted it into Mako's tight shaved pussy, she orgasmed immediately (lol) at Chigasaki City, Kanagawa Prefecture",https://pic.javct.net/poster/06032026/1773231497342.jpg,https://javct.net/v/336knb-403,71,2026-03-12
420HPT-048,"Mina (24) Amateur Hoi Hoi, Amateur Hoi Hoi Pet, Amateur, Neat, Gal, Slender, Masochistic, Moody, Sex Friend, Jumping, Outdoors, Shame, Toy, Creampie, Gonzo, Documentary",https://pic.javct.net/poster/06032026/1773231428469.jpg,https://javct.net/v/420hpt-048,99,2026-03-12
SIMP-015,"A married woman who turns into a pervert while her husband is away, exposes her to the adulterous rod, a voluptuous wife with big breasts and a big butt. Tames with handcuffs and a collar. Dirty fishnet stockings. All creampie eggs [Onapet No. 15_Sayuri]",https://pic.javct.net/poster/06032026/1773231354336.jpg,https://javct.net/v/simp-015,82,2026-03-12
FC2PPV-4859777,[No] A sequel to a beautiful woman with pure white skin and an elegant face. Her obscene looking pussy is too erotic... Her voice is also very cute. Her loud voice is also the best⤴ She cums inside you. *Bonus High resolution,https://pic.javct.net/poster/06032026/1773205167.jpg,https://javct.net/v/fc2ppv-4859777,43,2026-03-12
FC2PPV-4856862,"[Luxurious 6 shots] Two men fighting over the overwhelmingly fair-skinned and busty beauty of a former gravure idol, Which cock felt better?'' Intense footage of them making you cum with that technique",https://pic.javct.net/poster/06032026/1773205105.jpg,https://javct.net/v/fc2ppv-4856862,114,2026-03-12
FC2PPV-4861556,"[No/Saddle]**pyjpx*jsps A lovely woman who is petite, fair-skinned, cute, and sensitive in all sorts of ways came to our store today to request a longer oil session.The atmosphere has become more mature.",https://pic.javct.net/poster/06032026/1773205139.jpg,https://javct.net/v/fc2ppv-4861556,61,2026-03-12
FC2PPV-4861396,"[Complete amateur creampie] A beautiful woman and an old man, as soon as they met, her pussy was thoroughly attacked with a rich pacifier, and a huge amount of splash, a violent piston of raw dick, and a screaming creampie forever",https://pic.javct.net/poster/06032026/1773205292.jpg,https://javct.net/v/fc2ppv-4861396,66,2026-03-12
FC2PPV-4861400,"[First Shooting] Bonus included A shy and beautiful JD with a slender body applied for a photoshoot because she had made an expensive purchase. Tighten her big black cock and screw it into her pussy, pouring hot semen deep into her vagina.",https://pic.javct.net/poster/06032026/1773205318.jpg,https://javct.net/v/fc2ppv-4861400,51,2026-03-12
300MIUM-1341,"[Exciting, big breasts] A certain brand value as a female college student. This is the optimal body for a man with a fierce cervix piston that gradually clouds his sweet voice.",https://pic.javct.net/poster/06032026/1773146339107.jpg,https://javct.net/v/300mium-1341,68,2026-03-12
FC2PPV-4861456,Uncensored Charming and simple 18 year old island-bred hairy pink pussy spread wide\! Observation of tiny pussy and boobs ♡ Cunnilingus ♡ Masturbation ♡ Super close-up close-up review special included,https://pic.javct.net/poster/06032026/1773277716.jpg,https://javct.net/v/fc2ppv-4861456,25,2026-03-12
FC2PPV-4861214,"A secret meeting with a gym instructor who has a boyfriend. Her boyfriend, who is about to get married, impregnates her with continuous creampie sex while on a business trip.",https://pic.javct.net/poster/06032026/1773222116.jpg,https://javct.net/v/fc2ppv-4861214,85,2026-03-12
FC2PPV-4861269,"Amateur girl, cum in mouth from blowjob at the end",https://pic.javct.net/poster/06032026/1773222152.jpg,https://javct.net/v/fc2ppv-4861269,45,2026-03-12
PGD-495-RM,Miyu Hoshino Saki Ninomiya & Beauty Premium [Uncensored L**ked],https://pic.javct.net/poster/06032026/1773280963.jpg,https://javct.net/v/pgd-495-rm,220,2026-03-12
KTKL-140-RM,"A Video Of A Skinny, Slender Girl Who Only Feels Pleasure Through Anal. Anonymous [Uncensored L**ked]",https://pic.javct.net/poster/01202026/1772217845.jpg,https://javct.net/v/ktkl-140-rm,240,2026-03-12
CR-031226-001,Anal Encyclopedia : Mayu Aoyama,https://pic.javct.net/poster/06032026/1773292705.jpg,https://javct.net/v/cr-031226-001,20,2026-03-12
MIDD-794-RM,Rina Sakura Momoka Spoiled [Uncensored L**ked],https://pic.javct.net/poster/06032026/1773281167.jpg,https://javct.net/v/midd-794-rm,120,2026-03-12
HDRT-00401-RM,The black pantyhose of a female student is too tight. dance [Uncensored L**ked],https://pic.javct.net/poster/06032026/1773222597608.jpg,https://javct.net/v/hdrt-00401-rm,45,2026-03-12
NEO-846-RM,Sailor Suit Mature Woman Incontinence Shame Tada Yuka [Uncensored L**ked],https://pic.javct.net/poster/01202026/1772217285.jpg,https://javct.net/v/neo-846-rm,128,2026-03-12
HDRT-00404-RM,The black pantyhose of a female student is too tight. Yuzu [Uncensored L**ked],https://pic.javct.net/poster/06032026/1773222665124.jpg,https://javct.net/v/hdrt-00404-rm,51,2026-03-12
FC2PPV-4861316,"♯30-2 JD with a boyfriend has a penis injected into her hairy pussy. I'm sorry, she's the best boyfriend.",https://pic.javct.net/poster/06032026/1773222080.jpg,https://javct.net/v/fc2ppv-4861316,57,2026-03-12
FC2PPV-4861531,"[Public] Hiding from her husband, a beautiful wife with big breasts and a big ass and two black men with big dicks are impregnated with 2 consecutive *** NTR hardcore 3P",https://pic.javct.net/poster/06032026/1773205227.jpg,https://javct.net/v/fc2ppv-4861531,84,2026-03-12
SSIS-858-RM,"Even Though You're A Teacher, You're Bound To Get Fucked By Us Because You Have Huge Erotic Breasts, You Understand, Right? Nagi Hikaru [Uncensored L**ked]",https://pic.javct.net/poster/20230908/1694714182.jpg,https://javct.net/v/ssis-858-rm,120,2026-03-12
ADN-503-RM,My Father-in-law's Kiss As He Licks Me Miu Shiramine [Uncensored L**ked],https://pic.javct.net/poster/20231011/1699149399.jpg,https://javct.net/v/adn-503-rm,120,2026-03-12
SONE-248-RM,K-cup Secretary Gets Licked And Violated By Her Slug-like Boss Until She Cums Hikaru Nagi [Uncensored L**ked],https://pic.javct.net/poster/20243105/1720146570.jpg,https://javct.net/v/sone-248-rm,120,2026-03-12
JUQ-404-RM,Nude Model NTR Shocking Cheating Video Of A Wife Drowning In Shame With Her Boss Sayuri Hayama [Uncensored L**ked],https://pic.javct.net/poster/20231011/1698144969.jpg,https://javct.net/v/juq-404-rm,120,2026-03-12
FPRE-004-RM,Sleep R**e: Putting My Cocky Son's Big-breasted Wife To Sleep With Sleeping Pills And Raping Her. Mina Kitano [Uncensored L**ked],https://pic.javct.net/poster/20231912/1704020502.jpg,https://javct.net/v/fpre-004-rm,150,2026-03-12
JUQ-943-RM,Nude Model NTR: Shocking Video Of Wife Cheating With Her Boss And Drowning In Shame Meguri [Uncensored L**ked],https://pic.javct.net/poster/20241115/1732243413.jpg,https://javct.net/v/juq-943-rm,140,2026-03-12
SOAN-108-RM,"The Mother Of The Sakuma Family Who Fell Into Masochistic Anal. A Sexless Married Woman Who Is Not Recognized As A Woman By Her Husband Is Publicly Insulted And Inseminated In Two Holes By Another Man's Cock! The Whole Story Of How She Betrayed Her Husband And Fell Into Masochistic Awakening...Kaede, 42 Years Old [Uncensored L**ked]",https://pic.javct.net/poster/20242108/1727490518.jpg,https://javct.net/v/soan-108-rm,143,2026-03-12
JUQ-540-RM,"Wanted To Make My Wife Admit My Love, So I Left Her And My Unfaithful Junior Alone For 3 Hours...My NTR Story About How My Wife Was Stolen From Me With A Total Of 17 Vaginal Cum Shots Without Pulling Out Sayuri Hayama [Uncensored L**ked]",https://pic.javct.net/poster/20231912/1704643413.jpg,https://javct.net/v/juq-540-rm,120,2026-03-12
FSDSS-672-RM,"I keep being r**ed... A beautiful wife from a rural area is trained by a young man from the city near her husband, and she falls into a sexual assault with Nene Yoshitaka. [Uncensored L**ked]",https://pic.javct.net/poster/20231011/1697259924.jpg,https://javct.net/v/fsdss-672-rm,120,2026-03-12
YUJ-008-RM,"You Have A Husband And I Have A Wife, But You And Your Colleagues At Work Asked Each Other Until The Sun Rose. Miu Shiramine [Uncensored L**ked]",https://pic.javct.net/poster/20230908/1695605474.jpg,https://javct.net/v/yuj-008-rm,120,2026-03-12
STARS-923-RM,"5 Situations Where You Can Enjoy Rei Kamiki's ""beautiful Butt"" With A Transcendental Style.Actually, I...not Only My Boobs But Also My Buttocks Are Amazing Rei Kamiki [Uncensored L**ked]",https://pic.javct.net/poster/20231011/1697068491.jpg,https://javct.net/v/stars-923-rm,156,2026-03-12
JUQ-510-RM,The World's Most Luxurious Commemorative Work! ! Madonna 20th Anniversary - First Ever ALL Exclusive Bus Tour With Unlimited Creampie And Steam! ! First Part 4 Hours OVER 2-disc Set! ! [Uncensored L**ked],https://pic.javct.net/poster/20231912/1703554075.jpg,https://javct.net/v/juq-510-rm,290,2026-03-12
FTAV-003-RM,"""I Love Him, But... I'm Getting Wet Just Thinking About What He's Going To Do..."" I-cup Nurse, 22 Years Old, Not Affiliated With Kimitsu City, Chiba Production, A Woman With Natural Big Breasts Who Lives In The Countryside, Still An Amateur, SOFT ON DEMAND Yu Sasamoto's (tentative) Appearance For The Fourth Time In The New House Where Her Married Life Begins And Her Fiancé Works... [Uncensored L**ked]",https://pic.javct.net/poster/20242108/1727115023.jpg,https://javct.net/v/ftav-003-rm,159,2026-03-12
URE-100-RM,"Congratulations! Commemorative Work For 100 Mature Comics Original Work: Purpoison Mother-eating ~Yarichin Travel Edition~ Cumulative Total Of Over 100,000 Downloads Of The Series! ! A Live-action Sequel To The Legendary Popular Doujin Work Starring Madonna! ! Exclusive, Ririko Kinoshita's 6 Gorgeous Performances With Large Volumes! ! [Uncensored L**ked]",https://pic.javct.net/poster/20231711/1702777063.jpg,https://javct.net/v/ure-100-rm,240,2026-03-12
MVSD-471-RM,Remote Control NTS Indecent Pant Of My Beloved Wife Drowning In Another Stick Michiru Kujo [Uncensored L**ked],https://pic.javct.net/poster/20231912/1704622292.jpg,https://javct.net/v/mvsd-471-rm,120,2026-03-12
ADN-564-RM,"I Kept Giving My Son's Wife An Aphrodisiac So That She Wouldn't Find Out, And I Made Her Body, Which Had Become An Erogenous Zone, Go Crazy With Excitement And Climax. Shiramine Miu [Uncensored L**ked]",https://pic.javct.net/poster/20241804/1714707796.jpg,https://javct.net/v/adn-564-rm,160,2026-03-12
MEYD-890-RM,I Spent A Week Having Sex With A Big-breasted Aunt With A Sloppy Personality In A Ch**ing Trash Room. Sayama Love [Uncensored L**ked],https://pic.javct.net/poster/20241703/1710726271.jpg,https://javct.net/v/meyd-890-rm,150,2026-03-12
JUQ-563-RM,Days Of Creampie Ring That Will Never End. Sayuri Hayama [Uncensored L**ked],https://pic.javct.net/poster/20241901/1708307694.jpg,https://javct.net/v/juq-563-rm,120,2026-03-12
FSDSS-673-RM,"My husband isn't here today, so why don't we have another drink at home? I, Yuko Ono, got excited when I saw my ex-girlfriend again at the class reunion, wearing no panties or bra. [Uncensored L**ked]",https://pic.javct.net/poster/20231011/1698379389.jpg,https://javct.net/v/fsdss-673-rm,120,2026-03-12
JUQ-439-RM,"During My Wife's Pregnancy, I Was Forbidden To Even Masturbate, So I Had Sex With My Mother-in-law, Sayuri, Who Had Moved To Tokyo Many Times... Sayuri Hayama [Uncensored L**ked]",https://pic.javct.net/poster/20231011/1699830529.jpg,https://javct.net/v/juq-439-rm,120,2026-03-12
ROE-163-RM,My Aunt's Wet And See-through Body. A Night Alone Under The Same Roof... Sentimental Rain Pattern Yuka Mizuno [Uncensored L**ked],https://pic.javct.net/poster/20230908/1695970848.jpg,https://javct.net/v/roe-163-rm,140,2026-03-12
WAAA-303-RM,I Asked My Plump Wife At My Part-time Job To Be My Tutor... Ai Sayama [Uncensored L**ked],https://pic.javct.net/poster/20230908/1696605519.jpg,https://javct.net/v/waaa-303-rm,120,2026-03-12
ACHJ-030-RM,Madonna Dengeki Exclusive Authentic Slut Sumire Mizukawa Endless Ejaculation Orgasm That Makes Masochist Man's Body And Mind Melt With Deep And Rich Kisses And Stopping Creampie [Uncensored L**ked],https://pic.javct.net/poster/20231711/1700382348.jpg,https://javct.net/v/achj-030-rm,110,2026-03-12
PRED-526-RM,"When I Took Care Of Miu-sensei Who Had Collapsed And Sent Her Home... I Was A Monster Of Sexual Desire, And I Couldn't Stop Getting An Erection Due To Her Plump, Beautiful Legs And Strong Legs, And Ended Up Ejaculating Over And Over Again Until Morning. Shiramine Miu [Uncensored L**ked]",https://pic.javct.net/poster/20231011/1697500675.jpg,https://javct.net/v/pred-526-rm,120,2026-03-12
