code,title,image_url,page_url,views,date_scraped
FOCS-038-RM,"He Always Took Care Of His Shut-In Little Stepsister, But Now She's Getting Fucked!? She Transformed Into A Lusty Slut And Will Lure Even Her Big Stepbrother To Ejaculation As She Awakens To Her True Self! See What Happens When She Learns About The Joys Of Sex!! Mina Konno [Uncensored L**ked]",https://pic.javct.net/poster/20212011/1639723009.jpg,https://javct.net/v/focs-038-rm,123,2026-05-14
SPRD-1421-RM,Surrogate MILF Ayaka Makimura [Uncensored L**ked],https://static.javct.net/poster/sprd-1421.jpg,https://javct.net/v/sprd-1421-rm,141,2026-05-14
VENU-740-RM,This Stepmother And Son Will Start Fucking 2 Seconds After Stepdaddy Leaves For Work Kana Morisawa [Uncensored L**ked],https://pic.javct.net/poster/20221202/1645061130.jpg,https://javct.net/v/venu-740-rm,113,2026-05-14
VENU-831-RM,"After I Satisfied My Horny Mother, I Started Pumping Her Pussy Again After She Had Already Cum! High-Speed Action! Follow-Up Piston Pumping Sex Kana Morisawa [Uncensored L**ked]",https://pic.javct.net/poster/20221202/1650086349.jpg,https://javct.net/v/venu-831-rm,85,2026-05-14
BBTU-008-RM,Come Look At My Step Sister's Huge Tits Hana Himesaki [Uncensored L**ked],https://pic.javct.net/poster/20212011/1637575607.jpg,https://javct.net/v/bbtu-008-rm,136,2026-05-14
AMBI-154-RM,3 Full Days Alone With My Step-sister Who Isn't B**od-related! We Take The Opportunity To Do Nothing But Fuck Non-stop! Aoi Amano [Uncensored L**ked],https://pic.javct.net/poster/20221202/1649141835.jpg,https://javct.net/v/ambi-154-rm,126,2026-05-14
MIDE-542,Nobra Provocation Small Devil Gradle Takahashi Shōsho,https://pic.javct.net/poster/04112026/aad5011a51.jpg,https://javct.net/v/mide-542,200,2026-05-14
AVOP-210,G Cup Perfect Body Entertainer Naoko Takahashi MOODYZ AV Debut! !,https://pic.javct.net/poster/04112026/db838a0ddc.jpg,https://javct.net/v/avop-210,160,2026-05-14
MIDE-456,Non Stop Spittle Trading French Kissing Sex Takahashi Shouko,https://pic.javct.net/poster/04112026/92898cd403.jpg,https://javct.net/v/mide-456,210,2026-05-14
MIDE-448,The Gravure Idol Female Teacher's Temptation Takahashi Shouko,https://pic.javct.net/poster/04112026/907b66102a.jpg,https://javct.net/v/mide-448,200,2026-05-14
SON-126,Asako Koike Out First AV Big Big College Student Golf Section Princess Unauthorized In,https://pic.javct.net/poster/04112026/f25f5ad95a.jpg,https://javct.net/v/son-126,140,2026-05-14
PIYO-119,"[Hentai Desire] I Have A Complex Big Breast That Is Different From The C**ldren Around Me, But I Love Sex ... Also, I Want To Drink Sperm That I Want To See My Father's Erotic Book ...",https://pic.javct.net/poster/04112026/9415c2f1ce.jpg,https://javct.net/v/piyo-119,180,2026-05-14
SON-125,Take Out The First AV Big College Student Faculty Of Letters During Copulation Unauthorized,https://pic.javct.net/poster/04112026/ab7b51cd95.jpg,https://javct.net/v/son-125,140,2026-05-14
MIDE-419,Abstinence Explosion Stop Playing Cat And Mouse Is Orgasm Naoko Takahashi,https://pic.javct.net/poster/04112026/e0dd305cf9.jpg,https://javct.net/v/mide-419,180,2026-05-14
SON-140,Big Yoga Instructor Erection Big Nipples Shame Climax Shirakawa Rina,https://pic.javct.net/poster/04112026/0896a8aabc.jpg,https://javct.net/v/son-140,140,2026-05-14
MIDE-589,Premature Ejq Ikuiku Sensitive 4SEX Takahashi Syouko,https://pic.javct.net/poster/04112026/5a553db1ee.jpg,https://javct.net/v/mide-589,240,2026-05-14
MIDE-471,If I Marry A Gravure Idol Takahashi Syouko ...,https://pic.javct.net/poster/04112026/b4ea0f31b9.jpg,https://javct.net/v/mide-471,180,2026-05-14
MIDD-870-RM,F Cup Dick Look Cute Chestnut Interested In H Rookie Debut [Uncensored L**ked],https://pic.javct.net/poster/06032026/1773225222.jpg,https://javct.net/v/midd-870-rm,120,2026-05-14
LOCK-009-RM,"LOCK-ON@Yuuka A Tomboyish Girl I Found On A Drinking Buddy App Has Surprisingly Large Breasts When She Takes Her Clothes Off. A G-cup College Student Who's Ready For Sex Right Away. Raw, Instinctual Sex. Chiba Yuuka [Uncensored L**ked]",https://pic.javct.net/poster/04112026/9faa209140.jpg,https://javct.net/v/lock-009-rm,130,2026-05-14
SON-143,Sanki This Nozomi Delusion SEX Trip,https://pic.javct.net/poster/04112026/f0cacadd44.jpg,https://javct.net/v/son-143,140,2026-05-14
GESU-013-RM,Unilaterally Wagered Flesh Apologize Suspicion Of Confidential Documents Lost Part Cleaning Staff Of The Aunt Who Is From The Office [Uncensored L**ked],https://pic.javct.net/poster/04112026/727a785ce9.jpg,https://javct.net/v/gesu-013-rm,140,2026-05-14
AKDL-068,[Off Paco video] A cute and sensitive premature ejaculation slut who is as cute as an idol! ? A bitch layer that makes you feel naughty when you drink it: Nozomi Nozomi Arimura,https://pic.javct.net/poster/04112026/a839befed6.jpg,https://javct.net/v/akdl-068,75,2026-05-14
IESP-261-RM,Arisa Kanno Barrage 20 Women Out In The Pores [Uncensored L**ked],https://pic.javct.net/poster/04112026/c88ffc910e.jpg,https://javct.net/v/iesp-261-rm,115,2026-05-14
GVG-777-RM,Big Tits Widowed As Sexual Slaves Got Ridiculed By A Senior Citizen Elena Fengreena [Uncensored L**ked],https://pic.javct.net/poster/20222109/1664687672.jpg,https://javct.net/v/gvg-777-rm,125,2026-05-14
START-258-SUB,"The Nurse Who Has Been Assigned To A Marginal Village Is Hikari Aozora, Who Conveys The C**ld Species Of An Abnormal Libido In The Uterus Every Day. [English Subtitle]",https://pic.javct.net/poster/20253001/1738601997.jpg,https://javct.net/v/start-258-sub,130,2026-05-14
MIGD-535-RM,Anal FUCK Out And Bukkake! Tsumugi Serizawa [Uncensored L**ked],https://pic.javct.net/poster/06032026/1773544091.jpg,https://javct.net/v/migd-535-rm,120,2026-05-14
CADV-667,Daughter Girl Metamorphosis Poisoning 8 Hours! !,https://pic.javct.net/poster/04112026/f495c6f959.jpg,https://javct.net/v/cadv-667,480,2026-05-14
MDTM-155-RM,Reputation Rhythmic Gymnastics Staff At The School Is Spree Sensitive Serious Sex! ! Yuna Himekawa [Uncensored L**ked],https://pic.javct.net/poster/20230104/1681342357.jpg,https://javct.net/v/mdtm-155-rm,130,2026-05-14
MDTM-116-RM,Girl Is In White Liquor Covered By The Men Of The Devil Father And Abnormal Proclivities [Uncensored L**ked],https://pic.javct.net/poster/04112026/a2faf05fb6.jpg,https://javct.net/v/mdtm-116-rm,126,2026-05-14
FC2PPV-4898171,[3P Gonzo version of a half-beautiful married woman with her face in agony] A married woman who has to be trained is trained in an intense 3P by two men who are almost twice as big as her and continue to attack her.,https://pic.javct.net/poster/04112026/9cad4195e1.jpg,https://javct.net/v/fc2ppv-4898171,45,2026-05-14
FC2PPV-4897110,"""A total of 6 ejaculations, a neat F-cup country JD, surrounded by 4 big cocks, fair-skinned body training, creampie, cum swallowing, facial cumshot",https://pic.javct.net/poster/04112026/45eabb4b4f.jpg,https://javct.net/v/fc2ppv-4897110,53,2026-05-14
AKDL-001-RM,148cm Beautiful Girl x 100kg Giant Orc Hard Press Seeding Orgy 6P Hikaru Minazuki [Uncensored L**ked],https://pic.javct.net/poster/06032026/1773073586.jpg,https://javct.net/v/akdl-001-rm,48,2026-05-14
AKDL-063,[Off Paco video] Cute as an idol and with huge breasts and G cup! ! Bitch layer that makes you feel naughty when you drink it: Ayaka,https://pic.javct.net/poster/04112026/d876ad2f67.jpg,https://javct.net/v/akdl-063,62,2026-05-14
FC2PPV-4886269-RM,Participating in a couple exchange circle Perverted couple fetish Explosive creampie seeding orgy [Uncensored L**ked],https://pic.javct.net/poster/04112026/8194f8671a.jpg,https://javct.net/v/fc2ppv-4886269-rm,62,2026-05-14
RCT-541-RM,Target Little C**ld Molester Sexual Harassment Corps Camp Hen Mom's Leading [Uncensored L**ked],https://pic.javct.net/poster/20230302/1678773892.jpg,https://javct.net/v/rct-541-rm,120,2026-05-14
IESP-409-RM,Kaho Kasumi Spasm Of The Vagina Pickled Yak Narc [Uncensored L**ked],https://pic.javct.net/poster/04112026/358d1f1509.jpg,https://javct.net/v/iesp-409-rm,120,2026-05-14
GVG-775-RM,Ouchiki P ● A Chairman And Evil Gaki Student Council Aoi Yurika [Uncensored L**ked],https://pic.javct.net/poster/04112026/4e2fac0b8d.jpg,https://javct.net/v/gvg-775-rm,135,2026-05-14
FC2PPV-4891245,"F cup Korean half beauty reaches climax with 4 cocks, facial, swallows, and thick semen pours into her ass pussy",https://pic.javct.net/poster/04112026/1d8cbfcf0e.jpg,https://javct.net/v/fc2ppv-4891245,53,2026-05-14
SDAM-167-RM,"On the day I finished work early, I had an orgy with the gals and chuhai! ! Maika (25) and colleagues [Uncensored L**ked]",https://pic.javct.net/poster/04112026/6e284fc41b.jpg,https://javct.net/v/sdam-167-rm,150,2026-05-14
SON-132,Big De M Secretary Semen Shame Face Collapse To**ure,https://pic.javct.net/poster/04112026/1cb1d0600a.jpg,https://javct.net/v/son-132,140,2026-05-14
KV-318-RM,"113 Minutes Of Non-stop Filming, Uncut Editing, Featuring 25 Consecutive Cumshots, A Blowjob, And 13 Consecutive Cumshots!! Mai Onodera [Uncensored L**ked]",https://pic.javct.net/poster/04112026/01a61cea7a.jpg,https://javct.net/v/kv-318-rm,113,2026-05-14
ONED-280-RM,Nao Hazuki Big Tits Barely Barely [Uncensored L**ked],https://pic.javct.net/poster/04112026/6c33734f95.jpg,https://javct.net/v/oned-280-rm,120,2026-05-14
HIZ-012-RM,Intently Kaoi Yuki Kishi Earnestly Series No.012 [Uncensored L**ked],https://pic.javct.net/poster/04112026/2bf5d450f2.jpg,https://javct.net/v/hiz-012-rm,135,2026-05-14
APKH-147,[Amazing Waist Pet Girl] Keeping A Delicate Girl And Squeezing Radical Fuck Gonzo Himeno Kotome,https://pic.javct.net/poster/04112026/fbbfba492a.jpg,https://javct.net/v/apkh-147,150,2026-05-14
JBJB-003,Crushed With Muchimuchi Meat Bere College Student Squeezes Semen,https://pic.javct.net/poster/04112026/e800bec2a9.jpg,https://javct.net/v/jbjb-003,120,2026-05-14
DIC-063-RM,"18 Years And 9 Months. Aya Nakamori, The 18-year-old With The Highest Lewd Experience That Came To AV [Uncensored L**ked]",https://pic.javct.net/poster/04112026/9731ab1654.jpg,https://javct.net/v/dic-063-rm,160,2026-05-14
DIC-062-RM,"18 Years Old And 7 Months. 12 Revealing All, Determined Home Sex. Mayu Okino [Uncensored L**ked]",https://pic.javct.net/poster/04112026/871501c43b.jpg,https://javct.net/v/dic-062-rm,180,2026-05-14
SUMU-005,No Makeup! No Fake! Yuno Makikawa,https://pic.javct.net/poster/04112026/1a7b50b370.jpg,https://javct.net/v/sumu-005,126,2026-05-14
KV-318,"113 Minutes Of Non-stop Filming, Uncut Editing, Featuring 25 Consecutive Cumshots, A Blowjob, And 13 Consecutive Cumshots!! Mai Onodera",https://pic.javct.net/poster/04112026/01a61cea7a.jpg,https://javct.net/v/kv-318,113,2026-05-14
DIC-061-RM,Healthy Beauty Muscular Body Former Professional Athlete Ayaka Sawahara AV Debut Healthy Dense Dish Sex [Uncensored L**ked],https://pic.javct.net/poster/04112026/0bef52971c.jpg,https://javct.net/v/dic-061-rm,130,2026-05-14
APNS-409-RM,"I Just Received A DVD Containing A Video Of My Beloved Wife, Who Has Disappeared, Being Gang-r**ed... A Tragic Affair Of Infidelity, Impregnation, And Unprotected Sex... Yukimura Izuki [Uncensored L**ked]",https://pic.javct.net/poster/04112026/abc4e9bd73.jpg,https://javct.net/v/apns-409-rm,124,2026-05-14
MADV-631-RM,"The School's Top Student, A Fair-skinned, Big-breasted Girl, Came Onto Me Wearing A Swimsuit That Violated School Rules... And I Ended Up Having Unprotected Sex With Ruka Again And Again. - Itoi Ruka [Uncensored L**ked]",https://pic.javct.net/poster/04112026/8abf0a200b.jpg,https://javct.net/v/madv-631-rm,130,2026-05-14
APNS-410-RM,A Schoolgirl Obsessed With Exhibitionism; Her Womb Aches With The Thought Of Having Her Pussy Seen... Fuu Watari [Uncensored L**ked],https://pic.javct.net/poster/04112026/88823bf41b.jpg,https://javct.net/v/apns-410-rm,125,2026-05-14
APNS-131-RM,A Girl In A Uniform Who Is Fascinated By The Desire To Apply For Dew [Uncensored L**ked],https://pic.javct.net/poster/20240807/1722296185.jpg,https://javct.net/v/apns-131-rm,131,2026-05-14
BANK-235-RM,"Bouncy, Huge-breasted Mixed-sex Hot Spring Man-eater [Uncensored L**ked]",https://pic.javct.net/poster/04112026/1776012555.jpg,https://javct.net/v/bank-235-rm,195,2026-05-14
DIC-060-RM,18 Years Old And 4 Months Old. 11 Strongest 18-year-old Actress Naughty Too Sexual. Yuno Ayano [Uncensored L**ked],https://pic.javct.net/poster/04112026/8dcfae7451.jpg,https://javct.net/v/dic-060-rm,175,2026-05-14
MDTM-210-RM,Obedience School Girls-cum Hagi Much To Darned Cute Beautiful Girl Who Want To Be Played With A Man [Uncensored L**ked],https://pic.javct.net/poster/04112026/aced20172a.jpg,https://javct.net/v/mdtm-210-rm,145,2026-05-14
HODV-21571-RM,"Reverse NTR ""Hey Boss ... Do You Want To Rest Up At My Place?"" This Boss Got Taken Home By His Employee And Taken For A Ride. Marina Saito [Uncensored L**ked]",https://static.javct.net/poster/hodv-21571.jpg,https://javct.net/v/hodv-21571-rm,129,2026-05-14
JUY-311-RM,"This Horny Father-In-Law Is Teasing His Daughter-In-Law Father, Please Stop... Rika Mari [Uncensored L**ked]",https://pic.javct.net/poster/20222109/1665658400.jpg,https://javct.net/v/juy-311-rm,120,2026-05-14
MIAA-301-RM,Summer Vacation Supplementary NTR Lessons I Never Imagined That The Teacher That I Hated The Most Was Having Sweaty Creampie Sex With My Beloved Girlfriend... Rei Kuruki [Uncensored L**ked],https://pic.javct.net/poster/20220406/1657156738.jpg,https://javct.net/v/miaa-301-rm,149,2026-05-14
MDYD-918-RM,I Liked Getting Fucked By My Husband's Friend... Maki Hojo [Uncensored L**ked],https://pic.javct.net/poster/20221202/1648548271.jpg,https://javct.net/v/mdyd-918-rm,119,2026-05-14
NGOD-004-RM,I Want You To Hear My Cuckolding Story. The Wife Who Was Stalked And Fucked By Her Ex-Husband Maki Hojo [Uncensored L**ked],https://pic.javct.net/poster/20220406/1656216295.jpg,https://javct.net/v/ngod-004-rm,146,2026-05-14
JUX-914-RM,The Super-Masochist Wife Owner's Manual Yu Kawakami [Uncensored L**ked],https://pic.javct.net/poster/20221202/1644684119.jpg,https://javct.net/v/jux-914-rm,120,2026-05-14
MAZO-025-RM,"Hcup Thick Man Hair Mathematics Teacher 28 Years Old Big Breasts Shaking Domasochist Training Nymphomaniac Perverted Woman Serious Orgasms ""I'm Sorry Can I Cum?"" [Uncensored L**ked]",https://pic.javct.net/poster/04112026/104befaa58.jpg,https://javct.net/v/mazo-025-rm,73,2026-05-14
MDS-890-RM,"""Teacher... Have You Every Had Sex With A Younger Girl? It Feels Very Good, You Know...?"" I Was Planning To Get Married To My Girlfriend Of 7 Years Next Summer, But After Continuous Temptation By My Student, She Turned My Life Upside Down. I Couldn't Stop My Creampie Intercourse, And Developed A Pregnancy Fetish... Ichika Matsumoto [Uncensored L**ked]",https://static.javct.net/poster/mds-890.jpg,https://javct.net/v/mds-890-rm,133,2026-05-14
MKON-061-RM,"I Was In A Wholesome Relationship With My Adorable And Neat And Clean Girlfriend, And One Day, While We Were Out On A Date, We Just Happened To Wander Into The Love Hotel District, And This Lowlife Bastard Took A Compromising Photo Of Us And Used It To Blackmail Us And Then He Fucked Her Under Coercion, And This Is The Story Of What Happened Ichika Matsumoto [Uncensored L**ked]",https://pic.javct.net/poster/20212308/1630728892.jpg,https://javct.net/v/mkon-061-rm,119,2026-05-14
XVSR-145-RM,Amateur Uploads. Forbidden Confession Documentary. The Sexual Confessions Of A Beautiful Woman With Big Tits Mami Nagase [Uncensored L**ked],https://pic.javct.net/poster/20220406/1657148988.jpg,https://javct.net/v/xvsr-145-rm,119,2026-05-14
XVSR-558-RM,During My Husband's Work Trip... Married Woman NTR - Made To Cum For 26 Hours Straight By The Neighbor - Mao Hamasaki [Uncensored L**ked],https://pic.javct.net/poster/20212709/1632829506.jpg,https://javct.net/v/xvsr-558-rm,128,2026-05-14
EBOD-413-RM,Her First Porno While Her Husband's Away - 30-Year-Old Ui Suzuki (Pseudonym) [Uncensored L**ked],https://pic.javct.net/poster/20212011/1639924393.jpg,https://javct.net/v/ebod-413-rm,118,2026-05-14
JUY-304-RM,"My Wife's Little Stepsister Fakecest Lust Under One RooftopAn Exclusive Beautiful Mature Woman, #2!! Rin Yamamoto [Uncensored L**ked]",https://pic.javct.net/poster/20221202/1648875449.jpg,https://javct.net/v/juy-304-rm,115,2026-05-14
JUY-303-RM,My Husband Doesn't Know My Lusty Desires And My Secret Reika Hashimoto [Uncensored L**ked],https://pic.javct.net/poster/20221108/1661934160.jpg,https://javct.net/v/juy-303-rm,119,2026-05-14
NAMH-005-RM,First real creampie 13 shots NTR with the worst ex-boyfriend Suzu (university student) [Uncensored L**ked],https://pic.javct.net/poster/20241901/1707067226.jpg,https://javct.net/v/namh-005-rm,106,2026-05-14
XVSR-224-RM,Erotic Novel A Young Wife In The Throes Of Womanhood Sweetness In The Palm Of Her Hand Mami Nagase [Uncensored L**ked],https://pic.javct.net/poster/20220406/1656374183.jpg,https://javct.net/v/xvsr-224-rm,121,2026-05-14
NSFS-052-SUB,The Wife Who Was Creampied By Her Husband's Colleague [English Subtitle],https://pic.javct.net/poster/20212011/1640413569.jpg,https://javct.net/v/nsfs-052-sub,123,2026-05-14
JUX-900-RM,R**ed By Father-In-Law Every Day... Aoi Kasahara [Uncensored L**ked],https://pic.javct.net/poster/20221202/1646614670.jpg,https://javct.net/v/jux-900-rm,118,2026-05-14
MRSS-059-RM,"My Neighbor Was Making Too Much Noise, So My Wife And I Went Over To Complain, And It Turned Out To Be A Hangout For DQN Bad Boys. They Got Super Mad And Started Creampie Fucking My Wife, But I Was Too Scared To Do Anything About It. An Mashiro [Uncensored L**ked]",https://pic.javct.net/poster/20221904/1653273373.jpg,https://javct.net/v/mrss-059-rm,115,2026-05-14
CLUB-666-RM,"I Was Watching AV Videos With The Sound Turned Way Up And Then The Beautiful Married Woman From Next Door Came Over To Complain, So When I Showed Her My Rock Hard Cock She Started Getting Horny And So We Let Her Husband Stay Home And Listen To Her Practice Her Orgasmic Voice 7 [Uncensored L**ked]",https://pic.javct.net/poster/20212011/1643413183.jpg,https://javct.net/v/club-666-rm,232,2026-05-14
VENX-004-RM,"I Mistook My Stepmom's Booty For My Wife's From Behind, And Stuck My Dick In Her By Accident. Ayane Sezaki [Uncensored L**ked]",https://pic.javct.net/poster/20220707/1657247125.jpg,https://javct.net/v/venx-004-rm,96,2026-05-14
VOSS-187-RM,"This Horny Housewife Lured My Ugly Ass To Temptation Because Her Husband Has Cuckold Fantasies, But She Enjoyed Fucking Me So Much She Decided To Be My Woman! 2 I Was Secretly In Love With Her, So I Was All For It. And I Had Myself A Wild Creampie Good Time, Not Realizing That Her Husband Was Peeping On Us The Whole Time. And Then She Told Me That She Loved Me!! [Uncensored L**ked]",https://pic.javct.net/poster/20212011/1638927256.jpg,https://javct.net/v/voss-187-rm,106,2026-05-14
FC2PPV-4884888,[No *High quality Yui 22 years old Nogi◯ beauty's anal licking] Nogi◯ beauty tries anal licking The cute girl licks the anus so much that she gives a blowjob and releases a large amount of the old man's sperm ♡ Anal licking feels so good that the sperm splattered on her face lol,https://pic.javct.net/poster/04112026/1776755796.jpg,https://javct.net/v/fc2ppv-4884888,60,2026-04-25
FC2PPV-4884649,"[Uncensored] Gravure idol Aiko, 24 years old, the distance is too close to show off her beautiful breasts, and on nights when she can't say anything",https://pic.javct.net/poster/04112026/1776755525.jpg,https://javct.net/v/fc2ppv-4884649,25,2026-04-25
PA-042126-100,What If Your Dream Wife Wearing an Apron Naked? : Sakura Sakurai,https://pic.javct.net/poster/04112026/1776755661.jpg,https://javct.net/v/pa-042126-100,55,2026-04-25
10-042126-01,Collects the cum that was sprayed on her face and tastes every drop,https://pic.javct.net/poster/04112026/1776755750.jpg,https://javct.net/v/10-042126-01,09,2026-04-25
HZ-3829,Beauty Collection Vol.117 - Meirin,https://pic.javct.net/poster/04112026/1776755601.jpg,https://javct.net/v/hz-3829,59,2026-04-25
CR-042126-001,The tragedy of a wife who repays her husband's debts with her body,https://pic.javct.net/poster/04112026/1776755732.jpg,https://javct.net/v/cr-042126-001,61,2026-04-25
1P-042126-001,Happy Around in School! : Luxury Spa Club,https://pic.javct.net/poster/04112026/1776755765.jpg,https://javct.net/v/1p-042126-001,60,2026-04-25
FC2PPV-4884772,[Uncensored/Complete amateur/Creampie/Squirting] Neat and innocent 149cm short girl in uniform She's so cute that she inserts herself into a vagina that tightens so tight that you push her back and gives her a rich creampie ♡,https://pic.javct.net/poster/04112026/1776755692.jpg,https://javct.net/v/fc2ppv-4884772,14,2026-04-25
FC2PPV-4884691,"[Uncensored] Big-breasted receptionist Sayaka, 25 years old, her response is not a job, but a sex video record that is destroyed by a too polite distance",https://pic.javct.net/poster/04112026/1776755717.jpg,https://javct.net/v/fc2ppv-4884691,18,2026-04-25
FC2PPV-4884935,[Amateur's first shot] Sumire (18) 163 cm 47 kg D cup and the cutest shooting data was collected from the forehead camera's first person perspective video,https://pic.javct.net/poster/04112026/1776733868.jpg,https://javct.net/v/fc2ppv-4884935,66,2026-04-25
FC2PPV-4884375,"[Slender] A Kansai guy woke up after having sex for the first time in 2 years. He wanted more. He couldn't help but squirt at the overflowing moans. Two consecutive creampies, and a strong squirting finish.",https://pic.javct.net/poster/04112026/1776733779.jpg,https://javct.net/v/fc2ppv-4884375,63,2026-04-25
10-041926-01,Treasured Pussy Selection: Ai Nakano,https://pic.javct.net/poster/04112026/1776669419.jpg,https://javct.net/v/10-041926-01,14,2026-04-25
CR-042026-001,SEX establishment in which staff dress in costumes,https://pic.javct.net/poster/04112026/1776669371.jpg,https://javct.net/v/cr-042026-001,59,2026-04-25
FC2PPV-4883860,"[Limited Uncensored] A hole is made in the official layer condom of the fireworks costume, and she impregnates him on a dangerous day and accepts the invitation and has sex with him...♡ [Fireworks/Collapse Star Rail]",https://pic.javct.net/poster/04112026/1776645835.jpg,https://javct.net/v/fc2ppv-4883860,27,2026-04-25
FC2PPV-4883599,"[Complete secret version] [I cup] [Big breasts] [Creampie] Haruka, a new I cup graduate employee, was fo**ed to leave the company due to escalating harassment from her colleagues and boss [Chapter 1]",https://pic.javct.net/poster/04112026/1776576303.jpg,https://javct.net/v/fc2ppv-4883599,112,2026-04-25
FC2PPV-4883692,"[Uncensored] Hostess Marin, 23 years old, at first it was meant to be light, but before she knew it, the sex had become intense and she couldn't get out of it.",https://pic.javct.net/poster/04112026/1776576339.jpg,https://javct.net/v/fc2ppv-4883692,36,2026-04-25
HZ-3830,Asi-Hame!! Vol.26 - Zhang,https://pic.javct.net/poster/04112026/1776576140.jpg,https://javct.net/v/hz-3830,61,2026-04-25
FC2PPV-4878741,[Uncensored] ** The hidden face of nursery teacher Yumi (22)... Her secret is too neat,https://pic.javct.net/poster/04112026/1776576108.jpg,https://javct.net/v/fc2ppv-4878741,17,2026-04-25
FC2PPV-4882927,[Resale] [Mawashi Project] Here is a divine work full of F-cup beauties whose erotic marshmallow bodies make you irresistible no matter what you wear.,https://pic.javct.net/poster/04112026/1776570068.jpg,https://javct.net/v/fc2ppv-4882927,78,2026-04-25
FC2PPV-4879997,"[Uncensored] Ayame (27) Secretary with big breasts and beautiful breasts, intimate private life that is not usually shown",https://pic.javct.net/poster/04112026/1776576189.jpg,https://javct.net/v/fc2ppv-4879997,16,2026-04-25
FC2PPV-4883529,"380_[Dirty language graffiti] Thank you for her retirement, Runa-chan. Pervert dirty words graffiti on her super dynamite body. At the end, the three actors make Runa-chan enjoy her body to their heart's content. Creampie 4P Runa-chan Chapter 10 [Overseas version]",https://pic.javct.net/poster/04112026/1776569680.jpg,https://javct.net/v/fc2ppv-4883529,58,2026-04-25
HZ-3827,Perverted Maid Turns Into A Nympho With Her Master's Junk - Kaede Takagaki,https://pic.javct.net/poster/04112026/1776487863.jpg,https://javct.net/v/hz-3827,61,2026-04-25
PA-041826-100,It's Hawaii! A Bikini wife in high spirits!,https://pic.javct.net/poster/04112026/1776506834.jpg,https://javct.net/v/pa-041826-100,60,2026-04-25
10-041826-01,SEX within seconds of meeting : Ai Nakano,https://pic.javct.net/poster/04112026/1776487893.jpg,https://javct.net/v/10-041826-01,47,2026-04-25
REAL-547-RM,My Meat Urinal - Yojohan Captivity Daughter South Riona [Uncensored L**ked],https://pic.javct.net/poster/20233001/1676506722.jpg,https://javct.net/v/real-547-rm,145,2026-05-14
MDTM-194-RM,It Is Played With A Man Free In School Girls Miyu Kana You've Awakened To The Transformation Play [Uncensored L**ked],https://pic.javct.net/poster/04112026/ff8d19d0d2.jpg,https://javct.net/v/mdtm-194-rm,130,2026-05-14
BAZX-413-RM,Youthful Sex: What Kind Of Sex Do Emotional Schoolgirls Have? Complete Memorial BEST 4 Hours 12 Girls [Uncensored L**ked],https://pic.javct.net/poster/04112026/49b9a2104e.jpg,https://javct.net/v/bazx-413-rm,240,2026-05-14
PIYO-082,After All Han Is A Wolf! Attacking A Chick Girl Who Eats And Makes It Squid Pakkuncho Wolf Best,https://pic.javct.net/poster/04112026/c3aab4e7d4.jpg,https://javct.net/v/piyo-082,490,2026-05-14
PIYO-069,"Boyish Again! (This Is) Natural Premature Ejaculation Ikuiku School Girls. That Chick, The Most Sensitive Girl In The History Of Chick, Finally Appeared Only Once Again. Crazy Infinite Convulsions With Big Cock, Bukkake, Irama, 3P! ! ~ Akari",https://pic.javct.net/poster/04112026/d8beff9cb4.jpg,https://javct.net/v/piyo-069,260,2026-05-14
