code,title,image_url,page_url,views,date_scraped
IENE-713,"3 Days To Stay, Ultra-luxury Beauty Soap Yui Nishikawa To Live Under The Same Roof",https://pic.javct.net/poster/04112026/96be06815a.jpg,https://javct.net/v/iene-713,135,2026-05-14
MIDE-004,Dcup Super Rarity Soap Lady Nishikawa Yui,https://pic.javct.net/poster/04112026/9bfb85a362.jpg,https://javct.net/v/mide-004,150,2026-05-14
MIDE-202,Nishikawa Yui Exquisite Manners Full Course 8,https://pic.javct.net/poster/04112026/d8e04d6a1c.jpg,https://javct.net/v/mide-202,240,2026-05-14
GDRD-022-RM,Red Dragon Nene Tanaka [Uncensored L**ked],https://pic.javct.net/poster/20241703/1712373571.jpg,https://javct.net/v/gdrd-022-rm,109,2026-05-14
VAGU-259-RM,"Oops Pub, Soap, Men's Este ... No Matter Where You Go, A Mother Who Loves Her Son Will Come Without A Full-course Sexual Incest Reiko Kobayakawa [Uncensored L**ked]",https://pic.javct.net/poster/20230207/1691126842.jpg,https://javct.net/v/vagu-259-rm,105,2026-05-14
ONEZ-087-RM,"Love Sexual Dating With Sefure.Roppongi Luxury Caba Daughter Mika's Holiday 'Carey Is A Good-looking Guy, Sefure Is Not A Cheap Unfriendly Man But Only SEX Is Super Compatible ◆' [Uncensored L**ked]",https://pic.javct.net/poster/04112026/eb436ea3fd.jpg,https://javct.net/v/onez-087-rm,120,2026-05-14
MIDD-869-RM,Delivery Of Rene Rene Thorpe Castle Castle Mon Mon [Uncensored L**ked],https://pic.javct.net/poster/06032026/1773111305.jpg,https://javct.net/v/midd-869-rm,120,2026-05-14
SCOP-909-RM,"I Called A Call Girl And The One Who Showed Up Was The Former Delinquent Who Used To Bully Me!? I Got Annoyed At Her For Doing A Half-hearted Job And Cursing At Me, So I Slipped Her Some Aphrodisiac Oil I Had Prepared, And She Became Incredibly Horny!! Her Body Became Sensitive And Started To Convulse Uncontrollably, And When I Slathered More On, She Begged For My Dick Herself!! She Came So Hard She Arched Her Back Like A Shrimp [Uncensored L**ked]",https://pic.javct.net/poster/04112026/0e679cf473.jpg,https://javct.net/v/scop-909-rm,135,2026-05-14
MDBK-416-RM,Her Super Sensitive Body Is Cumming Like Crazy!! Schoolgirl Escort Girls In Swimsuits Keep Climaxing From The Customers' Cocks And Obediently Get Fucked With Cum Inside. [Uncensored L**ked],https://pic.javct.net/poster/04112026/8807e2855f.jpg,https://javct.net/v/mdbk-416-rm,140,2026-05-14
HVY-012-RM,Let Me Lick Surgery Service Yarra 80% If You Ask In This Matter Also Give 3 Beautiful Married Woman Tide Blow Cum Deriheru Married! ! [Uncensored L**ked],https://pic.javct.net/poster/04112026/ca1a271639.jpg,https://javct.net/v/hvy-012-rm,200,2026-05-14
SCOP-594,Large Carefully Selected Only Mother-of-sex Milk From The Manly And Married Ladies That The SCOOP Group Has Taken So Far! !Boobs Heaven Even This Is SP Best! !,https://pic.javct.net/poster/04112026/df223fb4ac.jpg,https://javct.net/v/scop-594,240,2026-05-14
MIST-209,"At ""An Old Traditional Titty Pub"" In The Biggest Entertainment District In Japan, New Girls Will Secretly Fuck Their Customers Raw In Order To Steal Them From The Veteran Girls 10",https://pic.javct.net/poster/04112026/9df49150c0.jpg,https://javct.net/v/mist-209,160,2026-05-14
MDBK-418-RM,Super Lewd High-Class Escort Girls: New Complete Collection 240 Minutes BEST [Uncensored L**ked],https://pic.javct.net/poster/04112026/14377d112d.jpg,https://javct.net/v/mdbk-418-rm,240,2026-05-14
MDBK-418,Super Lewd High-Class Escort Girls: New Complete Collection 240 Minutes BEST,https://pic.javct.net/poster/04112026/14377d112d.jpg,https://javct.net/v/mdbk-418,240,2026-05-14
HUNTC-506-RM,"""If You Let Me Cum, I'll Come To Work."" My Big Dick Is The Alarm Clock For The Hostesses!? My Job As A Helpless Worker Is To Wake Up The Hostesses In The Dorm. Today, A Super Spoiled Girl With A Hangover Gave Me The Impossible Task Of ""If You Let Me Cum..."" So I Gave Her A Quickie To Wake Her Up! And Then... [Uncensored L**ked]",https://pic.javct.net/poster/04112026/751f0ba0de.jpg,https://javct.net/v/huntc-506-rm,170,2026-05-14
MDBK-416,Her Super Sensitive Body Is Cumming Like Crazy!! Schoolgirl Escort Girls In Swimsuits Keep Climaxing From The Customers' Cocks And Obediently Get Fucked With Cum Inside.,https://pic.javct.net/poster/04112026/8807e2855f.jpg,https://javct.net/v/mdbk-416,140,2026-05-14
MOND-001-RM,Yuka Tachibana Seems That There Are Reipuman Of The Atrocity Aimed Specializing In Bride Of Your Shading In The Reception The Wedding Hall Of The Northern Kanto Certain Prefecture Certain City [Uncensored L**ked],https://pic.javct.net/poster/20220707/1659230187.jpg,https://javct.net/v/mond-001-rm,135,2026-05-14
MIDE-176,Female College Student Captivity Les ×-flops Nishikawa Yui,https://pic.javct.net/poster/04112026/5b63a01644.jpg,https://javct.net/v/mide-176,150,2026-05-14
MIDE-187,"Today, I Was Committed To Your Boss. Nishikawa Yui",https://pic.javct.net/poster/04112026/60203022ad.jpg,https://javct.net/v/mide-187,140,2026-05-14
MIGD-540-RM,Pies Only Meat Urinal Aoi Koharu [Uncensored L**ked],https://pic.javct.net/poster/06032026/1773888878.jpg,https://javct.net/v/migd-540-rm,160,2026-05-14
IESP-268-RM,Arisa Kanno Barrage Pies 20 New Employees [Uncensored L**ked],https://pic.javct.net/poster/04112026/ce4ad8da48.jpg,https://javct.net/v/iesp-268-rm,120,2026-05-14
T28-373-RM,Studio Shot & Tan Check Referred To As The Scout Of Summer Vacation Shaved Tanned Girl Wrecked Reader Model! [Uncensored L**ked],https://pic.javct.net/poster/20242012/1735059230.jpg,https://javct.net/v/t28-373-rm,160,2026-05-14
SCOP-593,Play A Body Full Of Sleeping Sleep! !Male And Female Incarnation Of Eroticism And Obscene Crawling 4 Hours BEST,https://pic.javct.net/poster/04112026/0c30eee0f0.jpg,https://javct.net/v/scop-593,240,2026-05-14
T28-371-RM,Pies SEX & Anal SEX And Russian Blonde Shaved Pussy Girl Gina Active College Student [Uncensored L**ked],https://pic.javct.net/poster/06032026/1772843457.jpg,https://javct.net/v/t28-371-rm,120,2026-05-14
MOMJ-147-RM,Mio Kuraki Being Fucked In The Hobby Of Husband [Uncensored L**ked],https://pic.javct.net/poster/04112026/b336d9d63c.jpg,https://javct.net/v/momj-147-rm,110,2026-05-14
T28-367-RM,R**e Out Netorare Elder Brother's Wife During Fucked Brother-in-law Next To The Husband Is Sleeping [Uncensored L**ked],https://pic.javct.net/poster/01202026/1772443072.jpg,https://javct.net/v/t28-367-rm,120,2026-05-14
SCAD-006-RM,SPECIAL SAKURA ISM Akane Sakura [Uncensored L**ked],https://pic.javct.net/poster/04112026/d8e2d66c14.jpg,https://javct.net/v/scad-006-rm,110,2026-05-14
SCOP-590,"There Is No Convenience Store In The Countryside Misunderstanding Of The Urban Rash I Am Stupid At The Gals Refined And R**e! ! ""Do Not Be Silly! ! ""Shouting, When It Gets Stared At All Over, It Becomes Extra Excited And A High Speed Piston! !Whether The Roots Are Jariman, While Being Disliked, I Will Rub The Coat, So Go Out To The Uterus And Vaginal Cum Shot! !",https://pic.javct.net/poster/04112026/d9947055a4.jpg,https://javct.net/v/scop-590,120,2026-05-14
SHKD-826,Closed Room Complete Confinement Selika Kurokawa,https://pic.javct.net/poster/04112026/ee42e856d6.jpg,https://javct.net/v/shkd-826,110,2026-05-14
ADN-233-SUB,The Bride Is Violated At Night Night-relationship With The Forbidden Father-in-law Akari Neo [English Subtitle],https://pic.javct.net/poster/06032026/1774430926.jpg,https://javct.net/v/adn-233-sub,120,2026-05-14
MIAE-314-SUB,My Boyfriend's Father Was Caught Until It Was Faked Immediately With Aphrodisiac Tea Puff And Cramped Misaka Ria [English Subtitle],https://pic.javct.net/poster/06032026/1773113024.jpg,https://javct.net/v/miae-314-sub,150,2026-05-14
IPZ-665,Always Friendly To Me And Hanru The Busty Sister Next Door!Yaru~tsu I Prisoners! ! Hatsune Minori,https://pic.javct.net/poster/04112026/12a5153ec8.jpg,https://javct.net/v/ipz-665,160,2026-05-14
PGD-572-RM,Girl ASUKA Active Campaign Was Committed [Uncensored L**ked],https://pic.javct.net/poster/01202026/1772766158.jpg,https://javct.net/v/pgd-572-rm,170,2026-05-14
T28-365-RM,Broad Daylight R**e Field That Was Aimed At The Mountain Girl Who Came To Climbing [Uncensored L**ked],https://pic.javct.net/poster/20230206/1686735616.jpg,https://javct.net/v/t28-365-rm,90,2026-05-14
HAR-080-RM,Miserable False Retribution - Sexual Bad JK 3 People Cock Meat Insult - [Uncensored L**ked],https://pic.javct.net/poster/04112026/f19a2a0cc8.jpg,https://javct.net/v/har-080-rm,105,2026-05-14
MIAA-294-RM,It's Winter Love That Got Erected When I Saw A C**ldhood Friend Who Is Helping Me [Uncensored L**ked],https://pic.javct.net/poster/20230104/1681689620.jpg,https://javct.net/v/miaa-294-rm,120,2026-05-14
CRS-026-RM,Kotone Amemiya - Being Fucked In The Old Man - Has Been Turned Into A Sex Slave Wife Breasts [Uncensored L**ked],https://pic.javct.net/poster/04112026/70787675cf.jpg,https://javct.net/v/crs-026-rm,120,2026-05-14
EMBZ-165-RM,"[Browsing Attention] Mature Female Gangbang R**e Image File # 05 ""Victims: 20s - 40s · Big Tits Housewives"" [Uncensored L**ked]",https://pic.javct.net/poster/04112026/0435c9fb61.jpg,https://javct.net/v/embz-165-rm,180,2026-05-14
HUSR-076,Eh ... And Bought The Daughter Of Ji ○ Port! Runaway Son Came Back To Become A Transsexual! Sister And Father That Night Crawling In Mercenary Big Penis Incest Yukino Akari,https://pic.javct.net/poster/04112026/ef3ddb902a.jpg,https://javct.net/v/husr-076,120,2026-05-14
CAWD-035-SUB,Rookie Kawaii * Exclusive Debut → W55cm Super Slender And Miraculous Natural F Cup Active College Student Shino Akina 20 Years Old AV Debut [English Subtitle],https://pic.javct.net/poster/06032026/1775635333.jpg,https://javct.net/v/cawd-035-sub,120,2026-05-14
MIDE-247,Married Nishikawa Yui Who Lost Us Ji ○ Port Other Than Husband,https://pic.javct.net/poster/04112026/556af053d8.jpg,https://javct.net/v/mide-247,120,2026-05-14
DASS-940-RM,"Unleashed. First Time Transsexual Sex. With Hearts Pounding, They Kiss Again And Again, Falling In Love And Melting Together. Misao Oguri, Chika Saotome [Uncensored L**ked]",https://pic.javct.net/poster/04112026/af81e4e563.jpg,https://javct.net/v/dass-940-rm,120,2026-05-14
PIYO-065,Adolescent Sexual Runaway. A Chick Bitch Blaming Blacks.,https://pic.javct.net/poster/04112026/090982f2b0.jpg,https://javct.net/v/piyo-065,180,2026-05-14
ODVHJ-074,An Erotic Story About Having Sex With Beautiful And Sexy Middle-aged Women At A Sauna In Tokyo... (3),https://pic.javct.net/poster/04112026/1d1caef6d3.jpg,https://javct.net/v/odvhj-074,160,2026-05-14
START-556-RM,"The penis is inserted in a string and the pussy is developed for 24 hours, and the sexual experience continues to get wet with love juice. Atsushi Nanase [Uncensored L**ked]",https://pic.javct.net/poster/04112026/57ef9c5cc8.jpg,https://javct.net/v/start-556-rm,150,2026-05-14
HUSR-167,Mom's Cock Is Incredible!Mother-in-law Is A Man's Daughter!Daughter And Son Dohimaru Who Haunts Her Huge Cock ... ... Pervert Family Gachijiki Incest Incest! [Yukino Akari] 【Sayaka Sakurai】,https://pic.javct.net/poster/04112026/ecd368dd91.jpg,https://javct.net/v/husr-167,120,2026-05-14
MOGI-157-RM,"[Creampie Orgy at Training Camp] I left my father and went to a summer training camp when I was a little league baseball girl. I want to be fucked by a man as old as my coach. Sakina Takeuchi, 18 years old [Uncensored L**ked]",https://pic.javct.net/poster/04112026/718c94bbe4.jpg,https://javct.net/v/mogi-157-rm,125,2026-05-14
MOGI-157,"[Creampie Orgy at Training Camp] I left my father and went to a summer training camp when I was a little league baseball girl. I want to be fucked by a man as old as my coach. Sakina Takeuchi, 18 years old",https://pic.javct.net/poster/04112026/718c94bbe4.jpg,https://javct.net/v/mogi-157,125,2026-05-14
START-556,"The penis is inserted in a string and the pussy is developed for 24 hours, and the sexual experience continues to get wet with love juice. Atsushi Nanase",https://pic.javct.net/poster/04112026/57ef9c5cc8.jpg,https://javct.net/v/start-556,150,2026-05-14
SDMU-866,"Magic Mirror Amateur Beauty Only Suddenly Decked Into 100 Questions While Asking!Shamefully, With A Continuous Piston, You Gotta Get Wet And Huge!Total 8 People",https://pic.javct.net/poster/04112026/bcfd881b65.jpg,https://javct.net/v/sdmu-866,240,2026-05-14
FC2PPV-4898685,"[No] [Esthetics] A service massage by a married woman with an E cup who specializes in black customers ♥ While giving a blow job, her uterus becomes erotic and she aggressively stamps the portio in the cowgirl position to the limit of her patience and ends up having orgasms ♥ [Overseas version] Bonus included",https://pic.javct.net/poster/04112026/a35ffa489d.jpg,https://javct.net/v/fc2ppv-4898685,53,2026-05-14
EKDV-816-RM,"Seeking A Huge Cock, She Appears In An Adult Video. The Plain-looking, Bespectacled Beauty Is A Hairy Bitch Overflowing With Erotic Curiosity. - Mari Azusa [Uncensored L**ked]",https://pic.javct.net/poster/04112026/ffae42be11.jpg,https://javct.net/v/ekdv-816-rm,150,2026-05-14
CHKP-004,Bitch A President Secretary Middle-aged Cock Father And Juice Nuo Rich Sex,https://pic.javct.net/poster/04112026/229af23bbc.jpg,https://javct.net/v/chkp-004,84,2026-05-14
NGOD-337-RM,"Lingerina, The Principal Of A Prestigious Private Girls' School, Is Stripped Naked By A Parent's Enormous Penis And Exposed For Backdoor Admissions. [Uncensored L**ked]",https://pic.javct.net/poster/04112026/7e74d0f870.jpg,https://javct.net/v/ngod-337-rm,120,2026-05-14
SKMJ-745-RM,"Beautiful Office Ladies From Marunouchi Take Part Lol [No-hands Blowjob Competition With Sperm Dripping From The Mouth (゜Д゜)] ""You Can't Spill The Sperm That's Been Released"" Receive 5 Ejaculations In Your Mouth Within The Time Limit And Complete The Mission Of Continuous Blowjobs To Win 1 Million Yen! Failure Results In An Immediate Cumshot Penalty Game! [Uncensored L**ked]",https://pic.javct.net/poster/04112026/ac9dac6812.jpg,https://javct.net/v/skmj-745-rm,209,2026-05-14
NKKD-362-RM,"Big Dick Incest: Mother Seduced By Her Son's Hard, Erect, Circumcised Cock [Uncensored L**ked]",https://pic.javct.net/poster/04112026/c6ca6074fe.jpg,https://javct.net/v/nkkd-362-rm,120,2026-05-14
EBOD-488,First Experience Of I Cup Overseas Model!Cheap Iki 4 Production Sasaki Erie,https://pic.javct.net/poster/04112026/16d74a349b.jpg,https://javct.net/v/ebod-488,150,2026-05-14
NGOD-338-RM,"This Is A Story About A Nephew Who Comes To Tokyo With A Magnificent Huge Penis, Leaving His Uncle With No Standing As A Man, And Even His Serious Wife Starting To Show A Feminine Expression Upon Seeing His Massive Cock... [Uncensored L**ked]",https://pic.javct.net/poster/04112026/788a0f680e.jpg,https://javct.net/v/ngod-338-rm,120,2026-05-14
NGOD-335-RM,"The Wife Of A General Contractor's Head Office, A Beautiful Woman In A Suit From A Major Construction Company, Has Her Sweaty Crotch Poked By A Sweaty, Big-dick Worker During A Rush Job. [Uncensored L**ked]",https://pic.javct.net/poster/04112026/a58ae607a9.jpg,https://javct.net/v/ngod-335-rm,120,2026-05-14
393OTIM-286-RM,"Completely defeated by a 30cm horse-sized dildo, flattering voice, flattering demon sex, in a portio & lewd state... gangimari vulgar intercourse Ai [Uncensored L**ked]",https://pic.javct.net/poster/20231011/1697847489.jpg,https://javct.net/v/393otim-286-rm,80,2026-05-14
PKPD-419-RM,Female Amateur Pornographer Mika And Lesbian Actresses: A Genuine Lovemaking Session With Yura Kana. [Uncensored L**ked],https://pic.javct.net/poster/04112026/fe3eaa18cc.jpg,https://javct.net/v/pkpd-419-rm,130,2026-05-14
XVSR-282,Hibiki Otsuki VS Hatano Yui Ikase Battle Royale - No Scripts · Gachinko Confrontation Without Any Omission! !~,https://pic.javct.net/poster/04112026/7f21c8ac0c.jpg,https://javct.net/v/xvsr-282,110,2026-05-14
JUFD-178,Haruna ~ Azumi Mizushima-Gi-Oh Glossy Distortion Of Two Gorgeous Babes - Soft Body Soap Heaven,https://pic.javct.net/poster/04112026/09920063c9.jpg,https://javct.net/v/jufd-178,180,2026-05-14
PIYO-063,[The Pervert Desire Of A Young Lady] The Intellectual Girl Who Serves As The Student Council President Loves Delusions As She Masturbates By Imagining Female Big Boobs. A Real Awakening To Lesbians! ? Indecent And Vulgar Enough To Imagine From An Elegant Atmosphere ... And This Nasty Bristle,https://pic.javct.net/poster/04112026/ca0552007e.jpg,https://javct.net/v/piyo-063,170,2026-05-14
JUC-480,Sakiko Mihara Azumi Mizushima ~ Trap Depths Of The Mother-in-law Mother-in-law Wife Tremble With Jealousy - Lesbian To**ure,https://pic.javct.net/poster/04112026/f7f5f4d29a.jpg,https://javct.net/v/juc-480,110,2026-05-14
BOKO-038,"Wanting To Get To Know Each Other Better, Two Close Friends Spend A Two-day, One-night Date Where They Eat, Shower, And Kiss A Lot Until Morning, Discovering Feelings Of Love They Didn't Know They Had. - Meru Adachi & Nana Kisaki",https://pic.javct.net/poster/04112026/e777903f80.jpg,https://javct.net/v/boko-038,172,2026-05-14
PKPD-419,Female Amateur Pornographer Mika And Lesbian Actresses: A Genuine Lovemaking Session With Yura Kana.,https://pic.javct.net/poster/04112026/fe3eaa18cc.jpg,https://javct.net/v/pkpd-419,130,2026-05-14
DANDY-877-RM,"Women's Love Is Rapidly Increasing Among Female College Students! ? Verification Suddenly Berokisu! Lesbian Bitch Chained Sex ""Please Introduce A Lesbian Friend Who Is More Erotic Than You"" VOL.2 [Uncensored L**ked]",https://pic.javct.net/poster/20230804/1694057041.jpg,https://javct.net/v/dandy-877-rm,239,2026-05-14
VIPR-076-RM,Erica Sato Invades A Shady AV Shoot!! Erika Sato [Uncensored L**ked],https://pic.javct.net/poster/04112026/e3714f871a.jpg,https://javct.net/v/vipr-076-rm,60,2026-05-14
JUY-318-RM,Kanae Matsuyuki Is Lifting Her Lesbian Ban!! Her Unspeakable Days Of Love And Lust An Immoral Married Woman Lesbian Series [Uncensored L**ked],https://pic.javct.net/poster/20253001/1739033457.jpg,https://javct.net/v/juy-318-rm,119,2026-05-14
AUKG-650-RM,Big-breasted Mature Beauty Sex Friend Training ~Jealousy-fueled Love-hungry Confinement Lesbian~ [Uncensored L**ked],https://pic.javct.net/poster/04112026/3b49da05d9.jpg,https://javct.net/v/aukg-650-rm,120,2026-05-14
DVDES-395-RM,Reversal Of The Relationship Between Teachers And Students! 6 Lesbian Gakuen Abstinence [Uncensored L**ked],https://pic.javct.net/poster/04112026/7d590e499d.jpg,https://javct.net/v/dvdes-395-rm,130,2026-05-14
JUR-738-RM,"Madonna's Exclusive Model, Okimiya Nami, Is Now Lesbian!! I Thought We Were Just Playing Around, But My Stepdaughter Turned Out To Be A Lesbian ~She Played With My Sensitive Weak Spot (nipples), And Before I Knew It, My Body And Soul Were Completely Captivated By Her.~ [Uncensored L**ked]",https://pic.javct.net/poster/04112026/5e76c2c60a.jpg,https://javct.net/v/jur-738-rm,110,2026-05-14
AUKG-650,Big-breasted Mature Beauty Sex Friend Training ~Jealousy-fueled Love-hungry Confinement Lesbian~,https://pic.javct.net/poster/04112026/3b49da05d9.jpg,https://javct.net/v/aukg-650,120,2026-05-14
BBAN-582-RM,"The Teased Character Is Hoping For More Erotic Teasing. A Love Triangle Lesbian With Lots Of Passionate Lovemaking, Squirting Orgasms, And Multiple Orgasms. Amou Ririka, Tenma Yui, Miki Hinano [Uncensored L**ked]",https://pic.javct.net/poster/04112026/db26f1cce3.jpg,https://javct.net/v/bban-582-rm,120,2026-05-14
BBAN-584-RM,The Ultimate Masochistic Awakening Training Lesbian That Drowns Women In Shame And Pleasure [Uncensored L**ked],https://pic.javct.net/poster/04112026/0904dffeb9.jpg,https://javct.net/v/bban-584-rm,200,2026-05-14
NVH-078,A Natural Futanari Beauty's Penis And Clitoris Are Devoured By Her Transsexual Lesbian Tutor Hanamiya Hime/Wakamiya Hazuki,https://pic.javct.net/poster/04112026/4e204da5db.jpg,https://javct.net/v/nvh-078,160,2026-05-14
DASS-893-RM,"Lesbianism Is Now Permitted. Loving, Agonizing, And Wanting To Be A Mess. Emotionally Raw Lesbians: Nanami Nami, Miyanishi Hikaru [Uncensored L**ked]",https://pic.javct.net/poster/04112026/bd4243e4c5.jpg,https://javct.net/v/dass-893-rm,180,2026-05-14
BBAN-583-RM,"Intense, Sweaty, And Juicy Lesbian Sex Between Mature Women! A Passionate, Sensual Sexual Encounter With That Woman You've Been Longing For. [Uncensored L**ked]",https://pic.javct.net/poster/04112026/c8841769d5.jpg,https://javct.net/v/bban-583-rm,170,2026-05-14
START-276-SUB,"Yotsuba Kominato X Riko Hoshino, The Two Top SODstars With Sensitive Constitutions, Co-star For The First Time, Lesbian Debut, Double Creampie, Liberation Cheat Day After Abstinence [English Subtitle]",https://pic.javct.net/poster/20253001/1740417005.jpg,https://javct.net/v/start-276-sub,170,2026-05-14
DANDY-873-RM,A Senior CA Is A Lesbian? ! A Rookie Cabin Attendant Who Felt Lesbian Harassment While Rubbing Her Breasts At Work [Uncensored L**ked],https://pic.javct.net/poster/20230804/1692853680.jpg,https://javct.net/v/dandy-873-rm,199,2026-05-14
IMJO-007-RM,[Female style voyeur] The real sexual reality of modern girls captured by the camera [Women's After 5] [Yuri] [Uncensored L**ked],https://pic.javct.net/poster/04112026/83b3b23c9e.jpg,https://javct.net/v/imjo-007-rm,69,2026-05-14
SONE-623-SUB,"My Sister Started Working Part-time At A Men's Beauty Salon, But She's Been Practicing Her Erotic Massage Sk**ls On My Body And It's Crazy! Rei Kuroshima [English Subtitle]",https://pic.javct.net/poster/20253001/1741285975.jpg,https://javct.net/v/sone-623-sub,140,2026-05-14
MDTM-181-RM,Engineered Trap False Accusation Shoplifting Force Squid To Bondage Hell Maya Nakanishi [Uncensored L**ked],https://pic.javct.net/poster/04112026/f4cf9cff38.jpg,https://javct.net/v/mdtm-181-rm,130,2026-05-14
SIMP-019-RM,Kaho [Uncensored L**ked],https://pic.javct.net/poster/04112026/eb8b5445f4.jpg,https://javct.net/v/simp-019-rm,69,2026-05-14
WNZ-340-RM,I Have Been Fertilized In Frustration Fuck Sex Life ~ ~ Beleaguered Young Wife. Mio Kuraki [Uncensored L**ked],https://pic.javct.net/poster/04112026/b93c008a83.jpg,https://javct.net/v/wnz-340-rm,120,2026-05-14
261ARA-424-RM,"[Miracle Breasts] 21 years old [Compatible with Divine Breasts] Nami-chan has arrived. She works at a kaiseki restaurant. Her reason for applying is ""I want to make the world peaceful with my breasts..."" She is so happy. [Uncensored L**ked]",https://pic.javct.net/poster/04112026/b20e8f34de.jpg,https://javct.net/v/261ara-424-rm,103,2026-05-14
UPSM-034,Years [3] OL Leading Travel Agency Work They Are Exposed To Face The Tide Piledriver Company To Return After 7 Series 8 Of OL,https://pic.javct.net/poster/04112026/3ea3027352.jpg,https://javct.net/v/upsm-034,120,2026-05-14
JUKF-104-RM,The Whole Story Of The A**se Of Authority Went To Girls Who Came To An AV Production Company For An Interview With A Director Because They Wanted A Job... (2) 8 People Included [Uncensored L**ked],https://pic.javct.net/poster/20230804/1693020967.jpg,https://javct.net/v/jukf-104-rm,200,2026-05-14
HAR-085-RM,Restrained Sensitive Mako Woman Who Is Jumping At Masturbation!Baki Baki Decachin Is Screwed In Ma Oko And It Is Just Like Fainting SEIKO SEX! ! [Uncensored L**ked],https://pic.javct.net/poster/04112026/812b628ad6.jpg,https://javct.net/v/har-085-rm,125,2026-05-14
NACR-733-RM,Masochistic Awakening Slender Office Lady Mari Ueto [Uncensored L**ked],https://pic.javct.net/poster/20231711/1701712373.jpg,https://javct.net/v/nacr-733-rm,120,2026-05-14
BLOR-297-RM,"The Slutty Stray Bitch Gets A Huge Cock And Her Eyes Roll Back In Ecstasy, Saying ""I Can't Take It Anymore, I Can't Do It"" As She Reaches A Complete Defeat And Orgasm, Then Gets Hit With More Thrusts And Groans Like An Animal. [Uncensored L**ked]",https://pic.javct.net/poster/04112026/74842ada7c.jpg,https://javct.net/v/blor-297-rm,128,2026-05-14
GEBB-044-RM,"""Huh? You're Seriously Hard, Gross..."" A Cool, Masked Beauty Deliberately Rubs Against A Masochistic Man Through Her Thong At A Massage Parlor Specializing In Submissive Men. [Uncensored L**ked]",https://pic.javct.net/poster/04112026/8d7c90bc09.jpg,https://javct.net/v/gebb-044-rm,180,2026-05-14
MIST-208,Take Okita And Insert It!,https://pic.javct.net/poster/04112026/8db33f8286.jpg,https://javct.net/v/mist-208,152,2026-05-14
MKMP-062,Undercover Investigator Nishikawa Yui,https://pic.javct.net/poster/04112026/44df8e9fcf.jpg,https://javct.net/v/mkmp-062,115,2026-05-14
NFDM-244,Circle Women Bang Away At A Man's Ass Gather,https://pic.javct.net/poster/04112026/b2809d8c12.jpg,https://javct.net/v/nfdm-244,125,2026-05-14
SAP-011-RM,Yua Aida Beauty Line [Uncensored L**ked],https://pic.javct.net/poster/04112026/6566020323.jpg,https://javct.net/v/sap-011-rm,100,2026-05-14
DDT-065-RM,Ran Asakawa Endless Semen Slut Libido [Uncensored L**ked],https://pic.javct.net/poster/04112026/797821e74d.jpg,https://javct.net/v/ddt-065-rm,127,2026-05-14
MDTM-105-RM,I Want to Be Tied Up and My Little Sis Does What I Say Kotone Suzumiya [Uncensored L**ked],https://pic.javct.net/poster/20221202/1649230400.jpg,https://javct.net/v/mdtm-105-rm,114,2026-05-14
NACT-125-RM,"An Intimate Documentary About AV Actress AIKA: Her True Self Revealed, And The Wild 3P Of The Empress's Arrival. [Uncensored L**ked]",https://pic.javct.net/poster/04112026/98abf9e763.jpg,https://javct.net/v/nact-125-rm,111,2026-05-14
NACT-120-RM,"Wife Sold: Sold At A Black Market Auction To Pay Off Her Husband's Debts, She Is Completely Trained And Corrupted By Perverted Customers. - Yuria Yoshine [Uncensored L**ked]",https://pic.javct.net/poster/04112026/fd14a88875.jpg,https://javct.net/v/nact-120-rm,122,2026-05-14
NACT-125,"An Intimate Documentary About AV Actress AIKA: Her True Self Revealed, And The Wild 3P Of The Empress's Arrival.",https://pic.javct.net/poster/04112026/98abf9e763.jpg,https://javct.net/v/nact-125,111,2026-05-14
