code,title,image_url,page_url,views,date_scraped
EBOD-228-SUB,[Uncensored] Dutiful Mother Tia [English Subtitle],https://static.javct.net/poster/ebod-228.jpg,https://javct.net/v/ebod-228-sub,119,2026-05-31
GVG-781-RM,A Man Wants His Mother-In-Law's Obscene Tits. Eri Takigawa [Uncensored L**ked],https://pic.javct.net/poster/20212709/1632995722.jpg,https://javct.net/v/gvg-781-rm,120,2026-05-31
XVSR-153-RM,"Erotic Novel, Stepmom Is 19-Year-Old Widow, Ecstatic Tears Of Joy, Suzu Harumiya [Uncensored L**ked]",https://pic.javct.net/poster/20220406/1655917797.jpg,https://javct.net/v/xvsr-153-rm,116,2026-05-31
OBA-381-RM,Cougar Hunter Vol. 2!! My Stepson is Amazing in Bed... Ayaka Makimura [Uncensored L**ked],https://pic.javct.net/poster/20221202/1646614728.jpg,https://javct.net/v/oba-381-rm,141,2026-05-31
SPRD-870-RM,Surrogate Mama Shihori Endo [Uncensored L**ked],https://pic.javct.net/poster/20212011/1641000918.jpg,https://javct.net/v/sprd-870-rm,116,2026-05-31
SPRD-1242-RM,The Surrogate Mother Mio Morishita [Uncensored L**ked],https://pic.javct.net/poster/20212011/1640918548.jpg,https://javct.net/v/sprd-1242-rm,123,2026-05-31
SPRD-1260-SUB,"Dear Stepmom, I, I Like You Better Than My Wife... Iroha Fukuyama [English Subtitle]",https://pic.javct.net/poster/20212011/1637801865.jpg,https://javct.net/v/sprd-1260-sub,106,2026-05-31
VENU-740-RM,This Stepmother And Son Will Start Fucking 2 Seconds After Stepdaddy Leaves For Work Kana Morisawa [Uncensored L**ked],https://pic.javct.net/poster/20221202/1645061130.jpg,https://javct.net/v/venu-740-rm,113,2026-05-31
AUKG-511-RM,"A Wife And Her Mother-In-Law Became Lesbian Lovers - This Horny Stepmom Fucked Her Daughter-In-Law After Watching Her Prancing Around With Her Guard Down, Flashing Panty Shot Action At Her Alice Otsu Shuri Yamaguchi [Uncensored L**ked]",https://static.javct.net/poster/aukg-511.jpg,https://javct.net/v/aukg-511-rm,121,2026-05-31
SPRD-1392-RM,Creampie Relations With My Kind Step Mother... Emi Toda [Uncensored L**ked],https://pic.javct.net/poster/20212011/1637462437.jpg,https://javct.net/v/sprd-1392-rm,108,2026-05-31
JUL-705-RM,After The Graduation Ceremony ... Your Stepmom Is Giving You A Gift To Celebrate Your Entry Into Adulthood ... A Madonna Label Exclusive Beautiful Mature Woman Actress Is Celebrating Your Launch Into The Real World With Her Alluring Eroticism. Maki Hojo [Uncensored L**ked],https://pic.javct.net/poster/20212308/1631256467.jpg,https://javct.net/v/jul-705-rm,124,2026-05-31
GVH-364-RM,"Son-In-Law Aiming For His Mother-In-Law's Too-Sexy Big Titties, With Kyoko Ichikawa [Uncensored L**ked]",https://pic.javct.net/poster/20212011/1644641824.jpg,https://javct.net/v/gvh-364-rm,120,2026-05-31
VENU-088-RM,Magic Mother: Taking Advantage Of Mom's Body While Daddy Is Not Home Asuka Yuki [Uncensored L**ked],https://pic.javct.net/poster/20220406/1656526601.jpg,https://javct.net/v/venu-088-rm,82,2026-05-31
JUL-673-RM,I Was Forbidden To Masturbate When My Wife Was Pregnant So I had Sex With My Mother-In-Law Maki Hojo [Uncensored L**ked],https://static.javct.net/poster/jul-673.jpg,https://javct.net/v/jul-673-rm,120,2026-05-31
ADN-165-US,"Forbidden Immoral Sex 3 An Excessively Young Mother-In-Law Saeko Matsushita [English Subtitle, Reducing Mosaic]",https://pic.javct.net/poster/20221202/1646177501.jpg,https://javct.net/v/adn-165-us,114,2026-05-31
SDMU-673-RM,SOD Romance x French Publishing Living Together I'm A Spoiled Brat Living With My Stepmom Sumire Shiraishi [Uncensored L**ked],https://pic.javct.net/poster/20221202/1648868830.jpg,https://javct.net/v/sdmu-673-rm,129,2026-05-31
SPRD-644-RM,"My Stepmother, Is Way Better Than My Wife... Mari Yonezaki [Uncensored L**ked]",https://pic.javct.net/poster/20212011/1641519219.jpg,https://javct.net/v/sprd-644-rm,115,2026-05-31
SPRD-1484-RM,"Step-mother-in-law, You're Much Better Than My Wife... Iori Nanase [Uncensored L**ked]",https://pic.javct.net/poster/20212011/1637815526.jpg,https://javct.net/v/sprd-1484-rm,139,2026-05-31
JUL-645-RM,Horny Pregnant Stepmom Rides My Cock For A Creampie Behind The Old Man's Back Ai Mukai [Uncensored L**ked],https://static.javct.net/poster/jul-645.jpg,https://javct.net/v/jul-645-rm,124,2026-05-31
SPRD-993-RM,"Dear Stepmom, You're Much Better Than My Wife... Azusa Yagi [Uncensored L**ked]",https://pic.javct.net/poster/20212011/1640980073.jpg,https://javct.net/v/sprd-993-rm,124,2026-05-31
JUY-418-RM,This Stepmom Has Been Hungering For Her Son-In-Law's Big Cock 24 Hours A Day And Tempting Him To Taste Her Pussy Momoko Isshiki [Uncensored L**ked],https://pic.javct.net/poster/20221202/1647328046.jpg,https://javct.net/v/juy-418-rm,145,2026-05-31
JUY-751-RM,"Day And Night, I Crave My Daughter's Husband's Giant Cock Seduced By The Mother-In-Law Yuko Shiraki [Uncensored L**ked]",https://pic.javct.net/poster/20212709/1632936029.jpg,https://javct.net/v/juy-751-rm,168,2026-05-31
JUY-268-RM,A Passion Drenched Afternoon Mother In Law and Son's Unforgivable Act of Depravity Maki Tomoda [Uncensored L**ked],https://pic.javct.net/poster/20212011/1643684288.jpg,https://javct.net/v/juy-268-rm,119,2026-05-31
JUL-469-RM,"All Alone With My Hot Stepmom During A Power Outage... It All Started By Accident, But It Led To An Indecent Creampie Relationship. Yuko Shiraki [Uncensored L**ked]",https://pic.javct.net/poster/20212011/1637859383.jpg,https://javct.net/v/jul-469-rm,117,2026-05-31
GVG-797-RM,Village Doctor Old Man Face Licking Creampie Pervert Clinical Chart Yuna Ishikawa [Uncensored L**ked],https://pic.javct.net/poster/20221108/1661677658.jpg,https://javct.net/v/gvg-797-rm,128,2026-05-31
FOCS-060-RM,Anal Licking! Temptress Maid With A Beautiful Huge Ass Uses Her Asshole To Induce Temptation. Get To Have A Creampie Load After Giving Anal Cunnilingus. Meisa Kawakita [Uncensored L**ked],https://pic.javct.net/poster/20221202/1650012605.jpg,https://javct.net/v/focs-060-rm,124,2026-05-31
FOCS-059-RM,A Fresh Face Extremely Tiny Titty Beautiful Girl Makes Her Debut A Brilliant Math Scholar Barely Legal Babe Uses Her Sensitive Nipples To Solve This Sex Equation! Yui Setouchi [Uncensored L**ked],https://pic.javct.net/poster/20221202/1646979240.jpg,https://javct.net/v/focs-059-rm,150,2026-05-31
MIDD-918-RM,[Reducing Mosaic] Sexual Healing Men's Massage Parlor - Miku Ohashi [Uncensored L**ked],https://static.javct.net/poster/midd-918.jpg,https://javct.net/v/midd-918-rm,118,2026-05-31
XVSR-198-RM,An Erotic Novel A Wet And Wild Sister-In-Law The Sexy Skin Of An Older Sister-In-Law Mao Kurata [Uncensored L**ked],https://pic.javct.net/poster/20220406/1656374126.jpg,https://javct.net/v/xvsr-198-rm,116,2026-05-31
URLH-013-RM,A Fresh Face Sexual Cabaret Hostess Princess Uses Her Tits To Lure Me To Temptation Yuka Sato [Uncensored L**ked],https://static.javct.net/poster/urlh-013.jpg,https://javct.net/v/urlh-013-rm,161,2026-05-31
REAL-766-RM,Young Wife With Big Tits Made To Breed With 20 Continuous Creampies Akari Niimura [Uncensored L**ked],https://static.javct.net/poster/real-766.jpg,https://javct.net/v/real-766-rm,160,2026-05-31
REAL-782-SUB,"A Schoolgirl Who Is Hard At Work, Studying For Her Entrance Exams, Is Panting And Moaning And Repeatedly Cumming While She Receives A Private, Aphrodisiac-Fueled Lesson Maika Hiizumi [English Subtitle]",https://pic.javct.net/poster/20212709/1636175008.jpg,https://javct.net/v/real-782-sub,120,2026-05-31
FOCS-058-RM,Innocent Female College Student Ends Up In University Sex Club And Recorded On Video. Female College Student Gets Really Obsessed With A Boyfriend Who Can't Get Enough Of Big Orgies. Maina Miura. [Uncensored L**ked],https://pic.javct.net/poster/20221202/1646979320.jpg,https://javct.net/v/focs-058-rm,124,2026-05-31
FMDL-008-RM,Cuckold By My Best Friend And Str**gled Development Falls M Awakening Mei Satsuki [Uncensored L**ked],https://pic.javct.net/poster/20230207/1689428020.jpg,https://javct.net/v/fmdl-008-rm,136,2026-05-31
EBOD-451-RM,The Temptation Of A Voluptuous Babe In High-Legged Lingerie With Plenty Of Camel Toe    Chitose Saegusa [Uncensored L**ked],https://pic.javct.net/poster/20221108/1661401477.jpg,https://javct.net/v/ebod-451-rm,118,2026-05-31
ZMAR-100-RM,Fully! Nanao Nakano [Uncensored L**ked],https://pic.javct.net/poster/20231711/1700420744.jpg,https://javct.net/v/zmar-100-rm,240,2026-05-31
OFJE-511-RM,World-class Beauty Kaede Fua's 3-year History Complete Collection Of All 33 Titles [Uncensored L**ked],https://pic.javct.net/poster/20252204/1746940895.jpg,https://javct.net/v/ofje-511-rm,960,2026-05-31
ROYD-070-RM,I Couldn't Resist The Temptations From The Tiny Tits Of My Classmate And I Had Unprotected Sex Multiple Times. Natsu Tojo [Uncensored L**ked],https://pic.javct.net/poster/20212709/1634886814.jpg,https://javct.net/v/royd-070-rm,151,2026-05-31
KSBJ-023-RM,Naked Wife: Iroha Narimiya [Uncensored L**ked],https://pic.javct.net/poster/20221904/1650597164.jpg,https://javct.net/v/ksbj-023-rm,119,2026-05-31
FOCS-057-RM,NTR Sex Using Aphrodisiacs. She Slips Her Boyfriend's Older Brother An Aphrodisiac... Makes Him Cum All Over And Does Everything... Drooling On It...Nipple Sensitive Hard Cumming. Machi Ikuta [Uncensored L**ked],https://pic.javct.net/poster/20221202/1646979405.jpg,https://javct.net/v/focs-057-rm,121,2026-05-31
DANDY-777-RM,Instant Gratification! A Little Devil Girl Who Can Make Any Troubled Man Cum By Sucking Him So Hard That He Gets A Hickey 5 Seconds After Entering The Room Ichika Matsumoto Aged 21 [Uncensored L**ked],https://pic.javct.net/poster/20212308/1630050812.jpg,https://javct.net/v/dandy-777-rm,134,2026-05-31
NGOD-007-RM,I Want To Tell You My Cuckolding Story The Sweaty Electronics Shop Guy Seduced My Wife Starring Kaho Shibuya [Uncensored L**ked],https://pic.javct.net/poster/20220707/1658245574.jpg,https://javct.net/v/ngod-007-rm,136,2026-05-31
JUY-320-RM,A Married Woman Soapland Girl Who Got Hooked On A Cherry Boy Maki Tomoda [Uncensored L**ked],https://pic.javct.net/poster/20220406/1655893217.jpg,https://javct.net/v/juy-320-rm,142,2026-05-31
JBD-280-RM,Sailor Uniform And Bondage Rope... Ichika Matsumoto [Uncensored L**ked],https://pic.javct.net/poster/20221202/1648797604.jpg,https://javct.net/v/jbd-280-rm,116,2026-05-31
HZGD-203-RM,The Cherry Boy Next Door Finally Has A Girlfriend So As A Kind Married Woman I Let Him Practice Sex and Creampies. Ichika Matsumoto [Uncensored L**ked],https://pic.javct.net/poster/20212709/1636200949.jpg,https://javct.net/v/hzgd-203-rm,119,2026-05-31
ABF-356-RM,A Closed-room Scenario Where Alice Shaku Sexually Harasses You At Zero Distance. [Uncensored L**ked],https://pic.javct.net/poster/05192026/ea3c2988fd.jpg,https://javct.net/v/abf-356-rm,135,2026-05-31
ABF-355,Monthly Amateur Porn: Instinctive 3-Part Show - Airi Suzumura,https://pic.javct.net/poster/05192026/4243635bd3.jpg,https://javct.net/v/abf-355,130,2026-05-31
ABF-356,A Closed-room Scenario Where Alice Shaku Sexually Harasses You At Zero Distance.,https://pic.javct.net/poster/05192026/ea3c2988fd.jpg,https://javct.net/v/abf-356,135,2026-05-31
SHM-046-RM,A Married Woman With A Ripe Sex Appeal That Satisfies The Sexual Desire Overflowing With Papa Katsu ] Rei (27) Aino Rei [Uncensored L**ked],https://pic.javct.net/poster/20221202/1648295522.jpg,https://javct.net/v/shm-046-rm,90,2026-05-31
ONEZ-115-RM,Sleeping Wife Erectile Dysfunction ED I Am Filming A Figure That Makes My Beloved Wife Embrace Others At The Hotel On Weekends.Vol.004 Yukinon 26 Years Old [Uncensored L**ked],https://pic.javct.net/poster/05192026/be25cd4d48.jpg,https://javct.net/v/onez-115-rm,125,2026-05-31
NEOS-001-RM,I Can't Keep Up With People I Don't Know [Uncensored L**ked],https://pic.javct.net/poster/20230207/1689131766.jpg,https://javct.net/v/neos-001-rm,139,2026-05-31
HUNTB-607-RM,"Unlimited Insertion With Anyone! Underground Idol Edition If You Purchase A Certain Amount Of Goods At The Live Venue, You Can Touch The Idol As Much As You Want On The Spot! All You Can Insert! ! [Uncensored L**ked]",https://pic.javct.net/poster/20230207/1688701384.jpg,https://javct.net/v/huntb-607-rm,120,2026-05-31
VEO-072-RM,"Real Amateur Wife AV Debut! ! ""It Looks Like This, But Actually I'm..."" An Elegant And Neat Beauty Staff Is A Bewitching Split Tongue Fellatio Wife Haruno Ando [Uncensored L**ked]",https://pic.javct.net/poster/20230207/1689310496.jpg,https://javct.net/v/veo-072-rm,120,2026-05-31
JERA-035,"My Sex Friend Who Squirts During Sex Says, ""I'm Interested, But I'm Scared To Do It Alone..."" I Was Invited By Minazuki Hikaru, A Usually Quiet Office Worker I Meet Once A Month, To My First Brain-wrenching Orgasm Date.",https://pic.javct.net/poster/05192026/a7673a6721.jpg,https://javct.net/v/jera-035,289,2026-05-31
ECB-167-RM,"A Woman Who Acts Like A Nymphomaniac, A Man Who Is R**ed, And Us Who Are Bystanders Watching It All () [Uncensored L**ked]",https://pic.javct.net/poster/05192026/db5dd9705a.jpg,https://javct.net/v/ecb-167-rm,137,2026-05-31
ONEZ-119-RM,# Pretty Girl Whose Uniform Is Too Suited Is My Canojo Vol.006 Amami Kokoro [Uncensored L**ked],https://pic.javct.net/poster/20240807/1720885432.jpg,https://javct.net/v/onez-119-rm,120,2026-05-31
DANDYA-036,"""It's Your Fault For Getting An Erection When I, An Older Woman, Touch You,"" Says The Sexually Insatiable Mature Woman, Seducing Her Handsome Boyfriend From Behind With A Sticky Handjob, Even With His Girlfriend Beside Her, To Make Him Erect. VOL.2",https://pic.javct.net/poster/05192026/2a258608b9.jpg,https://javct.net/v/dandya-036,188,2026-05-31
MIST-026-RM,"""Now, We Are Addicted To Switch Co ○!""No Need Personality Of Man On Earth ○ Kofechi!Only Switch Co ○ Want! [Uncensored L**ked]",https://pic.javct.net/poster/05192026/770e9a2135.jpg,https://javct.net/v/mist-026-rm,240,2026-05-31
DANDYA-041,"Alone With A Busty Lady In A Mixed-gender Hot Spring Where Towels Are Prohibited! ""Excuse Me, Your Nipples Are Showing,"" She Said. Her Large Breasts, Which She Couldn't Completely Hide With Her Hands, Made Me Hard, And Then She Had Sex With Me.",https://pic.javct.net/poster/05192026/63771e55de.jpg,https://javct.net/v/dandya-041,231,2026-05-31
SQTE-688,Spending A Holiday With Her. Having Sex With Her To Our Hearts' Content. Karin Kitaoka,https://pic.javct.net/poster/05192026/272557d278.jpg,https://javct.net/v/sqte-688,99,2026-05-31
FWTR-030,"I Called A High-class Escort Service And Unexpectedly Ran Into My Female Boss! I Had Something On Her, So I Broke The No-condom Rule And Had Unprotected Sex With Her As Much As I Wanted! I Was Seriously Turned On By The Sight Of Her Biting Her Lower Lip And With Tears In Her Eyes As She Took My Thick Semen Into Her Vagina! Yuki Chitose",https://pic.javct.net/poster/05192026/b4f53c4171.jpg,https://javct.net/v/fwtr-030,119,2026-05-31
SAN-462Z,"The Reality Of Young Men In The Reiwa Era Being Mostly Effeminate, While Women Are Becoming More Assertive. 002 / Hikaru, Yuri",https://pic.javct.net/poster/05192026/4c0729a8e6.jpg,https://javct.net/v/san-462z,100,2026-05-31
AGMX-265,Cumming With Her Face!! Close-up Subjective Blowjob 4,https://pic.javct.net/poster/05192026/d51442393b.jpg,https://javct.net/v/agmx-265,99,2026-05-31
SQTE-690,I Want To Have Sex With Her Without Taking Off Her Panties. Yumi Nijimura,https://pic.javct.net/poster/05192026/e22be2df1a.jpg,https://javct.net/v/sqte-690,105,2026-05-31
SQTE-689,"You Can Do Whatever You Want, Uncle. Aizawa Miyu",https://pic.javct.net/poster/05192026/ffe44c749a.jpg,https://javct.net/v/sqte-689,114,2026-05-31
SAN-461Z,"The Reality Of Young Men In The Reiwa Era Being Mostly Effeminate, While Women Are Becoming More Assertive. 001 / Shiori, Umi",https://pic.javct.net/poster/05192026/c885167007.jpg,https://javct.net/v/san-461z,110,2026-05-31
IPBZ-021,Limited distribution: Natupoke REC: Hina no Kanon Gonzo IP actress released as she is,https://pic.javct.net/poster/05192026/52bc7504d7.jpg,https://javct.net/v/ipbz-021,99,2026-05-31
SQTE-687,"Shizuka, The Junior Who Is Always Available As A Sex Toy",https://pic.javct.net/poster/05192026/eb3ead9df9.jpg,https://javct.net/v/sqte-687,106,2026-05-31
NHDTB-902-RM,Shortcut J○ Molester An Innocent Girl Who Grabs Her Hair And Gets Pounded From Behind And Cums With An Ahegao Face [Uncensored L**ked],https://pic.javct.net/poster/20241703/1712769292.jpg,https://javct.net/v/nhdtb-902-rm,170,2026-05-31
MIDA-647-RM,"Giant Dick NTR: A Gym Teacher With A Huge Cock Forces His Beloved Slender Club Manager's Undeveloped Pussy Deep Inside, Thrusting And Making Her Arch Her Back And Twitch As She Orgasms Against Her Will. [Uncensored L**ked]",https://pic.javct.net/poster/05192026/f5c2dc7630.jpg,https://javct.net/v/mida-647-rm,140,2026-05-31
MIDE-876-RM,Female Teacher Les X Puwa ● ~ Devil Irama / Group Humiliation ~ Nana Yagi [Uncensored L**ked],https://pic.javct.net/poster/20230206/1686641650.jpg,https://javct.net/v/mide-876-rm,150,2026-05-31
MDTM-363-RM,Shin New Zealand Bishoujo Spring Reflexology + Vol.012 Aya Sasami [Uncensored L**ked],https://pic.javct.net/poster/05192026/a486bd1594.jpg,https://javct.net/v/mdtm-363-rm,120,2026-05-31
JUX-930-RM,When My Wife Sparkles With Lust... Nene [Uncensored L**ked],https://pic.javct.net/poster/20222109/1665934712.jpg,https://javct.net/v/jux-930-rm,119,2026-05-31
VIPR-076-RM,Erica Sato Invades A Shady AV Shoot!! Erika Sato [Uncensored L**ked],https://pic.javct.net/poster/04112026/e3714f871a.jpg,https://javct.net/v/vipr-076-rm,60,2026-05-31
VIPR-078-RM,Dripping Wet Daydream Theater. Erika Sato . [Uncensored L**ked],https://pic.javct.net/poster/04112026/0f1129f2c2.jpg,https://javct.net/v/vipr-078-rm,59,2026-05-31
FOCS-048-RM,"38"" G-Cup Colossal Tits X 5'8"" Tall Crazy Girl With A Miraculously Slender Body - The Greatest Hard Rock Creampie Of Your Life Mira Sena [Uncensored L**ked]",https://pic.javct.net/poster/20212011/1644570879.jpg,https://javct.net/v/focs-048-rm,118,2026-05-31
VIPR-066-RM,BODY TO BODY Erika Sato [Uncensored L**ked],https://pic.javct.net/poster/04112026/81b6116248.jpg,https://javct.net/v/vipr-066-rm,58,2026-05-31
EKW-080-RM,"Today, I Want Her To Jack Me Off. An Mitsumi [Uncensored L**ked]",https://pic.javct.net/poster/20221904/1653628260.jpg,https://javct.net/v/ekw-080-rm,120,2026-05-31
JUY-865-RM,Madonna Exclusive Hot Mature Woman!! Married Woman's Lust Fuck Dripping With Immorality!! Husband Doesn't Know -My Dirty Lust And Secret- Maki Hojo [Uncensored L**ked],https://pic.javct.net/poster/20221904/1651553483.jpg,https://javct.net/v/juy-865-rm,119,2026-05-31
MIST-369-RM,With Kanami Miura At Night... Having Sex Like Crazy With A Beautiful Girl At Night. Kanami Miura [Uncensored L**ked],https://pic.javct.net/poster/20221202/1649322626.jpg,https://javct.net/v/mist-369-rm,150,2026-05-31
WKD-049-RM,Fallen Woman - Himari Kinoshita [Uncensored L**ked],https://pic.javct.net/poster/20212011/1641054004.jpg,https://javct.net/v/wkd-049-rm,52,2026-05-31
JUL-685-RM,31-day Abstinence Life: 3rd Document Showing The Explosive Desire Of A Married Woman Who Just Likes Dick Too Much!! Saori Nagashima [Uncensored L**ked],https://static.javct.net/poster/jul-685.jpg,https://javct.net/v/jul-685-rm,137,2026-05-31
SSIS-261-US,"Breast, Buttocks, Vagina, 171cm, Tasting The Best Style All Over Marin Hinata 's New World Of Acme [English Subtitle, Reducing Mosaic]",https://pic.javct.net/poster/20212011/1639118863.jpg,https://javct.net/v/ssis-261-us,145,2026-05-31
JUY-602-RM,"She Is Unfaithful With Her Clothes Still On, Full Tight Clothing Fuck. Reiko Sawamura [Uncensored L**ked]",https://pic.javct.net/poster/20220707/1660149537.jpg,https://javct.net/v/juy-602-rm,151,2026-05-31
KATU-090-RM,"Sexy Thick Thigh Job Makes You Want To Fuck 2, 5 Thick Dirty Miniskirt Sluts! [Uncensored L**ked]",https://pic.javct.net/poster/20212709/1634971908.jpg,https://javct.net/v/katu-090-rm,181,2026-05-31
FOCS-020-RM,Undiscovered Talent In Hakata! The 171cm Luxuriously Slender And Pure Beautiful Girl. A Lewd Sexual Extravaganza That Goes For 1 Night And 2 Days Without Sleep. Haru Yamaguchi [Uncensored L**ked],https://pic.javct.net/poster/20212308/1631874901.jpg,https://javct.net/v/focs-020-rm,123,2026-05-31
HBAD-619-RM,This Tall Erotic Wicked Woman Is Planning To Seduce A Rich Old Man And Knock Him Off And Clean Him Out Of All His Money But She Ends Up Getting Fucked Instead And Becoming His Sexy Slut. Mirai Sena. [Uncensored L**ked],https://pic.javct.net/poster/20221904/1650519375.jpg,https://javct.net/v/hbad-619-rm,110,2026-05-31
JUY-252-RM,My Big Sister-In-Law's Tight Peachy Ass Was Just Too Sexy... Maya Takeuchi [Uncensored L**ked],https://pic.javct.net/poster/20220406/1655379980.jpg,https://javct.net/v/juy-252-rm,118,2026-05-31
LULU-095-RM,"My Big Stepsister Was Working As A Model, And She Had Such A Beautiful Ass, I Could No Longer Resist, So I Gave Her A Furious Piston-Pounding Quickie, And Continued To Pour Creampie Cum Shots Into Her Ass. Himari Kinoshita [Uncensored L**ked]",https://pic.javct.net/poster/20212709/1633504868.jpg,https://javct.net/v/lulu-095-rm,148,2026-05-31
NGOD-151-RM,Woman At The Convenience Store Headquarters 6 - Chitose Yuki [Uncensored L**ked],https://static.javct.net/poster/ngod-151.jpg,https://javct.net/v/ngod-151-rm,122,2026-05-31
SONE-496-SUB,"After 15 years of dedication to high jumping, she has decided to retire! The world-famous beautiful medalist who can no longer fly is now an addictive sex slave for her sponsor's old man presidents, Kaede Fua [English Subtitle]",https://pic.javct.net/poster/20241115/1732244084.jpg,https://javct.net/v/sone-496-sub,160,2026-05-31
SDNM-515V-RM,"[Bonus Edition] 49 years old... The last spring of her life. 178cm tall, a wife with a model-like figure. AV DEBUT Sanae Kurihara [Uncensored L**ked]",https://pic.javct.net/poster/09052025/1761187138.jpg,https://javct.net/v/sdnm-515v-rm,233,2026-05-31
SSNI-753-SUB,Amu Hanamiya [English Subtitle],https://pic.javct.net/poster/07202025/1756095305.jpg,https://javct.net/v/ssni-753-sub,120,2026-05-31
HEY-218,"Office Ladies Compilation : Aoi Mizutani, Mayumi Hamada, Yu Nakano",https://pic.javct.net/poster/09052025/1759192423.jpg,https://javct.net/v/hey-218,180,2026-05-31
NAMH-042-RM,H-Cup Big Tits Newcomer [Uncensored L**ked],https://pic.javct.net/poster/09052025/1758090007.jpg,https://javct.net/v/namh-042-rm,107,2026-05-31
NAMH-042,H-Cup Big Tits Newcomer,https://pic.javct.net/poster/09052025/1758090007.jpg,https://javct.net/v/namh-042,107,2026-05-31
348NTR-007-RM,"An unannounced 3P with a serious office lady. Watching her depressed boyfriend, the quiet, serious office lady takes turns with her hard pistons, and the sweet cries of a lewd female that suddenly echoes in the room with her two male dicks. Her sensitive body trembles little by little as she shyly cums... The finish is with a large amount of semen being sprayed on her dignified face. NTR.net case7 [Uncensored L**ked]",https://pic.javct.net/poster/05192026/c4b28d2380.jpg,https://javct.net/v/348ntr-007-rm,86,2026-05-31
300MIUM-328-RM,"A working masochist. Underwear maker project / Mr. Imai / 22 years old A miraculous beautiful office lady who can't say ""no"" is summoned at work and gives a teary-eyed blowjob in the car in front of the company, tricks her into changing her clothes, voyeurs her, distorts her miraculous beautiful face, and captures her obscene behavior. [Uncensored L**ked]",https://pic.javct.net/poster/05192026/4ccf189420.jpg,https://javct.net/v/300mium-328-rm,101,2026-05-31
10-053026-01,We got frisky in Kimono before heading out to the summer festival,https://pic.javct.net/poster/05192026/f56fa7738b.jpg,https://javct.net/v/10-053026-01,60,2026-05-31
PA-053026-100,Natural Beauty : Ms. Hironaka's Real Face,https://pic.javct.net/poster/05192026/25b43628eb.jpg,https://javct.net/v/pa-053026-100,27,2026-05-31
CR-053026-001,Luxury Adult Healing Spa: A master in bed delivering vigorous head-shaking fellatio and intense pile-driving thrusts,https://pic.javct.net/poster/05192026/f54c66df65.jpg,https://javct.net/v/cr-053026-001,61,2026-05-31
FC2PPV-4909453,God Style Ho ■Aqua-chan Minato in uniform at the live show is thin but an E-cup model and has a beautiful body.,https://pic.javct.net/poster/05192026/bb59692a5e.jpg,https://javct.net/v/fc2ppv-4909453,98,2026-05-31
FC2PPV-4909954,[Exclusive/Individual Shooting] Very popular TikToker and idol Amichi makes a shocking debut!? ❣ Slender big breasted body with outstanding gravure class style released ♡ Her vagina is stirred by a big cock and she is creampied ♡ [Bonus: High resolution] [Main story / No facial footage],https://pic.javct.net/poster/05192026/3c78278ba1.jpg,https://javct.net/v/fc2ppv-4909954,62,2026-05-31
FC2PPV-4910016,[New product / first edition limited sale] Individual shooting) A swamp confirmed too cute and dangerous blonde gal angel uncontrollable devilish cowgirl position is too erotic best Gonzo,https://pic.javct.net/poster/05192026/ac74dd68a1.jpg,https://javct.net/v/fc2ppv-4910016,53,2026-05-31
FC2PPV-4909862,"[No] [Female body sharing session Chapter 17, Part 2] Even after the 3P, the fair-skinned petite young wife's desire does not subside, and she hopes for a second interaction with a black man. Creampie after intense sex",https://pic.javct.net/poster/05192026/0bd7a643fb.jpg,https://javct.net/v/fc2ppv-4909862,40,2026-05-31
FC2PPV-4909278,Kuchi Pussy Skewering Rental Play Plump BODY REI Circle members and friends play 3P play with unlimited use of the mouth pussy in the room,https://pic.javct.net/poster/05192026/bd6b371f82.jpg,https://javct.net/v/fc2ppv-4909278,44,2026-05-31
FC2PPV-4909288,"*Limited stock* [Video of gravure idol pregnant that you can never see on Fntia] I-cup breasted gravure idol's penis is flattered and creampied from behind, uncensored private video with raw semen dripping. Obtained by administrator.",https://pic.javct.net/poster/05192026/e12124b7dd.jpg,https://javct.net/v/fc2ppv-4909288,26,2026-05-31
