code,title,image_url,page_url,views,date_scraped
JJPP-094,DVD That Took A Voyeur Of How Handsome Brings Milf Into The Room And Brings It To SEX.83 - I Fo**ed It Inside As Forcefully ~,https://pic.javct.net/poster/05192026/488710a8a8.jpg,https://javct.net/v/jjpp-094,135,2026-05-31
JJPP-102,DVD That Took A Voyeur Of How Handsome Brings Milf Into The Room And Brings It To SEX.91 ~ Forcibly Left Intact As It Was ~ Invite Again Only A Beautiful Milf!I Did A Cosplay And Made A No-pan Twister! !,https://pic.javct.net/poster/05192026/be696fb5dd.jpg,https://javct.net/v/jjpp-102,125,2026-05-31
JJPP-101,DVD That Took A Voyeur Of How Handsome Brings Milf Into The Room And Brings It To SEX.90 ~ I Cummed Out As It Was Forcibly -,https://pic.javct.net/poster/05192026/247c0d3bbc.jpg,https://javct.net/v/jjpp-101,125,2026-05-31
JJPP-100,DVD That Took A Voyeur Of How Handsome Brings Milf Into The Room And Brought It To SEX.89 ~ I Fo**ed It Inside As Forcefully ~,https://pic.javct.net/poster/05192026/9efbd5ba22.jpg,https://javct.net/v/jjpp-100,125,2026-05-31
STOL-146-RM,"As Soon As She Realizes A Customer Has A Huge Penis, The Dispatched Escort Girl Performs The Act, Which Is Against The Shop's Rules. [Uncensored L**ked]",https://pic.javct.net/poster/05192026/bd076b98ef.jpg,https://javct.net/v/stol-146-rm,220,2026-05-31
NPJB-124-RM,Hidd** Camera Footage Of A Woman Working In A Sex Establishment: Her Penis Can't Resist The Handsome Therapist's Technique And She Begs For Insertion. [Uncensored L**ked],https://pic.javct.net/poster/05192026/8ac5e7f384.jpg,https://javct.net/v/npjb-124-rm,190,2026-05-31
AKDL-036-RM,[Breast flick/panty shot voyeur] Divine video of 8 girls with small and big breasts estimated to be B cup to F cup [Uncensored L**ked],https://pic.javct.net/poster/04112026/1775915501743.jpg,https://javct.net/v/akdl-036-rm,57,2026-05-31
DANDY-868-RM,"""Are You Excited To See Me Change My Clothes?""A Lady Boss Who Forgets A Woman Isn't Crazy Even If She's A Younger Cock Who Gets Horny On Her [Uncensored L**ked]",https://pic.javct.net/poster/20230207/1689826500.jpg,https://javct.net/v/dandy-868-rm,200,2026-05-31
KAM-135-RM,Record Of A Perverted Erotic Manipulator Who Repeatedly Acted Obscene Acts To A Busty Beauty Who Became A Generalized Sensitive Zone With A Secret Rejuvenating Massage Momo Minami [Uncensored L**ked],https://pic.javct.net/poster/20230207/1689309944.jpg,https://javct.net/v/kam-135-rm,120,2026-05-31
TPIN-058-RM,Super Luxury Cabaret Club VIP Private Room Voyeur [Uncensored L**ked],https://pic.javct.net/poster/20230207/1688793862.jpg,https://javct.net/v/tpin-058-rm,164,2026-05-31
DASS-944-RM,I'm The Only One Who Can't Have Sex At Home Drinking Party ●BSS. Mei Itsukaichi [Uncensored L**ked],https://pic.javct.net/poster/04112026/1776964547.jpg,https://javct.net/v/dass-944-rm,150,2026-05-31
JJPP-086,DVD That Took A Voyeur Of How Handsome Brings Milf Into The Room And Brings It To SEX.76 ~ I Fo**ed It Inside Forcibly As It Was ~,https://pic.javct.net/poster/05192026/ff7c1f6134.jpg,https://javct.net/v/jjpp-086,130,2026-05-31
JJPP-090,DVD That Took A Voyeur Of How Handsome Brings Milf Into The Room And Brings It To SEX.80 ~ I Cummed Out Intact As It Was ~,https://pic.javct.net/poster/05192026/113a5ab555.jpg,https://javct.net/v/jjpp-090,130,2026-05-31
JJPP-084,DVD That Took A Voyeur Of How Handsome Brings Milf Into The Room And Brings It To SEX.74 ~ I Cummed Out Intact As It Was ~,https://pic.javct.net/poster/05192026/ed22ea12e3.jpg,https://javct.net/v/jjpp-084,120,2026-05-31
JJPP-083,DVD That Took A Voyeur Of How Handsome Brings Milf Into The Room And Brings It To SEX.73 ~ I Fo**ed It Inside As Forcefully ~,https://pic.javct.net/poster/05192026/1fa4cfc5f0.jpg,https://javct.net/v/jjpp-083,130,2026-05-31
JJPP-093,DVD That Took A Voyeure Of How Handsome Brings Milf Into The Room And Brings It To SEX.82 ~ I Cummed Out Intact As It Was ~,https://pic.javct.net/poster/05192026/a0d2654528.jpg,https://javct.net/v/jjpp-093,120,2026-05-31
JJPP-092,DVD That Took A Voyeure Of How Handsome Brings Milf Into The Room And Brings It To SEX.81 - I Fo**ed It Inside As Forcefully ~,https://pic.javct.net/poster/05192026/cf07290100.jpg,https://javct.net/v/jjpp-092,120,2026-05-31
TYSF-024-RM,"If It's An AV Production Company's AD, It's Natural To Become A Meat Urinal Ww Fo**ed To Appoint A Sex Processor! Demon Cream Pie Pursuit Press Mai Flower Hunting That Can Be Queued [Uncensored L**ked]",https://pic.javct.net/poster/20221108/1662710508.jpg,https://javct.net/v/tysf-024-rm,240,2026-05-31
FJIN-145-RM,"Pie Time!! Hot Spring Date With A Slippery, Oily J-cup Busty Girl - Hibiki Amamiya [Uncensored L**ked]",https://pic.javct.net/poster/05192026/e466353d7f.jpg,https://javct.net/v/fjin-145-rm,130,2026-05-31
XVSR-196-RM,Asami Nagase Go! !Assault Street Reverse Nampa DX Akihabara Brush Wholesale Ed. [Uncensored L**ked],https://pic.javct.net/poster/06032026/1773381604.jpg,https://javct.net/v/xvsr-196-rm,120,2026-05-31
FJIN-145,"Pie Time!! Hot Spring Date With A Slippery, Oily J-cup Busty Girl - Hibiki Amamiya",https://pic.javct.net/poster/05192026/e466353d7f.jpg,https://javct.net/v/fjin-145,130,2026-05-31
NPJS-268,No-bra Shinjuku Wandering Masochistic Dog Walking Date,https://pic.javct.net/poster/05192026/9d08365c10.jpg,https://javct.net/v/npjs-268,130,2026-05-31
EBOD-500,Openly Half-naked Exposure Veterinary Full View!Phallic Hunting NAOMI From Morning Today,https://pic.javct.net/poster/05192026/dd6e9cfc9f.jpg,https://javct.net/v/ebod-500,150,2026-05-31
420HPT-055-RM,"Lulu (24) Amateur Hoi Hoi, Amateur Hoi Hoi Pet, Amateur, Gal, Slender, Blue Hair, Short Hair, Masochist Woman, Sex Friend, Jumping, Outdoors, Shame, Toy, Creampie, Gonzo, Documentary [Uncensored L**ked]",https://pic.javct.net/poster/05192026/23aeecc80e.jpg,https://javct.net/v/420hpt-055-rm,108,2026-05-31
420HPT-055,"Lulu (24) Amateur Hoi Hoi, Amateur Hoi Hoi Pet, Amateur, Gal, Slender, Blue Hair, Short Hair, Masochist Woman, Sex Friend, Jumping, Outdoors, Shame, Toy, Creampie, Gonzo, Documentary",https://pic.javct.net/poster/05192026/23aeecc80e.jpg,https://javct.net/v/420hpt-055,108,2026-05-31
SGKI-078-RM,Naked Sports Battle 2026 Complete Edition [Uncensored L**ked],https://pic.javct.net/poster/05192026/08a39e27fb.jpg,https://javct.net/v/sgki-078-rm,180,2026-05-31
FAX-390-RM,Fucked-strip-hit Sex Crime! [Uncensored L**ked],https://pic.javct.net/poster/05192026/a45ce92578.jpg,https://javct.net/v/fax-390-rm,115,2026-05-31
SUN-092-RM,No Bra Nipples Pocchi Walk Feeling The Gaze In The Crowd Nipples Bing [Uncensored L**ked],https://pic.javct.net/poster/20230207/1689476945.jpg,https://javct.net/v/sun-092-rm,179,2026-05-31
FAX-263-RM,"War Of Plunder, R**e, Abduction Gangbang [Uncensored L**ked]",https://pic.javct.net/poster/20222410/1666920901.jpg,https://javct.net/v/fax-263-rm,102,2026-05-31
SKMJ-753-RM,"Amateur Beauties On A Walk With Remote-controlled Vibrators - Black Pantyhose Sensitive Career Women Edition - ""I Can't Hold Back Anymore...//"" Office Ladies With Beautiful Legs In Black Pantyhose Tremble And Climax In The Middle Of A Crowd! Their First Ever Humiliating Experience Unexpectedly Turns On Their Erotic Switch! Bold Car Masturbation During Car Rides! And Finally, A Mind-blowing Experience At A Hotel... [Uncensored L**ked]",https://pic.javct.net/poster/05192026/e0f354a82d.jpg,https://javct.net/v/skmj-753-rm,246,2026-05-31
SGKI-078,Naked Sports Battle 2026 Complete Edition,https://pic.javct.net/poster/05192026/08a39e27fb.jpg,https://javct.net/v/sgki-078,180,2026-05-31
AKDL-025-RM,"Shizuka, a college student who loves throat orgasms and sperm. Swallowing all the disgusting middle-aged men she meets for the first time [Dirty dick deep throat deep throat trance] [Begging for the most disgusting semen] [Outdoor urination in broad daylight] Shizuka Sugisaki [Uncensored L**ked]",https://pic.javct.net/poster/06032026/1774954579.jpg,https://javct.net/v/akdl-025-rm,182,2026-05-31
FAX-304-RM,Yu Kawakami Various Life [Uncensored L**ked],https://pic.javct.net/poster/05192026/b3beee9aea.jpg,https://javct.net/v/fax-304-rm,160,2026-05-31
FAX-239-RM,Lust Battleground: Mother & Daughter Passed Around by 50 Men [Uncensored L**ked],https://pic.javct.net/poster/20221904/1652660133.jpg,https://javct.net/v/fax-239-rm,125,2026-05-31
XVSR-183-RM,Togu Tin Go! !Assault Street Reverse Nampa DX [Uncensored L**ked],https://pic.javct.net/poster/01202026/1772443009.jpg,https://javct.net/v/xvsr-183-rm,130,2026-05-31
NEO-949-RM,Mature Woman In Sailor Uniform Experiences Incontinence And Shame - Yoshii Miki [Uncensored L**ked],https://pic.javct.net/poster/05192026/b7f20debdd.jpg,https://javct.net/v/neo-949-rm,121,2026-05-31
MIDD-942,Ai Sayama Exposure Shyness Plump Out Hami,https://pic.javct.net/poster/05192026/436c78636c.jpg,https://javct.net/v/midd-942,120,2026-05-31
VGD-134-RM,Devil Bitch? SWEET DEVIL Muto Tsugumi [Uncensored L**ked],https://pic.javct.net/poster/06032026/1773217109.jpg,https://javct.net/v/vgd-134-rm,140,2026-05-31
SKMJ-753,"Amateur Beauties On A Walk With Remote-controlled Vibrators - Black Pantyhose Sensitive Career Women Edition - ""I Can't Hold Back Anymore...//"" Office Ladies With Beautiful Legs In Black Pantyhose Tremble And Climax In The Middle Of A Crowd! Their First Ever Humiliating Experience Unexpectedly Turns On Their Erotic Switch! Bold Car Masturbation During Car Rides! And Finally, A Mind-blowing Experience At A Hotel...",https://pic.javct.net/poster/05192026/e0f354a82d.jpg,https://javct.net/v/skmj-753,246,2026-05-31
FAX-219-RM,Housewife Was Attacked In The Footpath Of Rice Farming / Daughter Been **dnapped President / Violence To Break Into The House To The Ends Of The Amorous History Of Sex Crimes Japan Piece Was Wheel To Criminal [Uncensored L**ked],https://pic.javct.net/poster/05192026/5cb7ceb1bf.jpg,https://javct.net/v/fax-219-rm,110,2026-05-31
NEO-949,Mature Woman In Sailor Uniform Experiences Incontinence And Shame - Yoshii Miki,https://pic.javct.net/poster/05192026/b7f20debdd.jpg,https://javct.net/v/neo-949,121,2026-05-31
FC2PPV-4884888,[No *High quality Yui 22 years old Nogi◯ beauty's anal licking] Nogi◯ beauty tries anal licking The cute girl licks the anus so much that she gives a blowjob and releases a large amount of the old man's sperm ♡ Anal licking feels so good that the sperm splattered on her face lol,https://pic.javct.net/poster/04112026/1776755796.jpg,https://javct.net/v/fc2ppv-4884888,60,2026-04-25
FC2PPV-4884649,"[Uncensored] Gravure idol Aiko, 24 years old, the distance is too close to show off her beautiful breasts, and on nights when she can't say anything",https://pic.javct.net/poster/04112026/1776755525.jpg,https://javct.net/v/fc2ppv-4884649,25,2026-04-25
PA-042126-100,What If Your Dream Wife Wearing an Apron Naked? : Sakura Sakurai,https://pic.javct.net/poster/04112026/1776755661.jpg,https://javct.net/v/pa-042126-100,55,2026-04-25
10-042126-01,Collects the cum that was sprayed on her face and tastes every drop,https://pic.javct.net/poster/04112026/1776755750.jpg,https://javct.net/v/10-042126-01,09,2026-04-25
HZ-3829,Beauty Collection Vol.117 - Meirin,https://pic.javct.net/poster/04112026/1776755601.jpg,https://javct.net/v/hz-3829,59,2026-04-25
CR-042126-001,The tragedy of a wife who repays her husband's debts with her body,https://pic.javct.net/poster/04112026/1776755732.jpg,https://javct.net/v/cr-042126-001,61,2026-04-25
1P-042126-001,Happy Around in School! : Luxury Spa Club,https://pic.javct.net/poster/04112026/1776755765.jpg,https://javct.net/v/1p-042126-001,60,2026-04-25
FC2PPV-4884772,[Uncensored/Complete amateur/Creampie/Squirting] Neat and innocent 149cm short girl in uniform She's so cute that she inserts herself into a vagina that tightens so tight that you push her back and gives her a rich creampie ♡,https://pic.javct.net/poster/04112026/1776755692.jpg,https://javct.net/v/fc2ppv-4884772,14,2026-04-25
FC2PPV-4884691,"[Uncensored] Big-breasted receptionist Sayaka, 25 years old, her response is not a job, but a sex video record that is destroyed by a too polite distance",https://pic.javct.net/poster/04112026/1776755717.jpg,https://javct.net/v/fc2ppv-4884691,18,2026-04-25
FC2PPV-4884935,[Amateur's first shot] Sumire (18) 163 cm 47 kg D cup and the cutest shooting data was collected from the forehead camera's first person perspective video,https://pic.javct.net/poster/04112026/1776733868.jpg,https://javct.net/v/fc2ppv-4884935,66,2026-04-25
FC2PPV-4884375,"[Slender] A Kansai guy woke up after having sex for the first time in 2 years. He wanted more. He couldn't help but squirt at the overflowing moans. Two consecutive creampies, and a strong squirting finish.",https://pic.javct.net/poster/04112026/1776733779.jpg,https://javct.net/v/fc2ppv-4884375,63,2026-04-25
10-041926-01,Treasured Pussy Selection: Ai Nakano,https://pic.javct.net/poster/04112026/1776669419.jpg,https://javct.net/v/10-041926-01,14,2026-04-25
CR-042026-001,SEX establishment in which staff dress in costumes,https://pic.javct.net/poster/04112026/1776669371.jpg,https://javct.net/v/cr-042026-001,59,2026-04-25
FC2PPV-4883860,"[Limited Uncensored] A hole is made in the official layer condom of the fireworks costume, and she impregnates him on a dangerous day and accepts the invitation and has sex with him...♡ [Fireworks/Collapse Star Rail]",https://pic.javct.net/poster/04112026/1776645835.jpg,https://javct.net/v/fc2ppv-4883860,27,2026-04-25
FC2PPV-4883599,"[Complete secret version] [I cup] [Big breasts] [Creampie] Haruka, a new I cup graduate employee, was fo**ed to leave the company due to escalating harassment from her colleagues and boss [Chapter 1]",https://pic.javct.net/poster/04112026/1776576303.jpg,https://javct.net/v/fc2ppv-4883599,112,2026-04-25
FC2PPV-4883692,"[Uncensored] Hostess Marin, 23 years old, at first it was meant to be light, but before she knew it, the sex had become intense and she couldn't get out of it.",https://pic.javct.net/poster/04112026/1776576339.jpg,https://javct.net/v/fc2ppv-4883692,36,2026-04-25
HZ-3830,Asi-Hame!! Vol.26 - Zhang,https://pic.javct.net/poster/04112026/1776576140.jpg,https://javct.net/v/hz-3830,61,2026-04-25
FC2PPV-4878741,[Uncensored] ** The hidden face of nursery teacher Yumi (22)... Her secret is too neat,https://pic.javct.net/poster/04112026/1776576108.jpg,https://javct.net/v/fc2ppv-4878741,17,2026-04-25
FC2PPV-4882927,[Resale] [Mawashi Project] Here is a divine work full of F-cup beauties whose erotic marshmallow bodies make you irresistible no matter what you wear.,https://pic.javct.net/poster/04112026/1776570068.jpg,https://javct.net/v/fc2ppv-4882927,78,2026-04-25
FC2PPV-4879997,"[Uncensored] Ayame (27) Secretary with big breasts and beautiful breasts, intimate private life that is not usually shown",https://pic.javct.net/poster/04112026/1776576189.jpg,https://javct.net/v/fc2ppv-4879997,16,2026-04-25
FC2PPV-4883529,"380_[Dirty language graffiti] Thank you for her retirement, Runa-chan. Pervert dirty words graffiti on her super dynamite body. At the end, the three actors make Runa-chan enjoy her body to their heart's content. Creampie 4P Runa-chan Chapter 10 [Overseas version]",https://pic.javct.net/poster/04112026/1776569680.jpg,https://javct.net/v/fc2ppv-4883529,58,2026-04-25
HZ-3827,Perverted Maid Turns Into A Nympho With Her Master's Junk - Kaede Takagaki,https://pic.javct.net/poster/04112026/1776487863.jpg,https://javct.net/v/hz-3827,61,2026-04-25
PA-041826-100,It's Hawaii! A Bikini wife in high spirits!,https://pic.javct.net/poster/04112026/1776506834.jpg,https://javct.net/v/pa-041826-100,60,2026-04-25
10-041826-01,SEX within seconds of meeting : Ai Nakano,https://pic.javct.net/poster/04112026/1776487893.jpg,https://javct.net/v/10-041826-01,47,2026-04-25
MISM-123-RM,Amateur Masochist Slave No.1 Mika (pseudonym) 28 Years Old Self-intentioned Training Voluntary Brain Ikki Demon Maso Beautiful Wife [Uncensored L**ked],https://pic.javct.net/poster/05192026/912560621e.jpg,https://javct.net/v/mism-123-rm,180,2026-05-31
NNPJ-365-RM,C**ld-rearing Moms Only! Picking Up A Sexless Young Wife Who Has Outstanding Sensitivity After C**ldbirth! I Had Sex For 60 Minutes With My C**ld! ! [Uncensored L**ked],https://pic.javct.net/poster/05192026/7e8fc6da4e.jpg,https://javct.net/v/nnpj-365-rm,220,2026-05-31
300MIUM-390-RM,"Mr. Masochistic working. Case.10 IT company WEB engineer / Mr. Kurosaki / 22 years old A close contact with a self-proclaimed perverted perverted office lady who says, ""I touch my boyfriend's dick as soon as I'm around lol'' I didn't expect it, but as soon as I showed him my dick in the car, he said ""Isn't it really big lol'' and started to feel happy. Well then, I called him as a reward after work ⇒ Hard sex [Uncensored L**ked]",https://pic.javct.net/poster/05192026/3c3a31b227.jpg,https://javct.net/v/300mium-390-rm,78,2026-05-31
NPJS-269-RM,"Live Stream Of A Sadistic, Hard-to-get Erect Penis Being Fo**ed Into A Cowgirl Position With Intense Nipple To**ure After Drinking. [Uncensored L**ked]",https://pic.javct.net/poster/05192026/9abed4a568.jpg,https://javct.net/v/npjs-269-rm,180,2026-05-31
YAKO-092,"A Sexless, Slutty, Big-breasted, Beautiful Wife Becomes Addicted To The Rock-hard Cocks Of Young Men; A Shameless Record Of Her Affair.",https://pic.javct.net/poster/05192026/3e819c8995.jpg,https://javct.net/v/yako-092,240,2026-05-31
SAN-460,"What If I Went For An Interview At An Adult Video Company Like This PART 2 / Minami, Kirie",https://pic.javct.net/poster/05192026/8c543a21e7.jpg,https://javct.net/v/san-460,115,2026-05-31
SABA-981,"""I'm Going To Pee...watch A Lot"" Selfie Self-humiliation Play // Exhibitionist Masturbation Naked Peeing Girls 20 Girls Wetting Themselves Orgasm SP",https://pic.javct.net/poster/05192026/b6ab735908.jpg,https://javct.net/v/saba-981,162,2026-05-31
RDT-181-RM,"Rookie Female Teacher To Relieve Stress Painful Not Tell Anyone The Trouble In The Workplace, To Seduce Therapist In Bodywork Salon After Work [Uncensored L**ked]",https://pic.javct.net/poster/05192026/ba7b457215.jpg,https://javct.net/v/rdt-181-rm,120,2026-05-31
SABA-779,"""Eh !? Did You Put It Out To Naka (laughs)"" 15 Amateur Beautiful Girls Who Allow Unlicensed Vaginal Cum Shot With A Smile BEST 5 Hours",https://pic.javct.net/poster/05192026/cbd8132816.jpg,https://javct.net/v/saba-779,300,2026-05-31
DRPT-113,"5. Riho Shishido, A Busty Beauty Who, While Hanging From A Strap On A Crowded Train, Had Both Of Her Nipples Stimulated Simultaneously, Resulting In Her Unfortunate Arousal.",https://pic.javct.net/poster/05192026/164c44f9b6.jpg,https://javct.net/v/drpt-113,140,2026-05-31
LUKE-024-RM,Natsuki Kisaragi [Uncensored L**ked],https://pic.javct.net/poster/20230207/1688791359.jpg,https://javct.net/v/luke-024-rm,130,2026-05-31
MFCW-073-RM,Koharu [Uncensored L**ked],https://pic.javct.net/poster/05192026/412443ccf7.jpg,https://javct.net/v/mfcw-073-rm,80,2026-05-31
MFCW-073,Koharu,https://pic.javct.net/poster/05192026/412443ccf7.jpg,https://javct.net/v/mfcw-073,80,2026-05-31
BBAN-455-RM,I Will Make Mitsuki Nagisa's Lesbian Desires Come True Before She Retires A Woman Who Wants To Have Sex With Mitsuki Nagisa X A Woman Who Wants To Have Sex With Mitsuki Nagisa Mitsuki Nagisa Hikaru Minazuki Kotone Fuyuai Ran Himeno NATSUKA [Uncensored L**ked],https://pic.javct.net/poster/20231711/1702010886.jpg,https://javct.net/v/bban-455-rm,170,2026-05-31
MFCW-072-RM,Himeka [Uncensored L**ked],https://pic.javct.net/poster/05192026/79abb7c27d.jpg,https://javct.net/v/mfcw-072-rm,74,2026-05-31
RDT-157-RM,I Was Looking At The Body Under The Sticky Wet Shirt With Her Bra Showing Through... [Uncensored L**ked],https://pic.javct.net/poster/05192026/7ddf2a0422.jpg,https://javct.net/v/rdt-157-rm,113,2026-05-31
MESU-142-RM,"Three-star Mature Woman Soapland: A Lucky Moment Spent With A Soap Girl On Her First Day Of Work, With Unlimited Ejaculation - Konatsu Aoba [Uncensored L**ked]",https://pic.javct.net/poster/05192026/5bae16201c.jpg,https://javct.net/v/mesu-142-rm,105,2026-05-31
MESU-142,"Three-star Mature Woman Soapland: A Lucky Moment Spent With A Soap Girl On Her First Day Of Work, With Unlimited Ejaculation - Konatsu Aoba",https://pic.javct.net/poster/05192026/5bae16201c.jpg,https://javct.net/v/mesu-142,105,2026-05-31
MFCW-072,Himeka,https://pic.javct.net/poster/05192026/79abb7c27d.jpg,https://javct.net/v/mfcw-072,74,2026-05-31
SIMA-037-RM,mountain stream [Uncensored L**ked],https://pic.javct.net/poster/04112026/186603ad3e.jpg,https://javct.net/v/sima-037-rm,75,2026-05-31
FC2PPV-4903757,"Face Showing Case #133 An amateur comes to do naughty things - An-chan (20) in red lingerie, sexy route, both legs exposed and vibrator to**ure",https://pic.javct.net/poster/05192026/2f434bcb66.jpg,https://javct.net/v/fc2ppv-4903757,56,2026-05-31
NHDTA-383-RM,"Drawing Model Wife Which Was Fed Aphrodisiac Juice Drips Stand ""asking For Sex"" Just Seen A Naked Woman [Uncensored L**ked]",https://pic.javct.net/poster/05192026/d65926d975.jpg,https://javct.net/v/nhdta-383-rm,200,2026-05-31
XRW-653-RM,"To Tell The Truth, I Like The Smell Of Smell. Sakuragi Yuuki Sound [Uncensored L**ked]",https://pic.javct.net/poster/05192026/c9638a7b8f.jpg,https://javct.net/v/xrw-653-rm,148,2026-05-31
SIMA-037,mountain stream,https://pic.javct.net/poster/04112026/186603ad3e.jpg,https://javct.net/v/sima-037,75,2026-05-31
SEND-47-RM,Another B ★ Jean Amount Of Star [Uncensored L**ked],https://pic.javct.net/poster/04112026/32ead47d2a.jpg,https://javct.net/v/send-47-rm,135,2026-05-31
VENX-370-RM,"""Are you excited by your aunt's underwear?"" Aunt Reimi Saegusaki squeezes out every drop of her nephew's sperm with freshly taken off panties [Uncensored L**ked]",https://pic.javct.net/poster/04112026/fbb3881706.jpg,https://javct.net/v/venx-370-rm,99,2026-05-31
VENX-370,"""Are you excited by your aunt's underwear?"" Aunt Reimi Saegusaki squeezes out every drop of her nephew's sperm with freshly taken off panties",https://pic.javct.net/poster/04112026/fbb3881706.jpg,https://javct.net/v/venx-370,99,2026-05-31
RCTD-547-RM,"When I Changed Jobs To A Small Women's Underwear Maker, I Was The Only One Who Was Popular With Men. [Uncensored L**ked]",https://pic.javct.net/poster/20230908/1694497608.jpg,https://javct.net/v/rctd-547-rm,146,2026-05-31
SAP-005-RM,Yua PUSSY & HIP [Uncensored L**ked],https://pic.javct.net/poster/04112026/88fe77063a.jpg,https://javct.net/v/sap-005-rm,190,2026-05-31
JUR-303-SUB,I Asked The Busty Wife Next Door Who Was Weak To Pressure To Be An Underwear Model Monitor... Rena Fukiishi [English Subtitle],https://pic.javct.net/poster/20250903/1742496150.jpg,https://javct.net/v/jur-303-sub,130,2026-05-31
SON-130,Obscene Lingerie × Pheromone Sexual Intercourse,https://pic.javct.net/poster/04112026/703ba35bec.jpg,https://javct.net/v/son-130,130,2026-05-31
AVSA-265-RM,SUPER FISHEYE FETISHISM Powerful Excitement Nectar Erotic Cosplay Sensual BODY Iori Tsukimi [Uncensored L**ked],https://pic.javct.net/poster/20230908/1694233101.jpg,https://javct.net/v/avsa-265-rm,120,2026-05-31
NNNC-024-RM,A National Idol Class Beautiful Girl And A Uniform Icharab 3 Sex Ai Kawana [Uncensored L**ked],https://pic.javct.net/poster/20230207/1689131705.jpg,https://javct.net/v/nnnc-024-rm,95,2026-05-31
LULU-439-RM,"I Slipped An Aphrodisiac Into A Beautiful, Big-butt Cosplayer Who Was Doing Casual Sex For Business, And Turned Her Into A Cum-filled Sex Slave, Squirting And Making Ecstatic Faces During A Photoshoot Where She Was Doing Sensual, Flexible Poses. [Uncensored L**ked]",https://pic.javct.net/poster/05192026/2d6bbf5b47.jpg,https://javct.net/v/lulu-439-rm,160,2026-05-31
GKD-002-RM,Gakkugaku Of Woman Hasegawa Riho [Uncensored L**ked],https://pic.javct.net/poster/05192026/f1c693c301.jpg,https://javct.net/v/gkd-002-rm,120,2026-05-31
SGKI-004-RM,"It's Crazy! Mezamashi News: ""Never Change Your Expression During ON AIR'' Competitive Station Announcer, Third Year Professionalism [Uncensored L**ked]",https://pic.javct.net/poster/20252204/1747565585.jpg,https://javct.net/v/sgki-004-rm,115,2026-05-31
EBOD-452-RM,Ultra Breast Jcup Cosplayers Mii-chan Of Rumor [Uncensored L**ked],https://pic.javct.net/poster/06032026/1775274233.jpg,https://javct.net/v/ebod-452-rm,120,2026-05-31
DSAM-002,"Amateur AV 143cm ● Cute Face, Small Pussy, Squirting And Wetting Herself, Orgy Photo Shoot!",https://pic.javct.net/poster/05192026/7d7a6cec01.jpg,https://javct.net/v/dsam-002,150,2026-05-31
MMUS-110,"Little Devilish, Provocative Beauty Shiori Imoto",https://pic.javct.net/poster/05192026/453d946ab5.jpg,https://javct.net/v/mmus-110,140,2026-05-31
BOBB-383-RM,"Milk Fetish Erotic Cosplay That Maximizes The Charm Of J Cup Beautiful Breasts 7 Boin ""Natsuno Kohaku"" Box2 [Uncensored L**ked]",https://pic.javct.net/poster/20230207/1689305599.jpg,https://javct.net/v/bobb-383-rm,120,2026-05-31
XMOM-59-RM,Sukeban Chisato 54 Years Old Chisato Shoda [Uncensored L**ked],https://pic.javct.net/poster/20230207/1689218031.jpg,https://javct.net/v/xmom-59-rm,110,2026-05-31
MIST-437-RM,"Moeka Marui, A Dispatched Maid Who Can Make Babies On Dangerous Days [Uncensored L**ked]",https://pic.javct.net/poster/20241804/1715275741.jpg,https://javct.net/v/mist-437-rm,146,2026-05-31
RTP-105-RM,"Halloween Party With 4 Beautiful Sisters Whose Father Got Married And Suddenly Became A Family! To Cute Cosplay Figure And To Play King Like Girls With Tension Butchuage! ! ""The Things The King Says Absolutely!""I Have Been Tempted By The King's Instructions To Show Me My Breasts And Kisses ... Trick Or Treat! What? [Uncensored L**ked]",https://pic.javct.net/poster/05192026/a14bac682f.jpg,https://javct.net/v/rtp-105-rm,135,2026-05-31
