code,title,image_url,page_url,views,date_scraped
798BRV-150,"AV instant sex interview ""I heard it was just a story~'' All the lewd details of a dirty girl",https://pic.javct.net/poster/06032026/1773709804218.jpg,https://javct.net/v/798brv-150,120,2026-03-17
FC2PPV-4864687,[Big Breasts/Neat] A normally serious nursery teacher is so sensitive and cute that I couldn't help but cum inside her.,https://pic.javct.net/poster/06032026/1773709105.jpg,https://javct.net/v/fc2ppv-4864687,37,2026-03-17
FC2PPV-4864688,"Fan Appreciation Day: Showing off vaginal insemination and creampie sex with beautiful office lady Rinka-chan in front of dick fans, 48 seconds of cock jerking and having Cuzco after creampie_#30",https://pic.javct.net/poster/06032026/1773709128.jpg,https://javct.net/v/fc2ppv-4864688,34,2026-03-17
FC2PPV-4864507,"[Former idol] A devilish 20-year-old plays anal with all its might, three-point attack, male squirting, a must-see for masochist men, and ejaculates in large quantities.",https://pic.javct.net/poster/06032026/1773708608.jpg,https://javct.net/v/fc2ppv-4864507,60,2026-03-17
FC2PPV-4863991,"[Uncensored complete face reveal] First come first serve Yamato Nadeshiko, who is full of grace in every gesture. When she opened the lid, she was extremely lewd, so she trained her to punish her for SEX!! After fully enjoying her erotic body, a large amount of creampie was made into her fluffy pussy!!!",https://pic.javct.net/poster/06032026/1773642369.jpg,https://javct.net/v/fc2ppv-4863991,68,2026-03-17
200GANA-3352,"When I picked her up in Shinbashi, she was such a slutty squirting beauty that I had to pick her up in the opposite direction lol. With the kind of vibe you would expect from a modern-day college girl, men from all over the world are fascinated by how her excitement level increases and her squirting performance becomes more polished as the sexual act begins. Seriously soft girl, first shoot 2271",https://pic.javct.net/poster/06032026/1773642232775.jpg,https://javct.net/v/200gana-3352,59,2026-03-17
420HHL-146,"YUI(22) Amateur Hui Hui Lover, Amateur, Couple POV, Cosplay, Big Tits, Beautiful Woman, Masturbation, Facial",https://pic.javct.net/poster/06032026/1773642092497.jpg,https://javct.net/v/420hhl-146,79,2026-03-17
390JNT-117,"[Pulled with dick and twitches] [J-cup body wife x creampie] [Adult immoral lingerie sex] ""Please break my pussy!'' A huge-breasted J-cup wife pleads with someone else's dick. Dynamic sex with her vagina twitching and boobs bulging as she is penetrated deep inside [Honoka, 28 years old, 2nd year of marriage] #35",https://pic.javct.net/poster/06032026/1773641993251.jpg,https://javct.net/v/390jnt-117,112,2026-03-17
326IAV-003,[Erotic bunny cosplay] [3P] Two men devour the toned body of a yoga instructor,https://pic.javct.net/poster/06032026/1773641849249.jpg,https://javct.net/v/326iav-003,73,2026-03-17
FC2PPV-4864349,I did everything from binaural ear licking to raw bukkake where I could eat the morning erection of a super beautiful official official layer [NIK〇E/Cinderella],https://pic.javct.net/poster/06032026/1773641781.jpg,https://javct.net/v/fc2ppv-4864349,39,2026-03-17
FC2PPV-4863961,[Volume warning] Beauty system 19《Oho voice screaming》Vagina deep gun thrusting / bending sex!!,https://pic.javct.net/poster/06032026/1773641662.jpg,https://javct.net/v/fc2ppv-4863961,80,2026-03-17
567BEAF-206,"Ai-chan, 21 years old, pretends to be a real otaku, picks up girls, and goes straight to the hotel, and goes straight to the hotel.",https://pic.javct.net/poster/06032026/1773564421606.jpg,https://javct.net/v/567beaf-206,80,2026-03-17
FC2PPV-4864424,"♯32 The girl I received, Ri-chan, came here thinking she could have sex for free, but she got ripped off, but the sex was the best ♡ Two gorgeous angles included",https://pic.javct.net/poster/06032026/1773726775.jpg,https://javct.net/v/fc2ppv-4864424,87,2026-03-17
DOCS-129,[Sex-loving area] A group of sluts who enjoy erotic and talk with a lot of experience [Hinako],https://pic.javct.net/poster/06032026/1773709876724.jpg,https://javct.net/v/docs-129,85,2026-03-17
FC2PPV-4864350,"173 cm that rivals any model ♡ Tall, fair-skinned body ♡ Beautiful butt ♡ Beautiful legs ♡ Talented ♡ Cabin attendant ♡ Massive creampie sex with Yu-chan ♡",https://pic.javct.net/poster/06032026/1773638197.jpg,https://javct.net/v/fc2ppv-4864350,83,2026-03-17
FC2PPV-4863970,"[Complete Amateur Creampie] As spring approaches, an old man who is in heat won't stop pounding. It's such a rich sex raw creampie that even a lewd and beautiful tall office lady is exhausted.",https://pic.javct.net/poster/06032026/1773641887.jpg,https://javct.net/v/fc2ppv-4863970,49,2026-03-17
10-031726-01,Secret Pussy Collection: Anri Kuroda,https://pic.javct.net/poster/06032026/1773726618.jpg,https://javct.net/v/10-031726-01,10,2026-03-17
SDMU-633-RM,"Magic Mirror ""Can You Help Masturbation Of Mr. C**ldren?"" A Gentle CA Who Voice At The Airport Blushes Virgin Kun!9 [Uncensored L**ked]",https://pic.javct.net/poster/06032026/1773713325.jpg,https://javct.net/v/sdmu-633-rm,235,2026-03-17
IPTD-844-RM,Welcome To The World's Finest Sopuhe Narumiya Cana [Uncensored L**ked],https://pic.javct.net/poster/06032026/1773713078.jpg,https://javct.net/v/iptd-844-rm,180,2026-03-17
HODV-21469-RM,The Price Of Sleeping Kirishima Sakura [Uncensored L**ked],https://pic.javct.net/poster/06032026/1773712433.jpg,https://javct.net/v/hodv-21469-rm,240,2026-03-17
NNPJ-293-RM,Popular No. 1 Piece Sold Out Immediately At A Personal Photography Party Uncovering The Face Behind The Idol Kana (20) Suddenly Shoot Vivid Private SEX!AV Release As It Is! Nampa Japan EXPRESS Vol.76 [Uncensored L**ked],https://pic.javct.net/poster/06032026/1773712888.jpg,https://javct.net/v/nnpj-293-rm,150,2026-03-17
TIKB-217-RM,[Warning: Brain Bug] A Wanking Gal's Pussy Sensitivity Skyrockets And She Falls Into Drug-induced Sex! She's Become The Goddess Of Aheiki Trip Lol Kurosaki Hana [Uncensored L**ked],https://pic.javct.net/poster/06032026/1773421906.jpg,https://javct.net/v/tikb-217-rm,115,2026-03-17
STAR-904-RM,"A Newly Married Life That Is Gentle And Happy, Beginning With Sayakura Manabu. [Uncensored L**ked]",https://pic.javct.net/poster/06032026/1773713268.jpg,https://javct.net/v/star-904-rm,135,2026-03-17
230ORE-460,Suzu-san,https://pic.javct.net/poster/06032026/1773709673.jpg,https://javct.net/v/230ore-460,37,2026-03-17
FC2PPV-4863100,"[No Algae Bonus] We broke up with Fuuka-chan, a super cute JD who chose her boyfriend over sex, in the middle of the last secret meeting. 3 days only",https://pic.javct.net/poster/06032026/1773660809.jpg,https://javct.net/v/fc2ppv-4863100,57,2026-03-17
FC2PPV-4863644,"0411_001 Urara-chan, 20 years old, I thought she was a carnivorous JD with a natural G cup and cat eyes, but when she was fucked, she was a super masochist who screamed and convulsed, impregnated her, and begged her to cum inside her (explosion)",https://pic.javct.net/poster/06032026/1773641825.jpg,https://javct.net/v/fc2ppv-4863644,187,2026-03-17
FC2PPV-4862384,[Exclusive/Individual Shooting] Born as an idol and raised as an idol. / Role / Beauty salon lady❣ Beautiful ass x beautiful big breasts golden ratio body ♡ Sensitive and instantly wet pussy with raw sex that hits the uterus and 3 thick creampies ♡ [Bonus: High quality original version] [Main story / No face],https://pic.javct.net/poster/06032026/1773554055.jpg,https://javct.net/v/fc2ppv-4862384,92,2026-03-17
FC2PPV-4863385,"*A real sex exclusive video recording a total of 3 ejaculations, including raw sex and raw creampie on a dangerous day.",https://pic.javct.net/poster/06032026/1773553884.jpg,https://javct.net/v/fc2ppv-4863385,69,2026-03-17
FC2PPV-4862966,"[Face showing / None / Medium] A 22-year-old black-haired slender JD performs a rolling reverse slippery hand job, toying with the cock and thoroughly attacking the rod and balls, causing a huge ejaculation!?",https://pic.javct.net/poster/06032026/1773553638.jpg,https://javct.net/v/fc2ppv-4862966,61,2026-03-17
SSIS-858-RM,"Even Though You're A Teacher, You're Bound To Get Fucked By Us Because You Have Huge Erotic Breasts, You Understand, Right? Nagi Hikaru [Uncensored L**ked]",https://pic.javct.net/poster/20230908/1694714182.jpg,https://javct.net/v/ssis-858-rm,120,2026-03-17
ADN-503-RM,My Father-in-law's Kiss As He Licks Me Miu Shiramine [Uncensored L**ked],https://pic.javct.net/poster/20231011/1699149399.jpg,https://javct.net/v/adn-503-rm,120,2026-03-17
SONE-248-RM,K-cup Secretary Gets Licked And Violated By Her Slug-like Boss Until She Cums Hikaru Nagi [Uncensored L**ked],https://pic.javct.net/poster/20243105/1720146570.jpg,https://javct.net/v/sone-248-rm,120,2026-03-17
JUQ-404-RM,Nude Model NTR Shocking Cheating Video Of A Wife Drowning In Shame With Her Boss Sayuri Hayama [Uncensored L**ked],https://pic.javct.net/poster/20231011/1698144969.jpg,https://javct.net/v/juq-404-rm,120,2026-03-17
FPRE-004-RM,Sleep R**e: Putting My Cocky Son's Big-breasted Wife To Sleep With Sleeping Pills And Raping Her. Mina Kitano [Uncensored L**ked],https://pic.javct.net/poster/20231912/1704020502.jpg,https://javct.net/v/fpre-004-rm,150,2026-03-17
JUQ-943-RM,Nude Model NTR: Shocking Video Of Wife Cheating With Her Boss And Drowning In Shame Meguri [Uncensored L**ked],https://pic.javct.net/poster/20241115/1732243413.jpg,https://javct.net/v/juq-943-rm,140,2026-03-17
SOAN-108-RM,"The Mother Of The Sakuma Family Who Fell Into Masochistic Anal. A Sexless Married Woman Who Is Not Recognized As A Woman By Her Husband Is Publicly Insulted And Inseminated In Two Holes By Another Man's Cock! The Whole Story Of How She Betrayed Her Husband And Fell Into Masochistic Awakening...Kaede, 42 Years Old [Uncensored L**ked]",https://pic.javct.net/poster/20242108/1727490518.jpg,https://javct.net/v/soan-108-rm,143,2026-03-17
JUQ-540-RM,"Wanted To Make My Wife Admit My Love, So I Left Her And My Unfaithful Junior Alone For 3 Hours...My NTR Story About How My Wife Was Stolen From Me With A Total Of 17 Vaginal Cum Shots Without Pulling Out Sayuri Hayama [Uncensored L**ked]",https://pic.javct.net/poster/20231912/1704643413.jpg,https://javct.net/v/juq-540-rm,120,2026-03-17
FSDSS-672-RM,"I keep being r**ed... A beautiful wife from a rural area is trained by a young man from the city near her husband, and she falls into a sexual assault with Nene Yoshitaka. [Uncensored L**ked]",https://pic.javct.net/poster/20231011/1697259924.jpg,https://javct.net/v/fsdss-672-rm,120,2026-03-17
YUJ-008-RM,"You Have A Husband And I Have A Wife, But You And Your Colleagues At Work Asked Each Other Until The Sun Rose. Miu Shiramine [Uncensored L**ked]",https://pic.javct.net/poster/20230908/1695605474.jpg,https://javct.net/v/yuj-008-rm,120,2026-03-17
STARS-923-RM,"5 Situations Where You Can Enjoy Rei Kamiki's ""beautiful Butt"" With A Transcendental Style.Actually, I...not Only My Boobs But Also My Buttocks Are Amazing Rei Kamiki [Uncensored L**ked]",https://pic.javct.net/poster/20231011/1697068491.jpg,https://javct.net/v/stars-923-rm,156,2026-03-17
JUQ-510-RM,The World's Most Luxurious Commemorative Work! ! Madonna 20th Anniversary - First Ever ALL Exclusive Bus Tour With Unlimited Creampie And Steam! ! First Part 4 Hours OVER 2-disc Set! ! [Uncensored L**ked],https://pic.javct.net/poster/20231912/1703554075.jpg,https://javct.net/v/juq-510-rm,290,2026-03-17
FTAV-003-RM,"""I Love Him, But... I'm Getting Wet Just Thinking About What He's Going To Do..."" I-cup Nurse, 22 Years Old, Not Affiliated With Kimitsu City, Chiba Production, A Woman With Natural Big Breasts Who Lives In The Countryside, Still An Amateur, SOFT ON DEMAND Yu Sasamoto's (tentative) Appearance For The Fourth Time In The New House Where Her Married Life Begins And Her Fiancé Works... [Uncensored L**ked]",https://pic.javct.net/poster/20242108/1727115023.jpg,https://javct.net/v/ftav-003-rm,159,2026-03-17
URE-100-RM,"Congratulations! Commemorative Work For 100 Mature Comics Original Work: Purpoison Mother-eating ~Yarichin Travel Edition~ Cumulative Total Of Over 100,000 Downloads Of The Series! ! A Live-action Sequel To The Legendary Popular Doujin Work Starring Madonna! ! Exclusive, Ririko Kinoshita's 6 Gorgeous Performances With Large Volumes! ! [Uncensored L**ked]",https://pic.javct.net/poster/20231711/1702777063.jpg,https://javct.net/v/ure-100-rm,240,2026-03-17
MVSD-471-RM,Remote Control NTS Indecent Pant Of My Beloved Wife Drowning In Another Stick Michiru Kujo [Uncensored L**ked],https://pic.javct.net/poster/20231912/1704622292.jpg,https://javct.net/v/mvsd-471-rm,120,2026-03-17
ADN-564-RM,"I Kept Giving My Son's Wife An Aphrodisiac So That She Wouldn't Find Out, And I Made Her Body, Which Had Become An Erogenous Zone, Go Crazy With Excitement And Climax. Shiramine Miu [Uncensored L**ked]",https://pic.javct.net/poster/20241804/1714707796.jpg,https://javct.net/v/adn-564-rm,160,2026-03-17
MEYD-890-RM,I Spent A Week Having Sex With A Big-breasted Aunt With A Sloppy Personality In A Ch**ing Trash Room. Sayama Love [Uncensored L**ked],https://pic.javct.net/poster/20241703/1710726271.jpg,https://javct.net/v/meyd-890-rm,150,2026-03-17
JUQ-563-RM,Days Of Creampie Ring That Will Never End. Sayuri Hayama [Uncensored L**ked],https://pic.javct.net/poster/20241901/1708307694.jpg,https://javct.net/v/juq-563-rm,120,2026-03-17
FSDSS-673-RM,"My husband isn't here today, so why don't we have another drink at home? I, Yuko Ono, got excited when I saw my ex-girlfriend again at the class reunion, wearing no panties or bra. [Uncensored L**ked]",https://pic.javct.net/poster/20231011/1698379389.jpg,https://javct.net/v/fsdss-673-rm,120,2026-03-17
JUQ-439-RM,"During My Wife's Pregnancy, I Was Forbidden To Even Masturbate, So I Had Sex With My Mother-in-law, Sayuri, Who Had Moved To Tokyo Many Times... Sayuri Hayama [Uncensored L**ked]",https://pic.javct.net/poster/20231011/1699830529.jpg,https://javct.net/v/juq-439-rm,120,2026-03-17
ROE-163-RM,My Aunt's Wet And See-through Body. A Night Alone Under The Same Roof... Sentimental Rain Pattern Yuka Mizuno [Uncensored L**ked],https://pic.javct.net/poster/20230908/1695970848.jpg,https://javct.net/v/roe-163-rm,140,2026-03-17
WAAA-303-RM,I Asked My Plump Wife At My Part-time Job To Be My Tutor... Ai Sayama [Uncensored L**ked],https://pic.javct.net/poster/20230908/1696605519.jpg,https://javct.net/v/waaa-303-rm,120,2026-03-17
ACHJ-030-RM,Madonna Dengeki Exclusive Authentic Slut Sumire Mizukawa Endless Ejaculation Orgasm That Makes Masochist Man's Body And Mind Melt With Deep And Rich Kisses And Stopping Creampie [Uncensored L**ked],https://pic.javct.net/poster/20231711/1700382348.jpg,https://javct.net/v/achj-030-rm,110,2026-03-17
PRED-526-RM,"When I Took Care Of Miu-sensei Who Had Collapsed And Sent Her Home... I Was A Monster Of Sexual Desire, And I Couldn't Stop Getting An Erection Due To Her Plump, Beautiful Legs And Strong Legs, And Ended Up Ejaculating Over And Over Again Until Morning. Shiramine Miu [Uncensored L**ked]",https://pic.javct.net/poster/20231011/1697500675.jpg,https://javct.net/v/pred-526-rm,120,2026-03-17
