code,title,image_url,page_url,views,date_scraped
328HMDNV-910,A beautiful mature woman who is a former ballerina and runs multiple ballet classes. She seeks relief from her busy CEO job and her rift with her husband by having extramarital creampie sex.,https://pic.javct.net/poster/06032026/1774756115715.jpg,https://javct.net/v/328hmdnv-910,65,2026-03-30
FC2PPV-4870708,"[Current idol] [Full face exposed] A 21-year-old frustrated and neat beauty makes her slender slender body bounce and squirts in a voice that is unbecoming of an idol. She introduces herself while being fingered, swallows a big cock, and then cums with a big cock for the first time in the missionary position.",https://pic.javct.net/poster/06032026/1774774996.jpg,https://javct.net/v/fc2ppv-4870708,40,2026-03-30
FC2PPV-4870090,[Super-treasured first release!!] A beauty salon receptionist who is never seen outside the gate ♥ Forbidden private video of a charming slender body with a sweet and cute voice that makes you beg for creampie over and over ♥,https://pic.javct.net/poster/06032026/1774762404.jpg,https://javct.net/v/fc2ppv-4870090,77,2026-03-30
SIRO-5652,"Don't miss the overwhelming abomination of a baby-faced, big-breasted beautiful girl who is excited by a dick that is bigger than her face and gives a blowjob while taking advantage of her big ass in a cowgirl position. [First shot] AV application online AV experience shooting 2532 [First shot] AV application online AV experience shooting 2532",https://pic.javct.net/poster/06032026/1774756261455.jpg,https://javct.net/v/siro-5652,64,2026-03-30
FC2PPV-4870272,"[3 reverse blowjobs & double blowjobs in the mouth & 6 shots on the face] The beautiful classmate duo will ejaculate a huge cock, a metabolic anime geek, and 6 other unique cocks ☆ Misa-chan & Kasumi-chan",https://pic.javct.net/poster/06032026/1774755698.jpg,https://javct.net/v/fc2ppv-4870272,92,2026-03-30
FC2PPV-4870724,"0387_0414_001 Reira-chan, 19 years old, Kanna-chan, 18 years old Ma.ma's friend's two young married women are impregnated at the same time with another person's dick. No need to worry. Pregnancy egg creampie 3P orgy (explosion)",https://pic.javct.net/poster/06032026/1774754736.jpg,https://javct.net/v/fc2ppv-4870724,58,2026-03-30
FC2PPV-4867356,"[One shot] A beautiful new office lady who just moved to Tokyo, who I found on an app, came to me for a secret creampie from her long-distance boyfriend (SNN-53)",https://pic.javct.net/poster/06032026/1774754632.jpg,https://javct.net/v/fc2ppv-4867356,46,2026-03-30
FC2PPV-4870555,Try to make a pretty lady cry/Complete obedience meat urinal [Ai Part 1],https://pic.javct.net/poster/06032026/1774755602.jpg,https://javct.net/v/fc2ppv-4870555,63,2026-03-30
FC2PPV-4870671,"I took Ai-chan #6, a really cute and beautiful girl with beautiful breasts and a nice ass, into the sex room and had sex with her, making her cum inside me.",https://pic.javct.net/poster/06032026/1774754685.jpg,https://javct.net/v/fc2ppv-4870671,66,2026-03-30
567BEAF-208,"Yuri, 20 years old, is a monster masochist who craves approval and is hated by girls because of her frilly clothes and frivolous character.",https://pic.javct.net/poster/06032026/1774756194705.jpg,https://javct.net/v/567beaf-208,70,2026-03-30
STAR-920-RM,Nanami Shirase Novelty Spa Tour [Uncensored L**ked],https://pic.javct.net/poster/06032026/1774836412.jpg,https://javct.net/v/star-920-rm,230,2026-03-30
AVOP-403-RM,Sore Throat  Vaginal Cum Shot Acting Pretty Spirit Servant Throat Chat Yamai Suzu [Uncensored L**ked],https://pic.javct.net/poster/20230302/1679416071.jpg,https://javct.net/v/avop-403-rm,235,2026-03-30
CHN-059-RM,"New Absolute Pretty, I Will Lend You. ACT.32 Kitano Nozomi [Uncensored L**ked]",https://pic.javct.net/poster/06032026/1774836998.jpg,https://javct.net/v/chn-059-rm,130,2026-03-30
XVSR-112-RM,As You Can Begging High School Pond No Beauty Sister Rumor Mitsui Yuno × Ena Ruri [Uncensored L**ked],https://pic.javct.net/poster/06032026/1774835786.jpg,https://javct.net/v/xvsr-112-rm,120,2026-03-30
XRW-584-RM,Woman Brush Blame Insane Relaxed By Pleasure And Tickle 2 [Uncensored L**ked],https://pic.javct.net/poster/06032026/1774835905.jpg,https://javct.net/v/xrw-584-rm,179,2026-03-30
SDAM-027-RM,"Close Coverage On The Super Topic Solo Can Girls!The Nature And The Human Skin Are Also Relieved The Mind And The Scorpion, As It Is Sex Sex! ! [Uncensored L**ked]",https://pic.javct.net/poster/06032026/1774836544.jpg,https://javct.net/v/sdam-027-rm,165,2026-03-30
MIDE-697-RM,Groom And A Bride's Friend Who Sprinkled Overnight In Gamshala My Wife's Friend Who Met After A Long Time At The Wedding Was The Woman Of The First Love I Longed For. Hatsukawa Minami [Uncensored L**ked],https://pic.javct.net/poster/06032026/1774836691.jpg,https://javct.net/v/mide-697-rm,120,2026-03-30
IPTD-872-RM,SEX And The Kiss Of Cana Rich Narumiya [Uncensored L**ked],https://pic.javct.net/poster/06032026/1774836284.jpg,https://javct.net/v/iptd-872-rm,170,2026-03-30
SSIS-858-RM,"Even Though You're A Teacher, You're Bound To Get Fucked By Us Because You Have Huge Erotic Breasts, You Understand, Right? Nagi Hikaru [Uncensored L**ked]",https://pic.javct.net/poster/20230908/1694714182.jpg,https://javct.net/v/ssis-858-rm,120,2026-03-30
ADN-503-RM,My Father-in-law's Kiss As He Licks Me Miu Shiramine [Uncensored L**ked],https://pic.javct.net/poster/20231011/1699149399.jpg,https://javct.net/v/adn-503-rm,120,2026-03-30
SONE-248-RM,K-cup Secretary Gets Licked And Violated By Her Slug-like Boss Until She Cums Hikaru Nagi [Uncensored L**ked],https://pic.javct.net/poster/20243105/1720146570.jpg,https://javct.net/v/sone-248-rm,120,2026-03-30
JUQ-404-RM,Nude Model NTR Shocking Cheating Video Of A Wife Drowning In Shame With Her Boss Sayuri Hayama [Uncensored L**ked],https://pic.javct.net/poster/20231011/1698144969.jpg,https://javct.net/v/juq-404-rm,120,2026-03-30
FPRE-004-RM,Sleep R**e: Putting My Cocky Son's Big-breasted Wife To Sleep With Sleeping Pills And Raping Her. Mina Kitano [Uncensored L**ked],https://pic.javct.net/poster/20231912/1704020502.jpg,https://javct.net/v/fpre-004-rm,150,2026-03-30
JUQ-943-RM,Nude Model NTR: Shocking Video Of Wife Cheating With Her Boss And Drowning In Shame Meguri [Uncensored L**ked],https://pic.javct.net/poster/20241115/1732243413.jpg,https://javct.net/v/juq-943-rm,140,2026-03-30
SOAN-108-RM,"The Mother Of The Sakuma Family Who Fell Into Masochistic Anal. A Sexless Married Woman Who Is Not Recognized As A Woman By Her Husband Is Publicly Insulted And Inseminated In Two Holes By Another Man's Cock! The Whole Story Of How She Betrayed Her Husband And Fell Into Masochistic Awakening...Kaede, 42 Years Old [Uncensored L**ked]",https://pic.javct.net/poster/20242108/1727490518.jpg,https://javct.net/v/soan-108-rm,143,2026-03-30
JUQ-540-RM,"Wanted To Make My Wife Admit My Love, So I Left Her And My Unfaithful Junior Alone For 3 Hours...My NTR Story About How My Wife Was Stolen From Me With A Total Of 17 Vaginal Cum Shots Without Pulling Out Sayuri Hayama [Uncensored L**ked]",https://pic.javct.net/poster/20231912/1704643413.jpg,https://javct.net/v/juq-540-rm,120,2026-03-30
FSDSS-672-RM,"I keep being r**ed... A beautiful wife from a rural area is trained by a young man from the city near her husband, and she falls into a sexual assault with Nene Yoshitaka. [Uncensored L**ked]",https://pic.javct.net/poster/20231011/1697259924.jpg,https://javct.net/v/fsdss-672-rm,120,2026-03-30
YUJ-008-RM,"You Have A Husband And I Have A Wife, But You And Your Colleagues At Work Asked Each Other Until The Sun Rose. Miu Shiramine [Uncensored L**ked]",https://pic.javct.net/poster/20230908/1695605474.jpg,https://javct.net/v/yuj-008-rm,120,2026-03-30
STARS-923-RM,"5 Situations Where You Can Enjoy Rei Kamiki's ""beautiful Butt"" With A Transcendental Style.Actually, I...not Only My Boobs But Also My Buttocks Are Amazing Rei Kamiki [Uncensored L**ked]",https://pic.javct.net/poster/20231011/1697068491.jpg,https://javct.net/v/stars-923-rm,156,2026-03-30
FTAV-003-RM,"""I Love Him, But... I'm Getting Wet Just Thinking About What He's Going To Do..."" I-cup Nurse, 22 Years Old, Not Affiliated With Kimitsu City, Chiba Production, A Woman With Natural Big Breasts Who Lives In The Countryside, Still An Amateur, SOFT ON DEMAND Yu Sasamoto's (tentative) Appearance For The Fourth Time In The New House Where Her Married Life Begins And Her Fiancé Works... [Uncensored L**ked]",https://pic.javct.net/poster/20242108/1727115023.jpg,https://javct.net/v/ftav-003-rm,159,2026-03-30
JUQ-510-RM,The World's Most Luxurious Commemorative Work! ! Madonna 20th Anniversary - First Ever ALL Exclusive Bus Tour With Unlimited Creampie And Steam! ! First Part 4 Hours OVER 2-disc Set! ! [Uncensored L**ked],https://pic.javct.net/poster/20231912/1703554075.jpg,https://javct.net/v/juq-510-rm,290,2026-03-30
URE-100-RM,"Congratulations! Commemorative Work For 100 Mature Comics Original Work: Purpoison Mother-eating ~Yarichin Travel Edition~ Cumulative Total Of Over 100,000 Downloads Of The Series! ! A Live-action Sequel To The Legendary Popular Doujin Work Starring Madonna! ! Exclusive, Ririko Kinoshita's 6 Gorgeous Performances With Large Volumes! ! [Uncensored L**ked]",https://pic.javct.net/poster/20231711/1702777063.jpg,https://javct.net/v/ure-100-rm,240,2026-03-30
MVSD-471-RM,Remote Control NTS Indecent Pant Of My Beloved Wife Drowning In Another Stick Michiru Kujo [Uncensored L**ked],https://pic.javct.net/poster/20231912/1704622292.jpg,https://javct.net/v/mvsd-471-rm,120,2026-03-30
ADN-564-RM,"I Kept Giving My Son's Wife An Aphrodisiac So That She Wouldn't Find Out, And I Made Her Body, Which Had Become An Erogenous Zone, Go Crazy With Excitement And Climax. Shiramine Miu [Uncensored L**ked]",https://pic.javct.net/poster/20241804/1714707796.jpg,https://javct.net/v/adn-564-rm,160,2026-03-30
MEYD-890-RM,I Spent A Week Having Sex With A Big-breasted Aunt With A Sloppy Personality In A Ch**ing Trash Room. Sayama Love [Uncensored L**ked],https://pic.javct.net/poster/20241703/1710726271.jpg,https://javct.net/v/meyd-890-rm,150,2026-03-30
JUQ-563-RM,Days Of Creampie Ring That Will Never End. Sayuri Hayama [Uncensored L**ked],https://pic.javct.net/poster/20241901/1708307694.jpg,https://javct.net/v/juq-563-rm,120,2026-03-30
FSDSS-673-RM,"My husband isn't here today, so why don't we have another drink at home? I, Yuko Ono, got excited when I saw my ex-girlfriend again at the class reunion, wearing no panties or bra. [Uncensored L**ked]",https://pic.javct.net/poster/20231011/1698379389.jpg,https://javct.net/v/fsdss-673-rm,120,2026-03-30
JUQ-439-RM,"During My Wife's Pregnancy, I Was Forbidden To Even Masturbate, So I Had Sex With My Mother-in-law, Sayuri, Who Had Moved To Tokyo Many Times... Sayuri Hayama [Uncensored L**ked]",https://pic.javct.net/poster/20231011/1699830529.jpg,https://javct.net/v/juq-439-rm,120,2026-03-30
ROE-163-RM,My Aunt's Wet And See-through Body. A Night Alone Under The Same Roof... Sentimental Rain Pattern Yuka Mizuno [Uncensored L**ked],https://pic.javct.net/poster/20230908/1695970848.jpg,https://javct.net/v/roe-163-rm,140,2026-03-30
WAAA-303-RM,I Asked My Plump Wife At My Part-time Job To Be My Tutor... Ai Sayama [Uncensored L**ked],https://pic.javct.net/poster/20230908/1696605519.jpg,https://javct.net/v/waaa-303-rm,120,2026-03-30
ACHJ-030-RM,Madonna Dengeki Exclusive Authentic Slut Sumire Mizukawa Endless Ejaculation Orgasm That Makes Masochist Man's Body And Mind Melt With Deep And Rich Kisses And Stopping Creampie [Uncensored L**ked],https://pic.javct.net/poster/20231711/1700382348.jpg,https://javct.net/v/achj-030-rm,110,2026-03-30
PRED-526-RM,"When I Took Care Of Miu-sensei Who Had Collapsed And Sent Her Home... I Was A Monster Of Sexual Desire, And I Couldn't Stop Getting An Erection Due To Her Plump, Beautiful Legs And Strong Legs, And Ended Up Ejaculating Over And Over Again Until Morning. Shiramine Miu [Uncensored L**ked]",https://pic.javct.net/poster/20231011/1697500675.jpg,https://javct.net/v/pred-526-rm,120,2026-03-30
200GANA-3359,"[Cool beauty x facial orgasm] Her snow-white and smooth skin turns a mysterious pink color as she violently pistons. A real softie, first shot 2275",https://pic.javct.net/poster/06032026/1774756330436.jpg,https://javct.net/v/200gana-3359,60,2026-03-30
420STH-120,muyumi(23) [Amateur Hoi Hoi Stay Home/Bring Home/Amateur/Beautiful Girl/Black Hair/Neat/Deep Throat/Squirting/Electric Massager/Gonzo/Documentary],https://pic.javct.net/poster/06032026/1774756042655.jpg,https://javct.net/v/420sth-120,75,2026-03-30
FC2PPV-4870293,A beautiful 24-year-old restaurant worker has disastrous sex with a dildo and a meat stick that makes her breathe from her shoulders,https://pic.javct.net/poster/06032026/1774755648.jpg,https://javct.net/v/fc2ppv-4870293,61,2026-03-30
FC2PPV-4870346,"She looks very similar to that girl in the A〇 commercial ♡ Living with a boyfriend she doesn't like If my boyfriend finds out about this video, it will be a chance for us to break up (lol)'' I get creampied from swallowing saliva ♡",https://pic.javct.net/poster/06032026/1774755570.jpg,https://javct.net/v/fc2ppv-4870346,85,2026-03-30
FC2PPV-4870474,A must-see for big cock lovers.Is it possible to insert a demon big cock into anal for the first time in life?Plenty of creampie SEX,https://pic.javct.net/poster/06032026/1774755755.jpg,https://javct.net/v/fc2ppv-4870474,87,2026-03-30
PASN-015,"Slut beauty's reverse naughty immediate sex and creampie Vol.01 - Aggressive slut hunts men in the city and immediately inserts them straight into the hotel, leading to female-led creampie -",https://pic.javct.net/poster/06032026/1774690777394.jpg,https://javct.net/v/pasn-015,135,2026-03-30
