code,title,image_url,page_url,views,date_scraped
HEY-220,The Best View Of Yuuna Himekawa : Yuuna Himekawa,https://pic.javct.net/poster/09052025/1759277963.jpg,https://javct.net/v/hey-220,120,2026-05-31
HEY-221,Naked Widow Works For Debt : Shino Aoi,https://pic.javct.net/poster/09052025/1759278021.jpg,https://javct.net/v/hey-221,120,2026-05-31
HEY-216,Plunged Into Wild And Crazy Orgy : Mio Futaba,https://pic.javct.net/poster/09052025/1759192458.jpg,https://javct.net/v/hey-216,140,2026-05-31
CEMD-269-RM,Let's Have Sex In A Camper! Anal Sex Version Kanae Kawahara [Uncensored L**ked],https://pic.javct.net/poster/20222311/1670641158.jpg,https://javct.net/v/cemd-269-rm,130,2026-05-31
MIST-447-RM,Soapland 54 Where You Can Make A C**ld Directly On A Dangerous Day Yuri Honma [Uncensored L**ked],https://pic.javct.net/poster/20242108/1726074585.jpg,https://javct.net/v/mist-447-rm,147,2026-05-31
JUR-681-RM,"Cleaner NTR ~My Wife Was Seduced And Cheated On By A Jock With Athletic Build Who Boasted That He Was Stronger Than Me, And Was Subjected To Endless Hard Fucking~ Mito Kana [Uncensored L**ked]",https://pic.javct.net/poster/04112026/1776967211.jpg,https://javct.net/v/jur-681-rm,120,2026-05-31
JUR-071-RM,"I've Been Living With My Stepfather For Four Years... This Is The Story Of How I Was Repeatedly Penetrated Without A Condom, How I Awakened To Pleasure, And How I Became Pregnant. Yano Ama [Uncensored L**ked]",https://pic.javct.net/poster/04112026/1776963843.jpg,https://javct.net/v/jur-071-rm,170,2026-05-31
EMBZ-345,"A Mature Woman's Ripe, Sensitive, Huge Nipples. Sucking, Biting, Licking, And Playing With Her Fully Erect, Swollen Nipples Until She Cums. 7. Orie Fujiki",https://pic.javct.net/poster/05192026/ecf660f3be.jpg,https://javct.net/v/embz-345,130,2026-05-31
JUTA-196,Superb!! A 50-year-old Housewife's First Nude AV Documentary: Shinobu Masuoka,https://pic.javct.net/poster/05192026/6f4d2965eb.jpg,https://javct.net/v/juta-196,125,2026-05-31
VOD-056-RM,Authentic Amateur Wife Ecstasy Awakening Edition: Climax Development Sex With Splashing Love Juices - Asuka Tsukimoto [Uncensored L**ked],https://pic.javct.net/poster/05192026/494c3e94a1.jpg,https://javct.net/v/vod-056-rm,105,2026-05-31
JUR-308-SUB,"""It's Definitely Only 3cm..."" I Let My Sexually Insatiable Father-in-law Insert It For A Little While, And To My Surprise, We Had A Great Compatibility... I Climaxed Many Times. Rio Asahi [English Subtitle]",https://pic.javct.net/poster/20250903/1743707048.jpg,https://javct.net/v/jur-308-sub,130,2026-05-31
FC2PPV-4909641,"[3P] It seems that even after training, it is difficult to get used to it.It will be training in 3P.It will be a sex video and a physical examination.",https://pic.javct.net/poster/05192026/01aa860ea8.jpg,https://javct.net/v/fc2ppv-4909641,51,2026-05-31
VEC-778-RM,The Cuckolding Method ~A Husband Who Asks His Best Friend To Seduce His Wife Because He Wants To Confirm Her Love~ Haruka Ryukawa [Uncensored L**ked],https://pic.javct.net/poster/05192026/995b186160.jpg,https://javct.net/v/vec-778-rm,120,2026-05-31
HMGL-140-RM,Embarrassing Body Chatter Chi ● Po Article Ayaginu Mika [Uncensored L**ked],https://pic.javct.net/poster/06032026/1775145246.jpg,https://javct.net/v/hmgl-140-rm,120,2026-05-31
C-2392,Amateur Wife Speech Interview 【four】,https://pic.javct.net/poster/05192026/f0c041b538.jpg,https://javct.net/v/c-2392,100,2026-05-31
FC2PPV-4909459,"[Individual video] A frustrated young girl is fucked, her arms and legs are restrained and she squirts to climax",https://pic.javct.net/poster/05192026/846a51fbd9.jpg,https://javct.net/v/fc2ppv-4909459,25,2026-05-31
FOD-004,"""If I Were Your Husband, I Wouldn't Let You Feel So Lonely..."" The One Magic Phrase That Allows Me, A Socially Awkward Guy, To See Through A Dependent, Mentally Unstable Housewife, Trap Her In My Heart, And Drive Her Crazy ()",https://pic.javct.net/poster/05192026/88d1b283d8.jpg,https://javct.net/v/fod-004,126,2026-05-31
JUKF-047-RM,"Serious And Naive Girl Troubles ""Please Tell Me The Teacher"" Ichika-chan (A Cup) Ichika Matsumoto [Uncensored L**ked]",https://pic.javct.net/poster/20241115/1733099520.jpg,https://javct.net/v/jukf-047-rm,155,2026-05-31
MAD-096-RM,Wu Rui Saotome Horse Tied Its [Uncensored L**ked],https://pic.javct.net/poster/05192026/a2c2500133.jpg,https://javct.net/v/mad-096-rm,125,2026-05-31
XV-660-RM,New Comer Ria Sakurai [Uncensored L**ked],https://pic.javct.net/poster/05192026/d5e1657c95.jpg,https://javct.net/v/xv-660-rm,120,2026-05-31
SOE-756-RM,Ruri Saijo 3 Hour Special Discount Big FUCK Leverage [Uncensored L**ked],https://pic.javct.net/poster/05192026/432f1730ee.jpg,https://javct.net/v/soe-756-rm,180,2026-05-31
FC2PPV-4908256,"[Complete amateur creampie] A super beautiful office lady with a captivating body seduces an old man's cock for the first time.With a raw cock, one creampie and two pussy hair ejaculations with a large amount of splash.",https://pic.javct.net/poster/05192026/ae49caae93.jpg,https://javct.net/v/fc2ppv-4908256,54,2026-05-31
435MFC-054-RM,Naako [Uncensored L**ked],https://pic.javct.net/poster/05192026/8a2b65b597.jpg,https://javct.net/v/435mfc-054-rm,80,2026-05-31
STAR-991-RM,That Rumor That You Can Not Make A Reservation!Completely Supervised By Shimbashi's Famous Shop Leads To Terrible Ejaculation Testimony Simultaneous Blame Spring Esther Kato Momoka [Uncensored L**ked],https://pic.javct.net/poster/05192026/b8c2cb9d66.jpg,https://javct.net/v/star-991-rm,135,2026-05-31
ONEZ-107-RM,My Wife Who Was Snatched With Portio Development Oil Massage ... Vol.001 Namiki Anna [Uncensored L**ked],https://pic.javct.net/poster/05192026/6c9dbee64b.jpg,https://javct.net/v/onez-107-rm,130,2026-05-31
JJPP-044,Sexual Harassment Lessons Voyeur Post Of The Original Yoga Classroom Mature Attend Shigeku Foot For Menopause Eliminated 5,https://pic.javct.net/poster/05192026/eace63bb59.jpg,https://javct.net/v/jjpp-044,125,2026-05-31
MUGON-106-RM,Woman Pretend To Be Asleep (MUGON-106) [Uncensored L**ked],https://pic.javct.net/poster/05192026/4d5e54d1fb.jpg,https://javct.net/v/mugon-106-rm,120,2026-05-31
STAR-991,That Rumor That You Can Not Make A Reservation!Completely Supervised By Shimbashi's Famous Shop Leads To Terrible Ejaculation Testimony Simultaneous Blame Spring Esther Kato Momoka,https://pic.javct.net/poster/05192026/b8c2cb9d66.jpg,https://javct.net/v/star-991,135,2026-05-31
300MIUM-1391-RM,"[Physical disparity naughty] A complete recording of the whole story of renting the minimum beautiful girl Yuna-chan as a girlfriend and seducing her and doing erotic acts that were originally prohibited. Proof of the theory that the shorter the height, the more intense the sexual desire w The blowjob crazy who wants to lick the dick all the time. Raw sex & plenty of creampie in the tight pussy of the slender body [Rental Girlfriend] [Uncensored L**ked]",https://pic.javct.net/poster/05192026/d8717e8206.jpg,https://javct.net/v/300mium-1391-rm,117,2026-05-31
300MIUM-1391,"[Physical disparity naughty] A complete recording of the whole story of renting the minimum beautiful girl Yuna-chan as a girlfriend and seducing her and doing erotic acts that were originally prohibited. Proof of the theory that the shorter the height, the more intense the sexual desire w The blowjob crazy who wants to lick the dick all the time. Raw sex & plenty of creampie in the tight pussy of the slender body [Rental Girlfriend]",https://pic.javct.net/poster/05192026/d8717e8206.jpg,https://javct.net/v/300mium-1391,117,2026-05-31
SKMJ-754-RM,Going Too Far And Dying! Goddess-level Escort Girls Who Casually Offer Intense Extra Services! 10 Hand-picked No.1 Cast Members From Each Store! I'll Be Secretly Filming Them Everywhere - 300-minute Special! [Uncensored L**ked],https://pic.javct.net/poster/05192026/16ae6d6aa4.jpg,https://javct.net/v/skmj-754-rm,300,2026-05-31
SPRD-801-RM,Ultra Authentic Carnal Fakecest Illustrated - Mother Massaged By Her Own Son Yoshie Mizuno [Uncensored L**ked],https://pic.javct.net/poster/20221108/1662965131.jpg,https://javct.net/v/sprd-801-rm,120,2026-05-31
OBA-054-RM,"Mom, Now the Dehumidifier is Broken. - Chiaki Takeshita [Uncensored L**ked]",https://pic.javct.net/poster/20212011/1640936904.jpg,https://javct.net/v/oba-054-rm,117,2026-05-31
1P-070525-001,Aika Hoshino's Yoga Sex,https://pic.javct.net/poster/05192026/b0588dda75.jpg,https://javct.net/v/1p-070525-001,61,2026-05-31
PA-052626-100,The Temptation of My Unbelievably Sexy Sister-in-Law,https://pic.javct.net/poster/05192026/e272c44859.jpg,https://javct.net/v/pa-052626-100,57,2026-05-31
PA-052326-100,It's Hawaii! A Bikini wife in high spirits! : Ways to End a Sexless Marriage,https://pic.javct.net/poster/05192026/6c8dc8e374.jpg,https://javct.net/v/pa-052326-100,60,2026-05-31
PA-052126-100,A mix of saliva and love juice! A married woman's intense PtoM sex!  : Sara Suzukake,https://pic.javct.net/poster/05192026/9a9e87e82f.jpg,https://javct.net/v/pa-052126-100,60,2026-05-31
GVG-014-RM,Mama's Real Sex Education Kanako Ioka [Uncensored L**ked],https://pic.javct.net/poster/20221904/1651452891.jpg,https://javct.net/v/gvg-014-rm,117,2026-05-31
PA-051926-100,The Temptation of My Busty Boss,https://pic.javct.net/poster/04112026/f80ffcd8f9.jpg,https://javct.net/v/pa-051926-100,60,2026-05-31
PA-051626-100,Working mothers in rural areas : Salesperson for probiotic beverages,https://pic.javct.net/poster/04112026/b686261e70.jpg,https://javct.net/v/pa-051626-100,80,2026-05-31
1P-051626-001,Yui Shinjo: Brought to a Genuine Climax by a Perverted Old Guy,https://pic.javct.net/poster/04112026/0ed16d373b.jpg,https://javct.net/v/1p-051626-001,57,2026-05-31
GVG-785-RM,Stepmother And Offspring Fucking Hitomi Enjoji [Uncensored L**ked],https://pic.javct.net/poster/20212011/1641519705.jpg,https://javct.net/v/gvg-785-rm,131,2026-05-31
NHDTA-898-RM,C**ldhood Friend - Her Little Sister - Her Older Sister - And Even Her Mom! Busty Family Gets Fucked By A Virgin Boy 2 [Uncensored L**ked],https://pic.javct.net/poster/20220707/1660013084.jpg,https://javct.net/v/nhdta-898-rm,142,2026-05-31
PA-051426-100,A Horny Mom Who Gets Forcibly Fucked by Her Son's Friend but Can't Help But Enjoy It,https://pic.javct.net/poster/04112026/0f0d04fc49.jpg,https://javct.net/v/pa-051426-100,54,2026-05-31
1P-051426-001,The Professional Sexy Actress's Style: Eri Saeki,https://pic.javct.net/poster/04112026/7009d842af.jpg,https://javct.net/v/1p-051426-001,56,2026-05-31
GVG-782-RM,Mom's Real Sex Education Kanako Maeda [Uncensored L**ked],https://pic.javct.net/poster/20212011/1644199528.jpg,https://javct.net/v/gvg-782-rm,120,2026-05-31
PA-051226-100,"Mature Woman Special Movie 19 ~ 30s,40s and 50s ~",https://pic.javct.net/poster/04112026/e8d54f3afa.jpg,https://javct.net/v/pa-051226-100,72,2026-05-31
1P-051226-001,PtoM SEX: Sakura Aoi,https://pic.javct.net/poster/04112026/5f64e95de8.jpg,https://javct.net/v/1p-051226-001,61,2026-05-31
OKSN-290-RM,Let Me Be Your First Woman Erina Takimoto [Uncensored L**ked],https://pic.javct.net/poster/20221202/1645751293.jpg,https://javct.net/v/oksn-290-rm,120,2026-05-31
1P-051026-001,Sex with a loose wife in tight pants,https://pic.javct.net/poster/04112026/bc8ae565aa.jpg,https://javct.net/v/1p-051026-001,57,2026-05-31
PA-050926-100,"Throat, Ass, and Pussy: A Luxurious 3-Hole Fuck",https://pic.javct.net/poster/04112026/92ff3cb63d.jpg,https://javct.net/v/pa-050926-100,50,2026-05-31
DV-436-RM,Slut Beauty Kaede Matsushima [Uncensored L**ked],https://pic.javct.net/poster/05192026/ea5e49cc7f.jpg,https://javct.net/v/dv-436-rm,120,2026-05-31
SKJK-022-RM,Secret 0 Yen Saffle Riko Hino Riko [Uncensored L**ked],https://pic.javct.net/poster/20230207/1690432359.jpg,https://javct.net/v/skjk-022-rm,130,2026-05-31
PKPD-103-RM,Too Weak To Push Asahi Shizuku [Uncensored L**ked],https://pic.javct.net/poster/06032026/1775015573.jpg,https://javct.net/v/pkpd-103-rm,133,2026-05-31
PKPD-104-RM,Palliative! Rubber-picking uncle VS Raw NG new actresses Sara Kagami & Mirai Kogure [Uncensored L**ked],https://pic.javct.net/poster/06032026/1775141434133.jpg,https://javct.net/v/pkpd-104-rm,139,2026-05-31
OLM-322E,Underground Idol Seduces Perverted Old Men In Sexy Costumes! Pantyhose Sex And Perverse Foot Fetish Play! Hinako Matsui,https://pic.javct.net/poster/05192026/7674d29292.jpg,https://javct.net/v/olm-322e,121,2026-05-31
T38-062-RM,Perverted Train Office Lady Brutal 3-hole R**e [Uncensored L**ked],https://pic.javct.net/poster/05192026/a15e20c2a8.jpg,https://javct.net/v/t38-062-rm,130,2026-05-31
T28-433-RM,Pies In Tails Tits Knee Pretty [Uncensored L**ked],https://pic.javct.net/poster/04112026/1776592947.jpg,https://javct.net/v/t28-433-rm,240,2026-05-31
ATID-683-RM,This Is A Story About A Middle-aged Man Who Is Madly In Love With A Beautiful Woman Who Proposes To Him Every Day With Sex He Can't Refuse. [Uncensored L**ked],https://pic.javct.net/poster/05192026/81b9ba35fe.jpg,https://javct.net/v/atid-683-rm,120,2026-05-31
CAWD-995-RM,"""Father-in-law... Act More Like A Man..."" I, A Gentle, Effeminate Man, Was Sadistically Trained By My Secretly Masochistic Stepdaughter. - Asami Nami [Uncensored L**ked]",https://pic.javct.net/poster/05192026/30d97b88fb.jpg,https://javct.net/v/cawd-995-rm,120,2026-05-31
BBAN-305-RM,Licking Kiss Temptation Lesbians Rich Sexual Intercourse Inviting Privately Rei Kuruki Yui Nagase [Uncensored L**ked],https://pic.javct.net/poster/20240807/1722044623.jpg,https://javct.net/v/bban-305-rm,170,2026-05-31
GVH-849-RM,Mother-son R**e Honami Hazuki [Uncensored L**ked],https://pic.javct.net/poster/05192026/cb3076f09f.jpg,https://javct.net/v/gvh-849-rm,120,2026-05-31
DLDSS-494-RM,Story About A Messy Cohabitation Where A Man Is Picked Up By A Sex-addicted Woman In An Unfamiliar Town And Becomes Immersed In Unprotected Sex. (Tsukino Luna) [Uncensored L**ked],https://pic.javct.net/poster/05192026/27a2a73322.jpg,https://javct.net/v/dldss-494-rm,120,2026-05-31
SAME-243-RM,Female Teacher Gang-r**ed And Impregnated By The Student's Parent [Uncensored L**ked],https://pic.javct.net/poster/05192026/631533422c.jpg,https://javct.net/v/same-243-rm,120,2026-05-31
KSBJ-255-RM,"Ms. Mizune, 28 Years Old, Will Fulfill The Sexual Desires Of A Busty Wife Who Can't Be Satisfied With Her Monthly Activity And Masturbation Five Times A Week [Uncensored L**ked]",https://pic.javct.net/poster/20230207/1689392932.jpg,https://javct.net/v/ksbj-255-rm,120,2026-05-31
IENF-277-RM,Natsuhana Cream Pie Sex From Morning Till Night 51 [Uncensored L**ked],https://pic.javct.net/poster/20230207/1688613563.jpg,https://javct.net/v/ienf-277-rm,155,2026-05-31
FC2PPV-4910014,[Completely uncensored] A divine slender beauty I met at Ti〇der. A big cock with the same length as her face penetrated deep into her uterus and inseminated her twice.,https://pic.javct.net/poster/05192026/883f6f3264.jpg,https://javct.net/v/fc2ppv-4910014,59,2026-05-31
SON-527,Transformation De M Tits Amateur Woman Thorough To**ure,https://pic.javct.net/poster/05192026/ab9a4f4ccd.jpg,https://javct.net/v/son-527,140,2026-05-31
ABP-998-RM,My Sister Atsushi Nonoura Shares Sex With Everyone Mako No. 3 Creampie Group 11 Ejaculations [+15 Minutes With Bonus Footage Only Available At MGS] [Uncensored L**ked],https://pic.javct.net/poster/20231711/1701129246.jpg,https://javct.net/v/abp-998-rm,145,2026-05-31
STAR-578-SUB,R**e Pies Woman Of Furukawa Iori Mob [English Subtitle],https://pic.javct.net/poster/06032026/1775115152.jpg,https://javct.net/v/star-578-sub,180,2026-05-31
STARS-084-RM,Squid Want Wanted Compliant To**ure Ika Sedanjon Honjo Rin [Uncensored L**ked],https://pic.javct.net/poster/20243105/1719749763.jpg,https://javct.net/v/stars-084-rm,205,2026-05-31
SOE-703-RM,Drinken Lecher - Golden Shower - Gulping - Large Orgies - Ruri Saijo [Uncensored L**ked],https://pic.javct.net/poster/20212011/1640748499.jpg,https://javct.net/v/soe-703-rm,167,2026-05-31
SDJS-375-RM,"When I gave a girl from the human resources department a large amount of beer, she started cumming lol Hikage Yoda (22) [Uncensored L**ked]",https://pic.javct.net/poster/05192026/b976ae52ed.jpg,https://javct.net/v/sdjs-375-rm,120,2026-05-31
FAX-376-RM,FA In The 1990s One Army Blue Film [Uncensored L**ked],https://pic.javct.net/poster/05192026/e006ef3ec2.jpg,https://javct.net/v/fax-376-rm,135,2026-05-31
NITR-266,J Cup Breasts Out In The Cosplayers Orgy Shooting Sayaka Kujo,https://pic.javct.net/poster/05192026/e2f930665f.jpg,https://javct.net/v/nitr-266,130,2026-05-31
SDJS-375,"When I gave a girl from the human resources department a large amount of beer, she started cumming lol Hikage Yoda (22)",https://pic.javct.net/poster/05192026/b976ae52ed.jpg,https://javct.net/v/sdjs-375,120,2026-05-31
DTKM-045-RM,"Fakecest Stepmother And Son Swap, You Can Fuck My Stepmom, So Let Me Fuck Yours. Shinobu Oshima Yukie Mizukami [Uncensored L**ked]",https://pic.javct.net/poster/20220707/1660119590.jpg,https://javct.net/v/dtkm-045-rm,200,2026-05-31
SON-519,Ignorance Ignorant 19-year-old Erotic Length Tongue & Tits Ass Whore Juri Maino,https://pic.javct.net/poster/05192026/9fc7093f6b.jpg,https://javct.net/v/son-519,140,2026-05-31
GVG-795-RM,Mio Kimijima And Gross Guys' Passionate Licking Family Mio Kimijima [Uncensored L**ked],https://pic.javct.net/poster/20212011/1641318201.jpg,https://javct.net/v/gvg-795-rm,126,2026-05-31
FC2PPV-4906732,[Amateur orgy circle treasured video 118],https://pic.javct.net/poster/05192026/d1b517ca35.jpg,https://javct.net/v/fc2ppv-4906732,84,2026-05-31
FC2PPV-4907388,"[No] A 19-year-old idol with the strongest face with two black big cocks, violently defeating a beautiful F-cup cute girl and ending with a huge amount of creampie in two consecutive sweaty hardcore 3P [Overseas version] Bonus included",https://pic.javct.net/poster/05192026/b5d4e7d315.jpg,https://javct.net/v/fc2ppv-4907388,50,2026-05-31
ENKI-044-RM,Ami Is Perverted Girl With Crazy Sexual Appetite. Ultimately Perverted Lewd Call Girl Who Analyzes Cock Data. Raw Creampie Impregnation Press. [Uncensored L**ked],https://pic.javct.net/poster/20212011/1640492838.jpg,https://javct.net/v/enki-044-rm,245,2026-05-31
MIGD-614,Anal FUCK Out Bukkake NOW! Kotomi Asakura,https://pic.javct.net/poster/05192026/8c8926c2a5.jpg,https://javct.net/v/migd-614,120,2026-05-31
JUY-753-RM,"Satori Satsuki Cum Inside Campaign! ! Everyday Not Finishing, Cum Shuffling Gang Days. [Uncensored L**ked]",https://pic.javct.net/poster/20242108/1724447926.jpg,https://javct.net/v/juy-753-rm,120,2026-05-31
JUFD-537-RM,The Baby-Making Polygamist Life With 4 Bra-less Stepsisters With Colossal Tits [Uncensored L**ked],https://pic.javct.net/poster/20220406/1655946620.jpg,https://javct.net/v/jufd-537-rm,235,2026-05-31
DV-426-RM,Kaede Matsushima CLUB GAL SEX [Uncensored L**ked],https://pic.javct.net/poster/05192026/a45ea076cd.jpg,https://javct.net/v/dv-426-rm,120,2026-05-31
MIDA-103-SUB,Skewered Gangbang Summer Camp New Female Teacher Chihiro Miyazaki Used As A Semen Disposal Tool By Students [English Subtitle],https://pic.javct.net/poster/20250903/1743098783.jpg,https://javct.net/v/mida-103-sub,150,2026-05-31
SDGY-002,"This Beautiful Woman Is A Feminine Man [unbounded By Gender, Limitless Perverted Possibilities], A Super-aggressive, Masochistic Slut Begging For Immediate Sex, Saying ""Hey, Let's Have Sex,"" Offering A Parade Of Pleasure-focused Service That Would Be Absolutely Impossible With The Opposite Sex.",https://pic.javct.net/poster/05192026/1e58688dd5.jpg,https://javct.net/v/sdgy-002,130,2026-05-31
CEMD-268-RM,Nonstop Super Squid... Anal SEX Version 2 Yuzu Sumeragi [Uncensored L**ked],https://pic.javct.net/poster/20222311/1670641270.jpg,https://javct.net/v/cemd-268-rm,166,2026-05-31
BBTU-061-RM,I Want To Be Fucked By My Daughter's Big Boobs Toa Seiri [Uncensored L**ked],https://pic.javct.net/poster/20230206/1686971930.jpg,https://javct.net/v/bbtu-061-rm,104,2026-05-31
SAME-236-RM,"A Married Woman Who Has Fallen Into Becoming A Human Toilet In Place Of Her Husband. Impregnation, Press, Skewering, And Gangbang. [Uncensored L**ked]",https://pic.javct.net/poster/05192026/aeb9281207.jpg,https://javct.net/v/same-236-rm,120,2026-05-31
HUNBL-117-RM,Ma  Kogacha Indiscriminate R**e [Uncensored L**ked],https://pic.javct.net/poster/20222410/1668740861.jpg,https://javct.net/v/hunbl-117-rm,110,2026-05-31
CAWD-993-RM,The Dick Of The Old Man She Hates Is Right Up Her Alley!? The Girl Who Thought She Was Going To Have A Classic Debut Ends Up Having Sex With A Perverted Old Man. 144cm Petite And Cute Girl Makes Her AV Debut: Chizaki Nodoka [Uncensored L**ked],https://pic.javct.net/poster/05192026/119434d471.jpg,https://javct.net/v/cawd-993-rm,150,2026-05-31
MEAD-015-RM,"The Legendary H-cup Streetwalker With Miraculous Titjob Technique Makes A One-time AV Debut, Seeking Even More Thrills On The Condition That Her Face Is Not Shown. [Uncensored L**ked]",https://pic.javct.net/poster/05192026/c57c3864f7.jpg,https://javct.net/v/mead-015-rm,170,2026-05-31
FC2PPV-4907806,"Sumire (18) Anyway, this is a first-person angle video of the second shooting of cute Sumire-chan, creampie, anal penetration ATM, and cosplay creampie.",https://pic.javct.net/poster/05192026/9e7d438c0d.jpg,https://javct.net/v/fc2ppv-4907806,58,2026-05-31
HZ-3858,Beauty Collection Vol.122 - Hitomi Tanmura,https://pic.javct.net/poster/05192026/ef10044e0b.jpg,https://javct.net/v/hz-3858,61,2026-05-31
ROYD-065-RM,"The School Idol That Moved Next Door Saw My Boner, And Though She Was Embarassed, She Turned Out To Be A Massive Slut. Mone Kouno [Uncensored L**ked]",https://static.javct.net/poster/royd-065.jpg,https://javct.net/v/royd-065-rm,140,2026-05-31
HZ-3853,Having Sex With A Quiet-Looking Amateur Girl - Miharu Azumi,https://pic.javct.net/poster/05192026/7b2e230564.jpg,https://javct.net/v/hz-3853,51,2026-05-31
HZ-3852,Slender MILF Gets Fucked in a Threesome! - Momoko Akasaka,https://pic.javct.net/poster/05192026/1fcc87afe8.jpg,https://javct.net/v/hz-3852,59,2026-05-31
ROYD-060-RM,"When I Got My First Girlfriend, We Used This Camera To Film So Many Wonderful Memories ... And Now, I'm Using It To Film My Scary Friend While He Fucks Her ... And All The While, I Have A Melancholy Erection, That Just Won't Stop ... Rio Matsumoto [Uncensored L**ked]",https://static.javct.net/poster/royd-060.jpg,https://javct.net/v/royd-060-rm,134,2026-05-31
HZ-3850,Beauty Collection Vol.121 - Yui Nanase,https://pic.javct.net/poster/04112026/9d1f690735.jpg,https://javct.net/v/hz-3850,61,2026-05-31
HZ-3849,I Do Whatever I Want With A Busty MILF!! Vol.3 - Ayumi Fujiwara,https://pic.javct.net/poster/04112026/6a0e180676.jpg,https://javct.net/v/hz-3849,61,2026-05-31
HZ-3848,Erotic Multiple Creampies Vol.8 - Hina Sakurai,https://pic.javct.net/poster/04112026/1c5297f308.jpg,https://javct.net/v/hz-3848,55,2026-05-31
HZ-3846,Beauty Collection Vol.120 - Ami Ogura,https://pic.javct.net/poster/04112026/6df9806905.jpg,https://javct.net/v/hz-3846,61,2026-05-31
FC2PPV-4898377,"Sumire (18) The cutest girl in the second shoot, has a video of different angles of view, creampie, electric masturbation, anal penetration ATM, piston machine, and finally cosplay and creampie.",https://pic.javct.net/poster/04112026/3e21ffb8cd.jpg,https://javct.net/v/fc2ppv-4898377,174,2026-05-31
HZ-3844,Slut Amateur Girl Gets Fucked in a Threesome! - Maho Hoshijima,https://pic.javct.net/poster/04112026/f63afbff7e.jpg,https://javct.net/v/hz-3844,60,2026-05-31
HZ-3843,Slender MILF Stays Nude in Her Home - Hina Kusakabe,https://pic.javct.net/poster/04112026/03748f7c25.jpg,https://javct.net/v/hz-3843,55,2026-05-31
HZ-3837,Beauty Collection Vol.119 - Rion,https://pic.javct.net/poster/04112026/cbe3dbfa19.jpg,https://javct.net/v/hz-3837,61,2026-05-31
HZ-3828,A frustrated wife gets threesome with continuous creampies! - Sara Suzukake,https://pic.javct.net/poster/04112026/bc469fc5b4.jpg,https://javct.net/v/hz-3828,60,2026-05-31
HZ-3836,Beautiful Porcelain Skinned Nurse's Special Treatment - Yui Kisaragi,https://pic.javct.net/poster/04112026/2caa046390.jpg,https://javct.net/v/hz-3836,54,2026-05-31
FC2PPV-4890847,"Sumire (18) This was the second shoot for this super cute girl. Even though she should have known what was going to be done to her, she started to cum again, so I gave her an electric massage, put it in her anus, and used a piston machine.",https://pic.javct.net/poster/04112026/0b23e4cec7.jpg,https://javct.net/v/fc2ppv-4890847,120,2026-05-31
HZ-3835,Cheating woman has her exquisite breasts played with by her FWB - Mirina Nozomi,https://pic.javct.net/poster/04112026/7bfc2f2ed1.jpg,https://javct.net/v/hz-3835,62,2026-05-31
ROYD-056-RM,The Dorm Mom's Daughter Was Completely Defenseless When She Came In To Help With The Sex-starved Male Dorm. Airi Momose [Uncensored L**ked],https://static.javct.net/poster/royd-056.jpg,https://javct.net/v/royd-056-rm,141,2026-05-31
HZ-3834,Beauty Collection Vol.118 - Shiho Sakatani,https://pic.javct.net/poster/04112026/c5a5c9361f.jpg,https://javct.net/v/hz-3834,61,2026-05-31
HZ-3833,Pretty Amateur Girl I Picked up on the Street - Karen Hanatani,https://pic.javct.net/poster/04112026/0972add19a.jpg,https://javct.net/v/hz-3833,64,2026-05-31
HZ-3832,Thick Sex With A Sadistic Slut MILF Vol.4 - Ayu Kojima,https://pic.javct.net/poster/04112026/ed4bc0c0eef4.jpg,https://javct.net/v/hz-3832,59,2026-05-31
NVH-080,"My Best Friend At The All-boys School Is Actually A Girl!? A Transsexual, Flat-chested, Boyish Lesbian: Kondo Mumu / Monami Suzu",https://pic.javct.net/poster/05192026/bb1603b261.jpg,https://javct.net/v/nvh-080,160,2026-05-31
