code,title,image_url,page_url,views,date_scraped
JUL-667-RM,"A Madonna Exclusive: Giving The Green Light For Creampies In A Married Woman, Who Is A Peerless Bunny!! Overly Dense Adultery For The Dark. Iori Takahira [Uncensored L**ked]",https://static.javct.net/poster/jul-667.jpg,https://javct.net/v/jul-667-rm,143,2026-03-30
JUX-773-RM,Farmer's Bride Chitose Nanakusa [Uncensored L**ked],https://pic.javct.net/poster/20212011/1639356674.jpg,https://javct.net/v/jux-773-rm,120,2026-03-30
SSIS-030-US,"There's Nothing To Do In The Countryside During The Summer So I Had Sweaty Sex With The Seductive Beautiful Wife Next Door Every Day Marin Hinata [English Subtitle, Reducing Mosaic]",https://static.javct.net/poster/ssis-030.jpg,https://javct.net/v/ssis-030-us,119,2026-03-30
NKKD-228-SUB,"Fondling Sweaty And Sopping Wet See-Thru Colossal Tits NTR A Colossal Tits Housewife Gets Fucked To Dripping Wet, Transparently Sweaty Ecstasy By The Plumber Hana Haruna [English Subtitle]",https://pic.javct.net/poster/20212709/1633777463.jpg,https://javct.net/v/nkkd-228-sub,124,2026-03-30
NGOD-032-RM,[Sad News] NTR My JK Wife Was Fucked By Her Teacher And Now She's A Horny Whore Sora Shiina [Uncensored L**ked],https://pic.javct.net/poster/20221108/1661507272.jpg,https://javct.net/v/ngod-032-rm,120,2026-03-30
JUL-665-RM,Cuckold Video Of Camping In Town: A Video Of A Wife Shockingly Cuckolded And Given Repeated Creampies - Megu [Uncensored L**ked],https://static.javct.net/poster/jul-665.jpg,https://javct.net/v/jul-665-rm,135,2026-03-30
SSNI-580-RM,This Tiny Girlfriend Is Riding Her Horse-Hung Friend And Getting Fucked To Kingdom Cum Miharu Usa [Uncensored L**ked],https://pic.javct.net/poster/20221202/1648948913.jpg,https://javct.net/v/ssni-580-rm,119,2026-03-30
XVSR-103-RM,An Erotic Novel My Son's Lover - A Lady - Mami Nagase [Uncensored L**ked],https://pic.javct.net/poster/20220406/1657148931.jpg,https://javct.net/v/xvsr-103-rm,124,2026-03-30
DTKM-029-RM,"Immoral, Fakecestuous Neighborhood Stepmother And Son Swap - I'll Let You Fuck My Stepmom, So Let My Fuck Yours. Shinobu Igarashi Yuriko Shiomi [Uncensored L**ked]",https://pic.javct.net/poster/20220406/1655685040.jpg,https://javct.net/v/dtkm-029-rm,201,2026-03-30
MEYD-664-US,"Goro Tameiki 15-Year Anniversary Collaboration Part 3 - I Went To A Massage Parlor Where They Weren't Allowed To Put Out And Discovered The Uppity Married Woman Next Door Working There, So I Made Her Take My Creampie! After That She Became My Obedient Sex Doll Tsumugi Akari [English Subtitle, Reducing Mosaic]",https://static.javct.net/poster/meyd-664.jpg,https://javct.net/v/meyd-664-us,120,2026-03-30
DTKM-028-RM,"Immoral, Fakecestuous Neighborhood Stepmother And Son Swap - I'll Let You Fuck My Stepmom, So Let My Fuck Yours. Miho Sakaki Towako Kirishima [Uncensored L**ked]",https://pic.javct.net/poster/20212011/1643510688.jpg,https://javct.net/v/dtkm-028-rm,200,2026-03-30
NGOD-173-RM,"The Beautiful New Mother Who Lives Next Door Suddenly Hit Me With A Slut Attack, And Although I'm A Gloomy Boy, She Milked Me Of Every Last Drop Of My Semen. Sumire Mizukawa [Uncensored L**ked]",https://pic.javct.net/poster/20221904/1651814520.jpg,https://javct.net/v/ngod-173-rm,125,2026-03-30
NSPS-456-RM,"Giving In To R**e... Prim, Proper Married 44-Year-Old Rie Nishina [Uncensored L**ked]",https://pic.javct.net/poster/20212011/1640937266.jpg,https://javct.net/v/nsps-456-rm,91,2026-03-30
NSPS-447-RM,My First Cuckolding 3 I Want To Be Taken Away By Creepy Men Sana Mizuhara [Uncensored L**ked],https://pic.javct.net/poster/20221108/1661476382.jpg,https://javct.net/v/nsps-447-rm,91,2026-03-30
NDRA-077-RM,A Married Woman Became Her Neighbor's Mistress 28 - Kanna Misaki [Uncensored L**ked],https://pic.javct.net/poster/20212011/1641204067.jpg,https://javct.net/v/ndra-077-rm,122,2026-03-30
FC2PPV-4868343,"[None] [Chapter 4 of Picking Up Girls in the City] X Catch a beautiful married woman near Central Park and have sex with her immediately. Two white men and a married woman with beautiful breasts and a big ass. They are made to understand with the ekiben on the back, and two big cocks are continuously inserted into them, causing them to scream and orgasm with hell bonus.",https://pic.javct.net/poster/06032026/1774329062.jpg,https://javct.net/v/fc2ppv-4868343,56,2026-03-30
JUY-983-RM,Countdown to Creampie. Leona Kirishima [Uncensored L**ked],https://pic.javct.net/poster/20221202/1646702625.jpg,https://javct.net/v/juy-983-rm,118,2026-03-30
JUY-368-RM,"I Was Continuously R**ed By My Husband's Boss, And On The 7th Day, I Lost My Mind... Mako Oda [Uncensored L**ked]",https://pic.javct.net/poster/20212011/1640937083.jpg,https://javct.net/v/juy-368-rm,115,2026-03-30
PRED-379-SUB,"When My Husband was Away, My Father-in-Law I Hate Made Me Cum Like Never Before...Luna Tsukino [English Subtitle]",https://pic.javct.net/poster/20212011/1644559936.jpg,https://javct.net/v/pred-379-sub,119,2026-03-30
SSIS-231-US,"Younger Man Unable to Resist Tempting Posing of 8-Headed Beautiful-Legged Married Woman in Far Window After Moving Home! Marin Hinata [English Subtitle, Reducing Mosaic]",https://pic.javct.net/poster/20212709/1636093523.jpg,https://javct.net/v/ssis-231-us,119,2026-03-30
NGOD-171-RM,"The Woman From The Convenience Store Headquarters, 11. Sarina Momonaga [Uncensored L**ked]",https://pic.javct.net/poster/20221904/1651814576.jpg,https://javct.net/v/ngod-171-rm,120,2026-03-30
GNAX-017-RM,New Intruder Ai Mukai [Uncensored L**ked],https://pic.javct.net/poster/20212709/1633769550.jpg,https://javct.net/v/gnax-017-rm,105,2026-03-30
HOMA-093-RM,"I'm Working As A Private Tutor For My Girlfriend's Little Sister (A Neat And Clean J*), But... The Truth Is That She's An Orgasmic Bitch, And Secretly Hitting Me With Siren Reverse NTR Plays When My Girlfriend's Not Looking Yui Nagase [Uncensored L**ked]",https://pic.javct.net/poster/20221108/1660784835.jpg,https://javct.net/v/homa-093-rm,121,2026-03-30
NGOD-170-RM,I Got Fingered By My Husband's Mean Boss... Nene Tanaka [Uncensored L**ked],https://pic.javct.net/poster/20221202/1649409013.jpg,https://javct.net/v/ngod-170-rm,147,2026-03-30
FC2PPV-4871255,[Short-term release] “2026 new graduate big-breasted office lady” in-house sex video *Ends soon,https://pic.javct.net/poster/06032026/1774847152.jpg,https://javct.net/v/fc2ppv-4871255,25,2026-03-30
VGD-169,Cum Lovers Kirishima Sakura,https://pic.javct.net/poster/06032026/1774855276.jpg,https://javct.net/v/vgd-169,120,2026-03-30
REAL-555,Demon Capitalize Aoi Akari,https://pic.javct.net/poster/06032026/1774855400.jpg,https://javct.net/v/real-555,130,2026-03-30
KSBJ-026,Barefoot Wife Maori Orihara,https://pic.javct.net/poster/06032026/1774855524.jpg,https://javct.net/v/ksbj-026,122,2026-03-30
TMAM-036,Determine The Amount Of Energy If You Hold Sway For About Two Breast J Cup.,https://pic.javct.net/poster/06032026/1774839389.jpg,https://javct.net/v/tmam-036,120,2026-03-30
SKMJ-730-RM,"Race Queens Shine Brighter Than The Cars At The Motor Show! ""Would You Be Willing To Be A Model For A Virgin Photographer?"" 4 A Carnivorous Race Queen Is Turned On By A Virgin Who Gets Fully Erect While Photographing Her Nice Body And Can't Get A Good Shot... Lol ""Shall We Have Sex?"" A Congratulatory First Time With A Series Of Explosive Creampies! [Uncensored L**ked]",https://pic.javct.net/poster/06032026/1774548624.jpg,https://javct.net/v/skmj-730-rm,232,2026-03-30
SS-007,"""I Have Come In Raw!""Had Rubbed A Co ○ Ma Po Ji ○ Intercrural Sex In Oil, Raw Insertion I Too Pleasant!Miss Chau Manners That We Do To Sex Creampie",https://pic.javct.net/poster/06032026/1774845638.jpg,https://javct.net/v/ss-007,130,2026-03-30
FC2PPV-4870769,"Uncensored.172cm Korean half-breed [True nature] I'm actually an M too.. If it's a high-speed piston, I'll fuck Shiominato-ku female I cup",https://pic.javct.net/poster/06032026/1774847569.jpg,https://javct.net/v/fc2ppv-4870769,60,2026-03-30
SKMJ-731-RM,"Real Request To A Real Elementary School Teacher! Would You Like To Give A Bullied Virgin Boy Some Real Sex Education? His Teacher's Deep Kiss, Breastfeeding Handjob, And Pussy-gazing Will Make His Foreskin Erect! He Even Has Forbidden Sex With His Teacher, Who Kindly Accepts Him By Saying, ""It's A Natural Phenomenon!"" 3 [Uncensored L**ked]",https://pic.javct.net/poster/06032026/1774548559.jpg,https://javct.net/v/skmj-731-rm,243,2026-03-30
TPPN-073,Sweat Sparkling Brown Skin And Love Juice. Uehara Hanakoi,https://pic.javct.net/poster/06032026/1774839908.jpg,https://javct.net/v/tppn-073,120,2026-03-30
MIDD-815-RM,Squirting Tits Maid Slave Sakura Momoka [Uncensored L**ked],https://pic.javct.net/poster/06032026/1774836823.jpg,https://javct.net/v/midd-815-rm,150,2026-03-30
KBI-052-RM,Sweaty And Entwined With Soup That You Forget Your Husband ... Rich Kiss [Nakadashi] Sexual Intercourse. Sweaty Creampie Muddy 3 Production! !! Swan Minami [Uncensored L**ked],https://pic.javct.net/poster/20212011/1637999378.jpg,https://javct.net/v/kbi-052-rm,145,2026-03-30
MKZ-027,Big Ass Too Erotic Black Girls! ! Uehara Hanakoi,https://pic.javct.net/poster/06032026/1774839555.jpg,https://javct.net/v/mkz-027,146,2026-03-30
MIST-075-RM,"Applicants Married Woman That Can Not Be Pregnant Out In The Husband Is The Pies To AV Actor Of The Same B**od Type As The Husband. ""I Do I Not It Bad.Surely, Please I Have No Seed ... So Try Not To My Husband, ""Rei's 24-year-old [Uncensored L**ked]",https://pic.javct.net/poster/06032026/1774836168.jpg,https://javct.net/v/mist-075-rm,160,2026-03-30
MIAA-201-RM,"For Me Who Is Shaken By Her, I'm Ina [Uncensored L**ked]",https://pic.javct.net/poster/20230104/1681182588.jpg,https://javct.net/v/miaa-201-rm,120,2026-03-30
FTN-048-RM,Netra To 20 [Uncensored L**ked],https://pic.javct.net/poster/06032026/1774836878.jpg,https://javct.net/v/ftn-048-rm,135,2026-03-30
CHN-102-RM,"New Absolutely Beautiful Girl, And Then Lend You. ACT.56 Satomi Sakai [Uncensored L**ked]",https://pic.javct.net/poster/06032026/1774836942.jpg,https://javct.net/v/chn-102-rm,130,2026-03-30
PAIS-083-RM,"Compilation Of Super Busty, Busty Working Ladies Who Get All Sloppy At Work. 4 Hours [Uncensored L**ked]",https://pic.javct.net/poster/06032026/1774637515.jpg,https://javct.net/v/pais-083-rm,240,2026-03-30
SSNI-586-RM,Super Alive 121 Times!Convulsions 3238 Times!Onitsu 23739 Piston!3D Natural Hcup Body Eros Awakening [Uncensored L**ked],https://pic.javct.net/poster/06032026/1774836484.jpg,https://javct.net/v/ssni-586-rm,150,2026-03-30
MIDD-817-RM,Yu Minase Summer Gangbang Fucking Crazy [Uncensored L**ked],https://pic.javct.net/poster/06032026/1774836752.jpg,https://javct.net/v/midd-817-rm,120,2026-03-30
NACR-668-RM,I Came Looking For A Male Because I Wanted To Have Sex! Beast Big Tits Bitch Chitose Yuuki [Uncensored L**ked],https://pic.javct.net/poster/20230205/1684555089.jpg,https://javct.net/v/nacr-668-rm,117,2026-03-30
HMPD-10042-RM,Neighbors Cumshot Much Mochu Kinki Onee Sister Coming Inukawa Yuuri [Uncensored L**ked],https://pic.javct.net/poster/06032026/1774835600.jpg,https://javct.net/v/hmpd-10042-rm,183,2026-03-30
SGKI-002-RM,"Self-defense Techniques To Prevent Indecent Acts: ``Don't Show Your Face How You're Feeling.'' If You're Feeling It, You'll Turn On The Thugs! Unresponsive No Matter What You Do [Uncensored L**ked]",https://pic.javct.net/poster/20231011/1698038523.jpg,https://javct.net/v/sgki-002-rm,150,2026-03-30
HBAD-665-RM,My Son's Girlfriend Who Loves Cock Too Much Seduces Me With Big Tits In The House And Sucks It All The Time Shion Yumi [Uncensored L**ked],https://pic.javct.net/poster/20230804/1694056285.jpg,https://javct.net/v/hbad-665-rm,131,2026-03-30
MIAA-200-RM,"I Still Remember The Summer I Went Home After 20 Years, Met My First Love's Daughter, And Fucked Her. She Looked Just Like Her Mother. Mitsuki Nagisa [Uncensored L**ked]",https://pic.javct.net/poster/20212709/1633740276.jpg,https://javct.net/v/miaa-200-rm,118,2026-03-30
JUY-287-RM,A Horny Married Woman Is Seduced By Another Man's Huge Dick Mariko Hibiki [Uncensored L**ked],https://pic.javct.net/poster/20221202/1649812699.jpg,https://javct.net/v/juy-287-rm,120,2026-03-30
GVG-696-RM,True Stories Of A Mamasi*ta [Uncensored L**ked],https://pic.javct.net/poster/20212011/1641285869.jpg,https://javct.net/v/gvg-696-rm,136,2026-03-30
AMBI-126-RM,Small Love Story Between A Runaway Girl And An Older Man Chiharu Sakurai [Uncensored L**ked],https://static.javct.net/poster/ambi-126.jpg,https://javct.net/v/ambi-126-rm,125,2026-03-30
LULU-132-RM,The Best Slut With Big Tits Who Is Just So Easy And Will Let You Titty Fuck Her And Fuck Her Hard In Ways Your Wife Would Never Let You. Momo Minami. [Uncensored L**ked],https://pic.javct.net/poster/20221202/1648888935.jpg,https://javct.net/v/lulu-132-rm,160,2026-03-30
GVG-697-RM,"Shameful Hot Springs Trip, Rika Mari [Uncensored L**ked]",https://pic.javct.net/poster/20222109/1665658459.jpg,https://javct.net/v/gvg-697-rm,118,2026-03-30
ADN-148-US,"An Illicit Top Down Relationship Saeko Matsushita [English Subtitle, Reducing Mosaic]",https://pic.javct.net/poster/20212011/1641029762.jpg,https://javct.net/v/adn-148-us,118,2026-03-30
SHKD-288-RM,"Fucked In Front Of Her Husband - Brother-In-Law's Trap, Yuki Toma [Uncensored L**ked]",https://pic.javct.net/poster/20222109/1666539733.jpg,https://javct.net/v/shkd-288-rm,99,2026-03-30
HBAD-378-RM,"He Wants A Sexy And Young Woman, But It Has To Be A Son's Wife This Horny Father-In-Law Has Tied Up His Daughter-In-Law So He Can Satisfy His Lust On Her Yu Konishi [Uncensored L**ked]",https://pic.javct.net/poster/20221904/1652921546.jpg,https://javct.net/v/hbad-378-rm,120,2026-03-30
JUX-493-RM,My Father's Woman: Yumi Kazama [Uncensored L**ked],https://pic.javct.net/poster/20220707/1659528140.jpg,https://javct.net/v/jux-493-rm,120,2026-03-30
OFJE-376,Yua Mikami Temptation Eros 50 Production 8 Hours,https://pic.javct.net/poster/06032026/1774774317.jpg,https://javct.net/v/ofje-376,480,2026-03-30
FRJA-001,Half Gal Uehara Hanakoi,https://pic.javct.net/poster/06032026/1774772391.jpg,https://javct.net/v/frja-001,240,2026-03-30
SONE-582-SUB,"A student who knows how cute she is is so cunning! I, the homeroom teacher, have had unfaithful sex with her many times because she looked up at me. [English Subtitle]",https://pic.javct.net/poster/20253001/1738866107.jpg,https://javct.net/v/sone-582-sub,130,2026-03-30
WO-002-RM,A Woman Who Sells Sexual Goods A Slobbering Snake-Tongued Tornado Kiss x A Big Tits Sales Lady ... Honoka Tsujii [Uncensored L**ked],https://pic.javct.net/poster/20221904/1651728245.jpg,https://javct.net/v/wo-002-rm,93,2026-03-30
MUDR-014-RM,MISSING GIRLS (Chisato) I Can Never See It Again... What I Saw On That Day... Sora Shiina [Uncensored L**ked],https://pic.javct.net/poster/20220707/1657818308.jpg,https://javct.net/v/mudr-014-rm,117,2026-03-30
JUL-666-RM,Electric Shock Transfer Round 2!! I Was Made To Cum So Hard By A Man I Didn't Want To Be Held By... Rena Kodama [Uncensored L**ked],https://static.javct.net/poster/jul-666.jpg,https://javct.net/v/jul-666-rm,119,2026-03-30
XRW-581-RM,If We're Caught We're In Big Trouble!! Close And Tight Temptation Sex Tsubasa Hachino [Uncensored L**ked],https://pic.javct.net/poster/20221108/1662308566.jpg,https://javct.net/v/xrw-581-rm,152,2026-03-30
AMBI-125-RM,My Secret Love Life With My Homeroom Teacher Mashiro Kisaragi [Uncensored L**ked],https://static.javct.net/poster/ambi-125.jpg,https://javct.net/v/ambi-125-rm,118,2026-03-30
SCPX-259,"The Reputed Beauty Wife In The Neighborhood I Was Always Worried Was Actually A Super Male Woman!While Riding The Husband During The Absence Of Her Husband, She Was Asked To Repeat The Vaginal Cumshot Repeatedly Until She Got Shit Back With A Rubberless Woman On Top Posture! !",https://pic.javct.net/poster/06032026/1774840028.jpg,https://javct.net/v/scpx-259,259,2026-03-30
ZUKO-032,"Us, I Have A Orgy After Work.",https://pic.javct.net/poster/06032026/1774839849.jpg,https://javct.net/v/zuko-032,180,2026-03-30
WANZ-253,French Soap Uehara Hanakoi,https://pic.javct.net/poster/06032026/1774840197.jpg,https://javct.net/v/wanz-253,120,2026-03-30
SCPX-144,SHIBUYA Moth ● Gros Cafe Clerk Purveyor! !The Oil Massage Shop Popular Secret In The Legendary Red Circle Surge In Black Gal World Capstone High Tension In The Ultra-powerful Aphrodisiac Containing Characteristic Oil Use! !Or In About Reason Buttobiiki Eliminate The Storage Body And The Mind Refreshing Rumors Spree Out Spear Want Unlimited Live In And Is A True! ?,https://pic.javct.net/poster/06032026/1774840083.jpg,https://javct.net/v/scpx-144,218,2026-03-30
SCPX-132,Nearby Beauty Gyarumama Was A Bimbo Women ● School Graduate Who Knew Anyone At That Time!Or Rumors Husband And Son Will Be Squeezed Out Of The Raw Sperm Until The Testicles Broke At Any Time Vacuum Your Ma ● Co Ban If You Wait Too Long And The Kudoka Tsu Not Kaware It Comes True?,https://pic.javct.net/poster/06032026/1774839969.jpg,https://javct.net/v/scpx-132,236,2026-03-30
MMUS-025-RM,Behind The Scenes Of The Rumors In The Town Panchira Bar [Uncensored L**ked],https://pic.javct.net/poster/06032026/1774836111.jpg,https://javct.net/v/mmus-025-rm,240,2026-03-30
TPPN-131,Sex Pies Filthy Sweaty That Kuruwasu Blame A Man,https://pic.javct.net/poster/06032026/1774840256.jpg,https://javct.net/v/tppn-131,120,2026-03-30
FC2PPV-4870825,"When I start creampieing a cool beauty who looks like she's a dark person, I can't stand the sight of her being so sweet and full of pleasure, and even if I inseminate her without permission, she's a goddess who forgives me with a smile.",https://pic.javct.net/poster/06032026/1774839727.jpg,https://javct.net/v/fc2ppv-4870825,62,2026-03-30
FC2PPV-4869106,[Shocking Famous Influencer Seeding] A Divine Gal Descends What is the obscene act of a famous influencer who takes her to a love hotel...,https://pic.javct.net/poster/06032026/1774847711.jpg,https://javct.net/v/fc2ppv-4869106,23,2026-03-30
MDBK-306-RM,My Sloppy Female Friend Who Always Provokes Me With Her Panty Shots Unconsciously Collapses Into A Thong Butt That Causes My Reason To Collapse And Go Wild! ! [Uncensored L**ked],https://pic.javct.net/poster/20231011/1697855204.jpg,https://javct.net/v/mdbk-306-rm,150,2026-03-30
MIST-074-RM,To Show Off The Big Penis To Handjob Deriheru Miss Your Touch Ban!As It Is Raw Saddle Where It Became Obsessed With The Big Penis!Fully Voyeur Until Out Rainy Day Raw Medium To Handjob Miss! [Uncensored L**ked],https://pic.javct.net/poster/06032026/1774836225.jpg,https://javct.net/v/mist-074-rm,160,2026-03-30
SDAM-025-RM,Do Not Try To Enter The One Young Man Towel Single Towel Man Hot Water Found In Hakone Onsen? Shame Mission Special Victory 22 Launch SP Using Your Mouth [Uncensored L**ked],https://pic.javct.net/poster/06032026/1774836619.jpg,https://javct.net/v/sdam-025-rm,240,2026-03-30
SAN-093-RM,Sex 6 250 Minutes Of 6 Married Women Cuckolded By Other People's Sticks Other Than Their Husbands [Uncensored L**ked],https://pic.javct.net/poster/20222612/1673924774.jpg,https://javct.net/v/san-093-rm,250,2026-03-30
FC2PPV-4871318,"[No Blowjob] A married woman decided to take off her husband's greengrocer's business, and he made her give him a blowjob until she orgasmed in the shower after the incident.",https://pic.javct.net/poster/06032026/1774839687.jpg,https://javct.net/v/fc2ppv-4871318,11,2026-03-30
FTN-047-RM,I Wanted To Look At The Wife Do Not Know Me ... 28 [Uncensored L**ked],https://pic.javct.net/poster/20250606/1749629647.jpg,https://javct.net/v/ftn-047-rm,120,2026-03-30
TAMO-003-SUB,"I, I'm Sorry A Nasty ...... Iioka Kanako [English Subtitle]",https://pic.javct.net/poster/01202026/1770080161.jpg,https://javct.net/v/tamo-003-sub,140,2026-03-30
NNPJ-308-RM,"Chiaki (22 Years Old), A Modest Local Wife Who Began To Get Interested In Sex After Marrying Her First Experience, Cheated Her For The First Time!First Gonzo!It Took AV Shooting At Home From Me! ! Nampa Japan EXPRESS Vol.85 [Uncensored L**ked]",https://pic.javct.net/poster/20250606/1750031378.jpg,https://javct.net/v/nnpj-308-rm,170,2026-03-30
NGOD-180-RM,Big Penis Incest My Boy's Hard Sledding Slurping Chi  Mother Who Was Taken By Po I ... I Was Squid With My Boy's Cock ... Hana Haruna [Uncensored L**ked],https://pic.javct.net/poster/20220707/1659680952.jpg,https://javct.net/v/ngod-180-rm,120,2026-03-30
SAN-092-RM,My Aunt's Sweaty Passionate Sex That Reminded Me Of A Woman Who Was Held By Her Nephew! / S**ta Chisato [Uncensored L**ked],https://pic.javct.net/poster/20222612/1673924837.jpg,https://javct.net/v/san-092-rm,120,2026-03-30
NACR-669-RM,An Unlucky Beautiful Married Woman Mio Ichijo Was Targeted By A Hit Shop And Paid The Settlement Fee With Her Body [Uncensored L**ked],https://pic.javct.net/poster/20230206/1685935106.jpg,https://javct.net/v/nacr-669-rm,112,2026-03-30
MIMK-026-RM,Transformation Married Liberated Areas Ayano S Hatehana [Uncensored L**ked],https://pic.javct.net/poster/06032026/1774835167.jpg,https://javct.net/v/mimk-026-rm,150,2026-03-30
XMOM-047-RM,Night Celebrity Tall Obscene Married Woman Kanna Asumi [Uncensored L**ked],https://pic.javct.net/poster/06032026/1774835659.jpg,https://javct.net/v/xmom-047-rm,105,2026-03-30
JRZE-292-RM,First-time Filming Of A Married Woman: Yuki Kasuga [Uncensored L**ked],https://pic.javct.net/poster/06032026/1774666976.jpg,https://javct.net/v/jrze-292-rm,135,2026-03-30
NKKD-307-SUB,Crying NTR A Story Where I Was About To Be Transferred Overseas And Had Sex With My Busty Brother's Wife While Crying As I Regretted Parting With Her. Hana Haruna [English Subtitle],https://pic.javct.net/poster/20231011/1699592240.jpg,https://javct.net/v/nkkd-307-sub,120,2026-03-30
KBI-057-RM,[Former Music High School Teacher] The Ultimate Brush Wholesale Of A Beautiful Wife A Beautiful Wife With A Superb Body Gently Guides A Virgin! Ariga Minaho [Uncensored L**ked],https://static.javct.net/poster/kbi-057.jpg,https://javct.net/v/kbi-057-rm,180,2026-03-30
JBD-182-RM,Bondage Slut Body Play Kimika Ichijo [Uncensored L**ked],https://pic.javct.net/poster/06032026/1774803192.jpg,https://javct.net/v/jbd-182-rm,120,2026-03-30
JUY-822-RM,"I'm A Newcomer Who Has Been Scolded By A Woman Boss Who Has Been Working For A Long Time, Maki Tomoda [Uncensored L**ked]",https://pic.javct.net/poster/20240410/1728944543.jpg,https://javct.net/v/juy-822-rm,120,2026-03-30
JUX-563-RM,Housewife Decoy Been Debunked A Distorted Desire Lurking In The Investigation Molester Train  Body  Original Chitose [Uncensored L**ked],https://pic.javct.net/poster/20221108/1661766940.jpg,https://javct.net/v/jux-563-rm,120,2026-03-30
FC2PPV-4870877,Shino (19) 2nd shooting. She has become more slender than the previous shooting. She has sex for the first time in a long time and accepts the semen of a middle-aged man in her vagina and anus.,https://pic.javct.net/poster/06032026/1774838924.jpg,https://javct.net/v/fc2ppv-4870877,86,2026-03-30
FC2PPV-4870849,"[Complete amateur] A refreshing and cute 32-year-old single woman sucks a middle-aged man's thick dick, and after making him cum, she licks his pussy and loves to have intense sex. Her enchanted expression is irresistible.",https://pic.javct.net/poster/06032026/1774847642.jpg,https://javct.net/v/fc2ppv-4870849,58,2026-03-30
FC2PPV-4870876,"[None] The girl who came back ⚪︎ Nama Saki (20 years old) 60cm dildo and demon deepthroat, 3 ass squirts and the toilet is confirmed lol",https://pic.javct.net/poster/06032026/1774847677.jpg,https://javct.net/v/fc2ppv-4870876,41,2026-03-30
FC2PPV-4841602,"[Individual shooting] First come, first served, oil massage SEX titjob with a 2.5-dimensional big-breasted beauty like in a manga [high resolution with bonus]",https://pic.javct.net/poster/06032026/1774838967.jpg,https://javct.net/v/fc2ppv-4841602,61,2026-03-30
FC2PPV-4870718,[No] No-frills naive* Mei-chan #2 Homemade bento park date & immoral creampie sex wearing her favorite band T-shirt [Main story approx. 2 hours 30 minutes],https://pic.javct.net/poster/06032026/1774775077.jpg,https://javct.net/v/fc2ppv-4870718,23,2026-03-30
FC2PPV-4870640,"[Idol SSS class] [Limited quantity, all episodes available for viewing] [Completely secret version] Dedicated to everyone who loves FC2 Tsundere type Kanna-chan, quarter 19-year-old JD shows off her true abomination [Chapter 10]",https://pic.javct.net/poster/06032026/1774774964.jpg,https://javct.net/v/fc2ppv-4870640,100,2026-03-30
FC2PPV-4870750,[No] Innocent and naive* Mei-chan #4 A braless and panty date where she moans and cums raw on a big black dick [Main story approximately 1 hour and 40 minutes] [*Secret bonus and day review bonus included],https://pic.javct.net/poster/06032026/1774762538.jpg,https://javct.net/v/fc2ppv-4870750,28,2026-03-30
FC2PPV-4870360,"First *Experience**pyjpx*jsps ◾️A miraculous close-up shot◾️Big cry◾️Tears◾️The moment of a miraculous first*experience* that endures severe pain◾️You can see the real thing◾️No lies, real mourning.",https://pic.javct.net/poster/06032026/1774755537.jpg,https://javct.net/v/fc2ppv-4870360,254,2026-03-30
FC2PPV-4870539,"[First shot/Individual shot] A neat and clean c**ld./A royal gravure idol with a big face makes her ultimate FC2 debut ❣ A powerful body with huge breasts, obscene areolas, and a big ass ♡ The first raw insertion into her thick pussy and her first creampie ♡ [Bonus: High resolution version] [Main story/No face]",https://pic.javct.net/poster/06032026/1774755835.jpg,https://javct.net/v/fc2ppv-4870539,88,2026-03-30
348NTR-097,"[NTR] Even if I'm wearing the neat underwear my boyfriend likes and smiling, my true nature is this lol. I'm the uterus love girl who loves my dick lol",https://pic.javct.net/poster/06032026/1774755969606.jpg,https://javct.net/v/348ntr-097,66,2026-03-30
