code,title,image_url,page_url,views,date_scraped
JUY-277-RM,A Middle Aged Couple's Love Affair That Starts In The Bathtub The Wet And Wild Room Miyuki Okano [Uncensored L**ked],https://pic.javct.net/poster/20221108/1661969615.jpg,https://javct.net/v/juy-277-rm,116,2026-03-12
JUL-185-US,"A Married Woman Secretary Is Having Sweaty, Kiss-Filled Creampie Sex In The President's Office Nao Jinguji [English Subtitle, Reducing Mosaic]",https://pic.javct.net/poster/20212011/1640274968.jpg,https://javct.net/v/jul-185-us,117,2026-03-12
NGOD-168-RM,"He Was An Old Company Man Who Was Left To Wither In The Office, But When He Shoved His Big Dick Into This Naughty And Haughty Career Woman, She Melted Like Butter In His Hands Mao Hamasaki [Uncensored L**ked]",https://pic.javct.net/poster/20221202/1646376955.jpg,https://javct.net/v/ngod-168-rm,123,2026-03-12
MIAA-099-RM,My Dad Fucked My Faithful Girlfriend And Drove Her Crazy With His G-Spot Press. Sumire Kurokawa [Uncensored L**ked],https://pic.javct.net/poster/20221202/1646654552.jpg,https://javct.net/v/miaa-099-rm,115,2026-03-12
JUL-477-RM,"Madonna Exclusive, Part 2!! Creampie Ban Lifted!! A Mother Made Pregnant By Her Daughter's Boyfriend - Marika Kobayashi [Uncensored L**ked]",https://pic.javct.net/poster/20212011/1638926654.jpg,https://javct.net/v/jul-477-rm,115,2026-03-12
FSDSS-327-RM,My Step-brother Was Away For Three Days. This Is A Record Of Her Moaning And Coming To Life With A Meat Stick Other Than Her Step-Brother's. Kaname Momojiri [Uncensored L**ked],https://pic.javct.net/poster/20212709/1636606722.jpg,https://javct.net/v/fsdss-327-rm,124,2026-03-12
JUY-271-RM,"[Caution Before Viewing] The Worst NTR Story Ever I'm On Post Away From My Family, And I Wanted To Surprise My Wife On Her Birthday By Secretly Coming Home... But Then I Found My Wife Coming Home With My Boss, So I Hid Underneath The Bed And Listened To Them Fuck All Night [Uncensored L**ked]",https://pic.javct.net/poster/20212011/1641470662.jpg,https://javct.net/v/juy-271-rm,119,2026-03-12
FSDSS-326-RM,Looks Like She Likes Me!? Going On A Lovey-dovey Hot Springs Trip With My Company Junior And Shooting My Loads Out In The Water - Momo Honda [Uncensored L**ked],https://pic.javct.net/poster/20212011/1637816059.jpg,https://javct.net/v/fsdss-326-rm,124,2026-03-12
JUL-474-RM,"A Madonna Label Exclusive Mrs. Diamond Hitomi Honda No.2!! She's So Wild, You'll Forget To Breathe, As You Drown In Her Sweet, Dangerous Kisses ... [Uncensored L**ked]",https://pic.javct.net/poster/20212011/1639563961.jpg,https://javct.net/v/jul-474-rm,116,2026-03-12
HODV-21455-RM,Taking A Coworker For Myself During A Company Get Away - The Hottest Young Associate In The Company Goes After The Boss And Has His Way With Her For A Night Full Of Ten Climaxes - Tsubasa Hachino [Uncensored L**ked],https://pic.javct.net/poster/20221202/1645487460.jpg,https://javct.net/v/hodv-21455-rm,120,2026-03-12
VEC-391-RM,"Big Tits Cuckolding - My Best Friend Fucked My Beloved Bride, Fondling Her Massive Tits And Even Cumming Inside Her - Azusa Yagi [Uncensored L**ked]",https://pic.javct.net/poster/20221108/1663635115.jpg,https://javct.net/v/vec-391-rm,105,2026-03-12
WANZ-512-RM,"I'm Going To Have A Baby With My Daughter's Friend, So I Quit Being A Mom. Kaho Shibuya [Uncensored L**ked]",https://pic.javct.net/poster/20212011/1639366338.jpg,https://javct.net/v/wanz-512-rm,146,2026-03-12
JUX-377-RM,The Widow Fucked By Her Father-In-Law. Tied Up In Her Husband's Parents' House... Nana Aida [Uncensored L**ked],https://pic.javct.net/poster/20222109/1664725040.jpg,https://javct.net/v/jux-377-rm,145,2026-03-12
JUL-468-RM,Creampie Sex With My Younger Brother-In-Law At His Bachelor Pad While My Husband's At Work. Miho Aikawa [Uncensored L**ked],https://pic.javct.net/poster/20212011/1638725556.jpg,https://javct.net/v/jul-468-rm,135,2026-03-12
HOMA-017-RM,The Gal Widow: Innocent Wife AIKA Fucked to Service Her Uncle in Front of Husband's Funerary Portrait [Uncensored L**ked],https://pic.javct.net/poster/20221202/1645487518.jpg,https://javct.net/v/homa-017-rm,133,2026-03-12
FSDSS-311-RM,I'll Do It For The Money. My Friend's Girlfriend Finds More Than A Job By Selling Herself For Sex. Kaname Momojiri [Uncensored L**ked],https://pic.javct.net/poster/20212709/1633606225.jpg,https://javct.net/v/fsdss-311-rm,124,2026-03-12
SPRD-1095-RM,Her Husband Doesn't Suspect A Thing... Azusa Yagi [Uncensored L**ked],https://pic.javct.net/poster/20221202/1649725384.jpg,https://javct.net/v/sprd-1095-rm,134,2026-03-12
FSDSS-308-RM,"A Newlywed Returns Home To The Countryside And Has A Reunion With A Neat And Clean Longtime Friend, Leading To A Hot Summer Of Infidelity And Sex. Yui Shirasaka [Uncensored L**ked]",https://pic.javct.net/poster/20212709/1633606282.jpg,https://javct.net/v/fsdss-308-rm,119,2026-03-12
SSNI-547-RM,"""Dear... Please Forgive Me"" Every Time You Were Taking A Bath, For Those 15 Minutes, I Was Always Getting Fucked By your Father-In-Law Nene Yoshitaka [Uncensored L**ked]",https://pic.javct.net/poster/20221202/1646548354.jpg,https://javct.net/v/ssni-547-rm,121,2026-03-12
MIMK-087-RM,Part Time Worker Wife's Lusty Affair ~ Live Action Version ~ Cuckholding Pregnancy Fetish With A Big Titty Big Ass Wife! Yuri Honma [Uncensored L**ked],https://pic.javct.net/poster/20212709/1635481604.jpg,https://javct.net/v/mimk-087-rm,118,2026-03-12
GVH-367-RM,True Mamacita Stories - Kana Morisawa [Uncensored L**ked],https://pic.javct.net/poster/20221202/1645853019.jpg,https://javct.net/v/gvh-367-rm,136,2026-03-12
LULU-102-RM,"Wife With Beautiful Tits Gets A Sexy Oil Treatment From Former Masseuse Father-In-Law, He Teases Her Sticky Erogenous Zone, Cuckholded By Wet Smothering Kisses After She Could Not Bear The Pleasure... Riria Hyodo [Uncensored L**ked]",https://pic.javct.net/poster/20212709/1635594964.jpg,https://javct.net/v/lulu-102-rm,160,2026-03-12
GVG-098-RM,A Son-In-Law After His MILF-In-Law's Obscene Big Tits Azusa Yagi [Uncensored L**ked],https://pic.javct.net/poster/20221904/1652237715.jpg,https://javct.net/v/gvg-098-rm,120,2026-03-12
MDVHJ-019-RM,"While Father Was Away, This Stepmom Decided To Allow Her Horny Stepson To Satisfy His Sexual Desires, And She Knew It Was ""Wrong"", But She Was Drowned In The Pleasures Of Forbidden Sex... [Uncensored L**ked]",https://pic.javct.net/poster/20212011/1639100365.jpg,https://javct.net/v/mdvhj-019-rm,239,2026-03-12
OKAX-559,There Is A Special Beauty Wife's First Slimy Soapland Training 16 People 4 Hours,https://pic.javct.net/poster/06032026/1773278490.jpg,https://javct.net/v/okax-559,240,2026-03-12
FFT-038,"First Wife: A Frustrated Married Woman With Such A Sexy Body That It's A Shame She's Still Working As An Office Lady. Rui, 28 Years Old",https://pic.javct.net/poster/06032026/1773281756.jpg,https://javct.net/v/fft-038,110,2026-03-12
OKAX-558,4 Hours With A Drunk Aunt,https://pic.javct.net/poster/06032026/1773278427.jpg,https://javct.net/v/okax-558,240,2026-03-12
DVDMS-196-RM,"General Males And Females Monitoring Affiliate Negotiations With Men And Women Of Social Work Just Before The End Of AV Train!If Married Woman OL Is With Junior Male Employee And Two People At Love Hotel Forgot Her Husband And Will You Make One Ejaculation 100,000 Yen Continuous Ejaculation Sex! What? 2 4 Combination Cum Shot 13 Shots! [Uncensored L**ked]",https://pic.javct.net/poster/06032026/1773280406.jpg,https://javct.net/v/dvdms-196-rm,240,2026-03-12
SAN-072-RM,A Busty Angel In A White Coat Who Made Her Father-In-Law Cum And Passed Into The Other World / Mitsuki Yuina [Uncensored L**ked],https://pic.javct.net/poster/20221108/1663040837.jpg,https://javct.net/v/san-072-rm,120,2026-03-12
TORG-038-RM,Showa Wife Functional Picture Scroll ~ Bewitching Rogue Ripe Limb Us - [Director Special Edit Edition] [Uncensored L**ked],https://pic.javct.net/poster/06032026/1773280109.jpg,https://javct.net/v/torg-038-rm,240,2026-03-12
MAAN-1155-RM,"[This woman will do anything for the sake of work] Sales department ace married life insurance lady is sold by her boss and seizes a large contract with her angry, aroused, and superb G breasts.She goes crazy in a yukata, steamy, unfaithful entertainment www: Case.9_Mr. Akino (28) [Uncensored L**ked]",https://pic.javct.net/poster/06032026/1772962382693.jpg,https://javct.net/v/maan-1155-rm,90,2026-03-12
JUL-633-RM,Married Woman Gushes Sweat And Bucks Her Hips While She Drains Your Creampie. Kana Mito [Uncensored L**ked],https://static.javct.net/poster/jul-633.jpg,https://javct.net/v/jul-633-rm,155,2026-03-12
JUX-857-RM,My Husband Does Not Know - My Lustful Desires And Secret - Rika Suwon [Uncensored L**ked],https://pic.javct.net/poster/20230302/1680084400.jpg,https://javct.net/v/jux-857-rm,120,2026-03-12
HBAD-641-RM,"Satomi Mioka, A Wife Who Was Sold Her Body In Front Of Her Husband Who Was Looking Into A Forbidden Married Woman Deli [Uncensored L**ked]",https://pic.javct.net/poster/20222311/1670469167.jpg,https://javct.net/v/hbad-641-rm,131,2026-03-12
FJIN-001-RM,"A Hcup Busty Part-time Housewife Who Went On A One-night, Two-day Hot Spring Trip With Male Students From Her Part-time Job Who Are About The Same Age As Her Son Is Kind And Indecisive...We Are All In Love With Rina, A 37-year-old Part-time Housewife. [Uncensored L**ked]",https://pic.javct.net/poster/20231711/1701488755.jpg,https://javct.net/v/fjin-001-rm,168,2026-03-12
NSPS-314-RM,Netora Is Wife Never Seen Desire! Kessakusen [Uncensored L**ked],https://pic.javct.net/poster/06032026/1773280230.jpg,https://javct.net/v/nsps-314-rm,90,2026-03-12
JUL-638-RM,Innocent And Beautiful Wife Gets Ravished By An Older Corrupt Investigator Who Likes To Use His Authority Mikako Horiuchi [Uncensored L**ked],https://static.javct.net/poster/jul-638.jpg,https://javct.net/v/jul-638-rm,135,2026-03-12
SAN-073-RM,The Fugitive Mu**erer Was The Older Brother Of His First Love. / Mitsuki Mei [Uncensored L**ked],https://pic.javct.net/poster/20221108/1663040773.jpg,https://javct.net/v/san-073-rm,120,2026-03-12
NSPS-313-RM,Superb Thick Erotic Video Terrible Kiss Vol.1 [Uncensored L**ked],https://pic.javct.net/poster/06032026/1773280286.jpg,https://javct.net/v/nsps-313-rm,95,2026-03-12
RNA-009-RM,Amateur Bondage And Raw Creampie [Fair-skinned Chubby Meat Toilet Wife Edition] The Chubby Wife From The Neighborhood Was A Filthy Meat Toilet Sow Who Helped Us Clean Up. Narita Kanako [Uncensored L**ked],https://pic.javct.net/poster/06032026/1772989488.jpg,https://javct.net/v/rna-009-rm,140,2026-03-12
SY-220-RM,Dear Four-and-a-half-tatami-mat Wife Satomi-san 36 Years Old ●Amateur Four-and-a-half-tatami-mat Raw Creampie Series Tsumugi Rio [Uncensored L**ked],https://pic.javct.net/poster/06032026/1772989104.jpg,https://javct.net/v/sy-220-rm,100,2026-03-12
MOIL-002-RM,New Forbidden Sex With My Wife's Mother - My Mother-in-Law Is Better Than My Wife After All... Satsuki Kuriyama [Uncensored L**ked],https://pic.javct.net/poster/01202026/1772217473.jpg,https://javct.net/v/moil-002-rm,120,2026-03-12
CHERD-103-RM,"""Would You Mind If Your First Time Was Raw With An Older Woman?"" A Virgin Loses His Virginity To A Married Mature Woman With The Ultimate Sexual Experience - Rieko Hiraoka [Uncensored L**ked]",https://pic.javct.net/poster/06032026/1773165174.jpg,https://javct.net/v/cherd-103-rm,110,2026-03-12
ROE-324-SUB,"""You'll Pay With Your Body..."" A Faithful Wife Becomes A Shoplifter's Surrogate And Obedient Sex Slave Sayaka Minobe [English Subtitle]",https://pic.javct.net/poster/20253001/1740076787.jpg,https://javct.net/v/roe-324-sub,130,2026-03-12
JUL-559-RM,Exclusive Honoka Yonekura Is Getting Sweaty And Seriously Non-Stop Cumming!! Hard And Tight Sex - A Manly Housekeeper Consoles A Woman Mourning Her Failing Marriage With At-Home Adultery Sex - [Uncensored L**ked],https://static.javct.net/poster/jul-559.jpg,https://javct.net/v/jul-559-rm,115,2026-03-12
ABF-328,Saturday Morning Fucking With A Morning Erection. Remu Suzumori,https://pic.javct.net/poster/06032026/1773281950.jpg,https://javct.net/v/abf-328,135,2026-03-12
ABF-330,Takimoto Shizukuha Was Left Behind In A Mahjong Parlor Full Of Men.,https://pic.javct.net/poster/06032026/1773281820.jpg,https://javct.net/v/abf-330,120,2026-03-12
RKI-613-RM,Super Feel Good Impregnating Sex With The Number One Cum Lover In The World! Mei Satsuki [Uncensored L**ked],https://static.javct.net/poster/rki-613.jpg,https://javct.net/v/rki-613-rm,126,2026-03-12
KUSE-019-RM,"Woman Has A Bad Habit Tempting With Her Holes When She Wants It! Thick Bitch In Hole Temptation Reverse Pick Up Everywhere, Jun Asami [Uncensored L**ked]",https://static.javct.net/poster/1627973553.jpg,https://javct.net/v/kuse-019-rm,141,2026-03-12
FSDSS-342-RM,"Ever Since That Day, When I Partied Too Hard, And He Ravaged Me ... I Would Get Wet, As Soon As Our Eyes Met. She Hated Her Boss, But She Was Hooked On His Cock. Lulu Amakuni [Uncensored L**ked]",https://pic.javct.net/poster/20212011/1640234443.jpg,https://javct.net/v/fsdss-342-rm,120,2026-03-12
FNS-167-RM,"A Big-breasted Female College Student Couldn't Stand The Peeing Orgasm That Kneaded Her Private Parts And Fo**ed Her Squirt Out, So She Was Seduced By An Unscrupulous Masseuse. Misaki Soka [Uncensored L**ked]",https://pic.javct.net/poster/06032026/1773184434.jpg,https://javct.net/v/fns-167-rm,120,2026-03-12
FSDSS-340-RM,The Convenience Store Boss No One Likes Caught Right in the Middle of a Circle Jerk...Gangbanged by All the Part Time Employees Until She Came Hard. [Uncensored L**ked],https://pic.javct.net/poster/20212011/1640234501.jpg,https://javct.net/v/fsdss-340-rm,124,2026-03-12
FNS-173-RM,Sensitive Pussy Is At Its Limit...! Cunnilingus Peeing School Beautiful Girl Rui Shinomiya [Uncensored L**ked],https://pic.javct.net/poster/06032026/1773095690.jpg,https://javct.net/v/fns-173-rm,130,2026-03-12
HNAMH-019-RM,Natsu Shibuya [Uncensored L**ked],https://pic.javct.net/poster/20252204/1747197838.jpg,https://javct.net/v/hnamh-019-rm,56,2026-03-12
JUX-352-RM,Violated In Our New Home - Completely Dominated In The 3 Days While Her Husband Was Away - Nana Aida [Uncensored L**ked],https://pic.javct.net/poster/20221202/1647866764.jpg,https://javct.net/v/jux-352-rm,117,2026-03-12
FSDSS-341-RM,"""The Rumors Are True That This Nurse Does Cum Control Too..."" Can't Experience This During A Normal Hospital Visit. Special Private Room At A Hospital Somewhere. Kaname Momojiri [Uncensored L**ked]",https://pic.javct.net/poster/20212011/1639025858.jpg,https://javct.net/v/fsdss-341-rm,124,2026-03-12
JUY-274-RM,This Is My Identity In The Afternoon Reika Hashimoto Exclusive Video #3 Her First Drama!! <> The Beautiful Face Of A Housewife In The Afternoon!! [Uncensored L**ked],https://pic.javct.net/poster/20221108/1661934220.jpg,https://javct.net/v/juy-274-rm,115,2026-03-12
KUSE-018-RM,A Real-Life Muscle-Bound Beautiful Girl You*uber Is Getting Her First Raw Creampie! She Got Into Powerful Position To Receive Real Sperm Injected Deep Into Her Pussy!! Yota Chan [Uncensored L**ked],https://static.javct.net/poster/1623728099.jpg,https://javct.net/v/kuse-018-rm,123,2026-03-12
LULU-116-RM,"While My Girlfriend Was Away For 3 Days, I Went To A Rejuvenation Massage Parlor And Ordered The Most Popular Girl There And She Was A Hot Elder Sister Type Who Gave Me A Sweet Massage And So Much Nookie That My C*ck Went Crazy Sakura Tsuji [Uncensored L**ked]",https://pic.javct.net/poster/20212011/1641095387.jpg,https://javct.net/v/lulu-116-rm,160,2026-03-12
KUSE-017-RM,"If You're In The Mood For Fucking, Get Some Instant Pussy! Bust: 100cm x Hips: 100cm This Currently Active Office Lady Is A Big Hole Natural Airhead With A Voluptuous Body And She's Making Her Adult Video Debut!! A Natural Born Bitch Jun Asami Her Adult Video Debut [Uncensored L**ked]",https://static.javct.net/poster/1625550393.jpg,https://javct.net/v/kuse-017-rm,121,2026-03-12
JUL-632-RM,"Passionate Kissing And Sex Of A Rabbit-like Married Woman, Released Into The Wild After One Month Of Abstinence. Iori Takahira [Uncensored L**ked]",https://static.javct.net/poster/jul-632.jpg,https://javct.net/v/jul-632-rm,148,2026-03-12
MIAA-106-RM,"I Just Got My First Girlfriend, So I Decided To Practice Sex And Cumming Inside With My C**ldhood Friend: Yui Nagase [Uncensored L**ked]",https://pic.javct.net/poster/20220707/1659022135.jpg,https://javct.net/v/miaa-106-rm,119,2026-03-12
FNS-167,"A Big-breasted Female College Student Couldn't Stand The Peeing Orgasm That Kneaded Her Private Parts And Fo**ed Her Squirt Out, So She Was Seduced By An Unscrupulous Masseuse. Misaki Soka",https://pic.javct.net/poster/06032026/1773184434.jpg,https://javct.net/v/fns-167,120,2026-03-12
200GANA-3247,"""I'm going to cum in seconds!"" Chico Ai, who is far beyond the imagination of a perverted JD who claims to have the biggest orgasm in her life and calls herself a blowjob lover, keeps saying ""I'm going to cum in seconds"" and takes it all the way to the back of her throat and fascinates her with her soft F-pie voice. From there, she's constantly being attacked and goes into an ascension state fever time. Here's the superlative of erotic cuteness. In the room of a seasoned pick-up artist, hidden sex footage 409",https://pic.javct.net/poster/06032026/1773290513162.jpg,https://javct.net/v/200gana-3247,68,2026-03-12
200GANA-3245,"[J cup] Encounter rate 0.00001% Erotic, huge breasts All of the big breasted older sisters who tend to actively brandish their naughty bodies and have sex - mainly the breasts - and massage them as much as you like to flatter them. Seriously soft girl, first shot 2197",https://pic.javct.net/poster/06032026/1773290655405.jpg,https://javct.net/v/200gana-3245,69,2026-03-12
10-031226-01,Asia Girl's Portrait Collection: Banban,https://pic.javct.net/poster/06032026/1773292671.jpg,https://javct.net/v/10-031226-01,66,2026-03-12
NNPJ-281-RM,Active Female College Student Only! Friendship VS Sexual Desire Male And Female Friends Challenge Closed-room Erotic Extreme Photography Mission! Two People Who Can Not Suppress Muramura Will Do SEX With A Cum Shot! What?Freaky Tension Monitoring! [Uncensored L**ked],https://pic.javct.net/poster/10232025/1764587672.jpg,https://javct.net/v/nnpj-281-rm,160,2026-03-12
200GANA-3239,"A beautiful big-breasted K-cup daddy who has picked up girls has turned into a daddy who has cried countless tears of regret.The beautiful big-breasted daddy's boobs sway every time he thrusts into a girl, and it's a real hit, first shot 2192",https://pic.javct.net/poster/06032026/1773290861801.jpg,https://javct.net/v/200gana-3239,60,2026-03-12
KTKC-068,A Minato City-conscious Girl Who Aims At Only Celebrities With Huge Breasts As A Weapon And Drinks Glamor Glamorous I-cup Erina Kase Erina,https://pic.javct.net/poster/06032026/1773278363.jpg,https://javct.net/v/ktkc-068,125,2026-03-12
FCH-119-RM,[Distribution only] Mubobi Movie 3 [Uncensored L**ked],https://pic.javct.net/poster/06032026/1773164826702.jpg,https://javct.net/v/fch-119-rm,173,2026-03-12
MIST-058-RM,"If You Can Call Us, Us With Your Temper Big Tits College Student In Your Home As A ""home Drinking Companion""!Their High Spirits It 's Your Touch Ban Rules Make Me Until Cum Rainy Day To Me Show You Drunk And Boobs .... [Uncensored L**ked]",https://pic.javct.net/poster/06032026/1773280587.jpg,https://javct.net/v/mist-058-rm,145,2026-03-12
PGD-494-RM,~ BIERA ~ KAORI Naked Pictures And 3D [Uncensored L**ked],https://pic.javct.net/poster/06032026/1773281025.jpg,https://javct.net/v/pgd-494-rm,300,2026-03-12
MOGK-003-RM,"A G-cup Peeing Small Fry Pussy Office Lady Is Made Into A Swamp, Impregnated, And Brainwashed Into A Hole Doll [Uncensored L**ked]",https://pic.javct.net/poster/01202026/1772217536.jpg,https://javct.net/v/mogk-003-rm,106,2026-03-12
MIST-055-RM,Busty Wife Yamaguchi Aoi 32-year-old To Have Sex In Front Of Her Husband's Eyes Boss To The Body Is Starting To Throb That To Shield The Promotion Of Husband Looming A Physical Relationship [Uncensored L**ked],https://pic.javct.net/poster/06032026/1773280642.jpg,https://javct.net/v/mist-055-rm,160,2026-03-12
SOE-791-RM,Big Shameless Ruri Saijo Reporter [Uncensored L**ked],https://pic.javct.net/poster/20222311/1669903009.jpg,https://javct.net/v/soe-791-rm,120,2026-03-12
NACR-651-RM,Customer Satisfaction NO.1! Super Hard To Reservation Colossal Milking Men's Este Chitose Yuuki [Uncensored L**ked],https://pic.javct.net/poster/20230302/1679282244.jpg,https://javct.net/v/nacr-651-rm,126,2026-03-12
MIGD-501-RM,Reminiscence - Azusa Nagasawa - Investigators Tentacle 2 Hole [Uncensored L**ked],https://pic.javct.net/poster/06032026/1773280350.jpg,https://javct.net/v/migd-501-rm,120,2026-03-12
EMBZ-340-RM,"[Housewife's Naughty Live Experience] True Story! Real Sex Case Files Of Women - Real Documentary Situation #A Busty Mother Who Is Fo**ed To Appear In A Video In Front Of Her Son Who Can't Repay A Huge Debt To A Loan Shark And Despite Her Resistance, Ends Up In An Incestuous Threesome And Raw Creampie R**e! Mikoshiba Mika [Uncensored L**ked]",https://pic.javct.net/poster/01202026/1772385520.jpg,https://javct.net/v/embz-340-rm,130,2026-03-12
FC2PPV-4861832,Case #123: An amateur came to do naughty things with her face exposed. Sara-chan (22) was wearing sexy crimson underwear that matched her long black-haired JD.,https://pic.javct.net/poster/06032026/1773278041.jpg,https://javct.net/v/fc2ppv-4861832,50,2026-03-12
FC2PPV-4861874,"*Demon [face exposure] I trained a novice 19-year-old and presented her to Legend Jiro, and confirmed her dark history by thrusting her uterus and creampieing her inside her vagina.",https://pic.javct.net/poster/06032026/1773277822.jpg,https://javct.net/v/fc2ppv-4861874,55,2026-03-12
KTRA-777-RM,Naughty Little Devil Insemination 2 4 Hours [Uncensored L**ked],https://pic.javct.net/poster/06032026/1772851695.jpg,https://javct.net/v/ktra-777-rm,241,2026-03-12
T28-641-RM,Panchira Temptation To Provoke Me When My House Is Occupied By A Beautiful Girl In My Class [Uncensored L**ked],https://pic.javct.net/poster/20230205/1685072744.jpg,https://javct.net/v/t28-641-rm,120,2026-03-12
CAWD-741-US,"Licking My Anus, My Father-in-law's Twisted Sexual Education, Yuuhi Shitara [English Subtitle, Reducing Mosaic]",https://pic.javct.net/poster/20240410/1730435924.jpg,https://javct.net/v/cawd-741-us,120,2026-03-12
MIGD-464-RM,FUCK Anal Bukkake! Alice (Alice Suzuki) [Uncensored L**ked],https://pic.javct.net/poster/20242012/1737894296.jpg,https://javct.net/v/migd-464-rm,120,2026-03-12
RKI-611-RM,This Woman Is A Sex Monster Model Physique Porn Video Discovery Of The Ultimate Sexy And Beautiful Amateur Noa [Uncensored L**ked],https://static.javct.net/poster/rki-611.jpg,https://javct.net/v/rki-611-rm,175,2026-03-12
KTRA-586-RM,"When I Showed Off My Erect Penis To My Adolescent Sister, The Atmosphere Got Erotic, So I Asked Her If She Wanted To Have Sex.Misu Takeuchi [Uncensored L**ked]",https://pic.javct.net/poster/20231711/1700882469.jpg,https://javct.net/v/ktra-586-rm,133,2026-03-12
MKON-096-RM,"When I Let A Cuckold Take Over My Beloved Girlfriend, She Awakened Her Masochistic Attributes And Became Addicted To Hard Fucking That Made Her Squirt And C**ke Her.Uta Hibino [Uncensored L**ked]",https://pic.javct.net/poster/20231711/1701487158.jpg,https://javct.net/v/mkon-096-rm,126,2026-03-12
KTRA-587-RM,Started Working As A Dad. It's Time To Sell... Now Is The Time To Eat Mai Arisu [Uncensored L**ked],https://pic.javct.net/poster/20231711/1700884397.jpg,https://javct.net/v/ktra-587-rm,127,2026-03-12
FC2PPV-4862115,"207 The cash-strapped beauty washed up at a dark part-time job called FC2 AV, and it was during the second time. ♡ Bonus: Face exposed and uncensored",https://pic.javct.net/poster/06032026/1773277870.jpg,https://javct.net/v/fc2ppv-4862115,71,2026-03-12
STSK-217-RM,Neighbor Gacha Explosion: Hysterical Futon Beating Auntie Keeps Making Noise - Huge Dick Punishment [Uncensored L**ked],https://pic.javct.net/poster/06032026/1772818564.jpg,https://javct.net/v/stsk-217-rm,197,2026-03-12
FC2PPV-4861873,"[First shot] I rented a receptionist at a rental car shop for a day, and she had a divine style. She was delighted with her beautiful ass, and was very excited as she squirted for the first time.",https://pic.javct.net/poster/06032026/1773277845.jpg,https://javct.net/v/fc2ppv-4861873,87,2026-03-12
APGH-053-RM,"""My Dick Feels So Good!"" Dripping With Real Juice And Continuous Orgasms! Delicious With A Smile! Anal Licking Perverted Service After School Beautiful Girl And Love Sex Date Sakuraba Nina [Uncensored L**ked]",https://pic.javct.net/poster/06032026/1773165301.jpg,https://javct.net/v/apgh-053-rm,154,2026-03-12
FC2PPV-2936517,"A limited release of an overwhelmingly beautiful girl. The first and last glimpse of the work!! In addition to the main story shot with a cameraman, a long version of the miraculous [gonzo] is included as a special bonus.",https://pic.javct.net/poster/06032026/1773268893.jpg,https://javct.net/v/fc2ppv-2936517,70,2026-03-12
FC2PPV-4861383,"Sayuri's wife, who can't stand the lack of sex, calls me and gradually becomes a sex toy - complete version of her thin-faced mosaic",https://pic.javct.net/poster/06032026/1773277689.jpg,https://javct.net/v/fc2ppv-4861383,59,2026-03-12
FC2PPV-4861014,[Uncensored]**pyjpx*jsps The former CA beautiful celebrity wife has extremely erotic and intense sex! She holds the lust-covered cock deep in her vagina and has crazy continuous pleasurable sex!!,https://pic.javct.net/poster/06032026/1773277797.jpg,https://javct.net/v/fc2ppv-4861014,51,2026-03-12
FC2PPV-4862142,[Individual shooting] **pyjpx*jsps Carnivorous gravure big breasts 27 years old 2 Beautiful woman who jerks raw cock with her erotic H cup pussy [Full face exposed],https://pic.javct.net/poster/06032026/1773277958.jpg,https://javct.net/v/fc2ppv-4862142,40,2026-03-12
