code,title,image_url,page_url,views,date_scraped
SSNI-580-RM,This Tiny Girlfriend Is Riding Her Horse-Hung Friend And Getting Fucked To Kingdom Cum Miharu Usa [Uncensored L**ked],https://pic.javct.net/poster/20221202/1648948913.jpg,https://javct.net/v/ssni-580-rm,119,2026-03-27
XVSR-103-RM,An Erotic Novel My Son's Lover - A Lady - Mami Nagase [Uncensored L**ked],https://pic.javct.net/poster/20220406/1657148931.jpg,https://javct.net/v/xvsr-103-rm,124,2026-03-27
DTKM-029-RM,"Immoral, Fakecestuous Neighborhood Stepmother And Son Swap - I'll Let You Fuck My Stepmom, So Let My Fuck Yours. Shinobu Igarashi Yuriko Shiomi [Uncensored L**ked]",https://pic.javct.net/poster/20220406/1655685040.jpg,https://javct.net/v/dtkm-029-rm,201,2026-03-27
MEYD-664-US,"Goro Tameiki 15-Year Anniversary Collaboration Part 3 - I Went To A Massage Parlor Where They Weren't Allowed To Put Out And Discovered The Uppity Married Woman Next Door Working There, So I Made Her Take My Creampie! After That She Became My Obedient Sex Doll Tsumugi Akari [English Subtitle, Reducing Mosaic]",https://static.javct.net/poster/meyd-664.jpg,https://javct.net/v/meyd-664-us,120,2026-03-27
DTKM-028-RM,"Immoral, Fakecestuous Neighborhood Stepmother And Son Swap - I'll Let You Fuck My Stepmom, So Let My Fuck Yours. Miho Sakaki Towako Kirishima [Uncensored L**ked]",https://pic.javct.net/poster/20212011/1643510688.jpg,https://javct.net/v/dtkm-028-rm,200,2026-03-27
NGOD-173-RM,"The Beautiful New Mother Who Lives Next Door Suddenly Hit Me With A Slut Attack, And Although I'm A Gloomy Boy, She Milked Me Of Every Last Drop Of My Semen. Sumire Mizukawa [Uncensored L**ked]",https://pic.javct.net/poster/20221904/1651814520.jpg,https://javct.net/v/ngod-173-rm,125,2026-03-27
NSPS-456-RM,"Giving In To R**e... Prim, Proper Married 44-Year-Old Rie Nishina [Uncensored L**ked]",https://pic.javct.net/poster/20212011/1640937266.jpg,https://javct.net/v/nsps-456-rm,91,2026-03-27
NSPS-447-RM,My First Cuckolding 3 I Want To Be Taken Away By Creepy Men Sana Mizuhara [Uncensored L**ked],https://pic.javct.net/poster/20221108/1661476382.jpg,https://javct.net/v/nsps-447-rm,91,2026-03-27
NDRA-077-RM,A Married Woman Became Her Neighbor's Mistress 28 - Kanna Misaki [Uncensored L**ked],https://pic.javct.net/poster/20212011/1641204067.jpg,https://javct.net/v/ndra-077-rm,122,2026-03-27
FC2PPV-4868343,"[None] [Chapter 4 of Picking Up Girls in the City] X Catch a beautiful married woman near Central Park and have sex with her immediately. Two white men and a married woman with beautiful breasts and a big ass. They are made to understand with the ekiben on the back, and two big cocks are continuously inserted into them, causing them to scream and orgasm with hell bonus.",https://pic.javct.net/poster/06032026/1774329062.jpg,https://javct.net/v/fc2ppv-4868343,56,2026-03-27
JUY-983-RM,Countdown to Creampie. Leona Kirishima [Uncensored L**ked],https://pic.javct.net/poster/20221202/1646702625.jpg,https://javct.net/v/juy-983-rm,118,2026-03-27
JUY-368-RM,"I Was Continuously R**ed By My Husband's Boss, And On The 7th Day, I Lost My Mind... Mako Oda [Uncensored L**ked]",https://pic.javct.net/poster/20212011/1640937083.jpg,https://javct.net/v/juy-368-rm,115,2026-03-27
PRED-379-SUB,"When My Husband was Away, My Father-in-Law I Hate Made Me Cum Like Never Before...Luna Tsukino [English Subtitle]",https://pic.javct.net/poster/20212011/1644559936.jpg,https://javct.net/v/pred-379-sub,119,2026-03-27
SSIS-231-US,"Younger Man Unable to Resist Tempting Posing of 8-Headed Beautiful-Legged Married Woman in Far Window After Moving Home! Marin Hinata [English Subtitle, Reducing Mosaic]",https://pic.javct.net/poster/20212709/1636093523.jpg,https://javct.net/v/ssis-231-us,119,2026-03-27
NGOD-171-RM,"The Woman From The Convenience Store Headquarters, 11. Sarina Momonaga [Uncensored L**ked]",https://pic.javct.net/poster/20221904/1651814576.jpg,https://javct.net/v/ngod-171-rm,120,2026-03-27
GNAX-017-RM,New Intruder Ai Mukai [Uncensored L**ked],https://pic.javct.net/poster/20212709/1633769550.jpg,https://javct.net/v/gnax-017-rm,105,2026-03-27
HOMA-093-RM,"I'm Working As A Private Tutor For My Girlfriend's Little Sister (A Neat And Clean J*), But... The Truth Is That She's An Orgasmic Bitch, And Secretly Hitting Me With Siren Reverse NTR Plays When My Girlfriend's Not Looking Yui Nagase [Uncensored L**ked]",https://pic.javct.net/poster/20221108/1660784835.jpg,https://javct.net/v/homa-093-rm,121,2026-03-27
NGOD-170-RM,I Got Fingered By My Husband's Mean Boss... Nene Tanaka [Uncensored L**ked],https://pic.javct.net/poster/20221202/1649409013.jpg,https://javct.net/v/ngod-170-rm,147,2026-03-27
JUY-938-RM,"""My Wife Received Another Suspicious Letter..."" A Married Woman Who Invites Chance Into Her Life - Ai Mukai [Uncensored L**ked]",https://pic.javct.net/poster/20212011/1639973476.jpg,https://javct.net/v/juy-938-rm,120,2026-03-27
JUY-505-RM,Up Close And Personal Sex My Neighbor And I Are Committing Hungry And Ravenous Double Adultery Yuka Oshima [Uncensored L**ked],https://pic.javct.net/poster/20221202/1647503902.jpg,https://javct.net/v/juy-505-rm,120,2026-03-27
SCD-198-RM,She's Good At Getting Fucked A Bus Tour Guide In A Miniskirt Arisa Hanyu [Uncensored L**ked],https://pic.javct.net/poster/20212709/1634400573.jpg,https://javct.net/v/scd-198-rm,122,2026-03-27
JUX-865-RM,But I Still Love You. Nozomi Tanihara [Uncensored L**ked],https://pic.javct.net/poster/20221202/1646177860.jpg,https://javct.net/v/jux-865-rm,119,2026-03-27
JUL-651-RM,"A Shocking Transfer No.2!! Her First True NTR Video!! Husband-And-Wife Swapping NTR Shocking Infidelity Videos Of My Wife And A Friend, Fucking By The Window Rinka Tahara [Uncensored L**ked]",https://static.javct.net/poster/jul-651.jpg,https://javct.net/v/jul-651-rm,120,2026-03-27
PRED-362-US,"My Wife And I Are Bored Of Each Other So Tempted By Karen (Step Sister) And Creampie Her Again And Again. Karen Yuzurihara [English Subtitle, Reducing Mosaic]",https://pic.javct.net/poster/20212011/1639724395.jpg,https://javct.net/v/pred-362-us,121,2026-03-27
SIRO-5536,"A 24-year-old experienced cheerleader who has encouraged Sumireto and brought smiles to her face, is now on stage to be moved by pleasure. She is nervous about her first photo shoot, but she is at the mercy of the actor's technique, raises her voice, shakes her G-cup, and moans like cheers when she is poked by the window. From cheering to the subject, she exposes her instincts as a woman. [First shot] AV application online AV experience shooting 2426",https://pic.javct.net/poster/06032026/1774586306145.jpg,https://javct.net/v/siro-5536,65,2026-03-27
SIRO-5530,A love cup I cup sex exploration story of a girl with fluffy and fluffy big breasts. She actively seeks kisses and squirts over and over again in pleasure. Her hips tremble as she squirts and ascends to heaven. [First shot] AV application online AV experience shooting 2421,https://pic.javct.net/poster/06032026/1774586584158.jpg,https://javct.net/v/siro-5530,66,2026-03-27
SIRO-5528,"[Model figure x unstoppable sexual desire exploration] 170cm slender beautiful wife Maika (31) appears on Amateur TV She has erogenous zones all over her body, and she actively opens her instincts in front of the camera. Her mature sensitivity and endless curiosity create an intense adult experience. [First shot] AV application online AV experience shooting 2411",https://pic.javct.net/poster/06032026/1774586725174.jpg,https://javct.net/v/siro-5528,69,2026-03-27
SIRO-5523,"Those G-cup breasts are saying something... ""...let me cum, let me cum..., let me cum even more."" I'm so pregnant. Her big breasts are swaying in the missionary position, cowgirl position, and I'm going to fuck her with everything. She's a lewd-loving erotic woman who reacts twitchingly to a light feather touch. Even a person like this can become a CA... (sweat) [First shot] AV application online AV experience shooting 2415",https://pic.javct.net/poster/06032026/1774587081427.jpg,https://javct.net/v/siro-5523,63,2026-03-27
FC2PPV-4869259,"[Individual shooting outdoor blowjob & sex] <Big breasted perverted wife> Former CA's fleshy body! Big nipples! Sukehira pussy!! This mature woman's cock sucking, piston cowgirl position, and a-face are irresistible!!",https://pic.javct.net/poster/06032026/1774573891.jpg,https://javct.net/v/fc2ppv-4869259,75,2026-03-27
FC2PPV-4868456,[Uncensored] Raw sex with beautiful big breasts ⅹ beautiful butt ⅹ shaved ♡ erotic body Chikako,https://pic.javct.net/poster/06032026/1774585377.jpg,https://javct.net/v/fc2ppv-4868456,54,2026-03-27
SIRO-5521,"I want to make my sex friend jealous, so I appear in an AV... A beautiful woman who landed in a port town, let me release her love juice into the port? She wets her pussy with a cunnilingus, and it's ready for immediate insertion. I give her a hard piss to a beautiful woman, and she screams. [First shot] AV application online AV experience shooting 2406",https://pic.javct.net/poster/06032026/1774587221635.jpg,https://javct.net/v/siro-5521,60,2026-03-27
200GANA-3349-RM,"A girl who likes the outdoors is teased with an active toy and a dick at the same time, and she cries out loud. In the sex room of a seasoned pick-up artist, she is taken in and secretly filmed for sex 434 [Uncensored L**ked]",https://pic.javct.net/poster/06032026/1774421707580.jpg,https://javct.net/v/200gana-3349-rm,67,2026-03-27
BF-567-US,"When My Girlfriend Was Away On A Family Trip For 4 Days, I Went Crazy With Creampies On Her Elder Sister - Saeko Matsushita [English Subtitle, Reducing Mosaic]",https://pic.javct.net/poster/20212011/1641429169.jpg,https://javct.net/v/bf-567-us,170,2026-03-27
LUCY-025-RM,"Big-breasted Men's Beauty Salon: Be Careful Not To Pull Out Too Much! Close Contact Service From A Frustrated Beauty, Ayase Maina [Uncensored L**ked]",https://pic.javct.net/poster/06032026/1774416100.jpg,https://javct.net/v/lucy-025-rm,124,2026-03-27
SIRO-5540,"[Former underground idol] 22 years old, ascended to heaven after being licked thoroughly by the untapped destructive power of her G-cup body. At night, her cute smile turned into a lewd and erotic face. [First shot] AV application online AV experience shooting 2432",https://pic.javct.net/poster/06032026/1774586023490.jpg,https://javct.net/v/siro-5540,66,2026-03-27
CHN-135-RM,"New Amateur Daughter, And Then Lend You. VOL.64 Amane Quiet [Uncensored L**ked]",https://pic.javct.net/poster/06032026/1774577512.jpg,https://javct.net/v/chn-135-rm,135,2026-03-27
TKD-049-RM,This Is Japanese Hospitality - The Landlady's Super Erotic Techniques [Uncensored L**ked],https://pic.javct.net/poster/20231011/1699069062.jpg,https://javct.net/v/tkd-049-rm,135,2026-03-27
MFC-357-RM,"Obedient college student whose pussy is conveniently used × first time sex, exciting SM play close-up of the private part makes me feel embarrassed... But the pleasure wins and it's natural to climax, and the second round of creampie from raw dick insertion is even more powerful SM play with restraints [Sakura (university student)] [Uncensored L**ked]",https://pic.javct.net/poster/06032026/1774421640726.jpg,https://javct.net/v/mfc-357-rm,74,2026-03-27
CEMD-822-RM,"Shame, Insult, Wearing Vibrator, Downtown Date! 38 Tsukada Shiori [Uncensored L**ked]",https://pic.javct.net/poster/06032026/1774416227.jpg,https://javct.net/v/cemd-822-rm,168,2026-03-27
420HPT-047-RM,"Saya (28) Amateur Hoi Hoi, Amateur Hoi Hoi Pet, Amateur, Beautiful Girl, Big Breasts, Super Breasts, Big Butt, Masochist Woman, Sex Friend, Jumping, Outdoors, Shame, Toys, Creampie, Gonzo, Documentary [Uncensored L**ked]",https://pic.javct.net/poster/06032026/1774421571956.jpg,https://javct.net/v/420hpt-047-rm,109,2026-03-27
HZGD-262-RM,"""I'm Sorry For You..."" I'm Being Inseminated And Creampied By My Reluctant Father-in-law On A Dangerous Day Of Pregnancy... Chinamin [Uncensored L**ked]",https://pic.javct.net/poster/20231011/1698984660.jpg,https://javct.net/v/hzgd-262-rm,131,2026-03-27
XVSR-106-RM,Illegal Milk G Hoshii Laughs [Uncensored L**ked],https://pic.javct.net/poster/06032026/1774576731.jpg,https://javct.net/v/xvsr-106-rm,120,2026-03-27
GVG-690-RM,BDSM Training Exercise Volunteer Hamasaki Masa [Uncensored L**ked],https://pic.javct.net/poster/06032026/1774576489.jpg,https://javct.net/v/gvg-690-rm,135,2026-03-27
JUL-662-RM,"Newbies Of Madonna's Exclusive Talents. Wide-eyed With Arousal, Tongues Intertwining, Intense Kissing And Sex- Ema Kishi [Uncensored L**ked]",https://static.javct.net/poster/jul-662.jpg,https://javct.net/v/jul-662-rm,120,2026-03-27
ALDN-251-RM,"At That Time, My Mother-in-law Invited Me... Yoshii Miki [Uncensored L**ked]",https://pic.javct.net/poster/20231711/1702099922.jpg,https://javct.net/v/aldn-251-rm,105,2026-03-27
SSNI-582-RM,A Large Amount Of Oil Covered Black Glow Whip Whip Body Warps Brilliant Breasts Brun Brun Sensitivity Awakening Slimy Massage Yubi Oni [Uncensored L**ked],https://pic.javct.net/poster/06032026/1774577099.jpg,https://javct.net/v/ssni-582-rm,150,2026-03-27
PKPD-266-RM,"A Simple Job Where You Just Have To Cum Inside Her. F-cup Daddy Nursing Student Ayano, 20 Years Old, Ayano Ozawa. [Uncensored L**ked]",https://pic.javct.net/poster/20231011/1699069464.jpg,https://javct.net/v/pkpd-266-rm,140,2026-03-27
ROYD-004-RM,This Stepbrother And Stepsister Will Fight In Front Of Their Parents But Behind Their Backs They'll Be Fucking Their Brains Out! Noa Shiina [Uncensored L**ked],https://pic.javct.net/poster/20221202/1648981214.jpg,https://javct.net/v/royd-004-rm,141,2026-03-27
AMBI-122-RM,My Secret Married Love Life With My Homeroom Teacher Ichika Matsumoto [Uncensored L**ked],https://static.javct.net/poster/ambi-122.jpg,https://javct.net/v/ambi-122-rm,118,2026-03-27
JUL-434-SUB,You Really Want An Old Cougar Like Me...? - Alone With Her Nephew This Lusty MILF Craves Passionate Adultery - Maki Hojo [English Subtitle],https://pic.javct.net/poster/20212011/1639188426.jpg,https://javct.net/v/jul-434-sub,120,2026-03-27
VEC-411-RM,"Mom's Best Friend, Ai Mukai [Uncensored L**ked]",https://pic.javct.net/poster/20212011/1639100721.jpg,https://javct.net/v/vec-411-rm,112,2026-03-27
SPRD-644-RM,"My Stepmother, Is Way Better Than My Wife... Mari Yonezaki [Uncensored L**ked]",https://pic.javct.net/poster/20212011/1641519219.jpg,https://javct.net/v/sprd-644-rm,115,2026-03-27
WANZ-830-RM,A Semen Bukkake Sensual Development Massage Nao Jinguji [Uncensored L**ked],https://pic.javct.net/poster/20221904/1652834478.jpg,https://javct.net/v/wanz-830-rm,120,2026-03-27
JUFD-743-RM,Pussy Pleasure Training With Chitose! Chitose Yura [Uncensored L**ked],https://pic.javct.net/poster/20222109/1665934836.jpg,https://javct.net/v/jufd-743-rm,154,2026-03-27
ABF-337-RM,A Forbidden Affair With A Beautiful Woman About To Get Married. A Short Trip With Unprotected Sex. Alice Shaku [Uncensored L**ked],https://pic.javct.net/poster/06032026/1774491238.jpg,https://javct.net/v/abf-337-rm,140,2026-03-27
FSDSS-206-RM,College Girl With No Experience With Older Men Gets Licked And Ravished By The Gross Old Guy Next Door Ena Satsuki [Uncensored L**ked],https://pic.javct.net/poster/20221904/1651453686.jpg,https://javct.net/v/fsdss-206-rm,151,2026-03-27
ABF-335-RM,The Aesthetics Of Facial Ejaculation 28 Miyoshi [Uncensored L**ked],https://pic.javct.net/poster/06032026/1774491303.jpg,https://javct.net/v/abf-335-rm,135,2026-03-27
ABF-334-RM,I Left Mai Nanashima At A Batting Cage Full Of Men. [Uncensored L**ked],https://pic.javct.net/poster/06032026/1774491365.jpg,https://javct.net/v/abf-334-rm,135,2026-03-27
ABF-335,The Aesthetics Of Facial Ejaculation 28 Miyoshi,https://pic.javct.net/poster/06032026/1774491303.jpg,https://javct.net/v/abf-335,135,2026-03-27
IDBD-970-RM,Momo Sakura And 121 Thick Creampies. The Pleasure Of Raw Sex With The Finest Beauties Will Take Over Your Mind And Body In This 31-hour BEST 8-hour Series [Uncensored L**ked],https://pic.javct.net/poster/20250606/1751607110.jpg,https://javct.net/v/idbd-970-rm,480,2026-03-27
ABF-334,I Left Mai Nanashima At A Batting Cage Full Of Men.,https://pic.javct.net/poster/06032026/1774491365.jpg,https://javct.net/v/abf-334,135,2026-03-27
ABF-337,A Forbidden Affair With A Beautiful Woman About To Get Married. A Short Trip With Unprotected Sex. Alice Shaku,https://pic.javct.net/poster/06032026/1774491238.jpg,https://javct.net/v/abf-337,140,2026-03-27
JUL-660-RM,"A Drama Without Dialogue: No Words Needed, This Is The Ultimate Adulterous Sex Where Everything Is Told Through The Eyes And Fingers - Ayaka Mutou [Uncensored L**ked]",https://static.javct.net/poster/jul-660.jpg,https://javct.net/v/jul-660-rm,150,2026-03-27
JUY-283-RM,My Son's Colossal Tits Private Tutor Is Luring Us To Temptation With Her Hot And Horny Body Hana Haruna [Uncensored L**ked],https://pic.javct.net/poster/20212011/1640756406.jpg,https://javct.net/v/juy-283-rm,120,2026-03-27
SSIS-108-US,"I Am Terrible; I Was Licked Up And Down By My Amazing Father-in-lalw While My Husband Was Away On A Business Trip... Marin Hinata [English Subtitle, Reducing Mosaic]",https://static.javct.net/poster/ssis-108.jpg,https://javct.net/v/ssis-108-us,119,2026-03-27
MIDE-312-RM,[Reducing Mosaic] Female Teacher in a Tight Skirt Shoko Akiyama [Uncensored L**ked],https://static.javct.net/poster/mide-312.jpg,https://javct.net/v/mide-312-rm,165,2026-03-27
FSDSS-963-SUB,She was seduced by her slutty older brothers and became a sex slave with a sensitive and quick orgasm constitution. Momo Misono [English Subtitle],https://pic.javct.net/poster/20253001/1738991515.jpg,https://javct.net/v/fsdss-963-sub,124,2026-03-27
VNDS-3437-RM,"""I Won't Leave Until I Make You Cum!"" The Visiting Doctor Will Squeeze Out Every Last Drop Of Sperm Until You're Empty. Ai Akatsuki, A 60-year-old Sperm Hunter. [Uncensored L**ked]",https://pic.javct.net/poster/06032026/1774323686.jpg,https://javct.net/v/vnds-3437-rm,120,2026-03-27
CEAD-739-RM,"""Ichiba Reika"" Does What She Wants And Gets Fucked By A Lustful Dick - Super Lewd Sex [Uncensored L**ked]",https://pic.javct.net/poster/06032026/1774416356.jpg,https://javct.net/v/cead-739-rm,167,2026-03-27
413INSTV-699-RM,"Very popular among girls as well, a slutty, real-life erotic, real-life H-cup, big-breasted broadcaster with her boyfriend, creampie video l**ked [Uncensored L**ked]",https://pic.javct.net/poster/06032026/1774577643595.jpg,https://javct.net/v/413instv-699-rm,80,2026-03-27
FC2PPV-4869334,"0413_001 Arisa-chan, 20 years old, a mysterious girl with a super slender body who attends a prestigious women's university, and when she gets pregnant, she unexpectedly proposes to get married and impregnates her.Is it finally time for the old man to pay his annual tax?",https://pic.javct.net/poster/06032026/1774573999.jpg,https://javct.net/v/fc2ppv-4869334,193,2026-03-27
STAR-914-RM,Namatashi Initial Cum Inside Ban Removal Mitsuda Ann [Uncensored L**ked],https://pic.javct.net/poster/06032026/1774577030.jpg,https://javct.net/v/star-914-rm,205,2026-03-27
KAM-275-RM,[Private Tutoring] Secretly Filmed Sexual Intercourse Between A Married Private Tutor And A Student With A Big Dick [Forbidden 10-Camera Voyeur] Miho Tono [Uncensored L**ked],https://pic.javct.net/poster/06032026/1774373582.jpg,https://javct.net/v/kam-275-rm,120,2026-03-27
HUBLK-066-RM,Nipple Twisting And Aphrodisiac Soaked Student Guidance Aheiki Continuous Incontinence [Uncensored L**ked],https://pic.javct.net/poster/06032026/1774416163.jpg,https://javct.net/v/hublk-066-rm,120,2026-03-27
COSX-103-RM,[Hentai] Dochashiko Ichibanboshi! Sweet and sadistic Mikuru-chan is fo**ed to cum inside her! ? [5 shots] [Uncensored L**ked],https://pic.javct.net/poster/06032026/1774419760765.jpg,https://javct.net/v/cosx-103-rm,67,2026-03-27
SDNM-542-RM,"Wife who is defeated, prepares to become pregnant. Secretly having raw creampie sex at my in-laws' house with a SNS follower who wants to have eggs. Kazu Takashima [Uncensored L**ked]",https://pic.javct.net/poster/06032026/1774286654413.jpg,https://javct.net/v/sdnm-542-rm,169,2026-03-27
SDAM-161-RM,"A record of a relationship-seeking stalker. A salon receptionist is given drugs. She wakes up, immediately squeezes her neck, deep throats her, and cums inside her. XXX [Uncensored L**ked]",https://pic.javct.net/poster/06032026/1774286953571.jpg,https://javct.net/v/sdam-161-rm,146,2026-03-27
JRZE-168-RM,First Shooting Married Woman Document Emina Minamizawa [Uncensored L**ked],https://pic.javct.net/poster/20231011/1699521509.jpg,https://javct.net/v/jrze-168-rm,135,2026-03-27
SYK-009-RM,[Libido/Appetite/Sleep Desire] Memories Of A Summer Day With A Small Wife Who Is 9 147 Cm Even Though She Is A Married Woman? ! My Dear Toyo (Yutaka) Huh? ! Already In Your 30s? Such A Wife's [sexual Desire★appetite★sleep Desire] Satsuki Toyooka [Uncensored L**ked],https://pic.javct.net/poster/20231011/1699070547.jpg,https://javct.net/v/syk-009-rm,170,2026-03-27
SY-204-RM,"Kaede-san, 32 Years Old, The Wife Of A Four-and-a-half-tatami Room Amateur Four-and-a-half-tatami Creampie Series Kaede Mizukawa [Uncensored L**ked]",https://pic.javct.net/poster/20231011/1699070614.jpg,https://javct.net/v/sy-204-rm,120,2026-03-27
HODV-21484-RM,"The Best Mistress, Dense Creampie Fuck File.8 100cm Moist Beautiful Woman With Big Butt & Breasts Saki Kiyone [Uncensored L**ked]",https://pic.javct.net/poster/06032026/1774576247.jpg,https://javct.net/v/hodv-21484-rm,137,2026-03-27
ERDM-212-RM,"4 Hours Of Erotic Massage That Makes A Housewife Climax Against Her Will, With Her Husband Between Her And Her By A Curtain [Uncensored L**ked]",https://pic.javct.net/poster/06032026/1774373824.jpg,https://javct.net/v/erdm-212-rm,240,2026-03-27
259LUXU-252-RM,Luxury TV 227 [Uncensored L**ked],https://pic.javct.net/poster/06032026/1774577717473.jpg,https://javct.net/v/259luxu-252-rm,59,2026-03-27
SIRO-5495,"[Fascinating body hidden in black clothes] Kasumi (30), an office worker with a cute smile and voice, raises her legs and begs for the dick, squirting and squirting [First shot] AV application online AV experience shooting 2413",https://pic.javct.net/poster/06032026/1774587571973.jpg,https://javct.net/v/siro-5495,62,2026-03-27
JUY-284-RM,"Sancho Office Worker Shirout Married Wife Eating Fishing Document! ! A Sex Slut Woman Wearing A Neat Mask Make A Hard Busty Married Woman Of Super Guard At Home And Take A Hidden Shoot! !If You Insert A Huge Boast Of Ridiculous Despair With Its Hands, It Changes To A Kudamono Woman Of Super Amorous! ! [Uncensored L**ked]",https://pic.javct.net/poster/20222311/1670119702.jpg,https://javct.net/v/juy-284-rm,140,2026-03-27
FTN-042-RM,Netora To 16 [Uncensored L**ked],https://pic.javct.net/poster/06032026/1774577400.jpg,https://javct.net/v/ftn-042-rm,120,2026-03-27
GNS-147-RM,"Secret Footage L**ked: 4 Beautiful Wives Climaxing So Hardly They're Tied Up, Teasing, And Shamefully L**king Cum [Uncensored L**ked]",https://pic.javct.net/poster/06032026/1774373762.jpg,https://javct.net/v/gns-147-rm,215,2026-03-27
812MMC-024-RM,[Manager's wife who wants to be picked up] [Pleasant dreams of Corridor Street] Tokyo Wakazuma weather vol.024 [Uncensored L**ked],https://pic.javct.net/poster/06032026/1774421499232.jpg,https://javct.net/v/812mmc-024-rm,75,2026-03-27
SDNM-544-RM,"Kumi Koizumi, 41 years old, a healthy mother raising a 5-year-old daughter in Zushi City, Kanagawa Prefecture, ""I want to be messed up even more'' The liberated sexuality of a married woman, she forgets her husband and daughter and ends up orgasming, stays at home for 1 night and 2 days, and has a masochistic affair [Uncensored L**ked]",https://pic.javct.net/poster/06032026/1774286573399.jpg,https://javct.net/v/sdnm-544-rm,139,2026-03-27
SAN-089-RM,6 Wives Cuckold In Various Situations 6 Production 270 Minutes [Uncensored L**ked],https://pic.javct.net/poster/20222311/1670898553.jpg,https://javct.net/v/san-089-rm,270,2026-03-27
START-090-SUB,"Visiting Support For Recluse Yotsuha Kominato, A Kind Helper Who Can't Bear To See The Large Amount Of Tissue Paper Left In A Garbage House, So She Secretly Offers Sex Support To Even The Dick-covered Penis With A Smile. [English Subtitle]",https://pic.javct.net/poster/20243105/1719269317.jpg,https://javct.net/v/start-090-sub,103,2026-03-27
FTN-033-RM,I Wanted To Look At The Wife Do Not Know Me ... 22 [Uncensored L**ked],https://pic.javct.net/poster/06032026/1774577453.jpg,https://javct.net/v/ftn-033-rm,125,2026-03-27
MIAA-192-RM,I'll Send Out An Ant Tattooed Married Woman Who Can Cum Out Any Number Of Shots To A Timid Amateur Man's House Shizuku Kurosaki [Uncensored L**ked],https://pic.javct.net/poster/06032026/1774577281.jpg,https://javct.net/v/miaa-192-rm,120,2026-03-27
YMDD-350-RM,"Explosive Wife J Cup Wife's Limits Of Patience, Dripping Wet Squirting Ecstasy Explosive Video Of Suppressed Sexual Desire Miki Horikita [Uncensored L**ked]",https://pic.javct.net/poster/20231011/1699066876.jpg,https://javct.net/v/ymdd-350-rm,90,2026-03-27
SIRO-5533,"A natural girl with twin tails applied because she wanted to have intense sex.Even though she is fluffy and fidgety, when it comes to sex, she cums many times in the erogenous zones of her whole body and can't stop feeling pleasure [First shot] AV application online AV experience shooting 2422",https://pic.javct.net/poster/06032026/1774586447573.jpg,https://javct.net/v/siro-5533,64,2026-03-27
SIRO-5525,I put it in quickly and get excited at the connecting part and scream to the max voltage. Is the recent apparel clerk so erotic? She spreads her shaved pussy without the arrogance that she wants. [First shot] AV application online AV experience shooting 2409,https://pic.javct.net/poster/06032026/1774586942743.jpg,https://javct.net/v/siro-5525,69,2026-03-27
