code,title,size,image_url,torrent_url,tags,actresses,date,page_url
MILK281,炸裂！オチ○ポスマッシュ！テニスもペニスも大好き！超敏感Gカップ部活女子のオマ○コをねらえ！西野絵美,5.1 GB,https://pics.dmm.co.jp/mono/movie/adult/h_1240milk281/h_1240milk281pl.jpg,https://onejav.com/torrent/milk281/download/54831307/onejav.com_milk281.torrent,"Big Tits, BIGセール, Breasts, Couple, Creampie, Kiss, POV, Solowork, Sport",Emi Nishino,2026-03-19,https://onejav.com/torrent/milk281
SYKH177,ブーツの美魔女とナマ交尾 即ズボチ〇ポの快感に美貌が蕩ける… えみさん29歳 西野絵美,5.0 GB,https://pics.dmm.co.jp/mono/movie/adult/sykh177/sykh177pl.jpg,https://onejav.com/torrent/sykh177/download/63878387/onejav.com_sykh177.torrent,"Big Tits, Creampie, Impromptu Sex, Leg Fetish, Married Woman, Solowork",Emi Nishino,2026-02-14,https://onejav.com/torrent/sykh177
NEO943,長髪射 西野絵美,5.0 GB,https://pics.dmm.co.jp/mono/movie/adult/433neo943/433neo943pl.jpg,https://onejav.com/torrent/neo943/download/05653571/onejav.com_neo943.torrent,"3P, 4P, Bukkake, Other Fetish, Shame, Solowork, Vibe",Emi Nishino,2026-01-22,https://onejav.com/torrent/neo943
719MAG076,有名女優とマッチング♪ハウス 西野絵美,3.0 GB,https://image.mgstage.com/images/matchingtv/719mag/076/pb_e_719mag-076.jpg,https://onejav.com/torrent/719mag076/download/85618283/onejav.com_719mag076.torrent,"Amateur, Documentary, POV, Solowork",Emi Nishino,2025-12-01,https://onejav.com/torrent/719mag076
FTHTD163,BACHELOR・ FALENO TUBE SEASON2 友情と愛情の狭間で揺れ動く本性,9.6 GB,https://pics.dmm.co.jp/mono/movie/adult/1fthtd163/1fthtd163pl.jpg,https://onejav.com/torrent/fthtd163/download/51192915/onejav.com_fthtd163.torrent,"Cosplay, Creampie, Documentary, For Women, Orgy","Nozomi Arimura, Emi Nishino, 豊岡さつき",2025-11-30,https://onejav.com/torrent/fthtd163
RCTD697,指示どおりにシコってテンカウントで射精しなさい！ 究極JOI マスターベーションインストラクションSP4,5.1 GB,https://pics.dmm.co.jp/mono/movie/adult/1rctd697/1rctd697pl.jpg,https://onejav.com/torrent/rctd697/download/61855546/onejav.com_rctd697.torrent,"BIGセール, Dirty Words, Masturbation Support, M男, Other Fetish, Planning, Various Professions","Ayaka Tomoda, Emi Nishino, 十束るう",2025-10-16,https://onejav.com/torrent/rctd697
RBK114,隷女の涙 母親の咆哮、娘の純潔、奪われた母娘の明日…,5.5 GB,https://pics.dmm.co.jp/mono/movie/adult/rbk114/rbk114pl.jpg,https://onejav.com/torrent/rbk114/download/68368091/onejav.com_rbk114.torrent,"Adopted Daughter, Anal Sex, Confinement, Humiliation","Emi Nishino, 美雲そら",2025-10-03,https://onejav.com/torrent/rbk114
HNTRZ022,姉妹丼になっちゃいましたが、僕何かやっちゃいましたか？未練残して彼女と別れて、元カノそっくりな子と付き合ったら、たまたま妹で、それを見た姉は嫉妬に狂って濃厚孕ませ姉妹丼。,4.9 GB,https://pics.dmm.co.jp/mono/movie/adult/hntrz022/hntrz022pl.jpg,https://onejav.com/torrent/hntrz022/download/28137989/onejav.com_hntrz022.torrent,"Creampie, Harem, Sister, Slender, Slut","Emi Nishino, 西尾まりな",2025-09-19,https://onejav.com/torrent/hntrz022
CLOT033,パンストの誘惑 西野絵美,5.1 GB,https://pics.dmm.co.jp/mono/movie/adult/h_237clot033/h_237clot033pl.jpg,https://onejav.com/torrent/clot033/download/33497667/onejav.com_clot033.torrent,"Big Tits, Cosplay, Creampie, Pantyhose, Slender, Solowork",Emi Nishino,2025-07-20,https://onejav.com/torrent/clot033
KDMI066,絶対的ハイレグQueen’s II,10.5 GB,https://pics.dmm.co.jp/mono/movie/adult/kdmi066/kdmi066pl.jpg,https://onejav.com/torrent/kdmi066/download/24079373/onejav.com_kdmi066.torrent,"4HR+, Butt, Cosplay, Leg Fetish, Leotard, Pantyhose","Ayaka Tomoda, ちゃんよた, Emi Nishino, 瀬那ルミナ, 渋谷華, 黒木奈美",2025-07-12,https://onejav.com/torrent/kdmi066
