code,title,size,image_url,torrent_url,tags,actresses,date,page_url
PYM554,おま〇こズボズボ 美尻デカ尻ディルドオナニー 貴方のおちん〇ん食べちゃうぞ,10.4 GB,https://pics.dmm.co.jp/mono/movie/adult/h_283pym554/h_283pym554pl.jpg,https://onejav.com/torrent/pym554/download/76228979/onejav.com_pym554.torrent,"4HR+, Close Up, Cowgirl, Dildo, Masturbation, Older Sister, Subjectivity","Kokoro Ayase, 加護まり, Hotaru Nogi, 愛瀬ゆう, Yuina Taki, 乃南ゆり, 浅桜エリ, 指原美奈, 橘紅葉, 八森わか菜",2026-03-29,https://onejav.com/torrent/pym554
BDA215,黒人覚醒 真・黒い衝撃 デカすぎる黒光チ○ポでマ○コをズボズボッ！乃木蛍,5.6 GB,https://pics.dmm.co.jp/mono/movie/adult/bda215/bda215pl.jpg,https://onejav.com/torrent/bda215/download/96877502/onejav.com_bda215.torrent,"Black Actor, Creampie, Deep Throating, Female Investigator, Huge Cock, Solowork",Hotaru Nogi,2025-12-20,https://onejav.com/torrent/bda215
NSFS296,新・償い13 ～私のアソコが悲しみのはけ口になるならば・・～ 乃木蛍,5.9 GB,https://pics.dmm.co.jp/mono/movie/adult/nsfs296/nsfs296pl.jpg,https://onejav.com/torrent/nsfs296/download/87111263/onejav.com_nsfs296.torrent,"Affair, Big Tits, Drama, Married Woman, Solowork",Hotaru Nogi,2024-07-06,https://onejav.com/torrent/nsfs296
217MIHA077,もうひとつの…子作りできるソープランド 配信限定 乃木蛍,1.3 GB,https://image.mgstage.com/images/mrmichiru/217miha/077/pb_e_217miha-077.jpg,https://onejav.com/torrent/217miha077/download/79941210/onejav.com_217miha077.torrent,"Amateur, Cosplay, Creampie, Prostitutes, Sister, Solowork, Subjectivity",Hotaru Nogi,2023-11-25,https://onejav.com/torrent/217miha077
BONY070,A Beautiful Woman Who Lives Alone Is Targeted By A Brutal Criminal Group And Is Forced Into Her Home And Creampie Rape Hotaru Nogi,5.6 GB,https://pics.dmm.co.jp/mono/movie/adult/bony070/bony070pl.jpg,https://onejav.com/torrent/bony070/download/52523783/onejav.com_bony070.torrent,"Creampie, Deep Throating, Evil, Foreign Objects, Solowork, Urination",Hotaru Nogi,2023-11-10,https://onejav.com/torrent/bony070
MIST414,危険日直撃！！子作りできるソープ49 乃木蛍,5.6 GB,https://pics.dmm.co.jp/mono/movie/adult/1mist414/1mist414pl.jpg,https://onejav.com/torrent/mist414/download/37555226/onejav.com_mist414.torrent,"Big Tits, Conceived, Cosplay, Cowgirl, Creampie, Dirty Words, Huge Butt, Maid, Prostitutes, Solowork, Uniform",Hotaru Nogi,2023-10-14,https://onejav.com/torrent/mist414
DJE087,Ura Dirt Doujin Cum Swallowing Wife Hotaru Nogi,5.1 GB,https://pics.dmm.co.jp/mono/movie/adult/2dje087/2dje087pl.jpg,https://onejav.com/torrent/dje087/download/75116727/onejav.com_dje087.torrent,"3P, 4P, Big Tits, Blow, Cum, Married Woman, Masturbation, Slut, Solowork, Titty Fuck",Hotaru Nogi,2023-09-22,https://onejav.com/torrent/dje087
RVG204,Honor Student Training Obscene School Pregnancy Camp BEST VOL.1,10.1 GB,https://pics.dmm.co.jp/mono/movie/adult/rvg204/rvg204pl.jpg,https://onejav.com/torrent/rvg204/download/19555288/onejav.com_rvg204.torrent,"3P, 4P, 4HR+, Best, Omnibus, Confinement, School Girls","Hana Shirato, Yuzu Shirakawa, Hotaru Nogi, Sakura Tsuji, 2020 Rina Takase",2023-08-12,https://onejav.com/torrent/rvg204
SPSA13,Non-Transformation Heroine Mortal Pink Hotaru Nogi,1.8 GB,https://pics.dmm.co.jp/mono/movie/adult/h_173spsa13/h_173spsa13pl.jpg,https://onejav.com/torrent/spsa13/download/54238466/onejav.com_spsa13.torrent,"Female Warrior, Fighting Action, Restraint, Solowork, Special Effects",Hotaru Nogi,2023-07-21,https://onejav.com/torrent/spsa13
UMSO502,I Was Allowed To Take A Bathing Scene Between Shoots! ! 20 People VOL.02,8.5 GB,https://pics.dmm.co.jp/mono/movie/adult/umso502/umso502pl.jpg,https://onejav.com/torrent/umso502/download/03023233/onejav.com_umso502.torrent,"Bath, Big Tits, Breasts, Huge Butt, Other Fetish","Rika Tahara, Sawa Sasaki, Yuria Yoshine, Mako Oda, Alice Kisaki, Yumi Narisa, Misono Mizuhara, Hotaru Nogi, Kasumi Tsukino, Momo Minami",2023-05-20,https://onejav.com/torrent/umso502
