code,title,size,image_url,torrent_url,tags,actresses,date,page_url
MIDA580,立ち退き依頼で来た役所の地味メガネ爆乳を監禁アクメ Gカップ乳首ビンビン神乳揉みまくり！頑固オヤジの絶倫ピストンでガニ股オーガズムしちゃった私 天宮花南,5.4 GB,https://pics.dmm.co.jp/mono/movie/adult/mida580/mida580pl.jpg,https://onejav.com/torrent/mida580/download/91872590/onejav.com_mida580.torrent,"Acme · Orgasm, Big Tits, Confinement, Creampie, Solowork, Squirting",Kanan Amamiya,2026-04-07,https://onejav.com/torrent/mida580
MIDA539,ある日、媚薬に手を出した大学の飲み会が媚薬濃縮孕ませ輪●サークルに変わった。 天宮花南,7.7 GB,https://pics.dmm.co.jp/mono/movie/adult/mida539/mida539pl.jpg,https://onejav.com/torrent/mida539/download/80878286/onejav.com_mida539.torrent,"3P, 4P, Creampie, Drinking Party, Female College Student, Solowork, Squirting",Kanan Amamiya,2026-02-27,https://onejav.com/torrent/mida539
MIRD271,同窓会で再会した巨乳教え子ら4人に同時告白されて、酔った勢いホテルで神乳に囲まれ挟まれ奪い合い痴女られた元担任教師の僕 MOODYZ創立25周年記念 天宮花南 九野ひなの 白岩冬萌 百田光稀,6.6 GB,https://pics.dmm.co.jp/mono/movie/adult/mird271/mird271pl.jpg,https://onejav.com/torrent/mird271/download/13003597/onejav.com_mird271.torrent,"Big Tits, Cowgirl, Harem, Slut","百田光稀, 白岩冬萌, Hinano Kuno, Kanan Amamiya",2026-02-13,https://onejav.com/torrent/mird271
MIDA504,地味なオフィス清掃員を冗談半分でデカチン挑発！「私なんかにやめて…」と言いつつ結局勤務中自らおま○こくぱぁしてズボズボ中出しを受け入れる隠れエロボディ欲求不満妻 天宮花南,6.5 GB,https://pics.dmm.co.jp/mono/movie/adult/mida504/mida504pl.jpg,https://onejav.com/torrent/mida504/download/01393566/onejav.com_mida504.torrent,"3P, 4P, Big Tits, Creampie, Lotion, Married Woman, Solowork",Kanan Amamiya,2026-01-30,https://onejav.com/torrent/mida504
MIDA465,いつも地味メガネ女上司を酔わせたら…囁き誘惑キス魔になって何度も何度も勃起に持ち込まれ飲めば飲むほど無限中出し！！ 天宮花南,7.0 GB,https://pics.dmm.co.jp/mono/movie/adult/mida465/mida465pl.jpg,https://onejav.com/torrent/mida465/download/87039820/onejav.com_mida465.torrent,"Big Tits, Creampie, Female Boss, Kiss, Orgy, Solowork",Kanan Amamiya,2026-01-01,https://onejav.com/torrent/mida465
MIMK261,シリーズ累計8万DL超えの人気作を実写化！！ 国木田先輩のかくしごと―実写版― 文芸部の先輩が隠れて書いてた官能小説を盗み見てしまい成り行きでセックスしてしまった。 天宮花南,5.0 GB,https://pics.dmm.co.jp/mono/movie/adult/mimk261/mimk261pl.jpg,https://onejav.com/torrent/mimk261/download/59648016/onejav.com_mimk261.torrent,"Creampie, Original Collaboration, School Girls, Slender, Solowork, Uniform",Kanan Amamiya,2025-11-28,https://onejav.com/torrent/mimk261
MIDA391,母の出産入院中、イヤと言えない気弱な姉は義父に抱かれてた。従順オナホ化20射精中出しレ×プ 天宮花南,5.2 GB,https://pics.dmm.co.jp/mono/movie/adult/mida391/mida391pl.jpg,https://onejav.com/torrent/mida391/download/34595651/onejav.com_mida391.torrent,"Big Tits, Creampie, Humiliation, Incest, Slender, Solowork",Kanan Amamiya,2025-10-31,https://onejav.com/torrent/mida391
MIDA352,地味メガネな天宮先生が豹変。放課後から朝まで何度も生ハメ発情セックスしてしまった女教師中出し性欲モンスターな天宮先生とボク…。 天宮花南,5.1 GB,https://pics.dmm.co.jp/mono/movie/adult/mida352/mida352pl.jpg,https://onejav.com/torrent/mida352/download/27401450/onejav.com_mida352.torrent,"Big Tits, Blow, Creampie, Female Teacher, Kiss, Solowork",Kanan Amamiya,2025-10-03,https://onejav.com/torrent/mida352
MIDA312,年下好き天宮先生のバックハグ乳首こねくり淫語授業に堕ちそばに彼女がいるのに寝取られた中出し授業NTR 天宮花南,5.0 GB,https://pics.dmm.co.jp/mono/movie/adult/mida312/mida312pl.jpg,https://onejav.com/torrent/mida312/download/17681581/onejav.com_mida312.torrent,"Creampie, Cuckold, Female Teacher, Kiss, Slut, Solowork",Kanan Amamiya,2025-08-29,https://onejav.com/torrent/mida312
MIDA268,若者がいない限界集落で子種を欲しがって…乳首ビンビン欲情して足腰ガクガクド田舎ガニ股オーガズム中出しを求めたワタシ…。 天宮花南,5.0 GB,https://pics.dmm.co.jp/mono/movie/adult/mida268/mida268pl.jpg,https://onejav.com/torrent/mida268/download/00657693/onejav.com_mida268.torrent,"Big Tits, Blow, Conceived, Cowgirl, Creampie, Solowork",Kanan Amamiya,2025-08-01,https://onejav.com/torrent/mida268
