code,title,size,image_url,torrent_url,tags,actresses,date,page_url
ODVHJ075,人妻不倫性交流出動画（3）,7.7 GB,https://pics.dmm.co.jp/mono/movie/adult/48odvhj075/48odvhj075pl.jpg,https://onejav.com/torrent/odvhj075/download/13708930/onejav.com_odvhj075.torrent,"Big Tits, Creampie, Cuckold, Huge Cock, Married Woman","Miho Tsuno, 盛永いろは, 藤井レイラ, 赤城穂波",2026-05-02,https://onejav.com/torrent/odvhj075
KAM275,【個別指導】既婚の家庭教師と、巨根の受験生の、密室淫交盗撮記録【禁断の10カメ盗撮】 通野未帆,5.2 GB,https://pics.dmm.co.jp/mono/movie/adult/kam275/kam275pl.jpg,https://onejav.com/torrent/kam275/download/81294559/onejav.com_kam275.torrent,"Creampie, Married Woman, Slender, Solowork, Tutor, Voyeur",Miho Tsuno,2026-03-25,https://onejav.com/torrent/kam275
OKK110,通野未帆 濡れてテカってピッタリ密着 神競泳水着 可愛い女子の競泳水着姿をじっとりと堪能！着替え撮影から始まり貧乳から巨乳にパイパン、ハミ毛、ジョリワキ等のフェチ接写やローションソーププレイや競泳水着ぶっかけ等を完全着衣で楽しむAV,3.9 GB,https://pics.dmm.co.jp/mono/movie/adult/1okk110/1okk110pl.jpg,https://onejav.com/torrent/okk110/download/10057002/onejav.com_okk110.torrent,"Beautiful Girl, BIGセール, Bukkake, Close Up, Lotion, School Swimsuit, Solowork, Voyeur",Miho Tsuno,2026-03-18,https://onejav.com/torrent/okk110
BASJ040,夫のNTR性癖に付き合わされて痴女覚醒する妻 通野未帆,5.8 GB,https://pics.dmm.co.jp/mono/movie/adult/basj040/basj040pl.jpg,https://onejav.com/torrent/basj040/download/26503225/onejav.com_basj040.torrent,"Affair, Creampie, Cuckold, Married Woman, Slut, Solowork",Miho Tsuno,2026-03-07,https://onejav.com/torrent/basj040
NTRD128,ネトラレーゼ 妻が、土建屋の男達に寝盗られた話し 通野未帆,5.4 GB,https://pics.dmm.co.jp/mono/movie/adult/ntrd128/ntrd128pl.jpg,https://onejav.com/torrent/ntrd128/download/71360508/onejav.com_ntrd128.torrent,"Big Tits, Creampie, Cuckold, Married Woman, Mature Woman, Solowork",Miho Tsuno,2026-01-10,https://onejav.com/torrent/ntrd128
JJDA068,夫の同僚にねとられた妻 ジムで鍛えたむきむきマッチョな筋肉に魅せられて 通野未帆,5.5 GB,https://pics.dmm.co.jp/mono/movie/adult/jjda068/jjda068pl.jpg,https://onejav.com/torrent/jjda068/download/35608382/onejav.com_jjda068.torrent,"Breasts, Creampie, Cuckold, Married Woman, Slender, Solowork",Miho Tsuno,2026-01-03,https://onejav.com/torrent/jjda068
ALDN540,お前の嫁って最高だな 通野未帆,5.0 GB,https://pics.dmm.co.jp/mono/movie/adult/aldn540/aldn540pl.jpg,https://onejav.com/torrent/aldn540/download/36780400/onejav.com_aldn540.torrent,"Big Tits, BIGセール, Creampie, Married Woman, Mature Woman, Solowork",Miho Tsuno,2025-12-20,https://onejav.com/torrent/aldn540
VEMA253,僕を童貞扱いしてバカにするモラハラ女上司を、猛烈な鬼ピストンで反省イキの絶頂と屈辱の連続アクメ 通野未帆,5.0 GB,https://pics.dmm.co.jp/mono/movie/adult/vema253/vema253pl.jpg,https://onejav.com/torrent/vema253/download/70326734/onejav.com_vema253.torrent,"Creampie, Married Woman, Mature Woman, Slut, Solowork, Virgin Man",Miho Tsuno,2025-12-19,https://onejav.com/torrent/vema253
KSBJ406,リモートホストにハマってしまったサレ妻 通野未帆,5.1 GB,https://pics.dmm.co.jp/mono/movie/adult/ksbj406/ksbj406pl.jpg,https://onejav.com/torrent/ksbj406/download/12324362/onejav.com_ksbj406.torrent,"Breasts, Creampie, Drama, Married Woman, Masturbation, Solowork",Miho Tsuno,2025-11-29,https://onejav.com/torrent/ksbj406
ALDN531,家庭内愛人契約 通野未帆,5.6 GB,https://pics.dmm.co.jp/mono/movie/adult/aldn531/aldn531pl.jpg,https://onejav.com/torrent/aldn531/download/51722642/onejav.com_aldn531.torrent,"Big Tits, Creampie, Married Woman, Mature Woman, Solowork",Miho Tsuno,2025-11-22,https://onejav.com/torrent/aldn531
