code,title,size,image_url,torrent_url,tags,actresses,date,page_url
GVH842,世界一おしっこ飲ませるのが大好きなドSな女上司の聖水調教 デカ尻顔面騎乗飲尿クンニで再教育プログラム 北野未奈,7.2 GB,https://pics.dmm.co.jp/mono/movie/adult/gvh842/gvh842pl.jpg,https://onejav.com/torrent/gvh842/download/69743114/onejav.com_gvh842.torrent,"Cunnilingus, Facesitting, Female Boss, Slut, Solowork, Urination",Mina Kitano,2026-05-07,https://onejav.com/torrent/gvh842
EKDV813,このメス女…只今発情真っ盛り！？ 北野未奈としてみませんか？,6.9 GB,https://pics.dmm.co.jp/mono/movie/adult/ekdv813/ekdv813pl.jpg,https://onejav.com/torrent/ekdv813/download/95633876/onejav.com_ekdv813.torrent,"Big Tits, Butt, Facesitting, Masturbation, Reversed Role, Shaved, Solowork, Spanking, Squirting, Sun tan, Titty Fuck",Mina Kitano,2026-04-11,https://onejav.com/torrent/ekdv813
SQTE671,人に言えない私だけの裏エステ 北野未奈,4.8 GB,https://pics.dmm.co.jp/mono/movie/adult/sqte671/sqte671pl.jpg,https://onejav.com/torrent/sqte671/download/57067953/onejav.com_sqte671.torrent,"Beautiful Girl, Beauty Shop, Blow, Masturbation, Solowork, Squirting",Mina Kitano,2026-04-07,https://onejav.com/torrent/sqte671
ROYD304,偶然見た向かい部屋の変態。僕たち童貞なのにいきなりエゲつねぇ下品痴女が誘惑してきて…パナいズベ公すぎる鬼連続中出しレッスンで新品金玉がお亡くなりになりました。 北野未奈,6.8 GB,https://pics.dmm.co.jp/mono/movie/adult/royd304/royd304pl.jpg,https://onejav.com/torrent/royd304/download/78032213/onejav.com_royd304.torrent,"3P, 4P, Big Tits, Blow, Cowgirl, Slut, Solowork",Mina Kitano,2026-03-22,https://onejav.com/torrent/royd304
REAL977,愛妻崩壊ホームビデオ 貞淑な嫁がモラハラ鬼畜義父に凄惨なまでに調教され続け、ドM開花していく姿を収めた3日間のNTR記録 北野未奈,6.2 GB,https://pics.dmm.co.jp/mono/movie/adult/real977/real977pl.jpg,https://onejav.com/torrent/real977/download/68961211/onejav.com_real977.torrent,"Big Tits, Cuckold, Married Woman, M女, Nasty, Hardcore, Solowork",Mina Kitano,2026-03-21,https://onejav.com/torrent/real977
DASS903,死ねばいい。マジうるせぇ俺の激ヒステリック糞ミソばばあ（母）が朝起きたら、超優しくてエッチ大好き極上ママに！？いっぱ～いマラ愛して離さない甘ハメ三ツ星生活。ちゅ～しよ？ 北野未奈,5.5 GB,https://pics.dmm.co.jp/mono/movie/adult/dass903/dass903pl.jpg,https://onejav.com/torrent/dass903/download/67760058/onejav.com_dass903.torrent,"Big Tits, Cowgirl, Mother, Slut, Solowork, Subjectivity",Mina Kitano,2026-03-20,https://onejav.com/torrent/dass903
MIAB634,スケベ淫乱おま○こ限界突破 北野未奈リミッターカット 初・ポルチオ徹底開発,5.0 GB,https://pics.dmm.co.jp/mono/movie/adult/miab634/miab634pl.jpg,https://onejav.com/torrent/miab634/download/00634440/onejav.com_miab634.torrent,"Acme · Orgasm, Big Tits, Nasty, Hardcore, Older Sister, Solowork, Squirting",Mina Kitano,2026-03-13,https://onejav.com/torrent/miab634
NGOD320,証券会社の妻 円安株高バリキャリ証券レディの妻が顧客のクレームで右肩上がりにソリ返ったビンビン巨根をぶち込まれてねとられました…。 北野未奈,5.6 GB,https://pics.dmm.co.jp/mono/movie/adult/ngod320/ngod320pl.jpg,https://onejav.com/torrent/ngod320/download/21260037/onejav.com_ngod320.torrent,"Affair, Big Tits, Cuckold, Huge Cock, Married Woman, Solowork",Mina Kitano,2026-03-06,https://onejav.com/torrent/ngod320
MISM427,アナルガンギマリ！喉奥貫通！膣破壊！歪に溶け合う異常接近3穴レズ 北野未奈 ゆうきすず,8.7 GB,https://pics.dmm.co.jp/mono/movie/adult/mism427/mism427pl.jpg,https://onejav.com/torrent/mism427/download/53890345/onejav.com_mism427.torrent,"Anal, Deep Throating, M女, Nasty, Hardcore","Mina Kitano, ゆうきすず, 真咲南朋",2026-02-20,https://onejav.com/torrent/mism427
KAM272,産婦人科どすけべ診察 検診で来院した美人妻のお股をぬぷぬぷ診療しまくる悪徳エロ産婦人科医 北野未奈,5.4 GB,https://pics.dmm.co.jp/mono/movie/adult/kam272/kam272pl.jpg,https://onejav.com/torrent/kam272/download/09453001/onejav.com_kam272.torrent,"Big Tits, Creampie, Married Woman, Shame, Solowork, Voyeur",Mina Kitano,2026-02-15,https://onejav.com/torrent/kam272
