code,title,size,image_url,torrent_url,tags,actresses,date,page_url
AVSA437,ぬるテカ肉感ドエロ極上ボディ 光沢ぬるぬる恵体を激しく突き上げ爆乳揺らして止まらない快感痙攣絶頂 波多野結衣,5.2 GB,https://pics.dmm.co.jp/mono/movie/adult/avsa437/avsa437pl.jpg,https://onejav.com/torrent/avsa437/download/49402681/onejav.com_avsa437.torrent,"BBW, Big Tits, Huge Butt, Other Fetish, Solowork",Yui Hatano,2026-05-23,https://onejav.com/torrent/avsa437
DOA139,女王様降臨 私の言うことは絶対でしょ？ 波多野結衣,4.1 GB,https://pics.dmm.co.jp/mono/movie/adult/doa139/doa139pl.jpg,https://onejav.com/torrent/doa139/download/89602301/onejav.com_doa139.torrent,"Footjob, Leg Fetish, Mistress, M男, Solowork, Urination",Yui Hatano,2026-05-23,https://onejav.com/torrent/doa139
BONY191,抜かずに連射で膣内シェイク！！ まんキャパオーバー無制限中出し 波多野結衣,5.4 GB,https://pics.dmm.co.jp/mono/movie/adult/bony191/bony191pl.jpg,https://onejav.com/torrent/bony191/download/59592841/onejav.com_bony191.torrent,"Big Tits, Blow, Creampie, Huge Butt, Solowork, Squirting",Yui Hatano,2026-05-22,https://onejav.com/torrent/bony191
JYMA105,夫が出張中に男達のチ○ポを喰い漁る 美爆乳尻ビッチ妻 発情した肉感ボディでヤリまくるドスケベ嫁,6.0 GB,https://pics.dmm.co.jp/mono/movie/adult/jyma105/jyma105pl.jpg,https://onejav.com/torrent/jyma105/download/62165990/onejav.com_jyma105.torrent,"Affair, Big Tits, Bitch, Creampie, Married Woman, Solowork",Yui Hatano,2026-05-22,https://onejav.com/torrent/jyma105
ISD158,波多野結衣の田舎に泊まろう,5.4 GB,https://pics.dmm.co.jp/mono/movie/adult/isd158/isd158pl.jpg,https://onejav.com/torrent/isd158/download/15233112/onejav.com_isd158.torrent,"Big Tits, Blow, Creampie, Mature Woman, Solowork, Titty Fuck",Yui Hatano,2026-05-16,https://onejav.com/torrent/isd158
MADV630,「言わないで…」 Special版 波多野結衣,5.0 GB,https://pics.dmm.co.jp/mono/movie/adult/madv630/madv630pl.jpg,https://onejav.com/torrent/madv630/download/66414184/onejav.com_madv630.torrent,"Big Tits, Cowgirl, Creampie, Dirty Words, Electric Massager, Huge Butt, Masturbation, Shaved, Slut, Solowork, Urination",Yui Hatano,2026-05-09,https://onejav.com/torrent/madv630
NGOD336,大部屋病棟の肉便器妻 入院中の妻が真夜中のデカチン回診で廻され調教されてました…,7.2 GB,https://pics.dmm.co.jp/mono/movie/adult/ngod336/ngod336pl.jpg,https://onejav.com/torrent/ngod336/download/23378249/onejav.com_ngod336.torrent,"3P, 4P, Cuckold, Huge Cock, Married Woman, Solowork",Yui Hatano,2026-05-08,https://onejav.com/torrent/ngod336
MRSS184,バ先のファミレスで働くチョロい主婦に「うちでゲームしません？」と誘ったらホイホイついてきたので家に連れ込み生ハメ中出し 波多野結衣,5.2 GB,https://pics.dmm.co.jp/mono/movie/adult/mrss184/mrss184pl.jpg,https://onejav.com/torrent/mrss184/download/60625464/onejav.com_mrss184.torrent,"Big Tits, Creampie, Cuckold, Married Woman, Solowork, Waitress",Yui Hatano,2026-04-22,https://onejav.com/torrent/mrss184
GVH835,密着！パイズリ！SEX！男だらけのワケあり大家族で笑いあり射精あり…エロ母ちゃんのパコパコ奮闘SP 波多野結衣,5.6 GB,https://pics.dmm.co.jp/mono/movie/adult/gvh835/gvh835pl.jpg,https://onejav.com/torrent/gvh835/download/59717042/onejav.com_gvh835.torrent,"BBW, Documentary, Incest, Mother, Solowork, Titty Fuck",Yui Hatano,2026-04-11,https://onejav.com/torrent/gvh835
HZGD332,,5.1 GB,https://pics.dmm.co.jp/mono/movie/adult/h_1100hzgd332r/h_1100hzgd332rpl.jpg,https://onejav.com/torrent/hzgd332/download/63284415/onejav.com_hzgd332.torrent,"Big Tits, Creampie, Cuckold, Drama, Married Woman, Solowork",Yui Hatano,2026-03-06,https://onejav.com/torrent/hzgd332
