code,title,size,image_url,torrent_url,tags,actresses,date,page_url
START533,【ノーカット・ハメ撮り・ラブホ】五反田のHOTELで誰とSEXしたかはナイショです。 小倉由菜,5.0 GB,https://pics.dmm.co.jp/mono/movie/adult/1start533/1start533pl.jpg,https://onejav.com/torrent/start533/download/06324201/onejav.com_start533.torrent,"BIGセール, Documentary, Older Sister, POV, Slender, Slut, Solowork",Yuna Ogura,2026-03-10,https://onejav.com/torrent/start533
START513,最高の囁き小悪魔痴女による悶絶オナサポ射精スローコントロールで暴発したら叱られまくりSPECIAL！！！！ 小倉由菜,6.7 GB,https://pics.dmm.co.jp/mono/movie/adult/1start513/1start513pl.jpg,https://onejav.com/torrent/start513/download/39890836/onejav.com_start513.torrent,"Dirty Words, Handjob, Masturbation Support, M男, Slut, Solowork",Yuna Ogura,2026-02-10,https://onejav.com/torrent/start513
START494,3ヶ月前に出会った絶対挿入禁止の既婚者オナトモW不倫で、極限焦らしを超えた最初で最後の発情無制限中出しSEX。 小倉由菜,5.0 GB,https://pics.dmm.co.jp/mono/movie/adult/1start494/1start494pl.jpg,https://onejav.com/torrent/start494/download/12599183/onejav.com_start494.torrent,"Creampie, Cuckold, Married Woman, Masturbation, Slut, Solowork",Yuna Ogura,2026-01-13,https://onejav.com/torrent/start494
START471,配送中NTR 既婚ベテランドライバーの配送に付いて回るうち車中でおそわれてしまった新婚人妻 小倉由菜,5.2 GB,https://pics.dmm.co.jp/mono/movie/adult/1start471/1start471pl.jpg,https://onejav.com/torrent/start471/download/67604874/onejav.com_start471.torrent,"Creampie, Cuckold, Drama, Huge Butt, Solowork",Yuna Ogura,2025-12-09,https://onejav.com/torrent/start471
START453,小倉由菜さんを探しています。,5.8 GB,https://pics.dmm.co.jp/mono/movie/adult/1start453/1start453pl.jpg,https://onejav.com/torrent/start453/download/83594437/onejav.com_start453.torrent,"3P, 4P, Creampie, Documentary, Rolling Back Eyes, Fainting, Solowork",Yuna Ogura,2025-11-11,https://onejav.com/torrent/start453
START421,【SODSTAR×SHIGEKI】魔改造触手で日本一を目指せ 触手-1グランプリ 小倉由菜,3.8 GB,https://pics.dmm.co.jp/mono/movie/adult/1start421/1start421pl.jpg,https://onejav.com/torrent/start421/download/54882710/onejav.com_start421.torrent,"Acme · Orgasm, BIGセール, Facials, Solowork, Squirting, Tentacle",Yuna Ogura,2025-10-14,https://onejav.com/torrent/start421
REBD972,Yuna5 Crimson Rose・小倉由菜,3.6 GB,https://pics.dmm.co.jp/mono/movie/adult/h_346rebd972/h_346rebd972pl.jpg,https://onejav.com/torrent/rebd972/download/95929804/onejav.com_rebd972.torrent,"AV女優, Breasts, Image Video, Sexy, Solowork",Yuna Ogura,2025-10-02,https://onejav.com/torrent/rebd972
START370,同棲するため物件を内見にきたカップルの彼氏を寝取って生ハメ中出しさせる淫乱美尻な不動産レディ 小倉由菜,6.2 GB,https://pics.dmm.co.jp/mono/movie/adult/1start370/1start370pl.jpg,https://onejav.com/torrent/start370/download/36515243/onejav.com_start370.torrent,"Creampie, Cuckold, OL, Older Sister, Slut, Solowork",Yuna Ogura,2025-09-16,https://onejav.com/torrent/start370
START418,【完全主観×乳首責め騎乗位×淫語ASMR】超変態的な馬乗り痴女お姉さんの悶絶トライアングルSPECIAL！！！ 小倉由菜,6.4 GB,https://pics.dmm.co.jp/mono/movie/adult/1start418/1start418pl.jpg,https://onejav.com/torrent/start418/download/58943481/onejav.com_start418.torrent,"Cowgirl, Dirty Words, Older Sister, Other Fetish, Slut, Solowork",Yuna Ogura,2025-08-26,https://onejav.com/torrent/start418
START344,催●ブライダルエステ 幸せ絶頂の結婚式直前に媚ヤクミストで感度爆増エビ反り痙攣絶頂してしまうプレ花嫁 小倉由菜,5.5 GB,https://pics.dmm.co.jp/mono/movie/adult/1start344/1start344pl.jpg,https://onejav.com/torrent/start344/download/01810143/onejav.com_start344.torrent,"Beauty Shop, Bride, Creampie, Drama, Solowork",Yuna Ogura,2025-06-10,https://onejav.com/torrent/start344
