code,title,size,image_url,torrent_url,tags,actresses,date,page_url
DOKS674,乳首いじりが日常に溶け込んだ世界でイジられていることには気づかないまま皆の前で乳首絶頂してしまう敏感オフィスレディたち,4.1 GB,https://pics.dmm.co.jp/mono/movie/adult/h_139doks674/h_139doks674pl.jpg,https://onejav.com/torrent/doks674/download/68166147/onejav.com_doks674.torrent,"Big Tits, Blow, Breasts, OL, Other Fetish, Small Tits, Toy, Uniform","葉月ひな, Yuri Sasahara, 乙葉らぶ, 夢乃のあ, 涼花くるみ",2026-06-01,https://onejav.com/torrent/doks674
JJDA074,りはびりの妻 性処理出来ない患者に頼み込まれた看護師妻,5.4 GB,https://pics.dmm.co.jp/mono/movie/adult/jjda074/jjda074pl.jpg,https://onejav.com/torrent/jjda074/download/90815032/onejav.com_jjda074.torrent,"Big Tits, Creampie, Cuckold, Married Woman, Nurse, Solowork",Yuri Sasahara,2026-05-29,https://onejav.com/torrent/jjda074
DOKS675,外人のようにチ〇ポを根元までガッツリ咥えるジャパニーズディープスロート,5.1 GB,https://pics.dmm.co.jp/mono/movie/adult/h_139doks675/h_139doks675pl.jpg,https://onejav.com/torrent/doks675/download/75990415/onejav.com_doks675.torrent,"3P, 4P, Big Tits, Blow, Dirty Words, Kimono, Yukata, Nasty, Hardcore, Older Sister, Other Fetish, Slut","葉月ひな, 夢乃のあ, Yuri Sasahara, 乙葉らぶ, 涼花くるみ",2026-05-01,https://onejav.com/torrent/doks675
NEO946,唾とオシッコで溺死したい 紗々原ゆり,5.2 GB,https://pics.dmm.co.jp/mono/movie/adult/433neo946/433neo946pl.jpg,https://onejav.com/torrent/neo946/download/83123600/onejav.com_neo946.torrent,"BIGセール, Dirty Words, M男, Slut, Solowork, Urination",Yuri Sasahara,2026-03-21,https://onejav.com/torrent/neo946
NSFS453,元女優の妻 ～親族たちにまわされてしまったあの日～ 後編 紗々原ゆり,6.1 GB,https://pics.dmm.co.jp/mono/movie/adult/nsfs453/nsfs453pl.jpg,https://onejav.com/torrent/nsfs453/download/06853666/onejav.com_nsfs453.torrent,"Drama, Married Woman, Mature Woman, Solowork",Yuri Sasahara,2026-02-07,https://onejav.com/torrent/nsfs453
NSFS445,元女優の妻 ～親族たちにまわされてしまったあの日～ 前編 紗々原ゆり,4.6 GB,https://pics.dmm.co.jp/mono/movie/adult/nsfs445/nsfs445pl.jpg,https://onejav.com/torrent/nsfs445/download/83517150/onejav.com_nsfs445.torrent,"Drama, Married Woman, Mature Woman, Solowork",Yuri Sasahara,2026-01-10,https://onejav.com/torrent/nsfs445
AARM315,ノーハンドピストン！男に腰を振らせない立ちバック！！,5.2 GB,https://pics.dmm.co.jp/mono/movie/adult/aarm315/aarm315pl.jpg,https://onejav.com/torrent/aarm315/download/14494437/onejav.com_aarm315.torrent,"Back, Butt, Huge Butt, Slut","若宮はずき, Yuri Sasahara, 伊東沙蘭, Minaho Ariga",2025-09-18,https://onejav.com/torrent/aarm315
KSBJ392,愛する妻の裏の顔 紗々原ゆり,4.9 GB,https://pics.dmm.co.jp/mono/movie/adult/ksbj392/ksbj392pl.jpg,https://onejav.com/torrent/ksbj392/download/34801772/onejav.com_ksbj392.torrent,"Affair, Big Tits, Creampie, Married Woman, Mature Woman, Solowork",Yuri Sasahara,2025-08-16,https://onejav.com/torrent/ksbj392
NACR988,飲みすぎたフリしてデカチン部下を誘惑する淫乱女上司 紗々原ゆり,5.0 GB,https://pics.dmm.co.jp/mono/movie/adult/h_237nacr988/h_237nacr988pl.jpg,https://onejav.com/torrent/nacr988/download/48754905/onejav.com_nacr988.torrent,"Big Tits, Business Attire, Creampie, Female Boss, Slut, Solowork",Yuri Sasahara,2025-07-20,https://onejav.com/torrent/nacr988
HBAD706,セックスレスで性欲を持て余した美人妻がデカ尻から溢れる色気を漂わせてさりげなく誘惑してくる  紗々原ゆり,5.5 GB,https://pics.dmm.co.jp/mono/movie/adult/1hbad706/1hbad706pl.jpg,https://onejav.com/torrent/hbad706/download/76402149/onejav.com_hbad706.torrent,"BIGセール, Drama, Huge Butt, Married Woman, Solowork",Yuri Sasahara,2025-04-10,https://onejav.com/torrent/hbad706
