code,title,size,image_url,torrent_url,tags,actresses,date,page_url
GMEM151,ULTRA SWEET 赤貝 美少女戦士強烈2穴強●絶頂調教 ～SUPER淫穴おマ〇コとケツマ〇コ悲惨なるイキ地獄～ あおい藍,5.8 GB,https://pics.dmm.co.jp/mono/movie/adult/gmem151/gmem151pl.jpg,https://onejav.com/torrent/gmem151/download/77930624/onejav.com_gmem151.torrent,"Anal, Anal Sex, Beautiful Girl, Restraint, Solowork",あおい藍,2026-05-23,https://onejav.com/torrent/gmem151
MISM439,心を込めたイラマで生娘の全て嬲り尽くす 完全服従 喉奥拷問の館 あおい藍,7.7 GB,https://pics.dmm.co.jp/mono/movie/adult/mism439/mism439pl.jpg,https://onejav.com/torrent/mism439/download/10725766/onejav.com_mism439.torrent,"Deep Throating, M女, Nasty, Hardcore, Piss Drinking, SM, Solowork",あおい藍,2026-03-20,https://onejav.com/torrent/mism439
GAJK032,蔵の中で緊縛調教される女子校生 パパ活女学生を襲う恐怖の拉致監禁暴行事件！！ 縄調教とアナル開発と輪●で崩壊する理性 あおい藍,6.7 GB,https://pics.dmm.co.jp/mono/movie/adult/gajk032/gajk032pl.jpg,https://onejav.com/torrent/gajk032/download/59116235/onejav.com_gajk032.torrent,"Confinement, Restraints, Sailor Suit, School Girls, Solowork",あおい藍,2026-02-19,https://onejav.com/torrent/gajk032
MISM420,桜色ケツぽっかり咲き色めきアクメ 初めての喉ボコ快感にウキウキ 喉穴 アナル 膣壺 純正3ツ穴依存中毒者 あおい藍,6.5 GB,https://pics.dmm.co.jp/mono/movie/adult/mism420/mism420pl.jpg,https://onejav.com/torrent/mism420/download/10831407/onejav.com_mism420.torrent,"Anal Sex, Deep Throating, M女, Nasty, Hardcore, SM, Solowork",あおい藍,2025-12-19,https://onejav.com/torrent/mism420
FKOU005,【有給休暇はアナル解禁】 あおい23歳 片道2時間10分 地方零細OLさん あおい藍,5.4 GB,https://pics.dmm.co.jp/mono/movie/adult/fkou005/fkou005pl.jpg,https://onejav.com/torrent/fkou005/download/82135880/onejav.com_fkou005.torrent,"3P, 4P, Anal Sex, Foreign Objects, OL, Shame, Solowork",あおい藍,2025-10-04,https://onejav.com/torrent/fkou005
KBMS187,オナニー・ホテル,4.7 GB,https://pics.dmm.co.jp/mono/movie/adult/kbms187/kbms187pl.jpg,https://onejav.com/torrent/kbms187/download/19814309/onejav.com_kbms187.torrent,"Cosplay, Masturbation","あおい藍, 冨永れおな, 比嘉まりあ",2025-03-22,https://onejav.com/torrent/kbms187
MUKD524,好きなあの子がオジサンなんかと付き合ってるなんて… 僕は失望した。逆恨み同級生レ×プ あおい藍,6.0 GB,https://pics.dmm.co.jp/mono/movie/adult/mukd524/mukd524pl.jpg,https://onejav.com/torrent/mukd524/download/25218482/onejav.com_mukd524.torrent,"Creampie, Cuckold, Prank, Solowork, Uniform, Voyeur",あおい藍,2025-02-14,https://onejav.com/torrent/mukd524
AARM270,あおい藍、フェラチオ女子認定。,5.5 GB,https://pics.dmm.co.jp/mono/movie/adult/aarm270/aarm270pl.jpg,https://onejav.com/torrent/aarm270/download/61448461/onejav.com_aarm270.torrent,"Beautiful Girl, Blow, Cosplay, Solowork",あおい藍,2025-01-09,https://onejav.com/torrent/aarm270
