code,title,size,image_url,torrent_url,tags,actresses,date,page_url
CEMD842,ノーブラ熟巨乳ムチムチおっぱいデート5 ももの真利奈,6.8 GB,https://pics.dmm.co.jp/mono/movie/adult/cemd842/cemd842pl.jpg,https://onejav.com/torrent/cemd842/download/08413928/onejav.com_cemd842.torrent,"Big Tits, Creampie, Mature Woman, Outdoors, Shame, Solowork",ももの真利奈,2026-05-09,https://onejav.com/torrent/cemd842
JUR685,昔私の事が好きだった粗チンの幼馴染が、性欲旺盛な巨チン男に進化していたので、何度も生ハメSEXに溺れてしまった…。 ももの真利奈,5.0 GB,https://pics.dmm.co.jp/mono/movie/adult/jur685/jur685pl.jpg,https://onejav.com/torrent/jur685/download/13772709/onejav.com_jur685.torrent,"Affair, Creampie, Huge Cock, Married Woman, Mature Woman, Solowork",ももの真利奈,2026-03-06,https://onejav.com/torrent/jur685
JUR635,女教師NTR 不良生徒に最愛の妻を寝取られてー。 ももの真利奈,5.9 GB,https://pics.dmm.co.jp/mono/movie/adult/jur635/jur635pl.jpg,https://onejav.com/torrent/jur635/download/04321101/onejav.com_jur635.torrent,"Big Tits, Cuckold, Female Teacher, Married Woman, Mature Woman, Solowork",ももの真利奈,2026-02-06,https://onejav.com/torrent/jur635
JUR623,「一瞬だけでイイので挿れさせて下さい！！」 30歳になっても童貞の義弟に同情して一生の願いを受け挿れたら、相性抜群過ぎて何度もおかわり中出しSEXを求めてしまった私。 ももの真利奈,5.7 GB,https://pics.dmm.co.jp/mono/movie/adult/jur623/jur623pl.jpg,https://onejav.com/torrent/jur623/download/61545909/onejav.com_jur623.torrent,"Big Tits, Creampie, Married Woman, Mature Woman, Solowork, Virgin Man",ももの真利奈,2026-01-09,https://onejav.com/torrent/jur623
JUR576,お風呂を出たら、旦那の家族が全員集合してました。～家族風呂輪●～ ももの真利奈,6.2 GB,https://pics.dmm.co.jp/mono/movie/adult/jur576/jur576pl.jpg,https://onejav.com/torrent/jur576/download/74640185/onejav.com_jur576.torrent,"3P, 4P, Bath, Big Tits, Mature Woman, Shame, Solowork",ももの真利奈,2025-12-05,https://onejav.com/torrent/jur576
JUR536,卒業式の後に…大人になった君へ義母からの贈り物―。 ももの真利奈,6.2 GB,https://pics.dmm.co.jp/mono/movie/adult/jur536/jur536pl.jpg,https://onejav.com/torrent/jur536/download/37895022/onejav.com_jur536.torrent,"Creampie, Married Woman, Mature Woman, Solowork, Stepmother, Virgin Man",ももの真利奈,2025-11-07,https://onejav.com/torrent/jur536
JUR498,倉庫パート中の副業肉便器 脱いだら凄い地味な主婦は最低賃金の951円で抜いてくれます…。 ももの真利奈,9.4 GB,https://pics.dmm.co.jp/mono/movie/adult/jur498/jur498pl.jpg,https://onejav.com/torrent/jur498/download/32785360/onejav.com_jur498.torrent,"Big Tits, Creampie, Married Woman, Mature Woman, Orgy, Solowork",ももの真利奈,2025-10-10,https://onejav.com/torrent/jur498
JUR474,妻には口が裂けても言えません、義母さんを孕ませてしまったなんて…。-1泊2日の温泉旅行で、我を忘れて中出ししまくった僕。- ももの真利奈,5.9 GB,https://pics.dmm.co.jp/mono/movie/adult/jur474/jur474pl.jpg,https://onejav.com/torrent/jur474/download/17556129/onejav.com_jur474.torrent,"Big Tits, Creampie, Hot Spring, Married Woman, Mature Woman, Solowork",ももの真利奈,2025-09-05,https://onejav.com/torrent/jur474
JUR423,麗しきランジェリー、唾液と精液で汚れた酬いの人妻保険外交員 ももの真利奈,9.6 GB,https://pics.dmm.co.jp/mono/movie/adult/jur423/jur423pl.jpg,https://onejav.com/torrent/jur423/download/24049377/onejav.com_jur423.torrent,"Big Tits, Creampie, Lingerie, Married Woman, Mature Woman, Solowork",ももの真利奈,2025-08-08,https://onejav.com/torrent/jur423
JUR047,新人 元レースクイーンJcup人妻 ももの真利奈 37歳 AV DEBUT,6.4 GB,https://pics.dmm.co.jp/mono/movie/adult/jur047/jur047pl.jpg,https://onejav.com/torrent/jur047/download/15577371/onejav.com_jur047.torrent,"Big Tits, Debut Production, Documentary, Married Woman, Mature Woman, Solowork",ももの真利奈,2025-07-04,https://onejav.com/torrent/jur047
