code,title,size,image_url,torrent_url,tags,actresses,date,page_url
DRPT111,家事代行お姉さんのデカ尻が誘っているようにしか見えないから拡張無しの即アナルファックで肛門の気持ち良さを叩きこんでやった！佐々木咲和 ゆうきすず 光島遼花,6.3 GB,https://pics.dmm.co.jp/mono/movie/adult/1drpt111/1drpt111pl.jpg,https://onejav.com/torrent/drpt111/download/06326183/onejav.com_drpt111.torrent,"Anal, Anal Sex, Enema, Huge Butt, Impromptu Sex","佐々木咲和, ゆうきすず, 光島遼花",2026-05-29,https://onejav.com/torrent/drpt111
DDFF051,鬼畜学園 イラマチオ浣腸体罰 ゆうきすず,5.4 GB,https://pics.dmm.co.jp/mono/movie/adult/ddff051/ddff051pl.jpg,https://onejav.com/torrent/ddff051/download/15459401/onejav.com_ddff051.torrent,"Deep Throating, Enema, Evil, School Stuff, Solowork",ゆうきすず,2026-05-16,https://onejav.com/torrent/ddff051
DOKS665,バレたらヤバい状況で敏感乳首をイジられお漏らし絶頂してしまう女子●生たち,5.3 GB,https://pics.dmm.co.jp/mono/movie/adult/h_139doks665/h_139doks665pl.jpg,https://onejav.com/torrent/doks665/download/01561686/onejav.com_doks665.torrent,"Blow, School Girls, Shame, Small Tits, Urination","るるちゃ。, 渡来ふう, 音羽美鈴, ゆうきすず, 朝海凪咲",2026-03-18,https://onejav.com/torrent/doks665
DOKS663,バレたらマズイ状況でこっそり吐息を漏らす 働くオンナの足腰ガクブル角オナニー,4.4 GB,https://pics.dmm.co.jp/mono/movie/adult/h_139doks663/h_139doks663pl.jpg,https://onejav.com/torrent/doks663/download/48567351/onejav.com_doks663.torrent,"Big Tits, Butt, Close Up, Leg Fetish, Masturbation, OL, Other Fetish, Pantyhose, Slut","ゆうきすず, 渡来ふう, 朝海凪咲, 音羽美鈴, るるちゃ。",2026-03-05,https://onejav.com/torrent/doks663
MISM427,アナルガンギマリ！喉奥貫通！膣破壊！歪に溶け合う異常接近3穴レズ 北野未奈 ゆうきすず,8.7 GB,https://pics.dmm.co.jp/mono/movie/adult/mism427/mism427pl.jpg,https://onejav.com/torrent/mism427/download/34373950/onejav.com_mism427.torrent,"Anal, Deep Throating, M女, Nasty, Hardcore","Mina Kitano, ゆうきすず, 真咲南朋",2026-02-20,https://onejav.com/torrent/mism427
