code,title,size,image_url,torrent_url,tags,actresses,date,page_url
MBDD2178,Amrita～ねねのいる世界～/三澄寧々,3.9 GB,https://pics.dmm.co.jp/mono/movie/adult/n_707mbdd2178/n_707mbdd2178pl.jpg,https://onejav.com/torrent/mbdd2178/download/36558133/onejav.com_mbdd2178.torrent,"Idol, Image Video, Solowork",三澄寧々,2026-05-30,https://onejav.com/torrent/mbdd2178
IPZZ827,美貌・色気・テクニック 大人の魅力を凝縮した美麗お姉さんに脳とチ○ポをトロけさせられる最高の受け身オナサポ体験 三澄寧々,3.9 GB,https://pics.dmm.co.jp/mono/movie/adult/ipzz827/ipzz827pl.jpg,https://onejav.com/torrent/ipzz827/download/31441482/onejav.com_ipzz827.torrent,"Big Tits, Dirty Words, Idol, Masturbation Support, Solowork",三澄寧々,2026-05-08,https://onejav.com/torrent/ipzz827
IPZZ809,出張先が記録的豪雨で高嶺の花の女社長と相部屋に…大人の色気と官能的美ボディにフル勃起した童貞の僕を受け入れてくれた優しさに甘えて朝まで暴走むしゃぶりつき性交 三澄寧々,5.7 GB,https://pics.dmm.co.jp/mono/movie/adult/ipzz809/ipzz809pl.jpg,https://onejav.com/torrent/ipzz809/download/21948869/onejav.com_ipzz809.torrent,"Big Tits, Cuckold, Idol, Kiss, Solowork",三澄寧々,2026-04-10,https://onejav.com/torrent/ipzz809
IPZZ788,艶めく色気の美神 下品解禁ー。怒涛の快楽責めで痙攣・失禁・仰け反り連発 本人史上最大エクスタシー 三澄寧々,5.0 GB,https://pics.dmm.co.jp/mono/movie/adult/ipzz788/ipzz788pl.jpg,https://onejav.com/torrent/ipzz788/download/16891078/onejav.com_ipzz788.torrent,"Acme · Orgasm, Big Tits, Idol, Older Sister, Solowork",三澄寧々,2026-03-06,https://onejav.com/torrent/ipzz788
IPZZ762,地方ロケで訪れた温泉旅館でマネージャーに仕組まれ地元のゲス社長と相部屋枕強要…醜い絶倫おやじに何度もイカされ堕ちていく美しきグラビアアイドル 三澄寧々,5.1 GB,https://pics.dmm.co.jp/mono/movie/adult/ipzz762/ipzz762pl.jpg,https://onejav.com/torrent/ipzz762/download/38131111/onejav.com_ipzz762.torrent,"Big Tits, Idol, Older Sister, Solowork, Titty Fuck",三澄寧々,2026-02-06,https://onejav.com/torrent/ipzz762
IPZZ748,気品溢れる美人お姉さんがフェロモンを振り撒きながら唾液まみれで勃起チ○ポをむしゃぶり尽くす最高のフェラチオ顔射 三澄寧々,5.2 GB,https://pics.dmm.co.jp/mono/movie/adult/ipzz748/ipzz748pl.jpg,https://onejav.com/torrent/ipzz748/download/63770561/onejav.com_ipzz748.torrent,"Blow, Facials, Older Sister, Orgy, Solowork",三澄寧々,2026-01-09,https://onejav.com/torrent/ipzz748
NTRH027,側に彼女がいるのに僕が寝取られた 溢れ出る色気と淫美なランジェリー姿を見せつけて惑わせる向かいの部屋の誘惑美女 三澄寧々,5.1 GB,https://pics.dmm.co.jp/mono/movie/adult/ntrh027/ntrh027pl.jpg,https://onejav.com/torrent/ntrh027/download/77800842/onejav.com_ntrh027.torrent,"Big Tits, Cowgirl, Cuckold, Older Sister, Slut, Solowork",三澄寧々,2025-12-26,https://onejav.com/torrent/ntrh027
IPZZ708,溢れ出る色気と艶で雄を求める美女と快楽のままに貪り合う濃厚ベロキスと官能セックス 三澄寧々,5.7 GB,https://pics.dmm.co.jp/mono/movie/adult/ipzz708/ipzz708pl.jpg,https://onejav.com/torrent/ipzz708/download/01366705/onejav.com_ipzz708.torrent,"Big Tits, Idol, Kiss, Solowork, Sweat",三澄寧々,2025-11-07,https://onejav.com/torrent/ipzz708
IPZZ689,美女のイク姿は薔薇より美しいー。艶っぽさ溢れ出すエロス解放大絶頂4本番 三澄寧々,9.2 GB,https://pics.dmm.co.jp/mono/movie/adult/ipzz689/ipzz689pl.jpg,https://onejav.com/torrent/ipzz689/download/04016412/onejav.com_ipzz689.torrent,"Big Tits, Idol, Nasty, Hardcore, Older Sister, Solowork",三澄寧々,2025-10-10,https://onejav.com/torrent/ipzz689
