code,title,size,image_url,torrent_url,tags,actresses,date,page_url
SS143,素人セーラー服生中出し 上川星空 清純派色白美少女×Aカップ敏感微乳×孕ませ生中出し,5.7 GB,https://pics.dmm.co.jp/mono/movie/adult/h_113ss143/h_113ss143pl.jpg,https://onejav.com/torrent/ss143/download/40865533/onejav.com_ss143.torrent,"Bloomers, Creampie, School Girls, School Uniform, Small Tits, Solowork, Urination",上川星空,2026-02-26,https://onejav.com/torrent/ss143
ARM982,"Only Here, I Think That The Panchira In The Work Specializing In Legs And Thighs Is Quite Missing",10.1 GB,https://pics.dmm.co.jp/mono/movie/adult/arm982so/arm982sopl.jpg,https://onejav.com/torrent/arm982/download/74941584/onejav.com_arm982.torrent,"4HR+, Best, Omnibus, Butt, Leg Fetish, Slut, Underwear","Mio Kimishima, 阿部乃みく, Asahi Mizuno, 中条カノン, 上川星空, 水嶋アリス, さくらい麻乃, 高城アミナ, 大城さおり, 七瀬ひとみ",2021-05-22,https://onejav.com/torrent/arm982
MIZD219,2 Minutes Before Ejaculation Piston Rush! Small SEX 120 Barrage That Does Not Shake Even If It Explodes,3.7 GB,https://pics.dmm.co.jp/mono/movie/adult/mizd219/mizd219pl.jpg,https://onejav.com/torrent/mizd219/download/57974736/onejav.com_mizd219.torrent,"4HR+, Beautiful Girl, Creampie, Digital Mosaic, Slender, Tits","七沢みあ, Minami Hatsukawa, 松本いちか, Akari Mitani, Kaede Fuyutsuki, Yuna Yamakawa, 上川星空, 咲乃小春, 篠崎みお, Renon Kanae",2021-01-31,https://onejav.com/torrent/mizd219
SRMC019,,5.0 GB,https://pics.dmm.co.jp/mono/movie/adult/srmc019/srmc019pl.jpg,https://onejav.com/torrent/srmc019/download/90639015/onejav.com_srmc019.torrent,,上川星空,2021-01-27,https://onejav.com/torrent/srmc019
SRMC020,Hypnosis Document Starry Sky Kamikawa VS Event ● Surgeon RED Second Volume In A Psychological Room,5.1 GB,https://pics.dmm.co.jp/mono/movie/adult/srmc020/srmc020pl.jpg,https://onejav.com/torrent/srmc020/download/46355044/onejav.com_srmc020.torrent,"Abuse, Beautiful Girl, Hypnosis, Solowork, Squirting",上川星空,2021-01-27,https://onejav.com/torrent/srmc020
FGAN012,Panty Fetish Lovers Starry Sky Kamikawa Starry Sky,5.1 GB,https://pics.dmm.co.jp/mono/movie/adult/h_1440fgan012/h_1440fgan012pl.jpg,https://onejav.com/torrent/fgan012/download/83351775/onejav.com_fgan012.torrent,"Creampie, Mini Skirt, POV, School Uniform, Solowork, Underwear",上川星空,2021-01-27,https://onejav.com/torrent/fgan012
IENF117,,3.1 GB,https://pics.dmm.co.jp/mono/movie/adult/1ienf117/1ienf117pl.jpg,https://onejav.com/torrent/ienf117/download/01806600/onejav.com_ienf117.torrent,,"上川星空, 河奈亜依, 美咲かんな, 七菜原ココ, Rika Aimi, 河合ゆい, いとう美優, 冬愛ことね, 笠木いちか, Rui Hitzuki",2020-12-25,https://onejav.com/torrent/ienf117
MDTM690,Famous Private Girls Who Can Not Be Imagined And Can Not Be Shown To Anyone ● Raw Nature Bare Raw Copulation 10,2.3 GB,https://pics.dmm.co.jp/mono/movie/adult/84mdtm690/84mdtm690pl.jpg,https://onejav.com/torrent/mdtm690_2/download/96062588/onejav.com_mdtm690_2.torrent,"4HR+, Beautiful Girl, Creampie, School Girls, Toy, Uniform","上川星空, 朱果, 佐藤りこ, Aoi Kururigi",2020-12-16,https://onejav.com/torrent/mdtm690_2
NHDTB429,Kamikawa Starry Sky Goodbye Anal Virgin,8.3 GB,https://pics.dmm.co.jp/mono/movie/adult/1nhdtb429/1nhdtb429pl.jpg,https://onejav.com/torrent/nhdtb429_2/download/04016661/onejav.com_nhdtb429_2.torrent,"3P, 4P, Anal, Beautiful Girl, Humiliation, Slender, Solowork",上川星空,2020-08-28,https://onejav.com/torrent/nhdtb429_2
