code,title,size,image_url,torrent_url,tags,actresses,date,page_url
HDKA330,はだかの主婦 板橋区在住九井スナオ（27）,5.2 GB,https://pics.dmm.co.jp/mono/movie/adult/h_237hdka330/h_237hdka330pl.jpg,https://onejav.com/torrent/hdka330/download/01365964/onejav.com_hdka330.torrent,"Big Tits, BIGセール, Close Up, Creampie, Huge Butt, Married Woman, Mature Woman, Other Fetish, Solowork",九井スナオ,2026-03-20,https://onejav.com/torrent/hdka330
MVSD683,学生時代の体罰教師とまさかの再会。体罰で目覚めたマゾ願望を見透かされ調教され謝罪しながらアクメする変態喪女に仕上げられました。 九井スナオ,6.1 GB,https://pics.dmm.co.jp/mono/movie/adult/mvsd683/mvsd683pl.jpg,https://onejav.com/torrent/mvsd683/download/32255586/onejav.com_mvsd683.torrent,"Big Tits, Creampie, Deep Throating, Nasty, Hardcore, Outdoors, Solowork",九井スナオ,2026-03-13,https://onejav.com/torrent/mvsd683
YMDD486,白目痙攣ガンギマリ巨乳妻 九井スナオ,6.2 GB,https://pics.dmm.co.jp/mono/movie/adult/ymdd486/ymdd486pl.jpg,https://onejav.com/torrent/ymdd486/download/19722286/onejav.com_ymdd486.torrent,"Big Tits, Creampie, Cuckold, Drama, Married Woman, Solowork",九井スナオ,2026-03-02,https://onejav.com/torrent/ymdd486
MIAB615,「この保健室、エロい匂いがする」敏感早漏は亀頭責めスパルタ治療で限界射精管理 九井スナオ,5.0 GB,https://pics.dmm.co.jp/mono/movie/adult/miab615/miab615pl.jpg,https://onejav.com/torrent/miab615/download/32039446/onejav.com_miab615.torrent,"Creampie, Female Teacher, Handjob, M男, Slut, Solowork",九井スナオ,2026-02-13,https://onejav.com/torrent/miab615
CEAD725,巨大デカ尻で男を誘い、爆乳Hカップで勃起チ〇ポを包み込む、生中出し好きの淫乱肉欲女 九井スナオ,5.7 GB,https://pics.dmm.co.jp/mono/movie/adult/cead725/cead725pl.jpg,https://onejav.com/torrent/cead725/download/50253596/onejav.com_cead725.torrent,"Big Tits, Creampie, Huge Butt, POV, Solowork, Titty Fuck",九井スナオ,2026-01-24,https://onejav.com/torrent/cead725
MDBK400,【奇跡】デリヘル呼んだら地元の巨乳な友達で非常においしい思いをした件！！8,5.9 GB,https://pics.dmm.co.jp/mono/movie/adult/mdbk400/mdbk400pl.jpg,https://onejav.com/torrent/mdbk400/download/52254510/onejav.com_mdbk400.torrent,"Big Tits, Creampie, Documentary, Prostitutes, Titty Fuck","椿りか, Mina Kitano, 九井スナオ",2026-01-24,https://onejav.com/torrent/mdbk400
SORA624,僕をいじめるDQNに自宅占拠され居座り1週間レ●プ！地味な隠れ巨乳の姉ちゃんが身代わりに串刺し4P集団輪●されアヘ堕ちする姿にクズ勃起 九井スナオ,5.3 GB,https://pics.dmm.co.jp/mono/movie/adult/sora624/sora624pl.jpg,https://onejav.com/torrent/sora624/download/23779040/onejav.com_sora624.torrent,"Big Tits, Deep Throating, Evil, Solowork",九井スナオ,2026-01-02,https://onejav.com/torrent/sora624
CEMD786,恥辱、陵●、とびっこ装着・繁華街デート！35 九井スナオ,6.1 GB,https://pics.dmm.co.jp/mono/movie/adult/cemd786/cemd786pl.jpg,https://onejav.com/torrent/cemd786/download/34798118/onejav.com_cemd786.torrent,"Big Tits, BIGセール, Creampie, Huge Butt, Outdoors, POV, Solowork",九井スナオ,2025-12-20,https://onejav.com/torrent/cemd786
GVH806,デカパイ痴女のコスプレ淫語責め 九井スナオ,6.5 GB,https://pics.dmm.co.jp/mono/movie/adult/gvh806/gvh806pl.jpg,https://onejav.com/torrent/gvh806/download/15004343/onejav.com_gvh806.torrent,"Big Tits, Cosplay, Dirty Words, Slut, Solowork, Titty Fuck",九井スナオ,2025-12-20,https://onejav.com/torrent/gvh806
MKMP693,清楚で淫らなむちぷるオッパイに囲まれて朝昼晩ヌキ放題！！射精治療と称して繰り返しザーメン搾り取られる巨乳全裸ナースの献身ハーレム看護,6.1 GB,https://pics.dmm.co.jp/mono/movie/adult/mkmp693/mkmp693pl.jpg,https://onejav.com/torrent/mkmp693/download/02844177/onejav.com_mkmp693.torrent,"3P, 4P, Big Tits, BIGセール, Harem, Hospital, Clinic, Nurse","有岡みう, 羽月乃蒼, 九井スナオ",2025-12-06,https://onejav.com/torrent/mkmp693
