code,title,size,image_url,torrent_url,tags,actresses,date,page_url
HMN816,元男子校に転校してボーイッシュ男子になりすましてたのに…プールの授業で乳首ビンビンつるぺた男水着で女バレして、絶倫同級生に敏感乳首こねくられメス堕ち中出し肉便器に堕ちた私… 倉本すみれ,6.5 GB,https://pics.dmm.co.jp/mono/movie/adult/hmn816/hmn816pl.jpg,https://onejav.com/torrent/hmn816/download/24505664/onejav.com_hmn816.torrent,"Creampie, Drama, Nasty, Hardcore, School Swimsuit, Slender, Solowork",倉本すみれ,2026-04-24,https://onejav.com/torrent/hmn816
MUDR371,没落令嬢・闇性接待 会社を立て直す為、キモオジ社長にいいなりレ×プされる高飛車少女 倉本すみれ,5.0 GB,https://pics.dmm.co.jp/mono/movie/adult/mudr371/mudr371pl.jpg,https://onejav.com/torrent/mudr371/download/60655290/onejav.com_mudr371.torrent,"Beautiful Girl, Creampie, Maid, Shame, Solowork, Uniform",倉本すみれ,2026-04-22,https://onejav.com/torrent/mudr371
HMN829,性に目覚めはじめたボーイッシュ少女（息子の幼馴染）のSEXの練習台になって何度も何度も中出しでイカせまくった 倉本すみれ,6.6 GB,https://pics.dmm.co.jp/mono/movie/adult/hmn829/hmn829pl.jpg,https://onejav.com/torrent/hmn829/download/64940492/onejav.com_hmn829.torrent,"Beautiful Girl, Blow, Creampie, Drama, Slender, Solowork",倉本すみれ,2026-03-20,https://onejav.com/torrent/hmn829
MUDR353,少女を虜にする方法 背徳感と快楽を利用して少女に中出し＆種付け洗脳！ 倉本すみれ,4.9 GB,https://pics.dmm.co.jp/mono/movie/adult/mudr353/mudr353pl.jpg,https://onejav.com/torrent/mudr353/download/64498552/onejav.com_mudr353.torrent,"Acme · Orgasm, Beautiful Girl, Creampie, Restraint, Slender, Solowork",倉本すみれ,2026-03-13,https://onejav.com/torrent/mudr353
DASS858,一緒に上京してきた可愛い彼女は俺のために絶倫権力おじさんに種付けセックスされていた。 倉本すみれ,6.1 GB,https://pics.dmm.co.jp/mono/movie/adult/dass858/dass858pl.jpg,https://onejav.com/torrent/dass858/download/79818157/onejav.com_dass858.torrent,"Beautiful Girl, Cosplay, Creampie, Cuckold, Slender, Solowork",倉本すみれ,2026-03-06,https://onejav.com/torrent/dass858
HMN797,「これが村の淫習だ」夏休みに1週間の帰省中、初心ま○こを村長に捧げさせられて何度も何度も中出しされたワタシ… 倉本すみれ,5.0 GB,https://pics.dmm.co.jp/mono/movie/adult/hmn797/hmn797pl.jpg,https://onejav.com/torrent/hmn797/download/79722430/onejav.com_hmn797.torrent,"3P, 4P, Creampie, Small Tits, Solowork, Squirting, Sweat",倉本すみれ,2026-02-20,https://onejav.com/torrent/hmn797
RKI734,新・世界一媚薬でキマる変態女のトランス失禁キメセク大絶頂FUCK！！ 倉本すみれ,4.7 GB,https://pics.dmm.co.jp/mono/movie/adult/rki734/rki734pl.jpg,https://onejav.com/torrent/rki734/download/38019476/onejav.com_rki734.torrent,"Acme · Orgasm, Creampie, Drug, Orgy, Solowork, Squirting",倉本すみれ,2026-02-06,https://onejav.com/torrent/rki734
MUDR355,男装痴女の童貞狩りスクールライフ 男子校の同級生がまさかの女の子！？秘密を知ってしまったクラスメイトを痴女誘惑で口封じ 倉本すみれ,4.9 GB,https://pics.dmm.co.jp/mono/movie/adult/mudr355/mudr355pl.jpg,https://onejav.com/torrent/mudr355/download/72520087/onejav.com_mudr355.torrent,"Beautiful Girl, Creampie, Kiss, School Uniform, Slut, Solowork",倉本すみれ,2026-01-16,https://onejav.com/torrent/mudr355
HMN775,人工膣マ○コは人間の200倍の気持ち良さ！濡れ感・温度・締め具合、調整可能！！ 中出しすればするほどボクの言いなりになってくれる中出し特化型性処理セクサロイド 倉本すみれ,5.2 GB,https://pics.dmm.co.jp/mono/movie/adult/hmn775/hmn775pl.jpg,https://onejav.com/torrent/hmn775/download/44504998/onejav.com_hmn775.torrent,"Beautiful Girl, Creampie, Drama, Prank, Slender, Solowork",倉本すみれ,2025-12-23,https://onejav.com/torrent/hmn775
MUDR348,「お姉ちゃんにはなりたくない！！」大好きな母親を独占するために、子作りできなくなるまで再婚義父のザーメン搾り取る超マザコン美少女 倉本すみれ,6.8 GB,https://pics.dmm.co.jp/mono/movie/adult/mudr348/mudr348pl.jpg,https://onejav.com/torrent/mudr348/download/80596279/onejav.com_mudr348.torrent,"Beautiful Girl, Breasts, Creampie, Slender, Solowork, Squirting",倉本すみれ,2025-12-12,https://onejav.com/torrent/mudr348
