code,title,size,image_url,torrent_url,tags,actresses,date,page_url
EMLB088,鍛錬を重ねた至高のケツ穴に全挿入じゅぶにゅぷぅ！長～い超異次元ロングディルド丸飲みアナルファッカー2nd BEST,10.1 GB,https://pics.dmm.co.jp/mono/movie/adult/emlb088/emlb088pl.jpg,https://onejav.com/torrent/emlb088/download/02575884/onejav.com_emlb088.torrent,"4HR+, Anal Sex, Best, Omnibus, M女, Nasty, Hardcore, Toy","Kozue Minami, 天晴乃愛, 音琴るい, しおかわ雲丹, 一場れいか, 生田りん, 十川ありさ, 佐久間つな, 八神のえみ",2026-03-24,https://onejav.com/torrent/emlb088
JLZ063,熟女レズ ヨガりまくり ヨガ教室のエロ先生と生徒さん（JLZ-063）,5.4 GB,https://pics.dmm.co.jp/mono/movie/adult/jlz063/jlz063pl.jpg,https://onejav.com/torrent/jlz063/download/11859284/onejav.com_jlz063.torrent,"Electric Massager, Mature Woman, Urination, Yoga","宇佐美すい, 八神のえみ",2026-02-28,https://onejav.com/torrent/jlz063
LULU414,旦那が出張中、2人きりの自宅で絶倫デカ尻ボディビルダー叔母さんの筋トレ尻に我慢できず強圧マッスルアナルに即ハメ！アヘ顔痙攣するほどケツ穴イキさせて肛門中出ししまくった。 八神のえみ,6.6 GB,https://pics.dmm.co.jp/mono/movie/adult/lulu414/lulu414pl.jpg,https://onejav.com/torrent/lulu414/download/72866737/onejav.com_lulu414.torrent,"Anal Sex, Aunt, Creampie, Incest, Solowork",八神のえみ,2025-11-28,https://onejav.com/torrent/lulu414
RCTD699,ボディビルダー界のレズNo.1を決めるマッスル頂上決戦！！ ガチンコ筋肉女子レズバトル 八神のえみVS神崎麗華,5.3 GB,https://pics.dmm.co.jp/mono/movie/adult/1rctd699/1rctd699pl.jpg,https://onejav.com/torrent/rctd699/download/43667692/onejav.com_rctd699.torrent,"Muscle, Nasty, Hardcore, Planning","八神のえみ, 神崎麗華",2025-11-25,https://onejav.com/torrent/rctd699
FOCS285,アナル処女を調教した人は婚約者の兄だった…蘇る肛門快楽に絶対服従！二穴中出しNTRサンドイッチFUCK 八神のえみ,5.1 GB,https://pics.dmm.co.jp/mono/movie/adult/focs285/focs285pl.jpg,https://onejav.com/torrent/focs285/download/36901259/onejav.com_focs285.torrent,"Anal, Big Tits, Cuckold, Deep Throating, M女, Solowork",八神のえみ,2025-11-21,https://onejav.com/torrent/focs285
MFYD046,黒人トレーナーにアナル覚醒させられた女 八神のえみ,5.0 GB,https://pics.dmm.co.jp/mono/movie/adult/mfyd046/mfyd046pl.jpg,https://onejav.com/torrent/mfyd046/download/35524082/onejav.com_mfyd046.torrent,"Anal Sex, Black Actor, Muscle, M女, Nasty, Hardcore, Solowork",八神のえみ,2025-09-15,https://onejav.com/torrent/mfyd046
MIAB528,肛門マスキュラ― ガッチガチ鋼鉄アナル 肉弾ケツメド3穴貫通ドMモンスター 八神のえみ,6.7 GB,https://pics.dmm.co.jp/mono/movie/adult/miab528/miab528pl.jpg,https://onejav.com/torrent/miab528/download/06844476/onejav.com_miab528.torrent,"3P, 4P, Anal Sex, Creampie, Deep Throating, Nasty, Hardcore, Solowork",八神のえみ,2025-09-12,https://onejav.com/torrent/miab528
NKD331,女優ハメ撮り 八神のえみ,4.2 GB,https://pics.dmm.co.jp/mono/movie/adult/nkd331/nkd331pl.jpg,https://onejav.com/torrent/nkd331/download/65329231/onejav.com_nkd331.torrent,"Documentary, Electric Massager, Hotel, M女, Nasty, Hardcore, Solowork",八神のえみ,2025-07-05,https://onejav.com/torrent/nkd331
MISM370,某有名コンテストクラシックモデル部門受賞！ジム週8通う筋肉マゾ女にムッキムキ最狂トレーニング！鍛え抜かれたケツ穴！ヴァギナ！ノドマン！マッスル3穴性交DEBUT 八神のえみ,5.2 GB,https://pics.dmm.co.jp/mono/movie/adult/mism370/mism370pl.jpg,https://onejav.com/torrent/mism370/download/38930319/onejav.com_mism370.torrent,"Anal Sex, Deep Throating, Muscle, M女, Nasty, Hardcore, Solowork",八神のえみ,2025-02-21,https://onejav.com/torrent/mism370
MIAB443,イラマ！首絞め！アナルセックス！ぜ～んぶ大好き！健康的お姉さんにイキなり肛門ポッカリ中出し3穴AVデビュー！ 八神のえみ,7.4 GB,https://pics.dmm.co.jp/mono/movie/adult/miab443/miab443pl.jpg,https://onejav.com/torrent/miab443/download/35600783/onejav.com_miab443.torrent,"Anal Sex, Creampie, Debut Production, Deep Throating, Nasty, Hardcore, Solowork",八神のえみ,2025-02-04,https://onejav.com/torrent/miab443
