code,title,size,image_url,torrent_url,tags,actresses,date,page_url
EMLB088,鍛錬を重ねた至高のケツ穴に全挿入じゅぶにゅぷぅ！長～い超異次元ロングディルド丸飲みアナルファッカー2nd BEST,10.1 GB,https://pics.dmm.co.jp/mono/movie/adult/emlb088/emlb088pl.jpg,https://onejav.com/torrent/emlb088/download/02575884/onejav.com_emlb088.torrent,"4HR+, Anal Sex, Best, Omnibus, M女, Nasty, Hardcore, Toy","Kozue Minami, 天晴乃愛, 音琴るい, しおかわ雲丹, 一場れいか, 生田りん, 十川ありさ, 佐久間つな, 八神のえみ",2026-03-24,https://onejav.com/torrent/emlb088
NEO837,全開鼻フック 十川ありさ,5.0 GB,https://pics.dmm.co.jp/mono/movie/adult/433neo837/433neo837pl.jpg,https://onejav.com/torrent/neo837/download/80645582/onejav.com_neo837.torrent,"Facials, Nose Hook, Older Sister, Shame, Solowork",十川ありさ,2025-09-25,https://onejav.com/torrent/neo837
RMER049,滴り落ちるヨダレ一線 ボールギャグを嵌められた女たち,5.0 GB,https://pics.dmm.co.jp/mono/movie/adult/rmer049/rmer049pl.jpg,https://onejav.com/torrent/rmer049/download/82027184/onejav.com_rmer049.torrent,"Big Tits, Bukkake, Multiple Story, Restraint, Shame","柏木こなつ, 有加里ののか, Shiho Hamabe, 佐久間楓, 日々樹梨花, 十川ありさ",2025-09-20,https://onejav.com/torrent/rmer049
DFE104,喉奥発射、希望します。 十川ありさ,5.3 GB,https://pics.dmm.co.jp/mono/movie/adult/2dfe104/2dfe104pl.jpg,https://onejav.com/torrent/dfe104/download/88603804/onejav.com_dfe104.torrent,"3P, 4P, Breasts, Cruel Expression, Deep Throating, Evil, Huge Cock, M女, Nasty, Hardcore, Older Sister, Piss Drinking, Solowork, Tall",十川ありさ,2025-09-04,https://onejav.com/torrent/dfe104
BBAN516,十川ありさ レズ解禁 ママ友と禁断の愛人契約 奥様同士のドM懇願レズ調教 友田彩也香,5.0 GB,https://pics.dmm.co.jp/mono/movie/adult/bban516/bban516pl.jpg,https://onejav.com/torrent/bban516/download/56603688/onejav.com_bban516.torrent,"Beautiful Girl, Breasts, Kiss, Lesbian Kiss","Ayaka Tomoda, 十川ありさ",2025-01-10,https://onejav.com/torrent/bban516
RKI687,透明感抜群の柔肌美女 初アナルSEX二穴絶頂！ 驚く程に真っ白い肌で感度抜群。丸の内OL系美女のギャップたっぷりアナル姦（ハート）まさかのアナル愛撫で潮吹き絶頂！ 十川ありさ,5.2 GB,https://pics.dmm.co.jp/mono/movie/adult/rki687/rki687pl.jpg,https://onejav.com/torrent/rki687/download/09935364/onejav.com_rki687.torrent,"Anal, Anal Sex, Older Sister, Slender, Solowork",十川ありさ,2024-09-06,https://onejav.com/torrent/rki687
