code,title,size,image_url,torrent_url,tags,actresses,date,page_url
DFDM072,僕への愛と性欲がバグってる何でも言いなりミニマムJ系ちゃん。 夕木こいろ,5.1 GB,https://pics.dmm.co.jp/mono/movie/adult/2dfdm072/2dfdm072pl.jpg,https://onejav.com/torrent/dfdm072/download/92925759/onejav.com_dfdm072.torrent,"Beautiful Girl, Bloomers, Cum, Mini, Petite, School Girls, School Uniform, Shaved, Solowork",夕木こいろ,2026-03-29,https://onejav.com/torrent/dfdm072
DNJR154,Wサキュバスに寝込みを襲われて、死ぬほどザーメンを吸い取られたボク,5.6 GB,https://pics.dmm.co.jp/mono/movie/adult/dnjr154/dnjr154pl.jpg,https://onejav.com/torrent/dnjr154/download/66160760/onejav.com_dnjr154.torrent,"Creampie, Cum, M男, Slut, Subjectivity","天羽りりか, 綾美なな, 由良かな, 夕木こいろ, 望月つぼみ, 南日菜乃, 皆月ひかる, 下川紬",2026-03-14,https://onejav.com/torrent/dnjr154
HOKS216,地味で大人しい肉便器 わたしは職場の性処理係… 夕木こいろ,4.3 GB,https://pics.dmm.co.jp/mono/movie/adult/hoks216/hoks216pl.jpg,https://onejav.com/torrent/hoks216/download/39259294/onejav.com_hoks216.torrent,"Big Tits, Blow, Drama, Huge Butt, Nasty, Hardcore, Solowork",夕木こいろ,2026-01-31,https://onejav.com/torrent/hoks216
AVSA414,ハメをハズしてハメまくり！クラブでナンパ キメセクモクモクガンギマリBitch（AVSA-414）,6.6 GB,https://pics.dmm.co.jp/mono/movie/adult/avsa414/avsa414pl.jpg,https://onejav.com/torrent/avsa414/download/08302644/onejav.com_avsa414.torrent,"Big Tits, BIGセール, Bitch, Gal, Nampa, Rolling Back Eyes, Fainting","Rio Nagarekawa, 夕木こいろ",2025-12-20,https://onejav.com/torrent/avsa414
DNJR150,女子校専科 M男人間小便器 本当の便器扱い、してあげるからね 2便器目,5.3 GB,https://pics.dmm.co.jp/mono/movie/adult/dnjr150/dnjr150pl.jpg,https://onejav.com/torrent/dnjr150/download/59235567/onejav.com_dnjr150.torrent,"M男, Piss Drinking, School Girls, School Stuff, Slut","由良かな, 望月つぼみ, 夕木こいろ, 南日菜乃, 広瀬このみ",2025-12-20,https://onejav.com/torrent/dnjr150
MGMQ161,変態Mパパを濃厚メスイキさせる天然小悪魔なパパ活痴女 夕木こいろ,5.2 GB,https://pics.dmm.co.jp/mono/movie/adult/mgmq161/mgmq161pl.jpg,https://onejav.com/torrent/mgmq161/download/52484340/onejav.com_mgmq161.torrent,"Anal, Blow, Handjob, M男, Slut, Solowork",夕木こいろ,2025-11-15,https://onejav.com/torrent/mgmq161
APGH047,おっぱいマ●コの極上パイズリ 涎＆本気マン汁べっとり イキ過ぎ裏垢デート 放課後美少女とイチャLOVEハメ撮りデート 夕木こいろ,6.5 GB,https://pics.dmm.co.jp/mono/movie/adult/apgh047/apgh047pl.jpg,https://onejav.com/torrent/apgh047/download/80487150/onejav.com_apgh047.torrent,"Acme · Orgasm, Big Tits, Facials, POV, School Girls, Solowork",夕木こいろ,2025-11-10,https://onejav.com/torrent/apgh047
ROYD271,僕の姉は地味で控えめですが、眼鏡を外すと、絶世の美女で我慢できず迫ったら素股からの生挿入で初中出しをさせてくれました。 夕木こいろ,4.7 GB,https://pics.dmm.co.jp/mono/movie/adult/royd271/royd271pl.jpg,https://onejav.com/torrent/royd271/download/23936799/onejav.com_royd271.torrent,"Big Tits, Blow, Creampie, Digital Mosaic, Sister, Solowork",夕木こいろ,2025-10-24,https://onejav.com/torrent/royd271
KNAM080,完ナマSTYLE@こいろ オフパコ中出し浮気 ネトゲで知り合った男と1対1の密室オフ会で媚薬を盛られハメられながら彼氏に電話。ドキドキもろバレ中出しSEX ミニマムGカップ娘 夕木こいろ,4.2 GB,https://pics.dmm.co.jp/mono/movie/adult/h_491knam080/h_491knam080pl.jpg,https://onejav.com/torrent/knam080/download/97293087/onejav.com_knam080.torrent,"Beautiful Girl, Big Tits, Blow, Creampie, Solowork, Titty Fuck",夕木こいろ,2025-09-27,https://onejav.com/torrent/knam080
BABD021,働く女性に半中半外 看護師編 夕木こいろ,5.1 GB,https://pics.dmm.co.jp/mono/movie/adult/babd021/babd021pl.jpg,https://onejav.com/torrent/babd021/download/02783206/onejav.com_babd021.torrent,"Big Tits, Bukkake, Conceived, Creampie, POV, Solowork",夕木こいろ,2025-08-30,https://onejav.com/torrent/babd021
