code,title,size,image_url,torrent_url,tags,actresses,date,page_url
GNS147,秘蔵映像流出 拘束寸止め焦らし羞恥で頭が真っ白になるくらいアへりイキ漏らす美人妻たち4名,9.1 GB,https://pics.dmm.co.jp/mono/movie/adult/h_1596gns147/h_1596gns147pl.jpg,https://onejav.com/torrent/gns147/download/62246395/onejav.com_gns147.torrent,"BIGセール, Close Up, Humiliation, Married Woman, Shame, Urination","Kyouka Tachibana, 足立友梨, 小坂ひまり, 滝川すみれ",2026-03-25,https://onejav.com/torrent/gns147
PRED847,健全メンズエステで働き始めた巨乳彼女がしつこい本番交渉に負けるハズない。 小坂ひまり,5.2 GB,https://pics.dmm.co.jp/mono/movie/adult/pred847/pred847pl.jpg,https://onejav.com/torrent/pred847/download/22999322/onejav.com_pred847.torrent,"Acme · Orgasm, Beauty Shop, Big Tits, Creampie, Cuckold, Solowork",小坂ひまり,2026-03-13,https://onejav.com/torrent/pred847
RCTD715,妄想アイテム究極進化シリーズ 俺が校則！校則改変ノート2,6.2 GB,https://pics.dmm.co.jp/mono/movie/adult/1rctd715/1rctd715pl.jpg,https://onejav.com/torrent/rctd715/download/72072734/onejav.com_rctd715.torrent,"Delusion, School Girls, School Stuff, School Uniform, Shame","小坂ひまり, 日向由奈, 天音たお",2026-02-05,https://onejav.com/torrent/rctd715
CEMD795,恥辱、陵●、小旅行…野外にポツンとテントを張ってSEX三昧 小坂ひまり,5.5 GB,https://pics.dmm.co.jp/mono/movie/adult/cemd795/cemd795pl.jpg,https://onejav.com/torrent/cemd795/download/26742402/onejav.com_cemd795.torrent,"Big Tits, Nasty, Hardcore, Orgy, Outdoors, Solowork, Squirting",小坂ひまり,2026-01-24,https://onejav.com/torrent/cemd795
DVAJ720,奇跡の神乳BEST 最高のドスケベおっぱいを揉んで揺らして挟まれてプルプルもちもち柔らか乳肉味わい尽くす5時間,12.7 GB,https://pics.dmm.co.jp/mono/movie/adult/dvaj720/dvaj720pl.jpg,https://onejav.com/torrent/dvaj720/download/03385025/onejav.com_dvaj720.torrent,"4HR+, Best, Omnibus, Big Tits, Breasts, Busty Fetish, Titty Fuck","Nozomi Arimura, ▼すべて表示する, Asami Mizuhashi, 天月あず, 藤咲紫, 二羽紗愛, 静河, 小坂ひまり, 小野坂ゆいか, 碓井せりな, 花衣つばき",2026-01-10,https://onejav.com/torrent/dvaj720
DVEH074,パワハラ巨乳女上司を悶絶いいなりドM堕ちさせる部下ビアン達の快楽レズマウンティング 皆月ひかる・小坂ひまり・羽月果音,6.1 GB,https://pics.dmm.co.jp/mono/movie/adult/dveh074/dveh074pl.jpg,https://onejav.com/torrent/dveh074/download/58456576/onejav.com_dveh074.torrent,"3P, 4P, Big Tits, Lesbian Kiss, Urination","皆月ひかる, 羽月果音, 小坂ひまり",2026-01-03,https://onejav.com/torrent/dveh074
FJIN119,乳首こねくりあへいき失禁 内気なJ系が敏感乳首を開発され白目アヘ顔チクイキ失禁！！ 小坂ひまり,5.3 GB,https://pics.dmm.co.jp/mono/movie/adult/fjin119/fjin119pl.jpg,https://onejav.com/torrent/fjin119/download/41724391/onejav.com_fjin119.torrent,"Big Tits, School Girls, Solowork, Squirting, Uniform, Urination",小坂ひまり,2026-01-02,https://onejav.com/torrent/fjin119
YST341,義理の父に乳マ●コとして扱われてるのにマン汁を滴らせる私は変態です。 小坂ひまり,4.2 GB,https://pics.dmm.co.jp/mono/movie/adult/540yst341/540yst341pl.jpg,https://onejav.com/torrent/yst341/download/43221777/onejav.com_yst341.torrent,"BBW, Big Tits, Conceived, Creampie, Solowork, Ultra-Huge Tits",小坂ひまり,2025-11-01,https://onejav.com/torrent/yst341
YST340,下品だとか上品だとか関係なく、エグイくらい小坂さんを弄びたい 小坂ひまり,4.2 GB,https://pics.dmm.co.jp/mono/movie/adult/540yst340/540yst340pl.jpg,https://onejav.com/torrent/yst340/download/47930445/onejav.com_yst340.torrent,"BBW, Big Tits, Conceived, Creampie, Solowork, Titty Fuck",小坂ひまり,2025-09-27,https://onejav.com/torrent/yst340
YSN649,未熟でたわわな果実の香り 小坂ひまり,4.1 GB,https://pics.dmm.co.jp/mono/movie/adult/h_127ysn649/h_127ysn649pl.jpg,https://onejav.com/torrent/ysn649/download/75971068/onejav.com_ysn649.torrent,"BBW, Big Tits, Conceived, Creampie, Solowork",小坂ひまり,2025-09-27,https://onejav.com/torrent/ysn649
