code,title,size,image_url,torrent_url,tags,actresses,date,page_url
XVSR882,BEST OF 小那海あや 12本番×4時間,10.2 GB,https://pics.dmm.co.jp/mono/movie/adult/xvsr882/xvsr882pl.jpg,https://onejav.com/torrent/xvsr882/download/18686624/onejav.com_xvsr882.torrent,"4HR+, Actress Best, Beautiful Girl, Cowgirl, Creampie, Huge Butt, Solowork",小那海あや,2026-05-31,https://onejav.com/torrent/xvsr882
HODV22069,破壊力抜群の小悪魔トロ顔で僕のチ○ポを舐めまくってくれるおしゃぶりナース 小那海あや,4.1 GB,https://pics.dmm.co.jp/mono/movie/adult/41hodv22069/41hodv22069pl.jpg,https://onejav.com/torrent/hodv22069/download/84327565/onejav.com_hodv22069.torrent,"Blow, Breasts, Cowgirl, Creampie, Dirty Words, Kiss, Nurse, Slut, Solowork, Subjectivity",小那海あや,2026-05-22,https://onejav.com/torrent/hodv22069
MRSS183,妊活中にバイトをはじめた妻が、バ先の店長と不倫していました… 小那海あや,4.9 GB,https://pics.dmm.co.jp/mono/movie/adult/mrss183/mrss183pl.jpg,https://onejav.com/torrent/mrss183/download/14335175/onejav.com_mrss183.torrent,"Creampie, Cuckold, Huge Butt, Married Woman, Solowork",小那海あや,2026-04-04,https://onejav.com/torrent/mrss183
MDBK409,クラスのアイドルを拘束イカセしたら立場逆転 両手ドッキング状態の密着杭打ちで何度もオナホにされた発情話,6.3 GB,https://pics.dmm.co.jp/mono/movie/adult/mdbk409/mdbk409pl.jpg,https://onejav.com/torrent/mdbk409/download/58902653/onejav.com_mdbk409.torrent,"Beautiful Girl, Cowgirl, School Girls, Slut, Uniform","Jun Suehiro, 小那海あや, 日向由奈",2026-03-07,https://onejav.com/torrent/mdbk409
FJIN129,失禁潮まみれで屈辱アヘ堕ちした姉妹捜査官 小那海あや 皆瀬あかり,5.4 GB,https://pics.dmm.co.jp/mono/movie/adult/fjin129/fjin129pl.jpg,https://onejav.com/torrent/fjin129/download/37354385/onejav.com_fjin129.torrent,"Drug, Female Investigator, Sister, Squirting, Urination","小那海あや, 皆瀬あかり",2026-02-28,https://onejav.com/torrent/fjin129
MKON127,地元で一番怖い先輩の彼女に無理矢理ラブホに連れて行かれて何度も中出しSEXさせられてしまった 小那海あや,4.7 GB,https://pics.dmm.co.jp/mono/movie/adult/mkon127/mkon127pl.jpg,https://onejav.com/torrent/mkon127/download/57796849/onejav.com_mkon127.torrent,"Beautiful Girl, Big Tits, Creampie, Huge Butt, Slut, Solowork",小那海あや,2026-02-22,https://onejav.com/torrent/mkon127
RCTD713,妄想アイテム究極進化シリーズ 小那海あやの男女入れ替わり 幼馴染コンプレックス編,5.1 GB,https://pics.dmm.co.jp/mono/movie/adult/1rctd713/1rctd713pl.jpg,https://onejav.com/torrent/rctd713/download/06584166/onejav.com_rctd713.torrent,"Childhood Friend, Delusion, Sex Conversion, Feminized, Solowork",小那海あや,2026-01-20,https://onejav.com/torrent/rctd713
MXGS1412,感度倍増！意識がぶっ飛ぶほどイカされまくる最高潮FUCK 小那海あや,5.0 GB,https://pics.dmm.co.jp/mono/movie/adult/h_068mxgs1412/h_068mxgs1412pl.jpg,https://onejav.com/torrent/mxgs1412/download/56338491/onejav.com_mxgs1412.torrent,"Acme · Orgasm, Solowork",小那海あや,2026-01-17,https://onejav.com/torrent/mxgs1412
IENF394,サエない僕を不憫に思った美人な姉に「擦りつけるだけだよ」という約束で素股してもらっていたら互いに気持ち良すぎてマ○コはグッショリ！でヌルっと生挿入！「え！？入ってる？」でもどうにも止まらなくて中出し！（IENF-394）,5.0 GB,https://pics.dmm.co.jp/mono/movie/adult/1ienf394/1ienf394pl.jpg,https://onejav.com/torrent/ienf394/download/96301817/onejav.com_ienf394.torrent,"Creampie, Prank, Slut","小那海あや, 有星あおり, Amiri Saitou",2026-01-07,https://onejav.com/torrent/ienf394
SQTE648,いつでも使えるオナホ後輩 小那海あや,4.4 GB,https://pics.dmm.co.jp/mono/movie/adult/sqte648/sqte648pl.jpg,https://onejav.com/torrent/sqte648/download/10874116/onejav.com_sqte648.torrent,"Beautiful Girl, Blow, Creampie, Masturbation, OL, Solowork",小那海あや,2026-01-02,https://onejav.com/torrent/sqte648
