code,title,size,image_url,torrent_url,tags,actresses,date,page_url
AUKG645,姉妹レズ ～ずっと好きだった可愛い妹と…禁断姉妹レズ相姦～,5.1 GB,https://pics.dmm.co.jp/mono/movie/adult/aukg645/aukg645pl.jpg,https://onejav.com/torrent/aukg645/download/43616557/onejav.com_aukg645.torrent,"Drama, Incest, Sister, Squirting","松井日奈子, 西尾まりな",2026-02-28,https://onejav.com/torrent/aukg645
MUKC116,オジサンに没頭する発情コスプレイヤー 超敏感大量失禁・お漏らし・ハメ潮オフパコ5SEX 松井日奈子,4.9 GB,https://pics.dmm.co.jp/mono/movie/adult/mukc116/mukc116pl.jpg,https://onejav.com/torrent/mukc116/download/87852921/onejav.com_mukc116.torrent,"Cosplay, Creampie, Nasty, Hardcore, Solowork, Squirting, Urination",松井日奈子,2026-02-13,https://onejav.com/torrent/mukc116
REAL971,OD（オーバードーズ） ト○横キメセク人形凌● 犠牲者3名,6.3 GB,https://pics.dmm.co.jp/mono/movie/adult/real971/real971pl.jpg,https://onejav.com/torrent/real971/download/28370210/onejav.com_real971.torrent,"Beautiful Girl, Creampie, Drug, Evil, Humiliation","松井日奈子, Ema Futaba, 由良かな",2026-02-07,https://onejav.com/torrent/real971
ATID642,淫魔病棟 第1話 新人看護師の涙,5.0 GB,https://pics.dmm.co.jp/mono/movie/adult/atid642/atid642pl.jpg,https://onejav.com/torrent/atid642/download/38912094/onejav.com_atid642.torrent,"Creampie, Female Doctor, Humiliation, Nurse, Slut","北岡果林, 松井日奈子, 葉山さゆり",2026-02-04,https://onejav.com/torrent/atid642
FJIN124,乳首こねくり失禁 敏感乳首を開発され校内どこでもお漏らし！ 白目アヘ顔イキで肉便器堕ちした優等生J系 松井日奈子,5.4 GB,https://pics.dmm.co.jp/mono/movie/adult/fjin124/fjin124pl.jpg,https://onejav.com/torrent/fjin124/download/30779032/onejav.com_fjin124.torrent,"Mini, Petite, School Girls, Solowork, Squirting, Uniform, Urination",松井日奈子,2026-01-31,https://onejav.com/torrent/fjin124
MIAB607,選手村リポート中に狙われた新人女子アナは性欲も体力も桁違いな屈強アスリートの中出し輪●でバチボコに犯●れる 松井日奈子,4.8 GB,https://pics.dmm.co.jp/mono/movie/adult/miab607/miab607pl.jpg,https://onejav.com/torrent/miab607/download/27504399/onejav.com_miab607.torrent,"3P, 4P, Anchorwoman, Athlete, Creampie, Nasty, Hardcore, Solowork",松井日奈子,2026-01-30,https://onejav.com/torrent/miab607
MILK276,媚〇塗りたくりチ〇ポで拘束スローピストン 上は寄り目と白目ベロ出しアヘ顔に！下はガニ股ビクビク痙攣ジャブジャブ大量潮吹き！全身性感帯化で絶頂無限ループ お下劣オホ声女子○生 松井日奈子,5.2 GB,https://pics.dmm.co.jp/mono/movie/adult/h_1240milk276/h_1240milk276pl.jpg,https://onejav.com/torrent/milk276/download/40722822/onejav.com_milk276.torrent,"Cowgirl, Creampie, Drug, Nasty, Hardcore, POV, School Girls, Solowork, Squirting, Uniform",松井日奈子,2026-01-22,https://onejav.com/torrent/milk276
MIAB599,同窓会NTR 性奴●として調教頂いていたご主人様と再会。 松井日奈子,5.0 GB,https://pics.dmm.co.jp/mono/movie/adult/miab599/miab599pl.jpg,https://onejav.com/torrent/miab599/download/07817095/onejav.com_miab599.torrent,"Creampie, Cuckold, Deep Throating, Nasty, Hardcore, Solowork, Squirting",松井日奈子,2026-01-16,https://onejav.com/torrent/miab599
REAL963,生意気J×の無惨な姿をご覧ください。大人を舐め腐ったギャルが強●的に性感帯を開発され、失禁アヘ顔を晒してイキまくる人生終了F××K 松井日奈子,5.2 GB,https://pics.dmm.co.jp/mono/movie/adult/real963/real963pl.jpg,https://onejav.com/torrent/real963/download/44765439/onejav.com_real963.torrent,"3P, 4P, Acme · Orgasm, Nasty, Hardcore, Rolling Back Eyes, Fainting, School Girls, Solowork",松井日奈子,2026-01-10,https://onejav.com/torrent/real963
LULU418,自宅で預かった上司の娘のクッソ生意気なメスガキJ系に睡眠薬を盛り眠姦乳首ハラスメントで摘むだけでチクイキ潮射する敏感体質に仕上げた。 松井日奈子,6.7 GB,https://pics.dmm.co.jp/mono/movie/adult/lulu418/lulu418pl.jpg,https://onejav.com/torrent/lulu418/download/51258348/onejav.com_lulu418.torrent,"Creampie, School Girls, Shaved, Solowork, Squirting",松井日奈子,2026-01-01,https://onejav.com/torrent/lulu418
