code,title,size,image_url,torrent_url,tags,actresses,date,page_url
KTB116,「痴●で感じただけなのに…」7日後に犯●れるクラスの○○さん外伝～痴●で感じてる所をクラスメートに見られ痴●快楽に堕ちた【女子学生・Hさん】の1週間にわたる痴●記録～ 松井日奈子,8.0 GB,https://pics.dmm.co.jp/mono/movie/adult/ktb116/ktb116pl.jpg,https://onejav.com/torrent/ktb116/download/41441185/onejav.com_ktb116.torrent,"Beautiful Girl, Bukkake, Butt, Solowork, Squirting, Uniform",松井日奈子,2026-05-30,https://onejav.com/torrent/ktb116
MKON137,パパ活タイムリープ 塩対応すぎるJ系を堕としてデレるまで何度でもリロード 松井日奈子,4.0 GB,https://pics.dmm.co.jp/mono/movie/adult/mkon137/mkon137pl.jpg,https://onejav.com/torrent/mkon137/download/52346567/onejav.com_mkon137.torrent,"Creampie, School Girls, School Uniform, SF, Solowork",松井日奈子,2026-05-23,https://onejav.com/torrent/mkon137
MUCD354,最高にヌける激かわ制服美少女とハメまくりイチャラブSEX 精子出しきるまでパコる超濃厚種付け 美少女2名。大量中出し、ハメ撮り、フェラ顔もイキ顔も最高 松井日奈子 天馬ゆい,6.3 GB,https://pics.dmm.co.jp/mono/movie/adult/mucd354/mucd354pl.jpg,https://onejav.com/torrent/mucd354/download/23173107/onejav.com_mucd354.torrent,"Beautiful Girl, Creampie, POV, Squirting, Uniform","松井日奈子, 天馬ゆい",2026-05-16,https://onejav.com/torrent/mucd354
REAL989,鬼イカセ 松井日奈子,5.3 GB,https://pics.dmm.co.jp/mono/movie/adult/real989/real989pl.jpg,https://onejav.com/torrent/real989/download/88568930/onejav.com_real989.torrent,"Creampie, Deep Throating, Nasty, Hardcore, Restraint, Solowork, Squirting",松井日奈子,2026-05-09,https://onejav.com/torrent/real989
NSFS473,かわいい嫁の白き肉体 お義父さんにおしおきされて・・11 松井日奈子,5.7 GB,https://pics.dmm.co.jp/mono/movie/adult/nsfs473/nsfs473pl.jpg,https://onejav.com/torrent/nsfs473/download/21076196/onejav.com_nsfs473.torrent,"Affair, Bride, Young Wife, Drama, Solowork, Squirting",松井日奈子,2026-04-25,https://onejav.com/torrent/nsfs473
RCTD727,レズビアンリアリティーバトル～奪い愛～ 2人のタチが1人のネコをレズテクで奪い合う,5.7 GB,https://pics.dmm.co.jp/mono/movie/adult/1rctd727/1rctd727pl.jpg,https://onejav.com/torrent/rctd727/download/94222303/onejav.com_rctd727.torrent,"3P, 4P, Finger Fuck, Lesbian Kiss, Planning","西尾まりな, 松井日奈子, 石川陽波",2026-03-28,https://onejav.com/torrent/rctd727
ATYA036,おじさん大好きなミニ若妻極太浮気チ●ポで中イキさせられ、戻れない快楽堕ち！ 松井日奈子,5.3 GB,https://pics.dmm.co.jp/mono/movie/adult/atya036/atya036pl.jpg,https://onejav.com/torrent/atya036/download/97009375/onejav.com_atya036.torrent,"Deep Throating, Huge Cock, Married Woman, Small Tits, Solowork",松井日奈子,2026-03-16,https://onejav.com/torrent/atya036
MIAB600,時間停止できるゴミ部屋オヤジに狙われたJ系のワタシ…。 停止中もねっちょり絶倫ピストン突かれ10発濃厚中出し ストップ解除で訪れる蓄積分の快感にのけ反り痙攣ガクガク潮吹きアクメオーガズム 松井日奈子,5.0 GB,https://pics.dmm.co.jp/mono/movie/adult/miab600/miab600pl.jpg,https://onejav.com/torrent/miab600/download/56998801/onejav.com_miab600.torrent,"Creampie, Humiliation, School Girls, Solowork, Squirting, Time Stop",松井日奈子,2026-03-13,https://onejav.com/torrent/miab600
AUKG645,姉妹レズ ～ずっと好きだった可愛い妹と…禁断姉妹レズ相姦～,5.1 GB,https://pics.dmm.co.jp/mono/movie/adult/aukg645/aukg645pl.jpg,https://onejav.com/torrent/aukg645/download/88584845/onejav.com_aukg645.torrent,"Drama, Incest, Sister, Squirting","松井日奈子, 西尾まりな",2026-02-28,https://onejav.com/torrent/aukg645
MUKC116,オジサンに没頭する発情コスプレイヤー 超敏感大量失禁・お漏らし・ハメ潮オフパコ5SEX 松井日奈子,4.9 GB,https://pics.dmm.co.jp/mono/movie/adult/mukc116/mukc116pl.jpg,https://onejav.com/torrent/mukc116/download/93150859/onejav.com_mukc116.torrent,"Cosplay, Creampie, Nasty, Hardcore, Solowork, Squirting, Urination",松井日奈子,2026-02-13,https://onejav.com/torrent/mukc116
