code,title,size,image_url,torrent_url,tags,actresses,date,page_url
ATYA036,おじさん大好きなミニ若妻極太浮気チ●ポで中イキさせられ、戻れない快楽堕ち！ 松井日奈子,5.3 GB,https://pics.dmm.co.jp/mono/movie/adult/atya036/atya036pl.jpg,https://onejav.com/torrent/atya036/download/07027823/onejav.com_atya036.torrent,"Deep Throating, Huge Cock, Married Woman, Small Tits, Solowork",松井日奈子,2026-03-16,https://onejav.com/torrent/atya036
MIAB600,時間停止できるゴミ部屋オヤジに狙われたJ系のワタシ…。 停止中もねっちょり絶倫ピストン突かれ10発濃厚中出し ストップ解除で訪れる蓄積分の快感にのけ反り痙攣ガクガク潮吹きアクメオーガズム 松井日奈子,5.0 GB,https://pics.dmm.co.jp/mono/movie/adult/miab600/miab600pl.jpg,https://onejav.com/torrent/miab600/download/89151822/onejav.com_miab600.torrent,"Creampie, Humiliation, School Girls, Solowork, Squirting, Time Stop",松井日奈子,2026-03-13,https://onejav.com/torrent/miab600
AUKG645,姉妹レズ ～ずっと好きだった可愛い妹と…禁断姉妹レズ相姦～,5.1 GB,https://pics.dmm.co.jp/mono/movie/adult/aukg645/aukg645pl.jpg,https://onejav.com/torrent/aukg645/download/15287852/onejav.com_aukg645.torrent,"Drama, Incest, Sister, Squirting","松井日奈子, 西尾まりな",2026-02-28,https://onejav.com/torrent/aukg645
MUKC116,オジサンに没頭する発情コスプレイヤー 超敏感大量失禁・お漏らし・ハメ潮オフパコ5SEX 松井日奈子,4.9 GB,https://pics.dmm.co.jp/mono/movie/adult/mukc116/mukc116pl.jpg,https://onejav.com/torrent/mukc116/download/16139730/onejav.com_mukc116.torrent,"Cosplay, Creampie, Nasty, Hardcore, Solowork, Squirting, Urination",松井日奈子,2026-02-13,https://onejav.com/torrent/mukc116
REAL971,OD（オーバードーズ） ト○横キメセク人形凌● 犠牲者3名,6.3 GB,https://pics.dmm.co.jp/mono/movie/adult/real971/real971pl.jpg,https://onejav.com/torrent/real971/download/98851821/onejav.com_real971.torrent,"Beautiful Girl, Creampie, Drug, Evil, Humiliation","Ema Futaba, 由良かな, 松井日奈子",2026-02-07,https://onejav.com/torrent/real971
ATID642,淫魔病棟 第1話 新人看護師の涙,5.0 GB,https://pics.dmm.co.jp/mono/movie/adult/atid642/atid642pl.jpg,https://onejav.com/torrent/atid642/download/05495159/onejav.com_atid642.torrent,"Creampie, Female Doctor, Humiliation, Nurse, Slut","葉山さゆり, 松井日奈子, 北岡果林",2026-02-04,https://onejav.com/torrent/atid642
FJIN124,乳首こねくり失禁 敏感乳首を開発され校内どこでもお漏らし！ 白目アヘ顔イキで肉便器堕ちした優等生J系 松井日奈子,5.4 GB,https://pics.dmm.co.jp/mono/movie/adult/fjin124/fjin124pl.jpg,https://onejav.com/torrent/fjin124/download/79314647/onejav.com_fjin124.torrent,"Mini, Petite, School Girls, Solowork, Squirting, Uniform, Urination",松井日奈子,2026-01-31,https://onejav.com/torrent/fjin124
MIAB607,選手村リポート中に狙われた新人女子アナは性欲も体力も桁違いな屈強アスリートの中出し輪●でバチボコに犯●れる 松井日奈子,4.8 GB,https://pics.dmm.co.jp/mono/movie/adult/miab607/miab607pl.jpg,https://onejav.com/torrent/miab607/download/28034051/onejav.com_miab607.torrent,"3P, 4P, Anchorwoman, Athlete, Creampie, Nasty, Hardcore, Solowork",松井日奈子,2026-01-30,https://onejav.com/torrent/miab607
MILK276,媚〇塗りたくりチ〇ポで拘束スローピストン 上は寄り目と白目ベロ出しアヘ顔に！下はガニ股ビクビク痙攣ジャブジャブ大量潮吹き！全身性感帯化で絶頂無限ループ お下劣オホ声女子○生 松井日奈子,5.2 GB,https://pics.dmm.co.jp/mono/movie/adult/h_1240milk276/h_1240milk276pl.jpg,https://onejav.com/torrent/milk276/download/18012501/onejav.com_milk276.torrent,"Cowgirl, Creampie, Drug, Nasty, Hardcore, POV, School Girls, Solowork, Squirting, Uniform",松井日奈子,2026-01-22,https://onejav.com/torrent/milk276
MIAB599,同窓会NTR 性奴●として調教頂いていたご主人様と再会。 松井日奈子,5.0 GB,https://pics.dmm.co.jp/mono/movie/adult/miab599/miab599pl.jpg,https://onejav.com/torrent/miab599/download/97868644/onejav.com_miab599.torrent,"Creampie, Cuckold, Deep Throating, Nasty, Hardcore, Solowork, Squirting",松井日奈子,2026-01-16,https://onejav.com/torrent/miab599
