code,title,size,image_url,torrent_url,tags,actresses,date,page_url
AUKG647,義妹にレズられて… ～兄の留守に巨乳義姉をレズ誘惑する小悪魔ビアン～,5.1 GB,https://pics.dmm.co.jp/mono/movie/adult/aukg647/aukg647pl.jpg,https://onejav.com/torrent/aukg647/download/43041427/onejav.com_aukg647.torrent,"Big Tits, Drama, Married Woman, Sister","二羽紗愛, 桃瀬ひまり",2026-03-14,https://onejav.com/torrent/aukg647
GMEM147,精子嫌いの口内射精限界挑戦 穢れを知らない無垢な笑顔が臭っさい精子で消えていく！はつらつ肉感ボディの清楚系ドマゾ女が首絞め快感に溺れ涙目イキ！ 桃瀬ひまり,5.4 GB,https://pics.dmm.co.jp/mono/movie/adult/gmem147/gmem147pl.jpg,https://onejav.com/torrent/gmem147/download/12182349/onejav.com_gmem147.torrent,"Big Tits, Bitch, Deep Throating, M女, Solowork",桃瀬ひまり,2026-03-07,https://onejav.com/torrent/gmem147
NSFS429,かわいい嫁の白き肉体 お義父さんにおしおきされて・・9 桃瀬ひまり,5.4 GB,https://pics.dmm.co.jp/mono/movie/adult/nsfs429/nsfs429pl.jpg,https://onejav.com/torrent/nsfs429/download/07835735/onejav.com_nsfs429.torrent,"Affair, Big Tits, Bride, Young Wife, Drama, Solowork",桃瀬ひまり,2025-11-08,https://onejav.com/torrent/nsfs429
RBK125,真咲監督Presents ピンクスパイダー 今日は貴女を追い詰めます。,6.6 GB,https://pics.dmm.co.jp/mono/movie/adult/rbk125/rbk125pl.jpg,https://onejav.com/torrent/rbk125/download/73729449/onejav.com_rbk125.torrent,"Deep Throating, Documentary, Humiliation, Restraints","森野雫, 桃瀬ひまり, 真咲南朋",2025-10-31,https://onejav.com/torrent/rbk125
HODV22009,隣に越してきた出会いなさそうな地味メガネを言いなりセフレにしてやった。 スタイル最高でマゾ女 桃瀬ひまり,6.2 GB,https://pics.dmm.co.jp/mono/movie/adult/41hodv22009/41hodv22009pl.jpg,https://onejav.com/torrent/hodv22009/download/61373388/onejav.com_hodv22009.torrent,"Beautiful Girl, Big Tits, BIGセール, Creampie, Glasses, Huge Butt, Slut, Solowork, Titty Fuck",桃瀬ひまり,2025-10-24,https://onejav.com/torrent/hodv22009
FGAN157,甘サド小悪魔ブルマん娘 ブルマ娘に甘く優しくサドられたい,5.3 GB,https://pics.dmm.co.jp/mono/movie/adult/h_1440fgan157/h_1440fgan157pl.jpg,https://onejav.com/torrent/fgan157/download/98412342/onejav.com_fgan157.torrent,"Bloomers, Bukkake, Butt, Massage, Masturbation, Masturbation Support, Slut","望月つぼみ, 桃瀬ひまり",2025-09-25,https://onejav.com/torrent/fgan157
MISM401,夢に見た本格喉奥調教にホイップえづき液ドバァ昇天。胃底からエグり煌めく甘ゲボ嘔吐イラマチオ。 桃瀬ひまり,6.7 GB,https://pics.dmm.co.jp/mono/movie/adult/mism401/mism401pl.jpg,https://onejav.com/torrent/mism401/download/91851544/onejav.com_mism401.torrent,"Beautiful Girl, Big Tits, Deep Throating, M女, Nasty, Hardcore, Solowork",桃瀬ひまり,2025-09-19,https://onejav.com/torrent/mism401
SAME182,私、義理の父にレ●プされてます。 桃瀬ひまり,5.6 GB,https://pics.dmm.co.jp/mono/movie/adult/same182/same182pl.jpg,https://onejav.com/torrent/same182/download/96944425/onejav.com_same182.torrent,"Deep Throating, Humiliation, Incest, School Girls, Solowork, Spanking",桃瀬ひまり,2025-08-29,https://onejav.com/torrent/same182
FGAN156,ヒクヒクアナルマニア 美少女のお下品なアナルを超ドアップで見ながらオナサポされたい,4.3 GB,https://pics.dmm.co.jp/mono/movie/adult/h_1440fgan156/h_1440fgan156pl.jpg,https://onejav.com/torrent/fgan156/download/22054750/onejav.com_fgan156.torrent,"Anal, Close Up, Masturbation Support, Slut","岬さくら, 逢月ひまり, 音羽美鈴, 桃瀬ひまり, 松丸香澄",2025-08-21,https://onejav.com/torrent/fgan156
FGAN155,「だってパンティ穿くと蒸れるんだもん！」ノーパンで過ごす従妹の股間をガン見してしまう僕にま〇こくぱぁ挑発してくる！,5.0 GB,https://pics.dmm.co.jp/mono/movie/adult/h_1440fgan155/h_1440fgan155pl.jpg,https://onejav.com/torrent/fgan155/download/82685354/onejav.com_fgan155.torrent,"Close Up, No Undies, Shaved, Sister, Slut","望月つぼみ, 桃瀬ひまり",2025-08-21,https://onejav.com/torrent/fgan155
