code,title,size,image_url,torrent_url,tags,actresses,date,page_url
ROE489,昼間は地味で隠キャな妻の母だけど本当は… 週末こっそりクラブに通い 若い男をつまみ食いする淫キャだった。,5.0 GB,https://pics.dmm.co.jp/mono/movie/adult/roe489/roe489pl.jpg,https://onejav.com/torrent/roe489/download/14572797/onejav.com_roe489.torrent,"Affair, Married Woman, Mature Woman, Slut, Solowork, Stepmother",桐岡さつき,2026-05-08,https://onejav.com/torrent/roe489
ROE481,口辱 いつも文句を言ってくる隣の口うるさい主婦を毎回チ○ポで黙らせる口封じイラマレ×プ 桐岡さつき,6.2 GB,https://pics.dmm.co.jp/mono/movie/adult/roe481/roe481pl.jpg,https://onejav.com/torrent/roe481/download/29472178/onejav.com_roe481.torrent,"Deep Throating, Humiliation, Married Woman, Mature Woman, Shame, Solowork",桐岡さつき,2026-04-10,https://onejav.com/torrent/roe481
ROE472,最愛の母と 飲み交わした一夜。酒と潮吹きに溺れて大人になった僕。 桐岡さつき,4.9 GB,https://pics.dmm.co.jp/mono/movie/adult/roe472/roe472pl.jpg,https://onejav.com/torrent/roe472/download/01106463/onejav.com_roe472.torrent,"Incest, Married Woman, Mature Woman, Mother, Solowork, Squirting",桐岡さつき,2026-03-06,https://onejav.com/torrent/roe472
ROE448,ハメ撮りNTR 親友から誤送信された「ハメ撮り動画」に映っていた相手は僕の母だった。 桐岡さつき,5.0 GB,https://pics.dmm.co.jp/mono/movie/adult/roe448/roe448pl.jpg,https://onejav.com/torrent/roe448/download/31633638/onejav.com_roe448.torrent,"Cuckold, Married Woman, Mature Woman, POV, Shame, Solowork",桐岡さつき,2026-02-06,https://onejav.com/torrent/roe448
ROE453,殉愛調教スイートルーム 息子の為…肉体を捧げゆく母―。 桐岡さつき,5.6 GB,https://pics.dmm.co.jp/mono/movie/adult/roe453/roe453pl.jpg,https://onejav.com/torrent/roe453/download/50412599/onejav.com_roe453.torrent,"3P, 4P, Humiliation, Married Woman, Mature Woman, SM, Solowork",桐岡さつき,2026-01-09,https://onejav.com/torrent/roe453
ROE429,「大きくなったら結婚して下さい」そう言ってくれた少年が娘の婚約者として現れて…。結婚の報告をされた夜、大人になった彼の肉体に溺れてしまった私。 桐岡さつき,4.9 GB,https://pics.dmm.co.jp/mono/movie/adult/roe429/roe429pl.jpg,https://onejav.com/torrent/roe429/download/34508578/onejav.com_roe429.torrent,"Affair, Creampie, Married Woman, Mature Woman, Solowork, Stepmother",桐岡さつき,2025-12-05,https://onejav.com/torrent/roe429
ROE420,卒業式の後…厳しく指導してくれた女教師へ感謝と憎しみを込めたお礼参り輪● 桐岡さつき,5.0 GB,https://pics.dmm.co.jp/mono/movie/adult/roe420/roe420pl.jpg,https://onejav.com/torrent/roe420/download/15703400/onejav.com_roe420.torrent,"Creampie, Female Teacher, Humiliation, Married Woman, Mature Woman, Solowork",桐岡さつき,2025-11-07,https://onejav.com/torrent/roe420
ROE408,娘の幸せを見届けながら…。披露宴で娘婿に犯●れた母 桐岡さつき,5.8 GB,https://pics.dmm.co.jp/mono/movie/adult/roe408/roe408pl.jpg,https://onejav.com/torrent/roe408/download/35119255/onejav.com_roe408.torrent,"Creampie, Kimono, Yukata, Married Woman, Mature Woman, Solowork, Stepmother",桐岡さつき,2025-10-10,https://onejav.com/torrent/roe408
ROE400,いつもノーブラ透け美乳で僕を無自覚に誘惑してくる友人の母とアクシデントから始まる濃密不倫ー。 桐岡さつき,5.2 GB,https://pics.dmm.co.jp/mono/movie/adult/roe400/roe400pl.jpg,https://onejav.com/torrent/roe400/download/42046312/onejav.com_roe400.torrent,"Breasts, Creampie, Married Woman, Mature Woman, Slut, Solowork",桐岡さつき,2025-09-05,https://onejav.com/torrent/roe400
ROE383,PTA中出し不倫 家庭で空気扱いだった私が見つけた新しい居場所 桐岡さつき,6.1 GB,https://pics.dmm.co.jp/mono/movie/adult/roe383/roe383pl.jpg,https://onejav.com/torrent/roe383/download/63354220/onejav.com_roe383.torrent,"Affair, Big Tits, Drama, Married Woman, Mature Woman, Solowork",桐岡さつき,2025-08-08,https://onejav.com/torrent/roe383
