code,title,size,image_url,torrent_url,tags,actresses,date,page_url
ACHJ080,見下し目線で囁く美熟女の淫語ASMR M男垂涎！！貴方の脳内が蕩け堕ちる絶対服従！！完全主観バイノーラルオナサポ！！ 橘メアリー,6.5 GB,https://pics.dmm.co.jp/mono/movie/adult/achj080/achj080pl.jpg,https://onejav.com/torrent/achj080/download/42410324/onejav.com_achj080.torrent,"Big Tits, Married Woman, Masturbation Support, Mature Woman, Slut, Solowork",橘メアリー,2026-03-06,https://onejav.com/torrent/achj080
JUR622,「人生最後の勃起かもしれないんだ、一瞬だけでイイから挿れさせて！！」 勃起不全になった義父に同情して混浴したらまさかのフル勃起、相性抜群過ぎて馬乗り騎乗位で何度も生ハメ狂ってしまった私。 橘メアリー,5.1 GB,https://pics.dmm.co.jp/mono/movie/adult/jur622/jur622pl.jpg,https://onejav.com/torrent/jur622/download/08729202/onejav.com_jur622.torrent,"Affair, Big Tits, Creampie, Married Woman, Mature Woman, Solowork",橘メアリー,2026-02-06,https://onejav.com/torrent/jur622
JUR590,寝取らせ串刺し輪● 愛する妻を深奥まで犯し尽くして下さい―。 橘メアリー,6.3 GB,https://pics.dmm.co.jp/mono/movie/adult/jur590/jur590pl.jpg,https://onejav.com/torrent/jur590/download/40324235/onejav.com_jur590.torrent,"3P, 4P, Creampie, Cuckold, Married Woman, Mature Woman, Solowork",橘メアリー,2026-01-09,https://onejav.com/torrent/jur590
BDSR547,ドスケベ介護士ハメ撮りプライベート映像流出4時間 デイサービスで見つけちゃうかも！？ 12人全員介護施設勤めの現役介護士！！,10.1 GB,https://pics.dmm.co.jp/mono/movie/adult/57bdsr547/57bdsr547pl.jpg,https://onejav.com/torrent/bdsr547/download/48051684/onejav.com_bdsr547.torrent,"4HR+, Acme · Orgasm, Beautiful Girl, Big Tits, Breasts, Creampie, POV, Slender, Squirting","橘メアリー, 玉木くるみ, 今藤霧子, 由紀なつ碧, Iori Tsukimi, 羽生ありさ, 桃井れお, 高樹あすか, Mihina Nagai, 北乃ゆな, ▼すべて表示する",2025-12-27,https://onejav.com/torrent/bdsr547
DASS842,痴能犯 ～ただただSEXがしたいだけの極めて強い異常な性欲者～ 橘メアリー,4.9 GB,https://pics.dmm.co.jp/mono/movie/adult/dass842/dass842pl.jpg,https://onejav.com/torrent/dass842/download/65642455/onejav.com_dass842.torrent,"Big Tits, Creampie, Cuckold, Nasty, Hardcore, Slut, Solowork",橘メアリー,2025-12-23,https://onejav.com/torrent/dass842
JUR538,社員旅行で…妻にタオル1枚だけ渡して性豪男が集う男湯に入らせてしまった寝取られの末路。 橘メアリー,4.9 GB,https://pics.dmm.co.jp/mono/movie/adult/jur538/jur538pl.jpg,https://onejav.com/torrent/jur538/download/97047774/onejav.com_jur538.torrent,"Creampie, Cuckold, Hot Spring, Married Woman, Mature Woman, Solowork",橘メアリー,2025-12-05,https://onejav.com/torrent/jur538
DASS800,-性域- 相撲部屋のしきたりを汚した女記者を媚薬力水でかわいがりNTR 橘メアリー,5.4 GB,https://pics.dmm.co.jp/mono/movie/adult/dass800/dass800pl.jpg,https://onejav.com/torrent/dass800/download/66038545/onejav.com_dass800.torrent,"3P, 4P, Big Tits, Cuckold, Slender, Solowork",橘メアリー,2025-11-21,https://onejav.com/torrent/dass800
JUR504,俺の肉便器人妻、お貸しします。 10発中出しするまで帰れない、言いなり極悪成金オヤジ宅訪問。 橘メアリー,6.5 GB,https://pics.dmm.co.jp/mono/movie/adult/jur504/jur504pl.jpg,https://onejav.com/torrent/jur504/download/62484875/onejav.com_jur504.torrent,"Big Tits, Creampie, Cuckold, Married Woman, Mature Woman, Solowork",橘メアリー,2025-11-07,https://onejav.com/torrent/jur504
JUR552,女教師NTR 不良生徒に最愛の妻を寝取られてー。 橘メアリー,5.9 GB,https://pics.dmm.co.jp/mono/movie/adult/jur552/jur552pl.jpg,https://onejav.com/torrent/jur552/download/88389365/onejav.com_jur552.torrent,"Big Tits, Cuckold, Married Woman, Mature Woman, Solowork, Various Professions",橘メアリー,2025-10-10,https://onejav.com/torrent/jur552
JUR446,身も心も相性抜群の2人ー。’想い’と’唇’が重なる濃密接吻ソープ 橘メアリー,7.4 GB,https://pics.dmm.co.jp/mono/movie/adult/jur446/jur446pl.jpg,https://onejav.com/torrent/jur446/download/72207089/onejav.com_jur446.torrent,"Creampie, Kiss, Married Woman, Mature Woman, Soapland, Solowork",橘メアリー,2025-08-08,https://onejav.com/torrent/jur446
