code,title,size,image_url,torrent_url,tags,actresses,date,page_url
HDKA331,はだかのヨガ講師 汐河佳奈,5.5 GB,https://pics.dmm.co.jp/mono/movie/adult/h_237hdka331/h_237hdka331pl.jpg,https://onejav.com/torrent/hdka331/download/41405869/onejav.com_hdka331.torrent,"BIGセール, Breasts, Close Up, Creampie, Huge Butt, Instructor, Mature Woman, Other Fetish, Solowork",汐河佳奈,2026-03-22,https://onejav.com/torrent/hdka331
NEWM111,真・異常性交 五十路母と子 其の四拾弐 欲求不満に負けて息子棒で喘ぐ美乳スレンダー母 汐河佳奈,5.1 GB,https://pics.dmm.co.jp/mono/movie/adult/newm111/newm111pl.jpg,https://onejav.com/torrent/newm111/download/91576769/onejav.com_newm111.torrent,"Cuckold, Incest, Mature Woman, Mother, Solowork",汐河佳奈,2025-07-19,https://onejav.com/torrent/newm111
RCTD669,真・時間が止まる腕時計 家族全員まとめてSTOP ALL近親相姦SP3,7.1 GB,https://pics.dmm.co.jp/mono/movie/adult/1rctd669/1rctd669pl.jpg,https://onejav.com/torrent/rctd669/download/82988535/onejav.com_rctd669.torrent,"Big Tits, Incest, Mother, Planning, Shame, Sister, Time Stop","汐河佳奈, 若宮はずき, 桃瀬ひまり, 綾瀬舞菜",2025-06-10,https://onejav.com/torrent/rctd669
NDRA118,彼女に内緒で彼女の母ともヤってます… 汐河佳奈,5.1 GB,https://pics.dmm.co.jp/mono/movie/adult/ndra118/ndra118pl.jpg,https://onejav.com/torrent/ndra118/download/18650207/onejav.com_ndra118.torrent,"Affair, Creampie, Cuckold, Married Woman, Mature Woman, Solowork",汐河佳奈,2025-02-07,https://onejav.com/torrent/ndra118
HOKS185,母・娘 味くらべ 絶倫チ〇ポに絶対服従…,3.8 GB,https://pics.dmm.co.jp/mono/movie/adult/hoks185/hoks185pl.jpg,https://onejav.com/torrent/hoks185/download/06502839/onejav.com_hoks185.torrent,"Adopted Daughter, Drama, Married Woman, Mother, Nasty, Hardcore","汐河佳奈, 桃瀬まゆ",2024-10-19,https://onejav.com/torrent/hoks185
HOKS173,借金妻 旦那にバレたら身の破滅,5.2 GB,https://pics.dmm.co.jp/mono/movie/adult/hoks173/hoks173pl.jpg,https://onejav.com/torrent/hoks173/download/75037501/onejav.com_hoks173.torrent,"Big Tits, BIGセール, Drama, Married Woman, Mature Woman, Multiple Story, Nasty, Hardcore","汐河佳奈, 宗像れな, 汐見唯",2024-01-13,https://onejav.com/torrent/hoks173
OFKU178,"Forty Years Old, The Son-in-law Estrus On The Ripe Body Of The Mother Of A Beautiful And Erotic Bride And Got Fucked Raw 180 Minutes",7.5 GB,https://pics.dmm.co.jp/mono/movie/adult/h_254ofku178/h_254ofku178pl.jpg,https://onejav.com/torrent/ofku178/download/87719048/onejav.com_ofku178.torrent,"Creampie, Incest, Mature Woman, Mother, Stepmother","星野友里江, 汐河佳奈, 福山いろは",2021-03-21,https://onejav.com/torrent/ofku178
KSBJ122,Mother-in-law's Mistake Feeling Guilty But Unstoppable Lust ...,10.1 GB,https://pics.dmm.co.jp/mono/movie/adult/ksbj122/ksbj122pl.jpg,https://onejav.com/torrent/ksbj122/download/75287454/onejav.com_ksbj122.torrent,"4HR+, BBW, Best, Omnibus, Mature Woman, Stepmother","片瀬仁美, 音羽文子, 近藤郁（近藤郁美）, 小野さち子, 汐河佳奈, 時田こずえ",2021-03-04,https://onejav.com/torrent/ksbj122
KIR020,Daughter-in-law Kana Shiokawa Who Seeks The Body Of A Beautiful Mature Woman By Stealing The Eyes Of Her Wife's Mother And Wife Who Is Full Of Scent In The Forty,3.7 GB,https://pics.dmm.co.jp/mono/movie/adult/h_254kir020/h_254kir020pl.jpg,https://onejav.com/torrent/kir020/download/53665304/onejav.com_kir020.torrent,"AV Actress, Creampie, Incest, Mature Woman, Solowork, Stepmother",汐河佳奈,2021-01-27,https://onejav.com/torrent/kir020
HOKS088,,4.6 GB,https://pics.dmm.co.jp/mono/movie/adult/hoks088so/hoks088sopl.jpg,https://onejav.com/torrent/hoks088/download/29504229/onejav.com_hoks088.torrent,,"横山夏希, 前田あこ, 汐河佳奈, 黒澤雪",2020-12-28,https://onejav.com/torrent/hoks088
