code,title,size,image_url,torrent_url,tags,actresses,date,page_url
DNJR156,こんな世界があったなんて…ふわとろ爆乳でオトコを骨ヌキにするハーレム花魁,10.4 GB,https://pics.dmm.co.jp/mono/movie/adult/dnjr156/dnjr156pl.jpg,https://onejav.com/torrent/dnjr156/download/47028411/onejav.com_dnjr156.torrent,"Big Tits, Harem, Kimono, Yukata, M男, Slut","有岡みう, Sakura Mita, 深月めい",2026-05-02,https://onejav.com/torrent/dnjr156
RCTD725,変態下劣バカエロ2～下劣改名で新生活～,4.2 GB,https://pics.dmm.co.jp/mono/movie/adult/1rctd725/1rctd725pl.jpg,https://onejav.com/torrent/rctd725/download/49752702/onejav.com_rctd725.torrent,"Dirty Words, Other Fetish, Planning, Shame","朝比ゆの, 深月めい",2026-04-06,https://onejav.com/torrent/rctd725
MOOR057,人気ナンバーワンの爆乳コンカフェ嬢は欲望をお客様にぶちまけてザーメン欲しがる痴女でした 深月めい,5.1 GB,https://pics.dmm.co.jp/mono/movie/adult/moor057/moor057pl.jpg,https://onejav.com/torrent/moor057/download/35138601/onejav.com_moor057.torrent,"3P, 4P, Blow, Cowgirl, Creampie, Slut, Solowork",深月めい,2026-02-23,https://onejav.com/torrent/moor057
HOKS215,密着性交150日 わたしと先生のぐしょ濡れ同棲生活 深月めい,4.4 GB,https://pics.dmm.co.jp/mono/movie/adult/hoks215/hoks215pl.jpg,https://onejav.com/torrent/hoks215/download/81611021/onejav.com_hoks215.torrent,"BBW, Big Tits, Drama, Kiss, Nasty, Hardcore, Solowork",深月めい,2026-01-31,https://onejav.com/torrent/hoks215
RCTD709,女性専用 乳首こねクリニック健康診断5 チクビアン女医の粘着感度チェック初めての乳首合わせでイキ狂う！,6.2 GB,https://pics.dmm.co.jp/mono/movie/adult/1rctd709/1rctd709pl.jpg,https://onejav.com/torrent/rctd709/download/24679968/onejav.com_rctd709.torrent,"Big Tits, Female Doctor, Other Fetish, Planning, School Girls","天月あず, 乙羽あむ, 深月めい",2025-12-20,https://onejav.com/torrent/rctd709
DRPT101,スタイル抜群だけど態度の悪いメンエス嬢にお仕置き激イカせ肉体開発 深月めい,6.2 GB,https://pics.dmm.co.jp/mono/movie/adult/1drpt101/1drpt101pl.jpg,https://onejav.com/torrent/drpt101/download/79199909/onejav.com_drpt101.torrent,"3P, 4P, Beauty Shop, Big Tits, Restraint, Solowork, Squirting",深月めい,2025-12-01,https://onejav.com/torrent/drpt101
PKPL059,完全プライベート映像 Gカップふんわり癒し女神 深月めいちゃんと初めての二人きりお泊まり,5.3 GB,https://pics.dmm.co.jp/mono/movie/adult/pkpl059/pkpl059pl.jpg,https://onejav.com/torrent/pkpl059/download/50167003/onejav.com_pkpl059.torrent,"Big Tits, Breasts, Creampie, POV, Solowork",深月めい,2025-11-01,https://onejav.com/torrent/pkpl059
MFYD065,ジョギング中に出会った若者を自宅に連れ込んでエロい顔で即フェラ！美味しそうな顔でごっくん！する汗だく豊満ムッチリ妻 深月めい,5.5 GB,https://pics.dmm.co.jp/mono/movie/adult/mfyd065/mfyd065pl.jpg,https://onejav.com/torrent/mfyd065/download/15412595/onejav.com_mfyd065.torrent,"Big Tits, Blow, Cum, Huge Butt, Solowork, Sweat",深月めい,2025-10-17,https://onejav.com/torrent/mfyd065
KNMB102,ガチ中出し女優ちゃん 深月めい,5.6 GB,https://pics.dmm.co.jp/mono/movie/adult/h_491knmb102/h_491knmb102pl.jpg,https://onejav.com/torrent/knmb102/download/13873539/onejav.com_knmb102.torrent,"Beautiful Girl, Big Tits, Creampie, POV, Solowork",深月めい,2025-06-27,https://onejav.com/torrent/knmb102
ATYA014,小柄で童顔なのに巨乳な奥さん巨根おじさんのねっとり濃厚テクでイキ狂う 深月めい,5.0 GB,https://pics.dmm.co.jp/mono/movie/adult/atya014/atya014pl.jpg,https://onejav.com/torrent/atya014/download/65229956/onejav.com_atya014.torrent,"3P, 4P, Big Tits, Married Woman, M男, Solowork",深月めい,2024-11-16,https://onejav.com/torrent/atya014
