code,title,size,image_url,torrent_url,tags,actresses,date,page_url
START544,おねだり淫語で何度も中出しをせがんでくる都合の良すぎる俺専用肉オナホ人妻愛人 渚恋生,6.6 GB,https://pics.dmm.co.jp/mono/movie/adult/1start544/1start544pl.jpg,https://onejav.com/torrent/start544/download/82171638/onejav.com_start544.torrent,"Creampie, Cuckold, Dirty Words, Married Woman, Solowork",渚恋生,2026-04-28,https://onejav.com/torrent/start544
START516,妻子持ち男を潰させて、そのままホテルで朝まで中出しを要求してくる性欲モンスターのラウンジ嬢 渚恋生,4.7 GB,https://pics.dmm.co.jp/mono/movie/adult/1start516/1start516pl.jpg,https://onejav.com/torrent/start516/download/42324652/onejav.com_start516.torrent,"Breasts, Drama, Drinking Party, Idol, Solowork",渚恋生,2026-02-24,https://onejav.com/torrent/start516
START482,絶対ヌケる！絶頂の向こう側 ガチでイキすぎ失禁痙攣トランス 泣いてもわめいても容赦なく突き刺す追撃HARDピストン 渚恋生,5.6 GB,https://pics.dmm.co.jp/mono/movie/adult/1start482/1start482pl.jpg,https://onejav.com/torrent/start482/download/89687207/onejav.com_start482.torrent,"Creampie, Gal, Huge Cock, Nasty, Hardcore, Solowork, Squirting",渚恋生,2026-01-27,https://onejav.com/torrent/start482
START466,金髪喪服ギャル 渚恋生,5.7 GB,https://pics.dmm.co.jp/mono/movie/adult/1start466/1start466pl.jpg,https://onejav.com/torrent/start466/download/63599914/onejav.com_start466.torrent,"Creampie, Cuckold, Drinking Party, Gal, Married Woman, Solowork",渚恋生,2025-12-23,https://onejav.com/torrent/start466
START446,「子宮イキにハマっちゃいました…」外から圧迫！中から鬼ピスでポルチオ陥落！？びっくんびっくんエビ反る子宮開発誘淫オイルエステ 渚恋生,5.2 GB,https://pics.dmm.co.jp/mono/movie/adult/1start446/1start446pl.jpg,https://onejav.com/torrent/start446/download/95484131/onejav.com_start446.torrent,"Acme · Orgasm, Beauty Shop, Lotion, Nasty, Hardcore, Solowork, Squirting",渚恋生,2025-11-25,https://onejav.com/torrent/start446
START432,温泉旅行中の単独客や夫婦の男性を誘惑 館内で寝取りセックスをくり返す淫乱美人な若女将 渚恋生,5.3 GB,https://pics.dmm.co.jp/mono/movie/adult/1start432/1start432pl.jpg,https://onejav.com/torrent/start432/download/45334635/onejav.com_start432.torrent,"BIGセール, Creampie, Cuckold, Hot Spring, Landlady, Hostess, Slut, Solowork",渚恋生,2025-10-28,https://onejav.com/torrent/start432
START420,高飛車な女上司と真夏の張り込み捜査21日間 2週間過ぎてもホシは動かずしびれを切らしたぼくらは残り三日間汗だくでパコってしまい… 渚恋生,5.0 GB,https://pics.dmm.co.jp/mono/movie/adult/1start420/1start420pl.jpg,https://onejav.com/torrent/start420/download/95706505/onejav.com_start420.torrent,"Blow, Creampie, Female Investigator, OL, Solowork, Sweat",渚恋生,2025-09-30,https://onejav.com/torrent/start420
START391,人生初のナマ中出し解禁 渚恋生,5.5 GB,https://pics.dmm.co.jp/mono/movie/adult/1start391/1start391pl.jpg,https://onejav.com/torrent/start391/download/69670112/onejav.com_start391.torrent,"3P, 4P, Creampie, Lotion, Older Sister, Solowork, Tall",渚恋生,2025-08-26,https://onejav.com/torrent/start391
START376,命を救った男は最悪の強漢魔だった。無理矢理性処理をさせられ続け輪漢沼に堕ちた救急救命医・渚恋生,5.0 GB,https://pics.dmm.co.jp/mono/movie/adult/1start376/1start376pl.jpg,https://onejav.com/torrent/start376/download/35132666/onejav.com_start376.torrent,"3P, 4P, Drama, Female Doctor, Hospital, Clinic, Solowork, Tall",渚恋生,2025-07-29,https://onejav.com/torrent/start376
START360,いいなり温泉旅行 渚恋生,7.1 GB,https://pics.dmm.co.jp/mono/movie/adult/1start360/1start360pl.jpg,https://onejav.com/torrent/start360/download/90657175/onejav.com_start360.torrent,"3P, 4P, Acme · Orgasm, Hot Spring, Nasty, Hardcore, Restraint, Solowork",渚恋生,2025-06-24,https://onejav.com/torrent/start360
