code,title,size,image_url,torrent_url,tags,actresses,date,page_url
MILK290,潜入！オフパコ撮影会！単推シしてくれるなら即マンOK 枕営業系爆乳モデル 未来さん 瀬名未来,5.3 GB,https://pics.dmm.co.jp/mono/movie/adult/h_1240milk290/h_1240milk290pl.jpg,https://onejav.com/torrent/milk290/download/94286514/onejav.com_milk290.torrent,"3P, 4P, Big Tits, Cosplay, Creampie, Lotion, Solowork",瀬名未来,2026-05-21,https://onejav.com/torrent/milk290
MILK228,派遣型 爆乳インストラクター〇撮 手取り足取りデカパイ押しつけまくり 汗だく密着 生中出しエクササイズ 瀬名未来,5.1 GB,https://pics.dmm.co.jp/mono/movie/adult/h_1240milk228/h_1240milk228pl.jpg,https://onejav.com/torrent/milk228/download/55591352/onejav.com_milk228.torrent,"Big Tits, Creampie, Instructor, Older Sister, Solowork",瀬名未来,2024-12-05,https://onejav.com/torrent/milk228
RVG219,お色気P●A会長＆悩殺女教師と悪ガキ生徒会BEST VOL.5,10.1 GB,https://pics.dmm.co.jp/mono/movie/adult/rvg219/rvg219pl.jpg,https://onejav.com/torrent/rvg219/download/49642510/onejav.com_rvg219.torrent,"3P, 4P, 4HR+, Best, Omnibus, Female Teacher, Glasses","木村穂乃香, 水川由里, 田所百合, 朝陽えま, Yuri Sasahara, 七瀬いおり, 瀬名未来, 神谷さつき",2024-05-11,https://onejav.com/torrent/rvg219
MILK192,逆NTR痴女レイヤー 彼女持ちのカメラマンを最高の身体で誘惑して既成事実を逆盗撮 証拠消して欲しかったら今日一日私とデートしてくれますよね？ 瀬名未来,3.2 GB,https://pics.dmm.co.jp/mono/movie/adult/h_1240milk192/h_1240milk192pl.jpg,https://onejav.com/torrent/milk192/download/07505300/onejav.com_milk192.torrent,"Big Tits, Cosplay, Creampie, Cuckold, Slut, Solowork",瀬名未来,2023-12-07,https://onejav.com/torrent/milk192
FOCS048,Gcup93cm Big Breasts X 170cm Tall Menhera Girls Are Miraculous Slenders Seriously Squid Hard And Rock Creampie Sexual Intercourse Sena Mirai,5.1 GB,https://pics.dmm.co.jp/mono/movie/adult/focs048/focs048pl.jpg,https://onejav.com/torrent/focs048/download/87597870/onejav.com_focs048.torrent,"Big Tits, Creampie, Documentary, Shaved, Solowork, Tall",瀬名未来,2022-02-11,https://onejav.com/torrent/focs048
PKPD178,Girls' House Stay Document G Cup Former Chef Beauty Who Behaves Home Cooking Sena Mirai-chan's House Without Rubber 1 Night Boyfriend Mood Sena Mirai,5.8 GB,https://pics.dmm.co.jp/mono/movie/adult/pkpd178/pkpd178pl.jpg,https://onejav.com/torrent/pkpd178_2/download/42133158/onejav.com_pkpd178_2.torrent,"Beautiful Girl, Creampie, Documentary, Huge Butt, POV, Solowork",瀬名未来,2022-01-10,https://onejav.com/torrent/pkpd178_2
MILK128,G-Cup New Wife Just Before The Wedding Is Called A Treatment And Sexual Development Development A Big Cock Is Inserted Into A Sensitive Big Tits Wife Who Feels Covered With Oil Completely Fallen Iki Mad Sexual Intercourse Mirai Sena,4.6 GB,https://pics.dmm.co.jp/mono/movie/adult/h_1240milk128/h_1240milk128pl.jpg,https://onejav.com/torrent/milk128/download/86250195/onejav.com_milk128.torrent,"Beauty Shop, Big Tits, Breasts, Creampie, Cuckold, Lotion, Married Woman, Solowork",瀬名未来,2021-12-02,https://onejav.com/torrent/milk128
JUL595,"The Body That A Woman Wants To Be, The Body That A Man Wants To Embrace. Former Swimsuit Model Married Woman Mirai Sena 27 Years Old AV Debut",7.5 GB,https://pics.dmm.co.jp/mono/movie/adult/jul595/jul595pl.jpg,https://onejav.com/torrent/jul595/download/66281798/onejav.com_jul595.torrent,"Big Tits, Debut Production, Digital Mosaic, Married Woman, Mature Woman, Model, Solowork",瀬名未来,2021-06-04,https://onejav.com/torrent/jul595
