code,title,size,image_url,torrent_url,tags,actresses,date,page_url
PFES118,猛烈イラマで苦しみ果て こってり精子とエヅキ愛液に溺れる 喉奥射精シンデレラ 瀬戸ひなこ,8.1 GB,https://pics.dmm.co.jp/mono/movie/adult/pfes118/pfes118pl.jpg,https://onejav.com/torrent/pfes118/download/29696390/onejav.com_pfes118.torrent,"Beautiful Girl, Cum, Deep Throating, M女, Nasty, Hardcore, Solowork",瀬戸ひなこ,2026-03-27,https://onejav.com/torrent/pfes118
AGAV162,足裏フェチシズム ～変態に寛容なギャルなので、ぜひ足マ〇コをじっくり堪能させていただきたい～ 瀬戸ひなこ,5.0 GB,https://pics.dmm.co.jp/mono/movie/adult/agav162/agav162pl.jpg,https://onejav.com/torrent/agav162/download/73493886/onejav.com_agav162.torrent,"Beauty Shop, Footjob, Leg Fetish, Other Fetish, School Uniform, Solowork",瀬戸ひなこ,2026-02-21,https://onejav.com/torrent/agav162
AGMX255,顔で抜く！！顔面ドアップ主観フェラ,4.3 GB,https://pics.dmm.co.jp/mono/movie/adult/agmx255/agmx255pl.jpg,https://onejav.com/torrent/agmx255/download/11779209/onejav.com_agmx255.torrent,"Beautiful Girl, Blow, Handjob, Other Fetish, Subjectivity","Yuina Taki, 安堂はるの, 瀬戸ひなこ, 甘井くるみ, 橘内ひなた, 相沢澪, 兼咲みゆ",2026-01-24,https://onejav.com/torrent/agmx255
PYM547,アナタは私専用おちん○ん！ 騎乗位特化ディルドオナニー,10.4 GB,https://pics.dmm.co.jp/mono/movie/adult/h_283pym547/h_283pym547pl.jpg,https://onejav.com/torrent/pym547/download/39324969/onejav.com_pym547.torrent,"4HR+, Breasts, Masturbation, Older Sister, Toy","椿りか, 瀬戸ひなこ, 若月もあ, 千川とわ, 虹村ゆみ, 工藤ゆり, 幸村紀那, 望月ふうか, 真城かのん, 蒼まりな",2026-01-15,https://onejav.com/torrent/pym547
MADV607,令和版 私は痴女 ひなみ×りんか×ひなこ,7.2 GB,https://pics.dmm.co.jp/mono/movie/adult/madv607/madv607pl.jpg,https://onejav.com/torrent/madv607/download/38307306/onejav.com_madv607.torrent,"Big Tits, Cum, Facesitting, Huge Cock, Married Woman, Shaved, Slender, Slut, Squirting, Titty Fuck","瀬戸ひなこ, 石川陽波, 雨村梨花",2025-10-25,https://onejav.com/torrent/madv607
AUKG632,＃裏アカ女子レズビアン ～美少女の性欲処理します！裏垢で女を漁る美人レズビアン～,4.9 GB,https://pics.dmm.co.jp/mono/movie/adult/aukg632/aukg632pl.jpg,https://onejav.com/torrent/aukg632/download/14999382/onejav.com_aukg632.torrent,"BIGセール, Breasts, Drama, Older Sister, Uniform","瀬戸ひなこ, Seike Igarashi",2025-08-02,https://onejav.com/torrent/aukg632
DFE103,娘に喰わせてもらってます。 瀬戸ひなこ,4.9 GB,https://pics.dmm.co.jp/mono/movie/adult/2dfe103/2dfe103pl.jpg,https://onejav.com/torrent/dfe103/download/90211792/onejav.com_dfe103.torrent,"Beautiful Girl, Cum, School Girls, Small Tits, Solowork, Uniform",瀬戸ひなこ,2025-07-27,https://onejav.com/torrent/dfe103
FTHTD119,地味で無口な図書委員とセックスしまくった話。『何で？私、感じちゃってるの？？もしかして、いっぱい見て欲しいの？（※心の声）』 瀬戸ひなこ,5.4 GB,https://pics.dmm.co.jp/mono/movie/adult/1fthtd119/1fthtd119pl.jpg,https://onejav.com/torrent/fthtd119/download/08740154/onejav.com_fthtd119.torrent,"Breasts, Creampie, Drama, Planning, Slender, Solowork",瀬戸ひなこ,2025-06-30,https://onejav.com/torrent/fthtd119
GDRD040,Red Dragon 瀬戸ひなこ,6.4 GB,https://pics.dmm.co.jp/mono/movie/adult/gdrd040/gdrd040pl.jpg,https://onejav.com/torrent/gdrd040/download/36444571/onejav.com_gdrd040.torrent,"Big Tits, Bunny Girl, Creampie, Huge Butt, Prostitutes, Solowork",瀬戸ひなこ,2025-01-11,https://onejav.com/torrent/gdrd040
MXGS1359,イッた直後の感度100％のおま●こを更にメッタ突き無限ループピストンで絶叫アクメ 瀬戸ひなこ,3.5 GB,https://pics.dmm.co.jp/mono/movie/adult/h_068mxgs1359/h_068mxgs1359pl.jpg,https://onejav.com/torrent/mxgs1359/download/66130141/onejav.com_mxgs1359.torrent,"AV女優, Solowork",瀬戸ひなこ,2024-11-16,https://onejav.com/torrent/mxgs1359
