code,title,size,image_url,torrent_url,tags,actresses,date,page_url
CEMD847,縄に酔って溺れたドマゾ未亡人 相河沙季,4.7 GB,https://pics.dmm.co.jp/mono/movie/adult/cemd847/cemd847pl.jpg,https://onejav.com/torrent/cemd847/download/33171990/onejav.com_cemd847.torrent,"Big Tits, Huge Butt, Mature Woman, M女, SM, Solowork",相河沙季,2026-05-23,https://onejav.com/torrent/cemd847
CEMD809,ノーブラで乳首もろバレ！淫乱美熟女と羞恥プレイデート2 相河沙季,7.8 GB,https://pics.dmm.co.jp/mono/movie/adult/cemd809/cemd809pl.jpg,https://onejav.com/torrent/cemd809/download/78547242/onejav.com_cemd809.torrent,"Big Tits, Creampie, Mature Woman, No Bra, Shame, Solowork",相河沙季,2026-03-21,https://onejav.com/torrent/cemd809
ROE451,人妻を拘束椅子に放置して2時間…唾液だらだらのイグイグ変態女に育った話。 相河沙季,6.4 GB,https://pics.dmm.co.jp/mono/movie/adult/roe451/roe451pl.jpg,https://onejav.com/torrent/roe451/download/96679747/onejav.com_roe451.torrent,"Big Tits, Creampie, Married Woman, Mature Woman, Restraint, Solowork",相河沙季,2026-02-06,https://onejav.com/torrent/roe451
ROE436,PTA中出し不倫 家庭で空気扱いだった私が見つけた新しい居場所 相河沙季,5.7 GB,https://pics.dmm.co.jp/mono/movie/adult/roe436/roe436pl.jpg,https://onejav.com/torrent/roe436/download/88655866/onejav.com_roe436.torrent,"Affair, Big Tits, Drama, Married Woman, Mature Woman, Solowork",相河沙季,2026-01-09,https://onejav.com/torrent/roe436
ROE433,義理の娘は男友達を呼び出して毎日、私を輪●させています―。 相河沙季 伊織ひなの,6.0 GB,https://pics.dmm.co.jp/mono/movie/adult/roe433/roe433pl.jpg,https://onejav.com/torrent/roe433/download/93912330/onejav.com_roe433.torrent,"3P, 4P, Creampie, Humiliation, Married Woman, Mature Woman","相河沙季, 伊織ひなの",2025-12-05,https://onejav.com/torrent/roe433
ROE422,最愛の娘の彼氏と、大痙攣エビ反り性交に溺れた私。 相河沙季,6.0 GB,https://pics.dmm.co.jp/mono/movie/adult/roe422/roe422pl.jpg,https://onejav.com/torrent/roe422/download/60882510/onejav.com_roe422.torrent,"Big Tits, Creampie, Married Woman, Mature Woman, Solowork, Squirting",相河沙季,2025-11-07,https://onejav.com/torrent/roe422
ROE413,ハメ撮りNTR 親友から誤送信された「ハメ撮り動画」に映っていた相手は僕の母だった。 相河沙季,5.0 GB,https://pics.dmm.co.jp/mono/movie/adult/roe413/roe413pl.jpg,https://onejav.com/torrent/roe413/download/11515063/onejav.com_roe413.torrent,"Big Tits, Cuckold, Married Woman, Mature Woman, POV, Solowork",相河沙季,2025-10-10,https://onejav.com/torrent/roe413
ROE397,恥辱の言いなり肉便器旅行 超《絶倫》極悪男に、孕むまで何度も中出しされ続けた1泊2日。 相河沙季,6.5 GB,https://pics.dmm.co.jp/mono/movie/adult/roe397/roe397pl.jpg,https://onejav.com/torrent/roe397/download/19767135/onejav.com_roe397.torrent,"Creampie, Cuckold, Hot Spring, Married Woman, Mature Woman, Solowork",相河沙季,2025-09-05,https://onejav.com/torrent/roe397
ROE391,家族皆が巣立った実家で、 母と過ごす近親相姦の日々―。 相河沙季,8.3 GB,https://pics.dmm.co.jp/mono/movie/adult/roe391/roe391pl.jpg,https://onejav.com/torrent/roe391/download/71207855/onejav.com_roe391.torrent,"Big Tits, Creampie, Married Woman, Mature Woman, Mother, Solowork",相河沙季,2025-08-08,https://onejav.com/torrent/roe391
ROE386,電撃移籍 相河沙季 MONROE専属デビュー！！,7.0 GB,https://pics.dmm.co.jp/mono/movie/adult/roe386/roe386pl.jpg,https://onejav.com/torrent/roe386/download/94771299/onejav.com_roe386.torrent,"3P, 4P, Big Tits, Documentary, Married Woman, Mature Woman, Solowork",相河沙季,2025-07-04,https://onejav.com/torrent/roe386
