code,title,size,image_url,torrent_url,tags,actresses,date,page_url
RCTD716,ROCKET18周年記念作品 どろんこプールにドボン！ウェット＆メッシー（WAM）人間クレーンゲーム ～ボディペイントで巨大クレーンゲームのアームになって景品ゲットだぜ！～,5.6 GB,https://pics.dmm.co.jp/mono/movie/adult/1rctd716/1rctd716pl.jpg,https://onejav.com/torrent/rctd716/download/94778467/onejav.com_rctd716.torrent,"Other Fetish, Planning, Shame","幾野まち, 赤城穂波, 祈山愛, 横山夏希",2026-04-05,https://onejav.com/torrent/rctd716
RCTD718,羞恥M女博覧会 MXPO2026,5.2 GB,https://pics.dmm.co.jp/mono/movie/adult/1rctd718/1rctd718pl.jpg,https://onejav.com/torrent/rctd718/download/78058850/onejav.com_rctd718.torrent,"Humiliation, M女, Nose Hook, Planning, Shame","祈山愛, 坂本りお, 八坂凪, 朝倉七海, 湊波流, 本田瞳",2026-02-20,https://onejav.com/torrent/rctd718
JUAN028,叔父と従兄をまとめて2穴で翻弄する欲求不満妻 祈山愛,5.1 GB,https://pics.dmm.co.jp/mono/movie/adult/juan028/juan028pl.jpg,https://onejav.com/torrent/juan028/download/96861113/onejav.com_juan028.torrent,"Anal, Creampie, Incest, Married Woman, Mature Woman, Solowork",祈山愛,2026-01-17,https://onejav.com/torrent/juan028
CEAD718,あなたを見つめてノーハンドフェラチオでイカせる15人の女優たち！,8.5 GB,https://pics.dmm.co.jp/mono/movie/adult/cead718/cead718pl.jpg,https://onejav.com/torrent/cead718/download/12367860/onejav.com_cead718.torrent,"Big Tits, Blow, Dirty Words, Mature Woman, Subjectivity","Yui Hatano, 飯岡かなこ, 葉山さゆり, Azu Komatsu, 祈山愛, 桐香ゆうり, 依本しおり, Natsuki Takeuchi, 夏川あゆみ, 池田あやみ, ▼すべて表示する",2026-01-03,https://onejav.com/torrent/cead718
RCTD677,ROCKET17周年記念ユーザーリクエスト祭り 変態下劣バカエロ ～史上最低の発表会～,6.6 GB,https://pics.dmm.co.jp/mono/movie/adult/1rctd677/1rctd677pl.jpg,https://onejav.com/torrent/rctd677/download/51110532/onejav.com_rctd677.torrent,"Dirty Words, Other Fetish, Planning, Shame","祈山愛, 有加里ののか, Azu Komatsu",2025-07-20,https://onejav.com/torrent/rctd677
GTJ166,串刺し拷問 祈山愛,4.7 GB,https://pics.dmm.co.jp/mono/movie/adult/gtj166/gtj166pl.jpg,https://onejav.com/torrent/gtj166/download/32377418/onejav.com_gtj166.torrent,"Abuse, Deep Throating, Restraint, Restraints, SM, Solowork",祈山愛,2025-07-12,https://onejav.com/torrent/gtj166
VDD192,女教師in...（脅迫スイートルーム） 祈山愛,5.1 GB,https://pics.dmm.co.jp/mono/movie/adult/24vdd192/24vdd192pl.jpg,https://onejav.com/torrent/vdd192/download/33741040/onejav.com_vdd192.torrent,"3P, 4P, Breasts, Deep Throating, Facials, Female Teacher, Huge Butt, M女, Restraints, Solowork, Squirting",祈山愛,2025-04-27,https://onejav.com/torrent/vdd192
XMOM90,平日昼顔妻の羞恥セックス 祈山愛,3.9 GB,https://pics.dmm.co.jp/mono/movie/adult/h_086xmom90/h_086xmom90pl.jpg,https://onejav.com/torrent/xmom90/download/68657038/onejav.com_xmom90.torrent,"3P, 4P, Affair, Creampie, Married Woman, Mature Woman, Solowork",祈山愛,2025-04-24,https://onejav.com/torrent/xmom90
AUKG622,継母と私 ～レズの快感教えてあげる パパには内緒の強●レズ強要～,5.0 GB,https://pics.dmm.co.jp/mono/movie/adult/aukg622/aukg622pl.jpg,https://onejav.com/torrent/aukg622/download/60521348/onejav.com_aukg622.torrent,"M女, Nasty, Hardcore, Slut, Stepmother","Sarina Momonaga, 祈山愛",2025-03-15,https://onejav.com/torrent/aukg622
DETK003,溺れる女 老人介護は蜜の味 祈山愛,4.5 GB,https://pics.dmm.co.jp/mono/movie/adult/detk003/detk003pl.jpg,https://onejav.com/torrent/detk003/download/21547321/onejav.com_detk003.torrent,"Cowgirl, Deep Throating, Drama, Married Woman, M女, Solowork",祈山愛,2025-03-15,https://onejav.com/torrent/detk003
