code,title,size,image_url,torrent_url,tags,actresses,date,page_url
HMN842,マッスルガールズバーの腹筋バリキレお姉さん達に営業中こっそり逆ナンされて性欲むんむんケツ加圧逆鬼ピストンで何度も射精させられる卑猥なアフター中出し,5.7 GB,https://pics.dmm.co.jp/mono/movie/adult/hmn842/hmn842pl.jpg,https://onejav.com/torrent/hmn842/download/08922529/onejav.com_hmn842.torrent,"Butt, Harem, Muscle, Older Sister, Slut","竹内有紀, Asami Mizuhashi",2026-04-24,https://onejav.com/torrent/hmn842
CJOD506,GOGO痴女マッスルBAR お酒スイッチオンで豹変した筋肉美女に力負けして勝手に馬乗り中出しでエロ接客されちゃったボク 竹内有紀,6.4 GB,https://pics.dmm.co.jp/mono/movie/adult/cjod506/cjod506pl.jpg,https://onejav.com/torrent/cjod506/download/95949104/onejav.com_cjod506.torrent,"3P, 4P, Cowgirl, Creampie, Muscle, Slut, Solowork",竹内有紀,2026-04-24,https://onejav.com/torrent/cjod506
JUR692,家出した僕は叔母である有紀さんの自宅に入り浸り、彼女の色香に耐えられず… 生ハメで繋がりっぱなしのSEX漬け生活を送っている―。 竹内有紀,6.0 GB,https://pics.dmm.co.jp/mono/movie/adult/jur692/jur692pl.jpg,https://onejav.com/torrent/jur692/download/74953665/onejav.com_jur692.torrent,"Aunt, Drama, Married Woman, Mature Woman, Slender, Solowork",竹内有紀,2026-03-20,https://onejav.com/torrent/jur692
DASS892,ギャル化した清楚系お姉さんが！僕を振り向かせるために最強GALになって帰ってきて… 竹内有紀,5.3 GB,https://pics.dmm.co.jp/mono/movie/adult/dass892/dass892pl.jpg,https://onejav.com/torrent/dass892/download/01043097/onejav.com_dass892.torrent,"Blow, Creampie, Gal, Muscle, Older Sister, Solowork",竹内有紀,2026-03-06,https://onejav.com/torrent/dass892
JUR647,ハプニングバー人妻NTR 「あなたのためよ…」と言っていた妻がいつしか群がる男たちに夢中になっていた。 竹内有紀,6.3 GB,https://pics.dmm.co.jp/mono/movie/adult/jur647/jur647pl.jpg,https://onejav.com/torrent/jur647/download/63977281/onejav.com_jur647.torrent,"Creampie, Cuckold, Married Woman, Mature Woman, Slender","竹内有紀, 新セリナ",2026-02-20,https://onejav.com/torrent/jur647
ROYD293,毎日泊まりに来る彼氏持ちの女友達から無自覚に誘惑され、勇気を出せず生殺し状態になった僕。 竹内有紀,6.9 GB,https://pics.dmm.co.jp/mono/movie/adult/royd293/royd293pl.jpg,https://onejav.com/torrent/royd293/download/41361762/onejav.com_royd293.torrent,"Breasts, Creampie, Nasty, Hardcore, Slender, Solowork",竹内有紀,2026-02-20,https://onejav.com/torrent/royd293
YUJ054,最高の愛人、最高の中出し。 竹内有紀,5.2 GB,https://pics.dmm.co.jp/mono/movie/adult/yuj054/yuj054pl.jpg,https://onejav.com/torrent/yuj054/download/05971279/onejav.com_yuj054.torrent,"Affair, Blow, OL, Pantyhose, Slut, Solowork",竹内有紀,2026-01-30,https://onejav.com/torrent/yuj054
ROYD289,朝起きたら部屋に下着姿の同期女子社員！いつも生意気で悪態ばかりついてくるのに、甘えてきたので… 竹内有紀,5.2 GB,https://pics.dmm.co.jp/mono/movie/adult/royd289/royd289pl.jpg,https://onejav.com/torrent/royd289/download/30919737/onejav.com_royd289.torrent,"69, Creampie, Digital Mosaic, OL, Solowork",竹内有紀,2026-01-23,https://onejav.com/torrent/royd289
DASS837,「もう全部夢だから」酔った勢いで浮気セックスしたバイト先の先輩に何度も中出しした最後の夜。 竹内有紀,5.2 GB,https://pics.dmm.co.jp/mono/movie/adult/dass837/dass837pl.jpg,https://onejav.com/torrent/dass837/download/89275441/onejav.com_dass837.torrent,"Cowgirl, Creampie, Cuckold, Older Sister, Slender, Solowork",竹内有紀,2025-12-23,https://onejav.com/torrent/dass837
HMN799,筋肉トレーナーNTR 従順な彼女がマッチョ好みのバキバキ筋肉ボディーに改造されガン突き肉食チ○ポでイキまくるメスになってしまった話。 竹内有紀,6.2 GB,https://pics.dmm.co.jp/mono/movie/adult/hmn799/hmn799pl.jpg,https://onejav.com/torrent/hmn799/download/49169896/onejav.com_hmn799.torrent,"Creampie, Cuckold, Married Woman, Muscle, Slender, Solowork",竹内有紀,2025-12-19,https://onejav.com/torrent/hmn799
