code,title,size,image_url,torrent_url,tags,actresses,date,page_url
PKPD411,円女交際中出しoK18歳 先輩にフラれてヤリ○ン期間中のGカップ水泳部女子 糸井瑠花,5.6 GB,https://pics.dmm.co.jp/mono/movie/adult/pkpd411/pkpd411pl.jpg,https://onejav.com/torrent/pkpd411/download/43229973/onejav.com_pkpd411.torrent,"Beautiful Girl, Big Tits, Breasts, Creampie, POV, Solowork",糸井瑠花,2026-03-16,https://onejav.com/torrent/pkpd411
JUFE615,オヤジのハメ撮りドキュメント ねっとり濃厚に貪り尽くす体液ドロドロ汗だく性交 糸井瑠花,7.0 GB,https://pics.dmm.co.jp/mono/movie/adult/jufe615/jufe615pl.jpg,https://onejav.com/torrent/jufe615/download/25188464/onejav.com_jufe615.torrent,"Big Tits, Creampie, Kiss, Solowork, Squirting, Sweat",糸井瑠花,2026-03-13,https://onejav.com/torrent/jufe615
CAWD926,「●●クン、見て。先生のおっぱいだよ？」 2週間実習でやってきた地味な教育実習生は、生徒と2人きりになると何故かおっぱい丸出しになります。 糸井瑠花,6.3 GB,https://pics.dmm.co.jp/mono/movie/adult/cawd926/cawd926pl.jpg,https://onejav.com/torrent/cawd926/download/61102346/onejav.com_cawd926.torrent,"Big Tits, Creampie, Female Teacher, Nasty, Hardcore, Slut, Solowork",糸井瑠花,2026-01-30,https://onejav.com/torrent/cawd926
CAWD908,セーラー機関銃ボイン少女 違●製薬工場に潜入依頼を受けたスパイ女学生は返り討ちに遭う…イキ潮大洪水キメセク拷問堕ち,5.0 GB,https://pics.dmm.co.jp/mono/movie/adult/cawd908/cawd908pl.jpg,https://onejav.com/torrent/cawd908/download/75815365/onejav.com_cawd908.torrent,"Acme · Orgasm, Big Tits, Orgy, Sailor Suit, Squirting","天月あず, 糸井瑠花",2026-01-01,https://onejav.com/torrent/cawd908
CAWD895,隣人のゴミ部屋で異臭中年おやじに白い肉体を汗潮精子まみれにされ抜かずの連撃中出し51発で孕まされたショートカット制服少女の末路 kawaii移籍 中出し解禁デビュー 糸井瑠花,5.0 GB,https://pics.dmm.co.jp/mono/movie/adult/cawd895/cawd895pl.jpg,https://onejav.com/torrent/cawd895/download/91023099/onejav.com_cawd895.torrent,"Acme · Orgasm, Big Tits, Creampie, Solowork, Squirting, Uniform",糸井瑠花,2025-11-28,https://onejav.com/torrent/cawd895
SONE990,「娘とは小っちゃい頃から愛し合ってます。」父と連れ子の歪んだ愛を記録した10年分の性洗脳ビデオ 糸井瑠花,6.9 GB,https://pics.dmm.co.jp/mono/movie/adult/sone990/sone990pl.jpg,https://onejav.com/torrent/sone990/download/04547749/onejav.com_sone990.torrent,"Adopted Daughter, Incest, Kiss, POV, School Girls, Solowork",糸井瑠花,2025-11-07,https://onejav.com/torrent/sone990
SONE973,保健室登校の糸井さん、B組の男子全員から盛大にぶっかけられる。 糸井瑠花,6.1 GB,https://pics.dmm.co.jp/mono/movie/adult/sone973/sone973pl.jpg,https://onejav.com/torrent/sone973/download/76151015/onejav.com_sone973.torrent,"3P, 4P, Big Tits, Bukkake, Facials, School Girls, Solowork",糸井瑠花,2025-10-10,https://onejav.com/torrent/sone973
CKCK014,お隣の引きこもり女子●生と仲良くなってしまった 糸井瑠花,6.1 GB,https://pics.dmm.co.jp/mono/movie/adult/ckck014/ckck014pl.jpg,https://onejav.com/torrent/ckck014/download/04802096/onejav.com_ckck014.torrent,"Beautiful Girl, Big Tits, Drama, Handjob, School Girls, Solowork",糸井瑠花,2025-09-26,https://onejav.com/torrent/ckck014
SONE951,幼馴染にふざけてSMプレイしてみたら…ドMに目覚めて従順ほしがりエロマゾペットになっちゃった。 糸井瑠花,7.1 GB,https://pics.dmm.co.jp/mono/movie/adult/sone951/sone951pl.jpg,https://onejav.com/torrent/sone951/download/61312415/onejav.com_sone951.torrent,"Big Tits, Restraints, SM, Solowork, Squirting, Toy",糸井瑠花,2025-09-05,https://onejav.com/torrent/sone951
SONE911,田舎帰省で大嫌いな叔父宅に一人で泊めさせられた姪っ子…手を出してきたロリコンおじさんのキモち●ぽと少女ま●こがまさかの相性抜群！！2日2晩の絶倫汗だく大性交 糸井瑠花,6.3 GB,https://pics.dmm.co.jp/mono/movie/adult/sone911/sone911pl.jpg,https://onejav.com/torrent/sone911/download/71089163/onejav.com_sone911.torrent,"Acme · Orgasm, Blow, Drama, Nasty, Hardcore, School Girls, Solowork",糸井瑠花,2025-08-22,https://onejav.com/torrent/sone911
