code,title,size,image_url,torrent_url,tags,actresses,date,page_url
KNMB123,ガチ中出し女優ちゃん 糸井瑠花,5.4 GB,https://pics.dmm.co.jp/mono/movie/adult/h_491knmb123/h_491knmb123pl.jpg,https://onejav.com/torrent/knmb123/download/24030934/onejav.com_knmb123.torrent,"Beautiful Girl, Breasts, Creampie, POV, Solowork",糸井瑠花,2026-04-27,https://onejav.com/torrent/knmb123
PIYO233,孕ませ本屋さん～さびれた本屋で立ち読みしている気の弱そうな眼鏡少女たちは孕まさざるを得ない～,6.8 GB,https://pics.dmm.co.jp/mono/movie/adult/1piyo233/1piyo233pl.jpg,https://onejav.com/torrent/piyo233/download/84882156/onejav.com_piyo233.torrent,"Big Tits, Creampie, Petite, School Girls, Slender","鳥羽いく, 糸井瑠花, 月乃あや",2026-04-19,https://onejav.com/torrent/piyo233
SUJI305,メガネを掛けた無垢な子に変態わいせつ行為をしたら…興味津々で欲しがり顔…初体験の生チ●コの感触に「本物は初めてです。」と懐き、トロけた顔で崩壊絶頂する地味カワで巨乳のパイパン●学生るか 糸井瑠花,5.2 GB,https://pics.dmm.co.jp/mono/movie/adult/suji305/suji305pl.jpg,https://onejav.com/torrent/suji305/download/96875536/onejav.com_suji305.torrent,"Beautiful Girl, Big Tits, Creampie, Sailor Suit, Shaved, Solowork",糸井瑠花,2026-04-18,https://onejav.com/torrent/suji305
SQTE677,この子ヤバイ！！射精せずにはいられない関西ロリ巨乳！糸井瑠花,4.7 GB,https://pics.dmm.co.jp/mono/movie/adult/sqte677/sqte677pl.jpg,https://onejav.com/torrent/sqte677/download/11417324/onejav.com_sqte677.torrent,"Beautiful Girl, Big Tits, Blow, Creampie, POV, Solowork",糸井瑠花,2026-04-18,https://onejav.com/torrent/sqte677
NGOD333,禁断の二度孕ませ 昔孕まされた男と7年後再会しまた孕まされた妻 糸井瑠花,5.1 GB,https://pics.dmm.co.jp/mono/movie/adult/ngod333/ngod333pl.jpg,https://onejav.com/torrent/ngod333/download/92214391/onejav.com_ngod333.torrent,"Big Tits, Creampie, Cuckold, Drama, Married Woman, Solowork",糸井瑠花,2026-04-10,https://onejav.com/torrent/ngod333
PFES132,大阪ミナミで噂のごっつエロイ関西弁淫語とセクシーランジェリーで男をヌキまくる裏風俗アパート 花宮きょうこ 糸井瑠花,5.0 GB,https://pics.dmm.co.jp/mono/movie/adult/pfes132/pfes132pl.jpg,https://onejav.com/torrent/pfes132/download/22159275/onejav.com_pfes132.torrent,"Big Tits, Lingerie, Prostitutes, Slut, Soapland","花宮きょうこ, 糸井瑠花",2026-03-27,https://onejav.com/torrent/pfes132
PKPD411,円女交際中出しoK18歳 先輩にフラれてヤリ○ン期間中のGカップ水泳部女子 糸井瑠花,5.6 GB,https://pics.dmm.co.jp/mono/movie/adult/pkpd411/pkpd411pl.jpg,https://onejav.com/torrent/pkpd411/download/83847865/onejav.com_pkpd411.torrent,"Beautiful Girl, Big Tits, Breasts, Creampie, POV, Solowork",糸井瑠花,2026-03-16,https://onejav.com/torrent/pkpd411
JUFE615,オヤジのハメ撮りドキュメント ねっとり濃厚に貪り尽くす体液ドロドロ汗だく性交 糸井瑠花,7.0 GB,https://pics.dmm.co.jp/mono/movie/adult/jufe615/jufe615pl.jpg,https://onejav.com/torrent/jufe615/download/87779941/onejav.com_jufe615.torrent,"Big Tits, Creampie, Kiss, Solowork, Squirting, Sweat",糸井瑠花,2026-03-13,https://onejav.com/torrent/jufe615
CAWD926,「●●クン、見て。先生のおっぱいだよ？」 2週間実習でやってきた地味な教育実習生は、生徒と2人きりになると何故かおっぱい丸出しになります。 糸井瑠花,6.3 GB,https://pics.dmm.co.jp/mono/movie/adult/cawd926/cawd926pl.jpg,https://onejav.com/torrent/cawd926/download/44310967/onejav.com_cawd926.torrent,"Big Tits, Creampie, Female Teacher, Nasty, Hardcore, Slut, Solowork",糸井瑠花,2026-01-30,https://onejav.com/torrent/cawd926
CAWD908,セーラー機関銃ボイン少女 違●製薬工場に潜入依頼を受けたスパイ女学生は返り討ちに遭う…イキ潮大洪水キメセク拷問堕ち,5.0 GB,https://pics.dmm.co.jp/mono/movie/adult/cawd908/cawd908pl.jpg,https://onejav.com/torrent/cawd908/download/15774815/onejav.com_cawd908.torrent,"Acme · Orgasm, Big Tits, Orgy, Sailor Suit, Squirting","糸井瑠花, 天月あず",2026-01-01,https://onejav.com/torrent/cawd908
