code,title,size,image_url,torrent_url,tags,actresses,date,page_url
BAB192,幽霊ドクドク制服ちゃん season.09 糸井瑠花,5.2 GB,https://pics.dmm.co.jp/mono/movie/adult/bab192/bab192pl.jpg,https://onejav.com/torrent/bab192/download/86871447/onejav.com_bab192.torrent,"Big Tits, Bukkake, Busty Fetish, Creampie, Huge Butt, Solowork",糸井瑠花,2026-05-31,https://onejav.com/torrent/bab192
YMDD497,裏風俗学園祭 エロかわ巨乳女子○生の密着ご奉仕ソーププレイ 糸井瑠花＆桜ゆの,6.7 GB,https://pics.dmm.co.jp/mono/movie/adult/ymdd497/ymdd497pl.jpg,https://onejav.com/torrent/ymdd497/download/56043129/onejav.com_ymdd497.torrent,"Big Tits, Creampie, School Stuff, Soapland, Uniform","糸井瑠花, 桜ゆの",2026-05-31,https://onejav.com/torrent/ymdd497
MXGS1428,姉の彼氏をNTRする欲しがりであざとい妹 糸井瑠花,6.0 GB,https://pics.dmm.co.jp/mono/movie/adult/h_068mxgs1428/h_068mxgs1428pl.jpg,https://onejav.com/torrent/mxgs1428/download/50043201/onejav.com_mxgs1428.torrent,"Cuckold, Solowork",糸井瑠花,2026-05-16,https://onejav.com/torrent/mxgs1428
MUDR377,田舎に帰省したら実家がソープになっていた！？リピート確定巨乳看板娘のシコシコご奉仕奮闘記 糸井瑠花,3.9 GB,https://pics.dmm.co.jp/mono/movie/adult/mudr377/mudr377pl.jpg,https://onejav.com/torrent/mudr377/download/25243108/onejav.com_mudr377.torrent,"Beautiful Girl, Big Tits, Creampie, Lotion, Soapland, Solowork",糸井瑠花,2026-05-15,https://onejav.com/torrent/mudr377
MADV631,学校イチ優秀で色白巨乳な女生徒に校則違反水着で迫られ…何度も何度も瑠花と中出しSEXしてしまった 糸井瑠花,5.4 GB,https://pics.dmm.co.jp/mono/movie/adult/madv631/madv631pl.jpg,https://onejav.com/torrent/madv631/download/15341229/onejav.com_madv631.torrent,"Big Tits, Cowgirl, Creampie, Facials, Lotion, Masturbation, School Swimsuit, Shaved, Solowork, Titty Fuck, Uniform",糸井瑠花,2026-05-09,https://onejav.com/torrent/madv631
DVMM392,狙われたのは妹のスク水と爆乳 発育を見守り続けた変態兄がついに妹を水着のままハメまくった家庭内近親相姦映像 Rec-3 糸井瑠花,7.1 GB,https://pics.dmm.co.jp/mono/movie/adult/dvmm392/dvmm392pl.jpg,https://onejav.com/torrent/dvmm392/download/39253884/onejav.com_dvmm392.torrent,"Big Tits, Creampie, Incest, School Swimsuit, Sister, Solowork",糸井瑠花,2026-05-01,https://onejav.com/torrent/dvmm392
KNMB123,ガチ中出し女優ちゃん 糸井瑠花,5.4 GB,https://pics.dmm.co.jp/mono/movie/adult/h_491knmb123/h_491knmb123pl.jpg,https://onejav.com/torrent/knmb123/download/67902958/onejav.com_knmb123.torrent,"Beautiful Girl, Breasts, Creampie, POV, Solowork",糸井瑠花,2026-04-27,https://onejav.com/torrent/knmb123
PIYO233,孕ませ本屋さん～さびれた本屋で立ち読みしている気の弱そうな眼鏡少女たちは孕まさざるを得ない～,6.8 GB,https://pics.dmm.co.jp/mono/movie/adult/1piyo233/1piyo233pl.jpg,https://onejav.com/torrent/piyo233/download/69698844/onejav.com_piyo233.torrent,"Big Tits, Creampie, Petite, School Girls, Slender","鳥羽いく, 糸井瑠花, 月乃あや",2026-04-19,https://onejav.com/torrent/piyo233
SUJI305,メガネを掛けた無垢な子に変態わいせつ行為をしたら…興味津々で欲しがり顔…初体験の生チ●コの感触に「本物は初めてです。」と懐き、トロけた顔で崩壊絶頂する地味カワで巨乳のパイパン●学生るか 糸井瑠花,5.2 GB,https://pics.dmm.co.jp/mono/movie/adult/suji305/suji305pl.jpg,https://onejav.com/torrent/suji305/download/96541413/onejav.com_suji305.torrent,"Beautiful Girl, Big Tits, Creampie, Sailor Suit, Shaved, Solowork",糸井瑠花,2026-04-18,https://onejav.com/torrent/suji305
SQTE677,この子ヤバイ！！射精せずにはいられない関西ロリ巨乳！糸井瑠花,4.7 GB,https://pics.dmm.co.jp/mono/movie/adult/sqte677/sqte677pl.jpg,https://onejav.com/torrent/sqte677/download/53540582/onejav.com_sqte677.torrent,"Beautiful Girl, Big Tits, Blow, Creampie, POV, Solowork",糸井瑠花,2026-04-18,https://onejav.com/torrent/sqte677
