code,title,size,image_url,torrent_url,tags,actresses,date,page_url
RCTD738,洗脳家族II ～禁断の近親相姦光線銃を使ったら祖母、母、妹、全員僕のいいなり～,4.8 GB,https://pics.dmm.co.jp/mono/movie/adult/1rctd738/1rctd738pl.jpg,https://onejav.com/torrent/rctd738/download/44214505/onejav.com_rctd738.torrent,"3P, 4P, Creampie, Granny, Incest, Mother, Planning, Sister","Emi Nishino, 日向由奈, 花撫あや",2026-05-20,https://onejav.com/torrent/rctd738
WA586,「私を目で壊してっ！」淫乱妻オナニー独白 本能がバグる自撮り妻 10名,4.8 GB,https://pics.dmm.co.jp/mono/movie/adult/h_047wa586/h_047wa586pl.jpg,https://onejav.com/torrent/wa586/download/01291692/onejav.com_wa586.torrent,"Acme · Orgasm, Married Woman, Masturbation, Nasty, Hardcore","花衣つばき, 工藤ゆり, 花撫あや, 五芭, 真城かのん, 間宮詩, 瀬戸ひなこ, 北村海智, あすかみおん, 大原理央",2026-05-17,https://onejav.com/torrent/wa586
NASK279,嫁の母 優しい義母の熟れた身体 興奮する禁断の家庭内不倫 4人4時間,10.1 GB,https://pics.dmm.co.jp/mono/movie/adult/nask279/nask279pl.jpg,https://onejav.com/torrent/nask279/download/88846874/onejav.com_nask279.torrent,"4HR+, Affair, Best, Omnibus, BIGセール, Incest, Mature Woman","夏樹カオル, 小林真梨香, 加山なつこ, 花撫あや",2025-08-23,https://onejav.com/torrent/nask279
ALDN437,あなた、私みたいなおばさん興奮させて…どうするのよ… 花撫あや,4.5 GB,https://pics.dmm.co.jp/mono/movie/adult/aldn437/aldn437pl.jpg,https://onejav.com/torrent/aldn437/download/64558898/onejav.com_aldn437.torrent,"Big Tits, Married Woman, Mature Woman, Solowork",花撫あや,2025-03-08,https://onejav.com/torrent/aldn437
RCTD649,洗脳セクサロイド化光線銃,4.0 GB,https://pics.dmm.co.jp/mono/movie/adult/1rctd649/1rctd649pl.jpg,https://onejav.com/torrent/rctd649/download/67201197/onejav.com_rctd649.torrent,"Big Tits, Delusion, Leotard, Other Fetish","松井日奈子, Emi Nishino, 花撫あや",2025-02-06,https://onejav.com/torrent/rctd649
KAM229,ボクの叔母さん とある叔母と甥の禁断のお話… 花撫あや,5.0 GB,https://pics.dmm.co.jp/mono/movie/adult/kam229/kam229pl.jpg,https://onejav.com/torrent/kam229/download/65156730/onejav.com_kam229.torrent,"Aunt, BIGセール第2弾, Creampie, Documentary, Incest, Married Woman, Solowork",花撫あや,2024-12-13,https://onejav.com/torrent/kam229
KAM224,家出している巨乳美人妻をヤりたい放題！中出し専用オナホールにしてやった。 花撫あや,5.0 GB,https://pics.dmm.co.jp/mono/movie/adult/kam224/kam224pl.jpg,https://onejav.com/torrent/kam224/download/23249342/onejav.com_kam224.torrent,"Affair, Creampie, Documentary, Married Woman, Slender, Solowork",花撫あや,2024-11-15,https://onejav.com/torrent/kam224
ALDN379,娘の彼と… 密会中出し続ける日々 花撫あや,4.6 GB,https://pics.dmm.co.jp/mono/movie/adult/aldn379/aldn379pl.jpg,https://onejav.com/torrent/aldn379/download/07946301/onejav.com_aldn379.torrent,"Big Tits, Creampie, Married Woman, Mature Woman, Solowork",花撫あや,2024-11-13,https://onejav.com/torrent/aldn379
KAM208,都内某有名スーパーマーケット店長撮影 万引きした美人妻にデカちん20cm砲悪徳エロ店長が中出し折●する動画4 花撫あや,5.0 GB,https://pics.dmm.co.jp/mono/movie/adult/kam208/kam208pl.jpg,https://onejav.com/torrent/kam208/download/91555128/onejav.com_kam208.torrent,"BIGセール第2弾, Breasts, Creampie, Married Woman, Shame, Solowork, Voyeur",花撫あや,2024-08-16,https://onejav.com/torrent/kam208
MIST446,乳首発狂 乳首愛こそ全て 花撫あや,4.8 GB,https://pics.dmm.co.jp/mono/movie/adult/1mist446/1mist446pl.jpg,https://onejav.com/torrent/mist446/download/00785618/onejav.com_mist446.torrent,"Big Tits, Cowgirl, Creampie, Dirty Words, Male Squirting, Mature Woman, M男, Slut, Solowork, Squirting, Subjectivity",花撫あや,2024-08-12,https://onejav.com/torrent/mist446
