code,title,size,image_url,torrent_url,tags,actresses,date,page_url
AUKG646,美熟女レズビアン ～訳あり仲居と一夜の愛欲情事～,5.1 GB,https://pics.dmm.co.jp/mono/movie/adult/aukg646/aukg646pl.jpg,https://onejav.com/torrent/aukg646/download/95550894/onejav.com_aukg646.torrent,"Drama, Kimono, Yukata, Mature Woman, Nasty, Hardcore","葉山さゆり, 水瀬さな",2026-03-03,https://onejav.com/torrent/aukg646
JJDA070,憧れの巨乳兄嫁と… 背徳の院内義姉相姦 葉山さゆり,5.3 GB,https://pics.dmm.co.jp/mono/movie/adult/jjda070/jjda070pl.jpg,https://onejav.com/torrent/jjda070/download/59573888/onejav.com_jjda070.torrent,"Big Tits, Creampie, Cuckold, Married Woman, Solowork, Tall",葉山さゆり,2026-02-27,https://onejav.com/torrent/jjda070
RBK123,捕らわれの女捜査官 私達は絶対に負けない！,5.0 GB,https://pics.dmm.co.jp/mono/movie/adult/rbk123/rbk123pl.jpg,https://onejav.com/torrent/rbk123/download/48640542/onejav.com_rbk123.torrent,"Creampie, Drama, Female Investigator, Humiliation","葉山さゆり, 生田望美",2026-02-27,https://onejav.com/torrent/rbk123
CEAD729,セックスが好き過ぎて生中出しSEXがヤメられない…長身デカ尻発情オンナ 葉山さゆり,6.5 GB,https://pics.dmm.co.jp/mono/movie/adult/cead729/cead729pl.jpg,https://onejav.com/torrent/cead729/download/19891906/onejav.com_cead729.torrent,"Big Tits, Creampie, Mature Woman, Nasty, Hardcore, Solowork, Tall",葉山さゆり,2026-02-07,https://onejav.com/torrent/cead729
ATID642,淫魔病棟 第1話 新人看護師の涙,5.0 GB,https://pics.dmm.co.jp/mono/movie/adult/atid642/atid642pl.jpg,https://onejav.com/torrent/atid642/download/68386538/onejav.com_atid642.torrent,"Creampie, Female Doctor, Humiliation, Nurse, Slut","北岡果林, 松井日奈子, 葉山さゆり",2026-02-04,https://onejav.com/torrent/atid642
BF741,初めての黒人エッチ 葉山さゆり,4.8 GB,https://pics.dmm.co.jp/mono/movie/adult/bf741/bf741pl.jpg,https://onejav.com/torrent/bf741/download/34498548/onejav.com_bf741.torrent,"Black Actor, Creampie, Huge Cock, Solowork",葉山さゆり,2026-02-04,https://onejav.com/torrent/bf741
CEAD727,葉山さゆり 未公開完全撮り下ろし2オナニー＆プレミアム・オナニーベスト！！,7.4 GB,https://pics.dmm.co.jp/mono/movie/adult/cead727/cead727pl.jpg,https://onejav.com/torrent/cead727/download/34818985/onejav.com_cead727.torrent,"Big Tits, Dirty Words, Huge Butt, Masturbation, Mature Woman, Solowork",葉山さゆり,2026-01-24,https://onejav.com/torrent/cead727
CEAD718,あなたを見つめてノーハンドフェラチオでイカせる15人の女優たち！,8.5 GB,https://pics.dmm.co.jp/mono/movie/adult/cead718/cead718pl.jpg,https://onejav.com/torrent/cead718/download/78869502/onejav.com_cead718.torrent,"Big Tits, Blow, Dirty Words, Mature Woman, Subjectivity","Yui Hatano, 飯岡かなこ, 葉山さゆり, Azu Komatsu, 祈山愛, 桐香ゆうり, 依本しおり, Natsuki Takeuchi, 夏川あゆみ, 池田あやみ, ▼すべて表示する",2026-01-03,https://onejav.com/torrent/cead718
CEMD783,わたしは会社の『性欲処理担当』秘書5 葉山さゆり,6.1 GB,https://pics.dmm.co.jp/mono/movie/adult/cemd783/cemd783pl.jpg,https://onejav.com/torrent/cemd783/download/64721428/onejav.com_cemd783.torrent,"Big Tits, BIGセール, Creampie, Huge Butt, Nasty, Hardcore, Slut, Solowork",葉山さゆり,2025-12-20,https://onejav.com/torrent/cemd783
CEMD775,初めてのアナルSEX～撮影中にアナルSEXを交渉してみた～ vol.4 葉山さゆり,5.7 GB,https://pics.dmm.co.jp/mono/movie/adult/cemd775/cemd775pl.jpg,https://onejav.com/torrent/cemd775/download/15884311/onejav.com_cemd775.torrent,"Anal, Anal Sex, Big Tits, BIGセール, Huge Butt, Orgy, Solowork",葉山さゆり,2025-12-06,https://onejav.com/torrent/cemd775
