code,title,size,image_url,torrent_url,tags,actresses,date,page_url
DOKS675,外人のようにチ〇ポを根元までガッツリ咥えるジャパニーズディープスロート,5.1 GB,https://pics.dmm.co.jp/mono/movie/adult/h_139doks675/h_139doks675pl.jpg,https://onejav.com/torrent/doks675/download/28784214/onejav.com_doks675.torrent,"3P, 4P, Big Tits, Blow, Dirty Words, Kimono, Yukata, Nasty, Hardcore, Older Sister, Other Fetish, Slut","葉月ひな, 夢乃のあ, Yuri Sasahara, 乙葉らぶ, 涼花くるみ",2026-05-01,https://onejav.com/torrent/doks675
SILK192,Triangular Holic 3,6.5 GB,https://pics.dmm.co.jp/mono/movie/adult/1silk192/1silk192pl.jpg,https://onejav.com/torrent/silk192/download/10750552/onejav.com_silk192.torrent,"3P, 4P, Couple, Drama, For Women, Love","葉月ひな, Ema Futaba, 東雲怜弥, 向理来, 保志健斗",2025-10-09,https://onejav.com/torrent/silk192
GMEM135,ドマゾ女の性被虐願望 喉奥破壊イラマ地獄中にピストンで覚醒したいド変態 ひな 葉月ひな,5.6 GB,https://pics.dmm.co.jp/mono/movie/adult/gmem135/gmem135pl.jpg,https://onejav.com/torrent/gmem135/download/76418428/onejav.com_gmem135.torrent,"Deep Throating, M女, Nasty, Hardcore, Shame, Solowork",葉月ひな,2025-09-06,https://onejav.com/torrent/gmem135
RCTD657,無様エロ洗脳アプリ2,5.9 GB,https://pics.dmm.co.jp/mono/movie/adult/1rctd657/1rctd657pl.jpg,https://onejav.com/torrent/rctd657/download/00269230/onejav.com_rctd657.torrent,"BIGセール, Humiliation, Other Fetish, Planning, Shame, Various Professions","葉月ひな, 幾野まち, 雪代一鳳",2025-04-08,https://onejav.com/torrent/rctd657
USBA081,Mの衝撃 愛欲調教 佳麗な笑顔の美女が本性剥き出し本気のマゾイキ 葉月ひな,4.6 GB,https://pics.dmm.co.jp/mono/movie/adult/usba081/usba081pl.jpg,https://onejav.com/torrent/usba081/download/97785570/onejav.com_usba081.torrent,"M女, Restraint, Restraints, Solowork",葉月ひな,2025-01-11,https://onejav.com/torrent/usba081
MMGH003,診察中にフル勃起チ●ポを見せつけられた皮膚科の美人女医 水川潤,4.8 GB,https://pics.dmm.co.jp/mono/movie/adult/mmgh003/mmgh003pl.jpg,https://onejav.com/torrent/mmgh003/download/54307453/onejav.com_mmgh003.torrent,"Blow, Female Doctor, Handjob, Hospital, Clinic, Nurse","水川潤, 葉月ひな",2024-10-12,https://onejav.com/torrent/mmgh003
BONY110,僕の身代わりに監禁されたお姉ちゃんが媚薬をキメられ墜とされるまでの記録 葉月ひな,5.2 GB,https://pics.dmm.co.jp/mono/movie/adult/bony110/bony110pl.jpg,https://onejav.com/torrent/bony110/download/82311945/onejav.com_bony110.torrent,"3P, 4P, Confinement, Creampie, Sister, Solowork, Urination",葉月ひな,2024-07-19,https://onejav.com/torrent/bony110
KNMB075,裕福な家庭で育ったのに生円光がやめられないJ系娘 ひな（18） 葉月ひな,4.4 GB,https://pics.dmm.co.jp/mono/movie/adult/h_491knmb075/h_491knmb075pl.jpg,https://onejav.com/torrent/knmb075/download/42882261/onejav.com_knmb075.torrent,"Beautiful Girl, Big Tits, Creampie, POV, Solowork",葉月ひな,2024-04-27,https://onejav.com/torrent/knmb075
