code,title,size,image_url,torrent_url,tags,actresses,date,page_url
PKPD410,半中半外半彼女 みお 雪代美鳳,5.2 GB,https://pics.dmm.co.jp/mono/movie/adult/pkpd410/pkpd410pl.jpg,https://onejav.com/torrent/pkpd410/download/18329991/onejav.com_pkpd410.torrent,"Beautiful Girl, Big Tits, Breasts, Creampie, POV, Solowork",雪代美鳳,2026-03-14,https://onejav.com/torrent/pkpd410
RBK126,隷女の涙 女教師の屈辱、奪われた日常… 雪代美鳳,5.8 GB,https://pics.dmm.co.jp/mono/movie/adult/rbk126/rbk126pl.jpg,https://onejav.com/torrent/rbk126/download/89227855/onejav.com_rbk126.torrent,"Confinement, Creampie, Drama, Female Teacher, Humiliation, Solowork",雪代美鳳,2026-01-30,https://onejav.com/torrent/rbk126
CEMD797,「雪代美鳳」を本気で酔わせたら～性欲暴走リアルSEXドキュメント,5.5 GB,https://pics.dmm.co.jp/mono/movie/adult/cemd797/cemd797pl.jpg,https://onejav.com/torrent/cemd797/download/25654469/onejav.com_cemd797.torrent,"Creampie, Drinking Party, Nasty, Hardcore, Orgy, Solowork, Squirting",雪代美鳳,2026-01-24,https://onejav.com/torrent/cemd797
DFDM065,パンツ越し誘惑してくる小悪魔メンエス嬢 雪代美鳳,5.1 GB,https://pics.dmm.co.jp/mono/movie/adult/2dfdm065/2dfdm065pl.jpg,https://onejav.com/torrent/dfdm065/download/18540584/onejav.com_dfdm065.torrent,"Handjob, Massage, M男, Shame, Slut, Solowork",雪代美鳳,2025-12-01,https://onejav.com/torrent/dfdm065
YSN652,新しい義母は、鬼畜な人なのに僕の勃起は治まらない。 雪代美鳳,4.3 GB,https://pics.dmm.co.jp/mono/movie/adult/h_127ysn652/h_127ysn652pl.jpg,https://onejav.com/torrent/ysn652/download/03761635/onejav.com_ysn652.torrent,"Big Tits, Creampie, Incest, Nasty, Hardcore, Slut, Solowork, Stepmother",雪代美鳳,2025-12-01,https://onejav.com/torrent/ysn652
XVSR849,泡姫桃源郷 Gカップ美巨乳泡姫が大人の色気全開でお客様の敏感な所をじっくり丁寧に洗いつくす 雪代美鳳,5.0 GB,https://pics.dmm.co.jp/mono/movie/adult/xvsr849/xvsr849pl.jpg,https://onejav.com/torrent/xvsr849/download/04268140/onejav.com_xvsr849.torrent,"Big Tits, Creampie, Lotion, Soapland, Solowork, Titty Fuck",雪代美鳳,2025-11-29,https://onejav.com/torrent/xvsr849
CEMD771,涙のノンストップ激イカせSEX66 雪代美鳳,5.3 GB,https://pics.dmm.co.jp/mono/movie/adult/cemd771/cemd771pl.jpg,https://onejav.com/torrent/cemd771/download/07912234/onejav.com_cemd771.torrent,"Acme · Orgasm, Big Tits, Creampie, Nasty, Hardcore, Orgy, Solowork",雪代美鳳,2025-11-22,https://onejav.com/torrent/cemd771
HMN766,勃起チ○ポと射精を見たがるお姉さまが集まる巨乳女子会 M男は恋愛対象じゃないけどチ○ポをおもちゃにして遊ぶのはOKな肉食女子パーティ 小野坂ゆいか 雪代美鳳 二羽紗愛,4.0 GB,https://pics.dmm.co.jp/mono/movie/adult/hmn766/hmn766pl.jpg,https://onejav.com/torrent/hmn766/download/68061259/onejav.com_hmn766.torrent,"Big Tits, Creampie, Handjob, Harem, M男","二羽紗愛, 小野坂ゆいか, 雪代美鳳",2025-11-21,https://onejav.com/torrent/hmn766
VEC742,別れたいのに愛しちゃう…家事も仕事もしないクズ夫の肉棒が相性抜群 ケンカした後のセックスが最高すぎて抜け出せない結局円満オマンチョ妻 雪代美鳳,4.3 GB,https://pics.dmm.co.jp/mono/movie/adult/vec742/vec742pl.jpg,https://onejav.com/torrent/vec742/download/64314605/onejav.com_vec742.torrent,"Big Tits, Creampie, Drama, Married Woman, Mature Woman, Solowork",雪代美鳳,2025-11-14,https://onejav.com/torrent/vec742
DVAJ717,教習車で指導員と交わした濃密接吻が忘れられず…免許取ってもマイカー不倫密会 互いの熱気で窓が曇るほど激しくカラダを求めあった 雪代美鳳,4.8 GB,https://pics.dmm.co.jp/mono/movie/adult/dvaj717/dvaj717pl.jpg,https://onejav.com/torrent/dvaj717/download/11535274/onejav.com_dvaj717.torrent,"Affair, Big Tits, Blow, Car Sex, Creampie, Cuckold, Hotel, Kiss, Married Woman, Solowork",雪代美鳳,2025-11-08,https://onejav.com/torrent/dvaj717
