code,title,size,image_url,torrent_url,tags,actresses,date,page_url
PFES113,偉そうにしやがって。小っちゃいリボンの付いたパンティ履いてるくせに。～女上司なんてもう怖くない～ 響乃うた,5.2 GB,https://pics.dmm.co.jp/mono/movie/adult/pfes113/pfes113pl.jpg,https://onejav.com/torrent/pfes113/download/54349667/onejav.com_pfes113.torrent,"Back, Creampie, Female Boss, Skirt, Solowork, Squirting",響乃うた,2026-03-27,https://onejav.com/torrent/pfes113
NEO944,イク時はいつも足ピン 響乃うた,4.4 GB,https://pics.dmm.co.jp/mono/movie/adult/433neo944/433neo944pl.jpg,https://onejav.com/torrent/neo944/download/35585821/onejav.com_neo944.torrent,"Experience Confession, Leg Fetish, Masturbation, Mini, School Uniform, Shaved, Solowork",響乃うた,2026-02-19,https://onejav.com/torrent/neo944
REBD990,Uta2 波打ち際のリユニオン・響乃うた,3.1 GB,https://pics.dmm.co.jp/mono/movie/adult/h_346rebd990/h_346rebd990pl.jpg,https://onejav.com/torrent/rebd990/download/94576096/onejav.com_rebd990.torrent,"AV女優, Breasts, Image Video, Sexy, Solowork, Tall",響乃うた,2025-12-04,https://onejav.com/torrent/rebd990
RKI724,土下座敗北捜査官 プライド高きエリート捜査官が屈辱の土下座敗北に堕ちるまで… 響乃うた,5.3 GB,https://pics.dmm.co.jp/mono/movie/adult/rki724/rki724pl.jpg,https://onejav.com/torrent/rki724/download/11347231/onejav.com_rki724.torrent,"3P, 4P, Creampie, Enema, Female Investigator, Solowork, Squirting",響乃うた,2025-10-10,https://onejav.com/torrent/rki724
LZDM067,入り浸りギャルに百合趣味がバレたオタクが実マ●コを間近で弄らせてもらう学校帰りレズSEX 響乃うた 雫月心桜,5.2 GB,https://pics.dmm.co.jp/mono/movie/adult/lzdm067/lzdm067pl.jpg,https://onejav.com/torrent/lzdm067/download/46144204/onejav.com_lzdm067.torrent,"BIGセール第2弾, Gal, Lesbian Kiss, Otaku, School Girls","響乃うた, 雫月心桜",2024-12-21,https://onejav.com/torrent/lzdm067
IENF350,アナルのシワの数までハッキリわかる！スティックローター連続絶頂アナル見せオナニー2スティックローター連続絶頂アナル見せオナニー2,3.8 GB,https://pics.dmm.co.jp/mono/movie/adult/1ienf350/1ienf350pl.jpg,https://onejav.com/torrent/ienf350/download/99920324/onejav.com_ienf350.torrent,"Anal, BIGセール, Dirty Words, Egg Vibrator, Masturbation, Subjectivity","美園和花, 希咲那奈, ▼すべて表示する, 如月ゆの, 夏川あゆみ, 加藤結衣, 千石もなか, Sakura Mita, 響乃うた, 宇流木さらら, 白川みなみ",2024-07-25,https://onejav.com/torrent/ienf350
MUDR276,私を縛って犯してください… マゾに目覚めた制服美少女は緊縛調教を志願する 響乃うた,5.6 GB,https://pics.dmm.co.jp/mono/movie/adult/mudr276/mudr276pl.jpg,https://onejav.com/torrent/mudr276/download/96068664/onejav.com_mudr276.torrent,"Cuckold, Restraints, SM, Solowork, Squirting, Uniform",響乃うた,2024-07-12,https://onejav.com/torrent/mudr276
KSBJ318,義父と妊活 種なし息子の嫁の誘惑 響乃うた,4.9 GB,https://pics.dmm.co.jp/mono/movie/adult/ksbj318/ksbj318pl.jpg,https://onejav.com/torrent/ksbj318/download/39863839/onejav.com_ksbj318.torrent,"Breasts, Creampie, Married Woman, Slender, Slut, Solowork",響乃うた,2024-06-29,https://onejav.com/torrent/ksbj318
REAL850,意識は残るが身体は動かなくなりあられもないポーズで犯●れまくる全身硬直スプレーレ×プ,6.3 GB,https://pics.dmm.co.jp/mono/movie/adult/real850/real850pl.jpg,https://onejav.com/torrent/real850/download/33381335/onejav.com_real850.torrent,"Breasts, Creampie, Evil, Other Fetish, Shame","Kozue Minami, 胡桃さくら, 響乃うた",2024-06-08,https://onejav.com/torrent/real850
AMBI191,制服美少女中出し飼育 響乃うた,3.5 GB,https://pics.dmm.co.jp/mono/movie/adult/h_237ambi191/h_237ambi191pl.jpg,https://onejav.com/torrent/ambi191/download/99323519/onejav.com_ambi191.torrent,"Beautiful Girl, Blow, Breasts, Creampie, Solowork, Uniform",響乃うた,2024-05-20,https://onejav.com/torrent/ambi191
