code,title,size,image_url,torrent_url,tags,actresses,date,page_url
MADM218,セレブ妻オナホ堕ち 承認欲求に満ちた肉棒狂い雑魚マ●コ 黒島玲衣,4.3 GB,https://pics.dmm.co.jp/mono/movie/adult/madm218/madm218pl.jpg,https://onejav.com/torrent/madm218/download/55860752/onejav.com_madm218.torrent,"Affair, Back, Big Tits, Cowgirl, Creampie, Married Woman, Masturbation, Restraint, Slut, Solowork, Vibe",黒島玲衣,2026-05-23,https://onejav.com/torrent/madm218
HODV22068,デリヘル呼んだら初恋の幼馴染と12年ぶりの再会して朝まで生ハメ中出し射精した 黒島玲衣,5.8 GB,https://pics.dmm.co.jp/mono/movie/adult/41hodv22068/41hodv22068pl.jpg,https://onejav.com/torrent/hodv22068/download/98221510/onejav.com_hodv22068.torrent,"Beautiful Girl, Big Tits, Creampie, Cum, Drama, Love, Prostitutes, Solowork",黒島玲衣,2026-05-22,https://onejav.com/torrent/hodv22068
IENF445,経験豊富な優しい素人人妻が最高の童貞筆おろし 25,6.8 GB,https://pics.dmm.co.jp/mono/movie/adult/1ienf445/1ienf445pl.jpg,https://onejav.com/torrent/ienf445/download/86604979/onejav.com_ienf445.torrent,"Big Tits, Creampie, Married Woman, Nampa, Virgin Man","小野坂ゆいか, 小鈴みかん, 黒島玲衣",2026-05-18,https://onejav.com/torrent/ienf445
VDD204,女教師in...（脅迫スイートルーム） 黒島玲衣,5.4 GB,https://pics.dmm.co.jp/mono/movie/adult/24vdd204/24vdd204pl.jpg,https://onejav.com/torrent/vdd204/download/25817553/onejav.com_vdd204.torrent,"Deep Throating, Evil, Female Teacher, Restraint, Solowork",黒島玲衣,2026-04-27,https://onejav.com/torrent/vdd204
IENF444,黒島玲衣 最高級美女 中出しソープ,5.7 GB,https://pics.dmm.co.jp/mono/movie/adult/1ienf444/1ienf444pl.jpg,https://onejav.com/torrent/ienf444/download/11940917/onejav.com_ienf444.torrent,"Creampie, Prostitutes, Soapland, Solowork, Subjectivity",黒島玲衣,2026-04-21,https://onejav.com/torrent/ienf444
HODV22053,苦手な女上司に会議資料を送ったつもりがお気に入りの盗撮動画を共有してしまった件。次の日からメス顔で接してきて定時後はサービス残業SEXさせられている。 黒島玲衣,5.8 GB,https://pics.dmm.co.jp/mono/movie/adult/41hodv22053/41hodv22053pl.jpg,https://onejav.com/torrent/hodv22053/download/67418676/onejav.com_hodv22053.torrent,"Big Tits, BIGセール, Blow, Cowgirl, Female Boss, Kiss, OL, Slut, Solowork",黒島玲衣,2026-03-27,https://onejav.com/torrent/hodv22053
JUFE612,緊縛解禁！白い柔肌を縛り上げる令嬢緊縛 黒島玲衣,6.5 GB,https://pics.dmm.co.jp/mono/movie/adult/jufe612/jufe612pl.jpg,https://onejav.com/torrent/jufe612/download/11333199/onejav.com_jufe612.torrent,"Acme · Orgasm, Big Tits, Creampie, Restraints, Solowork, Toy",黒島玲衣,2026-02-28,https://onejav.com/torrent/jufe612
JUFE613,黒人解禁！英会話NTR 極太の黒マラSEXに溺れた美乳妻 黒島玲衣,6.2 GB,https://pics.dmm.co.jp/mono/movie/adult/jufe613/jufe613pl.jpg,https://onejav.com/torrent/jufe613/download/05657926/onejav.com_jufe613.torrent,"Black Actor, Creampie, Cuckold, Huge Cock, Married Woman, Solowork",黒島玲衣,2026-02-13,https://onejav.com/torrent/jufe613
MDBK405,思春期の女子校生は男の匂いが大好き！！ムラムラ発情を全身ペロペロ即尺で解消するビッチJ系,6.3 GB,https://pics.dmm.co.jp/mono/movie/adult/mdbk405/mdbk405pl.jpg,https://onejav.com/torrent/mdbk405/download/61150571/onejav.com_mdbk405.torrent,"Blow, School Girls, Slut, Uniform","五芭, 黒島玲衣, 北岡果林",2026-02-07,https://onejav.com/torrent/mdbk405
MUKC111,清楚系アイドルが小悪魔誘惑でガチ恋ザーメン搾り取る秘密のオフパコ中出し撮影会。 黒島玲衣,5.0 GB,https://pics.dmm.co.jp/mono/movie/adult/mukc111/mukc111pl.jpg,https://onejav.com/torrent/mukc111/download/69190915/onejav.com_mukc111.torrent,"Beautiful Girl, Cosplay, Creampie, Idol, Slut, Solowork",黒島玲衣,2026-01-16,https://onejav.com/torrent/mukc111
