code,title,size,image_url,torrent_url,tags,actresses,date,page_url
SNOS197,客達を勃起させちゃう風呂屋ひとり娘のフェロ漏れしなやかボディ！ 銭湯、ジジイたちの乱交場へ 楓ふうあ,6.2 GB,https://pics.dmm.co.jp/mono/movie/adult/snos197/snos197pl.jpg,https://onejav.com/torrent/snos197/download/42551836/onejav.com_snos197.torrent,"Acme · Orgasm, Blow, Nasty, Hardcore, Orgy, Slender, Solowork",Fuua Kaede,2026-04-10,https://onejav.com/torrent/snos197
SNOS141,モデル級プロポーションゆえに選任された囮捜査官、媚薬漬け痴●にまさかの完全敗北。 楓ふうあ,5.0 GB,https://pics.dmm.co.jp/mono/movie/adult/snos141/snos141pl.jpg,https://onejav.com/torrent/snos141/download/37366369/onejav.com_snos141.torrent,"Blow, Female Investigator, Nasty, Hardcore, Orgy, Slender, Solowork",Fuua Kaede,2026-03-06,https://onejav.com/torrent/snos141
REBD1007,Fuua3 Crystal Breeze・楓ふうあ,3.9 GB,https://pics.dmm.co.jp/mono/movie/adult/h_346rebd1007/h_346rebd1007pl.jpg,https://onejav.com/torrent/rebd1007/download/08015233/onejav.com_rebd1007.torrent,"AV女優, Big Tits, Image Video, Sexy, Solowork, Tall",Fuua Kaede,2026-02-05,https://onejav.com/torrent/rebd1007
OFJE594,S1オールスター23名大集合 全7タイトル全部入り 完全ベスト版16時間 未公開の40人越え乱交初収録,39.9 GB,https://pics.dmm.co.jp/mono/movie/adult/ofje594/ofje594pl.jpg,https://onejav.com/torrent/ofje594/download/86126320/onejav.com_ofje594.torrent,"4HR+, Best, Omnibus, Big Tits, Harem, Orgy","河北彩伽, Yume Nikaidou, 金松季歩, 田野憂, Fuua Kaede, Mitsuha Ashitaba, Nana Miho, 川越にこ, 白上咲花, 渚あいり, ▼すべて表示する",2025-12-26,https://onejav.com/torrent/ofje594
SONE982,妻子が実家に帰省中、自宅にM女専門デリヘル呼んだら…来たのは長男通う幼稚園で噂の美人先生！ 弱み握って限界イラマ、首絞め、本番強要、何でもありのSM調教3日間！ 楓ふうあ,6.2 GB,https://pics.dmm.co.jp/mono/movie/adult/sone982/sone982pl.jpg,https://onejav.com/torrent/sone982/download/47244145/onejav.com_sone982.torrent,"Acme · Orgasm, Deep Throating, M女, Nasty, Hardcore, SM, Solowork",Fuua Kaede,2025-11-07,https://onejav.com/torrent/sone982
SONE918,これが夢の顔射性活！父の再婚で出来たスーパー美人姉妹が毎日オナる僕のザーメンをすっごい美貌の顔面で受け止める,5.6 GB,https://pics.dmm.co.jp/mono/movie/adult/sone918/sone918pl.jpg,https://onejav.com/torrent/sone918/download/41744705/onejav.com_sone918.torrent,"3P, 4P, Blow, Facials, Sister","Fuua Kaede, 倉木華",2025-10-24,https://onejav.com/torrent/sone918
SONE880,「キメセクにハマって潮もヨダレも止まらないだなんて…」口から、肌から、媚薬が侵食。痩身エステで感度バグらされたスーパースレンダーOLの末路 楓ふうあ,8.6 GB,https://pics.dmm.co.jp/mono/movie/adult/sone880/sone880pl.jpg,https://onejav.com/torrent/sone880/download/92475145/onejav.com_sone880.torrent,"Acme · Orgasm, Beauty Shop, Lotion, Nasty, Hardcore, Slender, Solowork",Fuua Kaede,2025-09-19,https://onejav.com/torrent/sone880
SONE850,港区’プロ彼女’のなれの果ては…スラム街の公衆ぶっかけ顔射女 楓ふうあ,6.0 GB,https://pics.dmm.co.jp/mono/movie/adult/sone850/sone850pl.jpg,https://onejav.com/torrent/sone850/download/54148851/onejav.com_sone850.torrent,"Acme · Orgasm, Blow, Deep Throating, Orgy, Slender, Solowork",Fuua Kaede,2025-08-22,https://onejav.com/torrent/sone850
SONE566,エスワン20周年記念 AV業界史に残る最強タッグ作品 1×18。AVメーカーS1所属の新人ADの俺は、最高セクシー女優様たちにこっそりシコられ、ハメられ、エロいことに巻き込まれる、AV職場ラッキーSEX,7.4 GB,https://pics.dmm.co.jp/mono/movie/adult/sone566/sone566pl.jpg,https://onejav.com/torrent/sone566/download/81482808/onejav.com_sone566.torrent,"Beautiful Girl, Big Tits, Harem, Idol, Subjectivity","田野憂, 五条恋, Nana Miho, 白上咲花, 渚あいり, 浅野こころ, 村上悠華, Mitsuha Ashitaba, Fuua Kaede, 乃坂ひより, ▼すべて表示する",2025-07-18,https://onejav.com/torrent/sone566
SONE785,新人スポーツキャスターは局から人気スポーツ選手にあてがわれても断れず…力まかせのネジ込みピストンで死ぬほどイカされる。 楓ふうあ,6.3 GB,https://pics.dmm.co.jp/mono/movie/adult/sone785/sone785pl.jpg,https://onejav.com/torrent/sone785/download/27197038/onejav.com_sone785.torrent,"Acme · Orgasm, Anchorwoman, Cuckold, Huge Cock, Nasty, Hardcore, Solowork",Fuua Kaede,2025-07-18,https://onejav.com/torrent/sone785
