code,title,size,image_url,torrent_url,tags,actresses,date,page_url
ABF354,ヤリ過ぎ中出し温泉旅館 ～極上の摩天楼ボディを好き放題～ 瀧本雫葉,4.6 GB,https://image.mgstage.com/images/prestige/abf/354/pb_e_abf-354.jpg,https://onejav.com/torrent/abf354/download/06967918/onejav.com_abf354.torrent,"Big Tits, Creampie, Hot Spring, Masturbation, Shaved, Solowork",瀧本雫葉,2026-05-21,https://onejav.com/torrent/abf354
ABF350,タキモト無双 瀧本雫葉【限定特典映像20分付き】,5.2 GB,https://image.mgstage.com/images/prestige/abf/350/pb_e_abf-350.jpg,https://onejav.com/torrent/abf350/download/23164964/onejav.com_abf350.torrent,"Big Tits, Facials, Orgy, Shaved, Solowork",瀧本雫葉,2026-05-07,https://onejav.com/torrent/abf350
ABF340,性欲に支配された倒錯カップルの同棲中出し性交録。 瀧本雫葉【限定特典映像15分付き】,4.8 GB,https://image.mgstage.com/images/prestige/abf/340/pb_e_abf-340.jpg,https://onejav.com/torrent/abf340/download/36725667/onejav.com_abf340.torrent,"Big Tits, Couple, Creampie, Masturbation, Slender, Solowork",瀧本雫葉,2026-04-09,https://onejav.com/torrent/abf340
ABF330,男だらけの雀荘に瀧本雫葉、置いてきた。【限定特典映像55分付き】,6.5 GB,https://image.mgstage.com/images/prestige/abf/330/pb_e_abf-330.jpg,https://onejav.com/torrent/abf330/download/82499367/onejav.com_abf330.torrent,"Big Tits, Shaved, Slut, Solowork",瀧本雫葉,2026-03-12,https://onejav.com/torrent/abf330
REBD1008,Shizuha4 夢の一雫・瀧本雫葉,3.3 GB,https://pics.dmm.co.jp/mono/movie/adult/h_346rebd1008/h_346rebd1008pl.jpg,https://onejav.com/torrent/rebd1008/download/09475306/onejav.com_rebd1008.torrent,"AV女優, Big Tits, Image Video, Sexy, Solowork, Tall",瀧本雫葉,2026-02-05,https://onejav.com/torrent/rebd1008
ABF317,本能を解き放つ等身大 1/1 SEX 瀧本雫葉【限定特典映像15分付き】,5.1 GB,https://image.mgstage.com/images/prestige/abf/317/pb_e_abf-317.jpg,https://onejav.com/torrent/abf317/download/56552697/onejav.com_abf317.torrent,"Creampie, POV, Restraint, SM, Solowork",瀧本雫葉,2026-02-05,https://onejav.com/torrent/abf317
ABF308,平日女教師、週末オナホ。 瀧本雫葉【限定特典映像10分付き】,5.9 GB,https://image.mgstage.com/images/prestige/abf/308/pb_e_abf-308.jpg,https://onejav.com/torrent/abf308/download/74873957/onejav.com_abf308.torrent,"Cosplay, Creampie, Female Teacher, Restraint, Shaved, Solowork",瀧本雫葉,2026-01-08,https://onejav.com/torrent/abf308
ABF297,神テクたったの10分間我慢することが出来れば…ご褒美なま中出し 瀧本雫葉【限定特典映像25分付き】,5.9 GB,https://image.mgstage.com/images/prestige/abf/297/pb_e_abf-297.jpg,https://onejav.com/torrent/abf297/download/46070330/onejav.com_abf297.torrent,"Cosplay, Creampie, Slut, Solowork",瀧本雫葉,2025-12-11,https://onejav.com/torrent/abf297
ABF284,絶対忠実秘書 瀧本雫葉【限定特典映像45分付き】,6.6 GB,https://image.mgstage.com/images/prestige/abf/284/pb_e_abf-284.jpg,https://onejav.com/torrent/abf284/download/50980353/onejav.com_abf284.torrent,"Beautiful legs, Facials, Secretary, Shaved, Solowork, Squirting",瀧本雫葉,2025-11-06,https://onejav.com/torrent/abf284
ABF276,瀧本雫葉の美声で聴覚から刺激してイカせるちんしこサポート【限定特典映像40分付き】,6.6 GB,https://image.mgstage.com/images/prestige/abf/276/pb_e_abf-276.jpg,https://onejav.com/torrent/abf276/download/50894717/onejav.com_abf276.torrent,"Facials, Masturbation, Shaved, Solowork, Subjectivity",瀧本雫葉,2025-10-09,https://onejav.com/torrent/abf276
