code,title,size,image_url,torrent_url,tags,actresses,date,page_url
HEYZO3813,,2.0 GB,https://www.heyzo.com/contents/3000/3813/images/player_thumbnail_en.jpg,https://onejav.com/torrent/heyzo3813/download/33931324/onejav.com_heyzo3813.torrent,,,2026-03-31,https://onejav.com/torrent/heyzo3813
MIDA568,新人 脱・看護師 Jカップ専属 葉山みりあAV Debut！,6.3 GB,https://pics.dmm.co.jp/mono/movie/adult/mida568/mida568pl.jpg,https://onejav.com/torrent/mida568/download/79547758/onejav.com_mida568.torrent,"3P, 4P, Big Tits, Blow, Debut Production, POV, Solowork",葉山みりあ,2026-03-13,https://onejav.com/torrent/mida568
SNOS081,新人NO.1 STYLE あの話題の超庶民お姉ちゃん 鈴木希21歳 AVデビュー,5.8 GB,https://pics.dmm.co.jp/mono/movie/adult/snos081/snos081pl.jpg,https://onejav.com/torrent/snos081/download/03525548/onejav.com_snos081.torrent,"Beautiful Girl, Big Tits, Debut Production, Female College Student, Slender, Solowork",鈴木希,2026-03-06,https://onejav.com/torrent/snos081
FC2PPV4871698,FC2-PPV-4871698 ＃巨乳　＃SNS　＃素人　＃手コキ　＃大人の関係　＃割り切り　＃アルバイト　＃ぶっかけ,2.7 GB,https://contents-thumbnail2.fc2.com/w1280/storage201000.contents.fc2.com/file/396/39514748/1774837919.15.jpg,https://onejav.com/torrent/fc2ppv4871698/download/47055811/onejav.com_fc2ppv4871698.torrent,"Amateur, Beautiful Girl, Big Tits, Blow, FC2, Handjob, POV",,2026-03-31,https://onejav.com/torrent/fc2ppv4871698
SNOS168,最初で最後の限界挑戦ー。 2ヶ月禁欲後の潜在覚醒セックス 河北彩伽,5.8 GB,https://pics.dmm.co.jp/mono/movie/adult/snos168/snos168pl.jpg,https://onejav.com/torrent/snos168/download/83814892/onejav.com_snos168.torrent,"3P, 4P, Acme · Orgasm, Nasty, Hardcore, Slender, Solowork, Squirting",河北彩伽,2026-03-20,https://onejav.com/torrent/snos168
FC2PPV4872123,,5.0 GB,https://contents-thumbnail2.fc2.com/w1280/storage201000.contents.fc2.com/file/372/37151217/1774919259.46.jpg,https://onejav.com/torrent/fc2ppv4872123/download/67671736/onejav.com_fc2ppv4872123.torrent,,,2026-04-01,https://onejav.com/torrent/fc2ppv4872123
FC2PPV4873205,FC2-PPV-4873205 【顔出しサンプル】『143cm本物清純ローカルアイドル出演』”生中出し×白目絶頂×潮吹き噴射” 衝撃4P映像。※残りわずか,6.4 GB,https://contents-thumbnail2.fc2.com/w1280/storage201000.contents.fc2.com/file/393/39269224/1774949307.23.jpg,https://onejav.com/torrent/fc2ppv4873205/download/24060072/onejav.com_fc2ppv4873205.torrent,"Amateur, Beautiful Girl, Big Tits, Blow, Breasts, Close Up, Creampie, FC2, POV, Slender",,2026-04-01,https://onejav.com/torrent/fc2ppv4873205
ABF319,俺に沼ってる最高の女。-男本位の避妊なし中出しSEX- 涼森れむ【限定特典映像15分付き】,5.6 GB,https://image.mgstage.com/images/prestige/abf/319/pb_e_abf-319.jpg,https://onejav.com/torrent/abf319/download/86276647/onejav.com_abf319.torrent,"Big Tits, Butt, Creampie, Deep Throating, Solowork",Remu Suzumori,2026-02-12,https://onejav.com/torrent/abf319
EBWH317,この少女、身も心も純白。 男が汚したくなる素朴な一重まぶた まっしろな絹肌Fカップ 某大学病院で実習する医学部の規律育ち女子大生 白羽舞菜（22）,4.9 GB,https://pics.dmm.co.jp/mono/movie/adult/ebwh317/ebwh317pl.jpg,https://onejav.com/torrent/ebwh317/download/27074641/onejav.com_ebwh317.torrent,"3P, 4P, Big Tits, Busty Fetish, Debut Production, Female College Student, Solowork",白羽舞菜,2026-02-13,https://onejav.com/torrent/ebwh317
FC2PPV4873166,FC2-PPV-4873166 【無修正】熟⼥、⼈妻、若妻、5⼈の淫乱妻の⼤乱交！！2本組み1時間52分,8.0 GB,https://contents-thumbnail2.fc2.com/w1280/storage201000.contents.fc2.com/file/395/39456556/1774933786.65.jpg,https://onejav.com/torrent/fc2ppv4873166/download/18115327/onejav.com_fc2ppv4873166.torrent,"Amateur, Beautiful Girl, Blow, Breasts, Creampie, Electric Massager, FC2, Married Woman, Mature Woman, Orgy, POV, Toy, Uncensored",,2026-04-01,https://onejav.com/torrent/fc2ppv4873166
