code,title,size,image_url,torrent_url,tags,actresses,date,page_url
START542,会社では性格がキツすぎるパワハラ女上司に飲みに誘われて、愚痴を聞いたらまさかの豹変！甘々メンヘラで立場逆転して、何度もおねだり中出しセックス 神木麗,5.7 GB,https://pics.dmm.co.jp/mono/movie/adult/1start542/1start542pl.jpg,https://onejav.com/torrent/start542/download/42185040/onejav.com_start542.torrent,"Big Tits, Breasts, Drama, OL, Planning, Solowork",Rei Kamiki,2026-04-14,https://onejav.com/torrent/start542
SNOS168,最初で最後の限界挑戦ー。 2ヶ月禁欲後の潜在覚醒セックス 河北彩伽,5.8 GB,https://pics.dmm.co.jp/mono/movie/adult/snos168/snos168pl.jpg,https://onejav.com/torrent/snos168/download/40152795/onejav.com_snos168.torrent,"3P, 4P, Acme · Orgasm, Nasty, Hardcore, Slender, Solowork, Squirting",河北彩伽,2026-03-20,https://onejav.com/torrent/snos168
FC2PPV4870769,FC2-PPV-4870769 無修正.172cm한국인 하프【本性】私だって本当はMだもん..高速ピストンだとハメ潮港区女系Iカップ,5.7 GB,https://contents-thumbnail2.fc2.com/w1280/storage201000.contents.fc2.com/file/407/40600830/1774764032.93.png,https://onejav.com/torrent/fc2ppv4870769/download/30329108/onejav.com_fc2ppv4870769.torrent,"Amateur, Big Tits, Creampie, FC2, OL, Slender, Squirting, Uncensored",,2026-03-30,https://onejav.com/torrent/fc2ppv4870769
SNOS083,【サークル飲み会の奇跡】 サバサバで性格合わない女友達が酔って無防備になって思わず手を出した僕！するとまさかの…チ○コマ○コは相性抜群！朝までぶっ通しの以心伝心セックス。 倉木華,4.9 GB,https://pics.dmm.co.jp/mono/movie/adult/snos083/snos083pl.jpg,https://onejav.com/torrent/snos083/download/32403584/onejav.com_snos083.torrent,"Acme · Orgasm, Breasts, Drinking Party, Leg Fetish, Slender, Solowork",倉木華,2026-03-20,https://onejav.com/torrent/snos083
FC2PPV4901294,FC2-PPV-4901294 ♀219 ゆるふわなしおりちゃんにたっぷり中出し種付け♡ ★特典で無修正,4.6 GB,https://contents-thumbnail2.fc2.com/w1280/storage201000.contents.fc2.com/file/376/37547480/1778830841.38.jpg,https://onejav.com/torrent/fc2ppv4901294/download/85605300/onejav.com_fc2ppv4901294.torrent,"Amateur, Creampie, FC2, Uncensored",,2026-05-18,https://onejav.com/torrent/fc2ppv4901294
FC2PPV4901954,FC2-PPV-4901954 【初回70%オフ・初撮り♡】 0314_002 ひまりちゃん23歳 超人気同人AVモデルをガチで孕ませる本物中出し無.責.任種付けファック！果たして何度目の撮影で妊娠するのか、待望のシリーズスタート！,5.3 GB,https://contents-thumbnail2.fc2.com/w1280/storage201000.contents.fc2.com/file/383/38288919/1778892403.53.jpg,https://onejav.com/torrent/fc2ppv4901954/download/91027877/onejav.com_fc2ppv4901954.torrent,"Amateur, Beautiful Girl, Black Hair, Breasts, Conceived, Creampie, Deep Throating, FC2, POV, Slender",,2026-05-18,https://onejav.com/torrent/fc2ppv4901954
FC2PPV4902089,FC2-PPV-4902089 【200本限定.価格】僕のお人形さんは正常位名器wお口も名器で口内射精。お口に出したら即ごっくん。興奮抑えられず、コスプレ着せて連続中出し何発でもイケる名器は恐るべし。,2.9 GB,https://contents-thumbnail2.fc2.com/w1280/storage200000.contents.fc2.com/file/407/40666348/1778922312.73.png,https://onejav.com/torrent/fc2ppv4902089/download/51919764/onejav.com_fc2ppv4902089.torrent,"Amateur, Breasts, Butt, Cosplay, FC2, POV, Shaved, Toy, Uncensored",,2026-05-18,https://onejav.com/torrent/fc2ppv4902089
FC2PPV4902600,FC2-PPV-4902600 [期間限定で大放出!15000pt➡1980pt]無修正＜東北出身 経験人数１人❤ジャングル陰毛生やしっぱなし未処理の剛毛＞カフェバイトの荒野状態ボーボーマン毛掻き分け生チンポ挿入して濃厚中出し,4.4 GB,https://contents-thumbnail2.fc2.com/w1280/storage200000.contents.fc2.com/file/373/37232976/1778979175.18.jpg,https://onejav.com/torrent/fc2ppv4902600/download/99649889/onejav.com_fc2ppv4902600.torrent,"Amateur, Blow, Breasts, Creampie, Cunnilingus, FC2, Female College Student, Nasty, Hardcore, POV, Slender, Uncensored",,2026-05-18,https://onejav.com/torrent/fc2ppv4902600
FC2PPV4901916,FC2-PPV-4901916 女子大生とプライベートでやりたい放題させて貰いました,4.9 GB,https://contents-thumbnail2.fc2.com/w1280/storage200000.contents.fc2.com/file/405/40457861/1779086289.2.png,https://onejav.com/torrent/fc2ppv4901916/download/02265981/onejav.com_fc2ppv4901916.torrent,"Amateur, Beautiful Girl, Creampie, FC2, Female College Student, Petite, POV, Shaved, Uncensored",,2026-05-18,https://onejav.com/torrent/fc2ppv4901916
892OERO002,旦那に内緒でエロがる奥さん。ホテルに入った瞬間「ずっとムラムラしてた…」ってすごい勢いでキス。これからセックスするのに、'こんなモノ(指輪)'いらないよね？俺がどっぷり中出ししてあげるから。【特典映像付き】,3.4 GB,https://image.mgstage.com/images/kyantamaseisouin/892oero/002/pb_e_892oero-002.jpg,https://onejav.com/torrent/892oero002/download/32339079/onejav.com_892oero002.torrent,"Affair, Amateur, Big Tits, Creampie, Married Woman, POV",,2026-04-27,https://onejav.com/torrent/892oero002
