code,title,size,image_url,torrent_url,tags,actresses,date,page_url
MIDA479,手塩にかけた可愛い義娘（玲奈）…彼氏とセックスしまくってけしからんので性感帯を覗き見して7日間イカせ続けることにした。 宮下玲奈,4.9 GB,https://pics.dmm.co.jp/mono/movie/adult/mida479/mida479pl.jpg,https://onejav.com/torrent/mida479/download/21641613/onejav.com_mida479.torrent,"Acme · Orgasm, Slender, Solowork, Squirting, Sweat, Uniform",Rena Miyashita,2026-01-16,https://onejav.com/torrent/mida479
SDAM160,托卵の娘だった私は毎日父に使われ精子を飲まされています,6.6 GB,https://pics.dmm.co.jp/mono/movie/adult/1sdam160/1sdam160pl.jpg,https://onejav.com/torrent/sdam160/download/15639229/onejav.com_sdam160.torrent,"Adopted Daughter, BIGセール, Creampie, Cum, POV, School Uniform",,2026-03-17,https://onejav.com/torrent/sdam160
FC2PPV4864739,FC2-PPV-4864739 バレエ教室を複数経営する元バレリーナ美熟女 多忙な社長業と夫との不仲の癒しを求めて不倫中出しSEX,4.8 GB,https://contents-thumbnail2.fc2.com/w1280/storage200000.contents.fc2.com/file/297/29683723/1773628673.66.jpg,https://onejav.com/torrent/fc2ppv4864739/download/89772188/onejav.com_fc2ppv4864739.torrent,"Amateur, Big Tits, Breasts, Creampie, FC2, Married Woman, Mature Woman",,2026-03-17,https://onejav.com/torrent/fc2ppv4864739
START451,性欲処理専門セックス外来医院26 特別編 SODSTAR 小湊よつ葉 新人ナースの透明本気汁が糸引く真心診療,6.9 GB,https://pics.dmm.co.jp/mono/movie/adult/1start451/1start451pl.jpg,https://onejav.com/torrent/start451/download/32138936/onejav.com_start451.torrent,"3P, 4P, Creampie, Documentary, Impromptu Sex, Nurse, Solowork",Yotsuha Kominato,2026-01-20,https://onejav.com/torrent/start451
JUR061,美しき一凛の『花』が咲く、Madonnaの新時代―。 超大型新人 いち花 30歳 AV DEBUT,6.4 GB,https://pics.dmm.co.jp/mono/movie/adult/jur061/jur061pl.jpg,https://onejav.com/torrent/jur061/download/08882729/onejav.com_jur061.torrent,"Affair, Big Tits, Debut Production, Married Woman, Mature Woman, Solowork",いち花,2026-02-06,https://onejav.com/torrent/jur061
START534,,5.6 GB,https://pics.dmm.co.jp/mono/movie/adult/1start534/1start534pl.jpg,https://onejav.com/torrent/start534/download/67276299/onejav.com_start534.torrent,,,2026-03-17,https://onejav.com/torrent/start534
START508,閉店後の棚卸しで終電を逃した俺はバイトの子の家に泊まることに 頑なにすっぴんを拒む姿が可愛くて火が付いたが逆に絶倫腰フリマシーンと化した彼女に朝までしぼり取られた 神木麗,5.6 GB,https://pics.dmm.co.jp/mono/movie/adult/1start508/1start508pl.jpg,https://onejav.com/torrent/start508/download/07807824/onejav.com_start508.torrent,"Big Tits, Blow, Cowgirl, Creampie, Solowork, Subordinates, Colleagues",Rei Kamiki,2026-01-27,https://onejav.com/torrent/start508
FC2PPV4864780,FC2-PPV-4864780 【豪華特典付き】ロマンチストなハメ撮り師が望んだ、童顔でカワイイ顔の１８歳カフェ店員の色白美巨乳ムチムチボディ。,13.2 GB,https://contents-thumbnail2.fc2.com/w1280/storage200000.contents.fc2.com/file/286/28519270/1773664826.82.jpg,https://onejav.com/torrent/fc2ppv4864780/download/08091407/onejav.com_fc2ppv4864780.torrent,"Amateur, Bath, Big Tits, Breasts, Creampie, FC2, POV, Titty Fuck, Toy",,2026-03-17,https://onejav.com/torrent/fc2ppv4864780
MIDA494,新歓コンパNTR ※胸糞注意 上京したばかりの遠距離恋愛彼女がテニサーの【歓迎コンパ】で1年生を喰いまくってるヤリチン男子に1晩中ハメられイカされていた話 純白彩永,5.1 GB,https://pics.dmm.co.jp/mono/movie/adult/mida494/mida494pl.jpg,https://onejav.com/torrent/mida494/download/01649668/onejav.com_mida494.torrent,"Beautiful Girl, Big Tits, Cuckold, Drinking Party, Female College Student, Solowork",純白彩永,2026-01-30,https://onejav.com/torrent/mida494
MOGI154,足を舐めて土下座懇願するぐらいデカチンを求める体に教育する3本番 保育士2年目 石川くるみ（22）,7.4 GB,https://pics.dmm.co.jp/mono/movie/adult/1mogi154/1mogi154pl.jpg,https://onejav.com/torrent/mogi154/download/06920494/onejav.com_mogi154.torrent,"BIGセール, Breasts, Deep Throating, Huge Cock, Petite, Solowork",石川くるみ,2026-03-17,https://onejav.com/torrent/mogi154
