code,title,size,image_url,torrent_url,tags,actresses,date,page_url
SNOS130,新人NO.1 STYLE 奇跡のウブボディ 聖なる未完成少女 早坂奏音AVデビュー,7.4 GB,https://pics.dmm.co.jp/mono/movie/adult/snos130/snos130pl.jpg,https://onejav.com/torrent/snos130/download/11028663/onejav.com_snos130.torrent,"Beautiful Girl, Big Tits, Blow, Debut Production, Solowork, Titty Fuck",早坂奏音,2026-03-20,https://onejav.com/torrent/snos130
GNS149,,11.4 GB,https://pics.dmm.co.jp/mono/movie/adult/h_1596gns149/h_1596gns149pl.jpg,https://onejav.com/torrent/gns149/download/12307670/onejav.com_gns149.torrent,,,2026-04-26,https://onejav.com/torrent/gns149
FTHTD201,,5.8 GB,https://pics.dmm.co.jp/mono/movie/adult/1fthtd201/1fthtd201pl.jpg,https://onejav.com/torrent/fthtd201/download/97226418/onejav.com_fthtd201.torrent,,,2026-04-26,https://onejav.com/torrent/fthtd201
348NTR099,,2.7 GB,https://image.mgstage.com/images/ntrnet/348ntr/099/pb_e_348ntr-099.jpg,https://onejav.com/torrent/348ntr099/download/12909897/onejav.com_348ntr099.torrent,,,2026-04-26,https://onejav.com/torrent/348ntr099
START498,ハプバーでSEXをしたのは親友の旦那。もっと責めたい女と責められたい女…正反対の人妻二人が快楽堕ちして夫婦交換スワッピング4Pする仲になるまで。 青空ひかり 神木麗,12.7 GB,https://pics.dmm.co.jp/mono/movie/adult/1start498/1start498pl.jpg,https://onejav.com/torrent/start498/download/29251391/onejav.com_start498.torrent,"3P, 4P, 4HR+, Affair, BIGセール, Drama, Married Woman, Swingers","Hikari Aozora, Rei Kamiki",2026-03-03,https://onejav.com/torrent/start498
FC2PPV4863385,FC2-PPV-4863385 ※局アナ内定の現/.役JD///神くびれ美巨乳ボディの名家ご/.令/.嬢。危険日お構いなしの生ハメ・生中出しを含む、計3発射を記録した本物ハメ撮り独占映像 #008,3.1 GB,https://contents-thumbnail2.fc2.com/w1280/storage201000.contents.fc2.com/file/407/40606359/1773381407.58.png,https://onejav.com/torrent/fc2ppv4863385/download/27498469/onejav.com_fc2ppv4863385.torrent,"Amateur, Beautiful Girl, Big Tits, Breasts, Creampie, FC2, POV, Shaved",,2026-03-16,https://onejav.com/torrent/fc2ppv4863385
FC2PPV4887618,FC2-PPV-4887618 先着特価【無修正】神スタイルの美女とハメ撮り！中出し★奇跡の美乳・美尻★【顔出し】,3.2 GB,https://contents-thumbnail2.fc2.com/w1280/storage200000.contents.fc2.com/file/410/40970955/1777087681.25.jpg,https://onejav.com/torrent/fc2ppv4887618/download/43338050/onejav.com_fc2ppv4887618.torrent,"Amateur, Beautiful Girl, FC2, POV, Uncensored",,2026-04-26,https://onejav.com/torrent/fc2ppv4887618
MIDA574,,7.4 GB,https://pics.dmm.co.jp/mono/movie/adult/mida574/mida574pl.jpg,https://onejav.com/torrent/mida574/download/65356380/onejav.com_mida574.torrent,,,2026-04-03,https://onejav.com/torrent/mida574
PFES115,【Hカップおっとり妹系】【Jカップイケイケギャル】【Iカップ甘やかしお姉さん】 会社の先パイ3人に誘われ男はボクひとり！？囲まれ挟まれ揉んで甘えて、、爆乳だらけのハーレム女子旅 莉々はるか 清宮仁愛 柏木ふみか,6.4 GB,https://pics.dmm.co.jp/mono/movie/adult/pfes115/pfes115pl.jpg,https://onejav.com/torrent/pfes115/download/75687139/onejav.com_pfes115.torrent,"Big Tits, Harem, Hot Spring, Titty Fuck, Travel","莉々はるか, 清宮仁愛, 柏木ふみか",2026-03-27,https://onejav.com/torrent/pfes115
ANKB042,すぐに潮吹くザーメン大好きドスケベお姉さん,5.1 GB,https://pics.dmm.co.jp/mono/movie/adult/ankb042/ankb042pl.jpg,https://onejav.com/torrent/ankb042/download/50359436/onejav.com_ankb042.torrent,"Big Tits, Cum, Hot Spring, Squirting, Titty Fuck",,2026-04-26,https://onejav.com/torrent/ankb042
