code,title,size,image_url,torrent_url,tags,actresses,date,page_url
MIST505,オバショット おばさんの、おばさんによる、おばさんマニアのための、おばさんセックス めぐみおばさん50歳 鈴河めぐみ,7.5 GB,https://pics.dmm.co.jp/mono/movie/adult/1mist505/1mist505pl.jpg,https://onejav.com/torrent/mist505/download/69867732/onejav.com_mist505.torrent,"3P, 4P, Creampie, Mature Woman, POV, Solowork, Squirting",鈴河めぐみ,2026-04-05,https://onejav.com/torrent/mist505
SNOS168,最初で最後の限界挑戦ー。 2ヶ月禁欲後の潜在覚醒セックス 河北彩伽,5.8 GB,https://pics.dmm.co.jp/mono/movie/adult/snos168/snos168pl.jpg,https://onejav.com/torrent/snos168/download/87323326/onejav.com_snos168.torrent,"3P, 4P, Acme · Orgasm, Nasty, Hardcore, Slender, Solowork, Squirting",河北彩伽,2026-03-20,https://onejav.com/torrent/snos168
CVDX637,,10.1 GB,https://pics.dmm.co.jp/mono/movie/adult/h_086cvdx637/h_086cvdx637pl.jpg,https://onejav.com/torrent/cvdx637/download/10891171/onejav.com_cvdx637.torrent,,,2026-04-05,https://onejav.com/torrent/cvdx637
230ORECZ501,,2.5 GB,https://image.mgstage.com/images/orenoshirouto/230orecz/501/pb_e_230orecz-501.jpg,https://onejav.com/torrent/230orecz501/download/98881417/onejav.com_230orecz501.torrent,,,2026-04-05,https://onejav.com/torrent/230orecz501
ADN765,夫公認NTR 浮気相手（僕の上司）とのセックスでしかイケなくなってしまった妻に懇願されて、泣きながら浮気を許すしかなかった僕。 美園和花,4.9 GB,https://pics.dmm.co.jp/mono/movie/adult/adn765/adn765pl.jpg,https://onejav.com/torrent/adn765/download/79227027/onejav.com_adn765.torrent,"Affair, Big Tits, Creampie, Cuckold, Married Woman, Solowork",美園和花,2026-02-27,https://onejav.com/torrent/adn765
PRIN058,マゾま●こ クジラ姫とイキ狂い女,8.2 GB,https://pics.dmm.co.jp/mono/movie/adult/prin058/prin058pl.jpg,https://onejav.com/torrent/prin058/download/22378861/onejav.com_prin058.torrent,"Acme · Orgasm, Amateur, Breasts, Cosplay, Squirting",,2026-04-05,https://onejav.com/torrent/prin058
START538,俺ん家では常に全裸のセフレと過ごす3連休 ～体の相性だけは抜群の俺に彼氏の文句を言いながらイキまくる～ 新川空,7.0 GB,https://pics.dmm.co.jp/mono/movie/adult/1start538/1start538pl.jpg,https://onejav.com/torrent/start538/download/76744122/onejav.com_start538.torrent,"BIGセール, Couple, Drama, Facials, POV, Solowork",新川空,2026-03-24,https://onejav.com/torrent/start538
MIDA568,新人 脱・看護師 Jカップ専属 葉山みりあAV Debut！,6.3 GB,https://pics.dmm.co.jp/mono/movie/adult/mida568/mida568pl.jpg,https://onejav.com/torrent/mida568/download/84195792/onejav.com_mida568.torrent,"3P, 4P, Big Tits, Blow, Debut Production, POV, Solowork",葉山みりあ,2026-03-13,https://onejav.com/torrent/mida568
YMDS270,生ハメ中出し温泉旅行 川上ゆうを独占した一泊二日の旅,5.9 GB,https://pics.dmm.co.jp/mono/movie/adult/ymds270/ymds270pl.jpg,https://onejav.com/torrent/ymds270/download/24251203/onejav.com_ymds270.torrent,"Creampie, Cum, Deep Throating, Kiss, Solowork, Squirting",森野雫,2026-04-04,https://onejav.com/torrent/ymds270
SNOS130,新人NO.1 STYLE 奇跡のウブボディ 聖なる未完成少女 早坂奏音AVデビュー,7.4 GB,https://pics.dmm.co.jp/mono/movie/adult/snos130/snos130pl.jpg,https://onejav.com/torrent/snos130/download/41151943/onejav.com_snos130.torrent,"Beautiful Girl, Big Tits, Blow, Debut Production, Solowork, Titty Fuck",早坂奏音,2026-03-20,https://onejav.com/torrent/snos130
