code,title,size,image_url,torrent_url,tags,actresses,date,page_url
FC2PPV4856530,FC2-PPV-4856530 あゆちゃんクリスマススペシャル！天才的に可愛いトナカイさんに口内射精ごっくんエッチ！,2.3 GB,https://contents-thumbnail2.fc2.com/w1280/storage201000.contents.fc2.com/file/407/40690197/1772224945.98.jpg,https://onejav.com/torrent/fc2ppv4856530/download/64655765/onejav.com_fc2ppv4856530.torrent,"Amateur, FC2",,2026-03-02,https://onejav.com/torrent/fc2ppv4856530
FC2PPV4856533,FC2-PPV-4856533 あかりちゃんは当然最強かわいいに決まってる！チャイナとスク水の２作品セット,1.9 GB,https://contents-thumbnail2.fc2.com/w1280/storage201000.contents.fc2.com/file/407/40690197/1772228319.43.png,https://onejav.com/torrent/fc2ppv4856533/download/27071404/onejav.com_fc2ppv4856533.torrent,"Amateur, FC2",,2026-03-02,https://onejav.com/torrent/fc2ppv4856533
SNOS056,なんてことない日常生活で繰り広げられる、お酒の勢いで一線を超えてしまった男女のふしだらな土日。生々しくて普通だけど一番エロいSEX 河北彩伽,5.3 GB,https://pics.dmm.co.jp/mono/movie/adult/snos056/snos056pl.jpg,https://onejav.com/torrent/snos056/download/62809758/onejav.com_snos056.torrent,"Blow, Breasts, Cowgirl, Drama, Kiss, Solowork",河北彩伽,2026-01-23,https://onejav.com/torrent/snos056
SNOS112,巨乳グラドルはやはり痴●に狙われやすいらしい 紫堂るい,6.3 GB,https://pics.dmm.co.jp/mono/movie/adult/snos112/snos112pl.jpg,https://onejav.com/torrent/snos112/download/02796005/onejav.com_snos112.torrent,"Acme · Orgasm, Big Tits, Drama, Humiliation, Solowork, Squirting",紫堂るい,2026-02-06,https://onejav.com/torrent/snos112
CAWD944,隣人のゴミ部屋で異臭中年おやじにドブ臭ザーメンぶっかけで汚され抜かずの連撃中出し52発で孕まされた清楚な女子●生の末路… 青葉はる,5.2 GB,https://pics.dmm.co.jp/mono/movie/adult/cawd944/cawd944pl.jpg,https://onejav.com/torrent/cawd944/download/91451168/onejav.com_cawd944.torrent,"Acme · Orgasm, Beautiful Girl, Bukkake, Creampie, Drama, Solowork",青葉はる,2026-03-02,https://onejav.com/torrent/cawd944
IPZZ703,楓カレン大乱交解禁ノーカットSP 総勢16名20発オーバーの大ぶっかけ祭り,5.0 GB,https://pics.dmm.co.jp/mono/movie/adult/ipzz703/ipzz703pl.jpg,https://onejav.com/torrent/ipzz703/download/78724189/onejav.com_ipzz703.torrent,"Acme · Orgasm, Bukkake, Orgy, Slender, Solowork",Karen Kaede,2026-01-09,https://onejav.com/torrent/ipzz703
ABF319,俺に沼ってる最高の女。-男本位の避妊なし中出しSEX- 涼森れむ【限定特典映像15分付き】,5.6 GB,https://image.mgstage.com/images/prestige/abf/319/pb_e_abf-319.jpg,https://onejav.com/torrent/abf319/download/39559871/onejav.com_abf319.torrent,"Big Tits, Butt, Creampie, Deep Throating, Solowork",Remu Suzumori,2026-02-12,https://onejav.com/torrent/abf319
FC2PPV4857001,FC2-PPV-4857001 【完全シークレット版】【淫乱】【音量注意】【FC2初出演】２４歳IカップOL美奈さん、喘ぎ声が大きすぎて止まりません、脳がとろける程に逝きまくる醜態性が晒されます,6.1 GB,https://contents-thumbnail2.fc2.com/w1280/storage201000.contents.fc2.com/file/377/37664104/1772294107.28.jpg,https://onejav.com/torrent/fc2ppv4857001/download/76758039/onejav.com_fc2ppv4857001.torrent,"Amateur, Big Tits, Blow, Creampie, Cunnilingus, Electric Massager, FC2, Finger Fuck, Nasty, Hardcore, OL, Uncensored",,2026-03-02,https://onejav.com/torrent/fc2ppv4857001
FC2PPV4857084,FC2-PPV-4857084 清楚なアマネちゃんハメ撮りパート3,2.0 GB,https://contents-thumbnail2.fc2.com/w1280/storage200000.contents.fc2.com/file/404/40347725/1772299411.97.jpg,https://onejav.com/torrent/fc2ppv4857084/download/72081544/onejav.com_fc2ppv4857084.torrent,"Amateur, FC2",,2026-03-02,https://onejav.com/torrent/fc2ppv4857084
JUR061,美しき一凛の『花』が咲く、Madonnaの新時代―。 超大型新人 いち花 30歳 AV DEBUT,6.4 GB,https://pics.dmm.co.jp/mono/movie/adult/jur061/jur061pl.jpg,https://onejav.com/torrent/jur061/download/48878881/onejav.com_jur061.torrent,"Affair, Big Tits, Debut Production, Married Woman, Mature Woman, Solowork",いち花,2026-02-06,https://onejav.com/torrent/jur061
