code,title,size,image_url,torrent_url,tags,actresses,date,page_url
START529,新婚1年目の人妻が絶倫キモ親父に逆恨みされて…監●中出し 宮島めい,5.7 GB,https://pics.dmm.co.jp/mono/movie/adult/1start529/1start529pl.jpg,https://onejav.com/torrent/start529/download/43533132/onejav.com_start529.torrent,"BIGセール, Creampie, Cuckold, Drama, Married Woman, Restraint, Solowork",Mei Miyajima,2026-03-17,https://onejav.com/torrent/start529
BAB190,,5.0 GB,https://pics.dmm.co.jp/mono/movie/adult/bab190/bab190pl.jpg,https://onejav.com/torrent/bab190/download/25585406/onejav.com_bab190.torrent,,,2026-05-02,https://onejav.com/torrent/bab190
FC2PPV4893087,FC2-PPV-4893087 ※108個【無】お嬢様わか(25才) 「剛毛が多すぎて極楽浄土が見えません」仏の顔も三度まで。バチが当たらないよう2発中出ししましたww,1.5 GB,https://contents-thumbnail2.fc2.com/w1280/storage201000.contents.fc2.com/file/403/40203095/1777623064.14.gif,https://onejav.com/torrent/fc2ppv4893087/download/60570645/onejav.com_fc2ppv4893087.torrent,"Amateur, FC2",,2026-05-03,https://onejav.com/torrent/fc2ppv4893087
300MIUM1316,【むっつり女教師と校外不倫】普段はマジメな学年主任がどスケべ豹変。引き締まったカラダにハリのある美巨乳。膣奥まで生チン貪り込んで搾り取るどエロい腰使い。普段の姿からは想像できないどスケベ本性全開で、何度も中出し種付け。【既婚女性(国語教師)×独身男性(体育教師)】 case.18,3.5 GB,https://image.mgstage.com/images/prestigepremium/300mium/1316/pb_e_300mium-1316.jpg,https://onejav.com/torrent/300mium1316/download/47007152/onejav.com_300mium1316.torrent,"Affair, Amateur, Big Tits, Creampie, Female Teacher, Married Woman, POV",,2026-03-17,https://onejav.com/torrent/300mium1316
SIRO5664,大人しめな見た目とは裏腹な快感の嬌声！大好きな正常位ではカラダをくねらせて何度もイキまくる！セックスになると豹変する姿は男の性衝動を加速させる！！ 【初撮り】ネットでAV応募→AV体験撮影 2550,2.4 GB,https://image.mgstage.com/images/shirouto/siro/5664/pb_e_siro-5664.jpg,https://onejav.com/torrent/siro5664/download/71319439/onejav.com_siro5664.torrent,"Amateur, Butt, Debut Production, Female College Student, POV, Short Hair",,2026-05-03,https://onejav.com/torrent/siro5664
ABF338,空っぽになるまで搾り取られる 生ハメ騎乗位 涼森れむ,5.2 GB,https://image.mgstage.com/images/prestige/abf/338/pb_e_abf-338.jpg,https://onejav.com/torrent/abf338/download/61831738/onejav.com_abf338.torrent,"Creampie, Lotion, POV, Slut, Solowork",Remu Suzumori,2026-04-09,https://onejav.com/torrent/abf338
MKON134,マチアプでJDと待ち合わせしたつもりがJ系が来た 捕まりたくないけど欲望に負けて中出しSEX！！ 瀬戸ひなこ,4.8 GB,https://pics.dmm.co.jp/mono/movie/adult/mkon134/mkon134pl.jpg,https://onejav.com/torrent/mkon134/download/33634476/onejav.com_mkon134.torrent,"Beautiful Girl, Creampie, School Girls, School Uniform, Slut, Solowork",瀬戸ひなこ,2026-05-02,https://onejav.com/torrent/mkon134
START538,俺ん家では常に全裸のセフレと過ごす3連休 ～体の相性だけは抜群の俺に彼氏の文句を言いながらイキまくる～ 新川空,7.0 GB,https://pics.dmm.co.jp/mono/movie/adult/1start538/1start538pl.jpg,https://onejav.com/torrent/start538/download/88228296/onejav.com_start538.torrent,"BIGセール, Couple, Drama, Facials, POV, Solowork",新川空,2026-03-24,https://onejav.com/torrent/start538
FC2PPV4894081,,1.1 GB,https://contents-thumbnail2.fc2.com/w1280/storage200000.contents.fc2.com/file/377/37682362/1777700556.32.jpg,https://onejav.com/torrent/fc2ppv4894081/download/01334609/onejav.com_fc2ppv4894081.torrent,,,2026-05-03,https://onejav.com/torrent/fc2ppv4894081
SNOS130,新人NO.1 STYLE 奇跡のウブボディ 聖なる未完成少女 早坂奏音AVデビュー,7.4 GB,https://pics.dmm.co.jp/mono/movie/adult/snos130/snos130pl.jpg,https://onejav.com/torrent/snos130/download/63152178/onejav.com_snos130.torrent,"Beautiful Girl, Big Tits, Blow, Debut Production, Solowork, Titty Fuck",早坂奏音,2026-03-20,https://onejav.com/torrent/snos130
