code,title,image_url,page_url,views,date_scraped
SABA-851-RM,Immediate Saddle Raw Creampie OK Saffle-chan Gonzo AV Shooting 02 [Uncensored L**ked],https://pic.javct.net/poster/20230908/1694235230.jpg,https://javct.net/v/saba-851-rm,120,2026-05-02
PAKO-065-RM,# Minato-ku Video When My Son's Nursery School Mom Friends Ran Into An Affair [Uncensored L**ked],https://pic.javct.net/poster/20230908/1694490616.jpg,https://javct.net/v/pako-065-rm,140,2026-05-02
KTKC-167-RM,"A Sober Glasses Girl From Fukui, A Miracle Of A National Treasure-class Huge Breasts When She Takes It Off. Ah, I Found A Wonderful Talent In Tokyo Documentary. [Uncensored L**ked]",https://pic.javct.net/poster/20230804/1693626094.jpg,https://javct.net/v/ktkc-167-rm,125,2026-05-02
DIC-047-RM,18 Years And 9 Months. 08 Beautiful Breast E Cup × Number Of Experienced Person 1 X Life First Life [Uncensored L**ked],https://pic.javct.net/poster/04112026/0cbd607158.jpg,https://javct.net/v/dic-047-rm,150,2026-05-02
KOO-009-RM,Hinako [Uncensored L**ked],https://static.javct.net/poster/1624080449.jpg,https://javct.net/v/koo-009-rm,117,2026-05-02
HRSM-003-RM,Spear Throwing Away Abduction/Double Sleep [Uncensored L**ked],https://pic.javct.net/poster/20230908/1694177542.jpg,https://javct.net/v/hrsm-003-rm,105,2026-05-02
ETQR-495-RM,In A Shared Room At A Hotel With A Beautiful Drunk Female Employee... Elena [Uncensored L**ked],https://pic.javct.net/poster/20230804/1694018301.jpg,https://javct.net/v/etqr-495-rm,81,2026-05-02
336KNB-410-RM,"[Put it all the way in] No matter how old I am, I want to make love, and I want to be penetrated deep inside, in front of Chiba Koen Station, Chiba City, Saitama Prefecture. [Uncensored L**ked]",https://pic.javct.net/poster/04112026/2473ebd9fc.jpg,https://javct.net/v/336knb-410-rm,71,2026-05-02
T28-454,Realistic Amateur Nampa!Negotiations Raw Sex Over A Voice To The Girls Who Were Found In Certain Coterie Events Of Japan's Largest! !Cosplayers To Be Surrounded By A ~ Fanzine To Spend Money Freely Geek Girls And Cameco Was Bought Still Erotic! ! !~,https://pic.javct.net/poster/04112026/65df89695e.jpg,https://javct.net/v/t28-454,200,2026-05-02
MOGK-005,"Turning An Innocent Girl Into A Sex Doll Through Sleep R**e, Ensnaring Her, Impregnating Her, And Brainwashing Her Into A Hole-doll.",https://pic.javct.net/poster/04112026/8e73a53a2d.jpg,https://javct.net/v/mogk-005,112,2026-05-02
ATOM-108-RM,Amateur Limited!Super Sticky Birdlime Restraint Well-paid Part-time Job! [Uncensored L**ked],https://pic.javct.net/poster/04112026/b5be0a1b3e.jpg,https://javct.net/v/atom-108-rm,135,2026-05-02
FC2PPV-4890710,"[Bonus included] [Personal shooting] [Full face exposed] A 28-year-old beautiful conductor has a neat appearance, but her sensitive body makes her squirt easily. Her wet pussy is stirred and she reaches continuous orgasms.",https://pic.javct.net/poster/04112026/06e901a3b3.jpg,https://javct.net/v/fc2ppv-4890710,40,2026-05-02
FC2PPV-4892416,[Pregnancy/Suspension of activities] 19-year-old duo of beautiful influencers 3P creampie sex shot on a dangerous day Urgent release video *Prices will increase sequentially,https://pic.javct.net/poster/04112026/52376497c6.jpg,https://javct.net/v/fc2ppv-4892416,37,2026-05-02
FC2PPV-4892293,I had a secret meeting with a boyish beauty who is a Harajuku idol who looks like Pa◯tan,https://pic.javct.net/poster/04112026/566b3a510a.jpg,https://javct.net/v/fc2ppv-4892293,61,2026-05-02
HZ-3874,Offline Meetup With A Hot & Cute Office Lady! - S,https://pic.javct.net/poster/04112026/65019664f0.jpg,https://javct.net/v/hz-3874,51,2026-05-02
PA-050126-100,"Cum on Wives' Tits Special : Married women who make you want to grope them, regardless of their bra size",https://pic.javct.net/poster/04112026/6b58b40842.jpg,https://javct.net/v/pa-050126-100,59,2026-05-02
10-050126-01,Treasured Pussy Selection: Nozomi Hamada,https://pic.javct.net/poster/04112026/dc9bbd7850.jpg,https://javct.net/v/10-050126-01,08,2026-05-02
FC2PPV-4890498,[Individual video] Affair sex with a frustrated slender married woman at a married woman's house,https://pic.javct.net/poster/04112026/e268046dbb.jpg,https://javct.net/v/fc2ppv-4890498,23,2026-05-02
FC2PPV-4891895,"[Uncensored/Complete Amateur/Creampie/Squirting] An ordinary girl in uniform who agreed to a love hotel photoshoot on the condition that she wears a mask. She said she was in the deep end, but once the pheromones started, she got so horny that she had a thick creampie ♡",https://pic.javct.net/poster/04112026/4259712906.jpg,https://javct.net/v/fc2ppv-4891895,20,2026-05-02
FC2PPV-4891988,A super cute Harajuku idol is made to wear a maid costume and has a creampie play,https://pic.javct.net/poster/04112026/5b241034f4.jpg,https://javct.net/v/fc2ppv-4891988,56,2026-05-02
FC2PPV-4891643,"Early purchase bonus Miraculous fusion with a slender beauty ""Aaah, one high-speed dick thrusts a huge explosion, massive ejaculation finish",https://pic.javct.net/poster/04112026/d23a8f772f.jpg,https://javct.net/v/fc2ppv-4891643,62,2026-05-02
SKMJ-741-RM,"Full Face Reveal, Hardcore Pickup! We Gave A Beautiful Teenage Girl Who Came To Tokyo From The Countryside An Embarrassing Bareback Sex Experience! We Slid Straight Into Her Pussy, Which Was Overflowing With Sweet And Sour Juices! We Kept Thrusting Relentlessly, Even After She Came, Until Her Tight Slit Was Bright Red And Swollen, And We Kept Cumming Inside Her Repeatedly! 4 [Uncensored L**ked]",https://pic.javct.net/poster/04112026/1776971375.jpg,https://javct.net/v/skmj-741-rm,239,2026-05-02
GOJI-012-RM,Creampie My Sister Who Approaches Me From Morning Till Night [Uncensored L**ked],https://pic.javct.net/poster/20231011/1698721941.jpg,https://javct.net/v/goji-012-rm,186,2026-05-02
ETQR-494-RM,I Shared A Room With A Beautiful Drunk Female Employee At A Hotel... Himari [Uncensored L**ked],https://pic.javct.net/poster/20230804/1694018320.jpg,https://javct.net/v/etqr-494-rm,80,2026-05-02
