code,title,image_url,page_url,views,date_scraped
GOJU-315,"Mature Women's Hair Nude Video Recording: Women Whose Entire Bodies Were Filmed In Every Least Of Their Lives, And Even Fo**ed To Masturbate In Embarrassment 4",https://pic.javct.net/poster/04112026/6eae5f7505.jpg,https://javct.net/v/goju-315,178,2026-05-04
FC2PPV-4894432,"[Facial exposure lifted] 3rd Beauty Pageant Winner, Strongest Visual H Cup 19 Years Old Really Dangerous Daytime Creampie Gonzo Limited Release Video *Prices will increase sequentially",https://pic.javct.net/poster/04112026/27ff691d33.jpg,https://javct.net/v/fc2ppv-4894432,36,2026-05-04
HEZ-880-RM,"A Frustrated Housewife Visits A High-end Beauty Salon In Tokyo And Is Given An Aphrodisiac Oil To Release Her Sexual Desires. Once Her Body Is Aroused, She Can't Stop Wanting More... The Housewife's ""sex"" That Keeps Craving More Even After Multiple Orgasms! Vol. 2 [Uncensored L**ked]",https://pic.javct.net/poster/04112026/95bf461b1c.jpg,https://javct.net/v/hez-880-rm,125,2026-05-04
10-050426-01,Barefaced Beauty: Azusa Mizumori,https://pic.javct.net/poster/04112026/621a66e293.jpg,https://javct.net/v/10-050426-01,51,2026-05-04
FC2PPV-4891175,[Individual shooting] Raw sex and ejaculation in the mouth of a married woman delivery girl,https://pic.javct.net/poster/04112026/f0f5549820.jpg,https://javct.net/v/fc2ppv-4891175,20,2026-05-04
GEBB-040,Amateurs Who Applied To Try On Sexy Swimsuits As Monitors For A High-paying Part-time Job Advertised On Ta○mi○ Ended Up Losing Consciousness After Being Subjected To A Numbing Cream...,https://pic.javct.net/poster/04112026/8870bbda09.jpg,https://javct.net/v/gebb-040,142,2026-05-04
HEZ-880,"A Frustrated Housewife Visits A High-end Beauty Salon In Tokyo And Is Given An Aphrodisiac Oil To Release Her Sexual Desires. Once Her Body Is Aroused, She Can't Stop Wanting More... The Housewife's ""sex"" That Keeps Craving More Even After Multiple Orgasms! Vol. 2",https://pic.javct.net/poster/04112026/95bf461b1c.jpg,https://javct.net/v/hez-880,125,2026-05-04
390JAC-233,"[Explosive orgasm with someone else's dick] A real-life lady who doesn't even know her boyfriend, who has a lewd real face and a cheating office lady, 26 years old, real estate (global)",https://pic.javct.net/poster/04112026/a36436e309.jpg,https://javct.net/v/390jac-233,104,2026-05-04
MFCS-204,Luke,https://pic.javct.net/poster/04112026/81849bc18d.jpg,https://javct.net/v/mfcs-204,92,2026-05-04
MFCS-207,Yuri,https://pic.javct.net/poster/04112026/f06ee20428.jpg,https://javct.net/v/mfcs-207,85,2026-05-04
FC2PPV-4894309,[Individual shooting] A masochist man who owed money to two 20-year-olds full of sexual desire and was put in charge of sex processing... Creampie in 3PSEX..,https://pic.javct.net/poster/04112026/f1afb07be4.jpg,https://javct.net/v/fc2ppv-4894309,50,2026-05-04
FC2PPV-4894370,"[Gonzo version of a wife who has reached the rebellious period of showing her face] I shaved my pubic hair myself for this day, and the married woman with a slightly rough pussy licks my anus and feet, doing whatever I want",https://pic.javct.net/poster/04112026/a0038b61f9.jpg,https://javct.net/v/fc2ppv-4894370,52,2026-05-04
MAQQ-012,"A Beautiful 70-year-old Woman's Life Story. 6 Sex Scenes, 4 Hours.",https://pic.javct.net/poster/04112026/80ba0d3c94.jpg,https://javct.net/v/maqq-012,240,2026-05-04
FC2PPV-4894566,A tight beauty with a big black cock and beautiful breasts and a big ass is made to cum for the first time in an ekiben and is creampied and fucked.,https://pic.javct.net/poster/04112026/eaac38976e.jpg,https://javct.net/v/fc2ppv-4894566,42,2026-05-04
FC2PPV-4894291,"None First shooting/face appearance Limited to Golden Week 1980pt In the current era, romance is prohibited. She was an innocent underground idol aiming for the front stage. Creampie & ejaculation in the mouth of the current ◯ female college student.",https://pic.javct.net/poster/04112026/efb7f45026.jpg,https://javct.net/v/fc2ppv-4894291,72,2026-05-04
FC2PPV-4894396,This is a miracle! A serious female college student who just moved to Tokyo has her first sex with a big cock and has super climax sex,https://pic.javct.net/poster/04112026/134d5af571.jpg,https://javct.net/v/fc2ppv-4894396,49,2026-05-04
FC2PPV-4894504,"[Face showing training young wife sex edition] This is a young wife with a small body.It seems that her husband is training such a small body, so I will give him a creampie in return.",https://pic.javct.net/poster/04112026/2044cf0348.jpg,https://javct.net/v/fc2ppv-4894504,48,2026-05-04
FC2PPV-4894254,"Big tits lewd, huge breasts swaying & cumming, being squeezed out by a sex masterpiece lol",https://pic.javct.net/poster/04112026/1affa6a77b.jpg,https://javct.net/v/fc2ppv-4894254,66,2026-05-04
FC2PPV-4891172,[Individual shooting] Creampie with a raw dick to a neat single mother,https://pic.javct.net/poster/04112026/845fea8909.jpg,https://javct.net/v/fc2ppv-4891172,35,2026-05-04
326PAPA-004-RM,"[Infiltration of Dad Hunting - Satsuki-chan Edition] How to sneak into a daddy recruitment agency and woo a girl from the dad's perspective - Use the power of money to get a modern girl. A beautiful woman who has had the experience to the end tastes an old man's big cock with her mouth and pussy, making her shaved pussy wet. [Uncensored L**ked]",https://pic.javct.net/poster/04112026/51064dad6d.jpg,https://javct.net/v/326papa-004-rm,64,2026-05-04
DIC-050-RM,The Camera Closely Contacts The Trajectory Until Ordinary Girls Become AV Actresses! Sensitive Pink Nipple God Slender BODY 激 っ か わ う う う ぶ ぶ 団 団 あ ん な ち ゃ (仮 名) AV Debut! ! [Uncensored L**ked],https://pic.javct.net/poster/04112026/9e7dd83986.jpg,https://javct.net/v/dic-050-rm,130,2026-05-04
STSK-091-RM,"""Seriously, Will You Come Again!?""There Is A Girl Who Can Do It J0 Reflation Production Voyeurism Forbidden Acts If You Find Out 4 Shy Angels [Uncensored L**ked]",https://pic.javct.net/poster/20230804/1694058804.jpg,https://javct.net/v/stsk-091-rm,161,2026-05-04
277DCV-300-RM,"[SP that we will never be able to touch] We filmed the lovey-dovey SEX where real girls in real love are rumored to be feeling really good D. They were kicked out and it lasted for 40 minutes... When I returned to the room, I felt jealous and angry. ⇒ Don't pretend that ""I really want to have sex with you, so leave us alone."" ⇒ There are men in this world who are in love with Minato-ku girls like this ⇒ Jealous nudes that don't touch the huge breasts overflowing from the school swimsuit ⇒ Obsession with her ex-boyfriend... The woman's anger was amazing ⇒ Jealousy exploded Return to the room and have an unexpected second round of sex Can I take you home? case.293 [Uncensored L**ked]",https://pic.javct.net/poster/04112026/6ff2b2e08a.jpg,https://javct.net/v/277dcv-300-rm,97,2026-05-04
UMD-1005-RM,"A Timid, Unlucky-looking Female New Employee Experiences Sexual Harassment During A Health Checkup 02 - Haruna Noa, Nanahara Sayu, Ouka Rin [Uncensored L**ked]",https://pic.javct.net/poster/04112026/4116e167f9.jpg,https://javct.net/v/umd-1005-rm,120,2026-05-04
