code,title,image_url,page_url,views,date_scraped
FC2PPV-4892437,[First time] **pyjpx*jsps Newcomer *Early purchase bonus Popular Reiwa hostess'' I released a rich male juice from Small fish man'' who is twitching to the limitless orgasm hell.,https://pic.javct.net/poster/04112026/dfda598e33.jpg,https://javct.net/v/fc2ppv-4892437,55,2026-05-05
300MIUM-1361,"She has a cute face and is super sadistic [God tech slut with a huge gap] Her devilish bass voice is a sexy queen JD guy who knows everything about her hand techniques, oral techniques, and breast techniques to get rid of his premature ejaculation dick and sway her F cup beautiful breasts as she cums wildly [If you're horny, UrPenis is the way to go]",https://pic.javct.net/poster/04112026/9370d01906.jpg,https://javct.net/v/300mium-1361,63,2026-05-05
857OMG-029,"""I'll tease you a lot and do anything,'' said the girl who applied from behind the scenes, with teary eyes and shaking her hips, making me cum until my senses went crazy, and when I gave her a huge amount of creampie, she cried with joy...",https://pic.javct.net/poster/04112026/24ef799490.jpg,https://javct.net/v/857omg-029,80,2026-05-05
FC2PPV-4895221,"First photo shoot! A neat and pretty F-cup Moe cute teen who is still at a dangerous age! A pure white body with long black hair, beautiful skin and beautiful big breasts, and ejaculation inside the vagina without a rubber band. It was a dream-like moment.",https://pic.javct.net/poster/04112026/fb1189fc34.jpg,https://javct.net/v/fc2ppv-4895221,45,2026-05-05
FC2PPV-4895187,"[Married Woman Gonzo Edition with Apology for Showing Her Face] Sad news has come in.However, the request for re-shooting was answered.However, there are times when you have to apologize.",https://pic.javct.net/poster/04112026/d1833fc5d4.jpg,https://javct.net/v/fc2ppv-4895187,62,2026-05-05
FC2PPV-4894549,"I was having trouble being serious, so I relied on an uncle... and as a result, he creampied me.",https://pic.javct.net/poster/04112026/4d087602db.jpg,https://javct.net/v/fc2ppv-4894549,29,2026-05-05
FC2PPV-4894033,"[No algae bonus] It's too bad...'' Natsuki, a beautiful Akita woman who just moved to Tokyo, was cheated on and developed a heartbroken body, but she got too excited and ran away from the dick.",https://pic.javct.net/poster/04112026/6581adf6bb.jpg,https://javct.net/v/fc2ppv-4894033,103,2026-05-05
C-2347,Housewives Affair Travel # 187,https://pic.javct.net/poster/04112026/0665ee539c.jpg,https://javct.net/v/c-2347,170,2026-05-05
FC2PPV-4895395,"[Flame Wife Again] From a noble b**odline to a commoner, a married woman who suffers from the gap is recommended as a slender beauty who undergoes gonzo training",https://pic.javct.net/poster/04112026/59de244602.jpg,https://javct.net/v/fc2ppv-4895395,51,2026-05-05
SKMJ-425-RM,Female College Students In Fresh Recruit Suits Ww Would You Like To Experience A Super Dense Berokisu That Makes Your Brain Toll Under The Blue Sky? I'm Getting High With A Public Deep Kiss That Makes My Tongue Entangle! ? Anyway Kiss Kiss Kiss Vivid Kiss Pies SEXww [Uncensored L**ked],https://pic.javct.net/poster/20230908/1694177480.jpg,https://javct.net/v/skmj-425-rm,241,2026-05-05
FC2PPV-4895340,[Has a boyfriend] [5P] An 18-year-old boyfriend has never heard that we have a meat urinal boyfriend. She has a fair-skinned E-cup body that shows no mercy. Her shaved pussy opens wide and ejaculates continuously with continuous creampie.,https://pic.javct.net/poster/04112026/b0ff875cb6.jpg,https://javct.net/v/fc2ppv-4895340,80,2026-05-05
FC2PPV-4895385,A large amount of uncle sperm is injected into the vagina of an ordinary female college student who works part-time at a cafe.,https://pic.javct.net/poster/04112026/4a1216b54c.jpg,https://javct.net/v/fc2ppv-4895385,54,2026-05-05
FC2PPV-4892747,"Big Breasts, Big Ass [No] [Creampie] After enjoying the breasts like a super masochist cow, the I-cup big-breasted woman had creampie in her sensitive pussy and had good sensitivity, so it was fun *Bonuses included",https://pic.javct.net/poster/04112026/b152b1be97.jpg,https://javct.net/v/fc2ppv-4892747,43,2026-05-05
FC2PPV-4894551,"Second time with the 21 year old slender Hinami, a goddess who will come when you call.",https://pic.javct.net/poster/04112026/2528633b90.jpg,https://javct.net/v/fc2ppv-4894551,82,2026-05-05
FC2PPV-4895639,[Individual photo] A chubby bombshell cums while she sleeps...,https://pic.javct.net/poster/04112026/aa8603b20f.jpg,https://javct.net/v/fc2ppv-4895639,34,2026-05-05
DVMM-011-RM,Appearance MM No. Female College Student Only The Magic Mirror What's Inside Your Mouth? A Female College Student Who Unconsciously Gets Wet By Licking The Big Dick That Was Sneaked Out Is Rolling Up With Raw Insertion! [Uncensored L**ked],https://pic.javct.net/poster/20230804/1693543117.jpg,https://javct.net/v/dvmm-011-rm,240,2026-05-05
SDAM-169,"A young lady I found at Hakone Onsen.Would you like to enter the men's bath with just a towel? 63 7 beautiful women enjoying a trip get licked and sucked by an old man.The nape, the bulge, the anus, and the face are all wetter than in the bath.",https://pic.javct.net/poster/04112026/3aceb79d04.jpg,https://javct.net/v/sdam-169,298,2026-05-05
DIC-051-RM,The Camera Closely Contacts The Trajectory Until Ordinary Girls Become AV Actresses! Systemic Feeling Band BODY Sensitive Sensitive Grueling Hair ○ ○ Corioli Face Animation Voice Vehicle Maintenance Specialty Student Yukari Chan (kana) AV Debut! ! [Uncensored L**ked],https://pic.javct.net/poster/04112026/dc061aa98f.jpg,https://javct.net/v/dic-051-rm,135,2026-05-05
HRSM-001-RM,Athlete Hunter Physical Observation And Insertion Inside The Stadium Bukkake Chikan [Uncensored L**ked],https://pic.javct.net/poster/20230908/1694177662.jpg,https://javct.net/v/hrsm-001-rm,219,2026-05-05
FC2PPV-4895359,"[Uncensored x Personal Shooting] Kerberos Special Edition A beautiful woman with an outstanding G-cup style wanders deep in the mountains and is excited to see if anyone will come.In the second half, she took her time at the hotel and had a creampie lol",https://pic.javct.net/poster/04112026/9d3c3be433.jpg,https://javct.net/v/fc2ppv-4895359,42,2026-05-05
HTM-075-RM,Cheating Mature Woman Is Serious SEX VOL.75 [Uncensored L**ked],https://pic.javct.net/poster/20230908/1694235914.jpg,https://javct.net/v/htm-075-rm,160,2026-05-05
FC2PPV-4894516,"[Part 2 of 19-year-old new female college student Mika-chan] I taught Mika-chan, who just entered university and doesn't even know how to moan, intense adult sex.",https://pic.javct.net/poster/04112026/046e96e125.jpg,https://javct.net/v/fc2ppv-4894516,50,2026-05-05
MTALL-081-RM,"[Out Of Force Notice] I Thought That The Wife Of A Second-class Baseball Player Was Supporting Her Husband, But She Was A Bimbo Who Opens Her Crotch To Anyone [Uncensored L**ked]",https://pic.javct.net/poster/20230804/1693452413.jpg,https://javct.net/v/mtall-081-rm,141,2026-05-05
PAIS-049-RM,"Private Video Of Roppongi's Famous Huge-breasted Blond Gal Dancer Exposing Her Superb Body Like A Manga And Exposing It Hiihi, Will Be L**ked. [Uncensored L**ked]",https://pic.javct.net/poster/20230908/1694490746.jpg,https://javct.net/v/pais-049-rm,105,2026-05-05
