code,title,image_url,page_url,views,date_scraped
RDT-198-RM,I Who Had Witnessed The Accident Tits Woman To Raw Change Of Clothes In The Parking Lot Of The Sea ... [Uncensored L**ked],https://pic.javct.net/poster/04112026/b6d42168db.jpg,https://javct.net/v/rdt-198-rm,120,2026-05-09
PAIS-051-RM,#Individual Shooting #God Milk H-cup #Raw Girl #Punishment Tenchu [Uncensored L**ked],https://pic.javct.net/poster/20230804/1693109667.jpg,https://javct.net/v/pais-051-rm,123,2026-05-09
DIC-058-RM,The Camera Closely Contacts The Trajectory Until Ordinary Girls Become AV Actresses!To The World Of AV That Kept On Worrying For Two Years Too!Shimane Show Dancer Rika Chan (Kana) AVdebut! ! [Uncensored L**ked],https://pic.javct.net/poster/04112026/38225abd49.jpg,https://javct.net/v/dic-058-rm,125,2026-05-09
SKMJ-429-RM,"The Result Of Abstinence For More Than 30 Days Of An Unequaled CA <<27 Years Old>> With A Amazing Body... On The Way Home From The Flight, SEX Monster Ji Po Devouring No Rubber 4 Production Eros Bare Hot Spring Trip [Uncensored L**ked]",https://pic.javct.net/poster/20230908/1694177231.jpg,https://javct.net/v/skmj-429-rm,126,2026-05-09
AKDL-002-RM,"[Shin Mama Video] Manami, 24 years old, is a beautiful wife who is desperately trying to suppress her voice while her c**ld is in the next room. [Uncensored L**ked]",https://pic.javct.net/poster/06032026/1772961192.jpg,https://javct.net/v/akdl-002-rm,55,2026-05-09
RDT-269-RM,Tits I Saw By Chance Women Really Should Have Scored When He Was Chosen No Bra! ?Her Sensitive Nipples Were Excited To Be Seen Standing At The Bing ... 5 [Uncensored L**ked],https://pic.javct.net/poster/04112026/4f6b1a1d1e.jpg,https://javct.net/v/rdt-269-rm,130,2026-05-09
DIC-057-RM,The Camera Closely Contacts The Trajectory Until Ordinary Girls Become AV Actresses!Serving Favorite Blowjob Genius Active Big Breast Nurse Yuuka (Kana) AV Debut! ! [Uncensored L**ked],https://pic.javct.net/poster/04112026/5efb498b24.jpg,https://javct.net/v/dic-057-rm,130,2026-05-09
SIGL-020-RM,"Amateur Girl Vol. 20: Three Horny Amateur Girls, All Get Raw Cum Inside. [Uncensored L**ked]",https://pic.javct.net/poster/04112026/3e3ebbb976.jpg,https://javct.net/v/sigl-020-rm,220,2026-05-09
FC2PPV-4891988-RM,A super cute Harajuku idol is made to wear a maid costume and has a creampie play [Uncensored L**ked],https://pic.javct.net/poster/04112026/5b241034f4.jpg,https://javct.net/v/fc2ppv-4891988-rm,56,2026-05-09
PASN-021,"What are the different reactions shown by couple NTR ""unauthorized creampie""...",https://pic.javct.net/poster/04112026/b5d9336e95.jpg,https://javct.net/v/pasn-021,133,2026-05-09
TENH-22,"Naive Middle-aged Woman Who Readily Followed A Guy Who Hit On Her Gave Him A No-hands Blowjob!! He Took Her Back To His Place And Ejaculated In Her Mouth. 30 Men, 4 Hours",https://pic.javct.net/poster/04112026/120cc309ad.jpg,https://javct.net/v/tenh-22,240,2026-05-09
MDB-722-RM,Bullet Beauty Busty Fetishism 2 [Uncensored L**ked],https://pic.javct.net/poster/04112026/ff924a4d22.jpg,https://javct.net/v/mdb-722-rm,200,2026-05-09
SCOP-106-RM,Too Beautiful Female Employees Working In The Factory Town Full Of Greasy Sweaty Man For Some Reason.Rainy Day I Thought To Be A Tool Of Treatment Of Men Dressed As ... [Uncensored L**ked],https://pic.javct.net/poster/04112026/183e7ad4cf.jpg,https://javct.net/v/scop-106-rm,240,2026-05-09
SAMA-990-RM,Stubbornly Successful In Shooting Wooed The Well Meet H-chan In The Favorite Hangout Datsuba Who Had Refused To AV Appearance.And Arbitrarily Released! ! [Uncensored L**ked],https://pic.javct.net/poster/04112026/86b674143c.jpg,https://javct.net/v/sama-990-rm,120,2026-05-09
SKMJ-420-RM,"We Present A Decachin Virgin To A W Swimsuit Gal Who Shines Dazzlingly In The Sea Of Shonan! ? It's Really Big (ﾟДﾟ) Summer Girls Are Also Echiechi Estrus Ww Lewd Gently Teaching SEX To Naive Dicks, ""Would You Like To Do It?"" Pounding Creampie FESTIVAL2 [Uncensored L**ked]",https://pic.javct.net/poster/20230804/1692938551.jpg,https://javct.net/v/skmj-420-rm,143,2026-05-09
NSODN-017,"A L**ked Video Shows A Busty School Nurse, Whose Weakness Was Exploited, Getting Pregnant By Her Students.",https://pic.javct.net/poster/04112026/0ff0d5c2a3.jpg,https://javct.net/v/nsodn-017,120,2026-05-09
FC2PPV-4896999,"[Face exposure lifted] Selected from 10,000 people, Top Idol Candidates 18 years old'''' Creampie sex video emergency release *Prices will increase gradually",https://pic.javct.net/poster/04112026/6c48bd0146.jpg,https://javct.net/v/fc2ppv-4896999,42,2026-05-09
PA-050826-100,For Mature Women Only! Aim for the Big Prize! Wiggle Your Hips and Give Wacky Answers! The Butt-Writing Quiz Championship,https://pic.javct.net/poster/04112026/85745135df.jpg,https://javct.net/v/pa-050826-100,38,2026-05-09
10-050826-01,Treasured Pussy Selection: Kaho Hayakawa,https://pic.javct.net/poster/04112026/3770aee457.jpg,https://javct.net/v/10-050826-01,13,2026-05-09
FC2PPV-4872056,"[New release] “My husband isn’t here today, so why don’t we play?” A 24-year-old lonely married woman has an uncool affair date with a creampie [face showing/no]",https://pic.javct.net/poster/04112026/1d96487d39.jpg,https://javct.net/v/fc2ppv-4872056,49,2026-05-09
FC2PPV-4874099,She is just 18 years old and has taken the first step towards becoming a tax accountant.For those who can support her future together.,https://pic.javct.net/poster/04112026/a2b2d2e37c.jpg,https://javct.net/v/fc2ppv-4874099,106,2026-05-09
FC2PPV-4896857,[Uncensored] **pyjpx*jsps Black-haired neat Miku-chan 2 A beautiful girl in uniform who has an old man's penis inserted deep into her vagina and is seriously cumming even when a large amount of semen is creampied!!,https://pic.javct.net/poster/04112026/51d213e251.jpg,https://javct.net/v/fc2ppv-4896857,61,2026-05-09
FC2PPV-4897046,[None] [Chapter 4 of Picking Up Girls in the City] I found a neat and clean beauty in Gotanda who takes off her clothes and has beautiful breasts ♡ Beautiful ass is so lewd * ♡ She moans and cums while shaking her hips and cums with the gap wide open [Overseas version] Bonus included,https://pic.javct.net/poster/04112026/a1fdb7e1b9.jpg,https://javct.net/v/fc2ppv-4897046,40,2026-05-09
FC2PPV-4896881,[Uncensored] **pyjpx*jsps The best men's beautiful woman in black pantyhose tight mini dress is pressed to the brink of brain orgasm!,https://pic.javct.net/poster/04112026/d1bf8f528c.jpg,https://javct.net/v/fc2ppv-4896881,67,2026-05-09
