code,title,image_url,page_url,views,date_scraped
NFDM-244,Circle Women Bang Away At A Man's Ass Gather,https://pic.javct.net/poster/04112026/b2809d8c12.jpg,https://javct.net/v/nfdm-244,125,2026-05-13
SHKD-263-RM,Roh Scion Slave Sex Toys F ... Kara - Angel 5 Home Helper Mu**er R**e - Anal [Uncensored L**ked],https://pic.javct.net/poster/04112026/56a02a2a68.jpg,https://javct.net/v/shkd-263-rm,150,2026-05-13
OPRD-026-RM,Izumi Hasegawa Lady Cum Anal Virgins 5 Ketsugatchin [Uncensored L**ked],https://pic.javct.net/poster/04112026/656fb84d3b.jpg,https://javct.net/v/oprd-026-rm,120,2026-05-13
MISM-230-RM,Absolute Ass Hole Beautiful Girl DEBUT Kyoka-chan College Student 20 Years Old [Uncensored L**ked],https://pic.javct.net/poster/20221202/1645163826.jpg,https://javct.net/v/mism-230-rm,120,2026-05-13
TIMD-034,"A Beautiful Masochistic Older Sister, Mari Ruri, Experiences Female-like Spasms From Her Nipples And Anus.",https://pic.javct.net/poster/04112026/b907a32401.jpg,https://javct.net/v/timd-034,129,2026-05-13
OTIN-025-RM,"Anal Cumshot Infidelity, Only Offering Her Anus To Her Lover! The Young Wife With Beautiful Breasts Loses Her Mind As She Gets Fucked In Both Holes With An Ahegao Face! Her Masochistic Side Blossoms In Erotic Cosplay! Ball Licking, Ch**ing, Tongue Sticking Out, Ahegao Face, Cumming Like Crazy With Cumshots! 2SEX Kohaku Yaya [Uncensored L**ked]",https://pic.javct.net/poster/04112026/54b57e3b94.jpg,https://javct.net/v/otin-025-rm,102,2026-05-13
HUSR-167,Mom's Cock Is Incredible!Mother-in-law Is A Man's Daughter!Daughter And Son Dohimaru Who Haunts Her Huge Cock ... ... Pervert Family Gachijiki Incest Incest! [Yukino Akari] 【Sayaka Sakurai】,https://pic.javct.net/poster/04112026/ecd368dd91.jpg,https://javct.net/v/husr-167,120,2026-05-13
MOPP-121,"A Masochistic Man Is Teased And Played With By A Slut Who Will Make His Brain Melt With Pleasure, And Is Never Allowed To Ejaculate As A Rewarding To**ure Of Masochistic Pleasure - Aoi Miumi",https://pic.javct.net/poster/04112026/48a563fe22.jpg,https://javct.net/v/mopp-121,120,2026-05-13
GVG-778-RM,Anal Ballerina 5 Hamasaki Naomi / Yuki Tamaki [Uncensored L**ked],https://pic.javct.net/poster/04112026/dc895279a2.jpg,https://javct.net/v/gvg-778-rm,130,2026-05-13
KNMB-060-RM,Complete Raw STYLE @ Sumire [Uncensored L**ked],https://pic.javct.net/poster/20230804/1693109983.jpg,https://javct.net/v/knmb-060-rm,140,2026-05-13
OTIN-025,"Anal Cumshot Infidelity, Only Offering Her Anus To Her Lover! The Young Wife With Beautiful Breasts Loses Her Mind As She Gets Fucked In Both Holes With An Ahegao Face! Her Masochistic Side Blossoms In Erotic Cosplay! Ball Licking, Ch**ing, Tongue Sticking Out, Ahegao Face, Cumming Like Crazy With Cumshots! 2SEX Kohaku Yaya",https://pic.javct.net/poster/04112026/54b57e3b94.jpg,https://javct.net/v/otin-025,102,2026-05-13
MISM-232-RM,Masochist Sex Education That Is Not Taught At University. Asuka Morikawa [Uncensored L**ked],https://pic.javct.net/poster/20221202/1645160029.jpg,https://javct.net/v/mism-232-rm,180,2026-05-13
VICD-386,Squirting Big Tits Layer Tearing Anal To**ure,https://pic.javct.net/poster/04112026/e46f27401a.jpg,https://javct.net/v/vicd-386,170,2026-05-13
SAIT-029-RM,Beautiful Girl Agent Chi & Ta X 3 Hole Skewered Fuck X Double Guillotine Creampie Punishment X Massive Semen Bukkake Alice & Mei [Uncensored L**ked],https://pic.javct.net/poster/20230804/1692938611.jpg,https://javct.net/v/sait-029-rm,200,2026-05-13
FC2PPV-4898377,"Sumire (18) The cutest girl in the second shoot, has a video of different angles of view, creampie, electric masturbation, anal penetration ATM, piston machine, and finally cosplay and creampie.",https://pic.javct.net/poster/04112026/3e21ffb8cd.jpg,https://javct.net/v/fc2ppv-4898377,174,2026-05-13
MIGD-535-RM,Anal FUCK Out And Bukkake! Tsumugi Serizawa [Uncensored L**ked],https://pic.javct.net/poster/06032026/1773544091.jpg,https://javct.net/v/migd-535-rm,120,2026-05-13
CADV-667,Daughter Girl Metamorphosis Poisoning 8 Hours! !,https://pic.javct.net/poster/04112026/f495c6f959.jpg,https://javct.net/v/cadv-667,480,2026-05-13
BCV-003-RM,Wanted Chan TV × PRESTIGE SELECTION 03 [Uncensored L**ked],https://pic.javct.net/poster/04112026/e0801c6049.jpg,https://javct.net/v/bcv-003-rm,240,2026-05-13
MISM-239-RM,Full Awakening. Asshole Princess's Anal Penetration Confession Kyoka -chan [Uncensored L**ked],https://pic.javct.net/poster/20221904/1650612253.jpg,https://javct.net/v/mism-239-rm,139,2026-05-13
T28-371-RM,Pies SEX & Anal SEX And Russian Blonde Shaved Pussy Girl Gina Active College Student [Uncensored L**ked],https://pic.javct.net/poster/06032026/1772843457.jpg,https://javct.net/v/t28-371-rm,120,2026-05-13
PA-050926-100,"Throat, Ass, and Pussy: A Luxurious 3-Hole Fuck",https://pic.javct.net/poster/04112026/92ff3cb63d.jpg,https://javct.net/v/pa-050926-100,50,2026-05-13
FC2PPV-4897193,"[Amateur's First Shooting] Nana (19) After filming a creampie and anal penetration ATM of a plump and sensitive amateur, I was apparently meeting up with an old male friend for the first time in a few years, so I had a lot of creampie before that.",https://pic.javct.net/poster/04112026/d2710d91b0.jpg,https://javct.net/v/fc2ppv-4897193,143,2026-05-13
FC2PPV-4891741-RM,"Completely showing her face, the newlywed wife has a 21-year-old waist, busty, newlywed wife creampied while her husband is working, deep throating, anal licking, hands and feet fixed, neck ◯◯, bikini ◯◯, nostril licking, gag, individual shooting 540th person [Uncensored L**ked]",https://pic.javct.net/poster/04112026/7c5147b509.jpg,https://javct.net/v/fc2ppv-4891741-rm,238,2026-05-13
MIDD-863-RM,Maika From Explosion-greed-Say [Uncensored L**ked],https://pic.javct.net/poster/06032026/1772843376.jpg,https://javct.net/v/midd-863-rm,120,2026-05-13
