code,title,image_url,page_url,views,date_scraped
OKSN-329-RM,"New Discovery! Adorable Pale-Skinned Beauty Can't Resist Her Lust For Her Lover - Drowning In Forbidden, Adulterous Passions [Uncensored L**ked]",https://static.javct.net/poster/oksn-329.jpg,https://javct.net/v/oksn-329-rm,119,2026-05-15
SUJI-197-RM,"On A Rainy Day, The R**er Commits A Crime Because The Sound Is Turned Off [Uncensored L**ked]",https://pic.javct.net/poster/20230804/1691816676.jpg,https://javct.net/v/suji-197-rm,120,2026-05-15
SQTE-493-RM,Sorry For Being Cute Sorry For The Last Etch. Facial Specialization Aoi Kururugi [Uncensored L**ked],https://pic.javct.net/poster/20230804/1693628572.jpg,https://javct.net/v/sqte-493-rm,132,2026-05-15
BOKO-038-RM,"Wanting To Get To Know Each Other Better, Two Close Friends Spend A Two-day, One-night Date Where They Eat, Shower, And Kiss A Lot Until Morning, Discovering Feelings Of Love They Didn't Know They Had. - Meru Adachi & Nana Kisaki [Uncensored L**ked]",https://pic.javct.net/poster/04112026/e777903f80.jpg,https://javct.net/v/boko-038-rm,172,2026-05-15
SUMU-005-RM,No Makeup! No Fake! Yuno Makikawa [Uncensored L**ked],https://pic.javct.net/poster/04112026/1a7b50b370.jpg,https://javct.net/v/sumu-005-rm,126,2026-05-15
MIHD-002-RM,Hamedori distribution limited MOODYZ exclusive natural sex released Rena Miyashita [Uncensored L**ked],https://pic.javct.net/poster/04112026/47567d47f6.jpg,https://javct.net/v/mihd-002-rm,121,2026-05-15
MIDA-640,Everything Is A First-time Experience!! Sex Development 4-part Special!! Chiharu Okui,https://pic.javct.net/poster/04112026/46076a2a23.jpg,https://javct.net/v/mida-640,200,2026-05-15
ABF-342-RM,"Falling In Love While Still In School Uniform. Completely Subjective, Youthful 3SEX - Nanami Nakamori [Uncensored L**ked]",https://pic.javct.net/poster/04112026/1776305055.jpg,https://javct.net/v/abf-342-rm,110,2026-05-15
TIKP-070-RM,Hentai Uncle's Paco Activity Picture Ena Tan Satsuki Ena [Uncensored L**ked],https://pic.javct.net/poster/20220406/1655531094.jpg,https://javct.net/v/tikp-070-rm,140,2026-05-15
DVMM-399,"A World Where You Can Freely Stop Time, As In Hazuki Noa.",https://pic.javct.net/poster/04112026/1651ff68c7.jpg,https://javct.net/v/dvmm-399,165,2026-05-15
MIDA-591,"Newcomer, Top-tier, Gorgeous Raw Talent: Misaki Mayu",https://pic.javct.net/poster/04112026/da3df9acb2.jpg,https://javct.net/v/mida-591,160,2026-05-15
DRPT-110-RM,"Fully Clothed, Inside-the-camera Angles! Two Small-breasted Beauties, Yumi Nijimura, Kanna Shirahime, And Machi Ikuno, Are Teased On Their Sensitive Nipples With A Fiberscope Whose Tip Moves Freely, And They Feel Pleasure Despite Their Embarrassment. [Uncensored L**ked]",https://pic.javct.net/poster/04112026/0c1e9c9d42.jpg,https://javct.net/v/drpt-110-rm,155,2026-05-15
DVMM-395,"Absolute Obedience! A Naked Maid Who Will Immediately Give A Blowjob To Anyone's Dick, Covered In Cum, At Her Master's Command. With A Rental Mouth And Pussy, You Can Fuck As Much As You Want! Cum As Much As You Want!",https://pic.javct.net/poster/04112026/b3b78fe7df.jpg,https://javct.net/v/dvmm-395,150,2026-05-15
MUDR-377,I Went Back To My Hometown And Found Out My Family Home Had Turned Into A Soapland!? A Story Of The Busty Signboard Girl's Hard Work And Masturbation Service That Will Definitely Make You A Repeat Customer - Ruka Itoi,https://pic.javct.net/poster/04112026/116c38bb80.jpg,https://javct.net/v/mudr-377,110,2026-05-15
MUKD-574,Happy Birthday Dear Shuka The Most Unfortunate And Cruel Birthday In The World Will Be Ruined By R**e,https://pic.javct.net/poster/04112026/5de9a2f0f9.jpg,https://javct.net/v/mukd-574,120,2026-05-15
HMN-845,"I Might Have Been Able To Cum Inside Her That Day. If I Had Taken That Action At That Time, In That Place, On That Day... I Might Have Been Able To Have Unprotected Sex With That Girl. I Tried To Relive The Experience. - Karin Kitaoka",https://pic.javct.net/poster/04112026/969681c1de.jpg,https://javct.net/v/hmn-845,120,2026-05-15
HMN-857,Miracle In The 15th Year Of The School – The Birth Of An Absolute New Ace. Mian Akiyama,https://pic.javct.net/poster/04112026/adb6674e73.jpg,https://javct.net/v/hmn-857,190,2026-05-15
MIDA-632,"Mia Nanasawa, A Condescending Masturbation Supporter Who Belittles You And Insults Your Pathetic Cock While Repeatedly Leading You To Ejaculation.",https://pic.javct.net/poster/04112026/dadf559036.jpg,https://javct.net/v/mida-632,150,2026-05-15
EBWH-331,"Unfit To Be A Doctor. ""Please Stop..."" Despite Her Words, Her Nipples Continued To Be Erect. Shiraha Maina",https://pic.javct.net/poster/04112026/acbe0f1188.jpg,https://javct.net/v/ebwh-331,120,2026-05-15
XVSR-670-RM,"Soap Is Also A Genius! The Erotic Bubble Princess ""Ena Satsuki"" Is Born With A Body That Is Too Sensitive And Makes You And Your Customers Cum! ! [Uncensored L**ked]",https://pic.javct.net/poster/20221108/1662184114.jpg,https://javct.net/v/xvsr-670-rm,120,2026-05-15
ONEZ-199-RM,The Master Loves Too Much Yanderemade Service Vol. 002 Love Winter [Uncensored L**ked],https://pic.javct.net/poster/20240807/1722634546.jpg,https://javct.net/v/onez-199-rm,120,2026-05-15
T28-565-RM,"On A Day When My Parents Were Not There, I Was Scared All Day Long Until My Sister And Sperm Died.I Love Winter [Uncensored L**ked]",https://pic.javct.net/poster/04112026/cb7a268486.jpg,https://javct.net/v/t28-565-rm,130,2026-05-15
MIDA-636,"Mucosal Service Department, Body Fluid Exchange Department, Tongue Licking And Cumming Inside, Rookie Nurse Izumi Momoka",https://pic.javct.net/poster/04112026/d58e085022.jpg,https://javct.net/v/mida-636,120,2026-05-15
MDTM-218-RM,Breeding Life To It Among Permian And A Half.Brass Band Wings Attendance Number 001 Tsubasa Aihara [Uncensored L**ked],https://pic.javct.net/poster/04112026/f547ede279.jpg,https://javct.net/v/mdtm-218-rm,130,2026-05-15
