code,title,image_url,page_url,views,date_scraped
MIDD-940,Onoe 若葉 Soap Lady Ultra Rarity Fcup,https://pic.javct.net/poster/05192026/51b8cb396f.jpg,https://javct.net/v/midd-940,160,2026-05-20
JBJB-013,A Black Hair Beautiful Girl Is A Hidden Bitch Sperm Filled With Pervert Uncles And A Soothing Body Fluid Covered Sex Photo Session Alice Mizushima,https://pic.javct.net/poster/05192026/b3f8f1f8ae.jpg,https://javct.net/v/jbjb-013,117,2026-05-20
CPZ-69011,"Delusional Aizawa Miyu ~I Am On A Journey To ""know Humans"". Along The Way, I Learned About ""Infure-en-saa"". ~ A Story Born From The Fantasy Of What If Aizawa Miyu Were An Elf...",https://pic.javct.net/poster/05192026/bf86c3cc2d.jpg,https://javct.net/v/cpz-69011,117,2026-05-20
AMBI-171-RM,Small Love Story Between A Runaway Girl And An Old Man Saki Sakura [Uncensored L**ked],https://pic.javct.net/poster/20230206/1687239161.jpg,https://javct.net/v/ambi-171-rm,123,2026-05-20
MILK-181-RM,A Beautiful Girl With A Mine-type Love Brain Is A Guy. De M Service Misunderstanding Woman Sumire Kuramoto [Uncensored L**ked],https://pic.javct.net/poster/20230207/1691034268.jpg,https://javct.net/v/milk-181-rm,131,2026-05-20
NAMH-064,"13 Shots Into A Lively, Hairless Pussy: First Time Ever Unprotected Intercourse With Hanamori Natsuho",https://pic.javct.net/poster/05192026/862742f1b1.jpg,https://javct.net/v/namh-064,115,2026-05-20
XRW-653-RM,"To Tell The Truth, I Like The Smell Of Smell. Sakuragi Yuuki Sound [Uncensored L**ked]",https://pic.javct.net/poster/05192026/c9638a7b8f.jpg,https://javct.net/v/xrw-653-rm,148,2026-05-20
SABA-844-RM,Immediate Saddle Raw Creampie OK Saffle-chan Gonzo AV Shooting 01 [Uncensored L**ked],https://pic.javct.net/poster/20230804/1691214355.jpg,https://javct.net/v/saba-844-rm,120,2026-05-20
RDT-288-RM,A Little Devil Girl Who Seduces Me Without Hesitation As If To Make A Fool Of Me Who Is Not A Woman. [Uncensored L**ked],https://pic.javct.net/poster/20230302/1679976709.jpg,https://javct.net/v/rdt-288-rm,135,2026-05-20
HND-749-SUB,Rookie Busu Pretty Girl Laughing And Cute You Want To Be Complimented By Someone AV Debut Tomorrow Jun [English Subtitle],https://pic.javct.net/poster/06032026/1775635479.jpg,https://javct.net/v/hnd-749-sub,150,2026-05-20
FC2PPV-4903727,[Urgent] Creampie in the confident upper balls that will make you say that you have never met such a beautiful woman,https://pic.javct.net/poster/05192026/cc900b15f0.jpg,https://javct.net/v/fc2ppv-4903727,63,2026-05-20
MIDD-881-RM,Maki Department Of Diapers More Cosplay [Uncensored L**ked],https://pic.javct.net/poster/06032026/1773888817.jpg,https://javct.net/v/midd-881-rm,150,2026-05-20
FC2PPV-4903591,"Her 165cm slender beautiful body is so sensitive that her pink pussy is convulsing and moaning with the demon piston, and when it is penetrated deep inside, she cries out, ""I'm cumming again..."" and cums inside the honey pot.",https://pic.javct.net/poster/05192026/1f73d10698.jpg,https://javct.net/v/fc2ppv-4903591,53,2026-05-20
ABW-098-RM,"Spocos Sweaty Sex 4 Production! Athlete, Konomi Nagisa Act. 26 Exhilarating Sex With Sweat! !! !! [Uncensored L**ked]",https://static.javct.net/poster/abw-098.jpg,https://javct.net/v/abw-098-rm,155,2026-05-20
FC2PPV-4890983,"A neat and clean beautiful lady from Kobe, Mens, stimulates a man with a miniskirt massage that looks like you can see her crotch at any moment. She gets squeezed for two shots, one in a hotel and another in an open-air bath. [Uncensored Creampie]",https://pic.javct.net/poster/05192026/259c94aa1b.jpg,https://javct.net/v/fc2ppv-4890983,56,2026-05-20
FC2PPV-4903567,"[Face] Reddish brown black hair neat and clean office lady, lewd cowgirl position in the office, garter stockings",https://pic.javct.net/poster/05192026/9f3327158c.jpg,https://javct.net/v/fc2ppv-4903567,32,2026-05-20
FC2PPV-4901279,"[No] After all, the tall, beautiful legs, slender beauty with the maximum facial deviation value has accumulated, and I immediately swallow it, and immediately give it a hand job, force it to erect, and cum inside it, and then cum inside it on the bed... ⤵ *Bonus High resolution",https://pic.javct.net/poster/05192026/d595666889.jpg,https://javct.net/v/fc2ppv-4901279,61,2026-05-20
DVMM-364-RM,"This Gap Is Crazy... My Little Sister Has Always Looked Down On Me, But Now She's Begging Me To Creampie Her Over And Over Again, And Now We're Having Intimate, Tsundere Sex Every Day Yuno Sakura [Uncensored L**ked]",https://pic.javct.net/poster/04112026/560a5f2bff.jpg,https://javct.net/v/dvmm-364-rm,140,2026-05-20
FC2PPV-4903558,[Women's Body Sharing Chapter 15] An old man and a man with big cocks share Kawana's slender beautiful goddess abs and the best curvaceous office lady with a body that is too light to collapse and a waist that is at its limit [Overseas version] Bonus included,https://pic.javct.net/poster/05192026/82c30cfa94.jpg,https://javct.net/v/fc2ppv-4903558,46,2026-05-20
DV-722-RM,Kaede Matsushima Self Portrait # 7 [Uncensored L**ked],https://pic.javct.net/poster/05192026/64ec94803f.jpg,https://javct.net/v/dv-722-rm,120,2026-05-20
IPIT-005,Do You Hate Women Who Like H? Sensitive Kirekawa Who Gets Wet From 5 Seconds Before Kissing (pretty Cute) Beautiful Girl AV Debut Alice Nanase,https://pic.javct.net/poster/05192026/ba7e52109f.jpg,https://javct.net/v/ipit-005,120,2026-05-20
MIAA-551-SUB,"I'm The Only One Who Knows The True Face Of Our Student Council President. She's The Number One Neat And Clean Classmate, But She Was Rudely And Crudely Showing Off Her Anal Hole To Me And Lured Me To Temptation And Proceeded To Creampie Pound Me. Hana Shirato [English Subtitle]",https://pic.javct.net/poster/20212011/1640937385.jpg,https://javct.net/v/miaa-551-sub,117,2026-05-20
NACT-132,Rent-back Tenant ● Makes Fried Rice In A Naked Apron And Provides Bath Service! A Woman Whose Weakness Is Exploited And Is Taken Advantage Of By Her Landlord - Yukimura Izuki,https://pic.javct.net/poster/05192026/6667ee765a.jpg,https://javct.net/v/nact-132,103,2026-05-20
MDTM-224-RM,"Today, Tomorrow Is Also The Day After Tomorrow As Well ... When Only Me Make Me Cum Even JK Idle Yuna Himekawa [Uncensored L**ked]",https://pic.javct.net/poster/05192026/9da7d1183f.jpg,https://javct.net/v/mdtm-224-rm,120,2026-05-20
