code,title,image_url,page_url,views,date_scraped
YDNS-008,Train Sex Punishment #008,https://pic.javct.net/poster/04112026/adeb6096a8.jpg,https://javct.net/v/ydns-008,187,2026-05-04
ABP-241,The Obscene Naru Breeding Yuzutsuki Love Of Beautiful Young Lady,https://pic.javct.net/poster/04112026/c71c1919b1.jpg,https://javct.net/v/abp-241,120,2026-05-04
FC2PPV-4894220,"0387_T002 Reira-chan, 20 years old, The pathetic story of a former beauty pageant representative idol continues...The fate of an idol who fell to the point where her H-cup young wife's pussy was completely destroyed by an old man and a black man (explosion)",https://pic.javct.net/poster/04112026/4cdb0cbe6d.jpg,https://javct.net/v/fc2ppv-4894220,101,2026-05-04
CHN-202-RM,I Will Lend You A New Amateur Girl. 99 Pseudonym) Mami Sakurazaka (Esthetician) 27 Years Old. [Uncensored L**ked],https://static.javct.net/poster/chn-202.jpg,https://javct.net/v/chn-202-rm,130,2026-05-04
IPZZ-523-SUB,The Female Idol Employee In The Company That I Had A Crush On Was Being Passed Around By Her Trashy Bosses During A Drinking Session In A Hotel Room On A Business Trip. Kana Momonogi [English Subtitle],https://pic.javct.net/poster/20250903/1743700181.jpg,https://javct.net/v/ipzz-523-sub,120,2026-05-04
FC2PPV-4894504,"[Face showing training young wife sex edition] This is a young wife with a small body.It seems that her husband is training such a small body, so I will give him a creampie in return.",https://pic.javct.net/poster/04112026/2044cf0348.jpg,https://javct.net/v/fc2ppv-4894504,48,2026-05-04
FOCS-046-RM,"Gorgeous Big Tits F-cup Cosplayer Gets Super Horny! Her Pussy Gets Wet And Excited After Realizing It's A Risque Photo Shoot! ""I'll Be A Cosplayer That's Just For You!"" In Akihabara. Mei Mizuki [Uncensored L**ked]",https://pic.javct.net/poster/20212011/1642159512.jpg,https://javct.net/v/focs-046-rm,123,2026-05-04
MIGD-525-RM,Pinsaro Miss Minato 莉久 Cum Pacifier Your [Uncensored L**ked],https://pic.javct.net/poster/06032026/1772962247.jpg,https://javct.net/v/migd-525-rm,170,2026-05-04
AMBI-164-RM,Kozue Fujita A Little Love Story Between A Runaway Girl And An Old Man [Uncensored L**ked],https://pic.javct.net/poster/20233001/1676868338.jpg,https://javct.net/v/ambi-164-rm,121,2026-05-04
ZEX-404-RM,THE PERFECT ORGASM MANUAL How To Make Any Man Or Woman Achieve The Greatest Squirting Orgasm - A Sexual Problem-Solving Special To Help You Realize Truly Pleasurable Sexual Ecstasy - Mikako Abe [Uncensored L**ked],https://static.javct.net/poster/zex-404.jpg,https://javct.net/v/zex-404-rm,123,2026-05-04
IBW-928Z-RM,Incest Video Of A Daughter Who Continues To Be R**ed By Her Father Nana Kisaki [Uncensored L**ked],https://pic.javct.net/poster/20230804/1693368818.jpg,https://javct.net/v/ibw-928z-rm,120,2026-05-04
DV-616-RM,Beauty Shop Kaede Matsushima Is Farewell [Uncensored L**ked],https://pic.javct.net/poster/04112026/d28d1bdd53.jpg,https://javct.net/v/dv-616-rm,120,2026-05-04
DV-995-RM,3P Excited The First Time!! Akari Asahina [Uncensored L**ked],https://pic.javct.net/poster/20230206/1685943171.jpg,https://javct.net/v/dv-995-rm,120,2026-05-04
FAYS-012-RM,A Cute Girl With Animal Ears Purchased From A Slave Trader [Uncensored L**ked],https://pic.javct.net/poster/04112026/6190248921.jpg,https://javct.net/v/fays-012-rm,80,2026-05-04
EKDV-290,You're Soap Nana Usami,https://pic.javct.net/poster/04112026/5c3629db6a.jpg,https://javct.net/v/ekdv-290,120,2026-05-04
YUJ-063-RM,"I Met My Ex-girlfriend For The First Time In Several Years, And Even Though We Both Had Boyfriends/girlfriends, We Kept Saying ""I Love You"" And Yearning For Each Other, Getting Caught Up In A Relationship That Was More Than Friends With Benefits But Less Than Lovers. [Uncensored L**ked]",https://pic.javct.net/poster/04112026/a7358cf2a7.jpg,https://javct.net/v/yuj-063-rm,160,2026-05-04
CAWD-976-RM,A Hole That Wants To Be Filled By An Old Man: A Frustrated Girl Becomes Seriously Addicted To The Disgusting Sex With A Complete Stranger's Dick. - Nami Asami [Uncensored L**ked],https://pic.javct.net/poster/04112026/42247a234b.jpg,https://javct.net/v/cawd-976-rm,130,2026-05-04
FC2PPV-4894083,"[Half-faced half-beautiful housewife sex video edition] Twice a week, she still enjoys nighttime activities with her husband, so this time she prepared a cock bigger than her husband.",https://pic.javct.net/poster/04112026/dbdc10da21.jpg,https://javct.net/v/fc2ppv-4894083,44,2026-05-04
XVSR-270,Icha Love God Date Mermyn Is Real! ! Asami Nagase,https://pic.javct.net/poster/04112026/9271205ed7.jpg,https://javct.net/v/xvsr-270,120,2026-05-04
EBOD-409-RM,Curiosity Inoue Miwa E-BODY Exclusive Debut Honor Student [Uncensored L**ked],https://pic.javct.net/poster/01202026/1772510299.jpg,https://javct.net/v/ebod-409-rm,120,2026-05-04
CAWD-977-RM,"Too Erotic, It's Deadly! A Truly Beautiful Girl With An Overwhelming 55cm Waist And Miraculous Natural G-cup Breasts Awakens To A Massive Orgasm In This Pornographic Film Featuring 16 Facial Cumshots. Honma Asami [Uncensored L**ked]",https://pic.javct.net/poster/04112026/8f9b6b8322.jpg,https://javct.net/v/cawd-977-rm,130,2026-05-04
AMBI-163-RM,Only For Me School Swimsuit M Beautiful Girl Minori Mashiro [Uncensored L**ked],https://pic.javct.net/poster/20222612/1674189191.jpg,https://javct.net/v/ambi-163-rm,121,2026-05-04
TPPN-028-RM,Losing Her Mind To Pleasure. Azumi Chino [Uncensored L**ked],https://pic.javct.net/poster/20221202/1645105911.jpg,https://javct.net/v/tppn-028-rm,123,2026-05-04
TPPN-025-RM,"Never-ending Pleasure, Smeared In Cum. Mao Kurata [Uncensored L**ked]",https://pic.javct.net/poster/20221108/1663497848.jpg,https://javct.net/v/tppn-025-rm,121,2026-05-04
