code,title,image_url,page_url,views,date_scraped
FC2PPV-4908563,"[Female Body Sharing Chapter 17] Frustrated fair-skinned petite young wife reappears to satisfy her sexual desire, demands black man again Creampie & ass ejaculation, 2 consecutive SEX in which she takes turns being penetrated Part 1 [Overseas version] Bonus included",https://pic.javct.net/poster/05192026/a6bbcf0508.jpg,https://javct.net/v/fc2ppv-4908563,42,2026-05-28
DAL-010-RM,Fantasy Heisei Beautiful Girl AI MODEL AV DEBUT Kurosaki Hana [Uncensored L**ked],https://pic.javct.net/poster/05192026/e7d543f480.jpg,https://javct.net/v/dal-010-rm,110,2026-05-28
FC2PPV-4908416,I did whatever I wanted behind the scenes to a female college student who was part of the filming staff.,https://pic.javct.net/poster/05192026/fd9104f724.jpg,https://javct.net/v/fc2ppv-4908416,140,2026-05-28
XVSR-299,"Seriously Win! What? If You Win A Winning Match, The Woods Are Far More Vaginal Cum Shot SEX! !",https://pic.javct.net/poster/05192026/9ef2b3bb75.jpg,https://javct.net/v/xvsr-299,140,2026-05-28
PKPD-160,Completely Private Video Blonde K Cup Super Butt Bitch Gal Momono Yume-chan And First Stay Alone,https://pic.javct.net/poster/05192026/f19726a531.jpg,https://javct.net/v/pkpd-160,139,2026-05-28
FC2PPV-4908267,"The new medical graduate's muscular body and attractive face and gestures are so compatible that he penetrates deep into her vagina and says, ""It feels weird...'' and twitches and cums inside her beautiful pink pussy.",https://pic.javct.net/poster/05192026/48b7701fa6.jpg,https://javct.net/v/fc2ppv-4908267,54,2026-05-28
MUM-252-RM,De Chested Suspenders. Mayu A + [Uncensored L**ked],https://pic.javct.net/poster/05192026/541112e2b1.jpg,https://javct.net/v/mum-252-rm,190,2026-05-28
MIGD-620,"The Last Deep Throating, South Riona Morphism Throat",https://pic.javct.net/poster/05192026/55a728b471.jpg,https://javct.net/v/migd-620,170,2026-05-28
MIDD-949,Big-breasted slut female teacher Wakaba Onoue,https://pic.javct.net/poster/05192026/0b465b0d17.jpg,https://javct.net/v/midd-949,120,2026-05-28
MIST-434-RM,"Private Pub The Shop Suddenly Closed. A Girl Who Was In Trouble With Money Contacted Me And Said She Wanted To Meet Up With Me... Without Telling The Shop, I Rubbed Her Breasts And Had Creampie Sex. Riho Shirahashi [Uncensored L**ked]",https://pic.javct.net/poster/20241703/1712770368.jpg,https://javct.net/v/mist-434-rm,157,2026-05-28
DLIS-022,"My Girlfriend Was Charged With Aphrodisiacs By A Senior At A Circle Drinking Party, And She Was Fucked ... And She Can Become A Nympho Woman ... Hikaru Konno",https://pic.javct.net/poster/05192026/7a171c3016.jpg,https://javct.net/v/dlis-022,123,2026-05-28
MIST-435-RM,Soapland 52 Where You Can Make A C**ld Directly On A Dangerous Day Sumire Kuramoto [Uncensored L**ked],https://pic.javct.net/poster/20241804/1715275362.jpg,https://javct.net/v/mist-435-rm,159,2026-05-28
PKGP-001-RM,"Completely Private Footage The SSS Beautiful Girl Who Wants Her Girlfriend, Asuka Momose, Stays Alone For The First Time [Uncensored L**ked]",https://pic.javct.net/poster/20230207/1689391881.jpg,https://javct.net/v/pkgp-001-rm,130,2026-05-28
SCOP-814-RM,"When I Transferred To A Countryside School, All Of My Classmates Are Girls. ? My Dream Sex Life With A Country Girl Who Hangs Out After School At My House, Who Has A Nickname Of ""Tokyo Dick"" And Has No Entertainment Other Than Sex [Uncensored L**ked]",https://pic.javct.net/poster/20230207/1688788803.jpg,https://javct.net/v/scop-814-rm,155,2026-05-28
XVSR-192-RM,Deep And Rich Sex Real Sex With Anne Mizora [Uncensored L**ked],https://pic.javct.net/poster/20220707/1657420588.jpg,https://javct.net/v/xvsr-192-rm,125,2026-05-28
T28-401-RM,Looking You All The Way To Go.Best Berofera Us To The 14 People Of Beautiful Women In Various Places! [Uncensored L**ked],https://pic.javct.net/poster/06032026/1774696808.jpg,https://javct.net/v/t28-401-rm,120,2026-05-28
TGYM-001-RM,Unscrupulous Personal Trainer Obscene Muscle Training Road To Little Macho Yuka Ichii [Uncensored L**ked],https://pic.javct.net/poster/20230207/1689131582.jpg,https://javct.net/v/tgym-001-rm,123,2026-05-28
ABW-113-RM,Ultimate Boobs Breasts SP Ultimate Boyne Sex Treasure Boobs Specialized AV [Uncensored L**ked],https://static.javct.net/poster/abw-113.jpg,https://javct.net/v/abw-113-rm,195,2026-05-28
REXD-482-RM,My Girlfriend Who Was Made A Toy... A Falling Woman Mitsuki Nagisa [Uncensored L**ked],https://pic.javct.net/poster/20230804/1692333269.jpg,https://javct.net/v/rexd-482-rm,120,2026-05-28
STARS-023-RM,Mihiro Iiyi Tongue Tangled With The Lip Of 18 Years Old Velongu Esthetic Esthetic Sex [Uncensored L**ked],https://pic.javct.net/poster/20243105/1719524586.jpg,https://javct.net/v/stars-023-rm,135,2026-05-28
NMCH-015-RM,"Former National Team強化指定選手 (strengthened Training Squad Member) With An 8-head-tall Slender Body - When You Put It In, Her Masochistic Side Explodes, And Her Tsundere Personality Explodes - Serina, New Serina [Uncensored L**ked]",https://pic.javct.net/poster/05192026/fefbd35999.jpg,https://javct.net/v/nmch-015-rm,90,2026-05-28
WANZ-292-RM,Anal Gaping Full View SEX Yuki Eyebrows [Uncensored L**ked],https://pic.javct.net/poster/05192026/175a9c6e4f.jpg,https://javct.net/v/wanz-292-rm,150,2026-05-28
DAL-010,Fantasy Heisei Beautiful Girl AI MODEL AV DEBUT Kurosaki Hana,https://pic.javct.net/poster/05192026/e7d543f480.jpg,https://javct.net/v/dal-010,110,2026-05-28
FC2PPV-4596321,"[Part 1] Beautiful maid whose voice and gestures are too cute 5. She exposes her panties in a purikura photo booth and takes a commemorative photo ♥ Enjoy the deep tongue while massaging her plump, immature breasts",https://pic.javct.net/poster/05192026/ca8161d0ed.jpg,https://javct.net/v/fc2ppv-4596321,12,2026-05-28
