code,title,image_url,page_url,views,date_scraped
MCSR-104-RM,Yuna Saki Star 32 Travel Affair Married Woman Pies [Uncensored L**ked],https://pic.javct.net/poster/04112026/b1d3124161.jpg,https://javct.net/v/mcsr-104-rm,120,2026-05-16
300MIUM-1080-RM,"[How to welcome the Minato-ku ceremony's first night] Thinking it was the chance of her life, she seizes a seat with Minato-ku's uncle.It is normal for such a woman to be nourished by Sokko.So, has her Minato-ku dream come true?[A woman who wants to bully] [Uncensored L**ked]",https://pic.javct.net/poster/04112026/833eca9e36.jpg,https://javct.net/v/300mium-1080-rm,98,2026-05-16
FC2PPV-4901241,[First shot/Individual shooting] Still mature./Long/Medium big breasts G cup./Role/JD❣Idol-class beauty with a tall body and well-defined body♡A huge amount of creampie deep inside the vagina with raw dick inserted into the super sensitive and tight pussy♡[Bonus: High resolution] [Main story/No face],https://pic.javct.net/poster/04112026/14effd18a8.jpg,https://javct.net/v/fc2ppv-4901241,72,2026-05-16
WLT-001-RM,Premature Ejaculation G Chichitsuma Long Silence Oma ● This Stop Playing Cat And Mouse Is Adultery Mihara Honoka [Uncensored L**ked],https://pic.javct.net/poster/04112026/4ebd6e6fee.jpg,https://javct.net/v/wlt-001-rm,67,2026-05-16
ONED-321-RM,Nao Hazuki Sex Big Nasty Barely Soil Of Beauty [Uncensored L**ked],https://pic.javct.net/poster/04112026/d2281e18cf.jpg,https://javct.net/v/oned-321-rm,120,2026-05-16
MCSR-111-RM,Erika Kitagawa 34 Travel Affair Married Woman Cum [Uncensored L**ked],https://pic.javct.net/poster/04112026/185e2999d9.jpg,https://javct.net/v/mcsr-111-rm,120,2026-05-16
MCSR-109-RM,How Many Wives' Pussies Can I Fill With My Cum? 33 Ruri Saijo [Uncensored L**ked],https://pic.javct.net/poster/20220707/1660135959.jpg,https://javct.net/v/mcsr-109-rm,120,2026-05-16
BBTU-039-RM,Paikoki Big Breasts Without Hell Minami Momo [Uncensored L**ked],https://pic.javct.net/poster/20220406/1655528951.jpg,https://javct.net/v/bbtu-039-rm,123,2026-05-16
NNPJ-312-RM,"One Male Popular Idol Group Wisdom, Nagoya's 'God Kakitare' History's Strongest Slender Gcup Gravure Idol · My-chan Ikemen Pampering With Nanpa And Sending The Days Of SEX And Deciding On AV Appearance 31 Days Closely. Nampa Japan EXPRESS Vol.88 [Uncensored L**ked]",https://pic.javct.net/poster/04112026/5c3701431f.jpg,https://javct.net/v/nnpj-312-rm,180,2026-05-16
KSBJ-008-RM,Wife Naked Natsuko Kayama [Uncensored L**ked],https://pic.javct.net/poster/06032026/1773544225.jpg,https://javct.net/v/ksbj-008-rm,127,2026-05-16
336TNB-011-RM,"[Celebrity wife's abnormal sexual desire] I'm thinking of letting my daughter study abroad again. We want to master what we love A high-class wife with a beautiful, beautiful woman shakes her huge breasts and cums and a wealthy couple with a wealthy couple A super crazy porn video released by TNB 11th person [Uncensored L**ked]",https://pic.javct.net/poster/20253001/1739455938.jpg,https://javct.net/v/336tnb-011-rm,76,2026-05-16
HONB-310-RM,Hidden Busty Student 01 Sumire [Uncensored L**ked],https://pic.javct.net/poster/20230804/1691818037.jpg,https://javct.net/v/honb-310-rm,65,2026-05-16
300MIUM-1075-RM,"[Pampered voice, tongue technique, and sensual sensation] Even though she lives a confident life, her eyes tear up when she orgasms, and in order to build a network, she does her best to be obedient and climax, giving her the highest level of blowjob technique in history. [Uncensored L**ked]",https://pic.javct.net/poster/20241902/1710216801.jpg,https://javct.net/v/300mium-1075-rm,104,2026-05-16
GDRD-028-RM,Red Dragon Asami Nagase [Uncensored L**ked],https://pic.javct.net/poster/20243105/1720236134.jpg,https://javct.net/v/gdrd-028-rm,148,2026-05-16
OFKU-216-RM,Chubby Mother Satisfied Diary Miyu Hirosue [Uncensored L**ked],https://pic.javct.net/poster/20230804/1692933907.jpg,https://javct.net/v/ofku-216-rm,130,2026-05-16
336TNB-015-RM,"[Big breasts and big ass young wife] A wife with a cute face appears, and this forbidden couple, who are her husband's former student, has a perverted fetish that surpasses ordinary people lol She is at the mercy of her wife from start to finish lol TNB 15th person [Uncensored L**ked]",https://pic.javct.net/poster/20253001/1739450383.jpg,https://javct.net/v/336tnb-015-rm,94,2026-05-16
NGOD-232-RM,"Married Woman Pregnancy Affair Record: A Wife Addicted To The Pleasure Of Having An Affair With A Big-cocked Student. I Want To Pour My Sperm Into Your Frustrated, Greedy Womb Instead Of Your Husband's And Make You Pregnant. Hibiki Otsuki [Uncensored L**ked]",https://pic.javct.net/poster/20240410/1731037081.jpg,https://javct.net/v/ngod-232-rm,120,2026-05-16
NHDTB-804-RM,Climax Management Remote Bike NTR Son's Daughter-in-law Manipulated By Remote Stimulation Enough To Incontinence By Father-in-law [Uncensored L**ked],https://pic.javct.net/poster/20230804/1691639319.jpg,https://javct.net/v/nhdtb-804-rm,220,2026-05-16
KSBJ-007-RM,Wife Naked Rena Fukiishi [Uncensored L**ked],https://pic.javct.net/poster/20242108/1725835387.jpg,https://javct.net/v/ksbj-007-rm,113,2026-05-16
URKK-078-RM,My Boobs Are Rubbed By The Perverted Landlord Next Door And I Get R**ed Every Day Mio Fujiko [Uncensored L**ked],https://pic.javct.net/poster/20230302/1678508062.jpg,https://javct.net/v/urkk-078-rm,140,2026-05-16
HALT-033-RM,Kamihada Icharab Experience With An Active Nursery Teacher [Uncensored L**ked],https://pic.javct.net/poster/20230804/1691818286.jpg,https://javct.net/v/halt-033-rm,119,2026-05-16
NINE-077-RM,"A J-Cup Married Woman With Colossal Breasts With Super A5 Rank Superb Meat Born Sexless. Kyoko (36 Years Old) Is A Libido Monster Mature Woman Who Fucks Not Only Other Men, But Also Her Brother [Uncensored L**ked]",https://pic.javct.net/poster/20230804/1691817603.jpg,https://javct.net/v/nine-077-rm,100,2026-05-16
PKPD-081-RM,Completely Private Video F Cup Healing Sister Minami Kurisu And Staying Alone For The First Time Minami Kurisu [Uncensored L**ked],https://pic.javct.net/poster/01202026/1772592072.jpg,https://javct.net/v/pkpd-081-rm,140,2026-05-16
ABF-341-RM,Sweet Sad Nipple Slut Kawai Asuna [Uncensored L**ked],https://pic.javct.net/poster/04112026/1776304990.jpg,https://javct.net/v/abf-341-rm,125,2026-05-16
