code,title,image_url,page_url,views,date_scraped
451HHH-014,"[Crazy erotic terrorist] [G-breasted glamorous BODY] [Creampie in a lustful pussy] A pleasure fundamentalist with a bottomless sexual desire, stop & go, continuous orgasm, peach butt thrusting, huge tits shaking and cumming: Ura Talk Talk.07",https://pic.javct.net/poster/06032026/1774502736203.jpg,https://javct.net/v/451hhh-014,96,2026-03-26
812MMC-015,[I can't live without masturbation] The reason the women's restroom is crowded is because everyone masturbates in the restroom #Married woman #Doctor's wife #Deep throat #Squirting #Doctor's wife #Tokyo Wakazuma weather vol.015,https://pic.javct.net/poster/06032026/1774502206902.jpg,https://javct.net/v/812mmc-015,89,2026-03-26
SOE-514-RM,Hana Haruna Ban Esuwan Active Idle × K Cup [Uncensored L**ked],https://pic.javct.net/poster/06032026/1774489849.jpg,https://javct.net/v/soe-514-rm,240,2026-03-26
200GANA-3350-RM,"I came to see you because I was horny. A busty gal with explosive sexual desire is cumming all the time. In the sex room of a seasoned pick-up artist, we secretly filmed her having sex 433 [Uncensored L**ked]",https://pic.javct.net/poster/06032026/1774333588812.jpg,https://javct.net/v/200gana-3350-rm,59,2026-03-26
XRW-572-RM,Big Tits Service Maid!Husband 's Fever - Boobs Boobs Boobs 7 Semen Out!Rin Hayama [Uncensored L**ked],https://pic.javct.net/poster/06032026/1774489200.jpg,https://javct.net/v/xrw-572-rm,141,2026-03-26
CEMD-821-RM,"I Felt So Much I Wet Myself, Sorry... 54 Kitamura Kaito [Uncensored L**ked]",https://pic.javct.net/poster/06032026/1774416290.jpg,https://javct.net/v/cemd-821-rm,130,2026-03-26
STAR-912-RM,East-West North-South!Circumference Around The Circle Wrapped In A Circle Omni-directional Woman's Ejaculation Successive Ejaculation Semen Sex!Total Of 13 Kiritani Festival [Uncensored L**ked],https://pic.javct.net/poster/06032026/1774489372.jpg,https://javct.net/v/star-912-rm,140,2026-03-26
NNPJ-302-RM,"Taking Off The Signboarder Working At A Popular Pub Is A Rocket Beauty Big Tits G Cup! It Was A Gentle Girl Who Asked Me For Any Wishes, So I Made It Cum Shot AV As It Is! Nampa Japan EXPRESS Vol. 80 [Uncensored L**ked]",https://pic.javct.net/poster/20250606/1750031032.jpg,https://javct.net/v/nnpj-302-rm,180,2026-03-26
MFCS-202-RM,[A beautiful woman with G breasts will listen to anything she says in order to become his favorite] A scumbag man takes advantage of his goodwill and does whatever he wants to his spoiled girlfriend [Amachua Hame REC #Aya #Shop Clerk] [Uncensored L**ked],https://pic.javct.net/poster/06032026/1774333725664.jpg,https://javct.net/v/mfcs-202-rm,68,2026-03-26
CEMD-824-RM,Big-breasted Married Woman Rope Affair - Violated By Her Husband's Subordinate - Ogura Hikari [Uncensored L**ked],https://pic.javct.net/poster/06032026/1774323380.jpg,https://javct.net/v/cemd-824-rm,137,2026-03-26
FSDSS-348-RM,Squirting And Sexual Intercourse Retirement Until It Burns Out Minamo Nagase [Uncensored L**ked],https://pic.javct.net/poster/20212011/1639941593.jpg,https://javct.net/v/fsdss-348-rm,115,2026-03-26
BONU-045-RM,"The Amazing Ass Punishment Of A Big-assed Wife Experienced On An M-only Dating Site, Yuri Honma [Uncensored L**ked]",https://pic.javct.net/poster/06032026/1774323443.jpg,https://javct.net/v/bonu-045-rm,120,2026-03-26
APAK-327-RM,"Creampie Innocent Super Fleshy G Cup Lewd Masochist Yuuka ""I Want To Cum! Please Make Me Horny!"" The Pent Up Carnal Desires Of This Sulky Girl Run Wild! Natural Pubic Hair! Deep Throat! Breast Shaking And Trembling Orgasmic SEX! Lewd Climax Student Guidance Chiba Yuuka [Uncensored L**ked]",https://pic.javct.net/poster/06032026/1774416548.jpg,https://javct.net/v/apak-327-rm,141,2026-03-26
SDAM-016-RM,Couple Exchange!One Thin Cover!I Am Suspicious Of The Obscene Sound Coming From The Next Door!The Fire Is On And W Affair [Uncensored L**ked],https://pic.javct.net/poster/06032026/1774489555.jpg,https://javct.net/v/sdam-016-rm,190,2026-03-26
JUY-283-RM,My Son's Colossal Tits Private Tutor Is Luring Us To Temptation With Her Hot And Horny Body Hana Haruna [Uncensored L**ked],https://pic.javct.net/poster/20212011/1640756406.jpg,https://javct.net/v/juy-283-rm,120,2026-03-26
MTALL-092-RM,[4K Shooting] Hcup Nipple Development Portio Beyond Nipple Acme Waka Misono [Uncensored L**ked],https://pic.javct.net/poster/20231011/1698898061.jpg,https://javct.net/v/mtall-092-rm,131,2026-03-26
SSNI-579-RM,Busty Married Woman Who Can't Resist Pressure and The Erotic Massage Therapist Okuda Saki [Uncensored L**ked],https://pic.javct.net/poster/06032026/1774489432.jpg,https://javct.net/v/ssni-579-rm,150,2026-03-26
SQTE-504-RM,The Girl I Met On My Heartbreak Trip Is Too Cute And Too Naughty Kasumi Tsukino [Uncensored L**ked],https://pic.javct.net/poster/20231011/1699069195.jpg,https://javct.net/v/sqte-504-rm,154,2026-03-26
ANB-227-RM,"Can't Stand The Voluptuous Body Of My Beautiful And Naughty Aunt, Izumi Sakuma [Uncensored L**ked]",https://pic.javct.net/poster/20231011/1699070138.jpg,https://javct.net/v/anb-227-rm,110,2026-03-26
XVSR-103-RM,An Erotic Novel My Son's Lover - A Lady - Mami Nagase [Uncensored L**ked],https://pic.javct.net/poster/20220406/1657148931.jpg,https://javct.net/v/xvsr-103-rm,124,2026-03-26
XRW-573-RM,Breasts 100%!Nonstop!Sprinkle With Ten Bumps Of Bukkake To Tits Sensitive To Aphrodisiacs! Maki Takarada [Uncensored L**ked],https://pic.javct.net/poster/06032026/1774489138.jpg,https://javct.net/v/xrw-573-rm,134,2026-03-26
HODV-21482-RM,Hotel Shared Room Brought In By A Female Boss Reverse NTR Maria Nagai Made Many Times During The Pursuit [Uncensored L**ked],https://pic.javct.net/poster/10232025/1761453165.jpg,https://javct.net/v/hodv-21482-rm,132,2026-03-26
CEMD-214-RM,Tears Non-stop Super Squid SEX 20 Otsu Alice [Uncensored L**ked],https://pic.javct.net/poster/20220707/1659763190.jpg,https://javct.net/v/cemd-214-rm,126,2026-03-26
HMPD-10034-RM,Dimensions Stop Slut Naive Passive Actress Of Transformation Awakening Document Izumi Imamiya [Uncensored L**ked],https://pic.javct.net/poster/06032026/1774493357.jpg,https://javct.net/v/hmpd-10034-rm,148,2026-03-26
