code,title,image_url,page_url,views,date_scraped
MILK-291-RM,"A Single Mother Obsessed With Male Hosts, A Submissive, Spoiled Girl. A Deluded Masochistic Woman Who Thinks She's In Control. Yuika Onosaka [Uncensored L**ked]",https://pic.javct.net/poster/05192026/f6afaa371f.jpg,https://javct.net/v/milk-291-rm,127,2026-05-21
FC2PPV-4904280,"[Uncensored/Complete amateur/Creampie/Squirting] Natural G cup x slender girl with long black hair and erotic body Big ass pile driving piston & best cowgirl position, tight pussy for 3 consecutive raw creampies for the first time in her life",https://pic.javct.net/poster/05192026/73cfe209de.jpg,https://javct.net/v/fc2ppv-4904280,20,2026-05-21
ABF-354,Creampie hot spring inn - All you want with the finest skyscr**er body - Shizukuha Takimoto,https://pic.javct.net/poster/05192026/eacd01f2b9.jpg,https://javct.net/v/abf-354,115,2026-05-21
MUDR-364-RM,"A Schoolgirl Trying To Act Grown-up Sneaks Out Of Her School Trip For A Passionate Kissing Date With A Man The Age Of Her Father. They Then Lock Themselves In A Hotel And Have Sex Again And Again, Experiencing Adulthood Through Unprotected Intercourse. - Yuno Sakura [Uncensored L**ked]",https://pic.javct.net/poster/04112026/1776536462.jpg,https://javct.net/v/mudr-364-rm,170,2026-05-21
REBD-1034,Miharu9 Forbidden Eden・Miharu Hazaki,https://pic.javct.net/poster/05192026/3fee450765.jpg,https://javct.net/v/rebd-1034,73,2026-05-21
MILK-290,Infiltration! Off-camera Sex Photoshoot! Instant Sex OK If You're A Dedicated Fan! Busty Model Mirai Sena,https://pic.javct.net/poster/05192026/fe138e7d73.jpg,https://javct.net/v/milk-290,119,2026-05-21
REBD-1037,Mio Naturally-Uncut Scenes-・Mio Sakai,https://pic.javct.net/poster/05192026/ae6e8c95ee.jpg,https://javct.net/v/rebd-1037,122,2026-05-21
MIAE-117,M Men's Continuous Ejaculation Cure Spring Massage Salon Honda Cape,https://pic.javct.net/poster/05192026/c4e237e317.jpg,https://javct.net/v/miae-117,150,2026-05-21
FC2PPV-4879704,"While taking a picture of a very beautiful big-breasted married woman, I filmed her and creampied her [Super Value Pack]",https://pic.javct.net/poster/05192026/977e44d923.jpg,https://javct.net/v/fc2ppv-4879704,99,2026-05-21
HTHD-240,"True Friend's Mother, Momose Jogasaki",https://pic.javct.net/poster/05192026/35502d3bd4.jpg,https://javct.net/v/hthd-240,110,2026-05-21
SON-147,Transformation Tall Busty Woman Dziga Take Post SEX Video Kondo Chirico,https://pic.javct.net/poster/05192026/28498d8319.jpg,https://javct.net/v/son-147,140,2026-05-21
KSBJ-257-RM,A Horny Wife Reiko Iwai Revenges Her Frustration With A Housekeeper For Cheating On Her [Uncensored L**ked],https://pic.javct.net/poster/20230207/1690602596.jpg,https://javct.net/v/ksbj-257-rm,120,2026-05-21
JJDA-038-RM,My Father's Remarriage Partner Who Can't Stand Her Busty Swaying Under One Roof...Hana Haruna [Uncensored L**ked],https://pic.javct.net/poster/20230207/1690519142.jpg,https://javct.net/v/jjda-038-rm,120,2026-05-21
IZM-018-RM,An Amateur Girl Who Wants To Be Bullied Nakata's Creampie Pharmacist Monami 25 Years Old Penis Love Bicho Mando M Meat Urinal 95cm H Cup Sensitive Erotic Nipple Pharmacist A Woman Who Gives A Blowjob With A Seriously Cock-loving Face Monami Onizuka [Uncensored L**ked],https://pic.javct.net/poster/20230804/1691207186.jpg,https://javct.net/v/izm-018-rm,140,2026-05-21
LUKE-025-RM,Slut Older Sister Miki Shiraishi Who Seduces With Dirty Talk While Adhering [Uncensored L**ked],https://pic.javct.net/poster/20230207/1690602336.jpg,https://javct.net/v/luke-025-rm,110,2026-05-21
PIYO-233-RM,"The Pregnant Bookstore ~The Timid, Bespectacled Girls Browsing In This Run-down Bookstore Are Irresistibly Impregnated~ [Uncensored L**ked]",https://pic.javct.net/poster/04112026/1776536274.jpg,https://javct.net/v/piyo-233-rm,160,2026-05-21
GVG-790-RM,Scepe Wife Who Provokes In Nobler No Pan Moved To The Neighbor! Ren Mi Clare [Uncensored L**ked],https://pic.javct.net/poster/05192026/3499e120b8.jpg,https://javct.net/v/gvg-790-rm,120,2026-05-21
BBTU-046-RM,Men'S Puscher  Big Breasts Breasted Tanaka Ne [Uncensored L**ked],https://pic.javct.net/poster/20222109/1665812440.jpg,https://javct.net/v/bbtu-046-rm,97,2026-05-21
MILK-290-RM,Infiltration! Off-camera Sex Photoshoot! Instant Sex OK If You're A Dedicated Fan! Busty Model Mirai Sena [Uncensored L**ked],https://pic.javct.net/poster/05192026/fe138e7d73.jpg,https://javct.net/v/milk-290-rm,119,2026-05-21
FVMD-011-RM,MISSION Kiss Dirty Talk Technician Momonaga Sarina Reveals The Propensities Of 3 Fans And Manages The Ejaculation Of An Extremely Masochistic Man [Uncensored L**ked],https://pic.javct.net/poster/20230804/1691753094.jpg,https://javct.net/v/fvmd-011-rm,131,2026-05-21
AKDL-019-RM,Gonzo video saved on a part-time colleague's smartphone Cafe clerk Azusa 20 years old Azusa Misaki [Uncensored L**ked],https://pic.javct.net/poster/06032026/1774421025.jpg,https://javct.net/v/akdl-019-rm,114,2026-05-21
SOAV-096-RM,Married Woman's Cheating Heart Mizuki Yayoi [Uncensored L**ked],https://pic.javct.net/poster/20222612/1672460389.jpg,https://javct.net/v/soav-096-rm,136,2026-05-21
RTP-092-RM,"Woman In Love With A Younger Brother!?Or With Icha And His Brother On Purpose In Front Of Such A Girlfriend, Try Spoiled But Not Me At All Aware Of My Feelings ... Crying Tsu Thing That, To The Night Crawling Dive To The Futon And Once You Do If Much Be Taken To That Woman Mitara ... [Uncensored L**ked]",https://pic.javct.net/poster/05192026/44cc441f76.jpg,https://javct.net/v/rtp-092-rm,125,2026-05-21
NKKD-293-RM,Drive Recorder NTR29 In-vehicle Camera Was Watching The Whole Story Of The Netorare [Uncensored L**ked],https://pic.javct.net/poster/20230207/1691127327.jpg,https://javct.net/v/nkkd-293-rm,170,2026-05-21
