code,title,image_url,page_url,views,date_scraped
CHN-190-RM,I'll Lend You A New Amateur Girl. 91 Kana) Yuka Yuzuki (care Worker) 23 Years Old. [Uncensored L**ked],https://pic.javct.net/poster/20243105/1719699793.jpg,https://javct.net/v/chn-190-rm,135,2026-04-26
PPSD-029-RM,3 Hours And 30 Minutes Gently Special Class Pies OPPAI Female Teacher [Uncensored L**ked],https://pic.javct.net/poster/04112026/ce091e1269.jpg,https://javct.net/v/ppsd-029-rm,210,2026-04-26
MIDD-851-RM,Niiyama Maple Body Will Want A Man [Uncensored L**ked],https://pic.javct.net/poster/01202026/1772184068.jpg,https://javct.net/v/midd-851-rm,120,2026-04-26
STAR-952-RM,Super Close Contact! Innocence Innocence Ichaicha Squirrel Oil Massage Salon Kiritani Festival [Uncensored L**ked],https://pic.javct.net/poster/20250606/1751846069.jpg,https://javct.net/v/star-952-rm,125,2026-04-26
XVSR-213-RM,Realistic Sex Kanno Of Ko Sex Sayo Kanno Sayo [Uncensored L**ked],https://pic.javct.net/poster/06032026/1774504247.jpg,https://javct.net/v/xvsr-213-rm,120,2026-04-26
FC2PPV-4884700-RM,[Gachi Video] “Former Idol Popular Youngest Member” Forbidden FC2 Debut Gonzo Video Released *Prices will increase sequentially [Uncensored L**ked],https://pic.javct.net/poster/04112026/1776755553.jpg,https://javct.net/v/fc2ppv-4884700-rm,48,2026-04-26
FC2PPV-4881902-RM,A beautiful wife who works at the same luxury hotel as her husband has stress-relieving creampie sex [Uncensored L**ked],https://pic.javct.net/poster/04112026/1776487997.jpg,https://javct.net/v/fc2ppv-4881902-rm,52,2026-04-26
FC2PPV-4881773-RM,[Exclusive release] “New voice actor debuting in 2026 with 100% purity” Extreme photo session Massive creampie inside super bristly vagina * Only a few left [Uncensored L**ked],https://pic.javct.net/poster/04112026/1776405646.jpg,https://javct.net/v/fc2ppv-4881773-rm,41,2026-04-26
FC2PPV-4880661-RM,[Face exposed] “18-year-old SSS-class idol candidate who passed the audition 1st place” Extremely expensive and dangerous daytime creampie shooting *Prices will increase gradually [Uncensored L**ked],https://pic.javct.net/poster/04112026/1776148755.jpg,https://javct.net/v/fc2ppv-4880661-rm,28,2026-04-26
REAL-570-RM,Demon Capitalize Hatano Yui [Uncensored L**ked],https://pic.javct.net/poster/06032026/1775800736.jpg,https://javct.net/v/real-570-rm,150,2026-04-26
AVSA-237-RM,SUPER FISHEYE FETISHISM Powerful Excitement Nectar Erotic Cosplay Flesh Feeling BODY Soka Minamihata [Uncensored L**ked],https://pic.javct.net/poster/20230302/1678509544.jpg,https://javct.net/v/avsa-237-rm,130,2026-04-26
ABP-170,"One Night The 2nd, Beautiful Girl By Appointment. Sato Airi Second Chapter",https://pic.javct.net/poster/04112026/d4d8235bb2.jpg,https://javct.net/v/abp-170,120,2026-04-26
ABP-160,Life's First Deep-trance Alive Climax Sex Hoshino Chisa,https://pic.javct.net/poster/04112026/35c9834c2a.jpg,https://javct.net/v/abp-160,155,2026-04-26
GNS-149,Unreleased Footage Reveals 19 People Involved In A Habitual Sexual Assault Case In A Gym Locker Room.,https://pic.javct.net/poster/04112026/c5482c247c.jpg,https://javct.net/v/gns-149,270,2026-04-26
BBSS-103,"Misaki Kanna, A Lesbian Beauty Who Captivates Even Straight Men With Her Dangerously Erotic Face And Lewd Techniques, PREMIUM LESBIAN BEST 4 Hours",https://pic.javct.net/poster/04112026/e99b0832b6.jpg,https://javct.net/v/bbss-103,240,2026-04-26
CEMD-836-RM,"""Hey, Ordinary Men! Make Me Cum Like Crazy!"" ~A Sex Documentary About A Woman Who Gets Off Like Crazy By An Ordinary Man She Found On The Street~ 15 Yui Hatano [Uncensored L**ked]",https://pic.javct.net/poster/04112026/1777054519.jpg,https://javct.net/v/cemd-836-rm,150,2026-04-26
REAL-985-RM,"Busty, Gal-type Girl Who Mocks Nerdy Guys Falls Into A Pleasure-induced Trance... To Vent Her Pent-up Frustrations, She Has Her Fully Developed Breasts Forcibly Kneaded, And When Her Unusually Sensitive Nipples Are Discovered, The Tables Are Turned And She Succumbs To Pleasure. [Uncensored L**ked]",https://pic.javct.net/poster/04112026/1777054307.jpg,https://javct.net/v/real-985-rm,150,2026-04-26
REAL-982-RM,Betrayal And Pregnancy Date ~A Naive Cafe Employee's Special Day Is Ruthlessly Filled With Cummings And Turned Into A Shit Mixed With Semen~ Yuno Sakura [Uncensored L**ked],https://pic.javct.net/poster/04112026/1777049618.jpg,https://javct.net/v/real-982-rm,125,2026-04-26
EKDV-814-RM,"My Virginity Was Taken By My C**ldhood Friend... My Fair-skinned, Big-breasted, Caring C**ldhood Friend, Ruka Itoi, Became My Sex Practice Partner When I Got My First Girlfriend. [Uncensored L**ked]",https://pic.javct.net/poster/04112026/1777048182.jpg,https://javct.net/v/ekdv-814-rm,150,2026-04-26
MKMP-720-RM,Busty Young Wives Who Aren't Satisfied With Their Husbands' Dicks Tame Men In An Endless Ejaculation Party. [Uncensored L**ked],https://pic.javct.net/poster/04112026/1777047980.jpg,https://javct.net/v/mkmp-720-rm,145,2026-04-26
JUR-296-SUB,"Close-up Molestation By The Window. I Was Toyed With All Over My Body During My Commute, And I Was Brought To Pleasure. Today, I Am Offering My Body Again. This Video Also Includes A Molestation Angle That Simultaneously Unfolds Multiple Close-ups In Pursuit Of Realism! Yumi Kazama [English Subtitle]",https://pic.javct.net/poster/20250903/1743698418.jpg,https://javct.net/v/jur-296-sub,130,2026-04-26
ROYD-307-RM,"[Cause Of Defeat: Intense Uterine Knocking] I Repeatedly Teased And Stimulated The Self-proclaimed Frigid Sugar Baby's Pussy Until She Came And Squirted, And Then She Fell For Me. - Misao Oguri [Uncensored L**ked]",https://pic.javct.net/poster/04112026/1776967845.jpg,https://javct.net/v/royd-307-rm,130,2026-04-26
ROE-496-RM,"MONROE's Oldest And Top-class Actress In Her Late 50s, Kaoru **do, Makes Her AV Debut At 56 Years Old, Showcasing A Mature Allure That Youth Can't Replicate. [Uncensored L**ked]",https://pic.javct.net/poster/04112026/1776962821.jpg,https://javct.net/v/roe-496-rm,160,2026-04-26
ROE-479-RM,"I Became Addicted To Intense, Convulsive, Arching-back Sex With My Beloved Daughter's Boyfriend. - Yurika Aoi [Uncensored L**ked]",https://pic.javct.net/poster/04112026/1776962950.jpg,https://javct.net/v/roe-479-rm,150,2026-04-26
