code,title,image_url,page_url,views,date_scraped
FC2PPV-4871448,Latest work: I had fun in Shinjuku with a cute hairdresser with very big breasts (no),https://pic.javct.net/poster/06032026/1774942626.jpg,https://javct.net/v/fc2ppv-4871448,42,2026-03-31
SAN-437,The Story Of A Woman Whose Marriage Collapsed And Whose Life Went Haywire - Part 2 / Yu Kawakami,https://pic.javct.net/poster/06032026/1774926009.jpg,https://javct.net/v/san-437,125,2026-03-31
VGD-170,To Obscene Madonna Sawamura Reiko Journey,https://pic.javct.net/poster/06032026/1774951129.jpg,https://javct.net/v/vgd-170,140,2026-03-31
XVSR-113-RM,Super! !Rebirth Exploding Breasts Capitalize Deviation 150 Barrage Nagase Asami [Uncensored L**ked],https://pic.javct.net/poster/06032026/1774922079.jpg,https://javct.net/v/xvsr-113-rm,240,2026-03-31
SKMJ-734-RM,Congratulations! Graduation! 30 Innocent Female Students With Almost No Experience With Men In One Class - First-Time Creampie Sex Footage Released 300 Minutes Special [Uncensored L**ked],https://pic.javct.net/poster/06032026/1774548359.jpg,https://javct.net/v/skmj-734-rm,300,2026-03-31
MAAN-1159-RM,"[This woman will do anything for her job] An unlucky model who is about to get fired, a big-breasted slim beauty who cannot resist the pressure of a manet, becomes a delivery health girl. Wanting a big project, she turns around with a handsome man in power. Case.10_Sakura (24) [Uncensored L**ked]",https://pic.javct.net/poster/06032026/1774588459765.jpg,https://javct.net/v/maan-1159-rm,68,2026-03-31
HWS-003,2016 Halloween Nampa Extravaganza! 1 Person,https://pic.javct.net/poster/06032026/1774942901.jpg,https://javct.net/v/hws-003,120,2026-03-31
GVG-753-SUB,Stepmother And Offspring Natsuko Kayama [English Subtitle],https://pic.javct.net/poster/20220707/1658224274.jpg,https://javct.net/v/gvg-753-sub,122,2026-03-31
200GANA-3317-RM,"[Panties interview] Mysterious girl who is too happy even though she just got a boyfriend. She is a college girl who is too happy, and the conversation went in a strange direction lol. Seriously soft, first shoot 2274 [Uncensored L**ked]",https://pic.javct.net/poster/06032026/1774691272515.jpg,https://javct.net/v/200gana-3317-rm,69,2026-03-31
FC2PPV-4871698,#Big breasts #SNS #Amateur #Handjob #Adult relationship #Discount #Part-time job #Bukkake,https://pic.javct.net/poster/06032026/1774942213.jpg,https://javct.net/v/fc2ppv-4871698,24,2026-03-31
FC2PPV-4871788,"[Individual shot] **pyjpx*jsps 19 year old H cup caregiver gives blowjob, squirts tongue, licks anus, shaved vagina and jerks raw cock [Full face exposed]",https://pic.javct.net/poster/06032026/1774941966.jpg,https://javct.net/v/fc2ppv-4871788,35,2026-03-31
MARA-004-RM,Seven Herbs Chitose Tits Theater Jcup!110cm [Uncensored L**ked],https://pic.javct.net/poster/06032026/1774922324.jpg,https://javct.net/v/mara-004-rm,164,2026-03-31
10-033126-01,Pussy tug of war : Ai Nakano,https://pic.javct.net/poster/06032026/1774942459.jpg,https://javct.net/v/10-033126-01,16,2026-03-31
LOCK-006-RM,"LOCK-ON@Ruka I Was Creampied By A Kind Teacher. A Betrayal Of A Student Who Had Been So Kind To Me, With A Brutal Raw Fuck. Beautiful Girl With Beautiful F-cup Breasts, Ruka Itoi [Uncensored L**ked]",https://pic.javct.net/poster/06032026/1774638127.jpg,https://javct.net/v/lock-006-rm,114,2026-03-31
GRMO-294-RM,"Amateur boy's real SEX 43 NAOTO, 30 years old [Uncensored L**ked]",https://pic.javct.net/poster/06032026/1774757800280.jpg,https://javct.net/v/grmo-294-rm,60,2026-03-31
FNS-186-RM,Beautiful busty wife Goddess Jun who was cuckolded by the perverted old man who lives next door's nipple kneading development [Uncensored L**ked],https://pic.javct.net/poster/06032026/1774842347551.jpg,https://javct.net/v/fns-186-rm,124,2026-03-31
PASN-015-RM,"Slut beauty's reverse naughty immediate sex and creampie Vol.01 - Aggressive slut hunts men in the city and immediately inserts them straight into the hotel, leading to female-led creampie - [Uncensored L**ked]",https://pic.javct.net/poster/06032026/1774690777394.jpg,https://javct.net/v/pasn-015-rm,135,2026-03-31
300MIUM-1211-RM,"[Newcomer] Huh, you're so ""female"" during sex lol. Even though you're usually a healthy girl lol, you're cumming too much and shaving your body too much. I'm worried. [Uncensored L**ked]",https://pic.javct.net/poster/06032026/1774588257671.jpg,https://javct.net/v/300mium-1211-rm,66,2026-03-31
NINE-120-RM,"The Most Obscene A5-ranked Meat In Japan! A Charismatic Busty K-cup Prostitute From An Office Lady Specialty Store, A Private Video Of Her Slutty Behavior Leading To 15 Ejaculations. [Uncensored L**ked]",https://pic.javct.net/poster/06032026/1774637638.jpg,https://javct.net/v/nine-120-rm,121,2026-03-31
WANZ-301,Pies Once The Danger Date Famous Cosplayers Month Off Meeting Mey,https://pic.javct.net/poster/06032026/1774923032.jpg,https://javct.net/v/wanz-301,120,2026-03-31
SUN-100-RM,Uterus Picking Semen Drinking Date With Creampie Cum Swallowing Every Drop From The Upper And Lower Mouth [Uncensored L**ked],https://pic.javct.net/poster/20231011/1697945558.jpg,https://javct.net/v/sun-100-rm,225,2026-03-31
MIST-077-RM,"At ""An Old Traditional Titty Pub"" In The Biggest Entertainment District In Japan, New Girls Will Secretly Fuck Their Customers Raw In Order To Steal Them From The Veteran Girls 02 [Uncensored L**ked]",https://pic.javct.net/poster/06032026/1774922250.jpg,https://javct.net/v/mist-077-rm,160,2026-03-31
MEKO-386-RM,"""Auntie Rental"" Service Returns 110: I Wanted More Amazing Sex With This Sexy, Kind Auntie Who'd Even Let Me Secretly Have Creampie Sex If I Asked, So I Asked Her Again [Uncensored L**ked]",https://pic.javct.net/poster/06032026/1774638004.jpg,https://javct.net/v/meko-386-rm,120,2026-03-31
KNMB-120-RM,[Limited To Actresses Who Like Raw] Raw Raw Raw Raw Raw Raw Documentary: A Fusion Of Idol-level Cuteness And Serious Eroticism - Kasagi Ichika-chan's Case [Uncensored L**ked],https://pic.javct.net/poster/06032026/1774666746.jpg,https://javct.net/v/knmb-120-rm,120,2026-03-31
