code,title,image_url,page_url,views,date_scraped
ONED-383-RM,Nao Hazuki Tit Barely A Discount [Uncensored L**ked],https://pic.javct.net/poster/05192026/81670c3a79.jpg,https://javct.net/v/oned-383-rm,120,2026-05-31
VGD-153-RM,To Obscene Madonna Shinoda History Journey [Uncensored L**ked],https://pic.javct.net/poster/06032026/1774234335.jpg,https://javct.net/v/vgd-153-rm,140,2026-05-31
HMGL-141-RM,Embarrassing Body Nice Miniskirt Dating Tadakawa Misaki [Uncensored L**ked],https://pic.javct.net/poster/06032026/1775211257.jpg,https://javct.net/v/hmgl-141-rm,130,2026-05-31
FOCS-060-RM,Anal Licking! Temptress Maid With A Beautiful Huge Ass Uses Her Asshole To Induce Temptation. Get To Have A Creampie Load After Giving Anal Cunnilingus. Meisa Kawakita [Uncensored L**ked],https://pic.javct.net/poster/20221202/1650012605.jpg,https://javct.net/v/focs-060-rm,124,2026-05-31
CHRV-183-RM,Erotic Experience Reading Aloud Delusion Masturbation! Wet Pussy Wet! My Sister's Huge Breasts Are Worth Seeing! Sailor Uniform Raw Creampie! I Cup 101cm Meimei [Uncensored L**ked],https://pic.javct.net/poster/20230207/1688791665.jpg,https://javct.net/v/chrv-183-rm,150,2026-05-31
BBTU-063-RM,Big Breast Meat Daruma Please Make Me A Sex Processing Toy. Sakura Mita [Uncensored L**ked],https://pic.javct.net/poster/20230207/1689391253.jpg,https://javct.net/v/bbtu-063-rm,107,2026-05-31
AVSA-265-RM,SUPER FISHEYE FETISHISM Powerful Excitement Nectar Erotic Cosplay Sensual BODY Iori Tsukimi [Uncensored L**ked],https://pic.javct.net/poster/20230908/1694233101.jpg,https://javct.net/v/avsa-265-rm,120,2026-05-31
MIST-447-RM,Soapland 54 Where You Can Make A C**ld Directly On A Dangerous Day Yuri Honma [Uncensored L**ked],https://pic.javct.net/poster/20242108/1726074585.jpg,https://javct.net/v/mist-447-rm,147,2026-05-31
LULU-197-RM,"During Overtime, I Cummed Many Times Until I Got Addicted To The Marriage Boob Trap Of The Unequaled Arasa Busty Boss In The Suits Suit In The Company Alone With Two People. Takarada Monami [Uncensored L**ked]",https://pic.javct.net/poster/20230302/1679109716.jpg,https://javct.net/v/lulu-197-rm,160,2026-05-31
DVRT-075-RM,"My Busty Daughter-in-law, Who Has Always Treated Me Coldly, Is High On An Erection Drug! It's So Disgustingly Erotic That I Can't Help But Thrust Into Her, And She Cums With Such A Vulgar Ahegao That I Can't Stop Cumming Inside Her!! Mioka Satomi [Uncensored L**ked]",https://pic.javct.net/poster/05192026/a6329322eb.jpg,https://javct.net/v/dvrt-075-rm,130,2026-05-31
XVSR-198-RM,An Erotic Novel A Wet And Wild Sister-In-Law The Sexy Skin Of An Older Sister-In-Law Mao Kurata [Uncensored L**ked],https://pic.javct.net/poster/20220406/1656374126.jpg,https://javct.net/v/xvsr-198-rm,116,2026-05-31
OFKU-215-RM,"Asano Sakurai, The Bride's Mother Who Came To Tokyo From Morioka [Uncensored L**ked]",https://pic.javct.net/poster/20230207/1689825404.jpg,https://javct.net/v/ofku-215-rm,130,2026-05-31
URLH-013-RM,A Fresh Face Sexual Cabaret Hostess Princess Uses Her Tits To Lure Me To Temptation Yuka Sato [Uncensored L**ked],https://static.javct.net/poster/urlh-013.jpg,https://javct.net/v/urlh-013-rm,161,2026-05-31
300MIUM-390-RM,"Mr. Masochistic working. Case.10 IT company WEB engineer / Mr. Kurosaki / 22 years old A close contact with a self-proclaimed perverted perverted office lady who says, ""I touch my boyfriend's dick as soon as I'm around lol'' I didn't expect it, but as soon as I showed him my dick in the car, he said ""Isn't it really big lol'' and started to feel happy. Well then, I called him as a reward after work ⇒ Hard sex [Uncensored L**ked]",https://pic.javct.net/poster/05192026/3c3a31b227.jpg,https://javct.net/v/300mium-390-rm,78,2026-05-31
SOAV-108-RM,Married Woman's Cheating Heart Yui Kato [Uncensored L**ked],https://pic.javct.net/poster/20231912/1703909403.jpg,https://javct.net/v/soav-108-rm,135,2026-05-31
MIGD-566-RM,Nao Mizuki Out In Full Uncut Intrinsic [Uncensored L**ked],https://pic.javct.net/poster/07202025/1755792313.jpg,https://javct.net/v/migd-566-rm,160,2026-05-31
ECB-167-RM,"A Woman Who Acts Like A Nymphomaniac, A Man Who Is R**ed, And Us Who Are Bystanders Watching It All () [Uncensored L**ked]",https://pic.javct.net/poster/05192026/db5dd9705a.jpg,https://javct.net/v/ecb-167-rm,137,2026-05-31
FNS-211,"""I'm going home because there's no last train!"" After a drinking party, two big-breasted bosses push me into the house and have close-up sandwich sex until morning Rin Yamitsu Jun Goddess",https://pic.javct.net/poster/05192026/9936f3c10b.jpg,https://javct.net/v/fns-211,229,2026-05-31
YAKO-092,"A Sexless, Slutty, Big-breasted, Beautiful Wife Becomes Addicted To The Rock-hard Cocks Of Young Men; A Shameless Record Of Her Affair.",https://pic.javct.net/poster/05192026/3e819c8995.jpg,https://javct.net/v/yako-092,240,2026-05-31
JUR-071-RM,"I've Been Living With My Stepfather For Four Years... This Is The Story Of How I Was Repeatedly Penetrated Without A Condom, How I Awakened To Pleasure, And How I Became Pregnant. Yano Ama [Uncensored L**ked]",https://pic.javct.net/poster/04112026/1776963843.jpg,https://javct.net/v/jur-071-rm,170,2026-05-31
BOKO-039,"Just Before The Wedding, NTR Lesbian Esthetician ""Just For Today..."" That Night I Confided My Troubles To You, And We Made Love In A World Just For The Two Of Us, Where We Couldn't Think About Anything Else. Yuri Maina, Minoshima Meguri",https://pic.javct.net/poster/05192026/de9b4a2e95.jpg,https://javct.net/v/boko-039,171,2026-05-31
EMBZ-345,"A Mature Woman's Ripe, Sensitive, Huge Nipples. Sucking, Biting, Licking, And Playing With Her Fully Erect, Swollen Nipples Until She Cums. 7. Orie Fujiki",https://pic.javct.net/poster/05192026/ecf660f3be.jpg,https://javct.net/v/embz-345,130,2026-05-31
VANDR-045-RM,Big Wife Of Common Sense Knowing That Wants To Go Out With No Bra Also Vulnerable [Uncensored L**ked],https://pic.javct.net/poster/05192026/c2c71a6fd1.jpg,https://javct.net/v/vandr-045-rm,150,2026-05-31
SAN-458,A Miraculous Experience! The Story Of A Man Who Underwent A Sex Change And Became A Woman Named Tenma Yui / Tenma Yui,https://pic.javct.net/poster/05192026/959ac84f17.jpg,https://javct.net/v/san-458,120,2026-05-31
