code,title,image_url,page_url,views,date_scraped
KUSE-030-RM,"Virgin Debut G Cup At 14 Years Old, J Cup At 20 Years Old A Female College Student With Big Breasts Is A Shy And Stooped Female College Student Minamikaze Sawa AV Appearance [Uncensored L**ked]",https://pic.javct.net/poster/20212709/1634549631.jpg,https://javct.net/v/kuse-030-rm,195,2026-03-22
TIKB-175-RM,"[Pakopaco Video] This Lovey-dovey Couple! Too Erotic, I Can't Do It Www Kana Morisawa [Uncensored L**ked]",https://pic.javct.net/poster/20231711/1700279446.jpg,https://javct.net/v/tikb-175-rm,116,2026-03-22
NACR-664-RM,I Can't Tell My Husband... That I'm Being Fucked By My Father-In-Law... Umi Natsukawa [Uncensored L**ked],https://pic.javct.net/poster/20230205/1684555330.jpg,https://javct.net/v/nacr-664-rm,120,2026-03-22
ROE-466-RM,"""The Director Is Now Our Fleshlight"" Arrogant Female Boss Subjugates To Her Insatiable Subordinate In Office Gang R**e Maki Tomoda [Uncensored L**ked]",https://pic.javct.net/poster/06032026/1773948227.jpg,https://javct.net/v/roe-466-rm,130,2026-03-22
DASS-626-SUB,Was Completely Lured In By The Allure Of My Naughty Tutor's Big Breasts. Akane Mitani [English Subtitle],https://pic.javct.net/poster/20250903/1743703039.jpg,https://javct.net/v/dass-626-sub,120,2026-03-22
MISM-421-RM,Hello From The Land Of Vomit. Nice To Meet You. A Petite Girl Who Vomits From The Back Of Her Throat With A Smile. 149cm Yura [Uncensored L**ked],https://pic.javct.net/poster/06032026/1773969483.jpg,https://javct.net/v/mism-421-rm,180,2026-03-22
PRIN-010-RM,Doujin AV [104cm Super Big Breasts] Vaginal Spasm Keeps Coming [Reverse Bunny] Drunk And Tipsy [Home Coslayer] Shiny Oil [Virgin Until Last Year] [Uncensored L**ked],https://pic.javct.net/poster/20231912/1703908992.jpg,https://javct.net/v/prin-010-rm,134,2026-03-22
DANDY-881-RM,A Mother-in-law With A Strong Sexual Desire Who Wants To Have Sex Many Times While The Father Is Away Does Not Refuse The Raw Penetration Of Her Son VOL.5 [Uncensored L**ked],https://pic.javct.net/poster/20231011/1697086869.jpg,https://javct.net/v/dandy-881-rm,198,2026-03-22
PKPD-269-RM,Half Middle Half Outside Half Girlfriend Rihotan (20) Riho Shirahashi [Uncensored L**ked],https://pic.javct.net/poster/20231711/1701486691.jpg,https://javct.net/v/pkpd-269-rm,120,2026-03-22
JUL-656-RM,Exclusive: Minori Hatsune is Driven to Ecstasy before an Intense Vaginal Creampie!! Secretive Cheating Sex with a Hot Wife and Her Real Estate Agent. [Uncensored L**ked],https://static.javct.net/poster/jul-656.jpg,https://javct.net/v/jul-656-rm,119,2026-03-22
JUR-649-RM,"""Your Wife Was The Best."" An Unexpected NTR Story Written In The Resignation Letter Of A New Employee Who Quit After 3 Months, Ryo Aiyumi [Uncensored L**ked]",https://pic.javct.net/poster/06032026/1773949112.jpg,https://javct.net/v/jur-649-rm,150,2026-03-22
FSDSS-343-RM,Fresh Face Practically A Virgin But Strongly Curious About Sex Mayu Horizawa AV Debut [Uncensored L**ked],https://pic.javct.net/poster/20212709/1634792769.jpg,https://javct.net/v/fsdss-343-rm,123,2026-03-22
DASS-917-RM,"The Massage Therapist I Was Sent To, Touched My Private Parts So Much That I Couldn't Stand The Pleasure And Ended Up Cheating On My Lover With Him - Natsume Reika [Uncensored L**ked]",https://pic.javct.net/poster/06032026/1773949501.jpg,https://javct.net/v/dass-917-rm,120,2026-03-22
SDAB-080-RM,"Juicy Juice Covered With Fresh Fresh Body Juice, Sweat, Tide And Sperm Fly!Denpyun Youth Of High Waves Attention 14 Shots! ! Attention, Attention To You.Norimia Imai 19 Years Old [Uncensored L**ked]",https://pic.javct.net/poster/06032026/1774140867.jpg,https://javct.net/v/sdab-080-rm,130,2026-03-22
PRED-538-US,"It's The Last Time For Retirement, So I Had Her Cum For The Rest Of Her Life At The 3-part Graduation Climax Ceremony, Marin Hinata. [English Subtitle, Reducing Mosaic]",https://pic.javct.net/poster/20231011/1700191105.jpg,https://javct.net/v/pred-538-us,150,2026-03-22
DASS-880-RM,A Lot Of Dangerous Medicine! A Body With A Crotch Length Of 86cm Is Licked And Licked With Saliva And Lotion! A Trance Sex With Explosive Orgasms And A Demonic Squirt Sasakura Aya [Uncensored L**ked],https://pic.javct.net/poster/06032026/1773970826.jpg,https://javct.net/v/dass-880-rm,110,2026-03-22
CJOD-502-RM,"I Unexpectedly Met My Former Teacher At A Call Health Service. I Remembered My First Love And Had An Affair With Her, With All The Uniform Options And Full-on Sex. Riho Shishido [Uncensored L**ked]",https://pic.javct.net/poster/06032026/1773971014.jpg,https://javct.net/v/cjod-502-rm,130,2026-03-22
VEMA-002-RM,Busty Nurse Wife - Suzuka Neiro [Uncensored L**ked],https://pic.javct.net/poster/06032026/1774110085.jpg,https://javct.net/v/vema-002-rm,85,2026-03-22
SCD-236-RM,Outdoor Sex Bus Girl Satomi Suzuki [Uncensored L**ked],https://pic.javct.net/poster/20243105/1718420942.jpg,https://javct.net/v/scd-236-rm,109,2026-03-22
ROE-468-RM,"After 10 Days Of Giving My Beloved Aunt An Aphrodisiac, She Became A Horny, Cum-filled Sex Slave... Sakura Satsuki [Uncensored L**ked]",https://pic.javct.net/poster/06032026/1774057278.jpg,https://javct.net/v/roe-468-rm,120,2026-03-22
SNOS-140-RM,"I Wonder If The Pussy Of A Boyish, Athletic Girl With A Ripped Abs Is Really Tight? LOL Soa, A Female Sprinter College Student, Is Turned Into A Sex Doll With An Aphrodisiac. [Uncensored L**ked]",https://pic.javct.net/poster/06032026/1773947731.jpg,https://javct.net/v/snos-140-rm,120,2026-03-22
HMN-839-RM,"Bath Time With My Niece For The First Time In 10 Years. I Couldn't Resist The Unconscious Temptation Of Her G-cup, Plump, Fluffy Breasts That Had Grown Into An Adult Body... I Ended Up Cumming Inside Her While Her Hair Was Still Wet In The Bath. Riho Shishido [Uncensored L**ked]",https://pic.javct.net/poster/06032026/1773970065.jpg,https://javct.net/v/hmn-839-rm,120,2026-03-22
SHIND-109,Tracking The Sticky S●●Car M - Home Banned Records #134 & 135,https://pic.javct.net/poster/06032026/1774112334.jpg,https://javct.net/v/shind-109,135,2026-03-22
JUR-670-RM,"Madonna triple ""Big Breasts"" exclusive, unique co-starring. Strong Creampie Rehabilitation Program for Married Women Guards Starved of Lust [Uncensored L**ked]",https://pic.javct.net/poster/06032026/1773969562862.jpg,https://javct.net/v/jur-670-rm,150,2026-03-22
