code,title,image_url,page_url,views,date_scraped
MCSR-228,My SEX Spree Subjective Video She Cum In Shikekon To My Wife Big Tits Elder Brother's Wife And A Hot Spring Inn Of Big Brother! ! !,https://pic.javct.net/poster/04112026/232986a17b.jpg,https://javct.net/v/mcsr-228,120,2026-04-28
MDB-724,What If Working In The Married Woman Mah-jong Club Rumors With Excess Service Pies Is My Deca Lantern ... Kaho Shibuya Yu Shinoda Yuu Kawakami Maki Hojo,https://pic.javct.net/poster/04112026/063a979b3c.jpg,https://javct.net/v/mdb-724,120,2026-04-28
MCSR-126,I'm Really Sorry You Who I Accidentally Anal SEX But Did Not That Was Lit Married Husband First Anal ...,https://pic.javct.net/poster/04112026/2fad01ce20.jpg,https://javct.net/v/mcsr-126,120,2026-04-28
LANK-009,Busty Girl Soft Body Meat Treats Yu Pot,https://pic.javct.net/poster/04112026/08056940ca.jpg,https://javct.net/v/lank-009,110,2026-04-28
MDB-604,Would You Like To Test Drive With Me?Indecent Sales 2 Hasumi Claire Hosaka Collar Yu Shinoda Busty Car Dealer Wind Noise Mica Serino Rina,https://pic.javct.net/poster/04112026/9546c6d38f.jpg,https://javct.net/v/mdb-604,240,2026-04-28
MCKT-002,"[The Fuck Log] When Yu Shinoda Gets Busy, She's Pumping Out That Slut Energy, So We Filmed Some Creampie POV Videos With Her!",https://pic.javct.net/poster/04112026/6f5e7fbb9b.jpg,https://javct.net/v/mckt-002,66,2026-04-28
MIAA-092,"Encounter With Hate Woman Boss And Deriheru, Immediate Position Reversal! Time & Launch Unlimited!Intravaginal Ejaculation Fo**ed!The Shop And The Company Made Iinari Cowgirl Pet. Shinoda Yu",https://pic.javct.net/poster/04112026/dca9c8af51.jpg,https://javct.net/v/miaa-092,120,2026-04-28
MIAA-058,"Even If It Ejaculates, Seducing Whisper Middle-aged Father Who Doesn't Continue To Commit The Tympanic Membrane The Adhesion Press Elder Sister Without Pulling Out Hunting Shibata Yu",https://pic.javct.net/poster/04112026/a9f93544ee.jpg,https://javct.net/v/miaa-058,120,2026-04-28
START-543-RM,"My girlfriend is a natural girl with super big O cup breasts who is easy to get carried away. Today as well, a slut NTR4 situation where her huge breasts are being rubbed by men, her nipples cum immediately, and then she is creampied is Momona Koibuchi. [Uncensored L**ked]",https://pic.javct.net/poster/04112026/0a33a483ea.jpg,https://javct.net/v/start-543-rm,137,2026-04-28
10-042826-01,Busty swimsuit beauty and slippery lotion play,https://pic.javct.net/poster/04112026/861df0e9d3.jpg,https://javct.net/v/10-042826-01,46,2026-04-28
MIGD-589,Suzu-wa Miu Intrinsic Out During The First,https://pic.javct.net/poster/04112026/58c1f082cd.jpg,https://javct.net/v/migd-589,160,2026-04-28
REAL-593,Demon Fucking Hell Best Strongest Fucking Corps Nonstop Shear Defeated Specials,https://pic.javct.net/poster/04112026/16ec95e1ae.jpg,https://javct.net/v/real-593,240,2026-04-28
HMGL-182,Embarrassing Body Shortcut Sex Idol Aoi Tojo,https://pic.javct.net/poster/04112026/d608ddd076.jpg,https://javct.net/v/hmgl-182,130,2026-04-28
FC2PPV-4885311,"[None] [Also 3 previous works] A man who looks like he came out of an erotic manga. F-cup big breasts and high-leg leotard. Appearance, gesture, atmosphere, erotic technique. Everything is top-notch lewd and swallowed. *Bonus High quality image",https://pic.javct.net/poster/04112026/cfd4ae3cdc.jpg,https://javct.net/v/fc2ppv-4885311,49,2026-04-28
892OERO-002-RM,"The moment we enter the hotel, a wife who loves sex without telling her husband kisses her with great force and says, ""I've been horny for a long time...'' We're about to have sex, so you don't need something like this (a ring), I'll give you a big creampie [includes bonus video] [Uncensored L**ked]",https://pic.javct.net/poster/04112026/f1de3affe1.jpg,https://javct.net/v/892oero-002-rm,82,2026-04-28
VGD-207,I Want To Flirt With Soft Body Sex Addict Ruri Hoshijima,https://pic.javct.net/poster/04112026/fc19c36731.jpg,https://javct.net/v/vgd-207,130,2026-04-28
KSBJ-059,Widow's Mother-in-law Maiko Yuki Who Tempts Her Daughter-in-law,https://pic.javct.net/poster/04112026/27954f968d.jpg,https://javct.net/v/ksbj-059,114,2026-04-28
MFCW-071-RM,Aina [Uncensored L**ked],https://pic.javct.net/poster/04112026/3cc2e1ff33.jpg,https://javct.net/v/mfcw-071-rm,66,2026-04-28
DVMM-022-RM,"Regular Male/female Monitoring AV. An Unparalleled Busty Wife Is Given A Condom And Spends 1 Night And 2 Days With A Virgin College Student. There's No Way The Frustrated, Long-lost Wife Will Be Satisfied With Just One Rubber Sex... Straddling A Younger Man's Virgin Dick And Shaking Her Big Tits. I'm Cumming! Continuous Creampie SEX That Squeezes Out The Semen That Has Accumulated In The Pool Many Times! [Uncensored L**ked]",https://pic.javct.net/poster/20230908/1695959142.jpg,https://javct.net/v/dvmm-022-rm,260,2026-04-28
START-255-SUB,"Sexual Revenge For The King Of Our House When I Gave A 100 Times More Concentrated Sexual Desire Enhancer To My Bossy Older Sister Who Was Always Looking Down On Me, Rei Kamiki Fell Into A Gangly Small Fry And Got An Erection Even Though She Was The Younger Brother. [English Subtitle]",https://pic.javct.net/poster/20242012/1736788087.jpg,https://javct.net/v/start-255-sub,130,2026-04-28
HOI-412-RM,Aoi [Uncensored L**ked],https://pic.javct.net/poster/04112026/fb274567b3.jpg,https://javct.net/v/hoi-412-rm,90,2026-04-28
BBTU-011-RM,Titty Masochism She's Panting And Moaning In Ecstasy And Cumming Like Crazy With Her Colossal Tits Nene Tanaka [Uncensored L**ked],https://static.javct.net/poster/1618504534.jpg,https://javct.net/v/bbtu-011-rm,103,2026-04-28
ONED-089-RM,Barely Yua First Cell [Uncensored L**ked],https://pic.javct.net/poster/04112026/1f577bee85.jpg,https://javct.net/v/oned-089-rm,130,2026-04-28
JUY-295-RM,I Was Caught In Front Of My Husband 's Portrait And Caught Me Crazy. Rin Shiraishi [Uncensored L**ked],https://pic.javct.net/poster/20221904/1653449585.jpg,https://javct.net/v/juy-295-rm,120,2026-04-28
