code,title,image_url,page_url,views,date_scraped
HONE-296-RM,In Heat!! Erotic Manga Body Mother Nagasawa Fumika [Uncensored L**ked],https://pic.javct.net/poster/04112026/1776159515.jpg,https://javct.net/v/hone-296-rm,105,2026-05-13
FC2PPV-4899575,"[3P continuous creampie] Once again, I think I got caught in the tangle of two young wives brought by the 〇mi company.",https://pic.javct.net/poster/04112026/61c6dfe63a.jpg,https://javct.net/v/fc2ppv-4899575,35,2026-05-13
HMGL-117-RM,Body Embarrassing Company Matsuo Complete 07 [Uncensored L**ked],https://pic.javct.net/poster/06032026/1773544286.jpg,https://javct.net/v/hmgl-117-rm,360,2026-05-13
FC2PPV-4897634,"[No] A perfect model style with a threatening inseam of 87 cm and a height of 173 cm, beautiful legs and beautiful breasts ⤴ Gokkun Creampie *Bonus High resolution",https://pic.javct.net/poster/04112026/8e1a68c86c.jpg,https://javct.net/v/fc2ppv-4897634,68,2026-05-13
JUC-605-RM,Satomi Suzuki And The Young Bride Would Feel Bound By The Father-in-law - Wife Two Turtle Tie [Uncensored L**ked],https://pic.javct.net/poster/04112026/84415fa5d9.jpg,https://javct.net/v/juc-605-rm,120,2026-05-13
ANKB-019-RM,White Peach Breast Peach Girl And Open-air Hot Spring Beast FUCK [Uncensored L**ked],https://pic.javct.net/poster/20230804/1691818840.jpg,https://javct.net/v/ankb-019-rm,145,2026-05-13
HAR-086-RM,Withdrawal Opponent's Withdrawal Sons Are Sex Slaves And Accept Shame Play Guess Chastity Wife [Uncensored L**ked],https://pic.javct.net/poster/04112026/b7411c82a7.jpg,https://javct.net/v/har-086-rm,180,2026-05-13
HIZ-011-RM,Earnestly Milk Rin Shiraishi Earnestly Series No.011 [Uncensored L**ked],https://pic.javct.net/poster/20222612/1673396067.jpg,https://javct.net/v/hiz-011-rm,130,2026-05-13
GVG-781-RM,A Man Wants His Mother-In-Law's Obscene Tits. Eri Takigawa [Uncensored L**ked],https://pic.javct.net/poster/20212709/1632995722.jpg,https://javct.net/v/gvg-781-rm,120,2026-05-13
AQSH-102-RM,Father-in-law And Papa Life Small Devil Bride Anna Hanayagi Who Seduces Father-in-law To Want Pocket Money [Uncensored L**ked],https://pic.javct.net/poster/20230804/1691814250.jpg,https://javct.net/v/aqsh-102-rm,120,2026-05-13
GDRD-022-RM,Red Dragon Nene Tanaka [Uncensored L**ked],https://pic.javct.net/poster/20241703/1712373571.jpg,https://javct.net/v/gdrd-022-rm,109,2026-05-13
FC2PPV-4899471,Big tits uniform cosplay titty fuck pincer 3 shots\!!p26,https://pic.javct.net/poster/04112026/18caa0798c.jpg,https://javct.net/v/fc2ppv-4899471,48,2026-05-13
200GANA-3069-RM,"Seriously soft, first shot 2066 The president's secretary with a super SSS-class divine waist body that has nothing but sex appeal is obscenely shaking her hips and cumming, her slender limbs, well-shaped face, wonderful curvature, firm breasts, everything is erotic I can't get over the excitement of NTR sex that steals the president's woman which is so erotic [Uncensored L**ked]",https://pic.javct.net/poster/20242108/1725863231.jpg,https://javct.net/v/200gana-3069-rm,62,2026-05-13
URKK-072-RM,At Least 10 Shots Are Nuku! ! 240 Minutes Highlights Of A Rejuvenated Big Tits & Aphrodisiac Salon With Big Tits Shaking And Cumming Any Number Of Times [Uncensored L**ked],https://pic.javct.net/poster/20222311/1670645305.jpg,https://javct.net/v/urkk-072-rm,240,2026-05-13
STAR-975-RM,Enomoto Misaki Forty Vaginal Cum Shot 15 Shots That Can Not Be Satisfied Yet Even If She Sniffs All Day Long After Asceticism For 45 Days [Uncensored L**ked],https://pic.javct.net/poster/20241115/1734422002.jpg,https://javct.net/v/star-975-rm,130,2026-05-13
KSBJ-001-RM,Wife Naked Manabe Aya [Uncensored L**ked],https://pic.javct.net/poster/06032026/1772956553.jpg,https://javct.net/v/ksbj-001-rm,114,2026-05-13
NACR-735-RM,"Leave It To Erika Ozaki. Counseling Room For Any Concerns You May Have. ""For Cherry University Students.'' [Uncensored L**ked]",https://pic.javct.net/poster/20231711/1701712231.jpg,https://javct.net/v/nacr-735-rm,123,2026-05-13
KSBJ-002-RM,Wife Naked Shichihara Akari [Uncensored L**ked],https://pic.javct.net/poster/06032026/1773023062.jpg,https://javct.net/v/ksbj-002-rm,120,2026-05-13
START-465-RM,Climax development Jibun's best ever orgasm while shaking her I cup divine breasts BODY! Big Cock Big Climax Nano Ogasawara [Uncensored L**ked],https://pic.javct.net/poster/04112026/1776109035852.jpg,https://javct.net/v/start-465-rm,162,2026-05-13
JUY-322-RM,Married Nursery Nurse Morality Train ~ An Obscene Commuter Swallowed By Pleasure ~ Kase Kanako [Uncensored L**ked],https://pic.javct.net/poster/20241902/1708907708.jpg,https://javct.net/v/juy-322-rm,140,2026-05-13
JUFD-178,Haruna ~ Azumi Mizushima-Gi-Oh Glossy Distortion Of Two Gorgeous Babes - Soft Body Soap Heaven,https://pic.javct.net/poster/04112026/09920063c9.jpg,https://javct.net/v/jufd-178,180,2026-05-13
XVSR-155-RM,Thick Sex Asami Nagase Of Realistic Sex [Uncensored L**ked],https://pic.javct.net/poster/20241901/1708077594.jpg,https://javct.net/v/xvsr-155-rm,120,2026-05-13
RDT-277-RM,"When I Play A Prank On The Big-breasted Girl Next To Me In The Car With A Friend By My Side And I Can't Even Make A Sound, She Resists At First, But By The Time We Get To The Destination And Get Off... [Uncensored L**ked]",https://pic.javct.net/poster/20241804/1714088792.jpg,https://javct.net/v/rdt-277-rm,135,2026-05-13
RDT-274-RM,And Are Fascinated To Change Of Clothes Appearance Of Busty Beauties Peek Through The Window Of The Opposite Of The Room ... 3 [Uncensored L**ked],https://pic.javct.net/poster/20253001/1739979175.jpg,https://javct.net/v/rdt-274-rm,130,2026-05-13
