code,title,image_url,page_url,views,date_scraped
ZEX-417-RM,"Miraculous Fair Skin F Cup, Rina Takase Best [Uncensored L**ked]",https://pic.javct.net/poster/20221108/1660538591.jpg,https://javct.net/v/zex-417-rm,120,2026-05-23
XVSR-180-RM,Rookie DEBUT! ! An Misora [Uncensored L**ked],https://pic.javct.net/poster/01202026/1772254186.jpg,https://javct.net/v/xvsr-180-rm,120,2026-05-23
MIDE-815-RM,"Yui Shirasaka, A Tutor Who Is Tempted By Whispering Tightly [Uncensored L**ked]",https://pic.javct.net/poster/05192026/b0446779e0.jpg,https://javct.net/v/mide-815-rm,150,2026-05-23
YMDS-139-RM,Icha Love House Drinking Rich Tongue Sticky Sex The Day Monami Takarada Became Her Girlfriend [Uncensored L**ked],https://pic.javct.net/poster/20230207/1690604291.jpg,https://javct.net/v/ymds-139-rm,130,2026-05-23
PKPD-098-RM,Raw Love Hentai Beautiful Breasts Girl & Strongest Model Beautiful Leg Girl Black Pantyhose Student Love Homme [Uncensored L**ked],https://pic.javct.net/poster/06032026/1774079973.jpg,https://javct.net/v/pkpd-098-rm,115,2026-05-23
JYMA-038-RM,A Middle-Aged Man's Sexual Desire Documentary A Fair-skinned Carnal Body A Wife And An Old Man's Sweaty Sexual Intercourse All Day Fucking A Beautiful Busty Ass Wife Iori Tsukimi [Uncensored L**ked],https://pic.javct.net/poster/20230207/1689912834.jpg,https://javct.net/v/jyma-038-rm,120,2026-05-23
FC2PPV-4905495,[First shot/Individual shooting] Divine style with eight heads ❣ Highest class office lady with a tall body and beautiful big breasts slender body ♡ Raw insertion into the trained extremely tight pussy and 2 shots deep inside the vagina ready for fertilization ♡ [Bonus: High resolution] [Main story / No face mo.],https://pic.javct.net/poster/05192026/3279702ac3.jpg,https://javct.net/v/fc2ppv-4905495,83,2026-05-23
FOCS-049-RM,"Poor Theater Actress With Hidden F-Cup Tits... If She's Willing To Bare It All For The Camera, Both Her Palm And Pussy Will Get Greased! The Ultimate Moaning, Gasping Orgasms! Creampie Side-Hustle Rena Kodama [Uncensored L**ked]",https://pic.javct.net/poster/20212011/1644570818.jpg,https://javct.net/v/focs-049-rm,124,2026-05-23
FC2PPV-4904818,"[Big Breasts/Individual Shooting] Fascinating glamorous body with big breasts ❣ Beautiful young wife with white skin and G cup ♡ Her nipples are toyed with toys ♡ After a sensual titty fuck that fills the cock, a powerful sex video where a large amount is ejaculated deep inside her vagina with an intense piston ♡",https://pic.javct.net/poster/05192026/15b40fc721.jpg,https://javct.net/v/fc2ppv-4904818,78,2026-05-23
LULU-229-RM,"Cheeky Female Gaki Busty Student Who Is Running Away From Home Steals His Wife's Eyes And Pushes Her Boobs To Temptation And Makes Her Teacher Disqualified And Erects And Aims For Family Collapse, So While Rubbing Her Growing Boobs, I Made It Understand With An Adult Cock Piston. Kashiwagi Konatsu [Uncensored L**ked]",https://pic.javct.net/poster/20230207/1690602151.jpg,https://javct.net/v/lulu-229-rm,160,2026-05-23
FC2PPV-4904883,"Smiling and licking a lot of creampie, good friends, naughty edition, this Kitakami-san costume was done by an OL baker with puffy nipples.",https://pic.javct.net/poster/05192026/19b6dc3302.jpg,https://javct.net/v/fc2ppv-4904883,92,2026-05-23
FC2PPV-4904563,"Uncensored. This is a sex video with an F cup amateur J⚫︎ before it became a buzz in the neighborhood. [Reality] I would never do sex with other people, right? I was lied to, so I made my first shooting video at the same time as two consecutive rich and creamy creampies.",https://pic.javct.net/poster/05192026/886cd9be1b.jpg,https://javct.net/v/fc2ppv-4904563,63,2026-05-23
VGD-140-RM,Porn ★ Monster Minegishi Fujiko [Uncensored L**ked],https://pic.javct.net/poster/06032026/1773463768.jpg,https://javct.net/v/vgd-140-rm,120,2026-05-23
FC2PPV-4898658,[Individual shot] Raw creampie to snack clerk with erotic atmosphere,https://pic.javct.net/poster/05192026/5a6f6e19f0.jpg,https://javct.net/v/fc2ppv-4898658,36,2026-05-23
STARS-014-RM,Sakura Mana Thick Ass Butt Meat Spitting Big Dick Fuck And Cum Shot With Anal Fuck [Uncensored L**ked],https://pic.javct.net/poster/20243105/1719523603.jpg,https://javct.net/v/stars-014-rm,135,2026-05-23
YST-300-RM,I'm A Pervert Who Drips Pussy Juice Even Though My Father-in-law Treats Me As A Mouth. Rino Yuki [Uncensored L**ked],https://pic.javct.net/poster/20230207/1690521882.jpg,https://javct.net/v/yst-300-rm,103,2026-05-23
SOAV-098-RM,A Married Woman's Cheating Heart Sato's Or [Uncensored L**ked],https://pic.javct.net/poster/20230302/1677902117.jpg,https://javct.net/v/soav-098-rm,144,2026-05-23
FC2PPV-4903955,"[No] A tall 171 cm tall G cup beautiful butt beauty with an excellent figure. She has an elegant face and is naughty. She gives a saliva dripping blowjob and has a great titty fuck, ejaculates and cums inside. *Bonus High resolution",https://pic.javct.net/poster/05192026/6e5e3194c4.jpg,https://javct.net/v/fc2ppv-4903955,60,2026-05-23
ONEZ-103-RM,# Live Cream Pies Out Maid Refre Vol.001 Akeemi [Uncensored L**ked],https://pic.javct.net/poster/05192026/c49c704119.jpg,https://javct.net/v/onez-103-rm,110,2026-05-23
ROYD-061-RM,"Miyabi Midorikawa, A Sister-in-law Who Became A SEX Machine Because Her Sensitivity Became Stupid Day By Day Without Noticing That A Large Amount Of Libido Enhancer Was Added Every Day [Uncensored L**ked]",https://static.javct.net/poster/royd-061.jpg,https://javct.net/v/royd-061-rm,150,2026-05-23
MIGD-554-RM,"Great Tit, Na Also MANIAX Kasuga Injection Amazing Clamping [Uncensored L**ked]",https://pic.javct.net/poster/06032026/1774751734.jpg,https://javct.net/v/migd-554-rm,180,2026-05-23
VGD-137-RM,"Today, Your Wife Is Having An Affair.Ayumi [Uncensored L**ked]",https://pic.javct.net/poster/06032026/1773381547.jpg,https://javct.net/v/vgd-137-rm,140,2026-05-23
ABW-104-RM,Sexual Awakening To Taste The God's Milk Ecup 3 Production God's Modeling Beauty! !! Transcendental Beautiful Breasts Minoshima Tour [Uncensored L**ked],https://static.javct.net/poster/abw-104.jpg,https://javct.net/v/abw-104-rm,210,2026-05-23
ROE-504-RM,"Top-class Woman Nearing 60, Exclusive, Chapter 2: Unleashing The Ban On Internal Ejaculation. ""Mother-in-law, You Promised To Give Birth To My Little Brother Back Then, Didn't You?"" Desperate To Have A Younger C**ld, I Continued To Pour My Seed Into Kaoru's Vagina Every Day, Even Though She Was Nearing Menopause... [Uncensored L**ked]",https://pic.javct.net/poster/05192026/59945a16e9.jpg,https://javct.net/v/roe-504-rm,140,2026-05-23
