code,title,image_url,page_url,views,date_scraped
LULU-196-RM,"Mizuki Yayoi, The Best Semen Swallowing Mistress Who Can Cum Swallow If Called With An Exquisite Blowjob That A Wife Can't Taste [Uncensored L**ked]",https://pic.javct.net/poster/20230302/1679109780.jpg,https://javct.net/v/lulu-196-rm,160,2026-05-30
BBTU-059-RM,Pirama Deep Throat And Big Tits Go Crazy Sakura Mita [Uncensored L**ked],https://pic.javct.net/poster/20230205/1683949359.jpg,https://javct.net/v/bbtu-059-rm,112,2026-05-30
KAM-135-RM,Record Of A Perverted Erotic Manipulator Who Repeatedly Acted Obscene Acts To A Busty Beauty Who Became A Generalized Sensitive Zone With A Secret Rejuvenating Massage Momo Minami [Uncensored L**ked],https://pic.javct.net/poster/20230207/1689309944.jpg,https://javct.net/v/kam-135-rm,120,2026-05-30
TMAM-054,"And ""it Is Done To"" Also Count To 1 Mote Super Motegyaru",https://pic.javct.net/poster/05192026/d07c99f8bf.jpg,https://javct.net/v/tmam-054,130,2026-05-30
KSBJ-255-RM,"Ms. Mizune, 28 Years Old, Will Fulfill The Sexual Desires Of A Busty Wife Who Can't Be Satisfied With Her Monthly Activity And Masturbation Five Times A Week [Uncensored L**ked]",https://pic.javct.net/poster/20230207/1689392932.jpg,https://javct.net/v/ksbj-255-rm,120,2026-05-30
FC2PPV-4910014,[Completely uncensored] A divine slender beauty I met at Ti〇der. A big cock with the same length as her face penetrated deep into her uterus and inseminated her twice.,https://pic.javct.net/poster/05192026/883f6f3264.jpg,https://javct.net/v/fc2ppv-4910014,59,2026-05-30
RTP-106-RM,"Confession By Giving Courage To That Adorable C**ld!However, It Is Somewhat Sinking (one д-.)Even So, I Can Not Give It Up, ""I'm Actually, I Have Three Months Left My Life ..."" Lying And Buying Sympathy, I Begging To Do Sex Before I Die! ""I Promised If It's Up To You ""but If You Insert It Without Being Tolerated ... [Uncensored L**ked]",https://pic.javct.net/poster/05192026/f5737f233e.jpg,https://javct.net/v/rtp-106-rm,135,2026-05-30
NACR-754-RM,Very Popular With Gobusata Wives! Erotic Oil Massage At A Hidden Beauty Salon! Hitomi Mochizuki [Uncensored L**ked],https://pic.javct.net/poster/20241901/1705680761.jpg,https://javct.net/v/nacr-754-rm,120,2026-05-30
MKD-211-RM,"From The Tip Of The Head To The Toes Of The Foot, The Whole 50's Wife Is Making Her AV Debut! Matsuoka Shizue [Uncensored L**ked]",https://pic.javct.net/poster/05192026/e0998cbb4b.jpg,https://javct.net/v/mkd-211-rm,110,2026-05-30
FMDL-008-RM,Cuckold By My Best Friend And Str**gled Development Falls M Awakening Mei Satsuki [Uncensored L**ked],https://pic.javct.net/poster/20230207/1689428020.jpg,https://javct.net/v/fmdl-008-rm,136,2026-05-30
ONEZ-113-RM,"A Wife Who Did Not Stop The Tide Kept On Having Sex Till The Night Came At A Luxury Hotel With Her Husband Who Met For A Long Time.Posting Footage That We Asked For ""Creamie"" With A Looking Sweet Female Face And Continued Seeking To Make Each Other Pure White.Yuan (pseudonym) 23 Years Old [Uncensored L**ked]",https://pic.javct.net/poster/05192026/f95088d43b.jpg,https://javct.net/v/onez-113-rm,120,2026-05-30
VGD-150-RM,Gloss Woman Re-start 42-year-old Aizawa Much [Uncensored L**ked],https://pic.javct.net/poster/06032026/1773982887.jpg,https://javct.net/v/vgd-150-rm,140,2026-05-30
WAAA-656-RM,"The Condom Broke, Resulting In Unexpected Unprotected Sex! He Thrusts At Super-fast Speed, Cumming Inside Her Multiple Times! Riho Shishido [Uncensored L**ked]",https://pic.javct.net/poster/05192026/3560b8907d.jpg,https://javct.net/v/waaa-656-rm,160,2026-05-30
VGD-151-RM,Girl Hasegawa Riho That Word Back Report Of AV Actress [Uncensored L**ked],https://pic.javct.net/poster/06032026/1774079785.jpg,https://javct.net/v/vgd-151-rm,120,2026-05-30
WAAA-649-RM,"A Disliked Middle-aged Teacher Stalks, **dnaps, And Imprisons His Admired Top-performing Female Student, Drugging Her With Sleeping Pills And Aphrodisiacs, Raping Her, And Turning Her Into His Obedient Sex Slave Through Drug-induced Sex Education. (Arai Rima) [Uncensored L**ked]",https://pic.javct.net/poster/05192026/e3e8fe0441.jpg,https://javct.net/v/waaa-649-rm,120,2026-05-30
URLH-009-RM,Rookie Sekukyaba 6 Reira Who Comes To Super Temptation With Tits [Uncensored L**ked],https://pic.javct.net/poster/05192026/cbb23e14d1.jpg,https://javct.net/v/urlh-009-rm,150,2026-05-30
VEC-598-RM,Mother's Best Friend Miki Yoshii [Uncensored L**ked],https://pic.javct.net/poster/20230207/1688706247.jpg,https://javct.net/v/vec-598-rm,120,2026-05-30
ONEZ-112-RM,Dense Kiss And Serious Sexual Intercourse.VOL.002 Igarashi Ran [Uncensored L**ked],https://pic.javct.net/poster/05192026/3c9d819245.jpg,https://javct.net/v/onez-112-rm,120,2026-05-30
DIC-093-RM,18 Years And 5 Months 19 F Breasts Big Breasts Pre-Ass Anal Licking Life's First 3P Mayuki Dogami [Uncensored L**ked],https://pic.javct.net/poster/20212011/1639181754.jpg,https://javct.net/v/dic-093-rm,150,2026-05-30
EBOD-451-RM,The Temptation Of A Voluptuous Babe In High-Legged Lingerie With Plenty Of Camel Toe    Chitose Saegusa [Uncensored L**ked],https://pic.javct.net/poster/20221108/1661401477.jpg,https://javct.net/v/ebod-451-rm,118,2026-05-30
EBOD-452-RM,Ultra Breast Jcup Cosplayers Mii-chan Of Rumor [Uncensored L**ked],https://pic.javct.net/poster/06032026/1775274233.jpg,https://javct.net/v/ebod-452-rm,120,2026-05-30
MIDA-652-RM,"Even When He's Already Ejaculated, The Slutty Older Sister, Yua Fukuda, Keeps Blocking Him With Sweaty French Kisses And Straddling Him Again And Again. [Uncensored L**ked]",https://pic.javct.net/poster/05192026/646b1b38f5.jpg,https://javct.net/v/mida-652-rm,140,2026-05-30
MIDA-656-RM,"Her Older Sister Is, Surprisingly, A Slutty Porn Star. With Her P-cup Tits And Slutty Techniques, She'll Make You Ejaculate Until Your Balls Are Empty! Maria Valentine [Uncensored L**ked]",https://pic.javct.net/poster/05192026/0129465d96.jpg,https://javct.net/v/mida-656-rm,120,2026-05-30
MEAD-015-RM,"The Legendary H-cup Streetwalker With Miraculous Titjob Technique Makes A One-time AV Debut, Seeking Even More Thrills On The Condition That Her Face Is Not Shown. [Uncensored L**ked]",https://pic.javct.net/poster/05192026/c57c3864f7.jpg,https://javct.net/v/mead-015-rm,170,2026-05-30
