code,title,image_url,page_url,views,date_scraped
MARA-010-RM,Juri Maino Tits Theater Icup!100cm [Uncensored L**ked],https://pic.javct.net/poster/06032026/1775271091.jpg,https://javct.net/v/mara-010-rm,135,2026-04-04
LULU-139-RM,"Just The 2 Of Us At The Office While Working Overtime, My Boss Is A Married Woman With Big Tits Bursting At The Seams Of Her Suit, Her Tits Get Me Super Horny And She Uses Them Non-stop To Service Me Till I Giver Her Tons Of Cum For A BUKKAKE. Yuria Yoshine [Uncensored L**ked]",https://pic.javct.net/poster/20221904/1651300326.jpg,https://javct.net/v/lulu-139-rm,160,2026-04-04
261ARA-423-RM,"[Beautiful pink nipples] 24 years old [Much erotic BODY] Haruna-chan comes here. She works at an esthetic salon. Her reason for applying is ""I miss my boyfriend...I want the moisture of a woman...'' Anyway, [frustrated older sister] She has erogenous zones all over her body. She has an ultra-sensitive constitution [she comes to orgasm with her nipples]. Don't miss out on the climax-filled SEX of a beautiful woman who wants to be moisturized. [Uncensored L**ked]",https://pic.javct.net/poster/06032026/1775267494684.jpg,https://javct.net/v/261ara-423-rm,80,2026-04-04
BAB-186,Buri Buri Gangiri DJ Aphrodisiac Habu Sake Overdose Kimesek SEASON21 Walnut Sakura,https://pic.javct.net/poster/06032026/1775263021.jpg,https://javct.net/v/bab-186,125,2026-04-04
SAN-099-RM,Busty Wife With Long Black Hair Seeking The Body Of A Cuckold Man Who Don't Know Her Name / Rina Takase [Uncensored L**ked],https://pic.javct.net/poster/20233001/1677552866.jpg,https://javct.net/v/san-099-rm,120,2026-04-04
MARA-009-RM,Kiyozuka Nana Tits Theater Icup!101cm [Uncensored L**ked],https://pic.javct.net/poster/06032026/1775271155.jpg,https://javct.net/v/mara-009-rm,133,2026-04-04
LULU-138-RM,3 Days With Girlfriend Away On Trip. Thoroughly Probed Anus Of Big Tits Sister And Taught Her To Kiss And Make Love. Alice Otsu [Uncensored L**ked],https://pic.javct.net/poster/20221904/1651300385.jpg,https://javct.net/v/lulu-138-rm,160,2026-04-04
WKD-046-RM,Fallen*W-O-M-A-N - Akari Niimura [Uncensored L**ked],https://pic.javct.net/poster/20212709/1632750592.jpg,https://javct.net/v/wkd-046-rm,52,2026-04-04
SOAN-025-RM,My Wife Analal Lending Bulletin Board Sakura (28 Years Old) Is A Wife Of A Former Pink Companion Of G Cup Big Tits.It Is A Hope That Can Do Sexual Intercourse And Sandwich Orgy In Zama City. [Uncensored L**ked],https://pic.javct.net/poster/06032026/1775270689.jpg,https://javct.net/v/soan-025-rm,115,2026-04-04
NGOD-185-RM,JET Video 7th Anniversary Serial Drama Cuckold Trilogy My Bride Was Cuckold So I'm Going To Cuckold My Wife [Chapter 3] In The Case Of A Misaki Couple Sakura Misaki [Uncensored L**ked],https://pic.javct.net/poster/20222410/1667535164.jpg,https://javct.net/v/ngod-185-rm,120,2026-04-04
SCOP-825-RM,"A Super-strike Big-breasted Girl Enters A Certain Boob Pub In Tokyo Where It Is Strictly Forbidden Not Only To Have Sex, But Also To Have Sex With Her! ! I Sucked And Massaged Her Breasts, And Secretly Put An Aphrodisiac On Them So That I Wouldn't Find Out, And The Sensitivity Increased And My Pussy Juice L**ked Out And It Was Like A Carnival! ! God-friendly Service That Obediently Responds Even When Taken Out Of The Store. [Uncensored L**ked]",https://pic.javct.net/poster/20231011/1697858094.jpg,https://javct.net/v/scop-825-rm,145,2026-04-04
MILK-187-RM,"Immediate Sex, Raw Sex, Creampie, All OK! We Have An Extremely Erotic Bitch GAL Who Will Tolerate Anything! Delivery Health Specializing In Back Paco! ! Rika Tsubaki [Uncensored L**ked]",https://pic.javct.net/poster/20231011/1697683237.jpg,https://javct.net/v/milk-187-rm,146,2026-04-04
SUJI-203-RM,Forbidden Brother-sister Creampie Incest Where Immorality Doubles The Excitement Konatsu Shaved Konatsu Kashiwagi [Uncensored L**ked],https://pic.javct.net/poster/20231011/1697254120.jpg,https://javct.net/v/suji-203-rm,110,2026-04-04
MASM-017-RM,I Love You So Much That I Want To Destroy You. My Extreme Creampie Life Confined To A Cute Yandere J-type Sakura Kurumi [Uncensored L**ked],https://pic.javct.net/poster/20231011/1697252429.jpg,https://javct.net/v/masm-017-rm,118,2026-04-04
ROYD-015-RM,"Well, Teacher, Is Your Bra Black Today? I Couldn't Put Up With Seeing A Tutor Sister Whose Underwear Was Invisible Due To Sudden Heavy Rain, And I Couldn't Stand It... Kaede Ito [Uncensored L**ked]",https://pic.javct.net/poster/20230908/1696577524.jpg,https://javct.net/v/royd-015-rm,150,2026-04-04
WKD-047-RM,Peak of Womanhood Mao Kurata [Uncensored L**ked],https://pic.javct.net/poster/20212709/1634910071.jpg,https://javct.net/v/wkd-047-rm,62,2026-04-04
JUE-014-RM,"Showa Era: A Maid Living In A Rural Village After The War. The Desires Of Men Surrounding A Woman With No Relatives. The Owner Of An Evil Hot Spring Inn, The Heir Son Who Was Fo**ed To Marry, And A Reunion With A C**ldhood Friend. Miki Yoshii [Uncensored L**ked]",https://pic.javct.net/poster/20231011/1697860113.jpg,https://javct.net/v/jue-014-rm,120,2026-04-04
SUJI-204-RM,"Sora/Hikaru, A Healing Beautiful Girl Who Will Fulfill Your Sexual Desires And Wishes For Adults [Uncensored L**ked]",https://pic.javct.net/poster/20231011/1697254053.jpg,https://javct.net/v/suji-204-rm,104,2026-04-04
CHN-150-RM,I Will Lend You A New Amateur Girl. 72 Kana) Niijima Sakura (clerk At The Apparel) Is 21 Years Old. [Uncensored L**ked],https://pic.javct.net/poster/06032026/1775270361.jpg,https://javct.net/v/chn-150-rm,145,2026-04-04
SOE-529-RM,Hana Haruna K BODY Ultimate Cup 108cm [Uncensored L**ked],https://pic.javct.net/poster/06032026/1775270425.jpg,https://javct.net/v/soe-529-rm,180,2026-04-04
PXH-007-RM,Cosplay Cannonball RUN.07 Supreme Talent × Sucks × Erokos Hachino Tsubasa [Uncensored L**ked],https://pic.javct.net/poster/06032026/1775270174.jpg,https://javct.net/v/pxh-007-rm,120,2026-04-04
MIAA-216-RM,Brainwashing Trans Climax Intercourse Strong ● Dirty Aheiki Brain Orgasm Nekari Akira [Uncensored L**ked],https://pic.javct.net/poster/20241804/1716335699.jpg,https://javct.net/v/miaa-216-rm,160,2026-04-04
SAN-098-RM,Busty Wife Who Got Pregnant With Her Father-In-Law's C**ld While Her Husband Was Hospitalized / Hana Himesaki [Uncensored L**ked],https://pic.javct.net/poster/20233001/1677552929.jpg,https://javct.net/v/san-098-rm,120,2026-04-04
PXH-008-RM,Cosplay Cannonball RUN.08 Big Breasts Fcup × Nice Bottom × Erokos Maria Azawa [Uncensored L**ked],https://pic.javct.net/poster/06032026/1775270239.jpg,https://javct.net/v/pxh-008-rm,120,2026-04-04
