code,title,image_url,page_url,views,date_scraped
HUNT-947,"Surrounded By A Company Trip To Female Employees To Man My One King Game!I That Had A Job At A Company Full Of Women.Every Day, So I Of Which Is Pressed Against Anything Tea Set And Chores, Etc., Not Yasumara Cares Exactly The Same Situation, Even To Go To The Hot Spring Inn In The Company Trip. Three",https://pic.javct.net/poster/06032026/1773029949.jpg,https://javct.net/v/hunt-947,400,2026-03-09
SKMJ-712-RM,"Genuine Amateur Pick-up! [Single Woman On Her Way Home From A Wedding Vs. Unpopular Guy] Rumors That No Matter How Beautiful A Girl Is, She's Always Longing For Human Contact And Is Always On The Lookout! Is It True That She Wants To Get Married And Get Pregnant And Won't Refuse Creampies? Unpopular Guy Will Create A Miracle!? [Uncensored L**ked]",https://pic.javct.net/poster/01202026/1769312217.jpg,https://javct.net/v/skmj-712-rm,217,2026-03-09
DVAJ-732-RM,"When The Beautiful Office Lady In The Room Opposite Shows Off Her High-end Lingerie And Invites Me In... She Gives Me A Disgustingly Vulgar, Crab-legged Cowgirl Position That Makes My Waist Sink And I Cum. She Obscenely Preys On Me And Squeezes Out All My Semen. Kozu Mikan [Uncensored L**ked]",https://pic.javct.net/poster/06032026/1772849442.jpg,https://javct.net/v/dvaj-732-rm,118,2026-03-09
MIDE-683-RM,J Cup Advertising Department Female Employee Changed To AV Actress Breaks Serious And Unobtrusive Color MOODYZ Dengeki Transfer Awakening 4 Special Special Kana Kusakabe [Uncensored L**ked],https://pic.javct.net/poster/20230104/1681898827.jpg,https://javct.net/v/mide-683-rm,240,2026-03-09
VGD-132,To Obscene Madonna Fragrance Journey,https://pic.javct.net/poster/06032026/1773022445.jpg,https://javct.net/v/vgd-132,140,2026-03-09
NACX-166-RM,41 Fifty-Something Mature Women In The Strongest Cowgirl Position [Uncensored L**ked],https://pic.javct.net/poster/01202026/1772643512.jpg,https://javct.net/v/nacx-166-rm,218,2026-03-09
XVSR-191,Certain Ultra-luxury Este Nomination Of NO.1 Esthetician AV Debut Sayo Kanno,https://pic.javct.net/poster/06032026/1773022381.jpg,https://javct.net/v/xvsr-191,120,2026-03-09
AVSA-424-RM,"Ultra Close-Up: Voluptuous, Voluptuous Body, Big Tits, Voluptuous, Crazy, Hoshino Iroha [Uncensored L**ked]",https://pic.javct.net/poster/06032026/1772849752.jpg,https://javct.net/v/avsa-424-rm,134,2026-03-09
MUDR-087,Ever Since That Day ... Uniform Girl Nazuna Nonohara To Be Put Out In Bondage Training,https://pic.javct.net/poster/06032026/1773018970.jpg,https://javct.net/v/mudr-087,110,2026-03-09
ANKB-041-RM,A Sex-addicted College Girl With A Bulging Libido [Uncensored L**ked],https://pic.javct.net/poster/06032026/1772848447.jpg,https://javct.net/v/ankb-041-rm,115,2026-03-09
JUY-269-RM,"Suddenly, A Sudden Approach With My Neighborhood Married Woman In The Same Direction Both In The Office And Home. Kase Kanako [Uncensored L**ked]",https://pic.javct.net/poster/06032026/1773018010.jpg,https://javct.net/v/juy-269-rm,120,2026-03-09
FSDSS-327-RM,My Step-brother Was Away For Three Days. This Is A Record Of Her Moaning And Coming To Life With A Meat Stick Other Than Her Step-Brother's. Kaname Momojiri [Uncensored L**ked],https://pic.javct.net/poster/20212709/1636606722.jpg,https://javct.net/v/fsdss-327-rm,124,2026-03-09
IENF-411-RM,Itsuwa [Uncensored L**ked],https://pic.javct.net/poster/20250606/1752116932.jpg,https://javct.net/v/ienf-411-rm,143,2026-03-09
BACJ-176-RM,"""I Don't Want You To Look At Any Other Woman Besides Me. If We Have A Baby... We Can Be Together Forever, Right?"" The Broken Love Of A Landmine Wife, Hikaru Konno [Uncensored L**ked]",https://pic.javct.net/poster/06032026/1772848696.jpg,https://javct.net/v/bacj-176-rm,109,2026-03-09
MIAA-098-RM,"My Friend Said That She Wanted To See Some Adult Videos That Her Big Brother Had Stashed Away, And This Girl I Liked Tagged Along Too, So This Is The Story Of What Happened That Day - Inaba Ruka, Sasahara Rin [Uncensored L**ked]",https://pic.javct.net/poster/06032026/1773017884.jpg,https://javct.net/v/miaa-098-rm,120,2026-03-09
JUY-271-RM,"[Caution Before Viewing] The Worst NTR Story Ever I'm On Post Away From My Family, And I Wanted To Surprise My Wife On Her Birthday By Secretly Coming Home... But Then I Found My Wife Coming Home With My Boss, So I Hid Underneath The Bed And Listened To Them Fuck All Night [Uncensored L**ked]",https://pic.javct.net/poster/20212011/1641470662.jpg,https://javct.net/v/juy-271-rm,119,2026-03-09
JUX-851-RM,Of Woman Boss Temptation Yumi Kazama [Uncensored L**ked],https://pic.javct.net/poster/20230206/1688014658.jpg,https://javct.net/v/jux-851-rm,120,2026-03-09
FC2PPV-4860563,[Personal shooting] Raw sex from a love hotel photo session with F cup beautiful big breasts KanColle Kashima cosplayer and official management costume,https://pic.javct.net/poster/06032026/1773015548.jpg,https://javct.net/v/fc2ppv-4860563,54,2026-03-09
KTRA-775,Friendly Sex With Cute Big-Titted Sisters 4 Hours,https://pic.javct.net/poster/06032026/1772989747.jpg,https://javct.net/v/ktra-775,243,2026-03-09
STARS-501-SUB,"Kanan Amamiya Who Can Ejaculate At Least 3 Times Even In A Short Time Secret Meeting Of 2 Hours Break With Mr. A, A Convenience Store Housewife Who Has The Best Physical Compatibility [English Subtitle]",https://pic.javct.net/poster/20212011/1644374867.jpg,https://javct.net/v/stars-501-sub,130,2026-03-09
RKI-740-RM,Breasts. -About Breast Movement- Ririka Amano And Shiori Yorimoto [Uncensored L**ked],https://pic.javct.net/poster/06032026/1772804791.jpg,https://javct.net/v/rki-740-rm,150,2026-03-09
STSK-216,#Minato Ward Hostess #Big-Breasted Cast #Dazed #Obscene Molester,https://pic.javct.net/poster/06032026/1772989165.jpg,https://javct.net/v/stsk-216,169,2026-03-09
BAB-185,"It's Awkward, But The Video Of My Sister Telling Her Husband And Sister About Her Life As A Sex Slave Is Revealed Over The Phone.",https://pic.javct.net/poster/06032026/1772990022.jpg,https://javct.net/v/bab-185,146,2026-03-09
STARS-603-RM,I Was A Virgin Who Was Seduced By A Busty Tutor Whose Erotic Deviation Value Was Too High And Was Made To Ejaculate 10 Shots. Miran Suzuhara [Uncensored L**ked],https://pic.javct.net/poster/20221904/1652172432.jpg,https://javct.net/v/stars-603-rm,125,2026-03-09
