code,title,image_url,page_url,views,date_scraped
FC2PPV-4901241,[First shot/Individual shooting] Still mature./Long/Medium big breasts G cup./Role/JD❣Idol-class beauty with a tall body and well-defined body♡A huge amount of creampie deep inside the vagina with raw dick inserted into the super sensitive and tight pussy♡[Bonus: High resolution] [Main story/No face],https://pic.javct.net/poster/04112026/14effd18a8.jpg,https://javct.net/v/fc2ppv-4901241,72,2026-05-16
FC2PPV-4899947,[Former beautiful witch of CA] **pyjpx*jsps A secret meeting with a housewife who loves dick but is starving due to lack of sex,https://pic.javct.net/poster/04112026/62fdd145e8.jpg,https://javct.net/v/fc2ppv-4899947,58,2026-05-16
SQTE-684-RM,My Vagina Feels Amazing Deep Inside! I Want A Huge Cock To Thrust Into My Cervix. - Honjo Hana [Uncensored L**ked],https://pic.javct.net/poster/04112026/1b128f55d7.jpg,https://javct.net/v/sqte-684-rm,105,2026-05-16
DORI-098-RM,Paco Shooting No.98 Toroman Slender Beautiful Girl Who Came To Shine Before Playing With Friends Reina-chan Murase Rena [Uncensored L**ked],https://pic.javct.net/poster/20230804/1691818715.jpg,https://javct.net/v/dori-098-rm,85,2026-05-16
AKDL-011-RM,The librarian is a delusional girl who sneaks out during work and has sex with me! In the middle [Uncensored L**ked],https://pic.javct.net/poster/06032026/1773881644.jpg,https://javct.net/v/akdl-011-rm,79,2026-05-16
AKDL-012-RM,"[Verification AV] If you put an aphrodisiac in an open-air bath, you will get unexpected results! [Uncensored L**ked]",https://pic.javct.net/poster/06032026/1773807400.jpg,https://javct.net/v/akdl-012-rm,136,2026-05-16
HALT-033-RM,Kamihada Icharab Experience With An Active Nursery Teacher [Uncensored L**ked],https://pic.javct.net/poster/20230804/1691818286.jpg,https://javct.net/v/halt-033-rm,119,2026-05-16
ONEZ-090-RM,Solder Mistress Azabu Dating Club Affiliation Active Young Student Yuzu 20 Years Old 002 [Uncensored L**ked],https://pic.javct.net/poster/04112026/b52a9562d6.jpg,https://javct.net/v/onez-090-rm,120,2026-05-16
HMN-857-RM,Miracle In The 15th Year Of The School – The Birth Of An Absolute New Ace. Mian Akiyama [Uncensored L**ked],https://pic.javct.net/poster/04112026/adb6674e73.jpg,https://javct.net/v/hmn-857-rm,190,2026-05-16
PRST-027-RM,"Newcomer! Yua Hidaka Makes Her AV Debut. A Nine-head-tall Beauty Discovered. Wild, Orgasmic Sex Behind Her Boyfriend's Back. [Uncensored L**ked]",https://pic.javct.net/poster/04112026/309b0012e7.jpg,https://javct.net/v/prst-027-rm,140,2026-05-16
FC2PPV-4899463,"[No] She wears gym clothes and her breasts look great on her, and her cute E-cup beautiful breasts are no longer **⤴ She cums with a suction vibrator and cums all the time with convulsions and a huge facial cumshot *Bonus High resolution",https://pic.javct.net/poster/04112026/047c52ab98.jpg,https://javct.net/v/fc2ppv-4899463,55,2026-05-16
FC2PPV-4900977,[Complete amateur creampie] I will be creampied raw by a cute JD 20-year-old uncle who is a cunnilingus expert who is like my uncle's favorite little devil idol (creampie included as a bonus),https://pic.javct.net/poster/04112026/254ecfd745.jpg,https://javct.net/v/fc2ppv-4900977,43,2026-05-16
FC2PPV-4822930,Massive creampie ejaculation to the erotic girl whose spilled tits are dying [Uncensored creampie],https://pic.javct.net/poster/04112026/396ae5a9aa.jpg,https://javct.net/v/fc2ppv-4822930,72,2026-05-16
KSBJ-076,Harassment Of Escalating Son-in-law Haruka Ayane,https://pic.javct.net/poster/04112026/d025908fb0.jpg,https://javct.net/v/ksbj-076,120,2026-05-16
ONEZ-091-RM,Sleeping Wife Erectile Dysfunction ED I Am Shooting A Figure That Makes My Beloved Wife Embrace Other People At The Hotel At The Weekend Riho 26 Years Old [Uncensored L**ked],https://pic.javct.net/poster/04112026/e5b81cdaf9.jpg,https://javct.net/v/onez-091-rm,125,2026-05-16
MIDA-591-RM,"Newcomer, Top-tier, Gorgeous Raw Talent: Misaki Mayu [Uncensored L**ked]",https://pic.javct.net/poster/04112026/da3df9acb2.jpg,https://javct.net/v/mida-591-rm,160,2026-05-16
FC2PPV-4898656,[Individual photo shoot] I was served by a neat and clean newlywed wife with a plump and nice body.,https://pic.javct.net/poster/04112026/79ee3da1f0.jpg,https://javct.net/v/fc2ppv-4898656,27,2026-05-16
HARU-021,Plump In Black Pantyhose Older Sister Legs Desperate To Put In My Semen!,https://pic.javct.net/poster/04112026/8af57a2fbe.jpg,https://javct.net/v/haru-021,126,2026-05-16
SQTE-686,"After School, We Had A Sleepover Sex Session. It Felt So Good That We Even Had Sex Before Going To School. - Yuna Hinata",https://pic.javct.net/poster/04112026/37fb4092c1.jpg,https://javct.net/v/sqte-686,118,2026-05-16
AKDL-070,"[Shin Mama Video] Beautiful wife Yumika, 35 years old Yumika Saeki, is desperately trying to suppress her voice while her c**ld is in the next room.",https://pic.javct.net/poster/04112026/ffd657dc8e.jpg,https://javct.net/v/akdl-070,59,2026-05-16
FNS-209,"It Was A Saturday Morning When I Was Woken Up At My House By A Male Friend. We Had Lunch, Had Sex, Went To The Convenience Store In The Evening, Had Sex, And Slept Together Again On Sunday Night. Ranran Fujii",https://pic.javct.net/poster/04112026/01b4dfd536.jpg,https://javct.net/v/fns-209,150,2026-05-16
EYAN-220-RM,"My Husband, Whose Company Has An Annual Turnover Of 2 Billion Yen, Said, ""You Should Try Appearing In An Adult Video."" I Applied Without Asking Any Questions. [Husband-approved AV Debut] Natsuka (28) [Uncensored L**ked]",https://pic.javct.net/poster/04112026/d0df51bbfe.jpg,https://javct.net/v/eyan-220-rm,140,2026-05-16
MGMJ-084,"Tomoda's Pantyhose-clad Legs Are So Erotic, My Brain Is Melting. - Sayaka Tomoda",https://pic.javct.net/poster/04112026/b73fc315c3.jpg,https://javct.net/v/mgmj-084,121,2026-05-16
FFT-041-RM,"First-time Wife, A Wife Who Dedicates Everything To Her Husband, Her First 'cheating Cock'. She Can't Lie About The Perversion Hidden Within. Sui, 29 Years Old [Uncensored L**ked]",https://pic.javct.net/poster/04112026/1776305122.jpg,https://javct.net/v/fft-041-rm,135,2026-05-16
