code,title,image_url,page_url,views,date_scraped
SABA-851-RM,Immediate Saddle Raw Creampie OK Saffle-chan Gonzo AV Shooting 02 [Uncensored L**ked],https://pic.javct.net/poster/20230908/1694235230.jpg,https://javct.net/v/saba-851-rm,120,2026-05-02
NACR-726-RM,"Leave It To Shiori Tsukada. Consultation Room For Any Concerns You May Have. ""For Uncut Cherry College Students."" [Uncensored L**ked]",https://pic.javct.net/poster/20231011/1699155376.jpg,https://javct.net/v/nacr-726-rm,120,2026-05-02
STAR-963-RM,"Dense, Dense, Close, And Rough Melting Brains!Entangling Kissing Sound Even After Ejaculation Sought Fire Continuation Burntuous Intercourse Honjo Bell [Uncensored L**ked]",https://pic.javct.net/poster/20222612/1674067225.jpg,https://javct.net/v/star-963-rm,195,2026-05-02
SQTE-496-RM,She Looks Bright But Is Surprisingly Perverted. A God-style Perverted Beauty S-Cute Makes Her Debut! Reia Shiraishi [Uncensored L**ked],https://pic.javct.net/poster/20230908/1694839523.jpg,https://javct.net/v/sqte-496-rm,109,2026-05-02
TPPN-021-RM,"Speechless Obscene, Prisoner Of Libido Without End. Rei Aoki [Uncensored L**ked]",https://pic.javct.net/poster/04112026/396d610718.jpg,https://javct.net/v/tppn-021-rm,120,2026-05-02
CLO-054-RM,convulsions! incontinence! ! Gakuburu FUCK! ! ! Ichika Kanhata [Uncensored L**ked],https://pic.javct.net/poster/04112026/1dbabaab68.jpg,https://javct.net/v/clo-054-rm,35,2026-05-02
HEZ-886-RM,Mature Women Oral Sex Collection: Massive Ejaculations Of Semen Into The Mouth!! 20 Consecutive Shameful Blowjobs!! Vol. 2 [Uncensored L**ked],https://pic.javct.net/poster/04112026/4d066e0b40.jpg,https://javct.net/v/hez-886-rm,170,2026-05-02
DIC-047-RM,18 Years And 9 Months. 08 Beautiful Breast E Cup × Number Of Experienced Person 1 X Life First Life [Uncensored L**ked],https://pic.javct.net/poster/04112026/0cbd607158.jpg,https://javct.net/v/dic-047-rm,150,2026-05-02
DLDSS-500-RM,"Newcomer, ""Perverted Age"", Kasuga Oto, 34 Years Old, AV Debut, The ""orthodox"" Real Married Woman Presented By The New DAHLIA. [Uncensored L**ked]",https://pic.javct.net/poster/04112026/d84ad92332.jpg,https://javct.net/v/dldss-500-rm,220,2026-05-02
TPPN-023-RM,"Speechless Obscene, Prisoner Of Libido Without End. Mikami Riho [Uncensored L**ked]",https://pic.javct.net/poster/20230908/1694517790.jpg,https://javct.net/v/tppn-023-rm,120,2026-05-02
TPPN-022-RM,Love Juice And Sweat.Cum Repeat. Azusa Itagaki [Uncensored L**ked],https://pic.javct.net/poster/04112026/b3edf28cbb.jpg,https://javct.net/v/tppn-022-rm,120,2026-05-02
SCOP-581,"After Having Thoroughly Thoroughly Blowjobs, Beating Beyond The Limit Of Patience ● Pumping In The Cooker!This Is The Strongest Royal Road!Male And Female Sexual Intercourse Starting From Blowjob SP!2",https://pic.javct.net/poster/04112026/8375e86727.jpg,https://javct.net/v/scop-581,240,2026-05-02
AMBI-161-RM,I Come Here After School And Am Played With By An Old Man. Mashiro Minori [Uncensored L**ked],https://pic.javct.net/poster/20222410/1668911296.jpg,https://javct.net/v/ambi-161-rm,121,2026-05-02
HUNTB-647-RM,"""I'm A Little Touched By My Crotch..."" A Beautiful Personal Trainer With An Outstanding Style Of Zero-distance Super-adherence Guidance! Full Erection As Soon As You Are Instructed Like That! I Noticed More Erections. [Uncensored L**ked]",https://pic.javct.net/poster/20230908/1694145273.jpg,https://javct.net/v/huntb-647-rm,180,2026-05-02
UD-821,Every Man Wants To Experience It At Least Once In His Life!! The Best 6 Of Highly Select Horny Mature Woman Babes!! (Beautiful Mature Woman Edition) Part 2 6,https://pic.javct.net/poster/04112026/cd696ca58d.jpg,https://javct.net/v/ud-821,181,2026-05-02
MIDA-619-RM,"Reunited With The Senior I Had A Crush On In High School At A Call Girl Service—reminiscing About My First Love, Uniform, All Optional Services♪ Full Sex OK, Pussy Pounding, Cheating, I'm A Slut Yagi Nana [Uncensored L**ked]",https://pic.javct.net/poster/04112026/627de60243.jpg,https://javct.net/v/mida-619-rm,120,2026-05-02
SQTE-681,I Want To Have Sex With Her Without Taking Off Her Panties. Miyu Aizawa,https://pic.javct.net/poster/04112026/6f1c05cf8a.jpg,https://javct.net/v/sqte-681,102,2026-05-02
SQTE-679,I'll Empty Your Balls. Misaki Oto X Minami Hinano,https://pic.javct.net/poster/04112026/f84fe5e786.jpg,https://javct.net/v/sqte-679,100,2026-05-02
MGOLD-061,"My Internationally Married Wife Cheated On Me, So I Started Making Love With My Dad's Big-breasted Stepc**ld! Lisa",https://pic.javct.net/poster/04112026/f0880912c0.jpg,https://javct.net/v/mgold-061,105,2026-05-02
MIDA-623-RM,"When My Tutor, Ms. Sakura, Found Out I'm Abstaining From Masturbation, She Gave Me A Seductive, Wet Look... ""Just A Blowjob Wouldn't Be Cheating, Right?""... And To Make Matters Worse, It Looks Like There's Going To Be A Torrential Downpour Tonight That Will Make It Difficult To Get Home... (crying) Kawaguchi Sakura [Uncensored L**ked]",https://pic.javct.net/poster/04112026/46845ce8a3.jpg,https://javct.net/v/mida-623-rm,120,2026-05-02
MIDA-610-RM,"Love You. I Unexpectedly Ran Into My Ex-girlfriend From My Student Days. She Was Dating A Scumbag Boyfriend, But I Had Sex With Her Countless Times. [Uncensored L**ked]",https://pic.javct.net/poster/04112026/796dae1f6c.jpg,https://javct.net/v/mida-610-rm,120,2026-05-02
MGMQ-127-RM,"My Best Friend's Girlfriend Is A Perverted Slut, And While My Best Friend Was Away, My Anus Was Developed And I Was Fo**ed To Cum. Satsuki Ena [Uncensored L**ked]",https://pic.javct.net/poster/20241902/1708743385.jpg,https://javct.net/v/mgmq-127-rm,112,2026-05-02
PPPE-317-SUB,"""I Was The Reason He Married My Mother"" One Week After My Wife Returned Home, I Piston-trained My Precocious Big-breasted Stepdaughter With My Insatiable Cock Rima Arai [English Subtitle]",https://pic.javct.net/poster/20250903/1741887874.jpg,https://javct.net/v/pppe-317-sub,150,2026-05-02
FC2PPV-4890710,"[Bonus included] [Personal shooting] [Full face exposed] A 28-year-old beautiful conductor has a neat appearance, but her sensitive body makes her squirt easily. Her wet pussy is stirred and she reaches continuous orgasms.",https://pic.javct.net/poster/04112026/06e901a3b3.jpg,https://javct.net/v/fc2ppv-4890710,40,2026-05-02
