code,title,image_url,page_url,views,date_scraped
DNJR-104-RM,The Desperate Face Of A Masochistic Man Who Is Resisting ~ I Love It Specializing In Ejaculation Patience Daddy Live Girl Live Hikaru Minazuki [Uncensored L**ked],https://pic.javct.net/poster/20230207/1688787944.jpg,https://javct.net/v/dnjr-104-rm,144,2026-05-29
DANDY-866-RM,"A Girl Who Got Wet In The Rain ○ A See-through Bra Is Too Erotic! ! I Will Unconsciously Tempt You, So I Will Start Fir Tree Immediately [Uncensored L**ked]",https://pic.javct.net/poster/20230207/1689826465.jpg,https://javct.net/v/dandy-866-rm,170,2026-05-29
BACJ-063-RM,"At Manken, I Was In A Princess State Of A Reverse Otaku, And I Was Made To Ejaculate Many Times By Sullen Female Otaku Who Were Deeply Interested In Erotic Things. [Uncensored L**ked]",https://pic.javct.net/poster/20230207/1688788310.jpg,https://javct.net/v/bacj-063-rm,130,2026-05-29
ONEZ-110-RM,A Rookie AVDebut! Why Do Girls Who Were Born And Raised In Hiroshima And Went To School Half A Year Ago Have A Height Of 148 Cm And Are 18 Years Old Appeared In Adult Videos? Hina No Sato [Uncensored L**ked],https://pic.javct.net/poster/05192026/25a39e4ed7.jpg,https://javct.net/v/onez-110-rm,120,2026-05-29
ONEZ-111-RM,"I Am From Hokkaido ""I'm Interested In Something Erotic"" Experienced Person 1 Person.My Parents Are 358 Tokyo Dome Farmers Who Dairy Farmers I Was Born And Grew Up In A Large Area Of ​​1,700 Hectares It Is Impossible To Imagine From The Apparent Look Like Me Why Do 20 Of My Oldest Appearances In Adult Videos?Kurihara Wrapping [Uncensored L**ked]",https://pic.javct.net/poster/05192026/df57a9ebda.jpg,https://javct.net/v/onez-111-rm,125,2026-05-29
ADN-779,A Female College Student Was Fo**ed To Lick The Extremely Smelly Penis Of An Otaku From The Bath Cancellation Community.,https://pic.javct.net/poster/05192026/07e4014ade.jpg,https://javct.net/v/adn-779,150,2026-05-29
MIDA-648,"When I Found Out My Best Friend's Sister Was A Call Girl, I Ordered All The Options From Her First Day And Had Sex With Her Like Crazy.",https://pic.javct.net/poster/05192026/c6256c1186.jpg,https://javct.net/v/mida-648,160,2026-05-29
ECB-167,"A Woman Who Acts Like A Nymphomaniac, A Man Who Is R**ed, And Us Who Are Bystanders Watching It All ()",https://pic.javct.net/poster/05192026/db5dd9705a.jpg,https://javct.net/v/ecb-167,137,2026-05-29
MNGS-058,"Erotic Urban Legend Series: Nanase Alice, Who Sucks And Licks Even The Smegma Off Dirty Cocks.",https://pic.javct.net/poster/05192026/0377fc5978.jpg,https://javct.net/v/mngs-058,120,2026-05-29
ATID-679,"Our Married Housekeepers Will Serve You Courteously And Without Complaint, Fulfilling Even The Most Lewd Requests.",https://pic.javct.net/poster/05192026/ba963eef46.jpg,https://javct.net/v/atid-679,150,2026-05-29
DVMM-404,A Daily Life Of Cherishing Penises. A Self-improvement Office Lady's Slow Life In Tokyo. Mano Inori,https://pic.javct.net/poster/05192026/4c749019b5.jpg,https://javct.net/v/dvmm-404,120,2026-05-29
CAWD-964,Is She The Reason You're Having A Sexless Relationship? I'll Win You Over With Sexy Kisses And Oral Sex That Will Make You Want To Hug Me. - Mayuki Ito,https://pic.javct.net/poster/05192026/d3f2fc1dc6.jpg,https://javct.net/v/cawd-964,150,2026-05-29
MIDA-664,"Newcomer, Is It Okay If She's A Girl Who Likes Both Cooking And Sex? A Three-star Beauty Makes Her AV Debut With The Most Erotic Sex Ever!! Yuuki Nozomi",https://pic.javct.net/poster/05192026/518353d1f7.jpg,https://javct.net/v/mida-664,190,2026-05-29
NIMA-079,"A Work From The Hugely Popular Circle ""Tama Gou""! Live-action Version! Bullying Deserves Punishment From Mom!! Kinoshita Himari",https://pic.javct.net/poster/05192026/418625a9e1.jpg,https://javct.net/v/nima-079,120,2026-05-29
MIDA-642,"An Unfairly Sexy Body. A Regular Office Worker, She Makes Her AV Debut As A Side Job. Limited Edition, One Release Only: Mari Morishita.",https://pic.javct.net/poster/05192026/835a96da89.jpg,https://javct.net/v/mida-642,140,2026-05-29
SAME-233,A Widow Announces Her Pregnancy With Sorrow.,https://pic.javct.net/poster/05192026/c4820bf23d.jpg,https://javct.net/v/same-233,120,2026-05-29
MIDA-647,"Giant Dick NTR: A Gym Teacher With A Huge Cock Forces His Beloved Slender Club Manager's Undeveloped Pussy Deep Inside, Thrusting And Making Her Arch Her Back And Twitch As She Orgasms Against Her Will.",https://pic.javct.net/poster/05192026/f5c2dc7630.jpg,https://javct.net/v/mida-647,140,2026-05-29
LOCK-010-RM,"LOCK-ON@Mao I Took My Beautiful Colleague, Who Was Passed Out Drunk At A Drinking Party, Back To My Hotel... And In Her Drunken State, She Attacked Me And We Ended Up Having An Affair With Unprotected Sex. Takanashi Mao [Uncensored L**ked]",https://pic.javct.net/poster/05192026/6a9d1ba341.jpg,https://javct.net/v/lock-010-rm,124,2026-05-29
FC2PPV-4908423,"[Idol SSS class] [Limited quantity, all episodes available for viewing] [Completely secret version] Dedicated to everyone who loves FC2 Tsundere type Kanna-chan, quarter 19-year-old JD shows off her true abomination [Chapter 12]",https://pic.javct.net/poster/05192026/12c6a7c701.jpg,https://javct.net/v/fc2ppv-4908423,99,2026-05-29
10-052826-01,Met this cute girl through the friend who loves Sex vol.2,https://pic.javct.net/poster/05192026/c2408d363d.jpg,https://javct.net/v/10-052826-01,60,2026-05-29
PA-052826-100,What If Your Dream Wife Wearing an Apron Naked? : Mirei Imada,https://pic.javct.net/poster/05192026/1710bf2e31.jpg,https://javct.net/v/pa-052826-100,27,2026-05-29
1P-052826-001,Devouring Men!,https://pic.javct.net/poster/05192026/30fce924df.jpg,https://javct.net/v/1p-052826-001,58,2026-05-29
FC2PPV-4908235,"[Individual shooting, blow job in the car & hot spring hotel] <Erotic girlfriend> Always in heat and loves cock! I love old men! Lewd exposed and hard piston!!",https://pic.javct.net/poster/05192026/62f3dbde94.jpg,https://javct.net/v/fc2ppv-4908235,29,2026-05-29
FC2PPV-4908563,"[Female Body Sharing Chapter 17] Frustrated fair-skinned petite young wife reappears to satisfy her sexual desire, demands black man again Creampie & ass ejaculation, 2 consecutive SEX in which she takes turns being penetrated Part 1 [Overseas version] Bonus included",https://pic.javct.net/poster/05192026/a6bbcf0508.jpg,https://javct.net/v/fc2ppv-4908563,42,2026-05-29
