code,title,image_url,page_url,views,date_scraped
FC2PPV-4892310,"[2 cameras uncensored] SEX addicted funky gal makes her second appearance, this time she goes crazy with machine gun anal fucking",https://pic.javct.net/poster/04112026/4ae7248de3.jpg,https://javct.net/v/fc2ppv-4892310,79,2026-05-01
MDTE-048-RM,Raw Vaginal Cum Shot To Erokawa Active Female College Student I Met Through God App 10 [Uncensored L**ked],https://pic.javct.net/poster/20230908/1694146697.jpg,https://javct.net/v/mdte-048-rm,195,2026-05-01
FC2PPV-4892042,"Mr. JD, who has a calm demeanor and whose eyes droop when he smiles, came to our store with an active approach looking for stimulation.",https://pic.javct.net/poster/04112026/4771eb4a3b.jpg,https://javct.net/v/fc2ppv-4892042,43,2026-05-01
ZEX-359-RM,Once You Eat Into Chi - Po!SUPON Blowjob Sister [Uncensored L**ked],https://pic.javct.net/poster/04112026/de92308a8b.jpg,https://javct.net/v/zex-359-rm,120,2026-05-01
FC2PPV-4892287,"[Silenceless married woman with her face exposed] It's a sight to see her small breasts and slender body being played with.The voice that she had been holding back came out, and she was almost unconscious.",https://pic.javct.net/poster/04112026/1bc9e92ef3.jpg,https://javct.net/v/fc2ppv-4892287,47,2026-05-01
YMDD-207-RM,Anaconda Sisters Astonishing Tornado Snake Tongue Sisters Sucking Thick Kiss [Uncensored L**ked],https://pic.javct.net/poster/04112026/e2e93bf7a3.jpg,https://javct.net/v/ymdd-207-rm,120,2026-05-01
EKW-082-RM,When I Was K**led And K**led At A Healthy Store And Appealed By Saying Ann An... Megu Mio [Uncensored L**ked],https://pic.javct.net/poster/20221108/1661488759.jpg,https://javct.net/v/ekw-082-rm,120,2026-05-01
TIMD-032-RM,"Aki-kun, A Boyish Yet Feminine, Incredibly Beautiful Boy. [Uncensored L**ked]",https://pic.javct.net/poster/04112026/b0e265ac45.jpg,https://javct.net/v/timd-032-rm,127,2026-05-01
DOKS-675,"Japanese Deepthroating, Where You Take The Dick All The Way To The Base Like A Foreigner.",https://pic.javct.net/poster/04112026/dab119a4e9.jpg,https://javct.net/v/doks-675,124,2026-05-01
DVMM-390,"My Sister-in-law's Love Juice-filled Pussy Is So Wet That Sperm Is Overflowing And Spurting Out As I Thrust My Dick In And Out, Keeping It Tight And Close As I Cum Inside Her. - An Nomiya",https://pic.javct.net/poster/04112026/cbae6c7c16.jpg,https://javct.net/v/dvmm-390,135,2026-05-01
MIDA-623,"When My Tutor, Ms. Sakura, Found Out I'm Abstaining From Masturbation, She Gave Me A Seductive, Wet Look... ""Just A Blowjob Wouldn't Be Cheating, Right?""... And To Make Matters Worse, It Looks Like There's Going To Be A Torrential Downpour Tonight That Will Make It Difficult To Get Home... (crying) Kawaguchi Sakura",https://pic.javct.net/poster/04112026/46845ce8a3.jpg,https://javct.net/v/mida-623,120,2026-05-01
HMHI-408-RM,Momoka [Uncensored L**ked],https://pic.javct.net/poster/04112026/9f7f3e01c4.jpg,https://javct.net/v/hmhi-408-rm,61,2026-05-01
DIC-045-RM,"The Strongest Acup Adachi Hikari AV Debut ""I Do Not Have Confidence In Myself, But ... Become An AV Actress, Are You OK?"" [Uncensored L**ked]",https://pic.javct.net/poster/10232025/1761825059.jpg,https://javct.net/v/dic-045-rm,135,2026-05-01
BACJ-070-RM,"Chihiro Watari, An Office Lady Who Seduces Her Inexperienced Boss Who Became A Shared Room On A Business Trip And Makes Her Cum To The Limit [Uncensored L**ked]",https://pic.javct.net/poster/20230908/1694232854.jpg,https://javct.net/v/bacj-070-rm,122,2026-05-01
DVAJ-629-RM,"""If You Ejaculate Too Much, You'll Become Stupid ♪"" My Stupid C**ldhood Friend Who Took The Shit Article On The Net Seriously, Sucked And Pacoed Over And Over Again To Beat Me In The Next Test. Kuru Flower Hunting Mai [Uncensored L**ked]",https://pic.javct.net/poster/20230908/1694231917.jpg,https://javct.net/v/dvaj-629-rm,140,2026-05-01
DLDSS-500,"Newcomer, ""Perverted Age"", Kasuga Oto, 34 Years Old, AV Debut, The ""orthodox"" Real Married Woman Presented By The New DAHLIA.",https://pic.javct.net/poster/04112026/d84ad92332.jpg,https://javct.net/v/dldss-500,220,2026-05-01
WAAA-638,"If You Can Withstand Miu Arioka's Amazing Technique, You'll Get Raw, Unprotected Sex!",https://pic.javct.net/poster/04112026/dd2af3d962.jpg,https://javct.net/v/waaa-638,170,2026-05-01
MIDA-610,"Love You. I Unexpectedly Ran Into My Ex-girlfriend From My Student Days. She Was Dating A Scumbag Boyfriend, But I Had Sex With Her Countless Times.",https://pic.javct.net/poster/04112026/796dae1f6c.jpg,https://javct.net/v/mida-610,120,2026-05-01
NIMA-080,Live-action Version!! The Story Of How I Got To Have Sex With An Incredibly Sexy Girl After Recruiting Voice Actresses For An Erotic Game - Himesaki Hana,https://pic.javct.net/poster/04112026/8f0733006c.jpg,https://javct.net/v/nima-080,120,2026-05-01
MIDA-619,"Reunited With The Senior I Had A Crush On In High School At A Call Girl Service—reminiscing About My First Love, Uniform, All Optional Services♪ Full Sex OK, Pussy Pounding, Cheating, I'm A Slut Yagi Nana",https://pic.javct.net/poster/04112026/627de60243.jpg,https://javct.net/v/mida-619,120,2026-05-01
MIAA-449-RM,"I Will Suck Off Anybody For A Set Price! If You Hire Her, You Can Call This Horny Blowjob Bitch To Give you A Lick Any Time You Want - Hana Hakuto [Uncensored L**ked]",https://static.javct.net/poster/miaa-449.jpg,https://javct.net/v/miaa-449-rm,119,2026-05-01
PRED-183,"Secret For Only Two People.On The Day Of That Typhoon, I Stayed At My Teacher's House And Had Vaginal Cum Shot Many Times. Shinoda Yu",https://pic.javct.net/poster/04112026/92dea61856.jpg,https://javct.net/v/pred-183,120,2026-05-01
FC2PPV-4889296,[Individual photography / men's esthetics] [Authorized as a secret massage therapist?!] <A well-trained beauty therapist> This erotic esthetician is in trouble. Stimulates the testicles and back muscles with an anal hand job while crawling on all fours! Raw creampie option available!!,https://pic.javct.net/poster/04112026/dee784790d.jpg,https://javct.net/v/fc2ppv-4889296,37,2026-05-01
PA-043026-100,"A Beautiful Mature Woman's Mouth, Pussy, and Ass: A Full Three-Hole Course!",https://pic.javct.net/poster/04112026/56bd93d92f.jpg,https://javct.net/v/pa-043026-100,60,2026-05-01
