code,title,image_url,page_url,views,date_scraped
FC2PPV-4895396,"A pure and beautiful beauty is released for the first time in her life, and she suddenly has two people in her life. A rich threesome that destroys her rationality, followed by continuous creampies. Bonus included.",https://pic.javct.net/poster/04112026/cf49a4dac8.jpg,https://javct.net/v/fc2ppv-4895396,57,2026-05-05
NACT-121,"A Young Wife, Sunao Kui, Finds Herself In Debt Hell After Her Husband Is Laid Off... She's Offered A ""secret Job For The Neighborhood"" By The Neighborhood Association Chairman To Pay Off Unpaid Membership Fees, And Becomes Addicted To The Pleasures Of The Job.",https://pic.javct.net/poster/04112026/a35facfe0a.jpg,https://javct.net/v/nact-121,124,2026-05-05
FC2PPV-4892437,[First time] **pyjpx*jsps Newcomer *Early purchase bonus Popular Reiwa hostess'' I released a rich male juice from Small fish man'' who is twitching to the limitless orgasm hell.,https://pic.javct.net/poster/04112026/dfda598e33.jpg,https://javct.net/v/fc2ppv-4892437,55,2026-05-05
NACT-124,A Sexually Insatiable Housewife Begs For Unprotected Sex During A Side Job: Sayuri Hayama,https://pic.javct.net/poster/04112026/7b82a93ba6.jpg,https://javct.net/v/nact-124,124,2026-05-05
FC2PPV-4895187,"[Married Woman Gonzo Edition with Apology for Showing Her Face] Sad news has come in.However, the request for re-shooting was answered.However, there are times when you have to apologize.",https://pic.javct.net/poster/04112026/d1833fc5d4.jpg,https://javct.net/v/fc2ppv-4895187,62,2026-05-05
FC2PPV-4892196,"[First time limited] Make me understand with a forceful blowjob...Super slender slender beauty's waist jerks, destroys the piston, surrenders, and cums inside her uterus and cums inside her",https://pic.javct.net/poster/04112026/64f94cfa69.jpg,https://javct.net/v/fc2ppv-4892196,66,2026-05-05
FC2PPV-4895395,"[Flame Wife Again] From a noble b**odline to a commoner, a married woman who suffers from the gap is recommended as a slender beauty who undergoes gonzo training",https://pic.javct.net/poster/04112026/59de244602.jpg,https://javct.net/v/fc2ppv-4895395,51,2026-05-05
FC2PPV-4892747,"Big Breasts, Big Ass [No] [Creampie] After enjoying the breasts like a super masochist cow, the I-cup big-breasted woman had creampie in her sensitive pussy and had good sensitivity, so it was fun *Bonuses included",https://pic.javct.net/poster/04112026/b152b1be97.jpg,https://javct.net/v/fc2ppv-4892747,43,2026-05-05
AMBI-165-RM,I Come Here After School And Am Played With By An Old Man. Marui Moeka [Uncensored L**ked],https://pic.javct.net/poster/20230104/1680667335.jpg,https://javct.net/v/ambi-165-rm,118,2026-05-05
FC2PPV-4894516,"[Part 2 of 19-year-old new female college student Mika-chan] I taught Mika-chan, who just entered university and doesn't even know how to moan, intense adult sex.",https://pic.javct.net/poster/04112026/046e96e125.jpg,https://javct.net/v/fc2ppv-4894516,50,2026-05-05
YMDD-340-RM,Clean Up The Sperm! Rumba GAL! Infiltrate The Burrow Of The Extreme Tongue Anaconda Gal! Excellent Without Rubber! A Raw-loving Daughter Is Defeated With A Pressure Piston! Layla Kato Layla [Uncensored L**ked],https://pic.javct.net/poster/20230804/1693628203.jpg,https://javct.net/v/ymdd-340-rm,120,2026-05-05
NACR-730-RM,Oil Mania Ayana Rina [Uncensored L**ked],https://pic.javct.net/poster/20231711/1700421012.jpg,https://javct.net/v/nacr-730-rm,122,2026-05-05
MIAA-296-RM,"Don't Put It Out On A Dangerous Day! Even After Ejaculation, It's A Terrifying Pacifier To Prevent Cleaning Blowjobs Without Stopping Erina Oka [Uncensored L**ked]",https://pic.javct.net/poster/20241804/1713854586.jpg,https://javct.net/v/miaa-296-rm,120,2026-05-05
LOL-218-RM,(B) Specialized C**ldhood Discovery! The Long-awaited Paipanro Data Capture! Alice-chan Alice Mizuki [Uncensored L**ked],https://pic.javct.net/poster/20230804/1693893909.jpg,https://javct.net/v/lol-218-rm,102,2026-05-05
FC2PPV-4891181,[Individual video] Creampie for a shy and neat office worker...,https://pic.javct.net/poster/04112026/4c49ddc582.jpg,https://javct.net/v/fc2ppv-4891181,28,2026-05-05
DOKS-675-RM,"Japanese Deepthroating, Where You Take The Dick All The Way To The Base Like A Foreigner. [Uncensored L**ked]",https://pic.javct.net/poster/04112026/dab119a4e9.jpg,https://javct.net/v/doks-675-rm,124,2026-05-05
DLDSS-501-RM,Exclusive Transfer DAHLIA Rin Yoda Creampie Ban Lifted. Crossing The Forbidden Wall And Becoming An Adult Woman. [Uncensored L**ked],https://pic.javct.net/poster/04112026/43ff9bedb6.jpg,https://javct.net/v/dldss-501-rm,130,2026-05-05
START-416,[Escape Condition: Master The Technique Of Making 5 Men With Delayed Ejaculation Cum Repeatedly!] You Can't Leave Until You've Made Them All Cum. Ejaculation Dungeon Ichinomiya Rui,https://pic.javct.net/poster/04112026/49d12ceb6b.jpg,https://javct.net/v/start-416,145,2026-05-05
SDJS-372,SOD Female Employee Disciplinary AV Appearance Narika Fukuhara,https://pic.javct.net/poster/04112026/15b7cb1772.jpg,https://javct.net/v/sdjs-372,100,2026-05-05
SAP-021-RM,Yua Aida Feeling Ecstacy [Uncensored L**ked],https://pic.javct.net/poster/04112026/8911906dc3.jpg,https://javct.net/v/sap-021-rm,100,2026-05-05
DASS-512-RM,Kana Hiiragi's Success Begins. I Tried To Train Her With The Most Theoretically Powerful AV Actress. Featuring Mao Hamasaki [Uncensored L**ked],https://pic.javct.net/poster/20240410/1729222758.jpg,https://javct.net/v/dass-512-rm,220,2026-05-05
FC2PPV-4891741,"Completely showing her face, the newlywed wife has a 21-year-old waist, busty, newlywed wife creampied while her husband is working, deep throating, anal licking, hands and feet fixed, neck ◯◯, bikini ◯◯, nostril licking, gag, individual shooting 540th person",https://pic.javct.net/poster/04112026/7c5147b509.jpg,https://javct.net/v/fc2ppv-4891741,238,2026-05-05
1P-050426-001,Welcome To Luxury Spa: Reina Ishizaki,https://pic.javct.net/poster/04112026/285da2aebd.jpg,https://javct.net/v/1p-050426-001,61,2026-05-05
DANDYA-034-RM,"""If You Get An Erection With Anyone Other Than Me, That's Cheating!"" A Virile Husband Is Repeatedly Given A No-hands Jealous Blowjob By His Possessive Wife, Who Controls His Ejaculation. VOL.2 [Uncensored L**ked]",https://pic.javct.net/poster/04112026/7907199ec4.jpg,https://javct.net/v/dandya-034-rm,187,2026-05-05
