code,title,image_url,page_url,views,date_scraped
DJE-065-RM,It Topped Kupaa Wakaba Onoe [Uncensored L**ked],https://pic.javct.net/poster/04112026/212afc1dc2.jpg,https://javct.net/v/dje-065-rm,180,2026-05-12
TOTK-020,Clothed Restraint To**ure Anal FUCK Newhalf Aise Mei Submerged In Milky White Fluid,https://pic.javct.net/poster/04112026/d6c890bb94.jpg,https://javct.net/v/totk-020,126,2026-05-12
KV-318,"113 Minutes Of Non-stop Filming, Uncut Editing, Featuring 25 Consecutive Cumshots, A Blowjob, And 13 Consecutive Cumshots!! Mai Onodera",https://pic.javct.net/poster/04112026/01a61cea7a.jpg,https://javct.net/v/kv-318,113,2026-05-12
TENN-046-RM,"The Miraculous Beautiful Girl Umi-chan, Unearthed On MachiApp, Has A Truly Intense And Passionate Sex Session. [Uncensored L**ked]",https://pic.javct.net/poster/04112026/f8d7eda441.jpg,https://javct.net/v/tenn-046-rm,105,2026-05-12
FVMD-014-RM,"I Want To Connect With A Menhera Girl On March 17th, Somewhere In Shibuya Limit Saffle Maika Hiizumi Maika [Uncensored L**ked]",https://pic.javct.net/poster/20230804/1692970907.jpg,https://javct.net/v/fvmd-014-rm,160,2026-05-12
KDJE-065-RM,[4K remaster version] Bukkake spread Wakaba Onoue [Uncensored L**ked],https://pic.javct.net/poster/04112026/49aea9cb98.jpg,https://javct.net/v/kdje-065-rm,187,2026-05-12
MIGD-538-RM,Dream Woman Vol.92 Onoe Young Leaves [Uncensored L**ked],https://pic.javct.net/poster/06032026/1773803667.jpg,https://javct.net/v/migd-538-rm,150,2026-05-12
GVH-179,Exposure ・ Ring ● ・ Woman Obsessed With Bukkake Desire Himari Kinoshita,https://pic.javct.net/poster/04112026/d7886ca6d4.jpg,https://javct.net/v/gvh-179,120,2026-05-12
TENN-046,"The Miraculous Beautiful Girl Umi-chan, Unearthed On MachiApp, Has A Truly Intense And Passionate Sex Session.",https://pic.javct.net/poster/04112026/f8d7eda441.jpg,https://javct.net/v/tenn-046,105,2026-05-12
DJE-050-RM,Mature Shut! ! Shape Ayumi Shinoda That Doting MILF [Uncensored L**ked],https://pic.javct.net/poster/20222311/1671446636.jpg,https://javct.net/v/dje-050-rm,130,2026-05-12
FC2PPV-4898761,[7 shots in a row/facial cum swallowing] 07 generation cup college girl semen on face and body double piece Finish,https://pic.javct.net/poster/04112026/b6ef17e30d.jpg,https://javct.net/v/fc2ppv-4898761,15,2026-05-12
FC2PPV-4898645,"[Special price until 5/25] Living together with a G-cup compliant, masochistic beauty Every day I work hard with the nutrition that can only be obtained from breasts",https://pic.javct.net/poster/04112026/773f9377b9.jpg,https://javct.net/v/fc2ppv-4898645,71,2026-05-12
KDJE-050-RM,[4K remastered version] Mature shut! ! Ayumi Shinoda The Form Of Doting A Mature Woman [Uncensored L**ked],https://pic.javct.net/poster/04112026/d448aedb3c.jpg,https://javct.net/v/kdje-050-rm,129,2026-05-12
MIGD-535-RM,Anal FUCK Out And Bukkake! Tsumugi Serizawa [Uncensored L**ked],https://pic.javct.net/poster/06032026/1773544091.jpg,https://javct.net/v/migd-535-rm,120,2026-05-12
1P-051026-001,Sex with a loose wife in tight pants,https://pic.javct.net/poster/04112026/bc8ae565aa.jpg,https://javct.net/v/1p-051026-001,57,2026-05-12
WAWA-032-SUB,"A Wet, Tanned Beautiful Girl And A Creampie Sex Session! Nana Maeno [English Subtitle]",https://pic.javct.net/poster/20253001/1739983023.jpg,https://javct.net/v/wawa-032-sub,123,2026-05-12
KDJE-024-RM,[4K remaster version] Masochistic semen trance Azusa Nagasawa [Uncensored L**ked],https://pic.javct.net/poster/04112026/45f08754eb.jpg,https://javct.net/v/kdje-024-rm,127,2026-05-12
XVSR-231-RM,Ultra Nude Sex That Severely Humiliates Her With A Minimum Height Of 143 Cm SEX Kanno [Uncensored L**ked],https://pic.javct.net/poster/06032026/1775710911.jpg,https://javct.net/v/xvsr-231-rm,120,2026-05-12
DDT-065-RM,Ran Asakawa Endless Semen Slut Libido [Uncensored L**ked],https://pic.javct.net/poster/04112026/797821e74d.jpg,https://javct.net/v/ddt-065-rm,127,2026-05-12
GEKI-045-RM,"Rich sperm bukkake in a tight suit that shows off the voluptuous body! Kanna-san (31 years old), the president's secretary with a big ass, who treats male employees' dicks and turns them into sex toys Kanna Shinozaki [Uncensored L**ked]",https://pic.javct.net/poster/04112026/cdf045547a.jpg,https://javct.net/v/geki-045-rm,70,2026-05-12
SDAB-120-RM,A Healthy And Refreshing Clubgirl Girl Is Made To Speak Dirtyly. Puzzle → Blush → Estrus. Aoi Nakagusuku [Uncensored L**ked],https://pic.javct.net/poster/04112026/06827b9d09.jpg,https://javct.net/v/sdab-120-rm,135,2026-05-12
FC2PPV-4896918,[Face showing full-time housewife sex] Beautiful slender beautiful housewife with beautiful breasts is made to wear stockings without panties and is penetrated with a cock,https://pic.javct.net/poster/04112026/90d40dc031.jpg,https://javct.net/v/fc2ppv-4896918,66,2026-05-12
TENN-007-RM,Angel Girlfriend Vol.3 Ayame Chiba [Uncensored L**ked],https://pic.javct.net/poster/20230804/1693109420.jpg,https://javct.net/v/tenn-007-rm,123,2026-05-12
HUNTB-725-RM,"""Hey, You Have The Courage To Masturbate In Your Skirt And Cum On My Pants! ? ] A Super Perverted Sober Girl Is A Ridiculous Temptation! While Pounding So As Not To Be Found Out By The Surroundings... [Uncensored L**ked]",https://pic.javct.net/poster/20230908/1694150727.jpg,https://javct.net/v/huntb-725-rm,210,2026-05-12
