code,title,image_url,page_url,views,date_scraped
UBUG-012,Anal Virgin Auction Himari,https://pic.javct.net/poster/04112026/b867f2f9cb.jpg,https://javct.net/v/ubug-012,130,2026-04-27
BONY-188-RM,"Breeding-focused, Impregnation-inducing, Cum-in-the-vagina Konno Hikaru [Uncensored L**ked]",https://pic.javct.net/poster/04112026/1776971957.jpg,https://javct.net/v/bony-188-rm,135,2026-04-27
DASS-949-RM,"Top-ranked Creator In The ""Crossdresser/NH"" Category On A Creator Support Site. Exclusive To Dengeki. Natural Beauty Trans Woman, Momiji Hiiragi. [Uncensored L**ked]",https://pic.javct.net/poster/04112026/1776971891.jpg,https://javct.net/v/dass-949-rm,150,2026-04-27
FC2PPV-4886353,[10 consecutive facial cumshots] I'm going to semen in the toilet Registered dietitian at the company cafeteria (23) I want to do what I want to do only once in my life,https://pic.javct.net/poster/04112026/50efddc451.jpg,https://javct.net/v/fc2ppv-4886353,40,2026-04-27
MIGD-587,Dream Woman Vol.95 Natsume Saiharu,https://pic.javct.net/poster/04112026/92a1ca26c2.jpg,https://javct.net/v/migd-587,180,2026-04-27
XRW-624-RM,It's Ham Hame Thanksgiving Day 2nd Listener Participation BUKKAKE & Massacre! Tachibana @ Ham [Uncensored L**ked],https://pic.javct.net/poster/04112026/956bb620ea.jpg,https://javct.net/v/xrw-624-rm,195,2026-04-27
TENN-010-RM,Angelic Girlfriend Vol.4 Ichika Kasagi [Uncensored L**ked],https://pic.javct.net/poster/20230908/1694490425.jpg,https://javct.net/v/tenn-010-rm,120,2026-04-27
DASD-163-RM,Kinoshita Barrage Wakana 100 Bukkake Gangbang [Uncensored L**ked],https://pic.javct.net/poster/04112026/96610f83e7.jpg,https://javct.net/v/dasd-163-rm,170,2026-04-27
GQN-011-RM,"""Animals Don't Use Condoms, Right?"" A True Animal Kingdom Of Unprotected Sex And Ejaculation Outside. Kisaki Nana [Uncensored L**ked]",https://pic.javct.net/poster/04112026/1777054171.jpg,https://javct.net/v/gqn-011-rm,130,2026-04-27
TENN-009-RM,"Redemption Shoplifting ○ Instead Of Telling The Girl At School Or Home, Bondage Rin Ayame Chiba [Uncensored L**ked]",https://pic.javct.net/poster/20230908/1694490533.jpg,https://javct.net/v/tenn-009-rm,120,2026-04-27
GQN-011,"""Animals Don't Use Condoms, Right?"" A True Animal Kingdom Of Unprotected Sex And Ejaculation Outside. Kisaki Nana",https://pic.javct.net/poster/04112026/1777054171.jpg,https://javct.net/v/gqn-011,130,2026-04-27
SNOS-182-RM,"Former Bus Guide Yuka Murakami's 48-hour Sexual Harassment-friendly Fan Appreciation Bus Tour: Amateur Men Go Wild Over The Beautiful Face, Soft Breasts, And Close Proximity Of Their Idolized AV Actress! A Wild Orgy Festival Where She Receives 22 Loads Of Semen. [Uncensored L**ked]",https://pic.javct.net/poster/04112026/1776962132.jpg,https://javct.net/v/snos-182-rm,170,2026-04-27
SVDVD-549,Crucifixion Prison Les ○ Flop UNLIMITED (Unlimited) Target: Big Tits JK · Manami Yoshikawa,https://pic.javct.net/poster/04112026/1777042941.jpg,https://javct.net/v/svdvd-549,150,2026-04-27
BONY-188,"Breeding-focused, Impregnation-inducing, Cum-in-the-vagina Konno Hikaru",https://pic.javct.net/poster/04112026/1776971957.jpg,https://javct.net/v/bony-188,135,2026-04-27
AVSA-234-RM,Perverted Bimbo Ring Meat Urinal NATSUKA [Uncensored L**ked],https://pic.javct.net/poster/20233001/1676084103.jpg,https://javct.net/v/avsa-234-rm,111,2026-04-27
SNOS-182,"Former Bus Guide Yuka Murakami's 48-hour Sexual Harassment-friendly Fan Appreciation Bus Tour: Amateur Men Go Wild Over The Beautiful Face, Soft Breasts, And Close Proximity Of Their Idolized AV Actress! A Wild Orgy Festival Where She Receives 22 Loads Of Semen.",https://pic.javct.net/poster/04112026/1776962132.jpg,https://javct.net/v/snos-182,170,2026-04-27
DASS-949,"Top-ranked Creator In The ""Crossdresser/NH"" Category On A Creator Support Site. Exclusive To Dengeki. Natural Beauty Trans Woman, Momiji Hiiragi.",https://pic.javct.net/poster/04112026/1776971891.jpg,https://javct.net/v/dass-949,150,2026-04-27
MIMK-030-RM,Sex Workers Who!Honda Guidance To Vaginal Ejaculation Rico [Uncensored L**ked],https://pic.javct.net/poster/20230908/1694161088.jpg,https://javct.net/v/mimk-030-rm,180,2026-04-27
MIAD-589-RM,Explosion In Popularity! ?Nyan ♪ ~ That Had Been Dug Cum Bukkake Anal ~ Is Very Similar (○ ○ ​​嗣 Peach) ○ The Course Professional Workshop Idol Be ○ ○ Yz [Uncensored L**ked],https://pic.javct.net/poster/04112026/1776965420.jpg,https://javct.net/v/miad-589-rm,120,2026-04-27
STAR-493,Female Juice Yoshikawa Manami,https://pic.javct.net/poster/04112026/1776935552.jpg,https://javct.net/v/star-493,160,2026-04-27
SYKH-086-RM,"""Standing Wife"" Class B Mature Kozue 35 Years Old [Uncensored L**ked]",https://pic.javct.net/poster/20230908/1694837845.jpg,https://javct.net/v/sykh-086-rm,110,2026-04-27
MIGD-582,Dream Woman Vol.94 Bud,https://pic.javct.net/poster/04112026/1776839659.jpg,https://javct.net/v/migd-582,240,2026-04-27
SMKD-008-RM,"Complete Coma - 4 People - Beautiful Anime Otaku (21) / Beauty Salon Worker (31) / Saitama Medical Junior College Student (20) / Taiwanese Exchange Student (21) - All Internal Ejaculation, Sleepwalking Seconds [Uncensored L**ked]",https://pic.javct.net/poster/04112026/1776445204.jpg,https://javct.net/v/smkd-008-rm,225,2026-04-27
SYKH-085-RM,"Raw Copulation With A Beautiful Witch In Boots Immediately, Her Beautiful Face Melts In The Pleasure Of Zubochika... Ayano-san, 37 Years Old [Uncensored L**ked]",https://pic.javct.net/poster/20230908/1694837906.jpg,https://javct.net/v/sykh-085-rm,110,2026-04-27
