code,title,image_url,page_url,views,date_scraped
BBTU-015-RM,Submissive Girl With Big Tits Screams And Cums Like Crazy As She Has Her Huge Titties Covered With Cum Yuria Yoshine [Uncensored L**ked],https://static.javct.net/poster/1623987419.jpg,https://javct.net/v/bbtu-015-rm,118,2026-05-01
HUNBL-152-RM,"From Now On, I Will R**e Your Best Friend One After Another. [Uncensored L**ked]",https://pic.javct.net/poster/20230908/1694145396.jpg,https://javct.net/v/hunbl-152-rm,130,2026-05-01
CAWD-977,"Too Erotic, It's Deadly! A Truly Beautiful Girl With An Overwhelming 55cm Waist And Miraculous Natural G-cup Breasts Awakens To A Massive Orgasm In This Pornographic Film Featuring 16 Facial Cumshots. Honma Asami",https://pic.javct.net/poster/04112026/8f9b6b8322.jpg,https://javct.net/v/cawd-977,130,2026-05-01
MIAA-449-RM,"I Will Suck Off Anybody For A Set Price! If You Hire Her, You Can Call This Horny Blowjob Bitch To Give you A Lick Any Time You Want - Hana Hakuto [Uncensored L**ked]",https://static.javct.net/poster/miaa-449.jpg,https://javct.net/v/miaa-449-rm,119,2026-05-01
MIGD-592,Anal Bukkake FUCK NOW! Takizawa Canon,https://pic.javct.net/poster/04112026/e68f3d4fa9.jpg,https://javct.net/v/migd-592,120,2026-05-01
MDE-207-RM,Dream Woman vol.29 Hijiri Kayama [Uncensored L**ked],https://pic.javct.net/poster/04112026/145e73c5f2.jpg,https://javct.net/v/mde-207-rm,96,2026-05-01
NHD-001-SUB,Look At My Pork Bowl. Kana Morisawa [English Subtitle],https://pic.javct.net/poster/06032026/1773237740.jpg,https://javct.net/v/nhd-001-sub,120,2026-05-01
FVMD-015-RM,"Apprentice Succubus-chan Is A Clumsy Girl And I Thought She Would Be Able To Succumb, But When She Woke Up, She Was Succumbed And Drowned And Reached Climax Ena Satsuki [Uncensored L**ked]",https://pic.javct.net/poster/20230908/1695010124.jpg,https://javct.net/v/fvmd-015-rm,103,2026-05-01
AGAV-168-RM,"Glasses-wearing Facial Cumshot Story: After Regular Working Hours, I'm Alone With My Arrogant Female Boss Doing Unpaid Overtime - Shiori [Uncensored L**ked]",https://pic.javct.net/poster/04112026/d90c5bfc5f.jpg,https://javct.net/v/agav-168-rm,107,2026-05-01
AGAV-168,"Glasses-wearing Facial Cumshot Story: After Regular Working Hours, I'm Alone With My Arrogant Female Boss Doing Unpaid Overtime - Shiori",https://pic.javct.net/poster/04112026/d90c5bfc5f.jpg,https://javct.net/v/agav-168,107,2026-05-01
FC2PPV-4889371,"[No] Without telling her husband, a beautiful wife with big breasts and a big ass has sex with a big black dick, raw NTR, and squirts! SEX",https://pic.javct.net/poster/04112026/c0c113358a.jpg,https://javct.net/v/fc2ppv-4889371,62,2026-05-01
XVSR-216-RM,Dirty Gakuen Chapter Ayano Nana [Uncensored L**ked],https://pic.javct.net/poster/06032026/1774751490.jpg,https://javct.net/v/xvsr-216-rm,180,2026-05-01
UBUG-012-RM,Anal Virgin Auction Himari [Uncensored L**ked],https://pic.javct.net/poster/04112026/b867f2f9cb.jpg,https://javct.net/v/ubug-012-rm,130,2026-05-01
BONY-059-RM,Home Raid Slut Circle SSS Damage No.01 Mr. R [Uncensored L**ked],https://pic.javct.net/poster/20230908/1694146266.jpg,https://javct.net/v/bony-059-rm,125,2026-05-01
MDED-207-RM,Kiyoshi Kayama DREAM WOMAN VOL.29 Dream Woman [Uncensored L**ked],https://pic.javct.net/poster/04112026/2291c2e3ad.jpg,https://javct.net/v/mded-207-rm,110,2026-05-01
CEMD-279-RM,A Woman Drowning In Overflowing Sexual Impulses  Sex Donna Mai Hoshikawa Super Erotic 4 Sex [Uncensored L**ked],https://pic.javct.net/poster/20222311/1671854421.jpg,https://javct.net/v/cemd-279-rm,220,2026-05-01
DJE-046-RM,Like White Tail Soup Tin Ichinose My Semen [Uncensored L**ked],https://pic.javct.net/poster/20222311/1671428177.jpg,https://javct.net/v/dje-046-rm,130,2026-05-01
SDAM-171,A beautiful cafe clerk goes to work and leaves work. Pervert complainer sexually harasses by continuously spraying super thick semen on the face,https://pic.javct.net/poster/04112026/8539483e84.jpg,https://javct.net/v/sdam-171,151,2026-05-01
FC2PPV-4888463,[10 consecutive facial cumshots] I'm going to semen in the toilet Registered dietician at the company cafeteria (23) I want to do what I want to do only once in my life Ver1.1,https://pic.javct.net/poster/04112026/9f4c9a0410.jpg,https://javct.net/v/fc2ppv-4888463,40,2026-05-01
DIC-040-RM,Hatsuutsushi.Active Underground Idle Kiriyama Mikoto AV Debut Hatsu Sha 01 [Uncensored L**ked],https://pic.javct.net/poster/04112026/30a1193bbf.jpg,https://javct.net/v/dic-040-rm,135,2026-05-01
NWNK-001-RM,Tightly Bound And Tied-up Girl Rope Escape Game [Uncensored L**ked],https://pic.javct.net/poster/04112026/a037bcd511.jpg,https://javct.net/v/nwnk-001-rm,93,2026-05-01
TOTK-019,The Lewd Games Of A Transgender Slut: Climax Domination Asshole Battle - Himeoka Shia,https://pic.javct.net/poster/04112026/dda1559320.jpg,https://javct.net/v/totk-019,126,2026-05-01
MIGD-588,Dream Woman Vol.96 Shoko Akiyama,https://pic.javct.net/poster/04112026/b4ad18ace2.jpg,https://javct.net/v/migd-588,200,2026-05-01
NWNK-001,Tightly Bound And Tied-up Girl Rope Escape Game,https://pic.javct.net/poster/04112026/a037bcd511.jpg,https://javct.net/v/nwnk-001,93,2026-05-01
