code,title,image_url,page_url,views,date_scraped
FOCS-057-RM,NTR Sex Using Aphrodisiacs. She Slips Her Boyfriend's Older Brother An Aphrodisiac... Makes Him Cum All Over And Does Everything... Drooling On It...Nipple Sensitive Hard Cumming. Machi Ikuta [Uncensored L**ked],https://pic.javct.net/poster/20221202/1646979405.jpg,https://javct.net/v/focs-057-rm,121,2026-05-29
NGOD-007-RM,I Want To Tell You My Cuckolding Story The Sweaty Electronics Shop Guy Seduced My Wife Starring Kaho Shibuya [Uncensored L**ked],https://pic.javct.net/poster/20220707/1658245574.jpg,https://javct.net/v/ngod-007-rm,136,2026-05-29
NKKD-231-RM,"The Drive Recorder Catches My Wife Cheating on Me, Vol. 21. The On-Board Camera Was Watching All Her Cheating From Start to Finish. [Uncensored L**ked]",https://pic.javct.net/poster/20212709/1633950503.jpg,https://javct.net/v/nkkd-231-rm,187,2026-05-29
VENX-084-SUB,"Mistakenly Inserted In My Mother-In-Law, Mistaking My Mother-In-Law and My Wife's Ass. Kimishima Mio [English Subtitle]",https://pic.javct.net/poster/20212709/1634287212.jpg,https://javct.net/v/venx-084-sub,95,2026-05-29
MCSR-359-RM,"Please Father-In-Law, Stop It... A Creampie Fuck Fest A Married Woman Who Gave In To Overwhelming Lust [Uncensored L**ked]",https://pic.javct.net/poster/20221904/1652003843.jpg,https://javct.net/v/mcsr-359-rm,129,2026-05-29
MDYD-719-RM,New Pet Wife Reira Aisaki [Uncensored L**ked],https://pic.javct.net/poster/20221108/1661825380.jpg,https://javct.net/v/mdyd-719-rm,118,2026-05-29
HODV-21583-RM,Compensation For Cuckolding - Reika Hashimoto [Uncensored L**ked],https://static.javct.net/poster/hodv-21583.jpg,https://javct.net/v/hodv-21583-rm,239,2026-05-29
KEED-51-RM,A Mother Gets Fucked Deep By Her Daughter's Boyfriend And Orgasms Wildly. Ayaka Makimura [Uncensored L**ked],https://pic.javct.net/poster/20220707/1660095888.jpg,https://javct.net/v/keed-51-rm,101,2026-05-29
KSBJ-018-RM,"My Little Stepbrothers Wife, Arisa Hanyu [Uncensored L**ked]",https://pic.javct.net/poster/20220707/1658723860.jpg,https://javct.net/v/ksbj-018-rm,119,2026-05-29
JUX-930-RM,When My Wife Sparkles With Lust... Nene [Uncensored L**ked],https://pic.javct.net/poster/20222109/1665934712.jpg,https://javct.net/v/jux-930-rm,119,2026-05-29
NEM-034-RM,Forbidden Sex With The Bride's Mother Chapter Thirty-Three I Like My Stepmom Better Than My Wife... Rieko Hiraoka [Uncensored L**ked],https://pic.javct.net/poster/20212011/1640019335.jpg,https://javct.net/v/nem-034-rm,120,2026-05-29
HODV-21576-RM,Mami Nagase Best [Uncensored L**ked],https://static.javct.net/poster/hodv-21576.jpg,https://javct.net/v/hodv-21576-rm,244,2026-05-29
ROYD-060-RM,"When I Got My First Girlfriend, We Used This Camera To Film So Many Wonderful Memories ... And Now, I'm Using It To Film My Scary Friend While He Fucks Her ... And All The While, I Have A Melancholy Erection, That Just Won't Stop ... Rio Matsumoto [Uncensored L**ked]",https://static.javct.net/poster/royd-060.jpg,https://javct.net/v/royd-060-rm,134,2026-05-29
MEYD-542-SUB,A Wife Works Some Overtime NTR I've Been Lying To My Husband About My Overtime... Nanao Nakano [English Subtitle],https://pic.javct.net/poster/20220406/1655774678.jpg,https://javct.net/v/meyd-542-sub,119,2026-05-29
JUX-927-RM,2 Mature Women Fight Over A Younger Man Under One Roof. Maika Asai Hitomi Enjoji [Uncensored L**ked],https://pic.javct.net/poster/20221202/1647503771.jpg,https://javct.net/v/jux-927-rm,116,2026-05-29
JUX-926-RM,Suddenly Becoming Intimate With A Married Woman Who Goes To Work And Comes Home The Same Way That I Do. Aoi Matsushima [Uncensored L**ked],https://pic.javct.net/poster/20220707/1657676472.jpg,https://javct.net/v/jux-926-rm,118,2026-05-29
HODV-21560-RM,Sachiko Best Hits Collection [Uncensored L**ked],https://static.javct.net/poster/hodv-21560.jpg,https://javct.net/v/hodv-21560-rm,241,2026-05-29
JUX-922-RM,I Love My Father-in-Law More Than My Husband... Haruka Aso [Uncensored L**ked],https://pic.javct.net/poster/20212011/1644632608.jpg,https://javct.net/v/jux-922-rm,118,2026-05-29
MVSD-383-RM,"I Found A Shocking Video Of My Wife On The Video Camera I Took For Our Honeymoon. My Wife Was Fucked By The Powerful Cock Of A Construction Worker, Orgasmed And Got Creampied Repeatedly [Uncensored L**ked]",https://pic.javct.net/poster/20220707/1659920598.jpg,https://javct.net/v/mvsd-383-rm,144,2026-05-29
HODV-21571-RM,"Reverse NTR ""Hey Boss ... Do You Want To Rest Up At My Place?"" This Boss Got Taken Home By His Employee And Taken For A Ride. Marina Saito [Uncensored L**ked]",https://static.javct.net/poster/hodv-21571.jpg,https://javct.net/v/hodv-21571-rm,129,2026-05-29
JUY-311-RM,"This Horny Father-In-Law Is Teasing His Daughter-In-Law Father, Please Stop... Rika Mari [Uncensored L**ked]",https://pic.javct.net/poster/20222109/1665658400.jpg,https://javct.net/v/juy-311-rm,120,2026-05-29
MIAA-301-RM,Summer Vacation Supplementary NTR Lessons I Never Imagined That The Teacher That I Hated The Most Was Having Sweaty Creampie Sex With My Beloved Girlfriend... Rei Kuruki [Uncensored L**ked],https://pic.javct.net/poster/20220406/1657156738.jpg,https://javct.net/v/miaa-301-rm,149,2026-05-29
MDYD-918-RM,I Liked Getting Fucked By My Husband's Friend... Maki Hojo [Uncensored L**ked],https://pic.javct.net/poster/20221202/1648548271.jpg,https://javct.net/v/mdyd-918-rm,119,2026-05-29
NGOD-004-RM,I Want You To Hear My Cuckolding Story. The Wife Who Was Stalked And Fucked By Her Ex-Husband Maki Hojo [Uncensored L**ked],https://pic.javct.net/poster/20220406/1656216295.jpg,https://javct.net/v/ngod-004-rm,146,2026-05-29
