code,title,image_url,page_url,views,date_scraped
DSAM-002,"Amateur AV 143cm ● Cute Face, Small Pussy, Squirting And Wetting Herself, Orgy Photo Shoot!",https://pic.javct.net/poster/05192026/7d7a6cec01.jpg,https://javct.net/v/dsam-002,150,2026-05-30
MMUS-110,"Little Devilish, Provocative Beauty Shiori Imoto",https://pic.javct.net/poster/05192026/453d946ab5.jpg,https://javct.net/v/mmus-110,140,2026-05-30
BOBB-383-RM,"Milk Fetish Erotic Cosplay That Maximizes The Charm Of J Cup Beautiful Breasts 7 Boin ""Natsuno Kohaku"" Box2 [Uncensored L**ked]",https://pic.javct.net/poster/20230207/1689305599.jpg,https://javct.net/v/bobb-383-rm,120,2026-05-30
XMOM-59-RM,Sukeban Chisato 54 Years Old Chisato Shoda [Uncensored L**ked],https://pic.javct.net/poster/20230207/1689218031.jpg,https://javct.net/v/xmom-59-rm,110,2026-05-30
MIST-437-RM,"Moeka Marui, A Dispatched Maid Who Can Make Babies On Dangerous Days [Uncensored L**ked]",https://pic.javct.net/poster/20241804/1715275741.jpg,https://javct.net/v/mist-437-rm,146,2026-05-30
RTP-105-RM,"Halloween Party With 4 Beautiful Sisters Whose Father Got Married And Suddenly Became A Family! To Cute Cosplay Figure And To Play King Like Girls With Tension Butchuage! ! ""The Things The King Says Absolutely!""I Have Been Tempted By The King's Instructions To Show Me My Breasts And Kisses ... Trick Or Treat! What? [Uncensored L**ked]",https://pic.javct.net/poster/05192026/a14bac682f.jpg,https://javct.net/v/rtp-105-rm,135,2026-05-30
LULU-439,"I Slipped An Aphrodisiac Into A Beautiful, Big-butt Cosplayer Who Was Doing Casual Sex For Business, And Turned Her Into A Cum-filled Sex Slave, Squirting And Making Ecstatic Faces During A Photoshoot Where She Was Doing Sensual, Flexible Poses.",https://pic.javct.net/poster/05192026/2d6bbf5b47.jpg,https://javct.net/v/lulu-439,160,2026-05-30
FC2PPV-4908423,"[Idol SSS class] [Limited quantity, all episodes available for viewing] [Completely secret version] Dedicated to everyone who loves FC2 Tsundere type Kanna-chan, quarter 19-year-old JD shows off her true abomination [Chapter 12]",https://pic.javct.net/poster/05192026/12c6a7c701.jpg,https://javct.net/v/fc2ppv-4908423,99,2026-05-30
FC2PPV-4908389,"Luna-chan, 19 years old, highly educated JD's uterine expansion #2",https://pic.javct.net/poster/05192026/6d06313268.jpg,https://javct.net/v/fc2ppv-4908389,100,2026-05-30
FC2PPV-4908370,"[Squirting] A 26-year-old married woman's sexual desire is released. It starts with lovey-dovey sex in the bathroom, squirts that don't stop, sucks, and won't let go. Vacuum blow job that ends with anal play. No matter what I do, I get a perfect score of 100.",https://pic.javct.net/poster/05192026/d874243f2f.jpg,https://javct.net/v/fc2ppv-4908370,68,2026-05-30
FC2PPV-4908214,"Face Showing Case #134 where an amateur comes to do naughty things Yui-chan (20), who comes back as a maid and does public masturbation as her husband says",https://pic.javct.net/poster/05192026/3d97e65a8d.jpg,https://javct.net/v/fc2ppv-4908214,58,2026-05-30
FOCS-056-RM,A 20-Year Old Vocal Princess With F-Cup Big Tits From A Voice Acting School! We're At A Social Mixer Where She's Harvesting Otakus For Some Spending Money A Mini Fan Appreciation Fest That Turns Into A Creampie Orgy Aoi Amano [Uncensored L**ked],https://pic.javct.net/poster/20221202/1646979486.jpg,https://javct.net/v/focs-056-rm,121,2026-05-30
MUCH-168-RM,Misono-chan's Colossal Tits Painted Tekaful Course FUCK 03 Misono Suwon [Uncensored L**ked],https://pic.javct.net/poster/20230207/1688789480.jpg,https://javct.net/v/much-168-rm,119,2026-05-30
MIST-435-RM,Soapland 52 Where You Can Make A C**ld Directly On A Dangerous Day Sumire Kuramoto [Uncensored L**ked],https://pic.javct.net/poster/20241804/1715275362.jpg,https://javct.net/v/mist-435-rm,159,2026-05-30
DV-367-RM,Uniform Doll Kaede Matsushima (cosplay Doll) [Uncensored L**ked],https://pic.javct.net/poster/05192026/4c4df05928.jpg,https://javct.net/v/dv-367-rm,60,2026-05-30
FC2PPV-4596284,"[Part 1] Beautiful maid whose voice and gestures are too cute 4. Even more devilish in a fox costume. Hyottoko blowjob with a super erotic face, Part 1",https://pic.javct.net/poster/05192026/9dbf29e76c.jpg,https://javct.net/v/fc2ppv-4596284,25,2026-05-30
MIBB-022-RM,Fully Clothed Captivating Cosplay Queen Hinata Kimizuka [Uncensored L**ked],https://pic.javct.net/poster/20230207/1689392562.jpg,https://javct.net/v/mibb-022-rm,122,2026-05-30
FC2PPV-4907806,"Sumire (18) Anyway, this is a first-person angle video of the second shooting of cute Sumire-chan, creampie, anal penetration ATM, and cosplay creampie.",https://pic.javct.net/poster/05192026/9e7d438c0d.jpg,https://javct.net/v/fc2ppv-4907806,58,2026-05-30
FC2PPV-4907687,God Style Ho ■ Akua Minato in uniform at the live show is a thin but E-cup model with a beautiful body and tight Sugio Masturbation Edition,https://pic.javct.net/poster/05192026/efacdd0581.jpg,https://javct.net/v/fc2ppv-4907687,57,2026-05-30
SDAM-170-RM,"300,000/h Top layer Jaw collapse cracking throat development deep throat photo session No rubber OK Raw creampie OK Neck tightening OK Slap OK [Uncensored L**ked]",https://pic.javct.net/poster/05192026/546a725829.jpg,https://javct.net/v/sdam-170-rm,144,2026-05-30
DV-480-RM,Kaede Matsushima Adult Fairy Tale Snow White [Uncensored L**ked],https://pic.javct.net/poster/20250903/1744212206.jpg,https://javct.net/v/dv-480-rm,120,2026-05-30
ABW-252-RM,Mai Nanami Nakadashi 45 Tokuno 10 Barrage To Inject Sperm Of Drodro [Uncensored L**ked],https://pic.javct.net/poster/20220406/1655977757.jpg,https://javct.net/v/abw-252-rm,145,2026-05-30
START-576-RM,"I left a handsome man in a room with Sora Shinkawa for the first time.If you want to have sex, you can do it anytime! 24-hour monitoring of blushing flirty sex Sora Shinkawa [Uncensored L**ked]",https://pic.javct.net/poster/05192026/bac4394428.jpg,https://javct.net/v/start-576-rm,273,2026-05-30
START-576,"I left a handsome man in a room with Sora Shinkawa for the first time.If you want to have sex, you can do it anytime! 24-hour monitoring of blushing flirty sex Sora Shinkawa",https://pic.javct.net/poster/05192026/bac4394428.jpg,https://javct.net/v/start-576,273,2026-05-30
