code,title,image_url,page_url,views,date_scraped
COSX-106-RM,"[K breasts] 3-digit breasts! ? E-chan, who has the strongest breasts in the history of Cospaco, is impregnated in a popular V cosplay and is off-paco! [Uncensored L**ked]",https://pic.javct.net/poster/04112026/5c1d7717cb.jpg,https://javct.net/v/cosx-106-rm,69,2026-05-08
ZEX-410-RM,Creampie Raw Footage With A Slutty Secretary. Best Of Aoi Mizutani. [Uncensored L**ked],https://pic.javct.net/poster/20212011/1639587314.jpg,https://javct.net/v/zex-410-rm,138,2026-05-08
420ERK-103-RM,"Mina (21) Amateur Hoi Hoi, Erotic Kyun, Amateur, Big Breasts, Neck, Drinking Lover, Shaved Pussy, Cosplay, Facial, Gonzo, Documentary [Uncensored L**ked]",https://pic.javct.net/poster/04112026/267769f502.jpg,https://javct.net/v/420erk-103-rm,84,2026-05-08
FC2PPV-4885114-RM,"A crazy H-cup big breasted masochist layer who loves off-paco, ahegao face, stupid voice, hellish [Uncensored L**ked]",https://pic.javct.net/poster/04112026/1776918291.jpg,https://javct.net/v/fc2ppv-4885114-rm,52,2026-05-08
COSX-105-RM,"[Extreme breasts] Erotic than official! ? Dirty creampie sex with NOA, an SSR body with a plump I-cup big butt! [Nympho] [Uncensored L**ked]",https://pic.javct.net/poster/04112026/6aaa7bf22c.jpg,https://javct.net/v/cosx-105-rm,70,2026-05-08
SHW-003-RM,Yua Hunting A Man Body [Uncensored L**ked],https://pic.javct.net/poster/04112026/e2d324fee2.jpg,https://javct.net/v/shw-003-rm,130,2026-05-08
NEO-849,Secret Technique! Massive Saliva To**ure - Kasumi Tsukino,https://pic.javct.net/poster/04112026/295fd4c555.jpg,https://javct.net/v/neo-849,120,2026-05-08
COSX-106,"[K breasts] 3-digit breasts! ? E-chan, who has the strongest breasts in the history of Cospaco, is impregnated in a popular V cosplay and is off-paco!",https://pic.javct.net/poster/04112026/5c1d7717cb.jpg,https://javct.net/v/cosx-106,69,2026-05-08
NEO-948,Naughty Wetting Game - Minami Maeda,https://pic.javct.net/poster/04112026/1f4f710bb4.jpg,https://javct.net/v/neo-948,119,2026-05-08
COSX-105,"[Extreme breasts] Erotic than official! ? Dirty creampie sex with NOA, an SSR body with a plump I-cup big butt! [Nympho]",https://pic.javct.net/poster/04112026/6aaa7bf22c.jpg,https://javct.net/v/cosx-105,70,2026-05-08
1P-050626-001,The Reflexology After School: Manami Shirahana,https://pic.javct.net/poster/04112026/a863928027.jpg,https://javct.net/v/1p-050626-001,55,2026-05-08
MMUS-044-RM,Small Devil Provocative Girl Ichika Matsumoto [Uncensored L**ked],https://pic.javct.net/poster/20241115/1733263213.jpg,https://javct.net/v/mmus-044-rm,144,2026-05-08
420ERK-103,"Mina (21) Amateur Hoi Hoi, Erotic Kyun, Amateur, Big Breasts, Neck, Drinking Lover, Shaved Pussy, Cosplay, Facial, Gonzo, Documentary",https://pic.javct.net/poster/04112026/267769f502.jpg,https://javct.net/v/420erk-103,84,2026-05-08
DIC-052-RM,The Camera Closely Contacts The Trajectory Until Ordinary Girls Become AV Actresses! Natural Big Tits G Cup Miraculous Glamorous BODY Doctor Cosplay Year Nirana (Kana) AV Debut! ! [Uncensored L**ked],https://pic.javct.net/poster/04112026/76380047ee.jpg,https://javct.net/v/dic-052-rm,130,2026-05-08
MUKC-072-RM,148cm E Cup. I'll Do Whatever You Say Today. This Cosplay Girl Is On Sale. [Uncensored L**ked],https://pic.javct.net/poster/20242108/1726198158.jpg,https://javct.net/v/mukc-072-rm,140,2026-05-08
CIEL-008-RM,"""It's More Than A Textbook"" Fcup Eyeglasses Big Breasts Plain Girl Hidden Big Breasts Sober But Erotic Girlfriend Explosive Sex Hibiki Rika [Uncensored L**ked]",https://pic.javct.net/poster/20230207/1690434210.jpg,https://javct.net/v/ciel-008-rm,108,2026-05-08
FC2PPV-4892196,"[First time limited] Make me understand with a forceful blowjob...Super slender slender beauty's waist jerks, destroys the piston, surrenders, and cums inside her uterus and cums inside her",https://pic.javct.net/poster/04112026/64f94cfa69.jpg,https://javct.net/v/fc2ppv-4892196,66,2026-05-08
UFD-011-RM,Mio Kuraki Fuck With Beautiful Work [Uncensored L**ked],https://pic.javct.net/poster/04112026/5d03c590ef.jpg,https://javct.net/v/ufd-011-rm,120,2026-05-08
534IND-196-RM,Face showing [Personal shooting] Intense raw sex with a super emotional slender beautiful butt and beautiful breasts bitch [Uncensored L**ked],https://pic.javct.net/poster/04112026/37a1496a5c.jpg,https://javct.net/v/534ind-196-rm,72,2026-05-08
758JAPORN-096-RM,Hikari-chan [Uncensored L**ked],https://pic.javct.net/poster/04112026/44a910632f.jpg,https://javct.net/v/758japorn-096-rm,91,2026-05-08
NAMH-021-RM,"13 Shots Into The Womb Of Mini Puni Mako, The First True Creampie Shooting Konomi Hirose [Uncensored L**ked]",https://pic.javct.net/poster/20241115/1731908626.jpg,https://javct.net/v/namh-021-rm,111,2026-05-08
FOCS-046-RM,"Gorgeous Big Tits F-cup Cosplayer Gets Super Horny! Her Pussy Gets Wet And Excited After Realizing It's A Risque Photo Shoot! ""I'll Be A Cosplayer That's Just For You!"" In Akihabara. Mei Mizuki [Uncensored L**ked]",https://pic.javct.net/poster/20212011/1642159512.jpg,https://javct.net/v/focs-046-rm,123,2026-05-08
XVSR-142-RM,Temptation Beauty Slut Ayano Nana [Uncensored L**ked],https://pic.javct.net/poster/20241804/1715998092.jpg,https://javct.net/v/xvsr-142-rm,120,2026-05-08
PGD-566-RM,Kaori Glamorous 6 - Super Luxury Fucking [Uncensored L**ked],https://pic.javct.net/poster/20221202/1649917495.jpg,https://javct.net/v/pgd-566-rm,179,2026-05-08
