code,title,image_url,page_url,views,date_scraped
URKK-019-RM,Back Girl's Real Dad Live Hidden Busty Female College Student Yuuka [Uncensored L**ked],https://pic.javct.net/poster/04112026/315508aa8b.jpg,https://javct.net/v/urkk-019-rm,148,2026-04-26
DIC-038-RM,"""I Really Want To Be An AV Actress"" ""Miracle Of Hokkaido"" Mayu Kurusu AV Debut [Uncensored L**ked]",https://pic.javct.net/poster/20221202/1647975110.jpg,https://javct.net/v/dic-038-rm,180,2026-04-26
ZEX-346-RM,Amateur Fans Thanksgiving Paco Paco Soap Wagon 2018 Abe Mikako [Uncensored L**ked],https://pic.javct.net/poster/04112026/85a75ab461.jpg,https://javct.net/v/zex-346-rm,120,2026-04-26
HONB-393-RM,Tipsy Slender Cosplay Sex Ena [Uncensored L**ked],https://pic.javct.net/poster/20240807/1722013679.jpg,https://javct.net/v/honb-393-rm,64,2026-04-26
AVSA-237-RM,SUPER FISHEYE FETISHISM Powerful Excitement Nectar Erotic Cosplay Flesh Feeling BODY Soka Minamihata [Uncensored L**ked],https://pic.javct.net/poster/20230302/1678509544.jpg,https://javct.net/v/avsa-237-rm,130,2026-04-26
AVSA-431-RM,"Super Hot Newcomer Has Arrived! Cosplaying, Horny Live Streamer Hoshino Nene [Uncensored L**ked]",https://pic.javct.net/poster/04112026/1777076141.jpg,https://javct.net/v/avsa-431-rm,147,2026-04-26
NEO-850,"When She Climaxes, Her Legs Are Always Straight. - Nogi Aya",https://pic.javct.net/poster/04112026/8c2e6427b4.jpg,https://javct.net/v/neo-850,120,2026-04-26
FC2PPV-4886631,Completely unreleased works by the retired actress who was very popular in FC2 are now available.,https://pic.javct.net/poster/04112026/d408eed89a86.jpg,https://javct.net/v/fc2ppv-4886631,52,2026-04-26
MAAN-1163-RM,"[Raw sex in the store with a model-class con cafe girl] G-cup, tall, beautiful legs, perfect body that is simply admirable, a blowjob that is carefully licked while staring at her with a beautiful face, while still being an excellent erotic costume, with a cock inserted in a spectacular view standing doggy style and a large amount of creampie with rich climax play that cannot be seen by other customers [Thanks Bitch] [Aya] [Uncensored L**ked]",https://pic.javct.net/poster/04112026/1777082532701.jpg,https://javct.net/v/maan-1163-rm,83,2026-04-26
SABA-729,Halloween Nampa In Shibuya PREMIUM SELECT Echi Echi Amateur Beautiful Girls 11 All Raw Production 300 Minutes,https://pic.javct.net/poster/04112026/1777103470.jpg,https://javct.net/v/saba-729,300,2026-04-26
SIMW-006,Kaho & Rin,https://pic.javct.net/poster/04112026/1777082672410.jpg,https://javct.net/v/simw-006,96,2026-04-26
MAAN-1163,"[Raw sex in the store with a model-class con cafe girl] G-cup, tall, beautiful legs, perfect body that is simply admirable, a blowjob that is carefully licked while staring at her with a beautiful face, while still being an excellent erotic costume, with a cock inserted in a spectacular view standing doggy style and a large amount of creampie with rich climax play that cannot be seen by other customers [Thanks Bitch] [Aya]",https://pic.javct.net/poster/04112026/1777082532701.jpg,https://javct.net/v/maan-1163,83,2026-04-26
AVSA-431,"Super Hot Newcomer Has Arrived! Cosplaying, Horny Live Streamer Hoshino Nene",https://pic.javct.net/poster/04112026/1777076141.jpg,https://javct.net/v/avsa-431,147,2026-04-26
CIEL-009-RM,A Bitch Who Loves Flirting With Uncles Little Devil Colossal Tits Jcup Shion Yumi [Uncensored L**ked],https://pic.javct.net/poster/20230908/1695810868.jpg,https://javct.net/v/ciel-009-rm,107,2026-04-26
NNNC-026-RM,Kcup Boobs Knit Colossal Tits Beauty 2 Sex Boldly Open Big Breasts ◇Blowjob And Titty Fuck Are Kind To You◇ Ena Koume [Uncensored L**ked],https://pic.javct.net/poster/20230908/1694490853.jpg,https://javct.net/v/nnnc-026-rm,82,2026-04-26
PGD-016-RM,PORNOGRAPH 16 [Uncensored L**ked],https://pic.javct.net/poster/04112026/1777078802.jpg,https://javct.net/v/pgd-016-rm,110,2026-04-26
FC2PPV-4884736,"Seriously 18 years old. .I'm a cocky girl who keeps convulsing because I'm too much of a small fry. Seeding ""Rame Igu up to me, I really love your cock.''",https://pic.javct.net/poster/04112026/1777013289.jpg,https://javct.net/v/fc2ppv-4884736,47,2026-04-26
TEAM-025,10 Yoshikawa Situation Manami,https://pic.javct.net/poster/04112026/1777042751.jpg,https://javct.net/v/team-025,240,2026-04-26
MIDE-310-SUB,Slurp Vacuum Blow Hatsukawa South [English Subtitle],https://pic.javct.net/poster/06032026/1773573296.jpg,https://javct.net/v/mide-310-sub,120,2026-04-26
420POW-040-RM,Kuchiku @ Reverse Bunny [Amateur Hoi Hoi power / Gonzo / Cosplay / Beautiful girl / Big tits / G cup / Nice ass / Neat / Concafe work / Lotion oil / Small devil / Continuous cum / Launch on tongue / Cum] [Uncensored L**ked],https://pic.javct.net/poster/20212709/1634829759.jpg,https://javct.net/v/420pow-040-rm,116,2026-04-26
420HHL-150-RM,"KAHO(21) Amateur Hoi Hoi Lover, Amateur, Couple POV, Cosplay, Beautiful Girl, Beautiful Breasts, Facial [Uncensored L**ked]",https://pic.javct.net/poster/04112026/1776823718396.jpg,https://javct.net/v/420hhl-150-rm,74,2026-04-26
MUKC-091-SUB,"I Met A Bar Hostess After Work And We Had A Drunken Threesome In The Bar And Took Her Back To The Hotel For An Orgy, Hinano Miki [English Subtitle]",https://pic.javct.net/poster/20250903/1741888670.jpg,https://javct.net/v/mukc-091-sub,150,2026-04-26
PGD-002-RM,PORNOGRAPH 02 [Uncensored L**ked],https://pic.javct.net/poster/04112026/1776986700.jpg,https://javct.net/v/pgd-002-rm,100,2026-04-26
FTHTD-214-RM,[Live-action Version] C**ldhood Friend Erotic Konatsu Kashiwagi [Uncensored L**ked],https://pic.javct.net/poster/04112026/1776879899.jpg,https://javct.net/v/fthtd-214-rm,126,2026-04-26
