code,title,image_url,page_url,views,date_scraped
SVCAO-024,Unlicensed Association Standing Prostitute Rehabilitation Center Toyo Yoko Girls Horse Aphrodisiac,https://pic.javct.net/poster/01202026/1772676654.jpg,https://javct.net/v/svcao-024,180,2026-03-05
PA-030526-100,Totally hooked on other men's cocks! A horny married woman getting fucked to cum!,https://pic.javct.net/poster/01202026/1772687331.jpg,https://javct.net/v/pa-030526-100,61,2026-03-05
354KAMEF-113,Specializing in individual photography Erotic cos specializing in K-cup layer photo session Machida lens's BLACK KAMEKO FILE.113 Megumi's plump soft breasts seduces the penis. Raw insertion into the man on a dangerous day and off-paco creampie in the nursery womb,https://pic.javct.net/poster/01202026/1772681817919.jpg,https://javct.net/v/354kamef-113,80,2026-03-05
HODV-21446-RM,"AV Actress Aoi Kuriki, ... And Uncle. [Uncensored L**ked]",https://pic.javct.net/poster/20240807/1723427205.jpg,https://javct.net/v/hodv-21446-rm,129,2026-03-05
VRNC-077-RM,Nice Buddy Bitch [Uncensored L**ked],https://pic.javct.net/poster/01202026/1772334641982.jpg,https://javct.net/v/vrnc-077-rm,55,2026-03-05
DVMM-358-RM,"Ordinary Men And Women Monitoring AV: Behind The Magic Mirror Is Her Real Son! A Busty Mother And Her Son's Best Friend, Who Is Concerned About Being A Virgin, Challenge Each Other To A Continuous Ejaculation Deflowering Challenge With A 100,000 Yen Per Shot In A Closed Room! 2. The Virgin's Cock, Fully Erected When He Touches His Friend's Mother's Big Tits, Which He's Always Wanted To Do, Gently Accepts And Inserts It Into Her Pussy... [Uncensored L**ked]",https://pic.javct.net/poster/01202026/1772385583.jpg,https://javct.net/v/dvmm-358-rm,295,2026-03-05
AMBI-102-RM,(SNS) A Girl Who Got To Know Her Is A Super-de-M Character [Uncensored L**ked],https://pic.javct.net/poster/20241703/1712912023.jpg,https://javct.net/v/ambi-102-rm,128,2026-03-05
FC2PPV-4858357,"[First shoot] Her charming, plump body, big breasts, and sexy face are so erotic that she captivates men with a perfect smile. She got scolded when I ejaculated inside her vagina without permission (lol)",https://pic.javct.net/poster/01202026/1772687647.jpg,https://javct.net/v/fc2ppv-4858357,93,2026-03-05
MGNL-155-RM,“Limited To Big-breasted Female College Student Managers! Get A Prize If You Make The Male Members Ejaculate! 』A Firm Slender Big-breasted Imitator Takes On The Challenge ☆ He Pulls Out The Cocks Of 3 People And Even Finishes The Brush → He Gets Fucked By Everyone And All Of Them Cum Inside Each Other To Solve Their Problems ☆ [Street Corner Amateur Monitoring #Hana #Tennis Club Manager] [Uncensored L**ked],https://pic.javct.net/poster/01202026/1772341706507.jpg,https://javct.net/v/mgnl-155-rm,61,2026-03-05
FTHTD-170-RM,"""I'm Excited Because The Customers Are Going To Find Out..."" Working Late At Night With No Panties And No Bra. Yua Minase, A Big-breasted Female College Student Who Is Deceived By A Perverted Store Manager, Works Part-time As A Customer Service Worker. [Uncensored L**ked]",https://pic.javct.net/poster/01202026/1772302261594.jpg,https://javct.net/v/fthtd-170-rm,140,2026-03-05
VRNC-075-RM,"Group Sex With Beautiful Women Who Can Almost Be Called The Gals! If You Take It Off, You'll Devour The Body That Has So Much Potential For A Nice Body! [Hana./Karen./Kiki./Rika.] Ver.Kiki.＆Rika. [Uncensored L**ked]",https://pic.javct.net/poster/01202026/1772335481267.jpg,https://javct.net/v/vrnc-075-rm,86,2026-03-05
STCV-594-RM,Too Sensitive G-class Breasts ♪ GAL @ Tsubaki (temporary Name) [Uncensored L**ked],https://pic.javct.net/poster/01202026/1772334584897.jpg,https://javct.net/v/stcv-594-rm,65,2026-03-05
SAN-433Z-RM,"Middle-aged Men Can't Understand Their Thoughts, But This Is The Video D-side For People Who Want To Have Sex With Young, Cute Amateur Girls. [Uncensored L**ked]",https://pic.javct.net/poster/01202026/1772472344.jpg,https://javct.net/v/san-433z-rm,91,2026-03-05
MUDR-079-RM,Since That Day .... Bondage To**ure In Uniform Uniform-Hard Awakening-Kururugi Aoi [Uncensored L**ked],https://pic.javct.net/poster/01202026/1772675787.jpg,https://javct.net/v/mudr-079-rm,120,2026-03-05
FTHTD-182-RM,A Slutty Girl With A Monster Sexual Desire Who Lives In The Same Apartment And Can Do It As Soon As She Gets Drunk. [Uncensored L**ked],https://pic.javct.net/poster/01202026/1772302137973.jpg,https://javct.net/v/fthtd-182-rm,164,2026-03-05
MGNL-154-RM,“My Beloved Husband Is On The Other Side Of The Window! A Rich Tongue-chu Challenge Where A Wife Who Hasn't Been A Married Couple For A Long Time Gradually Becomes More Extreme! ” A Glamorous Married Woman Has A Deep Kiss With A Stranger Right Next To Her Husband ☆ It Feels So Good That She Can't Stop Squirting And Is Covered In Body Fluids NTR Copulation ♪ [Street Corner Amateur Monitoring # Misuzu # 30 Years Old] [Uncensored L**ked],https://pic.javct.net/poster/01202026/1772335538600.jpg,https://javct.net/v/mgnl-154-rm,89,2026-03-05
FC2PPV-4858454,"Aya-chan #1 with two big black cocks violently fucks a beautiful woman with a strong personality, and ends with a sweaty hardcore 3P with two consecutive vaginal cumshots",https://pic.javct.net/poster/01202026/1772687553.jpg,https://javct.net/v/fc2ppv-4858454,33,2026-03-05
HODV-21447-RM,If You're So Interested In Me ... Be My Guy For A Week. Sarina Kurokawa [Uncensored L**ked],https://pic.javct.net/poster/20241901/1705931057.jpg,https://javct.net/v/hodv-21447-rm,135,2026-03-05
FTHTD-169-RM,"As A Nurse, I Was Being Passed Around To Patients In Front Of My C**ldhood Friend Who I Loved So Much. Natsuho Hanamori [Uncensored L**ked]",https://pic.javct.net/poster/01202026/1772302323874.jpg,https://javct.net/v/fthtd-169-rm,160,2026-03-05
FNS-174-RM,I Succumbed To The Escalating Temptations Of My Serious And Docile Student And Had Sex With Him At A Love Hotel After School... Sana Ikuta [Uncensored L**ked],https://pic.javct.net/poster/01202026/1772553841939.jpg,https://javct.net/v/fns-174-rm,120,2026-03-05
MIGD-454-RM,FUCK Anal Bukkake! Nozomi Hatsuki [Uncensored L**ked],https://pic.javct.net/poster/20242012/1735172933.jpg,https://javct.net/v/migd-454-rm,120,2026-03-05
JUL-468-RM,Creampie Sex With My Younger Brother-In-Law At His Bachelor Pad While My Husband's At Work. Miho Aikawa [Uncensored L**ked],https://pic.javct.net/poster/20212011/1638725556.jpg,https://javct.net/v/jul-468-rm,135,2026-03-05
SAN-432Z-RM,"Middle-aged Men Can't Understand Their Thoughts, But This Is The C-side Of The Video For People Who Want To Have Sex With Young, Cute Amateur Girls. [Uncensored L**ked]",https://pic.javct.net/poster/01202026/1772472407.jpg,https://javct.net/v/san-432z-rm,96,2026-03-05
FTHTD-181-RM,"Alone In A Student Dormitory, A Female Student And A Middle-aged Manager Spend The Year-end And New Year Holidays. Their Young Bodies Can't Control Their Urges... New Year's Eve Deep Throating As They Fuck All Night Long. Motoka Komatsu [Uncensored L**ked]",https://pic.javct.net/poster/01202026/1772302201408.jpg,https://javct.net/v/fthtd-181-rm,138,2026-03-05
