code,title,image_url,page_url,views,date_scraped
MDTM-155-RM,Reputation Rhythmic Gymnastics Staff At The School Is Spree Sensitive Serious Sex! ! Yuna Himekawa [Uncensored L**ked],https://pic.javct.net/poster/20230104/1681342357.jpg,https://javct.net/v/mdtm-155-rm,130,2026-05-10
MDTM-138-RM,Transformation JK Haruhi Kotone Be Excited To Drink Piss School Girls Pee [Uncensored L**ked],https://pic.javct.net/poster/04112026/51d1e117ae.jpg,https://javct.net/v/mdtm-138-rm,127,2026-05-10
FNEO-075-RM,Mesugaki 05 Let's Make A Baby! A Serious Beautiful Girl Slips Out Of School And Has A Secret Hotel Date With Her Favorite Uncle. Riko Hino [Uncensored L**ked],https://pic.javct.net/poster/20230804/1693110558.jpg,https://javct.net/v/fneo-075-rm,118,2026-05-10
MDTM-116-RM,Girl Is In White Liquor Covered By The Men Of The Devil Father And Abnormal Proclivities [Uncensored L**ked],https://pic.javct.net/poster/04112026/a2faf05fb6.jpg,https://javct.net/v/mdtm-116-rm,126,2026-05-10
MADV-630-RM,"""Don't Say It..."" Special Edition Yui Hatano [Uncensored L**ked]",https://pic.javct.net/poster/04112026/646f69c21f.jpg,https://javct.net/v/madv-630-rm,120,2026-05-10
JUR-744-RM,"Every Time I Make A Mistake, My Wife Sneaks Out Of Work To Provide Sexual Services... She's Become My Personal ""fleshlight"" For My Scumbag Boss. [Uncensored L**ked]",https://pic.javct.net/poster/04112026/4cb1da974e.jpg,https://javct.net/v/jur-744-rm,120,2026-05-10
586HNHU-0201,"Immediately get hot with a cute girl who looks like a tall, small-faced model! While massaging her E-cup beautiful big breasts, she kisses him online and cries with an electric massager in super slutty mode! She is pounded hard from behind and cums inside her! Both of us are so fired up that the second time I ejaculate hot bukkake on my E-cup ♡",https://pic.javct.net/poster/04112026/aa476cadc1.jpg,https://javct.net/v/586hnhu-0201,63,2026-05-10
CHUC-041-RM,Asuka Momose Asuka Momose Active Girl [Uncensored L**ked],https://pic.javct.net/poster/20230804/1693110830.jpg,https://javct.net/v/chuc-041-rm,60,2026-05-10
FC2PPV-4898171,[3P Gonzo version of a half-beautiful married woman with her face in agony] A married woman who has to be trained is trained in an intense 3P by two men who are almost twice as big as her and continue to attack her.,https://pic.javct.net/poster/04112026/9cad4195e1.jpg,https://javct.net/v/fc2ppv-4898171,45,2026-05-10
FC2PPV-4897990,"World's first **pyjpx*jsps, successfully photographed 8-year-old girl in high school, 31 weeks pregnant, former idol group member, member of a super-major entertainment agency with many famous celebrities, fully exposed face, 10 days after graduation ceremony, 541st person to be photographed for the first time.",https://pic.javct.net/poster/04112026/dc0b8c1e5a.jpg,https://javct.net/v/fc2ppv-4897990,179,2026-05-10
FC2PPV-4896469,[Solo shot] A famous esthetician gets fucked in order to pay off her debt...,https://pic.javct.net/poster/04112026/712a9f2759.jpg,https://javct.net/v/fc2ppv-4896469,31,2026-05-10
HUNTC-590-RM,"The Plump, Protruding Buttocks Of The Moms' Volleyball Players In Their Bloomers Are Incredibly Erotic! 2 My Mother-in-law Brought Her Moms' Volleyball Teammates Over To Show Me Their Uniforms! [Uncensored L**ked]",https://pic.javct.net/poster/04112026/d988424c99.jpg,https://javct.net/v/huntc-590-rm,190,2026-05-10
URKK-066-RM,My Boobs Are Rubbed By The Perverted Landlord Next Door And I Get Fucked Every Day Nene Tanaka [Uncensored L**ked],https://pic.javct.net/poster/20221108/1662788152.jpg,https://javct.net/v/urkk-066-rm,136,2026-05-10
ROE-491-RM,"In The C**ldhood Home Where Everyone Else Has Left Home, I Spend My Days In Incestuous Relations With My Mother. [Uncensored L**ked]",https://pic.javct.net/poster/04112026/ed6e18761b.jpg,https://javct.net/v/roe-491-rm,150,2026-05-10
HUNTB-632-RM,"""Eh, Did You Insert It? ] A Beautiful Esthetician Who Seduces You At A Distance Of 0.1 Mm Over The Cloth! If You Get An Erection At A Men's Esthetic Where Touching Is Strictly Prohibited, It Will Be Over Your Panties... 2 [Uncensored L**ked]",https://pic.javct.net/poster/20230804/1692333998.jpg,https://javct.net/v/huntb-632-rm,210,2026-05-10
MDTM-084-RM,"Tsuruman Sweaty JK To Bare Is The Libido Tsuchiya Asami Pretty, SEX Pies Gamushara [Uncensored L**ked]",https://pic.javct.net/poster/20220707/1658767954.jpg,https://javct.net/v/mdtm-084-rm,140,2026-05-10
MIGD-533-RM,Sunohara Out Future Full Uncut Intrinsic In [Uncensored L**ked],https://pic.javct.net/poster/07202025/1756370628.jpg,https://javct.net/v/migd-533-rm,190,2026-05-10
ROYD-314-RM,"""Just The Tip"" Is Humanity's Greatest Lie. A Devilish, Slutty Therapist Pretends Not To Notice And Continues The Treatment With A 2cm Insertion Through The Cloth. Sarina Hyakunaga [Uncensored L**ked]",https://pic.javct.net/poster/04112026/997e3e7782.jpg,https://javct.net/v/royd-314-rm,130,2026-05-10
FC2PPV-4893257-RM,"I had creampie sex with a 23-year-old new graduate nurse. I appeared at the hospital in secret. Even though I had never orgasmed before, I found myself in a swamp of orgasmic pleasure overnight. It was so cute to see her shyly cumming inside. [Uncensored L**ked]",https://pic.javct.net/poster/04112026/a1530ebdf4.jpg,https://javct.net/v/fc2ppv-4893257-rm,94,2026-05-10
FC2PPV-4894624,"A pure-hearted person from Akita with only one experience, reunites with a freshly raised 18-year-old, and the semen of a city man is injected into a moist and erotic body that makes you feel the sex appeal of an adult before you see it.",https://pic.javct.net/poster/04112026/c86c71477a.jpg,https://javct.net/v/fc2ppv-4894624,52,2026-05-10
393OTIM-286-RM,"Completely defeated by a 30cm horse-sized dildo, flattering voice, flattering demon sex, in a portio & lewd state... gangimari vulgar intercourse Ai [Uncensored L**ked]",https://pic.javct.net/poster/20231011/1697847489.jpg,https://javct.net/v/393otim-286-rm,80,2026-05-10
ROYD-312-RM,"My C**ldhood Friend Has Grown Up More Than I Ever Imagined, And Her Incredibly Sexy Breasts Gave Me A Full Erection! Both Of Our Parents Were Away, So My Younger C**ldhood Friend Came To Stay The Night At My House. (Miyu Otori) [Uncensored L**ked]",https://pic.javct.net/poster/04112026/e89c4a3851.jpg,https://javct.net/v/royd-312-rm,130,2026-05-10
HUNTC-565-RM,Unlimited Sex With Anyone For A Fixed Monthly Fee! School Trip Edition: Pay A Fixed Monthly Fee And Have Unlimited Sex With Any Female Student Or Teacher During A School Trip! [Uncensored L**ked],https://pic.javct.net/poster/04112026/1a2ead5bce.jpg,https://javct.net/v/huntc-565-rm,140,2026-05-10
FC2PPV-4894535,"[Famous idol Nya-chan's 3rd work] This time, the stage is Okinawa⁉ It's not the Sapporo school swimsuit that has become a legend on SNS, but the Okinawa school swimsuit, where the neighbor almost finds out and has sex in the open. This time too, she gets creampied properly (^^",https://pic.javct.net/poster/04112026/562c7c8f27.jpg,https://javct.net/v/fc2ppv-4894535,100,2026-05-10
