code,title,image_url,page_url,views,date_scraped
VNDS-3437-RM,"""I Won't Leave Until I Make You Cum!"" The Visiting Doctor Will Squeeze Out Every Last Drop Of Sperm Until You're Empty. Ai Akatsuki, A 60-year-old Sperm Hunter. [Uncensored L**ked]",https://pic.javct.net/poster/06032026/1774323686.jpg,https://javct.net/v/vnds-3437-rm,120,2026-03-27
CEAD-739-RM,"""Ichiba Reika"" Does What She Wants And Gets Fucked By A Lustful Dick - Super Lewd Sex [Uncensored L**ked]",https://pic.javct.net/poster/06032026/1774416356.jpg,https://javct.net/v/cead-739-rm,167,2026-03-27
413INSTV-699-RM,"Very popular among girls as well, a slutty, real-life erotic, real-life H-cup, big-breasted broadcaster with her boyfriend, creampie video l**ked [Uncensored L**ked]",https://pic.javct.net/poster/06032026/1774577643595.jpg,https://javct.net/v/413instv-699-rm,80,2026-03-27
FC2PPV-4869334,"0413_001 Arisa-chan, 20 years old, a mysterious girl with a super slender body who attends a prestigious women's university, and when she gets pregnant, she unexpectedly proposes to get married and impregnates her.Is it finally time for the old man to pay his annual tax?",https://pic.javct.net/poster/06032026/1774573999.jpg,https://javct.net/v/fc2ppv-4869334,193,2026-03-27
FC2PPV-4869259,"[Individual shooting outdoor blowjob & sex] <Big breasted perverted wife> Former CA's fleshy body! Big nipples! Sukehira pussy!! This mature woman's cock sucking, piston cowgirl position, and a-face are irresistible!!",https://pic.javct.net/poster/06032026/1774573891.jpg,https://javct.net/v/fc2ppv-4869259,75,2026-03-27
BF-567-US,"When My Girlfriend Was Away On A Family Trip For 4 Days, I Went Crazy With Creampies On Her Elder Sister - Saeko Matsushita [English Subtitle, Reducing Mosaic]",https://pic.javct.net/poster/20212011/1641429169.jpg,https://javct.net/v/bf-567-us,170,2026-03-27
LUCY-025-RM,"Big-breasted Men's Beauty Salon: Be Careful Not To Pull Out Too Much! Close Contact Service From A Frustrated Beauty, Ayase Maina [Uncensored L**ked]",https://pic.javct.net/poster/06032026/1774416100.jpg,https://javct.net/v/lucy-025-rm,124,2026-03-27
TKD-049-RM,This Is Japanese Hospitality - The Landlady's Super Erotic Techniques [Uncensored L**ked],https://pic.javct.net/poster/20231011/1699069062.jpg,https://javct.net/v/tkd-049-rm,135,2026-03-27
MFC-357-RM,"Obedient college student whose pussy is conveniently used × first time sex, exciting SM play close-up of the private part makes me feel embarrassed... But the pleasure wins and it's natural to climax, and the second round of creampie from raw dick insertion is even more powerful SM play with restraints [Sakura (university student)] [Uncensored L**ked]",https://pic.javct.net/poster/06032026/1774421640726.jpg,https://javct.net/v/mfc-357-rm,74,2026-03-27
STAR-914-RM,Namatashi Initial Cum Inside Ban Removal Mitsuda Ann [Uncensored L**ked],https://pic.javct.net/poster/06032026/1774577030.jpg,https://javct.net/v/star-914-rm,205,2026-03-27
KAM-275-RM,[Private Tutoring] Secretly Filmed Sexual Intercourse Between A Married Private Tutor And A Student With A Big Dick [Forbidden 10-Camera Voyeur] Miho Tono [Uncensored L**ked],https://pic.javct.net/poster/06032026/1774373582.jpg,https://javct.net/v/kam-275-rm,120,2026-03-27
HUBLK-066-RM,Nipple Twisting And Aphrodisiac Soaked Student Guidance Aheiki Continuous Incontinence [Uncensored L**ked],https://pic.javct.net/poster/06032026/1774416163.jpg,https://javct.net/v/hublk-066-rm,120,2026-03-27
COSX-103-RM,[Hentai] Dochashiko Ichibanboshi! Sweet and sadistic Mikuru-chan is fo**ed to cum inside her! ? [5 shots] [Uncensored L**ked],https://pic.javct.net/poster/06032026/1774419760765.jpg,https://javct.net/v/cosx-103-rm,67,2026-03-27
SDNM-542-RM,"Wife who is defeated, prepares to become pregnant. Secretly having raw creampie sex at my in-laws' house with a SNS follower who wants to have eggs. Kazu Takashima [Uncensored L**ked]",https://pic.javct.net/poster/06032026/1774286654413.jpg,https://javct.net/v/sdnm-542-rm,169,2026-03-27
CEMD-822-RM,"Shame, Insult, Wearing Vibrator, Downtown Date! 38 Tsukada Shiori [Uncensored L**ked]",https://pic.javct.net/poster/06032026/1774416227.jpg,https://javct.net/v/cemd-822-rm,168,2026-03-27
SDAM-161-RM,"A record of a relationship-seeking stalker. A salon receptionist is given drugs. She wakes up, immediately squeezes her neck, deep throats her, and cums inside her. XXX [Uncensored L**ked]",https://pic.javct.net/poster/06032026/1774286953571.jpg,https://javct.net/v/sdam-161-rm,146,2026-03-27
420HPT-047-RM,"Saya (28) Amateur Hoi Hoi, Amateur Hoi Hoi Pet, Amateur, Beautiful Girl, Big Breasts, Super Breasts, Big Butt, Masochist Woman, Sex Friend, Jumping, Outdoors, Shame, Toys, Creampie, Gonzo, Documentary [Uncensored L**ked]",https://pic.javct.net/poster/06032026/1774421571956.jpg,https://javct.net/v/420hpt-047-rm,109,2026-03-27
JRZE-168-RM,First Shooting Married Woman Document Emina Minamizawa [Uncensored L**ked],https://pic.javct.net/poster/20231011/1699521509.jpg,https://javct.net/v/jrze-168-rm,135,2026-03-27
SYK-009-RM,[Libido/Appetite/Sleep Desire] Memories Of A Summer Day With A Small Wife Who Is 9 147 Cm Even Though She Is A Married Woman? ! My Dear Toyo (Yutaka) Huh? ! Already In Your 30s? Such A Wife's [sexual Desire★appetite★sleep Desire] Satsuki Toyooka [Uncensored L**ked],https://pic.javct.net/poster/20231011/1699070547.jpg,https://javct.net/v/syk-009-rm,170,2026-03-27
HZGD-262-RM,"""I'm Sorry For You..."" I'm Being Inseminated And Creampied By My Reluctant Father-in-law On A Dangerous Day Of Pregnancy... Chinamin [Uncensored L**ked]",https://pic.javct.net/poster/20231011/1698984660.jpg,https://javct.net/v/hzgd-262-rm,131,2026-03-27
SY-204-RM,"Kaede-san, 32 Years Old, The Wife Of A Four-and-a-half-tatami Room Amateur Four-and-a-half-tatami Creampie Series Kaede Mizukawa [Uncensored L**ked]",https://pic.javct.net/poster/20231011/1699070614.jpg,https://javct.net/v/sy-204-rm,120,2026-03-27
ALDN-251-RM,"At That Time, My Mother-in-law Invited Me... Yoshii Miki [Uncensored L**ked]",https://pic.javct.net/poster/20231711/1702099922.jpg,https://javct.net/v/aldn-251-rm,105,2026-03-27
HODV-21484-RM,"The Best Mistress, Dense Creampie Fuck File.8 100cm Moist Beautiful Woman With Big Butt & Breasts Saki Kiyone [Uncensored L**ked]",https://pic.javct.net/poster/06032026/1774576247.jpg,https://javct.net/v/hodv-21484-rm,137,2026-03-27
PKPD-266-RM,"A Simple Job Where You Just Have To Cum Inside Her. F-cup Daddy Nursing Student Ayano, 20 Years Old, Ayano Ozawa. [Uncensored L**ked]",https://pic.javct.net/poster/20231011/1699069464.jpg,https://javct.net/v/pkpd-266-rm,140,2026-03-27
