code,title,image_url,page_url,views,date_scraped
PKPD-092,Yen Woman Dating Creampie OK Big Ass Plump Job Hunting Student Kaede Ito,https://pic.javct.net/poster/06032026/1773543825.jpg,https://javct.net/v/pkpd-092,138,2026-03-15
AVOP-356-RM,Extreme Molester [Uncensored L**ked],https://pic.javct.net/poster/20222109/1664285017.jpg,https://javct.net/v/avop-356-rm,180,2026-03-15
SQTE-512-RM,"Love Triangle Where Both Are Girlfriends, 6 Shots In 2 Days And 1 Night! Until My Boyfriend's Spirit Runs Out. Aoi Kururugi/Mitsuki Nagisa [Uncensored L**ked]",https://pic.javct.net/poster/20231711/1701488157.jpg,https://javct.net/v/sqte-512-rm,142,2026-03-15
RKI-618-RM,All New Bucketloads Of Bukkake Minami Hatsukawa [Uncensored L**ked],https://pic.javct.net/poster/20212308/1631255832.jpg,https://javct.net/v/rki-618-rm,122,2026-03-15
MIST-061-RM,"At ""An Old Traditional Titty Pub"" In The Biggest Entertainment District In Japan, New Girls Will Secretly Fuck Their Customers Raw In Order To Steal Them From The Veteran Girls 01 [Uncensored L**ked]",https://pic.javct.net/poster/06032026/1773539615.jpg,https://javct.net/v/mist-061-rm,160,2026-03-15
BIJN-251-RM,THE Document Climax SEX That Exposes Instincts The Body Of A Beautiful Woman Who Wants To Be Fucked Awakens To Lewdness And Goes Crazy With Lewd Throbbing! Tsukihi Sara [Uncensored L**ked],https://pic.javct.net/poster/20231711/1701485564.jpg,https://javct.net/v/bijn-251-rm,128,2026-03-15
MUDR-361-RM,I'll Never Disobey Again... A Thorough Education For This Insolent Brat Who Looks Down On And Insults Men - Aizuki Himari [Uncensored L**ked],https://pic.javct.net/poster/06032026/1773373717.jpg,https://javct.net/v/mudr-361-rm,150,2026-03-15
YST-307-RM,"I Don't Care If She's Vulgar Or Classy, I Want To Play With Yokomiya As Much As I Can. Nanami Yokomiya [Uncensored L**ked]",https://pic.javct.net/poster/20231711/1700815570.jpg,https://javct.net/v/yst-307-rm,103,2026-03-15
MUDR-117-RM,From That Day On... Bondage Training In Uniform Girl Kanon Kanon [Uncensored L**ked],https://pic.javct.net/poster/06032026/1773226875.jpg,https://javct.net/v/mudr-117-rm,120,2026-03-15
AMBI-109-RM,Devil Father's Sex Processing Doll Uniform Beautiful Girl Crazy By Seeding Training Haruka Takami [Uncensored L**ked],https://pic.javct.net/poster/20240807/1722635098.jpg,https://javct.net/v/ambi-109-rm,121,2026-03-15
MIDA-040-SUB,"Even After Vaginal Ejaculation, Continue Pistoning To Make Sure She's Pregnant! Arata Arina [English Subtitle]",https://pic.javct.net/poster/20242012/1737084579.jpg,https://javct.net/v/mida-040-sub,120,2026-03-15
YMDD-353-RM,Younger Sister Catering Service Punichichi AI Younger Sister Is At Your Service! Ejaculation Treatment With A Naughty Nurse & Bet All My Semen To The Casino Bunny Girl! Kokoro Ayase [Uncensored L**ked],https://pic.javct.net/poster/20231711/1701487892.jpg,https://javct.net/v/ymdd-353-rm,120,2026-03-15
MOOR-006-RM,"The Younger Sister With A Kansai Dialect Who Came To Stay With Me On Holiday Had Grown Into A Super Masochist (and Had Big Breasts), So I Trained Her To Have Sex Without Telling Her Parents For 1 Night And 2 Days. Nonoka Yukari. [Uncensored L**ked]",https://pic.javct.net/poster/20231711/1700884197.jpg,https://javct.net/v/moor-006-rm,120,2026-03-15
APAK-266-RM,You Can Feel The Swaying Breasts All Over Your Body! A Voluptuous F-cup Beautiful Girl Who Loves Cowgirl Position #Off Paco Girl And Hotel Cage Lascivious Climax SEX Himari Aizuki [Uncensored L**ked],https://pic.javct.net/poster/20231711/1700888801.jpg,https://javct.net/v/apak-266-rm,139,2026-03-15
APNS-327-RM,Pregnant Guy● 120 Days Of Hell Yumerika [Uncensored L**ked],https://pic.javct.net/poster/20231711/1700888667.jpg,https://javct.net/v/apns-327-rm,120,2026-03-15
CVDX-373,Thirty Man Juice That Doesn't Thirst Begins To Spring Up.,https://pic.javct.net/poster/06032026/1773534583.jpg,https://javct.net/v/cvdx-373,240,2026-03-15
PRED-837-RM,A Black Gal Sister Is Treated Like A Masturbator In A Lewd Pose That Shows Her Body's Sensuality [Uncensored L**ked],https://pic.javct.net/poster/06032026/1773362378.jpg,https://javct.net/v/pred-837-rm,130,2026-03-15
PPPE-402-RM,My Girlfriend's Older Sister Seduces Me With Her Big Breasts And Creampie OK Marina Yakuno [Uncensored L**ked],https://pic.javct.net/poster/06032026/1773363184.jpg,https://javct.net/v/pppe-402-rm,120,2026-03-15
PKPD-410-RM,"Half In, Half Out, Half Girlfriend Mio Yukiyo Miho [Uncensored L**ked]",https://pic.javct.net/poster/06032026/1773449172.jpg,https://javct.net/v/pkpd-410-rm,120,2026-03-15
SABA-559,"Girls With Big TitsWhy Don't You Give Your Older Brother More Than One Turn And Give Him A Year's Worth Of Pocket Money?further!If You Can Get A White Liquid From The Tip Of Your Penis, You Can Spend 10 Years!",https://pic.javct.net/poster/06032026/1773534641.jpg,https://javct.net/v/saba-559,235,2026-03-15
PPPE-296-SUB,My Girlfriend's Sister Seduces Me With Her Big Tits And Creampie OK Haruhi Moka [English Subtitle],https://pic.javct.net/poster/20242012/1737083818.jpg,https://javct.net/v/pppe-296-sub,120,2026-03-15
MUDR-353-RM,How To Captivate A Girl: Using The Sense Of Immorality And Pleasure To Brainwash A Girl With Creampie Sex And Insemination! Sumire Kuramoto [Uncensored L**ked],https://pic.javct.net/poster/06032026/1773340787.jpg,https://javct.net/v/mudr-353-rm,120,2026-03-15
MRSS-181-RM,I Was Approached By The Mother (36) Of One Of My Students At The Soccer Club! I Never Thought A Frustrated Mother Would Be So Aggressive And Erotic... Fujisaki Murasaki [Uncensored L**ked],https://pic.javct.net/poster/06032026/1773449025.jpg,https://javct.net/v/mrss-181-rm,121,2026-03-15
JERA-027,"I Met Yuki Yoshizawa, A Hard-working Office Lady Who Lied About Being On A Business Trip, And We Had A Midnight Affair. From Night To Morning, I Drank Her Semen And Creampied Her Multiple Times, And I Had Her All To Myself.",https://pic.javct.net/poster/06032026/1773508029.jpg,https://javct.net/v/jera-027,264,2026-03-15
