code,title,image_url,page_url,views,date_scraped
DANDY-693-RM,Beautiful Ass Esthetician VOL.2 To Remove The Bones In The S-shaped Swinging Woman On Top Position That Does Not Move The Man Who Has Erected At All [Uncensored L**ked],https://pic.javct.net/poster/20240410/1729060016.jpg,https://javct.net/v/dandy-693-rm,160,2026-03-01
CAWD-958-RM,Super Revival Class Sex Triple Crown Champion Massive Creampie Orgy Unveiled Hibikiren [Uncensored L**ked],https://pic.javct.net/poster/01202026/1772126717.jpg,https://javct.net/v/cawd-958-rm,150,2026-03-01
MGNL-155,“Limited To Big-breasted Female College Student Managers! Get A Prize If You Make The Male Members Ejaculate! 』A Firm Slender Big-breasted Imitator Takes On The Challenge ☆ He Pulls Out The Cocks Of 3 People And Even Finishes The Brush → He Gets Fucked By Everyone And All Of Them Cum Inside Each Other To Solve Their Problems ☆ [Street Corner Amateur Monitoring #Hana #Tennis Club Manager],https://pic.javct.net/poster/01202026/1772341706507.jpg,https://javct.net/v/mgnl-155,61,2026-03-01
FC2PPV-4856372,"[Amateur POV #035] Super cute white gal Mio, who is a super talent, has sex in the hotel in the middle of the day while wearing long boots, and ends with a creampie [review bonus included]",https://pic.javct.net/poster/01202026/1772341189.jpg,https://javct.net/v/fc2ppv-4856372,58,2026-03-01
DASD-906-RM,Embarrassing Yet Arousing Bathtime. Nephew Bathes With His Aunt For The First Time In Years. Starring Morisawa Kana [Uncensored L**ked],https://static.javct.net/poster/dasd-906.jpg,https://javct.net/v/dasd-906-rm,118,2026-03-01
VRNC-075,"Group Sex With Beautiful Women Who Can Almost Be Called The Gals! If You Take It Off, You'll Devour The Body That Has So Much Potential For A Nice Body! [Hana./Karen./Kiki./Rika.] Ver.Kiki.＆Rika.",https://pic.javct.net/poster/01202026/1772335481267.jpg,https://javct.net/v/vrnc-075,86,2026-03-01
FC2PPV-4856380,[First shot] Is it a dream that a certain famous underground dollar will let you have sex? A 20-year-old with a strong sexual desire seduces an old man with the body trained through dance,https://pic.javct.net/poster/01202026/1772341108.jpg,https://javct.net/v/fc2ppv-4856380,98,2026-03-01
VRNC-077,Nice Buddy Bitch,https://pic.javct.net/poster/01202026/1772334641982.jpg,https://javct.net/v/vrnc-077,55,2026-03-01
FC2PPV-4833053,"The secret to a beautiful body of a Marunouchi office lady who works at a major listed company is fair-skinned, divine breasts, and slender body.The secret to her beautiful body is intense creampie sex at a hotel.",https://pic.javct.net/poster/01202026/1772341363.jpg,https://javct.net/v/fc2ppv-4833053,87,2026-03-01
STCV-594,Too Sensitive G-class Breasts ♪ GAL @ Tsubaki (temporary Name),https://pic.javct.net/poster/01202026/1772334584897.jpg,https://javct.net/v/stcv-594,65,2026-03-01
MGNL-153,“Escape Cooperation Game Where Gal X Virgin Semen Is Collected! ” A Tsundere Gal With An Irresistible Gap Takes On The Challenge ☆ Squeezing The Sperm Out Of An Unparalleled Virgin Dick And Developing It Into A Raw Sex Session... She Is Made To Cum By The Unrelenting Cock And Cums Continuously ♪ [Street Corner Amateur Monitoring #ran #25 Years Old],https://pic.javct.net/poster/01202026/1772334957943.jpg,https://javct.net/v/mgnl-153,82,2026-03-01
PKPD-276-RM,Rental Wife Delivered Directly From Her Husband - Plump H-Cup Masochistic Young Wife NTR Jun Asami Jun [Uncensored L**ked],https://pic.javct.net/poster/20231912/1703909606.jpg,https://javct.net/v/pkpd-276-rm,130,2026-03-01
FC2PPV-4856864,First shot [No] [Creampie] NTR A beautiful woman who has few experience and is devoted to her boyfriend. It feels better than her boyfriend. Creampie in her wet pussy. There are tan marks from her swimsuit. *Bonus included,https://pic.javct.net/poster/01202026/1772341891.jpg,https://javct.net/v/fc2ppv-4856864,45,2026-03-01
IENE-892,Extraordinary Virginity Boy Boy In A Row!stop It!And A Sassy And Busty C**ldhood Friend's Girl Who Escapes And Runs Away Man Chasing After Raw!I Attacked It Repeatedly And Stopped Inside!,https://pic.javct.net/poster/01202026/1772334528.jpg,https://javct.net/v/iene-892,140,2026-03-01
LULU-100-RM,"""If You Can't Hold It In You Can Put It Inside Me!"" I'm So Horny I'm About To Explode! Wife Addicted To Sex After Fucking Many Times Yuri Fukada [Uncensored L**ked]",https://pic.javct.net/poster/20212709/1633426205.jpg,https://javct.net/v/lulu-100-rm,160,2026-03-01
GVH-824-RM,Mother And Son R**e Yuki Yoshizawa [Uncensored L**ked],https://pic.javct.net/poster/01202026/1772218636.jpg,https://javct.net/v/gvh-824-rm,120,2026-03-01
LULU-428-RM,"In Order To Rehabilitate My Cheeky, Reclusive, And Socially Unfit Little Sister, I Tickled Her Whole Body... And She Writhed And Peed In Ecstasy! Her Sensitivity Increased, And She Instantly Orgasmed. I Creampied Her Sensitive, Shaved, Squirting Pussy Over And Over Again! Yura Kana [Uncensored L**ked]",https://pic.javct.net/poster/01202026/1772126424.jpg,https://javct.net/v/lulu-428-rm,160,2026-03-01
PKPD-277-RM,"A Simple Job Where You Just Have To Cum Inside Her. Natsuki Yokoyama Natsuki, A Natural G-cup Half-half-half-outer Girlfriend. [Uncensored L**ked]",https://pic.javct.net/poster/20231912/1703909537.jpg,https://javct.net/v/pkpd-277-rm,130,2026-03-01
PKGP-007-RM,Sweetheart Love Document - Natural Hairy Big Breasts Erotic Final Form One Day Flirty Date With Amaharuno Ai [Uncensored L**ked],https://pic.javct.net/poster/20231912/1703909806.jpg,https://javct.net/v/pkgp-007-rm,130,2026-03-01
GENM-017-RM,"Emi Fukada, A Woman Who Pleads Vaginal Cum Shot Many Times [Uncensored L**ked]",https://pic.javct.net/poster/20233001/1676260628.jpg,https://javct.net/v/genm-017-rm,118,2026-03-01
AKA-068-RM,Saddle Madly Perplexed Endless Pleasure Out In Pursuit Pleasure File. [Uncensored L**ked],https://pic.javct.net/poster/01202026/1772330801.jpg,https://javct.net/v/aka-068-rm,165,2026-03-01
JUR-218-SUB,"Miho, A Strong-willed Construction Worker Wife, Is A Sensitive, Weak-willed Pussy That Can't Stand Pressure And Cums Quickly With Her Subordinate's Dick. Miho Tono [English Subtitle]",https://pic.javct.net/poster/20253001/1740070451.jpg,https://javct.net/v/jur-218-sub,130,2026-03-01
JUFE-612-RM,Bondage Ban Lifted! Young Lady Bondage With White Soft Skin Tying Up Kuroshima Rei [Uncensored L**ked],https://pic.javct.net/poster/01202026/1772218328.jpg,https://javct.net/v/jufe-612-rm,160,2026-03-01
MIST-043-RM,"She Screwed Up At Work, So I Pretended To Console This Female Employee And Ended Up Giving Her A Creampie! She Bowed To Apologize And It Gave Me The Perfect Chance To Grab That Ass... [Uncensored L**ked]",https://pic.javct.net/poster/20221202/1648255497.jpg,https://javct.net/v/mist-043-rm,204,2026-03-01
