code,title,image_url,page_url,views,date_scraped
MDB-791,Naked Nurse Harlem Special Abe Mikako Shinoda Yu No Umenomiya Misato,https://pic.javct.net/poster/04112026/c9bcd0c993.jpg,https://javct.net/v/mdb-791,125,2026-04-28
MDB-724,What If Working In The Married Woman Mah-jong Club Rumors With Excess Service Pies Is My Deca Lantern ... Kaho Shibuya Yu Shinoda Yuu Kawakami Maki Hojo,https://pic.javct.net/poster/04112026/063a979b3c.jpg,https://javct.net/v/mdb-724,120,2026-04-28
MDB-604,Would You Like To Test Drive With Me?Indecent Sales 2 Hasumi Claire Hosaka Collar Yu Shinoda Busty Car Dealer Wind Noise Mica Serino Rina,https://pic.javct.net/poster/04112026/9546c6d38f.jpg,https://javct.net/v/mdb-604,240,2026-04-28
MCKT-002,"[The Fuck Log] When Yu Shinoda Gets Busy, She's Pumping Out That Slut Energy, So We Filmed Some Creampie POV Videos With Her!",https://pic.javct.net/poster/04112026/6f5e7fbb9b.jpg,https://javct.net/v/mckt-002,66,2026-04-28
MIAA-058,"Even If It Ejaculates, Seducing Whisper Middle-aged Father Who Doesn't Continue To Commit The Tympanic Membrane The Adhesion Press Elder Sister Without Pulling Out Hunting Shibata Yu",https://pic.javct.net/poster/04112026/a9f93544ee.jpg,https://javct.net/v/miaa-058,120,2026-04-28
MIAA-052,Nipple Irritating Spider Cowgirl In Continuous Shooting Out Rejuvenated Massage Yu Shibata,https://pic.javct.net/poster/04112026/190d59d31d.jpg,https://javct.net/v/miaa-052,170,2026-04-28
10-042826-01,Busty swimsuit beauty and slippery lotion play,https://pic.javct.net/poster/04112026/861df0e9d3.jpg,https://javct.net/v/10-042826-01,46,2026-04-28
390JAC-236-RM,"[A super sensitive girl with perfect visuals who cums all over the place 7 times a week, I'm going to cum continuously on Mako with a shaved pussy]in Odaiba - I can't be satisfied unless I meet a blonde gal with transparent skin 7 days a week and fuck her for two whole days in the past, and her sexual addiction is still evolving...Guilty gal-chan's erotic expression and the blow job that takes her deep inside her mouth feel so good...I fuck a super sensitive bijou gal who can't stop squirting with a lot of creampies [106th gal shibe rich man] Aika-chan] [Uncensored L**ked]",https://pic.javct.net/poster/04112026/381e4415e2.jpg,https://javct.net/v/390jac-236-rm,113,2026-04-28
SDAM-171,A beautiful cafe clerk goes to work and leaves work. Pervert complainer sexually harasses by continuously spraying super thick semen on the face,https://pic.javct.net/poster/04112026/8539483e84.jpg,https://javct.net/v/sdam-171,151,2026-04-28
413INSTV-706-RM,"I made the world's rotten, sassy woman understand the fear of being an adult. [Uncensored L**ked]",https://pic.javct.net/poster/04112026/ad0849de49.jpg,https://javct.net/v/413instv-706-rm,60,2026-04-28
DDH-394-RM,Touka [Uncensored L**ked],https://pic.javct.net/poster/04112026/fda7947553.jpg,https://javct.net/v/ddh-394-rm,64,2026-04-28
START-544-RM,"My very convenient meat masturbation married woman mistress who begs and begs for creampie over and over again with lewd words, Koio Nagisa [Uncensored L**ked]",https://pic.javct.net/poster/04112026/370cf2ed95.jpg,https://javct.net/v/start-544-rm,151,2026-04-28
PKPD-130,"Nakada Group C Hikari-chan (18) Hey, Why Don't You Play With Your Uncle? Demon Ro I Met In A Nearby Park ● Creampie Girl Hope Light",https://pic.javct.net/poster/04112026/a2f5b50bd2.jpg,https://javct.net/v/pkpd-130,136,2026-04-28
MIGD-589,Suzu-wa Miu Intrinsic Out During The First,https://pic.javct.net/poster/04112026/58c1f082cd.jpg,https://javct.net/v/migd-589,160,2026-04-28
FC2PPV-4887956,[S-class beauty] This smile is a national treasure of a 21-year-old female college student who makes her slender body slippery and is satisfied until she is satisfied. A groin massage of a model-shaped beauty is a violation.,https://pic.javct.net/poster/04112026/b62c4e8d80.jpg,https://javct.net/v/fc2ppv-4887956,64,2026-04-28
FC2PPV-4885311,"[None] [Also 3 previous works] A man who looks like he came out of an erotic manga. F-cup big breasts and high-leg leotard. Appearance, gesture, atmosphere, erotic technique. Everything is top-notch lewd and swallowed. *Bonus High quality image",https://pic.javct.net/poster/04112026/cfd4ae3cdc.jpg,https://javct.net/v/fc2ppv-4885311,49,2026-04-28
892OERO-002-RM,"The moment we enter the hotel, a wife who loves sex without telling her husband kisses her with great force and says, ""I've been horny for a long time...'' We're about to have sex, so you don't need something like this (a ring), I'll give you a big creampie [includes bonus video] [Uncensored L**ked]",https://pic.javct.net/poster/04112026/f1de3affe1.jpg,https://javct.net/v/892oero-002-rm,82,2026-04-28
KSBJ-059,Widow's Mother-in-law Maiko Yuki Who Tempts Her Daughter-in-law,https://pic.javct.net/poster/04112026/27954f968d.jpg,https://javct.net/v/ksbj-059,114,2026-04-28
MFCW-071-RM,Aina [Uncensored L**ked],https://pic.javct.net/poster/04112026/3cc2e1ff33.jpg,https://javct.net/v/mfcw-071-rm,66,2026-04-28
FTHTD-199-RM,Old-fashioned Beautiful Mother-in-law [Uncensored L**ked],https://pic.javct.net/poster/04112026/a64f79542f.jpg,https://javct.net/v/fthtd-199-rm,121,2026-04-28
T28-452-RM,Orgy Cum School Girls Group Hypnosis [Uncensored L**ked],https://pic.javct.net/poster/20242108/1727045142.jpg,https://javct.net/v/t28-452-rm,180,2026-04-28
SVCAO-025-RM,"A new female AD with a meat urinal of minimum height has complete mind control with her mu**erous phrase, ""You want to be a director, right?"" She is fucked every day, 365 days a year, and made to suck her dick, giving birth to a sex-crazed pussy. [Uncensored L**ked]",https://pic.javct.net/poster/04112026/1776971108222.jpg,https://javct.net/v/svcao-025-rm,183,2026-04-28
SGM-042-RM,Outdoors ● Psychopathic Strength In The Remote Mountains ● Married Women Who Were Attacked By Demons And Cried In Vain And Covered In Mud ● [Uncensored L**ked],https://pic.javct.net/poster/04112026/1b228793d0.jpg,https://javct.net/v/sgm-042-rm,120,2026-04-28
DVMM-022-RM,"Regular Male/female Monitoring AV. An Unparalleled Busty Wife Is Given A Condom And Spends 1 Night And 2 Days With A Virgin College Student. There's No Way The Frustrated, Long-lost Wife Will Be Satisfied With Just One Rubber Sex... Straddling A Younger Man's Virgin Dick And Shaking Her Big Tits. I'm Cumming! Continuous Creampie SEX That Squeezes Out The Semen That Has Accumulated In The Pool Many Times! [Uncensored L**ked]",https://pic.javct.net/poster/20230908/1695959142.jpg,https://javct.net/v/dvmm-022-rm,260,2026-04-28
