code,title,image_url,page_url,views,date_scraped
MXGS-1177,Membership Helper-If You Appoint A Housekeeper Who Has Been Waiting For 3 Months By Reservation ... Himari Kinoshita,https://pic.javct.net/poster/04112026/741852af45.jpg,https://javct.net/v/mxgs-1177,125,2026-05-12
HUSR-167,Mom's Cock Is Incredible!Mother-in-law Is A Man's Daughter!Daughter And Son Dohimaru Who Haunts Her Huge Cock ... ... Pervert Family Gachijiki Incest Incest! [Yukino Akari] 【Sayaka Sakurai】,https://pic.javct.net/poster/04112026/ecd368dd91.jpg,https://javct.net/v/husr-167,120,2026-05-12
DJE-065-RM,It Topped Kupaa Wakaba Onoe [Uncensored L**ked],https://pic.javct.net/poster/04112026/212afc1dc2.jpg,https://javct.net/v/dje-065-rm,180,2026-05-12
FC2PPV-4899228,[FC2/Legendary Beautiful Big Breasts] Sports Instructor's Bururun Big Breasts Streamer (21) Big titty fuck with another dimension ⇒ 2 creampies & facial cumshot,https://pic.javct.net/poster/04112026/ecdbae33a3.jpg,https://javct.net/v/fc2ppv-4899228,104,2026-05-12
FC2PPV-4899093,"[Individual] A former model with a half-faced face. She is 4 months pregnant and her work has drastically decreased. Even though she is behind on her payments, she still has a cocky attitude from her past glory. She is showing her mental attitude that does not yield to the advances of others.",https://pic.javct.net/poster/04112026/9e6617bc04.jpg,https://javct.net/v/fc2ppv-4899093,40,2026-05-12
PA-051226-100,"Mature Woman Special Movie 19 ~ 30s,40s and 50s ~",https://pic.javct.net/poster/04112026/e8d54f3afa.jpg,https://javct.net/v/pa-051226-100,72,2026-05-12
CR-051226-001,"Non Stop XXX for 180min : A proactive, horny older sister's multiple orgasms Part. 1",https://pic.javct.net/poster/04112026/b72829f675.jpg,https://javct.net/v/cr-051226-001,90,2026-05-12
HZ-3846,Beauty Collection Vol.120 - Ami Ogura,https://pic.javct.net/poster/04112026/6df9806905.jpg,https://javct.net/v/hz-3846,61,2026-05-12
HONB-485,"In The Showa Era, It Would Have Been Safe.",https://pic.javct.net/poster/04112026/902eb048fa.jpg,https://javct.net/v/honb-485,72,2026-05-12
1P-051226-001,PtoM SEX: Sakura Aoi,https://pic.javct.net/poster/04112026/5f64e95de8.jpg,https://javct.net/v/1p-051226-001,61,2026-05-12
KV-318,"113 Minutes Of Non-stop Filming, Uncut Editing, Featuring 25 Consecutive Cumshots, A Blowjob, And 13 Consecutive Cumshots!! Mai Onodera",https://pic.javct.net/poster/04112026/01a61cea7a.jpg,https://javct.net/v/kv-318,113,2026-05-12
EBOD-490,Reverse Aphrodisiac 10 Do My Sperm Pulling It Until The Testicle Karakkara Barrage SEX Suzuki Mayu,https://pic.javct.net/poster/04112026/6fc484b4de.jpg,https://javct.net/v/ebod-490,120,2026-05-12
546EROFV-374,Under fire after her boyfriend was found out!? Excavation data of the rookie Y〇UTUBER who is suspected of having sex videos l**ked is released,https://pic.javct.net/poster/04112026/a297980020.jpg,https://javct.net/v/546erofv-374,60,2026-05-12
TENN-046-RM,"The Miraculous Beautiful Girl Umi-chan, Unearthed On MachiApp, Has A Truly Intense And Passionate Sex Session. [Uncensored L**ked]",https://pic.javct.net/poster/04112026/f8d7eda441.jpg,https://javct.net/v/tenn-046-rm,105,2026-05-12
T28-475,Homecoming And Put Out In Secret Of Incest Sister And Parents Who Met In A Long Time Sexual Intercourse Yuri Asada,https://pic.javct.net/poster/04112026/2e87c3d8f0.jpg,https://javct.net/v/t28-475,120,2026-05-12
VEC-351-RM,"My Mother, Whose Sexual Desire Is Too Strong (with Flotilla Habit), Was Brought To Sleep With Her Loving Boyfriend. Hana Haruna [Uncensored L**ked]",https://pic.javct.net/poster/06032026/1774355415.jpg,https://javct.net/v/vec-351-rm,85,2026-05-12
MIGD-603,Makihara Aina Out In Full Uncut Intrinsic,https://pic.javct.net/poster/04112026/e164792e06.jpg,https://javct.net/v/migd-603,170,2026-05-12
MIST-209,"At ""An Old Traditional Titty Pub"" In The Biggest Entertainment District In Japan, New Girls Will Secretly Fuck Their Customers Raw In Order To Steal Them From The Veteran Girls 10",https://pic.javct.net/poster/04112026/9df49150c0.jpg,https://javct.net/v/mist-209,160,2026-05-12
DLIS-001,Beautiful Girls Crazy Sex Feeling Development Traceability,https://pic.javct.net/poster/04112026/980be46140.jpg,https://javct.net/v/dlis-001,130,2026-05-12
MOGI-157-RM,"[Creampie Orgy at Training Camp] I left my father and went to a summer training camp when I was a little league baseball girl. I want to be fucked by a man as old as my coach. Sakina Takeuchi, 18 years old [Uncensored L**ked]",https://pic.javct.net/poster/04112026/718c94bbe4.jpg,https://javct.net/v/mogi-157-rm,125,2026-05-12
RVG-242-RM,Mother-son R**e BEST VOL.7 [Uncensored L**ked],https://pic.javct.net/poster/07202025/1754676373.jpg,https://javct.net/v/rvg-242-rm,240,2026-05-12
HODV-21558-RM,(Complete POV) Girl With Accent Kumamoto Accent Kanon Nakajo [Uncensored L**ked],https://pic.javct.net/poster/20212709/1636419230.jpg,https://javct.net/v/hodv-21558-rm,143,2026-05-12
CHUC-043-RM,Former Reader Model 25-Year-Old De M Apparel Clerk Rena Munakata Rena [Uncensored L**ked],https://pic.javct.net/poster/20230804/1693110709.jpg,https://javct.net/v/chuc-043-rm,70,2026-05-12
FERA-177-RM,Son Gamusha Kunni Is A Strike! Chisato Shoda Was Too Pleasant To Have Sex With Her And Ended Up Having Creampie Incest [Uncensored L**ked],https://pic.javct.net/poster/20230804/1692242601.jpg,https://javct.net/v/fera-177-rm,100,2026-05-12
