code,title,image_url,page_url,views,date_scraped
GOJI-012-RM,Creampie My Sister Who Approaches Me From Morning Till Night [Uncensored L**ked],https://pic.javct.net/poster/20231011/1698721941.jpg,https://javct.net/v/goji-012-rm,186,2026-05-01
FC2PPV-4892310,"[2 cameras uncensored] SEX addicted funky gal makes her second appearance, this time she goes crazy with machine gun anal fucking",https://pic.javct.net/poster/04112026/4ae7248de3.jpg,https://javct.net/v/fc2ppv-4892310,79,2026-05-01
SBN-003-RM,Beautiful-legged Masochistic Pervert Woman Misuzu Shimizu () [Uncensored L**ked],https://pic.javct.net/poster/04112026/fd4da3fa92.jpg,https://javct.net/v/sbn-003-rm,115,2026-05-01
ETQR-494-RM,I Shared A Room With A Beautiful Drunk Female Employee At A Hotel... Himari [Uncensored L**ked],https://pic.javct.net/poster/20230804/1694018320.jpg,https://javct.net/v/etqr-494-rm,80,2026-05-01
MDTE-048-RM,Raw Vaginal Cum Shot To Erokawa Active Female College Student I Met Through God App 10 [Uncensored L**ked],https://pic.javct.net/poster/20230908/1694146697.jpg,https://javct.net/v/mdte-048-rm,195,2026-05-01
FC2PPV-4892087,"[Uncensored] **pyjpx*jsps Super cute ~ A lot of love juice oozing out of Rika's panties of 18 years old 〇〇 who has a real face... I can't resist Playing with her nipples with a suction device ~ Naturally, the clitoris is also standing up",https://pic.javct.net/poster/04112026/3209031f26.jpg,https://javct.net/v/fc2ppv-4892087,76,2026-05-01
MARA-060-RM,Yuki Chitose's Big Tits Theater Jcup! 110cm [Uncensored L**ked],https://static.javct.net/poster/mara-060.jpg,https://javct.net/v/mara-060-rm,127,2026-05-01
XRW-640-RM,Young Wife Mr. Kanna (Kana) Misaki Kan That Does Not Stop Even If She Sits Inside Five Times While Her Husband Does Not Know [Uncensored L**ked],https://pic.javct.net/poster/04112026/f8d7f39bfd.jpg,https://javct.net/v/xrw-640-rm,141,2026-05-01
PAKO-064-RM,Local NTR File.001 [Uncensored L**ked],https://pic.javct.net/poster/20230908/1694490680.jpg,https://javct.net/v/pako-064-rm,140,2026-05-01
MARA-059-RM,Yume Natsuki In The Colossal Tits Theater 93cm H-Cup Titties! [Uncensored L**ked],https://static.javct.net/poster/mara-059.jpg,https://javct.net/v/mara-059-rm,123,2026-05-01
MUDR-077-RM,Since That Day .... Bondage To**ure In Uniform Uniform Girl Kato Momo [Uncensored L**ked],https://pic.javct.net/poster/04112026/2ae1c888aa.jpg,https://javct.net/v/mudr-077-rm,110,2026-05-01
MILK-185-RM,Drink Holy Water Bristle Cabin Attendant Greedy Piss Drinking Cunnilingus Piss Sprinkle Sex Yuki Nono [Uncensored L**ked],https://pic.javct.net/poster/20230804/1694057375.jpg,https://javct.net/v/milk-185-rm,124,2026-05-01
VEC-612-RM,A Married Woman Who Was Vaginal Cum Shot By Her Husband's Friend Unfaithful Fire Play That Fills The Gap Of Her Lonely Body. Kawakami Yuu [Uncensored L**ked],https://pic.javct.net/poster/20230908/1694760651.jpg,https://javct.net/v/vec-612-rm,95,2026-05-01
HRSM-002-RM,Girls Targeted By Scum Teachers Irama Training / Meat Urinal Sex Guys W Completely Fallen Creampie... [Uncensored L**ked],https://pic.javct.net/poster/20230908/1694177601.jpg,https://javct.net/v/hrsm-002-rm,145,2026-05-01
SVN-002-RM,Blowjob Girl Pacifier Poisoning Uniform Fertilization Miru Machida [Uncensored L**ked],https://pic.javct.net/poster/20230908/1694315350.jpg,https://javct.net/v/svn-002-rm,122,2026-05-01
GMJK-013-RM,"Exposure Aokan-Outdoor, Slapping, Facial, Strangling... M Woman's Pleasure-Anna Suzune [Uncensored L**ked]",https://pic.javct.net/poster/20230908/1694491457.jpg,https://javct.net/v/gmjk-013-rm,120,2026-05-01
GNS-150-RM,Viewer Discretion Advised: 19 Videos Showing Exploitation Of Prospective Tenants By A Certain Real Estate Company. [Uncensored L**ked],https://pic.javct.net/poster/04112026/b2a8a36ac3.jpg,https://javct.net/v/gns-150-rm,290,2026-05-01
SABA-850-RM,Excessive Power Harassment Interview Video L**ked Raw Creampie Job Hunting Female College Student Job Hunting Students Who Get A Job Offer By Selling Their Bodies Vol.002 [Uncensored L**ked],https://pic.javct.net/poster/20230908/1694235291.jpg,https://javct.net/v/saba-850-rm,180,2026-05-01
NACR-725-RM,"Tsukino Okawa, The Editor's Wife Kept By An Elderly Novelist [Uncensored L**ked]",https://pic.javct.net/poster/20231011/1699155446.jpg,https://javct.net/v/nacr-725-rm,120,2026-05-01
MIST-385-RM,Danger Day Direct Hit! ! Soapland Where You Can Make C**ldren 41 Misono Suwon [Uncensored L**ked],https://pic.javct.net/poster/20222109/1665031807.jpg,https://javct.net/v/mist-385-rm,165,2026-05-01
MUKC-021-RM,"""Get Out Of Here ..."" Cosplayer Abducted By An Unknown Hotel Training Confinement Maika Hiizumi [Uncensored L**ked]",https://pic.javct.net/poster/20221904/1652428076.jpg,https://javct.net/v/mukc-021-rm,200,2026-05-01
URKK-050-RM,Get At Least 10 Shots Off!! Big Tits Aphrodisiac Salon Where Endless Creampies Possible As Big Tits Shake. Misono Mizuhara [Uncensored L**ked],https://pic.javct.net/poster/20212011/1639218234.jpg,https://javct.net/v/urkk-050-rm,123,2026-05-01
STSK-221-RM,Campaign Girl Vagina Hunt 3 - Event Companions Driven Crazy With Pleasure And Soiled With Semen - [Uncensored L**ked],https://pic.javct.net/poster/04112026/df37610cac.jpg,https://javct.net/v/stsk-221-rm,175,2026-05-01
STSK-089-RM,Hotel Woman Group Obscenity 2-Female Room Attendant Destroyed By Brutal Acts- [Uncensored L**ked],https://pic.javct.net/poster/20230804/1694058867.jpg,https://javct.net/v/stsk-089-rm,164,2026-05-01
