code,title,image_url,page_url,views,date_scraped
MIST-129,Cuckold Shock From The Wife Who Loves Video Letter!wife Once In 6 Private Video Watching Erotic Dvd Has Been Seeded To A Man Who Does Not Know At The Allusion To Me!,https://pic.javct.net/poster/01202026/1772766281.jpg,https://javct.net/v/mist-129,150,2026-03-06
NACT-093-RM,Pleasure Salon Room: I Learned Pleasure From The Creepy Old Man's Amazing Technique - Koiro Yuki [Uncensored L**ked],https://pic.javct.net/poster/01202026/1772643974.jpg,https://javct.net/v/nact-093-rm,125,2026-03-06
MFCS-199-RM,"[Impulsive cheating sex after 6 years of love for each other was discovered] At a school reunion, we found out we were in love with each other, but we secretly slipped out and had a blow job and swallowed cum in a private room in the bathroom.The after-party was just the two of us, and even though we had a girlfriend, we went directly to the hotel, but we lost our sense of reason.We had serious sex and creampied each other in our clothes, and we ejaculated thick cloudy sperm twice in a row. [Uncensored L**ked]",https://pic.javct.net/poster/01202026/1772522929274.jpg,https://javct.net/v/mfcs-199-rm,87,2026-03-06
MIGD-523,Yoshimi Riina One Shot Out Of The Amount Was Really,https://pic.javct.net/poster/01202026/1772766342.jpg,https://javct.net/v/migd-523,120,2026-03-06
IENE-898,"At The Gathering Of Young Women Of The Neighborhood Association, The Man Is The Only King Of The Game",https://pic.javct.net/poster/01202026/1772766465.jpg,https://javct.net/v/iene-898,150,2026-03-06
SKMJ-723-RM,A Real Pick-up Of A Female Announcer From A Local TV Station. She Makes A Miraculous AV Appearance Right After Filming → Even Has A Dream Threesome With Two TV Announcers! [Uncensored L**ked],https://pic.javct.net/poster/01202026/1772163115.jpg,https://javct.net/v/skmj-723-rm,253,2026-03-06
MDBK-244-SUB,"[Miracle] When I Called A Delivery Health Service, I Had A Very Good Experience With My Local Busty Friend! 07 [English Subtitle]",https://pic.javct.net/poster/20220406/1654928424.jpg,https://javct.net/v/mdbk-244-sub,140,2026-03-06
JERA-010-RM,"""I'm Interested, But I'm Scared To Do It Alone..."" My Normally Quiet Sex Friend Yukari Nono Invited Me On My First Sex-induced Affair Date. [Uncensored L**ked]",https://pic.javct.net/poster/01202026/1772305193.jpg,https://javct.net/v/jera-010-rm,280,2026-03-06
T28-634-RM,"The Day My Parents Were Away, I Fucked My Little Sister All Day Until My Sperm Withered. Nana Kisaki [Uncensored L**ked]",https://pic.javct.net/poster/20222612/1674788861.jpg,https://javct.net/v/t28-634-rm,160,2026-03-06
798BRV-148-RM,For a naughty married woman... special ejaculation in the vagina without permission 9 [Uncensored L**ked],https://pic.javct.net/poster/01202026/1772640825650.jpg,https://javct.net/v/798brv-148-rm,120,2026-03-06
FC2PPV-4859003,"""Luxurious 7 shots. An office worker with an outstanding style who works for a medical company in Tokyo. Her pussy is drenched while sucking the cock with her tongue. She gets excited and swallows cum, **pyjpx*jsps. Facial cumshot, creampie total 7 shots, meat urinal training, and making sure to make her pussy.",https://pic.javct.net/poster/01202026/1772780005.jpg,https://javct.net/v/fc2ppv-4859003,55,2026-03-06
SKMJ-721-RM,"A Pickup Artist Who Can Stop Time Actually Exists Lol. An Amateur Female College Student Takes On The Time-stopping Challenge! Don't Make A Sound! Don't Move! Don't Feel Anything! If She Can Keep Time Stopped While Holding Back From Climaxing No Matter What Happens, She Gets The Prize! If She Fails, She Gets Immediate, Raw, Creampie Sex! [Uncensored L**ked]",https://pic.javct.net/poster/01202026/1772163239.jpg,https://javct.net/v/skmj-721-rm,209,2026-03-06
MCKT-023-RM,A secret free man life full of body fluids that is stopped by a big breasted gal cosplayer and made into a slut [Uncensored L**ked],https://pic.javct.net/poster/01202026/1772515328674.jpg,https://javct.net/v/mckt-023-rm,88,2026-03-06
546EROFV-364-RM,"""Divorce your wife quickly!"" Office affair, love and sexual desire running out of control [Uncensored L**ked]",https://pic.javct.net/poster/01202026/1772526133677.jpg,https://javct.net/v/546erofv-364-rm,65,2026-03-06
FNS-179-RM,"Every Morning On The Way To School, The Person Whose Crotch Was Groped And Aroused Was... Yayoi Hamabe [Uncensored L**ked]",https://pic.javct.net/poster/01202026/1772644739354.jpg,https://javct.net/v/fns-179-rm,125,2026-03-06
300MIUM-1339-RM,"[Puff Puff Hcup] A smile that only my social slave girlfriend in a suit and me in a loungewear without makeup can show, a female face, an orgasmic face... A night where I feel refreshed with a slimy oil titty fuck, and a morning when I cum inside my big breasted girlfriend who has been in heat since early morning. Secret couple sex video post [half-cohabiting girlfriend] [Uncensored L**ked]",https://pic.javct.net/poster/01202026/1772434232839.jpg,https://javct.net/v/300mium-1339-rm,104,2026-03-06
YMRK-064-RM,"A group of brutal rapists targeting office ladies living alone, fo**ed into their homes and fo**ed into creampie sex Vol.64 Victim M.H [Uncensored L**ked]",https://pic.javct.net/poster/01202026/1772516024557.jpg,https://javct.net/v/ymrk-064-rm,66,2026-03-06
FC2PPV-4857717,"Until today [Face showing/No] This is the last pussy hairy neat black hair JD running towards the dream The real last SEX At the end, a large amount of creampie as each other asks",https://pic.javct.net/poster/01202026/1772780066.jpg,https://javct.net/v/fc2ppv-4857717,41,2026-03-06
MUDR-081-RM,Since That Day .... Nozomi Arimura Uniform Uniformed Out During Bondage Training [Uncensored L**ked],https://pic.javct.net/poster/01202026/1772762126.jpg,https://javct.net/v/mudr-081-rm,120,2026-03-06
LULU-109-RM,Sisterly Love. Made to Continually Sexually Satisfy The Big-Dicked Recluse Brother-In-Law Living in C**ld's Room Instead Of Him Masturbating. Big Tits Sister-In-Law. Amu Ohara. [Uncensored L**ked],https://pic.javct.net/poster/20212011/1638676105.jpg,https://javct.net/v/lulu-109-rm,160,2026-03-06
KOJA-040-RM,"Catch that cheeky annoying electric scooter and make it understand! Yui Hatano is punished with creampie as a matter of course as she cries from the unstoppable Iragantsuki belly-gripping and says, ""Please stop."" [Uncensored L**ked]",https://pic.javct.net/poster/01202026/1772516287343.jpg,https://javct.net/v/koja-040-rm,45,2026-03-06
GVG-673-RM,Stepmother And Offspring Fucking Mio Morishita [Uncensored L**ked],https://pic.javct.net/poster/20221202/1648571219.jpg,https://javct.net/v/gvg-673-rm,120,2026-03-06
413INSTV-695-RM,Daddy activity cancellation area Tall beautiful legged P active girl whose promise was missed and free pussy intense pissing creampie pleasure fall [Uncensored L**ked],https://pic.javct.net/poster/01202026/1772621185331.jpg,https://javct.net/v/413instv-695-rm,65,2026-03-06
MXGS-1316-RM,No One Will Help Me. A Ruthless Creampie R**e Targeted By A Gay Asshole. Maika Nisizumi [Uncensored L**ked],https://pic.javct.net/poster/20231912/1705338797.jpg,https://javct.net/v/mxgs-1316-rm,135,2026-03-06
