code,title,image_url,page_url,views,date_scraped
MDBK-316-RM,Divine Breasts Awahime Titty Fuck & Creampie Unlimited! Soap Covered With Bubbles And Making Fun [Uncensored L**ked],https://pic.javct.net/poster/20231912/1703303930.jpg,https://javct.net/v/mdbk-316-rm,150,2026-02-28
MIST-041-RM,"And ""Please Someone Stop The I When It Is Good.""When You Give To Stop The Girl In Trouble, To Turn ○ ンコ Of Commonplace As To Cum Sex Can Have Yet Dangerous Day .... [Uncensored L**ked]",https://pic.javct.net/poster/01202026/1772243753.jpg,https://javct.net/v/mist-041-rm,210,2026-02-28
FOCS-019-RM,(Complete POV) Horny Girlfriend That Loves Dirty Talk While Squeezing All That Cum Out! This Innocent Looking Girl With A Kansai Accent Secretly Loves To Fuck! Nonstop Creampie With Tons Of Cum Overflowing From Her Pussy. Mikako Horiuchi [Uncensored L**ked],https://pic.javct.net/poster/20212308/1631874959.jpg,https://javct.net/v/focs-019-rm,124,2026-02-28
ADN-767-RM,A Married Female Teacher Who Was Assigned To A Village On The Brink Of Collapse Is Fo**ed To Impregnate The Village Every Day For The Sake Of Its Prosperity. [Uncensored L**ked],https://pic.javct.net/poster/01202026/1772127176.jpg,https://javct.net/v/adn-767-rm,110,2026-02-28
SDHS-065-RM,"One week after the SODSTAR graduation location, she came to the company for the final greeting, and had sex at the studio of memories, Nanao Saizuki [Uncensored L**ked]",https://pic.javct.net/poster/01202026/1772075458230.jpg,https://javct.net/v/sdhs-065-rm,89,2026-02-28
XRW-524-RM,Full Scream!Nonstop!Cum On The Aphrodisiac With 10 Consecutive Blowjobs!Limit Breaking Ver Veri Yoshi Mariana [Uncensored L**ked],https://pic.javct.net/poster/01202026/1772243696.jpg,https://javct.net/v/xrw-524-rm,138,2026-02-28
AKA-067-RM,My Estrus Pet (provisional) File. 002 101 Cm Huge Breasts H Cup Continuous Creampie [Uncensored L**ked],https://pic.javct.net/poster/01202026/1772244328.jpg,https://javct.net/v/aka-067-rm,125,2026-02-28
ADN-764-RM,"""There's No Way She'll Ever Like Me..."" The Day I Ejaculated, Completely Showing My Shame To A Beautiful Woman Who Accepted Me With Complete Affirmation, Even Though I Distrust Women. Shiramine Miu [Uncensored L**ked]",https://pic.javct.net/poster/01202026/1772127300.jpg,https://javct.net/v/adn-764-rm,120,2026-02-28
MOND-262-RM,My Dream Female Boss And Megumi Wakatsuki [Uncensored L**ked],https://pic.javct.net/poster/20231912/1703310765.jpg,https://javct.net/v/mond-262-rm,125,2026-02-28
MIAA-814-RM,My Convenient Sperm Cum Swallowing Creampie Underclassman I Want To Make You Swallow Like You're About To Cry. Hinata Hikage [Uncensored L**ked],https://pic.javct.net/poster/20230104/1681445101.jpg,https://javct.net/v/miaa-814-rm,120,2026-02-28
CAWD-917-RM,"Mayuki Ito 8th Anniversary Debut Fan Appreciation Special Super Feeling Erotic Technique! If You Can Hold It, Raw Sex And Creampie! Continuous Explosive Ejaculations! 30 Shots Of Semen! [Uncensored L**ked]",https://pic.javct.net/poster/01202026/1772126968.jpg,https://javct.net/v/cawd-917-rm,210,2026-02-28
FPRE-217-RM,"I Live Alone And My Sister Is A Sex-challenged Sister Who Hangs Out In My Room, But I've Finally Discovered Her Arousal Nipple Switch That Unleashes Her Sexual Desires! She's Awakened As A Slutty Bitch And Milked Me Of Every Last Drop Of Semen. Himari Kinoshita [Uncensored L**ked]",https://pic.javct.net/poster/01202026/1772126654.jpg,https://javct.net/v/fpre-217-rm,120,2026-02-28
MKON-097-RM,"NTR R**e: I Had A Good Time With My Girlfriend On A School Trip, But I Was Beaten Up By A Brutal DQN Group And Told To ""please Like Her"", Then R**ed And Creampied In Front Of Me. Kazuka Amami [Uncensored L**ked]",https://pic.javct.net/poster/20231912/1703906506.jpg,https://javct.net/v/mkon-097-rm,121,2026-02-28
HZGD-020-RM,Married Otsuki Sound That Her Husband Is Imprisoned In Two Seconds Went Out [Uncensored L**ked],https://pic.javct.net/poster/20222311/1670142357.jpg,https://javct.net/v/hzgd-020-rm,141,2026-02-28
DOA-056-RM,A Big-breasted Girl Is Tied Up. [Uncensored L**ked],https://pic.javct.net/poster/20231912/1703302098.jpg,https://javct.net/v/doa-056-rm,121,2026-02-28
BAB-118-RM,Minimum Younger Sister Type Gal J's After School Positive Sex Kana Yura [Uncensored L**ked],https://pic.javct.net/poster/20231912/1703905565.jpg,https://javct.net/v/bab-118-rm,139,2026-02-28
IBW-578Z-RM,To**ure Sri And Further Out In Paipanro ● Over Data Girl Remains Of Sunburn Mark [Uncensored L**ked],https://pic.javct.net/poster/20242108/1724382263.jpg,https://javct.net/v/ibw-578z-rm,270,2026-02-28
MOOR-007-RM,After Watching The Baseball Game...I Missed The Last Train And Had No Choice But To Stay At A Hot Spring Inn. 10 Semen Home Runs Until Morning SEX Maina Yuri [Uncensored L**ked],https://pic.javct.net/poster/20231912/1703303653.jpg,https://javct.net/v/moor-007-rm,120,2026-02-28
HBAD-620-RM,Masegaki Brother-in-law And Bad Friend Are Both Sexually Treated Brother-in-law-Azusa Tani [Uncensored L**ked],https://pic.javct.net/poster/20221904/1652336226.jpg,https://javct.net/v/hbad-620-rm,120,2026-02-28
BNST-057-RM,Saffle Sumire Is The Woman Who Will Definitely Let You Do It If You Meet Sumire Mizukawa [Uncensored L**ked],https://pic.javct.net/poster/20222410/1667189056.jpg,https://javct.net/v/bnst-057-rm,132,2026-02-28
FJIN-003-RM,"A Genderless Amateur College Student, Rashi Asuka, Who Is Extremely Popular Among The Same Sex, Was Fucked Raw At A Tennis Training Camp Resort, And She Was More Sensitive Than I Imagined And Started To Cum Repeatedly...Rashi Asuka [Uncensored L**ked]",https://pic.javct.net/poster/20231912/1703907379.jpg,https://javct.net/v/fjin-003-rm,150,2026-02-28
APNS-329-RM,In Front Of My Brother... Mami Sakurai [Uncensored L**ked],https://pic.javct.net/poster/20231912/1703302909.jpg,https://javct.net/v/apns-329-rm,112,2026-02-28
APAK-268-RM,"Creampie 149 Cm Masochist Climax ""I'm Cumming! I'm Cumming! It's Hitting My Uterus!"" Lewd Climax Student Guidance Innocent Beautiful Girl's Sweaty All-out Sex! Irama And Riding Are Too Intense! Mai Arisu [Uncensored L**ked]",https://pic.javct.net/poster/20231912/1703303048.jpg,https://javct.net/v/apak-268-rm,135,2026-02-28
ALDN-258-RM,"After All, Being A Single Mother Is The Best... Yurika Hiyama [Uncensored L**ked]",https://pic.javct.net/poster/20231912/1703303247.jpg,https://javct.net/v/aldn-258-rm,105,2026-02-28
