code,title,image_url,page_url,views,date_scraped
SCOP-562,"When I Was Young, I Entered A Bath Together And Had Not Seen It As A Heterosexuality Until Now, When I Entered A Mixed Bathing Hot Spring I Grew Up Unexpectedly On The Body I Grew Up, I Got An Erection In A Gossip - Creampie Intercourse",https://pic.javct.net/poster/04112026/1776057868.jpg,https://javct.net/v/scop-562,95,2026-04-13
VAGU-212-RM,Shiho Kawakami Restraints And Lets Cum So That A Literary Mother Can Not Resist Son's Friend Nasty Dirty Plenty Sex Yu Kawakami [Uncensored L**ked],https://pic.javct.net/poster/04112026/1776011252.jpg,https://javct.net/v/vagu-212-rm,85,2026-04-13
MIST-176,Lady Deliher Specializing In Nipple Caresses Who Was Doing 'nipple Licking Handjob' Gave Me A Lot Of Lust For Grasping The Firmness Of The Gripping Hands And Gave Me A Service That I Gone Too Far And Let Me Vaginal Cum Shot.2,https://pic.javct.net/poster/04112026/1776058147.jpg,https://javct.net/v/mist-176,160,2026-04-13
FC2PPV-4879481,"[Strongest Bijuu] 10 Beautiful body of a slender, fair-skinned esthetician (side job model) I like it when both men and dicks are energetic♡'' Tight manhood that only selected men can enjoy",https://pic.javct.net/poster/04112026/1776049062.jpg,https://javct.net/v/fc2ppv-4879481,80,2026-04-13
SCOP-906-RM,"My Sister Went Out Without Wearing A Bra And Came Home Soaking Wet From A Sudden Downpour! I Was Captivated By Her Erect Nipples Showing Through Her Uniform, And I Relentlessly Tormented Her Nipples Without Regard For Her Soaking Wet State! I Fucked Her Raw And Came Inside Her Pussy, Which Was So Wet I Couldn't Tell If It Was Rain Or Her Own Juices, As She Came Over And Over Again! [Uncensored L**ked]",https://pic.javct.net/poster/06032026/1775848312.jpg,https://javct.net/v/scop-906-rm,135,2026-04-13
FC2PPV-4880076,[Neat] Hairy girl in maid costume ◯ Creampie sex with clerk,https://pic.javct.net/poster/04112026/1776049122.jpg,https://javct.net/v/fc2ppv-4880076,30,2026-04-13
RKI-746-RM,"A Lustful Nymphomaniac Who Devours Submissive Men, A Woman Who Loves Cock More Than Anything Else: Satsuki Mei [Uncensored L**ked]",https://pic.javct.net/poster/06032026/1775764116.jpg,https://javct.net/v/rki-746-rm,120,2026-04-13
HUNBL-147-RM,"``Don't Ever Open Your Eyes.'' ``If You Don't Open Your Eyes, You'll Be Here Forever,'' My Stepfather Told Me The First Time He Fo**ed Me Into Prostitution. [Uncensored L**ked]",https://pic.javct.net/poster/20230908/1696564715.jpg,https://javct.net/v/hunbl-147-rm,160,2026-04-13
AVOP-467-RM,Maternal And C**ld Mating [Yumura Road] Chisato Shokota [Uncensored L**ked],https://pic.javct.net/poster/01202026/1772180465.jpg,https://javct.net/v/avop-467-rm,97,2026-04-13
PKPD-115,Enjo Dating Creampie OK 18 Years Old Infinite Libido MAX Creampie Daughter Ryoka Kurumi,https://pic.javct.net/poster/04112026/1776058000.jpg,https://javct.net/v/pkpd-115,130,2026-04-13
EBOD-461,First Cum Ban Sally,https://pic.javct.net/poster/04112026/1776058278.jpg,https://javct.net/v/ebod-461,120,2026-04-13
MIGD-697-RM,Two Sister Oma ● This Biting Into Open Pies Sato Hina Makimura Airi Because've Been Tempted Me [Uncensored L**ked],https://pic.javct.net/poster/04112026/1776047292.jpg,https://javct.net/v/migd-697-rm,120,2026-04-13
JURA-84-RM,"Mitabi, A 50-year-old Wife On Her First Shoot. Kimiko Yoda [Uncensored L**ked]",https://pic.javct.net/poster/20230908/1696477396.jpg,https://javct.net/v/jura-84-rm,115,2026-04-13
413INSTV-703,"Mahjong Apocalypse: A total bet of 10 million yen, a huge gamble that will either grow or warp. If you lose, you will be immediately fucked and creampied. Shocking 4P serious video l**ked",https://pic.javct.net/poster/04112026/1776045071233.jpg,https://javct.net/v/413instv-703,80,2026-04-13
PKPD-260-RM,"Completely Private Video - First Sleepover Alone With Yuri Kirika, The Industry's #1 Actress With The Best Personality [Uncensored L**ked]",https://pic.javct.net/poster/20230908/1696048303.jpg,https://javct.net/v/pkpd-260-rm,140,2026-04-13
HUNBL-149-RM,Examination Student Restraint Super Slow Piston [Uncensored L**ked],https://pic.javct.net/poster/20230908/1696568358.jpg,https://javct.net/v/hunbl-149-rm,100,2026-04-13
T28-354-RM,The 1st Horny Spend In The Office And OL Legs Stockings [Uncensored L**ked],https://pic.javct.net/poster/01202026/1772366459.jpg,https://javct.net/v/t28-354-rm,240,2026-04-13
TUE-141-RM,Apartment Complex Wife Followed And Fo**ed Into Three-hole Sex Video [Uncensored L**ked],https://pic.javct.net/poster/20230908/1696478569.jpg,https://javct.net/v/tue-141-rm,120,2026-04-13
PKPD-057-RM,Completely Private Video Dosukebe Areola Transformation Sister Tomoko Kawaguchi For The First Time Only Two People Drunken Drunken Hotel Stay [Uncensored L**ked],https://pic.javct.net/poster/04112026/1776046659.jpg,https://javct.net/v/pkpd-057-rm,130,2026-04-13
MIGD-670-RM,Human Body Fixed Anal Slave Suwon Sana [Uncensored L**ked],https://pic.javct.net/poster/20231912/1704235213.jpg,https://javct.net/v/migd-670-rm,120,2026-04-13
APNS-407-RM,Middle-aged Cock Fetishist Schoolgirl Gets Cummed Inside By Neighborhood Uncles While Home Alone - Yuka Chiba [Uncensored L**ked],https://pic.javct.net/poster/06032026/1775867118.jpg,https://javct.net/v/apns-407-rm,121,2026-04-13
BONY-061-RM,"Sakina Mogami, A Compliant Employee Who Takes A Plain And Serious Girl With Glasses As A Nuisance [Uncensored L**ked]",https://pic.javct.net/poster/20230908/1696565374.jpg,https://javct.net/v/bony-061-rm,140,2026-04-13
VENU-167-RM,Ryoko Sawamura Iori Maya Mothers To Be Issued Immersed In Phantom Vaginal Swap Mothers Mother Forbidden [Uncensored L**ked],https://pic.javct.net/poster/04112026/1776011104.jpg,https://javct.net/v/venu-167-rm,95,2026-04-13
FC2PPV-4876823,"A 20-year-old female college student, 20 years old, who is a Gap Moe pure type but is too slutty ⇒ She gets creampied in the open-air bath and spreads her pussy in a yukata (Yumi-ni)",https://pic.javct.net/poster/04112026/1776049144.jpg,https://javct.net/v/fc2ppv-4876823,49,2026-04-13
