code,title,image_url,page_url,views,date_scraped
FNS-199,"Playing Pranks With Classmates In Preparation For The School Festival. The Masochist Switch Is Turned On By The Biting Of The Rope Of The Shackles He Had Tied Up As A Prank.After He Struggles With His Waist And Voice, He Awakens As A Masochist. From That Day On, We Were Addicted To Pretending To Be SM, Keeping It A Secret From Our Classmates...Rin Yoda",https://pic.javct.net/poster/06032026/1773888168943.jpg,https://javct.net/v/fns-199,170,2026-03-19
KSBJ-271-RM,A Secret Meeting On A Dangerous Day: I Got Pregnant With My Brother-in-law's Sperm... Kaho Tamaki [Uncensored L**ked],https://pic.javct.net/poster/20231711/1700278387.jpg,https://javct.net/v/ksbj-271-rm,120,2026-03-19
AVOP-365-RM,"An Elite Corporate High Power Couple Making 20 Million Yen In Salary Vs A Construction Worker DQN Couple Making Only 3 Million Yen In Salary A Short And Uncircumcised Husband With A Slender And Beautiful Wife A DQN Big Cock Husband With Giant Balloon Titties Colossal Tits Dumb Bitch Wife This Is What Happened When They Swapped Partners Trauma NTR ""Let's Decide, Once And For All, Which Husband Is Better"" Shiori Tsukada Sakura Ario [Uncensored L**ked]",https://pic.javct.net/poster/20221904/1652616269.jpg,https://javct.net/v/avop-365-rm,120,2026-03-19
300MIUM-1069,"[Hobbies = Man-hunting, masochist-loving dick fanatic, this is the ultimate] A super erotic slut picks up his girlfriend on top of an SSS-class beauty whose face is so beautiful that his eyes are drawn to her. A forbidden cuckold document. If you are seduced by a beautiful man on your way home, you will think it's a dream, but it's reality lol. A sudden kiss, an unavoidable raw insertion, destroying the girlfriend's idea of ​​chastity, and squeezing the creampie inside her seducing pussy [NTR Reverse]",https://pic.javct.net/poster/06032026/1773898168374.jpg,https://javct.net/v/300mium-1069,118,2026-03-19
NACR-659-RM,"Kanna Misaki, The Editor's Wife Who Was Kept By An Elderly Novelist [Uncensored L**ked]",https://pic.javct.net/poster/20230104/1681958611.jpg,https://javct.net/v/nacr-659-rm,120,2026-03-19
APNS-280-RM,Wild Infidelity Report. Wife Who Kept Refusing To Work Nights And Became The Boss Of A Company Was Getting Sexy Kinky Training Even Before Her Training And Inevitably This Led To Pregnancy. Riona Hirose. [Uncensored L**ked],https://pic.javct.net/poster/20221202/1647730981.jpg,https://javct.net/v/apns-280-rm,130,2026-03-19
MRHP-028-RM,"A Pushy Big-ass Married Woman Who Lives In The Same Apartment Building Can't Resist The Sight Of Her Skin-tight Jeans Seducing Her Without Realizing It, So She Cums All Day Long Ayumi Natsukawa [Uncensored L**ked]",https://pic.javct.net/poster/20231711/1700277704.jpg,https://javct.net/v/mrhp-028-rm,132,2026-03-19
MKON-095-RM,"I Was At The Peak Of Happiness After Having My First Girlfriend, But Then The DQN Who Used To Bully Me Moved In Next Door, Moeka Marui. [Uncensored L**ked]",https://pic.javct.net/poster/20231711/1700277907.jpg,https://javct.net/v/mkon-095-rm,121,2026-03-19
300MIUM-1068,"[Poisonous Fang of Pleasure] A sexy slut reverse-picks up a married man under the guise of a simple interview where reason is stripped away all at once. A forbidden cuckold documentary. A beautiful woman approaches so close that she forgets about home. Her F-cup breasts are pressed against her, and when she is kissed, the shocking video of her preparing for divorce and squirting and creampieing her until she is empty [NTR Reverse]",https://pic.javct.net/poster/06032026/1773898241906.jpg,https://javct.net/v/300mium-1068,119,2026-03-19
300MIUM-1067,"""Which one feels better, my wife's or my pussy..."" Documentary of a forbidden cuckold where a good-looking celebrity married woman reverse picks up a married man [W Affair Special] Face strongest F breasts Slender anal licking Slut Raw sex OK Just inserted, convulsions instantly in cowgirl position Saddle squirting Immoral creampie sex that feels too good [NTR Reverse]",https://pic.javct.net/poster/06032026/1773898313969.jpg,https://javct.net/v/300mium-1067,108,2026-03-19
FC2PPV-4865707,[Blonde masochist] A very cute girl with a deep throat and a hard-on [poor tearful eyes],https://pic.javct.net/poster/06032026/1773895237.jpg,https://javct.net/v/fc2ppv-4865707,62,2026-03-19
FNS-165,"When I Invited My Female Boss, Who Was Unable To Return Home Due To A Typhoon, To My Home... Her Crotch Was Humming! ? Nene Yoshitaka Plays With The Abnormally Sensitive Big Dick That Sticks Out Of Her Too-small Loungewear All Night And Ejaculates 50 Times In A Row Until Morning.",https://pic.javct.net/poster/06032026/1773901863398.jpg,https://javct.net/v/fns-165,115,2026-03-19
FNS-104,"In Order To Increase Her Hourly Wage, The Big-breasted Poster Girl Is Able To Cum With The Old Store Manager's Intense Caresses And Age-defying Voluptuous Penis Sex, And Is Able To Do Both Creampie And Work. Ranran Fujii",https://pic.javct.net/poster/06032026/1773888278810.jpg,https://javct.net/v/fns-104,115,2026-03-19
FC2PPV-4865628,"[Individual video/Handjob train] <Erotic black areola lewd mature woman> When I was on my way to a business trip, I showed my cock to the woman next to me and she gave me a handjob.I was so excited that my panties were soaked with pussy juice, so I took a bath and put my pussy on an anal bed.",https://pic.javct.net/poster/06032026/1773895186.jpg,https://javct.net/v/fc2ppv-4865628,58,2026-03-19
HBAD-650-RM,A Wife's Propensity That Can't Be Said To Her Husband A Young Wife Who Is Tied Up By Her Father-In-Law And Gets Drunk On Pleasure Satomi Mioka [Uncensored L**ked],https://pic.javct.net/poster/20233001/1675913955.jpg,https://javct.net/v/hbad-650-rm,127,2026-03-19
HALT-039-RM,A Girlfriend Who Easily Responds To The Requests Of Her Pervert Boyfriend Who Leans Toward M. [Uncensored L**ked],https://pic.javct.net/poster/20231711/1702701898.jpg,https://javct.net/v/halt-039-rm,139,2026-03-19
FC2PPV-4865938,"[H-cup beautiful huge breasts] A quiet 24-year-old married woman plays with fire without telling her husband ♥ She has a simple face and is penetrated by another man's dick, and her betrayal bristle pussy is dripping wet and creampie ♥",https://pic.javct.net/poster/06032026/1773895513.jpg,https://javct.net/v/fc2ppv-4865938,69,2026-03-19
FC2PPV-4865691,"[First shot] A beautiful fair-skinned office lady releases her pent-up sexual desire along with her naughty liquid, and then finishes with a creampie for the first time in a while, so it's all okay.",https://pic.javct.net/poster/06032026/1773895903.jpg,https://javct.net/v/fc2ppv-4865691,71,2026-03-19
FC2PPV-4863862,"A former weather caster is to**ured with a toy gun for erotic awakening in a violent convulsion 3P, and her rationality collapses due to the most intense piston of her life and a deluge of pleasure.",https://pic.javct.net/poster/06032026/1773895874.jpg,https://javct.net/v/fc2ppv-4863862,63,2026-03-19
ABF-331,"Weekday female teacher, weekend masturbation. Asuna Kawai",https://pic.javct.net/poster/06032026/1773888109425.jpg,https://javct.net/v/abf-331,145,2026-03-19
MOND-260-RM,The Beautiful Neighbor's Wife Is Kyoko Maki [Uncensored L**ked],https://pic.javct.net/poster/20231011/1699756286.jpg,https://javct.net/v/mond-260-rm,140,2026-03-19
FC2PPV-4865755,"[First shoot] Yu-chan, a gravure model with a beautiful E-cup body, is flooded with a demon piston on her fair-skinned reddish body. ""It feels like... I'm going to cum firmly in the pink Picho pussy.",https://pic.javct.net/poster/06032026/1773895959.jpg,https://javct.net/v/fc2ppv-4865755,86,2026-03-19
HODV-21475-RM,Two People Trapped In An Emergency Stop Elevator [Uncensored L**ked],https://pic.javct.net/poster/06032026/1773885396.jpg,https://javct.net/v/hodv-21475-rm,150,2026-03-19
FC2PPV-4865701,"Case #124 where an amateur came to do naughty things with her face showing her face. The case of Suzu-chan (20), a bridal planner with super beautiful breasts who has such a great style.",https://pic.javct.net/poster/06032026/1773895602.jpg,https://javct.net/v/fc2ppv-4865701,55,2026-03-19
