code,title,image_url,page_url,views,date_scraped
MESU-117-RM,Creampie Lifestyle Counseling Where I Am Constantly Being Attacked By A Stiff Female Employee Of A Government Office. Please Call Me Queen. Shiraki Yuko [Uncensored L**ked],https://pic.javct.net/poster/20231011/1698288220.jpg,https://javct.net/v/mesu-117-rm,95,2026-04-03
HUNTB-660-RM,"When I Attended A Cooking Class Full Of Young Wives, I Was The Only Man In The Harem! My Big Dick Is Being Cooked By Extremely Frustrated Young Wives Who Ignore The Practical Training! Husband's... [Uncensored L**ked]",https://pic.javct.net/poster/20231011/1698375812.jpg,https://javct.net/v/huntb-660-rm,150,2026-04-03
ICHK-025-RM,Ichahako! Amateur SSS Style Top Battle Model-class Slender Beauty Yu-chan & Manga-like Big-breasted Beauty Mai-chan [Uncensored L**ked],https://pic.javct.net/poster/20231011/1698291810.jpg,https://javct.net/v/ichk-025-rm,130,2026-04-03
AMBI-131-RM,Devil Father's Sex Toy Remu Suzumori Uniform Beautiful Girl Torn Up With Her Boyfriend [Uncensored L**ked],https://static.javct.net/poster/ambi-131.jpg,https://javct.net/v/ambi-131-rm,110,2026-04-03
AQSH-104-RM,"When I Degraded My Friend's Wife, Who Is Known For Her Sarcasm And Nagging, To A Persistent Pleasure To**ure, She Turned Into A Cock-obsessed Lewd Female Who Couldn't Stop Begging. Minaho Ariga [Uncensored L**ked]",https://pic.javct.net/poster/20231011/1697254321.jpg,https://javct.net/v/aqsh-104-rm,120,2026-04-03
FOCS-242-SUB,"Suddenly Soaked By A Sudden Downpour, The Raw And Voluptuous H-cup Of My Senior Makes Me Lose My Mind And I Get Pounded Hard In This Sex Scene With Yuika Onozaka [English Subtitle]",https://pic.javct.net/poster/20250903/1743101415.jpg,https://javct.net/v/focs-242-sub,120,2026-04-03
PKPD-041-RM,Miura Azuma First Time In A Living Room Staying In Bed Sickness Cum Inside Pleading Speaking Room Pick Up Until Morning Himehime Document Miura Ayaba [Uncensored L**ked],https://pic.javct.net/poster/06032026/1775182051.jpg,https://javct.net/v/pkpd-041-rm,130,2026-04-03
OFKU-217-RM,Plump Mother-in-law Proficient Diary Miori Akimoto [Uncensored L**ked],https://pic.javct.net/poster/20231011/1697777362.jpg,https://javct.net/v/ofku-217-rm,120,2026-04-03
NACR-674-RM,My Girlfriend Is Rino Yuuki [Uncensored L**ked],https://pic.javct.net/poster/20230206/1687262939.jpg,https://javct.net/v/nacr-674-rm,128,2026-04-03
MARA-008-RM,Shiori Tsukada Tits Theater Jcup!101cm [Uncensored L**ked],https://pic.javct.net/poster/06032026/1775182172.jpg,https://javct.net/v/mara-008-rm,120,2026-04-03
FERA-180-RM,"Remi Kawanami, A Mother Who Thought It Would Be Okay To Have Sex Just Once, But Ended Up In A Swamp Because Her Son Kept Making Her Cum. [Uncensored L**ked]",https://pic.javct.net/poster/20231011/1697684640.jpg,https://javct.net/v/fera-180-rm,110,2026-04-03
STAR-924-RM,Kiritani Festival Namaism First Cum Inside Lifting [Uncensored L**ked],https://pic.javct.net/poster/06032026/1775180855.jpg,https://javct.net/v/star-924-rm,165,2026-04-03
ONEX-019-RM,Sex With A Beautiful Girl In Uniform That Drives You Crazy 01 [Uncensored L**ked],https://pic.javct.net/poster/20231011/1698463039.jpg,https://javct.net/v/onex-019-rm,120,2026-04-03
MIGD-482-RM,Arisa Soap Squirting Cum Pretty OK Two Holes [Uncensored L**ked],https://pic.javct.net/poster/06032026/1775181383.jpg,https://javct.net/v/migd-482-rm,190,2026-04-03
MIAA-214-RM,"The Strongest Beauty Gets Fucked By Her Husband's Boss - I Quit Being An Investigator To Become A Wife, But... Mao Kurata [Uncensored L**ked]",https://pic.javct.net/poster/20221202/1646631319.jpg,https://javct.net/v/miaa-214-rm,120,2026-04-03
MIAA-215-RM,Sachiko Tried A Pervert Play That I Could Not Do With Her Because I Could Make A Saffle For The First Time [Uncensored L**ked],https://pic.javct.net/poster/06032026/1775181517.jpg,https://javct.net/v/miaa-215-rm,120,2026-04-03
CPZ69-012,"Mr. Shizukawa, who lives next door, sometimes wants to talk dirty to me.",https://pic.javct.net/poster/06032026/1775176622500.jpg,https://javct.net/v/cpz69-012,136,2026-04-03
IESP-638-RM,Mai Naked Rota Cotton Vaginal Cum Shot Twenty Times [Uncensored L**ked],https://pic.javct.net/poster/06032026/1775180714.jpg,https://javct.net/v/iesp-638-rm,150,2026-04-03
MIDA-580,A Plain-looking Woman With Glasses And Huge Breasts From The Government Office Who Came To Ask For Eviction Is Confined And Brought To Orgasm. Her G-cup Nipples Are Rock Hard And Her Divine Breasts Are Massaged! I Had A Crab-legged Orgasm With The Stubborn Old Man's Insatiable Thrusts. Amamiya Kanan,https://pic.javct.net/poster/06032026/1775160557.jpg,https://javct.net/v/mida-580,130,2026-04-03
420HPT-049-RM,"Yui (26) Amateur Hoi Hoi, Amateur Hoi Hoi Pet, Amateur, Big Breasts, Black Hair, Super Masochist, Obedient, Sensitive, Sex Friend, Jumping, Outdoors, Shame, Toy, Creampie, Gonzo, Documentary [Uncensored L**ked]",https://pic.javct.net/poster/06032026/1775008519959.jpg,https://javct.net/v/420hpt-049-rm,104,2026-04-03
FC2PPV-4862870-RM,"Pervert Cosplay A beautiful woman with a well-shaped face, big ass and pussy hair is brought in for massive squirting sex [4K high quality] [Uncensored L**ked]",https://pic.javct.net/poster/06032026/1773376098.jpg,https://javct.net/v/fc2ppv-4862870-rm,35,2026-04-03
DVEH-082,"Big Tits Clothed Lotion - Clothes And All, Slippery Mucus All Over The Body, Hidden Lewd Female Employee Swamped In Sexual Harassment Overtime Itoi Ruka",https://pic.javct.net/poster/06032026/1775155249.jpg,https://javct.net/v/dveh-082,160,2026-04-03
SVVRT-076,"Amateur variety show: A bikini gal who approached me at Shonan Beach gives me a cooling lotion massage experience to cool down my flushed body! Even though the body temperature is supposed to drop, the [secretly mixed aphrodisiac] awakens the sexual desire! Her sensitive nipples and clitoris are played with, and she squirts her crotch incontinence! I succumb to the pleasure and get huge...6",https://pic.javct.net/poster/06032026/1775160938834.jpg,https://javct.net/v/svvrt-076,210,2026-04-03
NMSL-037,"Tsubaki Hanai, a wife in yoga pants with a super smooth body, who was stolen and r**ed at a convenience store late at night",https://pic.javct.net/poster/06032026/1775161400860.jpg,https://javct.net/v/nmsl-037,134,2026-04-03
