code,title,image_url,page_url,views,date_scraped
FC2PPV-4861874,"*Demon [face exposure] I trained a novice 19-year-old and presented her to Legend Jiro, and confirmed her dark history by thrusting her uterus and creampieing her inside her vagina.",https://pic.javct.net/poster/06032026/1773277822.jpg,https://javct.net/v/fc2ppv-4861874,55,2026-03-12
10-031226-01,Asia Girl's Portrait Collection: Banban,https://pic.javct.net/poster/06032026/1773292671.jpg,https://javct.net/v/10-031226-01,66,2026-03-12
NNPJ-281-RM,Active Female College Student Only! Friendship VS Sexual Desire Male And Female Friends Challenge Closed-room Erotic Extreme Photography Mission! Two People Who Can Not Suppress Muramura Will Do SEX With A Cum Shot! What?Freaky Tension Monitoring! [Uncensored L**ked],https://pic.javct.net/poster/10232025/1764587672.jpg,https://javct.net/v/nnpj-281-rm,160,2026-03-12
DVDMS-196-RM,"General Males And Females Monitoring Affiliate Negotiations With Men And Women Of Social Work Just Before The End Of AV Train!If Married Woman OL Is With Junior Male Employee And Two People At Love Hotel Forgot Her Husband And Will You Make One Ejaculation 100,000 Yen Continuous Ejaculation Sex! What? 2 4 Combination Cum Shot 13 Shots! [Uncensored L**ked]",https://pic.javct.net/poster/06032026/1773280406.jpg,https://javct.net/v/dvdms-196-rm,240,2026-03-12
KTRA-777-RM,Naughty Little Devil Insemination 2 4 Hours [Uncensored L**ked],https://pic.javct.net/poster/06032026/1772851695.jpg,https://javct.net/v/ktra-777-rm,241,2026-03-12
KTKC-068,A Minato City-conscious Girl Who Aims At Only Celebrities With Huge Breasts As A Weapon And Drinks Glamor Glamorous I-cup Erina Kase Erina,https://pic.javct.net/poster/06032026/1773278363.jpg,https://javct.net/v/ktkc-068,125,2026-03-12
T28-641-RM,Panchira Temptation To Provoke Me When My House Is Occupied By A Beautiful Girl In My Class [Uncensored L**ked],https://pic.javct.net/poster/20230205/1685072744.jpg,https://javct.net/v/t28-641-rm,120,2026-03-12
CAWD-741-US,"Licking My Anus, My Father-in-law's Twisted Sexual Education, Yuuhi Shitara [English Subtitle, Reducing Mosaic]",https://pic.javct.net/poster/20240410/1730435924.jpg,https://javct.net/v/cawd-741-us,120,2026-03-12
RKI-613-RM,Super Feel Good Impregnating Sex With The Number One Cum Lover In The World! Mei Satsuki [Uncensored L**ked],https://static.javct.net/poster/rki-613.jpg,https://javct.net/v/rki-613-rm,126,2026-03-12
MIGD-464-RM,FUCK Anal Bukkake! Alice (Alice Suzuki) [Uncensored L**ked],https://pic.javct.net/poster/20242012/1737894296.jpg,https://javct.net/v/migd-464-rm,120,2026-03-12
MAAN-1155-RM,"[This woman will do anything for the sake of work] Sales department ace married life insurance lady is sold by her boss and seizes a large contract with her angry, aroused, and superb G breasts.She goes crazy in a yukata, steamy, unfaithful entertainment www: Case.9_Mr. Akino (28) [Uncensored L**ked]",https://pic.javct.net/poster/06032026/1772962382693.jpg,https://javct.net/v/maan-1155-rm,90,2026-03-12
RKI-611-RM,This Woman Is A Sex Monster Model Physique Porn Video Discovery Of The Ultimate Sexy And Beautiful Amateur Noa [Uncensored L**ked],https://static.javct.net/poster/rki-611.jpg,https://javct.net/v/rki-611-rm,175,2026-03-12
KTRA-586-RM,"When I Showed Off My Erect Penis To My Adolescent Sister, The Atmosphere Got Erotic, So I Asked Her If She Wanted To Have Sex.Misu Takeuchi [Uncensored L**ked]",https://pic.javct.net/poster/20231711/1700882469.jpg,https://javct.net/v/ktra-586-rm,133,2026-03-12
MOGK-003-RM,"A G-cup Peeing Small Fry Pussy Office Lady Is Made Into A Swamp, Impregnated, And Brainwashed Into A Hole Doll [Uncensored L**ked]",https://pic.javct.net/poster/01202026/1772217536.jpg,https://javct.net/v/mogk-003-rm,106,2026-03-12
MKON-096-RM,"When I Let A Cuckold Take Over My Beloved Girlfriend, She Awakened Her Masochistic Attributes And Became Addicted To Hard Fucking That Made Her Squirt And C**ke Her.Uta Hibino [Uncensored L**ked]",https://pic.javct.net/poster/20231711/1701487158.jpg,https://javct.net/v/mkon-096-rm,126,2026-03-12
KTRA-587-RM,Started Working As A Dad. It's Time To Sell... Now Is The Time To Eat Mai Arisu [Uncensored L**ked],https://pic.javct.net/poster/20231711/1700884397.jpg,https://javct.net/v/ktra-587-rm,127,2026-03-12
NACR-651-RM,Customer Satisfaction NO.1! Super Hard To Reservation Colossal Milking Men's Este Chitose Yuuki [Uncensored L**ked],https://pic.javct.net/poster/20230302/1679282244.jpg,https://javct.net/v/nacr-651-rm,126,2026-03-12
JUL-185-US,"A Married Woman Secretary Is Having Sweaty, Kiss-Filled Creampie Sex In The President's Office Nao Jinguji [English Subtitle, Reducing Mosaic]",https://pic.javct.net/poster/20212011/1640274968.jpg,https://javct.net/v/jul-185-us,117,2026-03-12
EMBZ-340-RM,"[Housewife's Naughty Live Experience] True Story! Real Sex Case Files Of Women - Real Documentary Situation #A Busty Mother Who Is Fo**ed To Appear In A Video In Front Of Her Son Who Can't Repay A Huge Debt To A Loan Shark And Despite Her Resistance, Ends Up In An Incestuous Threesome And Raw Creampie R**e! Mikoshiba Mika [Uncensored L**ked]",https://pic.javct.net/poster/01202026/1772385520.jpg,https://javct.net/v/embz-340-rm,130,2026-03-12
FC2PPV-4862115,"207 The cash-strapped beauty washed up at a dark part-time job called FC2 AV, and it was during the second time. ♡ Bonus: Face exposed and uncensored",https://pic.javct.net/poster/06032026/1773277870.jpg,https://javct.net/v/fc2ppv-4862115,71,2026-03-12
STSK-217-RM,Neighbor Gacha Explosion: Hysterical Futon Beating Auntie Keeps Making Noise - Huge Dick Punishment [Uncensored L**ked],https://pic.javct.net/poster/06032026/1772818564.jpg,https://javct.net/v/stsk-217-rm,197,2026-03-12
FC2PPV-4861873,"[First shot] I rented a receptionist at a rental car shop for a day, and she had a divine style. She was delighted with her beautiful ass, and was very excited as she squirted for the first time.",https://pic.javct.net/poster/06032026/1773277845.jpg,https://javct.net/v/fc2ppv-4861873,87,2026-03-12
APGH-053-RM,"""My Dick Feels So Good!"" Dripping With Real Juice And Continuous Orgasms! Delicious With A Smile! Anal Licking Perverted Service After School Beautiful Girl And Love Sex Date Sakuraba Nina [Uncensored L**ked]",https://pic.javct.net/poster/06032026/1773165301.jpg,https://javct.net/v/apgh-053-rm,154,2026-03-12
FC2PPV-4861832,Case #123: An amateur came to do naughty things with her face exposed. Sara-chan (22) was wearing sexy crimson underwear that matched her long black-haired JD.,https://pic.javct.net/poster/06032026/1773278041.jpg,https://javct.net/v/fc2ppv-4861832,50,2026-03-12
