code,title,image_url,page_url,views,date_scraped
SYKH-083-RM,"""Standing Wife"" Class B Milf Mizuki 47 Years Old [Uncensored L**ked]",https://pic.javct.net/poster/20230804/1691816495.jpg,https://javct.net/v/sykh-083-rm,110,2026-05-14
328HMDNV-922-RM,A high-class celebrity married woman who loves horseback riding as a hobby.A bimbo mature woman who toyed with men with the intense cowgirl techniques she trained through horseback riding. [Uncensored L**ked],https://pic.javct.net/poster/04112026/e98c5d3f3e.jpg,https://javct.net/v/328hmdnv-922-rm,80,2026-05-14
SON-124,AV Contract Kazumi Yanagida Out Married In Apo Without Taking Part,https://pic.javct.net/poster/04112026/f1f828ba0a.jpg,https://javct.net/v/son-124,130,2026-05-14
FC2PPV-4899749,[Amateur's first shot/main feature face] Hana (18) This is a different angle video of an amateur who lives in the countryside and anal penetration ATM and electric massager continuous orgasm.,https://pic.javct.net/poster/04112026/f8fccf5298.jpg,https://javct.net/v/fc2ppv-4899749,166,2026-05-14
SON-132,Big De M Secretary Semen Shame Face Collapse To**ure,https://pic.javct.net/poster/04112026/1cb1d0600a.jpg,https://javct.net/v/son-132,140,2026-05-14
SUJI-196-RM,Immorality Doubles Excitement Forbidden Brother And Sister Creampie Incest Shaved Wetting Daughter Alice Mizuki Alice [Uncensored L**ked],https://pic.javct.net/poster/20230804/1691819070.jpg,https://javct.net/v/suji-196-rm,109,2026-05-14
SON-126,Asako Koike Out First AV Big Big College Student Golf Section Princess Unauthorized In,https://pic.javct.net/poster/04112026/f25f5ad95a.jpg,https://javct.net/v/son-126,140,2026-05-14
PA-051426-100,A Horny Mom Who Gets Forcibly Fucked by Her Son's Friend but Can't Help But Enjoy It,https://pic.javct.net/poster/04112026/0f0d04fc49.jpg,https://javct.net/v/pa-051426-100,54,2026-05-14
1P-051426-001,The Professional Sexy Actress's Style: Eri Saeki,https://pic.javct.net/poster/04112026/7009d842af.jpg,https://javct.net/v/1p-051426-001,56,2026-05-14
SUPA-673-RM,"""We Haven't Had Sex Since We Got Married...it's All Built Up."" A Married Woman Overflowing With Sexual Desire Easily Spreads Her Legs And Begs For Cock In Intense Sex That Throws All Reason Out The Window. Amateur Wife's Extreme Slutty Sex BEST [Uncensored L**ked]",https://pic.javct.net/poster/04112026/4c7468bf9e.jpg,https://javct.net/v/supa-673-rm,230,2026-05-14
SON-125,Take Out The First AV Big College Student Faculty Of Letters During Copulation Unauthorized,https://pic.javct.net/poster/04112026/ab7b51cd95.jpg,https://javct.net/v/son-125,140,2026-05-14
IPZZ-525-SUB,"""Let's All Have Sex."" A Slutty Unmarried Woman Gets Horny At A Wedding After-party And Eats All The Men. She Milks All The Sperm! Tsumugi Akari [English Subtitle]",https://pic.javct.net/poster/20250903/1743700032.jpg,https://javct.net/v/ipzz-525-sub,120,2026-05-14
VRNC-084-RM,A Huge Orgy With Beautiful Women With Outstanding Style And A High Sense Of Beauty! Raw Creampie SEX While Wearing Sweaty And Pitchy Lesson Clothes! [Hikaru/Kaho/Rio/Rin] Ver Hikaru & Kaho [Uncensored L**ked],https://pic.javct.net/poster/04112026/7ca5bf21b8.jpg,https://javct.net/v/vrnc-084-rm,84,2026-05-14
SON-121,Transformation Camera Girls SEX Shooting And Recording Of Switch Port ○ Poisoning,https://pic.javct.net/poster/04112026/2ba589d6f6.jpg,https://javct.net/v/son-121,130,2026-05-14
SCOP-911-RM,"Is Incest On The Rise?! Excited By The Sense Of Transgression, Sperm Explodes... 50 Consecutive Cumshots Inside Female Relatives Being Shamelessly Fucked!! [Uncensored L**ked]",https://pic.javct.net/poster/04112026/16e723d219.jpg,https://javct.net/v/scop-911-rm,240,2026-05-14
URKK-075-RM,The Perverted Landlord Next Door Rubs My Tits And Fucks Me Every Day Shion Yumi [Uncensored L**ked],https://pic.javct.net/poster/20233001/1676086625.jpg,https://javct.net/v/urkk-075-rm,140,2026-05-14
SON-140,Big Yoga Instructor Erection Big Nipples Shame Climax Shirakawa Rina,https://pic.javct.net/poster/04112026/0896a8aabc.jpg,https://javct.net/v/son-140,140,2026-05-14
URKK-073-RM,My Boobs Are Rubbed By The Perverted Landlord Next Door And I Get R**ed Every Day Monami Takarada [Uncensored L**ked],https://pic.javct.net/poster/20222612/1673063341.jpg,https://javct.net/v/urkk-073-rm,140,2026-05-14
SON-130,Obscene Lingerie × Pheromone Sexual Intercourse,https://pic.javct.net/poster/04112026/703ba35bec.jpg,https://javct.net/v/son-130,130,2026-05-14
TIKB-167-RM,[Pacopako Video] This Icharab Couple! Too Erotic Www Hikaru Konno [Uncensored L**ked],https://pic.javct.net/poster/20230804/1691816160.jpg,https://javct.net/v/tikb-167-rm,145,2026-05-14
SVVRT-034-RM,"Amateur Variety Recruitment Amateur Young Wife Machine Vibrator Challenge If You Don't Squirt Until The End, 1 Million Yen If You Lose, Creampie SEX Vol 4 [Uncensored L**ked]",https://pic.javct.net/poster/20230804/1691638868.jpg,https://javct.net/v/svvrt-034-rm,162,2026-05-14
ONEZ-089-RM,Newcomer AV Debut Why Does A 20-year-old Female College Student Appear In Adult Videos?Mugi-chan (pseudonym) [Uncensored L**ked],https://pic.javct.net/poster/04112026/024664c7c8.jpg,https://javct.net/v/onez-089-rm,120,2026-05-14
MGNL-164-RM,“My Beloved Husband Is On The Other Side Of The Window! A Rich Tongue-chu Challenge Where A Wife Who Hasn't Been A Married Couple For A Long Time Gradually Becomes More Extreme! ” A Tall Beautiful Mother Of Two Has A Deep Kiss With A Stranger Right Next To Her Husband ☆ A Completely Fallen NTR Copulation That Can't Stop Climaxing After A Long Time Of Raw Paco ♪ [Street Corner Amateur Monitoring # Nao # 32 Years Old] [Uncensored L**ked],https://pic.javct.net/poster/04112026/157ae70796.jpg,https://javct.net/v/mgnl-164-rm,86,2026-05-14
MGNL-162-RM,"""Friends Of A Man And Woman Get Closer In Mind And Body Through Mutual Body Measurements!?'' A Modest And Calm JD Deepens Their Bond By Touching Their Bodies With A Male Friend ☆ Unable To Suppress His Growing Excitement, He Finally Crosses The Line... The Unknown True Face Of A Neat And Clean Girl Is Revealed! Forbidden Raw Creampie ♪ [Street Corner Amateur Monitoring #Karin] [Uncensored L**ked]",https://pic.javct.net/poster/04112026/78d939e2b5.jpg,https://javct.net/v/mgnl-162-rm,97,2026-05-14
