code,title,image_url,page_url,views,date_scraped
EMAZ-321,Bristles Devote Himself To The Company President For The Son-in-law Age Fifty Mother 2 Keiko Hattori,https://pic.javct.net/poster/01202026/1772598667.jpg,https://javct.net/v/emaz-321,138,2026-03-04
FC2PPV-4857995,[Public] Big dick black guy gave a cute and tight Japanese beauty Ai-chan #1 a creampie as a Christmas present,https://pic.javct.net/poster/01202026/1772605352.jpg,https://javct.net/v/fc2ppv-4857995,0,2026-03-04
FC2PPV-4858187,[Shima/i] Two neat people are alternately creampied and fucked in 3PSEX,https://pic.javct.net/poster/01202026/1772605313.jpg,https://javct.net/v/fc2ppv-4858187,55,2026-03-04
FC2PPV-4838002,[4K60P] Dream collaboration between lewd goddess married woman Kaho and lewd angel Hina #03-3P part “Blissful banquet surrounded by two beauties” Part 1,https://pic.javct.net/poster/01202026/1772605471.jpg,https://javct.net/v/fc2ppv-4838002,28,2026-03-04
FC2PPV-4857899,*Workplace protrusion is prohibited [Face showing] An apparel shop worker with a divine body who works at Shibuya 109 gets excited with oil on his jiggling F cup and gets a huge amount of creampie.,https://pic.javct.net/poster/01202026/1772605408.jpg,https://javct.net/v/fc2ppv-4857899,45,2026-03-04
FC2PPV-4857642,"[No] Really lewd ahe face is the best⤴Recently, the sexiness has increased and the coexistence of adultness and cuteness is amazing~ Swallow inside *Bonus High quality",https://pic.javct.net/poster/01202026/1772605115.jpg,https://javct.net/v/fc2ppv-4857642,39,2026-03-04
SAME-156-SUB,"Kaoru Yasui, The Undercover Investigator Who Fell For The Aphrodisiac Molester [English Subtitle]",https://pic.javct.net/poster/20253001/1738295712.jpg,https://javct.net/v/same-156-sub,120,2026-03-04
OPUD-071-RM,Aya Sakuraba Parentheses Evil Bukkake Enema Lesbian SEX W's First Defecation [Uncensored L**ked],https://pic.javct.net/poster/01202026/1772585352.jpg,https://javct.net/v/opud-071-rm,160,2026-03-04
PKPD-081,Completely Private Video F Cup Healing Sister Minami Kurisu And Staying Alone For The First Time Minami Kurisu,https://pic.javct.net/poster/01202026/1772592072.jpg,https://javct.net/v/pkpd-081,140,2026-03-04
MIST-127,"At ""An Old Traditional Titty Pub"" In The Biggest Entertainment District In Japan, New Girls Will Secretly Fuck Their Customers Raw In Order To Steal Them From The Veteran Girls 06",https://pic.javct.net/poster/01202026/1772592191.jpg,https://javct.net/v/mist-127,160,2026-03-04
MIST-050-RM,Husband And Wife Will Cheer Like That Can Be Pregnant!Cheerleader You Willing To Help Out In The Danger Date If You Can Call One Will Ask For It!You Boost The Sex Of Husband And Wife And Me To Moderately Stimulate Such As Jealousy Possessiveness Bound Heart! [Uncensored L**ked],https://pic.javct.net/poster/20241703/1711288584.jpg,https://javct.net/v/mist-050-rm,200,2026-03-04
YMDD-359-RM,Yukemuri Channel [Hot Spring Girls] A Soft-shelled Turtle Service Girl Who Won't Let Go In Her Mouth Sucks All The Juices And Cums Continuously! An Uncut Release Of The Naughty Broadcast Accident During The Yamakuni Onsen Tour! ! Ritsu Nagasawa [Uncensored L**ked],https://pic.javct.net/poster/20231912/1703908050.jpg,https://javct.net/v/ymdd-359-rm,130,2026-03-04
AMBI-099-RM,Black Hair Pure Beauty Girl And Perverted Ojisan's Extracurricular Class Ayuha Ami [Uncensored L**ked],https://pic.javct.net/poster/01202026/1772590324.jpg,https://javct.net/v/ambi-099-rm,130,2026-03-04
NACR-636-RM,Fucked By Her Husband's Subordinate For 3 Days Kyoko Maki [Uncensored L**ked],https://pic.javct.net/poster/20233001/1676867894.jpg,https://javct.net/v/nacr-636-rm,120,2026-03-04
IPX-115-SUB,Dokudokuto Plump Puffin First Cream Candy Yuzu Sunflower [English Subtitle],https://pic.javct.net/poster/12082025/1768372137.jpg,https://javct.net/v/ipx-115-sub,150,2026-03-04
SAN-069-RM,An Unfaithful Wife With A Strangely Long Tongue Who Was Taken Down By Her Brother-in-law Yuno Kisaragi [Uncensored L**ked],https://pic.javct.net/poster/20221108/1661833995.jpg,https://javct.net/v/san-069-rm,125,2026-03-04
MIGD-453-RM,Had To Have Sex In The Ass! Akira Makise [Uncensored L**ked],https://pic.javct.net/poster/01202026/1772590451.jpg,https://javct.net/v/migd-453-rm,120,2026-03-04
LULU-107-RM,"My Big Tits C**ldhood Friend Started Working At A Reverse Bunny Club, So When I Agreed To Help Her Practice Her Work Techniques, She Gave My Prematurely Ejaculating C*ck So Much Nookie, Every Day, That My Balls Went Bone Dry. Misono Mizuhara [Uncensored L**ked]",https://pic.javct.net/poster/20212011/1638596333.jpg,https://javct.net/v/lulu-107-rm,160,2026-03-04
MIAA-094-RM,"Voice K**l And Restraint Pies Les  「"" It Is The End Of Life If Such A Figure Is Seen, ""threatens Freedom And Robs The Silent Demon Squid 渚 [Uncensored L**ked]",https://pic.javct.net/poster/20222311/1670254933.jpg,https://javct.net/v/miaa-094-rm,120,2026-03-04
AMBI-100-RM,Devil's Father's Sex Slaves Gang Bang To**ure Tore A Pure Mind Hikaru Ayatsuki [Uncensored L**ked],https://pic.javct.net/poster/01202026/1772590257.jpg,https://javct.net/v/ambi-100-rm,117,2026-03-04
HZGS-001-RM,Driver's Substitution NTR [Uncensored L**ked],https://pic.javct.net/poster/01202026/1772589310.jpg,https://javct.net/v/hzgs-001-rm,120,2026-03-04
GAS-537-RM,Slippery Big Tits Meat Bullet Creampie Soapland Newcomer K Cup Milk Shop Akane Sana [Uncensored L**ked],https://pic.javct.net/poster/01202026/1772305317.jpg,https://javct.net/v/gas-537-rm,130,2026-03-04
NACR-637-RM,"My Brother-In-Law Grabbed My Weakness, And I Get Fucked Every Day... Kanna Misaki [Uncensored L**ked]",https://pic.javct.net/poster/20233001/1676867831.jpg,https://javct.net/v/nacr-637-rm,120,2026-03-04
MXGS-1310-RM,Sakura Misaki Cuckolded A Drunk Married Woman At A Class Reunion And Creampied Her. [Uncensored L**ked],https://pic.javct.net/poster/20231011/1700105236.jpg,https://javct.net/v/mxgs-1310-rm,130,2026-03-04
