code,title,image_url,page_url,views,date_scraped
300MIUM-1266,"[Newcomer] A new graduate with big breasts and an erotic face. As expected, she is a very erotic and frustrated girl who is in danger of drowning in bed lol. I'm glad I was the only one who took off my suit early.",https://pic.javct.net/poster/04112026/703304f592.jpg,https://javct.net/v/300mium-1266,63,2026-05-03
567BEAF-017-RM,"Aki-chan, a 24-year-old bitch dental hygienist who gets excited about her miserable self and sprees in dating [Uncensored L**ked]",https://pic.javct.net/poster/20221904/1653718611.jpg,https://javct.net/v/567beaf-017-rm,74,2026-05-03
300MIUM-168-RM,"I'll come to your workplace Case.04 Acting as a real estate manager A super beautiful career woman who works as an acting manager at a celebrity real estate that specializes in luxury properties in Aoyama.I couldn't control my frightening sexual desire, which I couldn't tell anyone about, so I visited the workplace of the girl who came for an interview at our company without an appointment, and I went to see her at a very expensive luxury property and did whatever I wanted with her masochistic girlfriend who couldn't refuse lol. [Uncensored L**ked]",https://pic.javct.net/poster/04112026/31507821e6.jpg,https://javct.net/v/300mium-168-rm,74,2026-05-03
300MIUM-196-RM,"I'd like to visit your workplace Case.05 Sales job A serious girl who has only ever had sex with a man she dated had just gotten a blow job in a public restroom near her place of business.Maybe she was hooked by someone else's cock, but she didn't give in to the onslaught of one of the industry's most perverted male actors at a city hotel, and she lost herself and went crazy with joy, enjoying extremely perverted play lol [Uncensored L**ked]",https://pic.javct.net/poster/06032026/1775457585554.jpg,https://javct.net/v/300mium-196-rm,114,2026-05-03
STAR-965-RM,Toda Makoto Maximum Height Difference 30 Cm Or More Maximum Weight Difference 60 Kg Or More Giants Sex With Giant Decachins For 8 Hours From Morning Till Night. [Uncensored L**ked],https://pic.javct.net/poster/20242108/1727206558.jpg,https://javct.net/v/star-965-rm,135,2026-05-03
XVSR-877-RM,"The More You Tease Her Nipples, The More Sensitive They Become And The Wetter They Get! Nipple Training Sex With A Perverted Masochistic Woman - Kitano Mina [Uncensored L**ked]",https://pic.javct.net/poster/04112026/c611d70568.jpg,https://javct.net/v/xvsr-877-rm,110,2026-05-03
CAWD-983-RM,"The Tragic Fate Of Idol-level Cute Schoolgirls In Uniforms, Impregnated By A Middle-aged Man With A Foul Odor In His Neighbor's Garbage-filled Apartment After 73 Uninterrupted Ejaculations Inside Them... [Uncensored L**ked]",https://pic.javct.net/poster/04112026/fe432fe5b5.jpg,https://javct.net/v/cawd-983-rm,120,2026-05-03
HR-012-RM,"[An Anime-loving, Sensitive Blonde Cosplayer From Berlin] El Hanade Meyer (20 Years Old) With Sensitive Nipples Cums Like Crazy, Eyes Rolling Back, Her Erotic Manga Body Going Wild As She Has Sex With A Samurai Penis, Losing Consciousness And Convulsing! [Genuine Cumshot] [Uncensored L**ked]",https://pic.javct.net/poster/04112026/ba71b76422.jpg,https://javct.net/v/hr-012-rm,120,2026-05-03
MOOR-062,"Nonoka, Who Loves Being Filmed While Being Violated",https://pic.javct.net/poster/04112026/521e398538.jpg,https://javct.net/v/moor-062,120,2026-05-03
XVSR-877,"The More You Tease Her Nipples, The More Sensitive They Become And The Wetter They Get! Nipple Training Sex With A Perverted Masochistic Woman - Kitano Mina",https://pic.javct.net/poster/04112026/c611d70568.jpg,https://javct.net/v/xvsr-877,110,2026-05-03
MDHR-002-RM,"Cumming Addict! The Most Insane Masochistic Actress In The Industry Gets Her Mouth, Pussy, And Anus Relentlessly Penetrated In All Three Holes!! Don't You Want To See What Happens When Her Anal Sex Is Unleashed And Feels Amazing?! Tsukino Sui [Uncensored L**ked]",https://pic.javct.net/poster/04112026/433e013ea3.jpg,https://javct.net/v/mdhr-002-rm,150,2026-05-03
ENKI-094-RM,"A Solitary Perverted Woman, A Submissive Masochistic Beauty, Kept As A Pet By Her Master, A Blissfully Happy Human Toilet For Cumming Inside - Ichika [Uncensored L**ked]",https://pic.javct.net/poster/04112026/1044b4eb73.jpg,https://javct.net/v/enki-094-rm,225,2026-05-03
NHDTB-336-RM,"Immediately Irama With A Small Girl Who Lives In The Same Apartment With An Aphrodisiac. As A Result, It Becomes Horny With A Neat Face That Is Covered With Ezuki Soup. 6 [Uncensored L**ked]",https://pic.javct.net/poster/04112026/97e025d3b1.jpg,https://javct.net/v/nhdtb-336-rm,240,2026-05-03
NHDTA-562-RM,"Irama Immediately With B**od  Port That Plaster The Aphrodisiac To A Small Girl Who Lives In The Same Apartment.Result, Nasty Of Breath Face Of Juice (s) That Covered Not Kue Thread Take Motto If Ne.2. [Uncensored L**ked]",https://pic.javct.net/poster/20230302/1679252940.jpg,https://javct.net/v/nhdta-562-rm,230,2026-05-03
SVN-002-RM,Blowjob Girl Pacifier Poisoning Uniform Fertilization Miru Machida [Uncensored L**ked],https://pic.javct.net/poster/20230908/1694315350.jpg,https://javct.net/v/svn-002-rm,122,2026-05-03
TCD-326-RM,My Face Is Ruined By My Beloved Irama! Transgender Idol Oryo Rolls Her Eyes Back At The Sight Of A Huge Cock. [Uncensored L**ked],https://pic.javct.net/poster/04112026/48520e822a.jpg,https://javct.net/v/tcd-326-rm,157,2026-05-03
SIMP-017-RM,mali [Uncensored L**ked],https://pic.javct.net/poster/04112026/1ca8cc9b21.jpg,https://javct.net/v/simp-017-rm,75,2026-05-03
DIC-044-RM,18 Years And 10 Months. 07 Ono Haruka [Uncensored L**ked],https://pic.javct.net/poster/10232025/1761824816.jpg,https://javct.net/v/dic-044-rm,130,2026-05-03
MNTL-006-RM,Fifth Perverted H-cup Chubby Flesh-pot Woman: Mito Ririna [Uncensored L**ked],https://pic.javct.net/poster/04112026/ae088c024a.jpg,https://javct.net/v/mntl-006-rm,122,2026-05-03
CAWD-983,"The Tragic Fate Of Idol-level Cute Schoolgirls In Uniforms, Impregnated By A Middle-aged Man With A Foul Odor In His Neighbor's Garbage-filled Apartment After 73 Uninterrupted Ejaculations Inside Them...",https://pic.javct.net/poster/04112026/fe432fe5b5.jpg,https://javct.net/v/cawd-983,120,2026-05-03
HR-012,"[An Anime-loving, Sensitive Blonde Cosplayer From Berlin] El Hanade Meyer (20 Years Old) With Sensitive Nipples Cums Like Crazy, Eyes Rolling Back, Her Erotic Manga Body Going Wild As She Has Sex With A Samurai Penis, Losing Consciousness And Convulsing! [Genuine Cumshot]",https://pic.javct.net/poster/04112026/ba71b76422.jpg,https://javct.net/v/hr-012,120,2026-05-03
NHDTA-731-RM,"Immediately Irama A Small Ji  Port Yelling Painted Aphrodisiac To Girls Who Live In The Same Apartment.Result, Nasty Reduction In The Thread Draw Kue Not Ki Juice Tainted Breath Face Motto If Ne.5 Pies All SP [Uncensored L**ked]",https://pic.javct.net/poster/20222311/1670118881.jpg,https://javct.net/v/nhdta-731-rm,220,2026-05-03
MDHR-002,"Cumming Addict! The Most Insane Masochistic Actress In The Industry Gets Her Mouth, Pussy, And Anus Relentlessly Penetrated In All Three Holes!! Don't You Want To See What Happens When Her Anal Sex Is Unleashed And Feels Amazing?! Tsukino Sui",https://pic.javct.net/poster/04112026/433e013ea3.jpg,https://javct.net/v/mdhr-002,150,2026-05-03
HUNBL-146-RM,Ryo A King's Game A Cruel Order That Makes Even A Self-Proclaimed Masochist Girl Want To Run Away [Uncensored L**ked],https://pic.javct.net/poster/20230908/1694145460.jpg,https://javct.net/v/hunbl-146-rm,150,2026-05-03
