code,title,image_url,page_url,views,date_scraped
FC2PPV-4897990,"World's first **pyjpx*jsps, successfully photographed 8-year-old girl in high school, 31 weeks pregnant, former idol group member, member of a super-major entertainment agency with many famous celebrities, fully exposed face, 10 days after graduation ceremony, 541st person to be photographed for the first time.",https://pic.javct.net/poster/04112026/dc0b8c1e5a.jpg,https://javct.net/v/fc2ppv-4897990,179,2026-05-10
GVH-844-RM,Mother And Daughter Gang R**e: A Chain Of R**es Where The Mother And Daughter Are Continuously Gang-r**ed And Impregnated Until They Become Sex Slaves. Minase Akari/Aina Miumi [Uncensored L**ked],https://pic.javct.net/poster/04112026/afeaa89a86.jpg,https://javct.net/v/gvh-844-rm,155,2026-05-10
YMRK-068-RM,Creampie r**e of a brutal manager. Victim: Room 502 of a certain apartment in Tokyo. Office lady Asa. [Uncensored L**ked],https://pic.javct.net/poster/04112026/bf0271228e.jpg,https://javct.net/v/ymrk-068-rm,70,2026-05-10
YMRK-069-RM,"Creampie r**e of a brutal manager. Victim: Ten-san, a female college student in room 308 of a certain apartment in Tokyo. [Uncensored L**ked]",https://pic.javct.net/poster/04112026/77515f0f0c.jpg,https://javct.net/v/ymrk-069-rm,74,2026-05-10
DASS-953-RM,"All Those Who Have A Grudge Against This Arrogant Woman, Gather Here! A Super Creepy Guy's Relentless, Brutal To**ure And R**e Will Break Her Down Mentally! A Cum-filled Spittoon Is Born From Sex! Jun Suehiro [Uncensored L**ked]",https://pic.javct.net/poster/04112026/0509bde766.jpg,https://javct.net/v/dass-953-rm,150,2026-05-10
FC2PPV-4897193,"[Amateur's First Shooting] Nana (19) After filming a creampie and anal penetration ATM of a plump and sensitive amateur, I was apparently meeting up with an old male friend for the first time in a few years, so I had a lot of creampie before that.",https://pic.javct.net/poster/04112026/d2710d91b0.jpg,https://javct.net/v/fc2ppv-4897193,143,2026-05-10
FC2PPV-4891741-RM,"Completely showing her face, the newlywed wife has a 21-year-old waist, busty, newlywed wife creampied while her husband is working, deep throating, anal licking, hands and feet fixed, neck ◯◯, bikini ◯◯, nostril licking, gag, individual shooting 540th person [Uncensored L**ked]",https://pic.javct.net/poster/04112026/7c5147b509.jpg,https://javct.net/v/fc2ppv-4891741-rm,238,2026-05-10
FC2PPV-4897340,Video of a secret meeting with a certain influencer with 174 cm E cup pink nipples The match ended with a technical knockout because it was too exciting,https://pic.javct.net/poster/04112026/d1b65d33bb.jpg,https://javct.net/v/fc2ppv-4897340,109,2026-05-10
FC2PPV-4897482,"[Face-showing slender beautiful wife sex video edition] A beautiful wife whose big cock cannot fit into her mouth and is made to suck his cock while drooling, and then it is penetrated into her vagina and played with with creampie",https://pic.javct.net/poster/04112026/f04386f859.jpg,https://javct.net/v/fc2ppv-4897482,80,2026-05-10
YST-302-RM,My Father-in-law Who Married My Beloved Mother Was A Devilish Person. Anka Suzune [Uncensored L**ked],https://pic.javct.net/poster/20230804/1692935751.jpg,https://javct.net/v/yst-302-rm,102,2026-05-10
YSN-606-RM,"I Want To Devour My Little Sister's Body, Anka Suzune [Uncensored L**ked]",https://pic.javct.net/poster/20230804/1692935877.jpg,https://javct.net/v/ysn-606-rm,100,2026-05-10
GFJ-002-RM,Instant Cum-Drinking Fellatio Girl 2: Suzune Mia [Uncensored L**ked],https://pic.javct.net/poster/04112026/32823443a9.jpg,https://javct.net/v/gfj-002-rm,122,2026-05-10
GVH-844,Mother And Daughter Gang R**e: A Chain Of R**es Where The Mother And Daughter Are Continuously Gang-r**ed And Impregnated Until They Become Sex Slaves. Minase Akari/Aina Miumi,https://pic.javct.net/poster/04112026/afeaa89a86.jpg,https://javct.net/v/gvh-844,155,2026-05-10
REAL-989,Oni Ikase Matsui Hinako,https://pic.javct.net/poster/04112026/35c37575bd.jpg,https://javct.net/v/real-989,120,2026-05-10
FC2PPV-4720118-RM,"The popular work has disappeared before I knew it**pyjpx*jsps Resale: 18-year-old Nobo* breasts splashed, '8KVR bonus included', super beautiful short hair, 18-year-old short hair super beautiful swimsuit with breasts splashed, uniform, 18-year-old Nobo* breasts splashed, 18-year-old Nobo* breasts splashed, 18-year-old [Uncensored L**ked]",https://pic.javct.net/poster/20250606/1752148178.jpg,https://javct.net/v/fc2ppv-4720118-rm,202,2026-05-10
YST-301-RM,Rino Yuki [Uncensored L**ked],https://pic.javct.net/poster/20230804/1692935812.jpg,https://javct.net/v/yst-301-rm,101,2026-05-10
HAR-084-RM,"A Neat Married Woman Is Sought After And Immediately From Behind, A Woman Who Stops Thinking Due To Confusion And Pleasure Is Shrimp Warped Back And Vaginal Cum Shot Continuously [Uncensored L**ked]",https://pic.javct.net/poster/20221904/1652340199.jpg,https://javct.net/v/har-084-rm,135,2026-05-10
FC2PPV-4885114-RM,"A crazy H-cup big breasted masochist layer who loves off-paco, ahegao face, stupid voice, hellish [Uncensored L**ked]",https://pic.javct.net/poster/04112026/1776918291.jpg,https://javct.net/v/fc2ppv-4885114-rm,52,2026-05-10
SKMJ-745,"Beautiful Office Ladies From Marunouchi Take Part Lol [No-hands Blowjob Competition With Sperm Dripping From The Mouth (゜Д゜)] ""You Can't Spill The Sperm That's Been Released"" Receive 5 Ejaculations In Your Mouth Within The Time Limit And Complete The Mission Of Continuous Blowjobs To Win 1 Million Yen! Failure Results In An Immediate Cumshot Penalty Game!",https://pic.javct.net/poster/04112026/ac9dac6812.jpg,https://javct.net/v/skmj-745,209,2026-05-10
DASS-953,"All Those Who Have A Grudge Against This Arrogant Woman, Gather Here! A Super Creepy Guy's Relentless, Brutal To**ure And R**e Will Break Her Down Mentally! A Cum-filled Spittoon Is Born From Sex! Jun Suehiro",https://pic.javct.net/poster/04112026/0509bde766.jpg,https://javct.net/v/dass-953,150,2026-05-10
XBS-008-RM,Masochistic Beast Vomit Training 7th Person Ayami Kikugawa [Uncensored L**ked],https://pic.javct.net/poster/20243105/1719111479.jpg,https://javct.net/v/xbs-008-rm,122,2026-05-10
FW-009-RM,She begins her newlywed life with her Yankee father-in-law who is addicted to gambling. The process of a father-in-law turning his serious stepdaughter into a sex slave Mai Arisu [Uncensored L**ked],https://pic.javct.net/poster/04112026/f653e4e093.jpg,https://javct.net/v/fw-009-rm,153,2026-05-10
DAZD-287-RM,"Group Cock To**ure And Orgasm! Violent Piston Action Sends Sanity Flying, Turning Her Into A Crazy, Orgasmic Human Toilet - BEST [Uncensored L**ked]",https://pic.javct.net/poster/04112026/dbe7f483f0.jpg,https://javct.net/v/dazd-287-rm,240,2026-05-10
HODV-21549-RM,"Pleasure Syndrome Case6 ""Baby-faced M Woman Who Keeps Crying Many Times"" Chiharu Miyazawa [Uncensored L**ked]",https://pic.javct.net/poster/20250903/1742747220.jpg,https://javct.net/v/hodv-21549-rm,130,2026-05-10
