code,title,image_url,page_url,views,date_scraped
DIC-038-RM,"""I Really Want To Be An AV Actress"" ""Miracle Of Hokkaido"" Mayu Kurusu AV Debut [Uncensored L**ked]",https://pic.javct.net/poster/20221202/1647975110.jpg,https://javct.net/v/dic-038-rm,180,2026-04-26
REAL-983-RM,"Himizumi Maika, An Underground Idol Who Is Supported By Only One Follower, Gives Tide-worthy Fan Service. [Uncensored L**ked]",https://pic.javct.net/poster/04112026/1777049546.jpg,https://javct.net/v/real-983-rm,120,2026-04-26
REAL-570-RM,Demon Capitalize Hatano Yui [Uncensored L**ked],https://pic.javct.net/poster/06032026/1775800736.jpg,https://javct.net/v/real-570-rm,150,2026-04-26
WANZ-863-RM,Time Stop Stalking X Pu Ban Ban Counterwaste DQN Fan Out In A Runaway Gangbang Bud [Uncensored L**ked],https://pic.javct.net/poster/06032026/1773047225.jpg,https://javct.net/v/wanz-863-rm,150,2026-04-26
MKMP-722-RM,"Make Her Understand The Difference Between Her Upper And Lower Mouths. I'll R**e My Little Sister, Who Doesn't Know My Troubles, By Defecating Her Throat And Vagina. Minazuki Hikaru [Uncensored L**ked]",https://pic.javct.net/poster/04112026/1777049692.jpg,https://javct.net/v/mkmp-722-rm,130,2026-04-26
MISM-433-RM,"The Unknown Throat Ceiling. No Matter How Much You Run, It Will Never Stop: Revised Futaba Emma [Uncensored L**ked]",https://pic.javct.net/poster/04112026/1776971632.jpg,https://javct.net/v/mism-433-rm,120,2026-04-26
XV-794-RM,Akari Asahina In Female Teacher Hunting [Uncensored L**ked],https://pic.javct.net/poster/04112026/92873329de.jpg,https://javct.net/v/xv-794-rm,120,2026-04-26
REAL-982-RM,Betrayal And Pregnancy Date ~A Naive Cafe Employee's Special Day Is Ruthlessly Filled With Cummings And Turned Into A Shit Mixed With Semen~ Yuno Sakura [Uncensored L**ked],https://pic.javct.net/poster/04112026/1777049618.jpg,https://javct.net/v/real-982-rm,125,2026-04-26
ENKI-094,"A Solitary Perverted Woman, A Submissive Masochistic Beauty, Kept As A Pet By Her Master, A Blissfully Happy Human Toilet For Cumming Inside - Ichika",https://pic.javct.net/poster/04112026/1044b4eb73.jpg,https://javct.net/v/enki-094,225,2026-04-26
BHSP-033,"Juice-soaked, Lustful Bodily Fluids, Sporty Girl Squirting, Clothed Sex, Cum Inside, Insemination 3 Ichika Koko",https://pic.javct.net/poster/04112026/f94671243d.jpg,https://javct.net/v/bhsp-033,122,2026-04-26
MNTL-006,Fifth Perverted H-cup Chubby Flesh-pot Woman: Mito Ririna,https://pic.javct.net/poster/04112026/ae088c024a.jpg,https://javct.net/v/mntl-006,122,2026-04-26
TCD-326,My Face Is Ruined By My Beloved Irama! Transgender Idol Oryo Rolls Her Eyes Back At The Sight Of A Huge Cock.,https://pic.javct.net/poster/04112026/48520e822a.jpg,https://javct.net/v/tcd-326,157,2026-04-26
DASS-914-RM,"The Bank Robber, Having Lost All Self-control, Continued To Gang-r**e My Busty Wife, The Envy Of Everyone, All Day Long. Hanae Tsubaki [Uncensored L**ked]",https://pic.javct.net/poster/04112026/1776964758.jpg,https://javct.net/v/dass-914-rm,120,2026-04-26
AGAV-166-RM,"Since The Day I Was Betrayed By The Man I Loved, I've Become Prey To The 'house'. - Minami Fukuhara [Uncensored L**ked]",https://pic.javct.net/poster/04112026/1777057479.jpg,https://javct.net/v/agav-166-rm,108,2026-04-26
300MIUM-1385-RM,"Cheeky gal makes you understand [Biju Bakura 120%] [Assault Bishibashi SEX ] ""You can't make money if you don't work like that lol"" A cocky girl who is looking down on you even though she's cute, starts to talk to you and convinces you not to give in. She immediately gives you a throat punch, but even so, her slutty attitude makes you angry, so when you play with Mako, you're sure to see it in her eyes lol.She makes her unrelenting without mercy, and even though she's pounding her in the press, she's silently convulsing, it's the best lol: case.62 [Uncensored L**ked]",https://pic.javct.net/poster/04112026/1777082389380.jpg,https://javct.net/v/300mium-1385-rm,72,2026-04-26
MISM-437-RM,"Anal, Deep Throat, Pussy: The Most Insane And Luxurious 3-hole Full Course. Screaming, Deepest Anal Training, Pure Bliss. A Heart Leaping With Joy At The Wicked, Vomit-inducing Anal Fuck. Rin, An Ordinary Office Worker With Huge H-cup Breasts Who Works Hard With All Her Might. [Uncensored L**ked]",https://pic.javct.net/poster/04112026/1776971567.jpg,https://javct.net/v/mism-437-rm,150,2026-04-26
MISM-436-RM,Invitation! Ass-fucking Upon Meeting. Impalement Anal Bootcamp - Yuri Adachi [Uncensored L**ked],https://pic.javct.net/poster/04112026/1776967069.jpg,https://javct.net/v/mism-436-rm,210,2026-04-26
300MIUM-1385,"Cheeky gal makes you understand [Biju Bakura 120%] [Assault Bishibashi SEX ] ""You can't make money if you don't work like that lol"" A cocky girl who is looking down on you even though she's cute, starts to talk to you and convinces you not to give in. She immediately gives you a throat punch, but even so, her slutty attitude makes you angry, so when you play with Mako, you're sure to see it in her eyes lol.She makes her unrelenting without mercy, and even though she's pounding her in the press, she's silently convulsing, it's the best lol: case.62",https://pic.javct.net/poster/04112026/1777082389380.jpg,https://javct.net/v/300mium-1385,72,2026-04-26
AVSA-236-RM,To**ure Love Slave Doll Sex Toy Covered With Semen With Continuous Irama Creampie Mio Ichijo [Uncensored L**ked],https://pic.javct.net/poster/20233001/1677294081.jpg,https://javct.net/v/avsa-236-rm,110,2026-04-26
FC2PPV-4886819,"Shino (19) 2nd shooting - Vaginal creampie and anal insertion in a slender country amateur, a different angle video of an ATM and a first-person video",https://pic.javct.net/poster/04112026/9c2042a28f.jpg,https://javct.net/v/fc2ppv-4886819,136,2026-04-26
MAAN-1162-RM,"[G cup sexual desire monster] Erotic cute influencer who can't help but want to be popular. Drooling, stringy, deep throat deep throat, excited, raw sex without rubber, all you can cum inside w. Grab her hair, treat her as a masturbator, and fuck her with intense piston blows [Namahame T☆kTok] [Honopi] [Uncensored L**ked]",https://pic.javct.net/poster/04112026/1776996147404.jpg,https://javct.net/v/maan-1162-rm,98,2026-04-26
406FTHT-140-RM,"[Starting a new series] With the new renewal of Women's Travel Pick-up, Kamikyo-chan discovers a talent who runs wild from the first person who starts Shin [Naniwa's sex beast from Osaka] Creates a limit that is not enough even if it is unsatisfactory No greedy mentality [Frantically beseeching my neck and climaxing over and over again] She cries when her cheeks are slapped [Please put the dick in my pussy, I don't have enough] Darashinai pussy girl incontinence due to merciless throat deep throat [self-throat deep] [Sucks a big dick until the end] Her face turns red and tears flow [Kamikyo-chan 01 @ Akari-chan (21 years old/university student) touches me every time] [Uncensored L**ked]",https://pic.javct.net/poster/20230908/1695637565.jpg,https://javct.net/v/406ftht-140-rm,113,2026-04-26
FC2PPV-4875796-RM,Super popular voice actor and extremely beautiful voice actor **pyjpx*jsps She is getting married to her boyfriend this year.The current beautiful voice actor who is very popular in erotic anime is currently engaged.She has already met her boyfriend's parents and is the 536th person to be shot in NTR's Yatai Hodai. [Uncensored L**ked],https://pic.javct.net/poster/06032026/1775435130.jpg,https://javct.net/v/fc2ppv-4875796-rm,04,2026-04-26
DIC-037-RM,You Are Allowed To Crock Chan AV Debut! ?Crock File.02 [Uncensored L**ked],https://pic.javct.net/poster/04112026/1777078495.jpg,https://javct.net/v/dic-037-rm,130,2026-04-26
