code,title,image_url,page_url,views,date_scraped
HUNBL-143-RM,"""I'll Let You Taste The Pain I've Suffered Until Now..."" Retaliation Big Cock Skewer To The Fucking Girls Who Bully Me! ! ! [Uncensored L**ked]",https://pic.javct.net/poster/20230207/1691121922.jpg,https://javct.net/v/hunbl-143-rm,150,2026-05-21
HUNBL-144-RM,"As Soon As You Open The Door, It's A Super Pizza! Infinite Vaginal Cum Shot Intense Piss Relay That Does Not End No Matter How Many Times It Comes [Uncensored L**ked]",https://pic.javct.net/poster/20230207/1691121862.jpg,https://javct.net/v/hunbl-144-rm,120,2026-05-21
HODV-21573-RM,"19 Years Old, Barely Legal. I Just Want To Be Fucked And Treated Like A Toy - Riko Shinohara [Uncensored L**ked]",https://static.javct.net/poster/hodv-21573.jpg,https://javct.net/v/hodv-21573-rm,134,2026-05-21
BBTU-047-RM,Closed Room Big Boob Training Class Alice Kisaki [Uncensored L**ked],https://pic.javct.net/poster/20222410/1668223235.jpg,https://javct.net/v/bbtu-047-rm,122,2026-05-21
MISM-106-RM,Anal Banning!Two-hole Ban Losing Ban!Full-bodied Bondage Lifting!Enema Lifting!Celebration Of A Candle!Flog Lifting! Ban Urination Lifted! A Hyper Masochist With Sensitivity Abnormality Screaming And Screaming With Anal With To**ure! Snow Takako [Uncensored L**ked],https://pic.javct.net/poster/05192026/4376db5d31.jpg,https://javct.net/v/mism-106-rm,170,2026-05-21
SCR-346-RM,Video Footage Of A **dnapping Crime Targeting A Female Student On Her Way Home From School. [Uncensored L**ked],https://pic.javct.net/poster/04112026/a499b6de66.jpg,https://javct.net/v/scr-346-rm,120,2026-05-21
300MIUM-1024-RM,"A girl like this... Covered in tides A lively-looking girl who (self-proclaimed) asks me to join an event company and says, Are you interested in music concerts? You can earn 1.5 million yen a month just by selling tickets.'' She's confirmed to be an unscrupulous multi-tasker, so she's changing the world. Slender body wrapped in a START dress She has a super sensitive constitution that will drip out serious juices if you play with her inside w While saying I don't feel good..., she releases a lot of female juice from her beautiful pink pussy, with her fingers, with an electric massager, and even with a dick. Jumpy tide ww The climax of the tide festival www: case27 [Uncensored L**ked]",https://pic.javct.net/poster/20241902/1708773680.jpg,https://javct.net/v/300mium-1024-rm,76,2026-05-21
NHDTC-205,Big-breasted Girl's Shameful Train 4: Defile Her Developed Breasts With Perverse Fetishes!,https://pic.javct.net/poster/05192026/23b9393d0f.jpg,https://javct.net/v/nhdtc-205,225,2026-05-21
NHDTC-203,A Music Student Is Blackmailed By A Sleazy Guy And Ends Up Offering Up Her Friend; A Chain Reaction Of Gang R**es In A Girls' Dormitory Using A Submissive Girl.,https://pic.javct.net/poster/05192026/9e8781e000.jpg,https://javct.net/v/nhdtc-203,185,2026-05-21
MILK-291,"A Single Mother Obsessed With Male Hosts, A Submissive, Spoiled Girl. A Deluded Masochistic Woman Who Thinks She's In Control. Yuika Onosaka",https://pic.javct.net/poster/05192026/f6afaa371f.jpg,https://javct.net/v/milk-291,127,2026-05-21
SGA-114,Forbidden Shukutoku Married Woman 2 Sleepless Gangbang Big Tits Married Woman Begins With NTR Maximum Acme,https://pic.javct.net/poster/05192026/da48e9eb38.jpg,https://javct.net/v/sga-114,130,2026-05-21
300MIUM-1147-RM,"[Vaginal labor of a virgin who is active as a dad] He is a pusher and has no experience as a host, and is a landmine beginner who has a nice face and good style. He says that he misses human skin and wants to debut as a dad. At first, he was confused, but his eroticism gradually accelerates. While shaking his proud G cup, he said, ""It might be fun to be a dad.'' ""I can recommend you.'' When I got used to it, I screwed my uncle's physical dick in wwww [creampie] [Uncensored L**ked]",https://pic.javct.net/poster/05192026/da191a76e0.jpg,https://javct.net/v/300mium-1147-rm,101,2026-05-21
HUNBL-141-RM,Devil Conceived Teacher Who Cums Female Students On A School Trip One After Another With A Close Contact Seeding Piston [Uncensored L**ked],https://pic.javct.net/poster/20230207/1691121985.jpg,https://javct.net/v/hunbl-141-rm,140,2026-05-21
300MIUM-1102-RM,"A famous streamer's private sex was l**ked in order to earn 10,000,000 yen in savings, and when I went to the host, Pientama, a big ass who was making money by selling erotica, she let me take a rasson every time. She was surrounded by a large number of uncles, the ""Princess of Lasson,'' and her small-time pussy collapsed helplessly. The beautiful girl Pien, who was covered in slimy oil, was so excited that her uncle was so excited wwwww [Uncensored L**ked]",https://pic.javct.net/poster/05192026/bcbbad40a8.jpg,https://javct.net/v/300mium-1102-rm,99,2026-05-21
XRW-651-RM,Libido Is Too Strong Hentai Semen Wife Cumshot In Naked Cum Shot Cumshot In Other Stick [Uncensored L**ked],https://pic.javct.net/poster/05192026/9d787a0b4e.jpg,https://javct.net/v/xrw-651-rm,165,2026-05-21
MDTM-225-RM,18-year-old AV Debut!Sensitive Compensated Dating Girls ● Raw Sasaki Chicks Has Passed Alive [Uncensored L**ked],https://pic.javct.net/poster/05192026/7fb565bba0.jpg,https://javct.net/v/mdtm-225-rm,130,2026-05-21
IPIT-003,I Want To Be Teased More Violently ... A Lustful Desire! The Pain Is Pleasure! Substandard Transformation M Beautiful Girl AV Debut! Kagami Sara,https://pic.javct.net/poster/05192026/0cb1c7d688.jpg,https://javct.net/v/ipit-003,180,2026-05-21
390JAC-237-RM,"[G breasts x slender miraculous body ""Raw sex is the only way to win.'' She was bullish at first, but she exposed her female face and continued to cum inside this beautiful gal] [Hikari-chan, the 107th gal shibe millionaire] [Uncensored L**ked]",https://pic.javct.net/poster/04112026/804bf86c71.jpg,https://javct.net/v/390jac-237-rm,109,2026-05-21
IPIT-008,Appearance Is Elegant SEX Is A Beast Intracerebral Libido Luxury Beautician AV Debut Aya Shiomi,https://pic.javct.net/poster/04112026/0cec717929.jpg,https://javct.net/v/ipit-008,160,2026-05-21
300MIUM-1081-RM,"[A girl who leads the man to ruin] The beautiful SSR-class girl Pien has been making flags that she doesn't feel anything other than the person she likes (host) and as expected, she cums with the man's dick, and goes on a cum wwww [Weekly Less cover-level erotic body] [Sucking and dangerous duck blowjob] lol If she gets too hooked, she'll be heading straight to ruin lol [Uncensored L**ked]",https://pic.javct.net/poster/20250606/1750668143.jpg,https://javct.net/v/300mium-1081-rm,95,2026-05-21
300MIUM-987-RM,"[Short G-breasted Pien type is treated as a toy] Short stature, big breasted anime type Yunapi is cute as a father for the first time, and the uncle who likes Pien type is especially impressed by the talented host who is very excited and seems to have to pay off the receivables by spending 3 million yen. At first he was confused, but the erotic flower gradually blooms www While swaying her natural soft G cup, she says, ""Do I have to do this...?'' and says, ""It feels good in the back.'' Yunapi has a talent for being a dad, so it's good, isn't it? Special ejaculation with her uncle's physical penis wwww [Creampie] [Uncensored L**ked]",https://pic.javct.net/poster/04112026/2e7dfe49e7.jpg,https://javct.net/v/300mium-987-rm,115,2026-05-21
MILK-180-RM,Licked By A Giant Old Man And Confined Acme Training For 7 Days A Beautiful Girl In Uniform Was Made An Obedient Sex Pet That Accepts Intravaginal Ejaculation At Any Time With A Human Bullet Seeding Press. Riku Ichikawa [Uncensored L**ked],https://pic.javct.net/poster/20230207/1691034328.jpg,https://javct.net/v/milk-180-rm,131,2026-05-21
SCR-346,Video Footage Of A **dnapping Crime Targeting A Female Student On Her Way Home From School.,https://pic.javct.net/poster/04112026/a499b6de66.jpg,https://javct.net/v/scr-346,120,2026-05-21
390JAC-237,"[G breasts x slender miraculous body ""Raw sex is the only way to win.'' She was bullish at first, but she exposed her female face and continued to cum inside this beautiful gal] [Hikari-chan, the 107th gal shibe millionaire]",https://pic.javct.net/poster/04112026/804bf86c71.jpg,https://javct.net/v/390jac-237,109,2026-05-21
