code,title,image_url,page_url,views,date_scraped
MOOR-062,"Nonoka, Who Loves Being Filmed While Being Violated",https://pic.javct.net/poster/04112026/521e398538.jpg,https://javct.net/v/moor-062,120,2026-05-02
XVSR-877,"The More You Tease Her Nipples, The More Sensitive They Become And The Wetter They Get! Nipple Training Sex With A Perverted Masochistic Woman - Kitano Mina",https://pic.javct.net/poster/04112026/c611d70568.jpg,https://javct.net/v/xvsr-877,110,2026-05-02
MDHR-002-RM,"Cumming Addict! The Most Insane Masochistic Actress In The Industry Gets Her Mouth, Pussy, And Anus Relentlessly Penetrated In All Three Holes!! Don't You Want To See What Happens When Her Anal Sex Is Unleashed And Feels Amazing?! Tsukino Sui [Uncensored L**ked]",https://pic.javct.net/poster/04112026/433e013ea3.jpg,https://javct.net/v/mdhr-002-rm,150,2026-05-02
ENKI-094-RM,"A Solitary Perverted Woman, A Submissive Masochistic Beauty, Kept As A Pet By Her Master, A Blissfully Happy Human Toilet For Cumming Inside - Ichika [Uncensored L**ked]",https://pic.javct.net/poster/04112026/1044b4eb73.jpg,https://javct.net/v/enki-094-rm,225,2026-05-02
NHDTB-336-RM,"Immediately Irama With A Small Girl Who Lives In The Same Apartment With An Aphrodisiac. As A Result, It Becomes Horny With A Neat Face That Is Covered With Ezuki Soup. 6 [Uncensored L**ked]",https://pic.javct.net/poster/04112026/97e025d3b1.jpg,https://javct.net/v/nhdtb-336-rm,240,2026-05-02
NHDTA-562-RM,"Irama Immediately With B**od  Port That Plaster The Aphrodisiac To A Small Girl Who Lives In The Same Apartment.Result, Nasty Of Breath Face Of Juice (s) That Covered Not Kue Thread Take Motto If Ne.2. [Uncensored L**ked]",https://pic.javct.net/poster/20230302/1679252940.jpg,https://javct.net/v/nhdta-562-rm,230,2026-05-02
SVN-002-RM,Blowjob Girl Pacifier Poisoning Uniform Fertilization Miru Machida [Uncensored L**ked],https://pic.javct.net/poster/20230908/1694315350.jpg,https://javct.net/v/svn-002-rm,122,2026-05-02
TCD-326-RM,My Face Is Ruined By My Beloved Irama! Transgender Idol Oryo Rolls Her Eyes Back At The Sight Of A Huge Cock. [Uncensored L**ked],https://pic.javct.net/poster/04112026/48520e822a.jpg,https://javct.net/v/tcd-326-rm,157,2026-05-02
SIMP-017-RM,mali [Uncensored L**ked],https://pic.javct.net/poster/04112026/1ca8cc9b21.jpg,https://javct.net/v/simp-017-rm,75,2026-05-02
DIC-044-RM,18 Years And 10 Months. 07 Ono Haruka [Uncensored L**ked],https://pic.javct.net/poster/10232025/1761824816.jpg,https://javct.net/v/dic-044-rm,130,2026-05-02
MNTL-006-RM,Fifth Perverted H-cup Chubby Flesh-pot Woman: Mito Ririna [Uncensored L**ked],https://pic.javct.net/poster/04112026/ae088c024a.jpg,https://javct.net/v/mntl-006-rm,122,2026-05-02
CAWD-983,"The Tragic Fate Of Idol-level Cute Schoolgirls In Uniforms, Impregnated By A Middle-aged Man With A Foul Odor In His Neighbor's Garbage-filled Apartment After 73 Uninterrupted Ejaculations Inside Them...",https://pic.javct.net/poster/04112026/fe432fe5b5.jpg,https://javct.net/v/cawd-983,120,2026-05-02
HR-012,"[An Anime-loving, Sensitive Blonde Cosplayer From Berlin] El Hanade Meyer (20 Years Old) With Sensitive Nipples Cums Like Crazy, Eyes Rolling Back, Her Erotic Manga Body Going Wild As She Has Sex With A Samurai Penis, Losing Consciousness And Convulsing! [Genuine Cumshot]",https://pic.javct.net/poster/04112026/ba71b76422.jpg,https://javct.net/v/hr-012,120,2026-05-02
NHDTA-731-RM,"Immediately Irama A Small Ji  Port Yelling Painted Aphrodisiac To Girls Who Live In The Same Apartment.Result, Nasty Reduction In The Thread Draw Kue Not Ki Juice Tainted Breath Face Motto If Ne.5 Pies All SP [Uncensored L**ked]",https://pic.javct.net/poster/20222311/1670118881.jpg,https://javct.net/v/nhdta-731-rm,220,2026-05-02
MDHR-002,"Cumming Addict! The Most Insane Masochistic Actress In The Industry Gets Her Mouth, Pussy, And Anus Relentlessly Penetrated In All Three Holes!! Don't You Want To See What Happens When Her Anal Sex Is Unleashed And Feels Amazing?! Tsukino Sui",https://pic.javct.net/poster/04112026/433e013ea3.jpg,https://javct.net/v/mdhr-002,150,2026-05-02
HUNBL-146-RM,Ryo A King's Game A Cruel Order That Makes Even A Self-Proclaimed Masochist Girl Want To Run Away [Uncensored L**ked],https://pic.javct.net/poster/20230908/1694145460.jpg,https://javct.net/v/hunbl-146-rm,150,2026-05-02
BHSP-033-RM,"Juice-soaked, Lustful Bodily Fluids, Sporty Girl Squirting, Clothed Sex, Cum Inside, Insemination 3 Ichika Koko [Uncensored L**ked]",https://pic.javct.net/poster/04112026/f94671243d.jpg,https://javct.net/v/bhsp-033-rm,122,2026-05-02
FC2PPV-4890847,"Sumire (18) This was the second shoot for this super cute girl. Even though she should have known what was going to be done to her, she started to cum again, so I gave her an electric massage, put it in her anus, and used a piston machine.",https://pic.javct.net/poster/04112026/0b23e4cec7.jpg,https://javct.net/v/fc2ppv-4890847,120,2026-05-02
MIAE-227,A Female Teacher Who Strikes DQN And Gets Stuck In All Four Anal Sexes Is Convulsant Lespe Shinoda Yu,https://pic.javct.net/poster/04112026/1c6c0a65b6.jpg,https://javct.net/v/miae-227,120,2026-05-02
MIAE-304,My Wife Was Taken Down By A Part-time Worker ... 2 Shinoda Yu,https://pic.javct.net/poster/04112026/85a75b6621.jpg,https://javct.net/v/miae-304,120,2026-05-02
300MIUM-1330-RM,[I'll lend you a super masochistic woman] Her M index is too high for an average man to satisfy her... She's a genuine desireless masochist woman who holds dick in her mouth and convulses until it's time to cum. Hodai uses Hodai M. She's willing to do anything... [Masochist's home Q-bin] [Uncensored L**ked],https://pic.javct.net/poster/04112026/7e725045db.jpg,https://javct.net/v/300mium-1330-rm,115,2026-05-02
300MIUM-1330,[I'll lend you a super masochistic woman] Her M index is too high for an average man to satisfy her... She's a genuine desireless masochist woman who holds dick in her mouth and convulses until it's time to cum. Hodai uses Hodai M. She's willing to do anything... [Masochist's home Q-bin],https://pic.javct.net/poster/04112026/7e725045db.jpg,https://javct.net/v/300mium-1330,115,2026-05-02
MIAD-981,Convulsions Climax Silent Les × Up Help Call In Rough Has Been Been Afraid That Being Labeled Fucked K**led Press The Voice Was School Girls Yuri Asada,https://pic.javct.net/poster/04112026/05ec0ba910.jpg,https://javct.net/v/miad-981,150,2026-05-02
HUBLK-065-RM,"Imprisoned And Devastated, The Muddy Woman's Throat Is Destroyed! A Torrent Of Solid, Muddy Fluid Rises From The Bottom Of Her Stomach! A **dnapped, Vomit-filled, Nauseating R**e. [Uncensored L**ked]",https://pic.javct.net/poster/04112026/8cae2d21e4.jpg,https://javct.net/v/hublk-065-rm,150,2026-05-02
