code,title,image_url,page_url,views,date_scraped
HUNBL-146-RM,Ryo A King's Game A Cruel Order That Makes Even A Self-Proclaimed Masochist Girl Want To Run Away [Uncensored L**ked],https://pic.javct.net/poster/20230908/1694145460.jpg,https://javct.net/v/hunbl-146-rm,150,2026-04-30
BHSP-033-RM,"Juice-soaked, Lustful Bodily Fluids, Sporty Girl Squirting, Clothed Sex, Cum Inside, Insemination 3 Ichika Koko [Uncensored L**ked]",https://pic.javct.net/poster/04112026/f94671243d.jpg,https://javct.net/v/bhsp-033-rm,122,2026-04-30
FC2PPV-4890847,"Sumire (18) This was the second shoot for this super cute girl. Even though she should have known what was going to be done to her, she started to cum again, so I gave her an electric massage, put it in her anus, and used a piston machine.",https://pic.javct.net/poster/04112026/0b23e4cec7.jpg,https://javct.net/v/fc2ppv-4890847,120,2026-04-30
MIAE-227,A Female Teacher Who Strikes DQN And Gets Stuck In All Four Anal Sexes Is Convulsant Lespe Shinoda Yu,https://pic.javct.net/poster/04112026/1c6c0a65b6.jpg,https://javct.net/v/miae-227,120,2026-04-30
MIAE-304,My Wife Was Taken Down By A Part-time Worker ... 2 Shinoda Yu,https://pic.javct.net/poster/04112026/85a75b6621.jpg,https://javct.net/v/miae-304,120,2026-04-30
300MIUM-1330-RM,[I'll lend you a super masochistic woman] Her M index is too high for an average man to satisfy her... She's a genuine desireless masochist woman who holds dick in her mouth and convulses until it's time to cum. Hodai uses Hodai M. She's willing to do anything... [Masochist's home Q-bin] [Uncensored L**ked],https://pic.javct.net/poster/04112026/7e725045db.jpg,https://javct.net/v/300mium-1330-rm,115,2026-04-30
300MIUM-1330,[I'll lend you a super masochistic woman] Her M index is too high for an average man to satisfy her... She's a genuine desireless masochist woman who holds dick in her mouth and convulses until it's time to cum. Hodai uses Hodai M. She's willing to do anything... [Masochist's home Q-bin],https://pic.javct.net/poster/04112026/7e725045db.jpg,https://javct.net/v/300mium-1330,115,2026-04-30
MIAD-981,Convulsions Climax Silent Les × Up Help Call In Rough Has Been Been Afraid That Being Labeled Fucked K**led Press The Voice Was School Girls Yuri Asada,https://pic.javct.net/poster/04112026/05ec0ba910.jpg,https://javct.net/v/miad-981,150,2026-04-30
HUBLK-065-RM,"Imprisoned And Devastated, The Muddy Woman's Throat Is Destroyed! A Torrent Of Solid, Muddy Fluid Rises From The Bottom Of Her Stomach! A **dnapped, Vomit-filled, Nauseating R**e. [Uncensored L**ked]",https://pic.javct.net/poster/04112026/8cae2d21e4.jpg,https://javct.net/v/hublk-065-rm,150,2026-04-30
AGMX-262-RM,"Super Sweet, Baby-like Older Sister Gives A Deep Throat Cumshot With A Pacifier. [Uncensored L**ked]",https://pic.javct.net/poster/04112026/8d7f5e61dd.jpg,https://javct.net/v/agmx-262-rm,94,2026-04-30
SORA-475-RM,"Using The Formula Of ""pi X Radius X Girl"", Find A Solution To The Reiwa Version Of Kaguya-hime, Who Becomes A Homeless C**ld With Debt And Has No Choice But To Live In A Drum Can Kana Yura [Uncensored L**ked]",https://pic.javct.net/poster/20230804/1691816982.jpg,https://javct.net/v/sora-475-rm,123,2026-04-30
390JAC-236-RM,"[A super sensitive girl with perfect visuals who cums all over the place 7 times a week, I'm going to cum continuously on Mako with a shaved pussy]in Odaiba - I can't be satisfied unless I meet a blonde gal with transparent skin 7 days a week and fuck her for two whole days in the past, and her sexual addiction is still evolving...Guilty gal-chan's erotic expression and the blow job that takes her deep inside her mouth feel so good...I fuck a super sensitive bijou gal who can't stop squirting with a lot of creampies [106th gal shibe rich man] Aika-chan] [Uncensored L**ked]",https://pic.javct.net/poster/04112026/381e4415e2.jpg,https://javct.net/v/390jac-236-rm,113,2026-04-30
SDAM-171,A beautiful cafe clerk goes to work and leaves work. Pervert complainer sexually harasses by continuously spraying super thick semen on the face,https://pic.javct.net/poster/04112026/8539483e84.jpg,https://javct.net/v/sdam-171,151,2026-04-30
MISM-440-RM,The Whole World Will Fall In Love With The Depths Of Your Throat. Your First Thrilling Throat-throating Experience. Pure And Innocent Beautiful Girl Irrumatio. Yumi Nijimura [Uncensored L**ked],https://pic.javct.net/poster/04112026/1776971503.jpg,https://javct.net/v/mism-440-rm,210,2026-04-30
SDNM-546,"Haruka Tamai, 34 years old, reunited 3 months after the last photo shoot. She is to**ured to the point of fainting at a local inn and ends up squirting endlessly. The vulgar and lewd ""real me"" [SOD real married woman]",https://pic.javct.net/poster/04112026/d00e2f593f.jpg,https://javct.net/v/sdnm-546,124,2026-04-30
MISM-432-RM,(I'm From The Toilet.) I Drink All 8840ml Of Concentrated Urine From 16 Male Actors. A Woman Who Drinks Urine And Feces Deep In Her Throat. [Uncensored L**ked],https://pic.javct.net/poster/04112026/1776971697.jpg,https://javct.net/v/mism-432-rm,120,2026-04-30
HUBLK-065,"Imprisoned And Devastated, The Muddy Woman's Throat Is Destroyed! A Torrent Of Solid, Muddy Fluid Rises From The Bottom Of Her Stomach! A **dnapped, Vomit-filled, Nauseating R**e.",https://pic.javct.net/poster/04112026/8cae2d21e4.jpg,https://javct.net/v/hublk-065,150,2026-04-30
VDD-204,Female Teacher In... (Threatening Suite Room) Rei Kuroshima,https://pic.javct.net/poster/04112026/25c93dfee9.jpg,https://javct.net/v/vdd-204,131,2026-04-30
AGMX-262,"Super Sweet, Baby-like Older Sister Gives A Deep Throat Cumshot With A Pacifier.",https://pic.javct.net/poster/04112026/8d7f5e61dd.jpg,https://javct.net/v/agmx-262,94,2026-04-30
390JAC-236,"[A super sensitive girl with perfect visuals who cums all over the place 7 times a week, I'm going to cum continuously on Mako with a shaved pussy]in Odaiba - I can't be satisfied unless I meet a blonde gal with transparent skin 7 days a week and fuck her for two whole days in the past, and her sexual addiction is still evolving...Guilty gal-chan's erotic expression and the blow job that takes her deep inside her mouth feel so good...I fuck a super sensitive bijou gal who can't stop squirting with a lot of creampies [106th gal shibe rich man] Aika-chan]",https://pic.javct.net/poster/04112026/381e4415e2.jpg,https://javct.net/v/390jac-236,113,2026-04-30
348NTR-099,"[NTR] Extremely erotic body and extremely Mwww Ah, my boyfriend doesn't know that this guy is a masochist lol",https://pic.javct.net/poster/04112026/cc816d5233.jpg,https://javct.net/v/348ntr-099,66,2026-04-30
348NTR-099-RM,"[NTR] Extremely erotic body and extremely Mwww Ah, my boyfriend doesn't know that this guy is a masochist lol [Uncensored L**ked]",https://pic.javct.net/poster/04112026/cc816d5233.jpg,https://javct.net/v/348ntr-099-rm,66,2026-04-30
FC2PPV-4887468,"19-year-old *breasts scattering**pyjpx*jsps, FC2's best talent, full face, breasts flowing, *splattering, transcendental beauty, divine style, divine breasts, complete first shot individual shooting 539th person",https://pic.javct.net/poster/04112026/48ff9d5f09.jpg,https://javct.net/v/fc2ppv-4887468,247,2026-04-30
FOCS-034-RM,Geki Kawa Uniform Girls ... Black-painted Dreams And Innocence Adults Who Take Advantage Of Dreams ... Absurdly Tattered And Humiliated Aoi Nakashiro [Uncensored L**ked],https://pic.javct.net/poster/04112026/16ba56c8ba.jpg,https://javct.net/v/focs-034-rm,120,2026-04-30
