code,title,image_url,page_url,views,date_scraped
FC2PPV-4890847,"Sumire (18) This was the second shoot for this super cute girl. Even though she should have known what was going to be done to her, she started to cum again, so I gave her an electric massage, put it in her anus, and used a piston machine.",https://pic.javct.net/poster/04112026/0b23e4cec7.jpg,https://javct.net/v/fc2ppv-4890847,120,2026-05-02
HZ-3835,Cheating woman has her exquisite breasts played with by her FWB - Mirina Nozomi,https://pic.javct.net/poster/04112026/7bfc2f2ed1.jpg,https://javct.net/v/hz-3835,62,2026-05-02
ROYD-056-RM,The Dorm Mom's Daughter Was Completely Defenseless When She Came In To Help With The Sex-starved Male Dorm. Airi Momose [Uncensored L**ked],https://static.javct.net/poster/royd-056.jpg,https://javct.net/v/royd-056-rm,141,2026-05-02
HZ-3834,Beauty Collection Vol.118 - Shiho Sakatani,https://pic.javct.net/poster/04112026/c5a5c9361f.jpg,https://javct.net/v/hz-3834,61,2026-05-02
HZ-3833,Pretty Amateur Girl I Picked up on the Street - Karen Hanatani,https://pic.javct.net/poster/04112026/0972add19a.jpg,https://javct.net/v/hz-3833,64,2026-05-02
HZ-3832,Thick Sex With A Sadistic Slut MILF Vol.4 - Ayu Kojima,https://pic.javct.net/poster/04112026/ed4bc0c0eef4.jpg,https://javct.net/v/hz-3832,59,2026-05-02
HZ-3829,Beauty Collection Vol.117 - Meirin,https://pic.javct.net/poster/04112026/1776755601.jpg,https://javct.net/v/hz-3829,59,2026-05-02
HZ-3830,Asi-Hame!! Vol.26 - Zhang,https://pic.javct.net/poster/04112026/1776576140.jpg,https://javct.net/v/hz-3830,61,2026-05-02
HZ-3827,Perverted Maid Turns Into A Nympho With Her Master's Junk - Kaede Takagaki,https://pic.javct.net/poster/04112026/1776487863.jpg,https://javct.net/v/hz-3827,61,2026-05-02
ROYD-031-RM,The Temptation Of A Godly Ass - She Showed Me Her Perfect Peach Booty And I Couldn't Resist Ichika Matsumoto [Uncensored L**ked],https://pic.javct.net/poster/20221904/1651567705.jpg,https://javct.net/v/royd-031-rm,151,2026-05-02
HZ-3825,Beauty Collection Vol.116 - Nako Nagase,https://pic.javct.net/poster/04112026/1776148653.jpg,https://javct.net/v/hz-3825,61,2026-05-02
HZ-3824,Straight To The Hotel! Sex With A Slender Amateur Girl Right After Meeting - Kei Noda,https://pic.javct.net/poster/04112026/1775972858.jpg,https://javct.net/v/hz-3824,50,2026-05-02
HZ-3823,Naughty Prank To The New Employee Vol.2 - Ayana Yamagishi,https://pic.javct.net/poster/04112026/1775895344.jpg,https://javct.net/v/hz-3823,59,2026-05-02
HZ-3845,Beauty Collection Vol.115 - Mai Shirakawa,https://pic.javct.net/poster/06032026/1775540728.jpg,https://javct.net/v/hz-3845,61,2026-05-02
HZ-3816,Thoroughly Fucking My Colleague Who's Actually Quite Promiscuous - Mikako Furuya,https://pic.javct.net/poster/06032026/1775373314.jpg,https://javct.net/v/hz-3816,48,2026-05-02
HZ-3815,Kneading Tits To Bring Her Off - Mai Honda,https://pic.javct.net/poster/06032026/1775282090.jpg,https://javct.net/v/hz-3815,53,2026-05-02
HZ-3813,Beauty Collection Vol.114 - Mirai Minano,https://pic.javct.net/poster/06032026/1774942526.jpg,https://javct.net/v/hz-3813,55,2026-05-02
HZ-3811,Bitch-jo -My Coworker Is An Escort Woman- - Miko Sakura,https://pic.javct.net/poster/06032026/1774672354.jpg,https://javct.net/v/hz-3811,60,2026-05-02
FSDSS-963-SUB,She was seduced by her slutty older brothers and became a sex slave with a sensitive and quick orgasm constitution. Momo Misono [English Subtitle],https://pic.javct.net/poster/20253001/1738991515.jpg,https://javct.net/v/fsdss-963-sub,124,2026-05-02
HZ-3809,Beauty Collection Vol.113 - Yukie Natsuki,https://pic.javct.net/poster/06032026/1774326877.jpg,https://javct.net/v/hz-3809,60,2026-05-02
HZ-3808,Upbeat Sugar Baby Gets Juicy Creampie During Filming Vol.4 - Yuka Okada,https://pic.javct.net/poster/06032026/1774154052.jpg,https://javct.net/v/hz-3808,60,2026-05-02
HZ-3807,Sorry Hon! Watch Me Fuck Him!! - Saki Konno,https://pic.javct.net/poster/06032026/1774067996.jpg,https://javct.net/v/hz-3807,61,2026-05-02
HZ-3806,My Best Friend Cuckolded His Beautiful Big Titted Girlfriend By Me!! - Satomi,https://pic.javct.net/poster/06032026/1773982254.jpg,https://javct.net/v/hz-3806,61,2026-05-02
HZ-3805,Beauty Collection Vol.112 - Shion Mochizuki,https://pic.javct.net/poster/06032026/1773726550.jpg,https://javct.net/v/hz-3805,61,2026-05-02
