code,title,image_url,page_url,views,date_scraped
NACT-121,"A Young Wife, Sunao Kui, Finds Herself In Debt Hell After Her Husband Is Laid Off... She's Offered A ""secret Job For The Neighborhood"" By The Neighborhood Association Chairman To Pay Off Unpaid Membership Fees, And Becomes Addicted To The Pleasures Of The Job.",https://pic.javct.net/poster/04112026/a35facfe0a.jpg,https://javct.net/v/nact-121,124,2026-05-05
HOKS-160-RM,"Blind Spot During The Day, Midday Thug [Uncensored L**ked]",https://pic.javct.net/poster/20230908/1694234673.jpg,https://javct.net/v/hoks-160-rm,80,2026-05-05
XVSR-145-RM,Amateur Uploads. Forbidden Confession Documentary. The Sexual Confessions Of A Beautiful Woman With Big Tits Mami Nagase [Uncensored L**ked],https://pic.javct.net/poster/20220406/1657148988.jpg,https://javct.net/v/xvsr-145-rm,119,2026-05-05
SAN-132-RM,A Married Woman Who Was Completely Fallen By A Stalker Man At A Healthy Store / Makoto Asahi [Uncensored L**ked],https://pic.javct.net/poster/20230205/1685604057.jpg,https://javct.net/v/san-132-rm,120,2026-05-05
NSFS-361-SUB,Cuckold House 11 ~My Wife Turned Into A Sex Doll~ Machi Ikuno [English Subtitle],https://pic.javct.net/poster/20253001/1740160848.jpg,https://javct.net/v/nsfs-361-sub,107,2026-05-05
CETD-019-RM,Fucked By Husband In Front Of The Anal Virgin Bride Loss Of White! ! Challenge To Limit Wearing A White Three Hole Simultaneous Fuck Anal Virgin Lesbian Couples Azusa Nagasawa I Cup 100cm! [Uncensored L**ked],https://pic.javct.net/poster/04112026/c7daf8917d.jpg,https://javct.net/v/cetd-019-rm,156,2026-05-05
GVH-574-RM,Son-in-law Ayano Yukari Aiming For Mother-in-law's Too Obscene Big Tits [Uncensored L**ked],https://pic.javct.net/poster/20230804/1692418947.jpg,https://javct.net/v/gvh-574-rm,125,2026-05-05
MOON-056-RM,The Last Kiss Train: Kissing A Beautiful Woman Over And Over Again In An Empty Train Car. - Yuki Yoshizawa [Uncensored L**ked],https://pic.javct.net/poster/04112026/8338d05537.jpg,https://javct.net/v/moon-056-rm,145,2026-05-05
MOON-056,The Last Kiss Train: Kissing A Beautiful Woman Over And Over Again In An Empty Train Car. - Yuki Yoshizawa,https://pic.javct.net/poster/04112026/8338d05537.jpg,https://javct.net/v/moon-056,145,2026-05-05
SQIS-119,Daughter/Mother/Daughter-in-law/Granddaughter Forbidden Breasts,https://pic.javct.net/poster/04112026/ff296ec38c.jpg,https://javct.net/v/sqis-119,162,2026-05-05
MUDR-170-RM,Ever Since That Day... Beautiful Girl In Uniform Asuka Momose Gets Creampied During Bondage Training [Uncensored L**ked],https://pic.javct.net/poster/20212709/1636800928.jpg,https://javct.net/v/mudr-170-rm,130,2026-05-05
SAN-131-RM,A Busty Wife Who Was Broken By Her Father-In-Law Because She Married A Helpless Man / Amu Ohara [Uncensored L**ked],https://pic.javct.net/poster/20230205/1685604123.jpg,https://javct.net/v/san-131-rm,120,2026-05-05
FAYS-012-RM,A Cute Girl With Animal Ears Purchased From A Slave Trader [Uncensored L**ked],https://pic.javct.net/poster/04112026/6190248921.jpg,https://javct.net/v/fays-012-rm,80,2026-05-05
GVG-770-RM,A Sexy Weather Girl And Naughty Brats. Akari Mitani [Uncensored L**ked],https://pic.javct.net/poster/20212011/1643623940.jpg,https://javct.net/v/gvg-770-rm,137,2026-05-05
MOON-010-RM,2:00 A.M. Tearful Overtime Affair Chiharu Miyazawa [Uncensored L**ked],https://pic.javct.net/poster/20230804/1693711317.jpg,https://javct.net/v/moon-010-rm,132,2026-05-05
SAN-130-RM,"Busty Wife Relieves Her Stress By Having Adultery Sex With Her Father-in-Law, And She Ruins Her Father-In-Law's Life / Hanon Iori [Uncensored L**ked]",https://pic.javct.net/poster/20230205/1685604188.jpg,https://javct.net/v/san-130-rm,120,2026-05-05
HZGD-257-RM,"""Dear, I'm Sorry...""I Was Seeded By My Father-in-law Muriyari On The Dangerous Day Of Pregnancy...Rio Ohara [Uncensored L**ked]",https://pic.javct.net/poster/20230804/1693542275.jpg,https://javct.net/v/hzgd-257-rm,118,2026-05-05
STAR-964-RM,Ms. Sakura Beautiful Wedding Planner To Force The Groom To Forget The Groom During The Wedding [Uncensored L**ked],https://pic.javct.net/poster/04112026/1899bfeea5.jpg,https://javct.net/v/star-964-rm,120,2026-05-05
MUDR-091-RM,Uniform Beautiful Girl Snake Bondage Innocent X Attackers Full Bondage SM Drama Aoi Kuroki [Uncensored L**ked],https://pic.javct.net/poster/04112026/3f61f3311a.jpg,https://javct.net/v/mudr-091-rm,120,2026-05-05
SORA-634-RM,"Personality Manipulation Brainwashing Hypnosis ● A Fertility Expert Manipulates A Married Woman's Desperate Wish To Have A Baby, Impregnating Her Through A Five-stage Process Of Brainwashing - Yuika Onosaka [Uncensored L**ked]",https://pic.javct.net/poster/04112026/a0910904db.jpg,https://javct.net/v/sora-634-rm,136,2026-05-05
NACR-761-RM,"When I Went To A Men's Beauty Salon, I Unexpectedly Found A Female Boss! ? The Position Is Reversed! I Made Her Into A Free Woman! ! Reika Takeda [Uncensored L**ked]",https://pic.javct.net/poster/20241901/1707067428.jpg,https://javct.net/v/nacr-761-rm,126,2026-05-05
KSBJ-428-RM,Runaway Wife's Condition For Staying At My Place Is To Be A Cum Receptacle For Cumming Inside Her - Arioka Miu [Uncensored L**ked],https://pic.javct.net/poster/04112026/b308c42a0c.jpg,https://javct.net/v/ksbj-428-rm,120,2026-05-05
SAME-223-RM,Skewered Rings ● Company Trip [Uncensored L**ked],https://pic.javct.net/poster/04112026/dc4ee3cd77.jpg,https://javct.net/v/same-223-rm,120,2026-05-05
FAYS-012,A Cute Girl With Animal Ears Purchased From A Slave Trader,https://pic.javct.net/poster/04112026/6190248921.jpg,https://javct.net/v/fays-012,80,2026-05-05
