code,title,image_url,page_url,views,date_scraped
NSPS-138-RM,Entertainment Do Not Know The Secret Of Companies That Do Not Lose To Anyone Recession ... [Uncensored L**ked],https://pic.javct.net/poster/20233001/1676573286.jpg,https://javct.net/v/nsps-138-rm,102,2026-05-13
GVG-781-RM,A Man Wants His Mother-In-Law's Obscene Tits. Eri Takigawa [Uncensored L**ked],https://pic.javct.net/poster/20212709/1632995722.jpg,https://javct.net/v/gvg-781-rm,120,2026-05-13
NSFS-208-RM,A Cute Bride's White Body Punished By Her Father-In-Law... 2 Urara Kanon [Uncensored L**ked],https://pic.javct.net/poster/20230804/1691208773.jpg,https://javct.net/v/nsfs-208-rm,126,2026-05-13
GVG-780-RM,I Love Buttocks And I'm Huntsuki Kiritani [Uncensored L**ked],https://pic.javct.net/poster/20222311/1671017079.jpg,https://javct.net/v/gvg-780-rm,125,2026-05-13
SAN-140-RM,A Young Wife Who Is Filmed Sex Videos By A Nouveau Richeer For Money / Yuka Ichii [Uncensored L**ked],https://pic.javct.net/poster/20230206/1687839101.jpg,https://javct.net/v/san-140-rm,120,2026-05-13
NSFS-049-SUB,New Atonement 6: The Wife Who Gave Her Body and Soul to Be Forgiven Mami Nagase [English Subtitle],https://pic.javct.net/poster/20212011/1639198736.jpg,https://javct.net/v/nsfs-049-sub,115,2026-05-13
FUGA-22-RM,A Wife Next Door Who Came Running Away With A Couple Genka - A Wall With A Sense Of Sense Of Tenderness - Cheating Sex On The Other Side - Ayaka Makimura [Uncensored L**ked],https://pic.javct.net/poster/04112026/5f2ecac4b0.jpg,https://javct.net/v/fuga-22-rm,80,2026-05-13
START-552-RM,Affair in the car: Even this old man was attracted to his daughter's c**ldhood friend (19) and ended up dating him! The age difference is 31 years! Hagoromo Tenjin kisses each other with saliva and sweat in the garage at home [Uncensored L**ked],https://pic.javct.net/poster/04112026/1776109108579.jpg,https://javct.net/v/start-552-rm,125,2026-05-13
START-548-RM,"Nurse A (26), a mood maker in the hospital who is liked by everyone, is given a mysterious vitamin supplement prepared by a married doctor Y who is secretly popular at work, and is soaked in sexy sex.Hikari Aozora becomes drooling and addicted to grinding cowgirl position. [Uncensored L**ked]",https://pic.javct.net/poster/04112026/1776108887907.jpg,https://javct.net/v/start-548-rm,133,2026-05-13
START-542-RM,"At work, I was invited out for drinks by my power-harassed female boss who has a very harsh personality, and when I heard her complain, things suddenly changed! A sweet manhera turns the tables and begs for creampie sex many times Rei Kamiki [Uncensored L**ked]",https://pic.javct.net/poster/04112026/1776108961127.jpg,https://javct.net/v/start-542-rm,130,2026-05-13
NSFS-477-RM,Mature Mother 39 ~A Mature Body Exposed To The World~ Mikine Ogura [Uncensored L**ked],https://pic.javct.net/poster/04112026/2c2958aa25.jpg,https://javct.net/v/nsfs-477-rm,106,2026-05-13
NSFS-477,Mature Mother 39 ~A Mature Body Exposed To The World~ Mikine Ogura,https://pic.javct.net/poster/04112026/2c2958aa25.jpg,https://javct.net/v/nsfs-477,106,2026-05-13
NACR-734-RM,"Mako Oda, A Perverted Big-breasted Wife Who Secretly Films Herself Having Sex With Others To Please Her Husband. [Uncensored L**ked]",https://pic.javct.net/poster/20231711/1701712296.jpg,https://javct.net/v/nacr-734-rm,111,2026-05-13
OKSN-290-RM,Let Me Be Your First Woman Erina Takimoto [Uncensored L**ked],https://pic.javct.net/poster/20221202/1645751293.jpg,https://javct.net/v/oksn-290-rm,120,2026-05-13
XVSR-153-RM,"Erotic Novel, Stepmom Is 19-Year-Old Widow, Ecstatic Tears Of Joy, Suzu Harumiya [Uncensored L**ked]",https://pic.javct.net/poster/20220406/1655917797.jpg,https://javct.net/v/xvsr-153-rm,116,2026-05-13
AUKG-650-RM,Big-breasted Mature Beauty Sex Friend Training ~Jealousy-fueled Love-hungry Confinement Lesbian~ [Uncensored L**ked],https://pic.javct.net/poster/04112026/3b49da05d9.jpg,https://javct.net/v/aukg-650-rm,120,2026-05-13
APNS-410-RM,A Schoolgirl Obsessed With Exhibitionism; Her Womb Aches With The Thought Of Having Her Pussy Seen... Fuu Watari [Uncensored L**ked],https://pic.javct.net/poster/04112026/88823bf41b.jpg,https://javct.net/v/apns-410-rm,125,2026-05-13
START-568,"I ended up having a one-night stand with a co-worker I don't like after returning from a drinking party, and the penis that fits deep inside my vagina was so compatible that I had the best orgasm of my life...Even though I didn't like it at all, we had sex instead Hikari Aozora",https://pic.javct.net/poster/04112026/c3cfea3908.jpg,https://javct.net/v/start-568,147,2026-05-13
APNS-131-RM,A Girl In A Uniform Who Is Fascinated By The Desire To Apply For Dew [Uncensored L**ked],https://pic.javct.net/poster/20240807/1722296185.jpg,https://javct.net/v/apns-131-rm,131,2026-05-13
ALDN-194-RM,Even My Mother-in-law Wants To Get Pregnant. Kawakami Yuu [Uncensored L**ked],https://pic.javct.net/poster/20230804/1691206326.jpg,https://javct.net/v/aldn-194-rm,115,2026-05-13
ALDN-195-RM,Female President's Libido Narimiya Iroha [Uncensored L**ked],https://pic.javct.net/poster/20230804/1691206261.jpg,https://javct.net/v/aldn-195-rm,125,2026-05-13
START-258-SUB,"The Nurse Who Has Been Assigned To A Marginal Village Is Hikari Aozora, Who Conveys The C**ld Species Of An Abnormal Libido In The Uterus Every Day. [English Subtitle]",https://pic.javct.net/poster/20253001/1738601997.jpg,https://javct.net/v/start-258-sub,130,2026-05-13
HZGD-065,Night Shift Ward Of Nyous Who Is Exposed To Big Tits Boyfriend Reiko Kobayakawa,https://pic.javct.net/poster/04112026/259a050174.jpg,https://javct.net/v/hzgd-065,120,2026-05-13
SHKD-798,Elite Agent Falling Into A Trap Agency Abe,https://pic.javct.net/poster/04112026/88fd07dbf2.jpg,https://javct.net/v/shkd-798,110,2026-05-13
