code,title,image_url,page_url,views,date_scraped
GVG-785-RM,Stepmother And Offspring Fucking Hitomi Enjoji [Uncensored L**ked],https://pic.javct.net/poster/20212011/1641519705.jpg,https://javct.net/v/gvg-785-rm,131,2026-05-16
GDQN-004-SUB,Bimbo Suspicion Of Gyarumama Uehara Hanakoi [English Subtitle],https://pic.javct.net/poster/20230104/1683023607.jpg,https://javct.net/v/gdqn-004-sub,115,2026-05-16
PES-089-RM,Showa Women's To**ure History 2 Discs [Uncensored L**ked],https://pic.javct.net/poster/20230804/1692936125.jpg,https://javct.net/v/pes-089-rm,190,2026-05-16
PRED-863-RM,"From After School Until The Next Morning, Over And Over Again... I, A Sex-crazed Monster, Became Aroused By Ms. Yuka's Defenseless, Beautiful Buttocks And Went On A Rampage Of Piston-like Thrusting, Ejaculating Inside Her Until Morning. Miyoshi Yuka [Uncensored L**ked]",https://pic.javct.net/poster/04112026/be41ea8ef6.jpg,https://javct.net/v/pred-863-rm,120,2026-05-16
WANZ-853,It Is Crawled By The Disliked Father-in-law At Night ... Arisaka Miyuki,https://pic.javct.net/poster/04112026/42fdc1ebf3.jpg,https://javct.net/v/wanz-853,120,2026-05-16
MFYD-131-RM,Itadakima-sama Yumemi Kanae: A Disgusting Enemy Of Men Sucks All The Sperm And Money Out Of Her. [Uncensored L**ked],https://pic.javct.net/poster/04112026/57e3717b61.jpg,https://javct.net/v/mfyd-131-rm,160,2026-05-16
ADN-231-SUB,Forgive You ... My 3 Ayaka Arai Fucked By My Husband's Old Friend [English Subtitle],https://pic.javct.net/poster/06032026/1775481548.jpg,https://javct.net/v/adn-231-sub,110,2026-05-16
MNGS-054,"""Hey, Stop Looking, It's Embarrassing..."" The Usually Tomboyish Gal Senior At My Part-time Job, Rima, Looked So Cute And Embarrassed In Her Bare-faced, Just-woken-up State... The Contrast Was So Arousing That My Morning Erection Wouldn't Cool Down, And I Spent The Whole Day Having Raw, Unprotected Sex With Her. Arai Rima",https://pic.javct.net/poster/04112026/2dc7d9315d.jpg,https://javct.net/v/mngs-054,150,2026-05-16
MUDR-378,**dnapping And Imprisonment Game ~A Planned Escape Mission~,https://pic.javct.net/poster/04112026/92fb19d7f7.jpg,https://javct.net/v/mudr-378,140,2026-05-16
ALDN-205-RM,Daughter's Husband And Duck Heat Mating Ryoko Iori [Uncensored L**ked],https://pic.javct.net/poster/20230804/1692415162.jpg,https://javct.net/v/aldn-205-rm,105,2026-05-16
HMN-845,"I Might Have Been Able To Cum Inside Her That Day. If I Had Taken That Action At That Time, In That Place, On That Day... I Might Have Been Able To Have Unprotected Sex With That Girl. I Tried To Relive The Experience. - Karin Kitaoka",https://pic.javct.net/poster/04112026/969681c1de.jpg,https://javct.net/v/hmn-845,120,2026-05-16
MIDA-644,"Even Though My Fiancé Was Right Beside Me... During My New Year's Visit Home, My Virile Father-in-law Made Me Cum So Hard With His Aphrodisiac-fueled Fingering While We Were Under The Kotatsu... In The End, I Was So Drenched In My Own Juices That I Couldn't Even Make A Sound Throughout The House. Ayase Maria",https://pic.javct.net/poster/04112026/77fbe84ada.jpg,https://javct.net/v/mida-644,120,2026-05-16
MFYD-131,Itadakima-sama Yumemi Kanae: A Disgusting Enemy Of Men Sucks All The Sperm And Money Out Of Her.,https://pic.javct.net/poster/04112026/57e3717b61.jpg,https://javct.net/v/mfyd-131,160,2026-05-16
PRED-863,"From After School Until The Next Morning, Over And Over Again... I, A Sex-crazed Monster, Became Aroused By Ms. Yuka's Defenseless, Beautiful Buttocks And Went On A Rampage Of Piston-like Thrusting, Ejaculating Inside Her Until Morning. Miyoshi Yuka",https://pic.javct.net/poster/04112026/be41ea8ef6.jpg,https://javct.net/v/pred-863,120,2026-05-16
MDVHJ-041-RM,"""Forgive This MILF..."" Her Step-daughter Has A Husband With A Huge Dick That This MILF Just Can't Get Enough Off. Marika Kobayashi [Uncensored L**ked]",https://pic.javct.net/poster/20212709/1635380135.jpg,https://javct.net/v/mdvhj-041-rm,99,2026-05-16
SONE-626-SUB,"""She's Shy, Timid, And Weak To Pressure"" I Was Attracted To My Girlfriend's Sister, And I Secretly Had Sex With Her. I'm Such A Terrible Person. [English Subtitle]",https://pic.javct.net/poster/20253001/1741285909.jpg,https://javct.net/v/sone-626-sub,120,2026-05-16
STAR-976-RM,Takeda Yume The Boy's Appearance Is Gangbanged And Ballet ... [Uncensored L**ked],https://pic.javct.net/poster/20222109/1665495089.jpg,https://javct.net/v/star-976-rm,125,2026-05-16
NSFS-225-RM,Best To Force A Strong Married Woman [Uncensored L**ked],https://pic.javct.net/poster/20230908/1696656596.jpg,https://javct.net/v/nsfs-225-rm,242,2026-05-16
GVG-783-RM,Forbidden Care Nursing Hanasaki Ian [Uncensored L**ked],https://pic.javct.net/poster/04112026/1153debd09.jpg,https://javct.net/v/gvg-783-rm,120,2026-05-16
ALDN-199-RM,Naked Mother-in-law Miki Yoshii [Uncensored L**ked],https://pic.javct.net/poster/20230804/1691206016.jpg,https://javct.net/v/aldn-199-rm,110,2026-05-16
STARS-534-RM,A sober girl JD who works part-time at a drug store Mr Ogura has no male experience but his sexual desire is Chomoramma class A boyfriend was made for a nerdy girl [Uncensored L**ked],https://pic.javct.net/poster/20221202/1646188473.jpg,https://javct.net/v/stars-534-rm,125,2026-05-16
SAN-141-RM,A Married Woman Who Couldn't Endure Her Husband's Violence And Became A Cripple After Being Toyed With By Her Master [Uncensored L**ked],https://pic.javct.net/poster/20230206/1687839038.jpg,https://javct.net/v/san-141-rm,125,2026-05-16
MOON-006-RM,Cigarette Affair ~ Forbidden Love On The Veranda With A Neighbor's Wife With Cigarettes ~ Hikaru Konno [Uncensored L**ked],https://pic.javct.net/poster/20230804/1691291572.jpg,https://javct.net/v/moon-006-rm,200,2026-05-16
GVG-782-RM,Mom's Real Sex Education Kanako Maeda [Uncensored L**ked],https://pic.javct.net/poster/20212011/1644199528.jpg,https://javct.net/v/gvg-782-rm,120,2026-05-16
