code,title,image_url,page_url,views,date_scraped
APNS-317-RM,"Now, The Circle Of My Beloved Wife Who Has Disappeared Has Been Sent To Me On DVD... Umi Oikawa [Uncensored L**ked]",https://pic.javct.net/poster/20230207/1689996574.jpg,https://javct.net/v/apns-317-rm,108,2026-05-23
NMSL-039-RM,Training diary that dominates a serious black secretary with pleasure Ruka Itoi [Uncensored L**ked],https://pic.javct.net/poster/05192026/bb53e83b2c.jpg,https://javct.net/v/nmsl-039-rm,117,2026-05-23
XRW-663-RM,She Got Fucked By Her Ex boyfriend.. A Young Wife Whose Pussy Is Awakend And Throbs For An Old Boyfriend. Kanna Misaki [Uncensored L**ked],https://pic.javct.net/poster/20222410/1667231325.jpg,https://javct.net/v/xrw-663-rm,120,2026-05-23
SAN-151-RM,A Beautiful Married Woman Who Awakens To Selling Herself To Pay Off The Huge Debts Made By Her Husband / Sarina Momonaga [Uncensored L**ked],https://pic.javct.net/poster/20230207/1690773851.jpg,https://javct.net/v/san-151-rm,125,2026-05-23
SNOS-240-RM,"My Beloved Girlfriend Was A Shared Pussy In The Office, Opening Her Legs To Anyone—my Boss, My Colleagues, My Juniors... But... I Was So Pathetic That I Got An Erection Out Of Frustration. Murakami Yuuka [Uncensored L**ked]",https://pic.javct.net/poster/05192026/9f2dfff2de.jpg,https://javct.net/v/snos-240-rm,120,2026-05-23
NEM-034-RM,Forbidden Sex With The Bride's Mother Chapter Thirty-Three I Like My Stepmom Better Than My Wife... Rieko Hiraoka [Uncensored L**ked],https://pic.javct.net/poster/20212011/1640019335.jpg,https://javct.net/v/nem-034-rm,120,2026-05-23
NSFS-481,Kissing And Being Cheated On...7 My Wife's Lips Were Stolen. Sayuri Hayama,https://pic.javct.net/poster/05192026/4a72e367f4.jpg,https://javct.net/v/nsfs-481,114,2026-05-23
NSFS-480,"New Atonement 23 ~To Be Forgiven, The Wife Offered Her Body~ Sayaka Tomoda",https://pic.javct.net/poster/05192026/a9e27d6db3.jpg,https://javct.net/v/nsfs-480,118,2026-05-23
START-547-RM,A daycare worker at my son's nursery school and his wife had a secret meeting at home while they were returning home and had sex for a week.Mei Miyajima [Uncensored L**ked],https://pic.javct.net/poster/04112026/1776713067692.jpg,https://javct.net/v/start-547-rm,148,2026-05-23
JUR-082-RM,"The Gemstone Wife, Exclusive Chapter 3: Finally, 'Internal Ejaculation' Is Allowed!! After Having Sex With Her Husband To Conceive A C**ld, She Is Always Being Ejaculated Into By Her Father-in-law... [Uncensored L**ked]",https://pic.javct.net/poster/05192026/4b6f99e5ba.jpg,https://javct.net/v/jur-082-rm,140,2026-05-23
ALDN-188-RM,Mio Nozaki At A Neighborhood Association Gathering [Uncensored L**ked],https://pic.javct.net/poster/20230207/1689996954.jpg,https://javct.net/v/aldn-188-rm,130,2026-05-23
GVG-791-RM,Sexy PTA President And Brat Student Council Shiori Misato [Uncensored L**ked],https://pic.javct.net/poster/20221108/1663056384.jpg,https://javct.net/v/gvg-791-rm,130,2026-05-23
SAN-150-RM,"Recently, My Wife Has Been Strange... A Married Woman Who Was Addicted To A Cheating Cock With A Light Feeling Loses Something Important At The Same Time / Hibiki Otsuki [Uncensored L**ked]",https://pic.javct.net/poster/20230207/1690773912.jpg,https://javct.net/v/san-150-rm,130,2026-05-23
FAX-251-RM,Women To Be Utilized In The One-time Boyfriend / Brother / Husband To Take Care Of The Boss Was Being Fucked By Force Confession Of Crime Victims [Uncensored L**ked],https://pic.javct.net/poster/05192026/788e002089.jpg,https://javct.net/v/fax-251-rm,123,2026-05-23
NMSL-039,Training diary that dominates a serious black secretary with pleasure Ruka Itoi,https://pic.javct.net/poster/05192026/bb53e83b2c.jpg,https://javct.net/v/nmsl-039,117,2026-05-23
HODV-22068,"I Called A Call Girl And Ended Up Reuniting With My C**ldhood Sweetheart After 12 Years, And We Had Unprotected Sex Until Morning, With Me Ejaculating Inside Her. - Rei Kuroshima",https://pic.javct.net/poster/05192026/619a1e2e8c.jpg,https://javct.net/v/hodv-22068,128,2026-05-23
JUR-082,"The Gemstone Wife, Exclusive Chapter 3: Finally, 'Internal Ejaculation' Is Allowed!! After Having Sex With Her Husband To Conceive A C**ld, She Is Always Being Ejaculated Into By Her Father-in-law...",https://pic.javct.net/poster/05192026/4b6f99e5ba.jpg,https://javct.net/v/jur-082,140,2026-05-23
SNOS-240,"My Beloved Girlfriend Was A Shared Pussy In The Office, Opening Her Legs To Anyone—my Boss, My Colleagues, My Juniors... But... I Was So Pathetic That I Got An Erection Out Of Frustration. Murakami Yuuka",https://pic.javct.net/poster/05192026/9f2dfff2de.jpg,https://javct.net/v/snos-240,120,2026-05-23
FAX-222-RM,Smuggled Assault R**e [Uncensored L**ked],https://pic.javct.net/poster/05192026/3276b425cf.jpg,https://javct.net/v/fax-222-rm,117,2026-05-23
FAX-219-RM,Housewife Was Attacked In The Footpath Of Rice Farming / Daughter Been **dnapped President / Violence To Break Into The House To The Ends Of The Amorous History Of Sex Crimes Japan Piece Was Wheel To Criminal [Uncensored L**ked],https://pic.javct.net/poster/05192026/5cb7ceb1bf.jpg,https://javct.net/v/fax-219-rm,110,2026-05-23
GVG-790-RM,Scepe Wife Who Provokes In Nobler No Pan Moved To The Neighbor! Ren Mi Clare [Uncensored L**ked],https://pic.javct.net/poster/05192026/3499e120b8.jpg,https://javct.net/v/gvg-790-rm,120,2026-05-23
GVG-789-RM,Sister Crime Diary Momojiri Kanon [Uncensored L**ked],https://pic.javct.net/poster/20241804/1714694320.jpg,https://javct.net/v/gvg-789-rm,130,2026-05-23
STAR-983-RM,Kiritani Festival Cum Inside Out Insult Mother-in-law [Uncensored L**ked],https://pic.javct.net/poster/20230804/1691483552.jpg,https://javct.net/v/star-983-rm,110,2026-05-23
AUKG-651-RM,"Fifty-something Lesbians ~Intimate Caresses Of Voluptuous Bodies, Mature Lesbian Eroticism~ [Uncensored L**ked]",https://pic.javct.net/poster/04112026/ff9e19d599.jpg,https://javct.net/v/aukg-651-rm,120,2026-05-23
