code,title,image_url,page_url,views,date_scraped
ALDN-209-RM,Even My Mother-in-law Wants To Get Pregnant. Kato Tsubaki [Uncensored L**ked],https://pic.javct.net/poster/20230908/1694231360.jpg,https://javct.net/v/aldn-209-rm,120,2026-04-30
MUDR-058-RM,From That Day All The Time .... Bondage Training Costume Played In A Cowgirl Beautiful Girl Aoi Aki [Uncensored L**ked],https://pic.javct.net/poster/04112026/001005eecd.jpg,https://javct.net/v/mudr-058-rm,120,2026-04-30
MUDR-053-RM,For Him Who Loves You ... Dedicate Anal With A Smile Squirting Sensitive Girl Two Cum Cum Cum Inside Shin Kotani Minori [Uncensored L**ked],https://pic.javct.net/poster/04112026/127015c6b8.jpg,https://javct.net/v/mudr-053-rm,120,2026-04-30
SAN-124-RM,My Next-door Neighbor Is My Ex-husband! ? A Muchimuchi Perverted Wife Who Repeats Adultery Sex For Her Husband Who Wants To Cuckold / Junna Uemura [Uncensored L**ked],https://pic.javct.net/poster/20230104/1682826681.jpg,https://javct.net/v/san-124-rm,120,2026-04-30
SAN-123-RM,A Bristly Wife Who Is Ruled By Fear Even Though She Hides Her Sinful Husband's Best Friend / Seika Harunagi [Uncensored L**ked],https://pic.javct.net/poster/20230104/1682826744.jpg,https://javct.net/v/san-123-rm,120,2026-04-30
MOON-011-RM,Drink All The Facial Semen. Tenma Yui [Uncensored L**ked],https://pic.javct.net/poster/20230908/1694922526.jpg,https://javct.net/v/moon-011-rm,154,2026-04-30
NSFS-469-RM,Mature Mother 38 ~A Ripe Body Driven Wild By Her Son's Huge Penis~ Megumi Suzukawa [Uncensored L**ked],https://pic.javct.net/poster/04112026/68623b1ce5.jpg,https://javct.net/v/nsfs-469-rm,91,2026-04-30
NSFS-360-SUB,"The Confession 20: A Wife Goes Crazy For The Man Who R**ed Her, Emi Nishino [English Subtitle]",https://pic.javct.net/poster/20253001/1740160921.jpg,https://javct.net/v/nsfs-360-sub,118,2026-04-30
NSFS-052-SUB,The Wife Who Was Creampied By Her Husband's Colleague [English Subtitle],https://pic.javct.net/poster/20212011/1640413569.jpg,https://javct.net/v/nsfs-052-sub,123,2026-04-30
STARS-220-RM,A Young Face Literary Girl Is A Gentle Slut Who Is A Middle-aged Professor Who Is More Than 30 Years Old Nagano Ichika [Uncensored L**ked],https://pic.javct.net/poster/20222311/1670861110.jpg,https://javct.net/v/stars-220-rm,135,2026-04-30
HODV-21524-RM,I Was Taken Down By Her Best Friend And Became A Captive Of The Convulsive Saddle Tide Meiko Ma Ko ... Reika Hashimoto [Uncensored L**ked],https://pic.javct.net/poster/04112026/1178969cac.jpg,https://javct.net/v/hodv-21524-rm,140,2026-04-30
MIAA-280-RM,Until Her Morning With Her Sister Who Became A Refugee Coming Home Due To Sudden Heavy Rain... Urara Hanane [Uncensored L**ked],https://pic.javct.net/poster/20253001/1740409875.jpg,https://javct.net/v/miaa-280-rm,120,2026-04-30
MDVHJ-089-RM,Mothers-in-law Who Are Captivated By Unfaithful Intercourse With Their Husband's Stepc**ld's Big Cock... (4) [Uncensored L**ked],https://pic.javct.net/poster/20230908/1695787016.jpg,https://javct.net/v/mdvhj-089-rm,180,2026-04-30
KSBJ-263-RM,"I Was R**ed By My Brother-In-Law, And The Whole Story Was Filmed On Video... Sumire Kurokawa [Uncensored L**ked]",https://pic.javct.net/poster/20230908/1694836620.jpg,https://javct.net/v/ksbj-263-rm,120,2026-04-30
T38-061-RM,A Hospitalized Son Becomes Aroused By His Mother Who Comes To Visit Him. [Uncensored L**ked],https://pic.javct.net/poster/04112026/12d4fe2853.jpg,https://javct.net/v/t38-061-rm,120,2026-04-30
SONE-647-SUB,I Couldn't Resist The Publicly Indecent K-cup Secretary And Started Molesting Her... She Became More Addicted To My Techniques Than Her Boyfriend. Momoka Kagura [English Subtitle],https://pic.javct.net/poster/20253001/1740075593.jpg,https://javct.net/v/sone-647-sub,150,2026-04-30
APNS-321-RM,Daughter Training 30 Days Of Hell Until Pregnancy Himari Otsuki [Uncensored L**ked],https://pic.javct.net/poster/20230908/1694230929.jpg,https://javct.net/v/apns-321-rm,127,2026-04-30
MIAA-306-RM,"Just 3 Minutes Away From My Boyfriend, In The Unstoppable Rain, Guess I Was Taken Away By His Ex-boyfriend And His Yukata Was Peeled Off And Continued To Be Vaginal Cum Shot Summer Rain Festival NTR Matsumoto Ichika [Uncensored L**ked]",https://pic.javct.net/poster/20241115/1733263281.jpg,https://javct.net/v/miaa-306-rm,120,2026-04-30
DJE-046-RM,Like White Tail Soup Tin Ichinose My Semen [Uncensored L**ked],https://pic.javct.net/poster/20222311/1671428177.jpg,https://javct.net/v/dje-046-rm,130,2026-04-30
SGM-042-RM,Outdoors ● Psychopathic Strength In The Remote Mountains ● Married Women Who Were Attacked By Demons And Cried In Vain And Covered In Mud ● [Uncensored L**ked],https://pic.javct.net/poster/04112026/1b228793d0.jpg,https://javct.net/v/sgm-042-rm,120,2026-04-30
NXG-445-RM,Superb Mature Woman Ayane Asakura Obscene And Glamorous Nasty Wife [Uncensored L**ked],https://pic.javct.net/poster/20230908/1695182709.jpg,https://javct.net/v/nxg-445-rm,120,2026-04-30
NSFS-362-SUB,My Wife Became A Nude Model In Front Of My Boss. 14 Shiori Tokunaga [English Subtitle],https://pic.javct.net/poster/20253001/1740160778.jpg,https://javct.net/v/nsfs-362-sub,138,2026-04-30
SAN-449-RM,A Miraculous Experience! I Woke Up One Morning To Find Myself Transformed Into A Cute Girl With Bushy Pubic Hair / Nonoka Hamabe [Uncensored L**ked],https://pic.javct.net/poster/04112026/f45c62fdb5.jpg,https://javct.net/v/san-449-rm,125,2026-04-30
SAN-447,"A Housewife, Frustrated By Her Husband's Premature Ejaculation, Turns To Her Father-in-law's Poisonous Mushroom / Yui Hatano",https://pic.javct.net/poster/04112026/2b9f60d8fd.jpg,https://javct.net/v/san-447,135,2026-04-30
