code,title,image_url,page_url,views,date_scraped
MEYD-994-SUB,Yumemi Kanae 111 Minutes Of Non-stop Bukkake And 17 Creampies!! Super Climax X Big Orgy SPECIAL [English Subtitle],https://pic.javct.net/poster/20250903/1744304660.jpg,https://javct.net/v/meyd-994-sub,120,2026-05-02
NHDTB-687-RM,"Cafe Girl Chain Slut  4 Beads Tethered Using A Fallen Compliant Clerk In The Store  Plan + That Beautiful Girl Byte Tie After The Job Change, Completely Taken Down SP [Uncensored L**ked]",https://pic.javct.net/poster/20221108/1660193750.jpg,https://javct.net/v/nhdtb-687-rm,240,2026-05-02
ONED-364-RM,Barely On The Southern Island Pakopako SEX ON THE BEACH ~! Maria Ozawa [Uncensored L**ked],https://pic.javct.net/poster/04112026/68f33969fc.jpg,https://javct.net/v/oned-364-rm,120,2026-05-02
ONED-343-RM,Maria Ozawa Barely Barely [Uncensored L**ked],https://pic.javct.net/poster/04112026/0d1f01b707.jpg,https://javct.net/v/oned-343-rm,130,2026-05-02
ONED-302-RM,Beautiful Maria Ozawa Barely There Mosaic Pakopako [Uncensored L**ked],https://pic.javct.net/poster/04112026/fdd23a4c24.jpg,https://javct.net/v/oned-302-rm,120,2026-05-02
MIMK-267-RM,Series Cumulative Sales Of 8 Million Copies: Karamizakari Reunion Edition [MOODYZ 25th Anniversary Work] Mio Ishikawa [Uncensored L**ked],https://pic.javct.net/poster/04112026/4c0c65a83f.jpg,https://javct.net/v/mimk-267-rm,120,2026-05-02
MIDA-623-RM,"When My Tutor, Ms. Sakura, Found Out I'm Abstaining From Masturbation, She Gave Me A Seductive, Wet Look... ""Just A Blowjob Wouldn't Be Cheating, Right?""... And To Make Matters Worse, It Looks Like There's Going To Be A Torrential Downpour Tonight That Will Make It Difficult To Get Home... (crying) Kawaguchi Sakura [Uncensored L**ked]",https://pic.javct.net/poster/04112026/46845ce8a3.jpg,https://javct.net/v/mida-623-rm,120,2026-05-02
ONED-384-RM,Barely One In Six Pakopako Costume! Maria Ozawa [Uncensored L**ked],https://pic.javct.net/poster/04112026/81272659d3.jpg,https://javct.net/v/oned-384-rm,120,2026-05-02
NHDTB-769-RM,Female Camper Who Couldn't Help Her Friend Who Was Brought Into The Tent And Was Turned Around At The Same Time [Uncensored L**ked],https://pic.javct.net/poster/20230205/1683775065.jpg,https://javct.net/v/nhdtb-769-rm,175,2026-05-02
MIGD-521-RM,"Great Tit, MANIAX Cove Manami Injection Amazing Clamping [Uncensored L**ked]",https://pic.javct.net/poster/01202026/1772592258.jpg,https://javct.net/v/migd-521-rm,180,2026-05-02
HALE-029-RM,"Eating Mama's Friends Infinite Loop Vol.24 Mari Female Ana-type Moms Are Intellectual, Fair-skinned And Get Wet Easily... [Uncensored L**ked]",https://pic.javct.net/poster/20230908/1694838650.jpg,https://javct.net/v/hale-029-rm,137,2026-05-02
SVN-002-RM,Blowjob Girl Pacifier Poisoning Uniform Fertilization Miru Machida [Uncensored L**ked],https://pic.javct.net/poster/20230908/1694315350.jpg,https://javct.net/v/svn-002-rm,122,2026-05-02
GMJK-013-RM,"Exposure Aokan-Outdoor, Slapping, Facial, Strangling... M Woman's Pleasure-Anna Suzune [Uncensored L**ked]",https://pic.javct.net/poster/20230908/1694491457.jpg,https://javct.net/v/gmjk-013-rm,120,2026-05-02
XVSR-221-RM,61 Days From The Lost Virgin ... Today Is My First Iki Anniversary Yuhanamoe [Uncensored L**ked],https://pic.javct.net/poster/04112026/34e1bc4227.jpg,https://javct.net/v/xvsr-221-rm,120,2026-05-02
CHN-197-RM,I Will Lend You A New Amateur Girl. 95 Pseudonym) Suzune Akimoto (supermarket / Clerk) 20 Years Old [Uncensored L**ked],https://pic.javct.net/poster/04112026/7ca1e24551.jpg,https://javct.net/v/chn-197-rm,135,2026-05-02
XRW-639-RM,Aphrodisiacs With Big Daughter Who Actively Daddy After School And Squirting And Raw Vaginal Cum Shot Record Image Yui Chan [Uncensored L**ked],https://pic.javct.net/poster/04112026/c1b61f3b8a.jpg,https://javct.net/v/xrw-639-rm,156,2026-05-02
MNTL-006-RM,Fifth Perverted H-cup Chubby Flesh-pot Woman: Mito Ririna [Uncensored L**ked],https://pic.javct.net/poster/04112026/ae088c024a.jpg,https://javct.net/v/mntl-006-rm,122,2026-05-02
MIDA-623,"When My Tutor, Ms. Sakura, Found Out I'm Abstaining From Masturbation, She Gave Me A Seductive, Wet Look... ""Just A Blowjob Wouldn't Be Cheating, Right?""... And To Make Matters Worse, It Looks Like There's Going To Be A Torrential Downpour Tonight That Will Make It Difficult To Get Home... (crying) Kawaguchi Sakura",https://pic.javct.net/poster/04112026/46845ce8a3.jpg,https://javct.net/v/mida-623,120,2026-05-02
MIDA-612,"Bullied **ds R**e Each Other ~I Was Relentlessly R**ed By Both The Bully And The Bullied **d Who Was Ordered To Do It, And I Came Over And Over Again While Crying~ Kira Hoshi",https://pic.javct.net/poster/04112026/12f772dd3d.jpg,https://javct.net/v/mida-612,120,2026-05-02
CAWD-977,"Too Erotic, It's Deadly! A Truly Beautiful Girl With An Overwhelming 55cm Waist And Miraculous Natural G-cup Breasts Awakens To A Massive Orgasm In This Pornographic Film Featuring 16 Facial Cumshots. Honma Asami",https://pic.javct.net/poster/04112026/8f9b6b8322.jpg,https://javct.net/v/cawd-977,130,2026-05-02
MIDA-615,"My Serious And Quiet C**ldhood Friend Shyly Tempts Me With A Panty Flash, Blushing And Showing Her Love. My Intense Gaze Makes Her Excited And Wet! Inoue Momo",https://pic.javct.net/poster/04112026/edd4b870f7.jpg,https://javct.net/v/mida-615,150,2026-05-02
MIMK-267,Series Cumulative Sales Of 8 Million Copies: Karamizakari Reunion Edition [MOODYZ 25th Anniversary Work] Mio Ishikawa,https://pic.javct.net/poster/04112026/4c0c65a83f.jpg,https://javct.net/v/mimk-267,120,2026-05-02
PGD-183-RM,Cohabitation And Living With You In The Eye She H Nao Yoshizaki 100%. [Uncensored L**ked],https://pic.javct.net/poster/04112026/d927ea2592.jpg,https://javct.net/v/pgd-183-rm,110,2026-05-02
NHDTB-748-RM,Cafe Girl Chain Slut 5 A Chained Slut Plan That Uses A Satisfied Clerk Who Has Fallen Into The Shop During Business [Uncensored L**ked],https://pic.javct.net/poster/20230207/1688614801.jpg,https://javct.net/v/nhdtb-748-rm,175,2026-05-02
