code,title,image_url,page_url,views,date_scraped
DIC-058-RM,The Camera Closely Contacts The Trajectory Until Ordinary Girls Become AV Actresses!To The World Of AV That Kept On Worrying For Two Years Too!Shimane Show Dancer Rika Chan (Kana) AVdebut! ! [Uncensored L**ked],https://pic.javct.net/poster/04112026/38225abd49.jpg,https://javct.net/v/dic-058-rm,125,2026-05-09
IPZZ-866-RM,"Fo**ed To Share A Room And R**ed, The Petite And Timid PR Girl, Seo Rin, Melts Body And Soul Into The Filthy Cum Of Her Sexually Depraved, Insatiable Boss, The Person She Hates Most In The World. [Uncensored L**ked]",https://pic.javct.net/poster/04112026/779aa89a80.jpg,https://javct.net/v/ipzz-866-rm,120,2026-05-09
ABW-078-RM,Aesthetics Of Facial Cumshots 14 Sprinkle The Cloudy Man Juice That Has Accumulated On The Face Of A Beautiful Woman! [Uncensored L**ked],https://static.javct.net/poster/abw-078.jpg,https://javct.net/v/abw-078-rm,210,2026-05-09
SNOS-166-RM,"""Master, Pour It On Me"" Two Maids Who Love My Cock So Much They Fight Over Freshly Squeezed Cum And Beg For A Facial Cumshot Adachi Yuri Araki Nozomi [Uncensored L**ked]",https://pic.javct.net/poster/04112026/b16b737c38.jpg,https://javct.net/v/snos-166-rm,150,2026-05-09
GFJ-002-RM,Instant Cum-Drinking Fellatio Girl 2: Suzune Mia [Uncensored L**ked],https://pic.javct.net/poster/04112026/32823443a9.jpg,https://javct.net/v/gfj-002-rm,122,2026-05-09
SNOS-183-RM,"Want To Miss The Last Train With The Ultimate Heroine, Stay In A Hotel, And Have Sex Until Morning! - Kanna Seto [Uncensored L**ked]",https://pic.javct.net/poster/04112026/840c39571a.jpg,https://javct.net/v/snos-183-rm,160,2026-05-09
IPZZ-856-RM,She Looks Innocent But Is Secretly A Pervert And Always Ready For Sex. Spending Time With My Face-to-face Girlfriend Is The Best Subjective Experience Of Cohabitation. Aisai Ria [Uncensored L**ked],https://pic.javct.net/poster/04112026/1ad8c21695.jpg,https://javct.net/v/ipzz-856-rm,120,2026-05-09
APNS-409,"I Just Received A DVD Containing A Video Of My Beloved Wife, Who Has Disappeared, Being Gang-r**ed... A Tragic Affair Of Infidelity, Impregnation, And Unprotected Sex... Yukimura Izuki",https://pic.javct.net/poster/04112026/abc4e9bd73.jpg,https://javct.net/v/apns-409,124,2026-05-09
EKDV-817,"My Virginity Was Taken By My C**ldhood Friend... My Teasing Goddess C**ldhood Friend, Miyu Aizawa, Became My Sex Practice Partner When I Got My First Girlfriend And Was Still A Virgin.",https://pic.javct.net/poster/04112026/a71e5482c1.jpg,https://javct.net/v/ekdv-817,150,2026-05-09
IPZZ-821-RM,"A Cheerful, Innocent, Anime-voiced Beauty Who Absolutely Adores Me Happily Accepts My Stinky Cum In A Massive Facial Cumshot Masturbation Support Cohabitation Life - Yamada Suzuna [Uncensored L**ked]",https://pic.javct.net/poster/04112026/832cc81129.jpg,https://javct.net/v/ipzz-821-rm,130,2026-05-09
BANK-237-RM,"A Beautiful, Obedient Wife; She Has A Cold Demeanor But Her Toes Curl When She Orgasms. A Slender Wife, Itsuki, 29 Years Old. [Uncensored L**ked]",https://pic.javct.net/poster/04112026/ff2fb876c6.jpg,https://javct.net/v/bank-237-rm,120,2026-05-09
IPZZ-823-RM,"Having Discovered That I Possess A Special Type Of Semen With Skin-beautifying Effects, I've Been Isolated In A Semen Research Lab As A Test Subject, And A Beautiful, Nymphomaniac Doctor Forces Me To Ejaculate Multiple Times A Day Into Her Face. 18 Ejaculations, Including Some For My Own Selfish Desires!! Sakura Momo [Uncensored L**ked]",https://pic.javct.net/poster/04112026/625b6b3fc3.jpg,https://javct.net/v/ipzz-823-rm,120,2026-05-09
BLOR-224-RM,A Yakiniku Restaurant Staff With A Soothing Smile A Stubborn Signboard Girl Has Been Fucked Over And Over Again With A Hetro Face [Uncensored L**ked],https://pic.javct.net/poster/20230804/1692419070.jpg,https://javct.net/v/blor-224-rm,130,2026-05-09
BANK-237,"A Beautiful, Obedient Wife; She Has A Cold Demeanor But Her Toes Curl When She Orgasms. A Slender Wife, Itsuki, 29 Years Old.",https://pic.javct.net/poster/04112026/ff2fb876c6.jpg,https://javct.net/v/bank-237,120,2026-05-09
MADM-171-RM,"When I Want To Fuck, I Order Immediately Aiming For A Delivery Person Who Comes To My House A Slutty Married Woman Kanna Misaki [Uncensored L**ked]",https://pic.javct.net/poster/20230804/1692418701.jpg,https://javct.net/v/madm-171-rm,140,2026-05-09
IPZZ-866,"Fo**ed To Share A Room And R**ed, The Petite And Timid PR Girl, Seo Rin, Melts Body And Soul Into The Filthy Cum Of Her Sexually Depraved, Insatiable Boss, The Person She Hates Most In The World.",https://pic.javct.net/poster/04112026/779aa89a80.jpg,https://javct.net/v/ipzz-866,120,2026-05-09
IPZZ-821,"A Cheerful, Innocent, Anime-voiced Beauty Who Absolutely Adores Me Happily Accepts My Stinky Cum In A Massive Facial Cumshot Masturbation Support Cohabitation Life - Yamada Suzuna",https://pic.javct.net/poster/04112026/832cc81129.jpg,https://javct.net/v/ipzz-821,130,2026-05-09
XBS-008-RM,Masochistic Beast Vomit Training 7th Person Ayami Kikugawa [Uncensored L**ked],https://pic.javct.net/poster/20243105/1719111479.jpg,https://javct.net/v/xbs-008-rm,122,2026-05-09
IPZZ-861,"Shy, Beautiful CEO's Secretary Pushes The Limits Of Eroticism: Her Extremely Slender Body Arches Back In Convulsive Orgasms, Culminating In A Massive Facial Cumshot Special - Mio Anzai",https://pic.javct.net/poster/04112026/8a959bb9f7.jpg,https://javct.net/v/ipzz-861,120,2026-05-09
NHDTC-153,Cafe Girl Chain Shame 9: A Chain-reaction Plan To Use Submissive Employees Who Have Fallen Into Orgasmic Ecstasy In The Cafe During Business Hours.,https://pic.javct.net/poster/04112026/09d33ad30e.jpg,https://javct.net/v/nhdtc-153,175,2026-05-09
SNOS-166,"""Master, Pour It On Me"" Two Maids Who Love My Cock So Much They Fight Over Freshly Squeezed Cum And Beg For A Facial Cumshot Adachi Yuri Araki Nozomi",https://pic.javct.net/poster/04112026/b16b737c38.jpg,https://javct.net/v/snos-166,150,2026-05-09
SHW-003-RM,Yua Hunting A Man Body [Uncensored L**ked],https://pic.javct.net/poster/04112026/e2d324fee2.jpg,https://javct.net/v/shw-003-rm,130,2026-05-09
IPZZ-856,She Looks Innocent But Is Secretly A Pervert And Always Ready For Sex. Spending Time With My Face-to-face Girlfriend Is The Best Subjective Experience Of Cohabitation. Aisai Ria,https://pic.javct.net/poster/04112026/1ad8c21695.jpg,https://javct.net/v/ipzz-856,120,2026-05-09
NHDTB-747-RM,A Perverted Couple Who Enjoys A Mixed 3P With A Working Innocent Girl (Deliveryman / Caregiver / Housekeeping Agent) Who Calls Her Home And Shows Her Vulgar SEX 2 [Uncensored L**ked],https://pic.javct.net/poster/20233001/1676841767.jpg,https://javct.net/v/nhdtb-747-rm,175,2026-05-09
