code,title,image_url,page_url,views,date_scraped
WHX-006,"I wanted to see you again... I cut my hair, you understand? Today I'm going to enjoy AV sex! Nagiyomi Yada Receptionist 22 years old",https://pic.javct.net/poster/04112026/a72235f79f.jpg,https://javct.net/v/whx-006,120,2026-05-18
APNS-313-RM,Humiliation Home Visit Married Female Teacher Mari Ueto [Uncensored L**ked],https://pic.javct.net/poster/20230804/1691207855.jpg,https://javct.net/v/apns-313-rm,108,2026-05-18
APAA-414-RM,The Smell Of Chestnut Flowers And The Love Juice Are Smeared In The Cage Sex. Kuromiya Erika [Uncensored L**ked],https://pic.javct.net/poster/20230804/1691210734.jpg,https://javct.net/v/apaa-414-rm,147,2026-05-18
APAK-259-RM,[Luxury Flesh Feeling Luxury] Sweet Sado Nasty Gal Kokona Girl [Fluffy Breasts & Soft Butt Thighs] God Tech Ejaculation Temptation! I Can't Stand It And I Can't Stand Demon Piss Intense Sexual Intercourse! Extreme Gachihame Adhesion Shooting! Cocona Asakura [Uncensored L**ked],https://pic.javct.net/poster/20230804/1691210673.jpg,https://javct.net/v/apak-259-rm,131,2026-05-18
HJMO-619-RM,"How To Back Option! We Tricked The Persuasion Technique That Makes A Maid Reflation Girl Who Is Weak To Push A Goddess Correspondence! In Addition, Will You Be Able To SEX Out Of Your Service Raw!? ? [Uncensored L**ked]",https://pic.javct.net/poster/20230804/1691728273.jpg,https://javct.net/v/hjmo-619-rm,180,2026-05-18
HIZ-020-RM,Hitosura Hitomi Igarashi Star Do Hirasawa Series No.020 [Uncensored L**ked],https://pic.javct.net/poster/20250606/1752843714.jpg,https://javct.net/v/hiz-020-rm,130,2026-05-18
DFDM-035-RM,"""You Want My Drool, Don't You?"" Mizuki Yayoi, Who Is Doted On By Her Saliva Kiss [Uncensored L**ked]",https://pic.javct.net/poster/20230207/1690516778.jpg,https://javct.net/v/dfdm-035-rm,120,2026-05-18
WHX-005,"I Was Looking Forward To Be A Problem, AV Sex Also ... ◆ Aitakute Again!Please, Tell Me A Lot That You Do Not Know Me!Makoto Takeuchi, 20-year-old Part-time Worker",https://pic.javct.net/poster/04112026/3afa4281d3.jpg,https://javct.net/v/whx-005,120,2026-05-18
HIZ-019-RM,Intently Intently Series Kaoi Kana Ogura No.019 [Uncensored L**ked],https://pic.javct.net/poster/04112026/a9a7ece428.jpg,https://javct.net/v/hiz-019-rm,130,2026-05-18
APAA-413-RM,Perverted Sleepover Sex Splashing Love Juice With A Simple Beautiful Girl Mei Satsuki [Uncensored L**ked],https://pic.javct.net/poster/20230804/1691207915.jpg,https://javct.net/v/apaa-413-rm,154,2026-05-18
DVAJ-124-RM,De M Gangbang Sasamoto Yuiai Was Awakening In The Aphrodisiac [Uncensored L**ked],https://pic.javct.net/poster/04112026/3fed2bd8e2.jpg,https://javct.net/v/dvaj-124-rm,150,2026-05-18
SON-528,Tits Figure BODY And Father Kissing Delusion SEX Nishio Rem,https://pic.javct.net/poster/04112026/bf43998951.jpg,https://javct.net/v/son-528,150,2026-05-18
PRWF-010-RM,"A Real Young Wife, 24 Years Old, Married For 1 Year, G-cup, Living In A Northern Region, Her Husband Is A Classmate. A Slender Wife With Huge Breasts And Hidden Masochistic Desires, Usually Plain-looking, Makes Her Debut! My First Affair, I'm Appearing In An Adult Video... Komatsu Sora [Uncensored L**ked]",https://pic.javct.net/poster/04112026/1776356465.jpg,https://javct.net/v/prwf-010-rm,190,2026-05-18
SON-523,Black Gal Athlete Topped Deca-ass FUCK Airi Fujii,https://pic.javct.net/poster/04112026/ee59d74c9c.jpg,https://javct.net/v/son-523,140,2026-05-18
SON-521,G Cup Big Tits Ass Gravure Model Trick Takes Orgy,https://pic.javct.net/poster/04112026/9560fa5d24.jpg,https://javct.net/v/son-521,140,2026-05-18
SON-522,Pies Tits Ass Black Gal Topped FUCK Mio Hazuki,https://pic.javct.net/poster/04112026/2eea05ccf9.jpg,https://javct.net/v/son-522,140,2026-05-18
ONED-321-RM,Nao Hazuki Sex Big Nasty Barely Soil Of Beauty [Uncensored L**ked],https://pic.javct.net/poster/04112026/d2281e18cf.jpg,https://javct.net/v/oned-321-rm,120,2026-05-18
HIZ-016-RM,Intently Sweat Hagi Much Earnestly Series No.016 [Uncensored L**ked],https://pic.javct.net/poster/04112026/4bf9e322f6.jpg,https://javct.net/v/hiz-016-rm,135,2026-05-18
HALE-028-RM,Mom Eating Infinite Loop Vol.23 Rio Highly Sensitive Erect Nipples Sucked As They Go... [Uncensored L**ked],https://pic.javct.net/poster/20230804/1691815793.jpg,https://javct.net/v/hale-028-rm,133,2026-05-18
NXG-436-RM,3P In Front Of My Husband... Voluptuous Amateur Wife Edition [Uncensored L**ked],https://pic.javct.net/poster/20230804/1692934200.jpg,https://javct.net/v/nxg-436-rm,120,2026-05-18
HIZ-017-RM,Intently Kaoi Kitagawa Leila Earnestly Series No.017 [Uncensored L**ked],https://pic.javct.net/poster/04112026/d9643c9795.jpg,https://javct.net/v/hiz-017-rm,130,2026-05-18
MIDD-873-RM,Haruki Nana Facial Cumshot From A Saturation Amount Of Suggoi [Uncensored L**ked],https://pic.javct.net/poster/06032026/1773382042.jpg,https://javct.net/v/midd-873-rm,180,2026-05-18
DIAM-007,Wheat Skin Pretty Oil Slimy Tied Up Sacred Tree YuAi 19 Years Old,https://pic.javct.net/poster/04112026/a3131c5703.jpg,https://javct.net/v/diam-007,138,2026-05-18
CESD-806-RM,The Only Reason A Happy Married Woman Who Is Quiet And Unaffected By Her Husband Feels Happiness ... Kana Morisawa Only When Having An Affair Sex With A Neighbor Man [Uncensored L**ked],https://pic.javct.net/poster/04112026/949af364a2.jpg,https://javct.net/v/cesd-806-rm,135,2026-05-18
