code,title,image_url,page_url,views,date_scraped
CPZ-69011,"Delusional Aizawa Miyu ~I Am On A Journey To ""know Humans"". Along The Way, I Learned About ""Infure-en-saa"". ~ A Story Born From The Fantasy Of What If Aizawa Miyu Were An Elf...",https://pic.javct.net/poster/05192026/bf86c3cc2d.jpg,https://javct.net/v/cpz-69011,117,2026-05-20
RAW-040-RM,We Unearthed Certain Private University Four-year Basketball Powerhouse Club Team Affiliation Sunaga Hiyori AV Debut AV Actress A New Generation! 36 [Uncensored L**ked],https://pic.javct.net/poster/05192026/77f384524b.jpg,https://javct.net/v/raw-040-rm,135,2026-05-20
IPIT-011,G Cup 21 Years Old Gravure Egg AV Debut Misa Tenjo,https://pic.javct.net/poster/05192026/79c59cd0cf.jpg,https://javct.net/v/ipit-011,160,2026-05-20
NACT-127,Pleasure Esthetic Room: I Found Pleasure In The Amazing Techniques Of A Creepy Old Man - Yui Asakaze,https://pic.javct.net/poster/05192026/e6048fdf6f.jpg,https://javct.net/v/nact-127,125,2026-05-20
NACT-129,"A Voyeuristic Masochistic Tutor Witnesses Her Student's Father's Hardcore S&M Mating And Becomes Aroused. With Her Secret Exposed, The College Student's True Nature Is Revealed Through Cotton Rope And A Collar In This Complete Record Of Her Training. (Rin Ouka)",https://pic.javct.net/poster/05192026/8389d4f28e.jpg,https://javct.net/v/nact-129,119,2026-05-20
NACT-132,Rent-back Tenant ● Makes Fried Rice In A Naked Apron And Provides Bath Service! A Woman Whose Weakness Is Exploited And Is Taken Advantage Of By Her Landlord - Yukimura Izuki,https://pic.javct.net/poster/05192026/6667ee765a.jpg,https://javct.net/v/nact-132,103,2026-05-20
NACT-128,"Yuika Onosaka, A Young Wife Repeatedly R**ed By Her Insatiable Stepfather And Trained To Be A Slut.",https://pic.javct.net/poster/05192026/7b6e9ff50d.jpg,https://javct.net/v/nact-128,117,2026-05-20
APKH-033-RM,"Uterus Also Face Also, Please Dirty All ... Part-time Waitress's Rustic Local JK Was A Juvenile Nymphomaniac Spree Guests And Spears .... Kokorohana Yura [Uncensored L**ked]",https://pic.javct.net/poster/05192026/ad8e6bb586.jpg,https://javct.net/v/apkh-033-rm,132,2026-05-20
ABP-767-RM,Endless Sex ACT.10 Nonstop Shooting Uncut Edit! !Marginal Biggone 49P 116 Minutes! ! Lotus Yoshikawa [Uncensored L**ked],https://pic.javct.net/poster/05192026/bfca6cf8fd.jpg,https://javct.net/v/abp-767-rm,125,2026-05-20
REAL-611,Grated Take Super BEST Treasured Mass Facials Rich One-shot Special With Extras! !,https://pic.javct.net/poster/04112026/12c8c6f80b.jpg,https://javct.net/v/real-611,300,2026-05-20
APNS-319-RM,Shameful Mortgage Wife Mami Sakurai [Uncensored L**ked],https://pic.javct.net/poster/20230804/1691207795.jpg,https://javct.net/v/apns-319-rm,119,2026-05-20
BANK-239-RM,"A Beautiful, Obedient Wife; A Kind-hearted, Seemingly Unfortunate Young Wife With Black Hair, Moeka, 23 Years Old. [Uncensored L**ked]",https://pic.javct.net/poster/04112026/8ccd66e4f5.jpg,https://javct.net/v/bank-239-rm,120,2026-05-20
BANK-239,"A Beautiful, Obedient Wife; A Kind-hearted, Seemingly Unfortunate Young Wife With Black Hair, Moeka, 23 Years Old.",https://pic.javct.net/poster/04112026/8ccd66e4f5.jpg,https://javct.net/v/bank-239,120,2026-05-20
NADE-783-RM,Married Louis Saotome Tragedy Of [Uncensored L**ked],https://pic.javct.net/poster/04112026/ce42dfed1e.jpg,https://javct.net/v/nade-783-rm,120,2026-05-20
DVAJ-152-RM,Do Not Go Home Until You Master!SEX Does Not End Until Remember 48 Positions All Ai Minano [Uncensored L**ked],https://pic.javct.net/poster/04112026/f45510534c.jpg,https://javct.net/v/dvaj-152-rm,150,2026-05-20
ONED-650-RM,Shou Nishino Screaming FUCK Barely Erotic Female Doctor [Uncensored L**ked],https://pic.javct.net/poster/04112026/29bc7d9bae.jpg,https://javct.net/v/oned-650-rm,120,2026-05-20
WHX-006,"I wanted to see you again... I cut my hair, you understand? Today I'm going to enjoy AV sex! Nagiyomi Yada Receptionist 22 years old",https://pic.javct.net/poster/04112026/a72235f79f.jpg,https://javct.net/v/whx-006,120,2026-05-20
APNS-313-RM,Humiliation Home Visit Married Female Teacher Mari Ueto [Uncensored L**ked],https://pic.javct.net/poster/20230804/1691207855.jpg,https://javct.net/v/apns-313-rm,108,2026-05-20
APAA-414-RM,The Smell Of Chestnut Flowers And The Love Juice Are Smeared In The Cage Sex. Kuromiya Erika [Uncensored L**ked],https://pic.javct.net/poster/20230804/1691210734.jpg,https://javct.net/v/apaa-414-rm,147,2026-05-20
APAK-259-RM,[Luxury Flesh Feeling Luxury] Sweet Sado Nasty Gal Kokona Girl [Fluffy Breasts & Soft Butt Thighs] God Tech Ejaculation Temptation! I Can't Stand It And I Can't Stand Demon Piss Intense Sexual Intercourse! Extreme Gachihame Adhesion Shooting! Cocona Asakura [Uncensored L**ked],https://pic.javct.net/poster/20230804/1691210673.jpg,https://javct.net/v/apak-259-rm,131,2026-05-20
HJMO-619-RM,"How To Back Option! We Tricked The Persuasion Technique That Makes A Maid Reflation Girl Who Is Weak To Push A Goddess Correspondence! In Addition, Will You Be Able To SEX Out Of Your Service Raw!? ? [Uncensored L**ked]",https://pic.javct.net/poster/20230804/1691728273.jpg,https://javct.net/v/hjmo-619-rm,180,2026-05-20
HIZ-020-RM,Hitosura Hitomi Igarashi Star Do Hirasawa Series No.020 [Uncensored L**ked],https://pic.javct.net/poster/20250606/1752843714.jpg,https://javct.net/v/hiz-020-rm,130,2026-05-20
DFDM-035-RM,"""You Want My Drool, Don't You?"" Mizuki Yayoi, Who Is Doted On By Her Saliva Kiss [Uncensored L**ked]",https://pic.javct.net/poster/20230207/1690516778.jpg,https://javct.net/v/dfdm-035-rm,120,2026-05-20
WHX-005,"I Was Looking Forward To Be A Problem, AV Sex Also ... ◆ Aitakute Again!Please, Tell Me A Lot That You Do Not Know Me!Makoto Takeuchi, 20-year-old Part-time Worker",https://pic.javct.net/poster/04112026/3afa4281d3.jpg,https://javct.net/v/whx-005,120,2026-05-20
