code,title,image_url,page_url,views,date_scraped
ABF-348,Ultimate Ecstasy: A New Realm Of Pleasure That Courses Through Every Nerve— Remu Suzumori,https://pic.javct.net/poster/04112026/582624978e.jpg,https://javct.net/v/abf-348,120,2026-05-07
ABF-350,Takimoto Musou (Takimoto Shizukuha),https://pic.javct.net/poster/04112026/1e704c71ae.jpg,https://javct.net/v/abf-350,115,2026-05-07
MIDD-925,SEX Kazuki Yu Pear Stuffing Rise To Go Up At The Same Time,https://pic.javct.net/poster/04112026/f14c2d7873.jpg,https://javct.net/v/midd-925,120,2026-05-07
SVMGM-048-RM,"Magic Mirror Hardboiled: Ordinary Girls On The Street Take Off Their Clothes And Face Off In A Game Of Rock-paper-scissors! They Have To Take Off A Piece Of Clothing Wherever They Turn Their Face, And Face Naughty Punishments Like Handjobs, Blowjobs, And Kisses! The First One To Get Their Opponent Completely Naked Wins! The Loser Gets Immediately Fucked And Cummed Inside! [Uncensored L**ked]",https://pic.javct.net/poster/04112026/58e4a52f72.jpg,https://javct.net/v/svmgm-048-rm,240,2026-05-07
GFJ-002,Instant Cum-Drinking Fellatio Girl 2: Suzune Mia,https://pic.javct.net/poster/04112026/32823443a9.jpg,https://javct.net/v/gfj-002,122,2026-05-07
APAK-329,"Himari, With Her Voluptuous Flesh And Vibrant Orgasm After Being Cummed Inside, Cries Out, ""I'm Cumming! I'm Cumming! I'm Cumming!"" A Thrilling Orgasm Directly Hitting Her Uterus! ""That Was The Best Feeling Of My Life!"" Lewd Orgasm Student Guidance Momose Himari",https://pic.javct.net/poster/04112026/c6a575dffc.jpg,https://javct.net/v/apak-329,134,2026-05-07
APAA-415-RM,Naughty Life Of A Naive Girl With Beautiful Breasts Sumire Uchida [Uncensored L**ked],https://pic.javct.net/poster/20230804/1692419251.jpg,https://javct.net/v/apaa-415-rm,136,2026-05-07
DIC-053-RM,"Camera Follows Closely Until This Normal Girl Turns Into A Porn Star! Sensitive Nipple Orgasms Super Anime Voice Currently Working At A Day Care, Rio-Chan's Porn Debut!! [Uncensored L**ked]",https://pic.javct.net/poster/04112026/6caf01a88a.jpg,https://javct.net/v/dic-053-rm,135,2026-05-07
APAK-260-RM,"Creampie Flesh Feeling Keiren Climax Riku ""I'm Trembling Too Much!"" Horny Climax Student Guidance Serious Sex! Convulsions Climax Morimori SEX Of Innocent Athletic Girl! Swimming Club Riku Ichikawa [Uncensored L**ked]",https://pic.javct.net/poster/20230804/1692415039.jpg,https://javct.net/v/apak-260-rm,137,2026-05-07
HODV-21548-RM,Group Madness Bukkake Facial Cum Inside 30 Shots Reika Hashimoto [Uncensored L**ked],https://pic.javct.net/poster/04112026/1a8117a2b5.jpg,https://javct.net/v/hodv-21548-rm,125,2026-05-07
NACT-119-RM,"Pleasure Esthetic Room: I, Sara Isshiki, Found Pleasure In The Amazing Techniques Of A Creepy Old Man. [Uncensored L**ked]",https://pic.javct.net/poster/04112026/e327f61f4c.jpg,https://javct.net/v/nact-119-rm,121,2026-05-07
DV-982-RM,Akari Asahina-white Fruit DEBUT [Uncensored L**ked],https://pic.javct.net/poster/20230205/1685531381.jpg,https://javct.net/v/dv-982-rm,120,2026-05-07
SVCAO-026-RM,J〇 Dark Part-Time Job: A Girl Tricked By A High Hourly Wage On A Certain Online Forum Is Bound To An Impenetrable Wall With Powerful Magnets And Subjected To Sexual A**se. Further Subjected To Shrink Wrap Restraint And A Wall-ass Escape Game. [Uncensored L**ked],https://pic.javct.net/poster/04112026/ff5ff524e5.jpg,https://javct.net/v/svcao-026-rm,152,2026-05-07
SGKI-085-RM,"Piston Vibe Fundamentalism: T.N., An Idol Girl Who Was Forcibly Converted Into A Cult. [Uncensored L**ked]",https://pic.javct.net/poster/04112026/27181a6eb0.jpg,https://javct.net/v/sgki-085-rm,140,2026-05-07
SVMGM-048,"Magic Mirror Hardboiled: Ordinary Girls On The Street Take Off Their Clothes And Face Off In A Game Of Rock-paper-scissors! They Have To Take Off A Piece Of Clothing Wherever They Turn Their Face, And Face Naughty Punishments Like Handjobs, Blowjobs, And Kisses! The First One To Get Their Opponent Completely Naked Wins! The Loser Gets Immediately Fucked And Cummed Inside!",https://pic.javct.net/poster/04112026/58e4a52f72.jpg,https://javct.net/v/svmgm-048,240,2026-05-07
SVCAO-026,J〇 Dark Part-Time Job: A Girl Tricked By A High Hourly Wage On A Certain Online Forum Is Bound To An Impenetrable Wall With Powerful Magnets And Subjected To Sexual A**se. Further Subjected To Shrink Wrap Restraint And A Wall-ass Escape Game.,https://pic.javct.net/poster/04112026/ff5ff524e5.jpg,https://javct.net/v/svcao-026,152,2026-05-07
NACT-119,"Pleasure Esthetic Room: I, Sara Isshiki, Found Pleasure In The Amazing Techniques Of A Creepy Old Man.",https://pic.javct.net/poster/04112026/e327f61f4c.jpg,https://javct.net/v/nact-119,121,2026-05-07
DIC-051-RM,The Camera Closely Contacts The Trajectory Until Ordinary Girls Become AV Actresses! Systemic Feeling Band BODY Sensitive Sensitive Grueling Hair ○ ○ Corioli Face Animation Voice Vehicle Maintenance Specialty Student Yukari Chan (kana) AV Debut! ! [Uncensored L**ked],https://pic.javct.net/poster/04112026/dc061aa98f.jpg,https://javct.net/v/dic-051-rm,135,2026-05-07
EVO-143-RM,VOL.70 Working Woman [Uncensored L**ked],https://pic.javct.net/poster/04112026/8abead5c87.jpg,https://javct.net/v/evo-143-rm,120,2026-05-07
PGD-570-RM,Saori PREMIUM STYLISH SOAP [Uncensored L**ked],https://pic.javct.net/poster/06032026/1772843155.jpg,https://javct.net/v/pgd-570-rm,160,2026-05-07
MIAA-296-RM,"Don't Put It Out On A Dangerous Day! Even After Ejaculation, It's A Terrifying Pacifier To Prevent Cleaning Blowjobs Without Stopping Erina Oka [Uncensored L**ked]",https://pic.javct.net/poster/20241804/1713854586.jpg,https://javct.net/v/miaa-296-rm,120,2026-05-07
SGKI-085,"Piston Vibe Fundamentalism: T.N., An Idol Girl Who Was Forcibly Converted Into A Cult.",https://pic.javct.net/poster/04112026/27181a6eb0.jpg,https://javct.net/v/sgki-085,140,2026-05-07
IPZ-988,First Time 8 Customs SPECIAL + 4 Production + Pinosaro + Mutual Onage + China Este + Quick Delivery Nishimiya Yume Book Nominating 240 Minutes,https://pic.javct.net/poster/04112026/a4bd008972.jpg,https://javct.net/v/ipz-988,240,2026-05-07
DANDYA-034-RM,"""If You Get An Erection With Anyone Other Than Me, That's Cheating!"" A Virile Husband Is Repeatedly Given A No-hands Jealous Blowjob By His Possessive Wife, Who Controls His Ejaculation. VOL.2 [Uncensored L**ked]",https://pic.javct.net/poster/04112026/7907199ec4.jpg,https://javct.net/v/dandya-034-rm,187,2026-05-07
