code,title,image_url,page_url,views,date_scraped
ABF-328,Saturday Morning Fucking With A Morning Erection. Remu Suzumori,https://pic.javct.net/poster/06032026/1773281950.jpg,https://javct.net/v/abf-328,135,2026-03-12
ABF-330,Takimoto Shizukuha Was Left Behind In A Mahjong Parlor Full Of Men.,https://pic.javct.net/poster/06032026/1773281820.jpg,https://javct.net/v/abf-330,120,2026-03-12
RKI-613-RM,Super Feel Good Impregnating Sex With The Number One Cum Lover In The World! Mei Satsuki [Uncensored L**ked],https://static.javct.net/poster/rki-613.jpg,https://javct.net/v/rki-613-rm,126,2026-03-12
JUL-633-RM,Married Woman Gushes Sweat And Bucks Her Hips While She Drains Your Creampie. Kana Mito [Uncensored L**ked],https://static.javct.net/poster/jul-633.jpg,https://javct.net/v/jul-633-rm,155,2026-03-12
KUSE-019-RM,"Woman Has A Bad Habit Tempting With Her Holes When She Wants It! Thick Bitch In Hole Temptation Reverse Pick Up Everywhere, Jun Asami [Uncensored L**ked]",https://static.javct.net/poster/1627973553.jpg,https://javct.net/v/kuse-019-rm,141,2026-03-12
JUY-277-RM,A Middle Aged Couple's Love Affair That Starts In The Bathtub The Wet And Wild Room Miyuki Okano [Uncensored L**ked],https://pic.javct.net/poster/20221108/1661969615.jpg,https://javct.net/v/juy-277-rm,116,2026-03-12
JUL-185-US,"A Married Woman Secretary Is Having Sweaty, Kiss-Filled Creampie Sex In The President's Office Nao Jinguji [English Subtitle, Reducing Mosaic]",https://pic.javct.net/poster/20212011/1640274968.jpg,https://javct.net/v/jul-185-us,117,2026-03-12
NGOD-168-RM,"He Was An Old Company Man Who Was Left To Wither In The Office, But When He Shoved His Big Dick Into This Naughty And Haughty Career Woman, She Melted Like Butter In His Hands Mao Hamasaki [Uncensored L**ked]",https://pic.javct.net/poster/20221202/1646376955.jpg,https://javct.net/v/ngod-168-rm,123,2026-03-12
JUL-638-RM,Innocent And Beautiful Wife Gets Ravished By An Older Corrupt Investigator Who Likes To Use His Authority Mikako Horiuchi [Uncensored L**ked],https://static.javct.net/poster/jul-638.jpg,https://javct.net/v/jul-638-rm,135,2026-03-12
FSDSS-342-RM,"Ever Since That Day, When I Partied Too Hard, And He Ravaged Me ... I Would Get Wet, As Soon As Our Eyes Met. She Hated Her Boss, But She Was Hooked On His Cock. Lulu Amakuni [Uncensored L**ked]",https://pic.javct.net/poster/20212011/1640234443.jpg,https://javct.net/v/fsdss-342-rm,120,2026-03-12
FNS-167-RM,"A Big-breasted Female College Student Couldn't Stand The Peeing Orgasm That Kneaded Her Private Parts And Fo**ed Her Squirt Out, So She Was Seduced By An Unscrupulous Masseuse. Misaki Soka [Uncensored L**ked]",https://pic.javct.net/poster/06032026/1773184434.jpg,https://javct.net/v/fns-167-rm,120,2026-03-12
JUL-559-RM,Exclusive Honoka Yonekura Is Getting Sweaty And Seriously Non-Stop Cumming!! Hard And Tight Sex - A Manly Housekeeper Consoles A Woman Mourning Her Failing Marriage With At-Home Adultery Sex - [Uncensored L**ked],https://static.javct.net/poster/jul-559.jpg,https://javct.net/v/jul-559-rm,115,2026-03-12
FSDSS-340-RM,The Convenience Store Boss No One Likes Caught Right in the Middle of a Circle Jerk...Gangbanged by All the Part Time Employees Until She Came Hard. [Uncensored L**ked],https://pic.javct.net/poster/20212011/1640234501.jpg,https://javct.net/v/fsdss-340-rm,124,2026-03-12
FNS-173-RM,Sensitive Pussy Is At Its Limit...! Cunnilingus Peeing School Beautiful Girl Rui Shinomiya [Uncensored L**ked],https://pic.javct.net/poster/06032026/1773095690.jpg,https://javct.net/v/fns-173-rm,130,2026-03-12
HNAMH-019-RM,Natsu Shibuya [Uncensored L**ked],https://pic.javct.net/poster/20252204/1747197838.jpg,https://javct.net/v/hnamh-019-rm,56,2026-03-12
JUX-352-RM,Violated In Our New Home - Completely Dominated In The 3 Days While Her Husband Was Away - Nana Aida [Uncensored L**ked],https://pic.javct.net/poster/20221202/1647866764.jpg,https://javct.net/v/jux-352-rm,117,2026-03-12
FSDSS-341-RM,"""The Rumors Are True That This Nurse Does Cum Control Too..."" Can't Experience This During A Normal Hospital Visit. Special Private Room At A Hospital Somewhere. Kaname Momojiri [Uncensored L**ked]",https://pic.javct.net/poster/20212011/1639025858.jpg,https://javct.net/v/fsdss-341-rm,124,2026-03-12
JUY-274-RM,This Is My Identity In The Afternoon Reika Hashimoto Exclusive Video #3 Her First Drama!! <> The Beautiful Face Of A Housewife In The Afternoon!! [Uncensored L**ked],https://pic.javct.net/poster/20221108/1661934220.jpg,https://javct.net/v/juy-274-rm,115,2026-03-12
KUSE-018-RM,A Real-Life Muscle-Bound Beautiful Girl You*uber Is Getting Her First Raw Creampie! She Got Into Powerful Position To Receive Real Sperm Injected Deep Into Her Pussy!! Yota Chan [Uncensored L**ked],https://static.javct.net/poster/1623728099.jpg,https://javct.net/v/kuse-018-rm,123,2026-03-12
LULU-116-RM,"While My Girlfriend Was Away For 3 Days, I Went To A Rejuvenation Massage Parlor And Ordered The Most Popular Girl There And She Was A Hot Elder Sister Type Who Gave Me A Sweet Massage And So Much Nookie That My C*ck Went Crazy Sakura Tsuji [Uncensored L**ked]",https://pic.javct.net/poster/20212011/1641095387.jpg,https://javct.net/v/lulu-116-rm,160,2026-03-12
KUSE-017-RM,"If You're In The Mood For Fucking, Get Some Instant Pussy! Bust: 100cm x Hips: 100cm This Currently Active Office Lady Is A Big Hole Natural Airhead With A Voluptuous Body And She's Making Her Adult Video Debut!! A Natural Born Bitch Jun Asami Her Adult Video Debut [Uncensored L**ked]",https://static.javct.net/poster/1625550393.jpg,https://javct.net/v/kuse-017-rm,121,2026-03-12
JUL-632-RM,"Passionate Kissing And Sex Of A Rabbit-like Married Woman, Released Into The Wild After One Month Of Abstinence. Iori Takahira [Uncensored L**ked]",https://static.javct.net/poster/jul-632.jpg,https://javct.net/v/jul-632-rm,148,2026-03-12
MIAA-106-RM,"I Just Got My First Girlfriend, So I Decided To Practice Sex And Cumming Inside With My C**ldhood Friend: Yui Nagase [Uncensored L**ked]",https://pic.javct.net/poster/20220707/1659022135.jpg,https://javct.net/v/miaa-106-rm,119,2026-03-12
FNS-167,"A Big-breasted Female College Student Couldn't Stand The Peeing Orgasm That Kneaded Her Private Parts And Fo**ed Her Squirt Out, So She Was Seduced By An Unscrupulous Masseuse. Misaki Soka",https://pic.javct.net/poster/06032026/1773184434.jpg,https://javct.net/v/fns-167,120,2026-03-12
