code,title,image_url,page_url,views,date_scraped
WO-002-RM,A Woman Who Sells Sexual Goods A Slobbering Snake-Tongued Tornado Kiss x A Big Tits Sales Lady ... Honoka Tsujii [Uncensored L**ked],https://pic.javct.net/poster/20221904/1651728245.jpg,https://javct.net/v/wo-002-rm,93,2026-03-29
NGOD-032-RM,[Sad News] NTR My JK Wife Was Fucked By Her Teacher And Now She's A Horny Whore Sora Shiina [Uncensored L**ked],https://pic.javct.net/poster/20221108/1661507272.jpg,https://javct.net/v/ngod-032-rm,120,2026-03-29
MUDR-014-RM,MISSING GIRLS (Chisato) I Can Never See It Again... What I Saw On That Day... Sora Shiina [Uncensored L**ked],https://pic.javct.net/poster/20220707/1657818308.jpg,https://javct.net/v/mudr-014-rm,117,2026-03-29
JUL-666-RM,Electric Shock Transfer Round 2!! I Was Made To Cum So Hard By A Man I Didn't Want To Be Held By... Rena Kodama [Uncensored L**ked],https://static.javct.net/poster/jul-666.jpg,https://javct.net/v/jul-666-rm,119,2026-03-29
JUL-665-RM,Cuckold Video Of Camping In Town: A Video Of A Wife Shockingly Cuckolded And Given Repeated Creampies - Megu [Uncensored L**ked],https://static.javct.net/poster/jul-665.jpg,https://javct.net/v/jul-665-rm,135,2026-03-29
XRW-581-RM,If We're Caught We're In Big Trouble!! Close And Tight Temptation Sex Tsubasa Hachino [Uncensored L**ked],https://pic.javct.net/poster/20221108/1662308566.jpg,https://javct.net/v/xrw-581-rm,152,2026-03-29
AMBI-125-RM,My Secret Love Life With My Homeroom Teacher Mashiro Kisaragi [Uncensored L**ked],https://static.javct.net/poster/ambi-125.jpg,https://javct.net/v/ambi-125-rm,118,2026-03-29
DASD-980-RM,Lewd Older Step-sister Will Work Out Cum All Over No Matter Where She Is. Sara Aizawa [Uncensored L**ked],https://pic.javct.net/poster/20221202/1647591181.jpg,https://javct.net/v/dasd-980-rm,144,2026-03-29
JUY-861-RM,I'm The New Guy At Work And My Female Boss Keeps Toying With Me During Work Eriko Miura [Uncensored L**ked],https://pic.javct.net/poster/20221202/1646702161.jpg,https://javct.net/v/juy-861-rm,120,2026-03-29
SSIS-261-US,"Breast, Buttocks, Vagina, 171cm, Tasting The Best Style All Over Marin Hinata 's New World Of Acme [English Subtitle, Reducing Mosaic]",https://pic.javct.net/poster/20212011/1639118863.jpg,https://javct.net/v/ssis-261-us,145,2026-03-29
FSDSS-257-US,"A Men's Massage Parlor Slut Is Providing Devilish Customer Service By Teasing Men's Nipples And Mind-Blowing Nookie For Their Cocks, Over And Over Again Yuko Ono [English Subtitle, Reducing Mosaic]",https://static.javct.net/poster/fsdss-257.jpg,https://javct.net/v/fsdss-257-us,119,2026-03-29
MGMQ-070-RM,Chubby Teacher Plays With My Ass And Teaches Me The Pleasures Of The Anus Rian Isaki [Uncensored L**ked],https://static.javct.net/poster/mgmq-070.jpg,https://javct.net/v/mgmq-070-rm,119,2026-03-29
AVOP-389-RM,The Fuck Wagon Is Cumming!! It's Happening A Go Go!! Hibiki Otsuki And Liz's Strange Adventure [Uncensored L**ked],https://pic.javct.net/poster/20221108/1662444283.jpg,https://javct.net/v/avop-389-rm,219,2026-03-29
IESP-692-RM,20 Creampie Loads In A Row Into A Schoolgirl - Lala Kudo [Uncensored L**ked],https://pic.javct.net/poster/20212011/1643276966.jpg,https://javct.net/v/iesp-692-rm,121,2026-03-29
AMBI-124-RM,No Way! My Homeroom Teacher Found Out About My Sex Videos! Aoi Nakajo [Uncensored L**ked],https://static.javct.net/poster/ambi-124.jpg,https://javct.net/v/ambi-124-rm,129,2026-03-29
AMBI-123-RM,Perverted Step Dad's Sex Toy Beautiful Young Girl In Uniform Has Her Relationship With Her Boyfriend Ruined Suzu Monami [Uncensored L**ked],https://static.javct.net/poster/ambi-123.jpg,https://javct.net/v/ambi-123-rm,121,2026-03-29
SSNI-584-RM,"A Creepy Middle-Aged Man And A Shy Big Tits Barely Legal In Her School Uniform The Smell Of Sweat, Drool, And Bodily Fluids A Midsummer Full-Body Soaking Humid Lusty Fuck Fest Rika Aimi [Uncensored L**ked]",https://pic.javct.net/poster/20222109/1666137153.jpg,https://javct.net/v/ssni-584-rm,153,2026-03-29
ROYD-006-RM,"Usually My Little Stepsister Is A Cute Plain Jane With A Big Ass, But Then She Started Showing Off The Total Domain Of Her Pussy, And By The Time I Realized What Was Happening, I Had Creampie Fucked her. Akari Neo [Uncensored L**ked]",https://pic.javct.net/poster/20221202/1648300171.jpg,https://javct.net/v/royd-006-rm,115,2026-03-29
DASD-966-RM,My Older Female Boss Took Care Of Me When I Was Tipsy. Sara Aisawa [Uncensored L**ked],https://pic.javct.net/poster/20212011/1643954428.jpg,https://javct.net/v/dasd-966-rm,133,2026-03-29
MANE-041-RM,"You're Doing Naughty Things Because You've Got All That Stored Up Cum, Aren't You? An Unlimited Ejaculation Sex Life With A Cute Big Tits Girlfriend Mina Wakatsuki [Uncensored L**ked]",https://pic.javct.net/poster/20221108/1660494522.jpg,https://javct.net/v/mane-041-rm,110,2026-03-29
ROE-320-SUB,My mother and I's short-time exam life: A 20-minute break for creampie sex supported me through the exams I took... Rin Okae [English Subtitle],https://pic.javct.net/poster/20253001/1738866702.jpg,https://javct.net/v/roe-320-sub,120,2026-03-29
STARS-357-RM,18 Year Old Amateur Sexy Model Himari Asada All Exciting New Experiences Fucks 4 Times [Uncensored L**ked],https://static.javct.net/poster/1617699096.jpg,https://javct.net/v/stars-357-rm,220,2026-03-29
SDMU-673-RM,SOD Romance x French Publishing Living Together I'm A Spoiled Brat Living With My Stepmom Sumire Shiraishi [Uncensored L**ked],https://pic.javct.net/poster/20221202/1648868830.jpg,https://javct.net/v/sdmu-673-rm,129,2026-03-29
STARS-377-RM,My G-Spot Is In My Titties ... The Sensual Nipples And Titties Of A Beautiful Girl Who Can Cum Just With Her Boobs Himari Asada [Uncensored L**ked],https://static.javct.net/poster/1620098053.jpg,https://javct.net/v/stars-377-rm,140,2026-03-29
