code,title,image_url,page_url,views,date_scraped
ROE-322-SUB,"Satsuki Kirioka makes her Madonna debut with a 10-year hiatus, filling in the gap with raw, lustful creampie sex [English Subtitle]",https://pic.javct.net/poster/20253001/1738866657.jpg,https://javct.net/v/roe-322-sub,140,2026-03-09
KUSE-012-RM,Delicate Body Awakens During Maso Bondage Plays - Submissive Subculture Public Servant Inori Bo [Uncensored L**ked],https://static.javct.net/poster/1618969209.jpg,https://javct.net/v/kuse-012-rm,141,2026-03-09
JUL-477-RM,"Madonna Exclusive, Part 2!! Creampie Ban Lifted!! A Mother Made Pregnant By Her Daughter's Boyfriend - Marika Kobayashi [Uncensored L**ked]",https://pic.javct.net/poster/20212011/1638926654.jpg,https://javct.net/v/jul-477-rm,115,2026-03-09
FSDSS-327-RM,My Step-brother Was Away For Three Days. This Is A Record Of Her Moaning And Coming To Life With A Meat Stick Other Than Her Step-Brother's. Kaname Momojiri [Uncensored L**ked],https://pic.javct.net/poster/20212709/1636606722.jpg,https://javct.net/v/fsdss-327-rm,124,2026-03-09
LULU-111-RM,"My Student Loves Me So Much, She Came Over To My House, So Because She Was Jealous Of My Wife, She Secretly Tweaked My Nipples, And Ejaculated Me Over And Over Until I Was Drained Empty. Ten Hasumi [Uncensored L**ked]",https://pic.javct.net/poster/20212011/1639655904.jpg,https://javct.net/v/lulu-111-rm,139,2026-03-09
IENF-411-RM,Itsuwa [Uncensored L**ked],https://pic.javct.net/poster/20250606/1752116932.jpg,https://javct.net/v/ienf-411-rm,143,2026-03-09
DLDSS-484-RM,"""Lucky! After Drinking, I Don't Remember Anything."" Newly Married Office Lady Completes Memoryless NTR With Obscene Clothed Sex In A Tight Suit! ! Chiharu Mitsuha [Uncensored L**ked]",https://pic.javct.net/poster/06032026/1772945351795.jpg,https://javct.net/v/dldss-484-rm,120,2026-03-09
KUSE-013-RM,No Way I'd Ever Fuck Him! The Rookie Female Teacher In Charge Of The Swim Team Gets Slipped An Aphrodisiac To Make Her Horny For The Principal She Hates Yota Chan [Uncensored L**ked],https://static.javct.net/poster/kuse-013.jpg,https://javct.net/v/kuse-013-rm,138,2026-03-09
FSDSS-328-RM,Getting Your Nipples Kneaded And Shooting It Out Continuously. A Men's Massage Parlor Where Beautiful Women Squeeze Men's Balls. Ruru Tengoku [Uncensored L**ked],https://pic.javct.net/poster/20212011/1637816000.jpg,https://javct.net/v/fsdss-328-rm,124,2026-03-09
SONE-580-SUB,"This gentle and natural nurse licks your dick until it goes berserk, makes you cum repeatedly, and doesn't want to stop sucking your dick. [English Subtitle]",https://pic.javct.net/poster/20253001/1738866198.jpg,https://javct.net/v/sone-580-sub,120,2026-03-09
GG-065-RM,Naughty Nurses Mitsuki An [Uncensored L**ked],https://pic.javct.net/poster/20221202/1649042230.jpg,https://javct.net/v/gg-065-rm,120,2026-03-09
LULU-110-RM,"My Landlord Loves Big Titties, And Since I Can Never Seem To Pay The Rent On Time, I Get To Continue Living Here Because I'm A Big Tits Pet Who Will Let Him Ejaculate Anytime. Reona Tomiyasu [Uncensored L**ked]",https://pic.javct.net/poster/20212011/1638676047.jpg,https://javct.net/v/lulu-110-rm,155,2026-03-09
DLDSS-484,"""Lucky! After Drinking, I Don't Remember Anything."" Newly Married Office Lady Completes Memoryless NTR With Obscene Clothed Sex In A Tight Suit! ! Chiharu Mitsuha",https://pic.javct.net/poster/06032026/1772945351795.jpg,https://javct.net/v/dldss-484,120,2026-03-09
DLDSS-483-RM,"I'll Turn My Winning Mother Into A Female! A Live-action Adaptation Of The Super Popular Comic With Cumulative Sales Of Over 90,000 Copies! Mino Suzume [Uncensored L**ked]",https://pic.javct.net/poster/06032026/1772842892505.jpg,https://javct.net/v/dldss-483-rm,120,2026-03-09
FSDSS-326-RM,Looks Like She Likes Me!? Going On A Lovey-dovey Hot Springs Trip With My Company Junior And Shooting My Loads Out In The Water - Momo Honda [Uncensored L**ked],https://pic.javct.net/poster/20212011/1637816059.jpg,https://javct.net/v/fsdss-326-rm,124,2026-03-09
KUSE-011-RM,Savor The Sweetest Hips As She Winds Her Way To Total Brothel Domination - From The Seediest To The Highest Class Mie Chin [Uncensored L**ked],https://static.javct.net/poster/kuse-011.jpg,https://javct.net/v/kuse-011-rm,139,2026-03-09
JUL-476-RM,"This Super Sweaty Married Woman Is Powerfully Shaking Her Ass So Hard, I Ended Up Creampie Fucking Her Without Ever Moving My Hips. Yuka Mizuno [Uncensored L**ked]",https://pic.javct.net/poster/20212011/1638229885.jpg,https://javct.net/v/jul-476-rm,142,2026-03-09
JUY-268-RM,A Passion Drenched Afternoon Mother In Law and Son's Unforgivable Act of Depravity Maki Tomoda [Uncensored L**ked],https://pic.javct.net/poster/20212011/1643684288.jpg,https://javct.net/v/juy-268-rm,119,2026-03-09
TORG-037-RM,Forbidden Triangle - Stepbrother And Sister Escape Their Destiny to Fuck - Hibiki Otsuki [Uncensored L**ked],https://pic.javct.net/poster/20221904/1653972901.jpg,https://javct.net/v/torg-037-rm,114,2026-03-09
SPRD-642-RM,The Journey Of My Adoptive Mother Nami Horikawa - Nami Horikawa [Uncensored L**ked],https://pic.javct.net/poster/20221202/1649605771.jpg,https://javct.net/v/sprd-642-rm,130,2026-03-09
JUX-485-RM,Mom's Friend Yuko Shiraki [Uncensored L**ked],https://pic.javct.net/poster/20212011/1643115940.jpg,https://javct.net/v/jux-485-rm,118,2026-03-09
CESD-927-RM,I Am Getting Fucked Again By This Glasses-wearing Stalker... Kana Morisawa [Uncensored L**ked],https://pic.javct.net/poster/20212011/1640457301.jpg,https://javct.net/v/cesd-927-rm,149,2026-03-09
GVG-676-RM,Father In Law and Daughter In Law's Secret Creampie Mating Yui Hatano [Uncensored L**ked],https://pic.javct.net/poster/20221904/1651192771.jpg,https://javct.net/v/gvg-676-rm,135,2026-03-09
SOE-485-RM,Beautiful Nymphos Kissing and Fucking Mika Kayama [Uncensored L**ked],https://pic.javct.net/poster/20221904/1651076676.jpg,https://javct.net/v/soe-485-rm,196,2026-03-09
