code,title,image_url,page_url,views,date_scraped
MIMK-079-RM,Hardcore Sex With A Quiet Student Librarian. Mia Nanasawa [Uncensored L**ked],https://static.javct.net/poster/mimk-079.jpg,https://javct.net/v/mimk-079-rm,96,2026-03-17
MUDR-144-RM,I Still Won't Give In... Beautiful Girl Continues To Resist Until She's Gangbanged. Breaking In A Proud Babe With S&M And Confinement - Mitsuki Nagisa [Uncensored L**ked],https://static.javct.net/poster/mudr-144.jpg,https://javct.net/v/mudr-144-rm,120,2026-03-17
KUSE-022-RM,(Older Sister Wants To Showcase Poop) Gorgeous City Office Worker Willingly Signs On For First Ever AV Performance To Show Off Pooping. Makoto (25) [Uncensored L**ked],https://static.javct.net/poster/1628570021.jpg,https://javct.net/v/kuse-022-rm,143,2026-03-17
JUL-645-RM,Horny Pregnant Stepmom Rides My Cock For A Creampie Behind The Old Man's Back Ai Mukai [Uncensored L**ked],https://static.javct.net/poster/jul-645.jpg,https://javct.net/v/jul-645-rm,124,2026-03-17
FSDSS-934-SUB,Merciless facial cumshot from an innocent blowjob Sakazu Yamashita [English Subtitle],https://pic.javct.net/poster/20242012/1736788614.jpg,https://javct.net/v/fsdss-934-sub,120,2026-03-17
MUDR-156-RM,Ever Since That Day ... Breaking In A Beautiful Young Girl In Uniform With Creampie S&M Training Minami Hatsukawa [Uncensored L**ked],https://static.javct.net/poster/mudr-156.jpg,https://javct.net/v/mudr-156-rm,137,2026-03-17
VENU-953-RM,Do You Get Excited By An Older Woman's Panties? - A Mature Woman Takes Off Her Panties To Jerk Off A Younger Guy - Ririka [Uncensored L**ked],https://pic.javct.net/poster/20212011/1638148646.jpg,https://javct.net/v/venu-953-rm,104,2026-03-17
VENU-921-RM,"""Are You Getting Horny Over An Old Lady's Underwear?"" This Horny Lady Is Using Her Freshly Stripped-Off Panties To Squeeze Out Every Last Drop Of Semen Ayane Haruka [Uncensored L**ked]",https://pic.javct.net/poster/20212011/1643730734.jpg,https://javct.net/v/venu-921-rm,106,2026-03-17
VENU-892-RM,"""Do Aunty's Panties Excite You?"" Aunty Squeezes Every Drop Of His Sperm With Her Panties Freshly Taken Off: Yuka Mizuno [Uncensored L**ked]",https://pic.javct.net/poster/20212011/1638926325.jpg,https://javct.net/v/venu-892-rm,104,2026-03-17
ADN-162-US,"A Cock Assault This Married Woman Housemaid Is Getting R**ed Against Her Will Saeko Matsushita [English Subtitle, Reducing Mosaic]",https://pic.javct.net/poster/20212011/1641971108.jpg,https://javct.net/v/adn-162-us,113,2026-03-17
HMGL-188-RM,"Shy Bodies, Black Sun Yumi Saeki [Uncensored L**ked]",https://pic.javct.net/poster/20212308/1632540715.jpg,https://javct.net/v/hmgl-188-rm,131,2026-03-17
MEYD-414-US,"I Went To This Sex Club That Didn't Allow Real Fucking, And To My Surprise, Out Came The Bitchy And Beautiful Married Woman From Next Door Now That I Knew Her Secret, I Could Demand Real Fucking And Creampie Sex Too! And I Fucked Her To Be My Obedient Sex Slave Outside Of The Club Too [English Subtitle, Reducing Mosaic]",https://pic.javct.net/poster/20221202/1646268354.jpg,https://javct.net/v/meyd-414-us,117,2026-03-17
JUL-647-RM,"She Turns Into A Completely Different Person With A Cock Inside Her. 34 Years Old, Married, And Cock-Crazed; Saori Nagashima Makes Her AV Debut. [Uncensored L**ked]",https://static.javct.net/poster/jul-647.jpg,https://javct.net/v/jul-647-rm,187,2026-03-17
GVH-337-SUB,Seductive PTA President And Bratty Student Council. Hikari Kisaki [English Subtitle],https://pic.javct.net/poster/20212011/1641014651.jpg,https://javct.net/v/gvh-337-sub,135,2026-03-17
SONE-574-SUB,"When your partner is in front of you, you'll be targeted by this beautiful woman who will whisper dirty talk, give you a titjob, and seduces you into an NTR (cuckold) relationship. Hikaru Nagi [English Subtitle]",https://pic.javct.net/poster/20253001/1738866422.jpg,https://javct.net/v/sone-574-sub,123,2026-03-17
XVSR-199,Secret Asami Nagase Four Hours Of H Milk,https://pic.javct.net/poster/06032026/1773633775.jpg,https://javct.net/v/xvsr-199,240,2026-03-17
LULU-123-RM,"A Boyish Friend From Back In The Day Gets Her Nipples Teased Non-stop, Making Her Face Go Unimaginably Wild As She Squirts With Pleasure! I Get Hard In No Time And Stick It In Her Dripping Pussy For Raw Fucking And Multiple Creampie Loads. Suzu Monami [Uncensored L**ked]",https://pic.javct.net/poster/20212011/1643449898.jpg,https://javct.net/v/lulu-123-rm,160,2026-03-17
SOE-496-RM,M-Cup Tits Want to be Spoiled 3 Hour Special Ruri Saijo [Uncensored L**ked],https://pic.javct.net/poster/20220406/1657157086.jpg,https://javct.net/v/soe-496-rm,176,2026-03-17
RKI-619-RM,The Story Behind How She Became An Obsessive Blowjob Fiend That Sucks Whenever She Can Ever Since She Was Taught How To Suck A Dick. Hotaru Nogi [Uncensored L**ked],https://pic.javct.net/poster/20212709/1633674678.jpg,https://javct.net/v/rki-619-rm,161,2026-03-17
JUL-644-RM,Yuko Shiraki Adult Style Sk**ls Honed By Years Of Experience Documentary Drama Featuring Actress Yuko Shiraki [Uncensored L**ked],https://static.javct.net/poster/jul-644.jpg,https://javct.net/v/jul-644-rm,160,2026-03-17
ADN-203-US,"Immature Adultery: Married Woman Office Lady And Her Younger Subordinate - Saeko Matsushita [English Subtitle, Reducing Mosaic]",https://pic.javct.net/poster/20212011/1641966391.jpg,https://javct.net/v/adn-203-us,115,2026-03-17
SSIS-202-US,"We Seriously Go Undercover At This Dispatch System Reflexology Salon Where The Rumor Is That You Can Get Some Nookie Marin Hinata Is Going All Out To Service You With Super Excessive Secret Optional Services, And We're Going All The Way To Show You Everything That Happens [English Subtitle, Reducing Mosaic]",https://pic.javct.net/poster/20212709/1633676440.jpg,https://javct.net/v/ssis-202-us,153,2026-03-17
NITR-380-RM,"I Went To My Relatives' House To Spend The Night And There I Saw My First Glimpse Of An Adult Naked Body And Even Now, I Remember That Moment As My Most Shocking Memory V Azusa Yagi [Uncensored L**ked]",https://pic.javct.net/poster/20212011/1644199589.jpg,https://javct.net/v/nitr-380-rm,136,2026-03-17
NACR-382-RM,Lady Editor Becomes Older Author's Personal Sex Pet Sumire Mizukawa [Uncensored L**ked],https://pic.javct.net/poster/20212011/1640790570.jpg,https://javct.net/v/nacr-382-rm,120,2026-03-17
