code,title,image_url,page_url,views,date_scraped
DLDSS-491-RM,[Blue Sky Project Lifted] Outdoor Gonzo Big Tits Exposed Car Sex Mami Yoshiba [Uncensored L**ked],https://pic.javct.net/poster/04112026/1776617699528.jpg,https://javct.net/v/dldss-491-rm,80,2026-05-22
HODV-21576-RM,Mami Nagase Best [Uncensored L**ked],https://static.javct.net/poster/hodv-21576.jpg,https://javct.net/v/hodv-21576-rm,244,2026-05-22
HODV-21578-RM,Former Celebrity Debut - Oto Haruno [Uncensored L**ked],https://static.javct.net/poster/hodv-21578.jpg,https://javct.net/v/hodv-21578-rm,163,2026-05-22
GVG-791-RM,Sexy PTA President And Brat Student Council Shiori Misato [Uncensored L**ked],https://pic.javct.net/poster/20221108/1663056384.jpg,https://javct.net/v/gvg-791-rm,130,2026-05-22
ROYD-060-RM,"When I Got My First Girlfriend, We Used This Camera To Film So Many Wonderful Memories ... And Now, I'm Using It To Film My Scary Friend While He Fucks Her ... And All The While, I Have A Melancholy Erection, That Just Won't Stop ... Rio Matsumoto [Uncensored L**ked]",https://static.javct.net/poster/royd-060.jpg,https://javct.net/v/royd-060-rm,134,2026-05-22
STARS-425-RM,"Memories Of Summertime Where A Locally Famous Slutty Gal Milks So Many Cumshots Out Of Me, Hibiki Natsume [Uncensored L**ked]",https://static.javct.net/poster/1628570223.jpg,https://javct.net/v/stars-425-rm,151,2026-05-22
PPR-007,Remu Suzumori 8 Hours BEST PRESTIGE PREMIUM RESTRICTED Vol.12,https://pic.javct.net/poster/05192026/4b582c2c2a.jpg,https://javct.net/v/ppr-007,480,2026-05-22
REBD-1036,Ao3 A Lingering Effervescence - Aoi Ebisaki,https://pic.javct.net/poster/05192026/991a1f37c5.jpg,https://javct.net/v/rebd-1036,83,2026-05-22
REBD-1034,Miharu9 Forbidden Eden・Miharu Hazaki,https://pic.javct.net/poster/05192026/3fee450765.jpg,https://javct.net/v/rebd-1034,73,2026-05-22
REBD-1037,Mio Naturally-Uncut Scenes-・Mio Sakai,https://pic.javct.net/poster/05192026/ae6e8c95ee.jpg,https://javct.net/v/rebd-1037,122,2026-05-22
HODV-21574-RM,[Complete POV] A Girl Speaking The Mikawa Dialect Rina Takase [Uncensored L**ked],https://static.javct.net/poster/hodv-21574.jpg,https://javct.net/v/hodv-21574-rm,133,2026-05-22
HODV-21573-RM,"19 Years Old, Barely Legal. I Just Want To Be Fucked And Treated Like A Toy - Riko Shinohara [Uncensored L**ked]",https://static.javct.net/poster/hodv-21573.jpg,https://javct.net/v/hodv-21573-rm,134,2026-05-22
ZEX-411-RM,"A TSUNDERE Newly Wed Lifestyle With My New Wife, Mikako. Mikako Abe [Uncensored L**ked]",https://pic.javct.net/poster/20212011/1642317158.jpg,https://javct.net/v/zex-411-rm,120,2026-05-22
ROYD-059-RM,"When You Pressed Your Dick Up Against Your Cheeky Coworker You Thought For Sure She'd Be Mad, But Instead It Felt So Good You Ended Up Fucking Until Dawn Yuno Hanasaki [Uncensored L**ked]",https://static.javct.net/poster/royd-059.jpg,https://javct.net/v/royd-059-rm,146,2026-05-22
VENX-027-RM,Step Mother And Step Son Have Sex 2 Seconds After Father Leaves The House Nanao Nakano [Uncensored L**ked],https://pic.javct.net/poster/20212308/1632137377.jpg,https://javct.net/v/venx-027-rm,116,2026-05-22
REBD-1035,Jun3 Summer Paradox・Perfume Jun,https://pic.javct.net/poster/05192026/860650f560.jpg,https://javct.net/v/rebd-1035,92,2026-05-22
GVG-014-RM,Mama's Real Sex Education Kanako Ioka [Uncensored L**ked],https://pic.javct.net/poster/20221904/1651452891.jpg,https://javct.net/v/gvg-014-rm,117,2026-05-22
HODV-21570-RM,This Horny Hospitality Whore Will Provide You With Extra Special Service And She'll Use Her Slender Body And H-Cup Titties To Treat You Like A God And Bring You To Full Course Ejaculatory Pleasure Miyabi Midorikawa [Uncensored L**ked],https://static.javct.net/poster/hodv-21570.jpg,https://javct.net/v/hodv-21570-rm,135,2026-05-22
ROYD-058-RM,My Older Stepsister Peeled Back My Stuck Foreskin And Washed My Dick - It Turned Me On So Much That We Started Fucking Madoka Shizuki [Uncensored L**ked],https://static.javct.net/poster/royd-058.jpg,https://javct.net/v/royd-058-rm,181,2026-05-22
FNS-192-RM,"In Order To Revive The Taste Of Her Late Grandfather... An Apprentice Who Trains At A Ramen Shop While Enduring Sexual Harassment On A Daily Basis In A World Full Of Men. Nene Yoshitaka Works 17 Hours A Day And Earns 1,175 Yen Per Hour (overtime Is Not Included). [Uncensored L**ked]",https://pic.javct.net/poster/04112026/badb7af326.jpg,https://javct.net/v/fns-192-rm,120,2026-05-22
MIAA-551-SUB,"I'm The Only One Who Knows The True Face Of Our Student Council President. She's The Number One Neat And Clean Classmate, But She Was Rudely And Crudely Showing Off Her Anal Hole To Me And Lured Me To Temptation And Proceeded To Creampie Pound Me. Hana Shirato [English Subtitle]",https://pic.javct.net/poster/20212011/1640937385.jpg,https://javct.net/v/miaa-551-sub,117,2026-05-22
SDJS-113-RM,"The Manager's Daughter Was Besieged And Fucked This Middle-Aged Loser Was Fired From His Job At A Convenience Store, So He Decided To Get His Revenge And Fuck The Manager's Daughter Right Before His Eyes! Koharu Asai [Uncensored L**ked]",https://static.javct.net/poster/1618969101.jpg,https://javct.net/v/sdjs-113-rm,124,2026-05-22
MEYD-542-SUB,A Wife Works Some Overtime NTR I've Been Lying To My Husband About My Overtime... Nanao Nakano [English Subtitle],https://pic.javct.net/poster/20220406/1655774678.jpg,https://javct.net/v/meyd-542-sub,119,2026-05-22
XVSR-289,Miyoshi Hoshino 4 Hours,https://pic.javct.net/poster/04112026/86c58ac656.jpg,https://javct.net/v/xvsr-289,240,2026-05-22
