code,title,image_url,page_url,views,date_scraped
FOCS-032-RM,Tokyo Metro's NO. 1 Too-Beautiful High Class Call Girls Slender Beautiful Body and Extraordinary Technique POV x W Blowjob x 3P Top-Class Service For You... Noa Uika [Uncensored L**ked],https://pic.javct.net/poster/20212709/1636702927.jpg,https://javct.net/v/focs-032-rm,122,2026-04-25
AMBI-154-RM,3 Full Days Alone With My Step-sister Who Isn't B**od-related! We Take The Opportunity To Do Nothing But Fuck Non-stop! Aoi Amano [Uncensored L**ked],https://pic.javct.net/poster/20221202/1649141835.jpg,https://javct.net/v/ambi-154-rm,126,2026-04-25
EKW-074-RM,Dirty Talk INGO Kanna Hirai [Uncensored L**ked],https://pic.javct.net/poster/20212709/1634910407.jpg,https://javct.net/v/ekw-074-rm,111,2026-04-25
MIAA-271-RM,"This Cherry Boy Little Stepbrother Took His Little Stepsister's Seduction Seriously, And He Didn't Realize That She Had Cum Already And Kept On Pumping Away Urara Kanon [Uncensored L**ked]",https://pic.javct.net/poster/20253001/1738947379.jpg,https://javct.net/v/miaa-271-rm,120,2026-04-25
MESU-94-RM,Overtime Sex With My Old Lady Boss In The Creampie Office Yukari Mikawa [Uncensored L**ked],https://pic.javct.net/poster/20221202/1647582411.jpg,https://javct.net/v/mesu-94-rm,109,2026-04-25
JFB-505-RM,"Kanon Kanon, With A Big Smile, Climaxes Repeatedly In All Of Fitch's Titles, All SEX 240 Minutes BEST [Uncensored L**ked]",https://pic.javct.net/poster/04112026/1776793569.jpg,https://javct.net/v/jfb-505-rm,240,2026-04-25
DLDSS-489-RM,"""Naho-san...I Can't Resist..."" I Want To Be Sandwiched Between The Breasts Of A Working Woman! Kado Naho [Uncensored L**ked]",https://pic.javct.net/poster/04112026/1776971026116.jpg,https://javct.net/v/dldss-489-rm,120,2026-04-25
FNS-176,I Became A Masturbator For My Girlfriend's Big-breasted NEET Sister Rin Yamitsu,https://pic.javct.net/poster/04112026/1777048375897.jpg,https://javct.net/v/fns-176,120,2026-04-25
HODV-21516-RM,"The Pleasure Syndrome Case 2 ""A Foot-Licking Beautiful Babe Who Succumbs To The Limits Of Maso Pleasures Of Ch**ing And Spanking"" Runa Kokomi [Uncensored L**ked]",https://pic.javct.net/poster/20221202/1645922308.jpg,https://javct.net/v/hodv-21516-rm,133,2026-04-25
AMBI-153-RM,Is She Trying To Lure My Cherry Boy Ass To Temptation With Her Tiny Titties!? A Devilish Step Cousin Ichika Matsumoto [Uncensored L**ked],https://pic.javct.net/poster/20221202/1647824824.jpg,https://javct.net/v/ambi-153-rm,125,2026-04-25
GVG-760-RM,"The Perverted, Face-Licking, Creampie Medical Records Of An Old Physician [Uncensored L**ked]",https://pic.javct.net/poster/20212011/1644115712.jpg,https://javct.net/v/gvg-760-rm,132,2026-04-25
GVG-729-RM,Father In Law and Daughter In Law Sticky Creampie Fucking Mio Kimijima [Uncensored L**ked],https://pic.javct.net/poster/20212011/1641318258.jpg,https://javct.net/v/gvg-729-rm,121,2026-04-25
ROYD-019-RM,"""I'm Sorry... I Was Feeling Lonely, So I Decided To Cum Over..."" My C**ldhood Friend Was In Love With Me, And One Day, She Was Caught In A Sudden Rainstorm, And Showed Up At My Door, Dripping Wet. Runa Kokomi [Uncensored L**ked]",https://pic.javct.net/poster/20212709/1635138366.jpg,https://javct.net/v/royd-019-rm,134,2026-04-25
DLDSS-489,"""Naho-san...I Can't Resist..."" I Want To Be Sandwiched Between The Breasts Of A Working Woman! Kado Naho",https://pic.javct.net/poster/04112026/1776971026116.jpg,https://javct.net/v/dldss-489,120,2026-04-25
VENX-101-RM,He Mistook His Resting Mother-in-law's Ass For His Wife's Ass And Inserted It Immediately Without Knowing She Was His Mother-in-law. Chisato Shoda [Uncensored L**ked],https://pic.javct.net/poster/20212011/1640339394.jpg,https://javct.net/v/venx-101-rm,93,2026-04-25
VENX-042-RM,"I Mistook My Resting Mother-In-Law's Ass For My Wife's, And Stuck My Dick Right In Without Knowing It Was Actually My Mother-In-Law. Yuna Kitano [Uncensored L**ked]",https://static.javct.net/poster/1622869942.jpg,https://javct.net/v/venx-042-rm,106,2026-04-25
VEC-395-RM,Mother Loses Her Pride Being Ravaged By Son's Classmate Rin Chibana [Uncensored L**ked],https://pic.javct.net/poster/20222109/1664709736.jpg,https://javct.net/v/vec-395-rm,100,2026-04-25
GVH-398-RM,"Development Of Vaginal Orgasms. 3 Nights, 4 Days. Ena Satsuki [Uncensored L**ked]",https://pic.javct.net/poster/20221904/1651296863.jpg,https://javct.net/v/gvh-398-rm,132,2026-04-25
VENU-890-RM,A Retired And Bored And Horny Father-In-Law Fucks With His Daughter-In-Law Tsubasa Haneda [Uncensored L**ked],https://pic.javct.net/poster/20221108/1663034250.jpg,https://javct.net/v/venu-890-rm,84,2026-04-25
HDKA-246-RM,Nude Maid. Nude Maid Referral Office. Ena Satsuki [Uncensored L**ked],https://pic.javct.net/poster/20212011/1638335334.jpg,https://javct.net/v/hdka-246-rm,120,2026-04-25
KEED-69-RM,I Let My Daughter's Boyfriend Fuck And Come Inside Me -Yukari Mikawa [Uncensored L**ked],https://static.javct.net/poster/keed-69.jpg,https://javct.net/v/keed-69-rm,88,2026-04-25
JUY-865-RM,Madonna Exclusive Hot Mature Woman!! Married Woman's Lust Fuck Dripping With Immorality!! Husband Doesn't Know -My Dirty Lust And Secret- Maki Hojo [Uncensored L**ked],https://pic.javct.net/poster/20221904/1651553483.jpg,https://javct.net/v/juy-865-rm,119,2026-04-25
MIAD-609-RM,[Reducing Mosaic] L**ita Squirting Gangbang Rina Hatsumi [Uncensored L**ked],https://static.javct.net/poster/miad-609.jpg,https://javct.net/v/miad-609-rm,179,2026-04-25
VAGU-115-RM,Naughty Life With Kanako Kanako Ioka [Uncensored L**ked],https://pic.javct.net/poster/20220406/1655096992.jpg,https://javct.net/v/vagu-115-rm,89,2026-04-25
