code,title,image_url,page_url,views,date_scraped
LULU-103-RM,"High-Pressure Ass Piston Is Amazing! Personal Training Raw Fucking Creampies 5 Days A Week With Bitch Trainer Who Has A Thick Round Ass That's Almost Too Much, Training My Dick Muscles. Saya Minami [Uncensored L**ked]",https://pic.javct.net/poster/20212709/1635594895.jpg,https://javct.net/v/lulu-103-rm,160,2026-03-02
MANE-030-RM,"A Sex Traiing Life With A Total Maso Man 2 - I Love You, That's Why I'm Giving You Breaking In Training! - Ai Hoshina [Uncensored L**ked]",https://pic.javct.net/poster/20212709/1635947664.jpg,https://javct.net/v/mane-030-rm,122,2026-03-02
FSDSS-305-RM,"Tonight, I Will Sexually Entertain You - Dribbling, Dripping Corporate Secrets And Semen - Nene Yoshitaka [Uncensored L**ked]",https://pic.javct.net/poster/20212709/1633606340.jpg,https://javct.net/v/fsdss-305-rm,122,2026-03-02
FSDSS-306-RM,A Female Student Makes Herself With Her Incontinent Orgasms - Yume Nikaidou [Uncensored L**ked],https://pic.javct.net/poster/20212709/1634792881.jpg,https://javct.net/v/fsdss-306-rm,120,2026-03-02
MIDD-783-RM,Wet SEX Outdoors! Yuki Maeda [Uncensored L**ked],https://pic.javct.net/poster/20220406/1655620271.jpg,https://javct.net/v/midd-783-rm,117,2026-03-02
LULU-102-RM,"Wife With Beautiful Tits Gets A Sexy Oil Treatment From Former Masseuse Father-In-Law, He Teases Her Sticky Erogenous Zone, Cuckholded By Wet Smothering Kisses After She Could Not Bear The Pleasure... Riria Hyodo [Uncensored L**ked]",https://pic.javct.net/poster/20212709/1635594964.jpg,https://javct.net/v/lulu-102-rm,160,2026-03-02
KUSE-010-RM,"""I Wanna Be A Cum Dumpster"" Slender, Baby-Faced Cutie Wants Men To Make Her Dirty - Buckets Of Cum Swallowing From A True Sub Servant - Inori Sasage, Age 23 [Uncensored L**ked]",https://pic.javct.net/poster/20212308/1631409980.jpg,https://javct.net/v/kuse-010-rm,133,2026-03-02
DLDSS-482-RM,"Luna Tsukino, The “beautiful Woman You Want To Destroy”, Transferred Exclusively To DAHLIA, Climaxes 38 Times…sweat, Body Fluids, And “instinctual” Creampie Intercourse. [Uncensored L**ked]",https://pic.javct.net/poster/01202026/1772302380427.jpg,https://javct.net/v/dldss-482-rm,120,2026-03-02
VEC-350-RM,My Mother's Friend Azusa Yagi [Uncensored L**ked],https://pic.javct.net/poster/20221108/1663475586.jpg,https://javct.net/v/vec-350-rm,106,2026-03-02
DLDSS-473,Beautiful Mature Woman Wearing A Mysterious Mask Has Her Real Face And Creampie Double Ban. Creampie Sex With A Big-breasted Married Woman She Met On SNS! Watercolor Space,https://pic.javct.net/poster/01202026/1772384862125.jpg,https://javct.net/v/dldss-473,125,2026-03-02
VENU-447-RM,Bath House Fakecest - Stepmother And Son Fucking In Under The Steam Misa Kudo [Uncensored L**ked],https://pic.javct.net/poster/20221904/1652745840.jpg,https://javct.net/v/venu-447-rm,100,2026-03-02
SDMT-485-RM,National Idol Tomomi Itano's Shocking Solo Debut! Ayaka Tomoda [Uncensored L**ked],https://pic.javct.net/poster/20220707/1657767201.jpg,https://javct.net/v/sdmt-485-rm,110,2026-03-02
DASD-906-RM,Embarrassing Yet Arousing Bathtime. Nephew Bathes With His Aunt For The First Time In Years. Starring Morisawa Kana [Uncensored L**ked],https://static.javct.net/poster/dasd-906.jpg,https://javct.net/v/dasd-906-rm,118,2026-03-02
LULU-100-RM,"""If You Can't Hold It In You Can Put It Inside Me!"" I'm So Horny I'm About To Explode! Wife Addicted To Sex After Fucking Many Times Yuri Fukada [Uncensored L**ked]",https://pic.javct.net/poster/20212709/1633426205.jpg,https://javct.net/v/lulu-100-rm,160,2026-03-02
DASD-417-RM,"Pee Pee, Nip-Slip Ran Izumi [Uncensored L**ked]",https://pic.javct.net/poster/20221108/1661448124.jpg,https://javct.net/v/dasd-417-rm,120,2026-03-02
FSDSS-303-RM,Five Days Living Together With And Fucking A Precocious Young Thing Who Was No Pushover But Had a Strong Libido While My Girlfriend Was Out of Town Rin Natsuki [Uncensored L**ked],https://pic.javct.net/poster/20212709/1634792938.jpg,https://javct.net/v/fsdss-303-rm,156,2026-03-02
KUSE-009-RM,Lust Monster With A Young Face! 10 Times Overnight Sex With A Short Tan Slut From Vietnam Ran Sakita [Uncensored L**ked],https://pic.javct.net/poster/20212709/1636884881.jpg,https://javct.net/v/kuse-009-rm,220,2026-03-02
JUY-264-RM,"Tonight, I'm Alone with my Wife's Friend... with Kaya Okumura [Uncensored L**ked]",https://pic.javct.net/poster/20221202/1646105227.jpg,https://javct.net/v/juy-264-rm,120,2026-03-02
JUL-467-RM,Mother-In-Law Desperate For Her Son-In-Law's Dick Around The Clock Tsubaki Kato [Uncensored L**ked],https://pic.javct.net/poster/20212011/1638460712.jpg,https://javct.net/v/jul-467-rm,137,2026-03-02
GVG-098-RM,A Son-In-Law After His MILF-In-Law's Obscene Big Tits Azusa Yagi [Uncensored L**ked],https://pic.javct.net/poster/20221904/1652237715.jpg,https://javct.net/v/gvg-098-rm,120,2026-03-02
FOCS-020-RM,Undiscovered Talent In Hakata! The 171cm Luxuriously Slender And Pure Beautiful Girl. A Lewd Sexual Extravaganza That Goes For 1 Night And 2 Days Without Sleep. Haru Yamaguchi [Uncensored L**ked],https://pic.javct.net/poster/20212308/1631874901.jpg,https://javct.net/v/focs-020-rm,123,2026-03-02
CRC-075-RM,"I Read On The Bulletin Boards About A Business Hotel With A Big Titty Guest Services Clerk In Glasses So I Made A Reservation. It Was True You Could Clearly Tell She Had Colossal Tits Underneath Her Clothes And In My Room The Bed... I Thought I Would Only Get To Look At Her, But Then Those Glasses, Those Big Tits...! Big Titty Guest Services Clerk In Glasses Makes A Blunder! Rie Tachikawa . [Uncensored L**ked]",https://pic.javct.net/poster/20220707/1658429622.jpg,https://javct.net/v/crc-075-rm,118,2026-03-02
MIDE-675-RM,"This Beautiful Girl's Needs Have Gone Unfulfilled For 30 Days, Now She's Ready For Some Sensual Climactic Sex With Older Guys - Koharu Sakuno [Uncensored L**ked]",https://pic.javct.net/poster/20221202/1644987049.jpg,https://javct.net/v/mide-675-rm,143,2026-03-02
VEMA-157-RM,"She's My Beautiful Female Teacher, My Class Leader, My Club Advisor, And My Girlfriend - Forbidden Creampie Sex From Morning Until Night - Rin Azuma [Uncensored L**ked]",https://pic.javct.net/poster/20212709/1632733162.jpg,https://javct.net/v/vema-157-rm,101,2026-03-02
