code,title,image_url,page_url,views,date_scraped
LULU-438,"Having Missed The Last Train, I Was Invited To The Home Of My Usually Cool, Big-buttocked Female Boss. Unable To Resist Her Tipsy, Melting Face, I Unexpectedly Kissed Her, And She Returned The Favor With Such Intense Kissing Technique That She Thrust Her Tongue Into My Mouth. We Passionately Kissed And Had Unprotected Sex All Night Long, Burning With Passion Again And Again.",https://pic.javct.net/poster/05192026/24fb5eedd7.jpg,https://javct.net/v/lulu-438,155,2026-05-30
FNS-205,"My boss, a moronic female boss who insulted her subordinates by calling them ""small fry,"" was a small fry, so I kept making her ejaculate until she stopped squirting. Mai Tsubasa",https://pic.javct.net/poster/05192026/47095ebe8b.jpg,https://javct.net/v/fns-205,125,2026-05-30
BBAN-506-RM,"A Cheeky New Graduate And A Lesbian Who Missed The Last Train And Shared A Room - Shiori Hamabe, Ema Futaba [Uncensored L**ked]",https://pic.javct.net/poster/20241115/1733454749.jpg,https://javct.net/v/bban-506-rm,140,2026-05-30
START-578-RM,"I met my female boss, who I hate, at a delivery health service...so I booked her for 5 days and had Polynesian sex to turn the tables on her. Mana Sakura [Uncensored L**ked]",https://pic.javct.net/poster/05192026/70287e7ca2.jpg,https://javct.net/v/start-578-rm,127,2026-05-30
START-578,"I met my female boss, who I hate, at a delivery health service...so I booked her for 5 days and had Polynesian sex to turn the tables on her. Mana Sakura",https://pic.javct.net/poster/05192026/70287e7ca2.jpg,https://javct.net/v/start-578,127,2026-05-30
MOND-252-RM,Longing Female Boss And Miho Tsuno [Uncensored L**ked],https://pic.javct.net/poster/20230207/1689997838.jpg,https://javct.net/v/mond-252-rm,130,2026-05-30
REAL-990-RM,"Despite Her Strong Will, She Has The Most Sensitive Nipples. When I Pinched The Nipples Of My Hated Female Boss, She Lost All Reason, Arched Her Back, And Had A Massive Squirting Orgasm!! Sunao Kui [Uncensored L**ked]",https://pic.javct.net/poster/05192026/161c206aea.jpg,https://javct.net/v/real-990-rm,130,2026-05-30
CJOD-516-RM,"My Slutty Sex Friend Who Ruins Me Has A Horny, Voluptuous Body And An Amazing Blowjob And A National Treasure-class Pile-driving Cowgirl Position That Will Keep Me Going No Matter How Many Times I Explode. - Kurea Hasumi [Uncensored L**ked]",https://pic.javct.net/poster/05192026/4cfa8d45d9.jpg,https://javct.net/v/cjod-516-rm,130,2026-05-30
REAL-990,"Despite Her Strong Will, She Has The Most Sensitive Nipples. When I Pinched The Nipples Of My Hated Female Boss, She Lost All Reason, Arched Her Back, And Had A Massive Squirting Orgasm!! Sunao Kui",https://pic.javct.net/poster/05192026/161c206aea.jpg,https://javct.net/v/real-990,130,2026-05-30
LULU-228-RM,"A Female Boss Who Was Strict At Work Invited Me To A Holiday Date And Was Frightened, But When I Was Frightened By The Innocent Off Face That I Showed Only To Me, I Found Out That I Had An Erection Involuntarily And Squeezed My Sperm In A Deca-ass Icharabu Cowgirl Until Morning. Sumire Kurokawa [Uncensored L**ked]",https://pic.javct.net/poster/20230207/1690602212.jpg,https://javct.net/v/lulu-228-rm,160,2026-05-30
CJOD-510,"Whenever My Female Boss Ovulates, She Gets Horny And Wriggles Her Amazing, Voluptuous Body, And With Dirty Talk And Erotic Harassment, She Lets Me Cum Inside Her Once, Twice, Three Times, And This Month Too, She's My Right-hand Man Subordinate JULIA",https://pic.javct.net/poster/05192026/aa9224b5b8.jpg,https://javct.net/v/cjod-510,120,2026-05-30
CJOD-516,"My Slutty Sex Friend Who Ruins Me Has A Horny, Voluptuous Body And An Amazing Blowjob And A National Treasure-class Pile-driving Cowgirl Position That Will Keep Me Going No Matter How Many Times I Explode. - Kurea Hasumi",https://pic.javct.net/poster/05192026/4cfa8d45d9.jpg,https://javct.net/v/cjod-516,130,2026-05-30
JUR-242-SUB,"""I Can't Drink Any More..."" Mary Tachibana, The Female Boss Who Was Fo**ed To Drink In Her Defenseless Pantyhose [English Subtitle]",https://pic.javct.net/poster/20250903/1743698975.jpg,https://javct.net/v/jur-242-sub,130,2026-05-30
MIDE-752-RM,Reverse NTR Overtime That I Can Not Tell My Wife I Was A Slut Until Morning Alone With My Big Boss Female Boss. Kusakabe Kana [Uncensored L**ked],https://pic.javct.net/poster/20253001/1741103518.jpg,https://javct.net/v/mide-752-rm,120,2026-05-30
YOCH-031-RM,"When I called a delivery health service, the woman who came out was the company's female boss. Having grasped my weakness, I also need the actual performance and creampie! Even in the office, she has sex... Yurine Tsukino, 50 years old [Uncensored L**ked]",https://pic.javct.net/poster/04112026/6955605bcd.jpg,https://javct.net/v/yoch-031-rm,118,2026-05-30
YOCH-031,"When I called a delivery health service, the woman who came out was the company's female boss. Having grasped my weakness, I also need the actual performance and creampie! Even in the office, she has sex... Yurine Tsukino, 50 years old",https://pic.javct.net/poster/04112026/6955605bcd.jpg,https://javct.net/v/yoch-031,118,2026-05-30
NXG-437-RM,"When You Go To A Sex Club, You Meet A Girl You Know... Is It Awkward And Embarrassing And Feels Good? In Other Words, It Was The Best Story [Uncensored L**ked]",https://pic.javct.net/poster/20230804/1692934138.jpg,https://javct.net/v/nxg-437-rm,120,2026-05-30
URKK-070-RM,"I Missed The Last Train, But My Part-Time Seniors Stayed With Me... I Couldn't Resist My Boobs Popping Out Of My No Bra Loungewear, And I Fucked Until Dawn! Takarada Monami [Uncensored L**ked]",https://pic.javct.net/poster/20222410/1667618777.jpg,https://javct.net/v/urkk-070-rm,134,2026-05-30
NACR-732-RM,My Usually Strict Female Boss Asks Me To Skip Work! Tsundere Sex Friend! ! Hitomi Mochizuki [Uncensored L**ked],https://pic.javct.net/poster/20231711/1700420875.jpg,https://javct.net/v/nacr-732-rm,132,2026-05-30
ALDN-195-RM,Female President's Libido Narimiya Iroha [Uncensored L**ked],https://pic.javct.net/poster/20230804/1691206261.jpg,https://javct.net/v/aldn-195-rm,125,2026-05-30
FBOS-006-RM,"On A Stormy Night, I'm Alone With My Female Boss, Who Is Trapped In The Company Iroha Narumiya [Uncensored L**ked]",https://pic.javct.net/poster/20230804/1692416382.jpg,https://javct.net/v/fbos-006-rm,120,2026-05-30
DASS-955-RM,"The Female CEO I Admired Had A Huge Penis. Submitting To Power And Cock, I Betrayed My Fiancé In This Complete NTR (Netorare) Story Featuring Marina Ikeda And Hinako Seto. [Uncensored L**ked]",https://pic.javct.net/poster/04112026/8ed5522476.jpg,https://javct.net/v/dass-955-rm,120,2026-05-30
DVAJ-737-RM,"I Used A 'sucker' To Peel Back And Suck On My Spinster Boss's Clitoris, Sucking And Refusing To Let Go. The Sticky Stimulation Kept Her Clitoris Exposed, And I Played With And Kneaded It Until Her Knees Were Shaking And She Was Squirting Like A Slut, Wanting To Cum. - Morisawa Kana [Uncensored L**ked]",https://pic.javct.net/poster/06032026/1775845146.jpg,https://javct.net/v/dvaj-737-rm,150,2026-05-30
MOND-254-RM,Longing Female Boss And Monami Takarada [Uncensored L**ked],https://pic.javct.net/poster/20230804/1692419915.jpg,https://javct.net/v/mond-254-rm,120,2026-05-30
