code,title,image_url,page_url,views,date_scraped
300MIUM-1357-RM,"[Newcomer] Takahashi, if you're aiming to be a career woman, it's better not to have a relationship with a man in the company. If you keep cumming like this and get caught, people will only look at you with erotic eyes. [Uncensored L**ked]",https://pic.javct.net/poster/04112026/1776995940992.jpg,https://javct.net/v/300mium-1357-rm,82,2026-04-28
300MIUM-1357,"[Newcomer] Takahashi, if you're aiming to be a career woman, it's better not to have a relationship with a man in the company. If you keep cumming like this and get caught, people will only look at you with erotic eyes.",https://pic.javct.net/poster/04112026/1776995940992.jpg,https://javct.net/v/300mium-1357,82,2026-04-28
SVVRT-076-RM,"Amateur variety show: A bikini gal who approached me at Shonan Beach gives me a cooling lotion massage experience to cool down my flushed body! Even though the body temperature is supposed to drop, the [secretly mixed aphrodisiac] awakens the sexual desire! Her sensitive nipples and clitoris are played with, and she squirts her crotch incontinence! I succumb to the pleasure and get huge...6 [Uncensored L**ked]",https://pic.javct.net/poster/06032026/1775160938834.jpg,https://javct.net/v/svvrt-076-rm,210,2026-04-28
SVVRT-076,"Amateur variety show: A bikini gal who approached me at Shonan Beach gives me a cooling lotion massage experience to cool down my flushed body! Even though the body temperature is supposed to drop, the [secretly mixed aphrodisiac] awakens the sexual desire! Her sensitive nipples and clitoris are played with, and she squirts her crotch incontinence! I succumb to the pleasure and get huge...6",https://pic.javct.net/poster/06032026/1775160938834.jpg,https://javct.net/v/svvrt-076,210,2026-04-28
SVVRT-074-RM,"Amateur Variety Amateur JD going around the town uses a thick vibrator fishing rod to catch orgasms and immediately gives a blowjob to the hooked fish! Catch a prize fish worth a total of 500,000 yen while being shocked by the punishment game! Enduring the vibrations of the vibrator and the pleasure of the orgasm, the fish turns on! [Uncensored L**ked]",https://pic.javct.net/poster/06032026/1774666597465.jpg,https://javct.net/v/svvrt-074-rm,225,2026-04-28
SVVRT-074,"Amateur Variety Amateur JD going around the town uses a thick vibrator fishing rod to catch orgasms and immediately gives a blowjob to the hooked fish! Catch a prize fish worth a total of 500,000 yen while being shocked by the punishment game! Enduring the vibrations of the vibrator and the pleasure of the orgasm, the fish turns on!",https://pic.javct.net/poster/06032026/1774666597465.jpg,https://javct.net/v/svvrt-074,225,2026-04-28
336KNB-405-RM,"[For the pastime of a wife with beautiful legs and sticky breasts] Before having sex with her husband, she appears in an AV with her boobs swaying and rubbing as an appetizer SEX at Toda Station, Toda City, Saitama Prefecture [Uncensored L**ked]",https://pic.javct.net/poster/06032026/1774513327621.jpg,https://javct.net/v/336knb-405-rm,63,2026-04-28
336KNB-405,"[For the pastime of a wife with beautiful legs and sticky breasts] Before having sex with her husband, she appears in an AV with her boobs swaying and rubbing as an appetizer SEX at Toda Station, Toda City, Saitama Prefecture",https://pic.javct.net/poster/06032026/1774513327621.jpg,https://javct.net/v/336knb-405,63,2026-04-28
MIDE-312-RM,[Reducing Mosaic] Female Teacher in a Tight Skirt Shoko Akiyama [Uncensored L**ked],https://static.javct.net/poster/mide-312.jpg,https://javct.net/v/mide-312-rm,165,2026-04-28
SIRO-5607-RM,Former Underground Idol's Sex Concert Begins Don't miss this lewd idol who is excited by the big dick and clutches the punch microphone and shamelessly shows off her singing voice and moaning voice if it's good [First shot] AV application online AV experience shooting 2524 [Uncensored L**ked],https://pic.javct.net/poster/06032026/1773564629281.jpg,https://javct.net/v/siro-5607-rm,69,2026-04-28
230ORE-460,Suzu-san,https://pic.javct.net/poster/06032026/1773709673.jpg,https://javct.net/v/230ore-460,37,2026-04-28
SIRO-5607,Former Underground Idol's Sex Concert Begins Don't miss this lewd idol who is excited by the big dick and clutches the punch microphone and shamelessly shows off her singing voice and moaning voice if it's good [First shot] AV application online AV experience shooting 2524,https://pic.javct.net/poster/06032026/1773564629281.jpg,https://javct.net/v/siro-5607,69,2026-04-28
200GANA-3345-RM,"Marino-chan, who enjoys sex with any partner, is a Reiwa bitch who doesn't make sex friends. She locks on to sex at the time of ""kipi'' and can't wait. She uses her long beautiful legs to spread her legs wide open and cums with an explosive fingering. Seriously soft girl, first shoot 2269 [Uncensored L**ked]",https://pic.javct.net/poster/06032026/1773030306601.jpg,https://javct.net/v/200gana-3345-rm,79,2026-04-28
200GANA-3345,"Marino-chan, who enjoys sex with any partner, is a Reiwa bitch who doesn't make sex friends. She locks on to sex at the time of ""kipi'' and can't wait. She uses her long beautiful legs to spread her legs wide open and cums with an explosive fingering. Seriously soft girl, first shoot 2269",https://pic.javct.net/poster/06032026/1773030306601.jpg,https://javct.net/v/200gana-3345,79,2026-04-28
AUKG-535-RM,Pantyhose Lesbian Without Panties On. For Lovers Of Fragrant Toes And Shining Beautiful Legs In Pantyhose. [Uncensored L**ked],https://pic.javct.net/poster/20221202/1645853251.jpg,https://javct.net/v/aukg-535-rm,117,2026-04-28
336KNB-402-RM,"[Erotic slender beauty] A slender and beautiful wife who seems to be strong-willed kisses her face and instantly makes her pussy melt (lol) She gets erotically touched by someone else's dick, gets penetrated deep inside, and has an explosive orgasm with a cute voice at Soga, Chiba Prefecture [Uncensored L**ked]",https://pic.javct.net/poster/01202026/1772098355630.jpg,https://javct.net/v/336knb-402-rm,61,2026-04-28
336KNB-402,"[Erotic slender beauty] A slender and beautiful wife who seems to be strong-willed kisses her face and instantly makes her pussy melt (lol) She gets erotically touched by someone else's dick, gets penetrated deep inside, and has an explosive orgasm with a cute voice at Soga, Chiba Prefecture",https://pic.javct.net/poster/01202026/1772098355630.jpg,https://javct.net/v/336knb-402,61,2026-04-28
GVG-666-RM,Spread Em' Race Queen Miyu Amano [Uncensored L**ked],https://pic.javct.net/poster/20222109/1664427789.jpg,https://javct.net/v/gvg-666-rm,120,2026-04-28
ARM-987-RM,A GothL**i's Footjob [Uncensored L**ked],https://static.javct.net/poster/arm-987.jpg,https://javct.net/v/arm-987-rm,105,2026-04-28
MGNL-017-RM,"""What Will Happen If You Receive A Sensitivity-increasing Massage Limited To Amateur Girls Wearing Black Tights?'' Thorough Examination A Naive-looking Girl In Black Tights From The Cooking Club Gets Her Challenging Pressure Points Stimulated, And She Is Confused By The Erotic Amount Of Squirting... A Big Dick... Amazing Splash Tide That Draws A Parabola Every Time It Is Gouged Out... [Uncensored L**ked]",https://pic.javct.net/poster/20241115/1732987949.jpg,https://javct.net/v/mgnl-017-rm,72,2026-04-28
SVERS-003-RM,"If the most evil woman in the history of AV loses, it will be a death match! ! Pirate Empress professional wrestler raising a black flag [Uncensored L**ked]",https://pic.javct.net/poster/01202026/1771197932779.jpg,https://javct.net/v/svers-003-rm,166,2026-04-28
FC2PPV-4848687,"Part 2 Super cute, tall 170 cm beautiful 24 year old beautiful woman with divine style ⇒ Her body was so soft that I fucked her in a Y-shaped balance and let her cum inside (Ayami)",https://pic.javct.net/poster/01202026/1771240147.jpg,https://javct.net/v/fc2ppv-4848687,57,2026-04-28
SVERS-003,"If the most evil woman in the history of AV loses, it will be a death match! ! Pirate Empress professional wrestler raising a black flag",https://pic.javct.net/poster/01202026/1771197932779.jpg,https://javct.net/v/svers-003,166,2026-04-28
DOGD-026,Dog Sniffing Milk Girl Marina Edition Super Breasts x Gross Old Man 2 Marina Akizuki,https://pic.javct.net/poster/01202026/1770485372641.jpg,https://javct.net/v/dogd-026,131,2026-04-28
