code,title,image_url,page_url,views,date_scraped
MIAE-117,M Men's Continuous Ejaculation Cure Spring Massage Salon Honda Cape,https://pic.javct.net/poster/05192026/c4e237e317.jpg,https://javct.net/v/miae-117,150,2026-05-21
BBTU-046-RM,Men'S Puscher  Big Breasts Breasted Tanaka Ne [Uncensored L**ked],https://pic.javct.net/poster/20222109/1665812440.jpg,https://javct.net/v/bbtu-046-rm,97,2026-05-21
FTHTD-178-RM,Monthly Subscription Service We Will Dispatch A Secretary Who Has Been Trained To Squirt! [Uncensored L**ked],https://pic.javct.net/poster/04112026/17a9e9e35a.jpg,https://javct.net/v/fthtd-178-rm,285,2026-05-21
SOE-599-RM,Committed In The Dick! Anna Natsuki [Uncensored L**ked],https://pic.javct.net/poster/06032026/1772953528.jpg,https://javct.net/v/soe-599-rm,120,2026-05-21
NACT-130-RM,"Huge Boobs!! Soft And Plump, Juicy Traveling Soap Girl Chan Yua [Uncensored L**ked]",https://pic.javct.net/poster/05192026/7a19cd6248.jpg,https://javct.net/v/nact-130-rm,120,2026-05-21
NHDTC-202,"A Beautiful Librarian Who Likes Younger Men Secretly Gives A Young Man A Handjob Through A Bookshelf, Making Him Ejaculate, And Then Has Sex With Him While He Tries To Suppress His Moans, Even Letting Him Cum Inside Her.",https://pic.javct.net/poster/05192026/bca5cd703a.jpg,https://javct.net/v/nhdtc-202,175,2026-05-21
UMD-403-RM,Sneaking In! The Rumored Rejuvenating Massage 01 [Uncensored L**ked],https://pic.javct.net/poster/05192026/376c5c4fde.jpg,https://javct.net/v/umd-403-rm,120,2026-05-21
ONED-947-RM,Ejaculation Of Semen And Momentum Shampoo Long Hair Handjob Limited! [Uncensored L**ked],https://pic.javct.net/poster/05192026/317daf1df3.jpg,https://javct.net/v/oned-947-rm,121,2026-05-21
CR-052026-001,A Married Woman Passed Around by Neighborhood Association Leaders in Front of Her Husband,https://pic.javct.net/poster/05192026/51d1c110ea.jpg,https://javct.net/v/cr-052026-001,67,2026-05-21
START-554-RM,"I don't refuse creampie, I don't feel embarrassed, I don't get attached. Mei Miyajima, a bimbo female college student who understands the story best [Uncensored L**ked]",https://pic.javct.net/poster/04112026/ab5b7ec1db.jpg,https://javct.net/v/start-554-rm,137,2026-05-21
OKSN-332-RM,"New Discovery! Gallons Of Breast Milk - Gorgeous H-Cup Colossal Tits & Big Nipples Dripping Breast Milk Are Proof Of Her Pleasure - Curvy, Light-Skinned Body Quivering [Uncensored L**ked]",https://static.javct.net/poster/oksn-332.jpg,https://javct.net/v/oksn-332-rm,119,2026-05-21
HODV-21570-RM,This Horny Hospitality Whore Will Provide You With Extra Special Service And She'll Use Her Slender Body And H-Cup Titties To Treat You Like A God And Bring You To Full Course Ejaculatory Pleasure Miyabi Midorikawa [Uncensored L**ked],https://static.javct.net/poster/hodv-21570.jpg,https://javct.net/v/hodv-21570-rm,135,2026-05-21
NNPJ-339-RM,God-level Handmastered Handjob Genius Who Trained Daily To Make Her Husband Dance!Beauty Big Tits Wife Airi (27 Years Old) AV Debut Nampa JAPAN EXPRESS Vol. 105 [Uncensored L**ked],https://pic.javct.net/poster/05192026/649d180f08.jpg,https://javct.net/v/nnpj-339-rm,150,2026-05-21
TLDC-054-RM,Miss Mens Who Can't Make A Reservation. Secret Surgery To Stop Ejaculation. [Uncensored L**ked],https://pic.javct.net/poster/05192026/9b93f53f89.jpg,https://javct.net/v/tldc-054-rm,65,2026-05-21
SKMJ-412-RM,"Glistening Sun! Erotic Dazzling Swimsuit! Shonan Beach's W Bikini Beauty Gets A Big Prize That Makes You Ejaculate Many Times! Continuous Ejaculation Challenge! In Order To Squeeze Out The Sperm, A Great Erotic Technique Is Activated WW Harem Echiechi Reverse 3P // Tight Pink Sesame ○ Raw Insertion! SP [Uncensored L**ked]",https://pic.javct.net/poster/20230207/1690549130.jpg,https://javct.net/v/skmj-412-rm,122,2026-05-21
ROYD-058-RM,My Older Stepsister Peeled Back My Stuck Foreskin And Washed My Dick - It Turned Me On So Much That We Started Fucking Madoka Shizuki [Uncensored L**ked],https://static.javct.net/poster/royd-058.jpg,https://javct.net/v/royd-058-rm,181,2026-05-21
NOSKN-101-RM,"[ALL Unedited] NO Cut! NO SKIN! Nakadashi! Completely Uncut, Real Creampie Video Yui Tenma [Uncensored L**ked]",https://pic.javct.net/poster/04112026/181d68967d.jpg,https://javct.net/v/noskn-101-rm,143,2026-05-21
FTHTD-197-RM,"A Challenge To Be Hit At The Pool Of A Certain Resort Hotel At Sunset! If The Ring Toss Goes In The 〇〇〇, You Will Get A Prize! ! A Battle Between Excited Girls Who Bravely Take On Challenges Without Thinking About What Will Happen If They Fail! [Uncensored L**ked]",https://pic.javct.net/poster/04112026/04d1a57b7d.jpg,https://javct.net/v/fthtd-197-rm,127,2026-05-21
FNS-192-RM,"In Order To Revive The Taste Of Her Late Grandfather... An Apprentice Who Trains At A Ramen Shop While Enduring Sexual Harassment On A Daily Basis In A World Full Of Men. Nene Yoshitaka Works 17 Hours A Day And Earns 1,175 Yen Per Hour (overtime Is Not Included). [Uncensored L**ked]",https://pic.javct.net/poster/04112026/badb7af326.jpg,https://javct.net/v/fns-192-rm,120,2026-05-21
FTHT-339-RM,"If Your Pants Get Stained, Go Out Immediately! Women Who Participated As Monitors For A Certain Underwear Manufacturer Will Get A Reward If They Become M-shaped And Endure The Relentless Attacks! ! ! How Many People Can Endure It? ? [Limited Distribution Vol.2] [Uncensored L**ked]",https://pic.javct.net/poster/04112026/68a036b605.jpg,https://javct.net/v/ftht-339-rm,0,2026-05-21
FTKD-039-RM,"[Live-action Adaptation] Ryoko, A Former Classmate Who Loves Sex Friends And Sex. Starring Kyoko Maki Original Work Eda [Uncensored L**ked]",https://pic.javct.net/poster/04112026/9a16d7adfd.jpg,https://javct.net/v/ftkd-039-rm,135,2026-05-21
FTHTD-173-RM,Cross-dressing Couple Street Lesbian Cum-swallowing Date Yui Tenma Satsuki Toyooka [Uncensored L**ked],https://pic.javct.net/poster/04112026/1f6de293cb.jpg,https://javct.net/v/fthtd-173-rm,185,2026-05-21
FTHTD-186-RM,"Volunteer Club Does Volunteer Work At A Nursing Home! In Order To Eliminate The Sexual Desire Of A Pale Old Man, He Dedicates Himself To Bubbles With A Bright And Fun Soap Practical Training! ! [Uncensored L**ked]",https://pic.javct.net/poster/04112026/59d56f417c.jpg,https://javct.net/v/fthtd-186-rm,123,2026-05-21
NACT-130,"Huge Boobs!! Soft And Plump, Juicy Traveling Soap Girl Chan Yua",https://pic.javct.net/poster/05192026/7a19cd6248.jpg,https://javct.net/v/nact-130,120,2026-05-21
