code,title,image_url,page_url,views,date_scraped
FC2PPV-4878776,I took a sex video of a beautiful girl with glasses while taking a photo [Super value pack],https://pic.javct.net/poster/04112026/23b5ab9b51.jpg,https://javct.net/v/fc2ppv-4878776,91,2026-04-30
MDE-169-RM,Digital Mosaic Vol.028 Hijiri Kayama [Uncensored L**ked],https://pic.javct.net/poster/04112026/7d49ba5970.jpg,https://javct.net/v/mde-169-rm,106,2026-04-30
MDE-207-RM,Dream Woman vol.29 Hijiri Kayama [Uncensored L**ked],https://pic.javct.net/poster/04112026/145e73c5f2.jpg,https://javct.net/v/mde-207-rm,96,2026-04-30
EKW-080-RM,"Today, I Want Her To Jack Me Off. An Mitsumi [Uncensored L**ked]",https://pic.javct.net/poster/20221904/1653628260.jpg,https://javct.net/v/ekw-080-rm,120,2026-04-30
WFR-020-RM,"Ejaculation Control By Endlessly Teasing And Not Teasing His Sensitive Nipples And Dick, Which Is Prone To Premature Ejaculation, And Then Stopping Just In Time. Ran Mukai [Uncensored L**ked]",https://pic.javct.net/poster/20221202/1648196461.jpg,https://javct.net/v/wfr-020-rm,63,2026-04-30
MIAE-136,"Great Handjob With Amazing Ejaculation, Full Erection Beauty Salon Shinoda Yu",https://pic.javct.net/poster/04112026/8df6eb4eb2.jpg,https://javct.net/v/miae-136,120,2026-04-30
AGMX-257,Specializing In Drool! A Handjob With A Drooling Tongue Kiss That Will Make You Drown In Saliva,https://pic.javct.net/poster/04112026/c2ad23516f.jpg,https://javct.net/v/agmx-257,120,2026-04-30
AGMX-258,Pull It Out With Your Face!! Close-up Face-to-face Subjective Blowjob 2,https://pic.javct.net/poster/04112026/3aac6e628d.jpg,https://javct.net/v/agmx-258,103,2026-04-30
MDLD-127-RM,Kiyoshi Kayama Brain Juice System [Masturbation Support] [Uncensored L**ked],https://pic.javct.net/poster/04112026/fc599865b1.jpg,https://javct.net/v/mdld-127-rm,120,2026-04-30
MDLD-140-RM,I Slut To**ure Is The Inverse Of St. Kayama Life Imprisonment Love Of Your Pet Slut [Uncensored L**ked],https://pic.javct.net/poster/04112026/09997541e3.jpg,https://javct.net/v/mdld-140-rm,100,2026-04-30
FC2PPV-4889416,[Individual shot] Raw creampie to a smiling H-cup beauty,https://pic.javct.net/poster/04112026/8f04892b96.jpg,https://javct.net/v/fc2ppv-4889416,39,2026-04-30
1P-042926-001,PtoM SEX: Karen Tanaka,https://pic.javct.net/poster/04112026/6b04b64ec0.jpg,https://javct.net/v/1p-042926-001,60,2026-04-30
PA-042926-100,"A beautiful mature insurance agent, pressured by a client, gets serious and begs him to cum inside her",https://pic.javct.net/poster/04112026/85f88bfef2.jpg,https://javct.net/v/pa-042926-100,60,2026-04-30
FC2PPV-4889477,"[Individual shot face showing] Even after the sex was finished, I was still looking for a cock, so I gave him a cleaning blowjob in the middle of the shower and ejaculated in his mouth.",https://pic.javct.net/poster/04112026/491413831a.jpg,https://javct.net/v/fc2ppv-4889477,14,2026-04-30
FTHTD-175-RM,A Beauty Salon That Sells Aroma Candles Filled With Aphrodisiac Ingredients! The Women Who Can't Control Themselves And Make A Face Repeatedly Cum On Instinct! [Uncensored L**ked],https://pic.javct.net/poster/04112026/89eb6c0e14.jpg,https://javct.net/v/fthtd-175-rm,250,2026-04-30
EKW-078-RM,"Today, I Want Her To Jack Me Off. Yuria Yoshine [Uncensored L**ked]",https://pic.javct.net/poster/20221202/1645866535.jpg,https://javct.net/v/ekw-078-rm,115,2026-04-30
FNS-197-RM,"I Had An Affair With My Son's Daycare Worker Through A Dating Site... After A Chance Encounter On A Matching App, I Crossed The Line And Had Secret Sex Over And Over Again, Goddess Jun. [Uncensored L**ked]",https://pic.javct.net/poster/04112026/bc334a66ce.jpg,https://javct.net/v/fns-197-rm,115,2026-04-30
STCV-596-RM,On The Verge Of Fainting From Excessive Toy To**ure! Uterus Collapse Ohoiki SEX @ Samitan (tentative) [Uncensored L**ked],https://pic.javct.net/poster/04112026/b91d92fcd9.jpg,https://javct.net/v/stcv-596-rm,71,2026-04-30
ANB-257-RM,I Became My Mother's Toy. The Carnal Desires Of My Lovely And Lewd Beautiful Stepmother! Mio Aizawa [Uncensored L**ked],https://pic.javct.net/poster/04112026/37341e5168.jpg,https://javct.net/v/anb-257-rm,115,2026-04-30
FTK-042-RM,[Live-action Adaptation] Onatomo. A Story About How My Room Became The Masturbation Room Of A Girl In My Class. Part 1 Starring Konatsu Kashiwagi/Miyu Aizawa Original Work Hiyamakura [Uncensored L**ked],https://pic.javct.net/poster/04112026/8a78cdb99c.jpg,https://javct.net/v/ftk-042-rm,0,2026-04-30
FTHTD-204-RM,A Trainee Dispatched To A Hospital That Is Going Out Of Business ~ Until A Bright And Energetic Trainee Falls For A Female ~ [Uncensored L**ked],https://pic.javct.net/poster/04112026/926a2f82b1.jpg,https://javct.net/v/fthtd-204-rm,151,2026-04-30
FTHTD-201-RM,"[Live-action Version] The Egg Girl, Starring Hinako Matsui, Original Story By Oretaro [Uncensored L**ked]",https://pic.javct.net/poster/04112026/3f893abcd8.jpg,https://javct.net/v/fthtd-201-rm,135,2026-04-30
STCVS-046-RM,[The Signboard Girl Is Onaho-chan] (1) Relaxing Regular Customers Who Are Tired From Work! (2) We Deliver Energy To Our Customers' Homes! (3) We Greet Customers Who Have Heard The Rumors And Come To Us With A Smile! (4)Very Crowded With Customers! I Will Serve Two People At The Same Time! [Delusion Erotic Man #Yui] [Uncensored L**ked],https://pic.javct.net/poster/04112026/3759765f17.jpg,https://javct.net/v/stcvs-046-rm,143,2026-04-30
STCVS-047-RM,"[Welcome To The Sexual Desire Monster Share House 2] ~ Sluts Are Targeting Your Penis All The Time ~ ① ""Himari"" With Fair Skin And Big Breasts Who Attacks You When You Wake Up ② ""Rika"", A Soft-breasted Gal Who Doesn't Care Even In The Shower ③ ""Rie"", A Model-shaped Beauty Who Comes Home And Immediately Joins In Sex [Delusion Erotic Man #Himari & Rie & Rika] [Uncensored L**ked]",https://pic.javct.net/poster/04112026/1fd880c242.jpg,https://javct.net/v/stcvs-047-rm,146,2026-04-30
