code,title,image_url,page_url,views,date_scraped
GVG-794-RM,"Bride With My Father And Father, Close-in Cum Embroidering Male Ohsumi Manami [Uncensored L**ked]",https://pic.javct.net/poster/05192026/ad985c7fa0.jpg,https://javct.net/v/gvg-794-rm,120,2026-05-24
T28-496,"Day Absent Parents, I Was Unreasonable SEX And Sister. Public Figures AyumiMinoru",https://pic.javct.net/poster/05192026/ff96b7d301.jpg,https://javct.net/v/t28-496,140,2026-05-24
DLIS-015,Crazy Devil Family Flocking To Irresistible Girl Winter Love Thing,https://pic.javct.net/poster/05192026/edb7ff1e73.jpg,https://javct.net/v/dlis-015,121,2026-05-24
HONE-277-RM,"Yuko Shiraki, A Mother Who Became A Nipple Iki Addiction After Being Attacked By A No Bra Floating Nipple [Uncensored L**ked]",https://pic.javct.net/poster/20222410/1667444370.jpg,https://javct.net/v/hone-277-rm,120,2026-05-24
ALDN-586-RM,My Mother-in-law Is Much Better Than My Wife... Mizuno Yuuka [Uncensored L**ked],https://pic.javct.net/poster/05192026/a33e841a22.jpg,https://javct.net/v/aldn-586-rm,140,2026-05-24
HUNTC-514,"""Punishment Game With Big Brother"" Begins! This Is A Punishment Game Where The Sister And Her Friends Barge Into The Room Of Their Brother, Who Is Usually Considered Creepy, And Suddenly Show Him Their Underwear! 2 It Escalates Even Further",https://pic.javct.net/poster/05192026/73be4c7fbf.jpg,https://javct.net/v/huntc-514,200,2026-05-24
HUNTC-462,"""That's Not Nearly Enough! Don't Hold Back, Just Thrust As Much As You Want, Since I'm A **d!"" While Taking A Bath With My Sister, She Hugged Me Tightly While Giving Me A Passionate French Kiss That Would Put Adults To Shame...4",https://pic.javct.net/poster/05192026/f5d81c1eab.jpg,https://javct.net/v/huntc-462,230,2026-05-24
BKD-312-RM,Mother-to-c**ld Copulation [Kurabuchi Onsen Road] Momo Saejima [Uncensored L**ked],https://pic.javct.net/poster/20230207/1689391184.jpg,https://javct.net/v/bkd-312-rm,120,2026-05-24
YSN-604-RM,It Is Kept By The Brother Of A C**ld Uncle Who Is Stupid But Has A Strong Libido. Mifune Misuzu [Uncensored L**ked],https://pic.javct.net/poster/20230207/1690522002.jpg,https://javct.net/v/ysn-604-rm,100,2026-05-24
STARS-015-RM,Takeda Yume Who Is Cute With The Highest Is Becoming Your Sister Of Anata Love Love Incest Life [Uncensored L**ked],https://pic.javct.net/poster/20243105/1719524335.jpg,https://javct.net/v/stars-015-rm,135,2026-05-24
STAR-987-RM,SODstar Mahiro Yuii 18 Years Old Erokawa Niece And Yakko Roll ◆ 3 Nights 4 Days Joint Activity [Uncensored L**ked],https://pic.javct.net/poster/20240807/1722325183.jpg,https://javct.net/v/star-987-rm,120,2026-05-24
SNOS-254-RM,"Hey Bro, Sorry! I Called A Call Girl And My Sister-in-law Showed Up... Her L-cup Boobs Were So Amazing That I Pounded Her Long-neglected Pussy Like Crazy And Turned Her Into The Best Slutty Wife Ever Lol Washio Mei [Uncensored L**ked]",https://pic.javct.net/poster/05192026/6053bd98e7.jpg,https://javct.net/v/snos-254-rm,140,2026-05-24
ALDN-586,My Mother-in-law Is Much Better Than My Wife... Mizuno Yuuka,https://pic.javct.net/poster/05192026/a33e841a22.jpg,https://javct.net/v/aldn-586,140,2026-05-24
IBW-565Z-RM,"Parent Is Not The Day, I Was With My Sister All Day Anal SEX Madhesh.Riona Minami [Uncensored L**ked]",https://pic.javct.net/poster/05192026/bdb24c04db.jpg,https://javct.net/v/ibw-565z-rm,150,2026-05-24
KSBJ-084,Sparta Sex Education Of Intelligent Mom Reiko Sawamura,https://pic.javct.net/poster/05192026/d3cdf342cd.jpg,https://javct.net/v/ksbj-084,122,2026-05-24
VENX-224-RM,Beautiful Aunt Izumi Yamagishi Who Is Unconscious Of The Smell Of A Female Who Unconsciously Provokes Me With Unprotected Erotica [Uncensored L**ked],https://pic.javct.net/poster/20230207/1690522549.jpg,https://javct.net/v/venx-224-rm,100,2026-05-24
T28-385-RM,First Love ~ Asami And Mizuki ~ [Uncensored L**ked],https://pic.javct.net/poster/06032026/1773720830.jpg,https://javct.net/v/t28-385-rm,150,2026-05-24
RTP-093-RM,"Without Knowing That Seen In The Younger Sister, My In Immersed In The Virtual Masturbation VR Which Got.If I Feel That Touch The Ji ○ Port To Someone Realistically Remove The Goggles ...! ?Sister To Co ○ Ma Wet ""I Real Better Is Feeling Good"" While Squeezing My Ji ○ Port ...! [Uncensored L**ked]",https://pic.javct.net/poster/05192026/a200fe88db.jpg,https://javct.net/v/rtp-093-rm,125,2026-05-24
STAR-986-RM,Awesome And Cute Aoyama Darling Becomes The Sister Of Your Best Love Love Incest Life [Uncensored L**ked],https://pic.javct.net/poster/05192026/0b3bb67eee.jpg,https://javct.net/v/star-986-rm,135,2026-05-24
SKMJ-750,"Forbidden Real Incest: When A Beautiful Brother And Sister Take On A Sex Mission...the Incredibly Horny Brother Gets Seriously Aroused! Ignoring His Sister's Bewildered Plea Of ""I Can't Tell Mom!"", He Thrusts His Hips Like Crazy! He Mercilessly Attacks His Sister, Who Is Exhausted From Convulsing From Too Many Orgasms, And Ejaculates Inside Her Again And Again And Again! 7",https://pic.javct.net/poster/05192026/9a6d10c9c9.jpg,https://javct.net/v/skmj-750,267,2026-05-24
SNOS-254,"Hey Bro, Sorry! I Called A Call Girl And My Sister-in-law Showed Up... Her L-cup Boobs Were So Amazing That I Pounded Her Long-neglected Pussy Like Crazy And Turned Her Into The Best Slutty Wife Ever Lol Washio Mei",https://pic.javct.net/poster/05192026/6053bd98e7.jpg,https://javct.net/v/snos-254,140,2026-05-24
IBW-496Z-RM,And Sister Incest Trip Secret To Parent Suzuka 1  Talent [Uncensored L**ked],https://pic.javct.net/poster/20222612/1673395693.jpg,https://javct.net/v/ibw-496z-rm,120,2026-05-24
DVAJ-183-RM,It Is Fucked The Girl Doll-two Father-in-law ...  Aoi Akane [Uncensored L**ked],https://pic.javct.net/poster/20222612/1673889965.jpg,https://javct.net/v/dvaj-183-rm,125,2026-05-24
ABP-862-RM,My Saffle Is The Same Sister Who Attends The Same School I Can Not Say To Anyone Secret Secret Affair Of My Sister And Asuka Kawai [Uncensored L**ked],https://pic.javct.net/poster/05192026/73fb0de85f.jpg,https://javct.net/v/abp-862-rm,190,2026-05-24
