code,title,image_url,page_url,views,date_scraped
NVH-078-RM,A Natural Futanari Beauty's Penis And Clitoris Are Devoured By Her Transsexual Lesbian Tutor Hanamiya Hime/Wakamiya Hazuki [Uncensored L**ked],https://pic.javct.net/poster/04112026/4e204da5db.jpg,https://javct.net/v/nvh-078-rm,160,2026-05-14
PKPD-419-RM,Female Amateur Pornographer Mika And Lesbian Actresses: A Genuine Lovemaking Session With Yura Kana. [Uncensored L**ked],https://pic.javct.net/poster/04112026/fe3eaa18cc.jpg,https://javct.net/v/pkpd-419-rm,130,2026-05-14
SORA-107,Exposure To**ure Holy Water Lesbian Forest Halla × Aoi MurasakiMinoru,https://pic.javct.net/poster/04112026/6d62f31bd4.jpg,https://javct.net/v/sora-107,120,2026-05-14
XVSR-282,Hibiki Otsuki VS Hatano Yui Ikase Battle Royale - No Scripts · Gachinko Confrontation Without Any Omission! !~,https://pic.javct.net/poster/04112026/7f21c8ac0c.jpg,https://javct.net/v/xvsr-282,110,2026-05-14
JUFD-178,Haruna ~ Azumi Mizushima-Gi-Oh Glossy Distortion Of Two Gorgeous Babes - Soft Body Soap Heaven,https://pic.javct.net/poster/04112026/09920063c9.jpg,https://javct.net/v/jufd-178,180,2026-05-14
PIYO-063,[The Pervert Desire Of A Young Lady] The Intellectual Girl Who Serves As The Student Council President Loves Delusions As She Masturbates By Imagining Female Big Boobs. A Real Awakening To Lesbians! ? Indecent And Vulgar Enough To Imagine From An Elegant Atmosphere ... And This Nasty Bristle,https://pic.javct.net/poster/04112026/ca0552007e.jpg,https://javct.net/v/piyo-063,170,2026-05-14
JUC-480,Sakiko Mihara Azumi Mizushima ~ Trap Depths Of The Mother-in-law Mother-in-law Wife Tremble With Jealousy - Lesbian To**ure,https://pic.javct.net/poster/04112026/f7f5f4d29a.jpg,https://javct.net/v/juc-480,110,2026-05-14
BOKO-038,"Wanting To Get To Know Each Other Better, Two Close Friends Spend A Two-day, One-night Date Where They Eat, Shower, And Kiss A Lot Until Morning, Discovering Feelings Of Love They Didn't Know They Had. - Meru Adachi & Nana Kisaki",https://pic.javct.net/poster/04112026/e777903f80.jpg,https://javct.net/v/boko-038,172,2026-05-14
PKPD-419,Female Amateur Pornographer Mika And Lesbian Actresses: A Genuine Lovemaking Session With Yura Kana.,https://pic.javct.net/poster/04112026/fe3eaa18cc.jpg,https://javct.net/v/pkpd-419,130,2026-05-14
KSDO-006-RM,This Massage Oil Is Squirting Rezuesute Two Erogenous A Female Ejaculation [Uncensored L**ked],https://pic.javct.net/poster/04112026/6067ee667d.jpg,https://javct.net/v/ksdo-006-rm,200,2026-05-14
DANDY-877-RM,"Women's Love Is Rapidly Increasing Among Female College Students! ? Verification Suddenly Berokisu! Lesbian Bitch Chained Sex ""Please Introduce A Lesbian Friend Who Is More Erotic Than You"" VOL.2 [Uncensored L**ked]",https://pic.javct.net/poster/20230804/1694057041.jpg,https://javct.net/v/dandy-877-rm,239,2026-05-14
VIPR-076-RM,Erica Sato Invades A Shady AV Shoot!! Erika Sato [Uncensored L**ked],https://pic.javct.net/poster/04112026/e3714f871a.jpg,https://javct.net/v/vipr-076-rm,60,2026-05-14
JUY-318-RM,Kanae Matsuyuki Is Lifting Her Lesbian Ban!! Her Unspeakable Days Of Love And Lust An Immoral Married Woman Lesbian Series [Uncensored L**ked],https://pic.javct.net/poster/20253001/1739033457.jpg,https://javct.net/v/juy-318-rm,119,2026-05-14
AUKG-650-RM,Big-breasted Mature Beauty Sex Friend Training ~Jealousy-fueled Love-hungry Confinement Lesbian~ [Uncensored L**ked],https://pic.javct.net/poster/04112026/3b49da05d9.jpg,https://javct.net/v/aukg-650-rm,120,2026-05-14
DVDES-395-RM,Reversal Of The Relationship Between Teachers And Students! 6 Lesbian Gakuen Abstinence [Uncensored L**ked],https://pic.javct.net/poster/04112026/7d590e499d.jpg,https://javct.net/v/dvdes-395-rm,130,2026-05-14
JUR-738-RM,"Madonna's Exclusive Model, Okimiya Nami, Is Now Lesbian!! I Thought We Were Just Playing Around, But My Stepdaughter Turned Out To Be A Lesbian ~She Played With My Sensitive Weak Spot (nipples), And Before I Knew It, My Body And Soul Were Completely Captivated By Her.~ [Uncensored L**ked]",https://pic.javct.net/poster/04112026/5e76c2c60a.jpg,https://javct.net/v/jur-738-rm,110,2026-05-14
AUKG-650,Big-breasted Mature Beauty Sex Friend Training ~Jealousy-fueled Love-hungry Confinement Lesbian~,https://pic.javct.net/poster/04112026/3b49da05d9.jpg,https://javct.net/v/aukg-650,120,2026-05-14
BBAN-582-RM,"The Teased Character Is Hoping For More Erotic Teasing. A Love Triangle Lesbian With Lots Of Passionate Lovemaking, Squirting Orgasms, And Multiple Orgasms. Amou Ririka, Tenma Yui, Miki Hinano [Uncensored L**ked]",https://pic.javct.net/poster/04112026/db26f1cce3.jpg,https://javct.net/v/bban-582-rm,120,2026-05-14
BBAN-584-RM,The Ultimate Masochistic Awakening Training Lesbian That Drowns Women In Shame And Pleasure [Uncensored L**ked],https://pic.javct.net/poster/04112026/0904dffeb9.jpg,https://javct.net/v/bban-584-rm,200,2026-05-14
NVH-078,A Natural Futanari Beauty's Penis And Clitoris Are Devoured By Her Transsexual Lesbian Tutor Hanamiya Hime/Wakamiya Hazuki,https://pic.javct.net/poster/04112026/4e204da5db.jpg,https://javct.net/v/nvh-078,160,2026-05-14
DASS-893-RM,"Lesbianism Is Now Permitted. Loving, Agonizing, And Wanting To Be A Mess. Emotionally Raw Lesbians: Nanami Nami, Miyanishi Hikaru [Uncensored L**ked]",https://pic.javct.net/poster/04112026/bd4243e4c5.jpg,https://javct.net/v/dass-893-rm,180,2026-05-14
BBAN-583-RM,"Intense, Sweaty, And Juicy Lesbian Sex Between Mature Women! A Passionate, Sensual Sexual Encounter With That Woman You've Been Longing For. [Uncensored L**ked]",https://pic.javct.net/poster/04112026/c8841769d5.jpg,https://javct.net/v/bban-583-rm,170,2026-05-14
START-276-SUB,"Yotsuba Kominato X Riko Hoshino, The Two Top SODstars With Sensitive Constitutions, Co-star For The First Time, Lesbian Debut, Double Creampie, Liberation Cheat Day After Abstinence [English Subtitle]",https://pic.javct.net/poster/20253001/1740417005.jpg,https://javct.net/v/start-276-sub,170,2026-05-14
DANDY-873-RM,A Senior CA Is A Lesbian? ! A Rookie Cabin Attendant Who Felt Lesbian Harassment While Rubbing Her Breasts At Work [Uncensored L**ked],https://pic.javct.net/poster/20230804/1692853680.jpg,https://javct.net/v/dandy-873-rm,199,2026-05-14
