code,title,image_url,page_url,views,date_scraped
SIMA-037-RM,mountain stream [Uncensored L**ked],https://pic.javct.net/poster/04112026/186603ad3e.jpg,https://javct.net/v/sima-037-rm,75,2026-05-21
FC2PPV-4903757,"Face Showing Case #133 An amateur comes to do naughty things - An-chan (20) in red lingerie, sexy route, both legs exposed and vibrator to**ure",https://pic.javct.net/poster/05192026/2f434bcb66.jpg,https://javct.net/v/fc2ppv-4903757,56,2026-05-21
NHDTA-383-RM,"Drawing Model Wife Which Was Fed Aphrodisiac Juice Drips Stand ""asking For Sex"" Just Seen A Naked Woman [Uncensored L**ked]",https://pic.javct.net/poster/05192026/d65926d975.jpg,https://javct.net/v/nhdta-383-rm,200,2026-05-21
XRW-653-RM,"To Tell The Truth, I Like The Smell Of Smell. Sakuragi Yuuki Sound [Uncensored L**ked]",https://pic.javct.net/poster/05192026/c9638a7b8f.jpg,https://javct.net/v/xrw-653-rm,148,2026-05-21
SIMA-037,mountain stream,https://pic.javct.net/poster/04112026/186603ad3e.jpg,https://javct.net/v/sima-037,75,2026-05-21
SEND-47-RM,Another B ★ Jean Amount Of Star [Uncensored L**ked],https://pic.javct.net/poster/04112026/32ead47d2a.jpg,https://javct.net/v/send-47-rm,135,2026-05-21
VENX-370-RM,"""Are you excited by your aunt's underwear?"" Aunt Reimi Saegusaki squeezes out every drop of her nephew's sperm with freshly taken off panties [Uncensored L**ked]",https://pic.javct.net/poster/04112026/fbb3881706.jpg,https://javct.net/v/venx-370-rm,99,2026-05-21
VENX-370,"""Are you excited by your aunt's underwear?"" Aunt Reimi Saegusaki squeezes out every drop of her nephew's sperm with freshly taken off panties",https://pic.javct.net/poster/04112026/fbb3881706.jpg,https://javct.net/v/venx-370,99,2026-05-21
RCTD-547-RM,"When I Changed Jobs To A Small Women's Underwear Maker, I Was The Only One Who Was Popular With Men. [Uncensored L**ked]",https://pic.javct.net/poster/20230908/1694497608.jpg,https://javct.net/v/rctd-547-rm,146,2026-05-21
SAP-005-RM,Yua PUSSY & HIP [Uncensored L**ked],https://pic.javct.net/poster/04112026/88fe77063a.jpg,https://javct.net/v/sap-005-rm,190,2026-05-21
JUR-303-SUB,I Asked The Busty Wife Next Door Who Was Weak To Pressure To Be An Underwear Model Monitor... Rena Fukiishi [English Subtitle],https://pic.javct.net/poster/20250903/1742496150.jpg,https://javct.net/v/jur-303-sub,130,2026-05-21
SON-130,Obscene Lingerie × Pheromone Sexual Intercourse,https://pic.javct.net/poster/04112026/703ba35bec.jpg,https://javct.net/v/son-130,130,2026-05-21
NACR-737-RM,Oil Mania Monami Takarada [Uncensored L**ked],https://pic.javct.net/poster/20231711/1701712096.jpg,https://javct.net/v/nacr-737-rm,122,2026-05-21
MIDE-132,SEX Nishikawa Yui Stuffing Rises Go Up At The Same Time,https://pic.javct.net/poster/04112026/2a0be0d288.jpg,https://javct.net/v/mide-132,150,2026-05-21
NACR-735-RM,"Leave It To Erika Ozaki. Counseling Room For Any Concerns You May Have. ""For Cherry University Students.'' [Uncensored L**ked]",https://pic.javct.net/poster/20231711/1701712231.jpg,https://javct.net/v/nacr-735-rm,123,2026-05-21
SCOP-594,Large Carefully Selected Only Mother-of-sex Milk From The Manly And Married Ladies That The SCOOP Group Has Taken So Far! !Boobs Heaven Even This Is SP Best! !,https://pic.javct.net/poster/04112026/df223fb4ac.jpg,https://javct.net/v/scop-594,240,2026-05-21
DV-576-RM,Lingerie Queen Kaede Matsushima [Uncensored L**ked],https://pic.javct.net/poster/04112026/45cc32a1dc.jpg,https://javct.net/v/dv-576-rm,120,2026-05-21
BOKD-074,Contest Of A Dream!Too NH Akari Yukino Kawai Too This Looks Our Otokonoko Beautiful Transvestite Daughter Rindoru Hoshikawa,https://pic.javct.net/poster/04112026/54d43d6c6a.jpg,https://javct.net/v/bokd-074,150,2026-05-21
NGOD-337-RM,"Lingerina, The Principal Of A Prestigious Private Girls' School, Is Stripped Naked By A Parent's Enormous Penis And Exposed For Backdoor Admissions. [Uncensored L**ked]",https://pic.javct.net/poster/04112026/7e74d0f870.jpg,https://javct.net/v/ngod-337-rm,120,2026-05-21
WANZ-191,One Flower Lingerie Na,https://pic.javct.net/poster/04112026/fa6258ee5f.jpg,https://javct.net/v/wanz-191,120,2026-05-21
PMGG-028-RM,"Breast milk, sperm, squirting, random ejaculation! ! A divine episode called off paco with a lewd slut erotic streamer ♂! ? As a result of the otaku dick going out of control with her beautiful big breasts and ass → ""Akan...I love this dick...it's buggy...//"" Anal creampie anal fuck with inevitable buzz! [Nel-chan] Aoyama Nell [Uncensored L**ked]",https://pic.javct.net/poster/04112026/df5f923972.jpg,https://javct.net/v/pmgg-028-rm,66,2026-05-21
HUNT-630-RM,I Substitute And Manager Of The Club Room Alone For A Million Years.I Was A Manager Of Wetting Bloomsbury Dumped Heavy Rain On The Way Home Suddenly Comes Back To The Club Room! I Saw The Manager See-through Underwear Is Wet Erection Involuntarily. [Uncensored L**ked],https://pic.javct.net/poster/01202026/1772066121.jpg,https://javct.net/v/hunt-630-rm,240,2026-05-21
CKW-002-RM,"It Was Always Decided That I Would Be Called During My Lunch Break. But... Ejaculation Is 9 Hours Later. Moreover, It Is Blamed Immediately After That. And In The End, Continuous Shooting Sex Himari Kinoshita [Uncensored L**ked]",https://pic.javct.net/poster/20230804/1692933674.jpg,https://javct.net/v/ckw-002-rm,128,2026-05-21
NGOD-337,"Lingerina, The Principal Of A Prestigious Private Girls' School, Is Stripped Naked By A Parent's Enormous Penis And Exposed For Backdoor Admissions.",https://pic.javct.net/poster/04112026/7e74d0f870.jpg,https://javct.net/v/ngod-337,120,2026-05-21
