code,title,image_url,page_url,views,date_scraped
HODV-21515-RM,"Thank You For Your Nomination. I'm Reika Hashimoto, A Newcomer Soap Lady. [Uncensored L**ked]",https://pic.javct.net/poster/04112026/1777000783.jpg,https://javct.net/v/hodv-21515-rm,150,2026-04-24
RCT-913,Busty Amateur Nudobura Balloon-breaking Game,https://pic.javct.net/poster/04112026/1776935058.jpg,https://javct.net/v/rct-913,120,2026-04-24
HMGL-176,Embarrassing Body # Shortcut Rookie Tojo Rin,https://pic.javct.net/poster/04112026/1776913137.jpg,https://javct.net/v/hmgl-176,140,2026-04-24
MIAA-265-RM,Ultra-luxury Creampie Special Soap Imai Natsuho [Uncensored L**ked],https://pic.javct.net/poster/20241804/1716454162.jpg,https://javct.net/v/miaa-265-rm,150,2026-04-24
NACR-714-RM,Part-time Job That Allows Girls With Unparalleled Sexual Desire To Be Creampied Satsuki Toyooka [Uncensored L**ked],https://pic.javct.net/poster/20230908/1696478823.jpg,https://javct.net/v/nacr-714-rm,123,2026-04-24
390JNT-118-RM,"[Dramatic massive squirting] [Fair-skinned F-breasted slender × Unauthorized creampie] [Adult immoral lingerie sex] A beautiful wife who was cheated on by her husband gets revenge by having sex and squirts a large amount of squirt in an unusual sexual intercourse and cums again and again without permission - [Masami, 29 years old, 3rd year of marriage] #36 [Uncensored L**ked]",https://pic.javct.net/poster/04112026/1776653097778.jpg,https://javct.net/v/390jnt-118-rm,116,2026-04-24
MIAA-303-RM,Ultra-luxury Cream Pie Specialty Soap Ichika Matsumoto [Uncensored L**ked],https://pic.javct.net/poster/20241115/1733386891.jpg,https://javct.net/v/miaa-303-rm,120,2026-04-24
CLUB-445,Lower-body Touch NG's Sekikaba Captures The Actual Situation Of Vulgar Customers Who Sk**lfully Wards Girls Who Enter The Store And Went Through The Production!Four,https://pic.javct.net/poster/04112026/1776668430.jpg,https://javct.net/v/club-445,200,2026-04-24
390JNT-118,"[Dramatic massive squirting] [Fair-skinned F-breasted slender × Unauthorized creampie] [Adult immoral lingerie sex] A beautiful wife who was cheated on by her husband gets revenge by having sex and squirts a large amount of squirt in an unusual sexual intercourse and cums again and again without permission - [Masami, 29 years old, 3rd year of marriage] #36",https://pic.javct.net/poster/04112026/1776653097778.jpg,https://javct.net/v/390jnt-118,116,2026-04-24
XVSR-801-SUB,Dirty Mouth: Tens Of Thousands Of Dicks In Her Mouth!? Amazing Blowjob Technique Leads To Unstoppable Ejaculation! Amiri Saito [English Subtitle],https://pic.javct.net/poster/20253001/1740762051.jpg,https://javct.net/v/xvsr-801-sub,110,2026-04-24
DV-736-RM,Double Eros Style [Uncensored L**ked],https://pic.javct.net/poster/04112026/1776630321.jpg,https://javct.net/v/dv-736-rm,120,2026-04-24
MIGD-579,Suo Yukiko Out In Full Uncut Intrinsic,https://pic.javct.net/poster/04112026/1776591370.jpg,https://javct.net/v/migd-579,150,2026-04-24
XRW-614-RM,"Excited A Man Unconsciously, A Floating Bra That Has Been Committed Waka Otoko Tenki Yu [Uncensored L**ked]",https://pic.javct.net/poster/20230205/1683574161.jpg,https://javct.net/v/xrw-614-rm,120,2026-04-24
HODV-21534-RM,[Completely Subjective] Dialect Girl Banshu Dialect Kanae Kawahara [Uncensored L**ked],https://pic.javct.net/poster/04112026/1776393511.jpg,https://javct.net/v/hodv-21534-rm,139,2026-04-24
HALT-080,"[Individual Shooting] If It's A Blowjob, I'll Let You Take It! 13 10 People Cum In The Mouth",https://pic.javct.net/poster/04112026/1776273567.jpg,https://javct.net/v/halt-080,125,2026-04-24
259LUXU-1883-RM,"Nurse's room teacher, married woman, F cup, carnivorous for sex. The seemingly decent female teacher is actually a sex-addicted woman who devours men every night... Luxury TV 1865 [Uncensored L**ked]",https://pic.javct.net/poster/04112026/1776045005606.jpg,https://javct.net/v/259luxu-1883-rm,62,2026-04-24
HMGL-155,Secretary Glamorous Tadakawa Misaki,https://pic.javct.net/poster/04112026/1776136177.jpg,https://javct.net/v/hmgl-155,130,2026-04-24
259LUXU-1182-RM,"Luxury TV 1173 A nurse with a strong sexual desire who brings an electric massager to the workplace appears on Luxury TV From the beginning, just by using an electric massager, she bends her body backwards and squirts, smearing herself with climax oil and shaking her big breasts, which have become even more bewitching. [Uncensored L**ked]",https://pic.javct.net/poster/04112026/1776133081865.jpg,https://javct.net/v/259luxu-1182-rm,75,2026-04-24
XRW-609-RM,"When I Stayed At A Hot Spring With My Big Busty Wife Boss, I Was A Ridiculous Girlfriend.Hanyu Arisa [Uncensored L**ked]",https://pic.javct.net/poster/20243105/1719909179.jpg,https://javct.net/v/xrw-609-rm,123,2026-04-24
DV-1219-RM,Akari Asahina AV Idol Photo Session [Uncensored L**ked],https://pic.javct.net/poster/04112026/1776099824.jpg,https://javct.net/v/dv-1219-rm,130,2026-04-24
259LUXU-1883,"Nurse's room teacher, married woman, F cup, carnivorous for sex. The seemingly decent female teacher is actually a sex-addicted woman who devours men every night... Luxury TV 1865",https://pic.javct.net/poster/04112026/1776045005606.jpg,https://javct.net/v/259luxu-1883,62,2026-04-24
259LUXU-1089-RM,"Luxury TV 1084 A former CA married woman with overwhelming big breasts and a magical, glamorous body. Her lustful body becomes greedy for pleasure, and as she searches for a big cock, she shakes her hips and cums wildly. [Uncensored L**ked]",https://pic.javct.net/poster/04112026/1775961792259.jpg,https://javct.net/v/259luxu-1089-rm,75,2026-04-24
GIRL-012,GIRL × GIRL LESBIAN VOL.12,https://pic.javct.net/poster/04112026/1775902251.jpg,https://javct.net/v/girl-012,112,2026-04-24
LUKE-028-RM,"Hitomi Honda, A Lewd Beauty Who Teases And Fucks My Dick, Which Instantly Gets Erect Just By Looking At Me. [Uncensored L**ked]",https://pic.javct.net/poster/20231011/1697256484.jpg,https://javct.net/v/luke-028-rm,135,2026-04-24
