code,title,image_url,page_url,views,date_scraped
SCOP-594,Large Carefully Selected Only Mother-of-sex Milk From The Manly And Married Ladies That The SCOOP Group Has Taken So Far! !Boobs Heaven Even This Is SP Best! !,https://pic.javct.net/poster/04112026/df223fb4ac.jpg,https://javct.net/v/scop-594,240,2026-05-12
DV-576-RM,Lingerie Queen Kaede Matsushima [Uncensored L**ked],https://pic.javct.net/poster/04112026/45cc32a1dc.jpg,https://javct.net/v/dv-576-rm,120,2026-05-12
BOKD-074,Contest Of A Dream!Too NH Akari Yukino Kawai Too This Looks Our Otokonoko Beautiful Transvestite Daughter Rindoru Hoshikawa,https://pic.javct.net/poster/04112026/54d43d6c6a.jpg,https://javct.net/v/bokd-074,150,2026-05-12
NGOD-337-RM,"Lingerina, The Principal Of A Prestigious Private Girls' School, Is Stripped Naked By A Parent's Enormous Penis And Exposed For Backdoor Admissions. [Uncensored L**ked]",https://pic.javct.net/poster/04112026/7e74d0f870.jpg,https://javct.net/v/ngod-337-rm,120,2026-05-12
WANZ-191,One Flower Lingerie Na,https://pic.javct.net/poster/04112026/fa6258ee5f.jpg,https://javct.net/v/wanz-191,120,2026-05-12
PMGG-028-RM,"Breast milk, sperm, squirting, random ejaculation! ! A divine episode called off paco with a lewd slut erotic streamer ♂! ? As a result of the otaku dick going out of control with her beautiful big breasts and ass → ""Akan...I love this dick...it's buggy...//"" Anal creampie anal fuck with inevitable buzz! [Nel-chan] Aoyama Nell [Uncensored L**ked]",https://pic.javct.net/poster/04112026/df5f923972.jpg,https://javct.net/v/pmgg-028-rm,66,2026-05-12
HUNT-630-RM,I Substitute And Manager Of The Club Room Alone For A Million Years.I Was A Manager Of Wetting Bloomsbury Dumped Heavy Rain On The Way Home Suddenly Comes Back To The Club Room! I Saw The Manager See-through Underwear Is Wet Erection Involuntarily. [Uncensored L**ked],https://pic.javct.net/poster/01202026/1772066121.jpg,https://javct.net/v/hunt-630-rm,240,2026-05-12
CKW-002-RM,"It Was Always Decided That I Would Be Called During My Lunch Break. But... Ejaculation Is 9 Hours Later. Moreover, It Is Blamed Immediately After That. And In The End, Continuous Shooting Sex Himari Kinoshita [Uncensored L**ked]",https://pic.javct.net/poster/20230804/1692933674.jpg,https://javct.net/v/ckw-002-rm,128,2026-05-12
NGOD-337,"Lingerina, The Principal Of A Prestigious Private Girls' School, Is Stripped Naked By A Parent's Enormous Penis And Exposed For Backdoor Admissions.",https://pic.javct.net/poster/04112026/7e74d0f870.jpg,https://javct.net/v/ngod-337,120,2026-05-12
XBS-008-RM,Masochistic Beast Vomit Training 7th Person Ayami Kikugawa [Uncensored L**ked],https://pic.javct.net/poster/20243105/1719111479.jpg,https://javct.net/v/xbs-008-rm,122,2026-05-12
FWAY-093,Transparent Boundary,https://pic.javct.net/poster/04112026/340740c6e2.jpg,https://javct.net/v/fway-093,110,2026-05-12
FWAY-094,A Body That Every Man Will Fall For,https://pic.javct.net/poster/04112026/105082c66d.jpg,https://javct.net/v/fway-094,120,2026-05-12
ASW-069-RM,Filthy ~ A! I Love My Daughter Drink Semen Reservoir 17 Tokuno [Uncensored L**ked],https://pic.javct.net/poster/04112026/d0172b2cfe.jpg,https://javct.net/v/asw-069-rm,95,2026-05-12
SAP-007-RM,Yua Aidayua [Uncensored L**ked],https://pic.javct.net/poster/04112026/1e9e16c481.jpg,https://javct.net/v/sap-007-rm,150,2026-05-12
PMGG-028,"Breast milk, sperm, squirting, random ejaculation! ! A divine episode called off paco with a lewd slut erotic streamer ♂! ? As a result of the otaku dick going out of control with her beautiful big breasts and ass → ""Akan...I love this dick...it's buggy...//"" Anal creampie anal fuck with inevitable buzz! [Nel-chan] Aoyama Nell",https://pic.javct.net/poster/04112026/df5f923972.jpg,https://javct.net/v/pmgg-028,66,2026-05-12
MARA-068-RM,Mita Sakura's Huge Breasts Theater Icup! 95cm [Uncensored L**ked],https://pic.javct.net/poster/20230205/1683258692.jpg,https://javct.net/v/mara-068-rm,128,2026-05-12
START-416-RM,[Escape Condition: Master The Technique Of Making 5 Men With Delayed Ejaculation Cum Repeatedly!] You Can't Leave Until You've Made Them All Cum. Ejaculation Dungeon Ichinomiya Rui [Uncensored L**ked],https://pic.javct.net/poster/04112026/49d12ceb6b.jpg,https://javct.net/v/start-416-rm,145,2026-05-12
ZEX-405-RM,Hot And Steamy Sex Pure And Innocent Sex Pure Lesbians In A World With Only Beautiful Women OR Dark Crazy Instinctual Sex [Uncensored L**ked],https://static.javct.net/poster/zex-405.jpg,https://javct.net/v/zex-405-rm,120,2026-05-12
START-416,[Escape Condition: Master The Technique Of Making 5 Men With Delayed Ejaculation Cum Repeatedly!] You Can't Leave Until You've Made Them All Cum. Ejaculation Dungeon Ichinomiya Rui,https://pic.javct.net/poster/04112026/49d12ceb6b.jpg,https://javct.net/v/start-416,145,2026-05-12
SPRD-890-RM,"Friend's Mom From Back In The Day, Rei Kitajima [Uncensored L**ked]",https://pic.javct.net/poster/20212011/1643855646.jpg,https://javct.net/v/sprd-890-rm,134,2026-05-12
FUGA-64-RM,~Neighborly Relations For When You're In Trouble~ The Old Lady Next Door Comes To Borrow My Dick - Konoe Tasaki [Uncensored L**ked],https://pic.javct.net/poster/06032026/1775690564.jpg,https://javct.net/v/fuga-64-rm,100,2026-05-12
DOKS-673-RM,Face-focused! Ahegao On All Fours! [Uncensored L**ked],https://pic.javct.net/poster/04112026/d9183d1f95.jpg,https://javct.net/v/doks-673-rm,130,2026-05-12
VENX-011-RM,New Exclusive Actress! - Do You Get Excited By Older Women's Panties? A Stepmom Uses Her Panties To Seduce Her Stepson And Drink Every Drop Of His Cum! - Minami Nagata [Uncensored L**ked],https://pic.javct.net/poster/20212709/1636587559.jpg,https://javct.net/v/venx-011-rm,107,2026-05-12
XVSR-267,Continuous Launch Guarantee Included! ! The Best Feeling Soap In The World Rimi Hatsumi,https://pic.javct.net/poster/04112026/2bafdd2268.jpg,https://javct.net/v/xvsr-267,120,2026-05-12
