code,title,image_url,page_url,views,date_scraped
NGOD-164-SUB,Woman At Convenience Store Headquarters 9 Yuuri Oshikawa [English Subtitle],https://pic.javct.net/poster/20212011/1641541808.jpg,https://javct.net/v/ngod-164-sub,120,2026-03-02
SAN-064-RM,Hana Haruna [Uncensored L**ked],https://pic.javct.net/poster/20220707/1658805512.jpg,https://javct.net/v/san-064-rm,120,2026-03-02
ALDN-445-SUB,The Reason Why My Wife Suddenly Asked Me To Cum Inside Her - Saran Ito [English Subtitle],https://pic.javct.net/poster/20250903/1742577070.jpg,https://javct.net/v/aldn-445-sub,120,2026-03-02
LULU-102-RM,"Wife With Beautiful Tits Gets A Sexy Oil Treatment From Former Masseuse Father-In-Law, He Teases Her Sticky Erogenous Zone, Cuckholded By Wet Smothering Kisses After She Could Not Bear The Pleasure... Riria Hyodo [Uncensored L**ked]",https://pic.javct.net/poster/20212709/1635594964.jpg,https://javct.net/v/lulu-102-rm,160,2026-03-02
HBAD-629-RM,"Hitomi Honda Talks About Immoral Affair, A Wife Who Gets Wet With Guilt And A Husband Who Is Jealous [Uncensored L**ked]",https://pic.javct.net/poster/20221108/1660194870.jpg,https://javct.net/v/hbad-629-rm,131,2026-03-02
JRZE-287-RM,First Shooting Of A Fifty-Something Wife Document Sae Mikuni [Uncensored L**ked],https://pic.javct.net/poster/01202026/1772301474.jpg,https://javct.net/v/jrze-287-rm,125,2026-03-02
IANN-27-RM,[Completely Subjective] Aoba Konatsu: I'm Secretly Enjoying My Son's Sexual Satisfaction [Uncensored L**ked],https://pic.javct.net/poster/01202026/1772416708.jpg,https://javct.net/v/iann-27-rm,110,2026-03-02
SQIS-116-RM,Ecstasy Of Middle-Aged Women: Mature Woman Copulation Hell [Uncensored L**ked],https://pic.javct.net/poster/01202026/1772245674.jpg,https://javct.net/v/sqis-116-rm,153,2026-03-02
583ERKR-1104-RM,Young Wife Affair Nozomi [Uncensored L**ked],https://pic.javct.net/poster/01202026/1772416344938.jpg,https://javct.net/v/583erkr-1104-rm,58,2026-03-02
YH-043-RM,The Cum 043 To Married Woman Drunk Amateur [Uncensored L**ked],https://pic.javct.net/poster/01202026/1772378421.jpg,https://javct.net/v/yh-043-rm,140,2026-03-02
DVMM-358,"Ordinary Men And Women Monitoring AV: Behind The Magic Mirror Is Her Real Son! A Busty Mother And Her Son's Best Friend, Who Is Concerned About Being A Virgin, Challenge Each Other To A Continuous Ejaculation Deflowering Challenge With A 100,000 Yen Per Shot In A Closed Room! 2. The Virgin's Cock, Fully Erected When He Touches His Friend's Mother's Big Tits, Which He's Always Wanted To Do, Gently Accepts And Inserts It Into Her Pussy...",https://pic.javct.net/poster/01202026/1772385583.jpg,https://javct.net/v/dvmm-358,295,2026-03-02
VRTM-408-RM,"Deca Nurse Wants A C**ld Buy Soap Mat For Eliminating SEX Less With Husband!Waiting At Micro Bikini When You Open The Door, The Father Of A Rainless Man!Fully Erect If You Enrich The Massive Breasts With Long-sleeved Big Tits Brush With Nurulur Lotion And Rubbing Comfortable Boobs!A Null ___ ___ ___ 0 ___ ___ 0Four [Uncensored L**ked]",https://pic.javct.net/poster/20220406/1654421100.jpg,https://javct.net/v/vrtm-408-rm,150,2026-03-02
VENX-363-RM,A Delicate Relationship Where The Mind Is Family But The Body Is Stranger. A Week Alone With My Stepmother Where Mistakes Are Bound To Happen Rio Asahi [Uncensored L**ked],https://pic.javct.net/poster/01202026/1772216516.jpg,https://javct.net/v/venx-363-rm,90,2026-03-02
VENU-620-RM,Kitagawa Erika Have Already Cum In Mother's Daughter-in-law [Uncensored L**ked],https://pic.javct.net/poster/20241804/1716615532.jpg,https://javct.net/v/venu-620-rm,80,2026-03-02
TORG-017-RM,Fucked And ....  Showa Of Caged Castle Diary  Miyabe Ryohana [Uncensored L**ked],https://pic.javct.net/poster/20221904/1651657320.jpg,https://javct.net/v/torg-017-rm,120,2026-03-02
VEC-350-RM,My Mother's Friend Azusa Yagi [Uncensored L**ked],https://pic.javct.net/poster/20221108/1663475586.jpg,https://javct.net/v/vec-350-rm,106,2026-03-02
CVDX-640,Fifty And Sixty Year Old Amateur Mature Women's First Full Nude Album 15 People 4 Hours,https://pic.javct.net/poster/01202026/1772385646.jpg,https://javct.net/v/cvdx-640,240,2026-03-02
JUR-219-SUB,Reverse PtoM Sex With Uncle Who Fills Pussy Dripping With Love Juice With Thick Cunnilingus And Insatiable Cock Fumino Satsuki [English Subtitle],https://pic.javct.net/poster/20253001/1740070386.jpg,https://javct.net/v/jur-219-sub,150,2026-03-02
ZOM-03-RM,Kato Noted Inn Love Affair Round Trip Married [Uncensored L**ked],https://pic.javct.net/poster/01202026/1772378356.jpg,https://javct.net/v/zom-03-rm,120,2026-03-02
VOD-051-RM,Genuine Amateur Wife Part 2: Passionate Adultery Creampie Sex Between A Man And A Woman Instinctively Kanae Mizuki [Uncensored L**ked],https://pic.javct.net/poster/01202026/1772216450.jpg,https://javct.net/v/vod-051-rm,135,2026-03-02
JBD-304,"Please Forgive Me... Bondage Special Edition: I Fell Into The Rope, Shiramine Ikumi",https://pic.javct.net/poster/01202026/1772385453.jpg,https://javct.net/v/jbd-304,110,2026-03-02
VENX-362-RM,"""You're Staring Too Much! Are You That Interested In My Breasts?"" My Busty Aunt Seduces Me With Whispers In My Ear And Intimate Sex Reo Fujisawa [Uncensored L**ked]",https://pic.javct.net/poster/01202026/1772216579.jpg,https://javct.net/v/venx-362-rm,105,2026-03-02
VENU-447-RM,Bath House Fakecest - Stepmother And Son Fucking In Under The Steam Misa Kudo [Uncensored L**ked],https://pic.javct.net/poster/20221904/1652745840.jpg,https://javct.net/v/venu-447-rm,100,2026-03-02
OKSN-233-RM,Sakurai Can Not Nante Me And Aunt ... Patience Ayu [Uncensored L**ked],https://pic.javct.net/poster/01202026/1772377148.jpg,https://javct.net/v/oksn-233-rm,120,2026-03-02
