code,title,image_url,page_url,views,date_scraped
KSBJ-014-RM,Drunkenness Netora Is Wife Shiho Egami [Uncensored L**ked],https://pic.javct.net/poster/06032026/1773888942.jpg,https://javct.net/v/ksbj-014-rm,127,2026-05-23
JYMA-038-RM,A Middle-Aged Man's Sexual Desire Documentary A Fair-skinned Carnal Body A Wife And An Old Man's Sweaty Sexual Intercourse All Day Fucking A Beautiful Busty Ass Wife Iori Tsukimi [Uncensored L**ked],https://pic.javct.net/poster/20230207/1689912834.jpg,https://javct.net/v/jyma-038-rm,120,2026-05-23
APNS-317-RM,"Now, The Circle Of My Beloved Wife Who Has Disappeared Has Been Sent To Me On DVD... Umi Oikawa [Uncensored L**ked]",https://pic.javct.net/poster/20230207/1689996574.jpg,https://javct.net/v/apns-317-rm,108,2026-05-23
JURA-73-RM,"First Shooting Married Woman, Again. Akina Nagahara [Uncensored L**ked]",https://pic.javct.net/poster/20230207/1689823924.jpg,https://javct.net/v/jura-73-rm,115,2026-05-23
FC2PPV-4904818,"[Big Breasts/Individual Shooting] Fascinating glamorous body with big breasts ❣ Beautiful young wife with white skin and G cup ♡ Her nipples are toyed with toys ♡ After a sensual titty fuck that fills the cock, a powerful sex video where a large amount is ejaculated deep inside her vagina with an intense piston ♡",https://pic.javct.net/poster/05192026/15b40fc721.jpg,https://javct.net/v/fc2ppv-4904818,78,2026-05-23
FC2PPV-4904760,"[Individual photo] A devoted, natural wife who started living in the countryside with the aim of getting rich quickly, but was at the mercy of her short-sighted husband, but still offered her body and sank into pleasure.",https://pic.javct.net/poster/05192026/9eb03e078a.jpg,https://javct.net/v/fc2ppv-4904760,44,2026-05-23
FC2PPV-4905651,"[Individual face shot] Reunited with the beautiful breasted slender young wife who is undergoing orthodontic treatment and has a shaved pussy, whose previous work was very popular.",https://pic.javct.net/poster/05192026/1eeea1bb83.jpg,https://javct.net/v/fc2ppv-4905651,42,2026-05-23
NMSL-039-RM,Training diary that dominates a serious black secretary with pleasure Ruka Itoi [Uncensored L**ked],https://pic.javct.net/poster/05192026/bb53e83b2c.jpg,https://javct.net/v/nmsl-039-rm,117,2026-05-23
FC2PPV-4903051,[Former CA Beautiful Witch] **pyjpx*jsps 3P creampie with a housewife who loves dick but is sexless and starving,https://pic.javct.net/poster/05192026/9ac94b289f.jpg,https://javct.net/v/fc2ppv-4903051,45,2026-05-23
FC2PPV-4904664,"[Uncensored x Personal Shooting] **pyjpx*jsps Ms. Matsuda, a married woman who works as a home-based illustrator, is a beautiful young wife who came to appear in an erotic video herself because she wanted to get inspiration because she received a request for an erotic manga.",https://pic.javct.net/poster/05192026/e005c1c601.jpg,https://javct.net/v/fc2ppv-4904664,70,2026-05-23
JJPP-004,DVD You Voyeur How To Bring In SEX Twink Is In The Room Tsurekon Milf. - That I Have To Cum Intact 4 To Forcibly,https://pic.javct.net/poster/05192026/5f3303cd2e.jpg,https://javct.net/v/jjpp-004,120,2026-05-23
SOAV-098-RM,A Married Woman's Cheating Heart Sato's Or [Uncensored L**ked],https://pic.javct.net/poster/20230302/1677902117.jpg,https://javct.net/v/soav-098-rm,144,2026-05-23
XRW-663-RM,She Got Fucked By Her Ex boyfriend.. A Young Wife Whose Pussy Is Awakend And Throbs For An Old Boyfriend. Kanna Misaki [Uncensored L**ked],https://pic.javct.net/poster/20222410/1667231325.jpg,https://javct.net/v/xrw-663-rm,120,2026-05-23
VGD-137-RM,"Today, Your Wife Is Having An Affair.Ayumi [Uncensored L**ked]",https://pic.javct.net/poster/06032026/1773381547.jpg,https://javct.net/v/vgd-137-rm,140,2026-05-23
SAN-151-RM,A Beautiful Married Woman Who Awakens To Selling Herself To Pay Off The Huge Debts Made By Her Husband / Sarina Momonaga [Uncensored L**ked],https://pic.javct.net/poster/20230207/1690773851.jpg,https://javct.net/v/san-151-rm,125,2026-05-23
ROE-504-RM,"Top-class Woman Nearing 60, Exclusive, Chapter 2: Unleashing The Ban On Internal Ejaculation. ""Mother-in-law, You Promised To Give Birth To My Little Brother Back Then, Didn't You?"" Desperate To Have A Younger C**ld, I Continued To Pour My Seed Into Kaoru's Vagina Every Day, Even Though She Was Nearing Menopause... [Uncensored L**ked]",https://pic.javct.net/poster/05192026/59945a16e9.jpg,https://javct.net/v/roe-504-rm,140,2026-05-23
892OERO-001-RM,"I've been married for a year, and I'm a newlywed wife...and yet I'm seeing another man.I'm saying, ""I don't have enough stimulation and excitement...'', and I'm doing all I want to this frustrated married woman who is getting erotic.At first, I said, ""I don't want it raw,'' but when she spreads her pussy, she says, ""I want sperm here''...That's too erotic, and I pass away. [Uncensored L**ked]",https://pic.javct.net/poster/05192026/ba6858db40.jpg,https://javct.net/v/892oero-001-rm,59,2026-05-23
JUR-696-RM,"Mother, Who Went To A Host Club To Save Her Beloved Daughter, Is Fo**ed To Repay Her Debts With Her Body. [Uncensored L**ked]",https://pic.javct.net/poster/05192026/483f82686d.jpg,https://javct.net/v/jur-696-rm,170,2026-05-23
JUX-930-RM,When My Wife Sparkles With Lust... Nene [Uncensored L**ked],https://pic.javct.net/poster/20222109/1665934712.jpg,https://javct.net/v/jux-930-rm,119,2026-05-23
ARSO-26206-RM,Mai Wife ~Celebrity Club~ 206 [Uncensored L**ked],https://pic.javct.net/poster/05192026/3afb364af2.jpg,https://javct.net/v/arso-26206-rm,198,2026-05-23
328HMDNV-924-RM,"A mature woman who takes sex videos according to her husband's instructions!!She is actually embarrassed but she is a healthy wife who follows her beloved husband's instructions!Every time she plays, her perverted heart grows and she feels great and creampied by the NTR wife. [Uncensored L**ked]",https://pic.javct.net/poster/05192026/160fcce4ea.jpg,https://javct.net/v/328hmdnv-924-rm,80,2026-05-23
MFCW-072-RM,Himeka [Uncensored L**ked],https://pic.javct.net/poster/05192026/79abb7c27d.jpg,https://javct.net/v/mfcw-072-rm,74,2026-05-23
ROE-493-RM,"≪Emergency Return To Japan≫ Personal Trainer Tsubaki Kotoha, Who Has Been Active Overseas, Makes Her AV Debut!! [Uncensored L**ked]",https://pic.javct.net/poster/05192026/65e3c14194.jpg,https://javct.net/v/roe-493-rm,120,2026-05-23
JUR-085-RM,"It Wasn't The Mirror Or The Sun That Shone, It Was You. Madonna's Big New Star, Shiina Kamiya, 28 Years Old, Is More Attractive Than Anyone Else, Yet She Has Lived Her Life Unaware That She Is A Rough Gem. AV DEBUT [Uncensored L**ked]",https://pic.javct.net/poster/05192026/c63ebe3c92.jpg,https://javct.net/v/jur-085-rm,120,2026-05-23
