code,title,image_url,page_url,views,date_scraped
RAPD-011,"Global Media 25th Anniversary Special Production: Super Mother-Daughter R**e - An Unprecedented Three-Generation R**e! The Evil Hands Of Men Attack Grandmother, Mother, And Daughter!! A Hellish 7-person Orgy Filled With Screams Of Agony And The Stench Of Lust!! Yumi Anno, Yuka Tada, Jun Suehiro",https://pic.javct.net/poster/04112026/1777076582.jpg,https://javct.net/v/rapd-011,135,2026-04-25
KSBJ-265-RM,Sarina Momunaga Is Fascinated By Her Brother-in-law's Big Cock [Uncensored L**ked],https://pic.javct.net/poster/20230908/1696046282.jpg,https://javct.net/v/ksbj-265-rm,120,2026-04-25
VEMA-209-RM,"My Girlfriend, A Beautiful Female Teacher, Is My Class Teacher, Club Advisor, And My Lover - Forbidden Passionate Creampie Sex With My Older Girlfriend From Morning Till Night - Akiho Oozono [Uncensored L**ked]",https://pic.javct.net/poster/20230908/1695961063.jpg,https://javct.net/v/vema-209-rm,95,2026-04-25
KSBJ-357-SUB,"Mika Sumikawa, The Mother Who Sacrificed Her Body To Help Her Son Pass The Entrance Exam [English Subtitle]",https://pic.javct.net/poster/20242012/1737170907.jpg,https://javct.net/v/ksbj-357-sub,118,2026-04-25
OIGS-052-RM,Rope Sick Married Woman Please Make My Wife A Bondage Model. Tsukumo Mei [Uncensored L**ked],https://pic.javct.net/poster/20230908/1695445111.jpg,https://javct.net/v/oigs-052-rm,120,2026-04-25
ARSO-23174-RM,Mai Wife ~Celebrity Club~ 174 [Uncensored L**ked],https://pic.javct.net/poster/20230908/1695268550.jpg,https://javct.net/v/arso-23174-rm,184,2026-04-25
JUY-290-RM,Mature Woman Soap Kase Kanako Hospitable Middle-aged Man With Rich Kiss [Uncensored L**ked],https://pic.javct.net/poster/04112026/1777079234.jpg,https://javct.net/v/juy-290-rm,140,2026-04-25
CEMD-240-RM,Erotic Underwear Temptation Of A Young Wife Slut Who Moved Next Door 3 Momo Minami [Uncensored L**ked],https://pic.javct.net/poster/20222109/1663993689.jpg,https://javct.net/v/cemd-240-rm,118,2026-04-25
FC2PPV-4886904,"A wife who has a c**ld, I will start physical training again ① & A slender wife who forgets about the things she left behind and immerses herself in other people's dicks.A 28-year-old slender body gets penetrated by another person's dick.Thin face mosaic set version",https://pic.javct.net/poster/04112026/c7c17c405c7c.jpg,https://javct.net/v/fc2ppv-4886904,68,2026-04-25
SAN-122-RM,A Busty Wife Who Fell In Love With An Old Familiar Who Was Tired Of Caring For Her Husband And Resumes With An Impulsive Shoplifter / Sakura Tsukishima [Uncensored L**ked],https://pic.javct.net/poster/20230104/1682826805.jpg,https://javct.net/v/san-122-rm,120,2026-04-25
KGR-001-RM,Perverted Teacher Erotic Mom Rumi Arimura [Uncensored L**ked],https://pic.javct.net/poster/20230908/1694662486.jpg,https://javct.net/v/kgr-001-rm,120,2026-04-25
HTHD-211-RM,My Friend's Mother ~Final Chapter~ Chigusa Mitsuki [Uncensored L**ked],https://pic.javct.net/poster/20230908/1695266292.jpg,https://javct.net/v/hthd-211-rm,120,2026-04-25
336KNB-409-RM,"[My husband is no longer in the air] After 5 years of marriage, a mature wife who refuses even her husband's fingertips has a hidden lustful desire. Release of the eroticism cultivated in AV since c**ldhood. ""Love me gently and for a long time..."" [Large flood] of love juice overflowing from sensitive skin that bloomed after a long time of intercourse - Hanyu station colored by indigo dyeing [Smartphone shooting included] [Uncensored L**ked]",https://pic.javct.net/poster/04112026/1776909715994.jpg,https://javct.net/v/336knb-409-rm,72,2026-04-25
URE-035-US,"Written By Fan-Fic Group Yojohan Shobo A New Work From A Comic Event!! Mother's Day And Daughter's Day A Beautiful Stepmother And Daughter Cannot Be Saved From Impregnation The Live-Action Adaptation Of The Comic!! [English Subtitle, Reducing Mosaic]",https://pic.javct.net/poster/20221904/1652868690.jpg,https://javct.net/v/ure-035-us,218,2026-04-25
JUR-720-RM,"Iyo Shinohara's Long-awaited Private Affair Documentary!! A Twilight Affair On A Remote Island, Immersed In Pleasure. A 2-day, 1-night Trip Where Iyo Shinohara Unleashes Her Desires With Unprotected Sex And Ejaculation Inside. [Uncensored L**ked]",https://pic.javct.net/poster/04112026/1776963168.jpg,https://javct.net/v/jur-720-rm,160,2026-04-25
PAP-235-RM,Yeah! Are You Really In Your 40s? Addicted To Sex With Japanese People With Outstanding Looks And Beautiful Legs! Korean Beautiful Mature Woman! ! [Uncensored L**ked],https://pic.javct.net/poster/20230908/1694838403.jpg,https://javct.net/v/pap-235-rm,174,2026-04-25
MESU-116-RM,A Married Woman Housekeeper Saki Oishi Who Is Popular For A Fixed Price Unlimited Insertion Service Anytime Anywhere [Uncensored L**ked],https://pic.javct.net/poster/20230908/1694662240.jpg,https://javct.net/v/mesu-116-rm,95,2026-04-25
VNDS-3402-RM,An Ordinary Married Woman Is The Lewdest Misaki (34) Misaki Sugisaki [Uncensored L**ked],https://pic.javct.net/poster/20230908/1695182448.jpg,https://javct.net/v/vnds-3402-rm,100,2026-04-25
VEC-615-RM,Creampie Courtship Sex With A Fascinating Single Mother Who Moved Next Door To My Apartment Yuuki Hiiragi [Uncensored L**ked],https://pic.javct.net/poster/20230908/1695961131.jpg,https://javct.net/v/vec-615-rm,105,2026-04-25
NINE-078-RM,[Super A5 Rank Aged Meat] A Herbivore Boy Gets Fucked By A Plump Landlord Who Is Older Than His Mother For Being In A Rent Delinquency 12 Shots. Mineko (45 Years Old) [Uncensored L**ked],https://pic.javct.net/poster/20230908/1695785876.jpg,https://javct.net/v/nine-078-rm,119,2026-04-25
JUR-208-SUB,I Thrust My Dick Into My Cheating Wife Kana And Her Partner Misaki And Made Them Understand In Their Uteruses. [English Subtitle],https://pic.javct.net/poster/20250903/1742488765.jpg,https://javct.net/v/jur-208-sub,130,2026-04-25
SOAV-046-RM,Married Wife's Cheating Heart Kanako Maeda [Uncensored L**ked],https://pic.javct.net/poster/04112026/1777079038.jpg,https://javct.net/v/soav-046-rm,120,2026-04-25
ALDN-579,You're Getting An Old Lady Like Me Excited... What Are You Going To Do About It...? - Kaede Sakuma,https://pic.javct.net/poster/04112026/1777057412.jpg,https://javct.net/v/aldn-579,110,2026-04-25
RDVHJ-160-RM,Amateur! ! Mother Daughter Nampa Creampie! ! Vol 26 [Uncensored L**ked],https://pic.javct.net/poster/20230908/1695785754.jpg,https://javct.net/v/rdvhj-160-rm,110,2026-04-25
