code,title,image_url,page_url,views,date_scraped
KBBA-004-RM,Obscene To**ure Lady - The Burning Honey Lips Of A Married Woman Born Into A Prestigious Family - She Goes Crazy With Her Eyes Wide Open As She Trains Her Obscene Flesh. [Uncensored L**ked],https://pic.javct.net/poster/20231011/1697081538.jpg,https://javct.net/v/kbba-004-rm,102,2026-04-10
UMAN-002,Forbidden NTR: Penetrated By My Beloved Husband's Father... Immoral Caregiving - Yuika Onosaka,https://pic.javct.net/poster/06032026/1775814386.jpg,https://javct.net/v/uman-002,120,2026-04-10
JUX-877-RM,Mad Mori In Broad Daylight Woman Tsuyado Shihori [Uncensored L**ked],https://pic.javct.net/poster/06032026/1775787543.jpg,https://javct.net/v/jux-877-rm,120,2026-04-10
NKKD-300-RM,"Big Butt Piss NTR Hana Haruna, A Big Butt Wife Whose Sensitive Big Butt Was Massaged And Caressed At The Butt-lifting Beauty Salon She Ordered For Her Beauty And Health, And Who Was Fo**ed To Stop Her Butt From Shaking With The Demon Thrusting Piston [Uncensored L**ked]",https://pic.javct.net/poster/20230908/1696572635.jpg,https://javct.net/v/nkkd-300-rm,120,2026-04-10
NACR-690-RM,Delusion About My Brother's Wife... Satomi Nagasawa [Uncensored L**ked],https://pic.javct.net/poster/20230207/1689826259.jpg,https://javct.net/v/nacr-690-rm,120,2026-04-10
T28-342-RM,Devil Father-in-law To Commit Force In The Bathroom The Daughter-in-law Of Son [Uncensored L**ked],https://pic.javct.net/poster/20222311/1671583333.jpg,https://javct.net/v/t28-342-rm,120,2026-04-10
YOCH-005-RM,"Kaede Sakuma, 42 Years Old, Makes Her Beautiful Butt Body AV Debut And Wants To Have Her First Orgasm For Her Husband. [Uncensored L**ked]",https://pic.javct.net/poster/20231011/1697083292.jpg,https://javct.net/v/yoch-005-rm,130,2026-04-10
JUL-693-RM,"I Want To Shine Again Like I Did Back Then. Former Soda Commercial TV Celeb Minase Amakawa, 31 Years Old, AV Debut [Uncensored L**ked]",https://pic.javct.net/poster/20212308/1631257093.jpg,https://javct.net/v/jul-693-rm,150,2026-04-10
VAGU-262-RM,Wife Awakens To Pleasure After Being Tied Up By Her Husband's Subordinates. Saki Oishi [Uncensored L**ked],https://pic.javct.net/poster/20231011/1697171600.jpg,https://javct.net/v/vagu-262-rm,95,2026-04-10
JUL-696-RM,No Matter What I'd Never Tell My Wife That I Impregnated My Mother-In-Law...-On A 1 Night 2 Day Hot Springs Trip I Lost Myself And Gave Her A Creampie. -Rinka Tahara [Uncensored L**ked],https://pic.javct.net/poster/20212308/1631256921.jpg,https://javct.net/v/jul-696-rm,118,2026-04-10
JUR-715,"Anything Is Fine As Long As You Can Release Your Sexual Urges, Right? My Sexual Preferences Were Destroyed By Her Mother And I'm Sinking Deeper Into The Abyss.",https://pic.javct.net/poster/06032026/1775760448.jpg,https://javct.net/v/jur-715,150,2026-04-10
ROE-485,A Suite Room Of Martyrdom And Training: A Mother Who Offers Her Body For Her Son—Toko Yoshinaga,https://pic.javct.net/poster/06032026/1775760194.jpg,https://javct.net/v/roe-485,140,2026-04-10
336KNB-407-RM,"[Super Breasts = Super Dream Breasts] [Super Lewd Young Wife with Oho Voice] A super rare breed of huge breasts and a super breasts wife applied for AV saying, ""I want to go to Hawaii with my husband,'' and while saying, ""I want to go to Hawaii with my husband,'' a lewd wife who loves sex sways her super tits and climaxes with a crazy voice, and a titty fuck with divine breasts bigger than her face is fired It was really the best (LOL) at Minami Gyotoku Station [Uncensored L**ked]",https://pic.javct.net/poster/06032026/1775613504124.jpg,https://javct.net/v/336knb-407-rm,61,2026-04-10
292MY-1043-RM,Nakamura Meguri 1 [Uncensored L**ked],https://pic.javct.net/poster/06032026/1775613724363.jpg,https://javct.net/v/292my-1043-rm,53,2026-04-10
NGOD-333,"The Forbidden Double Pregnancy: A Wife, Ruka Itoi, Reunites With The Man Who Impregnated Her Seven Years Ago And Gets Pregnant Again.",https://pic.javct.net/poster/06032026/1775765664.jpg,https://javct.net/v/ngod-333,120,2026-04-10
NGOD-332,"A Woman At A Memorial Service: A City Wife Who Returns To Her Hometown Becomes Prey To The Throbbing, Enormous Penises Of Men Frustrated By Rural Life... Miho Tsuno",https://pic.javct.net/poster/06032026/1775764321.jpg,https://javct.net/v/ngod-332,120,2026-04-10
HEZ-881,A Mother Is Repeatedly Impregnated By Her Stepson In Front Of Her Husband's Portrait; Please Forgive Her... Misako Aiba,https://pic.javct.net/poster/06032026/1775765930.jpg,https://javct.net/v/hez-881,139,2026-04-10
JUR-723,"I Transformed The Plain, Married Accounting Lady At My Company Into My Personal Mistress, Making Her Squirt With Intense Masochistic Pleasure. - Okimiya Nami",https://pic.javct.net/poster/06032026/1775760319.jpg,https://javct.net/v/jur-723,150,2026-04-10
ROE-481,Verbal Humiliation: Silencing The Nagging Housewife Next Door Who Always Complains By Silencing Her With My Dick Every Time - Kirioka Satsuki,https://pic.javct.net/poster/06032026/1775763804.jpg,https://javct.net/v/roe-481,120,2026-04-10
JUR-710,"Madonna's Exclusive Model, Sarara Uruki, Engages In Three Intensely Passionate, Deep-penetration Sex Scenes Where Saliva And Vaginal Fluids Intertwine.",https://pic.javct.net/poster/06032026/1775760519.jpg,https://javct.net/v/jur-710,160,2026-04-10
JUR-680,Intimate Sex: My Forbidden But Passionate Affair With My Boss - Ichiki Mahiro,https://pic.javct.net/poster/06032026/1775760971.jpg,https://javct.net/v/jur-680,140,2026-04-10
JUR-665,"The Young Proprietress Of The Izakaya Seduces Him Into Sheltering From The Rain And Engaging In Infidelity... After Last Order, They Have A Passionate, Raw Sex Session Drenched In Depravity And Bodily Fluids - Ririko Kinoshita",https://pic.javct.net/poster/06032026/1775761043.jpg,https://javct.net/v/jur-665,140,2026-04-10
SONE-617-SUB,"""Did Your Penis Get Hard? If You're Okay With Being An Older Woman, I'll Take Care Of It Right Away."" Working Older Woman Secretly Helps Guys Who Have A Hard Penis Ejaculate With Her Big Breasts That She Can't Hide. Occupational Situation Okuda Saki [English Subtitle]",https://pic.javct.net/poster/20253001/1741286328.jpg,https://javct.net/v/sone-617-sub,120,2026-04-10
XMOM-111-RM,"Tongue-licking Pervert Club: Tongue Kissing Arouses Desire, Big Dick Drives You Wild! Yoshizawa Yuki [Uncensored L**ked]",https://pic.javct.net/poster/06032026/1775690688.jpg,https://javct.net/v/xmom-111-rm,115,2026-04-10
