code,title,image_url,page_url,views,date_scraped
RIX-035,Host Oil Massage Addictive Is Kabukicho Celebrity Lady,https://pic.javct.net/poster/06032026/1773724467.jpg,https://javct.net/v/rix-035,235,2026-03-17
SKMJ-729-RM,"This Amateur Wife, Who Can't Hide Her Frustration From Playing Moms' Volleyball 3 Days A Week, Takes On The Challenge! A Plump, Big-assed Smooch! She Blushes And Gets Turned On By A Big, Curved Cock That's Younger Than Her Husband's! Then, He Slides It In Deep From Behind And Gives Her A Creampie! [Uncensored L**ked]",https://pic.javct.net/poster/06032026/1773549341.jpg,https://javct.net/v/skmj-729-rm,146,2026-03-17
BANK-234-RM,"Busty Married Woman Hot Spring Date: Reluctantly Selling Her Body, Aoi, 27 Years Old [Uncensored L**ked]",https://pic.javct.net/poster/06032026/1773549722.jpg,https://javct.net/v/bank-234-rm,115,2026-03-17
EBOD-372-RM,Hatsudori H Cup Breast Milk Sub-Mari Real Married Woman Lilith [Uncensored L**ked],https://pic.javct.net/poster/06032026/1773712685.jpg,https://javct.net/v/ebod-372-rm,120,2026-03-17
JUL-645-RM,Horny Pregnant Stepmom Rides My Cock For A Creampie Behind The Old Man's Back Ai Mukai [Uncensored L**ked],https://static.javct.net/poster/jul-645.jpg,https://javct.net/v/jul-645-rm,124,2026-03-17
SAN-081-RM,A Married Woman Who Was Unable To Pay The Rent And Dedicated Her Body To A Devil Landlord / Miku Arima [Uncensored L**ked],https://pic.javct.net/poster/20222410/1668479728.jpg,https://javct.net/v/san-081-rm,120,2026-03-17
NPJB-121-RM,A Broke Single Mother Releases Her Frustration With Daily Allowances 4 Uncut Sex Videos 140 Minutes BEST [Uncensored L**ked],https://pic.javct.net/poster/06032026/1773163990.jpg,https://javct.net/v/npjb-121-rm,140,2026-03-17
JUX-866-RM,Neighbor To**ure - Female Dog Of Service Married Woman Has Been Inculcated  Eriko Miura [Uncensored L**ked],https://pic.javct.net/poster/20220406/1656465829.jpg,https://javct.net/v/jux-866-rm,120,2026-03-17
FC2PPV-4864554,[3P continuous creampie] A mature wife takes on two cocks with her libido unleashed. Her body can no longer go back and surrenders to the to**ure of two cocks.,https://pic.javct.net/poster/06032026/1773709155.jpg,https://javct.net/v/fc2ppv-4864554,42,2026-03-17
MVSD-583-US,"A Double Bourgeois Married Woman's Splendid Dick Play. A Man-eater Mature Woman Who Sucks Out The Young Man's Dick. A Lewd Slut Sex Covered In Pheromones. Yuri Oshikawa And Mary Tachibana. [English Subtitle, Reducing Mosaic]",https://pic.javct.net/poster/20241901/1708050769.jpg,https://javct.net/v/mvsd-583-us,140,2026-03-17
AVOP-363-RM,"Too Tender Amateur Wife Keeps Her Husband Secretly A Virgin Brush!Special Edition ""Actually I Like My Younger Brother."" In A Hurry, 'Brother Too' Brushed Down At Home!Famimish Cum Shot SP Eumi 30 Years Old [Uncensored L**ked]",https://pic.javct.net/poster/06032026/1773712317.jpg,https://javct.net/v/avop-363-rm,140,2026-03-17
ALDN-244-RM,"After All, Being A Single Mother Is The Best... Hitomi Mochizuki [Uncensored L**ked]",https://pic.javct.net/poster/20231711/1700889003.jpg,https://javct.net/v/aldn-244-rm,110,2026-03-17
NGOD-018,Japan Netora Are Grand Prize Winners Netora The Fiance Aki Sasaki,https://pic.javct.net/poster/06032026/1773704913.jpg,https://javct.net/v/ngod-018,120,2026-03-17
JRZD-878,First Shooting Fifty Wife Document Akiyoshi Yoshinaga,https://pic.javct.net/poster/06032026/1773703907.jpg,https://javct.net/v/jrzd-878,120,2026-03-17
VENU-953-RM,Do You Get Excited By An Older Woman's Panties? - A Mature Woman Takes Off Her Panties To Jerk Off A Younger Guy - Ririka [Uncensored L**ked],https://pic.javct.net/poster/20212011/1638148646.jpg,https://javct.net/v/venu-953-rm,104,2026-03-17
VOSS-173-RM,My Neighbor Is A Widow With Big Tits! 6 - This Pretty Widow Doesn't Wear A Bra And She Obviously Has Some Built-Up Sexual Frustrations! She Presses Her Tits Against Me And Lets Me Fondle Them! I Rub My Cock Against Her Clit Before Piston-Fucking Her Deep In Her Pussy And Giving Her Multiple Orgasms! [Uncensored L**ked],https://pic.javct.net/poster/20221108/1663646502.jpg,https://javct.net/v/voss-173-rm,95,2026-03-17
VENU-921-RM,"""Are You Getting Horny Over An Old Lady's Underwear?"" This Horny Lady Is Using Her Freshly Stripped-Off Panties To Squeeze Out Every Last Drop Of Semen Ayane Haruka [Uncensored L**ked]",https://pic.javct.net/poster/20212011/1643730734.jpg,https://javct.net/v/venu-921-rm,106,2026-03-17
VENU-892-RM,"""Do Aunty's Panties Excite You?"" Aunty Squeezes Every Drop Of His Sperm With Her Panties Freshly Taken Off: Yuka Mizuno [Uncensored L**ked]",https://pic.javct.net/poster/20212011/1638926325.jpg,https://javct.net/v/venu-892-rm,104,2026-03-17
SUPA-320-RM,I Will Lend You My All-you-can-use Wife Every Day. Kanna 31 Years Old [Uncensored L**ked],https://pic.javct.net/poster/06032026/1773676364.jpg,https://javct.net/v/supa-320-rm,125,2026-03-17
NTR-032-RM,It Came From Abroad Netora Is Desire Married Couple Amelia [Uncensored L**ked],https://pic.javct.net/poster/20230104/1682577560.jpg,https://javct.net/v/ntr-032-rm,118,2026-03-17
START-529,A married woman who has been married for 1 year has a grudge against her creepy father... Supervised creampie Mei Miyajima,https://pic.javct.net/poster/06032026/1773680723376.jpg,https://javct.net/v/start-529,130,2026-03-17
START-534,"The wife who married into my parents' house seems to be in the middle of my family's extremely male-obsessed sex drive, and she was an unfaithful married woman who sneaked into the family and had sex with everyone, so it was a family crush! Mahiro Yuii",https://pic.javct.net/poster/06032026/1773680531487.jpg,https://javct.net/v/start-534,128,2026-03-17
ADN-162-US,"A Cock Assault This Married Woman Housemaid Is Getting R**ed Against Her Will Saeko Matsushita [English Subtitle, Reducing Mosaic]",https://pic.javct.net/poster/20212011/1641971108.jpg,https://javct.net/v/adn-162-us,113,2026-03-17
SORA-174,A celebrity beast wife is trained in the room. Misa Arisawa,https://pic.javct.net/poster/06032026/1773682831.jpg,https://javct.net/v/sora-174,135,2026-03-17
