code,title,image_url,page_url,views,date_scraped
JURA-85-RM,"First Shot Of A Married Woman, Again. Reina Nagano [Uncensored L**ked]",https://pic.javct.net/poster/20231011/1697081609.jpg,https://javct.net/v/jura-85-rm,110,2026-04-07
XRW-590-RM,Occidental And Duskabe's Obscene Daily Life Yatsuno Tsubasa [Uncensored L**ked],https://pic.javct.net/poster/06032026/1775528255.jpg,https://javct.net/v/xrw-590-rm,121,2026-04-07
NACR-680-RM,"When The Two Of Us Are Alone, The Temptation Of My Younger Brother's Wife Begins! My Plump Body Is Too Erotic And I Can't Stand It... Hosho Mei [Uncensored L**ked]",https://pic.javct.net/poster/20230206/1687240476.jpg,https://javct.net/v/nacr-680-rm,120,2026-04-07
VEC-619-RM,Yukari Orihara's Climax Rush Creampie Sex Destroys The Reason Of The Big-breasted Wife Who Lives In The Neighborhood With Her Boobs Shaking Violently [Uncensored L**ked],https://pic.javct.net/poster/20231011/1697771146.jpg,https://javct.net/v/vec-619-rm,110,2026-04-07
HODV-21498-RM,One Day Next Door Married Woman Suddenly Becomes My Exclusive Maid Bride Reika Hashimoto [Uncensored L**ked],https://pic.javct.net/poster/06032026/1775531885.jpg,https://javct.net/v/hodv-21498-rm,145,2026-04-07
MIDD-828-RM,Sakura Momoka Tempted To Selfishness Of Married Life Bra Plump Tits L**i [Uncensored L**ked],https://pic.javct.net/poster/06032026/1775527720.jpg,https://javct.net/v/midd-828-rm,150,2026-04-07
KAM-149-RM,Celebrating Her Husband's Boss's Promotion And Getting Fucked NTR Married Woman's Home Party A Beautiful Big Butt Bride Gets Drunk And Cums Full Of Lewd Little Schoolgirl Minori Hatsune [Uncensored L**ked],https://pic.javct.net/poster/20231011/1697170903.jpg,https://javct.net/v/kam-149-rm,120,2026-04-07
JUFD-721-RM,Body Ichinose Miki De M Breast Milk Wife To Wake Blame To Erogenous Development Transformer Cum Fuck Extreme [Uncensored L**ked],https://pic.javct.net/poster/06032026/1775527786.jpg,https://javct.net/v/jufd-721-rm,160,2026-04-07
SY-221-RM,"Dear Mrs. Hinami, 27 Years Old, From The Four-and-a-Half Tatami Room ● Amateur Four-and-a-Half Tatami Room Raw Cumshot Series Ishikawa Hinami [Uncensored L**ked]",https://pic.javct.net/poster/06032026/1775209573.jpg,https://javct.net/v/sy-221-rm,110,2026-04-07
VEO-074-RM,"Real Amateur Wife AV Debut! ! Aoi Mibu, The Popular Izakaya's Signboard Wife Who Loves Her Hometown And Is Loved By Local Customers, Is Good At Getting Cocks [Uncensored L**ked]",https://pic.javct.net/poster/20231011/1697770944.jpg,https://javct.net/v/veo-074-rm,120,2026-04-07
FC2PPV-4876324,[Complete face reveal] I realized something serious.My husband got a call saying that the video was found out and asked to meet him.,https://pic.javct.net/poster/06032026/1775523769.jpg,https://javct.net/v/fc2ppv-4876324,48,2026-04-07
SYKH-089-RM,"Raw Copulation With A Beautiful Witch In Boots, Her Beauty Melts Away With The Pleasure Of Being Penetrated... Yukari, 34 Years Old [Uncensored L**ked]",https://pic.javct.net/poster/20231011/1697253921.jpg,https://javct.net/v/sykh-089-rm,110,2026-04-07
JUL-689-RM,"Mom Gets Seduced By My Bully, Starring Rin Okae [Uncensored L**ked]",https://static.javct.net/poster/jul-689.jpg,https://javct.net/v/jul-689-rm,118,2026-04-07
292MY-1042-RM,Rei Maeda 2 [Uncensored L**ked],https://pic.javct.net/poster/06032026/1775183222769.jpg,https://javct.net/v/292my-1042-rm,60,2026-04-07
C-2293,MILF Wife Interview POV Preview TheBest 2017.08-2018.01,https://pic.javct.net/poster/06032026/1775524654.jpg,https://javct.net/v/c-2293,240,2026-04-07
FC2PPV-4873983,This is the wife who applied through SNS. Complete version.,https://pic.javct.net/poster/06032026/1775523553.jpg,https://javct.net/v/fc2ppv-4873983,68,2026-04-07
MACB-010,"A Beautiful Big-ass Wife Is Seen Through The Whole Body Erogenous Zone, Shakes The Ass, And Drowns In The Port! Miku Abe",https://pic.javct.net/poster/06032026/1775521288.jpg,https://javct.net/v/macb-010,118,2026-04-07
MACB-008,Kubire Busty Wife To See Again Without Passing A Man With A Passionate Face To A Cleanly Faced Guss Sexual Desire Explosion! Mihara Honoka,https://pic.javct.net/poster/06032026/1775521539.jpg,https://javct.net/v/macb-008,120,2026-04-07
MACB-012,"Dosukebemuchimuchi I Cup Wife If You Take Off Your Refreshing Wife, It Was A Chi Body Of A Spear Body! Takarada Monami",https://pic.javct.net/poster/06032026/1775521477.jpg,https://javct.net/v/macb-012,120,2026-04-07
MACB-009,Big Breasts! ! The Nursery Wife's Fathers Have Developed A Neat Nature And Are Pickled In Thick Acme Kurata Mao,https://pic.javct.net/poster/06032026/1775521354.jpg,https://javct.net/v/macb-009,120,2026-04-07
JJEE-005-SUB,[First Time Completely Free] [Completely Private Room] [Creampie] [Hidd** Camera Data L**k] A Handsome Pistol Will Definitely Bring Down A Married Woman At The Resort Esthetic Salon 005 [English Subtitle],https://pic.javct.net/poster/20250903/1741884595.jpg,https://javct.net/v/jjee-005-sub,120,2026-04-07
MOON-055-RM,"""It's Not Cheating As Long As It's Just Titty-fuck, Right?"" I-cup Busty Wife Tanaka Nene Seduces Her Seemingly Weak-willed, Herbivorous Neighbor, Using Titty-fuck To Entice Him Into Sex Every Night. [Uncensored L**ked]",https://pic.javct.net/poster/06032026/1775332825.jpg,https://javct.net/v/moon-055-rm,140,2026-04-07
URE-060-RM,"A Masterpiece Of Unaware NTR That Invites A Married Woman's Ripe Body To Fall Into Pleasure Without Noticing It! !! Includes The Original Episode, Kokudakaya, 15 Minutes Of Overtime, And An Original Episode Depicting The Store Manager's Perspective And Husband's Perspective! !! Mukai Ai [Uncensored L**ked]",https://pic.javct.net/poster/20230104/1680443812.jpg,https://javct.net/v/ure-060-rm,200,2026-04-07
NDRA-093-RM,"Keeping it a Secret From My Girlfriend, I Also Fuck My Girlfriend's Mom... Mayu Suzuki [Uncensored L**ked]",https://pic.javct.net/poster/20212011/1639115158.jpg,https://javct.net/v/ndra-093-rm,120,2026-04-07
