code,title,image_url,page_url,views,date_scraped
EMAZ-321,Bristles Devote Himself To The Company President For The Son-in-law Age Fifty Mother 2 Keiko Hattori,https://pic.javct.net/poster/01202026/1772598667.jpg,https://javct.net/v/emaz-321,138,2026-03-04
TORG-028-RM,Showa Functional Pornography Daizenshu Second Chapter [Uncensored L**ked],https://pic.javct.net/poster/01202026/1772589525.jpg,https://javct.net/v/torg-028-rm,240,2026-03-04
START-498V-RM,[Bonus version] The person I had sex with at Hapbar was my best friend's husband. A woman who wants to blame more and a woman who wants to be blamed... until two opposite married women fall for pleasure and become friends in a 4P swapping swap. Aozora Hikari Kamiki Rei [Uncensored L**ked],https://pic.javct.net/poster/01202026/1772589181620.jpg,https://javct.net/v/start-498v-rm,292,2026-03-04
SABA-661,Married Woman Job Hunting-Sexual Harassment Interview-Vol.001,https://pic.javct.net/poster/01202026/1772591951.jpg,https://javct.net/v/saba-661,210,2026-03-04
T28-312-RM,I Lend Day Erotic Married Woman. Reiko Kobayakawa [Uncensored L**ked],https://pic.javct.net/poster/01202026/1772590195.jpg,https://javct.net/v/t28-312-rm,190,2026-03-04
SAN-068-RM,"Haruka Miyana, A Wife Who Was Intended To Play With Fire When She Got Her Hands On A Matching App On The Moment [Uncensored L**ked]",https://pic.javct.net/poster/20220707/1660016898.jpg,https://javct.net/v/san-068-rm,120,2026-03-04
PGD-479-RM,"Sister-in-law And Sister-in-law's Obscene - Temptation Tail, Shiho - Under One Roof [Uncensored L**ked]",https://pic.javct.net/poster/01202026/1772590705.jpg,https://javct.net/v/pgd-479-rm,120,2026-03-04
LULU-106-RM,"Super Curvy Huge Ass Wife From The Neighborhood Gets Huge Loads Of Cum Out, Leading Me To Repay Her 3 Times Over With Non-stop Orgasms From All Out Pounding And Intense Fucking. Sumire Chino [Uncensored L**ked]",https://pic.javct.net/poster/20212709/1635594702.jpg,https://javct.net/v/lulu-106-rm,160,2026-03-04
NACR-636-RM,Fucked By Her Husband's Subordinate For 3 Days Kyoko Maki [Uncensored L**ked],https://pic.javct.net/poster/20233001/1676867894.jpg,https://javct.net/v/nacr-636-rm,120,2026-03-04
SAN-069-RM,An Unfaithful Wife With A Strangely Long Tongue Who Was Taken Down By Her Brother-in-law Yuno Kisaragi [Uncensored L**ked],https://pic.javct.net/poster/20221108/1661833995.jpg,https://javct.net/v/san-069-rm,125,2026-03-04
HZGS-001-RM,Driver's Substitution NTR [Uncensored L**ked],https://pic.javct.net/poster/01202026/1772589310.jpg,https://javct.net/v/hzgs-001-rm,120,2026-03-04
NACR-637-RM,"My Brother-In-Law Grabbed My Weakness, And I Get Fucked Every Day... Kanna Misaki [Uncensored L**ked]",https://pic.javct.net/poster/20233001/1676867831.jpg,https://javct.net/v/nacr-637-rm,120,2026-03-04
MXGS-1310-RM,Sakura Misaki Cuckolded A Drunk Married Woman At A Class Reunion And Creampied Her. [Uncensored L**ked],https://pic.javct.net/poster/20231011/1700105236.jpg,https://javct.net/v/mxgs-1310-rm,130,2026-03-04
MOMJ-149-RM,Akari Hoshino In Thailand Really Attacked [Uncensored L**ked],https://pic.javct.net/poster/01202026/1772589643.jpg,https://javct.net/v/momj-149-rm,120,2026-03-04
SCPX-488-RM,I Mistook Her For My Girlfriend And Immediately Cum Inside Her Mother! ! [Uncensored L**ked],https://pic.javct.net/poster/20231912/1703304902.jpg,https://javct.net/v/scpx-488-rm,150,2026-03-04
HALE-075-RM,Mommy Friend Eating Infinite Loop Vol.70 Tomoe Hikari [Uncensored L**ked],https://pic.javct.net/poster/01202026/1772218511.jpg,https://javct.net/v/hale-075-rm,135,2026-03-04
SAN-429-RM,The Story Of A Woman Whose Marriage Collapsed And Her Life Went Haywire - Part 2 / Yu Kawakami [Uncensored L**ked],https://pic.javct.net/poster/01202026/1772472534.jpg,https://javct.net/v/san-429-rm,120,2026-03-04
AGR-006-RM,Nami Horikawa Wife Wife Next Door Super Ripe I Cup Milk [Uncensored L**ked],https://pic.javct.net/poster/01202026/1772589431.jpg,https://javct.net/v/agr-006-rm,90,2026-03-04
VEC-360-RM,The Director's Wife Is Too Erotic ... Azusa Yagi [Uncensored L**ked],https://pic.javct.net/poster/20222311/1671090042.jpg,https://javct.net/v/vec-360-rm,85,2026-03-04
SPRD-800-RM,Ultra Authentic Carnal Fakecest Illustrated - MILF In High-Legged Leotards - Daily Life With Camel Toe Azusa Yagi [Uncensored L**ked],https://pic.javct.net/poster/20221202/1649820952.jpg,https://javct.net/v/sprd-800-rm,120,2026-03-04
SCPX-300-RM,It Is Absolutely Possible To Negotiate Actual Production!Married Wife Changchun Massage [Uncensored L**ked],https://pic.javct.net/poster/01202026/1772553785.jpg,https://javct.net/v/scpx-300-rm,240,2026-03-04
SPRD-804-RM,Charisma Mature Counselor Was Rehabilitated An Inner Brother Continued Withdrawal Super Authentic Functional Load Yarn Erotic Picture Scroll 15 Years Fujishita Rika [Uncensored L**ked],https://pic.javct.net/poster/20242108/1725834708.jpg,https://javct.net/v/sprd-804-rm,120,2026-03-04
SPRD-1095-RM,Her Husband Doesn't Suspect A Thing... Azusa Yagi [Uncensored L**ked],https://pic.javct.net/poster/20221202/1649725384.jpg,https://javct.net/v/sprd-1095-rm,134,2026-03-04
PTS-430-RM,Relentless Nipple Tweaking At The Married Woman Lesbian Massage Parlor A New Style Of Sensual Development Oil Massage [Uncensored L**ked],https://pic.javct.net/poster/20253001/1739036195.jpg,https://javct.net/v/pts-430-rm,191,2026-03-04
