code,title,image_url,page_url,views,date_scraped
START-549-RM,Osaka → Tokyo - An unlimited hospitality tour that traverses the Tokaido and visits male fans and responds to all their requests. 5 sex! Shinkawa Sora [Uncensored L**ked],https://pic.javct.net/poster/04112026/26dcf46ab5.jpg,https://javct.net/v/start-549-rm,274,2026-04-29
URKK-046-RM,A Minimum Of 10 Cum Shots!! She's Shaking Her Big Tits And Cumming Like Crazy So You Can Creampie This Bitch As Much As You Want At This Big Tits Aphrodisiac Salon Leona Tomiyasu [Uncensored L**ked],https://pic.javct.net/poster/20212709/1634387988.jpg,https://javct.net/v/urkk-046-rm,131,2026-04-29
BLOR-294-RM,"Indoor Otaku Girl Falls For Cock. Her Excited Reactions To Her Favorite Character Are Too Cute. Unable To Contain Her Interest In Penises, She Appears In An Adult Video. The Result... ""Cock Cums So Good!"" She Screams. [Uncensored L**ked]",https://pic.javct.net/poster/04112026/1777054719.jpg,https://javct.net/v/blor-294-rm,124,2026-04-29
IESP-617-RM,Mihono Home To Assault Visit!Pies 20 Barrage [Uncensored L**ked],https://pic.javct.net/poster/04112026/75e495ba84.jpg,https://javct.net/v/iesp-617-rm,130,2026-04-29
MIAA-052,Nipple Irritating Spider Cowgirl In Continuous Shooting Out Rejuvenated Massage Yu Shibata,https://pic.javct.net/poster/04112026/190d59d31d.jpg,https://javct.net/v/miaa-052,170,2026-04-29
START-543-RM,"My girlfriend is a natural girl with super big O cup breasts who is easy to get carried away. Today as well, a slut NTR4 situation where her huge breasts are being rubbed by men, her nipples cum immediately, and then she is creampied is Momona Koibuchi. [Uncensored L**ked]",https://pic.javct.net/poster/04112026/0a33a483ea.jpg,https://javct.net/v/start-543-rm,137,2026-04-29
START-549,Osaka → Tokyo - An unlimited hospitality tour that traverses the Tokaido and visits male fans and responds to all their requests. 5 sex! Shinkawa Sora,https://pic.javct.net/poster/04112026/26dcf46ab5.jpg,https://javct.net/v/start-549,274,2026-04-29
FC2PPV-4887956,[S-class beauty] This smile is a national treasure of a 21-year-old female college student who makes her slender body slippery and is satisfied until she is satisfied. A groin massage of a model-shaped beauty is a violation.,https://pic.javct.net/poster/04112026/b62c4e8d80.jpg,https://javct.net/v/fc2ppv-4887956,64,2026-04-29
FC2PPV-4888097,[Complete amateur creampie] A slender and cute office lady whose clitoris is very sensitive and easily stains her panties.The old man is very excited and gets 2 raw creampies in her juice-covered pussy with his thick cock.,https://pic.javct.net/poster/04112026/4f0638ff9c.jpg,https://javct.net/v/fc2ppv-4888097,44,2026-04-29
IPTD-942-RM,Virtual Date with Luke Kanae [Uncensored L**ked],https://pic.javct.net/poster/04112026/8ac172f9aa.jpg,https://javct.net/v/iptd-942-rm,170,2026-04-29
BBTU-010-RM,"You'll Swoon With Pleasure! Breast Oil Massage, Slow Titty Fuck & Slow Sex Yuria Yoshine [Uncensored L**ked]",https://static.javct.net/poster/bbtu-010.jpg,https://javct.net/v/bbtu-010-rm,124,2026-04-29
URKK-039-RM,You'll Cum At Least 10 Times! Big Titty Aphrodisiac Massage Where The Girls Cum And Shake Their Huge Tits While They Let You Fill Them With As Many Loads As You Want Honoka Tsujii [Uncensored L**ked],https://static.javct.net/poster/urkk-039.jpg,https://javct.net/v/urkk-039-rm,135,2026-04-29
758REFUCK-234-RM,Himari-san [Uncensored L**ked],https://pic.javct.net/poster/04112026/08c97683c8.jpg,https://javct.net/v/758refuck-234-rm,74,2026-04-29
START-543,"My girlfriend is a natural girl with super big O cup breasts who is easy to get carried away. Today as well, a slut NTR4 situation where her huge breasts are being rubbed by men, her nipples cum immediately, and then she is creampied is Momona Koibuchi.",https://pic.javct.net/poster/04112026/0a33a483ea.jpg,https://javct.net/v/start-543,137,2026-04-29
SAN-450,What If There Was A Men's Spa Where You Could Have A Real Experience Like This?,https://pic.javct.net/poster/04112026/f7626ccee5.jpg,https://javct.net/v/san-450,115,2026-04-29
JUKF-132,Holiday Teacher Kasumi Sena,https://pic.javct.net/poster/04112026/06f3a2095a.jpg,https://javct.net/v/jukf-132,150,2026-04-29
JUKF-112-RM,"# Doujin AV Ena Satsuki, A Girl I Met On SNS [Uncensored L**ked]",https://pic.javct.net/poster/20241902/1708410786.jpg,https://javct.net/v/jukf-112-rm,146,2026-04-29
AARM-346,A Riot Of Colors! Mature Women's Rejuvenation Massages Are Overflowing With Tenderness And Eroticism.,https://pic.javct.net/poster/04112026/826686f350.jpg,https://javct.net/v/aarm-346,240,2026-04-29
KSBJ-058,"The Cuckold Who Fell In A Bag, Wife Ikawa Nozomi",https://pic.javct.net/poster/04112026/4b65ce093d.jpg,https://javct.net/v/ksbj-058,121,2026-04-29
NXG-444-RM,Office Lady Specialty! Unscrupulous Massage Shop [Uncensored L**ked],https://pic.javct.net/poster/20230908/1695182808.jpg,https://javct.net/v/nxg-444-rm,120,2026-04-29
JUKF-106-RM,The No. 1 Individual Shooting Idol Mitsuki Mitsuki Nagisa Mitsuki Nagisa Mitsuki Nagisa [Uncensored L**ked],https://pic.javct.net/poster/20230908/1695444033.jpg,https://javct.net/v/jukf-106-rm,173,2026-04-29
SIMW-006-RM,Kaho & Rin [Uncensored L**ked],https://pic.javct.net/poster/04112026/1777082672410.jpg,https://javct.net/v/simw-006-rm,96,2026-04-29
MADV-629-RM,"""Don't Tell Anyone..."" My Sister-in-law, A Current College Student, Came Over To My House While My Wife Was Out... I Put A Nose Hook On Her Defenseless Body And Couldn't Hold Back, So I Ejaculated Inside Her Multiple Times... Mizuno Roa [Uncensored L**ked]",https://pic.javct.net/poster/04112026/1777076267.jpg,https://javct.net/v/madv-629-rm,120,2026-04-29
XV-778-RM,Akari Asahina FUCK Let Squid Continuous Climax [Uncensored L**ked],https://pic.javct.net/poster/04112026/c28fedc498.jpg,https://javct.net/v/xv-778-rm,120,2026-04-29
