code,title,image_url,page_url,views,date_scraped
SGKI-087-RM,Public Phone Booth 360 Degrees: Big-breasted Amateur Nipple Listening Challenge [Uncensored L**ked],https://pic.javct.net/poster/04112026/1776726921.jpg,https://javct.net/v/sgki-087-rm,120,2026-04-24
MXGS-137-RM,Iconoclasm Slutty 絶 FUCK! Mai Hagiwara [Uncensored L**ked],https://pic.javct.net/poster/04112026/1776965292.jpg,https://javct.net/v/mxgs-137-rm,120,2026-04-24
FC2PPV-4885569,A beautiful office lady with a great style is coming back to our store.Repeat customers are welcome if they wish to use the oil for a longer period of time.,https://pic.javct.net/poster/04112026/1776906602.jpg,https://javct.net/v/fc2ppv-4885569,53,2026-04-24
CLUB-831-RM,"Even Though My Husband Is Next To Me, I... I... An Unscrupulous Bridal Esthetician Who Only Targets Newlyweds And Seduces The New Wife 70 Cm Next To Her Husband. An Immoral Massage NTR. An Unfaithful Wife Who Learns The Pleasure Of Experiencing Life For The First Time Through Unwanted Sex And Demands A Creampie. [Uncensored L**ked]",https://pic.javct.net/poster/20241902/1709261418.jpg,https://javct.net/v/club-831-rm,210,2026-04-24
WO-020-SUB,Uncontrollable Sexual Desire... Dirty And Lewd Female Doctor Yui Hatano [English Subtitle],https://pic.javct.net/poster/20250903/1742401381.jpg,https://javct.net/v/wo-020-sub,136,2026-04-24
DORI-102-RM,Paco Shooting No.102 Beautiful Body Gal Rena-chan Rena Munakata Who Has A Sunburn After Seeking Pleasure [Uncensored L**ked],https://pic.javct.net/poster/20230908/1694489406.jpg,https://javct.net/v/dori-102-rm,77,2026-04-24
MARA-044-RM,Maki Takarada 's Big Tits Theater Icup!100 Cm [Uncensored L**ked],https://pic.javct.net/poster/04112026/1776825515.jpg,https://javct.net/v/mara-044-rm,123,2026-04-24
KNSM-004-RM,Complete Raw STYLE @ J-kei Shinma Candidate 04 Hidden Bimbo Who Loves Creampies And Fucks With Uncle After School Riko Hino [Uncensored L**ked],https://pic.javct.net/poster/20230908/1694491138.jpg,https://javct.net/v/knsm-004-rm,137,2026-04-24
WAWA-016-RM,Maria Yumeno Revival Second Advent No.1 Miraculous P Cup In Existence [Uncensored L**ked],https://pic.javct.net/poster/20230908/1695269155.jpg,https://javct.net/v/wawa-016-rm,172,2026-04-24
SUJI-199-RM,Adultery Girl Raw ~Konatsu's Circumstances~ Kashiwagi Konatsu [Uncensored L**ked],https://pic.javct.net/poster/20230908/1694838155.jpg,https://javct.net/v/suji-199-rm,104,2026-04-24
DDH-401-RM,Sayuri [Uncensored L**ked],https://pic.javct.net/poster/04112026/1776564831838.jpg,https://javct.net/v/ddh-401-rm,70,2026-04-24
DDH-396-RM,Urara [Uncensored L**ked],https://pic.javct.net/poster/04112026/1776824634835.jpg,https://javct.net/v/ddh-396-rm,72,2026-04-24
798BRV-155-RM,For a naughty married woman... special ejaculation in the vagina without permission 10 [Uncensored L**ked],https://pic.javct.net/poster/04112026/1776824557154.jpg,https://javct.net/v/798brv-155-rm,120,2026-04-24
DDH-400-RM,Kotone [Uncensored L**ked],https://pic.javct.net/poster/04112026/1776824886257.jpg,https://javct.net/v/ddh-400-rm,63,2026-04-24
DDH-397-RM,bean paste [Uncensored L**ked],https://pic.javct.net/poster/04112026/1776824706840.jpg,https://javct.net/v/ddh-397-rm,61,2026-04-24
300MIUM-1362-RM,"She's charming and has K breasts lol [Minimum dynamite] [Smiling busty] [Explosive body] ""I'm nervous, I'm laughing and pretending... but I'm shining"" If you blindfold the charming smiley busty-chan A high-sensitivity pussy that blows all over without even knowing that the K cup is turned on and is in a state of disarray. After the forbidden dick is inserted, the single-minded pile-driving cowgirl position is the best #Female style #Women's sex industry #Peeping :file.38 [Uncensored L**ked]",https://pic.javct.net/poster/04112026/1776824269268.jpg,https://javct.net/v/300mium-1362-rm,100,2026-04-24
JUFD-594,Big Tits Nurse - Yoshikawa Writhes In Voyeur Meat Wet Massage - Incontinence Shame Manami,https://pic.javct.net/poster/04112026/1776824131.jpg,https://javct.net/v/jufd-594,150,2026-04-24
FSPT-054,"Play With Your Good Parts And Cum! 20 Beautiful Girls Climax Masturbation Compilation, About 5 Hours",https://pic.javct.net/poster/04112026/1776793765.jpg,https://javct.net/v/fspt-054,299,2026-04-24
PIYO-143-RM,"At A Schoolgirl Massage Parlor That Doesn't Have Any Secret Options For Sex, A Dick Presses Through Her Soft Panties. Going From 1cm To 3cm, And Then She Realizes The Entire Tip Of His Dick Is Inside Her! ""I Want To Feel A Big Dick Inside Me, But I Can't Say That..."" Is She Offering Some Temptation? Will She Get Horny And Excited From There? ""I Mean It's Already In Me Anyway, Right?"" [Uncensored L**ked]",https://pic.javct.net/poster/20221202/1649323228.jpg,https://javct.net/v/piyo-143-rm,178,2026-04-24
285ENDX-323-RM,A neat female college student who is very excited about her first double blowjob. Her small breasts are extremely sensitive and cute. [Uncensored L**ked],https://pic.javct.net/poster/04112026/1776738105981.jpg,https://javct.net/v/285endx-323-rm,49,2026-04-24
PIYO-181-RM,"It's Not A Sex Shop, It's A J ○ Refre, And It's A Soft Panty, And It's Estrus By Inserting The Whole Glans, And It's A Secretly Vaginal Cum Shot Uncle. [Uncensored L**ked]",https://pic.javct.net/poster/20230908/1695269360.jpg,https://javct.net/v/piyo-181-rm,170,2026-04-24
MARA-042-RM,Hakuren Hikari's Big Tits Theater Hcup 104 Cm [Uncensored L**ked],https://pic.javct.net/poster/04112026/1776737971.jpg,https://javct.net/v/mara-042-rm,137,2026-04-24
DORI-101-RM,Paco Shooting No.101 No Rubber OK! Shy Girl Drenched In Love Juice Mayuna-chan Mitsuhiro Mayuna [Uncensored L**ked],https://pic.javct.net/poster/20230908/1694489477.jpg,https://javct.net/v/dori-101-rm,79,2026-04-24
START-286-SUB,"Honjo Suzu, the ultimate beautiful legs aroma salon that enjoys the reaction of a man who whispers sweetly and holds his beautiful legs together and endures his orgasm. [English Subtitle]",https://pic.javct.net/poster/20250903/1741624811.jpg,https://javct.net/v/start-286-sub,135,2026-04-24
