code,title,image_url,page_url,views,date_scraped
JUKF-104-RM,The Whole Story Of The A**se Of Authority Went To Girls Who Came To An AV Production Company For An Interview With A Director Because They Wanted A Job... (2) 8 People Included [Uncensored L**ked],https://pic.javct.net/poster/20230804/1693020967.jpg,https://javct.net/v/jukf-104-rm,200,2026-05-12
HAR-085-RM,Restrained Sensitive Mako Woman Who Is Jumping At Masturbation!Baki Baki Decachin Is Screwed In Ma Oko And It Is Just Like Fainting SEIKO SEX! ! [Uncensored L**ked],https://pic.javct.net/poster/04112026/812b628ad6.jpg,https://javct.net/v/har-085-rm,125,2026-05-12
NACR-733-RM,Masochistic Awakening Slender Office Lady Mari Ueto [Uncensored L**ked],https://pic.javct.net/poster/20231711/1701712373.jpg,https://javct.net/v/nacr-733-rm,120,2026-05-12
BLOR-297-RM,"The Slutty Stray Bitch Gets A Huge Cock And Her Eyes Roll Back In Ecstasy, Saying ""I Can't Take It Anymore, I Can't Do It"" As She Reaches A Complete Defeat And Orgasm, Then Gets Hit With More Thrusts And Groans Like An Animal. [Uncensored L**ked]",https://pic.javct.net/poster/04112026/74842ada7c.jpg,https://javct.net/v/blor-297-rm,128,2026-05-12
START-556,"The penis is inserted in a string and the pussy is developed for 24 hours, and the sexual experience continues to get wet with love juice. Atsushi Nanase",https://pic.javct.net/poster/04112026/57ef9c5cc8.jpg,https://javct.net/v/start-556,150,2026-05-12
GEBB-044-RM,"""Huh? You're Seriously Hard, Gross..."" A Cool, Masked Beauty Deliberately Rubs Against A Masochistic Man Through Her Thong At A Massage Parlor Specializing In Submissive Men. [Uncensored L**ked]",https://pic.javct.net/poster/04112026/8d7c90bc09.jpg,https://javct.net/v/gebb-044-rm,180,2026-05-12
MIST-208,Take Okita And Insert It!,https://pic.javct.net/poster/04112026/8db33f8286.jpg,https://javct.net/v/mist-208,152,2026-05-12
FC2PPV-4898292,[Amateur POV #037] 19-year-old girl who falls in love with idol-like cute Minami-chan and miraculous first shoot creampie round 2 [review bonus included],https://pic.javct.net/poster/04112026/816617a0f2.jpg,https://javct.net/v/fc2ppv-4898292,71,2026-05-12
FC2PPV-4898685,"[No] [Esthetics] A service massage by a married woman with an E cup who specializes in black customers ♥ While giving a blow job, her uterus becomes erotic and she aggressively stamps the portio in the cowgirl position to the limit of her patience and ends up having orgasms ♥ [Overseas version] Bonus included",https://pic.javct.net/poster/04112026/a35ffa489d.jpg,https://javct.net/v/fc2ppv-4898685,53,2026-05-12
FC2PPV-4898377,"Sumire (18) The cutest girl in the second shoot, has a video of different angles of view, creampie, electric masturbation, anal penetration ATM, piston machine, and finally cosplay and creampie.",https://pic.javct.net/poster/04112026/3e21ffb8cd.jpg,https://javct.net/v/fc2ppv-4898377,174,2026-05-12
JUKF-103-RM,"Mr. Hamasaki, Mao Hamasaki, Foreign Language Class Teacher [Uncensored L**ked]",https://pic.javct.net/poster/20230804/1693021071.jpg,https://javct.net/v/jukf-103-rm,153,2026-05-12
FC2PPV-4898646,[Individual photo shoot] Blindfolded sex training of a slightly chubby girl who is tired of being a girl,https://pic.javct.net/poster/04112026/f6970a3a5f.jpg,https://javct.net/v/fc2ppv-4898646,33,2026-05-12
IMJO-007,[Female style voyeur] The real sexual reality of modern girls captured by the camera [Women's After 5] [Yuri],https://pic.javct.net/poster/04112026/83b3b23c9e.jpg,https://javct.net/v/imjo-007,69,2026-05-12
WZEN-071-RM,Banned 20 Nice Booty Trainer Anna (27) [Uncensored L**ked],https://pic.javct.net/poster/20230804/1692936003.jpg,https://javct.net/v/wzen-071-rm,127,2026-05-12
SDMM-098-RM,"Magic Mirror Can You Give Me A Beautician-only ""testicle Massage""? Includes 4 Gentle Amateur Girls Who Carefully Massaged And Loosened The Gold Ball Of A Man Who Is In Trouble With Erectile Dysfunction 2 [Uncensored L**ked]",https://pic.javct.net/poster/20212709/1634642118.jpg,https://javct.net/v/sdmm-098-rm,215,2026-05-12
GEBB-044,"""Huh? You're Seriously Hard, Gross..."" A Cool, Masked Beauty Deliberately Rubs Against A Masochistic Man Through Her Thong At A Massage Parlor Specializing In Submissive Men.",https://pic.javct.net/poster/04112026/8d7c90bc09.jpg,https://javct.net/v/gebb-044,180,2026-05-12
MDTM-155-RM,Reputation Rhythmic Gymnastics Staff At The School Is Spree Sensitive Serious Sex! ! Yuna Himekawa [Uncensored L**ked],https://pic.javct.net/poster/20230104/1681342357.jpg,https://javct.net/v/mdtm-155-rm,130,2026-05-12
FNEO-075-RM,Mesugaki 05 Let's Make A Baby! A Serious Beautiful Girl Slips Out Of School And Has A Secret Hotel Date With Her Favorite Uncle. Riko Hino [Uncensored L**ked],https://pic.javct.net/poster/20230804/1693110558.jpg,https://javct.net/v/fneo-075-rm,118,2026-05-12
MADV-630-RM,"""Don't Say It..."" Special Edition Yui Hatano [Uncensored L**ked]",https://pic.javct.net/poster/04112026/646f69c21f.jpg,https://javct.net/v/madv-630-rm,120,2026-05-12
FC2PPV-4896469,[Solo shot] A famous esthetician gets fucked in order to pay off her debt...,https://pic.javct.net/poster/04112026/712a9f2759.jpg,https://javct.net/v/fc2ppv-4896469,31,2026-05-12
ROYD-314-RM,"""Just The Tip"" Is Humanity's Greatest Lie. A Devilish, Slutty Therapist Pretends Not To Notice And Continues The Treatment With A 2cm Insertion Through The Cloth. Sarina Hyakunaga [Uncensored L**ked]",https://pic.javct.net/poster/04112026/997e3e7782.jpg,https://javct.net/v/royd-314-rm,130,2026-05-12
GMEM-100-RM,ULTRA SWEET Akagai Pretty Soldier Strong Indecent Ascension Training ~ Sorrowful Iki Crazy Pleasure Flowering Young Flesh ~ Yura Hinata [Uncensored L**ked],https://pic.javct.net/poster/20230804/1692416261.jpg,https://javct.net/v/gmem-100-rm,150,2026-05-12
JUKF-102-RM,# Doujin AV Megu Megu Mio Megu Behind The Scenes On SNS [Uncensored L**ked],https://pic.javct.net/poster/20230804/1693021132.jpg,https://javct.net/v/jukf-102-rm,158,2026-05-12
MDTM-111-RM,Nagomi After School Pretty Rejuvenated Reflexology [Uncensored L**ked],https://pic.javct.net/poster/04112026/6a2a7234c2.jpg,https://javct.net/v/mdtm-111-rm,120,2026-05-12
