code,title,image_url,page_url,views,date_scraped
URKK-052-RM,Get Off At Least 10 Times! Aphrodisiac Sex Salon With Big Titty Girls Whose Huge Boobs Shake And Bounce As They Cum! They'll Let You Cum Inside Of Them As Much As You Want! Rino Yuki [Uncensored L**ked],https://pic.javct.net/poster/20212011/1641616600.jpg,https://javct.net/v/urkk-052-rm,136,2026-05-02
HAR-076-RM,Girls Who Are More Liberal Than Ordinary People Athlete People Doubled Pleasant Sensation Due To The Effect Of Aphrodisiac Oil And Sprinkle At The God Wightly Position [Uncensored L**ked],https://pic.javct.net/poster/04112026/5a4eee5d19.jpg,https://javct.net/v/har-076-rm,130,2026-05-02
EKW-083-RM,A Plenty Of Service That Will Make Your Cock Slip Hard  Reservation Difficulty Big Boobs Sandwiched Esthetician Chitose Yuuki [Uncensored L**ked],https://pic.javct.net/poster/20222109/1663917380.jpg,https://javct.net/v/ekw-083-rm,122,2026-05-02
ATOM-108-RM,Amateur Limited!Super Sticky Birdlime Restraint Well-paid Part-time Job! [Uncensored L**ked],https://pic.javct.net/poster/04112026/b5be0a1b3e.jpg,https://javct.net/v/atom-108-rm,135,2026-05-02
MIDA-611-RM,"""Is A Cute Kiss Not Enough?"" A Devilish Tongue Kiss That Drives Men Wild, A Love That Leaves Them Drooling, Licking, Sucking, And Drowning In Saliva, A Rejuvenating Reflexology Session With Shiraishi Nami. [Uncensored L**ked]",https://pic.javct.net/poster/04112026/a5f0e6c0d4.jpg,https://javct.net/v/mida-611-rm,120,2026-05-02
MNGS-051-RM,"The Masseuse Massaged My Sensitive Private Parts So Intensely That I Couldn't Control My Pleasure And My Urethra Burst, Spraying A Massive Load Of Orgasmic Fluid Onto The Curtain, And I Got NTR'd... Ayatsuki Nanao [Uncensored L**ked]",https://pic.javct.net/poster/04112026/2037536efc.jpg,https://javct.net/v/mngs-051-rm,170,2026-05-02
FC2PPV-4890498,[Individual video] Affair sex with a frustrated slender married woman at a married woman's house,https://pic.javct.net/poster/04112026/e268046dbb.jpg,https://javct.net/v/fc2ppv-4890498,23,2026-05-02
FC2PPV-4892042,"Mr. JD, who has a calm demeanor and whose eyes droop when he smiles, came to our store with an active approach looking for stimulation.",https://pic.javct.net/poster/04112026/4771eb4a3b.jpg,https://javct.net/v/fc2ppv-4892042,43,2026-05-02
URKK-050-RM,Get At Least 10 Shots Off!! Big Tits Aphrodisiac Salon Where Endless Creampies Possible As Big Tits Shake. Misono Mizuhara [Uncensored L**ked],https://pic.javct.net/poster/20212011/1639218234.jpg,https://javct.net/v/urkk-050-rm,123,2026-05-02
WO-025-RM,Masochistic Girl: Toy To**ure Lecture - Sae Niwa [Uncensored L**ked],https://pic.javct.net/poster/04112026/4c4c2215fe.jpg,https://javct.net/v/wo-025-rm,130,2026-05-02
XRW-639-RM,Aphrodisiacs With Big Daughter Who Actively Daddy After School And Squirting And Raw Vaginal Cum Shot Record Image Yui Chan [Uncensored L**ked],https://pic.javct.net/poster/04112026/c1b61f3b8a.jpg,https://javct.net/v/xrw-639-rm,156,2026-05-02
MNGS-051,"The Masseuse Massaged My Sensitive Private Parts So Intensely That I Couldn't Control My Pleasure And My Urethra Burst, Spraying A Massive Load Of Orgasmic Fluid Onto The Curtain, And I Got NTR'd... Ayatsuki Nanao",https://pic.javct.net/poster/04112026/2037536efc.jpg,https://javct.net/v/mngs-051,170,2026-05-02
MIDA-611,"""Is A Cute Kiss Not Enough?"" A Devilish Tongue Kiss That Drives Men Wild, A Love That Leaves Them Drooling, Licking, Sucking, And Drowning In Saliva, A Rejuvenating Reflexology Session With Shiraishi Nami.",https://pic.javct.net/poster/04112026/a5f0e6c0d4.jpg,https://javct.net/v/mida-611,120,2026-05-02
FC2PPV-4891124,"[Complete secret version] [SSS-class beauty] [Creampie] [Facial appearance] [Celebrity resemblance] Tokyo's high-class lounge manager and hostess, Akane-san's abomination [Chapter 3]",https://pic.javct.net/poster/04112026/68d1c0de67.jpg,https://javct.net/v/fc2ppv-4891124,105,2026-05-02
DDH-392,Karen & Saya,https://pic.javct.net/poster/04112026/269a0d7ad2.jpg,https://javct.net/v/ddh-392,67,2026-05-02
DDH-392-RM,Karen & Saya [Uncensored L**ked],https://pic.javct.net/poster/04112026/269a0d7ad2.jpg,https://javct.net/v/ddh-392-rm,67,2026-05-02
BBTU-014-RM,Writhing Pleasure Bouncing Titty Oil Massage Slow Titty Fucking & Slow Sex Miu Arioka [Uncensored L**ked],https://static.javct.net/poster/1623926716.jpg,https://javct.net/v/bbtu-014-rm,144,2026-05-02
JUY-297-RM,Married Woman Babes Are Hooked On The Pleasure They Get From This Lusty Massage Parlor Ryoko Furusawa [Uncensored L**ked],https://pic.javct.net/poster/20220707/1659839138.jpg,https://javct.net/v/juy-297-rm,147,2026-05-02
MOND-256-RM,The Beautiful Neighborhood Wife Is Sae Fujiki [Uncensored L**ked],https://pic.javct.net/poster/20230908/1694233985.jpg,https://javct.net/v/mond-256-rm,140,2026-05-02
XRW-633-RM,Shock AV Appeared! Sudden Shemale Binika! Japanese Bondage Master Rectangle Chapter 4 KANNA [Uncensored L**ked],https://pic.javct.net/poster/04112026/f2da6c3dae.jpg,https://javct.net/v/xrw-633-rm,125,2026-05-02
URKK-048-RM,"At Least 10 Cum Shots Of Nookie!! Welcome To The Big Tits Aphrodisiac Salon, Where You Can Get As Many Creampie Cum Shots As You Like While They Jiggle And Wiggle Their Big Tits While You Cum Like Crazy Yuria Hakaze [Uncensored L**ked]",https://pic.javct.net/poster/20212709/1636256031.jpg,https://javct.net/v/urkk-048-rm,132,2026-05-02
SAN-450-RM,What If There Was A Men's Spa Where You Could Have A Real Experience Like This? [Uncensored L**ked],https://pic.javct.net/poster/04112026/f7626ccee5.jpg,https://javct.net/v/san-450-rm,115,2026-05-02
FC2PPV-4890878,"Case #130 where an amateur came to do naughty things with her face exposed. The case of Yui-chan (20), a JD who works part-time at a cute bar with a graceful and charming style.",https://pic.javct.net/poster/04112026/a52fe5aece.jpg,https://javct.net/v/fc2ppv-4890878,59,2026-05-02
FC2PPV-4890500,[Individual shooting] Because I don't usually reply.. Raw sex with a married woman who came for an AV interview,https://pic.javct.net/poster/04112026/526fb767a9.jpg,https://javct.net/v/fc2ppv-4890500,28,2026-05-02
