code,title,image_url,page_url,views,date_scraped
MIDD-862-RM,Akira Makise Acme Body Modification [Uncensored L**ked],https://pic.javct.net/poster/01202026/1772592318.jpg,https://javct.net/v/midd-862-rm,120,2026-05-09
SCOP-706,Illegal Existence In A Multi-tenant Building In A Certain Downtown Area J ● Active Girls In Refre ● There Are Rumors That Students Are Providing Illegal Reflation Services To Men At Night! Geki Kawa X Erotic Little Devil J ● Thorough Refre Misses SCOOOP!,https://pic.javct.net/poster/04112026/b8f2ad7ee6.jpg,https://javct.net/v/scop-706,150,2026-05-09
DVAJ-742,"""We're Not A Brothel, Haha,"" Says The Mischievous Scrub Girl In This Wholesome Sauna, Running Her Fingers All The Way To The Edge Of Your Crotch, Smirking As She Stares At Your Erection Peeking Out From Your Paper Underwear. 23 Sweaty Ruined Detox Sessions With Yuika Onosaka.",https://pic.javct.net/poster/04112026/7303deb880.jpg,https://javct.net/v/dvaj-742,150,2026-05-09
MADV-630,"""Don't Say It..."" Special Edition Yui Hatano",https://pic.javct.net/poster/04112026/646f69c21f.jpg,https://javct.net/v/madv-630,120,2026-05-09
HSODA-114-RM,"Magic Mirror NTR Massage Parlor: My Beautiful Slender Girlfriend Is Being Cuckolded Next To Me, But I Can't Resist The Amazing Technique Of The Big Breasted Masseuse And I Ended Up Having Raw Sex With Her - Hasumi Kurea, Misaki Oto [Uncensored L**ked]",https://pic.javct.net/poster/04112026/8bb06b74d1.jpg,https://javct.net/v/hsoda-114-rm,130,2026-05-09
CLUB-818-RM,"Sports Trainer Chiropractic Treatment Clinic 16 That Targets Only Competitive Swimming Athletes, Attached To Ichiru University Of Education [Uncensored L**ked]",https://pic.javct.net/poster/20230908/1695963741.jpg,https://javct.net/v/club-818-rm,230,2026-05-09
CLUB-841-RM,39 Chiropractic Therapy Clinic For Female Teachers In Bunkyo Ward [Uncensored L**ked],https://pic.javct.net/poster/20241804/1717125132.jpg,https://javct.net/v/club-841-rm,230,2026-05-09
DFDM-036-RM,Big Ass Show Temptation Men's Massage Parlor Yuri Oshikawa [Uncensored L**ked],https://pic.javct.net/poster/20230804/1692933613.jpg,https://javct.net/v/dfdm-036-rm,120,2026-05-09
HSODA-116,"Relieve Erectile Dysfunction. A Blissful Moment To Enhance Male Function. The Ultimate Firm Testicular Massage Esthetic Salon, Hibiki Ren.",https://pic.javct.net/poster/04112026/41f58ae057.jpg,https://javct.net/v/hsoda-116,180,2026-05-09
HUNTC-498,"""Please Do Not Remove Your Blindfold During The Treatment,"" Says The Esthetician, Whose Love Juices Overflow From Her Honey Pot, Leaving Your Entire Body Moist And Smooth! At This Esthetic Salon, Which Is The Talk Of The Town On Social Media, The Estheticians Rub Their Pussy All Over You With Their Lower Bodies Exposed! And With A Smile, They Even Insert My Dick Directly Into Their Honey Pot!",https://pic.javct.net/poster/04112026/9c0ccf45cb.jpg,https://javct.net/v/huntc-498,150,2026-05-09
HSODA-114,"Magic Mirror NTR Massage Parlor: My Beautiful Slender Girlfriend Is Being Cuckolded Next To Me, But I Can't Resist The Amazing Technique Of The Big Breasted Masseuse And I Ended Up Having Raw Sex With Her - Hasumi Kurea, Misaki Oto",https://pic.javct.net/poster/04112026/8bb06b74d1.jpg,https://javct.net/v/hsoda-114,130,2026-05-09
ROYD-314,"""Just The Tip"" Is Humanity's Greatest Lie. A Devilish, Slutty Therapist Pretends Not To Notice And Continues The Treatment With A 2cm Insertion Through The Cloth. Sarina Hyakunaga",https://pic.javct.net/poster/04112026/997e3e7782.jpg,https://javct.net/v/royd-314,130,2026-05-09
AED-258-RM,Mature Woman's Playtime: A 50-Year-Old Mother Gets Hooked On Female-Oriented Escort Services - Yurine Tsukino [Uncensored L**ked],https://pic.javct.net/poster/04112026/1ba5048bec.jpg,https://javct.net/v/aed-258-rm,120,2026-05-09
FW-009-RM,She begins her newlywed life with her Yankee father-in-law who is addicted to gambling. The process of a father-in-law turning his serious stepdaughter into a sex slave Mai Arisu [Uncensored L**ked],https://pic.javct.net/poster/04112026/f653e4e093.jpg,https://javct.net/v/fw-009-rm,153,2026-05-09
AED-258,Mature Woman's Playtime: A 50-Year-Old Mother Gets Hooked On Female-Oriented Escort Services - Yurine Tsukino,https://pic.javct.net/poster/04112026/1ba5048bec.jpg,https://javct.net/v/aed-258,120,2026-05-09
FC2PPV-4896293,A tall and beautiful office lady with an outstanding figure has become a repeat customer because she liked the treatment with the massage equipment. She is working long hours and is at her limit of stress.,https://pic.javct.net/poster/04112026/3d02f63cc5.jpg,https://javct.net/v/fc2ppv-4896293,57,2026-05-09
MDTM-050-RM,After School Girl Rejuvenated Reflexology Ayane [Uncensored L**ked],https://pic.javct.net/poster/04112026/6b3bc44485.jpg,https://javct.net/v/mdtm-050-rm,120,2026-05-09
FW-009,She begins her newlywed life with her Yankee father-in-law who is addicted to gambling. The process of a father-in-law turning his serious stepdaughter into a sex slave Mai Arisu,https://pic.javct.net/poster/04112026/f653e4e093.jpg,https://javct.net/v/fw-009,153,2026-05-09
HZGD-068-RM,A Married Woman Colossal Tits Spence Gland Massage Parlor Aimi Yoshikawa [Uncensored L**ked],https://pic.javct.net/poster/20212011/1641350590.jpg,https://javct.net/v/hzgd-068-rm,120,2026-05-09
SKMJ-426-RM,"Have A Boyfriend, But A Man And A Woman Who Are Good Friends Are Sticking To The Oil Esthetic Slimy Intercrural Sex Experience! ? A Pounding Oil Massage With A Female Friend Who Has A Girlfriend... Growing Awareness Of The Opposite Sex & Libido WW Oma Kotochi Do Friends Men And Women Who Rub Each Other Can't Keep Their Reason And Insert It Nullly As They Desire? ? 2 [Uncensored L**ked]",https://pic.javct.net/poster/20230908/1694177417.jpg,https://javct.net/v/skmj-426-rm,236,2026-05-09
URKK-056-RM,Have To Get Out 10 Shots Of Cum At The Very Least! Big Tits Are Swaying All Over While Orgasming And Taking Non-stop Creampie Cum Loads At This Big Tits Magic Chems Salon. Sarina Momonaga [Uncensored L**ked],https://pic.javct.net/poster/20221202/1646476927.jpg,https://javct.net/v/urkk-056-rm,136,2026-05-09
URKK-054-RM,Minimum Of 10 Shots! Huge Tit Aphrodisiac Salon With Unlimited Cream Pies As They Shake Tits. Alice Kisaki [Uncensored L**ked],https://pic.javct.net/poster/20212011/1644066690.jpg,https://javct.net/v/urkk-054-rm,132,2026-05-09
FC2PPV-4895817,[Musume of a sushi restaurant/Gonzo version] I can't repay my debt to a picture scammer and take a sex video,https://pic.javct.net/poster/04112026/7a739e0ea4.jpg,https://javct.net/v/fc2ppv-4895817,72,2026-05-09
MFCS-204-RM,Luke [Uncensored L**ked],https://pic.javct.net/poster/04112026/81849bc18d.jpg,https://javct.net/v/mfcs-204-rm,92,2026-05-09
