code,title,image_url,page_url,views,date_scraped
NXG-442-RM,"Even Though It's Old, ""Washa, I've Made A Woman A Captive With This Technique!"" [Uncensored L**ked]",https://pic.javct.net/poster/20230908/1695182979.jpg,https://javct.net/v/nxg-442-rm,120,2026-04-26
STAR-952-RM,Super Close Contact! Innocence Innocence Ichaicha Squirrel Oil Massage Salon Kiritani Festival [Uncensored L**ked],https://pic.javct.net/poster/20250606/1751846069.jpg,https://javct.net/v/star-952-rm,125,2026-04-26
AARM-344,Therapist's Lewd Techniques In Men's Spas (Part 2),https://pic.javct.net/poster/04112026/3a7c810fdb.jpg,https://javct.net/v/aarm-344,130,2026-04-26
SIMW-006,Kaho & Rin,https://pic.javct.net/poster/04112026/1777082672410.jpg,https://javct.net/v/simw-006,96,2026-04-26
MADV-629,"""Don't Tell Anyone..."" My Sister-in-law, A Current College Student, Came Over To My House While My Wife Was Out... I Put A Nose Hook On Her Defenseless Body And Couldn't Hold Back, So I Ejaculated Inside Her Multiple Times... Mizuno Roa",https://pic.javct.net/poster/04112026/1777076267.jpg,https://javct.net/v/madv-629,120,2026-04-26
SONE-629-SUB,If You Get An Erection During A Risky VIO Treatment... A Beautiful And Sexy Men's Hair Removal Girl Will Gently Give You A Handjob With A Spirit Of Service. Hana Alice [English Subtitle],https://pic.javct.net/poster/20253001/1741287174.jpg,https://javct.net/v/sone-629-sub,120,2026-04-26
EMBM-016-RM,A Beautiful Wife Who Lives Next Door To A Men's Esthetician? Absolutely Secret Creampie Affair Starting From There Yuri Hanai [Uncensored L**ked],https://pic.javct.net/poster/20230908/1695181222.jpg,https://javct.net/v/embm-016-rm,109,2026-04-26
HODV-20559-RM,Kirara Hana Tomorrow Obscenity Mouth Full [Uncensored L**ked],https://pic.javct.net/poster/04112026/1777049295.jpg,https://javct.net/v/hodv-20559-rm,120,2026-04-26
BLOR-294,"Indoor Otaku Girl Falls For Cock. Her Excited Reactions To Her Favorite Character Are Too Cute. Unable To Contain Her Interest In Penises, She Appears In An Adult Video. The Result... ""Cock Cums So Good!"" She Screams.",https://pic.javct.net/poster/04112026/1777054719.jpg,https://javct.net/v/blor-294,124,2026-04-26
FSPT-054-RM,"Play With Your Good Parts And Cum! 20 Beautiful Girls Climax Masturbation Compilation, About 5 Hours [Uncensored L**ked]",https://pic.javct.net/poster/04112026/1776793765.jpg,https://javct.net/v/fspt-054-rm,299,2026-04-26
FC2PPV-4886228,[Neat] Gachihame SEX with a fair-skinned beautiful office lady,https://pic.javct.net/poster/04112026/1777013129.jpg,https://javct.net/v/fc2ppv-4886228,49,2026-04-26
HUNTB-698-RM,"""Eh! Is This A Practical Training?"" I'm The Only Man When I Enter An Esthetic Vocational School! Practicing Touches A Girl's Body With A Towel! My Crotch Is Touched And Full Erection 4 [Uncensored L**ked]",https://pic.javct.net/poster/20230908/1695362594.jpg,https://javct.net/v/huntb-698-rm,240,2026-04-26
SGKI-087-RM,Public Phone Booth 360 Degrees: Big-breasted Amateur Nipple Listening Challenge [Uncensored L**ked],https://pic.javct.net/poster/04112026/1776726921.jpg,https://javct.net/v/sgki-087-rm,120,2026-04-26
MXGS-137-RM,Iconoclasm Slutty 絶 FUCK! Mai Hagiwara [Uncensored L**ked],https://pic.javct.net/poster/04112026/1776965292.jpg,https://javct.net/v/mxgs-137-rm,120,2026-04-26
FC2PPV-4885569,A beautiful office lady with a great style is coming back to our store.Repeat customers are welcome if they wish to use the oil for a longer period of time.,https://pic.javct.net/poster/04112026/1776906602.jpg,https://javct.net/v/fc2ppv-4885569,53,2026-04-26
CLUB-831-RM,"Even Though My Husband Is Next To Me, I... I... An Unscrupulous Bridal Esthetician Who Only Targets Newlyweds And Seduces The New Wife 70 Cm Next To Her Husband. An Immoral Massage NTR. An Unfaithful Wife Who Learns The Pleasure Of Experiencing Life For The First Time Through Unwanted Sex And Demands A Creampie. [Uncensored L**ked]",https://pic.javct.net/poster/20241902/1709261418.jpg,https://javct.net/v/club-831-rm,210,2026-04-26
WO-020-SUB,Uncontrollable Sexual Desire... Dirty And Lewd Female Doctor Yui Hatano [English Subtitle],https://pic.javct.net/poster/20250903/1742401381.jpg,https://javct.net/v/wo-020-sub,136,2026-04-26
DORI-102-RM,Paco Shooting No.102 Beautiful Body Gal Rena-chan Rena Munakata Who Has A Sunburn After Seeking Pleasure [Uncensored L**ked],https://pic.javct.net/poster/20230908/1694489406.jpg,https://javct.net/v/dori-102-rm,77,2026-04-26
MARA-044-RM,Maki Takarada 's Big Tits Theater Icup!100 Cm [Uncensored L**ked],https://pic.javct.net/poster/04112026/1776825515.jpg,https://javct.net/v/mara-044-rm,123,2026-04-26
KNSM-004-RM,Complete Raw STYLE @ J-kei Shinma Candidate 04 Hidden Bimbo Who Loves Creampies And Fucks With Uncle After School Riko Hino [Uncensored L**ked],https://pic.javct.net/poster/20230908/1694491138.jpg,https://javct.net/v/knsm-004-rm,137,2026-04-26
WAWA-016-RM,Maria Yumeno Revival Second Advent No.1 Miraculous P Cup In Existence [Uncensored L**ked],https://pic.javct.net/poster/20230908/1695269155.jpg,https://javct.net/v/wawa-016-rm,172,2026-04-26
SUJI-199-RM,Adultery Girl Raw ~Konatsu's Circumstances~ Kashiwagi Konatsu [Uncensored L**ked],https://pic.javct.net/poster/20230908/1694838155.jpg,https://javct.net/v/suji-199-rm,104,2026-04-26
DDH-401-RM,Sayuri [Uncensored L**ked],https://pic.javct.net/poster/04112026/1776564831838.jpg,https://javct.net/v/ddh-401-rm,70,2026-04-26
DDH-396-RM,Urara [Uncensored L**ked],https://pic.javct.net/poster/04112026/1776824634835.jpg,https://javct.net/v/ddh-396-rm,72,2026-04-26
