code,title,image_url,page_url,views,date_scraped
348NTR-007-RM,"An unannounced 3P with a serious office lady. Watching her depressed boyfriend, the quiet, serious office lady takes turns with her hard pistons, and the sweet cries of a lewd female that suddenly echoes in the room with her two male dicks. Her sensitive body trembles little by little as she shyly cums... The finish is with a large amount of semen being sprayed on her dignified face. NTR.net case7 [Uncensored L**ked]",https://pic.javct.net/poster/05192026/c4b28d2380.jpg,https://javct.net/v/348ntr-007-rm,86,2026-05-31
MIDD-918-RM,[Reducing Mosaic] Sexual Healing Men's Massage Parlor - Miku Ohashi [Uncensored L**ked],https://static.javct.net/poster/midd-918.jpg,https://javct.net/v/midd-918-rm,118,2026-05-31
RDT-181-RM,"Rookie Female Teacher To Relieve Stress Painful Not Tell Anyone The Trouble In The Workplace, To Seduce Therapist In Bodywork Salon After Work [Uncensored L**ked]",https://pic.javct.net/poster/05192026/ba7b457215.jpg,https://javct.net/v/rdt-181-rm,120,2026-05-31
MDTM-363-RM,Shin New Zealand Bishoujo Spring Reflexology + Vol.012 Aya Sasami [Uncensored L**ked],https://pic.javct.net/poster/05192026/a486bd1594.jpg,https://javct.net/v/mdtm-363-rm,120,2026-05-31
MIDD-951,Yuria Satomi Esthetician Dedicated Rejuvenated Man M,https://pic.javct.net/poster/05192026/8a56d6e078.jpg,https://javct.net/v/midd-951,120,2026-05-31
HUNTB-602-RM,"The Body Wash Reflexology Found On A Business Trip Is Strongly Stated That It Is Not A Sex Shop! Anything From Kisses, Handjobs, And Live Performances! [Uncensored L**ked]",https://pic.javct.net/poster/20230207/1688701445.jpg,https://javct.net/v/huntb-602-rm,150,2026-05-31
KAM-135-RM,Record Of A Perverted Erotic Manipulator Who Repeatedly Acted Obscene Acts To A Busty Beauty Who Became A Generalized Sensitive Zone With A Secret Rejuvenating Massage Momo Minami [Uncensored L**ked],https://pic.javct.net/poster/20230207/1689309944.jpg,https://javct.net/v/kam-135-rm,120,2026-05-31
FC2PPV-4909459,"[Individual video] A frustrated young girl is fucked, her arms and legs are restrained and she squirts to climax",https://pic.javct.net/poster/05192026/846a51fbd9.jpg,https://javct.net/v/fc2ppv-4909459,25,2026-05-31
FOD-004,"""If I Were Your Husband, I Wouldn't Let You Feel So Lonely..."" The One Magic Phrase That Allows Me, A Socially Awkward Guy, To See Through A Dependent, Mentally Unstable Housewife, Trap Her In My Heart, And Drive Her Crazy ()",https://pic.javct.net/poster/05192026/88d1b283d8.jpg,https://javct.net/v/fod-004,126,2026-05-31
JUKF-047-RM,"Serious And Naive Girl Troubles ""Please Tell Me The Teacher"" Ichika-chan (A Cup) Ichika Matsumoto [Uncensored L**ked]",https://pic.javct.net/poster/20241115/1733099520.jpg,https://javct.net/v/jukf-047-rm,155,2026-05-31
FC2PPV-4908423,"[Idol SSS class] [Limited quantity, all episodes available for viewing] [Completely secret version] Dedicated to everyone who loves FC2 Tsundere type Kanna-chan, quarter 19-year-old JD shows off her true abomination [Chapter 12]",https://pic.javct.net/poster/05192026/12c6a7c701.jpg,https://javct.net/v/fc2ppv-4908423,99,2026-05-31
MAD-096-RM,Wu Rui Saotome Horse Tied Its [Uncensored L**ked],https://pic.javct.net/poster/05192026/a2c2500133.jpg,https://javct.net/v/mad-096-rm,125,2026-05-31
XV-660-RM,New Comer Ria Sakurai [Uncensored L**ked],https://pic.javct.net/poster/05192026/d5e1657c95.jpg,https://javct.net/v/xv-660-rm,120,2026-05-31
SOE-756-RM,Ruri Saijo 3 Hour Special Discount Big FUCK Leverage [Uncensored L**ked],https://pic.javct.net/poster/05192026/432f1730ee.jpg,https://javct.net/v/soe-756-rm,180,2026-05-31
FC2PPV-4908256,"[Complete amateur creampie] A super beautiful office lady with a captivating body seduces an old man's cock for the first time.With a raw cock, one creampie and two pussy hair ejaculations with a large amount of splash.",https://pic.javct.net/poster/05192026/ae49caae93.jpg,https://javct.net/v/fc2ppv-4908256,54,2026-05-31
435MFC-054-RM,Naako [Uncensored L**ked],https://pic.javct.net/poster/05192026/8a2b65b597.jpg,https://javct.net/v/435mfc-054-rm,80,2026-05-31
STAR-991-RM,That Rumor That You Can Not Make A Reservation!Completely Supervised By Shimbashi's Famous Shop Leads To Terrible Ejaculation Testimony Simultaneous Blame Spring Esther Kato Momoka [Uncensored L**ked],https://pic.javct.net/poster/05192026/b8c2cb9d66.jpg,https://javct.net/v/star-991-rm,135,2026-05-31
ONEZ-107-RM,My Wife Who Was Snatched With Portio Development Oil Massage ... Vol.001 Namiki Anna [Uncensored L**ked],https://pic.javct.net/poster/05192026/6c9dbee64b.jpg,https://javct.net/v/onez-107-rm,130,2026-05-31
JJPP-044,Sexual Harassment Lessons Voyeur Post Of The Original Yoga Classroom Mature Attend Shigeku Foot For Menopause Eliminated 5,https://pic.javct.net/poster/05192026/eace63bb59.jpg,https://javct.net/v/jjpp-044,125,2026-05-31
MUGON-106-RM,Woman Pretend To Be Asleep (MUGON-106) [Uncensored L**ked],https://pic.javct.net/poster/05192026/4d5e54d1fb.jpg,https://javct.net/v/mugon-106-rm,120,2026-05-31
STAR-991,That Rumor That You Can Not Make A Reservation!Completely Supervised By Shimbashi's Famous Shop Leads To Terrible Ejaculation Testimony Simultaneous Blame Spring Esther Kato Momoka,https://pic.javct.net/poster/05192026/b8c2cb9d66.jpg,https://javct.net/v/star-991,135,2026-05-31
300MIUM-1391-RM,"[Physical disparity naughty] A complete recording of the whole story of renting the minimum beautiful girl Yuna-chan as a girlfriend and seducing her and doing erotic acts that were originally prohibited. Proof of the theory that the shorter the height, the more intense the sexual desire w The blowjob crazy who wants to lick the dick all the time. Raw sex & plenty of creampie in the tight pussy of the slender body [Rental Girlfriend] [Uncensored L**ked]",https://pic.javct.net/poster/05192026/d8717e8206.jpg,https://javct.net/v/300mium-1391-rm,117,2026-05-31
300MIUM-1391,"[Physical disparity naughty] A complete recording of the whole story of renting the minimum beautiful girl Yuna-chan as a girlfriend and seducing her and doing erotic acts that were originally prohibited. Proof of the theory that the shorter the height, the more intense the sexual desire w The blowjob crazy who wants to lick the dick all the time. Raw sex & plenty of creampie in the tight pussy of the slender body [Rental Girlfriend]",https://pic.javct.net/poster/05192026/d8717e8206.jpg,https://javct.net/v/300mium-1391,117,2026-05-31
SKMJ-754-RM,Going Too Far And Dying! Goddess-level Escort Girls Who Casually Offer Intense Extra Services! 10 Hand-picked No.1 Cast Members From Each Store! I'll Be Secretly Filming Them Everywhere - 300-minute Special! [Uncensored L**ked],https://pic.javct.net/poster/05192026/16ae6d6aa4.jpg,https://javct.net/v/skmj-754-rm,300,2026-05-31
