code,title,image_url,page_url,views,date_scraped
C-2330,Hot Wise Spa Worship # 017,https://pic.javct.net/poster/04112026/36b564cd12.jpg,https://javct.net/v/c-2330,150,2026-04-28
KSBJ-059,Widow's Mother-in-law Maiko Yuki Who Tempts Her Daughter-in-law,https://pic.javct.net/poster/04112026/27954f968d.jpg,https://javct.net/v/ksbj-059,114,2026-04-28
SGM-042-RM,Outdoors ● Psychopathic Strength In The Remote Mountains ● Married Women Who Were Attacked By Demons And Cried In Vain And Covered In Mud ● [Uncensored L**ked],https://pic.javct.net/poster/04112026/1b228793d0.jpg,https://javct.net/v/sgm-042-rm,120,2026-04-28
JUY-295-RM,I Was Caught In Front Of My Husband 's Portrait And Caught Me Crazy. Rin Shiraishi [Uncensored L**ked],https://pic.javct.net/poster/20221904/1653449585.jpg,https://javct.net/v/juy-295-rm,120,2026-04-28
JJDD-010-RM,An Old Housekeeper Who Can't Say No To Creampie Sex When Asked By A Younger Boy 10 Documentary Where She Takes Advantage Of His Kindness And Fucks Him Raw [Uncensored L**ked],https://pic.javct.net/poster/20230908/1695960202.jpg,https://javct.net/v/jjdd-010-rm,125,2026-04-28
CEMD-244-RM,Tears Of Non-stop Super Squid SEX 22 Satomi Nagasawa [Uncensored L**ked],https://pic.javct.net/poster/20222109/1665204621.jpg,https://javct.net/v/cemd-244-rm,129,2026-04-28
NXG-445-RM,Superb Mature Woman Ayane Asakura Obscene And Glamorous Nasty Wife [Uncensored L**ked],https://pic.javct.net/poster/20230908/1695182709.jpg,https://javct.net/v/nxg-445-rm,120,2026-04-28
JUY-294-RM,"Every Friday, It Is A Day When You Get Fucked. Okumura Kaya [Uncensored L**ked]",https://pic.javct.net/poster/20231912/1705058689.jpg,https://javct.net/v/juy-294-rm,120,2026-04-28
328HMDNV-918-RM,A beautiful wife who works at the same luxury hotel as her husband. Creampie sex to release stress from a serious and slutty married woman who can't be satisfied with sex once a week. [Uncensored L**ked],https://pic.javct.net/poster/04112026/34037faba9.jpg,https://javct.net/v/328hmdnv-918-rm,70,2026-04-28
DFE-113,Married Woman's Voice L**ks Out During Esthetic Treatment (),https://pic.javct.net/poster/04112026/ac70420662.jpg,https://javct.net/v/dfe-113,148,2026-04-28
JRZE-295,First-time Filming Of A Married Woman: Shiori Kimika,https://pic.javct.net/poster/04112026/fb5088b3b4.jpg,https://javct.net/v/jrze-295,130,2026-04-28
SAN-451,What If You Encountered A Slut Like This?,https://pic.javct.net/poster/04112026/a72816965a.jpg,https://javct.net/v/san-451,94,2026-04-28
SPRD-1421-RM,Surrogate MILF Ayaka Makimura [Uncensored L**ked],https://static.javct.net/poster/sprd-1421.jpg,https://javct.net/v/sprd-1421-rm,141,2026-04-28
PFAS-032-SUB,"Reiwa The Swap: Couple Swapping, Married Woman Sister Swapping Alliance [English Subtitle]",https://pic.javct.net/poster/20250903/1743181250.jpg,https://javct.net/v/pfas-032-sub,95,2026-04-28
JRZE-201-RM,First Shooting Of A 50-Year-Old Wife Documentary Kanako Narita [Uncensored L**ked],https://pic.javct.net/poster/20240807/1721876015.jpg,https://javct.net/v/jrze-201-rm,115,2026-04-28
IQQQ-08-RM,Married Teacher Ayaka Makimura Gets 10x As Wet In A Cum Class Where You Gotta Be Quiet [Uncensored L**ked],https://pic.javct.net/poster/20212011/1641285556.jpg,https://javct.net/v/iqqq-08-rm,84,2026-04-28
IRO-63-RM,Days Of Being R**ed On A Commuter Train By A Married Office Lady - Erika Komura [Uncensored L**ked],https://pic.javct.net/poster/04112026/079b14f3e7.jpg,https://javct.net/v/iro-63-rm,105,2026-04-28
AARM-346,A Riot Of Colors! Mature Women's Rejuvenation Massages Are Overflowing With Tenderness And Eroticism.,https://pic.javct.net/poster/04112026/826686f350.jpg,https://javct.net/v/aarm-346,240,2026-04-28
C-2329,Glamorous Mature Hot Springs Love Memory Collection Treasures Images Collection 【1】,https://pic.javct.net/poster/04112026/1c2780eb06.jpg,https://javct.net/v/c-2329,120,2026-04-28
KSBJ-058,"The Cuckold Who Fell In A Bag, Wife Ikawa Nozomi",https://pic.javct.net/poster/04112026/4b65ce093d.jpg,https://javct.net/v/ksbj-058,121,2026-04-28
IRO-63,Days Of Being R**ed On A Commuter Train By A Married Office Lady - Erika Komura,https://pic.javct.net/poster/04112026/079b14f3e7.jpg,https://javct.net/v/iro-63,105,2026-04-28
ANB-257,I Became My Mother's Toy. The Carnal Desires Of My Lovely And Lewd Beautiful Stepmother! Mio Aizawa,https://pic.javct.net/poster/04112026/37341e5168.jpg,https://javct.net/v/anb-257,115,2026-04-28
HTHD-239,My Friend's Mother ~The Final Chapter~ By Mika Sumikawa,https://pic.javct.net/poster/04112026/e96c8fc1bb.jpg,https://javct.net/v/hthd-239,100,2026-04-28
JUR-247-SUB,A Married Woman Investigator Who Fell Into A Gangbang To Get Pregnant - She Was Captured At The Hideout Of An Organization She Infiltrated To Save Her Husband And Was Repeatedly Creampied... - Kimura Rei [English Subtitle],https://pic.javct.net/poster/20250903/1742496893.jpg,https://javct.net/v/jur-247-sub,120,2026-04-28
