code,title,image_url,page_url,views,date_scraped
JUX-897-RM,"Lifting Of The Ban Real Pies! !Heaven And Hell! !1 Day Horny Dimension Stop Temptation!On The Second Day Cum The Pampanga Of Sperm Plenty! !Tsuyado Shihori's And Amateur 10 Men, Room Share Out In Two Nights And Three Days! ! [Uncensored L**ked]",https://pic.javct.net/poster/20230908/1695341527.jpg,https://javct.net/v/jux-897-rm,150,2026-04-26
YOCH-019-SUB,"Thinking about her husband... second edition! I've started a fair-skinned body anus with a desire to cum... Hanamura Mayuri, 40 years old [English Subtitle]",https://pic.javct.net/poster/20253001/1739988603.jpg,https://javct.net/v/yoch-019-sub,123,2026-04-26
MYBA-042-RM,Tearing Off The Flower Petals Of A Married Woman. Yukari Mikawa [Uncensored L**ked],https://pic.javct.net/poster/20212011/1642318200.jpg,https://javct.net/v/myba-042-rm,135,2026-04-26
HMDNV-537-RM,[Godly response] Extremely popular married woman Potore model proposes off-pacotion herself at a hotel photoshoot.Dangerous copulation with thick semen dripping from her hairy pussy [Uncensored L**ked],https://pic.javct.net/poster/04112026/a128a32521.jpg,https://javct.net/v/hmdnv-537-rm,83,2026-04-26
SDDE-471-RM,"""eh?I 10,000 Glance Of Tourists! ?There Is A Memorial Service! ? ""I Asked A Married Woman Deriheru, By Chance, What Would You Do? If Yours Is Supposed To Be Top Cast 5 People Come? [Uncensored L**ked]",https://pic.javct.net/poster/04112026/080adc7403.jpg,https://javct.net/v/sdde-471-rm,95,2026-04-26
MOIL-004-RM,"New Bride's Mother And Forbidden Sex, Part 3: My Mother-in-Law Is Better Than My Wife After All... Ruka Aida [Uncensored L**ked]",https://pic.javct.net/poster/04112026/1777076391.jpg,https://javct.net/v/moil-004-rm,130,2026-04-26
ROE-484-RM,"My Stepdaughter Calls Her Male Friends Over And Makes Them Gangbang Me Every Day. - Satsuki Sakura, Kishinaga Mirina [Uncensored L**ked]",https://pic.javct.net/poster/04112026/1776965749.jpg,https://javct.net/v/roe-484-rm,150,2026-04-26
CEMD-836-RM,"""Hey, Ordinary Men! Make Me Cum Like Crazy!"" ~A Sex Documentary About A Woman Who Gets Off Like Crazy By An Ordinary Man She Found On The Street~ 15 Yui Hatano [Uncensored L**ked]",https://pic.javct.net/poster/04112026/1777054519.jpg,https://javct.net/v/cemd-836-rm,150,2026-04-26
LUCY-026-RM,"The Secret Of My Female Boss: In Private, She Was A Submissive Masochistic Woman - Yu Kawakami [Uncensored L**ked]",https://pic.javct.net/poster/04112026/1777057213.jpg,https://javct.net/v/lucy-026-rm,118,2026-04-26
JUKD-980-RM,Juri Yamaguchi Yu-Gi-Oh Shame Of Adultery Betrayal Slave Mother-in-law [Uncensored L**ked],https://pic.javct.net/poster/04112026/cf0e174866.jpg,https://javct.net/v/jukd-980-rm,120,2026-04-26
VEC-232-RM,Her Mom Nipples Chiratchira. Morisawa Kana [Uncensored L**ked],https://pic.javct.net/poster/04112026/2ba38c8706.jpg,https://javct.net/v/vec-232-rm,85,2026-04-26
JUR-296-SUB,"Close-up Molestation By The Window. I Was Toyed With All Over My Body During My Commute, And I Was Brought To Pleasure. Today, I Am Offering My Body Again. This Video Also Includes A Molestation Angle That Simultaneously Unfolds Multiple Close-ups In Pursuit Of Realism! Yumi Kazama [English Subtitle]",https://pic.javct.net/poster/20250903/1743698418.jpg,https://javct.net/v/jur-296-sub,130,2026-04-26
ROE-496-RM,"MONROE's Oldest And Top-class Actress In Her Late 50s, Kaoru **do, Makes Her AV Debut At 56 Years Old, Showcasing A Mature Allure That Youth Can't Replicate. [Uncensored L**ked]",https://pic.javct.net/poster/04112026/1776962821.jpg,https://javct.net/v/roe-496-rm,160,2026-04-26
ROE-479-RM,"I Became Addicted To Intense, Convulsive, Arching-back Sex With My Beloved Daughter's Boyfriend. - Yurika Aoi [Uncensored L**ked]",https://pic.javct.net/poster/04112026/1776962950.jpg,https://javct.net/v/roe-479-rm,150,2026-04-26
DASD-101-RM,Beautiful Mature Women Enemas Maki Hojo [Uncensored L**ked],https://pic.javct.net/poster/20212011/1641297823.jpg,https://javct.net/v/dasd-101-rm,116,2026-04-26
HEZ-886,Mature Women Oral Sex Collection: Massive Ejaculations Of Semen Into The Mouth!! 20 Consecutive Shameful Blowjobs!! Vol. 2,https://pic.javct.net/poster/04112026/4d066e0b40.jpg,https://javct.net/v/hez-886,170,2026-04-26
EMBZ-341,"[Job Recruitment/Amateur Interview] When We Recruited A Secretary For Our Company, A Plump Lady With Huge G-cup Breasts Came. She Had Various Reasons For Wanting To Appear In An Adult Video, And When We Asked Her If She'd Like, She Turned Out To Be Quite The Pervert! Kirishima Asuka",https://pic.javct.net/poster/04112026/e02f30ff86.jpg,https://javct.net/v/embz-341,130,2026-04-26
JRZE-297,First-time Filming Of A 50-year-old Wife: Sumino Makise,https://pic.javct.net/poster/04112026/47c38d4d87.jpg,https://javct.net/v/jrze-297,130,2026-04-26
NSFS-469,Mature Mother 38 ~A Ripe Body Driven Wild By Her Son's Huge Penis~ Megumi Suzukawa,https://pic.javct.net/poster/04112026/68623b1ce5.jpg,https://javct.net/v/nsfs-469,91,2026-04-26
JUR-706-RM,"""This Might Be The Last Erection Of My Life, So Just Let Me Put It In For A Second!!"" Out Of Sympathy, I Took A Bath With My Father-in-law, Who Had Erectile Dysfunction, And He Unexpectedly Got A Full Erection, So I Let Him Put It In. We Had Such Great Chemistry That I Ended Up Riding Him In The Cowgirl Position And Fucking Him Raw Over And Over Again - Imai Miyuu [Uncensored L**ked]",https://pic.javct.net/poster/04112026/1776968172.jpg,https://javct.net/v/jur-706-rm,120,2026-04-26
JUR-269-SUB,A Visiting Beauty Salon Makes Her Beg For A Dick After Being Teased! Aphrodisiac Orgasmic Beauty Salon With Love Juices That Make Her Pubic Hair Slippery Haruka Rukawa [English Subtitle],https://pic.javct.net/poster/20250903/1742496449.jpg,https://javct.net/v/jur-269-sub,150,2026-04-26
DASS-935-RM,"A Beautiful, Mature Mom Friend, Whose True Identity Is Known To Both Of Them, Meets At A Brothel And Engages In An Affair Behind The Scenes. Hinata Tachibana [Uncensored L**ked]",https://pic.javct.net/poster/04112026/1776966211.jpg,https://javct.net/v/dass-935-rm,120,2026-04-26
KSBJ-363-SUB,"I'd Like To Introduce My Prized Pet, A Live Dick Pet! Miki Yamase [English Subtitle]",https://pic.javct.net/poster/20253001/1739551826.jpg,https://javct.net/v/ksbj-363-sub,122,2026-04-26
MOIL-004,"New Bride's Mother And Forbidden Sex, Part 3: My Mother-in-Law Is Better Than My Wife After All... Ruka Aida",https://pic.javct.net/poster/04112026/1777076391.jpg,https://javct.net/v/moil-004,130,2026-04-26
