code,title,image_url,page_url,views,date_scraped
DJE-050-RM,Mature Shut! ! Shape Ayumi Shinoda That Doting MILF [Uncensored L**ked],https://pic.javct.net/poster/20222311/1671446636.jpg,https://javct.net/v/dje-050-rm,130,2026-05-11
JUX-991,Six Months Mom Friend Of The Wife Of The Av Director Came Moving In The Transfer Of Av Debut Husband ... Acquaintance Married Woman Of Shy That Was Also Less To Tsumora The Loneliness Is Maho Appearance Tsutsui Of Determination,https://pic.javct.net/poster/04112026/330c373ab2.jpg,https://javct.net/v/jux-991,170,2026-05-11
C-2357,Hot Wise Spa Adoration # 020,https://pic.javct.net/poster/04112026/ec9d31198e.jpg,https://javct.net/v/c-2357,150,2026-05-11
REBK-002-RM,"A pervert masochist mother writhes in pleasure as she is trained by her son. Aphrodisiac sex incest, domesticated bitch mother, restrained graffiti toy to**ure 3P Mitsuyo Ikuno, Yumiko Sakura, Mio Saionji [Uncensored L**ked]",https://pic.javct.net/poster/04112026/d87a8fb212.jpg,https://javct.net/v/rebk-002-rm,130,2026-05-11
FC2PPV-4898646,[Individual photo shoot] Blindfolded sex training of a slightly chubby girl who is tired of being a girl,https://pic.javct.net/poster/04112026/f6970a3a5f.jpg,https://javct.net/v/fc2ppv-4898646,33,2026-05-11
FC2PPV-4898644,[Face exposed H-cup big breasted mature woman 2 POV version] H-cup big breasted and areolaed married woman's job will be a sex video with a married woman with the title of international school administrator,https://pic.javct.net/poster/04112026/52cf1aa7d6.jpg,https://javct.net/v/fc2ppv-4898644,53,2026-05-11
BKD-314-RM,Mother-to-c**ld Copulation ~Haruna Futatsudake Road~ Reiko Iwai [Uncensored L**ked],https://pic.javct.net/poster/04112026/19a5fe5a09.jpg,https://javct.net/v/bkd-314-rm,121,2026-05-11
ALDN-194-RM,Even My Mother-in-law Wants To Get Pregnant. Kawakami Yuu [Uncensored L**ked],https://pic.javct.net/poster/20230804/1691206326.jpg,https://javct.net/v/aldn-194-rm,115,2026-05-11
SAN-138-RM,"My Husband And I Went On A Hot Spring Trip As A Couple And Even Though My Husband Was Nearby, Someone I Didn't Know Liked Me For 250 Minutes [Uncensored L**ked]",https://pic.javct.net/poster/20230205/1685603633.jpg,https://javct.net/v/san-138-rm,250,2026-05-11
FC2PPV-4897567,[Creampie] A married woman who falls for the pleasure of using someone else's cock. A woman who keeps being teased by the insertion of a cock starts to fall.,https://pic.javct.net/poster/04112026/98da0a4ed8.jpg,https://javct.net/v/fc2ppv-4897567,48,2026-05-11
JRZE-293-RM,First-time Filming Of A Married Woman: Koharu Sasaki [Uncensored L**ked],https://pic.javct.net/poster/04112026/1776011738.jpg,https://javct.net/v/jrze-293-rm,115,2026-05-11
SAN-137-RM,150 Minutes Of Sex With Three Widows Fucked By Two Men In Front Of Her Husband's Buddhist Temple [Uncensored L**ked],https://pic.javct.net/poster/20230205/1685603716.jpg,https://javct.net/v/san-137-rm,150,2026-05-11
KDJE-050-RM,[4K remastered version] Mature shut! ! Ayumi Shinoda The Form Of Doting A Mature Woman [Uncensored L**ked],https://pic.javct.net/poster/04112026/d448aedb3c.jpg,https://javct.net/v/kdje-050-rm,129,2026-05-11
FERA-176-RM,"My Mother Became A Practice Table For Sex I Broke Up With My Mother Because Her Sex Was Too Good For Me, I Was Crazy And Cummed Over And Over Again Aika Nagano [Uncensored L**ked]",https://pic.javct.net/poster/20230804/1691638260.jpg,https://javct.net/v/fera-176-rm,100,2026-05-11
ALDN-195-RM,Female President's Libido Narimiya Iroha [Uncensored L**ked],https://pic.javct.net/poster/20230804/1691206261.jpg,https://javct.net/v/aldn-195-rm,125,2026-05-11
JUY-314-RM,Fresh Married Nonfiction Cum Intense Documentary! ! Muzzli Beautiful Ass Lady Lady Amazing Lumbar Swing 28 Years Old Wakaba [Uncensored L**ked],https://pic.javct.net/poster/04112026/1a18e0939a.jpg,https://javct.net/v/juy-314-rm,140,2026-05-11
VEX-009-RM,Do Not Try To Ruri Quick And MILF Class S [Uncensored L**ked],https://pic.javct.net/poster/04112026/b3f7edac37.jpg,https://javct.net/v/vex-009-rm,115,2026-05-11
VEX-003-RM,Do Not Try To Elena Tachibana And S-class MILF [Uncensored L**ked],https://pic.javct.net/poster/04112026/2ed86354fc.jpg,https://javct.net/v/vex-003-rm,105,2026-05-11
VEX-004-RM,Do Not Try To Miku Hasegawa And S-class MILF [Uncensored L**ked],https://pic.javct.net/poster/04112026/d19d54fa49.jpg,https://javct.net/v/vex-004-rm,90,2026-05-11
JUC-862,Company housing wife swapping ~Slutty mature woman playing with men while her husband is away~,https://pic.javct.net/poster/04112026/5d00fea137.jpg,https://javct.net/v/juc-862,160,2026-05-11
ROE-497-RM,"Refined Beauty, Inexhaustible Eroticism: Masami Inamori, 42 Years Old, Makes Her AV Debut. A Former Local TV Announcer And Married Woman, Nurtured In The Northern Lands, Is Born. [Uncensored L**ked]",https://pic.javct.net/poster/04112026/03f0964cbd.jpg,https://javct.net/v/roe-497-rm,120,2026-05-11
ROE-494-RM,"Seeing That I Could Only Get Off Using My Mother's Panties Soaked With Her Cum, She Took Pity On Me And Started Using Her Big Ass And Pussy To Relieve My Sexual Needs Every Day. Those Flashy Undergarments I Thought Belonged To My Sister-in-law And Used As Masturbation Material Were Actually My Mother's Panties!! [Uncensored L**ked]",https://pic.javct.net/poster/04112026/7a09207e2b.jpg,https://javct.net/v/roe-494-rm,150,2026-05-11
JUY-844-RM,Intelli Dirty Garter Secretary Yuko Shiraki Reinventing A Sassy Younger President [Uncensored L**ked],https://pic.javct.net/poster/20240410/1728944655.jpg,https://javct.net/v/juy-844-rm,150,2026-05-11
JUR-744-RM,"Every Time I Make A Mistake, My Wife Sneaks Out Of Work To Provide Sexual Services... She's Become My Personal ""fleshlight"" For My Scumbag Boss. [Uncensored L**ked]",https://pic.javct.net/poster/04112026/4cb1da974e.jpg,https://javct.net/v/jur-744-rm,120,2026-05-11
