code,title,image_url,page_url,views,date_scraped
JUX-922-RM,I Love My Father-in-Law More Than My Husband... Haruka Aso [Uncensored L**ked],https://pic.javct.net/poster/20212011/1644632608.jpg,https://javct.net/v/jux-922-rm,118,2026-05-15
VEC-606-RM,"Satomi Narushima, A Bride's Best Friend Who Came To Preach Her Unequaled Husband Who Was Cheated On [Uncensored L**ked]",https://pic.javct.net/poster/20230804/1691729996.jpg,https://javct.net/v/vec-606-rm,100,2026-05-15
AED-256-RM,Incest: Creampie In The Vagina Of A Fifty-year-old Mother Rika Utsugi [Uncensored L**ked],https://pic.javct.net/poster/04112026/26a9d8a183.jpg,https://javct.net/v/aed-256-rm,115,2026-05-15
MFYD-136,"While On A Hot Spring Trip With My Girlfriend, I Was Intensely Tempted By Her Older Sister (a Married Woman) And Her Breasts.",https://pic.javct.net/poster/04112026/153f3bc699.jpg,https://javct.net/v/mfyd-136,150,2026-05-15
MFYD-137,"Noa Eikawa's Final Slutty Work! Noa-chan, Reborn As A Beautiful Woman, Delivers Her Final And Ultimate Slutty Full Course! ~Holy Water, Face Riding, Edging, Dominatrix... This One Video Completes The Entirety Of Noa Eikawa's Slutty Side!~",https://pic.javct.net/poster/04112026/4e8ea8c10b.jpg,https://javct.net/v/mfyd-137,180,2026-05-15
JUX-923-RM,The Day Of Awakening To The Joy That Is Bound To You .... Sawamura Reiko [Uncensored L**ked],https://pic.javct.net/poster/06032026/1773629551.jpg,https://javct.net/v/jux-923-rm,150,2026-05-15
VES-007-RM,"Please Embrace Me, Someone. My Breast Milk From Spilling Over, Why Not Drink? Misa Yuki [Uncensored L**ked]",https://pic.javct.net/poster/04112026/60a76e6c7f.jpg,https://javct.net/v/ves-007-rm,90,2026-05-15
VEMA-027-RM,A Friend's Wife Misa Yuki Tutor Dirty [Uncensored L**ked],https://pic.javct.net/poster/04112026/f5fad0d60e.jpg,https://javct.net/v/vema-027-rm,80,2026-05-15
MFYD-134,"A Rejuvenating Spa That Will Lead You To Ejaculation Again And Again With Plenty Of Dirty Talk And Long, Passionate Kisses.",https://pic.javct.net/poster/04112026/6472cce0e8.jpg,https://javct.net/v/mfyd-134,140,2026-05-15
MFYD-132,"The Hardest Work In Futaba Otani's History! A Super-muscular, Sexually Insatiable Woman Is Utterly Destroyed By The Full-power Pistons Of Muscular Men In A Wild, Trembling, Orgasmic Orgy.",https://pic.javct.net/poster/04112026/b24b9e2872.jpg,https://javct.net/v/mfyd-132,120,2026-05-15
ODVHJ-074-RM,An Erotic Story About Having Sex With Beautiful And Sexy Middle-aged Women At A Sauna In Tokyo... (3) [Uncensored L**ked],https://pic.javct.net/poster/04112026/1d1caef6d3.jpg,https://javct.net/v/odvhj-074-rm,160,2026-05-15
MFYD-142,Restraint X Intense Fucking X Huge Cock! Saegusa Rei's Best Sex Ever Is Easily Surpassed! She Came And Came And Came!!,https://pic.javct.net/poster/04112026/1c57c6bfef.jpg,https://javct.net/v/mfyd-142,160,2026-05-15
C-2969-RM,"I Begged An Older Acquaintance On My Knees, ""Please Let Me Have Sex With You!!"" [Uncensored L**ked]",https://pic.javct.net/poster/04112026/eb463872f2.jpg,https://javct.net/v/c-2969-rm,120,2026-05-15
BJD-057-RM,Mature Couple's Full Moon Trip To Nasu Nakamiyori Onsen By Yumi Yasuno [Uncensored L**ked],https://pic.javct.net/poster/04112026/7639a9642d.jpg,https://javct.net/v/bjd-057-rm,112,2026-05-15
VENU-060-RM,Incest: A Son Is Driven Mad By His Beautiful Mom - Ishihara Koto [Uncensored L**ked],https://pic.javct.net/poster/04112026/61d8a77c31.jpg,https://javct.net/v/venu-060-rm,80,2026-05-15
MFYD-153,"Harumi Kyomoto (34 Years Old), Whose Libido Is Out Of Control, Appears In An Adult Video: A Beastly Fuck Scene Drenched In Sweat And Bodily Fluids.",https://pic.javct.net/poster/04112026/50068ff6d8.jpg,https://javct.net/v/mfyd-153,140,2026-05-15
ALDN-205-RM,Daughter's Husband And Duck Heat Mating Ryoko Iori [Uncensored L**ked],https://pic.javct.net/poster/20230804/1692415162.jpg,https://javct.net/v/aldn-205-rm,105,2026-05-15
MFYD-138,"A Former Bio-scientist Is Glitched! In A Studio With A Broken Air Conditioner In The Middle Of Summer, Three Intense Rounds Of Passionate French Kissing And Mating Between Two Sweaty, Drooling Old Men!",https://pic.javct.net/poster/04112026/4de0381101.jpg,https://javct.net/v/mfyd-138,130,2026-05-15
VEC-766-RM,"""Just Once, Please Have Sex With My Mother."" A Son Accidentally Peeks At His Mother Masturbating. Realizing His Mother's Sexual Frustration, He Asks His Horny Friend For Help. Nakamaru Miku [Uncensored L**ked]",https://pic.javct.net/poster/04112026/1776271791.jpg,https://javct.net/v/vec-766-rm,110,2026-05-15
VENX-371,"In The Midst Of A Passionate Sexual Encounter Between A Mother And Her Son, The Mother's Excitement Reaches Its Peak As She Experiences The Thrill Of Being Caught By Her Husband Who Is On His Way Home. They Face Imminent Danger As She Reaches Orgasm In A Life-or-death Situation - Hiraoka Rieko",https://pic.javct.net/poster/04112026/08e207a9ae.jpg,https://javct.net/v/venx-371,105,2026-05-15
MFYD-143,"[Super Condescending] A Personal Trainer's Lewd Verbal A**se And Masturbation Support. I'm Being Fucked So Much My Brain Is Malfunctioning, And As A Masochist, My Dick Is Super Muscular!!",https://pic.javct.net/poster/04112026/7d05abe6ec.jpg,https://javct.net/v/mfyd-143,120,2026-05-15
MFYD-131,Itadakima-sama Yumemi Kanae: A Disgusting Enemy Of Men Sucks All The Sperm And Money Out Of Her.,https://pic.javct.net/poster/04112026/57e3717b61.jpg,https://javct.net/v/mfyd-131,160,2026-05-15
MFYD-135,"Riona Hirose's Best Ever, Three Amazing Sex Scenes! After Abstaining From Sex, She Gets Cummed Inside By The Best Cock And Reaches Her Limit With 9 Ejaculations!! Special",https://pic.javct.net/poster/04112026/57ce5c2d30.jpg,https://javct.net/v/mfyd-135,110,2026-05-15
MFYD-141,"Newcomer, Married Woman Karin Tsukigami, Makes Her AV Debut. The White-skinned Angel From Tohoku's Passionate Extramarital Sex Record That Will Melt The Snow.",https://pic.javct.net/poster/04112026/eb36ef8a00.jpg,https://javct.net/v/mfyd-141,150,2026-05-15
