code,title,image_url,page_url,views,date_scraped
ROE-482-RM,"PTA Affair With Unprotected Sex: A New Place I Found Where I Belonged, After Being Treated Like I Wasn't Even There At Home - Maki Tomoda [Uncensored L**ked]",https://pic.javct.net/poster/04112026/1776965814.jpg,https://javct.net/v/roe-482-rm,140,2026-05-29
CEMD-267-RM,A Horny Slut With The Power To Stop Time! 5 Hana Haruna [Uncensored L**ked],https://pic.javct.net/poster/20222311/1670641332.jpg,https://javct.net/v/cemd-267-rm,130,2026-05-29
CEMD-266-RM,Let's Have Sex In A Camper! 8 Mai Hoshikawa [Uncensored L**ked],https://pic.javct.net/poster/20222410/1668826815.jpg,https://javct.net/v/cemd-266-rm,118,2026-05-29
ALDN-186-RM,"After All, A Single Mother Is The Best... Shizuka Momoi [Uncensored L**ked]",https://pic.javct.net/poster/20230207/1688785884.jpg,https://javct.net/v/aldn-186-rm,105,2026-05-29
MKD-210-RM,Eriko Nagai Erotic Large Areola Who Wants To Take The First Shooting Age Fifty Wife [Uncensored L**ked],https://pic.javct.net/poster/20240807/1724217883.jpg,https://javct.net/v/mkd-210-rm,109,2026-05-29
XMOM-59-RM,Sukeban Chisato 54 Years Old Chisato Shoda [Uncensored L**ked],https://pic.javct.net/poster/20230207/1689218031.jpg,https://javct.net/v/xmom-59-rm,110,2026-05-29
JSOP-028-RM,New And Beautiful Mature Woman Bathhouse Rich Soggy Luxury Soap Airi Tsujime [Uncensored L**ked],https://pic.javct.net/poster/20230207/1690000466.jpg,https://javct.net/v/jsop-028-rm,120,2026-05-29
JRZE-156-RM,First Shot Married Woman Document Remi Kawanami [Uncensored L**ked],https://pic.javct.net/poster/20230207/1689217783.jpg,https://javct.net/v/jrze-156-rm,155,2026-05-29
KSBJ-023-RM,Naked Wife: Iroha Narimiya [Uncensored L**ked],https://pic.javct.net/poster/20221904/1650597164.jpg,https://javct.net/v/ksbj-023-rm,119,2026-05-29
VGD-148-RM,Tsuyaon'na Debut 45 Years Sawaki Ririka [Uncensored L**ked],https://pic.javct.net/poster/06032026/1773803301.jpg,https://javct.net/v/vgd-148-rm,140,2026-05-29
NSFS-200-RM,New Love Wife Sex Doll 3 ~Persuading My Wife To Cuckold For The First Time~ Akari Aizawa [Uncensored L**ked],https://pic.javct.net/poster/20230207/1688789357.jpg,https://javct.net/v/nsfs-200-rm,121,2026-05-29
VEMA-204-RM,"The Remarriage Partner Brought By My Father Was Yuko, A Nurse I Admired While I Was In The Hospital. Jealous Erection Creampie Sex Yuko Shiraki [Uncensored L**ked]",https://pic.javct.net/poster/20230207/1688706184.jpg,https://javct.net/v/vema-204-rm,105,2026-05-29
VAGU-258-RM,An Adult Creampie Nursery School Where Saki-sensei Will Spoil You As Much As You Like With Baby Talk Saki Oishi [Uncensored L**ked],https://pic.javct.net/poster/20230207/1689309259.jpg,https://javct.net/v/vagu-258-rm,115,2026-05-29
URE-132-RM,"Over 120,000 Downloads In Total!! Original Work: Mama-san Ballet Netorarete Netorasete A Husband Awakens To A New Sexual Fetish Due To His Wife's Infidelity. A Twisted Desire Accelerates, Bringing To Life The Joy And Despair Of NTR In Live Action!! Momozono Reina [Uncensored L**ked]",https://pic.javct.net/poster/04112026/1776966606.jpg,https://javct.net/v/ure-132-rm,150,2026-05-29
C-2970-RM,Married Housekeeper 03 [Uncensored L**ked],https://pic.javct.net/poster/05192026/77f71d0ea4.jpg,https://javct.net/v/c-2970-rm,120,2026-05-29
JJDA-073,The Wife Of A Board Member; The Wife Of A Boss Who Was Too Strict.,https://pic.javct.net/poster/05192026/a84288bac6.jpg,https://javct.net/v/jjda-073,120,2026-05-29
VEC-777,"With Her Captivating Technique And Sexy, Gorgeous Body, Momose Jogasaki, The Top Performer Of Erotic Performances, Engages In Passionate Sex With Her Horny Daughter's Boyfriend.",https://pic.javct.net/poster/05192026/e2f6473a5c.jpg,https://javct.net/v/vec-777,105,2026-05-29
JUR-667-RM,"My Son's Wife Is A Queen, Ayumi Ryo [Uncensored L**ked]",https://pic.javct.net/poster/04112026/1776963613.jpg,https://javct.net/v/jur-667-rm,160,2026-05-29
VEC-779,The Neighboring Housewife In See-Through Clothes ~The Sweet Trap Of See-Through Seduction~ Rio Ryukawa,https://pic.javct.net/poster/05192026/e4a6000060.jpg,https://javct.net/v/vec-779,115,2026-05-29
VEC-778,The Cuckolding Method ~A Husband Who Asks His Best Friend To Seduce His Wife Because He Wants To Confirm Her Love~ Haruka Ryukawa,https://pic.javct.net/poster/05192026/995b186160.jpg,https://javct.net/v/vec-778,120,2026-05-29
DTT-051-RM,NTR Favorite Husband Certified Seeding SEX 4 Production! ! Kei Mimori 36 Years Old Married Woman Creampie Affair Hot Spring [Uncensored L**ked],https://pic.javct.net/poster/05192026/e32abe863c.jpg,https://javct.net/v/dtt-051-rm,130,2026-05-29
MEYD-996-SUB,"Morning Wood Cock Gangbang Every Morning, I'm Being Passed Around By My Son's Friends. Mio Mao [English Subtitle]",https://pic.javct.net/poster/20250903/1744304565.jpg,https://javct.net/v/meyd-996-sub,150,2026-05-29
IHTT-007-RM,7 Diary Eating Part Of The Case's Original Manager I [Uncensored L**ked],https://pic.javct.net/poster/05192026/826ed9e118.jpg,https://javct.net/v/ihtt-007-rm,120,2026-05-29
JUY-320-RM,A Married Woman Soapland Girl Who Got Hooked On A Cherry Boy Maki Tomoda [Uncensored L**ked],https://pic.javct.net/poster/20220406/1655893217.jpg,https://javct.net/v/juy-320-rm,142,2026-05-29
