code,title,image_url,page_url,views,date_scraped
PA-042326-100,A married woman currently job hunting who wants to return to work,https://pic.javct.net/poster/04112026/1776918325.jpg,https://javct.net/v/pa-042326-100,60,2026-04-25
1P-042326-001,A Single Nymphomaniac Targeting the Deliveryman's Cock,https://pic.javct.net/poster/04112026/1776917041.jpg,https://javct.net/v/1p-042326-001,53,2026-04-25
OKSN-246-RM,My First Time Was With Mom... Ayaka Muto [Uncensored L**ked],https://pic.javct.net/poster/20221108/1661343100.jpg,https://javct.net/v/oksn-246-rm,123,2026-04-25
PA-042126-100,What If Your Dream Wife Wearing an Apron Naked? : Sakura Sakurai,https://pic.javct.net/poster/04112026/1776755661.jpg,https://javct.net/v/pa-042126-100,55,2026-04-25
AKBS-004-RM,Sexy Stepmother And Daughter Sex Yu Shinoda Yoko Hideyoshi [Uncensored L**ked],https://pic.javct.net/poster/20221202/1647504153.jpg,https://javct.net/v/akbs-004-rm,81,2026-04-25
OBA-268-RM,The Married Woman Who Invites A Fuck Buddy To Her Own Home To Have Sex With Him While Her Husband Is Out Ikumi Kondo [Uncensored L**ked],https://pic.javct.net/poster/20212011/1643936374.jpg,https://javct.net/v/oba-268-rm,119,2026-04-25
BKD-277-RM,Stepmother And Offspring Sex. [West Otawara Road] Nanao Nakano. [Uncensored L**ked],https://pic.javct.net/poster/20212011/1643611532.jpg,https://javct.net/v/bkd-277-rm,121,2026-04-25
PA-041826-100,It's Hawaii! A Bikini wife in high spirits!,https://pic.javct.net/poster/04112026/1776506834.jpg,https://javct.net/v/pa-041826-100,60,2026-04-25
PA-041626-100,A mix of saliva and love juice! A married woman's intense PtoM sex!  : Aya Hamanaka,https://pic.javct.net/poster/04112026/1776320465.jpg,https://javct.net/v/pa-041626-100,41,2026-04-25
BABM-008-RM,"Mommy Ena Praises Me For Simply Being Myself And Then Gives Me Sex When I Cry For Attention Like A Baby, Starring Ena Satsuki [Uncensored L**ked]",https://pic.javct.net/poster/20212011/1644052763.jpg,https://javct.net/v/babm-008-rm,116,2026-04-25
PA-041426-100,The Seduction of a Beautiful Mature Woman in a Knit Dress That Looks Seductive,https://pic.javct.net/poster/04112026/1776148700.jpg,https://javct.net/v/pa-041426-100,61,2026-04-25
SPRD-649-RM,High Leg Mother Maya Sawamura - Maya Sawamura [Uncensored L**ked],https://pic.javct.net/poster/20221202/1649895725.jpg,https://javct.net/v/sprd-649-rm,123,2026-04-25
SPRD-835-RM,Fakecest: Stepmother And Son Fall For Each Other Rika Fujishita [Uncensored L**ked],https://pic.javct.net/poster/20221108/1661225011.jpg,https://javct.net/v/sprd-835-rm,120,2026-04-25
RCT-941-RM,"A perverted family plays a sex game that turns into Fakecest before they know it! The son guesses his Stepmom and Stepsisters' naked bodies! A New Years home visit, large family orgies special. [Uncensored L**ked]",https://pic.javct.net/poster/20221202/1648627274.jpg,https://javct.net/v/rct-941-rm,139,2026-04-25
BKD-127-RM,Stepmother And Son Fucking The Road To Yugu Ayumi Shinoda [Uncensored L**ked],https://pic.javct.net/poster/20221904/1652915161.jpg,https://javct.net/v/bkd-127-rm,123,2026-04-25
VGS-07-RM,Country Stepmother And Offspring Sex A Fifty-Something Mother Who Kindly And Gently Cares For Her Orgasmic Cherry Boy Son Yukie Honjo [Uncensored L**ked],https://pic.javct.net/poster/20212011/1641880785.jpg,https://javct.net/v/vgs-07-rm,120,2026-04-25
OBA-047-RM,Fakecest: Takashi's Mother is a Perverted MILF ( Chiaki Takeshita ) [Uncensored L**ked],https://pic.javct.net/poster/20221202/1646448049.jpg,https://javct.net/v/oba-047-rm,117,2026-04-25
PA-041126-100,A shining me that even my family doesn't know about : The wife of the accomplished department head,https://pic.javct.net/poster/04112026/1775895277.jpg,https://javct.net/v/pa-041126-100,60,2026-04-25
1P-041126-001,Braless Neighbor In The Morning: Shiho Sakatani,https://pic.javct.net/poster/04112026/1775895130.jpg,https://javct.net/v/1p-041126-001,59,2026-04-25
GVG-712-RM,The True Story Of Mamacita Hikari Misumi [Uncensored L**ked],https://static.javct.net/poster/gvg-712.jpg,https://javct.net/v/gvg-712-rm,115,2026-04-25
PA-040926-100,Mature Woman Masturbator Door-to-Door Saleswoman - Hina Kusakabe,https://pic.javct.net/poster/06032026/1775710391.jpg,https://javct.net/v/pa-040926-100,41,2026-04-25
SPRD-1065-RM,Fakecest Creampie With Mother - Stepmom Has Her First Creampie With Her Son - Rieko Hiraoka [Uncensored L**ked],https://pic.javct.net/poster/20212011/1644374011.jpg,https://javct.net/v/sprd-1065-rm,114,2026-04-25
DTKM-031-RM,"Fakecestuous Stepmother And Son Swap - You Fuck My Stepmom, And I'll Fuck Yours. Yukie Miyamae & Ayako Inoue [Uncensored L**ked]",https://pic.javct.net/poster/20212011/1643249407.jpg,https://javct.net/v/dtkm-031-rm,197,2026-04-25
PA-040726-100,A mix of saliva and love juice! A married woman's intense PtoM sex!  : Mie Arakawa,https://pic.javct.net/poster/06032026/1775540746.jpg,https://javct.net/v/pa-040726-100,61,2026-04-25
