code,title,image_url,page_url,views,date_scraped
FC2PPV-4911164,"[Meru◯ Super similar!! ︎]G cup tall!! ︎ System ◯ Massive creampie sex after class with a beautiful woman, euphoric max in the afternoon",https://pic.javct.net/poster/05192026/4d34a2b0fa.jpg,https://javct.net/v/fc2ppv-4911164,109,2026-06-01
FC2PPV-4908425,Sperm donation [Ringo-chan 1st time] Young wife's sperm donation directly,https://pic.javct.net/poster/05192026/e112fbf0b9.jpg,https://javct.net/v/fc2ppv-4908425,113,2026-06-01
IMJO-008,[Female style voyeur] The real sexual reality of modern girls captured by the camera [Women's After 5] [Seina],https://pic.javct.net/poster/05192026/beb8ed6d16.jpg,https://javct.net/v/imjo-008,71,2026-06-01
MBRK-007-RM,"A Double Slut Teases You Until You Go Crazy, A Hell Of Pleasure, A Men's Esthetician To Improve Premature Ejaculation [Uncensored L**ked]",https://pic.javct.net/poster/20240807/1722317011.jpg,https://javct.net/v/mbrk-007-rm,127,2026-06-01
IPBZ-021-RM,Limited distribution: Natupoke REC: Hina no Kanon Gonzo IP actress released as she is [Uncensored L**ked],https://pic.javct.net/poster/05192026/52bc7504d7.jpg,https://javct.net/v/ipbz-021-rm,99,2026-06-01
1P-053126-001,Hospitality from What a sexy body!,https://pic.javct.net/poster/05192026/fa2e254def.jpg,https://javct.net/v/1p-053126-001,61,2026-06-01
FC2PPV-4909960,[Big breasts/individual video] Mammary gland destruction ❣ Nice body beauty with big boobs and H cup ♡ Massage so violently that the shape of the breast changes ♡ High-level gonzo video where the cervix is ​​stimulated by the demon piston that shakes the soft breasts ♡,https://pic.javct.net/poster/05192026/ab7470e1fa.jpg,https://javct.net/v/fc2ppv-4909960,68,2026-06-01
FC2PPV-4907764,"[So cute that you can't believe she's 42 years old] **pyjpx*jsps A naive beautiful witch with little sex experience came to make her last memories before getting married, and I made her do it with her mouth.",https://pic.javct.net/poster/05192026/0c7b4a596f.jpg,https://javct.net/v/fc2ppv-4907764,77,2026-06-01
AKDL-037-RM,"I love riding astride, a special machine for the cowgirl position [meat butt pile driving piston, close contact with flirting, S-shape butt shaking slow grind] Nanahoshi Kokoro [Uncensored L**ked]",https://pic.javct.net/poster/04112026/1775973162413.jpg,https://javct.net/v/akdl-037-rm,154,2026-06-01
FC2PPV-4910377,"[Complete Amateur Creampie] A very popular tall and beautiful office lady shows off her wonderful body, licks it a lot, and is happy to serve you for raw creampie",https://pic.javct.net/poster/05192026/93cf75ab10.jpg,https://javct.net/v/fc2ppv-4910377,49,2026-06-01
348NTR-007-RM,"An unannounced 3P with a serious office lady. Watching her depressed boyfriend, the quiet, serious office lady takes turns with her hard pistons, and the sweet cries of a lewd female that suddenly echoes in the room with her two male dicks. Her sensitive body trembles little by little as she shyly cums... The finish is with a large amount of semen being sprayed on her dignified face. NTR.net case7 [Uncensored L**ked]",https://pic.javct.net/poster/05192026/c4b28d2380.jpg,https://javct.net/v/348ntr-007-rm,86,2026-06-01
300MIUM-328-RM,"A working masochist. Underwear maker project / Mr. Imai / 22 years old A miraculous beautiful office lady who can't say ""no"" is summoned at work and gives a teary-eyed blowjob in the car in front of the company, tricks her into changing her clothes, voyeurs her, distorts her miraculous beautiful face, and captures her obscene behavior. [Uncensored L**ked]",https://pic.javct.net/poster/05192026/4ccf189420.jpg,https://javct.net/v/300mium-328-rm,101,2026-06-01
IPBZ-021,Limited distribution: Natupoke REC: Hina no Kanon Gonzo IP actress released as she is,https://pic.javct.net/poster/05192026/52bc7504d7.jpg,https://javct.net/v/ipbz-021,99,2026-06-01
10-053026-01,We got frisky in Kimono before heading out to the summer festival,https://pic.javct.net/poster/05192026/f56fa7738b.jpg,https://javct.net/v/10-053026-01,60,2026-06-01
PA-053026-100,Natural Beauty : Ms. Hironaka's Real Face,https://pic.javct.net/poster/05192026/25b43628eb.jpg,https://javct.net/v/pa-053026-100,27,2026-06-01
CR-053026-001,Luxury Adult Healing Spa: A master in bed delivering vigorous head-shaking fellatio and intense pile-driving thrusts,https://pic.javct.net/poster/05192026/f54c66df65.jpg,https://javct.net/v/cr-053026-001,61,2026-06-01
FC2PPV-4909453,God Style Ho ■Aqua-chan Minato in uniform at the live show is thin but an E-cup model and has a beautiful body.,https://pic.javct.net/poster/05192026/bb59692a5e.jpg,https://javct.net/v/fc2ppv-4909453,98,2026-06-01
FC2PPV-4909954,[Exclusive/Individual Shooting] Very popular TikToker and idol Amichi makes a shocking debut!? ❣ Slender big breasted body with outstanding gravure class style released ♡ Her vagina is stirred by a big cock and she is creampied ♡ [Bonus: High resolution] [Main story / No facial footage],https://pic.javct.net/poster/05192026/3c78278ba1.jpg,https://javct.net/v/fc2ppv-4909954,62,2026-06-01
FC2PPV-4910016,[New product / first edition limited sale] Individual shooting) A swamp confirmed too cute and dangerous blonde gal angel uncontrollable devilish cowgirl position is too erotic best Gonzo,https://pic.javct.net/poster/05192026/ac74dd68a1.jpg,https://javct.net/v/fc2ppv-4910016,53,2026-06-01
FC2PPV-4909862,"[No] [Female body sharing session Chapter 17, Part 2] Even after the 3P, the fair-skinned petite young wife's desire does not subside, and she hopes for a second interaction with a black man. Creampie after intense sex",https://pic.javct.net/poster/05192026/0bd7a643fb.jpg,https://javct.net/v/fc2ppv-4909862,40,2026-06-01
FC2PPV-4909278,Kuchi Pussy Skewering Rental Play Plump BODY REI Circle members and friends play 3P play with unlimited use of the mouth pussy in the room,https://pic.javct.net/poster/05192026/bd6b371f82.jpg,https://javct.net/v/fc2ppv-4909278,44,2026-06-01
FC2PPV-4909288,"*Limited stock* [Video of gravure idol pregnant that you can never see on Fntia] I-cup breasted gravure idol's penis is flattered and creampied from behind, uncensored private video with raw semen dripping. Obtained by administrator.",https://pic.javct.net/poster/05192026/e12124b7dd.jpg,https://javct.net/v/fc2ppv-4909288,26,2026-06-01
CR-052926-001,"A Two-Day, One-Night Trip Spent Constantly Getting Outdone by My Sister-in-Law While My Wife Was Away on Business",https://pic.javct.net/poster/05192026/6933aef184.jpg,https://javct.net/v/cr-052926-001,61,2026-06-01
SAN-154-RM,A Wife Who Was Creampied By A Mad Doctor And Got Pregnant With An Unknown C**ld / Monaka Sengoku [Uncensored L**ked],https://pic.javct.net/poster/20230207/1690863841.jpg,https://javct.net/v/san-154-rm,130,2026-06-01
