code,title,image_url,page_url,views,date_scraped
1P-052126-001,"Welcome to the world of M-Guy and W: Bang, Bang, Bang!",https://pic.javct.net/poster/05192026/28e74fba46.jpg,https://javct.net/v/1p-052126-001,59,2026-05-21
CR-052126-001,3 Cumshot To A Tough Pussy 8,https://pic.javct.net/poster/05192026/72a355c5ae.jpg,https://javct.net/v/cr-052126-001,55,2026-05-21
PA-052126-100,A mix of saliva and love juice! A married woman's intense PtoM sex!  : Sara Suzukake,https://pic.javct.net/poster/05192026/9a9e87e82f.jpg,https://javct.net/v/pa-052126-100,60,2026-05-21
FC2PPV-4904280,"[Uncensored/Complete amateur/Creampie/Squirting] Natural G cup x slender girl with long black hair and erotic body Big ass pile driving piston & best cowgirl position, tight pussy for 3 consecutive raw creampies for the first time in her life",https://pic.javct.net/poster/05192026/73cfe209de.jpg,https://javct.net/v/fc2ppv-4904280,20,2026-05-21
FC2PPV-4903279,A 20-year-old serious JD who attends a famous nursing school's first sex video!! A fair-skinned marshmallow body and a big dick piston make her moan non-stop,https://pic.javct.net/poster/05192026/0d258ad1f0.jpg,https://javct.net/v/fc2ppv-4903279,63,2026-05-21
FC2PPV-4903984,[The strongest facial level in the first half of 2026] Completely private video of Akasaka VIP purveyor's membership lounge girl who was not scheduled to be released ♥️She smiles and holds the dick deep in her throat and is wildly violent **The top is released♥️,https://pic.javct.net/poster/05192026/c2b2300e7b.jpg,https://javct.net/v/fc2ppv-4903984,87,2026-05-21
FC2PPV-4879704,"While taking a picture of a very beautiful big-breasted married woman, I filmed her and creampied her [Super Value Pack]",https://pic.javct.net/poster/05192026/977e44d923.jpg,https://javct.net/v/fc2ppv-4879704,99,2026-05-21
326FCT-225-RM,[Enjoy your free time] A dark history confirmed in which a large orgy of youthful passion between 6 men and women avoiding night patrols was broadcast to the whole world [Uncensored L**ked],https://pic.javct.net/poster/04112026/453cef3a9f.jpg,https://javct.net/v/326fct-225-rm,197,2026-05-21
SIMA-037-RM,mountain stream [Uncensored L**ked],https://pic.javct.net/poster/04112026/186603ad3e.jpg,https://javct.net/v/sima-037-rm,75,2026-05-21
FC2PPV-4903757,"Face Showing Case #133 An amateur comes to do naughty things - An-chan (20) in red lingerie, sexy route, both legs exposed and vibrator to**ure",https://pic.javct.net/poster/05192026/2f434bcb66.jpg,https://javct.net/v/fc2ppv-4903757,56,2026-05-21
FNS-208,Masochistic Nurse's once-a-month dangerous day remote control incontinence late-night vibrating rounds RARA,https://pic.javct.net/poster/05192026/7300f6c637.jpg,https://javct.net/v/fns-208,150,2026-05-21
476MLA-276-RM,"I reluctantly agreed to the photoshoot because I wanted money for mencon.I was lured by the high salary and was followed by a 19-year-old landmine NEET with a sharp personality and a tight vagina, so I ended up creampieing her a lot lol [Uncensored L**ked]",https://pic.javct.net/poster/05192026/68bdd4a230.jpg,https://javct.net/v/476mla-276-rm,78,2026-05-21
476MLA-276,"I reluctantly agreed to the photoshoot because I wanted money for mencon.I was lured by the high salary and was followed by a 19-year-old landmine NEET with a sharp personality and a tight vagina, so I ended up creampieing her a lot lol",https://pic.javct.net/poster/05192026/68bdd4a230.jpg,https://javct.net/v/476mla-276,78,2026-05-21
MFC-359-RM,Miyuu [Uncensored L**ked],https://pic.javct.net/poster/05192026/8f7c85082e.jpg,https://javct.net/v/mfc-359-rm,55,2026-05-21
SIRO-5676-RM,"An innocent and lewd tattooed gal who can orgasm in any position has sex. Contrary to her appearance, her pussy hair is a natural jungle. [First shot] AV application online AV experience shooting 2558 [Uncensored L**ked]",https://pic.javct.net/poster/04112026/ddb6f3a5ee.jpg,https://javct.net/v/siro-5676-rm,64,2026-05-21
FC2PPV-4903657,[18 years old] A secret meeting video of Nakadashi in a uniform that covers the fair-skinned marshmallow body of a real 18-year-old,https://pic.javct.net/poster/05192026/72f57415ae.jpg,https://javct.net/v/fc2ppv-4903657,96,2026-05-21
MFC-359,Miyuu,https://pic.javct.net/poster/05192026/8f7c85082e.jpg,https://javct.net/v/mfc-359,55,2026-05-21
AKDL-076,"[Big-breasted amateur] Ayase, a first-year working dental assistant who has extremely sensitive H-cup breasts and nipples orgasms many times",https://pic.javct.net/poster/05192026/72ed9a6ae5.jpg,https://javct.net/v/akdl-076,117,2026-05-21
CR-052026-001,A Married Woman Passed Around by Neighborhood Association Leaders in Front of Her Husband,https://pic.javct.net/poster/05192026/51d1c110ea.jpg,https://javct.net/v/cr-052026-001,67,2026-05-21
START-554-RM,"I don't refuse creampie, I don't feel embarrassed, I don't get attached. Mei Miyajima, a bimbo female college student who understands the story best [Uncensored L**ked]",https://pic.javct.net/poster/04112026/ab5b7ec1db.jpg,https://javct.net/v/start-554-rm,137,2026-05-21
GVG-014-RM,Mama's Real Sex Education Kanako Ioka [Uncensored L**ked],https://pic.javct.net/poster/20221904/1651452891.jpg,https://javct.net/v/gvg-014-rm,117,2026-05-21
300MIUM-1102-RM,"A famous streamer's private sex was l**ked in order to earn 10,000,000 yen in savings, and when I went to the host, Pientama, a big ass who was making money by selling erotica, she let me take a rasson every time. She was surrounded by a large number of uncles, the ""Princess of Lasson,'' and her small-time pussy collapsed helplessly. The beautiful girl Pien, who was covered in slimy oil, was so excited that her uncle was so excited wwwww [Uncensored L**ked]",https://pic.javct.net/poster/05192026/bcbbad40a8.jpg,https://javct.net/v/300mium-1102-rm,99,2026-05-21
RDT-288-RM,A Little Devil Girl Who Seduces Me Without Hesitation As If To Make A Fool Of Me Who Is Not A Woman. [Uncensored L**ked],https://pic.javct.net/poster/20230302/1679976709.jpg,https://javct.net/v/rdt-288-rm,135,2026-05-21
FC2PPV-4890983,"A neat and clean beautiful lady from Kobe, Mens, stimulates a man with a miniskirt massage that looks like you can see her crotch at any moment. She gets squeezed for two shots, one in a hotel and another in an open-air bath. [Uncensored Creampie]",https://pic.javct.net/poster/05192026/259c94aa1b.jpg,https://javct.net/v/fc2ppv-4890983,56,2026-05-21
