code,title,image_url,page_url,views,date_scraped
HODV-21571-RM,"Reverse NTR ""Hey Boss ... Do You Want To Rest Up At My Place?"" This Boss Got Taken Home By His Employee And Taken For A Ride. Marina Saito [Uncensored L**ked]",https://static.javct.net/poster/hodv-21571.jpg,https://javct.net/v/hodv-21571-rm,129,2026-05-17
HODV-21556-RM,A Friend In Passing Revenge Gangbang Reika Hashimoto [Uncensored L**ked],https://pic.javct.net/poster/20212709/1636503215.jpg,https://javct.net/v/hodv-21556-rm,135,2026-05-17
XRW-641-RM,The Bedridden Husband And The Totally Perverted Wife. [Uncensored L**ked],https://pic.javct.net/poster/20220707/1659399269.jpg,https://javct.net/v/xrw-641-rm,144,2026-05-17
ADN-769-RM,"A Married Office Lady Who Is Fo**ed To Constantly Accept Sexual Servitude While Enjoying It, Due To The Absolute Obscurity Of Her Despised, Perverted, Scumbag Boss's Orders. [Uncensored L**ked]",https://pic.javct.net/poster/04112026/1875233dbb.jpg,https://javct.net/v/adn-769-rm,120,2026-05-17
ADN-769,"A Married Office Lady Who Is Fo**ed To Constantly Accept Sexual Servitude While Enjoying It, Due To The Absolute Obscurity Of Her Despised, Perverted, Scumbag Boss's Orders.",https://pic.javct.net/poster/04112026/1875233dbb.jpg,https://javct.net/v/adn-769,120,2026-05-17
APNS-271-RM,"Gangbang Girls The Tragedy Of Two Girls Fucked By Their Bosses In Front Of Their Fiances ""I Don't Know Whose Baby Is Inside Of Me..."" Aoi Mukai Suzu Monami [Uncensored L**ked]",https://pic.javct.net/poster/20212011/1641684419.jpg,https://javct.net/v/apns-271-rm,137,2026-05-17
DASS-923-RM,"I Used A Notebook To Alter Common Sense And Turned A Man-hating, Gloomy, Beautiful Girl Into A Sweaty, Raw-fucking, Disposable Fleshlight. Aizawa Miyu [Uncensored L**ked]",https://pic.javct.net/poster/04112026/1776964692.jpg,https://javct.net/v/dass-923-rm,150,2026-05-17
DASS-923,"I Used A Notebook To Alter Common Sense And Turned A Man-hating, Gloomy, Beautiful Girl Into A Sweaty, Raw-fucking, Disposable Fleshlight. Aizawa Miyu",https://pic.javct.net/poster/04112026/1776964692.jpg,https://javct.net/v/dass-923,150,2026-05-17
JUR-034-SUB,"""Teacher, Please Come To School Properly From Tomorrow Onwards"" Female Teacher Training Plan Humiliating School Creampie Training Given By A Colleague Ryo Aiyumi [English Subtitle]",https://pic.javct.net/poster/20250903/1742489214.jpg,https://javct.net/v/jur-034-sub,130,2026-05-17
PPPE-301-SUB,"""You Can Come To My Place Until The First Train?"" I Missed The Last Train And Went To My Colleague's House To Have A Raw Sex Session With Her, Unable To Resist The Temptation Of Her Careless Breasts Peeking Out From Under Her Thin Loungewear. [English Subtitle]",https://pic.javct.net/poster/20242012/1737083580.jpg,https://javct.net/v/pppe-301-sub,120,2026-05-17
SPZ-1174-RM,Real Office Lady Beauties Included! Close-up Shots Of The Erotic Lives Of Working Ladies In Uniform [Uncensored L**ked],https://pic.javct.net/poster/04112026/1776727988.jpg,https://javct.net/v/spz-1174-rm,120,2026-05-17
SPZ-1174,Real Office Lady Beauties Included! Close-up Shots Of The Erotic Lives Of Working Ladies In Uniform,https://pic.javct.net/poster/04112026/1776727988.jpg,https://javct.net/v/spz-1174,120,2026-05-17
MIDA-600-RM,"Even Though I Have A Girlfriend At Work... My Junior Colleague, Who's A Total Sex Toy With Me, Secretly Lets Me Fuck Her And Cum Inside Her Whenever She Gets Horny, Which Makes Work Go So Much More Smoothly!! Izumi Momoka [Uncensored L**ked]",https://pic.javct.net/poster/04112026/1776363074.jpg,https://javct.net/v/mida-600-rm,120,2026-05-17
MIDA-600,"Even Though I Have A Girlfriend At Work... My Junior Colleague, Who's A Total Sex Toy With Me, Secretly Lets Me Fuck Her And Cum Inside Her Whenever She Gets Horny, Which Makes Work Go So Much More Smoothly!! Izumi Momoka",https://pic.javct.net/poster/04112026/1776363074.jpg,https://javct.net/v/mida-600,120,2026-05-17
JUL-707-RM,Soon To Be Married Gorgeous Professional Woman Gets Breaking In For 7-Day Slut Training. Ai Mukai [Uncensored L**ked],https://pic.javct.net/poster/20212308/1631254905.jpg,https://javct.net/v/jul-707-rm,132,2026-05-17
DASS-927-RM,"During A Business Trip, A Torrential Downpour Hit, And I Unexpectedly Got Drunk In Front Of My Disliked Boss... We Ended Up Sharing A Room Unexpectedly. Even After Dawn, We Were Still Passionately Having Sex, Our Saliva Mingling, Sweating Profusely, And I Was Cumming Inside Her. Amane Michelle [Uncensored L**ked]",https://pic.javct.net/poster/06032026/1775762967.jpg,https://javct.net/v/dass-927-rm,120,2026-05-17
BIJN-196-RM,The Document Wild Animalistic Sex Horny Hot Secretary Gets Covered In Cum In No Holds Barred sex Akari Niimura [Uncensored L**ked],https://pic.javct.net/poster/20212011/1637575668.jpg,https://javct.net/v/bijn-196-rm,128,2026-05-17
DASS-927,"During A Business Trip, A Torrential Downpour Hit, And I Unexpectedly Got Drunk In Front Of My Disliked Boss... We Ended Up Sharing A Room Unexpectedly. Even After Dawn, We Were Still Passionately Having Sex, Our Saliva Mingling, Sweating Profusely, And I Was Cumming Inside Her. Amane Michelle",https://pic.javct.net/poster/06032026/1775762967.jpg,https://javct.net/v/dass-927,120,2026-05-17
NACT-106-RM,"Unexpectedly, We End Up Sharing A Room And I Get NTR'd! The Most Beautiful Subordinate In The Company Is With Me, A Dull Boss... Rinne Mochizuki [Uncensored L**ked]",https://pic.javct.net/poster/06032026/1775332623.jpg,https://javct.net/v/nact-106-rm,107,2026-05-17
DVEH-082-RM,"Big Tits Clothed Lotion - Clothes And All, Slippery Mucus All Over The Body, Hidden Lewd Female Employee Swamped In Sexual Harassment Overtime Itoi Ruka [Uncensored L**ked]",https://pic.javct.net/poster/06032026/1775155249.jpg,https://javct.net/v/dveh-082-rm,160,2026-05-17
YUJ-062-RM,"When My First Girlfriend Took Off Her Clothes, Her Incredible Body And Sexual Desire Made Me Cum So Many Times That I Ran Out Of Sperm. [Uncensored L**ked]",https://pic.javct.net/poster/06032026/1775157911.jpg,https://javct.net/v/yuj-062-rm,120,2026-05-17
NACT-106,"Unexpectedly, We End Up Sharing A Room And I Get NTR'd! The Most Beautiful Subordinate In The Company Is With Me, A Dull Boss... Rinne Mochizuki",https://pic.javct.net/poster/06032026/1775332623.jpg,https://javct.net/v/nact-106,107,2026-05-17
FNS-166-RM,"When I went to a hotel with a surly beautiful co-worker after drinking, I was glared at, but their dicks and pussies were so compatible that they ended up having secret sex every time they worked overtime... Tsumugi Akari [Uncensored L**ked]",https://pic.javct.net/poster/06032026/1774550982520.jpg,https://javct.net/v/fns-166-rm,124,2026-05-17
LULU-139-RM,"Just The 2 Of Us At The Office While Working Overtime, My Boss Is A Married Woman With Big Tits Bursting At The Seams Of Her Suit, Her Tits Get Me Super Horny And She Uses Them Non-stop To Service Me Till I Giver Her Tons Of Cum For A BUKKAKE. Yuria Yoshine [Uncensored L**ked]",https://pic.javct.net/poster/20221904/1651300326.jpg,https://javct.net/v/lulu-139-rm,160,2026-05-17
