code,title,image_url,page_url,views,date_scraped
SHKD-505,Ariga Some Cruel Dream And Reality Scattered Fleetingly Target School Girls Gangbang Club And Livestock,https://pic.javct.net/poster/04112026/be0e9559ad.jpg,https://javct.net/v/shkd-505,110,2026-05-18
SHKD-486,Kana Narumiya Two Student Teacher Of Shame,https://pic.javct.net/poster/04112026/04f0a1a75d.jpg,https://javct.net/v/shkd-486,110,2026-05-18
AKDL-016-RM,[Verification AV] What would happen if 6 men and women had a blindfold orgy? [Uncensored L**ked],https://pic.javct.net/poster/06032026/1774241309.jpg,https://javct.net/v/akdl-016-rm,77,2026-05-18
DIC-072-RM,Decided to appear in AV to raise business funds! 10 pages for a debut work! Endless convulsions climax! Aspiring entrepreneur/highly conscious female college student Aria Narimiya 21 years old AV debut! ! [Uncensored L**ked],https://pic.javct.net/poster/04112026/171b72a260.jpg,https://javct.net/v/dic-072-rm,175,2026-05-18
BBTU-114,Paisha! Semen bukkake on big tits with ahegao face Mizuki Shirayuki,https://pic.javct.net/poster/04112026/a496237ccc.jpg,https://javct.net/v/bbtu-114,122,2026-05-18
MIGD-608,Anal FUCK Out Bukkake NOW! Cool Breeze Kotono,https://pic.javct.net/poster/04112026/dd8b4e147e.jpg,https://javct.net/v/migd-608,120,2026-05-18
IDOL-058-RM,Feel R**ed? ! Hotaru Akane 20 Pies Barrage Company Employee [Uncensored L**ked],https://pic.javct.net/poster/04112026/9b570f81a6.jpg,https://javct.net/v/idol-058-rm,115,2026-05-18
DVAJ-124-RM,De M Gangbang Sasamoto Yuiai Was Awakening In The Aphrodisiac [Uncensored L**ked],https://pic.javct.net/poster/04112026/3fed2bd8e2.jpg,https://javct.net/v/dvaj-124-rm,150,2026-05-18
SHKD-277-RM,66 Brutal Gangbang R**e School Girls Confinement [Uncensored L**ked],https://pic.javct.net/poster/04112026/8999c1c8fe.jpg,https://javct.net/v/shkd-277-rm,90,2026-05-18
SON-541,Metamorphosis Doo Big Breasts Amateur Thorough Training,https://pic.javct.net/poster/04112026/bb33630013.jpg,https://javct.net/v/son-541,150,2026-05-18
SON-537,"""Take Off Her Bosom Her Tits And Release It For AV""",https://pic.javct.net/poster/04112026/30f37b9d9b.jpg,https://javct.net/v/son-537,140,2026-05-18
SON-528,Tits Figure BODY And Father Kissing Delusion SEX Nishio Rem,https://pic.javct.net/poster/04112026/bf43998951.jpg,https://javct.net/v/son-528,150,2026-05-18
SON-526,Former Gravure Transformation De M Tits Housewife To**ure Narisawa Nichinami,https://pic.javct.net/poster/04112026/175ea71906.jpg,https://javct.net/v/son-526,140,2026-05-18
SON-536,Pick Up The Nagano Prefecture Erotic Body G Cup Kamigyo Countryside Musume Sex Pickles,https://pic.javct.net/poster/04112026/8ad8742497.jpg,https://javct.net/v/son-536,140,2026-05-18
SON-533,Muchi Which Big Tits Butt Goban Cosplay Year Nude Shoot Tomorishami,https://pic.javct.net/poster/04112026/ed1b7702ae.jpg,https://javct.net/v/son-533,150,2026-05-18
SON-531,Naive H Cup Breasts Daughter - Tokyo Freshly Immediately AV Debut ~,https://pic.javct.net/poster/04112026/8cba926eb3.jpg,https://javct.net/v/son-531,150,2026-05-18
SON-530,Busty Intelligent Secretary Scrounge Service M To**ure Hoshizaki Kotone,https://pic.javct.net/poster/04112026/b6294ae04c.jpg,https://javct.net/v/son-530,140,2026-05-18
HZ-3848,Erotic Multiple Creampies Vol.8 - Hina Sakurai,https://pic.javct.net/poster/04112026/1c5297f308.jpg,https://javct.net/v/hz-3848,55,2026-05-18
SON-162,Big Tits Poisoning 4 Hours II,https://pic.javct.net/poster/04112026/414518adb8.jpg,https://javct.net/v/son-162,240,2026-05-18
SON-523,Black Gal Athlete Topped Deca-ass FUCK Airi Fujii,https://pic.javct.net/poster/04112026/ee59d74c9c.jpg,https://javct.net/v/son-523,140,2026-05-18
SON-161,Erotic Long Tongue Women's Rich Beloch Licking Mating 4 Hr,https://pic.javct.net/poster/04112026/48a6490939.jpg,https://javct.net/v/son-161,240,2026-05-18
SON-525,Big Tits Shaved H Cup AV Debut Sada Anzuminami,https://pic.javct.net/poster/04112026/515b206068.jpg,https://javct.net/v/son-525,140,2026-05-18
SON-522,Pies Tits Ass Black Gal Topped FUCK Mio Hazuki,https://pic.javct.net/poster/04112026/2eea05ccf9.jpg,https://javct.net/v/son-522,140,2026-05-18
ONEZ-091-RM,Sleeping Wife Erectile Dysfunction ED I Am Shooting A Figure That Makes My Beloved Wife Embrace Other People At The Hotel At The Weekend Riho 26 Years Old [Uncensored L**ked],https://pic.javct.net/poster/04112026/e5b81cdaf9.jpg,https://javct.net/v/onez-091-rm,125,2026-05-18
