code,title,image_url,page_url,views,date_scraped
NMSL-038-RM,"""Please impregnate me... Please..."" Prisoner Creampie Seeding Prison Akari Niimura [Uncensored L**ked]",https://pic.javct.net/poster/04112026/1776988359652.jpg,https://javct.net/v/nmsl-038-rm,150,2026-04-27
SIMW-006-RM,Kaho & Rin [Uncensored L**ked],https://pic.javct.net/poster/04112026/1777082672410.jpg,https://javct.net/v/simw-006-rm,96,2026-04-27
FC2PPV-4887363,"[No] Beautiful Nora-chan is violently fucked by a black man and a white man with big cocks in front of her boyfriend, and the NTR sweaty hardcore 3P with two consecutive cumshots at the end [Overseas version] Bonus included",https://pic.javct.net/poster/04112026/fb9d296607.jpg,https://javct.net/v/fc2ppv-4887363,41,2026-04-27
FC2PPV-4886269,Participating in a couple exchange circle Perverted couple fetish Explosive creampie seeding orgy,https://pic.javct.net/poster/04112026/8194f8671a.jpg,https://javct.net/v/fc2ppv-4886269,62,2026-04-27
JUX-897-RM,"Lifting Of The Ban Real Pies! !Heaven And Hell! !1 Day Horny Dimension Stop Temptation!On The Second Day Cum The Pampanga Of Sperm Plenty! !Tsuyado Shihori's And Amateur 10 Men, Room Share Out In Two Nights And Three Days! ! [Uncensored L**ked]",https://pic.javct.net/poster/20230908/1695341527.jpg,https://javct.net/v/jux-897-rm,150,2026-04-27
WANZ-863-RM,Time Stop Stalking X Pu Ban Ban Counterwaste DQN Fan Out In A Runaway Gangbang Bud [Uncensored L**ked],https://pic.javct.net/poster/06032026/1773047225.jpg,https://javct.net/v/wanz-863-rm,150,2026-04-27
DASD-163-RM,Kinoshita Barrage Wakana 100 Bukkake Gangbang [Uncensored L**ked],https://pic.javct.net/poster/04112026/96610f83e7.jpg,https://javct.net/v/dasd-163-rm,170,2026-04-27
SIMW-006,Kaho & Rin,https://pic.javct.net/poster/04112026/1777082672410.jpg,https://javct.net/v/simw-006,96,2026-04-27
FC2PPV-4878542-RM,"[4th year, Faculty of Economics, Waseda University] Good friend JD, close to graduation, fucked and creampied 4P orgy [Uncensored L**ked]",https://pic.javct.net/poster/04112026/1775953348.jpg,https://javct.net/v/fc2ppv-4878542-rm,83,2026-04-27
NMSL-038,"""Please impregnate me... Please..."" Prisoner Creampie Seeding Prison Akari Niimura",https://pic.javct.net/poster/04112026/1776988359652.jpg,https://javct.net/v/nmsl-038,150,2026-04-27
FC2PPV-4886086,Female college student's first anal sex & first 3P sex with continuous creampie,https://pic.javct.net/poster/04112026/1776990167.jpg,https://javct.net/v/fc2ppv-4886086,273,2026-04-27
MVSD-341,Stop Time Daughter Tadaman Casual Vaginal Cum Shot Sena Ai,https://pic.javct.net/poster/04112026/1777002000.jpg,https://javct.net/v/mvsd-341,120,2026-04-27
HAR-066-RM,My girlfriend was fucked and cuckolded at a drinking party [Uncensored L**ked],https://pic.javct.net/poster/04112026/1776997843535.jpg,https://javct.net/v/har-066-rm,125,2026-04-27
MIAA-081-SUB,The Tight Skirt Female Teacher Who Was Put Out For A Moment By The Time Ichut I Cup Huge Breasts Yari Want Unlimited [English Subtitle],https://pic.javct.net/poster/06032026/1773043715.jpg,https://javct.net/v/miaa-081-sub,150,2026-04-27
REAL-618-RM,Pies R**e To School Girls Conceived 20 Barrage Natsume Airi [Uncensored L**ked],https://pic.javct.net/poster/20230206/1686279051.jpg,https://javct.net/v/real-618-rm,130,2026-04-27
GVG-727-RM,Megumi P A Chairperson And Evil Gaki Student Council Maria Aizawa [Uncensored L**ked],https://pic.javct.net/poster/04112026/1776908797.jpg,https://javct.net/v/gvg-727-rm,135,2026-04-27
HAR-064-RM,VR Bus Molester - Virtual Bus Commute Monitor And Falsify Been Busty Beauties That Has Been Put On A Bus Full Of Pervert Teacher - [Uncensored L**ked],https://pic.javct.net/poster/04112026/1776908668.jpg,https://javct.net/v/har-064-rm,125,2026-04-27
REAL-612-RM,Pies R**e To School Girls Conceived 20 Barrage Kanae Luke [Uncensored L**ked],https://pic.javct.net/poster/20222612/1673965689.jpg,https://javct.net/v/real-612-rm,140,2026-04-27
FOCS-031-RM,We Go Undercover To Investigate A Beautiful Girl At The Private ** University! We're At A Training Facility That Cums With A Pool (A Welcumning Orgy Party) A Neat And Clean Gets Splattered With Semen And Climaxes Like Crazy Meru Ito [Uncensored L**ked],https://pic.javct.net/poster/20212709/1636702998.jpg,https://javct.net/v/focs-031-rm,125,2026-04-27
KRND-019-RM,Undercover Itagaki Azusa That Are Pregnancy [Uncensored L**ked],https://pic.javct.net/poster/04112026/1776794619.jpg,https://javct.net/v/krnd-019-rm,120,2026-04-27
SDAM-165,"Satomi Ikura (22), a college student living in Chofu City, cums with 6 other people's dicks inserted in her first shoot ""I didn't have enough money for my boyfriend's birthday play''",https://pic.javct.net/poster/04112026/1776713386906.jpg,https://javct.net/v/sdam-165,156,2026-04-27
MIGD-580,Swallowing creampie semen Vol.4 Saya Tachibana Hibiki Otsuki,https://pic.javct.net/poster/04112026/1776665452.jpg,https://javct.net/v/migd-580,218,2026-04-27
DTKM-043-RM,"Fakecest: Stepmother And Offspring Swap - I'll Let You Fuck My Stepmom, So Let Me Fuck Yours. Mitsuko Ueshima Saeko Yokoyama [Uncensored L**ked]",https://pic.javct.net/poster/20212011/1643510747.jpg,https://javct.net/v/dtkm-043-rm,207,2026-04-27
BIJN-203-RM,The Documentary The Ultimate Animalistic Sex Beautiful Married Slut Loses Her Mind Joining In On A Creampie Orgy Ai Mukai [Uncensored L**ked],https://static.javct.net/poster/bijn-203.jpg,https://javct.net/v/bijn-203-rm,130,2026-04-27
