code,title,image_url,page_url,views,date_scraped
SUN-092-RM,No Bra Nipples Pocchi Walk Feeling The Gaze In The Crowd Nipples Bing [Uncensored L**ked],https://pic.javct.net/poster/20230207/1689476945.jpg,https://javct.net/v/sun-092-rm,179,2026-05-25
FAX-263-RM,"War Of Plunder, R**e, Abduction Gangbang [Uncensored L**ked]",https://pic.javct.net/poster/20222410/1666920901.jpg,https://javct.net/v/fax-263-rm,102,2026-05-25
SKMJ-753-RM,"Amateur Beauties On A Walk With Remote-controlled Vibrators - Black Pantyhose Sensitive Career Women Edition - ""I Can't Hold Back Anymore...//"" Office Ladies With Beautiful Legs In Black Pantyhose Tremble And Climax In The Middle Of A Crowd! Their First Ever Humiliating Experience Unexpectedly Turns On Their Erotic Switch! Bold Car Masturbation During Car Rides! And Finally, A Mind-blowing Experience At A Hotel... [Uncensored L**ked]",https://pic.javct.net/poster/05192026/e0f354a82d.jpg,https://javct.net/v/skmj-753-rm,246,2026-05-25
SGKI-078,Naked Sports Battle 2026 Complete Edition,https://pic.javct.net/poster/05192026/08a39e27fb.jpg,https://javct.net/v/sgki-078,180,2026-05-25
AKDL-025-RM,"Shizuka, a college student who loves throat orgasms and sperm. Swallowing all the disgusting middle-aged men she meets for the first time [Dirty dick deep throat deep throat trance] [Begging for the most disgusting semen] [Outdoor urination in broad daylight] Shizuka Sugisaki [Uncensored L**ked]",https://pic.javct.net/poster/06032026/1774954579.jpg,https://javct.net/v/akdl-025-rm,182,2026-05-25
FAX-304-RM,Yu Kawakami Various Life [Uncensored L**ked],https://pic.javct.net/poster/05192026/b3beee9aea.jpg,https://javct.net/v/fax-304-rm,160,2026-05-25
FAX-239-RM,Lust Battleground: Mother & Daughter Passed Around by 50 Men [Uncensored L**ked],https://pic.javct.net/poster/20221904/1652660133.jpg,https://javct.net/v/fax-239-rm,125,2026-05-25
XVSR-183-RM,Togu Tin Go! !Assault Street Reverse Nampa DX [Uncensored L**ked],https://pic.javct.net/poster/01202026/1772443009.jpg,https://javct.net/v/xvsr-183-rm,130,2026-05-25
NEO-949-RM,Mature Woman In Sailor Uniform Experiences Incontinence And Shame - Yoshii Miki [Uncensored L**ked],https://pic.javct.net/poster/05192026/b7f20debdd.jpg,https://javct.net/v/neo-949-rm,121,2026-05-25
MIDD-942,Ai Sayama Exposure Shyness Plump Out Hami,https://pic.javct.net/poster/05192026/436c78636c.jpg,https://javct.net/v/midd-942,120,2026-05-25
VGD-134-RM,Devil Bitch? SWEET DEVIL Muto Tsugumi [Uncensored L**ked],https://pic.javct.net/poster/06032026/1773217109.jpg,https://javct.net/v/vgd-134-rm,140,2026-05-25
SKMJ-753,"Amateur Beauties On A Walk With Remote-controlled Vibrators - Black Pantyhose Sensitive Career Women Edition - ""I Can't Hold Back Anymore...//"" Office Ladies With Beautiful Legs In Black Pantyhose Tremble And Climax In The Middle Of A Crowd! Their First Ever Humiliating Experience Unexpectedly Turns On Their Erotic Switch! Bold Car Masturbation During Car Rides! And Finally, A Mind-blowing Experience At A Hotel...",https://pic.javct.net/poster/05192026/e0f354a82d.jpg,https://javct.net/v/skmj-753,246,2026-05-25
FAX-219-RM,Housewife Was Attacked In The Footpath Of Rice Farming / Daughter Been **dnapped President / Violence To Break Into The House To The Ends Of The Amorous History Of Sex Crimes Japan Piece Was Wheel To Criminal [Uncensored L**ked],https://pic.javct.net/poster/05192026/5cb7ceb1bf.jpg,https://javct.net/v/fax-219-rm,110,2026-05-25
NEO-949,Mature Woman In Sailor Uniform Experiences Incontinence And Shame - Yoshii Miki,https://pic.javct.net/poster/05192026/b7f20debdd.jpg,https://javct.net/v/neo-949,121,2026-05-25
SUN-093-RM,Contraceptive Drinking A Female College Student Carrying A Condom With Sperm And Drinking It Outdoors [Uncensored L**ked],https://pic.javct.net/poster/20230804/1691291268.jpg,https://javct.net/v/sun-093-rm,178,2026-05-25
KIRD-174,Lisa BODY-SLENDER sun sensitive - Shaved exposure,https://pic.javct.net/poster/05192026/49b0e4468c.jpg,https://javct.net/v/kird-174,110,2026-05-25
HMGL-123-RM,Big Dirty Little Collection Fujisaki Elina And Aoi Yamaguchi [Uncensored L**ked],https://pic.javct.net/poster/06032026/1773983557.jpg,https://javct.net/v/hmgl-123-rm,140,2026-05-25
VGD-131-RM,Emi Again Incense [Uncensored L**ked],https://pic.javct.net/poster/06032026/1772953467.jpg,https://javct.net/v/vgd-131-rm,140,2026-05-25
NHDTA-858-RM,Pies Pool Molester Water Rimobai Shame SP [Uncensored L**ked],https://pic.javct.net/poster/05192026/a6f3160b43.jpg,https://javct.net/v/nhdta-858-rm,240,2026-05-25
MIGD-610,Fcup Breasts College Student Virgins!Dating & SEX Serizawa Pupil Of The First AV Debut,https://pic.javct.net/poster/04112026/fe04d13d22.jpg,https://javct.net/v/migd-610,120,2026-05-25
RCTD-096-RM,Lower Body Rolled Out Part-time Job At A Staggered Street Mayor Kurata Mana Hamasaki Mao [Uncensored L**ked],https://pic.javct.net/poster/20231711/1702771824.jpg,https://javct.net/v/rctd-096-rm,120,2026-05-25
HMGL-120-RM,Embarrassing Body Super Sex Symbol Hasumi Claire [Uncensored L**ked],https://pic.javct.net/poster/06032026/1773803922.jpg,https://javct.net/v/hmgl-120-rm,140,2026-05-25
T28-379-RM,Orgy Incidents Shaved Girls Attending A Boarding-school Dormitory In The Woods Became Pregnant [Uncensored L**ked],https://pic.javct.net/poster/06032026/1773217049.jpg,https://javct.net/v/t28-379-rm,140,2026-05-25
SEND-47-RM,Another B ★ Jean Amount Of Star [Uncensored L**ked],https://pic.javct.net/poster/04112026/32ead47d2a.jpg,https://javct.net/v/send-47-rm,135,2026-05-25
