code,title,image_url,page_url,views,date_scraped
MIDA-619,"Reunited With The Senior I Had A Crush On In High School At A Call Girl Service—reminiscing About My First Love, Uniform, All Optional Services♪ Full Sex OK, Pussy Pounding, Cheating, I'm A Slut Yagi Nana",https://pic.javct.net/poster/04112026/627de60243.jpg,https://javct.net/v/mida-619,120,2026-05-01
HODV-20599-RM,Kirara Kirara ☆ Royale Tomorrow Flower Of Love Sex [Uncensored L**ked],https://pic.javct.net/poster/04112026/2c30996227.jpg,https://javct.net/v/hodv-20599-rm,120,2026-05-01
MNGS-050,"Facial-focused 2D Ejaculation Control, Rejuvenation Massage Girl's Cohabitation And Submissive Training, My Dick Goes Beyond Its Limits 24 Hours A Day With Her God-like Techniques And Brain-melting Dirty Talk, Nanase Alice",https://pic.javct.net/poster/04112026/8fc0f82eb1.jpg,https://javct.net/v/mngs-050,120,2026-05-01
NACR-305,"If ... ""Yu Shinoda"" Is Xx ...",https://pic.javct.net/poster/04112026/12dd69492b.jpg,https://javct.net/v/nacr-305,125,2026-05-01
MIST-196,Direct Hit On Dangerous Day !! Soapland Where You Can Make Babies 10 - Nikaidou Yuri,https://pic.javct.net/poster/04112026/e10e2e5958.jpg,https://javct.net/v/mist-196,140,2026-05-01
MARA-057-RM,Shion No Orchid Tits Theater Hcup! 90cm [Uncensored L**ked],https://pic.javct.net/poster/04112026/c022f40e2b.jpg,https://javct.net/v/mara-057-rm,124,2026-05-01
MARA-058-RM,Yua Asakura Big Breasts Theater Kcup! 116cm [Uncensored L**ked],https://pic.javct.net/poster/04112026/3673d40a78.jpg,https://javct.net/v/mara-058-rm,121,2026-05-01
SDAB-112-RM,Bubble-covered Youth Narikiri Awahime Experience Service Soap Kuroki [Uncensored L**ked],https://pic.javct.net/poster/04112026/6b1a010157.jpg,https://javct.net/v/sdab-112-rm,135,2026-05-01
MIAE-271,Ultra-high-end Vaginal Cum Shot Special Soap Shinoda Yu,https://pic.javct.net/poster/04112026/ddd208b7ea.jpg,https://javct.net/v/miae-271,120,2026-05-01
MIAE-136,"Great Handjob With Amazing Ejaculation, Full Erection Beauty Salon Shinoda Yu",https://pic.javct.net/poster/04112026/8df6eb4eb2.jpg,https://javct.net/v/miae-136,120,2026-05-01
PGD-096-RM,PREMIUM STYLISH SOAP ~ Welcome To Premium Soap! Ning - We [Uncensored L**ked],https://pic.javct.net/poster/04112026/4a1819793a.jpg,https://javct.net/v/pgd-096-rm,110,2026-05-01
PPPE-314-SUB,Karen-chan's School Is Full Of Moral Lewdness After She Creates An Entertainment District In Her School. Karen Yuzuriha [English Subtitle],https://pic.javct.net/poster/20250903/1741888004.jpg,https://javct.net/v/pppe-314-sub,120,2026-05-01
PGD-645,Minute Special Night Results PREMIUM STYLISH SOAP VIP180,https://pic.javct.net/poster/04112026/040b31b26b.jpg,https://javct.net/v/pgd-645,180,2026-05-01
MIAA-158,Dopyu!Pursuit Bush! Unlimited Vaginal Cum Shot & Male Juice!Welcome To Fainting Man Squirting Soap Yu Shinoda,https://pic.javct.net/poster/04112026/5b6085fb44.jpg,https://javct.net/v/miaa-158,120,2026-05-01
MKS-002,Soap Lady Shinoda Yu Was Really Ass,https://pic.javct.net/poster/04112026/820b659f98.jpg,https://javct.net/v/mks-002,151,2026-05-01
MIST-194,New Delhi That The Girls Visit Nakedly!Immediate Scale & Instantly Girls Who Work In Customs That Are Too Sketchy Of DK Are Quiet! What?Even If You Insert It Rawly Into The Crotch You Accept It!Cum Shot Repeatedly Using Unlimited Shots In Time!2,https://pic.javct.net/poster/04112026/9912753c2b.jpg,https://javct.net/v/mist-194,160,2026-05-01
IPTD-951-RM,Welcome To Soap Star Rika And The World's Finest [Uncensored L**ked],https://pic.javct.net/poster/04112026/022555fe34.jpg,https://javct.net/v/iptd-951-rm,170,2026-05-01
NXG-449-RM,Live Insertion Negotiation At A Delivery Health Service Specializing In Beautiful Mature Women Who Are Not Allowed To Perform Live! ! [Uncensored L**ked],https://pic.javct.net/poster/20231011/1697777506.jpg,https://javct.net/v/nxg-449-rm,120,2026-05-01
MARA-056-RM,Yuri Yoshine That Big Breast Theater Mcup! 111 Cm [Uncensored L**ked],https://pic.javct.net/poster/04112026/fcd9e36020.jpg,https://javct.net/v/mara-056-rm,123,2026-05-01
MDBK-300-RM,Sexy Munmun! Enchanting Ero Buddy! Unequaled Bimbo Bit Slut's Triple Colossal Tits Surrounded By Fucking Dirty Lewd Snack Always Bing With Rich Reverse Sexual Harassment Customer Service! ! All-you-can-drink All-you-can-eat Harlem Orgy Tonight Until Morning! ! [Uncensored L**ked],https://pic.javct.net/poster/20230908/1694234360.jpg,https://javct.net/v/mdbk-300-rm,140,2026-05-01
KNMB-122-RM,"Mari (23), A Hostess With Gorgeous Legs Who Lets You Cum Inside Her Before She Goes To Work. [Uncensored L**ked]",https://pic.javct.net/poster/04112026/86f6a55d41.jpg,https://javct.net/v/knmb-122-rm,120,2026-05-01
CEMD-304-RM,A Woman Drowning In Overflowing Sexual Impulses Sex Donna Akari Niimura Super Erotic 4SEX [Uncensored L**ked],https://pic.javct.net/poster/20230302/1678512080.jpg,https://javct.net/v/cemd-304-rm,234,2026-05-01
MIAA-092,"Encounter With Hate Woman Boss And Deriheru, Immediate Position Reversal! Time & Launch Unlimited!Intravaginal Ejaculation Fo**ed!The Shop And The Company Made Iinari Cowgirl Pet. Shinoda Yu",https://pic.javct.net/poster/04112026/dca9c8af51.jpg,https://javct.net/v/miaa-092,120,2026-05-01
MARA-055-RM,Ena Koume's Big Breast Theater Kcup! 105 Cm [Uncensored L**ked],https://pic.javct.net/poster/04112026/ad7f4eb111.jpg,https://javct.net/v/mara-055-rm,124,2026-05-01
