code,title,image_url,page_url,views,date_scraped
XVSR-230-RM,Soap Play Started 3 Minutes And Suddenly Reverse Soap! It Is!~ Teaching By Mr. Active Soap Is Also Ineffective ~ Flowering Pot [Uncensored L**ked],https://pic.javct.net/poster/06032026/1773145270.jpg,https://javct.net/v/xvsr-230-rm,120,2026-05-09
PGD-581-RM,PREMIUM STYLISH SOAP ASUKA [Uncensored L**ked],https://pic.javct.net/poster/06032026/1773292933.jpg,https://javct.net/v/pgd-581-rm,120,2026-05-09
SCOP-706,Illegal Existence In A Multi-tenant Building In A Certain Downtown Area J ● Active Girls In Refre ● There Are Rumors That Students Are Providing Illegal Reflation Services To Men At Night! Geki Kawa X Erotic Little Devil J ● Thorough Refre Misses SCOOOP!,https://pic.javct.net/poster/04112026/b8f2ad7ee6.jpg,https://javct.net/v/scop-706,150,2026-05-09
SCOP-909,"I Called A Call Girl And The One Who Showed Up Was The Former Delinquent Who Used To Bully Me!? I Got Annoyed At Her For Doing A Half-hearted Job And Cursing At Me, So I Slipped Her Some Aphrodisiac Oil I Had Prepared, And She Became Incredibly Horny!! Her Body Became Sensitive And Started To Convulse Uncontrollably, And When I Slathered More On, She Begged For My Dick Herself!! She Came So Hard She Arched Her Back Like A Shrimp",https://pic.javct.net/poster/04112026/0e679cf473.jpg,https://javct.net/v/scop-909,135,2026-05-09
JUR-727-RM,"I Unexpectedly Reunited With The Teacher Who Sexually Harassed Me During My Student Days, While Working At A Call Girl Service. From That Day On, I Was Fo**ed To Become His Obedient Sex Pet... [Uncensored L**ked]",https://pic.javct.net/poster/04112026/7244422498.jpg,https://javct.net/v/jur-727-rm,130,2026-05-09
MIST-205,"This Is My Life Long Life.In The Tokyo Interior Interview Of A Certain Health In Tokyo, Guys Who Are Geeks Voyeur A Newcomer!To Vaginal Cum Shot 2",https://pic.javct.net/poster/04112026/6c1062a607.jpg,https://javct.net/v/mist-205,160,2026-05-09
ONSG-068-RM,Busty Deriheru H Cup Nene Tanaka [Uncensored L**ked],https://pic.javct.net/poster/20230804/1692418024.jpg,https://javct.net/v/onsg-068-rm,130,2026-05-09
GDRD-018-RM,Red Dragon Oto Alice [Uncensored L**ked],https://pic.javct.net/poster/20241902/1709952577.jpg,https://javct.net/v/gdrd-018-rm,118,2026-05-09
JUR-727,"I Unexpectedly Reunited With The Teacher Who Sexually Harassed Me During My Student Days, While Working At A Call Girl Service. From That Day On, I Was Fo**ed To Become His Obedient Sex Pet...",https://pic.javct.net/poster/04112026/7244422498.jpg,https://javct.net/v/jur-727,130,2026-05-09
HUNTC-506,"""If You Let Me Cum, I'll Come To Work."" My Big Dick Is The Alarm Clock For The Hostesses!? My Job As A Helpless Worker Is To Wake Up The Hostesses In The Dorm. Today, A Super Spoiled Girl With A Hangover Gave Me The Impossible Task Of ""If You Let Me Cum..."" So I Gave Her A Quickie To Wake Her Up! And Then...",https://pic.javct.net/poster/04112026/751f0ba0de.jpg,https://javct.net/v/huntc-506,170,2026-05-09
OVG-206-RM,"Raw Vaginal Cum Shot For Miss Deriheru Who Is Absolutely Prohibited! 7 When I Was Rubbed By My Pussy With An Oil Intercrural Sex, It Was So Comfortable That I Involuntarily Inserted It Raw! Sensitive Busty Lady Who Gets Vaginal Cum Shot While Reluctant To Say No [Uncensored L**ked]",https://pic.javct.net/poster/20222311/1670039468.jpg,https://javct.net/v/ovg-206-rm,125,2026-05-09
STAR-970-RM,Aoyama Darumi If You Come Across The Idol Of Pushing And The Shamisen Store ... [Uncensored L**ked],https://pic.javct.net/poster/04112026/f5dad01607.jpg,https://javct.net/v/star-970-rm,140,2026-05-09
GDRD-017-RM,Red Dragon Moeka Marui [Uncensored L**ked],https://pic.javct.net/poster/20241901/1707536380.jpg,https://javct.net/v/gdrd-017-rm,130,2026-05-09
GDRD-016-RM,Red Dragon Kimito Ayumi [Uncensored L**ked],https://pic.javct.net/poster/20241901/1707536449.jpg,https://javct.net/v/gdrd-016-rm,126,2026-05-09
SCOP-588,"It Was A Local Yankee Who Was Bullying Me For A Long Time Calling Deriher! !As I Was Fo**ed To Take The Wallet And All The Options Were Set Aside, The Performance Of The Back Ops So I Inserted It As Soon As I Inserted It! !I Was Caught All The Way But My Throbbing In My Mouth! !",https://pic.javct.net/poster/04112026/c9c76a1250.jpg,https://javct.net/v/scop-588,135,2026-05-09
GDRD-015-RM,Red Dragon Erika Ozaki [Uncensored L**ked],https://pic.javct.net/poster/20231912/1705116633.jpg,https://javct.net/v/gdrd-015-rm,133,2026-05-09
GDRD-014-RM,Red Dragon Nagi Mamiya [Uncensored L**ked],https://pic.javct.net/poster/20231912/1705118723.jpg,https://javct.net/v/gdrd-014-rm,141,2026-05-09
PGD-570-RM,Saori PREMIUM STYLISH SOAP [Uncensored L**ked],https://pic.javct.net/poster/06032026/1772843155.jpg,https://javct.net/v/pgd-570-rm,160,2026-05-09
IPZ-988,First Time 8 Customs SPECIAL + 4 Production + Pinosaro + Mutual Onage + China Este + Quick Delivery Nishimiya Yume Book Nominating 240 Minutes,https://pic.javct.net/poster/04112026/a4bd008972.jpg,https://javct.net/v/ipz-988,240,2026-05-09
MIGD-525-RM,Pinsaro Miss Minato 莉久 Cum Pacifier Your [Uncensored L**ked],https://pic.javct.net/poster/06032026/1772962247.jpg,https://javct.net/v/migd-525-rm,170,2026-05-09
LULU-161-RM,"A Reunion With A Local Busty Yariman Bitch Senior Who Used To Be Zurineta In Deriheru! If The Big Cock Is Found Out And Fo**ed To Try It, It Will Shoot Immediately! I Liked The Big Cock And Cummed Out With Unlimited Firing For One Night Only. Alice Otsu [Uncensored L**ked]",https://pic.javct.net/poster/20221108/1662182308.jpg,https://javct.net/v/lulu-161-rm,160,2026-05-09
ABP-237,Customs Tower Erogenous Full Course 3 Hours SPECIAL Suzumura Airi,https://pic.javct.net/poster/04112026/6b5f96e0b7.jpg,https://javct.net/v/abp-237,180,2026-05-09
EKDV-290,You're Soap Nana Usami,https://pic.javct.net/poster/04112026/5c3629db6a.jpg,https://javct.net/v/ekdv-290,120,2026-05-09
MIGD-595,Specialty Soap Kururugi Mikan Out Super High Quality In,https://pic.javct.net/poster/04112026/c8bbc459a9.jpg,https://javct.net/v/migd-595,150,2026-05-09
