code,title,image_url,page_url,views,date_scraped
LANK-009,Busty Girl Soft Body Meat Treats Yu Pot,https://pic.javct.net/poster/04112026/08056940ca.jpg,https://javct.net/v/lank-009,110,2026-04-28
T28-452-RM,Orgy Cum School Girls Group Hypnosis [Uncensored L**ked],https://pic.javct.net/poster/20242108/1727045142.jpg,https://javct.net/v/t28-452-rm,180,2026-04-28
MIDD-853-RM,Nana And Aya Haruki SEX Girl Uniform [Uncensored L**ked],https://pic.javct.net/poster/01202026/1772180781.jpg,https://javct.net/v/midd-853-rm,120,2026-04-28
HAR-073-RM,A Woman With A Daughter And A Woman Tattoos Aphrodisiac And Estrangement & Close-minded & Lesbian 3P In W Creampie Sex 2 [Uncensored L**ked],https://pic.javct.net/poster/04112026/70d6379648.jpg,https://javct.net/v/har-073-rm,125,2026-04-28
LOL-211-RM,B  Senka The Most Cute Beautiful Girl Staying Gonzo Creampie SEX Ena Satsuki [Uncensored L**ked],https://pic.javct.net/poster/20220707/1659681549.jpg,https://javct.net/v/lol-211-rm,105,2026-04-28
JUKF-112-RM,"# Doujin AV Ena Satsuki, A Girl I Met On SNS [Uncensored L**ked]",https://pic.javct.net/poster/20241902/1708410786.jpg,https://javct.net/v/jukf-112-rm,146,2026-04-28
SCOP-180-RM,"Ma ● Co Because Has Drifted Female Smell Intense Pouring Away Love Juice In The Clinic Woman Who Suffer From Underarm Sweat To Attend Professional, If I Had Continued To Sexual Harassment In The Name Of Treatment, Juice Smeared SEX Therapy With B**od ● Port Of Male Conducted!  ! [Uncensored L**ked]",https://pic.javct.net/poster/04112026/232860f1d5.jpg,https://javct.net/v/scop-180-rm,240,2026-04-28
NHDTB-165-RM,Girls ○ Raw Noodles Squirrel Impossible To Spite Of Buttocks Aphrodisiac Quickly!Erotic Masturbation Can Not Stop With Escaping Aphrodisiac Effect Even If Escaping [Uncensored L**ked],https://pic.javct.net/poster/04112026/7bf78b5b37.jpg,https://javct.net/v/nhdtb-165-rm,155,2026-04-28
MIAD-997-RM,Sister And You Sister Or Which Is Not Try Crazy Spear And Erotic Squid Exchange?# 02 Sakaegawa Noa Suzuya Strawberries [Uncensored L**ked],https://pic.javct.net/poster/20241902/1709942645.jpg,https://javct.net/v/miad-997-rm,180,2026-04-28
RCTD-040-RM,Immediately After The Guerilla Heavy Rain The R**e Rain ○ ○ ○ [Uncensored L**ked],https://pic.javct.net/poster/04112026/daa1f89c50.jpg,https://javct.net/v/rctd-040-rm,120,2026-04-28
MIAD-819-RM,Absolutely The Girl Hunt Trespassing Frightened Fallen Death Gangbang Family Secret Of The Hide-and-seek Natsume Airi [Uncensored L**ked],https://pic.javct.net/poster/04112026/6116bba10c.jpg,https://javct.net/v/miad-819-rm,120,2026-04-28
AOZ-304Z-RM,Trailing Devil Outdoor Rep Video Aimed At Female Students On Their Way Home [Uncensored L**ked],https://pic.javct.net/poster/20212308/1630048968.jpg,https://javct.net/v/aoz-304z-rm,160,2026-04-28
SLAP-152,Schoolgirls Show Off Their Panties By Pushing Them Tightly Into Their Pussies. 10,https://pic.javct.net/poster/04112026/4eb9566e31.jpg,https://javct.net/v/slap-152,100,2026-04-28
MIST-192,J ○ Special Service Of The Visiting Club 2,https://pic.javct.net/poster/04112026/254f7f7964.jpg,https://javct.net/v/mist-192,160,2026-04-28
REAL-592,Bondage Demon Capitalize Otoha Nanase-byte Destination Pretty Saddle Was In JK ~,https://pic.javct.net/poster/04112026/84c0b6ffe1.jpg,https://javct.net/v/real-592,115,2026-04-28
PKPD-129,Enjo Dating Creampie OK 18 Years Old H Cup Big Breasts Too Merry Cheerful Girl Hana Himesaki,https://pic.javct.net/poster/04112026/cb6432b0ad.jpg,https://javct.net/v/pkpd-129,139,2026-04-28
MIAD-744-RM,Home Confinement Les -flops Have Been Mother And Daughter - Gangbang Been Mother-in-law And The Pies Have Been School Girls  Aisu Kokoa Camellia Pretty [Uncensored L**ked],https://pic.javct.net/poster/20230302/1678158417.jpg,https://javct.net/v/miad-744-rm,120,2026-04-28
SKMJ-431-RM,"Big Penis Sanction! I Made A Salty PA ● Life Super Impertinent Daughter Thoroughly Understand Condom Poi In The Middle Of The Back! No Matter How Many Times I Apologize, I Will Never Forgive The High-speed Intense Piston That Completely Defeats My Legs! I Want To Cry! ! 3 4 Rotten Enkou Girls Licking Adults [Uncensored L**ked]",https://pic.javct.net/poster/20230908/1695386807.jpg,https://javct.net/v/skmj-431-rm,253,2026-04-28
APAK-261-RM,"Creampie Busty Masochist Climax Sumire (G Cup) ""The Uterus And Throat Are Violent!"" A Sober Beautiful Girl Awakens And Masochistic Runaway! Sweaty Screaming Climax SEX! Art Department Sumire Uchida [Uncensored L**ked]",https://pic.javct.net/poster/20230908/1694230992.jpg,https://javct.net/v/apak-261-rm,132,2026-04-28
URKK-029-RM,Breasts Have Been Rubbed By The Next Transformation Lord [Uncensored L**ked],https://pic.javct.net/poster/20250903/1742822403.jpg,https://javct.net/v/urkk-029-rm,140,2026-04-28
STAR-954-RM,"My Girlfriend Is Mihiro Iiyi Of The Same Class And Is Exciting And Erotic, Two Love Love School Life [Uncensored L**ked]",https://pic.javct.net/poster/04112026/47a001470d.jpg,https://javct.net/v/star-954-rm,135,2026-04-28
HUNTA-488-SUB,"""I Want You To See It From The Scary Of One Person ..."" My First Younger Sister Is In Front Of Me V-shaped Legged Iki! !I Have A Good Sister Who Can Tell Me Anything, But Unusually ... [English Subtitle]",https://pic.javct.net/poster/06032026/1774229118.jpg,https://javct.net/v/hunta-488-sub,180,2026-04-28
MILD-757-RM,Shiori Kanzaki Active Guidance Of The Teacher's Way Of Training Of Teachers Compliant Tits Horny M [Uncensored L**ked],https://pic.javct.net/poster/04112026/dd470afd1d.jpg,https://javct.net/v/mild-757-rm,180,2026-04-28
JUBE-007-RM,Old Man Loves Plump Body Busty Girl ○ Raw And Unauthorized Creampie Sex [Uncensored L**ked],https://pic.javct.net/poster/20230207/1690602738.jpg,https://javct.net/v/jube-007-rm,173,2026-04-28
