code,title,image_url,page_url,views,date_scraped
LULU-171-RM,"Couldn't Resist The Unconscious Provocation Panchira Of My Namaiki Deca-ass Neo Gal Sister Who Was Suddenly Made By My Father's Remarriage, And I Was Courageous And Immediately Saddled With My Virginity Piston Many Times. Himari Kinoshita [Uncensored L**ked]",https://pic.javct.net/poster/20222109/1664600070.jpg,https://javct.net/v/lulu-171-rm,160,2026-05-09
ONEZ-082-RM,"After School, I Want To Commit Intently Hole Of Uniform You.Yuko Kitagawa [Uncensored L**ked]",https://pic.javct.net/poster/04112026/2daafd12e0.jpg,https://javct.net/v/onez-082-rm,120,2026-05-09
SCOP-706,Illegal Existence In A Multi-tenant Building In A Certain Downtown Area J ● Active Girls In Refre ● There Are Rumors That Students Are Providing Illegal Reflation Services To Men At Night! Geki Kawa X Erotic Little Devil J ● Thorough Refre Misses SCOOOP!,https://pic.javct.net/poster/04112026/b8f2ad7ee6.jpg,https://javct.net/v/scop-706,150,2026-05-09
GVH-844,Mother And Daughter Gang R**e: A Chain Of R**es Where The Mother And Daughter Are Continuously Gang-r**ed And Impregnated Until They Become Sex Slaves. Minase Akari/Aina Miumi,https://pic.javct.net/poster/04112026/afeaa89a86.jpg,https://javct.net/v/gvh-844,155,2026-05-09
MKMP-727,"I Was Dragged To A Hotel After School By Two Mischievous Students... Until I Answered Which One I Would Date, They Devoured Me With Their Mouths, One Above The Other, And Squeezed Out My Semen.",https://pic.javct.net/poster/04112026/d5ed312def.jpg,https://javct.net/v/mkmp-727,135,2026-05-09
MDTM-102-RM,"Tsuruman Sweaty JK To Bare The Mifune Mikoto Beautiful Girl Is Libido, SEX Pies Hell-bent [Uncensored L**ked]",https://pic.javct.net/poster/04112026/cd72d2e736.jpg,https://javct.net/v/mdtm-102-rm,120,2026-05-09
BBAN-580-RM,"Homesick Lesbians: Mama's Boys Who Immerse Themselves In Lesbian Pleasure To Forget The Loneliness Growing In A Girls' Dormitory - Minami Hinano, Mochizuki Tsubomi [Uncensored L**ked]",https://pic.javct.net/poster/04112026/dbb39b61c8.jpg,https://javct.net/v/bban-580-rm,150,2026-05-09
HUNTA-662,"Roll Up The Knee High And Mini Skirt Girls With A Hot Roll! !The School Where I Entered Was A Girls' School Until Last Year And Became A Collaborator From This Year! !In Junior High School, She Has Nothing To Do With Girls ...",https://pic.javct.net/poster/04112026/c856d7eeda.jpg,https://javct.net/v/hunta-662,320,2026-05-09
BABM-021-RM,The J-kei Mom Who Lives Next Door Pampers Me With Great Love And Tolerance! Feel Babu Feel Baby Return SEX Ichika Matsumoto [Uncensored L**ked],https://pic.javct.net/poster/20230804/1693625243.jpg,https://javct.net/v/babm-021-rm,125,2026-05-09
BBAN-580,"Homesick Lesbians: Mama's Boys Who Immerse Themselves In Lesbian Pleasure To Forget The Loneliness Growing In A Girls' Dormitory - Minami Hinano, Mochizuki Tsubomi",https://pic.javct.net/poster/04112026/dbb39b61c8.jpg,https://javct.net/v/bban-580,150,2026-05-09
MDBK-297-RM,Sensitive Nipple Slut On The School Train A Timid Sensitive Girl Who Can't Stop Her Love Juices Overflowing In A Situation She's Too Embarrassed To Speak Out [Uncensored L**ked],https://pic.javct.net/poster/20230804/1692420097.jpg,https://javct.net/v/mdbk-297-rm,150,2026-05-09
LULU-170-RM,I Smeared An Aphrodisiac On The Nipples Of My Innocent Girlfriend's Sister And Made Her A Sensitive Club Girl. Natsu Sano [Uncensored L**ked],https://pic.javct.net/poster/20222109/1664600135.jpg,https://javct.net/v/lulu-170-rm,160,2026-05-09
SDAB-119-RM,"Juice, Juice, Sweat, Tide, And Sperm Fly From A Fresh And Fresh Body! 11 Doppons! ! Youth Is Something That Makes Your Eyes Spin! ! Chiharu Sakurai [Uncensored L**ked]",https://pic.javct.net/poster/04112026/e0438529a9.jpg,https://javct.net/v/sdab-119-rm,130,2026-05-09
XBS-008-RM,Masochistic Beast Vomit Training 7th Person Ayami Kikugawa [Uncensored L**ked],https://pic.javct.net/poster/20243105/1719111479.jpg,https://javct.net/v/xbs-008-rm,122,2026-05-09
HUNTC-565,Unlimited Sex With Anyone For A Fixed Monthly Fee! School Trip Edition: Pay A Fixed Monthly Fee And Have Unlimited Sex With Any Female Student Or Teacher During A School Trip!,https://pic.javct.net/poster/04112026/1a2ead5bce.jpg,https://javct.net/v/huntc-565,140,2026-05-09
DASS-960,"""The More We Fight, The Closer We Become."" An Argument With My Cheeky Stepsister Who's An Idol Leads To Sex!? Unstoppable, Wild Piston Action And Cumming Inside!! Aizawa Miyu",https://pic.javct.net/poster/04112026/95af677106.jpg,https://javct.net/v/dass-960,120,2026-05-09
HSODA-119,"Brainwashing His Students. A Teacher Who Manipulates The Minds Of Female Track And Field Club Members And Turns Them Into His Sex Slaves. Yumi Nijimura, Ito Akana",https://pic.javct.net/poster/04112026/544655a41a.jpg,https://javct.net/v/hsoda-119,110,2026-05-09
MDTM-165-RM,Pretty And Dedication Support Using The Prestigious Soccer Part Of The Process Manager Riko Hinata Body JK [Uncensored L**ked],https://pic.javct.net/poster/04112026/36c594517b.jpg,https://javct.net/v/mdtm-165-rm,143,2026-05-09
MDTM-073-RM,"To Bare The Libido Tsuruman Sweat JK Aisu Kokoa Pretty, SEX Pies Gamushara [Uncensored L**ked]",https://pic.javct.net/poster/04112026/60e1463e2d.jpg,https://javct.net/v/mdtm-073-rm,160,2026-05-09
SKMJ-747,"For Real-life Friends Only // Classmates On A School Trip Take On The Challenge Of ""Win 1 Million Yen If You Can Give Two Virgins Their First Sexual Experience In A 4P""! The Girls Are Shy Around Their Friends' Dicks And The Virgin Boys Are Fully Erect And On The Verge Of Exploding! The Best Memories... Their First Time Is An Erotic Orgy (゜Д゜) An Unforgettable Virginity-losing, Cum-in-her-vagina Sex.",https://pic.javct.net/poster/04112026/43e9b761c2.jpg,https://javct.net/v/skmj-747,129,2026-05-09
APAK-329-RM,"Himari, With Her Voluptuous Flesh And Vibrant Orgasm After Being Cummed Inside, Cries Out, ""I'm Cumming! I'm Cumming! I'm Cumming!"" A Thrilling Orgasm Directly Hitting Her Uterus! ""That Was The Best Feeling Of My Life!"" Lewd Orgasm Student Guidance Momose Himari [Uncensored L**ked]",https://pic.javct.net/poster/04112026/c6a575dffc.jpg,https://javct.net/v/apak-329-rm,134,2026-05-09
PPPE-315-SUB,I Lost My Senses To My Student's Big Breasts And Ended Up Having Creampie Sex With Konatsu Over And Over Again At A Love Hotel After School Konatsu Kashiwagi [English Subtitle],https://pic.javct.net/poster/20250903/1744308550.jpg,https://javct.net/v/pppe-315-sub,120,2026-05-09
HUNTB-725-RM,"""Hey, You Have The Courage To Masturbate In Your Skirt And Cum On My Pants! ? ] A Super Perverted Sober Girl Is A Ridiculous Temptation! While Pounding So As Not To Be Found Out By The Surroundings... [Uncensored L**ked]",https://pic.javct.net/poster/20230908/1694150727.jpg,https://javct.net/v/huntb-725-rm,210,2026-05-09
SDAB-118-RM,From Day To Day With A Club Girl [Uncensored L**ked],https://pic.javct.net/poster/04112026/2049e68ec8.jpg,https://javct.net/v/sdab-118-rm,135,2026-05-09
