code,title,image_url,page_url,views,date_scraped
HUNBL-139-RM,"""Call Your Friends! Then I'll Help You!"" A Girl Who Met On A Daddy Activity Site Is Confined At Home! All-you-can-eat And Re-roll Creampie! Because I'm Getting Tired Of It... [Uncensored L**ked]",https://pic.javct.net/poster/20230207/1689911777.jpg,https://javct.net/v/hunbl-139-rm,120,2026-05-24
APAK-330,"Innocent 149cm F-cup Naughty Girl Ririka Gets Cummed Inside: ""I'm Cumming! I'm Cumming Right Away!"" Intense Orgasm From Hardcore Fucking! ""I Can't Stop My Hips!"" Grinding Cowgirl Climax! Crying Cumming! Lewd Orgasm Student Guidance: Amaba Ririka",https://pic.javct.net/poster/05192026/4c46c6195a.jpg,https://javct.net/v/apak-330,147,2026-05-24
APNS-318-RM,Nasty Stamp Despair Commentary Yuki Hiiragi [Uncensored L**ked],https://pic.javct.net/poster/20230207/1689996510.jpg,https://javct.net/v/apns-318-rm,110,2026-05-24
JAN-016-RM,C Erika In The Uniform 16 [Uncensored L**ked],https://pic.javct.net/poster/05192026/cafadbf674.jpg,https://javct.net/v/jan-016-rm,130,2026-05-24
IENE-858-RM,"I Want To See ""inserted"" Hikikiku Crotch!A Woman's Horny Juice Is A Nuchojunecho!When Girls ○ Students Got Bastards Oyazi ○ Po, It Was Such A Shameful Thing. [Uncensored L**ked]",https://pic.javct.net/poster/05192026/27c33a303e.jpg,https://javct.net/v/iene-858-rm,190,2026-05-24
MKON-090-RM,"When I Brought My Girlfriend, Who Loves Cleanliness, To A Boys' Dormitory Where Women Are Forbidden, She Was Caught By A Gross And Filthy Manager, And She Was Defiled Until She Was Tattered Kana Yura [Uncensored L**ked]",https://pic.javct.net/poster/20230207/1689997903.jpg,https://javct.net/v/mkon-090-rm,126,2026-05-24
JAN-015-RM,C In The Uniform Swing-chan 15 [Uncensored L**ked],https://pic.javct.net/poster/20250606/1752052690.jpg,https://javct.net/v/jan-015-rm,135,2026-05-24
RTP-096-RM,"I Saw The Thigh ""absolute Area"" Between Skirt And Knee High Looking Down From Elongated Legs In Front Of Me ... 4 [Uncensored L**ked]",https://pic.javct.net/poster/05192026/ef287aabba.jpg,https://javct.net/v/rtp-096-rm,120,2026-05-24
RTP-097-RM,"""Please!Let Me Do It Only Once! It Is! ""My Head Is Full Of Horny Things And No Matter What I Do It Is ""It Is Because Of That C**ld!""My Friend Who Did Not See Me Said ""Please Do SEX With Hitsu!""And Please With Dogezaadi! Is It?At First She Feels Troubled She Is Surprisingly ... 2 [Uncensored L**ked]",https://pic.javct.net/poster/05192026/086a9c4833.jpg,https://javct.net/v/rtp-097-rm,130,2026-05-24
ROYD-315-RM,"My Super Cute Classmate Is Coming To My House, A Virgin's House?! A Super Sweet, Intimate 2-day Cohabitation Where She Craves Close-up Penis Erections. [Uncensored L**ked]",https://pic.javct.net/poster/05192026/eb7846d8ef.jpg,https://javct.net/v/royd-315-rm,100,2026-05-24
HUBLK-071-RM,"What?! 90%? What's With This Number? A World Where The Probability Of Success Is Visualized And Only I Can See It! I Enrolled In A School That Was An All-girls School Until Last Year, And Now It's Almost Entirely Girls! I Thought I'd Be Popular, But Instead I'm Bullied Almost Every Day And Treated Like A Slave! Then One Day, A Turning Point Comes... [Uncensored L**ked]",https://pic.javct.net/poster/05192026/597bdcfc8b.jpg,https://javct.net/v/hublk-071-rm,180,2026-05-24
REAL-991-RM,"Despite The Financial Support I'm Giving, The Sugar Baby Is Cold And Unresponsive. A Record Of Irresponsible Impregnation And Ejaculation. [Uncensored L**ked]",https://pic.javct.net/poster/05192026/ae5dd8e065.jpg,https://javct.net/v/real-991-rm,135,2026-05-24
JUKF-135-RM,"The Rumored Schoolgirl Idol, Ichika-chan, Who Earns Pocket Money Through Personal Business With Her Older Male Fans, Kasagi Ichika [Uncensored L**ked]",https://pic.javct.net/poster/04112026/1776713616.jpg,https://javct.net/v/jukf-135-rm,138,2026-05-24
FLAV-420,"The Rumored Idol High School Girl, Nozomi Arimura, Is A Devilish Slut Who Seduces Older Men With Her Erect Nipples And Big Ass.",https://pic.javct.net/poster/05192026/4a61015fc1.jpg,https://javct.net/v/flav-420,185,2026-05-24
HUNTC-514,"""Punishment Game With Big Brother"" Begins! This Is A Punishment Game Where The Sister And Her Friends Barge Into The Room Of Their Brother, Who Is Usually Considered Creepy, And Suddenly Show Him Their Underwear! 2 It Escalates Even Further",https://pic.javct.net/poster/05192026/73be4c7fbf.jpg,https://javct.net/v/huntc-514,200,2026-05-24
MKON-136,"My Cute C**ldhood Friend, Who Has An Expressionless Face, Asked Me, ""I Have A Boyfriend, So I'd Like You To Help Me Practice Sex."" - Mochizuki Tsubomi",https://pic.javct.net/poster/05192026/55cc65dc55.jpg,https://javct.net/v/mkon-136,128,2026-05-24
HUNTC-462,"""That's Not Nearly Enough! Don't Hold Back, Just Thrust As Much As You Want, Since I'm A **d!"" While Taking A Bath With My Sister, She Hugged Me Tightly While Giving Me A Passionate French Kiss That Would Put Adults To Shame...4",https://pic.javct.net/poster/05192026/f5d81c1eab.jpg,https://javct.net/v/huntc-462,230,2026-05-24
APKH-195,"""Jerk Off A Lot!"" Please Film Me Having Sex... A Cheerful Big-breasted Schoolgirl's Lewd Service Sex G-cup Sakura Yuno",https://pic.javct.net/poster/05192026/2ae0a2d189.jpg,https://javct.net/v/apkh-195,155,2026-05-24
MKON-137,Sugar Daddy Time Leap: Reloading The Page Countless Times Until The Coldest J-pop Idol Finally Warms Up To You - Hinako Matsui,https://pic.javct.net/poster/05192026/8bf7374852.jpg,https://javct.net/v/mkon-137,131,2026-05-24
JAN-013-RM,F Momoka In The Uniform 13 [Uncensored L**ked],https://pic.javct.net/poster/20230205/1685083524.jpg,https://javct.net/v/jan-013-rm,135,2026-05-24
PKPD-098-RM,Raw Love Hentai Beautiful Breasts Girl & Strongest Model Beautiful Leg Girl Black Pantyhose Student Love Homme [Uncensored L**ked],https://pic.javct.net/poster/06032026/1774079973.jpg,https://javct.net/v/pkpd-098-rm,115,2026-05-24
APAK-258-RM,Innocent Creampie 149cm (Ecup) Erika-chan Fair-skinned Beautiful Big Breasts Crunchy Nipples Demon Fucking Fierce Iki ♂ # Off Paco Daughter And Hotel Cage Erika Kuromiya Horny Climax SEX [Uncensored L**ked],https://pic.javct.net/poster/20230207/1689999400.jpg,https://javct.net/v/apak-258-rm,127,2026-05-24
PKPD-097-RM,Yen Woman Dating Creampie OK 18-year-old Small Chip Legal Law ● Daughter Takanashi Kotori [Uncensored L**ked],https://pic.javct.net/poster/06032026/1773983309.jpg,https://javct.net/v/pkpd-097-rm,136,2026-05-24
HUNTA-626,"The Room Is Too Hot And Full Erection To The Friend Of The Sister Who Became Super Light Clothes!My Sister Came Home With My Friend On Summer Vacation, But The Air Conditioner In My Room Was Broken And I Was In The Greenhouse!Because The Fan's Wind Doesn't Cool At All And Keeps Sweaty, I'm Taking Off My Jacket, Putting On A Skirt And Putting On A Pantyhose, Nipples Chilling!Seeing Such A Figure ...",https://pic.javct.net/poster/05192026/b4f84d9fa2.jpg,https://javct.net/v/hunta-626,240,2026-05-24
