code,title,image_url,page_url,views,date_scraped
DLIS-016,A Black-haired Uniform Girl Developed By A Middle-aged Father,https://pic.javct.net/poster/05192026/bc8e8927b0.jpg,https://javct.net/v/dlis-016,122,2026-05-25
DLIS-018,My Wife Is A Student Girl ○ Raw Beautiful Sweetness,https://pic.javct.net/poster/05192026/19c060c5f2.jpg,https://javct.net/v/dlis-018,115,2026-05-25
JAN-018-RM,A In The Uniform YUKI 18 [Uncensored L**ked],https://pic.javct.net/poster/07202025/1753054211.jpg,https://javct.net/v/jan-018-rm,135,2026-05-25
JAN-017-RM,E In The Uniform Miki-chan 17 [Uncensored L**ked],https://pic.javct.net/poster/07202025/1753055347.jpg,https://javct.net/v/jan-017-rm,130,2026-05-25
RTP-099-RM,Forgotten That Rural Girls 'girls' College Students Take Off Their Clothes And Getting Wet With Jibs As A Funny Figure Seems More Erotic Than I Expected ... 4 [Uncensored L**ked],https://pic.javct.net/poster/05192026/a15457643b.jpg,https://javct.net/v/rtp-099-rm,120,2026-05-25
PKPD-101-RM,Circle Female Dating Creampie OK 18 Years Old SSS Class Student I**do M Daughter Urara Hanane [Uncensored L**ked],https://pic.javct.net/poster/20253001/1739385004.jpg,https://javct.net/v/pkpd-101-rm,139,2026-05-25
RTP-100-RM,"Heat Stroke Continues Due To The Hot Weather Every Day! Is It?Meanwhile, The School Regulation That Our School Made In An Emergency Was ""Super Cool Biz""!If You Look Around You Girls' Badly Developed Body!In Such Circumstances There Is No Reason To Concentrate On The Lesson, Every Time I See A Girl, I Feel Horrible ... 4 [Uncensored L**ked]",https://pic.javct.net/poster/05192026/c65e4fd390.jpg,https://javct.net/v/rtp-100-rm,130,2026-05-25
REXD-477-RM,Voyeur! Envy! Envy! Fallen Schoolgirl Mei Satsuki [Uncensored L**ked],https://pic.javct.net/poster/20230207/1689912333.jpg,https://javct.net/v/rexd-477-rm,120,2026-05-25
HUBLK-069-RM,After-school Urine Drinking Club [Uncensored L**ked],https://pic.javct.net/poster/05192026/70274fb416.jpg,https://javct.net/v/hublk-069-rm,150,2026-05-25
FLAV-420-RM,"The Rumored Idol High School Girl, Nozomi Arimura, Is A Devilish Slut Who Seduces Older Men With Her Erect Nipples And Big Ass. [Uncensored L**ked]",https://pic.javct.net/poster/05192026/4a61015fc1.jpg,https://javct.net/v/flav-420-rm,185,2026-05-25
APKH-195-RM,"""Jerk Off A Lot!"" Please Film Me Having Sex... A Cheerful Big-breasted Schoolgirl's Lewd Service Sex G-cup Sakura Yuno [Uncensored L**ked]",https://pic.javct.net/poster/05192026/2ae0a2d189.jpg,https://javct.net/v/apkh-195-rm,155,2026-05-25
NVH-079,"Oryo/Suzuka Kurumi/Minato Haru/Sugiura Minami/Wakatsuki Yui, Masochistic Transsexuals Who Experienced Sexual Lesbian Bullying At An All-girls School.",https://pic.javct.net/poster/05192026/b25b383117.jpg,https://javct.net/v/nvh-079,155,2026-05-25
HUNTC-514-RM,"""Punishment Game With Big Brother"" Begins! This Is A Punishment Game Where The Sister And Her Friends Barge Into The Room Of Their Brother, Who Is Usually Considered Creepy, And Suddenly Show Him Their Underwear! 2 It Escalates Even Further [Uncensored L**ked]",https://pic.javct.net/poster/05192026/73be4c7fbf.jpg,https://javct.net/v/huntc-514-rm,200,2026-05-25
HUNTC-585-RM,"I'm The Only One Who Can Have Unprotected Sex Anytime, Anywhere, With Anyone I Want! It Doesn't Matter If She Has A Boyfriend Or Is Married... I Can Do Whatever I Want! [Uncensored L**ked]",https://pic.javct.net/poster/05192026/450daaf81b.jpg,https://javct.net/v/huntc-585-rm,230,2026-05-25
HUNTC-574-RM,"Little Bit Of Psychic Power! After Taking A Suspicious Pill That Promises ""One Pill Will Change Your Life Just A Little!"", Your Psychic Abilities Awaken Just A Little! You Can Read People's Minds Just A Little, Stop Time Just A Little, And Use Superpowers For Naughty Things! With These Abilities... [Uncensored L**ked]",https://pic.javct.net/poster/05192026/9eb61b3c7d.jpg,https://javct.net/v/huntc-574-rm,130,2026-05-25
HUNTC-496-RM,"Excessive Sexual Harassment Prevention Measures In After-school Job Interview Practice!? Teachers And Students Conduct Mock Interviews To Prepare For All Kinds Of Sexual Harassment, Simulating A High-pressure Interview In A Real One. [Uncensored L**ked]",https://pic.javct.net/poster/05192026/1025d38359.jpg,https://javct.net/v/huntc-496-rm,180,2026-05-25
HUNBL-139-RM,"""Call Your Friends! Then I'll Help You!"" A Girl Who Met On A Daddy Activity Site Is Confined At Home! All-you-can-eat And Re-roll Creampie! Because I'm Getting Tired Of It... [Uncensored L**ked]",https://pic.javct.net/poster/20230207/1689911777.jpg,https://javct.net/v/hunbl-139-rm,120,2026-05-25
APAK-330,"Innocent 149cm F-cup Naughty Girl Ririka Gets Cummed Inside: ""I'm Cumming! I'm Cumming Right Away!"" Intense Orgasm From Hardcore Fucking! ""I Can't Stop My Hips!"" Grinding Cowgirl Climax! Crying Cumming! Lewd Orgasm Student Guidance: Amaba Ririka",https://pic.javct.net/poster/05192026/4c46c6195a.jpg,https://javct.net/v/apak-330,147,2026-05-25
APNS-318-RM,Nasty Stamp Despair Commentary Yuki Hiiragi [Uncensored L**ked],https://pic.javct.net/poster/20230207/1689996510.jpg,https://javct.net/v/apns-318-rm,110,2026-05-25
JAN-016-RM,C Erika In The Uniform 16 [Uncensored L**ked],https://pic.javct.net/poster/05192026/cafadbf674.jpg,https://javct.net/v/jan-016-rm,130,2026-05-25
IENE-858-RM,"I Want To See ""inserted"" Hikikiku Crotch!A Woman's Horny Juice Is A Nuchojunecho!When Girls ○ Students Got Bastards Oyazi ○ Po, It Was Such A Shameful Thing. [Uncensored L**ked]",https://pic.javct.net/poster/05192026/27c33a303e.jpg,https://javct.net/v/iene-858-rm,190,2026-05-25
MKON-090-RM,"When I Brought My Girlfriend, Who Loves Cleanliness, To A Boys' Dormitory Where Women Are Forbidden, She Was Caught By A Gross And Filthy Manager, And She Was Defiled Until She Was Tattered Kana Yura [Uncensored L**ked]",https://pic.javct.net/poster/20230207/1689997903.jpg,https://javct.net/v/mkon-090-rm,126,2026-05-25
JAN-015-RM,C In The Uniform Swing-chan 15 [Uncensored L**ked],https://pic.javct.net/poster/20250606/1752052690.jpg,https://javct.net/v/jan-015-rm,135,2026-05-25
RTP-096-RM,"I Saw The Thigh ""absolute Area"" Between Skirt And Knee High Looking Down From Elongated Legs In Front Of Me ... 4 [Uncensored L**ked]",https://pic.javct.net/poster/05192026/ef287aabba.jpg,https://javct.net/v/rtp-096-rm,120,2026-05-25
