code,title,image_url,page_url,views,date_scraped
WAAA-653-RM,"I Said I'd Just Rub It, But I Lost My Mind When I Saw Her Younger Sister's Defenseless Pussy Cleavage And Panty Flash, And Teased Her By Rubbing My Bare Crotch Against Her Through The Fabric, And Went On A Rampage Of Fucking A Teenage Pussy. [Uncensored L**ked]",https://pic.javct.net/poster/05192026/f9948aea29.jpg,https://javct.net/v/waaa-653-rm,120,2026-05-30
CAWD-997-RM,"Female Students Working Part-time At A Convenience Store, Exposing Themselves. Bad Girls Who Got Caught Shoplifting Have Been Assigned To Sex Work Starting Today. Yukimura Izuki, Tanimura Nagisa [Uncensored L**ked]",https://pic.javct.net/poster/05192026/fa56e65d2d.jpg,https://javct.net/v/cawd-997-rm,120,2026-05-30
GVH-850,"I Was Fo**ed To Join The Pee Research Club By A Devilish, Sadistic, Beautiful Girl Who Loves To Make People Drink Holy Water. - Aizawa Miyu",https://pic.javct.net/poster/05192026/f74783bb8b.jpg,https://javct.net/v/gvh-850,160,2026-05-30
APAK-235-RM,Slope-style Beautiful Girl Akari-chan [Extreme Sex With A Schoolgirl] Her Hairless Pussy Cums Awkwardly! # Off Paco Girl And Hotel Cage Nasty Climax SEX Akari Minase [Uncensored L**ked],https://pic.javct.net/poster/20221108/1660973484.jpg,https://javct.net/v/apak-235-rm,139,2026-05-30
SORA-639,"●Each Time, Her Memory Is Erased With Sleeping Pills, And A Few Hours Later She's Back At Home, Living Her Normal Life. Reset R**e Futaba Ayuka",https://pic.javct.net/poster/05192026/6990b42ea0.jpg,https://javct.net/v/sora-639,128,2026-05-30
DNJR-157,"Female Student's Sweaty, Smelly Black Pantyhose Give A Beautiful Leg Job (Part 3)",https://pic.javct.net/poster/05192026/e405433474.jpg,https://javct.net/v/dnjr-157,127,2026-05-30
FJIN-146,"Nipple Kneading Leads To Incontinence. The Skinny, Slender Track And Field Club Girl Is A Sensitive, Petite L**i With Tiny Breasts Who Can't Stop Cumming And Cumming Uncontrollably, Becoming A Human Fleshlight In The Classroom! Mizuhara Wako",https://pic.javct.net/poster/05192026/40a5f5f912.jpg,https://javct.net/v/fjin-146,123,2026-05-30
LZDM-063-RM,"[ASMR Lesbian Subjective] On That Day, I Gave In To My Students' Lesbian Temptations And Gave In To Them Once, And Ever Since Then, I've Been Made To Cum Over And Over Again Whenever We Meet... ~An Incident At A Famous Preparatory School For Girls~ [Uncensored L**ked]",https://pic.javct.net/poster/20241804/1716606375.jpg,https://javct.net/v/lzdm-063-rm,145,2026-05-30
DLIS-023,My Wife Is A Student Girl ○ Raw Haruka Takami,https://pic.javct.net/poster/05192026/7dab948f78.jpg,https://javct.net/v/dlis-023,120,2026-05-30
SCOP-601,"I Was Overwhelmed By The Student My Suddenly I Came To The House And Even Before My Wife Is There, I Do Not Have A Whole Thing",https://pic.javct.net/poster/05192026/272facf8ec.jpg,https://javct.net/v/scop-601,150,2026-05-30
SABA-777,Black Hair Uniform Beautiful Girl Memorial / Creampie / Collection Special Carefully Selected 10 People 5 Hours,https://pic.javct.net/poster/05192026/a0cd29e2c0.jpg,https://javct.net/v/saba-777,300,2026-05-30
HUNTB-568-RM,"""Don't Run Away For A Minute! ] My Sister-in-law Is A Monster Who Loves Vaginal Cum Shot Sex! My Sister-in-law Is A Super Naughty Little Devil Girl! Even If I Refuse, I Chase Them All Over The House And My Sperm Is Empty... [Uncensored L**ked]",https://pic.javct.net/poster/20230207/1689911593.jpg,https://javct.net/v/huntb-568-rm,230,2026-05-30
DNJR-104-RM,The Desperate Face Of A Masochistic Man Who Is Resisting ~ I Love It Specializing In Ejaculation Patience Daddy Live Girl Live Hikaru Minazuki [Uncensored L**ked],https://pic.javct.net/poster/20230207/1688787944.jpg,https://javct.net/v/dnjr-104-rm,144,2026-05-30
IENF-274-RM,"Naive And Cute School Girls! ""Could You Solve The Problem Of A Virgin's Premature Ejaculation?""A Curious Schoolgirl Gets Squeezed By A Virgin Who Has Too Premature Ejaculation And Cums Inside Out! 2 [Uncensored L**ked]",https://pic.javct.net/poster/20230207/1688613626.jpg,https://javct.net/v/ienf-274-rm,145,2026-05-30
DANDY-866-RM,"A Girl Who Got Wet In The Rain ○ A See-through Bra Is Too Erotic! ! I Will Unconsciously Tempt You, So I Will Start Fir Tree Immediately [Uncensored L**ked]",https://pic.javct.net/poster/20230207/1689826465.jpg,https://javct.net/v/dandy-866-rm,170,2026-05-30
MISM-119-RM,Please Make It My Uncle's Treasure. It Is A Horny Nonsense Of SM Wearing A School Uniform Like A SM Boy But In My Head Is Full Of Ochinchine Pure White Beautiful Girl Named Reunion [Uncensored L**ked],https://pic.javct.net/poster/05192026/1a8c75dcb1.jpg,https://javct.net/v/mism-119-rm,170,2026-05-30
JAN-023-RM,B In The Uniform Uhisamori's 23 [Uncensored L**ked],https://pic.javct.net/poster/05192026/8643fd2332.jpg,https://javct.net/v/jan-023-rm,120,2026-05-30
CAWD-974,"Imprisoned And Trained By A Middle-aged Man With A Foul Odor In His Neighbor's Garbage-filled Apartment... A Schoolgirl In Uniform, Mio Matsuoka, Impregnated Through An Unjustly Brutal Act Of Fo**ed Intercourse.",https://pic.javct.net/poster/05192026/aa6e4ec458.jpg,https://javct.net/v/cawd-974,120,2026-05-30
WAAA-649,"A Disliked Middle-aged Teacher Stalks, **dnaps, And Imprisons His Admired Top-performing Female Student, Drugging Her With Sleeping Pills And Aphrodisiacs, Raping Her, And Turning Her Into His Obedient Sex Slave Through Drug-induced Sex Education. (Arai Rima)",https://pic.javct.net/poster/05192026/e3e8fe0441.jpg,https://javct.net/v/waaa-649,120,2026-05-30
WAAA-656,"The Condom Broke, Resulting In Unexpected Unprotected Sex! He Thrusts At Super-fast Speed, Cumming Inside Her Multiple Times! Riho Shishido",https://pic.javct.net/poster/05192026/3560b8907d.jpg,https://javct.net/v/waaa-656,160,2026-05-30
WAAA-653,"I Said I'd Just Rub It, But I Lost My Mind When I Saw Her Younger Sister's Defenseless Pussy Cleavage And Panty Flash, And Teased Her By Rubbing My Bare Crotch Against Her Through The Fabric, And Went On A Rampage Of Fucking A Teenage Pussy.",https://pic.javct.net/poster/05192026/f9948aea29.jpg,https://javct.net/v/waaa-653,120,2026-05-30
CAWD-997,"Female Students Working Part-time At A Convenience Store, Exposing Themselves. Bad Girls Who Got Caught Shoplifting Have Been Assigned To Sex Work Starting Today. Yukimura Izuki, Tanimura Nagisa",https://pic.javct.net/poster/05192026/fa56e65d2d.jpg,https://javct.net/v/cawd-997,120,2026-05-30
APAK-102-RM,Tails Mania Nagomi [Uncensored L**ked],https://pic.javct.net/poster/05192026/ce8467ba38.jpg,https://javct.net/v/apak-102-rm,145,2026-05-30
IESP-759,Yuna Hinata 20 consecutive creampies,https://pic.javct.net/poster/05192026/fc153956e6.jpg,https://javct.net/v/iesp-759,153,2026-05-30
