code,title,image_url,page_url,views,date_scraped
HTTM-052-RM,"A married woman who fell in love with a men's underground idol, the price she was fo**ed to pay in front of her pusher, Kana Morisawa [Uncensored L**ked]",https://pic.javct.net/poster/04112026/362070ab24.jpg,https://javct.net/v/httm-052-rm,49,2026-05-15
MANX-031,"Lewd, Slutty, Sensual Poses That Will Make You Cum Like Crazy - Big-butt Beauty Who Spouts Dirty Talk At You - Kyoko Hanamiya",https://pic.javct.net/poster/04112026/5b590fbdeb.jpg,https://javct.net/v/manx-031,110,2026-05-15
10-051426-01,SEX within seconds of meeting : Yuko Ide,https://pic.javct.net/poster/04112026/6a5b156922.jpg,https://javct.net/v/10-051426-01,60,2026-05-15
ABF-353,"With Umi Yakake's ""face'', you can enjoy it.",https://pic.javct.net/poster/04112026/9632900574.jpg,https://javct.net/v/abf-353,135,2026-05-15
FC2PPV-4899749,[Amateur's first shot/main feature face] Hana (18) This is a different angle video of an amateur who lives in the countryside and anal penetration ATM and electric massager continuous orgasm.,https://pic.javct.net/poster/04112026/f8fccf5298.jpg,https://javct.net/v/fc2ppv-4899749,166,2026-05-15
XVSR-158-RM,Super Alive In The First Climax! ! JK 4 Production HakuSaki Yuzu Harnessed [Uncensored L**ked],https://pic.javct.net/poster/04112026/ec92beab12.jpg,https://javct.net/v/xvsr-158-rm,120,2026-05-15
NACR-738-RM,Oil Mania Kasumi Yuai [Uncensored L**ked],https://pic.javct.net/poster/20231912/1703003761.jpg,https://javct.net/v/nacr-738-rm,122,2026-05-15
NACR-737-RM,Oil Mania Monami Takarada [Uncensored L**ked],https://pic.javct.net/poster/20231711/1701712096.jpg,https://javct.net/v/nacr-737-rm,122,2026-05-15
XVSR-724-RM,Fucking Hibiki Otsuki With A Private Vaginal Cum Shot! [Uncensored L**ked],https://pic.javct.net/poster/20230804/1693628388.jpg,https://javct.net/v/xvsr-724-rm,113,2026-05-15
336KNB-411-RM,"[Nationwide Married Woman Ero Illustrated Book Shuuchin's Dirty Clash - Piston-] ""I want to see my husband happy...///"" It was supposed to be a netorare service for my beloved husband who appeared in an AV... but the beautiful wife was so erotic that she burst into tears with continuous orgasms and squirts, so hot that she even blew her glasses wwwwww at Toda City, Saitama Prefecture [Uncensored L**ked]",https://pic.javct.net/poster/04112026/76eb2f2813.jpg,https://javct.net/v/336knb-411-rm,70,2026-05-15
FC2PPV-4899053,[Sense of immorality] Exciting married woman's affair creampie & facial cumshot with 4 super thick ejaculations ~ Can you please smear my lascivious self so dirty without telling my husband...,https://pic.javct.net/poster/04112026/8328d27b04.jpg,https://javct.net/v/fc2ppv-4899053,69,2026-05-15
FC2PPV-4899589,"[Uncensored 2-part set] They told me it was a simple personal photo shoot, and I took them to the room and whether I cried or screamed, my first anal was delicious.",https://pic.javct.net/poster/04112026/72f1c7e52e.jpg,https://javct.net/v/fc2ppv-4899589,67,2026-05-15
336KNB-411,"[Nationwide Married Woman Ero Illustrated Book Shuuchin's Dirty Clash - Piston-] ""I want to see my husband happy...///"" It was supposed to be a netorare service for my beloved husband who appeared in an AV... but the beautiful wife was so erotic that she burst into tears with continuous orgasms and squirts, so hot that she even blew her glasses wwwwww at Toda City, Saitama Prefecture",https://pic.javct.net/poster/04112026/76eb2f2813.jpg,https://javct.net/v/336knb-411,70,2026-05-15
HIZ-011-RM,Earnestly Milk Rin Shiraishi Earnestly Series No.011 [Uncensored L**ked],https://pic.javct.net/poster/20222612/1673396067.jpg,https://javct.net/v/hiz-011-rm,130,2026-05-15
MFCS-208-RM,cherry [Uncensored L**ked],https://pic.javct.net/poster/04112026/48466984b0.jpg,https://javct.net/v/mfcs-208-rm,77,2026-05-15
SGKI-086-RM,Popular AV actress takes on the challenge! Peeing and squirting acme bicycle makes me cum! Miyu Aizawa Hinako Matsui [Uncensored L**ked],https://pic.javct.net/poster/04112026/1898107e63.jpg,https://javct.net/v/sgki-086-rm,196,2026-05-15
FC2PPV-4899228,[FC2/Legendary Beautiful Big Breasts] Sports Instructor's Bururun Big Breasts Streamer (21) Big titty fuck with another dimension ⇒ 2 creampies & facial cumshot,https://pic.javct.net/poster/04112026/ecdbae33a3.jpg,https://javct.net/v/fc2ppv-4899228,104,2026-05-15
PA-051226-100,"Mature Woman Special Movie 19 ~ 30s,40s and 50s ~",https://pic.javct.net/poster/04112026/e8d54f3afa.jpg,https://javct.net/v/pa-051226-100,72,2026-05-15
10-051226-01,Treasured Pussy Selection: Ayane Nakai,https://pic.javct.net/poster/04112026/795595c0df.jpg,https://javct.net/v/10-051226-01,20,2026-05-15
1P-051226-001,PtoM SEX: Sakura Aoi,https://pic.javct.net/poster/04112026/5f64e95de8.jpg,https://javct.net/v/1p-051226-001,61,2026-05-15
MFCS-208,cherry,https://pic.javct.net/poster/04112026/48466984b0.jpg,https://javct.net/v/mfcs-208,77,2026-05-15
300MIUM-1343-RM,"[Super soft G cup] A smile that only I can show, a female face, a lively face, as my skin-whitening and lewd girlfriend and I, wearing no-makeup clothes, are having sex with each other... I come back from eating out and have a quick flirting time.While massaging her fluffy breasts, I kiss her from the tongue and get horny. After a night of toying with toys where her sensitivity is increasing and she can't stop convulsing, she straddles herself in her underwear and seduces her to wake her up.The best morning when she wakes up, her orgasmic face is so cute that she instantly revives her for the 2nd round.Secret couple sex video post [semi-cohabiting girlfriend] [Uncensored L**ked]",https://pic.javct.net/poster/04112026/30f5d1a614.jpg,https://javct.net/v/300mium-1343-rm,105,2026-05-15
SGKI-086,Popular AV actress takes on the challenge! Peeing and squirting acme bicycle makes me cum! Miyu Aizawa Hinako Matsui,https://pic.javct.net/poster/04112026/1898107e63.jpg,https://javct.net/v/sgki-086,196,2026-05-15
HTTM-052,"A married woman who fell in love with a men's underground idol, the price she was fo**ed to pay in front of her pusher, Kana Morisawa",https://pic.javct.net/poster/04112026/362070ab24.jpg,https://javct.net/v/httm-052,49,2026-05-15
