code,title,image_url,page_url,views,date_scraped
PA-052126-100,A mix of saliva and love juice! A married woman's intense PtoM sex!  : Sara Suzukake,https://pic.javct.net/poster/05192026/9a9e87e82f.jpg,https://javct.net/v/pa-052126-100,60,2026-05-21
NYKD-128-RM,"Sequel, First Shot At 70 Years Old Miyoko Suzuki [Uncensored L**ked]",https://pic.javct.net/poster/20230207/1690604587.jpg,https://javct.net/v/nykd-128-rm,105,2026-05-21
SDJS-369-RM,SOD female employee AV appearance work Production department 1st year mid-career Akira Okajima (24) First objective solo sex Weekday daytime in-house escort voice toleration sex Toy masturbation First 4P where she is made to cum Nude greeting in public [Uncensored L**ked],https://pic.javct.net/poster/04112026/949a53ea7c.jpg,https://javct.net/v/sdjs-369-rm,290,2026-05-21
SIMA-037-RM,mountain stream [Uncensored L**ked],https://pic.javct.net/poster/04112026/186603ad3e.jpg,https://javct.net/v/sima-037-rm,75,2026-05-21
FC2PPV-4903757,"Face Showing Case #133 An amateur comes to do naughty things - An-chan (20) in red lingerie, sexy route, both legs exposed and vibrator to**ure",https://pic.javct.net/poster/05192026/2f434bcb66.jpg,https://javct.net/v/fc2ppv-4903757,56,2026-05-21
UGH-042-RM,Mature Woman Specialized AV Production L**ked Confidential Interview File.12 [Uncensored L**ked],https://pic.javct.net/poster/04112026/907face7b8.jpg,https://javct.net/v/ugh-042-rm,57,2026-05-21
300MIUM-1024-RM,"A girl like this... Covered in tides A lively-looking girl who (self-proclaimed) asks me to join an event company and says, Are you interested in music concerts? You can earn 1.5 million yen a month just by selling tickets.'' She's confirmed to be an unscrupulous multi-tasker, so she's changing the world. Slender body wrapped in a START dress She has a super sensitive constitution that will drip out serious juices if you play with her inside w While saying I don't feel good..., she releases a lot of female juice from her beautiful pink pussy, with her fingers, with an electric massager, and even with a dick. Jumpy tide ww The climax of the tide festival www: case27 [Uncensored L**ked]",https://pic.javct.net/poster/20241902/1708773680.jpg,https://javct.net/v/300mium-1024-rm,76,2026-05-21
NHDTC-205,Big-breasted Girl's Shameful Train 4: Defile Her Developed Breasts With Perverse Fetishes!,https://pic.javct.net/poster/05192026/23b9393d0f.jpg,https://javct.net/v/nhdtc-205,225,2026-05-21
SDMU-581-RM,Cum The Graduation Ceremony Ban Date Kokorohana Yura [Uncensored L**ked],https://pic.javct.net/poster/20250606/1752052192.jpg,https://javct.net/v/sdmu-581-rm,135,2026-05-21
MDTM-246-RM,Mercy Of Younger There Love Away Lid Around Yuri She Asada [Uncensored L**ked],https://pic.javct.net/poster/05192026/108d5b95f4.jpg,https://javct.net/v/mdtm-246-rm,120,2026-05-21
NACT-129-RM,"A Voyeuristic Masochistic Tutor Witnesses Her Student's Father's Hardcore S&M Mating And Becomes Aroused. With Her Secret Exposed, The College Student's True Nature Is Revealed Through Cotton Rope And A Collar In This Complete Record Of Her Training. (Rin Ouka) [Uncensored L**ked]",https://pic.javct.net/poster/05192026/8389d4f28e.jpg,https://javct.net/v/nact-129-rm,119,2026-05-21
NACT-127-RM,Pleasure Esthetic Room: I Found Pleasure In The Amazing Techniques Of A Creepy Old Man - Yui Asakaze [Uncensored L**ked],https://pic.javct.net/poster/05192026/e6048fdf6f.jpg,https://javct.net/v/nact-127-rm,125,2026-05-21
476MLA-276-RM,"I reluctantly agreed to the photoshoot because I wanted money for mencon.I was lured by the high salary and was followed by a 19-year-old landmine NEET with a sharp personality and a tight vagina, so I ended up creampieing her a lot lol [Uncensored L**ked]",https://pic.javct.net/poster/05192026/68bdd4a230.jpg,https://javct.net/v/476mla-276-rm,78,2026-05-21
476MLA-276,"I reluctantly agreed to the photoshoot because I wanted money for mencon.I was lured by the high salary and was followed by a 19-year-old landmine NEET with a sharp personality and a tight vagina, so I ended up creampieing her a lot lol",https://pic.javct.net/poster/05192026/68bdd4a230.jpg,https://javct.net/v/476mla-276,78,2026-05-21
RAW-040-RM,We Unearthed Certain Private University Four-year Basketball Powerhouse Club Team Affiliation Sunaga Hiyori AV Debut AV Actress A New Generation! 36 [Uncensored L**ked],https://pic.javct.net/poster/05192026/77f384524b.jpg,https://javct.net/v/raw-040-rm,135,2026-05-21
OKSN-336-RM,"(An Immoral, Lusty Affair) Why Did This Pretty Married Woman Do What She Did ... A Super Meaty Married Woman She Descended Into The Depths Of Pleasure With Her Super Horny Erotic And Voluptuous Body After Being Served With Rich And Thick Sex By A Male Adult Video Actor, She Shed Tears Of Joy, Glistening Across Her Hot Sweaty Body, And Her Wedding Ring ... [Uncensored L**ked]",https://static.javct.net/poster/oksn-336.jpg,https://javct.net/v/oksn-336-rm,120,2026-05-21
FC2PPV-4903350,"168cm ☆ G cup ☆ New gravure idol, 22 years old ☆ A handsome man violently pushes his stiff penis in and out and cums many times ⇒ Creampie & facial cumshot (Aya)",https://pic.javct.net/poster/05192026/9076816bf6.jpg,https://javct.net/v/fc2ppv-4903350,46,2026-05-21
NACT-127,Pleasure Esthetic Room: I Found Pleasure In The Amazing Techniques Of A Creepy Old Man - Yui Asakaze,https://pic.javct.net/poster/05192026/e6048fdf6f.jpg,https://javct.net/v/nact-127,125,2026-05-21
NACT-129,"A Voyeuristic Masochistic Tutor Witnesses Her Student's Father's Hardcore S&M Mating And Becomes Aroused. With Her Secret Exposed, The College Student's True Nature Is Revealed Through Cotton Rope And A Collar In This Complete Record Of Her Training. (Rin Ouka)",https://pic.javct.net/poster/05192026/8389d4f28e.jpg,https://javct.net/v/nact-129,119,2026-05-21
IENE-762-RM,Kokorohana Yura Daughter C**ld Making Hot Spring Trip Without Telling His Wife Too Love [Uncensored L**ked],https://pic.javct.net/poster/20242108/1724714445.jpg,https://javct.net/v/iene-762-rm,150,2026-05-21
SIMA-037,mountain stream,https://pic.javct.net/poster/04112026/186603ad3e.jpg,https://javct.net/v/sima-037,75,2026-05-21
HIZ-021-RM,Always Squeezing Snow Mellow Chirping Series No.021 [Uncensored L**ked],https://pic.javct.net/poster/20250606/1752843781.jpg,https://javct.net/v/hiz-021-rm,135,2026-05-21
SDJS-369,SOD female employee AV appearance work Production department 1st year mid-career Akira Okajima (24) First objective solo sex Weekday daytime in-house escort voice toleration sex Toy masturbation First 4P where she is made to cum Nude greeting in public,https://pic.javct.net/poster/04112026/949a53ea7c.jpg,https://javct.net/v/sdjs-369,290,2026-05-21
HIZ-020-RM,Hitosura Hitomi Igarashi Star Do Hirasawa Series No.020 [Uncensored L**ked],https://pic.javct.net/poster/20250606/1752843714.jpg,https://javct.net/v/hiz-020-rm,130,2026-05-21
