code,title,image_url,page_url,views,date_scraped
ABF-348,Ultimate Ecstasy: A New Realm Of Pleasure That Courses Through Every Nerve— Remu Suzumori,https://pic.javct.net/poster/04112026/582624978e.jpg,https://javct.net/v/abf-348,120,2026-05-07
PA-050626-100,Wives Drink Cum 147 : A busty wife with a sexy beauty mark swallows cum three times in a row,https://pic.javct.net/poster/04112026/69cc56e3cc.jpg,https://javct.net/v/pa-050626-100,61,2026-05-07
NACT-121-RM,"A Young Wife, Sunao Kui, Finds Herself In Debt Hell After Her Husband Is Laid Off... She's Offered A ""secret Job For The Neighborhood"" By The Neighborhood Association Chairman To Pay Off Unpaid Membership Fees, And Becomes Addicted To The Pleasures Of The Job. [Uncensored L**ked]",https://pic.javct.net/poster/04112026/a35facfe0a.jpg,https://javct.net/v/nact-121-rm,124,2026-05-07
GDRD-014-RM,Red Dragon Nagi Mamiya [Uncensored L**ked],https://pic.javct.net/poster/20231912/1705118723.jpg,https://javct.net/v/gdrd-014-rm,141,2026-05-07
DIC-053-RM,"Camera Follows Closely Until This Normal Girl Turns Into A Porn Star! Sensitive Nipple Orgasms Super Anime Voice Currently Working At A Day Care, Rio-Chan's Porn Debut!! [Uncensored L**ked]",https://pic.javct.net/poster/04112026/6caf01a88a.jpg,https://javct.net/v/dic-053-rm,135,2026-05-07
XRW-649-RM,"Once I Dropped My Smartphone, I Was Robbed Of Everything! ! Shigetsumi Hikaru [Uncensored L**ked]",https://pic.javct.net/poster/09052025/1758151114.jpg,https://javct.net/v/xrw-649-rm,127,2026-05-07
YMDS-142-RM,The Day Akari Niimura Became Her Girlfriend [Uncensored L**ked],https://pic.javct.net/poster/20230804/1693628081.jpg,https://javct.net/v/ymds-142-rm,130,2026-05-07
SDAB-350-RM,[18-year-old climax development] There is an actor wherever the old man goes! A day of constant to**ure with toys and dicks - Erin Onda [Uncensored L**ked],https://pic.javct.net/poster/04112026/687b04038c.jpg,https://javct.net/v/sdab-350-rm,169,2026-05-07
MAAN-1166-RM,"[This woman will do anything for work] Congratulations on your meat onahole debut, a big-breasted liver with a desire for approval, a high-sensitivity, luxurious body with a J-cup & big butt www: Case.11_Sakura (20) [Uncensored L**ked]",https://pic.javct.net/poster/04112026/afdcabb666.jpg,https://javct.net/v/maan-1166-rm,76,2026-05-07
NACT-119-RM,"Pleasure Esthetic Room: I, Sara Isshiki, Found Pleasure In The Amazing Techniques Of A Creepy Old Man. [Uncensored L**ked]",https://pic.javct.net/poster/04112026/e327f61f4c.jpg,https://javct.net/v/nact-119-rm,121,2026-05-07
FC2PPV-4895641,[Individual shooting] A shaved gal with a shaved pussy releases her daily stress and cums with a cock,https://pic.javct.net/poster/04112026/8d140065b2.jpg,https://javct.net/v/fc2ppv-4895641,27,2026-05-07
FC2PPV-4895772,"A minimalist girl with a pale face gets as excited as she likes with steamy mat play, and is excited by the unparalleled beautiful ass lurking in her fully exposed minimalist body. She feels like she could cum as many times as she wants, but she has to endure it with two creampies and a bukkake on her stomach.",https://pic.javct.net/poster/04112026/b294702046.jpg,https://javct.net/v/fc2ppv-4895772,65,2026-05-07
SCAD-01-RM,SPECIAL Sexy Akane Sakura Project [Uncensored L**ked],https://pic.javct.net/poster/04112026/83d7beb571.jpg,https://javct.net/v/scad-01-rm,100,2026-05-07
NACT-120-RM,"Wife Sold: Sold At A Black Market Auction To Pay Off Her Husband's Debts, She Is Completely Trained And Corrupted By Perverted Customers. - Yuria Yoshine [Uncensored L**ked]",https://pic.javct.net/poster/04112026/fd14a88875.jpg,https://javct.net/v/nact-120-rm,122,2026-05-07
390JAC-233-RM,"[Explosive orgasm with someone else's dick] A real-life lady who doesn't even know her boyfriend, who has a lewd real face and a cheating office lady, 26 years old, real estate (global) [Uncensored L**ked]",https://pic.javct.net/poster/04112026/a36436e309.jpg,https://javct.net/v/390jac-233-rm,104,2026-05-07
NACT-120,"Wife Sold: Sold At A Black Market Auction To Pay Off Her Husband's Debts, She Is Completely Trained And Corrupted By Perverted Customers. - Yuria Yoshine",https://pic.javct.net/poster/04112026/fd14a88875.jpg,https://javct.net/v/nact-120,122,2026-05-07
NACT-119,"Pleasure Esthetic Room: I, Sara Isshiki, Found Pleasure In The Amazing Techniques Of A Creepy Old Man.",https://pic.javct.net/poster/04112026/e327f61f4c.jpg,https://javct.net/v/nact-119,121,2026-05-07
NACT-121,"A Young Wife, Sunao Kui, Finds Herself In Debt Hell After Her Husband Is Laid Off... She's Offered A ""secret Job For The Neighborhood"" By The Neighborhood Association Chairman To Pay Off Unpaid Membership Fees, And Becomes Addicted To The Pleasures Of The Job.",https://pic.javct.net/poster/04112026/a35facfe0a.jpg,https://javct.net/v/nact-121,124,2026-05-07
FC2PPV-4892437,[First time] **pyjpx*jsps Newcomer *Early purchase bonus Popular Reiwa hostess'' I released a rich male juice from Small fish man'' who is twitching to the limitless orgasm hell.,https://pic.javct.net/poster/04112026/dfda598e33.jpg,https://javct.net/v/fc2ppv-4892437,55,2026-05-07
DIC-051-RM,The Camera Closely Contacts The Trajectory Until Ordinary Girls Become AV Actresses! Systemic Feeling Band BODY Sensitive Sensitive Grueling Hair ○ ○ Corioli Face Animation Voice Vehicle Maintenance Specialty Student Yukari Chan (kana) AV Debut! ! [Uncensored L**ked],https://pic.javct.net/poster/04112026/dc061aa98f.jpg,https://javct.net/v/dic-051-rm,135,2026-05-07
FC2PPV-4894516,"[Part 2 of 19-year-old new female college student Mika-chan] I taught Mika-chan, who just entered university and doesn't even know how to moan, intense adult sex.",https://pic.javct.net/poster/04112026/046e96e125.jpg,https://javct.net/v/fc2ppv-4894516,50,2026-05-07
NACR-730-RM,Oil Mania Ayana Rina [Uncensored L**ked],https://pic.javct.net/poster/20231711/1700421012.jpg,https://javct.net/v/nacr-730-rm,122,2026-05-07
SDAB-350,[18-year-old climax development] There is an actor wherever the old man goes! A day of constant to**ure with toys and dicks - Erin Onda,https://pic.javct.net/poster/04112026/687b04038c.jpg,https://javct.net/v/sdab-350,169,2026-05-07
HZ-3837,Beauty Collection Vol.119 - Rion,https://pic.javct.net/poster/04112026/cbe3dbfa19.jpg,https://javct.net/v/hz-3837,61,2026-05-07
