code,title,image_url,page_url,views,date_scraped
FOCS-055-RM,A Day When Her Pristine Sailor Suit Got Dirty. This Girl Wearing A Famous Private School Uniform Gets Her First Sugar Daddy Action And Her Heart And Body Sullied With A Humiliating And Degrading Cum Facial. Rin Momono [Uncensored L**ked],https://pic.javct.net/poster/20221202/1645782096.jpg,https://javct.net/v/focs-055-rm,121,2026-05-29
SDMM-232-RM,"Magic Mirror Issue: Teenage male and female students challenge themselves with their bodies and compatibility! Aoharu 2 people 3 legs! Pictogram challenge for adults! If everything is successful, we will give you the latest smartphone! The sense of distance that is too close makes young sexual desire explode! ? Forbidden sex between friends who should not have sex! ? [Uncensored L**ked]",https://pic.javct.net/poster/05192026/f4e892207e.jpg,https://javct.net/v/sdmm-232-rm,230,2026-05-29
MOGI-159-RM,"""I'm having trouble with sweating..."" Hidden shots of sweat dripping down my armpits, cleavage, and crotch! Continuous climax with sweaty copulation Kurumi Ishikawa (22) [Uncensored L**ked]",https://pic.javct.net/poster/05192026/cb61b3868a.jpg,https://javct.net/v/mogi-159-rm,140,2026-05-29
START-575-RM,"Due to her strict duties, a female investigator has been forbidden from having sex ever since she took office. She was thoroughly teased and had to bow down to such an anti-social group, saying, ""Please, please let me cum.""... Suzu Honjo [Uncensored L**ked]",https://pic.javct.net/poster/05192026/1166a1a53b.jpg,https://javct.net/v/start-575-rm,149,2026-05-29
MOGI-159,"""I'm having trouble with sweating..."" Hidden shots of sweat dripping down my armpits, cleavage, and crotch! Continuous climax with sweaty copulation Kurumi Ishikawa (22)",https://pic.javct.net/poster/05192026/cb61b3868a.jpg,https://javct.net/v/mogi-159,140,2026-05-29
FOCS-053-RM,Teeny Tiny Petite - Itty Bitty Babe Under 5' And 100lbs Arrives With One Bag To Savor Carnal Delights... And So Her Journey To Hell Begins Eru Yukino [Uncensored L**ked],https://pic.javct.net/poster/20212011/1644655491.jpg,https://javct.net/v/focs-053-rm,119,2026-05-29
SDMM-232,"Magic Mirror Issue: Teenage male and female students challenge themselves with their bodies and compatibility! Aoharu 2 people 3 legs! Pictogram challenge for adults! If everything is successful, we will give you the latest smartphone! The sense of distance that is too close makes young sexual desire explode! ? Forbidden sex between friends who should not have sex! ?",https://pic.javct.net/poster/05192026/f4e892207e.jpg,https://javct.net/v/sdmm-232,230,2026-05-29
START-575,"Due to her strict duties, a female investigator has been forbidden from having sex ever since she took office. She was thoroughly teased and had to bow down to such an anti-social group, saying, ""Please, please let me cum.""... Suzu Honjo",https://pic.javct.net/poster/05192026/1166a1a53b.jpg,https://javct.net/v/start-575,149,2026-05-29
FOCS-049-RM,"Poor Theater Actress With Hidden F-Cup Tits... If She's Willing To Bare It All For The Camera, Both Her Palm And Pussy Will Get Greased! The Ultimate Moaning, Gasping Orgasms! Creampie Side-Hustle Rena Kodama [Uncensored L**ked]",https://pic.javct.net/poster/20212011/1644570818.jpg,https://javct.net/v/focs-049-rm,124,2026-05-29
NEM-034-RM,Forbidden Sex With The Bride's Mother Chapter Thirty-Three I Like My Stepmom Better Than My Wife... Rieko Hiraoka [Uncensored L**ked],https://pic.javct.net/poster/20212011/1640019335.jpg,https://javct.net/v/nem-034-rm,120,2026-05-29
SDJS-369-RM,SOD female employee AV appearance work Production department 1st year mid-career Akira Okajima (24) First objective solo sex Weekday daytime in-house escort voice toleration sex Toy masturbation First 4P where she is made to cum Nude greeting in public [Uncensored L**ked],https://pic.javct.net/poster/04112026/949a53ea7c.jpg,https://javct.net/v/sdjs-369-rm,290,2026-05-29
SDJS-369,SOD female employee AV appearance work Production department 1st year mid-career Akira Okajima (24) First objective solo sex Weekday daytime in-house escort voice toleration sex Toy masturbation First 4P where she is made to cum Nude greeting in public,https://pic.javct.net/poster/04112026/949a53ea7c.jpg,https://javct.net/v/sdjs-369,290,2026-05-29
JUC-605,Tortoise Shell Bride 2 ~A young beautiful wife who feels tied down by her father-in-law~ Satomi Suzuki,https://pic.javct.net/poster/04112026/a94227afdb.jpg,https://javct.net/v/juc-605,118,2026-05-29
NHDTB-572-RM,Going Completely Nude Under Her Cape In The Beauty Salon This Sensitive Girl Secretly Cums Over And Over During Her Haircut [Uncensored L**ked],https://pic.javct.net/poster/20212308/1631160056.jpg,https://javct.net/v/nhdtb-572-rm,178,2026-05-29
SDMM-231-RM,"Magic Mirror No. Couples can come together! I called out and experienced the popular quick massage for the first time! The more I try to hold back my beloved husband's voice through the mirror, the more I feel it... A real married woman can't hold back and has sex in her skirt. [Uncensored L**ked]",https://pic.javct.net/poster/04112026/e9af509e50.jpg,https://javct.net/v/sdmm-231-rm,180,2026-05-29
SGKI-086-RM,Popular AV actress takes on the challenge! Peeing and squirting acme bicycle makes me cum! Miyu Aizawa Hinako Matsui [Uncensored L**ked],https://pic.javct.net/poster/04112026/1898107e63.jpg,https://javct.net/v/sgki-086-rm,196,2026-05-29
SDMM-231,"Magic Mirror No. Couples can come together! I called out and experienced the popular quick massage for the first time! The more I try to hold back my beloved husband's voice through the mirror, the more I feel it... A real married woman can't hold back and has sex in her skirt.",https://pic.javct.net/poster/04112026/e9af509e50.jpg,https://javct.net/v/sdmm-231,180,2026-05-29
SGKI-086,Popular AV actress takes on the challenge! Peeing and squirting acme bicycle makes me cum! Miyu Aizawa Hinako Matsui,https://pic.javct.net/poster/04112026/1898107e63.jpg,https://javct.net/v/sgki-086,196,2026-05-29
MIST-407-RM,YAPPA Yurika Aoi A High-Career Actress Wants To Show Her The Most Eros Dosukebe Slut Older Sister Sex With All Her Sk**ls [Uncensored L**ked],https://pic.javct.net/poster/20230207/1688618233.jpg,https://javct.net/v/mist-407-rm,136,2026-05-29
KDJE-024-RM,[4K remaster version] Masochistic semen trance Azusa Nagasawa [Uncensored L**ked],https://pic.javct.net/poster/04112026/45f08754eb.jpg,https://javct.net/v/kdje-024-rm,127,2026-05-29
JUY-311-RM,"This Horny Father-In-Law Is Teasing His Daughter-In-Law Father, Please Stop... Rika Mari [Uncensored L**ked]",https://pic.javct.net/poster/20222109/1665658400.jpg,https://javct.net/v/juy-311-rm,120,2026-05-29
HODV-21555-RM,Sensual Sex Licking Every Last Inch Of Your Body Natsu Tojo [Uncensored L**ked],https://pic.javct.net/poster/20212709/1636475822.jpg,https://javct.net/v/hodv-21555-rm,130,2026-05-29
JUX-561-RM,Wife's High-Leg Leotard Shame Maki Hojo [Uncensored L**ked],https://pic.javct.net/poster/20221202/1649527719.jpg,https://javct.net/v/jux-561-rm,141,2026-05-29
OMHD-014-RM,"Electric Shock Brainwashing Experiments (AKA: ""Pavlov's Dog"" Is Used As A Brainwashing Method) Barely Legal That Still Hasn't Caught On Gets Her First Experiences Sexually After Electric Shock. Ichika Matsumoto [Uncensored L**ked]",https://pic.javct.net/poster/20212011/1642231629.jpg,https://javct.net/v/omhd-014-rm,105,2026-05-29
