code,title,image_url,page_url,views,date_scraped
DASS-955,"The Female CEO I Admired Had A Huge Penis. Submitting To Power And Cock, I Betrayed My Fiancé In This Complete NTR (Netorare) Story Featuring Marina Ikeda And Hinako Seto.",https://pic.javct.net/poster/04112026/8ed5522476.jpg,https://javct.net/v/dass-955,120,2026-05-08
SDGY-001,"This Beautiful Woman Is A Male-to-female Transgender Person. ""She's So Beautiful That Her Gender Doesn't Matter Anymore."" [Meeting And Immediately Having Sex, Mutual Anal Insertion] A Documentary Of Two Days Of Non-stop Sex.",https://pic.javct.net/poster/04112026/fadcc58394.jpg,https://javct.net/v/sdgy-001,141,2026-05-08
FEM-029,Miraculous GAL♂Debut: Himeno Kamiya,https://pic.javct.net/poster/04112026/f64be359b7.jpg,https://javct.net/v/fem-029,122,2026-05-08
TCD-329,"Newhalf Lesbians ~Sadism And Masochism Are Two Sides Of The Same Coin~ Himeoka Shia, Shizuku Kokoro",https://pic.javct.net/poster/04112026/2b10d05670.jpg,https://javct.net/v/tcd-329,136,2026-05-08
PMGG-028,"Breast milk, sperm, squirting, random ejaculation! ! A divine episode called off paco with a lewd slut erotic streamer ♂! ? As a result of the otaku dick going out of control with her beautiful big breasts and ass → ""Akan...I love this dick...it's buggy...//"" Anal creampie anal fuck with inevitable buzz! [Nel-chan] Aoyama Nell",https://pic.javct.net/poster/04112026/df5f923972.jpg,https://javct.net/v/pmgg-028,66,2026-05-08
AVOP-133,Lesbian-orgasm 2 Eba Liu Yukino Akari,https://pic.javct.net/poster/04112026/88573ae95f.jpg,https://javct.net/v/avop-133,160,2026-05-08
DASS-512-RM,Kana Hiiragi's Success Begins. I Tried To Train Her With The Most Theoretically Powerful AV Actress. Featuring Mao Hamasaki [Uncensored L**ked],https://pic.javct.net/poster/20240410/1729222758.jpg,https://javct.net/v/dass-512-rm,220,2026-05-08
MOOC-019-RM,"A Beautiful Trans Woman With Wet Hair After Her Bath Seductively Tempted Me, Causing My Erection To Flare Up, Awakening My Inner Female Cock. In The Afternoon, I Had A Wild, Intense Anal Affair, Cumming Inside Her Repeatedly. - Tsukino Kuroro [Uncensored L**ked]",https://pic.javct.net/poster/04112026/216f72291a.jpg,https://javct.net/v/mooc-019-rm,160,2026-05-08
MGMR-0012-RM,A Tall 178cm [transgender] Former Transsexual Beauty Queen's Extraordinary Physical Training Will Drive You Mad And Make You Drown In A Messy Transsexual Swamp! Olivia [Uncensored L**ked],https://pic.javct.net/poster/04112026/23ae768d56.jpg,https://javct.net/v/mgmr-0012-rm,126,2026-05-08
TOTK-019-RM,The Lewd Games Of A Transgender Slut: Climax Domination Asshole Battle - Himeoka Shia [Uncensored L**ked],https://pic.javct.net/poster/04112026/dda1559320.jpg,https://javct.net/v/totk-019-rm,126,2026-05-08
MOOC-019,"A Beautiful Trans Woman With Wet Hair After Her Bath Seductively Tempted Me, Causing My Erection To Flare Up, Awakening My Inner Female Cock. In The Afternoon, I Had A Wild, Intense Anal Affair, Cumming Inside Her Repeatedly. - Tsukino Kuroro",https://pic.javct.net/poster/04112026/216f72291a.jpg,https://javct.net/v/mooc-019,160,2026-05-08
MGMR-012,A Tall 178cm [transgender] Former Transsexual Beauty Queen's Extraordinary Physical Training Will Drive You Mad And Make You Drown In A Messy Transsexual Swamp! Olivia,https://pic.javct.net/poster/04112026/7307b86db0.jpg,https://javct.net/v/mgmr-012,126,2026-05-08
FEM-025-RM,Anal Crazy Story Oryo [Uncensored L**ked],https://pic.javct.net/poster/04112026/e3e39915f2.jpg,https://javct.net/v/fem-025-rm,121,2026-05-08
ARAN-108-RM,"Bondage Female Orgasm Hell -GekiYABA- I Was Given An Aphrodisiac And Tied Up, And I Became So Sensitive I Was About To Go Insane... Oryo [Uncensored L**ked]",https://pic.javct.net/poster/04112026/904d888755.jpg,https://javct.net/v/aran-108-rm,130,2026-05-08
TCD-326-RM,My Face Is Ruined By My Beloved Irama! Transgender Idol Oryo Rolls Her Eyes Back At The Sight Of A Huge Cock. [Uncensored L**ked],https://pic.javct.net/poster/04112026/48520e822a.jpg,https://javct.net/v/tcd-326-rm,157,2026-05-08
TIMD-032-RM,"Aki-kun, A Boyish Yet Feminine, Incredibly Beautiful Boy. [Uncensored L**ked]",https://pic.javct.net/poster/04112026/b0e265ac45.jpg,https://javct.net/v/timd-032-rm,127,2026-05-08
FEM-030-RM,The Cat God Family: Kisaragi Mona [Uncensored L**ked],https://pic.javct.net/poster/04112026/804b5693e2.jpg,https://javct.net/v/fem-030-rm,129,2026-05-08
SXMA-021-RM,Lewd Female Degraded Flesh Doll I'm Going Crazy And Dying! Episode 2: Male Flesh Dissection Program On The Brink Of Madness Suzune Nico [Uncensored L**ked],https://pic.javct.net/poster/04112026/339168a85b.jpg,https://javct.net/v/sxma-021-rm,127,2026-05-08
XRW-633-RM,Shock AV Appeared! Sudden Shemale Binika! Japanese Bondage Master Rectangle Chapter 4 KANNA [Uncensored L**ked],https://pic.javct.net/poster/04112026/f2da6c3dae.jpg,https://javct.net/v/xrw-633-rm,125,2026-05-08
PETS-065-RM,First-time Shoot: Handsome Former Stage Actor Secretly Appears In Drag. The Handsome Straight Guy's Hidden Fetish Was Cross-dressing... [Uncensored L**ked],https://pic.javct.net/poster/04112026/1777047771.jpg,https://javct.net/v/pets-065-rm,106,2026-05-08
TOTK-019,The Lewd Games Of A Transgender Slut: Climax Domination Asshole Battle - Himeoka Shia,https://pic.javct.net/poster/04112026/dda1559320.jpg,https://javct.net/v/totk-019,126,2026-05-08
FEM-030,The Cat God Family: Kisaragi Mona,https://pic.javct.net/poster/04112026/804b5693e2.jpg,https://javct.net/v/fem-030,129,2026-05-08
SXMA-021,Lewd Female Degraded Flesh Doll I'm Going Crazy And Dying! Episode 2: Male Flesh Dissection Program On The Brink Of Madness Suzune Nico,https://pic.javct.net/poster/04112026/339168a85b.jpg,https://javct.net/v/sxma-021,127,2026-05-08
FEM-025,Anal Crazy Story Oryo,https://pic.javct.net/poster/04112026/e3e39915f2.jpg,https://javct.net/v/fem-025,121,2026-05-08
