code,title,image_url,page_url,views,date_scraped
ADN-782-RM,"A Mother, Taking Her Daughter's Place, Is Impregnated By A Debt Collector Who Presses Her With His Penis Until She Becomes Pregnant. [Uncensored L**ked]",https://pic.javct.net/poster/05192026/59ef6430ba.jpg,https://javct.net/v/adn-782-rm,120,2026-05-29
DVAJ-621-RM,"A Love Hotel With A Music Student Who Was Diagnosed With The Best Physical Compatibility By A Fortune Teller On The First Date. Guuuuu!!"" Miku Misora Who Was Not Enough With The Two Rubbers Provided And Cummed Over And Over Again [Uncensored L**ked]",https://pic.javct.net/poster/20230207/1688787823.jpg,https://javct.net/v/dvaj-621-rm,122,2026-05-29
ROYD-070-RM,I Couldn't Resist The Temptations From The Tiny Tits Of My Classmate And I Had Unprotected Sex Multiple Times. Natsu Tojo [Uncensored L**ked],https://pic.javct.net/poster/20212709/1634886814.jpg,https://javct.net/v/royd-070-rm,151,2026-05-29
XVSR-195-RM,Life First!Cum SEX Adhesion Document! Togu Tin [Uncensored L**ked],https://pic.javct.net/poster/06032026/1773292621.jpg,https://javct.net/v/xvsr-195-rm,120,2026-05-29
TIKB-165-RM,"[Hamelog] When I Made A Slender Gal Drink Alcohol, The Bimbo Aura Was Fully Open, So I Took A Gonzo As It Was! Yuki's [Uncensored L**ked]",https://pic.javct.net/poster/20230207/1689396045.jpg,https://javct.net/v/tikb-165-rm,156,2026-05-29
PGD-687,Premium Stylish Soap Gold Kawana Misuzu,https://pic.javct.net/poster/05192026/045190dd49.jpg,https://javct.net/v/pgd-687,120,2026-05-29
FC2PPV-4892594,"A video of a naive and cute 19-year-old trainee before being promoted to an underground idol. Her white and delicate body is blushing, and she has a secret appearance that she does not show on the public stage.",https://pic.javct.net/poster/05192026/52c74e7f07.jpg,https://javct.net/v/fc2ppv-4892594,51,2026-05-29
WAAA-650,"""Is It Okay With Someone This Much Older...?"" A Beautiful Wife Who Had Lost Her Confidence As A Woman Became Addicted To Having An Affair And Unprotected Sex With A Devoted Part-time Worker. - Hibiki Otsuki",https://pic.javct.net/poster/05192026/68dff74b12.jpg,https://javct.net/v/waaa-650,120,2026-05-29
CLUB-919,"Stalking, Secretly Filming, Beautiful Girl, J-type, Dr**ged, Unconscious, R**e",https://pic.javct.net/poster/05192026/05511c9985.jpg,https://javct.net/v/club-919,100,2026-05-29
MIDA-655,"This Is The Story Of How I Offered My Girlfriend To My Best Friend For One Day, When We Were In A Love Triangle, And Ended Up Losing Him Body And Soul. (Yagi Nana)",https://pic.javct.net/poster/05192026/5d6f095723.jpg,https://javct.net/v/mida-655,150,2026-05-29
ADN-786,Female Prisoner #407: A Vow Of Revenge In Prison,https://pic.javct.net/poster/05192026/b41ceb3128.jpg,https://javct.net/v/adn-786,140,2026-05-29
CLUB-920,"A Clingy, Stalking, Secretly Filming, Mentally Unstable Girl Who Is Unconscious And R**ed.",https://pic.javct.net/poster/05192026/7c999d0b8e.jpg,https://javct.net/v/club-920,110,2026-05-29
WAAA-649,"A Disliked Middle-aged Teacher Stalks, **dnaps, And Imprisons His Admired Top-performing Female Student, Drugging Her With Sleeping Pills And Aphrodisiacs, Raping Her, And Turning Her Into His Obedient Sex Slave Through Drug-induced Sex Education. (Arai Rima)",https://pic.javct.net/poster/05192026/e3e8fe0441.jpg,https://javct.net/v/waaa-649,120,2026-05-29
MIDA-664,"Newcomer, Is It Okay If She's A Girl Who Likes Both Cooking And Sex? A Three-star Beauty Makes Her AV Debut With The Most Erotic Sex Ever!! Yuuki Nozomi",https://pic.javct.net/poster/05192026/518353d1f7.jpg,https://javct.net/v/mida-664,190,2026-05-29
NPJS-269,"Live Stream Of A Sadistic, Hard-to-get Erect Penis Being Fo**ed Into A Cowgirl Position With Intense Nipple To**ure After Drinking.",https://pic.javct.net/poster/05192026/9abed4a568.jpg,https://javct.net/v/npjs-269,180,2026-05-29
CAWD-992,Ballet Dancers On Their Way Home From Lessons Are Targeted By Perverts And Fo**ed To Perform Flexible Poses To Make Them Climax.,https://pic.javct.net/poster/05192026/0c5d506663.jpg,https://javct.net/v/cawd-992,120,2026-05-29
ADN-782,"A Mother, Taking Her Daughter's Place, Is Impregnated By A Debt Collector Who Presses Her With His Penis Until She Becomes Pregnant.",https://pic.javct.net/poster/05192026/59ef6430ba.jpg,https://javct.net/v/adn-782,120,2026-05-29
SAME-243,Female Teacher Gang-r**ed And Impregnated By The Student's Parent,https://pic.javct.net/poster/05192026/631533422c.jpg,https://javct.net/v/same-243,120,2026-05-29
MIDA-653,"Rikka And I Are More Than Friends With Benefits, But Not Quite Lovers. She Lets Me Have Sex With Her Anytime, But She Doesn't Allow Me To Cum Inside Her. I Secretly Take Off The Condom And Impregnate My Sex Buddy. Ono Rikka",https://pic.javct.net/poster/05192026/a3d0fa94d4.jpg,https://javct.net/v/mida-653,130,2026-05-29
ABP-998-RM,My Sister Atsushi Nonoura Shares Sex With Everyone Mako No. 3 Creampie Group 11 Ejaculations [+15 Minutes With Bonus Footage Only Available At MGS] [Uncensored L**ked],https://pic.javct.net/poster/20231711/1701129246.jpg,https://javct.net/v/abp-998-rm,145,2026-05-29
VEC-778,The Cuckolding Method ~A Husband Who Asks His Best Friend To Seduce His Wife Because He Wants To Confirm Her Love~ Haruka Ryukawa,https://pic.javct.net/poster/05192026/995b186160.jpg,https://javct.net/v/vec-778,120,2026-05-29
MIDA-647,"Giant Dick NTR: A Gym Teacher With A Huge Cock Forces His Beloved Slender Club Manager's Undeveloped Pussy Deep Inside, Thrusting And Making Her Arch Her Back And Twitch As She Orgasms Against Her Will.",https://pic.javct.net/poster/05192026/f5c2dc7630.jpg,https://javct.net/v/mida-647,140,2026-05-29
MIAB-669,Facial-focused: Rei Kuroshima's Binaural Dirty Talk Masturbation Support And Close-up Pussy Riding Position 2D,https://pic.javct.net/poster/05192026/8d986b983f.jpg,https://javct.net/v/miab-669,130,2026-05-29
FC2PPV-4908783,[Uncensored] A neat female college student with a tight slender body in the valley goes crazy with anal licking without hesitation for money ♥ Intense creampie sex ♥ Undisclosed bonus included,https://pic.javct.net/poster/05192026/edf9520430.jpg,https://javct.net/v/fc2ppv-4908783,79,2026-05-29
