code,title,image_url,page_url,views,date_scraped
PA-051426-100,A Horny Mom Who Gets Forcibly Fucked by Her Son's Friend but Can't Help But Enjoy It,https://pic.javct.net/poster/04112026/0f0d04fc49.jpg,https://javct.net/v/pa-051426-100,54,2026-05-14
IMJO-007-RM,[Female style voyeur] The real sexual reality of modern girls captured by the camera [Women's After 5] [Yuri] [Uncensored L**ked],https://pic.javct.net/poster/04112026/83b3b23c9e.jpg,https://javct.net/v/imjo-007-rm,69,2026-05-14
FC2PPV-4899850,"[First shooting] A very rare person with 1 experience, I took a sex video. Even though he looks like a quiet person, it is illegal to be a masochist. He was a pervert who squirted during the deep orgasm.",https://pic.javct.net/poster/04112026/fdfec315d3.jpg,https://javct.net/v/fc2ppv-4899850,77,2026-05-14
HONB-484-RM,"In The Showa Era, It Would Be Safe. [Uncensored L**ked]",https://pic.javct.net/poster/04112026/3025a7f0ac.jpg,https://javct.net/v/honb-484-rm,73,2026-05-14
HONB-483-RM,A 34-year-old Gal Who Flirts While Working A Clinical Trial For An Aphrodisiac. [Uncensored L**ked],https://pic.javct.net/poster/04112026/32453ea02f.jpg,https://javct.net/v/honb-483-rm,58,2026-05-14
261ARA-583-RM,[Cute voice] [Seriously beautiful] I want to do something that feels so good that my voice l**ks out A beautiful female student who aspires to be a voice actress and works at a maid cafe has come to fulfill her sweet desires [Reverse bunny] [Super erotic body] Big breasted reverse bunny The strongest glamorous body is too extreme lol Don't miss the SEX where the sexual desire is exposed as it is violently disturbed after being to**ured a lot. [Uncensored L**ked],https://pic.javct.net/poster/20231011/1697531128.jpg,https://javct.net/v/261ara-583-rm,93,2026-05-14
FC2PPV-4899692,"Case #132 where an amateur came to do naughty things with her face exposed Miku-chan (20), a beautiful, fair-skinned and cute girl with an outstanding figure transforms.",https://pic.javct.net/poster/04112026/3f1f029f4e.jpg,https://javct.net/v/fc2ppv-4899692,58,2026-05-14
FC2PPV-4899642,A big-breasted single mother brought her one c**ld to the shooting location. A sex video with no morals is forbidden and a creampie next to the stroller.,https://pic.javct.net/poster/04112026/4ffa9f8b1d.jpg,https://javct.net/v/fc2ppv-4899642,26,2026-05-14
FC2PPV-4899993,The secret face of the beautiful office lady from a cool manufacturer is an unexpectedly P-active job.She gets a hard piss on her slender sensitive body and cums continuously in tight pussy.,https://pic.javct.net/poster/04112026/0c512be5cd.jpg,https://javct.net/v/fc2ppv-4899993,53,2026-05-14
FC2PPV-4713279,"Part 1, slender, black-haired bob, cool beauty, Tashiro-chan uniform cosplay creampie (main story face showing) Uncensored with review bonus",https://pic.javct.net/poster/04112026/7e2f93e3eb.jpg,https://javct.net/v/fc2ppv-4713279,62,2026-05-14
APKH-147,[Amazing Waist Pet Girl] Keeping A Delicate Girl And Squeezing Radical Fuck Gonzo Himeno Kotome,https://pic.javct.net/poster/04112026/fbbfba492a.jpg,https://javct.net/v/apkh-147,150,2026-05-14
ABW-253-RM,Customs Tower Sexual Feeling Full Course 3 Hours SPECIAL ACT.41 An Overwhelming Beautiful Girl Who Captivates Everything You See Will Do Your Best To Meet Your Desires Yuu Ryukawa [Uncensored L**ked],https://pic.javct.net/poster/20220406/1655977700.jpg,https://javct.net/v/abw-253-rm,210,2026-05-14
AARM-348-RM,Leg Fetish Men's Esthetic Salon ~ Legs Shibuya [Uncensored L**ked],https://pic.javct.net/poster/04112026/0ee1634fcd.jpg,https://javct.net/v/aarm-348-rm,130,2026-05-14
CAWD-035-SUB,Rookie Kawaii * Exclusive Debut → W55cm Super Slender And Miraculous Natural F Cup Active College Student Shino Akina 20 Years Old AV Debut [English Subtitle],https://pic.javct.net/poster/06032026/1775635333.jpg,https://javct.net/v/cawd-035-sub,120,2026-05-14
FC2PPV-4899053,[Sense of immorality] Exciting married woman's affair creampie & facial cumshot with 4 super thick ejaculations ~ Can you please smear my lascivious self so dirty without telling my husband...,https://pic.javct.net/poster/04112026/8328d27b04.jpg,https://javct.net/v/fc2ppv-4899053,69,2026-05-14
FC2PPV-4898104,"[Total of 4 shots] A tall beautiful woman participating in a summer comic with her hobby cosplay, she is shy but squeezes the cock violently with her beautiful butt and squeezes the man's semen with a smile",https://pic.javct.net/poster/04112026/952ef5af04.jpg,https://javct.net/v/fc2ppv-4898104,103,2026-05-14
KSBJ-074,My Husband Is In The ED ... Eliminating Frustration Is My Husband's Brother ... Hikari Yoshizawa,https://pic.javct.net/poster/04112026/120e847ad9.jpg,https://javct.net/v/ksbj-074,120,2026-05-14
FC2PPV-4891971,"I was so excited about this fair-skinned, beautiful, slender girl with model-class beauty and style who likes close contact, and to be honest, I got a little too erect [Uncensored Creampie]",https://pic.javct.net/poster/04112026/9a6ec53967.jpg,https://javct.net/v/fc2ppv-4891971,63,2026-05-14
483DAM-065,[Kimees] Black Gal K-san [Massage],https://pic.javct.net/poster/04112026/6308140363.jpg,https://javct.net/v/483dam-065,42,2026-05-14
261ARA-424-RM,"[Miracle Breasts] 21 years old [Compatible with Divine Breasts] Nami-chan has arrived. She works at a kaiseki restaurant. Her reason for applying is ""I want to make the world peaceful with my breasts..."" She is so happy. [Uncensored L**ked]",https://pic.javct.net/poster/04112026/b20e8f34de.jpg,https://javct.net/v/261ara-424-rm,103,2026-05-14
HIZ-011-RM,Earnestly Milk Rin Shiraishi Earnestly Series No.011 [Uncensored L**ked],https://pic.javct.net/poster/20222612/1673396067.jpg,https://javct.net/v/hiz-011-rm,130,2026-05-14
200GANA-3069-RM,"Seriously soft, first shot 2066 The president's secretary with a super SSS-class divine waist body that has nothing but sex appeal is obscenely shaking her hips and cumming, her slender limbs, well-shaped face, wonderful curvature, firm breasts, everything is erotic I can't get over the excitement of NTR sex that steals the president's woman which is so erotic [Uncensored L**ked]",https://pic.javct.net/poster/20242108/1725863231.jpg,https://javct.net/v/200gana-3069-rm,62,2026-05-14
SOAV-088-RM,A Married Woman's Cheating Heart. Sumire Kuramoto [Uncensored L**ked],https://pic.javct.net/poster/20221904/1651303763.jpg,https://javct.net/v/soav-088-rm,148,2026-05-14
MILK-179-RM,Landmine Runaway Girl X Unequaled Big Dick Man Sexual Intercourse Record Of Fucking A Sick Kawa Girl Found On SNS With Desire Monaka Sengoku [Uncensored L**ked],https://pic.javct.net/poster/20230804/1691639798.jpg,https://javct.net/v/milk-179-rm,126,2026-05-14
