code,title,image_url,page_url,views,date_scraped
1P-052826-001,Devouring Men!,https://pic.javct.net/poster/05192026/30fce924df.jpg,https://javct.net/v/1p-052826-001,58,2026-05-28
FC2PPV-4904008,[First shot] A serious slender beauty whose beautiful body you can't help but follow with your eyes becomes more and more bold as she has sex for the first time in a while,https://pic.javct.net/poster/05192026/735e6feb03.jpg,https://javct.net/v/fc2ppv-4904008,83,2026-05-28
FC2PPV-4908563,"[Female Body Sharing Chapter 17] Frustrated fair-skinned petite young wife reappears to satisfy her sexual desire, demands black man again Creampie & ass ejaculation, 2 consecutive SEX in which she takes turns being penetrated Part 1 [Overseas version] Bonus included",https://pic.javct.net/poster/05192026/a6bbcf0508.jpg,https://javct.net/v/fc2ppv-4908563,42,2026-05-28
FC2PPV-4908701,"[Uncensored/Complete Amateur/Creampie/Squirting] Pure, petite, 18, uniform with ponytail She doesn't have much experience but loves sex. She's in ecstasy with empty eyes. Continuous creampies in her smooth pussy.",https://pic.javct.net/poster/05192026/5ff4f984b0.jpg,https://javct.net/v/fc2ppv-4908701,20,2026-05-28
DAL-010-RM,Fantasy Heisei Beautiful Girl AI MODEL AV DEBUT Kurosaki Hana [Uncensored L**ked],https://pic.javct.net/poster/05192026/e7d543f480.jpg,https://javct.net/v/dal-010-rm,110,2026-05-28
BAB-095-RM,The Name Of This Slender GAL Who Attends A Prefectural Ordinary School Is Nagi-chan Nagisa Ishizaki [Uncensored L**ked],https://pic.javct.net/poster/20230207/1689391501.jpg,https://javct.net/v/bab-095-rm,137,2026-05-28
TIKB-164-RM,"[Hamelog] When I Made A Gachishiko Gal Drink Alcohol, The Bimbo Aura Was Fully Open, So I Took A Gonzo As It Was! Mio Ichijo [Uncensored L**ked]",https://pic.javct.net/poster/20230207/1689393545.jpg,https://javct.net/v/tikb-164-rm,152,2026-05-28
300MIUM-329-RM,A working masochist. Case.2 Accountant for a health food manufacturer / Mr. Kato / 23 years old A serious office lady who talks too fast but can't refuse an appointment. Fo**ed to break through the company's convex office and give a blow job in the reception room with a glass window. Obtaining the key in accordance with the company's rules. - Explosive piston sex in the conference room. [Uncensored L**ked],https://pic.javct.net/poster/05192026/231389b21e.jpg,https://javct.net/v/300mium-329-rm,81,2026-05-28
RTP-104-RM,"I Live Alone, And My Little Sister Came Over To Spend The Night We Hadn't Slept Next To Each Other In 10 Years, But When She Turned Over, I Could See Her Plump Titties! I Couldn't Resist, So I Secretly Started Masturbation, But When She Came Up From Behind And Whispered, ""You Were Jacking Off To My Tits, Weren't You...?"" And Then She Grabbed My Cock... [Uncensored L**ked]",https://pic.javct.net/poster/20212709/1635834935.jpg,https://javct.net/v/rtp-104-rm,125,2026-05-28
SOAV-104-RM,Married Woman's Cheating Heart Emi Nishino [Uncensored L**ked],https://pic.javct.net/poster/20230804/1693628937.jpg,https://javct.net/v/soav-104-rm,146,2026-05-28
HONB-486-RM,"Older Guy Who Loves Girls: A Hall Of Fame Pick-Up Trip - Absolutely Beautiful Girl, Dangerous Sex 13 [Uncensored L**ked]",https://pic.javct.net/poster/05192026/b5c771fad7.jpg,https://javct.net/v/honb-486-rm,62,2026-05-28
NMCH-015-RM,"Former National Team強化指定選手 (strengthened Training Squad Member) With An 8-head-tall Slender Body - When You Put It In, Her Masochistic Side Explodes, And Her Tsundere Personality Explodes - Serina, New Serina [Uncensored L**ked]",https://pic.javct.net/poster/05192026/fefbd35999.jpg,https://javct.net/v/nmch-015-rm,90,2026-05-28
HONB-487-RM,Demand > Supply 5 [Uncensored L**ked],https://pic.javct.net/poster/05192026/6d0f251d9a.jpg,https://javct.net/v/honb-487-rm,70,2026-05-28
ABF-343-RM,"The Best Woman Who's Crazy About Me. -Male-centered, Unprotected Sex With Ejaculation Inside- Umi Hachigake [Uncensored L**ked]",https://pic.javct.net/poster/04112026/1776909925.jpg,https://javct.net/v/abf-343-rm,120,2026-05-28
FNS-207-RM,"I was reunited with my ex-boyfriend who had such good sexual compatibility with me at a class reunion, and even if he made me cum to death with his amazing NTR techniques, I would never get back together... Tsumugi Akari [Uncensored L**ked]",https://pic.javct.net/poster/05192026/f02044a9ca.jpg,https://javct.net/v/fns-207-rm,123,2026-05-28
MGTD-078,Let's Play With The Penis. Vol.02,https://pic.javct.net/poster/05192026/b7d09ed402.jpg,https://javct.net/v/mgtd-078,297,2026-05-28
DAL-010,Fantasy Heisei Beautiful Girl AI MODEL AV DEBUT Kurosaki Hana,https://pic.javct.net/poster/05192026/e7d543f480.jpg,https://javct.net/v/dal-010,110,2026-05-28
420HPT-055-RM,"Lulu (24) Amateur Hoi Hoi, Amateur Hoi Hoi Pet, Amateur, Gal, Slender, Blue Hair, Short Hair, Masochist Woman, Sex Friend, Jumping, Outdoors, Shame, Toy, Creampie, Gonzo, Documentary [Uncensored L**ked]",https://pic.javct.net/poster/05192026/23aeecc80e.jpg,https://javct.net/v/420hpt-055-rm,108,2026-05-28
XVSR-298,Icha LOVE Cum Inside Dating With Neighborhood Cute Sister Mari Haruka Young,https://pic.javct.net/poster/05192026/b64a8efd00.jpg,https://javct.net/v/xvsr-298,120,2026-05-28
MIGD-619,Professional Soap Otoha Nanase Out Super Premium During,https://pic.javct.net/poster/05192026/9b00223a98.jpg,https://javct.net/v/migd-619,150,2026-05-28
IENE-890-RM,Amateur Girls ○ Students Change Their Clothes In Swimming Suit!Nulnur Foam Bowl Soap Experience [Uncensored L**ked],https://pic.javct.net/poster/01202026/1772254781.jpg,https://javct.net/v/iene-890-rm,240,2026-05-28
FC2PPV-4908256,"[Complete amateur creampie] A super beautiful office lady with a captivating body seduces an old man's cock for the first time.With a raw cock, one creampie and two pussy hair ejaculations with a large amount of splash.",https://pic.javct.net/poster/05192026/ae49caae93.jpg,https://javct.net/v/fc2ppv-4908256,54,2026-05-28
420HPT-055,"Lulu (24) Amateur Hoi Hoi, Amateur Hoi Hoi Pet, Amateur, Gal, Slender, Blue Hair, Short Hair, Masochist Woman, Sex Friend, Jumping, Outdoors, Shame, Toy, Creampie, Gonzo, Documentary",https://pic.javct.net/poster/05192026/23aeecc80e.jpg,https://javct.net/v/420hpt-055,108,2026-05-28
BNST-067-RM,My Obedient And Lovely Yarimanko-chan Mami (26 Years Old)-Saffle Acclaimed For Rent-Mami Sakurai [Uncensored L**ked],https://pic.javct.net/poster/20230207/1689480773.jpg,https://javct.net/v/bnst-067-rm,130,2026-05-28
