code,title,image_url,page_url,views,date_scraped
VENX-224-RM,Beautiful Aunt Izumi Yamagishi Who Is Unconscious Of The Smell Of A Female Who Unconsciously Provokes Me With Unprotected Erotica [Uncensored L**ked],https://pic.javct.net/poster/20230207/1690522549.jpg,https://javct.net/v/venx-224-rm,100,2026-05-22
MISM-107-RM,Company Matsuo × Initial SM & Insult × Eimu Daughter Lab × Miyamura Nanako [Uncensored L**ked],https://pic.javct.net/poster/05192026/01d18aca3c.jpg,https://javct.net/v/mism-107-rm,150,2026-05-22
MADM-170-RM,Busty Wife's Erect Nipples Are Waiting To Be Licked... Sexual Desire Explosive Sex With Horny Monsters With Erotic Areolas 5 Years Of Marriage 32 Years Old Night Life With Husband Is Completely Rude Hinano Imamura [Uncensored L**ked],https://pic.javct.net/poster/20230207/1689998210.jpg,https://javct.net/v/madm-170-rm,150,2026-05-22
OKSN-338-RM,"An Exquisite Young Housewife!! This Married Woman Learned What Real Sex Is All About When She Got Hooked On Getting Filmed While Being Fucked, This Beautiful Lady Began Baring More Of Her True Instincts Every Time We Filmed, Until She Released All Of Her Erotic Energy In A Semen-Seeking, Cum-Crazy Fuck Fest [Uncensored L**ked]",https://static.javct.net/poster/oksn-338.jpg,https://javct.net/v/oksn-338-rm,122,2026-05-22
YSN-603-RM,"My New Mother-in-law Is A Devilish Person, But My Erection Does Not Go Away. Rino Yuki [Uncensored L**ked]",https://pic.javct.net/poster/20230207/1690522063.jpg,https://javct.net/v/ysn-603-rm,100,2026-05-22
420ERK-100-RM,"Other-chan (21) Amateur Hoi Hoi, Erotic Kyun, Amateur, Neat, Beautiful Breasts, Drinking Lover, Sensitive, Weak, Cosplay, Facial, Gonzo, Documentary [Uncensored L**ked]",https://pic.javct.net/poster/05192026/df9bb64ef9.jpg,https://javct.net/v/420erk-100-rm,84,2026-05-22
FC2PPV-4904206,[Amateur Video/Special Price] Exclusive sex video of a big-breasted cram school teacher (20s/Ⅰ cup) who became a hot topic on SNS with a beautiful face and beautiful body who was fired after seducing a man with a large amount of creampie at her home.,https://pic.javct.net/poster/05192026/2b9a1ce686.jpg,https://javct.net/v/fc2ppv-4904206,29,2026-05-22
DSOD-003,National Treasure Of The Female Body: Convulsive Arching Ecstasy - Rin Amazawa,https://pic.javct.net/poster/05192026/8a574a9826.jpg,https://javct.net/v/dsod-003,150,2026-05-22
DASS-963,"Please Stop... Not In Front Of The C**ld... A New Mother, Targeted For Her Postpartum Virginity, Is Utterly Crushed By To**ure, To**ure, To**ure. Yuki Takeuchi",https://pic.javct.net/poster/05192026/49a535d18f.jpg,https://javct.net/v/dass-963,130,2026-05-22
DASS-925,"A Struggling Rookie Model Is Brainwashed And Controlled! She's Completely At The Mercy Of Her Filthy, Perverted Cult Leader! A Blissful, Ecstatic, Slutty Toilet Girl With A Face Full Of Euphoria Every Minute And Second. Sasakura Aya",https://pic.javct.net/poster/05192026/3e04bafd94.jpg,https://javct.net/v/dass-925,130,2026-05-22
DASS-993,"Bye-bye. See You Later. A Couple Who Broke Up After Living Together For Five Years Reminisce About The Past On The Night Before Moving Out. On The Last Day, They Repeated The Farewell Passionate Sex, Imprinting Your Naked Body, Kisses, And Scent On Their Hearts Again And Again. Akari Neo",https://pic.javct.net/poster/05192026/6f71220741.jpg,https://javct.net/v/dass-993,130,2026-05-22
DASS-915,"A Slender, Big-breasted Gal Picks Up A Masochistic Man And Controls His Masturbation And His Entire Life - A Theory Of Happiness For A Pathetic Little Dick - Sarina Hyakunaga",https://pic.javct.net/poster/05192026/c6b1671e00.jpg,https://javct.net/v/dass-915,120,2026-05-22
DASS-997,"The Massage Therapist I Was Sent To, Touched My Private Parts So Much That I Couldn't Stand The Pleasure And Ended Up Cheating On My Lover With Him - Fujisaki Soa",https://pic.javct.net/poster/05192026/c107639309.jpg,https://javct.net/v/dass-997,140,2026-05-22
SNOS-229,"[16:25-10:37] Hotel Room: A Lovely Bob-haired Woman Is Subjected To 18 Hours And 12 Minutes Of Deep Vaginal Penetration, Culminating In A Flood Of Orgasms Until She Breaks Down. Kuraki Hana",https://pic.javct.net/poster/05192026/ebec33c6ee.jpg,https://javct.net/v/snos-229,130,2026-05-22
SNOS-207,"A Short, Unemployed, Unpopular Older Brother Is Looked Down Upon And Teased By His Busty, Tall, Popular Younger Sister, Leading To Devilish Sex. - Honoka Watanabe",https://pic.javct.net/poster/05192026/192b4a1389.jpg,https://javct.net/v/snos-207,120,2026-05-22
SNOS-239,"A Timid, Tall Maid Is Retrained With Unreasonable Complaints And Transformed Into A Masochistic Sex Slave Who Climaxes Repeatedly Through Punishment R**e. - Sakika Shirakami",https://pic.javct.net/poster/05192026/d8841d1009.jpg,https://javct.net/v/snos-239,120,2026-05-22
SNOS-208,"Newcomer No. 1 Style: The Legendary Hakata Idol Candidate, Shiraishi Touha, Makes Her AV Debut.",https://pic.javct.net/poster/05192026/0a098fa708.jpg,https://javct.net/v/snos-208,170,2026-05-22
HMN-833,"That Summer, I Was Repeatedly Sexually Assaulted On The Train, Drenched In Sweat. A Summer Of Sweat And Semen Mixed Together In My Panties. Natsu Tojo",https://pic.javct.net/poster/05192026/79fdcd1cdb.jpg,https://javct.net/v/hmn-833,120,2026-05-22
HMN-873,"Our Invincible Group Revenge: A Gang R**e With Ejaculation Inside, After Our Lives Were Ruined By Being Sued For Non-consensual Sexual Intercourse.",https://pic.javct.net/poster/05192026/00b6c0926a.jpg,https://javct.net/v/hmn-873,120,2026-05-22
DASS-943,"A Cock-crazed Slut Pig Falls Into Depravity. The Beautiful Wife Of The Worst, Most Abusive Boss Was Secretly Working At A Hostess Club, So I Took Revenge By Specifically Requesting Her. That Body Will Make Up For It. Shiramine Miu",https://pic.javct.net/poster/05192026/42ec5d7e4c.jpg,https://javct.net/v/dass-943,120,2026-05-22
SNOS-219,"During The New Year's Holiday, A Female Student And An Older Caretaker Were Alone In An Old Student Dormitory... The Forbidden Situation Aroused The Middle-aged Man's Cock, And The Young Girl's Pussy, Wanting To Fill Her Loneliness, Was A Perfect Match, And They Continued To Unite. Kodama Nanami",https://pic.javct.net/poster/05192026/3f6b24ec65.jpg,https://javct.net/v/snos-219,120,2026-05-22
SNOS-273,"A Female Track And Field Ace Whose Dreams Were Shattered By Injury Chooses To Contribute To Male Athletes... Face Shower Sex Worker ""I'm Happier Now, Getting Showered In Semen, Than When I Was Running!"" Moe Sakakibara",https://pic.javct.net/poster/05192026/21a2c66a9e.jpg,https://javct.net/v/snos-273,120,2026-05-22
SNOS-242,"After Persistently Licking And Raping My Quiet Stepdaughter, She Started Moaning And Crying Out A Lot. Is It Hatsumi?",https://pic.javct.net/poster/05192026/bbbf758a23.jpg,https://javct.net/v/snos-242,120,2026-05-22
FC2PPV-4904121,[Face exposed] “18-year-old beautiful cosplayer with rapidly increasing followers” ​​FC2 Shocking Appearance Dangerous Daytime Creampie Rare Video “1 hour 24 minutes” *Only a few left,https://pic.javct.net/poster/05192026/c4f93599d7.jpg,https://javct.net/v/fc2ppv-4904121,31,2026-05-22
