code,title,image_url,page_url,views,date_scraped
348NTR-098,[NTR] It's so erotic when a downer type gets dizzy during sex. Her boyfriend's yelling is in the BGM lol,https://pic.javct.net/poster/05192026/937cc58225.jpg,https://javct.net/v/348ntr-098,61,2026-05-24
FC2PPV-4901891,[Beautiful woman who works at Ollypa] A fair-skinned and slender esthetician with an outstanding style I will revitalize your mind and body with a special massage ♡'' She carefully teaches the sensitive body of a man.,https://pic.javct.net/poster/05192026/6ddf4694ba.jpg,https://javct.net/v/fc2ppv-4901891,86,2026-05-24
HONB-305-RM,One Hundred Million And Two Thousand Years Saseko Gal Akarin [Uncensored L**ked],https://pic.javct.net/poster/20230207/1690433845.jpg,https://javct.net/v/honb-305-rm,65,2026-05-24
SOAV-099-RM,Married Woman's Cheating Heart Natsu Tojo [Uncensored L**ked],https://pic.javct.net/poster/20230302/1679111972.jpg,https://javct.net/v/soav-099-rm,135,2026-05-24
FC2PPV-4896999-RM,"[Face exposure lifted] Selected from 10,000 people, Top Idol Candidates 18 years old'''' Creampie sex video emergency release *Prices will increase gradually [Uncensored L**ked]",https://pic.javct.net/poster/04112026/6c48bd0146.jpg,https://javct.net/v/fc2ppv-4896999-rm,42,2026-05-24
DSOD-003-RM,National Treasure Of The Female Body: Convulsive Arching Ecstasy - Rin Amazawa [Uncensored L**ked],https://pic.javct.net/poster/05192026/8a574a9826.jpg,https://javct.net/v/dsod-003-rm,150,2026-05-24
PKPD-100-RM,Yen Woman Dating Cum Shot OK Innocent White Employee OL Erika Sasami [Uncensored L**ked],https://pic.javct.net/poster/06032026/1774504430.jpg,https://javct.net/v/pkpd-100-rm,124,2026-05-24
JBJB-016,A Slender Little Girl Wants To Play With Her Uncle! Winter Love,https://pic.javct.net/poster/05192026/7c779ed28e.jpg,https://javct.net/v/jbjb-016,118,2026-05-24
FC2PPV-4896352-RM,[Face revealed] Top-class visual 19-year-old F-cup rookie voice actor'' over 20cm'' huge penis penetrating uterus and creampie High investment limited release video *Prices will increase sequentially [Uncensored L**ked],https://pic.javct.net/poster/04112026/31873c79b0.jpg,https://javct.net/v/fc2ppv-4896352-rm,40,2026-05-24
MIDD-943,Yuria Satomi Super Body × Pitakosu SPECIAL,https://pic.javct.net/poster/05192026/3a1e448216.jpg,https://javct.net/v/midd-943,200,2026-05-24
DLIS-015,Crazy Devil Family Flocking To Irresistible Girl Winter Love Thing,https://pic.javct.net/poster/05192026/edb7ff1e73.jpg,https://javct.net/v/dlis-015,121,2026-05-24
XVSR-294,"Asami Nagase 's 3rd Anniversary Debut!Amateur Male's ""Well, I Want To Do It!Three Hours Of Dreams That Will Make You Real! !",https://pic.javct.net/poster/05192026/9da8e0ed35.jpg,https://javct.net/v/xvsr-294,180,2026-05-24
DASS-997-RM,"The Massage Therapist I Was Sent To, Touched My Private Parts So Much That I Couldn't Stand The Pleasure And Ended Up Cheating On My Lover With Him - Fujisaki Soa [Uncensored L**ked]",https://pic.javct.net/poster/05192026/c107639309.jpg,https://javct.net/v/dass-997-rm,140,2026-05-24
DASS-925-RM,"A Struggling Rookie Model Is Brainwashed And Controlled! She's Completely At The Mercy Of Her Filthy, Perverted Cult Leader! A Blissful, Ecstatic, Slutty Toilet Girl With A Face Full Of Euphoria Every Minute And Second. Sasakura Aya [Uncensored L**ked]",https://pic.javct.net/poster/05192026/3e04bafd94.jpg,https://javct.net/v/dass-925-rm,130,2026-05-24
DASS-993-RM,"Bye-bye. See You Later. A Couple Who Broke Up After Living Together For Five Years Reminisce About The Past On The Night Before Moving Out. On The Last Day, They Repeated The Farewell Passionate Sex, Imprinting Your Naked Body, Kisses, And Scent On Their Hearts Again And Again. Akari Neo [Uncensored L**ked]",https://pic.javct.net/poster/05192026/6f71220741.jpg,https://javct.net/v/dass-993-rm,130,2026-05-24
HMN-833-RM,"That Summer, I Was Repeatedly Sexually Assaulted On The Train, Drenched In Sweat. A Summer Of Sweat And Semen Mixed Together In My Panties. Natsu Tojo [Uncensored L**ked]",https://pic.javct.net/poster/05192026/79fdcd1cdb.jpg,https://javct.net/v/hmn-833-rm,120,2026-05-24
DASS-915-RM,"A Slender, Big-breasted Gal Picks Up A Masochistic Man And Controls His Masturbation And His Entire Life - A Theory Of Happiness For A Pathetic Little Dick - Sarina Hyakunaga [Uncensored L**ked]",https://pic.javct.net/poster/05192026/c6b1671e00.jpg,https://javct.net/v/dass-915-rm,120,2026-05-24
NACT-131,"A Woman Who Plunders. When I See Other People's Happiness, I Feel Like Destroying It. - Komatsumoto Ka",https://pic.javct.net/poster/05192026/3c8ff89739.jpg,https://javct.net/v/nact-131,120,2026-05-24
CEMD-849,"Screams (moans)! Agony! Clitoral Stimulation! Woman 12 Orgasms Deep, Deep Inside Her Uterus - Kanna Amane",https://pic.javct.net/poster/05192026/a69512c085.jpg,https://javct.net/v/cemd-849,128,2026-05-24
1P-052326-001,Braless Neighbor In The Morning: Nozomi Maruyama,https://pic.javct.net/poster/05192026/e1cff76253.jpg,https://javct.net/v/1p-052326-001,58,2026-05-24
FC2PPV-4904357,"㊟ Rui-chan, a completely female fallen country teacher who can't stop making a silly voice, has developed a squishy moaning voice.",https://pic.javct.net/poster/05192026/e9f7a1e63a.jpg,https://javct.net/v/fc2ppv-4904357,47,2026-05-24
PA-052326-100,It's Hawaii! A Bikini wife in high spirits! : Ways to End a Sexless Marriage,https://pic.javct.net/poster/05192026/6c8dc8e374.jpg,https://javct.net/v/pa-052326-100,60,2026-05-24
LUCY-027,"The Secret Of My Female Boss: In Private, She Was A Submissive Masochistic Woman - Saki Usumi",https://pic.javct.net/poster/05192026/45dec560ec.jpg,https://javct.net/v/lucy-027,116,2026-05-24
APAK-331,"""I'm Cumming! I'm Cumming! It's Hitting My Cervix!"" Small Face, Slutty And Slim Beauty Orgasms Hard! Lustful Holiday Work! Lewd Orgasm Instruction By Sk**led Office Worker Yukimura Izuki (25)",https://pic.javct.net/poster/05192026/70916c6bd5.jpg,https://javct.net/v/apak-331,126,2026-05-24
