code,title,image_url,page_url,views,date_scraped
WHX-019,"I Have Seen A~tsumata!I Always Thought I!It 's Like I Tits Man!I'll Have Hidden Your Work, Because It Sooo OL 21-year-old Akane Mizusaki ◇ Mon I Shake",https://pic.javct.net/poster/05192026/1119aea34a.jpg,https://javct.net/v/whx-019,120,2026-05-25
XVSR-296,Pissing On A Pretty Girl Who Is Seriously Blushing! ! Eikawa Ooa,https://pic.javct.net/poster/05192026/9ef0c6585d.jpg,https://javct.net/v/xvsr-296,120,2026-05-25
YSN-425-RM,"It Is Zubozubo, Biting Into The Open Obscene Contact Ma ● Co Onishi Neighbor [Uncensored L**ked]",https://pic.javct.net/poster/05192026/c47548a65c.jpg,https://javct.net/v/ysn-425-rm,120,2026-05-25
JAN-018-RM,A In The Uniform YUKI 18 [Uncensored L**ked],https://pic.javct.net/poster/07202025/1753054211.jpg,https://javct.net/v/jan-018-rm,135,2026-05-25
BBTU-052-RM,Screaming Squirting Pie Splash Nene Tanaka [Uncensored L**ked],https://pic.javct.net/poster/20222612/1673671526.jpg,https://javct.net/v/bbtu-052-rm,96,2026-05-25
JAN-017-RM,E In The Uniform Miki-chan 17 [Uncensored L**ked],https://pic.javct.net/poster/07202025/1753055347.jpg,https://javct.net/v/jan-017-rm,130,2026-05-25
BBAN-455-RM,I Will Make Mitsuki Nagisa's Lesbian Desires Come True Before She Retires A Woman Who Wants To Have Sex With Mitsuki Nagisa X A Woman Who Wants To Have Sex With Mitsuki Nagisa Mitsuki Nagisa Hikaru Minazuki Kotone Fuyuai Ran Himeno NATSUKA [Uncensored L**ked],https://pic.javct.net/poster/20231711/1702010886.jpg,https://javct.net/v/bban-455-rm,170,2026-05-25
XVSR-186-RM,"Tonight, Of Fate And The Son Of The Daughter-in-law Intimacies ~ Yui Hatano [Uncensored L**ked]",https://pic.javct.net/poster/20241901/1706431617.jpg,https://javct.net/v/xvsr-186-rm,120,2026-05-25
FC2PPV-4898659,[Individual video] A slender and neat dentist is fucked raw and impregnated with creampie,https://pic.javct.net/poster/05192026/3b15bb032a.jpg,https://javct.net/v/fc2ppv-4898659,23,2026-05-25
GVH-848-RM,Restraining A Masochistic Man And Imprinting Pleasure On Him With Ejaculation Control And Follow-up Male Cum! Titjob GOD Bondage Slut! Yoshine Yuria [Uncensored L**ked],https://pic.javct.net/poster/05192026/25f7ad6350.jpg,https://javct.net/v/gvh-848-rm,160,2026-05-25
FLAV-420-RM,"The Rumored Idol High School Girl, Nozomi Arimura, Is A Devilish Slut Who Seduces Older Men With Her Erect Nipples And Big Ass. [Uncensored L**ked]",https://pic.javct.net/poster/05192026/4a61015fc1.jpg,https://javct.net/v/flav-420-rm,185,2026-05-25
EBOD-446-RM,W Tall Sister Of Harlem Reverse 3P Kayama Yoshisakura Ayumi Mao [Uncensored L**ked],https://pic.javct.net/poster/06032026/1774751984.jpg,https://javct.net/v/ebod-446-rm,150,2026-05-25
SIRO-5660-RM,"[SSS Class Little Devil Beautiful Girl] Just by being gently licked with a squirt jet that doesn't stop every time you thrust, you can confirm your orgasm. [First shot] AV application online AV experience shooting 2561 [Uncensored L**ked]",https://pic.javct.net/poster/05192026/489a5624e9.jpg,https://javct.net/v/siro-5660-rm,67,2026-05-25
FC2PPV-4897339-RM,"*Individual shooting* A secret meeting with a pregnant woman with bristle hair who is 7 months pregnant: A perverted pregnant woman who has less sex with her husband and relieves her sexual desire with another person's dick, and a creampie sex record with a silly voice [Uncensored L**ked]",https://pic.javct.net/poster/04112026/05965c45ef.jpg,https://javct.net/v/fc2ppv-4897339-rm,36,2026-05-25
CEMD-846-RM,"I Got Too Excited And Wet Myself So Much, I'm Sorry... 55 Hikari Ogura [Uncensored L**ked]",https://pic.javct.net/poster/05192026/1a4930a47c.jpg,https://javct.net/v/cemd-846-rm,128,2026-05-25
TIKB-222,"Want To Have Some Drug-fueled Sex Together? A Frustrated, Perverted, Dark-skinned Cosplayer Seduces Me, Giving Me An Aphrodisiac That Makes My Brain Malfunction And Makes Me Cum Like Crazy During Our Casual Sex.",https://pic.javct.net/poster/05192026/7135008fd3.jpg,https://javct.net/v/tikb-222,110,2026-05-25
SGKI-088,Public Phone Booth 360 Degrees Face Of The Most Beautiful Breasts J〇 Nipple Challenge,https://pic.javct.net/poster/05192026/84f5d86ec9.jpg,https://javct.net/v/sgki-088,140,2026-05-25
NHDTB-798-RM,Sightseeing Bus Tour Slut [Uncensored L**ked],https://pic.javct.net/poster/20230207/1689825954.jpg,https://javct.net/v/nhdtb-798-rm,150,2026-05-25
MIDE-701-RM,"""It's Already Good!"" Continuous Creampie Orgasm SP Miu Nakamura [Uncensored L**ked]",https://pic.javct.net/poster/06032026/1773237871.jpg,https://javct.net/v/mide-701-rm,150,2026-05-25
HALT-084-RM,"A Hardworking Office Lady In Black Pantyhose Who Works Late Into The Night At A Black Company Receives A Relaxing Aphrodisiac As A Gift!! She Starts Squirting Profusely From Her Sweaty Pantyhose While At Work!! Shaking And Convulsing, The Office Becomes Flooded. - Kanon Urara [Uncensored L**ked]",https://pic.javct.net/poster/05192026/99153ff2d7.jpg,https://javct.net/v/halt-084-rm,118,2026-05-25
MIDD-408-RM,Shou Nishino Squirting FUCK Intrinsic [Uncensored L**ked],https://pic.javct.net/poster/05192026/cdc96cc760.jpg,https://javct.net/v/midd-408-rm,120,2026-05-25
ENKI-048-RM,Meat Urinal Mirai-chan Crotch Yuru L**ked Metamorphosis Pet Mass Seeding Ring [Uncensored L**ked],https://pic.javct.net/poster/20221904/1650612793.jpg,https://javct.net/v/enki-048-rm,250,2026-05-25
CEMD-849-RM,"Screams (moans)! Agony! Clitoral Stimulation! Woman 12 Orgasms Deep, Deep Inside Her Uterus - Kanna Amane [Uncensored L**ked]",https://pic.javct.net/poster/05192026/a69512c085.jpg,https://javct.net/v/cemd-849-rm,128,2026-05-25
SIRO-5660,"[SSS Class Little Devil Beautiful Girl] Just by being gently licked with a squirt jet that doesn't stop every time you thrust, you can confirm your orgasm. [First shot] AV application online AV experience shooting 2561",https://pic.javct.net/poster/05192026/489a5624e9.jpg,https://javct.net/v/siro-5660,67,2026-05-25
