code,title,image_url,page_url,views,date_scraped
VICD-386,Squirting Big Tits Layer Tearing Anal To**ure,https://pic.javct.net/poster/04112026/e46f27401a.jpg,https://javct.net/v/vicd-386,170,2026-05-11
PGD-661,"Pissing, Squirting, And Incontinence Anju Kitagawa",https://pic.javct.net/poster/04112026/0d832c462c.jpg,https://javct.net/v/pgd-661,120,2026-05-11
390JNT-119,"[Double creampie] [Explosive climax] The popular influencer anoano, who uploads erotic photos on Instagram, is many times cuter than the advent photos, and is even more erotic... She has breasts that feel great when rubbed, a big ass that is pudding, and when it comes to sex, she suddenly turns into a super masochist. ""My pussy has gone crazy! Fill it with semen.'' While begging, she squirts and cums over and over again.",https://pic.javct.net/poster/04112026/c9909f8e51.jpg,https://javct.net/v/390jnt-119,112,2026-05-11
RDT-272-RM,A C**ld I Saw The Fluoride Is Pas Isla Bra Busty Daughter! ?The Servant Was Too Excited About Wearing After Involuntarily ... [Uncensored L**ked],https://pic.javct.net/poster/04112026/93d4d0c14c.jpg,https://javct.net/v/rdt-272-rm,120,2026-05-11
JRZE-293-RM,First-time Filming Of A Married Woman: Koharu Sasaki [Uncensored L**ked],https://pic.javct.net/poster/04112026/1776011738.jpg,https://javct.net/v/jrze-293-rm,115,2026-05-11
T28-372-RM,Passion Fuck Chika Arimura Mutually Determined To Be Rich Kiss Intertwined Libido Release [Uncensored L**ked],https://pic.javct.net/poster/20241902/1710640436.jpg,https://javct.net/v/t28-372-rm,120,2026-05-11
MIST-407-RM,YAPPA Yurika Aoi A High-Career Actress Wants To Show Her The Most Eros Dosukebe Slut Older Sister Sex With All Her Sk**ls [Uncensored L**ked],https://pic.javct.net/poster/20230207/1688618233.jpg,https://javct.net/v/mist-407-rm,136,2026-05-11
ABP-179,2014 Tan Girl Prestige Summer Festival. Yuzutsuki Love,https://pic.javct.net/poster/04112026/e3f6ff4fac.jpg,https://javct.net/v/abp-179,160,2026-05-11
WZEN-071-RM,Banned 20 Nice Booty Trainer Anna (27) [Uncensored L**ked],https://pic.javct.net/poster/20230804/1692936003.jpg,https://javct.net/v/wzen-071-rm,127,2026-05-11
DIC-060-RM,18 Years Old And 4 Months Old. 11 Strongest 18-year-old Actress Naughty Too Sexual. Yuno Ayano [Uncensored L**ked],https://pic.javct.net/poster/04112026/8dcfae7451.jpg,https://javct.net/v/dic-060-rm,175,2026-05-11
EKDV-816-RM,"Seeking A Huge Cock, She Appears In An Adult Video. The Plain-looking, Bespectacled Beauty Is A Hairy Bitch Overflowing With Erotic Curiosity. - Mari Azusa [Uncensored L**ked]",https://pic.javct.net/poster/04112026/ffae42be11.jpg,https://javct.net/v/ekdv-816-rm,150,2026-05-11
STAR-971-RM,SODstar Muhiro Yui 18 Years Old Will Not Stop ... Super Large Squirt! [Uncensored L**ked],https://pic.javct.net/poster/04112026/1a51d7b22d.jpg,https://javct.net/v/star-971-rm,125,2026-05-11
DVAJ-741-RM,"A Super Close-up Of The Ultimate Busty, Slutty Woman's Body, Her Huge Boobs Bouncing Wildly, Her Fleshy Breasts Jiggling As They Come Within 1cm Of Your Eyes, A Direct Dose Of Pheromones, An Incredibly Powerful FUCK, The Rarest Ever. [Uncensored L**ked]",https://pic.javct.net/poster/04112026/e03d4cf02f.jpg,https://javct.net/v/dvaj-741-rm,132,2026-05-11
MDTM-214-RM,Aphrodisiac Incontinence Shrimp Sledding School Girls Home Sweet Home Miko [Uncensored L**ked],https://pic.javct.net/poster/04112026/cbdc96792d.jpg,https://javct.net/v/mdtm-214-rm,120,2026-05-11
ONED-810-RM,Akiho Yoshizawa Hyper Hyper × Barely Barely Squirting [Uncensored L**ked],https://pic.javct.net/poster/04112026/37e4dfae53.jpg,https://javct.net/v/oned-810-rm,120,2026-05-11
CJOD-263,"[Midnight Overtime Office] I Was Suddenly Filthy By A Junior (Mr. Kururugi) Who Thought It Was Sober, And I Was Made To Vaginal Cum Shot Many Times Until Morning ... Aoi Kururugi",https://pic.javct.net/poster/04112026/34c380817b.jpg,https://javct.net/v/cjod-263,150,2026-05-11
RKI-736-RM,"The Story Of Doing Whatever You Want With The Body Of A Shy, Introverted Ghost Who Has Taken Up Residence In Your Home, Part 1 & 2. Since She's A Ghost, She Can't Get Pregnant No Matter How Much You Cum Inside Her! So, Let's Have Unprotected Sex And Cum Inside Her Every Day! Living With A Glamorous Ghost Is Nothing But Good! Satsuki Mei [Uncensored L**ked]",https://pic.javct.net/poster/04112026/7ef20b5c83.jpg,https://javct.net/v/rki-736-rm,90,2026-05-11
YSN-434,Afternoon sex slave Moa Hoshizora 23 years old Fcup,https://pic.javct.net/poster/04112026/3b066846ac.jpg,https://javct.net/v/ysn-434,120,2026-05-11
PGD-659,Masturbation Support 3D Imaging Night,https://pic.javct.net/poster/04112026/24940a11b2.jpg,https://javct.net/v/pgd-659,240,2026-05-11
RKI-747-RM,"New World's Best Aphrodisiac: A Perverted Woman Gets High On It, Transgender Incontinence, And Reaches A Huge Orgasm During Sex!! Hibiki Ren [Uncensored L**ked]",https://pic.javct.net/poster/04112026/59fd0287b3.jpg,https://javct.net/v/rki-747-rm,120,2026-05-11
REAL-989-RM,Oni Ikase Matsui Hinako [Uncensored L**ked],https://pic.javct.net/poster/04112026/35c37575bd.jpg,https://javct.net/v/real-989-rm,120,2026-05-11
DDH-415,Akiho,https://pic.javct.net/poster/04112026/ae16e23fea.jpg,https://javct.net/v/ddh-415,68,2026-05-11
HODV-21556-RM,A Friend In Passing Revenge Gangbang Reika Hashimoto [Uncensored L**ked],https://pic.javct.net/poster/20212709/1636503215.jpg,https://javct.net/v/hodv-21556-rm,135,2026-05-11
XVSR-232-RM,Full Body Blowjob Climax Nagase Asami [Uncensored L**ked],https://pic.javct.net/poster/06032026/1775800535.jpg,https://javct.net/v/xvsr-232-rm,140,2026-05-11
