code,title,image_url,page_url,views,date_scraped
XVSR-290,"Acting College Student Who Makes A Byte At Sports Gym, Debut AV Creator AV Episode! ! Erika Sasaki",https://pic.javct.net/poster/05192026/5cb102f13e.jpg,https://javct.net/v/xvsr-290,140,2026-05-20
FVMD-010-RM,"Bottom Female YouTuber ""Tempting My Younger Brother Surprise"" Planning Shooting Is Too Spear, My Brother Who Was Seriously Lusted Was Dochaso Fucked And Grass Wwwwwww [Uncensored L**ked]",https://pic.javct.net/poster/20230804/1691407054.jpg,https://javct.net/v/fvmd-010-rm,165,2026-05-20
BBTU-045-RM,Specialized Big Boobs Big Boobs Fuck Miu Arioka [Uncensored L**ked],https://pic.javct.net/poster/20221108/1663389238.jpg,https://javct.net/v/bbtu-045-rm,123,2026-05-20
SGKI-091-RM,Time is stopped for girls in school uniforms to have intense sex and become love dolls at will. [Uncensored L**ked],https://pic.javct.net/poster/04112026/0de9d26a9b.jpg,https://javct.net/v/sgki-091-rm,164,2026-05-20
NNPJ-333-RM,"A Prize Of 300,000 Yen Is Won If You Endure The Sexual Sk**l Of An AV Actor!Challenge A Crazy Teaching Game That Cute Female College Students Desperately Endure Iki!Once A Giant Man Immediately · Seeded Press! ! [Uncensored L**ked]",https://pic.javct.net/poster/05192026/91f7b60353.jpg,https://javct.net/v/nnpj-333-rm,160,2026-05-20
MIST-425-RM,"Oba Shot - Aunt Sex By An Aunt, For Aunt Enthusiasts, Aunt Reiko, 48 Years Old, Reiko Himekawa [Uncensored L**ked]",https://pic.javct.net/poster/20231912/1704910189.jpg,https://javct.net/v/mist-425-rm,177,2026-05-20
RAW-040-RM,We Unearthed Certain Private University Four-year Basketball Powerhouse Club Team Affiliation Sunaga Hiyori AV Debut AV Actress A New Generation! 36 [Uncensored L**ked],https://pic.javct.net/poster/05192026/77f384524b.jpg,https://javct.net/v/raw-040-rm,135,2026-05-20
MIGD-547-RM,Rorisopu Shinomiya Daughter Lily Is Pies [Uncensored L**ked],https://pic.javct.net/poster/06032026/1774420193.jpg,https://javct.net/v/migd-547-rm,190,2026-05-20
SOE-598-RM,Special Maki Mind Squirting Leverage [Uncensored L**ked],https://pic.javct.net/poster/06032026/1772859722.jpg,https://javct.net/v/soe-598-rm,120,2026-05-20
MIDD-881-RM,Maki Department Of Diapers More Cosplay [Uncensored L**ked],https://pic.javct.net/poster/06032026/1773888817.jpg,https://javct.net/v/midd-881-rm,150,2026-05-20
BANK-238-RM,"Big-breasted Married Woman On A Hot Spring Date - Ichika, 29 Years Old, A Busty Wife Asked By Her Husband Who Has NTR Fantasies. [Uncensored L**ked]",https://pic.javct.net/poster/04112026/1ab49fa9a5.jpg,https://javct.net/v/bank-238-rm,125,2026-05-20
DSS-246-RM,Amateur Pickup GET!! No. 246 The Halloween Queen's Prank Goes Too Far: Sonic's Ecstasy [Uncensored L**ked],https://pic.javct.net/poster/04112026/6f141419df.jpg,https://javct.net/v/dss-246-rm,140,2026-05-20
IPIT-011,G Cup 21 Years Old Gravure Egg AV Debut Misa Tenjo,https://pic.javct.net/poster/05192026/79c59cd0cf.jpg,https://javct.net/v/ipit-011,160,2026-05-20
IPIT-014,I Want To Have More Comfortable Sex! !! Misa Tenjo,https://pic.javct.net/poster/05192026/b436a8f88d.jpg,https://javct.net/v/ipit-014,120,2026-05-20
MDTM-224-RM,"Today, Tomorrow Is Also The Day After Tomorrow As Well ... When Only Me Make Me Cum Even JK Idle Yuna Himekawa [Uncensored L**ked]",https://pic.javct.net/poster/05192026/9da7d1183f.jpg,https://javct.net/v/mdtm-224-rm,120,2026-05-20
ONED-856-RM,Hyper Hyper - Barely There Mosaic Shou Nishino Squirting × Barely [Uncensored L**ked],https://pic.javct.net/poster/05192026/98ce347ccc.jpg,https://javct.net/v/oned-856-rm,120,2026-05-20
546EROFV-375,"The night before my first love got married again at the class reunion, and I cum multiple times on the last night out.",https://pic.javct.net/poster/04112026/4ca9cbaabe.jpg,https://javct.net/v/546erofv-375,65,2026-05-20
390JAC-237-RM,"[G breasts x slender miraculous body ""Raw sex is the only way to win.'' She was bullish at first, but she exposed her female face and continued to cum inside this beautiful gal] [Hikari-chan, the 107th gal shibe millionaire] [Uncensored L**ked]",https://pic.javct.net/poster/04112026/804bf86c71.jpg,https://javct.net/v/390jac-237-rm,109,2026-05-20
T28-488,Yu Kawakami Non-stop 20 People Continuous Ejaculation,https://pic.javct.net/poster/04112026/42c67f1f99.jpg,https://javct.net/v/t28-488,150,2026-05-20
SIRO-5676,"An innocent and lewd tattooed gal who can orgasm in any position has sex. Contrary to her appearance, her pussy hair is a natural jungle. [First shot] AV application online AV experience shooting 2558",https://pic.javct.net/poster/04112026/ddb6f3a5ee.jpg,https://javct.net/v/siro-5676,64,2026-05-20
RCTD-096-RM,Lower Body Rolled Out Part-time Job At A Staggered Street Mayor Kurata Mana Hamasaki Mao [Uncensored L**ked],https://pic.javct.net/poster/20231711/1702771824.jpg,https://javct.net/v/rctd-096-rm,120,2026-05-20
XVSR-166-RM,Man-eating 4 Production Sakurai Ayane [Uncensored L**ked],https://pic.javct.net/poster/04112026/4bce4d5894.jpg,https://javct.net/v/xvsr-166-rm,120,2026-05-20
DSS-246,Amateur Pickup GET!! No. 246 The Halloween Queen's Prank Goes Too Far: Sonic's Ecstasy,https://pic.javct.net/poster/04112026/6f141419df.jpg,https://javct.net/v/dss-246,140,2026-05-20
SGKI-091,Time is stopped for girls in school uniforms to have intense sex and become love dolls at will.,https://pic.javct.net/poster/04112026/0de9d26a9b.jpg,https://javct.net/v/sgki-091,164,2026-05-20
