code,title,image_url,page_url,views,date_scraped
SPRD-1421-RM,Surrogate MILF Ayaka Makimura [Uncensored L**ked],https://static.javct.net/poster/sprd-1421.jpg,https://javct.net/v/sprd-1421-rm,141,2026-04-28
VENU-740-RM,This Stepmother And Son Will Start Fucking 2 Seconds After Stepdaddy Leaves For Work Kana Morisawa [Uncensored L**ked],https://pic.javct.net/poster/20221202/1645061130.jpg,https://javct.net/v/venu-740-rm,113,2026-04-28
VENU-831-RM,"After I Satisfied My Horny Mother, I Started Pumping Her Pussy Again After She Had Already Cum! High-Speed Action! Follow-Up Piston Pumping Sex Kana Morisawa [Uncensored L**ked]",https://pic.javct.net/poster/20221202/1650086349.jpg,https://javct.net/v/venu-831-rm,85,2026-04-28
BBTU-008-RM,Come Look At My Step Sister's Huge Tits Hana Himesaki [Uncensored L**ked],https://pic.javct.net/poster/20212011/1637575607.jpg,https://javct.net/v/bbtu-008-rm,136,2026-04-28
AMBI-154-RM,3 Full Days Alone With My Step-sister Who Isn't B**od-related! We Take The Opportunity To Do Nothing But Fuck Non-stop! Aoi Amano [Uncensored L**ked],https://pic.javct.net/poster/20221202/1649141835.jpg,https://javct.net/v/ambi-154-rm,126,2026-04-28
GVG-729-RM,Father In Law and Daughter In Law Sticky Creampie Fucking Mio Kimijima [Uncensored L**ked],https://pic.javct.net/poster/20212011/1641318258.jpg,https://javct.net/v/gvg-729-rm,121,2026-04-28
VAGU-115-RM,Naughty Life With Kanako Kanako Ioka [Uncensored L**ked],https://pic.javct.net/poster/20220406/1655096992.jpg,https://javct.net/v/vagu-115-rm,89,2026-04-28
ROYD-017-RM,Sharing A Small Room With My Stepsister - There's No Place To Hide From Her Big Tits When She Flashes Them All Over The Place Rika Aimi [Uncensored L**ked],https://pic.javct.net/poster/20221904/1651633866.jpg,https://javct.net/v/royd-017-rm,130,2026-04-28
ROYD-016-RM,My Stepsister Seduced Me - Even Though Our Family Was Right There My Cock Got Rock Hard Mizuki Yayoi [Uncensored L**ked],https://pic.javct.net/poster/20221202/1644978525.jpg,https://javct.net/v/royd-016-rm,178,2026-04-28
SW-252-RM,"An Fakecest Dream! Daddy's Big Cock Is Ready To Explode Seeing His Daughters Flash Panty Shots At Him! Awakening Their Sexual Desires, His Little Girls Secretly Throb With Lust For Stepdaddy's Dick [Uncensored L**ked]",https://pic.javct.net/poster/20220406/1657072319.jpg,https://javct.net/v/sw-252-rm,123,2026-04-28
BKD-211-RM,Mother/ C**ld Fucking [The Southern Road] Mio Morishita [Uncensored L**ked],https://pic.javct.net/poster/20212011/1644452829.jpg,https://javct.net/v/bkd-211-rm,120,2026-04-28
AMBI-148-RM,The Sex Toy Of Her Perverted Stepfather. The Beautiful Young Girl in Uniform Whose Relationship With Her Boyfriend Is Disrupted. Miina Konno [Uncensored L**ked],https://pic.javct.net/poster/20212011/1641356827.jpg,https://javct.net/v/ambi-148-rm,122,2026-04-28
OKSN-246-RM,My First Time Was With Mom... Ayaka Muto [Uncensored L**ked],https://pic.javct.net/poster/20221108/1661343100.jpg,https://javct.net/v/oksn-246-rm,123,2026-04-28
AKBS-004-RM,Sexy Stepmother And Daughter Sex Yu Shinoda Yoko Hideyoshi [Uncensored L**ked],https://pic.javct.net/poster/20221202/1647504153.jpg,https://javct.net/v/akbs-004-rm,81,2026-04-28
SSNI-654-RM,"Because He Was Her Father-In-Law, She Could Not Refuse His Demands, And While Her Husband Was Nearby, He Fucked Her Every Night And Made Her Cum... Shihori Kotoi [Uncensored L**ked]",https://pic.javct.net/poster/20221202/1646548294.jpg,https://javct.net/v/ssni-654-rm,120,2026-04-28
DTKM-043-RM,"Fakecest: Stepmother And Offspring Swap - I'll Let You Fuck My Stepmom, So Let Me Fuck Yours. Mitsuko Ueshima Saeko Yokoyama [Uncensored L**ked]",https://pic.javct.net/poster/20212011/1643510747.jpg,https://javct.net/v/dtkm-043-rm,207,2026-04-28
BKD-277-RM,Stepmother And Offspring Sex. [West Otawara Road] Nanao Nakano. [Uncensored L**ked],https://pic.javct.net/poster/20212011/1643611532.jpg,https://javct.net/v/bkd-277-rm,121,2026-04-28
BKD-196-RM,Mother/ C**ld Fucking - The Hashikura Road - Hibiki Otsuki [Uncensored L**ked],https://pic.javct.net/poster/20221202/1648402153.jpg,https://javct.net/v/bkd-196-rm,111,2026-04-28
JUC-318-RM,House-Renting Stepmom Fakecest ( Kiyoko Ikeda ) [Uncensored L**ked],https://pic.javct.net/poster/20221202/1645922822.jpg,https://javct.net/v/juc-318-rm,117,2026-04-28
WANZ-837-RM,"Whenever Our Parents Aren't Looking, My Big Sister Starts Luring Me To Temptation For Thrilling Creampie Sex Akari Mitani [Uncensored L**ked]",https://pic.javct.net/poster/20220406/1654607070.jpg,https://javct.net/v/wanz-837-rm,117,2026-04-28
ROYD-031-RM,The Temptation Of A Godly Ass - She Showed Me Her Perfect Peach Booty And I Couldn't Resist Ichika Matsumoto [Uncensored L**ked],https://pic.javct.net/poster/20221904/1651567705.jpg,https://javct.net/v/royd-031-rm,151,2026-04-28
NATR-476-RM,Drink Mama With Colossal Tits Spies On Her Son's Masturbation Mizuki An [Uncensored L**ked],https://pic.javct.net/poster/20221202/1648255438.jpg,https://javct.net/v/natr-476-rm,95,2026-04-28
AMBI-138-RM,Papa's A Pervert! And He Loves His Sex Toys A Beautiful Young Girl In Uniform Had Her Relationship With Her Boyfriend Torn Apart Riko Shinohara [Uncensored L**ked],https://pic.javct.net/poster/20212709/1633176768.jpg,https://javct.net/v/ambi-138-rm,124,2026-04-28
AMBI-141-RM,Perverted Step-Dad's Sex Toy A Beautiful Young Girl In Uniform Breaks Up With Her Boyfriend Rion Izumi [Uncensored L**ked],https://pic.javct.net/poster/20212709/1635760234.jpg,https://javct.net/v/ambi-141-rm,123,2026-04-28
