code,title,image_url,page_url,views,date_scraped
1P-052126-001,"Welcome to the world of M-Guy and W: Bang, Bang, Bang!",https://pic.javct.net/poster/05192026/28e74fba46.jpg,https://javct.net/v/1p-052126-001,59,2026-05-21
JURA-193,First-Time Filming Of A Married Woman: Chapter Two - Kimika Shiori,https://pic.javct.net/poster/05192026/5a6a695e73.jpg,https://javct.net/v/jura-193,135,2026-05-21
MILK-290,Infiltration! Off-camera Sex Photoshoot! Instant Sex OK If You're A Dedicated Fan! Busty Model Mirai Sena,https://pic.javct.net/poster/05192026/fe138e7d73.jpg,https://javct.net/v/milk-290,119,2026-05-21
IZM-018-RM,An Amateur Girl Who Wants To Be Bullied Nakata's Creampie Pharmacist Monami 25 Years Old Penis Love Bicho Mando M Meat Urinal 95cm H Cup Sensitive Erotic Nipple Pharmacist A Woman Who Gives A Blowjob With A Seriously Cock-loving Face Monami Onizuka [Uncensored L**ked],https://pic.javct.net/poster/20230804/1691207186.jpg,https://javct.net/v/izm-018-rm,140,2026-05-21
HUNBL-144-RM,"As Soon As You Open The Door, It's A Super Pizza! Infinite Vaginal Cum Shot Intense Piss Relay That Does Not End No Matter How Many Times It Comes [Uncensored L**ked]",https://pic.javct.net/poster/20230207/1691121862.jpg,https://javct.net/v/hunbl-144-rm,120,2026-05-21
HODV-21573-RM,"19 Years Old, Barely Legal. I Just Want To Be Fucked And Treated Like A Toy - Riko Shinohara [Uncensored L**ked]",https://static.javct.net/poster/hodv-21573.jpg,https://javct.net/v/hodv-21573-rm,134,2026-05-21
MILK-290-RM,Infiltration! Off-camera Sex Photoshoot! Instant Sex OK If You're A Dedicated Fan! Busty Model Mirai Sena [Uncensored L**ked],https://pic.javct.net/poster/05192026/fe138e7d73.jpg,https://javct.net/v/milk-290-rm,119,2026-05-21
JURA-76-RM,"First Shooting Married Woman, Mitabi. Ichika Tokiwa [Uncensored L**ked]",https://pic.javct.net/poster/20230207/1691032974.jpg,https://javct.net/v/jura-76-rm,120,2026-05-21
BBTU-047-RM,Closed Room Big Boob Training Class Alice Kisaki [Uncensored L**ked],https://pic.javct.net/poster/20222410/1668223235.jpg,https://javct.net/v/bbtu-047-rm,122,2026-05-21
OKSN-337-RM,"Secret Love Affair - Overflowing With Pussy Juice For A Man Who's Not Her Husband - Down For His Creampie And Cum Swallowing - Squirting With Faithless Pleasure - Sensitive, Submissive Married Woman Pleads For Fresh Cock [Uncensored L**ked]",https://static.javct.net/poster/oksn-337.jpg,https://javct.net/v/oksn-337-rm,119,2026-05-21
VGD-133-RM,18-year-old Misaki Spring Shy Flying Debut [Uncensored L**ked],https://pic.javct.net/poster/06032026/1773110939.jpg,https://javct.net/v/vgd-133-rm,140,2026-05-21
ZEX-412-RM,A Moment Of Bliss - Wonderful Lesbian Sex With Two Women Whom She Likes Very Much [Uncensored L**ked],https://pic.javct.net/poster/20221202/1644915653.jpg,https://javct.net/v/zex-412-rm,122,2026-05-21
MILK-182-RM,Voyeurism Perverted House Invasion Crimson R**e A Neat And Clean Beautiful Wife Is A Meat Urinal Iki Crazy Absolute Obedience Sexual Intercourse Mochizuki Ayaka [Uncensored L**ked],https://pic.javct.net/poster/20230207/1691034206.jpg,https://javct.net/v/milk-182-rm,132,2026-05-21
SOE-599-RM,Committed In The Dick! Anna Natsuki [Uncensored L**ked],https://pic.javct.net/poster/06032026/1772953528.jpg,https://javct.net/v/soe-599-rm,120,2026-05-21
MILK-289,"I Met A Girl Who Was A ""sadistic"" Type Through Sugar Dating, Got Her Addicted To Drugs, And Turned Her Into A Drug Addict For Sex! She Begged For It On Her Knees, Getting High On An Orgasm-inducing Aphrodisiac! Endless Orgasmic Sex That Pushes The Limits! Yura Kana",https://pic.javct.net/poster/05192026/e0e34ceb73.jpg,https://javct.net/v/milk-289,135,2026-05-21
WSTD-14-RM,Liao Star / Story Lurking In The Back Of The Three Obscenity Cute Smile [Uncensored L**ked],https://pic.javct.net/poster/05192026/cb40d06a36.jpg,https://javct.net/v/wstd-14-rm,95,2026-05-21
SDMU-581-RM,Cum The Graduation Ceremony Ban Date Kokorohana Yura [Uncensored L**ked],https://pic.javct.net/poster/20250606/1752052192.jpg,https://javct.net/v/sdmu-581-rm,135,2026-05-21
VDD-019-RM,Cabin Attendant Risa [suite Room Intimidation] Stewardess In ... (24) [Uncensored L**ked],https://pic.javct.net/poster/20230206/1687247980.jpg,https://javct.net/v/vdd-019-rm,110,2026-05-21
NAMH-064-RM,"13 Shots Into A Lively, Hairless Pussy: First Time Ever Unprotected Intercourse With Hanamori Natsuho [Uncensored L**ked]",https://pic.javct.net/poster/05192026/862742f1b1.jpg,https://javct.net/v/namh-064-rm,115,2026-05-21
RCTD-738-RM,"Brainwashed Family II ~When I Used The Forbidden Incest Ray Gun, My Grandmother, Mother, And Sister All Became My Puppets~ [Uncensored L**ked]",https://pic.javct.net/poster/05192026/da68ee4521.jpg,https://javct.net/v/rctd-738-rm,130,2026-05-21
MDTM-236-RM,Rookie Yuna Yamakawa AV Debut [Uncensored L**ked],https://pic.javct.net/poster/05192026/7d5703cf76.jpg,https://javct.net/v/mdtm-236-rm,150,2026-05-21
SGA-114,Forbidden Shukutoku Married Woman 2 Sleepless Gangbang Big Tits Married Woman Begins With NTR Maximum Acme,https://pic.javct.net/poster/05192026/da48e9eb38.jpg,https://javct.net/v/sga-114,130,2026-05-21
MIGD-611,College Student Virgins AV Debut Want To Be An Adult! ! Sha也 Someday,https://pic.javct.net/poster/05192026/71a989ee38.jpg,https://javct.net/v/migd-611,180,2026-05-21
SOE-605-RM,Haruna Hana Matsuri Prime Mega Facials [Uncensored L**ked],https://pic.javct.net/poster/05192026/4a27f86edc.jpg,https://javct.net/v/soe-605-rm,170,2026-05-21
