code,title,image_url,page_url,views,date_scraped
HIZ-015-RM,Intently Kaoi Ayumi Kishida Earnestly Series No.015 [Uncensored L**ked],https://pic.javct.net/poster/04112026/60a178b7c0.jpg,https://javct.net/v/hiz-015-rm,125,2026-05-15
NEBO-008-RM,Welcome To The Breastfeeding Committee! The Day A F-Cup Shy Student Woke Up To Breastfeeding Saki Sakura [Uncensored L**ked],https://pic.javct.net/poster/20230804/1693111198.jpg,https://javct.net/v/nebo-008-rm,128,2026-05-15
XVSR-161-RM,Rebirth Sensitive BODY Screaming Convulsions FUCK Togu Tin [Uncensored L**ked],https://pic.javct.net/poster/01202026/1772366399.jpg,https://javct.net/v/xvsr-161-rm,120,2026-05-15
MIDA-640,Everything Is A First-time Experience!! Sex Development 4-part Special!! Chiharu Okui,https://pic.javct.net/poster/04112026/46076a2a23.jpg,https://javct.net/v/mida-640,200,2026-05-15
HIZ-014-RM,Pies Earnestly HakuSaki Citron Earnestly Series No.014 [Uncensored L**ked],https://pic.javct.net/poster/04112026/a9722f67d8.jpg,https://javct.net/v/hiz-014-rm,135,2026-05-15
DIC-067-RM,18 Years And 7 Months. 15 Pure SEX With 120% Ubu Feeling While Feeling Confused! Shiraishi Plane [Uncensored L**ked],https://pic.javct.net/poster/04112026/b0643affe0.jpg,https://javct.net/v/dic-067-rm,180,2026-05-15
ONED-301-RM,Nao Hazuki Sex Barely Dense Net Re- [Uncensored L**ked],https://pic.javct.net/poster/04112026/5b778231d7.jpg,https://javct.net/v/oned-301-rm,130,2026-05-15
BAGR-020-RM,"Chi Pobaka Ejaculation Strong Ejaculation Committee If You Ejaculate To The Limit, You'll Fix Your Truancy! And I Was Made To Ejaculate Many Times By Girls Who Rushed For Unreasonable Reasons. [Uncensored L**ked]",https://pic.javct.net/poster/20230804/1691210418.jpg,https://javct.net/v/bagr-020-rm,128,2026-05-15
MIDA-591,"Newcomer, Top-tier, Gorgeous Raw Talent: Misaki Mayu",https://pic.javct.net/poster/04112026/da3df9acb2.jpg,https://javct.net/v/mida-591,160,2026-05-15
MUKA-009,Occupational Uniforms. I Want To Have Sex With Working Girls In Their Work Clothes. Perverted Sex With A Busty Beauty Who Works At A Beauty Clinic.,https://pic.javct.net/poster/04112026/2dfe528dee.jpg,https://javct.net/v/muka-009,180,2026-05-15
HMN-867,"A Real Housewife, With Her Husband's Permission, Appears In A Genuine Unprotected Sex AV. She's Amazing When She Takes Her Clothes Off. A Perverted Cuckolding Sex Documentary Of A Beautiful, Curvaceous, G-cup Busty Wife.",https://pic.javct.net/poster/04112026/09ef2f6a61.jpg,https://javct.net/v/hmn-867,150,2026-05-15
DVMM-397,"Bring On The Drama! A Mother And Daughter Are Locked In A Threesome Over The Daughter's Scumbag Boyfriend! They Compete To See Who Can Give The Best Sex, Fighting Over His Dick In A Simultaneous Reverse Threesome!",https://pic.javct.net/poster/04112026/ae9d48b542.jpg,https://javct.net/v/dvmm-397,155,2026-05-15
MUKD-574,Happy Birthday Dear Shuka The Most Unfortunate And Cruel Birthday In The World Will Be Ruined By R**e,https://pic.javct.net/poster/04112026/5de9a2f0f9.jpg,https://javct.net/v/mukd-574,120,2026-05-15
MIDA-643,"Newcomer, Current College Student, I-cup, Peachy-bottomed Urara Makes Her AV Debut!",https://pic.javct.net/poster/04112026/498fba4030.jpg,https://javct.net/v/mida-643,170,2026-05-15
MIKR-095,Uncensored: Fuyumi Shiraiwa's First Unprotected Sex,https://pic.javct.net/poster/04112026/a7d10e7712.jpg,https://javct.net/v/mikr-095,170,2026-05-15
PRED-864,A Pure And Innocent Announcer Is Targeted By A Train Pervert And Repeatedly Brought To Orgasm In Shame... Her Mind And Body Are Defiled As She Is Gang-r**ed And Unable To Move.,https://pic.javct.net/poster/04112026/83dcf1a1cd.jpg,https://javct.net/v/pred-864,120,2026-05-15
MIFD-730,"When She Undresses, She Reveals Beautiful F-cup Breasts And A 52cm Waist. This Young Lady, Raised In A Strict Household, Wants To Be Brutally Violated. Her Sexual Desires Are Unleashed, And She Makes Her Debut As A Masochist. Kiyono Miyori",https://pic.javct.net/poster/04112026/830622d7d4.jpg,https://javct.net/v/mifd-730,150,2026-05-15
HMN-857,Miracle In The 15th Year Of The School – The Birth Of An Absolute New Ace. Mian Akiyama,https://pic.javct.net/poster/04112026/adb6674e73.jpg,https://javct.net/v/hmn-857,190,2026-05-15
ZEX-279-RM,Rainy Day AV Debut At The Entertainer Idol That Had Appeared In Certain TV Program Of Hokkaido Shot Planning!St. Yurika [Uncensored L**ked],https://pic.javct.net/poster/04112026/b865429833.jpg,https://javct.net/v/zex-279-rm,120,2026-05-15
PPPE-416,"The Brutal Rapists Who Assaulted Me A Few Years Ago Have Reappeared... Trauma Reignited, Big Boobs Cumshot, Impalement, Cumming Inside, Gangbang 17 Times Anzu Anzu",https://pic.javct.net/poster/04112026/fff4d252dc.jpg,https://javct.net/v/pppe-416,120,2026-05-15
MNGS-053,Six Months After Being Away On A Business Trip... The First Thing I Saw When I Returned Home Was My Beloved Wife Having A Wild Orgy With Strangers... Misono Waka,https://pic.javct.net/poster/04112026/6a44ece281.jpg,https://javct.net/v/mngs-053,120,2026-05-15
ZEX-291-RM,"I Am, Because You Do Mase Alive, Is Okay To Ask Out Seriously And Cheeky Daughter Is Screaming Iki Rolled Matsubushi Dreamed (19 Years Old) Who Had Said [Uncensored L**ked]",https://pic.javct.net/poster/04112026/3f6ffc9a03.jpg,https://javct.net/v/zex-291-rm,120,2026-05-15
PRWF-011,"""I've Already Come! ...I'm Coming Again!"" The Awakening Orgasm Documentary Of A Slender, Big-breasted Wife, Sora Komatsu",https://pic.javct.net/poster/04112026/d692fe0bca.jpg,https://javct.net/v/prwf-011,150,2026-05-15
IDOL-010-RM,Arisa Kanno Mosaic Limit Grazing [Uncensored L**ked],https://pic.javct.net/poster/04112026/26edf55519.jpg,https://javct.net/v/idol-010-rm,115,2026-05-15
