code,title,image_url,page_url,views,date_scraped
MUDR-033-RM,For Him That I Love ... I Give Anal With A Smile F Cup Beautiful Girl Two Holes Cum Inside Cum Inside Shizuka Misa [Uncensored L**ked],https://pic.javct.net/poster/20222410/1667699247.jpg,https://javct.net/v/mudr-033-rm,120,2026-04-24
STAR-949-RM,Furukawa Iori Ultra Sensitive Sensitive Clitoris Leaping Frenzy Cum Maximum Transformer SEX [Uncensored L**ked],https://pic.javct.net/poster/20230205/1683104684.jpg,https://javct.net/v/star-949-rm,135,2026-04-24
SSNI-745-RM,Three Days During Homecoming Just After Sex With Two Busty Cousins ​​Who Meet Only Once A Year Miharu Hanezaki Nogi Hotaru [Uncensored L**ked],https://pic.javct.net/poster/07202025/1756096188.jpg,https://javct.net/v/ssni-745-rm,150,2026-04-24
DIC-036-RM,Compliant beautiful girl Ponkotsu Chan will make her AV debut! ? Ponkotsu File.01 Kotoriyu Mayu [Uncensored L**ked],https://pic.javct.net/poster/04112026/1776997326655.jpg,https://javct.net/v/dic-036-rm,100,2026-04-24
DIC-035-RM,Active reader model female college student Yuki Kishi 20 years old AV DEBUT first shoot JD 06 [Uncensored L**ked],https://pic.javct.net/poster/04112026/1776997395990.jpg,https://javct.net/v/dic-035-rm,135,2026-04-24
ROE-484,"My Stepdaughter Calls Her Male Friends Over And Makes Them Gangbang Me Every Day. - Satsuki Sakura, Kishinaga Mirina",https://pic.javct.net/poster/04112026/1776965749.jpg,https://javct.net/v/roe-484,150,2026-04-24
HUNTC-566,"""This Room Is Making My Crotch Tingle..."" I Had Unprotected Sex With The Neighborhood Girl And Her Friend Who Got Excited By My Embarrassing, Messy Room! 3",https://pic.javct.net/poster/04112026/1776966144.jpg,https://javct.net/v/huntc-566,180,2026-04-24
DASS-944,I'm The Only One Who Can't Have Sex At Home Drinking Party ●BSS. Mei Itsukaichi,https://pic.javct.net/poster/04112026/1776964547.jpg,https://javct.net/v/dass-944,150,2026-04-24
HMN-802,"""Sorry For Fighting Over Your Dick,"" Two Sexually Frustrated, Insatiable Older Women Said, Sucking My Pussy And Grinding My Big Ass, Making Me Cum Inside Them Repeatedly... Hasumi Claire, Misaki Kanna",https://pic.javct.net/poster/04112026/1776964391.jpg,https://javct.net/v/hmn-802,140,2026-04-24
HUNTC-570,"30 Seconds After Getting Home, It's ""Welcome Home"" Followed By Immediate Penetration! My House Has Become A Hangout For Troubled Female Students, And I'm Fucking Them One After Another! Cumming Inside Them All The Time! 6",https://pic.javct.net/poster/04112026/1776966076.jpg,https://javct.net/v/huntc-570,200,2026-04-24
MUKC-091-SUB,"I Met A Bar Hostess After Work And We Had A Drunken Threesome In The Bar And Took Her Back To The Hotel For An Orgy, Hinano Miki [English Subtitle]",https://pic.javct.net/poster/20250903/1741888670.jpg,https://javct.net/v/mukc-091-sub,150,2026-04-24
GVH-398-RM,"Development Of Vaginal Orgasms. 3 Nights, 4 Days. Ena Satsuki [Uncensored L**ked]",https://pic.javct.net/poster/20221904/1651296863.jpg,https://javct.net/v/gvh-398-rm,132,2026-04-24
JUR-724,"I Fo**ed My Dick Into My Cheating Wife, Mei, And Her Lover, Rio, And Made Them Understand Through Their Wombs.",https://pic.javct.net/poster/04112026/1776963086.jpg,https://javct.net/v/jur-724,130,2026-04-24
MIDD-205-RM,Sha Snow 3P × 4 Ultimate Production [Uncensored L**ked],https://pic.javct.net/poster/04112026/1777001442.jpg,https://javct.net/v/midd-205-rm,130,2026-04-24
HMN-841,Haruhi Moka VS Virgin Boy: You Can't Go Home Until You've Cummed 24 Times In 24 Hours!! Five M-type Virgins And A Gal Are Held Captive And Monitored Under One Roof! A Special Episode Where They Cum Like Crazy Because They Want To Go Home Quickly!,https://pic.javct.net/poster/04112026/1776964186.jpg,https://javct.net/v/hmn-841,150,2026-04-24
DASS-914,"The Bank Robber, Having Lost All Self-control, Continued To Gang-r**e My Busty Wife, The Envy Of Everyone, All Day Long. Hanae Tsubaki",https://pic.javct.net/poster/04112026/1776964758.jpg,https://javct.net/v/dass-914,120,2026-04-24
DASS-934,"Position (shape) That Harvests Sperm (life). 99% Implantation Rate, Loud-voiced Female Insemination Driver. Kyoko Hanamiya",https://pic.javct.net/poster/04112026/1776966281.jpg,https://javct.net/v/dass-934,140,2026-04-24
DASS-973,Triumphant Return: Rin Amazawa,https://pic.javct.net/poster/04112026/1776964476.jpg,https://javct.net/v/dass-973,120,2026-04-24
HMN-859,"A Seemingly Innocent But Extremely Vulgar S-class Beauty's 'cum Inside' Is Now Unleashed!! A Masochistic, Super Slender, Delicate, Curvaceous Schoolgirl Is Impregnated And Given Obscene Education. The Fate Of A Girl Sold By Her Mother Who Gives Her First Ever Raw Cum Inside To A Stranger. Otonashi Suzu",https://pic.javct.net/poster/04112026/1776963977.jpg,https://javct.net/v/hmn-859,120,2026-04-24
HMN-831,"[Kimeseku NTR Video] My Girlfriend, Who Went To A Different University, Stopped Contacting Me After Our First Club Welcome Party. The Next Morning, I Received A Video Of What Appeared To Be Her, A Woman Repeatedly Having A Vulgar Orgasm While High On Drugs. Perfume Jun",https://pic.javct.net/poster/04112026/1776964327.jpg,https://javct.net/v/hmn-831,120,2026-04-24
DASS-911,Defeated Heroine. I Will Absolutely Not Lose To The Pleasure Of Aphrodisiacs...! Mary Tachibana,https://pic.javct.net/poster/04112026/1776964822.jpg,https://javct.net/v/dass-911,110,2026-04-24
HUNTC-563,"The Gap Behind The School Lockers Is Our Secret Fuck Spot! We Were Caught Having Sex In Hiding And Ended Up Fucking A Bunch Of Frustrated Girls Who Were Peeking In, Creating A Chain Reaction Of Fucking! 3",https://pic.javct.net/poster/04112026/1776963908.jpg,https://javct.net/v/huntc-563,90,2026-04-24
PGD-213-RM,Super Luxury 6 Honoka Glamorous Production [Uncensored L**ked],https://pic.javct.net/poster/04112026/1776965150.jpg,https://javct.net/v/pgd-213-rm,240,2026-04-24
NHDTC-192-RM,Lesbian Threesome With A Schoolgirl Couple; Teaching The Sensitive Girl Who Is Holding Back Her Orgasm In Front Of Her Girlfriend The Pleasure Of A Cock With Unprotected Sex. [Uncensored L**ked],https://pic.javct.net/poster/04112026/1776879710.jpg,https://javct.net/v/nhdtc-192-rm,170,2026-04-24
