code,title,image_url,page_url,views,date_scraped
HIZ-016-RM,Intently Sweat Hagi Much Earnestly Series No.016 [Uncensored L**ked],https://pic.javct.net/poster/04112026/4bf9e322f6.jpg,https://javct.net/v/hiz-016-rm,135,2026-05-16
BNST-069-RM,My Lovely Bimbo Jun Jun (25 Years Old)-Sefure Acclaimed Lending- Jun Suehiro [Uncensored L**ked],https://pic.javct.net/poster/20230804/1691896547.jpg,https://javct.net/v/bnst-069-rm,147,2026-05-16
XVSR-233-RM,Pissing On A Pretty Girl Who Is Seriously Blushing! It Is! Haruka Tagi [Uncensored L**ked],https://pic.javct.net/poster/06032026/1773145325.jpg,https://javct.net/v/xvsr-233-rm,120,2026-05-16
BAGR-021-RM,"I Saw My Classmate Lez In The Classroom. When I Tried To Threaten It With A Story, I Was Counterattacked And Made To Ejaculate Many Times [Uncensored L**ked]",https://pic.javct.net/poster/20230804/1691210356.jpg,https://javct.net/v/bagr-021-rm,125,2026-05-16
NXG-436-RM,3P In Front Of My Husband... Voluptuous Amateur Wife Edition [Uncensored L**ked],https://pic.javct.net/poster/20230804/1692934200.jpg,https://javct.net/v/nxg-436-rm,120,2026-05-16
HIZ-017-RM,Intently Kaoi Kitagawa Leila Earnestly Series No.017 [Uncensored L**ked],https://pic.javct.net/poster/04112026/d9643c9795.jpg,https://javct.net/v/hiz-017-rm,130,2026-05-16
HMN-867-RM,"A Real Housewife, With Her Husband's Permission, Appears In A Genuine Unprotected Sex AV. She's Amazing When She Takes Her Clothes Off. A Perverted Cuckolding Sex Documentary Of A Beautiful, Curvaceous, G-cup Busty Wife. [Uncensored L**ked]",https://pic.javct.net/poster/04112026/09ef2f6a61.jpg,https://javct.net/v/hmn-867-rm,150,2026-05-16
MIFD-730-RM,"When She Undresses, She Reveals Beautiful F-cup Breasts And A 52cm Waist. This Young Lady, Raised In A Strict Household, Wants To Be Brutally Violated. Her Sexual Desires Are Unleashed, And She Makes Her Debut As A Masochist. Kiyono Miyori [Uncensored L**ked]",https://pic.javct.net/poster/04112026/830622d7d4.jpg,https://javct.net/v/mifd-730-rm,150,2026-05-16
HMN-857-RM,Miracle In The 15th Year Of The School – The Birth Of An Absolute New Ace. Mian Akiyama [Uncensored L**ked],https://pic.javct.net/poster/04112026/adb6674e73.jpg,https://javct.net/v/hmn-857-rm,190,2026-05-16
FC2PPV-4900862,[Uncensored x Personal Shooting] **pyjpx*jsps I have a rash overseas!? Rina-chan came out aggressively in a bold over-exposing outfit and suddenly showed off a 3P to the viewers during the live broadcast lol,https://pic.javct.net/poster/04112026/9d9ae9588e.jpg,https://javct.net/v/fc2ppv-4900862,53,2026-05-16
MIDD-873-RM,Haruki Nana Facial Cumshot From A Saturation Amount Of Suggoi [Uncensored L**ked],https://pic.javct.net/poster/06032026/1773382042.jpg,https://javct.net/v/midd-873-rm,180,2026-05-16
MIDA-643-RM,"Newcomer, Current College Student, I-cup, Peachy-bottomed Urara Makes Her AV Debut! [Uncensored L**ked]",https://pic.javct.net/poster/04112026/498fba4030.jpg,https://javct.net/v/mida-643-rm,170,2026-05-16
MIDA-591-RM,"Newcomer, Top-tier, Gorgeous Raw Talent: Misaki Mayu [Uncensored L**ked]",https://pic.javct.net/poster/04112026/da3df9acb2.jpg,https://javct.net/v/mida-591-rm,160,2026-05-16
DIAM-007,Wheat Skin Pretty Oil Slimy Tied Up Sacred Tree YuAi 19 Years Old,https://pic.javct.net/poster/04112026/a3131c5703.jpg,https://javct.net/v/diam-007,138,2026-05-16
MXGS-1429,"Soaked From Head To Toe! Unstoppable, Fluid-soaked, Orgasmic Sex - Hikaru Miyanishi",https://pic.javct.net/poster/04112026/a102b4fcc9.jpg,https://javct.net/v/mxgs-1429,125,2026-05-16
ZEX-318-RM,AV Starring Chiaki Asada Of Amateur Shaved Married Once As Long As The Frustration You Are Feeling A Rut In Life Of A Married Couple (30 Years Old) [Uncensored L**ked],https://pic.javct.net/poster/04112026/9d5ac38566.jpg,https://javct.net/v/zex-318-rm,120,2026-05-16
PRWF-011-RM,"""I've Already Come! ...I'm Coming Again!"" The Awakening Orgasm Documentary Of A Slender, Big-breasted Wife, Sora Komatsu [Uncensored L**ked]",https://pic.javct.net/poster/04112026/d692fe0bca.jpg,https://javct.net/v/prwf-011-rm,150,2026-05-16
PRED-864-RM,A Pure And Innocent Announcer Is Targeted By A Train Pervert And Repeatedly Brought To Orgasm In Shame... Her Mind And Body Are Defiled As She Is Gang-r**ed And Unable To Move. [Uncensored L**ked],https://pic.javct.net/poster/04112026/83dcf1a1cd.jpg,https://javct.net/v/pred-864-rm,120,2026-05-16
MNGS-053-RM,Six Months After Being Away On A Business Trip... The First Thing I Saw When I Returned Home Was My Beloved Wife Having A Wild Orgy With Strangers... Misono Waka [Uncensored L**ked],https://pic.javct.net/poster/04112026/6a44ece281.jpg,https://javct.net/v/mngs-053-rm,120,2026-05-16
ABW-231-RM,The Female Manager Is Our Sexual Processing Pet 044 Yuu Ryukawa [Uncensored L**ked],https://pic.javct.net/poster/20221904/1651055567.jpg,https://javct.net/v/abw-231-rm,200,2026-05-16
XMOM-61-RM,Dirty Mating Record Of A Married Woman With A Strong Sexual Desire Reiko Himekawa [Uncensored L**ked],https://pic.javct.net/poster/20230804/1691638624.jpg,https://javct.net/v/xmom-61-rm,95,2026-05-16
BBTU-037-RM,Big Pai Girl Bullying Club Suwon Miso [Uncensored L**ked],https://pic.javct.net/poster/20221904/1652508200.jpg,https://javct.net/v/bbtu-037-rm,98,2026-05-16
BASJ-008-RM,My Wife Suddenly Became A Slut After Seeing Me Forcibly Fucked Her. From That Moment I'm Two Meat Vibes [Uncensored L**ked],https://pic.javct.net/poster/20230804/1691210294.jpg,https://javct.net/v/basj-008-rm,133,2026-05-16
MIFD-570-SUB,"""Mom And Dad, I Might Be Pregnant"" A Real Young Lady's First Raw Creampie On Her Dangerous Day SPECIAL Otoha Ikegami [English Subtitle]",https://pic.javct.net/poster/20250903/1744310610.jpg,https://javct.net/v/mifd-570-sub,120,2026-05-16
