code,title,image_url,page_url,views,date_scraped
STARS-639-RM,"""Because The Back Menu Of Our Store Is The Squirting Of The Teacher, Come To Play? W"" At The School Festival, The New Female Teacher Hikari Aozora Was Fo**ed To Circle The Students. [Uncensored L**ked]",https://pic.javct.net/poster/20220406/1656398485.jpg,https://javct.net/v/stars-639-rm,140,2026-05-22
MADM-170-RM,Busty Wife's Erect Nipples Are Waiting To Be Licked... Sexual Desire Explosive Sex With Horny Monsters With Erotic Areolas 5 Years Of Marriage 32 Years Old Night Life With Husband Is Completely Rude Hinano Imamura [Uncensored L**ked],https://pic.javct.net/poster/20230207/1689998210.jpg,https://javct.net/v/madm-170-rm,150,2026-05-22
OKSN-338-RM,"An Exquisite Young Housewife!! This Married Woman Learned What Real Sex Is All About When She Got Hooked On Getting Filmed While Being Fucked, This Beautiful Lady Began Baring More Of Her True Instincts Every Time We Filmed, Until She Released All Of Her Erotic Energy In A Semen-Seeking, Cum-Crazy Fuck Fest [Uncensored L**ked]",https://static.javct.net/poster/oksn-338.jpg,https://javct.net/v/oksn-338-rm,122,2026-05-22
BBTU-048-RM,Big Tits ASMR Whispering Paima Co  Brain Juice Crazy Miu Arioka [Uncensored L**ked],https://pic.javct.net/poster/20222410/1668223171.jpg,https://javct.net/v/bbtu-048-rm,135,2026-05-22
STAR-985-RM,Former Celebrity Ai Haneda Shooting Place Can Not Be Translated If Found In My Home Husband ... Doki Doki 3SEX At Home [Uncensored L**ked],https://pic.javct.net/poster/05192026/3bf9054b98.jpg,https://javct.net/v/star-985-rm,135,2026-05-22
JURA-195-RM,First-time Filming Of A 50-year-old Wife: Chapter 2 - Sumino Makise [Uncensored L**ked],https://pic.javct.net/poster/05192026/fdbc2aedc7.jpg,https://javct.net/v/jura-195-rm,120,2026-05-22
DIC-079-RM,[Active] Beautiful Big Breasts! !! Wadaiko Player Masaru Matsuda AV Debut Talent Super Aggressive De M [Uncensored L**ked],https://pic.javct.net/poster/05192026/a13f06caf2.jpg,https://javct.net/v/dic-079-rm,120,2026-05-22
JURA-194-RM,First-Time Filming Of A Married Woman: Chapter Two - Kasumi Kudo [Uncensored L**ked],https://pic.javct.net/poster/05192026/39d0157364.jpg,https://javct.net/v/jura-194-rm,110,2026-05-22
JUR-696,"Mother, Who Went To A Host Club To Save Her Beloved Daughter, Is Fo**ed To Repay Her Debts With Her Body.",https://pic.javct.net/poster/05192026/483f82686d.jpg,https://javct.net/v/jur-696,170,2026-05-22
JUX-869-SUB,Married Is Addictive Gangbang Off Meeting Sumire Shiraishi [English Subtitle],https://pic.javct.net/poster/06032026/1773678032.jpg,https://javct.net/v/jux-869-sub,120,2026-05-22
HUBLK-069,After-school Urine Drinking Club,https://pic.javct.net/poster/05192026/70274fb416.jpg,https://javct.net/v/hublk-069,150,2026-05-22
MISM-446,"The House Of Throat To**ure. The Eagerly Awaited Anal Destruction. The Long-awaited, Exhilarating Full-force Vomiting. We Invite Our Energetic, Boyish Girl.",https://pic.javct.net/poster/05192026/1e463570c5.jpg,https://javct.net/v/mism-446,180,2026-05-22
HUBLK-071,"What?! 90%? What's With This Number? A World Where The Probability Of Success Is Visualized And Only I Can See It! I Enrolled In A School That Was An All-girls School Until Last Year, And Now It's Almost Entirely Girls! I Thought I'd Be Popular, But Instead I'm Bullied Almost Every Day And Treated Like A Slave! Then One Day, A Turning Point Comes...",https://pic.javct.net/poster/05192026/597bdcfc8b.jpg,https://javct.net/v/hublk-071,180,2026-05-22
NMSL-039,Training diary that dominates a serious black secretary with pleasure Ruka Itoi,https://pic.javct.net/poster/05192026/bb53e83b2c.jpg,https://javct.net/v/nmsl-039,117,2026-05-22
HUNTC-496,"Excessive Sexual Harassment Prevention Measures In After-school Job Interview Practice!? Teachers And Students Conduct Mock Interviews To Prepare For All Kinds Of Sexual Harassment, Simulating A High-pressure Interview In A Real One.",https://pic.javct.net/poster/05192026/1025d38359.jpg,https://javct.net/v/huntc-496,180,2026-05-22
MISM-442,The Woman Who Processes Sewage Down Her Throat Drinks All The Stinky Dirty Juice! 13 Shots Of Freshly Ejaculated Cum! 1860ml Of Vomiting! 580ml Of Self-urinated Pee.,https://pic.javct.net/poster/05192026/b2da0aee05.jpg,https://javct.net/v/mism-442,180,2026-05-22
SW-631-RM,"Mamashi ○ Ta ・ Boin!Too Big Tits Of My Friend's Mom In Front Of Her Eyes.My Libre Addicted To My Bin Erection Chi ○ Co-mama Is ""play When There Is No Son"" Devil's Roar At The Ear.He Taught Me A Mischievous Woman To My Body I Do Not Know Anything [Uncensored L**ked]",https://pic.javct.net/poster/20242108/1727168407.jpg,https://javct.net/v/sw-631-rm,180,2026-05-22
SNOS-187,"This Is What I Want To Do, So I'm Appearing In An Adult Video! Huge Cock, Bondage, 3P Piston, Marshmallow G Girl's First Time, All Uncensored, 3 Scenes, Shirahana Nia",https://pic.javct.net/poster/05192026/fde3e8eb22.jpg,https://javct.net/v/snos-187,120,2026-05-22
IBW-521Z-RM,The Niece Sister  Homecoming Was 7 Days NAGOMI And Yuzu Or Of Record [Uncensored L**ked],https://pic.javct.net/poster/20220406/1655137949.jpg,https://javct.net/v/ibw-521z-rm,140,2026-05-22
DVAJ-183-RM,It Is Fucked The Girl Doll-two Father-in-law ...  Aoi Akane [Uncensored L**ked],https://pic.javct.net/poster/20222612/1673889965.jpg,https://javct.net/v/dvaj-183-rm,125,2026-05-22
BNDV-00450-RM,Revived In The New Standard Mosaic That Idle Super Clear [Madoka Ozawa] [Uncensored L**ked],https://pic.javct.net/poster/05192026/b6ff044c37.jpg,https://javct.net/v/bndv-00450-rm,240,2026-05-22
AARM-347-RM,"""I'm Not Going To Let You Cum Just Yet..."" She Whispers, Licking My Ear And French Kissing Me, Then Continuing To Tease Me Erotically And Gently From My Nipples To My Testicles In This 3P Slutty Experience. [Uncensored L**ked]",https://pic.javct.net/poster/04112026/b78acbb591.jpg,https://javct.net/v/aarm-347-rm,100,2026-05-22
JURA-195,First-time Filming Of A 50-year-old Wife: Chapter 2 - Sumino Makise,https://pic.javct.net/poster/05192026/fdbc2aedc7.jpg,https://javct.net/v/jura-195,120,2026-05-22
JURA-194,First-Time Filming Of A Married Woman: Chapter Two - Kasumi Kudo,https://pic.javct.net/poster/05192026/39d0157364.jpg,https://javct.net/v/jura-194,110,2026-05-22
