code,title,image_url,page_url,views,date_scraped
HUNTB-151-RM,"Door To Anywhere ""Aah, Pervert! Why Are You Here!? Get out!"" You Can Go Anywhere With This Door! And You Can Cum Anywhere With It Too! [Uncensored L**ked]",https://pic.javct.net/poster/20212709/1637308899.jpg,https://javct.net/v/huntb-151-rm,165,2026-05-18
MAZO-026-RM,A Public School Student 1 Years Old Trained To Train A First-Class Body As A Track And Field Club Super Sensitive Nipple Twist And Faints In Agony Irresponsible Seeding Sex Loving Masochist Lady [Uncensored L**ked],https://pic.javct.net/poster/04112026/3ca4374d65.jpg,https://javct.net/v/mazo-026-rm,72,2026-05-18
JUY-935-RM,"My Last Summer Break, Private Lessons With My Favorite Female Teacher In A Sweaty Classroom - Ayaka Makimura [Uncensored L**ked]",https://pic.javct.net/poster/20212011/1641085593.jpg,https://javct.net/v/juy-935-rm,120,2026-05-18
GVG-770-RM,A Sexy Weather Girl And Naughty Brats. Akari Mitani [Uncensored L**ked],https://pic.javct.net/poster/20212011/1643623940.jpg,https://javct.net/v/gvg-770-rm,137,2026-05-18
JUE-007-RM,"Showa. Female Medic Goes Out Looking For Her Lover On The Battlefield. A Sad And Ephemeral Wartime Story About Ongoing Struggles, Sex With Those In Power, Fucking A Father In Law. Ai Mukai. [Uncensored L**ked]",https://pic.javct.net/poster/20221202/1647760447.jpg,https://javct.net/v/jue-007-rm,120,2026-05-18
HDKA-246-RM,Nude Maid. Nude Maid Referral Office. Ena Satsuki [Uncensored L**ked],https://pic.javct.net/poster/20212011/1638335334.jpg,https://javct.net/v/hdka-246-rm,120,2026-05-18
JUL-489-RM,"A Madonna Label Exclusive Kana Mito She's Lifting Her Lesbian Ban!! While On A Business Trip, To Her Surprise, She Was Booked Into The Same Room At The Business Hotel With Her Cute Colleague, Whom She Discovered, To Her Further Surprise, That She Was A Lesbian. [Uncensored L**ked]",https://pic.javct.net/poster/20212709/1636394681.jpg,https://javct.net/v/jul-489-rm,166,2026-05-18
JUL-537-RM,On A Two Night Three Day Trip I Was Ordered To Stay In The Hotel And Ended Up Seducing The Hot Receptionist... Aoi Mukai [Uncensored L**ked],https://static.javct.net/poster/jul-537.jpg,https://javct.net/v/jul-537-rm,119,2026-05-18
JUY-917-RM,"I Got A New Job, And Now I'm The Fresh Face In The Office, And My Lady Boss Is Always Toying With Me During Work Hours Yuka Oshima [Uncensored L**ked]",https://pic.javct.net/poster/20221904/1652889883.jpg,https://javct.net/v/juy-917-rm,119,2026-05-18
JUY-932-RM,Do You Have A Thing For Older Women? My Female Boss Is Dripping With Sex Appeal At Our Secret Rendezvous Yuko Shiraki [Uncensored L**ked],https://pic.javct.net/poster/20221202/1645520332.jpg,https://javct.net/v/juy-932-rm,120,2026-05-18
JUY-861-RM,I'm The New Guy At Work And My Female Boss Keeps Toying With Me During Work Eriko Miura [Uncensored L**ked],https://pic.javct.net/poster/20221202/1646702161.jpg,https://javct.net/v/juy-861-rm,120,2026-05-18
PFES-029-SUB,The Wet Pantyhose Of The Cooking Expert. Honoka Tsuji [English Subtitle],https://pic.javct.net/poster/20221202/1648190355.jpg,https://javct.net/v/pfes-029-sub,133,2026-05-18
JUL-659-RM,"31 After A Long String Of Work Days, Office Sex That Destroys Reason. Men And Women On The Brink While Working For An Exploitative Company. Marika Kobayashi. [Uncensored L**ked]",https://static.javct.net/poster/jul-659.jpg,https://javct.net/v/jul-659-rm,120,2026-05-18
SCD-198-RM,She's Good At Getting Fucked A Bus Tour Guide In A Miniskirt Arisa Hanyu [Uncensored L**ked],https://pic.javct.net/poster/20212709/1634400573.jpg,https://javct.net/v/scd-198-rm,122,2026-05-18
SPRD-1027-RM,Voluptuous Married Librarian Azusa Yagi [Uncensored L**ked],https://pic.javct.net/poster/20221108/1663689205.jpg,https://javct.net/v/sprd-1027-rm,105,2026-05-18
JUX-854-RM,Married 32-Year-Old Real Life Swimming Instructor At A Famous Fitness Gym's Porn Debut! Tomomi Satonaka [Uncensored L**ked],https://pic.javct.net/poster/20220406/1654583306.jpg,https://javct.net/v/jux-854-rm,119,2026-05-18
JUFD-380-RM,Loads of Glamorous Sticky Juice -A Lady Dripping With Pheromones- Aoi Aoyama [Uncensored L**ked],https://pic.javct.net/poster/20220707/1658245459.jpg,https://javct.net/v/jufd-380-rm,175,2026-05-18
CRC-075-RM,"I Read On The Bulletin Boards About A Business Hotel With A Big Titty Guest Services Clerk In Glasses So I Made A Reservation. It Was True You Could Clearly Tell She Had Colossal Tits Underneath Her Clothes And In My Room The Bed... I Thought I Would Only Get To Look At Her, But Then Those Glasses, Those Big Tits...! Big Titty Guest Services Clerk In Glasses Makes A Blunder! Rie Tachikawa . [Uncensored L**ked]",https://pic.javct.net/poster/20220707/1658429622.jpg,https://javct.net/v/crc-075-rm,118,2026-05-18
LULU-137-RM,This Big Tits Nursery School Teacher Is Unleashing All Of Her Baby Talk Sk**ls To Get The Guardian Of One Of Her Students Rock Hard And Erect Through Baby Dirty Talk And Giving Him A Sweet And Spoiled Titty Fuck Ejaculation Miu Arioka [Uncensored L**ked],https://pic.javct.net/poster/20221904/1651296625.jpg,https://javct.net/v/lulu-137-rm,160,2026-05-18
IESP-431-RM,The Narcotics Investigation Squad Addicted Pussy Spasms [Uncensored L**ked],https://pic.javct.net/poster/20221904/1652746828.jpg,https://javct.net/v/iesp-431-rm,121,2026-05-18
JUFD-335-RM,Kinky Housemother's Giant Ass Cum Control Fujiko Minegishi [Uncensored L**ked],https://pic.javct.net/poster/20220707/1658017814.jpg,https://javct.net/v/jufd-335-rm,148,2026-05-18
LULU-079-RM,"This Beautiful Wedding Planner Gave The Groom A Deep Throat 3D Blowjob That He Could Never Get From His Wife, And Showed Off Her Amazing Technique In A Display Of Her Powerful Cum Swallowing Semen-Sucking SK**ls Yumi Saeki [Uncensored L**ked]",https://static.javct.net/poster/lulu-079.jpg,https://javct.net/v/lulu-079-rm,160,2026-05-18
JUL-437-RM,"A Married Woman Cleaning Lady And A New Employee Are Engaged In A May-December Adultery Affair, Seeped In Lust And Desire. Yuko Shiraki [Uncensored L**ked]",https://pic.javct.net/poster/20212011/1638097574.jpg,https://javct.net/v/jul-437-rm,119,2026-05-18
CLUB-644-RM,Start To Finish Video Of Fucking My Female Boss Raw Over And Over All Night After Accidentally Being Put In The Same Hotel Room As Her [Uncensored L**ked],https://static.javct.net/poster/club-644.jpg,https://javct.net/v/club-644-rm,122,2026-05-18
