code,title,image_url,page_url,views,date_scraped
JJPP-016,DVD That Twink Has To Voyeur How To Bring In SEX In Tsurekon The MILF In The Room. 16 To Forcibly Was I Have To Cum As It Is ~ Yosoji Boyne Hen,https://pic.javct.net/poster/05192026/0a89ca7ec0.jpg,https://javct.net/v/jjpp-016,130,2026-05-24
JJPP-008,DVD You Voyeur How To Bring In SEX Twink Is In The Room Tsurekon Milf. - It Became More Cum Intact 8 To Brute Force,https://pic.javct.net/poster/05192026/f2bc1ea94a.jpg,https://javct.net/v/jjpp-008,140,2026-05-24
IBW-555Z-RM,Remains Of Sunburn Marks Paipanro ● Pies Over Data Girl To**ure Main Dish Trinh [Uncensored L**ked],https://pic.javct.net/poster/20240807/1722986963.jpg,https://javct.net/v/ibw-555z-rm,190,2026-05-24
CLUB-832-RM,Pursuit Piston Massage Specialized In Major Airlines Targeting Only Beautiful Legged Cabin Attendants 8 [Uncensored L**ked],https://pic.javct.net/poster/20241902/1709266384.jpg,https://javct.net/v/club-832-rm,230,2026-05-24
HUNTA-626,"The Room Is Too Hot And Full Erection To The Friend Of The Sister Who Became Super Light Clothes!My Sister Came Home With My Friend On Summer Vacation, But The Air Conditioner In My Room Was Broken And I Was In The Greenhouse!Because The Fan's Wind Doesn't Cool At All And Keeps Sweaty, I'm Taking Off My Jacket, Putting On A Skirt And Putting On A Pantyhose, Nipples Chilling!Seeing Such A Figure ...",https://pic.javct.net/poster/05192026/b4f84d9fa2.jpg,https://javct.net/v/hunta-626,240,2026-05-24
JJPP-003,DVD You Voyeur How To Bring In SEX Twink Is In The Room Tsurekon Milf. - That I Have To Cum Intact 3 To Forcibly,https://pic.javct.net/poster/05192026/d031b036bb.jpg,https://javct.net/v/jjpp-003,135,2026-05-24
JJPP-004,DVD You Voyeur How To Bring In SEX Twink Is In The Room Tsurekon Milf. - That I Have To Cum Intact 4 To Forcibly,https://pic.javct.net/poster/05192026/5f3303cd2e.jpg,https://javct.net/v/jjpp-004,120,2026-05-24
IBW-529Z-RM,Pies Remains Of Sunburn Trace Paipanro ● Over Data Girl To**ure Rinato Asami [Uncensored L**ked],https://pic.javct.net/poster/05192026/68511a2cfd.jpg,https://javct.net/v/ibw-529z-rm,160,2026-05-24
IBW-554Z-RM,Russia By The Ballet Instructor ● Over Data Girl Obscenity Voyeur Video [Uncensored L**ked],https://pic.javct.net/poster/05192026/8b89af2975.jpg,https://javct.net/v/ibw-554z-rm,160,2026-05-24
CLUB-051-RM,Futakotamagawa Big Celebrity Wife Pelvis Correction Oil Chiropractic [Uncensored L**ked],https://pic.javct.net/poster/05192026/0015744583.jpg,https://javct.net/v/club-051-rm,230,2026-05-24
XVSR-177-RM,Life First!Cum Sex Adhesion Document!Ayano Nana [Uncensored L**ked],https://pic.javct.net/poster/01202026/1772159125.jpg,https://javct.net/v/xvsr-177-rm,120,2026-05-24
NKKD-293-RM,Drive Recorder NTR29 In-vehicle Camera Was Watching The Whole Story Of The Netorare [Uncensored L**ked],https://pic.javct.net/poster/20230207/1691127327.jpg,https://javct.net/v/nkkd-293-rm,170,2026-05-24
MILK-182-RM,Voyeurism Perverted House Invasion Crimson R**e A Neat And Clean Beautiful Wife Is A Meat Urinal Iki Crazy Absolute Obedience Sexual Intercourse Mochizuki Ayaka [Uncensored L**ked],https://pic.javct.net/poster/20230207/1691034206.jpg,https://javct.net/v/milk-182-rm,132,2026-05-24
CLUB-684-RM,"When I Was Watching AV At A Loud Volume, A Beautiful Wife Next Door Came To Complain, So I Was Lustful To Show Off A Full Erection Decachin, So I Told My Wife's Cum Voice To My Husband Who Is Answering Machine 9 [Uncensored L**ked]",https://pic.javct.net/poster/20220406/1656657927.jpg,https://javct.net/v/club-684-rm,230,2026-05-24
NUBI-077-RM,Business Trip Men's Esthetic Behind Op Hidden Shooting 7 Raw Blow Production Service Without Telling The Store Manager [Uncensored L**ked],https://pic.javct.net/poster/20230207/1690774052.jpg,https://javct.net/v/nubi-077-rm,115,2026-05-24
MIST-216,Amateur Wife Deriher Dispatched Complete Voyeur,https://pic.javct.net/poster/04112026/1f5077f69b.jpg,https://javct.net/v/mist-216,155,2026-05-24
CLUB-810-RM,Junior OL (Under Sales Training) On The Road Is Gonna Drink And Abduct R**e <Female Body Observation / Unconscious Blowjob / Unlimited Creampie / Aphrodisiac Injection 3P > [Uncensored L**ked],https://pic.javct.net/poster/20230207/1690516970.jpg,https://javct.net/v/club-810-rm,150,2026-05-24
300MIUM-1375-RM,"Fresh smile, slutty throat [snappy healthy body] [slutty like an angel] ""I can't muster up the courage...Steru'' A beautiful girl with a dazzling smile, but her curly eyes from earlier are so sloppy that it seems like a lie The look in the female's eyes says, ""You can't insert it...I mean, it's okay to insert it..."" It's illegal to insert it because it's a violation of the law. The image of her frantically pistoning in the cowgirl position is a completely different person. The gap is too erotic. :file.40 [Uncensored L**ked]",https://pic.javct.net/poster/04112026/00561854e2.jpg,https://javct.net/v/300mium-1375-rm,119,2026-05-24
NHDTB-805-RM,Stalking Pervert Sentence [Uncensored L**ked],https://pic.javct.net/poster/20230804/1691639258.jpg,https://javct.net/v/nhdtb-805-rm,240,2026-05-24
300MIUM-1375,"Fresh smile, slutty throat [snappy healthy body] [slutty like an angel] ""I can't muster up the courage...Steru'' A beautiful girl with a dazzling smile, but her curly eyes from earlier are so sloppy that it seems like a lie The look in the female's eyes says, ""You can't insert it...I mean, it's okay to insert it..."" It's illegal to insert it because it's a violation of the law. The image of her frantically pistoning in the cowgirl position is a completely different person. The gap is too erotic. :file.40",https://pic.javct.net/poster/04112026/00561854e2.jpg,https://javct.net/v/300mium-1375,119,2026-05-24
NUBI-078-RM,Business Trip Men's Esthetic Behind Op Hidden Shooting 8 Raw Blow Production Service Secretly From The Store Manager [Uncensored L**ked],https://pic.javct.net/poster/20230804/1693283103.jpg,https://javct.net/v/nubi-078-rm,125,2026-05-24
T28-483,Record The Video That Was Taken Hid Her Cosplayers,https://pic.javct.net/poster/04112026/a3e0a2d734.jpg,https://javct.net/v/t28-483,150,2026-05-24
OFTR-008-RM,"Amateur Male And Female Monitoring AV: Two Strangers, A Man And A Woman, Alone In A Closed Room! A Series Of 5 Increasingly Extreme Stages! Intense! Deep Kissing! Will The Two, Who Have Kissed Repeatedly, Be Able To Contain Their Excitement And End Up Having Sex?! [Uncensored L**ked]",https://pic.javct.net/poster/04112026/f4f313c441.jpg,https://javct.net/v/oftr-008-rm,333,2026-05-24
NNPJ-311-RM,Genuine Idle 'Shiku - Kutton' Popular No.1 Ririka 's Cum Inside SEX Steal Movie I Released The AV As It Was. Nampa JAPAN EXPRESS Vol.87 [Uncensored L**ked],https://pic.javct.net/poster/04112026/6485527130.jpg,https://javct.net/v/nnpj-311-rm,120,2026-05-24
