code,title,image_url,page_url,views,date_scraped
NKKD-293-RM,Drive Recorder NTR29 In-vehicle Camera Was Watching The Whole Story Of The Netorare [Uncensored L**ked],https://pic.javct.net/poster/20230207/1691127327.jpg,https://javct.net/v/nkkd-293-rm,170,2026-05-21
MILK-182-RM,Voyeurism Perverted House Invasion Crimson R**e A Neat And Clean Beautiful Wife Is A Meat Urinal Iki Crazy Absolute Obedience Sexual Intercourse Mochizuki Ayaka [Uncensored L**ked],https://pic.javct.net/poster/20230207/1691034206.jpg,https://javct.net/v/milk-182-rm,132,2026-05-21
CLUB-684-RM,"When I Was Watching AV At A Loud Volume, A Beautiful Wife Next Door Came To Complain, So I Was Lustful To Show Off A Full Erection Decachin, So I Told My Wife's Cum Voice To My Husband Who Is Answering Machine 9 [Uncensored L**ked]",https://pic.javct.net/poster/20220406/1656657927.jpg,https://javct.net/v/club-684-rm,230,2026-05-21
NUBI-077-RM,Business Trip Men's Esthetic Behind Op Hidden Shooting 7 Raw Blow Production Service Without Telling The Store Manager [Uncensored L**ked],https://pic.javct.net/poster/20230207/1690774052.jpg,https://javct.net/v/nubi-077-rm,115,2026-05-21
MIST-216,Amateur Wife Deriher Dispatched Complete Voyeur,https://pic.javct.net/poster/04112026/1f5077f69b.jpg,https://javct.net/v/mist-216,155,2026-05-21
CLUB-810-RM,Junior OL (Under Sales Training) On The Road Is Gonna Drink And Abduct R**e <Female Body Observation / Unconscious Blowjob / Unlimited Creampie / Aphrodisiac Injection 3P > [Uncensored L**ked],https://pic.javct.net/poster/20230207/1690516970.jpg,https://javct.net/v/club-810-rm,150,2026-05-21
300MIUM-1375-RM,"Fresh smile, slutty throat [snappy healthy body] [slutty like an angel] ""I can't muster up the courage...Steru'' A beautiful girl with a dazzling smile, but her curly eyes from earlier are so sloppy that it seems like a lie The look in the female's eyes says, ""You can't insert it...I mean, it's okay to insert it..."" It's illegal to insert it because it's a violation of the law. The image of her frantically pistoning in the cowgirl position is a completely different person. The gap is too erotic. :file.40 [Uncensored L**ked]",https://pic.javct.net/poster/04112026/00561854e2.jpg,https://javct.net/v/300mium-1375-rm,119,2026-05-21
NHDTB-805-RM,Stalking Pervert Sentence [Uncensored L**ked],https://pic.javct.net/poster/20230804/1691639258.jpg,https://javct.net/v/nhdtb-805-rm,240,2026-05-21
300MIUM-1375,"Fresh smile, slutty throat [snappy healthy body] [slutty like an angel] ""I can't muster up the courage...Steru'' A beautiful girl with a dazzling smile, but her curly eyes from earlier are so sloppy that it seems like a lie The look in the female's eyes says, ""You can't insert it...I mean, it's okay to insert it..."" It's illegal to insert it because it's a violation of the law. The image of her frantically pistoning in the cowgirl position is a completely different person. The gap is too erotic. :file.40",https://pic.javct.net/poster/04112026/00561854e2.jpg,https://javct.net/v/300mium-1375,119,2026-05-21
NUBI-078-RM,Business Trip Men's Esthetic Behind Op Hidden Shooting 8 Raw Blow Production Service Secretly From The Store Manager [Uncensored L**ked],https://pic.javct.net/poster/20230804/1693283103.jpg,https://javct.net/v/nubi-078-rm,125,2026-05-21
T28-483,Record The Video That Was Taken Hid Her Cosplayers,https://pic.javct.net/poster/04112026/a3e0a2d734.jpg,https://javct.net/v/t28-483,150,2026-05-21
OFTR-008-RM,"Amateur Male And Female Monitoring AV: Two Strangers, A Man And A Woman, Alone In A Closed Room! A Series Of 5 Increasingly Extreme Stages! Intense! Deep Kissing! Will The Two, Who Have Kissed Repeatedly, Be Able To Contain Their Excitement And End Up Having Sex?! [Uncensored L**ked]",https://pic.javct.net/poster/04112026/f4f313c441.jpg,https://javct.net/v/oftr-008-rm,333,2026-05-21
NNPJ-311-RM,Genuine Idle 'Shiku - Kutton' Popular No.1 Ririka 's Cum Inside SEX Steal Movie I Released The AV As It Was. Nampa JAPAN EXPRESS Vol.87 [Uncensored L**ked],https://pic.javct.net/poster/04112026/6485527130.jpg,https://javct.net/v/nnpj-311-rm,120,2026-05-21
483DAM-065-RM,[Kimees] Black Gal K-san [Massage] [Uncensored L**ked],https://pic.javct.net/poster/04112026/6308140363.jpg,https://javct.net/v/483dam-065-rm,42,2026-05-21
BDSR-052,Truth Of Urban Legends Erotic Shock! Part Of The Rumor Scene Look At The Video And The Video Scoop Was Really Juicy Story Outflow ~ ~,https://pic.javct.net/poster/04112026/a64ce7f434.jpg,https://javct.net/v/bdsr-052,120,2026-05-21
483DAM-065,[Kimees] Black Gal K-san [Massage],https://pic.javct.net/poster/04112026/6308140363.jpg,https://javct.net/v/483dam-065,42,2026-05-21
RDT-274-RM,And Are Fascinated To Change Of Clothes Appearance Of Busty Beauties Peek Through The Window Of The Opposite Of The Room ... 3 [Uncensored L**ked],https://pic.javct.net/poster/20253001/1739979175.jpg,https://javct.net/v/rdt-274-rm,130,2026-05-21
KAM-142-RM,Excellent Effect On Bust Up! ? Relentless Breast Rubbing Nipple To**ure Business Trip Sex Detox Esthetics Shrimp Warp Climax Sensitivity Exceptional Frustration Tamaki Celebrity Lady Mizuhara Misono [Uncensored L**ked],https://pic.javct.net/poster/20230804/1691730668.jpg,https://javct.net/v/kam-142-rm,120,2026-05-21
T28-375-RM,"I Was Tosa And Theft Peeing, If I Put Up Is To Drink A Peeing Girls - Diuretics, Sato ~ Airi That Has Been Cum Tannins Until Graduation [Uncensored L**ked]",https://pic.javct.net/poster/06032026/1772953593.jpg,https://javct.net/v/t28-375-rm,180,2026-05-21
STAR-974-RM,"Makoto Sakura If You Are Hit By A Junior Part-time Job In The College Era, What Will You Do? [Uncensored L**ked]",https://pic.javct.net/poster/20231711/1702722651.jpg,https://javct.net/v/star-974-rm,200,2026-05-21
JJPP-200,A DVD Secretly Filmed Showing A Handsome Man Luring A Married Woman Into His Room And Having Sex With Her. 024 - He Forcefully Ejaculated Inside Her.,https://pic.javct.net/poster/04112026/8995a9ae9a.jpg,https://javct.net/v/jjpp-200,260,2026-05-21
DOCD-088-RM,Secretly Filmed Right Next To Her Boyfriend!! Lover NTR Esthetics Vol.2 [Uncensored L**ked],https://pic.javct.net/poster/04112026/f7c694143c.jpg,https://javct.net/v/docd-088-rm,267,2026-05-21
BDSR-116-RM,I Have Served In The Esthetician Married Men Este Voyeur Trip. 2 [Uncensored L**ked],https://pic.javct.net/poster/04112026/16183323c0.jpg,https://javct.net/v/bdsr-116-rm,120,2026-05-21
KSDO-006-RM,This Massage Oil Is Squirting Rezuesute Two Erogenous A Female Ejaculation [Uncensored L**ked],https://pic.javct.net/poster/04112026/6067ee667d.jpg,https://javct.net/v/ksdo-006-rm,200,2026-05-21
