code,title,image_url,page_url,views,date_scraped
JJDD-008-RM,An Aunt Housekeeper Who Can't Say No To Creampie Sex If A Younger Boy Asks Her 08 Take Advantage Of Kindness To Assault Raw Saddle Documentary [Uncensored L**ked],https://pic.javct.net/poster/20230804/1693544573.jpg,https://javct.net/v/jjdd-008-rm,125,2026-05-06
T28-365-RM,Broad Daylight R**e Field That Was Aimed At The Mountain Girl Who Came To Climbing [Uncensored L**ked],https://pic.javct.net/poster/20230206/1686735616.jpg,https://javct.net/v/t28-365-rm,90,2026-05-06
GEBB-040-RM,Amateurs Who Applied To Try On Sexy Swimsuits As Monitors For A High-paying Part-time Job Advertised On Ta○mi○ Ended Up Losing Consciousness After Being Subjected To A Numbing Cream... [Uncensored L**ked],https://pic.javct.net/poster/04112026/8870bbda09.jpg,https://javct.net/v/gebb-040-rm,142,2026-05-06
HRSM-082-RM,"Sexual Harassment Bone Setting Clinic 2 Four Girls In Business Suits With Hidden Big Breasts Who Are Job Hunting. When They Take It Off, They Have Great Style! Sexual Harassment Massage → Raw Stabbing! [Uncensored L**ked]",https://pic.javct.net/poster/20242012/1737650523.jpg,https://javct.net/v/hrsm-082-rm,163,2026-05-06
CLUB-812-RM,A Major Airline Specialty Pursuing Piston Massage 4 That Aims Only For Beautiful Legs Cabin Attendants [Uncensored L**ked],https://pic.javct.net/poster/20230206/1688097605.jpg,https://javct.net/v/club-812-rm,230,2026-05-06
HRSM-001-RM,Athlete Hunter Physical Observation And Insertion Inside The Stadium Bukkake Chikan [Uncensored L**ked],https://pic.javct.net/poster/20230908/1694177662.jpg,https://javct.net/v/hrsm-001-rm,219,2026-05-06
JJDD-007-RM,An Aunt Housekeeper Who Can't Say No To Creampie Sex If A Younger Boy Asks Her 07 Taking Advantage Of Kindness To Assault Raw Saddle Documentary [Uncensored L**ked],https://pic.javct.net/poster/20230804/1693544635.jpg,https://javct.net/v/jjdd-007-rm,125,2026-05-06
STAR-968-RM,Kiritani Festival Chan Towel One Sheet Do You Not Enter A Man Hot Water?HARD [Uncensored L**ked],https://pic.javct.net/poster/20230804/1691483425.jpg,https://javct.net/v/star-968-rm,180,2026-05-06
JJPP-199,A DVD Of A Handsome Man Secretly Filming Himself Bringing A Married Woman To His Room For Sex. 023 - He Forcefully Creampied Her.,https://pic.javct.net/poster/04112026/201d21e793.jpg,https://javct.net/v/jjpp-199,245,2026-05-06
GEBB-040,Amateurs Who Applied To Try On Sexy Swimsuits As Monitors For A High-paying Part-time Job Advertised On Ta○mi○ Ended Up Losing Consciousness After Being Subjected To A Numbing Cream...,https://pic.javct.net/poster/04112026/8870bbda09.jpg,https://javct.net/v/gebb-040,142,2026-05-06
MEYD-990-SUB,Couple Beauty Salon Voyeur NTR I Was Made To Climax While My Boyfriend Was Sleeping Next To Me. (Lesbian Play Included) [English Subtitle],https://pic.javct.net/poster/20250903/1744304880.jpg,https://javct.net/v/meyd-990-sub,90,2026-05-06
STSK-091-RM,"""Seriously, Will You Come Again!?""There Is A Girl Who Can Do It J0 Reflation Production Voyeurism Forbidden Acts If You Find Out 4 Shy Angels [Uncensored L**ked]",https://pic.javct.net/poster/20230804/1694058804.jpg,https://javct.net/v/stsk-091-rm,161,2026-05-06
CLUB-916-RM,"Stalking, Voyeurism, Aphrodisiacs, Drug-induced Sex, Awakening, R**e [Uncensored L**ked]",https://pic.javct.net/poster/04112026/15641503ac.jpg,https://javct.net/v/club-916-rm,120,2026-05-06
CLUB-921-RM,First-class Hotel Woman's Elegant Pussy Gets Intensely Piston-fucked And Cummed Inside In A Gangbang Video () [Uncensored L**ked],https://pic.javct.net/poster/04112026/9c06f7582f.jpg,https://javct.net/v/club-921-rm,120,2026-05-06
STOL-091-RM,"When I Was Watching An AV At High Volume, The Beautiful Wife Next Door Came To Complain, And When She Showed Me Her Fully Erect Big Dick, She Got So Horny That I Let Her Husband Listen To Her Orgasm While He Was Home.Compilation Volume 3 [Uncensored L**ked]",https://pic.javct.net/poster/20231011/1698985404.jpg,https://javct.net/v/stol-091-rm,240,2026-05-06
BNDV-00420-RM,Candy 240min. Miho Maejima Volume1 [Uncensored L**ked],https://pic.javct.net/poster/04112026/9836784887.jpg,https://javct.net/v/bndv-00420-rm,240,2026-05-06
300MIUM-1365-RM,"Although she is young, she has a perfect body lol [This eroticism in Hatachi] [Fair-skinned & beautiful big butt] [Kissing demon] ""I like chewing... I like everything"" A 20 year old who is open to naughty things and gets shattered by fingering Kumako's anus is twitching with an electric massager, and in an instant, she turns into a female face, and with a sweet voice, she presses her body together and kisses her deeply. Her face turns bright red and she shakes her hips, which is too erotic. :file.39 [Uncensored L**ked]",https://pic.javct.net/poster/04112026/4b7bf791e0.jpg,https://javct.net/v/300mium-1365-rm,116,2026-05-06
CLUB-907-RM,"Group Bullying And Sexual Assault, Public Display Of Human Toilets In Video [Uncensored L**ked]",https://pic.javct.net/poster/04112026/ddb1413dd4.jpg,https://javct.net/v/club-907-rm,110,2026-05-06
CLUB-912-RM,"Stalker Targeting Women In Yukata, Secretly Filming Them, Drugging Them, Gangbang. [Uncensored L**ked]",https://pic.javct.net/poster/04112026/6d2abead4e.jpg,https://javct.net/v/club-912-rm,110,2026-05-06
CLUB-923-RM,Student Discount Sports Massage: Footage L**ked Of A Lewd Middle-aged Masseur's Heinous Acts Against Female Swimmers - Forcing Them To Wear Revealing Swimsuits With Exposed Pubic Hair And Nipples - Sexual Harassment During Massage - Swimsuit Oil Massage - Blackmail R**e [Uncensored L**ked],https://pic.javct.net/poster/04112026/87c316d89e.jpg,https://javct.net/v/club-923-rm,120,2026-05-06
CLUB-914-RM,"Sleeveless Beautiful Office Lady Stalked, Secretly Filmed, Poisoned, Dr**ged, Fo**ed Sex. [Uncensored L**ked]",https://pic.javct.net/poster/04112026/6f743c7987.jpg,https://javct.net/v/club-914-rm,120,2026-05-06
300MIUM-1365,"Although she is young, she has a perfect body lol [This eroticism in Hatachi] [Fair-skinned & beautiful big butt] [Kissing demon] ""I like chewing... I like everything"" A 20 year old who is open to naughty things and gets shattered by fingering Kumako's anus is twitching with an electric massager, and in an instant, she turns into a female face, and with a sweet voice, she presses her body together and kisses her deeply. Her face turns bright red and she shakes her hips, which is too erotic. :file.39",https://pic.javct.net/poster/04112026/4b7bf791e0.jpg,https://javct.net/v/300mium-1365,116,2026-05-06
T28-457,Cosplay Event Nampa Tsurekomi SEX Hidd** Camera 2 To Amateur Layer Pies Cum Gonzo Face Multiplied By The Voice Unauthorized Sale ~,https://pic.javct.net/poster/04112026/0c462e0c63.jpg,https://javct.net/v/t28-457,150,2026-05-06
NKKD-297-RM,"This Time, My Wife (30) Was Caught By A Part-time Job (20) (virgin) ... → I'm Sorry, So Please Release The AV As It Is. [Uncensored L**ked]",https://pic.javct.net/poster/20230908/1694150094.jpg,https://javct.net/v/nkkd-297-rm,180,2026-05-06
