code,title,size,image_url,torrent_url,tags,actresses,date,page_url
FC2PPV4863385,FC2-PPV-4863385 ※局アナ内定の現/.役JD///神くびれ美巨乳ボディの名家ご/.令/.嬢。危険日お構いなしの生ハメ・生中出しを含む、計3発射を記録した本物ハメ撮り独占映像 #008,3.1 GB,https://contents-thumbnail2.fc2.com/w1280/storage201000.contents.fc2.com/file/407/40606359/1773381407.58.png,https://onejav.com/torrent/fc2ppv4863385/download/85514115/onejav.com_fc2ppv4863385.torrent,"Amateur, Beautiful Girl, Big Tits, Breasts, Creampie, FC2, POV, Shaved",,2026-03-16,https://onejav.com/torrent/fc2ppv4863385
FC2PPV4862384,FC2-PPV-4862384 【独占/個撮】アイドル生まれアイドル育ちの現./役/エステのおねえさん❣美尻×美巨乳の黄金比率ボディ♡敏感な即濡れマンコに子宮直撃の生ハメ性交で濃厚中出し3発射♡【特典:高画質原版】【本編/顔モ.無】,4.1 GB,https://contents-thumbnail2.fc2.com/w1280/storage201000.contents.fc2.com/file/397/39644488/1773228420.57.jpg,https://onejav.com/torrent/fc2ppv4862384/download/90475946/onejav.com_fc2ppv4862384.torrent,"Amateur, Back, Beautiful Girl, Beauty Shop, Big Tits, Blow, Breasts, Butt, Cowgirl, Creampie, FC2, POV, Shaved",,2026-03-16,https://onejav.com/torrent/fc2ppv4862384
FC2PPV4864350,FC2-PPV-4864350 モデル顔負け173㎝♡高身長色白美body♡美尻♡美脚♡才色兼備♡キャビンアテンダント♡ゆうちゃんに大量中出しエッチ♡,6.6 GB,https://contents-thumbnail2.fc2.com/w1280/storage200000.contents.fc2.com/file/373/37250122/1773512009.94.jpg,https://onejav.com/torrent/fc2ppv4864350/download/82543226/onejav.com_fc2ppv4864350.torrent,"Amateur, Beautiful legs, Creampie, FC2, POV",,2026-03-16,https://onejav.com/torrent/fc2ppv4864350
FC2PPV4863961,FC2-PPV-4863961 【音量注意】美容系19《オホ声絶叫》膣奥ガン突き！○従・屈○セックス‼,5.7 GB,https://contents-thumbnail2.fc2.com/w1280/storage201000.contents.fc2.com/file/394/39385099/1773492139.75.png,https://onejav.com/torrent/fc2ppv4863961/download/18235096/onejav.com_fc2ppv4863961.torrent,"Amateur, FC2, POV",,2026-03-16,https://onejav.com/torrent/fc2ppv4863961
PKPD411,円女交際中出しoK18歳 先輩にフラれてヤリ○ン期間中のGカップ水泳部女子 糸井瑠花,5.6 GB,https://pics.dmm.co.jp/mono/movie/adult/pkpd411/pkpd411pl.jpg,https://onejav.com/torrent/pkpd411/download/43229973/onejav.com_pkpd411.torrent,"Beautiful Girl, Big Tits, Breasts, Creampie, POV, Solowork",糸井瑠花,2026-03-16,https://onejav.com/torrent/pkpd411
FC2PPV4863970,FC2-PPV-4863970 ♡3/29日迄半額【無・完全素人・生中出し】春が近づき、発情したおじさんのバキバキちんぽが止まりません！スケベな美しい長身OLさんもぐったりするほどの濃厚SEX！生ハメ・中出しです！,4.2 GB,https://contents-thumbnail2.fc2.com/w1280/storage200000.contents.fc2.com/file/392/39182810/1773494455.82.jpg,https://onejav.com/torrent/fc2ppv4863970/download/55627540/onejav.com_fc2ppv4863970.torrent,"Amateur, Back, Beautiful Girl, Blow, Breasts, Creampie, Cunnilingus, FC2, Lingerie, OL, POV, Slender, Tall, Uncensored",,2026-03-16,https://onejav.com/torrent/fc2ppv4863970
SKMJ727,家族の絆が性欲に負ける！？卒業式直後の父娘が相互エステ密着オイルエステぬるぬる素股体験！？お互いの身体を施術…「お父さん大きくなってる。」父のフル勃起に驚きながらもクリトリスとち○ぽを擦り合わせた親子は理性を保てず欲望のままにヌルっと近親相○ナマ挿入し…,9.1 GB,https://pics.dmm.co.jp/mono/movie/adult/h_1324skmj727/h_1324skmj727pl.jpg,https://onejav.com/torrent/skmj727/download/06295501/onejav.com_skmj727.torrent,"Amateur, BIGセール, Creampie, Incest, Lotion, Massage, Nampa, School Girls, Uniform",,2026-03-16,https://onejav.com/torrent/skmj727
MXGS1422,上司と温泉旅館で一泊二日10連発 終わらないNTR性交旅行 美ノ嶋めぐり,5.2 GB,https://pics.dmm.co.jp/mono/movie/adult/h_068mxgs1422/h_068mxgs1422pl.jpg,https://onejav.com/torrent/mxgs1422/download/13241623/onejav.com_mxgs1422.torrent,"Affair, BIGセール, Hot Spring, Solowork",Meguri Minoshima,2026-03-16,https://onejav.com/torrent/mxgs1422
PTS540,結婚式帰りの友達同士！ 童貞君とSEXの練習してあげてくれませんか？初めての膣キュンっシンデレラ3P筆下ろし！,7.4 GB,https://pics.dmm.co.jp/mono/movie/adult/h_021pts540/h_021pts540pl.jpg,https://onejav.com/torrent/pts540/download/66460054/onejav.com_pts540.torrent,"3P, 4P, Blow, Creampie, Nampa, Older Sister",,2026-03-16,https://onejav.com/torrent/pts540
SKMJ728,美人で巨乳な彼有りの姉と童貞弟が高額賞金かけて野球拳で対決！？「姉ちゃんの裸で興奮するわけないじゃん！」と言いつつ童貞弟バッキバキ勃起ガチ欲情＆お姉ちゃんも弟デカチンに赤面発情（＾＾；）仲良し姉弟筆おろし中出しSP,9.3 GB,https://pics.dmm.co.jp/mono/movie/adult/h_1324skmj728/h_1324skmj728pl.jpg,https://onejav.com/torrent/skmj728/download/48410174/onejav.com_skmj728.torrent,"Amateur, Beautiful Girl, Big Tits, BIGセール, Creampie, Female College Student, Incest, Nampa, Sister, Virgin Man",,2026-03-16,https://onejav.com/torrent/skmj728
