code,title,size,image_url,torrent_url,tags,actresses,date,page_url
FC2PPV4879110,FC2-PPV-4879110 3日間！70OFF【初撮り】20歳の上玉。ポイントは凄くエロい。。。関西弁でスレンダーGカップの最強スペック。【２射精】,5.0 GB,https://contents-thumbnail2.fc2.com/w1280/storage201000.contents.fc2.com/file/385/38454154/1775758325.44.jpg,https://onejav.com/torrent/fc2ppv4879110/download/13466253/onejav.com_fc2ppv4879110.torrent,"Amateur, Big Tits, Creampie, FC2, POV, Uncensored",,2026-04-11,https://onejav.com/torrent/fc2ppv4879110
FC2PPV4879218,FC2-PPV-4879218 【5/1迄1090pt】【初撮】アパレル業界のHカップ美豪乳新卒ムスメ。騎乗位で色白美乳を揺らしながら激しく貫かれ何度も絶頂に達する。「そこはダメ...イクゥ！」剛毛マンコにたっぷり中出し。,4.8 GB,https://contents-thumbnail2.fc2.com/w1280/storage201000.contents.fc2.com/file/370/36940995/1775793525.69.png,https://onejav.com/torrent/fc2ppv4879218/download/44183512/onejav.com_fc2ppv4879218.torrent,"Amateur, Big Tits, Cowgirl, Creampie, FC2, POV, Uncensored",,2026-04-11,https://onejav.com/torrent/fc2ppv4879218
FC2PPV4878804,FC2-PPV-4878804 【無修正】某人気コスプレイヤー・うらら（24）隠されていた素顔がこぼれる,1.9 GB,https://contents-thumbnail2.fc2.com/w1280/storage201000.contents.fc2.com/file/407/40685789/1775723020.73.png,https://onejav.com/torrent/fc2ppv4878804/download/86406868/onejav.com_fc2ppv4878804.torrent,"Amateur, Beautiful Girl, Big Tits, Cosplay, FC2, Uncensored",,2026-04-11,https://onejav.com/torrent/fc2ppv4878804
REAL981,女子校生孕ませレ●プ中出し20連発 胡桃さくら,5.9 GB,https://pics.dmm.co.jp/mono/movie/adult/real981/real981pl.jpg,https://onejav.com/torrent/real981/download/02623424/onejav.com_real981.torrent,"Beautiful Girl, Big Tits, Confinement, Creampie, School Girls, Solowork",胡桃さくら,2026-04-11,https://onejav.com/torrent/real981
FC2PPV4877363,FC2-PPV-4877363 【4/27まで特別価格】狂暴すぎる神乳スタイルと野獣の喘ぎ声で中出しを懇願する癒し系JD,3.7 GB,https://contents-thumbnail2.fc2.com/w1280/storage200000.contents.fc2.com/file/355/35406629/1775562734.97.jpg,https://onejav.com/torrent/fc2ppv4877363/download/93507034/onejav.com_fc2ppv4877363.torrent,"Amateur, Big Tits, Blow, Creampie, FC2, Huge Butt, POV, Squirting, Swimsuit",,2026-04-11,https://onejav.com/torrent/fc2ppv4877363
FC2PPV4873441,,3.9 GB,https://contents-thumbnail2.fc2.com/w1280/storage200000.contents.fc2.com/file/404/40347725/1774954252.1.jpg,https://onejav.com/torrent/fc2ppv4873441/download/98943994/onejav.com_fc2ppv4873441.torrent,,,2026-04-11,https://onejav.com/torrent/fc2ppv4873441
FC2PPV4866048,FC2-PPV-4866048 【7日間限定75％OFF】ビジュ良きデリバリーメンエス嬢のイキ過ぎたサービスで大興奮♡いっぱい中出ししちゃいました。 【無修正・中出し】,5.5 GB,https://contents-thumbnail2.fc2.com/w1280/storage200000.contents.fc2.com/file/381/38031442/1773831068.21.png,https://onejav.com/torrent/fc2ppv4866048/download/53504063/onejav.com_fc2ppv4866048.torrent,"Amateur, Beautiful Girl, Big Tits, Breasts, Butt, Creampie, FC2, POV, Uncensored",,2026-04-11,https://onejav.com/torrent/fc2ppv4866048
NGHJ055,男女の友情は性欲に負ける…！？幼なじみの巨乳彼有り女子と童貞君が全身ぬるべちょオイルエステ素股体験デカパイ幼なじみとのエチエチオイルマッサージ…意識し合う男女！？びちょぬるマ〇コ＆勃起チ〇ポをグチュグチュ擦り合わせる男女はスケベ本能の剥き出しでヌルっと筆,8.6 GB,https://pics.dmm.co.jp/mono/movie/adult/nghj055/nghj055pl.jpg,https://onejav.com/torrent/nghj055/download/79454201/onejav.com_nghj055.torrent,"Amateur, Beauty Shop, Big Tits, Creampie, Virgin Man",,2026-04-11,https://onejav.com/torrent/nghj055
DVAJ736,「無責任に種付けしていいんだよ？」耳元で中出し懇願する愛人の孕ませ淫語ASMRで家庭崩壊寸前なのに不倫マ○コへの危険中出しがやめられない「奥さんに内緒でさくらのマ〇コ孕ませて…」 胡桃さくら,5.1 GB,https://pics.dmm.co.jp/mono/movie/adult/dvaj736/dvaj736pl.jpg,https://onejav.com/torrent/dvaj736/download/45352608/onejav.com_dvaj736.torrent,"Affair, Big Tits, Blow, Conceived, Creampie, Cuckold, Dirty Words, Kiss, Solowork, Subjectivity",胡桃さくら,2026-04-11,https://onejav.com/torrent/dvaj736
GVH835,密着！パイズリ！SEX！男だらけのワケあり大家族で笑いあり射精あり…エロ母ちゃんのパコパコ奮闘SP 波多野結衣,5.6 GB,https://pics.dmm.co.jp/mono/movie/adult/gvh835/gvh835pl.jpg,https://onejav.com/torrent/gvh835/download/91640582/onejav.com_gvh835.torrent,"BBW, Documentary, Incest, Mother, Solowork, Titty Fuck",Yui Hatano,2026-04-11,https://onejav.com/torrent/gvh835
