code,title,size,image_url,torrent_url,tags,actresses,date,page_url
390JNT119,【中出し二連発！】【爆潮絶頂】エロい写真をイ●スタにUPしまくる、話題のインフルエンサーanoanoちゃんが降臨！写真よりも何倍も可愛く、そしてどエロい…！揉み心地最高なおっぱいとプリンとしたデカケツ！！そしてHの時はドMに大豹変！「ぼくおま●こおかしくなっちゃったッ！精液でいっぱいにしてぇ」ドスべおねだりしながら、何度も何度も潮吹いてイキまくり！！！！,4.6 GB,https://image.mgstage.com/images/jackson/390jnt/119/pb_e_390jnt-119.jpg,https://onejav.com/torrent/390jnt119/download/60184102/onejav.com_390jnt119.torrent,"Amateur, Big Tits, Creampie, Deep Throating, Masturbation, Squirting",anoano,2026-05-11,https://onejav.com/torrent/390jnt119
FC2PPV4898346,FC2-PPV-4898346 【無】【初撮り】美容看護師 「もう挿れて..」クールな性格が快楽に溺れ豹変！最後は子宮の奥にいっぱい出して..!!【本編約１時間４０分】【完全顔出しフェラ(口内射精)特典あり】,3.9 GB,https://contents-thumbnail2.fc2.com/w1280/storage200000.contents.fc2.com/file/410/40970911/1778325689.13.png,https://onejav.com/torrent/fc2ppv4898346/download/39085456/onejav.com_fc2ppv4898346.torrent,"Amateur, FC2",,2026-05-11,https://onejav.com/torrent/fc2ppv4898346
FC2PPV4898440,FC2-PPV-4898440 ※これで最後【顔出し】芋の原石のGカップ地方高〇/生。卒業前の制服姿に顔射2回中出しの計４回発射で締めくくる。。,7.3 GB,https://contents-thumbnail2.fc2.com/w1280/storage200000.contents.fc2.com/file/404/40364366/1778411948.03.jpg,https://onejav.com/torrent/fc2ppv4898440/download/50312541/onejav.com_fc2ppv4898440.torrent,"Amateur, Cosplay, Creampie, Facials, FC2, POV, Uncensored, Uniform",,2026-05-11,https://onejav.com/torrent/fc2ppv4898440
FC2PPV4898377,FC2-PPV-4898377 すみれ(18)最高にかわいいこの２回目撮影別画角動画。中出し、電マオナニー、アナル貫通ATM、ピストンマシンをして、最後コスプレさせて中出ししています,12.5 GB,https://contents-thumbnail2.fc2.com/w1280/storage200000.contents.fc2.com/file/261/26076760/1778332894.1.jpg,https://onejav.com/torrent/fc2ppv4898377/download/82354797/onejav.com_fc2ppv4898377.torrent,"Amateur, Anal, Beautiful Girl, Blow, Cosplay, Cowgirl, Creampie, Deep Throating, Electric Massager, FC2, Masturbation, Petite, Uncensored",,2026-05-11,https://onejav.com/torrent/fc2ppv4898377
FC2PPV4897080,FC2-PPV-4897080 【無】日本男児vs金髪女子 現地で部屋を借りたらポリスが来て疑われたけど、お尻に興奮して思わず入れちゃいました(;'∀') レビューで高画質ＺＩＰ付き 釣り人,2.7 GB,https://contents-thumbnail2.fc2.com/w1280/storage201000.contents.fc2.com/file/358/35743745/1778142779.95.jpg,https://onejav.com/torrent/fc2ppv4897080/download/82572944/onejav.com_fc2ppv4897080.torrent,"Amateur, FC2",,2026-05-11,https://onejav.com/torrent/fc2ppv4897080
FC2PPV4898784,FC2-PPV-4898784 駅前の書店でアルバイトをしている超剛毛女子大生に巨根で中に注がれる濃厚ザーメン！！,3.7 GB,https://contents-thumbnail2.fc2.com/w1280/storage200000.contents.fc2.com/file/399/39880699/1778390709.44.png,https://onejav.com/torrent/fc2ppv4898784/download/96199707/onejav.com_fc2ppv4898784.torrent,"Amateur, FC2",,2026-05-11,https://onejav.com/torrent/fc2ppv4898784
FC2PPV4898645,FC2-PPV-4898645 【5/25まで特別価格】Gカップの言いなりドM美女との同棲生活。おっぱいでしか得られない栄養で仕事を頑張る日々。,5.1 GB,https://contents-thumbnail2.fc2.com/w1280/storage200000.contents.fc2.com/file/355/35406629/1778367292.58.jpg,https://onejav.com/torrent/fc2ppv4898645/download/62897740/onejav.com_fc2ppv4898645.torrent,"Amateur, Big Tits, Black Hair, Blow, Bukkake, Creampie, Cum, Facials, FC2, POV, Titty Fuck",,2026-05-11,https://onejav.com/torrent/fc2ppv4898645
FC2PPV4898292,FC2-PPV-4898292 【素人ハメ撮り#037】アイドル級な可愛さの「みなみちゃん」。推しに恋する19歳と奇跡の初撮影。中出し2回戦。【レビュー特典あり】,6.0 GB,https://contents-thumbnail2.fc2.com/w1280/storage200000.contents.fc2.com/file/388/38732582/1778317598.13.jpg,https://onejav.com/torrent/fc2ppv4898292/download/92138336/onejav.com_fc2ppv4898292.torrent,"Amateur, Blow, Breasts, Creampie, Cunnilingus, Electric Massager, FC2, POV, Vibe",,2026-05-11,https://onejav.com/torrent/fc2ppv4898292
SIRO5670,施術より私を責めて...清楚な整体師が桃尻揺らして憧れの男優チ○ポでイキまくる！ 【初撮り】ネットでAV応募→AV体験撮影 2554,2.9 GB,https://image.mgstage.com/images/shirouto/siro/5670/pb_e_siro-5670.jpg,https://onejav.com/torrent/siro5670/download/65005881/onejav.com_siro5670.torrent,"Amateur, Beautiful legs, Debut Production, POV",,2026-05-11,https://onejav.com/torrent/siro5670
FC2PPV4898644,FC2-PPV-4898644 ※18日まで初回限定65％OFF※【顔出し・Hカップ巨乳熟女2ハメ撮り編】Hカップ巨乳乳輪でかめの人妻。仕事はインターナショナルスクール事務という肩書を持つ人妻とのハメ撮りになります。,4.0 GB,https://contents-thumbnail2.fc2.com/w1280/storage201000.contents.fc2.com/file/377/37682362/1778365734.75.jpg,https://onejav.com/torrent/fc2ppv4898644/download/60720138/onejav.com_fc2ppv4898644.torrent,"Affair, Amateur, Big Tits, Blow, Creampie, FC2, Married Woman, Mature Woman, POV, Shaved",,2026-05-11,https://onejav.com/torrent/fc2ppv4898644
