code,title,size,image_url,torrent_url,tags,actresses,date,page_url
300MIUM1328,顔に似合わずエッロいカラダw【デカパイ肉尻ドM】「ハリウッドスターに会えちゃうんですよっ！」あどけない顔のクセしてムチムチのデカパイにエロい腰つき。しょうもない話で騙し取ろうとしてきたのでここは容赦無くスパンキング激イラマ祭りww拒むそぶりを見せつつも漏れる声、デニム越しにま●こ爆濡れ。ハメてもブッシャアア。ゴリゴリの鬼ピスでデカ乳揺らしながら乱れイキしまくるただのドMでしたww ：case.58,2.5 GB,https://image.mgstage.com/images/prestigepremium/300mium/1328/pb_e_300mium-1328.jpg,https://onejav.com/torrent/300mium1328/download/31292934/onejav.com_300mium1328.torrent,"Amateur, Big Tits, Breasts, Electric Massager, Huge Butt, POV, Squirting",,2026-02-14,https://onejav.com/torrent/300mium1328
FC2PPV4848059,FC2-PPV-4848059 【3/6迄1290pt】モデル体型Fカップみずきちゃん。遠隔バイブ装着し街へ！「やめてほしい...」と言いながらも痙攣しまくって調教され、発情濡れマンコに熱いザーメンを注ぎ込む,4.1 GB,https://contents-thumbnail2.fc2.com/w1280/storage200000.contents.fc2.com/file/370/36940995/1770885479.96.png,https://onejav.com/torrent/fc2ppv4848059/download/93705991/onejav.com_fc2ppv4848059.torrent,"Amateur, Blow, Breasts, Creampie, FC2, Model, Uncensored",,2026-02-14,https://onejav.com/torrent/fc2ppv4848059
SIRO5595,美ボディを持つ現役女子大生が登場！弱点の乳首を責められて感じてる姿がエロい！バックのしがいあるお尻に何度も何度も打ち付けるピストンがどんどん激しくなり何度もイキまくる！ 【初撮り】ネットでAV応募→AV体験撮影 2508,2.5 GB,https://image.mgstage.com/images/shirouto/siro/5595/pb_e_siro-5595.jpg,https://onejav.com/torrent/siro5595/download/38443141/onejav.com_siro5595.torrent,"Amateur, Beautiful legs, Big Tits, Debut Production, POV, Slender",,2026-02-14,https://onejav.com/torrent/siro5595
FC2PPV4848222,FC2-PPV-4848222 最強美女がオナホに！【無】【中出し】仕事終わりに会いに来てくれたアイドル顔の美女。世界一可愛いフェラ顔、そして変顔まで(笑)中出しに体力を使った事後は焼き肉デート♡※特典あり,2.2 GB,https://contents-thumbnail2.fc2.com/w1280/storage200000.contents.fc2.com/file/393/39207373/1770899770.17.jpg,https://onejav.com/torrent/fc2ppv4848222/download/93974344/onejav.com_fc2ppv4848222.torrent,"Amateur, Beautiful Girl, Blow, Creampie, FC2, POV, Uncensored",,2026-02-14,https://onejav.com/torrent/fc2ppv4848222
SOON011,,5.5 GB,https://pics.dmm.co.jp/mono/movie/adult/soon011/soon011pl.jpg,https://onejav.com/torrent/soon011/download/35230026/onejav.com_soon011.torrent,,,2026-02-14,https://onejav.com/torrent/soon011
FKRU016,クラスの隠キャ女子が実は裏垢女子だった件。エロ自撮り連投する爆乳性欲モンスターだった… 丸最レア,5.3 GB,https://pics.dmm.co.jp/mono/movie/adult/fkru016/fkru016pl.jpg,https://onejav.com/torrent/fkru016/download/38795832/onejav.com_fkru016.torrent,"Big Tits, Busty Fetish, Creampie, School Uniform, Slut, Solowork",丸最レア,2026-02-14,https://onejav.com/torrent/fkru016
FC2PPV4846638,FC2-PPV-4846638 【無】真っ白な色白美肌ボディーの清楚系！形と色が素晴らしく綺麗なおま〇こ披露！おとなしそうに見えてエッチなことは大好き美女！ゴックン中だし　※特典高画質,3.9 GB,https://contents-thumbnail2.fc2.com/w1280/storage201000.contents.fc2.com/file/381/38003297/1770629883.53.jpg,https://onejav.com/torrent/fc2ppv4846638/download/63480524/onejav.com_fc2ppv4846638.torrent,"Amateur, Beautiful Girl, Big Tits, Blow, Creampie, FC2, POV, Uncensored",,2026-02-14,https://onejav.com/torrent/fc2ppv4846638
GVH821,【極上おっぱい×お風呂体験】濡れムチBODY・波多野結衣と密着エッチし放題！脱衣所から始まる3つの物語,6.9 GB,https://pics.dmm.co.jp/mono/movie/adult/gvh821/gvh821pl.jpg,https://onejav.com/torrent/gvh821/download/24385580/onejav.com_gvh821.torrent,"Bath, Big Tits, Cuckold, Huge Butt, Kimono, Yukata, Solowork",Yui Hatano,2026-02-14,https://onejav.com/torrent/gvh821
FNS171,深夜バイト筆おろし 童貞のバキバキデカチンにハマった巨乳バイトちゃんが夜勤中に店内360°アクメセックス！ 浜辺やよい,3.9 GB,https://cdn.faleno.net/top/wp-content/uploads/2026/01/FNS-171_1200.jpg?output-quality=60,https://onejav.com/torrent/fns171/download/24540208/onejav.com_fns171.torrent,,浜辺やよい,2026-02-14,https://onejav.com/torrent/fns171
FC2PPV4847722,FC2-PPV-4847722 3日間！70OFF【複数プレイ】アメリカの衝撃！Kカップ＆巨尻を激しく揺らしながら性欲のままに4人の男を包み込む！合計5射精の性欲パラダイス！,4.9 GB,https://contents-thumbnail2.fc2.com/w1280/storage200000.contents.fc2.com/file/385/38454154/1770834768.03.jpg,https://onejav.com/torrent/fc2ppv4847722/download/96844098/onejav.com_fc2ppv4847722.torrent,"Amateur, Big Tits, Creampie, FC2, Huge Butt, POV, Titty Fuck, Uncensored",,2026-02-14,https://onejav.com/torrent/fc2ppv4847722
