code,title,size,image_url,torrent_url,tags,actresses,date,page_url
EBWH304,「俺の彼女に1，000円で中出ししませんか？w」NTR好きの彼氏に乳まる出し立ちんぼさせられてます… 清宮仁愛,6.7 GB,https://pics.dmm.co.jp/mono/movie/adult/ebwh304/ebwh304pl.jpg,https://onejav.com/torrent/ebwh304/download/85493067/onejav.com_ebwh304.torrent,"Big Tits, Busty Fetish, Creampie, Documentary, Solowork, Titty Fuck",清宮仁愛,2026-03-13,https://onejav.com/torrent/ebwh304
FC2PPV4862565,FC2-PPV-4862565 バスト100㎝の爆乳ナース人妻 ロケットおっぱいに挟まれながら快楽絶頂SEX,5.2 GB,https://contents-thumbnail2.fc2.com/w1280/storage200000.contents.fc2.com/file/297/29683723/1773281076.04.jpg,https://onejav.com/torrent/fc2ppv4862565/download/51588101/onejav.com_fc2ppv4862565.torrent,"Amateur, Big Tits, Breasts, Creampie, FC2, Married Woman, POV",,2026-03-13,https://onejav.com/torrent/fc2ppv4862565
PPPE402,彼女のお姉さんは巨乳と中出しOKで僕を誘惑 役野満里奈,5.0 GB,https://pics.dmm.co.jp/mono/movie/adult/pppe402/pppe402pl.jpg,https://onejav.com/torrent/pppe402/download/10891758/onejav.com_pppe402.torrent,"Big Tits, Blow, Creampie, Slut, Solowork, Titty Fuck",役野満里奈,2026-03-13,https://onejav.com/torrent/pppe402
MIDA568,新人 脱・看護師 Jカップ専属 葉山みりあAV Debut！,6.3 GB,https://pics.dmm.co.jp/mono/movie/adult/mida568/mida568pl.jpg,https://onejav.com/torrent/mida568/download/68419311/onejav.com_mida568.torrent,"3P, 4P, Big Tits, Blow, Debut Production, POV, Solowork",葉山みりあ,2026-03-13,https://onejav.com/torrent/mida568
PRED853,「精子カラっぽになるまでイカせてあげる（ハート）」【甘とろ囁きで脳イキASMR主観】見つめて中出し！快感オナサポ 三好佑香,4.9 GB,https://pics.dmm.co.jp/mono/movie/adult/pred853/pred853pl.jpg,https://onejav.com/torrent/pred853/download/64999794/onejav.com_pred853.torrent,"Blow, Cowgirl, Creampie, Masturbation Support, Slut, Solowork",三好佑香,2026-03-13,https://onejav.com/torrent/pred853
FC2PPV4862845,FC2-PPV-4862845 Tik Tok creator Miss Akane Shirosaki in full nude interview,4.5 GB,https://contents-thumbnail2.fc2.com/w1280/storage200000.contents.fc2.com/file/394/39375031/1773305833.7.png,https://onejav.com/torrent/fc2ppv4862845/download/18280972/onejav.com_fc2ppv4862845.torrent,"Amateur, Back, Blow, Breasts, FC2, Slender, Toy, Uncensored",,2026-03-13,https://onejav.com/torrent/fc2ppv4862845
EBWH309,オレが痴●をヤメられないのはだらしないデカパイ人妻がスキだらけで電車に乗るせいだろ？ 柏木ふみか,5.9 GB,https://pics.dmm.co.jp/mono/movie/adult/ebwh309/ebwh309pl.jpg,https://onejav.com/torrent/ebwh309/download/44270401/onejav.com_ebwh309.torrent,"Acme · Orgasm, Big Tits, Busty Fetish, Married Woman, Nasty, Hardcore, Solowork",柏木ふみか,2026-03-13,https://onejav.com/torrent/ebwh309
EBWH319,純白いたいけ巨乳薬学生、新薬研究中にできてしまった老教授のキモチイイおクスリで… 年季入りの古ペニスに染まっちゃった。 白羽舞菜,7.0 GB,https://pics.dmm.co.jp/mono/movie/adult/ebwh319/ebwh319pl.jpg,https://onejav.com/torrent/ebwh319/download/65754821/onejav.com_ebwh319.torrent,"3P, 4P, Acme · Orgasm, Big Tits, Female College Student, Nasty, Hardcore, Solowork",白羽舞菜,2026-03-13,https://onejav.com/torrent/ebwh319
FC2PPV4862676,FC2-PPV-4862676 【半端ないエロス】１７０cmスレンダー長身巨乳淫乱マゾ奥様 えずき汁まみれバチボコ中出し,4.4 GB,https://contents-thumbnail2.fc2.com/w1280/storage200000.contents.fc2.com/file/376/37528443/1773288697.62.jpg,https://onejav.com/torrent/fc2ppv4862676/download/27809400/onejav.com_fc2ppv4862676.torrent,"Amateur, Big Tits, Bitch, Creampie, FC2, Nasty, Hardcore, Sexy, Tall",,2026-03-13,https://onejav.com/torrent/fc2ppv4862676
EBWH315,「タバコ吸わずにおっぱい吸えば？」 喫煙やめなきゃ命危ない僕を心配して… いつでもどこでも乳差し出してくる 禁煙おっパ×ポ彼女 莉々はるか,4.9 GB,https://pics.dmm.co.jp/mono/movie/adult/ebwh315/ebwh315pl.jpg,https://onejav.com/torrent/ebwh315/download/38437862/onejav.com_ebwh315.torrent,"Acme · Orgasm, Big Tits, Blow, Busty Fetish, Solowork, Titty Fuck",莉々はるか,2026-03-13,https://onejav.com/torrent/ebwh315
