code,title,size,image_url,torrent_url,tags,actresses,date,page_url
ABF348,究エクスタシー 全神経駆け巡る快楽の新境地へー。 涼森れむ,4.6 GB,https://image.mgstage.com/images/prestige/abf/348/pb_e_abf-348.jpg,https://onejav.com/torrent/abf348/download/35584066/onejav.com_abf348.torrent,"3P, 4P, Big Tits, Facials, Solowork",Remu Suzumori,2026-05-07,https://onejav.com/torrent/abf348
FC2PPV4895806,FC2-PPV-4895806 【5/26迄1290pt】※19歳グラビアスタイル級の色白美ボディムスメ再び。巨根に教育され制服姿で喘ぎながら何度も痙攣、イキまくる。「今日の方が気持ちいい…！」とピンク色の締め付けマンコに中出し。,3.8 GB,https://contents-thumbnail2.fc2.com/w1280/storage201000.contents.fc2.com/file/370/36940995/1778041126.54.png,https://onejav.com/torrent/fc2ppv4895806/download/43592442/onejav.com_fc2ppv4895806.torrent,"Amateur, Beautiful Girl, Big Tits, Blow, Breasts, FC2, Uncensored, Uniform",,2026-05-07,https://onejav.com/torrent/fc2ppv4895806
MIMK267,,4.9 GB,https://pics.dmm.co.jp/mono/movie/adult/mimk267/mimk267pl.jpg,https://onejav.com/torrent/mimk267/download/21392324/onejav.com_mimk267.torrent,,,2026-05-07,https://onejav.com/torrent/mimk267
WAAA642,,5.2 GB,https://pics.dmm.co.jp/mono/movie/adult/waaa642/waaa642pl.jpg,https://onejav.com/torrent/waaa642/download/81370301/onejav.com_waaa642.torrent,,,2026-05-07,https://onejav.com/torrent/waaa642
MIDA590,ダブルJcupスリム巨乳独占ハーレム！！ムカつく地味メガネ女上司を自宅で立場逆転いいなりご奉仕全裸メイド 百田光稀 篠真有,4.8 GB,https://pics.dmm.co.jp/mono/movie/adult/mida590/mida590pl.jpg,https://onejav.com/torrent/mida590/download/71236485/onejav.com_mida590.torrent,"3P, 4P, Big Tits, Harem, Maid, Titty Fuck","篠真有, 百田光稀",2026-05-07,https://onejav.com/torrent/mida590
FC2PPV4895619,FC2-PPV-4895619 【無修正】美肌綺麗系スレンダー金髪女子 小さな綺麗なピンクま〇こを見せつけて、オチンチンをキュッと締め付ける 高画質プレゼント付き 釣り人,1.2 GB,https://contents-thumbnail2.fc2.com/w1280/storage201000.contents.fc2.com/file/358/35743745/1777903570.88.jpg,https://onejav.com/torrent/fc2ppv4895619/download/61292511/onejav.com_fc2ppv4895619.torrent,"Amateur, FC2",,2026-05-07,https://onejav.com/torrent/fc2ppv4895619
SIRO5674,ついに人妻参戦！！！旦那とのレスで溜まった欲望をぶつける、エロがり人妻に男優も大興奮！！ 【初撮り】ネットでAV応募→AV体験撮影 2552,2.5 GB,https://image.mgstage.com/images/shirouto/siro/5674/pb_e_siro-5674.jpg,https://onejav.com/torrent/siro5674/download/87029770/onejav.com_siro5674.torrent,"Amateur, Big Tits, Debut Production, Married Woman, POV",,2026-05-07,https://onejav.com/torrent/siro5674
ABF350,タキモト無双 瀧本雫葉【限定特典映像20分付き】,5.2 GB,https://image.mgstage.com/images/prestige/abf/350/pb_e_abf-350.jpg,https://onejav.com/torrent/abf350/download/86767402/onejav.com_abf350.torrent,"Big Tits, Facials, Orgy, Shaved, Solowork",瀧本雫葉,2026-05-07,https://onejav.com/torrent/abf350
WAAA629,新任美乳教師輪●中出し学級 鈴の家りん,5.1 GB,https://pics.dmm.co.jp/mono/movie/adult/waaa629/waaa629pl.jpg,https://onejav.com/torrent/waaa629/download/64824553/onejav.com_waaa629.torrent,"3P, 4P, Beautiful Girl, Creampie, Female Teacher, Orgy, Solowork",鈴の家りん,2026-05-07,https://onejav.com/torrent/waaa629
WAAA639,「セックスの練習させてよ！？」男勝りな幼馴染の芽依がコンドーム一個だけを持参してまさかのお願い 俺が思ってた以上に芽依のカラダは巨乳ですけべでおま○こ気持ちよくって... 初めてのセックスにハマってしまい未熟おま○こに三日三晩の中出しセックス10発 五日市芽依,5.0 GB,https://pics.dmm.co.jp/mono/movie/adult/waaa639/waaa639pl.jpg,https://onejav.com/torrent/waaa639/download/70896455/onejav.com_waaa639.torrent,"Acme · Orgasm, Childhood Friend, Creampie, School Girls, Solowork, Uniform",五日市芽依,2026-05-07,https://onejav.com/torrent/waaa639
