code,title,size,image_url,torrent_url,tags,actresses,date,page_url
ABF326,鈴村あいりが素人♂を逆ナン！【限定特典映像40分付き】,7.1 GB,https://image.mgstage.com/images/prestige/abf/326/pb_e_abf-326.jpg,https://onejav.com/torrent/abf326/download/58280256/onejav.com_abf326.torrent,"Breasts, Cosplay, Nampa, Reversed Role, Slut, Solowork",Airi Suzumura,2026-03-05,https://onejav.com/torrent/abf326
FC2PPV4858357,FC2-PPV-4858357 3日間！70OFF【初撮り】愛嬌抜群！！ぷるるん美巨乳な体とあざとい顔がエロすぎる。男を虜にする満点笑顔。。勝手に膣内射精したら怒られちゃった（笑）,6.7 GB,https://contents-thumbnail2.fc2.com/w1280/storage201000.contents.fc2.com/file/385/38454154/1772550126.03.jpg,https://onejav.com/torrent/fc2ppv4858357/download/49773965/onejav.com_fc2ppv4858357.torrent,"Amateur, Big Tits, Breasts, Creampie, FC2, POV, Uncensored",,2026-03-05,https://onejav.com/torrent/fc2ppv4858357
ABF327,新人女子アナ 『性』いっぱい頑張りますっ…！！ 釈アリス【限定特典映像20分付き】,5.2 GB,https://image.mgstage.com/images/prestige/abf/327/pb_e_abf-327.jpg,https://onejav.com/torrent/abf327/download/38145485/onejav.com_abf327.torrent,"Breasts, Facials, Orgy, Shaved, Solowork",釈アリス,2026-03-05,https://onejav.com/torrent/abf327
FC2PPV4858729,FC2-PPV-4858729 元祇園舞妓の秘めた欲情がドスケベ本性が大暴走！ はんなり上品崩壊で貪欲腰振り連続中出し懇願♡,4.9 GB,https://contents-thumbnail2.fc2.com/w1280/storage200000.contents.fc2.com/file/388/38703450/1772614066.78.jpg,https://onejav.com/torrent/fc2ppv4858729/download/38514415/onejav.com_fc2ppv4858729.torrent,"Amateur, Creampie, FC2, POV, Slender, Uncensored",,2026-03-05,https://onejav.com/torrent/fc2ppv4858729
FNS179,毎朝の通学で股間を弄られM覚醒させられた相手は… 浜辺やよい,5.5 GB,https://cdn.faleno.net/top/wp-content/uploads/2026/02/FNS-179_1200.jpg?output-quality=60,https://onejav.com/torrent/fns179/download/17807946/onejav.com_fns179.torrent,,浜辺やよい,2026-03-05,https://onejav.com/torrent/fns179
FC2PPV4858360,FC2-PPV-4858360 ★顔出し★素人さんがえっちな事をしにやってきた！ケース＃122　美女・スタイル抜群！奇跡のJD！元バトミントン部の文系才女　あみちゃん（20）の場合,4.8 GB,https://contents-thumbnail2.fc2.com/w1280/storage201000.contents.fc2.com/file/368/36773637/1772551048.25.jpg,https://onejav.com/torrent/fc2ppv4858360/download/37555543/onejav.com_fc2ppv4858360.torrent,"Amateur, Back, Beautiful Girl, Big Tits, Blow, Breasts, Cowgirl, FC2, Shaved, Slender, Uncensored",,2026-03-05,https://onejav.com/torrent/fc2ppv4858360
FC2PPV4858454,FC2-PPV-4858454 【無】【3/6まで70%OFF】黒人巨根２人であやちゃん#1、性格が強気な美女を激しくハメ倒して、最後に大量の２連続生中出しの汗だくハードコア３P,2.4 GB,https://contents-thumbnail2.fc2.com/w1280/storage200000.contents.fc2.com/file/372/37151217/1772589559.77.jpg,https://onejav.com/torrent/fc2ppv4858454/download/55004953/onejav.com_fc2ppv4858454.torrent,"Amateur, Beautiful Girl, Creampie, FC2, Orgy, SM, Spanking, Uncensored",,2026-03-05,https://onejav.com/torrent/fc2ppv4858454
FC2PPV4839267,FC2-PPV-4839267 【初回限定特別価格！】剛毛！経験値ショボすぎガリ勉黒髪スレンダー。マン毛がザーメンで真っ白ドロドロになるまで中年オッサンと3Pセックス。リアル助産師さんへ中出し実習,1.1 GB,https://contents-thumbnail2.fc2.com/w1280/storage200000.contents.fc2.com/file/393/39226530/1769605023.71.png,https://onejav.com/torrent/fc2ppv4839267/download/22116503/onejav.com_fc2ppv4839267.torrent,"3P, 4P, Amateur, Black Hair, Creampie, FC2, POV, Slender, Uncensored",,2026-03-05,https://onejav.com/torrent/fc2ppv4839267
HBAD729,無口なKカップ爆乳の姪っ子が笑顔でノーブラオッパイ見せつけて誘惑してくる 丸最レア,5.1 GB,https://pics.dmm.co.jp/mono/movie/adult/1hbad729/1hbad729pl.jpg,https://onejav.com/torrent/hbad729/download/25230003/onejav.com_hbad729.torrent,"BIGセール, Solowork",丸最レア,2026-03-05,https://onejav.com/torrent/hbad729
XMOM109,パンストエアーライン ノーパンCAおま〇こフライト 及川うみ,4.8 GB,https://pics.dmm.co.jp/mono/movie/adult/h_086xmom109/h_086xmom109pl.jpg,https://onejav.com/torrent/xmom109/download/38254294/onejav.com_xmom109.torrent,"BIGセール, Lotion, Mature Woman, Pantyhose, Solowork, Stewardess",及川うみ,2026-03-05,https://onejav.com/torrent/xmom109
