code,title,size,image_url,torrent_url,tags,actresses,date,page_url
FC2PPV4861113,FC2-PPV-4861113 【7日間限定セール】コミュ障で控えめなメンエス嬢を暴走ちんぽで好き放題して自分好みにしちゃいました♡【無修正・中出し】,4.9 GB,https://contents-thumbnail2.fc2.com/w1280/storage200000.contents.fc2.com/file/381/38031442/1773044563.49.png,https://onejav.com/torrent/fc2ppv4861113/download/10970440/onejav.com_fc2ppv4861113.torrent,"Amateur, Beautiful Girl, Blow, Creampie, Electric Massager, FC2, Toy, Uncensored",,2026-03-14,https://onejav.com/torrent/fc2ppv4861113
SIRO5606,ワンワン！チ○ポが好きだわん！ペットカフェ店員の絶対的美少女がおチ○ポジャーキーをハムハムジュポジュポスケベフェラ！よくできましたね？！ご褒美に極太オチ○ポでデスファ○クですよ？！パンパンパンパン！！ 【初撮り】ネットでAV応募→AV体験撮影 2523,2.3 GB,https://image.mgstage.com/images/shirouto/siro/5606/pb_e_siro-5606.jpg,https://onejav.com/torrent/siro5606/download/28088255/onejav.com_siro5606.torrent,"Amateur, Breasts, Debut Production, POV, Tall",,2026-03-14,https://onejav.com/torrent/siro5606
FC2PPV4862988,FC2-PPV-4862988 【無・顔出し】170cmの黒髪ボブ。クールな雰囲気の長身スレンダー美女をノーカット撮影,4.7 GB,https://contents-thumbnail2.fc2.com/w1280/storage201000.contents.fc2.com/file/343/34292857/1773348242.62.jpg,https://onejav.com/torrent/fc2ppv4862988/download/29713255/onejav.com_fc2ppv4862988.torrent,"Amateur, Beautiful legs, Black Hair, Butt, Creampie, FC2, Slender, Tall, Uncensored",,2026-03-14,https://onejav.com/torrent/fc2ppv4862988
300MIUM1342,出来杉淫ボディ【キラキラ笑顔のデカパイちゃん】「ほっといても稼げます。今めっちゃキテるんで」乳寄せ上目遣いで景気のイイ話ばかりしてくるので、適当に言いくるめてホテイン直行。都合が悪くなると反抗的な目つきで態度一変するも…パンストま●こは蒸れ濡れですwwこちらを睨みながらもチ●ポ挿入で漏れる声。強気で対抗しても終いには腰振ってアヘアヘしてましたww  ：case.60,2.4 GB,https://image.mgstage.com/images/prestigepremium/300mium/1342/pb_e_300mium-1342.jpg,https://onejav.com/torrent/300mium1342/download/25973851/onejav.com_300mium1342.torrent,"Amateur, Beautiful legs, Big Tits, Breasts, POV, Titty Fuck",,2026-03-14,https://onejav.com/torrent/300mium1342
FC2PPV4863320,FC2-PPV-4863320 【4/3迄1190pt】【初撮】※特典付　上品で色白なピアノ美人講師。生意気ながらも黒巨根見たら即ハメ。膣奥まで突かれ、ぴちょぴちょマンコにたっぷり中出し,3.9 GB,https://contents-thumbnail2.fc2.com/w1280/storage200000.contents.fc2.com/file/370/36940995/1773372846.18.png,https://onejav.com/torrent/fc2ppv4863320/download/01915459/onejav.com_fc2ppv4863320.torrent,"Amateur, Blow, Breasts, Creampie, FC2, Pregnant, Slender, Uncensored",,2026-03-14,https://onejav.com/torrent/fc2ppv4863320
FC2PPV4861514,FC2-PPV-4861514 【無】まさにリアルレースクィーンに大量顔射と中だし！長身スレンダー美女再降臨⤴相変わらずの感度で痙攣しながら何度もオーガズム！※特典高画質,3.7 GB,https://contents-thumbnail2.fc2.com/w1280/storage200000.contents.fc2.com/file/381/38003297/1773123876.29.jpg,https://onejav.com/torrent/fc2ppv4861514/download/64634150/onejav.com_fc2ppv4861514.torrent,"Amateur, Beautiful Girl, Big Tits, Blow, Creampie, FC2, POV, Uncensored",,2026-03-14,https://onejav.com/torrent/fc2ppv4861514
SQTE669,この子ヤバイ！！Kカップ痴女S-Cuteデビュー！ 丸最レア,4.5 GB,https://pics.dmm.co.jp/mono/movie/adult/sqte669/sqte669pl.jpg,https://onejav.com/torrent/sqte669/download/90292651/onejav.com_sqte669.torrent,"Beautiful Girl, Big Tits, Blow, POV, Slut, Solowork",丸最レア,2026-03-14,https://onejav.com/torrent/sqte669
FC2PPV4862649,FC2-PPV-4862649 一週間50%OFF「合計5発」美体形スレンダー新卒ムスメ。「またイキそう…！」経験のない感覚、3本のチンポに囲まれて完全に壊れ。ぶっかけ、垂れ流し中出し、総計5発をしっかり受け止めて果てる,4.0 GB,https://contents-thumbnail2.fc2.com/w1280/storage201000.contents.fc2.com/file/373/37213813/1773286806.1.png,https://onejav.com/torrent/fc2ppv4862649/download/36407348/onejav.com_fc2ppv4862649.torrent,"Amateur, Breasts, Bukkake, Creampie, FC2, Pregnant, Slender, Uncensored",,2026-03-14,https://onejav.com/torrent/fc2ppv4862649
FC2PPV4862899,FC2-PPV-4862899 ※初回のみ※外資系IT企業勤務のアラサー美女（２８）しごおわSEXでまん汁が止まらないスケベなメスにしてやりました【口内射精＆中出し】（ひなみ）,2.5 GB,https://contents-thumbnail2.fc2.com/w1280/storage201000.contents.fc2.com/file/375/37468189/1773327676.49.jpg,https://onejav.com/torrent/fc2ppv4862899/download/91660780/onejav.com_fc2ppv4862899.torrent,"Amateur, Bath, Beautiful Girl, Beautiful legs, Blow, Breasts, Butt, Creampie, FC2, OL, Petite, POV, Slender, Titty Fuck",,2026-03-14,https://onejav.com/torrent/fc2ppv4862899
326FCT216,経験たった3人の元音大生22歳が彼氏に内緒で中出しハメ撮りｗｗ中イキ未体験のド素人女子が自ら腰振り大量潮吹き絶頂！,3.8 GB,https://image.mgstage.com/images/kurofune/326fct/216/pb_e_326fct-216.jpg,https://onejav.com/torrent/326fct216/download/65177768/onejav.com_326fct216.torrent,"Amateur, Big Tits, Creampie, Masturbation, POV, Slender, Squirting",うみ,2026-03-14,https://onejav.com/torrent/326fct216
