code,title,size,image_url,torrent_url,tags,actresses,date,page_url
SNOS197,客達を勃起させちゃう風呂屋ひとり娘のフェロ漏れしなやかボディ！ 銭湯、ジジイたちの乱交場へ 楓ふうあ,6.2 GB,https://pics.dmm.co.jp/mono/movie/adult/snos197/snos197pl.jpg,https://onejav.com/torrent/snos197/download/78982138/onejav.com_snos197.torrent,"Acme · Orgasm, Blow, Nasty, Hardcore, Orgy, Slender, Solowork",Fuua Kaede,2026-04-10,https://onejav.com/torrent/snos197
SNOS193,中小企業に入社したプリプリデカ乳OLが ボロッボロになるまで全オトコ社員に数珠つなぎレ●プ 小日向みゆう,6.6 GB,https://pics.dmm.co.jp/mono/movie/adult/snos193/snos193pl.jpg,https://onejav.com/torrent/snos193/download/94265800/onejav.com_snos193.torrent,"3P, 4P, Big Tits, Busty Fetish, Nasty, Hardcore, OL, Solowork",小日向みゆう,2026-04-10,https://onejav.com/torrent/snos193
SNOS124,あの話題の超庶民お姉ちゃん、一歩イイオンナ感。人生初めて尽くし性交で絶頂イキまくり初体験3本番 鈴木希,9.4 GB,https://pics.dmm.co.jp/mono/movie/adult/snos124/snos124pl.jpg,https://onejav.com/torrent/snos124/download/55445739/onejav.com_snos124.torrent,"3P, 4P, Beautiful Girl, Big Tits, Older Sister, Slender, Solowork",鈴木希,2026-04-10,https://onejav.com/torrent/snos124
IPZZ809,出張先が記録的豪雨で高嶺の花の女社長と相部屋に…大人の色気と官能的美ボディにフル勃起した童貞の僕を受け入れてくれた優しさに甘えて朝まで暴走むしゃぶりつき性交 三澄寧々,5.7 GB,https://pics.dmm.co.jp/mono/movie/adult/ipzz809/ipzz809pl.jpg,https://onejav.com/torrent/ipzz809/download/83392891/onejav.com_ipzz809.torrent,"Big Tits, Cuckold, Idol, Kiss, Solowork",三澄寧々,2026-04-10,https://onejav.com/torrent/ipzz809
IPZZ858,上京したてで都会の満員電車を知らないお嬢様女子大生は脱いだら凄いことがバレて痴●の餌食になってしまう… 坂井美桜,7.1 GB,https://pics.dmm.co.jp/mono/movie/adult/ipzz858/ipzz858pl.jpg,https://onejav.com/torrent/ipzz858/download/36715262/onejav.com_ipzz858.torrent,"Acme · Orgasm, Breasts, Drama, Female College Student, Solowork",坂井美桜,2026-04-10,https://onejav.com/torrent/ipzz858
IPZZ791,,4.9 GB,https://pics.dmm.co.jp/mono/movie/adult/ipzz791/ipzz791pl.jpg,https://onejav.com/torrent/ipzz791/download/07159648/onejav.com_ipzz791.torrent,,,2026-04-10,https://onejav.com/torrent/ipzz791
IPZZ824,大会前合宿でマネージャーの私は先生と相部屋に…。引退までの2ヶ月間、顧問との浮気SEXにハマってしまったことはエースの彼氏には絶対に知られたくない 堀北桃愛,6.0 GB,https://pics.dmm.co.jp/mono/movie/adult/ipzz824/ipzz824pl.jpg,https://onejav.com/torrent/ipzz824/download/01334763/onejav.com_ipzz824.torrent,"Acme · Orgasm, Big Tits, Club Activities, Manager, School Girls, Solowork, Uniform",堀北桃愛,2026-04-10,https://onejav.com/torrent/ipzz824
JUR683,昔俺の事が好きだった地味な幼馴染が、色気漂う巨乳人妻に進化していたので、性欲が尽き果てるまで生ハメしまくった…。 南沢海香,6.0 GB,https://pics.dmm.co.jp/mono/movie/adult/jur683/jur683pl.jpg,https://onejav.com/torrent/jur683/download/57538683/onejav.com_jur683.torrent,"Big Tits, Creampie, Cuckold, Married Woman, Mature Woman, Solowork",南沢海香,2026-04-10,https://onejav.com/torrent/jur683
300MIUM1285,,3.8 GB,https://image.mgstage.com/images/prestigepremium/300mium/1285/pb_e_300mium-1285.jpg,https://onejav.com/torrent/300mium1285/download/99781415/onejav.com_300mium1285.torrent,,,2026-04-10,https://onejav.com/torrent/300mium1285
SNOS178,ヤリサーの男達に雑に寝取られといてピースなんかすんなよ… 僕の大切な年下彼女が大学のチャラ男たちとノリノリSEXを楽しんでいた…。 三田真鈴,6.0 GB,https://pics.dmm.co.jp/mono/movie/adult/snos178/snos178pl.jpg,https://onejav.com/torrent/snos178/download/24382256/onejav.com_snos178.torrent,"Beautiful Girl, Cuckold, Facials, Orgy, POV, Solowork",三田真鈴,2026-04-10,https://onejav.com/torrent/snos178
