code,title,size,image_url,torrent_url,tags,actresses,date,page_url
FNS177,,5.2 GB,https://faleno.jp/top/wp-content/uploads/2026/03/FNS-177_1200.jpg?output-quality=60,https://onejav.com/torrent/fns177/download/39815459/onejav.com_fns177.torrent,,,2026-03-28,https://onejav.com/torrent/fns177
FC2PPV4869117,FC2-PPV-4869117 24日迄 1490pt!!【初】※早期購入特典 ・新人発掘！「個撮初体験」色白スレンダー美女/ 敏感マ〇㋙イキまくりの痙攣。、アへ顔で「ぁあ、。もっと突いてぇぇ！！」おねだり,5.1 GB,https://contents-thumbnail2.fc2.com/w1280/storage200000.contents.fc2.com/file/359/35808353/1774431522.48.jpg,https://onejav.com/torrent/fc2ppv4869117/download/78284311/onejav.com_fc2ppv4869117.torrent,"Amateur, Beautiful Girl, Blow, Breasts, Cowgirl, Cunnilingus, FC2, Model, POV, Slender",,2026-03-28,https://onejav.com/torrent/fc2ppv4869117
FC2PPV4869941,FC2-PPV-4869941 《4/3まで1980pt》【無】 【黒髪巨乳×ニーハイ】触れただけで崩れる敏感Fカップ美女！！清楚な顔して”エグすぎる口内テク”で…大量中出し！！,4.9 GB,https://contents-thumbnail2.fc2.com/w1280/storage200000.contents.fc2.com/file/387/38616959/1774576690.75.JPG,https://onejav.com/torrent/fc2ppv4869941/download/85895130/onejav.com_fc2ppv4869941.torrent,"Amateur, Big Tits, Black Hair, Creampie, FC2, POV, Uncensored",,2026-03-28,https://onejav.com/torrent/fc2ppv4869941
FC2PPV4869653,FC2-PPV-4869653 【ガチ社不】顔面優勝ちょうかわいいフリーターバチボコ中出し,6.0 GB,https://contents-thumbnail2.fc2.com/w1280/storage201000.contents.fc2.com/file/376/37528443/1774514212.42.jpg,https://onejav.com/torrent/fc2ppv4869653/download/31658682/onejav.com_fc2ppv4869653.torrent,"4K, Amateur, Creampie, FC2, Nasty, Hardcore, Petite",,2026-03-28,https://onejav.com/torrent/fc2ppv4869653
FC2PPV4869890,FC2-PPV-4869890 3日間！70OFF【洒池肉林】同級生でもあるＳ級美女コンビとハーレムプレイ！硬くなったらすぐ挿れたいな。一緒にイこう？なんの体位が好き？待ったなしの連続プレイ！！合計７人から精子搾り取っちゃいました！,5.0 GB,https://contents-thumbnail2.fc2.com/w1280/storage201000.contents.fc2.com/file/385/38454154/1774568365.8.jpg,https://onejav.com/torrent/fc2ppv4869890/download/14256683/onejav.com_fc2ppv4869890.torrent,"Amateur, Beautiful legs, Breasts, Butt, Creampie, FC2, Harem, POV, Uncensored",,2026-03-28,https://onejav.com/torrent/fc2ppv4869890
FC2PPV4868183,FC2-PPV-4868183 【無】本当にＨが大好きなのが分かる目がエロい女性！常に楽しそうに色んなこと求めてくるドスケベ…、天然ヘアー　ゴックン　中だし　※特典高画質,5.6 GB,https://contents-thumbnail2.fc2.com/w1280/storage201000.contents.fc2.com/file/381/38003297/1774232880.77.jpg,https://onejav.com/torrent/fc2ppv4868183/download/76266826/onejav.com_fc2ppv4868183.torrent,"Amateur, Beautiful Girl, Big Tits, Blow, Creampie, FC2, POV, Uncensored",,2026-03-28,https://onejav.com/torrent/fc2ppv4868183
FC2PPV4869199,FC2-PPV-4869199 初撮り！【無】【中出し】可愛いのに1本パイ毛が生えてる美女。大人しそうに見えてパンツはびしょ濡れ。体は正直です。懇願させて中出し。※特典あり,3.1 GB,https://contents-thumbnail2.fc2.com/w1280/storage200000.contents.fc2.com/file/391/39050133/1774442579.71.jpg,https://onejav.com/torrent/fc2ppv4869199/download/12004250/onejav.com_fc2ppv4869199.torrent,"Amateur, Blow, Breasts, Butt, Creampie, FC2, POV, Uncensored",,2026-03-28,https://onejav.com/torrent/fc2ppv4869199
HEYZO3811,,2.1 GB,https://www.heyzo.com/contents/3000/3811/images/player_thumbnail_en.jpg,https://onejav.com/torrent/heyzo3811/download/66010371/onejav.com_heyzo3811.torrent,,,2026-03-28,https://onejav.com/torrent/heyzo3811
FC2PPV4868726,FC2-PPV-4868726 傑作！うみちゃんの*くてかわいくて純粋な子のマンコが気持ち良すぎて早漏連続中出し祭り！,7.4 GB,https://contents-thumbnail2.fc2.com/w1280/storage201000.contents.fc2.com/file/326/32518753/1774337771.14.jpg,https://onejav.com/torrent/fc2ppv4868726/download/21588050/onejav.com_fc2ppv4868726.torrent,"Amateur, Black Hair, Creampie, Debut Production, FC2, Petite, POV, Uncensored",,2026-03-28,https://onejav.com/torrent/fc2ppv4868726
FC2PPV4870093,FC2-PPV-4870093 ♀210 ホットパンツをはくいやらしい白ギャルちゃんの舐め技におじさん快感めろめろ♡ たっぷり2回中出し♡久しぶりの膣内カメラも！ ★特典で無修正と膣内カメラ,6.4 GB,https://contents-thumbnail2.fc2.com/w1280/storage201000.contents.fc2.com/file/376/37547480/1774586721.06.jpg,https://onejav.com/torrent/fc2ppv4870093/download/83106642/onejav.com_fc2ppv4870093.torrent,"Amateur, Creampie, FC2, Uncensored",,2026-03-28,https://onejav.com/torrent/fc2ppv4870093
