code,title,size,image_url,torrent_url,tags,actresses,date,page_url
FC2PPV4901486,FC2-PPV-4901486 Hカップ爆乳都合のいいオナホ彼女 ３２歳非正規雇用実家住まいアラサー,7.5 GB,https://contents-thumbnail2.fc2.com/w1280/storage201000.contents.fc2.com/file/367/36631962/1778841560.12.jpg,https://onejav.com/torrent/fc2ppv4901486/download/23450890/onejav.com_fc2ppv4901486.torrent,"4K, Amateur, Big Tits, Creampie, FC2, Nasty, Hardcore, Petite",,2026-05-18,https://onejav.com/torrent/fc2ppv4901486
FC2PPV4902089,FC2-PPV-4902089 【200本限定.価格】僕のお人形さんは正常位名器wお口も名器で口内射精。お口に出したら即ごっくん。興奮抑えられず、コスプレ着せて連続中出し何発でもイケる名器は恐るべし。,2.9 GB,https://contents-thumbnail2.fc2.com/w1280/storage200000.contents.fc2.com/file/407/40666348/1778922312.73.png,https://onejav.com/torrent/fc2ppv4902089/download/51919764/onejav.com_fc2ppv4902089.torrent,"Amateur, Breasts, Butt, Cosplay, FC2, POV, Shaved, Toy, Uncensored",,2026-05-18,https://onejav.com/torrent/fc2ppv4902089
FC2PPV4901233,FC2-PPV-4901233 【22歳】お嬢様学校に在籍の妄想癖持ちの女子大生♥ 年上好き彼女の清楚なカラダがおぢに溺れる一部始終,7.3 GB,https://contents-thumbnail2.fc2.com/w1280/storage200000.contents.fc2.com/file/388/38703450/1778821791.72.png,https://onejav.com/torrent/fc2ppv4901233/download/98987222/onejav.com_fc2ppv4901233.torrent,"Amateur, Black Hair, Creampie, FC2, Female College Student, POV, Uncensored",,2026-05-18,https://onejav.com/torrent/fc2ppv4901233
FC2PPV4902092,FC2-PPV-4902092 【アイドルSSS級】【数量限定・全編視聴可】【完全シークレット版】FC2を愛する全ての人に捧げます！ツンデレ系”かんなちゃん、クォーター19歳JDが魅せる本性むき出しの醜態性【第１１章】,8.8 GB,https://contents-thumbnail2.fc2.com/w1280/storage201000.contents.fc2.com/file/377/37664104/1778909755.86.jpg,https://onejav.com/torrent/fc2ppv4902092/download/01986081/onejav.com_fc2ppv4902092.torrent,"Amateur, Big Tits, Blow, Close Up, Cosplay, Creampie, Egg Vibrator, Electric Massager, FC2, Finger Fuck, Petite, Shaved, Uncensored",,2026-05-18,https://onejav.com/torrent/fc2ppv4902092
FC2PPV4901954,FC2-PPV-4901954 【初回70%オフ・初撮り♡】 0314_002 ひまりちゃん23歳 超人気同人AVモデルをガチで孕ませる本物中出し無.責.任種付けファック！果たして何度目の撮影で妊娠するのか、待望のシリーズスタート！,5.3 GB,https://contents-thumbnail2.fc2.com/w1280/storage201000.contents.fc2.com/file/383/38288919/1778892403.53.jpg,https://onejav.com/torrent/fc2ppv4901954/download/91027877/onejav.com_fc2ppv4901954.torrent,"Amateur, Beautiful Girl, Black Hair, Breasts, Conceived, Creampie, Deep Throating, FC2, POV, Slender",,2026-05-18,https://onejav.com/torrent/fc2ppv4901954
FC2PPV4902183,FC2-PPV-4902183 超美人ハーフキャバ嬢と連続潮吹きスプラッシュ。バチボコピストンで昇天後の大量中出し,7.5 GB,https://contents-thumbnail2.fc2.com/w1280/storage201000.contents.fc2.com/file/382/38167029/1778918645.52.png,https://onejav.com/torrent/fc2ppv4902183/download/42402728/onejav.com_fc2ppv4902183.torrent,"Amateur, Beautiful Girl, Big Tits, Breasts, Creampie, FC2, POV, Squirting",,2026-05-18,https://onejav.com/torrent/fc2ppv4902183
FC2PPV4901294,FC2-PPV-4901294 ♀219 ゆるふわなしおりちゃんにたっぷり中出し種付け♡ ★特典で無修正,4.6 GB,https://contents-thumbnail2.fc2.com/w1280/storage201000.contents.fc2.com/file/376/37547480/1778830841.38.jpg,https://onejav.com/torrent/fc2ppv4901294/download/85605300/onejav.com_fc2ppv4901294.torrent,"Amateur, Creampie, FC2, Uncensored",,2026-05-18,https://onejav.com/torrent/fc2ppv4901294
FC2PPV4901552,FC2-PPV-4901552 【11発連続/顔射ごっくん】固形＆ゼリーザーメンをガブ飲みするGカップ看護師さやかちゃん,3.3 GB,https://contents-thumbnail2.fc2.com/w1280/storage201000.contents.fc2.com/file/389/38845233/1778848289.56.jpg,https://onejav.com/torrent/fc2ppv4901552/download/62941307/onejav.com_fc2ppv4901552.torrent,"Amateur, Blow, Bukkake, Cum, Facials, FC2",,2026-05-18,https://onejav.com/torrent/fc2ppv4901552
FC2PPV4902014,FC2-PPV-4902014 ※22日まで初回限定48％OFF※【限定顔出し】代々教師家計という**学校で働く３２歳の人妻です。３２歳なのに未経験のような体つきの人妻でした。,4.5 GB,https://contents-thumbnail2.fc2.com/w1280/storage200000.contents.fc2.com/file/377/37682362/1778901183.46.jpg,https://onejav.com/torrent/fc2ppv4902014/download/91633599/onejav.com_fc2ppv4902014.torrent,"Affair, Amateur, Blow, Creampie, FC2, Married Woman, POV",,2026-05-18,https://onejav.com/torrent/fc2ppv4902014
FC2PPV4902130,FC2-PPV-4902130 【無修正】日本男児vsブルネット女子 かわいらしい客室乗務員が緊張している外国人経験なしの日本男児にとっても優しくしてくれました (^ー^)ノ レビューで高画質ＺＩＰ付き 釣り人,2.2 GB,https://contents-thumbnail2.fc2.com/w1280/storage200000.contents.fc2.com/file/358/35743745/1778912368.08.jpg,https://onejav.com/torrent/fc2ppv4902130/download/21033450/onejav.com_fc2ppv4902130.torrent,"Amateur, FC2",,2026-05-18,https://onejav.com/torrent/fc2ppv4902130
