code,title,size,image_url,torrent_url,tags,actresses,date,page_url
SNOS183,最強ヒロインと 一緒に終電逃して ホテル泊まって 朝までヤリたい！ 瀬戸環奈,4.7 GB,https://pics.dmm.co.jp/mono/movie/adult/snos183/snos183pl.jpg,https://onejav.com/torrent/snos183/download/68518465/onejav.com_snos183.torrent,"Beautiful Girl, Big Tits, Blow, Breasts, Facials, Solowork",瀬戸環奈,2026-05-08,https://onejav.com/torrent/snos183
SNOS175,潮吹きクイーン誕生 170cm幼顔Icupでお漏らしバグボディ 雛形みくる,3.6 GB,https://pics.dmm.co.jp/mono/movie/adult/snos175/snos175pl.jpg,https://onejav.com/torrent/snos175/download/44700423/onejav.com_snos175.torrent,"3P, 4P, Acme · Orgasm, Big Tits, Slender, Solowork, Squirting",雛形みくる,2026-05-08,https://onejav.com/torrent/snos175
JUR753,昔俺の事が好きだった地味な幼馴染が、色気漂う巨乳人妻に進化していたので、性欲が尽き果てるまで生ハメしまくった…。,4.0 GB,https://pics.dmm.co.jp/mono/movie/adult/jur753/jur753pl.jpg,https://onejav.com/torrent/jur753/download/09566398/onejav.com_jur753.torrent,"Affair, Big Tits, Creampie, Married Woman, Mature Woman, Solowork",彩月七緒,2026-05-08,https://onejav.com/torrent/jur753
SNOS149,新時代グラドル絶頂解禁 震えが止まらない初絶頂でイクッ！未体験3本番 博多彩葉,4.6 GB,https://pics.dmm.co.jp/mono/movie/adult/snos149/snos149pl.jpg,https://onejav.com/torrent/snos149/download/00332761/onejav.com_snos149.torrent,"3P, 4P, Beautiful Girl, Big Tits, Facials, Idol, Solowork",博多彩葉,2026-05-08,https://onejav.com/torrent/snos149
IPZZ831,新任女教師は部活合宿の下見で先輩ゲス教師に媚薬を飲まされ脱いだら凄いスリム巨乳を全身クリトリス感度にされキメセク堕ち,4.2 GB,https://pics.dmm.co.jp/mono/movie/adult/ipzz831/ipzz831pl.jpg,https://onejav.com/torrent/ipzz831/download/07028723/onejav.com_ipzz831.torrent,"Acme · Orgasm, Beautiful Girl, Big Tits, Blow, Cuckold, Solowork",坂井美桜,2026-05-08,https://onejav.com/torrent/ipzz831
IPZZ827,美貌・色気・テクニック 大人の魅力を凝縮した美麗お姉さんに脳とチ○ポをトロけさせられる最高の受け身オナサポ体験 三澄寧々,3.9 GB,https://pics.dmm.co.jp/mono/movie/adult/ipzz827/ipzz827pl.jpg,https://onejav.com/torrent/ipzz827/download/83928604/onejav.com_ipzz827.torrent,"Big Tits, Dirty Words, Idol, Masturbation Support, Solowork",三澄寧々,2026-05-08,https://onejav.com/torrent/ipzz827
SNOS164,全裸より恥ずかしい… 布面積0.1％のファッションモデル 明日葉みつは,4.2 GB,https://pics.dmm.co.jp/mono/movie/adult/snos164/snos164pl.jpg,https://onejav.com/torrent/snos164/download/06626496/onejav.com_snos164.torrent,"Cuckold, Drama, Humiliation, Married Woman, Model, Solowork",Mitsuha Ashitaba,2026-05-08,https://onejav.com/torrent/snos164
SNOS166,「ご主人様、私にかけて」僕のチ●ポが好きすぎて生搾りザーメン奪い合う顔射おねだりWメイド 安達夕莉 新木希空,4.4 GB,https://pics.dmm.co.jp/mono/movie/adult/snos166/snos166pl.jpg,https://onejav.com/torrent/snos166/download/21470991/onejav.com_snos166.torrent,"Beautiful Girl, Big Tits, Blow, Facials, Maid","Yuri Adachi, 新木希空",2026-05-08,https://onejav.com/torrent/snos166
SNOS205,顔も性格もセックスも巨乳ニットもパツパツのジーンズに隠れたお尻も全てが最高のスタイル抜群の骨格ウェーブふんわり柔らか曲線美の俺だけの愛人を早く脱がせてそのカラダを独り占めして一晩中ひたすらにハメまくりたい。 鈴木希,5.5 GB,https://pics.dmm.co.jp/mono/movie/adult/snos205/snos205pl.jpg,https://onejav.com/torrent/snos205/download/68374112/onejav.com_snos205.torrent,"Affair, Big Tits, Date, POV, Slender, Solowork",鈴木希,2026-05-08,https://onejav.com/torrent/snos205
FC2PPV4896999,FC2-PPV-4896999 【顔出し解禁】『1万人から厳選 ”最上級アイドル候補生18歳”』中出しガチハメ撮り緊急公開。 ※順次値上げ,5.4 GB,https://contents-thumbnail2.fc2.com/w1280/storage201000.contents.fc2.com/file/393/39269224/1778143791.53.jpg,https://onejav.com/torrent/fc2ppv4896999/download/71825165/onejav.com_fc2ppv4896999.torrent,"Amateur, Beautiful Girl, Big Tits, Blow, Breasts, Close Up, Creampie, FC2, POV, Slender",,2026-05-08,https://onejav.com/torrent/fc2ppv4896999
