code,title,size,image_url,torrent_url,tags,actresses,date,page_url
FC2PPV4809873,FC2-PPV-4809873 【個人撮影】身長170cmのスレンダーキャバ嬢のさくらさんに焦らしに焦らされ、最後は我慢できずに中出し,847.3 MB,https://contents-thumbnail2.fc2.com/w1280/storage201000.contents.fc2.com/file/406/40593188/1765021505.58.png,https://onejav.com/torrent/fc2ppv4809873/download/01290221/onejav.com_fc2ppv4809873.torrent,"Amateur, Beautiful Girl, Big Tits, Blow, Breasts, Creampie, FC2, Huge Butt, M男, POV, Slut, Titty Fuck",,2026-03-18,https://onejav.com/torrent/fc2ppv4809873
FC2PPV4863449,FC2-PPV-4863449 19日迄1490pt!!【最後】「Gカップ不二子ボディ」女王様をバチ凹！「中だし」ご褒美あげちゃいました。,3.3 GB,https://contents-thumbnail2.fc2.com/w1280/storage200000.contents.fc2.com/file/359/35808353/1773649621.74.jpg,https://onejav.com/torrent/fc2ppv4863449/download/32882734/onejav.com_fc2ppv4863449.torrent,"Amateur, Beautiful Girl, Big Tits, FC2, Model, Slender, SM",,2026-03-18,https://onejav.com/torrent/fc2ppv4863449
FC2PPV4863388,FC2-PPV-4863388 【無】プリンプリンのお尻最高！やっぱり可愛くってエロい⤴元チアの体幹と引き締まったカラダでえぐいスパイダー騎乗位　ゴックン　中だし　※特典高画質,3.4 GB,https://contents-thumbnail2.fc2.com/w1280/storage200000.contents.fc2.com/file/381/38003297/1773381504.74.jpg,https://onejav.com/torrent/fc2ppv4863388/download/53276866/onejav.com_fc2ppv4863388.torrent,"Amateur, Beautiful Girl, Big Tits, Blow, Creampie, FC2, POV, Uncensored",,2026-03-18,https://onejav.com/torrent/fc2ppv4863388
FC2PPV4865219,FC2-PPV-4865219 【特典でスク水・うさぎさんエッチ付】メロメロ注意！えくぼがキュートなももちゃんの身体をたっぷり精液で汚しちゃいました！,1.8 GB,https://contents-thumbnail2.fc2.com/w1280/storage201000.contents.fc2.com/file/408/40760543/1773674213.11.PNG,https://onejav.com/torrent/fc2ppv4865219/download/36956017/onejav.com_fc2ppv4865219.torrent,"Amateur, FC2",,2026-03-18,https://onejav.com/torrent/fc2ppv4865219
FC2PPV4865259,FC2-PPV-4865259 卒業したてのまだ彼氏もできたことない子と... 「中出しはしない」って約束だったけど 理性保てず自分から求めてくれたので 膣奥に中出し！！,12.8 GB,https://contents-thumbnail2.fc2.com/w1280/storage201000.contents.fc2.com/file/385/38499350/1773706523.19.png,https://onejav.com/torrent/fc2ppv4865259/download/89590882/onejav.com_fc2ppv4865259.torrent,"Amateur, Blow, Breasts, Butt, Cowgirl, Creampie, FC2, Uniform",,2026-03-18,https://onejav.com/torrent/fc2ppv4865259
FC2PPV4862790,FC2-PPV-4862790 【7日間限定75％OFF】「エッチでごめんなさいぃ」スタイル抜群おっとり美女、本番行為に興味ないフリして、さりげなくおちんぽをピンクの綺麗なおまんこへ誘導してきました♡【無修正・中出し】,4.1 GB,https://contents-thumbnail2.fc2.com/w1280/storage200000.contents.fc2.com/file/381/38031442/1773764026.04.png,https://onejav.com/torrent/fc2ppv4862790/download/15427016/onejav.com_fc2ppv4862790.torrent,"Amateur, Beautiful Girl, Butt, FC2, Uncensored",,2026-03-18,https://onejav.com/torrent/fc2ppv4862790
FC2PPV4865255,FC2-PPV-4865255 アイドル顔のアオイちゃんに、たっぷりフェラしてもらいました,1.5 GB,https://contents-thumbnail2.fc2.com/w1280/storage200000.contents.fc2.com/file/404/40347725/1773704759.63.jpg,https://onejav.com/torrent/fc2ppv4865255/download/41171540/onejav.com_fc2ppv4865255.torrent,"Amateur, FC2",,2026-03-18,https://onejav.com/torrent/fc2ppv4865255
FC2PPV4865624,FC2-PPV-4865624 【待望】ウブな子を言いくるめて素股したらドスケベすぎた。026,1.3 GB,https://contents-thumbnail2.fc2.com/w1280/storage201000.contents.fc2.com/file/395/39482717/1773743204.25.jpg,https://onejav.com/torrent/fc2ppv4865624/download/35480885/onejav.com_fc2ppv4865624.torrent,"Amateur, Beauty Shop, FC2, Handjob, Subjectivity",,2026-03-18,https://onejav.com/torrent/fc2ppv4865624
FC2PPV4865549,FC2-PPV-4865549 An Takada is our newest cafe gi.rl turned amateur nude model,4.0 GB,https://contents-thumbnail2.fc2.com/w1280/storage200000.contents.fc2.com/file/394/39375031/1773735030.04.png,https://onejav.com/torrent/fc2ppv4865549/download/33005666/onejav.com_fc2ppv4865549.torrent,"Amateur, Back, Beautiful Girl, Blow, Breasts, FC2, Slender, Uncensored",,2026-03-18,https://onejav.com/torrent/fc2ppv4865549
FC2PPV4864926,FC2-PPV-4864926 ♡3/29迄半額！【無/なま中出し】またしても長身でスタイル抜群の美しいOLさんが仕事の疲れを癒しにご来店してくれました。引き締まったお身体がステキなリピーター様です。,3.0 GB,https://contents-thumbnail2.fc2.com/w1280/storage200000.contents.fc2.com/file/271/27020439/1773650550.08.jpg,https://onejav.com/torrent/fc2ppv4864926/download/17198630/onejav.com_fc2ppv4864926.torrent,"69, Amateur, Beautiful Girl, Blow, Breasts, Creampie, Cunnilingus, Electric Massager, FC2, Finger Fuck, Slender, Tall, Uncensored",,2026-03-18,https://onejav.com/torrent/fc2ppv4864926
