code,title,size,image_url,torrent_url,tags,actresses,date,page_url
YMDS270,生ハメ中出し温泉旅行 川上ゆうを独占した一泊二日の旅,5.9 GB,https://pics.dmm.co.jp/mono/movie/adult/ymds270/ymds270pl.jpg,https://onejav.com/torrent/ymds270/download/77317402/onejav.com_ymds270.torrent,"Creampie, Cum, Deep Throating, Kiss, Solowork, Squirting",森野雫,2026-04-04,https://onejav.com/torrent/ymds270
FC2PPV4873940,FC2-PPV-4873940 【顔出し・無・中】美女20歳によるザーメン絞り選手権♡バキュームフェラ＆乳首責めでおっさんチンポに挑戦するが・・フェラ抜きできなければ生ハメ中出し罰ゲーム,6.4 GB,https://contents-thumbnail2.fc2.com/w1280/storage200000.contents.fc2.com/file/408/40702218/1775048159.95.png,https://onejav.com/torrent/fc2ppv4873940/download/86802447/onejav.com_fc2ppv4873940.torrent,"Amateur, Beautiful Girl, Blow, Breasts, Cowgirl, Creampie, FC2, Handjob, Petite",,2026-04-04,https://onejav.com/torrent/fc2ppv4873940
FC2PPV4874545,FC2-PPV-4874545 [期間限定で大放出!15000pt➡1980pt]＜無修正＞愛嬌抜群の笑顔！**キャビンアテンダント❤ＣＡ制服着衣ＳＥＸ！アへ顔全開!生ちんぽ大好き美女にたっぷり濃厚精子中出し！,4.5 GB,https://contents-thumbnail2.fc2.com/w1280/storage200000.contents.fc2.com/file/373/37232976/1775127281.54.jpg,https://onejav.com/torrent/fc2ppv4874545/download/12599696/onejav.com_fc2ppv4874545.torrent,"Amateur, Blow, Breasts, Creampie, Cunnilingus, FC2, Nasty, Hardcore, OL, POV, Slender, Uncensored",,2026-04-04,https://onejav.com/torrent/fc2ppv4874545
FC2PPV4874817,,4.3 GB,https://contents-thumbnail2.fc2.com/w1280/storage200000.contents.fc2.com/file/402/40198932/1775189319.31.jpg,https://onejav.com/torrent/fc2ppv4874817/download/63164286/onejav.com_fc2ppv4874817.torrent,,,2026-04-04,https://onejav.com/torrent/fc2ppv4874817
HEYZO3815,,1.9 GB,https://www.heyzo.com/contents/3000/3815/images/player_thumbnail_en.jpg,https://onejav.com/torrent/heyzo3815/download/95052487/onejav.com_heyzo3815.torrent,,,2026-04-04,https://onejav.com/torrent/heyzo3815
200GANA3366,,2.4 GB,https://image.mgstage.com/images/nanpatv/200gana/3366/pb_e_200gana-3366.jpg,https://onejav.com/torrent/200gana3366/download/79399639/onejav.com_200gana3366.torrent,,,2026-04-04,https://onejav.com/torrent/200gana3366
300MIUM1297,こんなの誰が見ても可愛いww【全アングル優勝】【桃尻オブザイヤー】【究極のくびれ】「初めてで…緊張してます恥」照れる顔でもうボッキ確定w恥ずかしがって目も合わせなかったのに次第に情熱的にトロける顔。美巨尻突き出してビクッビク。ま●こが絡みつくネットリ騎乗位、エロすぎ…。こんな美顔の子がジト目でだらしなくイク姿、見るしかないでしょww#女風#女性用風俗#覗き ：file.37,3.6 GB,https://image.mgstage.com/images/prestigepremium/300mium/1297/pb_e_300mium-1297.jpg,https://onejav.com/torrent/300mium1297/download/26062045/onejav.com_300mium1297.torrent,"Amateur, Beautiful legs, Breasts, Butt, Lotion, Voyeur",,2026-04-04,https://onejav.com/torrent/300mium1297
YMDD487,,6.4 GB,https://pics.dmm.co.jp/mono/movie/adult/ymdd487/ymdd487pl.jpg,https://onejav.com/torrent/ymdd487/download/15271602/onejav.com_ymdd487.torrent,,,2026-04-04,https://onejav.com/torrent/ymdd487
FJIN134,子育てとバイトで忙しい巨乳シンママが息抜きで一泊二日の旅行へ。バイト仲間の僕（無害な童貞）は男としてカウントされずお泊り温泉女子会の運転手に任命されてしまい… 夕季ちとせ 星明日菜,5.7 GB,https://pics.dmm.co.jp/mono/movie/adult/fjin134/fjin134pl.jpg,https://onejav.com/torrent/fjin134/download/76456487/onejav.com_fjin134.torrent,"BBW, Big Tits, Creampie, Hot Spring, Virgin Man","夕季ちとせ, 星明日菜",2026-04-04,https://onejav.com/torrent/fjin134
MRSS183,妊活中にバイトをはじめた妻が、バ先の店長と不倫していました… 小那海あや,4.9 GB,https://pics.dmm.co.jp/mono/movie/adult/mrss183/mrss183pl.jpg,https://onejav.com/torrent/mrss183/download/23446192/onejav.com_mrss183.torrent,"Creampie, Cuckold, Huge Butt, Married Woman, Solowork",小那海あや,2026-04-04,https://onejav.com/torrent/mrss183
