code,title,size,image_url,torrent_url,tags,actresses,date,page_url
AGAV164,性処理の為だけに存在する不潔な肉便器 春瀬ももな,4.4 GB,https://pics.dmm.co.jp/mono/movie/adult/agav164/agav164pl.jpg,https://onejav.com/torrent/agav164/download/58801817/onejav.com_agav164.torrent,"3P, 4P, Confinement, Deep Throating, Nasty, Hardcore, Older Sister, Solowork",春瀬ももな,2026-03-24,https://onejav.com/torrent/agav164
BONU045,M専出会い系で経験した巨尻奥さんのすごいお尻責め 本真ゆり,5.1 GB,https://pics.dmm.co.jp/mono/movie/adult/bonu045/bonu045pl.jpg,https://onejav.com/torrent/bonu045/download/09763263/onejav.com_bonu045.torrent,"Big Tits, Facesitting, Huge Butt, M男, Slut, Solowork",Yuri Honma,2026-03-24,https://onejav.com/torrent/bonu045
CEMD824,爆乳人妻縄不倫～夫の部下に犯●れて～ 小椋ひかり,5.6 GB,https://pics.dmm.co.jp/mono/movie/adult/cemd824/cemd824pl.jpg,https://onejav.com/torrent/cemd824/download/18468060/onejav.com_cemd824.torrent,"Big Tits, Huge Butt, M女, SM, Solowork, Ultra-Huge Tits",小椋ひかり,2026-03-24,https://onejav.com/torrent/cemd824
EMLB088,鍛錬を重ねた至高のケツ穴に全挿入じゅぶにゅぷぅ！長～い超異次元ロングディルド丸飲みアナルファッカー2nd BEST,10.1 GB,https://pics.dmm.co.jp/mono/movie/adult/emlb088/emlb088pl.jpg,https://onejav.com/torrent/emlb088/download/02575884/onejav.com_emlb088.torrent,"4HR+, Anal Sex, Best, Omnibus, M女, Nasty, Hardcore, Toy","Kozue Minami, 天晴乃愛, 音琴るい, しおかわ雲丹, 一場れいか, 生田りん, 十川ありさ, 佐久間つな, 八神のえみ",2026-03-24,https://onejav.com/torrent/emlb088
FEM027,奨学金女子のパパ活日記 富永けやき,5.5 GB,https://pics.dmm.co.jp/mono/movie/adult/fem027/fem027pl.jpg,https://onejav.com/torrent/fem027/download/21529912/onejav.com_fem027.torrent,"Anal Sex, Cross Dressing, Female College Student, Small Tits, Solowork, Transsexual",富永けやき,2026-03-24,https://onejav.com/torrent/fem027
FEM028,ビッ痴な男の娘♂ riisa,5.2 GB,https://pics.dmm.co.jp/mono/movie/adult/fem028/fem028pl.jpg,https://onejav.com/torrent/fem028/download/89926377/onejav.com_fem028.torrent,"Anal Sex, Cross Dressing, Male Squirting, Solowork, Squirting, Transsexual",riisa,2026-03-24,https://onejav.com/torrent/fem028
HERY168,男の娘、完全メス化これくしょん55 氷上えり,4.8 GB,https://pics.dmm.co.jp/mono/movie/adult/hery168/hery168pl.jpg,https://onejav.com/torrent/hery168/download/16142537/onejav.com_hery168.torrent,"Anal Sex, Cross Dressing, Masturbation, Nasty, Hardcore, Solowork, Transsexual",氷上えり,2026-03-24,https://onejav.com/torrent/hery168
JUYU002,新・麗しの熟女湯屋 極 濃密ぬるべちょ快感ソープ 奈良崎みづき,5.4 GB,https://pics.dmm.co.jp/mono/movie/adult/juyu002/juyu002pl.jpg,https://onejav.com/torrent/juyu002/download/81542710/onejav.com_juyu002.torrent,"Kimono, Yukata, Lotion, Mature Woman, Soapland, Solowork",奈良崎みづき,2026-03-24,https://onejav.com/torrent/juyu002
NSFS467,AIリマスター版 被害者はいつも女… 婦女暴行,8.2 GB,https://pics.dmm.co.jp/mono/movie/adult/nsfs467/nsfs467pl.jpg,https://onejav.com/torrent/nsfs467/download/17849142/onejav.com_nsfs467.torrent,"Best, Omnibus, Drama, Multiple Story","小池絵美子, 桜沢まひる, 平山加奈, ほのか優, 白坂百合, 雛形ともこ, 宮台かな, 藤本ちさと, 東城えみ, 黒田ユリ",2026-03-24,https://onejav.com/torrent/nsfs467
PETS064,素人美女装子が初AV出演！！最初で最後かもしれない貴重な生アナルSEX,4.3 GB,https://pics.dmm.co.jp/mono/movie/adult/pets064/pets064pl.jpg,https://onejav.com/torrent/pets064/download/43254389/onejav.com_pets064.torrent,"Amateur, Anal, Cross Dressing, Debut Production, Transsexual",,2026-03-24,https://onejav.com/torrent/pets064
