code,title,size,image_url,torrent_url,tags,actresses,date,page_url
FC2PPV4854487,FC2-PPV-4854487 【顔出し・無・中】『本気出しちゃおうかな♡』巨乳スレンダーネキによる鬼イカせキタｗありえない神技フェラ！口マンコ責めでチンポがバカになるまでしゃぶりつくす！,6.3 GB,https://contents-thumbnail2.fc2.com/w1280/storage200000.contents.fc2.com/file/408/40702218/1772025123.68.png,https://onejav.com/torrent/fc2ppv4854487/download/45939702/onejav.com_fc2ppv4854487.torrent,"Amateur, Blow, Breasts, FC2, Uncensored",,2026-03-01,https://onejav.com/torrent/fc2ppv4854487
FC2PPV4856380,FC2-PPV-4856380 3日間！70OFF【初撮り】某有名地下ドルがハメ撮りさせてくれるって夢ですか？性欲つよつよな20歳が、ダンスで鍛えた体でおじさんを誘惑しまくる。。。,7.0 GB,https://contents-thumbnail2.fc2.com/w1280/storage201000.contents.fc2.com/file/385/38454154/1772196973.27.jpg,https://onejav.com/torrent/fc2ppv4856380/download/17254149/onejav.com_fc2ppv4856380.torrent,"Amateur, Breasts, Creampie, FC2, Huge Butt, POV, Uncensored",,2026-03-01,https://onejav.com/torrent/fc2ppv4856380
FC2PPV4856735,FC2-PPV-4856735 【前編】『骨格ウェーブ爆デカ尻』神色白爆美女SSSS級真っ白な天使ちゃん大量潮吹き【４Ｋ】,2.6 GB,https://contents-thumbnail2.fc2.com/w1280/storage200000.contents.fc2.com/file/366/36549441/1772253924.34.jpg,https://onejav.com/torrent/fc2ppv4856735/download/90833995/onejav.com_fc2ppv4856735.torrent,"Amateur, Beautiful Girl, Breasts, FC2, Finger Fuck, Petite, Shaved, Squirting",,2026-03-01,https://onejav.com/torrent/fc2ppv4856735
FC2PPV4856738,FC2-PPV-4856738 【後編】『骨格ウェーブ爆デカ尻』神色白爆美女SSSS級真っ白な天使Kちゃん大量潮吹きSEX【４Ｋ】,2.3 GB,https://contents-thumbnail2.fc2.com/w1280/storage200000.contents.fc2.com/file/366/36549441/1772254523.26.jpg,https://onejav.com/torrent/fc2ppv4856738/download/73281221/onejav.com_fc2ppv4856738.torrent,"Amateur, Beautiful Girl, Beautiful legs, FC2, Finger Fuck, Petite, POV, Shaved, Squirting",,2026-03-01,https://onejav.com/torrent/fc2ppv4856738
FC2PPV4856864,FC2-PPV-4856864 初撮り！【無】【中出し】経験人数が少なく彼氏に一途な美女をNTR。彼ちんより気持ち良くなっちゃう濡れまんこに中出し。水着の日焼け跡がシコい。※特典あり,3.0 GB,https://contents-thumbnail2.fc2.com/w1280/storage201000.contents.fc2.com/file/391/39050133/1772267313.04.jpg,https://onejav.com/torrent/fc2ppv4856864/download/10013959/onejav.com_fc2ppv4856864.torrent,"Amateur, Blow, Breasts, Creampie, FC2, POV, Shaved, Slender, Uncensored",,2026-03-01,https://onejav.com/torrent/fc2ppv4856864
HEYZO3792,,2.5 GB,https://www.heyzo.com/contents/3000/3792/images/player_thumbnail_en.jpg,https://onejav.com/torrent/heyzo3792/download/84129782/onejav.com_heyzo3792.torrent,,,2026-03-01,https://onejav.com/torrent/heyzo3792
ADN762,あなたの為に、私は… 不倫の言い訳を探す汗まみれの若妻 幸村泉希,5.0 GB,https://pics.dmm.co.jp/mono/movie/adult/adn762/adn762pl.jpg,https://onejav.com/torrent/adn762/download/02991817/onejav.com_adn762.torrent,"Affair, Bride, Young Wife, Creampie, Cuckold, Drama, Solowork",幸村泉希,2026-03-01,https://onejav.com/torrent/adn762
CAWD957,ザーメン精子大好きメチャかわ変態メイドはご主人様が尽きるまでめちゃくちゃ大量顔射ぶっかけられたい。 幸村泉希 【美少女キャラ 解禁】,5.2 GB,https://pics.dmm.co.jp/mono/movie/adult/cawd957/cawd957pl.jpg,https://onejav.com/torrent/cawd957/download/75146200/onejav.com_cawd957.torrent,"Acme · Orgasm, Bukkake, Facials, Maid, Slender, Solowork",幸村泉希,2026-03-01,https://onejav.com/torrent/cawd957
GAS537,ヌルヌル爆乳肉弾中出しソープ 新人Kカップ乳店 茜さな,5.4 GB,https://pics.dmm.co.jp/mono/movie/adult/71gas537/71gas537pl.jpg,https://onejav.com/torrent/gas537/download/00363689/onejav.com_gas537.torrent,"BBW, Big Tits, Creampie, Prostitutes, Solowork, Titty Fuck",茜さな,2026-03-01,https://onejav.com/torrent/gas537
HODV22046,小悪魔生徒会長のいちゃ甘サド校内誘惑 椎名ななみ,5.4 GB,https://pics.dmm.co.jp/mono/movie/adult/41hodv22046/41hodv22046pl.jpg,https://onejav.com/torrent/hodv22046/download/26952566/onejav.com_hodv22046.torrent,"Big Tits, BIGセール, Cosplay, Creampie, School Stuff, Solowork",椎名ななみ,2026-03-01,https://onejav.com/torrent/hodv22046
