code,title,size,image_url,torrent_url,tags,actresses,date,page_url
ATYA036,おじさん大好きなミニ若妻極太浮気チ●ポで中イキさせられ、戻れない快楽堕ち！ 松井日奈子,5.3 GB,https://pics.dmm.co.jp/mono/movie/adult/atya036/atya036pl.jpg,https://onejav.com/torrent/atya036/download/07027823/onejav.com_atya036.torrent,"Deep Throating, Huge Cock, Married Woman, Small Tits, Solowork",松井日奈子,2026-03-16,https://onejav.com/torrent/atya036
JUTA191,極上！！四十路奥さま初脱ぎAVドキュメント 江崎奈央,5.5 GB,https://pics.dmm.co.jp/mono/movie/adult/juta191/juta191pl.jpg,https://onejav.com/torrent/juta191/download/67856474/onejav.com_juta191.torrent,"Creampie, Debut Production, Documentary, Married Woman, Mature Woman, Solowork",江崎奈央,2026-03-16,https://onejav.com/torrent/juta191
PKPD411,円女交際中出しoK18歳 先輩にフラれてヤリ○ン期間中のGカップ水泳部女子 糸井瑠花,5.6 GB,https://pics.dmm.co.jp/mono/movie/adult/pkpd411/pkpd411pl.jpg,https://onejav.com/torrent/pkpd411/download/43229973/onejav.com_pkpd411.torrent,"Beautiful Girl, Big Tits, Breasts, Creampie, POV, Solowork",糸井瑠花,2026-03-16,https://onejav.com/torrent/pkpd411
PTS540,結婚式帰りの友達同士！ 童貞君とSEXの練習してあげてくれませんか？初めての膣キュンっシンデレラ3P筆下ろし！,7.4 GB,https://pics.dmm.co.jp/mono/movie/adult/h_021pts540/h_021pts540pl.jpg,https://onejav.com/torrent/pts540/download/66460054/onejav.com_pts540.torrent,"3P, 4P, Blow, Creampie, Nampa, Older Sister",,2026-03-16,https://onejav.com/torrent/pts540
PTS541,心優しい先生2人組さん！ 早漏に悩む童貞君の性教育実習してくれませんか？美人教師と初めての3P筆下ろしSEX！,6.3 GB,https://pics.dmm.co.jp/mono/movie/adult/h_021pts541/h_021pts541pl.jpg,https://onejav.com/torrent/pts541/download/19053938/onejav.com_pts541.torrent,"3P, 4P, Creampie, Female Teacher, Handjob, Nampa",,2026-03-16,https://onejav.com/torrent/pts541
SKMJ727,家族の絆が性欲に負ける！？卒業式直後の父娘が相互エステ密着オイルエステぬるぬる素股体験！？お互いの身体を施術…「お父さん大きくなってる。」父のフル勃起に驚きながらもクリトリスとち○ぽを擦り合わせた親子は理性を保てず欲望のままにヌルっと近親相○ナマ挿入し…,9.1 GB,https://pics.dmm.co.jp/mono/movie/adult/h_1324skmj727/h_1324skmj727pl.jpg,https://onejav.com/torrent/skmj727/download/06295501/onejav.com_skmj727.torrent,"Amateur, BIGセール, Creampie, Incest, Lotion, Massage, Nampa, School Girls, Uniform",,2026-03-16,https://onejav.com/torrent/skmj727
SKMJ728,美人で巨乳な彼有りの姉と童貞弟が高額賞金かけて野球拳で対決！？「姉ちゃんの裸で興奮するわけないじゃん！」と言いつつ童貞弟バッキバキ勃起ガチ欲情＆お姉ちゃんも弟デカチンに赤面発情（＾＾；）仲良し姉弟筆おろし中出しSP,9.3 GB,https://pics.dmm.co.jp/mono/movie/adult/h_1324skmj728/h_1324skmj728pl.jpg,https://onejav.com/torrent/skmj728/download/48410174/onejav.com_skmj728.torrent,"Amateur, Beautiful Girl, Big Tits, BIGセール, Creampie, Female College Student, Incest, Nampa, Sister, Virgin Man",,2026-03-16,https://onejav.com/torrent/skmj728
WA580,優しいママ友さん 童貞くんにハーレム3P筆おろし！,6.4 GB,https://pics.dmm.co.jp/mono/movie/adult/h_047wa580/h_047wa580pl.jpg,https://onejav.com/torrent/wa580/download/42023882/onejav.com_wa580.torrent,"3P, 4P, Creampie, Married Woman, Mature Woman, Nampa",,2026-03-16,https://onejav.com/torrent/wa580
WA581,眠れる膣の美女 夢アクメ中出し32人 5時間,13.1 GB,https://pics.dmm.co.jp/mono/movie/adult/h_047wa581/h_047wa581pl.jpg,https://onejav.com/torrent/wa581/download/89534128/onejav.com_wa581.torrent,"4HR+, Creampie, Married Woman, Older Sister, School Girls",,2026-03-16,https://onejav.com/torrent/wa581
FC2PPV4863961,FC2-PPV-4863961 【音量注意】美容系19《オホ声絶叫》膣奥ガン突き！○従・屈○セックス‼,5.7 GB,https://contents-thumbnail2.fc2.com/w1280/storage201000.contents.fc2.com/file/394/39385099/1773492139.75.png,https://onejav.com/torrent/fc2ppv4863961/download/18235096/onejav.com_fc2ppv4863961.torrent,"Amateur, FC2, POV",,2026-03-16,https://onejav.com/torrent/fc2ppv4863961
