code,title,size,image_url,torrent_url,tags,actresses,date,page_url
FC2PPV4901173,FC2-PPV-4901173 【二週間50%OFF】清楚系黒髪ロングJD美女 ホテルで淫乱覚醒 無碼ハメ撮り 美尻ピストン＋2回口内射精＆ごっくん,2.0 GB,https://contents-thumbnail2.fc2.com/w1280/storage200000.contents.fc2.com/file/373/37213813/1778835597.98.png,https://onejav.com/torrent/fc2ppv4901173/download/60772645/onejav.com_fc2ppv4901173.torrent,"Amateur, Blow, Cum, FC2, POV",,2026-05-19,https://onejav.com/torrent/fc2ppv4901173
FC2PPV4901422,FC2-PPV-4901422 22日迄1490pt!!【初】やばい㋙見つけました。※早期特典「ガチ素人」カレシに内緒で応募！   自ら.くぱぁ「使用してください、」きもじよずぎで、失神寸前・。従順マン㋙に中だしマーキング！,4.5 GB,https://contents-thumbnail2.fc2.com/w1280/storage200000.contents.fc2.com/file/359/35808353/1778838055.75.png,https://onejav.com/torrent/fc2ppv4901422/download/17354731/onejav.com_fc2ppv4901422.torrent,"Amateur, Blow, Breasts, FC2, POV",,2026-05-19,https://onejav.com/torrent/fc2ppv4901422
FC2PPV4901550,FC2-PPV-4901550 【神Body神スレンダー♡】ぷるぷるＦカップ美ボディの渋谷１０９ｱﾊﾟﾚﾙ店員。神乳美ボディをカメラの前に見せつけイキまくる密会映像。,6.3 GB,https://contents-thumbnail2.fc2.com/w1280/storage201000.contents.fc2.com/file/286/28519270/1779057390.96.jpg,https://onejav.com/torrent/fc2ppv4901550/download/60737246/onejav.com_fc2ppv4901550.torrent,"Amateur, Big Tits, Breasts, Butt, Creampie, FC2, POV, Slender",,2026-05-19,https://onejav.com/torrent/fc2ppv4901550
FC2PPV4902134,FC2-PPV-4902134 【顔出し！】地方女子アナ内定の美女まゆちゃんに最後の火遊びでおじ精子を大量孕ませ生中出し！！,4.7 GB,https://contents-thumbnail2.fc2.com/w1280/storage201000.contents.fc2.com/file/407/40685789/1778912919.83.png,https://onejav.com/torrent/fc2ppv4902134/download/71855484/onejav.com_fc2ppv4902134.torrent,"Amateur, Beautiful Girl, Black Hair, FC2, Uncensored",,2026-05-19,https://onejav.com/torrent/fc2ppv4902134
FC2PPV4902935,FC2-PPV-4902935 70％OFF【初撮り】ＯＬのガチ性事情はコチラです。23歳、新卒ガールが日々のストレスをセックスで発散したいらしいので、連続2回戦でイカセまくりました。,11.3 GB,https://contents-thumbnail2.fc2.com/w1280/storage200000.contents.fc2.com/file/385/38454154/1779050258.5.jpg,https://onejav.com/torrent/fc2ppv4902935/download/86135008/onejav.com_fc2ppv4902935.torrent,"Amateur, Breasts, Creampie, FC2, POV, Uncensored",,2026-05-19,https://onejav.com/torrent/fc2ppv4902935
FC2PPV4903171,FC2-PPV-4903171 【顔出し解禁】”神ビジュ新生アイドル18歳” 加入わずか1週間で限界FC2デビュー。ピル無しガチ生中出し映像。※残りわずか,4.7 GB,https://contents-thumbnail2.fc2.com/w1280/storage200000.contents.fc2.com/file/393/39269224/1779095330.3.png,https://onejav.com/torrent/fc2ppv4903171/download/50662903/onejav.com_fc2ppv4903171.torrent,"Amateur, Beautiful Girl, Big Tits, Blow, Breasts, Close Up, Creampie, FC2, POV, Slender",,2026-05-19,https://onejav.com/torrent/fc2ppv4903171
FC2PPV4903172,FC2-PPV-4903172 【無修正ｘ個人撮影】★Kerberos特別編★えっちOKなレンタル彼女を頼んでみたら、スタイル良すぎるFカップ美女登場！いちゃいちゃ具合が半端ないって！！,3.3 GB,https://contents-thumbnail2.fc2.com/w1280/storage201000.contents.fc2.com/file/316/31589918/1779086923.56.jpg,https://onejav.com/torrent/fc2ppv4903172/download/47319958/onejav.com_fc2ppv4903172.torrent,"Amateur, Big Tits, Breasts, Cowgirl, Creampie, FC2, Masturbation, POV, Slender, Uncensored",,2026-05-19,https://onejav.com/torrent/fc2ppv4903172
FC2PPV4903210,FC2-PPV-4903210 【無修正】《3日間限定》モデル級のスタイルのOLちゃん♡トレーニング用の自前水着を着させてイチャラブセックス2発中出し!※未公開特典付き,4.9 GB,https://contents-thumbnail2.fc2.com/w1280/storage201000.contents.fc2.com/file/410/40976927/1779089347.83.jpg,https://onejav.com/torrent/fc2ppv4903210/download/07500003/onejav.com_fc2ppv4903210.torrent,"Amateur, Creampie, FC2, OL, Slender, Swimsuit, Uncensored",,2026-05-19,https://onejav.com/torrent/fc2ppv4903210
HEYZO3850,,2.2 GB,https://www.heyzo.com/contents/3000/3850/images/player_thumbnail_en.jpg,https://onejav.com/torrent/heyzo3850/download/68099206/onejav.com_heyzo3850.torrent,,,2026-05-19,https://onejav.com/torrent/heyzo3850
FC2PPV4903231,FC2-PPV-4903231 空港でも話題になるほどのGカップ美人CAさんが登場！剛毛ピンクの可愛らしいマンコにハメまくりの孕ませ中出し！超大量口内射精も！,1.6 GB,https://contents-thumbnail2.fc2.com/w1280/storage200000.contents.fc2.com/file/399/39880699/1779091456.12.png,https://onejav.com/torrent/fc2ppv4903231/download/20410016/onejav.com_fc2ppv4903231.torrent,"Amateur, FC2",,2026-05-19,https://onejav.com/torrent/fc2ppv4903231
