code,title,size,image_url,torrent_url,tags,actresses,date,page_url
FC2PPV4857717,FC2-PPV-4857717 本日迄！限定価格【顔出し/無】これで最後！マン毛もっさり清楚黒髪JD。夢に向かって走り出す。本当のラストSEX。最後は求め合うままに大量中出し,3.8 GB,https://contents-thumbnail2.fc2.com/w1280/storage200000.contents.fc2.com/file/379/37807540/1772456115.81.png,https://onejav.com/torrent/fc2ppv4857717/download/62631548/onejav.com_fc2ppv4857717.torrent,"Amateur, Beautiful Girl, Blow, Breasts, Creampie, FC2, Hot Spring, POV, Uncensored",,2026-03-06,https://onejav.com/torrent/fc2ppv4857717
FC2PPV4858867,FC2-PPV-4858867 【完全顔出し】【メンヘラ】FC2初上陸、メンヘラチックでアニメ声の”このみちゃん”、ガクブルする醜態性が詰まった９０分、もう逝きすぎて立てません！,5.5 GB,https://contents-thumbnail2.fc2.com/w1280/storage200000.contents.fc2.com/file/377/37664104/1772641135.21.jpg,https://onejav.com/torrent/fc2ppv4858867/download/28227592/onejav.com_fc2ppv4858867.torrent,"Amateur, Black Hair, Cosplay, Creampie, Electric Massager, FC2, M女, Nasty, Hardcore",,2026-03-06,https://onejav.com/torrent/fc2ppv4858867
FC2PPV4858872,FC2-PPV-4858872 【無修正ｘ個人撮影】★Kerberos番外編★五十路熟女がトレーニングウェアのまま突かれまくり！ダブルおもちゃ責めで悶絶・絶叫でイキまくってノックアウトｗ,5.7 GB,https://contents-thumbnail2.fc2.com/w1280/storage200000.contents.fc2.com/file/316/31589918/1772644074.75.jpg,https://onejav.com/torrent/fc2ppv4858872/download/35231023/onejav.com_fc2ppv4858872.torrent,"Affair, Amateur, Blow, Cosplay, FC2, Married Woman, Mature Woman, POV, Toy, Uncensored",,2026-03-06,https://onejav.com/torrent/fc2ppv4858872
FC2PPV4858878,FC2-PPV-4858878 【ラスト作品】１９歳 青山学院大生、フェロモン溢れる色白スレンダーな奇跡の軟体美脚む./す./め。後輩ハメ撮り師をひと皮剥けさせる本能的SEX映像。,7.9 GB,https://contents-thumbnail2.fc2.com/w1280/storage201000.contents.fc2.com/file/286/28519270/1772646635.48.jpg,https://onejav.com/torrent/fc2ppv4858878/download/78482532/onejav.com_fc2ppv4858878.torrent,"Amateur, Cosplay, Creampie, FC2, Flexible, Long Hair, POV, Slender, Toy",,2026-03-06,https://onejav.com/torrent/fc2ppv4858878
FC2PPV4859003,FC2-PPV-4859003 一週間50%OFF「豪華7発射」都内で医療系企業勤めスタイル抜群の事務員さん。舌使いでチンポをしゃぶりながらマンコがびしょ濡れ大興奮。ごっくん、顔射、中出し総計7発射肉便器調教しっかりコ作り。,4.0 GB,https://contents-thumbnail2.fc2.com/w1280/storage201000.contents.fc2.com/file/373/37213813/1772683239.2.png,https://onejav.com/torrent/fc2ppv4859003/download/27347862/onejav.com_fc2ppv4859003.torrent,"Amateur, Blow, Creampie, Cum, Facials, FC2, Pregnant, Uncensored",,2026-03-06,https://onejav.com/torrent/fc2ppv4859003
HEYZO3798,,2.0 GB,https://www.heyzo.com/contents/3000/3798/images/player_thumbnail_en.jpg,https://onejav.com/torrent/heyzo3798/download/69925386/onejav.com_heyzo3798.torrent,,,2026-03-06,https://onejav.com/torrent/heyzo3798
FWAY089,兎はコールガールの夢を見る 宮下玲奈,4.3 GB,https://pics.dmm.co.jp/mono/movie/adult/fway089/fway089pl.jpg,https://onejav.com/torrent/fway089/download/75553338/onejav.com_fway089.torrent,"Beautiful Girl, Breasts, Cosplay, Image Video, Slender, Solowork",Rena Miyashita,2026-03-06,https://onejav.com/torrent/fway089
FWAY091,,5.1 GB,https://pics.dmm.co.jp/mono/movie/adult/fway091/fway091pl.jpg,https://onejav.com/torrent/fway091/download/11445256/onejav.com_fway091.torrent,,,2026-03-06,https://onejav.com/torrent/fway091
IPZZ797,おどおどブルブル… 押し弱アイドルはプロデューサーのいいなりなので無理矢理温泉旅行に連れてかれオナホ扱いされています 姫森あむ,6.7 GB,https://pics.dmm.co.jp/mono/movie/adult/ipzz797/ipzz797pl.jpg,https://onejav.com/torrent/ipzz797/download/76622724/onejav.com_ipzz797.torrent,"Beautiful Girl, Big Tits, Hot Spring, Idol, POV, Solowork",姫森あむ,2026-03-06,https://onejav.com/torrent/ipzz797
IPZZ800,SEX があまりにもエロすぎて入店3ヶ月で1億円プレイヤーになった銀座の新星キャバ嬢 第二章 AV男優を上客として仕掛け撮影した台本無しのプライベートアフターSEXがやはり凄かった 紫月みやび,4.9 GB,https://pics.dmm.co.jp/mono/movie/adult/ipzz800/ipzz800pl.jpg,https://onejav.com/torrent/ipzz800/download/98658810/onejav.com_ipzz800.torrent,"Beautiful Girl, Big Tits, Blow, Prostitutes, Solowork",紫月みやび,2026-03-06,https://onejav.com/torrent/ipzz800
