code,title,size,image_url,torrent_url,tags,actresses,date,page_url
FC2PPV4891181,FC2-PPV-4891181 ※22日まで50％OFF※【個撮】恥ずかしがり屋の清楚系会社員に生中出し...,1.9 GB,https://contents-thumbnail2.fc2.com/w1280/storage201000.contents.fc2.com/file/403/40214313/1777426274.03.jpg,https://onejav.com/torrent/fc2ppv4891181/download/72655527/onejav.com_fc2ppv4891181.torrent,"Amateur, Blow, Breasts, Creampie, FC2, POV, Shaved, Slender",,2026-05-05,https://onejav.com/torrent/fc2ppv4891181
FC2PPV4891184,FC2-PPV-4891184 ※23日まで25％OFF※【個撮】欲求が溜まりまくった人妻と温泉旅行で不倫SEX,3.5 GB,https://contents-thumbnail2.fc2.com/w1280/storage200000.contents.fc2.com/file/403/40214313/1777426798.43.jpg,https://onejav.com/torrent/fc2ppv4891184/download/58678338/onejav.com_fc2ppv4891184.torrent,"Amateur, Big Tits, Blow, Breasts, Butt, FC2, Handjob, Married Woman, POV, Shaved, Slender, Titty Fuck",,2026-05-05,https://onejav.com/torrent/fc2ppv4891184
FC2PPV4892437,FC2-PPV-4892437 【初】新人 ※早期購入特典「売れっ子令和のキャバ嬢」  絶頂無限イキ地獄。びくつく「雑魚マン㋙」に濃厚.男汁出しちゃいました！,4.5 GB,https://contents-thumbnail2.fc2.com/w1280/storage200000.contents.fc2.com/file/359/35808353/1777534757.16.png,https://onejav.com/torrent/fc2ppv4892437/download/22676144/onejav.com_fc2ppv4892437.torrent,"Amateur, Back, Beautiful Girl, Blow, Breasts, Cowgirl, FC2, Gal, POV, Slender, Toy",,2026-05-05,https://onejav.com/torrent/fc2ppv4892437
FC2PPV4892747,FC2-PPV-4892747 爆乳デカ尻！【無】【中出し】Ｉカップの爆乳女はドMちゃん。牛のような胸を楽しんだ後は敏感まんこに中出し。ノリも感度も良くて楽しかった。※特典あり,2.9 GB,https://contents-thumbnail2.fc2.com/w1280/storage201000.contents.fc2.com/file/391/39050133/1777564279.85.jpg,https://onejav.com/torrent/fc2ppv4892747/download/59807108/onejav.com_fc2ppv4892747.torrent,"Amateur, Big Tits, Blow, Creampie, FC2, POV, Shaved, Uncensored",,2026-05-05,https://onejav.com/torrent/fc2ppv4892747
FC2PPV4894236,FC2-PPV-4894236 特典映像付【どスケベな目隠しS⚫︎X】変態プレイ大好き彼女をハメ撮り目隠し、中出し、なんでもあり 大量濃厚ザーメンぶっこみ,1.2 GB,https://contents-thumbnail2.fc2.com/w1280/storage200000.contents.fc2.com/file/221/22068066/1777731866.92.jpg,https://onejav.com/torrent/fc2ppv4894236/download/65194647/onejav.com_fc2ppv4894236.torrent,"Amateur, Beautiful Girl, Blow, Creampie, FC2, POV, Uniform",,2026-05-05,https://onejav.com/torrent/fc2ppv4894236
FC2PPV4894516,FC2-PPV-4894516 ※8日まで初回限定70％OFF※【19歳の新女子大生みかちゃん後編】喘ぎ方もまだ知らない、大学入学したてのみかちゃんに激しい大人のセックス教えました,3.8 GB,https://contents-thumbnail2.fc2.com/w1280/storage200000.contents.fc2.com/file/366/36590517/1777794498.59.jpg,https://onejav.com/torrent/fc2ppv4894516/download/75873826/onejav.com_fc2ppv4894516.torrent,"Amateur, Beautiful Girl, Blow, Breasts, Creampie, FC2, Petite, POV, Shaved, Slender, Toy",,2026-05-05,https://onejav.com/torrent/fc2ppv4894516
FC2PPV4895187,FC2-PPV-4895187 ※11日まで初回限定50％OFF※【顔出し・詫びの人妻ハメ撮り編】悲報が飛び込んできました。しかし再撮影を求める声には答えられました。しかしお詫びしなくてはいけないこともあります,4.5 GB,https://contents-thumbnail2.fc2.com/w1280/storage200000.contents.fc2.com/file/377/37682362/1777856838.92.jpg,https://onejav.com/torrent/fc2ppv4895187/download/94587244/onejav.com_fc2ppv4895187.torrent,"Affair, Amateur, Beautiful Girl, Blow, Creampie, Electric Massager, FC2, Handjob, Married Woman, Masturbation, POV, Shaved",,2026-05-05,https://onejav.com/torrent/fc2ppv4895187
FC2PPV4895340,FC2-PPV-4895340 70％OFF【彼氏持ち】【５Ｐ】１８歳の彼氏持ちは俺らの肉便器！彼氏いるなんて聞いてねえし！容赦しねえ！色白Ｅカップのカラダを開発！！パイパンおまんこはかっ開き！！！止まらぬ連続中出しで大量射精！！！,5.8 GB,https://contents-thumbnail2.fc2.com/w1280/storage200000.contents.fc2.com/file/385/38454154/1777874781.28.jpg,https://onejav.com/torrent/fc2ppv4895340/download/37482361/onejav.com_fc2ppv4895340.torrent,"Amateur, Breasts, Butt, Creampie, FC2, POV, Shaved, Squirting, Uncensored",,2026-05-05,https://onejav.com/torrent/fc2ppv4895340
FC2PPV4895351,FC2-PPV-4895351 ガチ　野外エッチ　バーベキューを抜け出して橋の下で　半年SEXしてない白濁汁出まくる女,1.3 GB,https://contents-thumbnail2.fc2.com/w1280/storage200000.contents.fc2.com/file/274/27324139/1777876589.35.PNG,https://onejav.com/torrent/fc2ppv4895351/download/31882906/onejav.com_fc2ppv4895351.torrent,"Amateur, Blow, Car Sex, FC2, Gal, Outdoors, POV",,2026-05-05,https://onejav.com/torrent/fc2ppv4895351
FC2PPV4895359,FC2-PPV-4895359 【無修正ｘ個人撮影】★Kerberos特別編★Gカップスタイル抜群美女が山奥を徘徊！誰か来ないかドキドキえっち♪後半はゆっくりホテルで中出ししておきましたｗ,3.0 GB,https://contents-thumbnail2.fc2.com/w1280/storage201000.contents.fc2.com/file/316/31589918/1777877084.27.jpg,https://onejav.com/torrent/fc2ppv4895359/download/37030535/onejav.com_fc2ppv4895359.torrent,"Amateur, Big Tits, Cowgirl, Creampie, FC2, Outdoors, POV, Shaved, Slender, Uncensored",,2026-05-05,https://onejav.com/torrent/fc2ppv4895359
