code,title,size,image_url,torrent_url,tags,actresses,date,page_url
MIDA624,,5.1 GB,https://pics.dmm.co.jp/mono/movie/adult/mida624/mida624pl.jpg,https://onejav.com/torrent/mida624/download/68151349/onejav.com_mida624.torrent,,,2026-05-01,https://onejav.com/torrent/mida624
CAWD988,はじめての中出し 初めての1ヶ月禁欲×人生初の生ち●ぽ生ハメ×怒涛の追撃ピストン kawaii*卒業 ナマ解禁スペシャル 香川あんず,4.2 GB,https://pics.dmm.co.jp/mono/movie/adult/cawd988/cawd988pl.jpg,https://onejav.com/torrent/cawd988/download/45950779/onejav.com_cawd988.torrent,"Acme · Orgasm, Creampie, Documentary, POV, Solowork, Squirting",香川あんず,2026-05-01,https://onejav.com/torrent/cawd988
MIDA616,彼女の妹のノーブラ誘惑に負け巨乳ナマ乳沼に溺れたサイテーなボク 福田ゆあ,5.3 GB,https://pics.dmm.co.jp/mono/movie/adult/mida616/mida616pl.jpg,https://onejav.com/torrent/mida616/download/30085613/onejav.com_mida616.torrent,"Big Tits, Cuckold, No Bra, Sister, Solowork, Uniform",福田ゆあ,2026-05-01,https://onejav.com/torrent/mida616
FC2PPV4891643,FC2-PPV-4891643 28日迄 1490pt!!【神回】※早期購入特典 スレンダー美女と奇跡のフュージョン「ぁぁ突いて！！」高速ちンポ一本突きで大暴発、大量射精フィニッシュ,4.7 GB,https://contents-thumbnail2.fc2.com/w1280/storage200000.contents.fc2.com/file/359/35808353/1777443258.09.png,https://onejav.com/torrent/fc2ppv4891643/download/16404003/onejav.com_fc2ppv4891643.torrent,"Amateur, Back, Beautiful Girl, Blow, Breasts, Cunnilingus, FC2, Model, POV, Slender",,2026-05-01,https://onejav.com/torrent/fc2ppv4891643
MNGS051,,7.0 GB,https://pics.dmm.co.jp/mono/movie/adult/mngs051/mngs051pl.jpg,https://onejav.com/torrent/mngs051/download/57572604/onejav.com_mngs051.torrent,,,2026-05-01,https://onejav.com/torrent/mngs051
FC2PPV4895410,FC2-PPV-4895410 【顔出し解禁】『爆乳Jカップグラドル 孕ませデート旅行』危険日2回中出し含むガチハメ撮り限定公開映像。 ※順次値上げ,2.6 GB,https://contents-thumbnail2.fc2.com/w1280/storage201000.contents.fc2.com/file/393/39269224/1777889006.2.jpg,https://onejav.com/torrent/fc2ppv4895410/download/69989198/onejav.com_fc2ppv4895410.torrent,"Amateur, Beautiful Girl, Big Tits, Blow, Breasts, Close Up, Creampie, FC2, POV, Slender",,2026-05-05,https://onejav.com/torrent/fc2ppv4895410
YUJ063,数年ぶりに会った元カノとお互いに彼氏彼女がいるのに「好き」って言いながら求め合うセフレ以上恋人未満の関係に溺れた日々。,6.7 GB,https://pics.dmm.co.jp/mono/movie/adult/yuj063/yuj063pl.jpg,https://onejav.com/torrent/yuj063/download/01041068/onejav.com_yuj063.torrent,"Beautiful Girl, Big Tits, Creampie, Cuckold, Slut, Solowork",神木彩,2026-05-01,https://onejav.com/torrent/yuj063
FC2PPV4892310,FC2-PPV-4892310 【2カメ個撮無修正】SEX依存症ファンキーギャル2回目の登場！今回もマシンガンアナルファッキングで狂気乱舞！,5.7 GB,https://contents-thumbnail2.fc2.com/w1280/storage201000.contents.fc2.com/file/384/38352955/1777528285.41.jpg,https://onejav.com/torrent/fc2ppv4892310/download/33235455/onejav.com_fc2ppv4892310.torrent,"Amateur, Anal, Blow, Creampie, FC2, Uncensored",,2026-05-01,https://onejav.com/torrent/fc2ppv4892310
CAWD977,エロすぎて、滅！55cm圧倒的クビレと奇跡の天然Gcupがホンマに良い美少女の、16発顔射ぶっかけポルノ大絶頂覚醒。 本間あさ美,5.4 GB,https://pics.dmm.co.jp/mono/movie/adult/cawd977/cawd977pl.jpg,https://onejav.com/torrent/cawd977/download/66040965/onejav.com_cawd977.torrent,"Beautiful Girl, Big Tits, Bukkake, Facials, Slender, Solowork",本間あさ美,2026-05-01,https://onejav.com/torrent/cawd977
CAWD983,,5.0 GB,https://pics.dmm.co.jp/mono/movie/adult/cawd983/cawd983pl.jpg,https://onejav.com/torrent/cawd983/download/87365529/onejav.com_cawd983.torrent,,,2026-05-01,https://onejav.com/torrent/cawd983
