code,title,size,image_url,torrent_url,tags,actresses,date,page_url
SNOS079,人気学生カップルインフルエンサーがSNSでバズりたくて迷い込んだ先は濃厚絶倫オヤジが住む淫欲まみれの変態村だった…。 白上咲花,5.0 GB,https://pics.dmm.co.jp/mono/movie/adult/snos079/snos079pl.jpg,https://onejav.com/torrent/snos079/download/43328485/onejav.com_snos079.torrent,"Acme · Orgasm, Beautiful Girl, Cuckold, Orgy, School Girls, Solowork",白上咲花,2026-02-25,https://onejav.com/torrent/snos079
FC2PPV4850984,FC2-PPV-4850984 【初撮り】【顔出し】【モ無】【生中】マッチングアプリで出会った姫と即パコ濃厚中出しセックス！！！,8.1 GB,https://contents-thumbnail2.fc2.com/w1280/storage201000.contents.fc2.com/file/392/39105329/1771468630.73.jpg,https://onejav.com/torrent/fc2ppv4850984/download/57316309/onejav.com_fc2ppv4850984.torrent,"Amateur, FC2",,2026-02-22,https://onejav.com/torrent/fc2ppv4850984
MIDA533,,6.2 GB,https://pics.dmm.co.jp/mono/movie/adult/mida533/mida533pl.jpg,https://onejav.com/torrent/mida533/download/96350728/onejav.com_mida533.torrent,,,2026-02-27,https://onejav.com/torrent/mida533
ADN765,夫公認NTR 浮気相手（僕の上司）とのセックスでしかイケなくなってしまった妻に懇願されて、泣きながら浮気を許すしかなかった僕。 美園和花,4.9 GB,https://pics.dmm.co.jp/mono/movie/adult/adn765/adn765pl.jpg,https://onejav.com/torrent/adn765/download/48068459/onejav.com_adn765.torrent,"Affair, Big Tits, Creampie, Cuckold, Married Woman, Solowork",美園和花,2026-02-27,https://onejav.com/torrent/adn765
ABF325,天然成分由来 三佳詩汁 120% 88【限定特典映像30分付き】,6.3 GB,https://image.mgstage.com/images/prestige/abf/325/pb_e_abf-325.jpg,https://onejav.com/torrent/abf325/download/71480760/onejav.com_abf325.torrent,"Big Tits, Facials, Shaved, Solowork, Squirting",三佳詩,2026-02-26,https://onejav.com/torrent/abf325
START522,大っ嫌いなサークルの先輩に嵌められ軟禁されたあの日 あと1回触られたらイっちゃう寸前まで執拗に焦らされ嫌なはずなのに「お願いします！もう…イカせてくださいぃ！」と絶頂おねだりしてしまい快楽堕ち 新川空,5.9 GB,https://pics.dmm.co.jp/mono/movie/adult/1start522/1start522pl.jpg,https://onejav.com/torrent/start522/download/82410126/onejav.com_start522.torrent,"3P, 4P, Acme · Orgasm, Facials, Solowork, Squirting",新川空,2026-02-24,https://onejav.com/torrent/start522
ABF323,,5.6 GB,https://image.mgstage.com/images/prestige/abf/323/pb_e_abf-323.jpg,https://onejav.com/torrent/abf323/download/66602960/onejav.com_abf323.torrent,,,2026-02-26,https://onejav.com/torrent/abf323
START521,,7.0 GB,https://pics.dmm.co.jp/mono/movie/adult/1start521/1start521pl.jpg,https://onejav.com/torrent/start521/download/13076193/onejav.com_start521.torrent,,,2026-02-24,https://onejav.com/torrent/start521
CAWD951,人気絶頂で調子乗ってるT●KT●Kインフルエンサーを潮まみれエビ反りまみれ鬼連チャンイかせて理解らせます。 香川あんず,5.4 GB,https://pics.dmm.co.jp/mono/movie/adult/cawd951/cawd951pl.jpg,https://onejav.com/torrent/cawd951/download/81854821/onejav.com_cawd951.torrent,"Acme · Orgasm, Breasts, Facials, Nasty, Hardcore, Solowork, Squirting",香川あんず,2026-02-27,https://onejav.com/torrent/cawd951
300MIUM1323,【ドM女、お貸しします】おち●ぽ触らせてください。お願いします…。意地悪したくなっちゃう可愛い顔のちん媚びアイドルM女。時間がくるまで好きホーダイ使いホーダイ。Mは何でもアリ。だって、Mだから……。,3.3 GB,https://image.mgstage.com/images/prestigepremium/300mium/1323/pb_e_300mium-1323.jpg,https://onejav.com/torrent/300mium1323/download/28267982/onejav.com_300mium1323.torrent,"Amateur, Deep Throating, Masturbation, Restraint, SM",,2026-02-24,https://onejav.com/torrent/300mium1323
