code,title,size,image_url,torrent_url,tags,actresses,date,page_url
ABF328,朝勃ちチ○ポで起き抜けからハメまくる土曜日。 涼森れむ【限定特典映像30分付き】,6.0 GB,https://image.mgstage.com/images/prestige/abf/328/pb_e_abf-328.jpg,https://onejav.com/torrent/abf328/download/84068025/onejav.com_abf328.torrent,"Big Tits, Butt, Solowork",Remu Suzumori,2026-03-12,https://onejav.com/torrent/abf328
MIDA568,新人 脱・看護師 Jカップ専属 葉山みりあAV Debut！,6.3 GB,https://pics.dmm.co.jp/mono/movie/adult/mida568/mida568pl.jpg,https://onejav.com/torrent/mida568/download/57561770/onejav.com_mida568.torrent,"3P, 4P, Big Tits, Blow, Debut Production, POV, Solowork",葉山みりあ,2026-03-13,https://onejav.com/torrent/mida568
EBWH309,オレが痴●をヤメられないのはだらしないデカパイ人妻がスキだらけで電車に乗るせいだろ？ 柏木ふみか,5.9 GB,https://pics.dmm.co.jp/mono/movie/adult/ebwh309/ebwh309pl.jpg,https://onejav.com/torrent/ebwh309/download/94949306/onejav.com_ebwh309.torrent,"Acme · Orgasm, Big Tits, Busty Fetish, Married Woman, Nasty, Hardcore, Solowork",柏木ふみか,2026-03-13,https://onejav.com/torrent/ebwh309
EBWH319,純白いたいけ巨乳薬学生、新薬研究中にできてしまった老教授のキモチイイおクスリで… 年季入りの古ペニスに染まっちゃった。 白羽舞菜,7.0 GB,https://pics.dmm.co.jp/mono/movie/adult/ebwh319/ebwh319pl.jpg,https://onejav.com/torrent/ebwh319/download/26875416/onejav.com_ebwh319.torrent,"3P, 4P, Acme · Orgasm, Big Tits, Female College Student, Nasty, Hardcore, Solowork",白羽舞菜,2026-03-13,https://onejav.com/torrent/ebwh319
FC2PPV4861113,FC2-PPV-4861113 【7日間限定セール】コミュ障で控えめなメンエス嬢を暴走ちんぽで好き放題して自分好みにしちゃいました♡【無修正・中出し】,4.9 GB,https://contents-thumbnail2.fc2.com/w1280/storage200000.contents.fc2.com/file/381/38031442/1773044563.49.png,https://onejav.com/torrent/fc2ppv4861113/download/33294618/onejav.com_fc2ppv4861113.torrent,"Amateur, Beautiful Girl, Blow, Creampie, Electric Massager, FC2, Toy, Uncensored",,2026-03-14,https://onejav.com/torrent/fc2ppv4861113
EBWH304,「俺の彼女に1，000円で中出ししませんか？w」NTR好きの彼氏に乳まる出し立ちんぼさせられてます… 清宮仁愛,6.7 GB,https://pics.dmm.co.jp/mono/movie/adult/ebwh304/ebwh304pl.jpg,https://onejav.com/torrent/ebwh304/download/00364737/onejav.com_ebwh304.torrent,"Big Tits, Busty Fetish, Creampie, Documentary, Solowork, Titty Fuck",清宮仁愛,2026-03-13,https://onejav.com/torrent/ebwh304
MIDA563,姪っ子（陸上スポーツ選手）の健康的なハミ尻を中年テク×媚薬ち○ぽで責め続けたら、ケツ肉ピクピク痙攣絶倫ピストンイキに沼ってしまった。 九野ひなの,5.1 GB,https://pics.dmm.co.jp/mono/movie/adult/mida563/mida563pl.jpg,https://onejav.com/torrent/mida563/download/30590965/onejav.com_mida563.torrent,"Acme · Orgasm, Beautiful Girl, Big Tits, Butt, Solowork, Sport",Hinano Kuno,2026-03-13,https://onejav.com/torrent/mida563
FC2PPV4862565,FC2-PPV-4862565 バスト100㎝の爆乳ナース人妻 ロケットおっぱいに挟まれながら快楽絶頂SEX,5.2 GB,https://contents-thumbnail2.fc2.com/w1280/storage200000.contents.fc2.com/file/297/29683723/1773281076.04.jpg,https://onejav.com/torrent/fc2ppv4862565/download/09661002/onejav.com_fc2ppv4862565.torrent,"Amateur, Big Tits, Breasts, Creampie, FC2, Married Woman, POV",,2026-03-13,https://onejav.com/torrent/fc2ppv4862565
FC2PPV4862988,FC2-PPV-4862988 【無・顔出し】170cmの黒髪ボブ。クールな雰囲気の長身スレンダー美女をノーカット撮影,4.7 GB,https://contents-thumbnail2.fc2.com/w1280/storage201000.contents.fc2.com/file/343/34292857/1773348242.62.jpg,https://onejav.com/torrent/fc2ppv4862988/download/30200476/onejav.com_fc2ppv4862988.torrent,"Amateur, Beautiful legs, Black Hair, Butt, Creampie, FC2, Slender, Tall, Uncensored",,2026-03-14,https://onejav.com/torrent/fc2ppv4862988
PRST025,新人 葉月なぎさ この美女の騎乗位で暴発したい。 男をイカせる素人離れしたエロセンスの現役看護師 プロ男優のイキ顔見たさにAVデビュー,6.1 GB,https://pics.dmm.co.jp/mono/movie/adult/prst025/prst025pl.jpg,https://onejav.com/torrent/prst025/download/61436409/onejav.com_prst025.torrent,"Big Tits, Blow, Cowgirl, Debut Production, Older Sister, Solowork",葉月なぎさ,2026-03-13,https://onejav.com/torrent/prst025
