code,title,size,image_url,torrent_url,tags,actresses,date,page_url
MIDA642,ズルい程、最高にエロいカラダ 普段はOL 副業AV DEBUT 1本限定 森下茉莉,5.5 GB,https://pics.dmm.co.jp/mono/movie/adult/mida642/mida642pl.jpg,https://onejav.com/torrent/mida642/download/47372936/onejav.com_mida642.torrent,"3P, 4P, Big Tits, Blow, Debut Production, Facials, Solowork",森下茉莉,2026-05-29,https://onejav.com/torrent/mida642
START578,,3.3 GB,https://pics.dmm.co.jp/mono/movie/adult/1start578/1start578pl.jpg,https://onejav.com/torrent/start578/download/34626309/onejav.com_start578.torrent,,,2026-05-26,https://onejav.com/torrent/start578
FC2PPV4904351,FC2-PPV-4904351 50％OFF【初撮り】ナースちゃん、夜の看護は大忙し！？色白パイパンのカラダを大開発！！潮吹きからのハメ潮で大量潮吹き！！！止まらぬ潮吹きに大興奮！野外で中出し、ベットで中出しで大満足！最後はガシマン,4.3 GB,https://contents-thumbnail2.fc2.com/w1280/storage201000.contents.fc2.com/file/385/38454154/1779295232.15.jpg,https://onejav.com/torrent/fc2ppv4904351/download/41072100/onejav.com_fc2ppv4904351.torrent,"Amateur, Breasts, Butt, Creampie, Debut Production, FC2, POV, Shaved, Squirting, Uncensored",,2026-05-23,https://onejav.com/torrent/fc2ppv4904351
DLDSS499,夫が出社して帰宅する定時9時から18時まで…義父と’孫作り’の中出しSEXに励んでいます―。 善場まみ,5.6 GB,https://pics.dmm.co.jp/mono/movie/adult/1dldss499/1dldss499pl.jpg,https://onejav.com/torrent/dldss499/download/79882063/onejav.com_dldss499.torrent,"Big Tits, Creampie, Cuckold, Married Woman, Mature Woman, Solowork",善場まみ,2026-05-23,https://onejav.com/torrent/dldss499
START576,新川空と初対面のイケメン男を2人きりの部屋に置いてきた ヤリたくなったらいつでもOK！赤面イチャイチャセックスを24時間モニタリング 新川空,11.9 GB,https://pics.dmm.co.jp/mono/movie/adult/1start576/1start576pl.jpg,https://onejav.com/torrent/start576/download/98642978/onejav.com_start576.torrent,"4HR+, Big Tits, Cosplay, Documentary, POV, Solowork",新川空,2026-05-26,https://onejav.com/torrent/start576
348NTR098,【NTR】ダウナー系がセックスで目うるってんのエロいよね。彼氏さんの怒号がBGMで草,2.5 GB,https://image.mgstage.com/images/ntrnet/348ntr/098/pb_e_348ntr-098.jpg,https://onejav.com/torrent/348ntr098/download/47227714/onejav.com_348ntr098.torrent,"Amateur, Big Tits, Creampie, Deep Throating, Slender, Squirting",,2026-05-24,https://onejav.com/torrent/348ntr098
MKMP725,他人の男を奪いたくて仕方がないヤリマン姉が妹の彼氏をデカ尻誘惑…卑猥なピストンでマン汁まみれになったチ〇ポを躊躇なくフェラしながら濃厚ザーメンを何度も搾り取る禁断の逆NTR 小野坂ゆいか,7.1 GB,https://pics.dmm.co.jp/mono/movie/adult/mkmp725/mkmp725pl.jpg,https://onejav.com/torrent/mkmp725/download/22516837/onejav.com_mkmp725.torrent,"Butt, Creampie, Cuckold, Huge Butt, Slut, Solowork",小野坂ゆいか,2026-05-23,https://onejav.com/torrent/mkmp725
MIDA614,家に住み憑くワケアリ地味巨乳な幽霊を乳揉みセクハラ挑発していたら…毎晩俺に勝手に跨りこねくり腰振り 中出しをねだるエロメス狂いに豹変！ 百田光稀,6.2 GB,https://pics.dmm.co.jp/mono/movie/adult/mida614/mida614pl.jpg,https://onejav.com/torrent/mida614/download/12462443/onejav.com_mida614.torrent,"Big Tits, Creampie, Drama, Older Sister, Solowork, Titty Fuck",百田光稀,2026-05-29,https://onejav.com/torrent/mida614
FC2PPV4907647,FC2-PPV-4907647 【80分超え】最強ビジュアル19歳『144cm ミニマム美女』子宮突きピル無し生中出し。80分超え生性行為映像。※売り切れ次第終了,5.8 GB,https://contents-thumbnail2.fc2.com/w1280/storage200000.contents.fc2.com/file/393/39269224/1779699975.96.png,https://onejav.com/torrent/fc2ppv4907647/download/00970806/onejav.com_fc2ppv4907647.torrent,"Amateur, Beautiful Girl, Big Tits, Blow, Breasts, Close Up, Creampie, FC2, POV, Slender",,2026-05-26,https://onejav.com/torrent/fc2ppv4907647
START575,,6.5 GB,https://pics.dmm.co.jp/mono/movie/adult/1start575/1start575pl.jpg,https://onejav.com/torrent/start575/download/26067065/onejav.com_start575.torrent,,,2026-05-26,https://onejav.com/torrent/start575
