code,title,image_url,page_url,views,date_scraped
SIRO-5536,"A 24-year-old experienced cheerleader who has encouraged Sumireto and brought smiles to her face, is now on stage to be moved by pleasure. She is nervous about her first photo shoot, but she is at the mercy of the actor's technique, raises her voice, shakes her G-cup, and moans like cheers when she is poked by the window. From cheering to the subject, she exposes her instincts as a woman. [First shot] AV application online AV experience shooting 2426",https://pic.javct.net/poster/06032026/1774586306145.jpg,https://javct.net/v/siro-5536,65,2026-03-27
SIRO-5533,"A natural girl with twin tails applied because she wanted to have intense sex.Even though she is fluffy and fidgety, when it comes to sex, she cums many times in the erogenous zones of her whole body and can't stop feeling pleasure [First shot] AV application online AV experience shooting 2422",https://pic.javct.net/poster/06032026/1774586447573.jpg,https://javct.net/v/siro-5533,64,2026-03-27
SIRO-5530,A love cup I cup sex exploration story of a girl with fluffy and fluffy big breasts. She actively seeks kisses and squirts over and over again in pleasure. Her hips tremble as she squirts and ascends to heaven. [First shot] AV application online AV experience shooting 2421,https://pic.javct.net/poster/06032026/1774586584158.jpg,https://javct.net/v/siro-5530,66,2026-03-27
SIRO-5528,"[Model figure x unstoppable sexual desire exploration] 170cm slender beautiful wife Maika (31) appears on Amateur TV She has erogenous zones all over her body, and she actively opens her instincts in front of the camera. Her mature sensitivity and endless curiosity create an intense adult experience. [First shot] AV application online AV experience shooting 2411",https://pic.javct.net/poster/06032026/1774586725174.jpg,https://javct.net/v/siro-5528,69,2026-03-27
SIRO-5525,I put it in quickly and get excited at the connecting part and scream to the max voltage. Is the recent apparel clerk so erotic? She spreads her shaved pussy without the arrogance that she wants. [First shot] AV application online AV experience shooting 2409,https://pic.javct.net/poster/06032026/1774586942743.jpg,https://javct.net/v/siro-5525,69,2026-03-27
SIRO-5523,"Those G-cup breasts are saying something... ""...let me cum, let me cum..., let me cum even more."" I'm so pregnant. Her big breasts are swaying in the missionary position, cowgirl position, and I'm going to fuck her with everything. She's a lewd-loving erotic woman who reacts twitchingly to a light feather touch. Even a person like this can become a CA... (sweat) [First shot] AV application online AV experience shooting 2415",https://pic.javct.net/poster/06032026/1774587081427.jpg,https://javct.net/v/siro-5523,63,2026-03-27
FC2PPV-4869334,"0413_001 Arisa-chan, 20 years old, a mysterious girl with a super slender body who attends a prestigious women's university, and when she gets pregnant, she unexpectedly proposes to get married and impregnates her.Is it finally time for the old man to pay his annual tax?",https://pic.javct.net/poster/06032026/1774573999.jpg,https://javct.net/v/fc2ppv-4869334,193,2026-03-27
FC2PPV-4869259,"[Individual shooting outdoor blowjob & sex] <Big breasted perverted wife> Former CA's fleshy body! Big nipples! Sukehira pussy!! This mature woman's cock sucking, piston cowgirl position, and a-face are irresistible!!",https://pic.javct.net/poster/06032026/1774573891.jpg,https://javct.net/v/fc2ppv-4869259,75,2026-03-27
FC2PPV-4868456,[Uncensored] Raw sex with beautiful big breasts ⅹ beautiful butt ⅹ shaved ♡ erotic body Chikako,https://pic.javct.net/poster/06032026/1774585377.jpg,https://javct.net/v/fc2ppv-4868456,54,2026-03-27
SIRO-5521,"I want to make my sex friend jealous, so I appear in an AV... A beautiful woman who landed in a port town, let me release her love juice into the port? She wets her pussy with a cunnilingus, and it's ready for immediate insertion. I give her a hard piss to a beautiful woman, and she screams. [First shot] AV application online AV experience shooting 2406",https://pic.javct.net/poster/06032026/1774587221635.jpg,https://javct.net/v/siro-5521,60,2026-03-27
SIRO-5510,A lewd dental hygienist who is an erotic evangelist who feels instinctively has applied. Her whole body gets wet quickly with the erogenous zones. She has orgasmed many times and can't stop shaking her hips. She shakes her hips with the hips trained in dance. [First shot] AV application online AV experience shooting 2412,https://pic.javct.net/poster/06032026/1774587361759.jpg,https://javct.net/v/siro-5510,69,2026-03-27
SIRO-5495,"[Fascinating body hidden in black clothes] Kasumi (30), an office worker with a cute smile and voice, raises her legs and begs for the dick, squirting and squirting [First shot] AV application online AV experience shooting 2413",https://pic.javct.net/poster/06032026/1774587571973.jpg,https://javct.net/v/siro-5495,62,2026-03-27
SIRO-5548,"[Isn't it okay to blow like this...] Even though she has a neat atmosphere, she masturbates every night with NTR AV. She squirts a lot of excitement when she gets fingered for the first time in half a year. [First shot] AV application online AV experience shooting 2424",https://pic.javct.net/poster/06032026/1774585597770.jpg,https://javct.net/v/siro-5548,58,2026-03-27
SIRO-5544,A popular con cafe girl applied because she wanted to have sex. She captivates the customers' hearts with her cute smile. She becomes captivated by the pleasure of her nipples. She cums repeatedly and can't stop the tide from overflowing. [First shot] AV application online AV experience shooting 2433,https://pic.javct.net/poster/06032026/1774585736178.jpg,https://javct.net/v/siro-5544,71,2026-03-27
SIRO-5542,A fresh beauty in her second year in the workforce [Kaho-san] The ultimate SEX where her youthful clear skin and slender curves twist lewdly [First shot] AV application online AV experience shooting 2435,https://pic.javct.net/poster/06032026/1774585878626.jpg,https://javct.net/v/siro-5542,69,2026-03-27
SIRO-5540,"[Former underground idol] 22 years old, ascended to heaven after being licked thoroughly by the untapped destructive power of her G-cup body. At night, her cute smile turned into a lewd and erotic face. [First shot] AV application online AV experience shooting 2432",https://pic.javct.net/poster/06032026/1774586023490.jpg,https://javct.net/v/siro-5540,66,2026-03-27
SIRO-5538,Take a look at her wild side that made her dream of having sex with a huge squirting actor come true due to the fingering of a powerful G-cup actor. [First shot] AV application online AV experience shooting 2430,https://pic.javct.net/poster/06032026/1774586167530.jpg,https://javct.net/v/siro-5538,60,2026-03-27
FC2PPV-4869465,"[No] Women's Body Sharing Chapter 11 A neat and clean office lady who plays with a short, masochistic man falls into an extremely thick cock in front of her eyes. She is fo**ed to jerk off while being shown the thick creampie, and finally ejaculates in her own ass. NTR despair development [Overseas version] Bonus included",https://pic.javct.net/poster/06032026/1774573933.jpg,https://javct.net/v/fc2ppv-4869465,48,2026-03-27
FC2PPV-4868478,[First shot] A special cream is poured onto the fair and fine skin of a professional baker who dreams of opening a bakery.,https://pic.javct.net/poster/06032026/1774573818.jpg,https://javct.net/v/fc2ppv-4868478,64,2026-03-27
FC2PPV-4862961,"First time [Face showing/No/Creampie] Short stature, small breasts, young wife who seems to be calm and quiet, uses another man's stick to release her sexual desire, repeating It feels better than my husband's ♡ and being inseminated raw with someone else's semen",https://pic.javct.net/poster/06032026/1774574143.jpg,https://javct.net/v/fc2ppv-4862961,60,2026-03-27
FC2PPV-4869417,"[None] [Public] I took the really cute and tight beauty Ai-chan #5 into the room, creampied her, and had sex with her.",https://pic.javct.net/poster/06032026/1774574100.jpg,https://javct.net/v/fc2ppv-4869417,65,2026-03-27
FC2PPV-4869254,[Festival shock yukata mouth ejaculation] Erotic blowjob time on a festival day What happens at my parents' home without parents...,https://pic.javct.net/poster/06032026/1774573850.jpg,https://javct.net/v/fc2ppv-4869254,32,2026-03-27
FC2PPV-4869188,"[Uncensored x Personal Shooting] **pyjpx*jsps I finally met my boyfriend in private after wooing my favorite hostess in her 30s. I'm already engaged to her, so I don't want him to find out. Still, she readily agreed to appear in the video.",https://pic.javct.net/poster/06032026/1774573966.jpg,https://javct.net/v/fc2ppv-4869188,58,2026-03-27
FC2PPV-1870810,"[If found out, it's dangerous to show your face] [Appearance of a certain O-trend] Model-class beautiful legs perverted *♥** Uniform x black tights A raw piston that penetrates to the root of the shaved pussy w Creampie perverted penis stud (Full HD bonus included)",https://pic.javct.net/poster/06032026/1774568546.jpg,https://javct.net/v/fc2ppv-1870810,55,2026-03-27
