code,title,image_url,page_url,views,date_scraped
300MIUM-1069,"[Hobbies = Man-hunting, masochist-loving dick fanatic, this is the ultimate] A super erotic slut picks up his girlfriend on top of an SSS-class beauty whose face is so beautiful that his eyes are drawn to her. A forbidden cuckold document. If you are seduced by a beautiful man on your way home, you will think it's a dream, but it's reality lol. A sudden kiss, an unavoidable raw insertion, destroying the girlfriend's idea of ​​chastity, and squeezing the creampie inside her seducing pussy [NTR Reverse]",https://pic.javct.net/poster/06032026/1773898168374.jpg,https://javct.net/v/300mium-1069,118,2026-03-19
300MIUM-1068,"[Poisonous Fang of Pleasure] A sexy slut reverse-picks up a married man under the guise of a simple interview where reason is stripped away all at once. A forbidden cuckold documentary. A beautiful woman approaches so close that she forgets about home. Her F-cup breasts are pressed against her, and when she is kissed, the shocking video of her preparing for divorce and squirting and creampieing her until she is empty [NTR Reverse]",https://pic.javct.net/poster/06032026/1773898241906.jpg,https://javct.net/v/300mium-1068,119,2026-03-19
300MIUM-1067,"""Which one feels better, my wife's or my pussy..."" Documentary of a forbidden cuckold where a good-looking celebrity married woman reverse picks up a married man [W Affair Special] Face strongest F breasts Slender anal licking Slut Raw sex OK Just inserted, convulsions instantly in cowgirl position Saddle squirting Immoral creampie sex that feels too good [NTR Reverse]",https://pic.javct.net/poster/06032026/1773898313969.jpg,https://javct.net/v/300mium-1067,108,2026-03-19
FC2PPV-4865707,[Blonde masochist] A very cute girl with a deep throat and a hard-on [poor tearful eyes],https://pic.javct.net/poster/06032026/1773895237.jpg,https://javct.net/v/fc2ppv-4865707,62,2026-03-19
FC2PPV-4865628,"[Individual video/Handjob train] <Erotic black areola lewd mature woman> When I was on my way to a business trip, I showed my cock to the woman next to me and she gave me a handjob.I was so excited that my panties were soaked with pussy juice, so I took a bath and put my pussy on an anal bed.",https://pic.javct.net/poster/06032026/1773895186.jpg,https://javct.net/v/fc2ppv-4865628,58,2026-03-19
FC2PPV-4865938,"[H-cup beautiful huge breasts] A quiet 24-year-old married woman plays with fire without telling her husband ♥ She has a simple face and is penetrated by another man's dick, and her betrayal bristle pussy is dripping wet and creampie ♥",https://pic.javct.net/poster/06032026/1773895513.jpg,https://javct.net/v/fc2ppv-4865938,69,2026-03-19
FC2PPV-4865691,"[First shot] A beautiful fair-skinned office lady releases her pent-up sexual desire along with her naughty liquid, and then finishes with a creampie for the first time in a while, so it's all okay.",https://pic.javct.net/poster/06032026/1773895903.jpg,https://javct.net/v/fc2ppv-4865691,71,2026-03-19
FC2PPV-4863862,"A former weather caster is to**ured with a toy gun for erotic awakening in a violent convulsion 3P, and her rationality collapses due to the most intense piston of her life and a deluge of pleasure.",https://pic.javct.net/poster/06032026/1773895874.jpg,https://javct.net/v/fc2ppv-4863862,63,2026-03-19
FC2PPV-4865755,"[First shoot] Yu-chan, a gravure model with a beautiful E-cup body, is flooded with a demon piston on her fair-skinned reddish body. ""It feels like... I'm going to cum firmly in the pink Picho pussy.",https://pic.javct.net/poster/06032026/1773895959.jpg,https://javct.net/v/fc2ppv-4865755,86,2026-03-19
FC2PPV-4865701,"Case #124 where an amateur came to do naughty things with her face showing her face. The case of Suzu-chan (20), a bridal planner with super beautiful breasts who has such a great style.",https://pic.javct.net/poster/06032026/1773895602.jpg,https://javct.net/v/fc2ppv-4865701,55,2026-03-19
FC2PPV-4866139,[Uncensored] [Public] Really cute and tight beauty Ai-chan #4 and Ekiben and creampie impregnation and sex,https://pic.javct.net/poster/06032026/1773894963.jpg,https://javct.net/v/fc2ppv-4866139,65,2026-03-19
FC2PPV-4861208,"[First time] Completely fell in love with a perfect and beautiful sadist hostess! Hand job, dick slap, and at the end she is excited and ejaculates as she begs for creampie, saying, Let me cum, move more!''",https://pic.javct.net/poster/06032026/1773895572.jpg,https://javct.net/v/fc2ppv-4861208,55,2026-03-19
FC2PPV-1021420,"Double Demon Cock x Married Woman 3P] 32-year-old married woman Kanna (pseudonym) completely fell into the demon pleasure of 3P for the first time, and was inseminated and had a convulsive orgasm. Personal shooting [Amateur orgy]",https://storage6000.contents.fc2.com/file/297/29683723/1548514438.08.jpg,https://javct.net/v/fc2ppv-1021420,60,2026-03-19
277DCV-121,"Can I take you home? case.121 Ex-T〇S / Masu〇 Ana resemblance, she has been on the road since she was 14 years old. The real queen is a carnivorous type [extremely beautiful woman] ⇒ The pussy she has trained since she was 14 years old... How many times did this woman cum? ⇒ THE erotic body [Beautiful big breasts x exquisite waist x erotic butt x nice thighs] ⇒ A mischievous past where ""bad-looking guys are mostly friends"" A world of water in the second year of middle school & commuting to high school on the Shinkansen ⇒ A sex room where she takes a man home and an episode of carnivorous eating ⇒ A little devil who teases dicks with an electric massager ⇒ A woman who has lost her youth goes to the world of water to rehabilitate her youth",https://pic.javct.net/poster/06032026/1773826206173.jpg,https://javct.net/v/277dcv-121,63,2026-03-19
277DCV-128,"Can I take you home? case.128 All the faces are too cute 120 points ""Queen"" reigns ⇒ ""S"" in ""SM"" is ""S"" for service Manipulatives, foot techniques, mouth techniques that know everything about a man ⇒ Anyway, boneless strap-on, cowgirl position, anal licking ⇒ Just cute ⇒ Tattoo engraved ""Dick user'' like a ""snake charmer'' ⇒ The reason why I fell in love with SM... What was the fall from the rich and the disaster that struck my family?",https://pic.javct.net/poster/06032026/1773825747515.jpg,https://javct.net/v/277dcv-128,78,2026-03-19
277DCV-118,"Can I take you home? case.118 144 games a year A popular matchmaking queen k**ls men with her swinging eyes ⇒ F-cup big breasts overflowing from her overwhelming yoga wear ⇒ Feminine power like a fashion magazine ""I'll do anything to be popular'' ⇒ Triple-winning perfect breasts in terms of firmness, shape, and kneading ⇒ She's good at hitting the floor where she feels comfortable ⇒ Mother's abandonment of c**ldcare... Thoughts of gratitude towards grandparents",https://pic.javct.net/poster/06032026/1773826365463.jpg,https://javct.net/v/277dcv-118,58,2026-03-19
277DCV-130,"Can I take you home? Case.130 ""Tie me tight.'' An SM nerd who lives in delusions, uses ropes, candles, and whips to orgasm. Sudden urge to urinate. Embarrassing but broken woman. ""Pain is the first step to pleasure.'' An ecstasy maniac hungry for stimulation. Wetting, blowing, and cumming. A human sprinkler collapses. A knife pointed at Mako's father... The rope brings out the true joy.",https://pic.javct.net/poster/06032026/1773825591624.jpg,https://javct.net/v/277dcv-130,88,2026-03-19
277DCV-124,"Can I take you home? case.124 These are the super tsundere kissers, former ladies, current gals appear ⇒ They are pure and devoted to SEX ⇒ ""It's tsuppatsutaru, but ~ super spoiled boy"" The widest range ⇒ The bad guy is usually a super masochist spanking cowgirl position Massive squirt release kiss kiss kiss ⇒ A requiem dedicated to the friend... Tail lamps stained with tears",https://pic.javct.net/poster/06032026/1773826063230.jpg,https://javct.net/v/277dcv-124,66,2026-03-19
277DCV-133,"Can I take you home? case.133 Various delusions, NTR, desire to fuck, etc...A woman who is too erotic looking for new stimulation A case book that is too erotic ① Delivery worker seduction case 2 Forbidden relationship with ex-boyfriend 3 Lesbian request to delivery health ""To fulfill a man's desire'' Women's sex theory ""Lingering masturbation after sex is a must'' A brother possessed by a ghost... Days when he continues to fight alone",https://pic.javct.net/poster/06032026/1773825356239.jpg,https://javct.net/v/277dcv-133,80,2026-03-19
277DCV-126,"Can I take you home? case.126 ""I love dating sites'' Chico has the eyes of a leopard pervert ⇒ A pile of plastic bottles... A dirty room full of love ⇒ Possessed type / shitty pervert ⇒ A big hole in my heart... A job exam where I lost everything",https://pic.javct.net/poster/06032026/1773825905126.jpg,https://javct.net/v/277dcv-126,64,2026-03-19
277DCV-155,"Caligula file.02_Woman who hides her face @ Active gravure idol_ Revealing her face is prohibited [Caligula: A psychological phenomenon that makes you want to try it the more it is banned] ""Today's AV is full of lies"" ▼ B92 (H cup) W62H90's ""Mutchimuchi"" ▼ A woman who has published 10 photo books and a gravure for a certain youth magazine ▼ A woman who has done the pillow business more than 5 times... A woman who takes work with her body ▼ If she hides her face, she reveals her ""true nature''... ""An extremely sensitive woman who l**ks immediately'' if you touch her pussy ▼ What is the true identity of the woman... ""Shocking last 7 minutes''",https://pic.javct.net/poster/06032026/1773824858185.jpg,https://javct.net/v/277dcv-155,108,2026-03-19
277DCV-151,"Can I take you home? Case.151 The biggest lewd monster in the series When you open the door, it's ready in 2 seconds ⇒ Fastest and the most lewd... Reverse sexual harassment in a taxi ⇒ Experienced 2000 people, target 10000 people ⇒ Searching for eternal love, working hard at sex day and night ⇒ Masochist pervert, cumming through pain and pleasure 100,000,000 times ⇒ Suddenly, a tearful upbringing... The first time I touched a small love",https://pic.javct.net/poster/06032026/1773825179509.jpg,https://javct.net/v/277dcv-151,108,2026-03-19
336KNB-404,"[A married woman who has returned to virginity] A married woman who has been married for about 2 years, has only had sex once since marriage, is practically a virgin, and is ""emotional orgasm"" from mass ejaculation. A married woman in her prime who really wants to see a man's ejaculation and be showered with sperm is here. [Ejaculation = value as a woman]  Sodegaura, where the night view of a factory sways on the sea surface",https://pic.javct.net/poster/06032026/1773821600705.jpg,https://javct.net/v/336knb-404,72,2026-03-19
277DCV-249,"Can I take you home? case.241 I love sex, and my hips move a lot [Tsunderemutsuri girl who looks very similar to Asamai] It's like Kazunoko's ceiling tongue kissing, mouth blowjob, waist shaking cowgirl position ⇒ Is it going to be fucked? The kiss is the strongest erotic gap ⇒ Libido is the most sensitive Abeharusu climax Dobori ⇒ No. 1 God back overwhelming ass angle ⇒ Everything has changed with Corona... Impatience with the same generation, dream pastry chef",https://pic.javct.net/poster/06032026/1773823234303.jpg,https://javct.net/v/277dcv-249,93,2026-03-19
