code,title,image_url,page_url,views,date_scraped
FC2PPV-4857697,"Creampie Inevitable After 2 Years of Marriage, My Beautiful Model-Class Wife (26) Put on a Wedding Ring and We Had Sex, and Both of Us Were So Excited That We Cum Inside (Akane)",https://pic.javct.net/poster/01202026/1772778692.jpg,https://javct.net/v/fc2ppv-4857697,68,2026-03-06
FC2PPV-4843693,[Limited Quantity] Nipple Fan Club Titty Fuck vol.137,https://pic.javct.net/poster/01202026/1772778783.jpg,https://javct.net/v/fc2ppv-4843693,35,2026-03-06
FC2PPV-4859160,"[Power harassment female boss is sanctioned by a big dick] Her raw mouth is covered with a huge dick and her lascivious pussy is made to squirt by continuous thrusting deep inside her throat, and her uterus is destroyed by a giant dick",https://pic.javct.net/poster/01202026/1772779960.jpg,https://javct.net/v/fc2ppv-4859160,96,2026-03-06
FC2PPV-4859003,"""Luxurious 7 shots. An office worker with an outstanding style who works for a medical company in Tokyo. Her pussy is drenched while sucking the cock with her tongue. She gets excited and swallows cum, **pyjpx*jsps. Facial cumshot, creampie total 7 shots, meat urinal training, and making sure to make her pussy.",https://pic.javct.net/poster/01202026/1772780005.jpg,https://javct.net/v/fc2ppv-4859003,55,2026-03-06
FC2PPV-4857717,"Until today [Face showing/No] This is the last pussy hairy neat black hair JD running towards the dream The real last SEX At the end, a large amount of creampie as each other asks",https://pic.javct.net/poster/01202026/1772780066.jpg,https://javct.net/v/fc2ppv-4857717,41,2026-03-06
583ERKR-1105,Yarimoku girlfriend Rin wakes up and gives blowjob in the living room,https://pic.javct.net/poster/01202026/1772681881154.jpg,https://javct.net/v/583erkr-1105,67,2026-03-06
354KAMEF-113,Specializing in individual photography Erotic cos specializing in K-cup layer photo session Machida lens's BLACK KAMEKO FILE.113 Megumi's plump soft breasts seduces the penis. Raw insertion into the man on a dangerous day and off-paco creampie in the nursery womb,https://pic.javct.net/poster/01202026/1772681817919.jpg,https://javct.net/v/354kamef-113,80,2026-03-06
SIRO-5635,A perfect girl with big breasts and slender body who likes to watch men pee. [First shot] AV application online AV experience shooting 2518,https://pic.javct.net/poster/01202026/1772681741383.jpg,https://javct.net/v/siro-5635,70,2026-03-06
FC2PPV-4858569,This is a wife who applied through SNS.She even gave me a cum swallow at the end for a higher salary.,https://pic.javct.net/poster/01202026/1772687511.jpg,https://javct.net/v/fc2ppv-4858569,34,2026-03-06
420ERK-096,"Yurari-chan (21) Amateur Hoihoi, Erokyun, Amateur, Neat, Big Breasts, Incontinence, Wetting, Cosplay, Facials, Gonzo, Documentary",https://pic.javct.net/poster/01202026/1772621058356.jpg,https://javct.net/v/420erk-096,79,2026-03-06
FC2PPV-4858283,"[Individual shot/Outdoor blow job & sex] [2 sex and creampie] <A beautiful wife with a very erotic shaved pussy - Once again> With such a lewd wife, I want to do it every day part 2! The instinctual climax sex is irresistible!!",https://pic.javct.net/poster/01202026/1772687480.jpg,https://javct.net/v/fc2ppv-4858283,38,2026-03-06
FC2PPV-4858357,"[First shoot] Her charming, plump body, big breasts, and sexy face are so erotic that she captivates men with a perfect smile. She got scolded when I ejaculated inside her vagina without permission (lol)",https://pic.javct.net/poster/01202026/1772687647.jpg,https://javct.net/v/fc2ppv-4858357,93,2026-03-06
FC2PPV-4858729,A former Gion maiko's hidden lust and lewd nature go wild. Hannari's elegance collapses and she greedily swings her hips and begs for creampie ♡,https://pic.javct.net/poster/01202026/1772687207.jpg,https://javct.net/v/fc2ppv-4858729,69,2026-03-06
FC2PPV-4858454,"Aya-chan #1 with two big black cocks violently fucks a beautiful woman with a strong personality, and ends with a sweaty hardcore 3P with two consecutive vaginal cumshots",https://pic.javct.net/poster/01202026/1772687553.jpg,https://javct.net/v/fc2ppv-4858454,33,2026-03-06
FC2PPV-4839267,"Hairy experience level too thin, skinny black-haired slender man, 3P sex with a middle-aged man until his hair turns pure white with semen, creampie training with a real midwife",https://pic.javct.net/poster/01202026/1772687614.jpg,https://javct.net/v/fc2ppv-4839267,54,2026-03-06
FC2PPV-4858303,[Part 3] A girl with beautiful skin and a beautiful pussy is exposed raw and fucked,https://pic.javct.net/poster/01202026/1772687380.jpg,https://javct.net/v/fc2ppv-4858303,20,2026-03-06
FC2PPV-4858449,[Nympho masochist] Huge breasts hentai masochist layer teary-eyed joy creampie [plump meat pussy],https://pic.javct.net/poster/01202026/1772687418.jpg,https://javct.net/v/fc2ppv-4858449,55,2026-03-06
FC2PPV-4858508,[Individual shooting] **pyjpx*jsps Big ass masturbation meat urinal that will come without a blowjob if you call it even if it's your period [borrowed woman 33rd],https://pic.javct.net/poster/01202026/1772687449.jpg,https://javct.net/v/fc2ppv-4858508,39,2026-03-06
FC2PPV-4858360,"Case #122 where an amateur came to do naughty things with her face exposed Ami-chan (20), a miraculous JD former member of the badminton club who is a beauty and has an outstanding figure.",https://pic.javct.net/poster/01202026/1772687584.jpg,https://javct.net/v/fc2ppv-4858360,66,2026-03-06
413INSTV-695,Daddy activity cancellation area Tall beautiful legged P active girl whose promise was missed and free pussy intense pissing creampie pleasure fall,https://pic.javct.net/poster/01202026/1772621185331.jpg,https://javct.net/v/413instv-695,65,2026-03-06
200GANA-3357,"I picked up a beautiful woman in Hachioji who was number 4.She was shy but had sensitive nipples and turned on the erotic mode.I felt so much that I was squirting so much that it was still coming out.The whole area was soaked with water.A heavy rain warning was issued.Everyone, don't forget to prepare your umbrella.Seriously soft girl, first shoot 2268",https://pic.javct.net/poster/01202026/1772621121520.jpg,https://javct.net/v/200gana-3357,66,2026-03-06
336KNB-398,"[L**king sex appeal] [An unforgettable affair with a big-breasted wife] ""I haven't had sex for too long...I want my cock as soon as possible..."" A beautiful, tall woman with big breasts and a big ass gets an erection just by being next to her when she applies for an AV. Every time I shake my hips in the erotic body cowgirl position, the powerful G-cup portio sways in front of my eyes, and every time I touch it, I tremble and convulse, and both of us are in a daze because we can't fuck each other enough... Husband, seriously, please change me every night (lol) at Kumagaya Station",https://pic.javct.net/poster/01202026/1772620989252.jpg,https://javct.net/v/336knb-398,78,2026-03-06
FC2PPV-4857985,"[First shot] Using a gorgeous ex-gravure model as an excuse to shoot a beautiful woman, you can enjoy her body with an outstanding figure, and get a thorough education on her pink pussy while swaying her D-cup beautiful breasts.",https://pic.javct.net/poster/01202026/1772605381.jpg,https://javct.net/v/fc2ppv-4857985,63,2026-03-06
FC2PPV-4857976,"The tit-fuck magician couldn't resist the unstoppable tit-fucking and had to give me a big ejaculation, so I cum on her face lol",https://pic.javct.net/poster/01202026/1772615345.jpg,https://javct.net/v/fc2ppv-4857976,50,2026-03-06
