code,title,image_url,page_url,views,date_scraped
FC2PPV-4868773,"[None] [Publication] When the black ban was lifted, I made the husband wait in front of the room for 3P, and the two big black guys fucked the super beautiful married woman violently until her muscles ached and her pussy tingled, ejaculated a large amount of thick semen into her mouth, and made her swallow.",https://pic.javct.net/poster/06032026/1774422683.jpg,https://javct.net/v/fc2ppv-4868773,119,2026-03-25
FC2PPV-4867759,[Collaboration / 2 shots] Real video of insemination in the beautiful body of the trained Mus.,https://pic.javct.net/poster/06032026/1774326027.jpg,https://javct.net/v/fc2ppv-4867759,83,2026-03-25
FC2PPV-4868429,The revived Konruru was given Ru Suzuhara by an OL baker with puffy nipples. Titty fuck creampie & sex part 2,https://pic.javct.net/poster/06032026/1774422124.jpg,https://javct.net/v/fc2ppv-4868429,74,2026-03-25
FC2PPV-4868432,"Case #125 where an amateur came to do naughty things with his face exposed: Yukino-chan (20), a talented Kyawa JD who is praised by everyone for having a tight inside.",https://pic.javct.net/poster/06032026/1774422557.jpg,https://javct.net/v/fc2ppv-4868432,54,2026-03-25
FC2PPV-4868315,[No/Raw creampie] **pyjpx*jsps The tall and beautiful office lady with an outstanding figure and number one repeater comes to our store to have fun with her body.She seems to love massages.,https://pic.javct.net/poster/06032026/1774422764.jpg,https://javct.net/v/fc2ppv-4868315,66,2026-03-25
SIRO-5649,Sex is a game that can be enjoyed in moderation. A girl who has learned the joy of sex plays with the penis as if it were a game. She is on the verge of exploding from the unstoppable pleasure. [First shot] AV application online AV experience shooting 2530,https://pic.javct.net/poster/06032026/1774333793574.jpg,https://javct.net/v/siro-5649,64,2026-03-25
MFCS-202,[A beautiful woman with G breasts will listen to anything she says in order to become his favorite] A scumbag man takes advantage of his goodwill and does whatever he wants to his spoiled girlfriend [Amachua Hame REC #Aya #Shop Clerk],https://pic.javct.net/poster/06032026/1774333725664.jpg,https://javct.net/v/mfcs-202,68,2026-03-25
546EROFV-368,A new employee who is swayed and obeys her co-worker's moral harassment boyfriend orders sex during work,https://pic.javct.net/poster/06032026/1774333656843.jpg,https://javct.net/v/546erofv-368,85,2026-03-25
200GANA-3350,"I came to see you because I was horny. A busty gal with explosive sexual desire is cumming all the time. In the sex room of a seasoned pick-up artist, we secretly filmed her having sex 433",https://pic.javct.net/poster/06032026/1774333588812.jpg,https://javct.net/v/200gana-3350,59,2026-03-25
FC2PPV-4867764,"I invited her to the hotel and told her there was gorgeous illumination indoors, and I was able to make it to the end??? It felt so good! It was amazing! An incredible 80-minute story with a woman who could only say something!!",https://pic.javct.net/poster/06032026/1774246245.jpg,https://javct.net/v/fc2ppv-4867764,84,2026-03-25
FC2PPV-4867765,"I lured her to the hotel and told her there was gorgeous illumination indoors, but I managed to get to the end, but she must have liked my big cock so much that it felt so good again.A story with a woman who can only say it's crazy.",https://pic.javct.net/poster/06032026/1774246151.jpg,https://javct.net/v/fc2ppv-4867765,56,2026-03-25
FC2PPV-4868087,"375_[Angry pile driving cowgirl position] Chizu-chan, whose clit twitches with the lotion on her panties and trembles, lines up and cums vulgarly in a raw fucking orgy, finishing with 3 consecutive creampies.Chizu-chan Chapter 2 [Overseas Edition]",https://pic.javct.net/poster/06032026/1774326556.jpg,https://javct.net/v/fc2ppv-4868087,61,2026-03-25
FC2PPV-4868080,"[NTR] I got a call from a guy while I was filming a real happening, so I asked him to answer (lol) This guy is a pervert who squirts while being scared of being found out.",https://pic.javct.net/poster/06032026/1774326185.jpg,https://javct.net/v/fc2ppv-4868080,58,2026-03-25
FC2PPV-4868179,208 Amateur with cute face and plump breasts ♡ She can even get naked for her boyfriend ♡ Plenty of creampie  Face showing and uncensored as a bonus,https://pic.javct.net/poster/06032026/1774326096.jpg,https://javct.net/v/fc2ppv-4868179,68,2026-03-25
FC2PPV-4867919,"[Complete Amateur Creampie] A cool beauty, tall and slender office lady is a lewd woman who loves having her clitoris attacked. When she is penetrated from behind by an old man's thick dick and creampied.",https://pic.javct.net/poster/06032026/1774326490.jpg,https://javct.net/v/fc2ppv-4867919,48,2026-03-25
FC2PPV-4868343,"[None] [Chapter 4 of Picking Up Girls in the City] X Catch a beautiful married woman near Central Park and have sex with her immediately. Two white men and a married woman with beautiful breasts and a big ass. They are made to understand with the ekiben on the back, and two big cocks are continuously inserted into them, causing them to scream and orgasm with hell bonus.",https://pic.javct.net/poster/06032026/1774329062.jpg,https://javct.net/v/fc2ppv-4868343,56,2026-03-25
FC2PPV-4867184,"[Graduation] **pyjpx*jsps I'm retiring as a fellatio fan, I'm attacking small fry men with toy demons/I'm still making a finale.",https://pic.javct.net/poster/06032026/1774326138.jpg,https://javct.net/v/fc2ppv-4867184,58,2026-03-25
200GANA-3318,"Neat type x highest sexual desire. Although she hates it, her waist is very demanding, and her body and reactions are innocent. She falls lewdly and fucks herself. Seriously soft girl, first shoot 2272",https://pic.javct.net/poster/06032026/1774244397916.jpg,https://javct.net/v/200gana-3318,62,2026-03-25
390JAC-231,"[1 liter of shameful juice] A small fry man, 24 years old, bank clerk, who immediately blows the dignity of a sex friend",https://pic.javct.net/poster/06032026/1774243977128.jpg,https://javct.net/v/390jac-231,87,2026-03-25
FC2PPV-4867741,"A normal but erotic girl can't hold back and doesn't have it.I cum inside her with permission, and the old man I met for the first time inseminated her with teary eyes, and then she is instructed to masturbate and squirts a lot.",https://pic.javct.net/poster/06032026/1774326218.jpg,https://javct.net/v/fc2ppv-4867741,65,2026-03-25
FC2PPV-4868160,[Neat/Amateur] Take a student to a hotel and have raw sex,https://pic.javct.net/poster/06032026/1774326351.jpg,https://javct.net/v/fc2ppv-4868160,28,2026-03-25
FC2PPV-4868044,* Ends same day * 133cm/31kg gymnastics competition first shooting ** Less than 2 hours of thorough training treasured shooting data * Deluxe 3-part 16GB bonus,https://pic.javct.net/poster/06032026/1774326585.jpg,https://javct.net/v/fc2ppv-4868044,48,2026-03-25
MFNA-005,"Playing a prank on my girlfriend without make-up...Just as a return, my morning erection gets played with and we have raw sex on holiday [Couple's Daily Life #05 Rio]",https://pic.javct.net/poster/06032026/1774244118628.jpg,https://javct.net/v/mfna-005,56,2026-03-25
413INSTV-698,"Yuna-chan, a girl who is active as a dad, made a cheeky girl who is rotten in the world understand the fear of adulthood",https://pic.javct.net/poster/06032026/1774244050304.jpg,https://javct.net/v/413instv-698,70,2026-03-25
