code,title,image_url,page_url,views,date_scraped
FC2PPV-4867884,"[None] [Public] Secretly from her husband, a beautiful horny married woman with big breasts and a big ass, and two black guys with big cocks, 2 consecutive large bukkake raw sex and squirting NTR hardcore 3P",https://pic.javct.net/poster/06032026/1774240008.jpg,https://javct.net/v/fc2ppv-4867884,108,2026-03-23
FC2PPV-4867697,[Amateur/Beautiful Wife] Masturbation housewife's body that can be used anytime vol.23 Ms. Mari [New item buy now campaign/review special bonus gift],https://pic.javct.net/poster/06032026/1774239854.jpg,https://javct.net/v/fc2ppv-4867697,86,2026-03-23
FC2PPV-4867926,"[No] Two-hole simultaneous penetration with black people lifted [Public] In front of her boyfriend, a beautiful girlfriend with big breasts and a big ass is convulsed by two big dicks, made to squirt, and her anus is destroyed. Dangerous SM raw sex NTR hard 3P fuck",https://pic.javct.net/poster/06032026/1774239907.jpg,https://javct.net/v/fc2ppv-4867926,54,2026-03-23
FC2PPV-4867770,[Real Amateur] Godly Slender Lady Living in Ashiya Part 2 This is a super limited sale with no plans for resale.,https://pic.javct.net/poster/06032026/1774239763.jpg,https://javct.net/v/fc2ppv-4867770,54,2026-03-23
FC2PPV-4867711,[No face shown] I was planning to do a fashion survey to a new graduate with F cup big breasts... but it gradually escalated and ended up with two consecutive creampie sex,https://pic.javct.net/poster/06032026/1774239941.jpg,https://javct.net/v/fc2ppv-4867711,102,2026-03-23
FC2PPV-4867782,(No) Personal shooting married woman Mai 28 years old handheld camera Gonzo!! I called her home and impregnated her with creampie and started training!! A secret from my husband...,https://pic.javct.net/poster/06032026/1774239969.jpg,https://javct.net/v/fc2ppv-4867782,26,2026-03-23
FC2PPV-4865786,A super celebrity with a super rich husband. Cheating and creampie sex with a greedy and greedy married woman with huge breasts.,https://pic.javct.net/poster/06032026/1774239799.jpg,https://javct.net/v/fc2ppv-4865786,42,2026-03-23
FC2PPV-4866254,"[Bonus included] [SSS grade] [Full face exposed] Indoor style neat and clean beauty, violent squirting and violent sex, showing off her terrifying cowgirl sk**ls",https://pic.javct.net/poster/06032026/1774153755.jpg,https://javct.net/v/fc2ppv-4866254,49,2026-03-23
SIRO-5647,"Beautiful Married Woman's Secret Sex A married woman who applied without telling her husband was too erotic. She couldn't hold back the desire that had been building up in the sexless situation, and she learned that the forbidden fruit with her ripe and messy body was the sweetest. [First shot] AV application online AV experience shooting 2529",https://pic.javct.net/poster/06032026/1774173207888.jpg,https://javct.net/v/siro-5647,63,2026-03-23
586HNHU-0194,"If you pick them up, a hidden M beauty who wants to be blamed ♡ will appear! Beautiful areola bulging, big breasts licked, saliva covered, blowjob, live insertion, orgasm crazy, creampie, joyful face, sperm dripping, cleaning, nipple licking, handjob, continuous shooting www",https://pic.javct.net/poster/06032026/1774173120790.jpg,https://javct.net/v/586hnhu-0194,66,2026-03-23
567BEAF-207,"Her hobby is working part-time, saving money, and traveling all over the country by herself. She follows the men she meets and immediately fucks them and cums inside her. A one-night traveling JD with big breasts, Mina-chan, 19 years old.",https://pic.javct.net/poster/06032026/1774173052112.jpg,https://javct.net/v/567beaf-207,65,2026-03-23
300MIUM-1334,"""You can lick all the sweat and semen ///"" There's no way that anything will happen in a karaoke room with a man and a woman lol The black-haired gal's deep pleas are too erotic lol I'm doing it so that everyone won't find out and it's all wet lol [Everyone is sleeping so I can't fuck]",https://pic.javct.net/poster/06032026/1774172982511.jpg,https://javct.net/v/300mium-1334,87,2026-03-23
FC2PPV-4866793,"Cute anime voice [None] [Creampie] An obedient beauty with an idol face. Immediate blowjob, immediate sex, fuck all you want, creampie and poi *Bonus included",https://pic.javct.net/poster/06032026/1774153788.jpg,https://javct.net/v/fc2ppv-4866793,37,2026-03-23
FC2PPV-4867287,"Current **model appearing in a famous apparel ad**pyjpx*jsps Has appeared in a Japanese ad for a world-famous brand that everyone knows.Completely first shooting.No experience in cabaret, adult entertainment, support, 534th solo shoot.",https://pic.javct.net/poster/06032026/1774154258.jpg,https://javct.net/v/fc2ppv-4867287,202,2026-03-23
FC2PPV-4867610,[Neat/Amateur] Introverted 21 year old professional ◯ I fucked raw,https://pic.javct.net/poster/06032026/1774154232.jpg,https://javct.net/v/fc2ppv-4867610,46,2026-03-23
FC2PPV-4867418,"[No] Permission for first shooting NTR Korean half-married woman What's going on with this? It's big. Excited for the first time by a thick black cock, her desire is released, her reason collapses with the sound of pussy farting, and she's very satisfied with the creampie [Overseas version] Bonus included",https://pic.javct.net/poster/06032026/1774154126.jpg,https://javct.net/v/fc2ppv-4867418,43,2026-03-23
FC2PPV-4867745,"[Amateur first shot] Sumire (18) 163 cm 47 kg D cup and super cute It seems like she can't really do it, but in the end she accepts kissing, creampie, and anal penetration as a middle-aged woman with metabolic syndrome",https://pic.javct.net/poster/06032026/1774153943.jpg,https://javct.net/v/fc2ppv-4867745,114,2026-03-23
FC2PPV-4867433,Momoka-chan dangerous day uterine dilation Serious pregnancy #7,https://pic.javct.net/poster/06032026/1774154354.jpg,https://javct.net/v/fc2ppv-4867433,134,2026-03-23
FC2PPV-4867344,"Hairy beauty 3 Kasumi, a 19 year old former member of the rhythmic gymnastics team, has a large amount of naughty sex with a cute girl with a plump beautiful body wearing a cheerleading costume.She has experience as a former rhythmic gymnastics team cheerleader and shows off her competition.",https://pic.javct.net/poster/06032026/1774153857.jpg,https://javct.net/v/fc2ppv-4867344,56,2026-03-23
FC2PPV-4867502,Just turned 18 years old/Private one night hot spring creampie trip with Gcup beautiful big breasts girl/3rd round record,https://pic.javct.net/poster/06032026/1774154389.jpg,https://javct.net/v/fc2ppv-4867502,59,2026-03-23
FC2PPV-4867426,[None/Number] Creampie video of the amateur layer of Hetiakos who loves sex so much that her mouth and pussy are all muddy and the best lewd goddess won't let you sleep tonight.,https://pic.javct.net/poster/06032026/1774153894.jpg,https://javct.net/v/fc2ppv-4867426,40,2026-03-23
FC2PPV-4867354,"Resuming with a fair-skinned, bristle-haired girl who just moved to Tokyo from Aomori. She begs me to make her pregnant, and while shaking her pink nipples and D-cup beautiful breasts, she twitches and convulses, and the thick cloudy liquid from her big cock explodes into pregnancy.",https://pic.javct.net/poster/06032026/1774153711.jpg,https://javct.net/v/fc2ppv-4867354,56,2026-03-23
FC2PPV-4867621,A girlfriend with G breasts who eats a large amount of sperm that is not enough just to have daily creampie with her cohabiting girlfriend,https://pic.javct.net/poster/06032026/1774154467.jpg,https://javct.net/v/fc2ppv-4867621,60,2026-03-23
FC2PPV-4867391,"0206_022 Miku-chan, 19 years old. The training of a masochist woman with no human rights who can do anything from impregnation to exposing her ID continues... This time, she gets her beautiful face dirty with her first facial, which includes raw sex and a super thick semen bukkake.",https://pic.javct.net/poster/06032026/1774154087.jpg,https://javct.net/v/fc2ppv-4867391,46,2026-03-23
