code,title,image_url,page_url,views,date_scraped
FC2PPV-4876154,"There are married women who want to expose their Icups and come to NTR without telling their husbands, but their sexual desire has increased and they have a hard time finding a place to release it. | Creampie from titty fuck service in the car *Disposal of collapse with remote toys",https://pic.javct.net/poster/06032026/1775435182.jpg,https://javct.net/v/fc2ppv-4876154,69,2026-04-06
FC2PPV-4875376,"Before being touched by the new employee's boss from the spring, he is a member of society since the spring, so he can't do anything inside...I completely ignore him and send him off before the new graduate *Video",https://pic.javct.net/poster/06032026/1775435367.jpg,https://javct.net/v/fc2ppv-4875376,62,2026-04-06
FC2PPV-4875797,"Shocking video of lewd married woman studding] A real married woman approved by her husband is creampied at a love hotel. After creampie, she is also creampied in the anus",https://pic.javct.net/poster/06032026/1775435219.jpg,https://javct.net/v/fc2ppv-4875797,39,2026-04-06
FC2PPV-4876157,"If she can't make you cum, a beautiful office lady will challenge you to see if she can make you cum with a 7-minute blowjob and hand job.",https://pic.javct.net/poster/06032026/1775435031.jpg,https://javct.net/v/fc2ppv-4876157,49,2026-04-06
FC2PPV-4876052,"[Limited Uncensored] NIK〇E: Ma〇to / A super beautiful woman who is rumored to be a reverse r**e demon ** When I took a private photo shoot with the official layer at a hotel, the layer's sexual desire went out of control and I was eaten...♡",https://pic.javct.net/poster/06032026/1775435329.jpg,https://javct.net/v/fc2ppv-4876052,34,2026-04-06
FC2PPV-4875448,"[Completely secret version] [Launch] [Volume warning] [First appearance in FC2] 24-year-old I-cup office lady Mina, her moaning voice is so loud that she can't stop, her abominable behavior is exposed to the point where her brain is pounding [Chapter 3]",https://pic.javct.net/poster/06032026/1775373390.jpg,https://javct.net/v/fc2ppv-4875448,103,2026-04-06
FC2PPV-4873816,[Raw Dollar / Uncensored] 2 consecutive 3Ps with a sexy and beautiful woman who looks like a female announcer!! Light caressing makes her nipples ping and her pussy makes obscene swishing sounds!! Enjoy sex with a troubled expression!! Original version!!,https://pic.javct.net/poster/06032026/1775373415.jpg,https://javct.net/v/fc2ppv-4873816,50,2026-04-06
FC2PPV-4873635,"[Bonus video 1 hour and 40 minutes long, high quality complete (no**)] Sara x Rio x Creampie 3P | A big-breasted beauty is violently pushed around by a muscular macho man, and they do it all side by side, stacked on top of each other, and do whatever you want",https://pic.javct.net/poster/06032026/1775373442.jpg,https://javct.net/v/fc2ppv-4873635,37,2026-04-06
857OMG-024,"This girl who mistakenly thinks she's dating me seems to be yearning for lovey-dovey, so when I whisper ""I love you"" in her ear, she lets me cum inside her. She's a real bitch who's convenient, super beautiful, and makes her yukata and bed drenched in squirt...Poor thing [includes bonus footage]",https://pic.javct.net/poster/06032026/1775373400837.jpg,https://javct.net/v/857omg-024,83,2026-04-06
230ORECZ-501,snow,https://pic.javct.net/poster/06032026/1775373614925.jpg,https://javct.net/v/230orecz-501,61,2026-04-06
300MIUM-1367,"After all, we like gals. There's no rival to a cheerful, beautiful girl who entangles men with a carefree smile.",https://pic.javct.net/poster/06032026/1775357955886.jpg,https://javct.net/v/300mium-1367,73,2026-04-06
230OREMO-528,Mr. S,https://pic.javct.net/poster/06032026/1775373472255.jpg,https://javct.net/v/230oremo-528,50,2026-04-06
326IAV-004,"Mina, a cynical college student with blonde hair and a C cup, who has a compensated relationship like a part-time job, was lured by a high salary and ended up having a large amount of creampie in a cosplay 3P sex video lol",https://pic.javct.net/poster/06032026/1775357731857.jpg,https://javct.net/v/326iav-004,63,2026-04-06
SIRO-5637,"As you can see, the smooth nude body like a plump F cup pottery is sure to increase a man's libido [First shot] AV application online AV experience shooting 2535",https://pic.javct.net/poster/06032026/1775358071.jpg,https://javct.net/v/siro-5637,64,2026-04-06
567BEAF-209,"Hina-chan, 20 years old, is a slutty pervert bitch who loves to be fucked. She has a cute face and crazy sexual tendencies. Young handsome men are out of sight, and she refuses to accept anyone under 40.",https://pic.javct.net/poster/06032026/1775357803131.jpg,https://javct.net/v/567beaf-209,70,2026-04-06
FC2PPV-4874925,"0416_001 Emma-chan, 20 years old, a hostess with an unbalanced natural G-cup breasts and an innocent cute face that takes advantage of customers, is impregnated with an old man's semen creampie and is impregnated.",https://pic.javct.net/poster/06032026/1775358584.jpg,https://javct.net/v/fc2ppv-4874925,172,2026-04-06
FC2PPV-4875795,376_[*Echiechi 3P in clothes] Yuki-chan is cute Moko-chan feels good Two people share raw dick and have sex alternately with facial cumshots & creampie sex Yuki-chan Chapter 7 & Moko-chan 2nd Chapter 3 [Overseas version],https://pic.javct.net/poster/06032026/1775358259.jpg,https://javct.net/v/fc2ppv-4875795,96,2026-04-06
300MIUM-141,"Picking up a celebrity married woman on the go and filming her at home ⇒ creampie sex celeb.41 A kind-hearted wife who has a successful husband and is blessed with c**ldren, but drowns in her pent-up sexual desire and lets it out with someone else's dick in Daikanyama",https://pic.javct.net/poster/06032026/1775362173184.jpg,https://javct.net/v/300mium-141,68,2026-04-06
300MIUM-147,"Drinking until morning 06 in Shinjuku Station area: Absolutely beautiful free model found in Shinjuku, one of the busiest areas in Japan. No boyfriend, likes drinking, no masturbation type (anyone is OK as long as it's fun). Shikato on the last train with a wacky vibe. She wrote a pretty lame story about how her first erotic experience in life was groping with a person of the same sex. It was the best shot of the series, with endless erotic experience stories & super erotic lovey-dovey sex with caution about nudity...",https://pic.javct.net/poster/06032026/1775361775932.jpg,https://javct.net/v/300mium-147,97,2026-04-06
300MIUM-146,"Drinking until morning 07 in Gotanda Station area: ""I masturbate every day'' ""I can have sex for hours'' ""I mastered handjobs in 6th grade''...A super cute amateur who walks around drinking in Gotanda was discovered and had sex 24 hours a day, over 10 times...The hidden lewd beautiful girl was so greedy that she would masturbate in the toilet if you didn't approach her quickly.",https://pic.javct.net/poster/06032026/1775361851559.jpg,https://javct.net/v/300mium-146,99,2026-04-06
300MIUM-145,"Dirty joke stall The third snack girl I caught at the west exit of Shinjuku Station: Rena Aoi, 23 years old, super beautiful, a hard-working novice esthetician who has been working hard to save up on her low monthly salary. Her erotic stories that she can never tell anyone are l**ked out by the magic of alcohol, and her ex-boyfriend (a pervert) has a sky-high erotic potential that is so amazing that I was completely devoured by her.",https://pic.javct.net/poster/06032026/1775361928981.jpg,https://javct.net/v/300mium-145,81,2026-04-06
300MIUM-144,"Picking up a celebrity married woman walking around town and filming her at home ⇒ Creampie sex celeb.44 Even though she knows that not eating a set meal is a shameful AV for a man, she takes a man in and has creampie sex to her heart's content in Shinjuku Ward",https://pic.javct.net/poster/06032026/1775362013243.jpg,https://javct.net/v/300mium-144,67,2026-04-06
300MIUM-143,"Picking up a celebrity married woman walking around town and filming her at home ⇒ Creampie sex celeb.43 Her guard is number one.She is the proof of a ladylike celebrity wife.The house is 3 stories tall, has an elevator, and has a stained glass window at the entrance.In Ikebukuro, Toshima Ward.",https://pic.javct.net/poster/06032026/1775362094835.jpg,https://javct.net/v/300mium-143,69,2026-04-06
FC2PPV-4875703,Aoi-chan's continuous creampie video for 5 days limited distribution pressure/force.,https://pic.javct.net/poster/06032026/1775358715.jpg,https://javct.net/v/fc2ppv-4875703,73,2026-04-06
