code,title,image_url,page_url,views,date_scraped
FC2PPV-4890710,"[Bonus included] [Personal shooting] [Full face exposed] A 28-year-old beautiful conductor has a neat appearance, but her sensitive body makes her squirt easily. Her wet pussy is stirred and she reaches continuous orgasms.",https://pic.javct.net/poster/04112026/06e901a3b3.jpg,https://javct.net/v/fc2ppv-4890710,40,2026-05-02
FC2PPV-4892416,[Pregnancy/Suspension of activities] 19-year-old duo of beautiful influencers 3P creampie sex shot on a dangerous day Urgent release video *Prices will increase sequentially,https://pic.javct.net/poster/04112026/52376497c6.jpg,https://javct.net/v/fc2ppv-4892416,37,2026-05-02
FC2PPV-4892281,"[Two good friends who love sex, Misa-chan and Kasumi-chan reappear, and they can't get enough of them, so they have a live 3P battle with the director]",https://pic.javct.net/poster/04112026/57b7f05d8a.jpg,https://javct.net/v/fc2ppv-4892281,79,2026-05-02
FC2PPV-4892293,I had a secret meeting with a boyish beauty who is a Harajuku idol who looks like Pa◯tan,https://pic.javct.net/poster/04112026/566b3a510a.jpg,https://javct.net/v/fc2ppv-4892293,61,2026-05-02
FC2PPV-4890498,[Individual video] Affair sex with a frustrated slender married woman at a married woman's house,https://pic.javct.net/poster/04112026/e268046dbb.jpg,https://javct.net/v/fc2ppv-4890498,23,2026-05-02
FC2PPV-4891895,"[Uncensored/Complete Amateur/Creampie/Squirting] An ordinary girl in uniform who agreed to a love hotel photoshoot on the condition that she wears a mask. She said she was in the deep end, but once the pheromones started, she got so horny that she had a thick creampie ♡",https://pic.javct.net/poster/04112026/4259712906.jpg,https://javct.net/v/fc2ppv-4891895,20,2026-05-02
SIRO-5033,"[It's moving...] I'm not satisfied with sex in private, I squirt with the fingering of a beauty club actor who has an air of being more mature than his age, and when he inserts a penis, I can't stop my hips and go wild... AV application online AV experience shooting 1953",https://pic.javct.net/poster/04112026/6005ecfa68.jpg,https://javct.net/v/siro-5033,0,2026-05-02
FC2PPV-4891988,A super cute Harajuku idol is made to wear a maid costume and has a creampie play,https://pic.javct.net/poster/04112026/5b241034f4.jpg,https://javct.net/v/fc2ppv-4891988,56,2026-05-02
FC2PPV-4891643,"Early purchase bonus Miraculous fusion with a slender beauty ""Aaah, one high-speed dick thrusts a huge explosion, massive ejaculation finish",https://pic.javct.net/poster/04112026/d23a8f772f.jpg,https://javct.net/v/fc2ppv-4891643,62,2026-05-02
FC2PPV-4892310,"[2 cameras uncensored] SEX addicted funky gal makes her second appearance, this time she goes crazy with machine gun anal fucking",https://pic.javct.net/poster/04112026/4ae7248de3.jpg,https://javct.net/v/fc2ppv-4892310,79,2026-05-02
FC2PPV-4892087,"[Uncensored] **pyjpx*jsps Super cute ~ A lot of love juice oozing out of Rika's panties of 18 years old 〇〇 who has a real face... I can't resist Playing with her nipples with a suction device ~ Naturally, the clitoris is also standing up",https://pic.javct.net/poster/04112026/3209031f26.jpg,https://javct.net/v/fc2ppv-4892087,76,2026-05-02
FC2PPV-4892042,"Mr. JD, who has a calm demeanor and whose eyes droop when he smiles, came to our store with an active approach looking for stimulation.",https://pic.javct.net/poster/04112026/4771eb4a3b.jpg,https://javct.net/v/fc2ppv-4892042,43,2026-05-02
FC2PPV-4892287,"[Silenceless married woman with her face exposed] It's a sight to see her small breasts and slender body being played with.The voice that she had been holding back came out, and she was almost unconscious.",https://pic.javct.net/poster/04112026/1bc9e92ef3.jpg,https://javct.net/v/fc2ppv-4892287,47,2026-05-02
FC2PPV-4892640,"[Account Opening Commemoration Sale] Miu-chan, who is extremely naughty in nature, is willing to give a cleaning blow job ♡ Her true face that is not shown on stage is a must-see",https://pic.javct.net/poster/04112026/4dabb19c75.jpg,https://javct.net/v/fc2ppv-4892640,40,2026-05-02
FC2PPV-4890664,"[Account Opening Commemoration Sale] Idol trainee Kokoa-chan, who has finally completed her debut work after continuing to negotiate for appearances without giving up, tried creampie for the first time in her life.",https://pic.javct.net/poster/04112026/a62fd559ad.jpg,https://javct.net/v/fc2ppv-4890664,37,2026-05-02
FC2PPV-4867757,"[Unreleased treasured record] A secret video of a beautiful girl who aspires to be an innocent idol, her uniform being disturbed by a dirty man's cock! A large amount of semen engraved in her beautiful body and vagina at the end of the lesson",https://pic.javct.net/poster/04112026/397eb081f1.jpg,https://javct.net/v/fc2ppv-4867757,188,2026-05-02
SIRO-5023,"[Slender G breasts] I thought she was a cool beauty, but she trembled while cumming. AV application online AV experience shooting 1951",https://pic.javct.net/poster/04112026/2171a0e0dc.jpg,https://javct.net/v/siro-5023,64,2026-05-02
FC2PPV-4891744,"♯41 When I undressed a plain girl, she had a voluptuous erotic body. Japan's future Mio, who was a current/worker until last month and was almost a virgin, accepts an uncle's raw cock for only 3000 yen",https://pic.javct.net/poster/04112026/e7154800f4.jpg,https://javct.net/v/fc2ppv-4891744,113,2026-05-02
FC2PPV-4891124,"[Complete secret version] [SSS-class beauty] [Creampie] [Facial appearance] [Celebrity resemblance] Tokyo's high-class lounge manager and hostess, Akane-san's abomination [Chapter 3]",https://pic.javct.net/poster/04112026/68d1c0de67.jpg,https://javct.net/v/fc2ppv-4891124,105,2026-05-02
FC2PPV-4889296,[Individual photography / men's esthetics] [Authorized as a secret massage therapist?!] <A well-trained beauty therapist> This erotic esthetician is in trouble. Stimulates the testicles and back muscles with an anal hand job while crawling on all fours! Raw creampie option available!!,https://pic.javct.net/poster/04112026/dee784790d.jpg,https://javct.net/v/fc2ppv-4889296,37,2026-05-02
FC2PPV-4891589,"NTR Squirting sex in a separate room with a G-cup big-breasted, big-ass, hairy nurse from a certain beauty clinic right before the wedding ceremony",https://pic.javct.net/poster/04112026/d5225a3255.jpg,https://javct.net/v/fc2ppv-4891589,16,2026-05-02
FC2PPV-4887454,[19-year-old sex video] I fucked a cute 19-year-old junior at home who was exhausted from her part-time job [Yes],https://pic.javct.net/poster/04112026/ed38c97175.jpg,https://javct.net/v/fc2ppv-4887454,13,2026-05-02
FC2PPV-4891133,"[Urgent Release Breasts] **pyjpx*jsps 0414_001 Kanna-chan, 18 years old, has only one husband, and is already a married young wife who is ready for divorce and completely exposes her idol face, drowning in NTR creampie sex on a dangerous day (explosion)",https://pic.javct.net/poster/04112026/07e6dcfd88.jpg,https://javct.net/v/fc2ppv-4891133,197,2026-05-02
336KNB-410,"[Put it all the way in] No matter how old I am, I want to make love, and I want to be penetrated deep inside, in front of Chiba Koen Station, Chiba City, Saitama Prefecture.",https://pic.javct.net/poster/04112026/2473ebd9fc.jpg,https://javct.net/v/336knb-410,71,2026-05-02
