code,title,image_url,page_url,views,date_scraped
FC2PPV-4899749,[Amateur's first shot/main feature face] Hana (18) This is a different angle video of an amateur who lives in the countryside and anal penetration ATM and electric massager continuous orgasm.,https://pic.javct.net/poster/04112026/f8fccf5298.jpg,https://javct.net/v/fc2ppv-4899749,166,2026-05-14
FC2PPV-4892365,[Individual camera/kitchen affair] <Erotic breasts/big butt perverted wife> Having sex at home when her husband is away! Cumming all over the place! Cumming with a hard piston on her ahegao face and a cock-loving affair!!,https://pic.javct.net/poster/04112026/52337a06a4.jpg,https://javct.net/v/fc2ppv-4892365,60,2026-05-14
FC2PPV-4899850,"[First shooting] A very rare person with 1 experience, I took a sex video. Even though he looks like a quiet person, it is illegal to be a masochist. He was a pervert who squirted during the deep orgasm.",https://pic.javct.net/poster/04112026/fdfec315d3.jpg,https://javct.net/v/fc2ppv-4899850,77,2026-05-14
FC2PPV-4899427,[Out of print] An 18-year-old girl with a dazzling smile and fair-skinned nude body has sex for the first time in her life ♥️ Massive ejaculation into the love juice-covered pussy of a beautiful woman who is nervous that she might become pregnant ♥️,https://pic.javct.net/poster/04112026/afe37cb3fd.jpg,https://javct.net/v/fc2ppv-4899427,104,2026-05-14
FC2PPV-4899533,"A 23-year-old office lady who came to Tokyo from Kansai, has raw sex without rubber during a high-priced part-time job and cums inside her fair-skinned and petite body.",https://pic.javct.net/poster/04112026/a767e6f8ed.jpg,https://javct.net/v/fc2ppv-4899533,59,2026-05-14
FC2PPV-4899692,"Case #132 where an amateur came to do naughty things with her face exposed Miku-chan (20), a beautiful, fair-skinned and cute girl with an outstanding figure transforms.",https://pic.javct.net/poster/04112026/3f1f029f4e.jpg,https://javct.net/v/fc2ppv-4899692,58,2026-05-14
FC2PPV-4899872,[Complete facial exposure 2-piece set] SSS Icharab delivery with idol-class cute beauty,https://pic.javct.net/poster/04112026/4b0b775446.jpg,https://javct.net/v/fc2ppv-4899872,83,2026-05-14
FC2PPV-4899642,A big-breasted single mother brought her one c**ld to the shooting location. A sex video with no morals is forbidden and a creampie next to the stroller.,https://pic.javct.net/poster/04112026/4ffa9f8b1d.jpg,https://javct.net/v/fc2ppv-4899642,26,2026-05-14
FC2PPV-4899993,The secret face of the beautiful office lady from a cool manufacturer is an unexpectedly P-active job.She gets a hard piss on her slender sensitive body and cums continuously in tight pussy.,https://pic.javct.net/poster/04112026/0c512be5cd.jpg,https://javct.net/v/fc2ppv-4899993,53,2026-05-14
FC2PPV-4900381,"A year after moving to Tokyo, enjoy the innocent sex of a female college student who is still not used to the city.",https://pic.javct.net/poster/04112026/4e25048e28.jpg,https://javct.net/v/fc2ppv-4900381,93,2026-05-14
FC2PPV-4899877,"[With sound] [Individual] A former model with a half-faced face. 4 months pregnant, her work has drastically decreased. Even though she is behind on her payments, she can't let go of her cocky attitude from her past glory. She is showing her mental state of not giving in to the advances of others.",https://pic.javct.net/poster/04112026/8dfb893590.jpg,https://javct.net/v/fc2ppv-4899877,40,2026-05-14
FC2PPV-4713279,"Part 1, slender, black-haired bob, cool beauty, Tashiro-chan uniform cosplay creampie (main story face showing) Uncensored with review bonus",https://pic.javct.net/poster/04112026/7e2f93e3eb.jpg,https://javct.net/v/fc2ppv-4713279,62,2026-05-14
FC2PPV-4719263,"Part 2, slender, black-haired bob, cool beauty, Tashiro-chan bloomers cosplay creampie (main story face out) uncensored with review bonus",https://pic.javct.net/poster/04112026/a4db57b800.jpg,https://javct.net/v/fc2ppv-4719263,67,2026-05-14
420HPT-052,"Ako (22) Amateur Hoi Hoi, Amateur Hoi Hoi Pet, Amateur, Black Hair, Super Masochist, Submissive, Sensitive, Urinating, Wetting, Sex Friend, Jumping, Outdoors, Shame, Toys, Creampie, Gonzo, Documentary",https://pic.javct.net/poster/04112026/e4a2f67150.jpg,https://javct.net/v/420hpt-052,99,2026-05-14
SIMP-019,Kaho,https://pic.javct.net/poster/04112026/eb8b5445f4.jpg,https://javct.net/v/simp-019,69,2026-05-14
FC2PPV-4899053,[Sense of immorality] Exciting married woman's affair creampie & facial cumshot with 4 super thick ejaculations ~ Can you please smear my lascivious self so dirty without telling my husband...,https://pic.javct.net/poster/04112026/8328d27b04.jpg,https://javct.net/v/fc2ppv-4899053,69,2026-05-14
259LUXU-1884,"""Like a thing...I want to be fucked so hard that it breaks..."" [Very wet SEX where a sullen young lady spreads her erotic tide and orgasms wildly] Blindfolded, restrained, fucked, and masochist SP Luxury TV 1870",https://pic.javct.net/poster/04112026/6162d078ab.jpg,https://javct.net/v/259luxu-1884,68,2026-05-14
FC2PPV-4899589,"[Uncensored 2-part set] They told me it was a simple personal photo shoot, and I took them to the room and whether I cried or screamed, my first anal was delicious.",https://pic.javct.net/poster/04112026/72f1c7e52e.jpg,https://javct.net/v/fc2ppv-4899589,67,2026-05-14
FC2PPV-4898794,"Uncensored. It's as if the vagina is breathing... A simple and serious [woman's true nature] 〇〇-kun, who has a boyfriend who masturbates 182 days a year, cheats on me, so I too...",https://pic.javct.net/poster/04112026/6b285f310f.jpg,https://javct.net/v/fc2ppv-4898794,65,2026-05-14
336KNB-411,"[Nationwide Married Woman Ero Illustrated Book Shuuchin's Dirty Clash - Piston-] ""I want to see my husband happy...///"" It was supposed to be a netorare service for my beloved husband who appeared in an AV... but the beautiful wife was so erotic that she burst into tears with continuous orgasms and squirts, so hot that she even blew her glasses wwwwww at Toda City, Saitama Prefecture",https://pic.javct.net/poster/04112026/76eb2f2813.jpg,https://javct.net/v/336knb-411,70,2026-05-14
FC2PPV-4898104,"[Total of 4 shots] A tall beautiful woman participating in a summer comic with her hobby cosplay, she is shy but squeezes the cock violently with her beautiful butt and squeezes the man's semen with a smile",https://pic.javct.net/poster/04112026/952ef5af04.jpg,https://javct.net/v/fc2ppv-4898104,103,2026-05-14
FC2PPV-4899219,"[First shot] 20-year-old F-cup hairdresser's assistant says, ""No, that feels so good... Her fair-skinned beautiful body is violently penetrated by a long-lost big cock, and she trembles continuously and cums in her wet pussy that tightens and cums inside her.",https://pic.javct.net/poster/04112026/7fe145742a.jpg,https://javct.net/v/fc2ppv-4899219,67,2026-05-14
FC2PPV-4891971,"I was so excited about this fair-skinned, beautiful, slender girl with model-class beauty and style who likes close contact, and to be honest, I got a little too erect [Uncensored Creampie]",https://pic.javct.net/poster/04112026/9a6ec53967.jpg,https://javct.net/v/fc2ppv-4891971,63,2026-05-14
FC2PPV-4899575,"[3P continuous creampie] Once again, I think I got caught in the tangle of two young wives brought by the 〇mi company.",https://pic.javct.net/poster/04112026/61c6dfe63a.jpg,https://javct.net/v/fc2ppv-4899575,35,2026-05-14
