code,title,image_url,page_url,views,date_scraped
420ERK-103,"Mina (21) Amateur Hoi Hoi, Erotic Kyun, Amateur, Big Breasts, Neck, Drinking Lover, Shaved Pussy, Cosplay, Facial, Gonzo, Documentary",https://pic.javct.net/poster/04112026/267769f502.jpg,https://javct.net/v/420erk-103,84,2026-05-06
FC2PPV-4895817,[Musume of a sushi restaurant/Gonzo version] I can't repay my debt to a picture scammer and take a sex video,https://pic.javct.net/poster/04112026/7a739e0ea4.jpg,https://javct.net/v/fc2ppv-4895817,72,2026-05-06
FC2PPV-4895890,Astonishingly natural super divine breasts K cup Private potato JD in Tokyo ① New therapist Massive creampie for 5 million yen Historic private personal record [Original quality],https://pic.javct.net/poster/04112026/6d719e4a46.jpg,https://javct.net/v/fc2ppv-4895890,42,2026-05-06
FC2PPV-4895641,[Individual shooting] A shaved gal with a shaved pussy releases her daily stress and cums with a cock,https://pic.javct.net/poster/04112026/8d140065b2.jpg,https://javct.net/v/fc2ppv-4895641,27,2026-05-06
FC2PPV-4895643,7 consecutive ejaculations in the mouth during the oniden from the husband who has his ex-wife pull out the cock that has been stored for more than 2 weeks until it is dry,https://pic.javct.net/poster/04112026/4d71c6471f.jpg,https://javct.net/v/fc2ppv-4895643,34,2026-05-06
FC2PPV-4895772,"A minimalist girl with a pale face gets as excited as she likes with steamy mat play, and is excited by the unparalleled beautiful ass lurking in her fully exposed minimalist body. She feels like she could cum as many times as she wants, but she has to endure it with two creampies and a bukkake on her stomach.",https://pic.javct.net/poster/04112026/b294702046.jpg,https://javct.net/v/fc2ppv-4895772,65,2026-05-06
FC2PPV-4895427,"Uncensored Beautiful flight attendant of a certain airline greedily sucks on cock like a succubus, erotic no-hands blowjob, cum in mouth cleaning blowjob & masturbation",https://pic.javct.net/poster/04112026/2881e1e5a0.jpg,https://javct.net/v/fc2ppv-4895427,27,2026-05-06
FC2PPV-4895978,[Uncensored] A beautiful 21-year-old race queen who is a beauty pageant regular wears an actual costume and is filmed continuously ♥ Undisclosed bonus 2 ejaculations in 33 minutes!,https://pic.javct.net/poster/04112026/1868811d88.jpg,https://javct.net/v/fc2ppv-4895978,41,2026-05-06
FC2PPV-4891699,[No] (Extreme) A neat and clean slender beauty with beautiful legs. She has a small face and smooth black hair. Swallow for the first time in her life ⤴ Her beautiful visuals and natural hair make her the best to swallow. *Bonus High resolution,https://pic.javct.net/poster/04112026/3151acd31b.jpg,https://javct.net/v/fc2ppv-4891699,42,2026-05-06
FC2PPV-4880640,"Continuous piston with big breasts J.D in the open-air bath of the hotel, even in the hot tub **pyjpx*jsps",https://pic.javct.net/poster/04112026/9103b6175b.jpg,https://javct.net/v/fc2ppv-4880640,49,2026-05-06
FC2PPV-4895622,Sex at Ekiben. First reverse 3P fuck with two beautiful women with big black cocks and beautiful breasts and beautiful butts and impregnated with raw creampie.,https://pic.javct.net/poster/04112026/5cba670450.jpg,https://javct.net/v/fc2ppv-4895622,25,2026-05-06
FC2PPV-4885493,"An esthetician I know gave me information about a gal men's esthetician who has lots of sex with customers, so I tried to negotiate for a sex shot [Uncensored Creampie]",https://pic.javct.net/poster/04112026/c7da6d132c.jpg,https://javct.net/v/fc2ppv-4885493,64,2026-05-06
FC2PPV-4892383,"[No face showing] That former idol, a lot of semen in a natural H cup ⚫︎ After ejaculation ➡︎ The main part is a Gonzo video, a trajectory encounter",https://pic.javct.net/poster/04112026/fda9dbf8c5.jpg,https://javct.net/v/fc2ppv-4892383,83,2026-05-06
FC2PPV-4891966,"* Super beautiful breasts [first appearance] An innocent video of a baby-faced G cup who will make her solo debut in 100 days. Her fluffy big boobs are violently poked and shaken, and a large amount of creampie is produced.",https://pic.javct.net/poster/04112026/a9a3c866de.jpg,https://javct.net/v/fc2ppv-4891966,58,2026-05-06
SIRO-5340,"[Tall girl with glasses] Quickly appeared in between schoolwork The firm young body of a current university student is irresistible from the kiss to the end, intense sex with a creamy face [First shot] AV application online AV trial shooting 2221",https://pic.javct.net/poster/04112026/74a99caae4.jpg,https://javct.net/v/siro-5340,0,2026-05-06
SIRO-5330,"A career woman with a strong constitution who gets wet with just the slightest touch appears on Amateur TV. She says, ""Please do it violently..."" Don't hesitate to listen to the moans that come out even if you try to suppress the demon piss back. [First shot] AV application online AV experience shooting 2223",https://pic.javct.net/poster/04112026/df11885473.jpg,https://javct.net/v/siro-5330,0,2026-05-06
SIRO-5345,"Youth is justice A fluffy natural girl's smooth and chewy natural body is photographed with the most erotic camera, and she gets so excited that she squirts her natural juices and explodes with youthful fresh SEX [First shot] AV application online AV experience shooting 2226",https://pic.javct.net/poster/04112026/16c5fdaad8.jpg,https://javct.net/v/siro-5345,0,2026-05-06
SIRO-5305,"A beautiful therapist can't control her sexual desire and applies. Contrary to her beautiful appearance, her perverted face, body, and erotic level are all perfect. I want to have sex with such a beautiful woman forever [First shot] AV application online AV experience shooting 2224",https://pic.javct.net/poster/04112026/0213cab744.jpg,https://javct.net/v/siro-5305,0,2026-05-06
SIRO-5306,"A beautiful slender wife appears and seduces a man with her erotic lingerie and slender body. She feels the man with an expression that she doesn't usually show to her husband, and succumbs to the pleasure and gets wild [First shot] AV application online AV experience shooting 2222",https://pic.javct.net/poster/04112026/17fd40da2c.jpg,https://javct.net/v/siro-5306,0,2026-05-06
FC2PPV-4895221,"First photo shoot! A neat and pretty F-cup Moe cute teen who is still at a dangerous age! A pure white body with long black hair, beautiful skin and beautiful big breasts, and ejaculation inside the vagina without a rubber band. It was a dream-like moment.",https://pic.javct.net/poster/04112026/fb1189fc34.jpg,https://javct.net/v/fc2ppv-4895221,45,2026-05-06
FC2PPV-4895224,"First photo shoot, that girl.3 She is a caregiver apprentice who has never had a feminine way of thinking, but now she looks great in a cute apron! She cums inside her still undeveloped body! It's not just her appearance that has become a little more mature.",https://pic.javct.net/poster/04112026/bd5a8dd125.jpg,https://javct.net/v/fc2ppv-4895224,78,2026-05-06
200GANA-3363,"Nice body and busty tits Mitanku [Aki, 32 years old, office worker] A big-breasted beauty who is weak against pressure feels pleasure for the first time in about a year. She shakes her proud H cup and feels it. A real softie, first shot 2291",https://pic.javct.net/poster/04112026/4ba733c0f6.jpg,https://javct.net/v/200gana-3363,0,2026-05-06
857OMG-029,"""I'll tease you a lot and do anything,'' said the girl who applied from behind the scenes, with teary eyes and shaking her hips, making me cum until my senses went crazy, and when I gave her a huge amount of creampie, she cried with joy...",https://pic.javct.net/poster/04112026/24ef799490.jpg,https://javct.net/v/857omg-029,80,2026-05-06
300MIUM-1361,"She has a cute face and is super sadistic [God tech slut with a huge gap] Her devilish bass voice is a sexy queen JD guy who knows everything about her hand techniques, oral techniques, and breast techniques to get rid of his premature ejaculation dick and sway her F cup beautiful breasts as she cums wildly [If you're horny, UrPenis is the way to go]",https://pic.javct.net/poster/04112026/9370d01906.jpg,https://javct.net/v/300mium-1361,63,2026-05-06
