code,title,image_url,page_url,views,date_scraped
GVG-760-RM,"The Perverted, Face-Licking, Creampie Medical Records Of An Old Physician [Uncensored L**ked]",https://pic.javct.net/poster/20212011/1644115712.jpg,https://javct.net/v/gvg-760-rm,132,2026-04-24
MARA-050-RM,Nana Reira's Big Tits Theater Hcup101cm [Uncensored L**ked],https://pic.javct.net/poster/04112026/1777000718.jpg,https://javct.net/v/mara-050-rm,128,2026-04-24
FOCS-155-RM,"Real Virgin Debut, First Tense Uncut Sex For The First Time, Minami Kazama [Uncensored L**ked]",https://pic.javct.net/poster/20230908/1695960338.jpg,https://javct.net/v/focs-155-rm,185,2026-04-24
KNMB-062-RM,Raw 3P Love Older Sister 25 Years Old G Cup Nurse Karen Mochizuki Karen [Uncensored L**ked],https://pic.javct.net/poster/20230908/1695787139.jpg,https://javct.net/v/knmb-062-rm,140,2026-04-24
FOCS-154-RM,I Turned My Boss's Plain-looking Daughter Into A Meat Urinal And Addicted To Cock With An Aphrodisiac Sex... Madoka Kuga [Uncensored L**ked],https://pic.javct.net/poster/20230908/1695960405.jpg,https://javct.net/v/focs-154-rm,120,2026-04-24
HODV-21515-RM,"Thank You For Your Nomination. I'm Reika Hashimoto, A Newcomer Soap Lady. [Uncensored L**ked]",https://pic.javct.net/poster/04112026/1777000783.jpg,https://javct.net/v/hodv-21515-rm,150,2026-04-24
EKW-041-RM,I Want To Be Cooked By This Guy Today. Maijima Akari [Uncensored L**ked],https://pic.javct.net/poster/04112026/1777000901.jpg,https://javct.net/v/ekw-041-rm,120,2026-04-24
HAR-066-RM,My girlfriend was fucked and cuckolded at a drinking party [Uncensored L**ked],https://pic.javct.net/poster/04112026/1776997843535.jpg,https://javct.net/v/har-066-rm,125,2026-04-24
GVG-729-RM,Father In Law and Daughter In Law Sticky Creampie Fucking Mio Kimijima [Uncensored L**ked],https://pic.javct.net/poster/20212011/1641318258.jpg,https://javct.net/v/gvg-729-rm,121,2026-04-24
XRW-622-RM,You Do Not Have To Do Anything!I Want To Be Playful With Full Passive Sex. [Uncensored L**ked],https://pic.javct.net/poster/04112026/1777000520.jpg,https://javct.net/v/xrw-622-rm,141,2026-04-24
XRW-623-RM,Big Breast Yariman Women's Inverse Nan Bonded Snakes SEX Foam Yuuki [Uncensored L**ked],https://pic.javct.net/poster/04112026/1777000585.jpg,https://javct.net/v/xrw-623-rm,180,2026-04-24
PKPD-262-RM,"Sweetheart Icha Love Documentary She's Short And Spoiled, But Her Sexual Activities Are Endless. A One-day Flirty Date With Mio Ichijo [Uncensored L**ked]",https://pic.javct.net/poster/20230908/1696048241.jpg,https://javct.net/v/pkpd-262-rm,130,2026-04-24
URKK-009-RM,Kimeepaco Amateur Tits Bottom Gradle Pregnancy Mating Mikuru Shiiba Mikuru [Uncensored L**ked],https://pic.javct.net/poster/04112026/1776997559.jpg,https://javct.net/v/urkk-009-rm,140,2026-04-24
NEBO-009-RM,"Parent Disqualification Uncle, I'll Miss You If You're Not Here. Madoka Kuga [Uncensored L**ked]",https://pic.javct.net/poster/20230908/1695785939.jpg,https://javct.net/v/nebo-009-rm,121,2026-04-24
PAIS-050-RM,A Sober Busty Young Wife Has Applied. She Seems To Be Sexless. [Uncensored L**ked],https://pic.javct.net/poster/20230908/1695785815.jpg,https://javct.net/v/pais-050-rm,119,2026-04-24
SOAV-042-RM,Married Wife's Cheating Heart Rash [Uncensored L**ked],https://pic.javct.net/poster/20231711/1702835833.jpg,https://javct.net/v/soav-042-rm,106,2026-04-24
DASS-926-RM,"Enjoy The Irresistible Beauty Of Legs That Will Ruin Any Man. An Exquisite Foot Fetish Suite That's Too Sweet. The Sacred Feet In Sweaty Pantyhose Sandwich Your Penis, Squeezing And Teasing You To The Point Of Ejaculation. Shiramine Miu [Uncensored L**ked]",https://pic.javct.net/poster/04112026/1776964625.jpg,https://javct.net/v/dass-926-rm,120,2026-04-24
SDAB-104-RM,"Uniform Girl And Daytime All Day Long, I Have A Sexual Intercourse [Uncensored L**ked]",https://pic.javct.net/poster/04112026/1777000416.jpg,https://javct.net/v/sdab-104-rm,135,2026-04-24
NUKA-65-RM,"6 Shots Without Pulling Out, Incestuous Copulation, Aika Hayashi [Uncensored L**ked]",https://pic.javct.net/poster/20230908/1695870990.jpg,https://javct.net/v/nuka-65-rm,105,2026-04-24
MUDR-033-RM,For Him That I Love ... I Give Anal With A Smile F Cup Beautiful Girl Two Holes Cum Inside Cum Inside Shizuka Misa [Uncensored L**ked],https://pic.javct.net/poster/20222410/1667699247.jpg,https://javct.net/v/mudr-033-rm,120,2026-04-24
MIAA-269-RM,Knead The Sensitive Cock Immediately After Ejaculation And Fire Continuously. ! Amazing Chin Shabu Loved Maid Rei Kuruki [Uncensored L**ked],https://pic.javct.net/poster/04112026/1777002114.jpg,https://javct.net/v/miaa-269-rm,120,2026-04-24
SOAV-045-RM,Married Wife's Cheating Heart Rena Kiyomoto [Uncensored L**ked],https://pic.javct.net/poster/04112026/1777000650.jpg,https://javct.net/v/soav-045-rm,116,2026-04-24
STAR-949-RM,Furukawa Iori Ultra Sensitive Sensitive Clitoris Leaping Frenzy Cum Maximum Transformer SEX [Uncensored L**ked],https://pic.javct.net/poster/20230205/1683104684.jpg,https://javct.net/v/star-949-rm,135,2026-04-24
SILK-2012-RM,"Tonight, in one bed. [Uncensored L**ked]",https://pic.javct.net/poster/04112026/1776842205138.jpg,https://javct.net/v/silk-2012-rm,74,2026-04-24
