code,title,image_url,page_url,views,date_scraped
DANDY-868-RM,"""Are You Excited To See Me Change My Clothes?""A Lady Boss Who Forgets A Woman Isn't Crazy Even If She's A Younger Cock Who Gets Horny On Her [Uncensored L**ked]",https://pic.javct.net/poster/20230207/1689826500.jpg,https://javct.net/v/dandy-868-rm,200,2026-05-30
MIST-440-RM,Overshot Aunt Sex For Aunt Enthusiasts By Aunts Aunt Fumino 60 Years Old Fumino Ishikawa [Uncensored L**ked],https://pic.javct.net/poster/20243105/1717609427.jpg,https://javct.net/v/mist-440-rm,168,2026-05-30
CHIB-001-RM,"When I Brought A Really Small Girl To A Multi-tenant Building, She Was Rejected, Saying, ""I'm Kind Of Scared..."" So I Got Excited And Inserted A Cock Into The Crack [Two Little Girls] Forbidden Prank Video 161 Minutes [Uncensored L**ked]",https://pic.javct.net/poster/20230207/1689391002.jpg,https://javct.net/v/chib-001-rm,161,2026-05-30
LULU-196-RM,"Mizuki Yayoi, The Best Semen Swallowing Mistress Who Can Cum Swallow If Called With An Exquisite Blowjob That A Wife Can't Taste [Uncensored L**ked]",https://pic.javct.net/poster/20230302/1679109780.jpg,https://javct.net/v/lulu-196-rm,160,2026-05-30
BBTU-059-RM,Pirama Deep Throat And Big Tits Go Crazy Sakura Mita [Uncensored L**ked],https://pic.javct.net/poster/20230205/1683949359.jpg,https://javct.net/v/bbtu-059-rm,112,2026-05-30
KAM-135-RM,Record Of A Perverted Erotic Manipulator Who Repeatedly Acted Obscene Acts To A Busty Beauty Who Became A Generalized Sensitive Zone With A Secret Rejuvenating Massage Momo Minami [Uncensored L**ked],https://pic.javct.net/poster/20230207/1689309944.jpg,https://javct.net/v/kam-135-rm,120,2026-05-30
HHH-412-RM,"The Moment Of Incest... Oh, I Wish I Hadn't Seen It... My Grown-up Son's Dick Is Bigger And More Attractive Than My Husband's... [Uncensored L**ked]",https://pic.javct.net/poster/05192026/de7b61d2cb.jpg,https://javct.net/v/hhh-412-rm,239,2026-05-30
KSBJ-255-RM,"Ms. Mizune, 28 Years Old, Will Fulfill The Sexual Desires Of A Busty Wife Who Can't Be Satisfied With Her Monthly Activity And Masturbation Five Times A Week [Uncensored L**ked]",https://pic.javct.net/poster/20230207/1689392932.jpg,https://javct.net/v/ksbj-255-rm,120,2026-05-30
JUBE-006-RM,"A Pichi Pichi Girl Who Works At A Maid Cafe ○ As A Result Of Powdering Herself For Beauty Goods, She Becomes A Pet Who Drowns In Pleasure And Sprinkles Saddle Tide Ww [Uncensored L**ked]",https://pic.javct.net/poster/20230207/1690602799.jpg,https://javct.net/v/jube-006-rm,167,2026-05-30
JAN-024-RM,E Uniform 24 In Uniform [Uncensored L**ked],https://pic.javct.net/poster/07202025/1753054988.jpg,https://javct.net/v/jan-024-rm,130,2026-05-30
JRZE-157-RM,First Shooting Age Fifty Wife Document Kiyoka Yoshizaki [Uncensored L**ked],https://pic.javct.net/poster/20230207/1689217723.jpg,https://javct.net/v/jrze-157-rm,120,2026-05-30
IENF-277-RM,Natsuhana Cream Pie Sex From Morning Till Night 51 [Uncensored L**ked],https://pic.javct.net/poster/20230207/1688613563.jpg,https://javct.net/v/ienf-277-rm,155,2026-05-30
SAME-236-RM,"A Married Woman Who Has Fallen Into Becoming A Human Toilet In Place Of Her Husband. Impregnation, Press, Skewering, And Gangbang. [Uncensored L**ked]",https://pic.javct.net/poster/05192026/aeb9281207.jpg,https://javct.net/v/same-236-rm,120,2026-05-30
RTP-106-RM,"Confession By Giving Courage To That Adorable C**ld!However, It Is Somewhat Sinking (one д-.)Even So, I Can Not Give It Up, ""I'm Actually, I Have Three Months Left My Life ..."" Lying And Buying Sympathy, I Begging To Do Sex Before I Die! ""I Promised If It's Up To You ""but If You Insert It Without Being Tolerated ... [Uncensored L**ked]",https://pic.javct.net/poster/05192026/f5737f233e.jpg,https://javct.net/v/rtp-106-rm,135,2026-05-30
SAN-156-RM,Harsh Reality Of Society. The Story Of How A Family Collapsed Due To The Power Of Money / Leila Fujii [Uncensored L**ked],https://pic.javct.net/poster/20230207/1690773607.jpg,https://javct.net/v/san-156-rm,130,2026-05-30
NEBO-007-RM,"The Scent Of The Southern Country The Skin Was So Thin That It Seemed To Break Black, And The Narrow, Almost Unused Dick Was Torn. Tropical Prostitution Beautiful Girl Yukinoeru [Uncensored L**ked]",https://pic.javct.net/poster/20230207/1690434823.jpg,https://javct.net/v/nebo-007-rm,123,2026-05-30
NSFS-206-RM,Father-in-law And Daughter-in-law Summer Secrets Best [Uncensored L**ked],https://pic.javct.net/poster/20230207/1690001331.jpg,https://javct.net/v/nsfs-206-rm,202,2026-05-30
NACR-754-RM,Very Popular With Gobusata Wives! Erotic Oil Massage At A Hidden Beauty Salon! Hitomi Mochizuki [Uncensored L**ked],https://pic.javct.net/poster/20241901/1705680761.jpg,https://javct.net/v/nacr-754-rm,120,2026-05-30
MKD-211-RM,"From The Tip Of The Head To The Toes Of The Foot, The Whole 50's Wife Is Making Her AV Debut! Matsuoka Shizue [Uncensored L**ked]",https://pic.javct.net/poster/05192026/e0998cbb4b.jpg,https://javct.net/v/mkd-211-rm,110,2026-05-30
MBG-002-RM,Demon Chi Po Addiction De M Spear Man Black Bitch Gal Creampie Meat Urinal [Uncensored L**ked],https://pic.javct.net/poster/20230207/1689477682.jpg,https://javct.net/v/mbg-002-rm,121,2026-05-30
TPIN-058-RM,Super Luxury Cabaret Club VIP Private Room Voyeur [Uncensored L**ked],https://pic.javct.net/poster/20230207/1688793862.jpg,https://javct.net/v/tpin-058-rm,164,2026-05-30
FMDL-008-RM,Cuckold By My Best Friend And Str**gled Development Falls M Awakening Mei Satsuki [Uncensored L**ked],https://pic.javct.net/poster/20230207/1689428020.jpg,https://javct.net/v/fmdl-008-rm,136,2026-05-30
XMOM-60-RM,Ripe Men's Esthetic That Makes A Man Eccentric Kokoro Hinagata [Uncensored L**ked],https://pic.javct.net/poster/20230207/1689217969.jpg,https://javct.net/v/xmom-60-rm,90,2026-05-30
ONEZ-113-RM,"A Wife Who Did Not Stop The Tide Kept On Having Sex Till The Night Came At A Luxury Hotel With Her Husband Who Met For A Long Time.Posting Footage That We Asked For ""Creamie"" With A Looking Sweet Female Face And Continued Seeking To Make Each Other Pure White.Yuan (pseudonym) 23 Years Old [Uncensored L**ked]",https://pic.javct.net/poster/05192026/f95088d43b.jpg,https://javct.net/v/onez-113-rm,120,2026-05-30
