code,title,image_url,page_url,views,date_scraped
HRSM-013-RM,Model Lesson Student ~Special Obscene Course~4 Ignorant Beautiful Girls Targeted [Uncensored L**ked],https://pic.javct.net/poster/20231011/1699703006.jpg,https://javct.net/v/hrsm-013-rm,257,2026-05-29
CR-052926-001,"A Two-Day, One-Night Trip Spent Constantly Getting Outdone by My Sister-in-Law While My Wife Was Away on Business",https://pic.javct.net/poster/05192026/6933aef184.jpg,https://javct.net/v/cr-052926-001,61,2026-05-29
ROE-482-RM,"PTA Affair With Unprotected Sex: A New Place I Found Where I Belonged, After Being Treated Like I Wasn't Even There At Home - Maki Tomoda [Uncensored L**ked]",https://pic.javct.net/poster/04112026/1776965814.jpg,https://javct.net/v/roe-482-rm,140,2026-05-29
MIDE-750-RM,"Suddenly I Was Called Naked Immediately After I Was Called By A Sister Who Was Immediately Playing Deriheru, And As A Result, She Came Naked Every Day. Bud [Uncensored L**ked]",https://pic.javct.net/poster/20253001/1741103636.jpg,https://javct.net/v/mide-750-rm,150,2026-05-29
KAGP-229-RM,Onasapo! !! Girls  Raw Clothes Naked And Provocative Dance 2 [Uncensored L**ked],https://pic.javct.net/poster/20221904/1651910575.jpg,https://javct.net/v/kagp-229-rm,120,2026-05-29
SCPX-482-RM,"Incest Father-in-law And Daughter ""Dad Is No Good..."" 6 People 250 Minutes [Uncensored L**ked]",https://pic.javct.net/poster/20230908/1695458782.jpg,https://javct.net/v/scpx-482-rm,250,2026-05-29
ADN-758-RM,My Beloved C**ldhood Friend Was Being Held By My Father... [Uncensored L**ked],https://pic.javct.net/poster/05192026/17510f79ae.jpg,https://javct.net/v/adn-758-rm,120,2026-05-29
MIMK-277-RM,"Ignoring Her Resistance, Her Boyfriend Proceeded To Have Unprotected Sex With Her, And What He Ended Up Asking Her For Was... A Sperm Extraction Service With A 100% Repeat Rate. [Uncensored L**ked]",https://pic.javct.net/poster/05192026/6859a46963.jpg,https://javct.net/v/mimk-277-rm,110,2026-05-29
ADN-782-RM,"A Mother, Taking Her Daughter's Place, Is Impregnated By A Debt Collector Who Presses Her With His Penis Until She Becomes Pregnant. [Uncensored L**ked]",https://pic.javct.net/poster/05192026/59ef6430ba.jpg,https://javct.net/v/adn-782-rm,120,2026-05-29
BAB-097-RM,"In Fact, I've Been Rubbing GCUP's Boobs Since I Was A Manager Of The Baseball Club Sumire Uchida Sumire [Uncensored L**ked]",https://pic.javct.net/poster/20230207/1689391441.jpg,https://javct.net/v/bab-097-rm,137,2026-05-29
CEMD-267-RM,A Horny Slut With The Power To Stop Time! 5 Hana Haruna [Uncensored L**ked],https://pic.javct.net/poster/20222311/1670641332.jpg,https://javct.net/v/cemd-267-rm,130,2026-05-29
MDE-303-RM,Sexual President's Lewd Plan One Man's Cock Reigned Over By Female Supremacy [Uncensored L**ked],https://pic.javct.net/poster/05192026/a029aa2ae4.jpg,https://javct.net/v/mde-303-rm,236,2026-05-29
BOBB-383-RM,"Milk Fetish Erotic Cosplay That Maximizes The Charm Of J Cup Beautiful Breasts 7 Boin ""Natsuno Kohaku"" Box2 [Uncensored L**ked]",https://pic.javct.net/poster/20230207/1689305599.jpg,https://javct.net/v/bobb-383-rm,120,2026-05-29
BBTU-056-RM,Agony Big Tits Orgasm Lotion Hard Fuck Mei Hosho [Uncensored L**ked],https://pic.javct.net/poster/20230302/1679109294.jpg,https://javct.net/v/bbtu-056-rm,116,2026-05-29
HUNTB-568-RM,"""Don't Run Away For A Minute! ] My Sister-in-law Is A Monster Who Loves Vaginal Cum Shot Sex! My Sister-in-law Is A Super Naughty Little Devil Girl! Even If I Refuse, I Chase Them All Over The House And My Sperm Is Empty... [Uncensored L**ked]",https://pic.javct.net/poster/20230207/1689911593.jpg,https://javct.net/v/huntb-568-rm,230,2026-05-29
SPZ-748-RM,Popular In Certain Variety Show! Reverse Offer From Shinoda Yu Saw The Video Program Takes Yoshoku-ya Mr. S Saddle! [Uncensored L**ked],https://pic.javct.net/poster/05192026/b000118441.jpg,https://javct.net/v/spz-748-rm,120,2026-05-29
AKDL-033-RM,Completely Subjective Real Dick A**se [Uncensored L**ked],https://pic.javct.net/poster/20243105/1718814840.jpg,https://javct.net/v/akdl-033-rm,114,2026-05-29
XVSR-194-RM,"To Blush In Earnest, Pissing Girl! !Incontinence Ban! Miyu Okura [Uncensored L**ked]",https://pic.javct.net/poster/06032026/1773216987.jpg,https://javct.net/v/xvsr-194-rm,120,2026-05-29
SPSD-021-RM,"Beautiful Witch Mask Shiroganese: A Trap Of Betrayal For The Beautiful Saint, Kyoka Tachibana [Uncensored L**ked]",https://pic.javct.net/poster/05192026/36bac6dcc9.jpg,https://javct.net/v/spsd-021-rm,70,2026-05-29
HMGL-139-RM,Resort Hachikkyo Psycho Pies Bikini Glamorous [Uncensored L**ked],https://pic.javct.net/poster/06032026/1775015948.jpg,https://javct.net/v/hmgl-139-rm,120,2026-05-29
NACR-753-RM,Breast Meat And Butt Meat Festival! An Unscripted Showdown With Anna Hanayagi! ! [Uncensored L**ked],https://pic.javct.net/poster/20241901/1705680832.jpg,https://javct.net/v/nacr-753-rm,121,2026-05-29
DNJR-104-RM,The Desperate Face Of A Masochistic Man Who Is Resisting ~ I Love It Specializing In Ejaculation Patience Daddy Live Girl Live Hikaru Minazuki [Uncensored L**ked],https://pic.javct.net/poster/20230207/1688787944.jpg,https://javct.net/v/dnjr-104-rm,144,2026-05-29
IENF-274-RM,"Naive And Cute School Girls! ""Could You Solve The Problem Of A Virgin's Premature Ejaculation?""A Curious Schoolgirl Gets Squeezed By A Virgin Who Has Too Premature Ejaculation And Cums Inside Out! 2 [Uncensored L**ked]",https://pic.javct.net/poster/20230207/1688613626.jpg,https://javct.net/v/ienf-274-rm,145,2026-05-29
DANDY-866-RM,"A Girl Who Got Wet In The Rain ○ A See-through Bra Is Too Erotic! ! I Will Unconsciously Tempt You, So I Will Start Fir Tree Immediately [Uncensored L**ked]",https://pic.javct.net/poster/20230207/1689826465.jpg,https://javct.net/v/dandy-866-rm,170,2026-05-29
