code,title,image_url,page_url,views,date_scraped
MISM-110-RM,"I Thrust Until I Throw Out, The Most Crazy Deep Throat History Ever [Uncensored L**ked]",https://pic.javct.net/poster/05192026/9368b4c5dd.jpg,https://javct.net/v/mism-110-rm,170,2026-05-23
ZEX-417-RM,"Miraculous Fair Skin F Cup, Rina Takase Best [Uncensored L**ked]",https://pic.javct.net/poster/20221108/1660538591.jpg,https://javct.net/v/zex-417-rm,120,2026-05-23
KSBJ-014-RM,Drunkenness Netora Is Wife Shiho Egami [Uncensored L**ked],https://pic.javct.net/poster/06032026/1773888942.jpg,https://javct.net/v/ksbj-014-rm,127,2026-05-23
XVSR-180-RM,Rookie DEBUT! ! An Misora [Uncensored L**ked],https://pic.javct.net/poster/01202026/1772254186.jpg,https://javct.net/v/xvsr-180-rm,120,2026-05-23
JUKF-101-RM,"A Beautiful Female Manager Who Works At A Certain AV Office Serves Her Clients With Her Body ""If You Do As The President Says, Can You Really Get The Job?"" Mr. Konno Hikaru Konno [Uncensored L**ked]",https://pic.javct.net/poster/20230207/1690000341.jpg,https://javct.net/v/jukf-101-rm,160,2026-05-23
MIDE-815-RM,"Yui Shirasaka, A Tutor Who Is Tempted By Whispering Tightly [Uncensored L**ked]",https://pic.javct.net/poster/05192026/b0446779e0.jpg,https://javct.net/v/mide-815-rm,150,2026-05-23
YST-299-RM,"Regardless Of Whether It's Vulgar Or Elegant, I Want To Play With Suzune-san As Much As I Can. Anka Suzune [Uncensored L**ked]",https://pic.javct.net/poster/20230207/1690521941.jpg,https://javct.net/v/yst-299-rm,100,2026-05-23
GVG-793-RM,Fo**ed Women's Staff To Naked ... All The Records Of The Rhythmic Gymnastics That Sexual Harassment Called Special Training Is Prevalent [Uncensored L**ked],https://pic.javct.net/poster/05192026/62969f56cb.jpg,https://javct.net/v/gvg-793-rm,130,2026-05-23
YMDS-139-RM,Icha Love House Drinking Rich Tongue Sticky Sex The Day Monami Takarada Became Her Girlfriend [Uncensored L**ked],https://pic.javct.net/poster/20230207/1690604291.jpg,https://javct.net/v/ymds-139-rm,130,2026-05-23
PKPD-098-RM,Raw Love Hentai Beautiful Breasts Girl & Strongest Model Beautiful Leg Girl Black Pantyhose Student Love Homme [Uncensored L**ked],https://pic.javct.net/poster/06032026/1774079973.jpg,https://javct.net/v/pkpd-098-rm,115,2026-05-23
IENE-857-RM,"Picking Up Amateurs: More Than Friends But Less Than Lovers, When We Had These Friends Thigh Fuck With Just Cling Wrap Between Them, Things Got FILTHY Fast [Uncensored L**ked]",https://pic.javct.net/poster/05192026/0baaa5af64.jpg,https://javct.net/v/iene-857-rm,200,2026-05-23
JYMA-038-RM,A Middle-Aged Man's Sexual Desire Documentary A Fair-skinned Carnal Body A Wife And An Old Man's Sweaty Sexual Intercourse All Day Fucking A Beautiful Busty Ass Wife Iori Tsukimi [Uncensored L**ked],https://pic.javct.net/poster/20230207/1689912834.jpg,https://javct.net/v/jyma-038-rm,120,2026-05-23
HRDV-574-RM,That idol is revived with a new super clear standard mosaic [Madoka Ozawa] Part 1 [Uncensored L**ked],https://pic.javct.net/poster/05192026/b8e3d19c43.jpg,https://javct.net/v/hrdv-574-rm,115,2026-05-23
HMN-853-RM,Brothel For Masochistic Men Where Younger Girls Treat You Like A Weakling But Make Your Dick Hard As A Rock And Let You Cum Inside Them Again And Again. Nipple To**ure And Verbal A**se By Naughty Girls. Perfume Jun Hinata Natsu [Uncensored L**ked],https://pic.javct.net/poster/05192026/3a1bf896a5.jpg,https://javct.net/v/hmn-853-rm,200,2026-05-23
BONU-029-RM,"Cum Swallowing Dirty Talk Hear In Your Ear, The Erotic Sound Of Nebasupe And Throat Cum Swallowing Miho Tomii [Uncensored L**ked]",https://pic.javct.net/poster/20230207/1689391123.jpg,https://javct.net/v/bonu-029-rm,123,2026-05-23
BNDV-450-RM,Revived In The New Standard Mosaic That Idle Super Clear [Madoka Ozawa] [Uncensored L**ked],https://pic.javct.net/poster/05192026/3696e5d108.jpg,https://javct.net/v/bndv-450-rm,240,2026-05-23
BKD-312-RM,Mother-to-c**ld Copulation [Kurabuchi Onsen Road] Momo Saejima [Uncensored L**ked],https://pic.javct.net/poster/20230207/1689391184.jpg,https://javct.net/v/bkd-312-rm,120,2026-05-23
APNS-317-RM,"Now, The Circle Of My Beloved Wife Who Has Disappeared Has Been Sent To Me On DVD... Umi Oikawa [Uncensored L**ked]",https://pic.javct.net/poster/20230207/1689996574.jpg,https://javct.net/v/apns-317-rm,108,2026-05-23
MISM-446-RM,"The House Of Throat To**ure. The Eagerly Awaited Anal Destruction. The Long-awaited, Exhilarating Full-force Vomiting. We Invite Our Energetic, Boyish Girl. [Uncensored L**ked]",https://pic.javct.net/poster/05192026/1e463570c5.jpg,https://javct.net/v/mism-446-rm,180,2026-05-23
APAK-258-RM,Innocent Creampie 149cm (Ecup) Erika-chan Fair-skinned Beautiful Big Breasts Crunchy Nipples Demon Fucking Fierce Iki ♂ # Off Paco Daughter And Hotel Cage Erika Kuromiya Horny Climax SEX [Uncensored L**ked],https://pic.javct.net/poster/20230207/1689999400.jpg,https://javct.net/v/apak-258-rm,127,2026-05-23
AKDL-024-RM,"[Verification AV] For some reason, girls look cuter without make-up Koko Nanase [Uncensored L**ked]",https://pic.javct.net/poster/06032026/1774857594.jpg,https://javct.net/v/akdl-024-rm,128,2026-05-23
SDAM-165-RM,"Satomi Ikura (22), a college student living in Chofu City, cums with 6 other people's dicks inserted in her first shoot ""I didn't have enough money for my boyfriend's birthday play'' [Uncensored L**ked]",https://pic.javct.net/poster/04112026/1776713386906.jpg,https://javct.net/v/sdam-165-rm,156,2026-05-23
PKPD-097-RM,Yen Woman Dating Creampie OK 18-year-old Small Chip Legal Law ● Daughter Takanashi Kotori [Uncensored L**ked],https://pic.javct.net/poster/06032026/1773983309.jpg,https://javct.net/v/pkpd-097-rm,136,2026-05-23
NNPJ-349-RM,"""Please Give Me A Semen"" Smile With 11 Shots Gokkun! ! The AV Release Of The Weekend That I Took A Hamburger Of Amateur Sex Drinking Female College Student Nao-chan (20 Years Old) Who Loves Blowjob And Drinks Freely. Pick-up JAPAN EXPRESS Vol. 112 [Uncensored L**ked]",https://pic.javct.net/poster/05192026/ea0f6d6343.jpg,https://javct.net/v/nnpj-349-rm,170,2026-05-23
