code,title,image_url,page_url,views,date_scraped
KUSE-030-RM,"Virgin Debut G Cup At 14 Years Old, J Cup At 20 Years Old A Female College Student With Big Breasts Is A Shy And Stooped Female College Student Minamikaze Sawa AV Appearance [Uncensored L**ked]",https://pic.javct.net/poster/20212709/1634549631.jpg,https://javct.net/v/kuse-030-rm,195,2026-03-22
TIKB-175-RM,"[Pakopaco Video] This Lovey-dovey Couple! Too Erotic, I Can't Do It Www Kana Morisawa [Uncensored L**ked]",https://pic.javct.net/poster/20231711/1700279446.jpg,https://javct.net/v/tikb-175-rm,116,2026-03-22
HUNTC-513-RM,"Before I Knew It, My Room Had Become A Hangout Spot For Runaway Girls With Their Own Problems! As Long As I Use A Condom, They Never Hate Sex And Never Complain! But They Don't Seem To Like It, So They Barely React! But When I Have Raw Sex With Them Without Permission, They Cum Over And Over Again With An Ahegao Face And Beg For Creampies! [Uncensored L**ked]",https://pic.javct.net/poster/06032026/1773969818.jpg,https://javct.net/v/huntc-513-rm,200,2026-03-22
NNPJ-300-RM,"A Encounter Of A Miracle In The City Center!The Minor Alpine Growing Up! SEX Genius!Mai Chan, A Girls' University Student With Passionate Waist, Released Her Summer Memories With 20 Years Old! ! Nanpa JAPAN EXPRESS Vol.79 [Uncensored L**ked]",https://pic.javct.net/poster/20250606/1750030967.jpg,https://javct.net/v/nnpj-300-rm,180,2026-03-22
HUNTC-394-RM,"The Cheap Apartment I Live In On A Low Salary Is 60 Years Old And Dilapidated With A Japanese-style Toilet, But All The Women Who Live There Are Sex-crazed Monsters Who Forcefully Cum Inside Me In A Piston-like Cowgirl Position That Makes The Apartment Creak! [Uncensored L**ked]",https://pic.javct.net/poster/06032026/1773970005.jpg,https://javct.net/v/huntc-394-rm,180,2026-03-22
NACR-664-RM,I Can't Tell My Husband... That I'm Being Fucked By My Father-In-Law... Umi Natsukawa [Uncensored L**ked],https://pic.javct.net/poster/20230205/1684555330.jpg,https://javct.net/v/nacr-664-rm,120,2026-03-22
HBAD-654-RM,The Nice-Looking Older Sister In The Same Apartment I Saw Every Morning Was A Perverted Slut Who Loved Dicks With Erotic Big Tits And An Insanely Nice Body Rino Nakajo [Uncensored L**ked],https://pic.javct.net/poster/20230302/1678332084.jpg,https://javct.net/v/hbad-654-rm,120,2026-03-22
ROE-466-RM,"""The Director Is Now Our Fleshlight"" Arrogant Female Boss Subjugates To Her Insatiable Subordinate In Office Gang R**e Maki Tomoda [Uncensored L**ked]",https://pic.javct.net/poster/06032026/1773948227.jpg,https://javct.net/v/roe-466-rm,130,2026-03-22
CEMD-428-RM,I Will Help You Have The Best Masturbation! ! Mei Satsuki [Uncensored L**ked],https://pic.javct.net/poster/20231011/1699703946.jpg,https://javct.net/v/cemd-428-rm,135,2026-03-22
MUM-172-RM,Miracle Of TTP Slippery Pe~tsutan AV Debut Kumi 148cm [Uncensored L**ked],https://pic.javct.net/poster/06032026/1774107993.jpg,https://javct.net/v/mum-172-rm,180,2026-03-22
BACJ-080-RM,A Too Sweet Trap Set By A Wife With NTR Attributes [Uncensored L**ked],https://pic.javct.net/poster/20231011/1699672724.jpg,https://javct.net/v/bacj-080-rm,132,2026-03-22
ROE-450-RM,While Witnessing Her Daughter's Happiness... Mother Yuka Mizuno Violated By Her Son-in-law At The Wedding Reception [Uncensored L**ked],https://pic.javct.net/poster/06032026/1773948346.jpg,https://javct.net/v/roe-450-rm,120,2026-03-22
NSPS-437-RM,"The Widow Who Forgot What It Was Like To Be A Woman -A Faithful Wife, 51 Years Old- Sara Yumeka [Uncensored L**ked]",https://pic.javct.net/poster/20220707/1658192738.jpg,https://javct.net/v/nsps-437-rm,84,2026-03-22
SNOS-136-RM,"I Hit It Off With Two Super Sexy Swimsuit Gals At The Beach! We Went Drinking Together, Got Horny, And Ended Up Having Sex... No Matter How Many Times We Did It, We Still Want To Do It! Two Gay Bitches Who Love To Cum! Nanatsumori Riri And Murakami Yuuka [Uncensored L**ked]",https://pic.javct.net/poster/06032026/1773947793.jpg,https://javct.net/v/snos-136-rm,160,2026-03-22
JUY-938-RM,"""My Wife Received Another Suspicious Letter..."" A Married Woman Who Invites Chance Into Her Life - Ai Mukai [Uncensored L**ked]",https://pic.javct.net/poster/20212011/1639973476.jpg,https://javct.net/v/juy-938-rm,120,2026-03-22
RKI-627-RM,"One Day, Suddenly, A Woman Who Wants To Be My Exclusive Guy  ""I'm Glad To Be A Guy !"" Otsu Alice [Uncensored L**ked]",https://pic.javct.net/poster/20220707/1657300578.jpg,https://javct.net/v/rki-627-rm,160,2026-03-22
MISM-421-RM,Hello From The Land Of Vomit. Nice To Meet You. A Petite Girl Who Vomits From The Back Of Her Throat With A Smile. 149cm Yura [Uncensored L**ked],https://pic.javct.net/poster/06032026/1773969483.jpg,https://javct.net/v/mism-421-rm,180,2026-03-22
PRIN-010-RM,Doujin AV [104cm Super Big Breasts] Vaginal Spasm Keeps Coming [Reverse Bunny] Drunk And Tipsy [Home Coslayer] Shiny Oil [Virgin Until Last Year] [Uncensored L**ked],https://pic.javct.net/poster/20231912/1703908992.jpg,https://javct.net/v/prin-010-rm,134,2026-03-22
DANDY-881-RM,A Mother-in-law With A Strong Sexual Desire Who Wants To Have Sex Many Times While The Father Is Away Does Not Refuse The Raw Penetration Of Her Son VOL.5 [Uncensored L**ked],https://pic.javct.net/poster/20231011/1697086869.jpg,https://javct.net/v/dandy-881-rm,198,2026-03-22
PKPD-269-RM,Half Middle Half Outside Half Girlfriend Rihotan (20) Riho Shirahashi [Uncensored L**ked],https://pic.javct.net/poster/20231711/1701486691.jpg,https://javct.net/v/pkpd-269-rm,120,2026-03-22
JSOP-032-RM,New And Beautiful Mature Woman Bathhouse Rich And Sticky Luxury Soap Yui Hatano [Uncensored L**ked],https://pic.javct.net/poster/20231711/1700884671.jpg,https://javct.net/v/jsop-032-rm,125,2026-03-22
AVSA-280-RM,'INGO' IN GOD ECSTASY A Perverted Older Sister Who Loves Fellatio And Completely Dominates Men With Her Obscene Erotic Voice That Resonates In Men's Brains And Squeezes Out Their Semen. Lewd Slut Dirty Talk Nonoka Sato [Uncensored L**ked],https://pic.javct.net/poster/20231711/1700892727.jpg,https://javct.net/v/avsa-280-rm,126,2026-03-22
AVOP-378-RM,My Sister And Parents Met After A Long Absence With My Parents' Incest Incest Cumsome Sexual Intercourse Marksmith & Bamboo [Uncensored L**ked],https://pic.javct.net/poster/20221904/1653305442.jpg,https://javct.net/v/avop-378-rm,150,2026-03-22
MISM-434-RM,"No Movement Allowed! *Throat, Vagina And Anal Completely Destroyed! 3-hole R**e Iron Exorcist Reika Ichiba Who Never Stops Even If She Has A Serious Spasm [Uncensored L**ked]",https://pic.javct.net/poster/06032026/1773969358.jpg,https://javct.net/v/mism-434-rm,120,2026-03-22
