code,title,image_url,page_url,views,date_scraped
JUY-263-RM,Unstoppable Pleasure Defiled By My Father-In-Law's Dirty Love Nami Sekine [Uncensored L**ked],https://pic.javct.net/poster/20221202/1646614903.jpg,https://javct.net/v/juy-263-rm,119,2026-02-28
MDBK-316-RM,Divine Breasts Awahime Titty Fuck & Creampie Unlimited! Soap Covered With Bubbles And Making Fun [Uncensored L**ked],https://pic.javct.net/poster/20231912/1703303930.jpg,https://javct.net/v/mdbk-316-rm,150,2026-02-28
JURA-184-RM,First Shooting Married Woman Document Chapter 2 Erika Komura [Uncensored L**ked],https://pic.javct.net/poster/01202026/1772075609.jpg,https://javct.net/v/jura-184-rm,125,2026-02-28
MIST-041-RM,"And ""Please Someone Stop The I When It Is Good.""When You Give To Stop The Girl In Trouble, To Turn ○ ンコ Of Commonplace As To Cum Sex Can Have Yet Dangerous Day .... [Uncensored L**ked]",https://pic.javct.net/poster/01202026/1772243753.jpg,https://javct.net/v/mist-041-rm,210,2026-02-28
FOCS-019-RM,(Complete POV) Horny Girlfriend That Loves Dirty Talk While Squeezing All That Cum Out! This Innocent Looking Girl With A Kansai Accent Secretly Loves To Fuck! Nonstop Creampie With Tons Of Cum Overflowing From Her Pussy. Mikako Horiuchi [Uncensored L**ked],https://pic.javct.net/poster/20212308/1631874959.jpg,https://javct.net/v/focs-019-rm,124,2026-02-28
CAWD-947-RM,The Youngest And Eroticest A-Cup Legal L**ita Traffic Guard In History AV Debut Shono Sora [Uncensored L**ked],https://pic.javct.net/poster/01202026/1772126841.jpg,https://javct.net/v/cawd-947-rm,170,2026-02-28
MIDE-668-RM,Sober Landlord Is The Day's De Filthy Girl! !Bold-Tuned Bumps In Restraint [Uncensored L**ked],https://pic.javct.net/poster/01202026/1772244008.jpg,https://javct.net/v/mide-668-rm,180,2026-02-28
200GANA-3335-RM,"The beautiful OL older sister who is so frustrated that she gets taken home on a dating site or at a shared table, releases the stress of her extremely erotic work through sex and squirting, which is truly an overwhelmingly erotic girl. A real softie, first shot 2265 [Uncensored L**ked]",https://pic.javct.net/poster/01202026/1772098290142.jpg,https://javct.net/v/200gana-3335-rm,68,2026-02-28
ADN-767-RM,A Married Female Teacher Who Was Assigned To A Village On The Brink Of Collapse Is Fo**ed To Impregnate The Village Every Day For The Sake Of Its Prosperity. [Uncensored L**ked],https://pic.javct.net/poster/01202026/1772127176.jpg,https://javct.net/v/adn-767-rm,110,2026-02-28
SDHS-065-RM,"One week after the SODSTAR graduation location, she came to the company for the final greeting, and had sex at the studio of memories, Nanao Saizuki [Uncensored L**ked]",https://pic.javct.net/poster/01202026/1772075458230.jpg,https://javct.net/v/sdhs-065-rm,89,2026-02-28
IPTD-818-RM,Satoshi Konno Wage Tomomi Loves Big Penis [Uncensored L**ked],https://pic.javct.net/poster/01202026/1772243871.jpg,https://javct.net/v/iptd-818-rm,120,2026-02-28
KUSE-008-RM,"After 30 Days Of Celibacy, She's Unleashing Her Lust! Demonic Piston-Pumping Action!! Furious Orgasms! She Loves Cock, And Now She's Surrounded In 360 Degrees Of Endless Perverted Muscle-Bound Sexual Release! Yota Chan [Uncensored L**ked]",https://pic.javct.net/poster/20212709/1635835190.jpg,https://javct.net/v/kuse-008-rm,132,2026-02-28
MIST-040-RM,Missed Fascination Of Clarity / Mana Miyawaki [Uncensored L**ked],https://pic.javct.net/poster/01202026/1772243811.jpg,https://javct.net/v/mist-040-rm,70,2026-02-28
KUSE-007-RM,Baby-faced Slender Small Breasts Wonder-chan? Subculture De M Civil Servant Dedicated Nori AV DEBUT [Uncensored L**ked],https://pic.javct.net/poster/01202026/1772244203.jpg,https://javct.net/v/kuse-007-rm,140,2026-02-28
XRW-524-RM,Full Scream!Nonstop!Cum On The Aphrodisiac With 10 Consecutive Blowjobs!Limit Breaking Ver Veri Yoshi Mariana [Uncensored L**ked],https://pic.javct.net/poster/01202026/1772243696.jpg,https://javct.net/v/xrw-524-rm,138,2026-02-28
GVG-350-RM,Crab Crotch To**ure 2 Mochizuki Sakura [Uncensored L**ked],https://pic.javct.net/poster/01202026/1772228297.jpg,https://javct.net/v/gvg-350-rm,125,2026-02-28
JUL-465-RM,"I, The Greeter, Went On An Adulterous Drive With The Company President's Wife. Maki Hojo [Uncensored L**ked]",https://pic.javct.net/poster/20212709/1633330536.jpg,https://javct.net/v/jul-465-rm,146,2026-02-28
FSDSS-300-RM,"The Call Girl I Invite Over Ends Up Being My Bully, Hiyori... Leading To Wild And Crazed Fucking. Hiyori Yoshioka [Uncensored L**ked]",https://pic.javct.net/poster/20212709/1633606393.jpg,https://javct.net/v/fsdss-300-rm,124,2026-02-28
AVSA-213-RM,Super Adhesion Close-up Obscene Nasty Bitch Colossal Tits Plump Saddle Crazy Nanami Matsumoto [Uncensored L**ked],https://pic.javct.net/poster/20221108/1660973354.jpg,https://javct.net/v/avsa-213-rm,125,2026-02-28
AKA-067-RM,My Estrus Pet (provisional) File. 002 101 Cm Huge Breasts H Cup Continuous Creampie [Uncensored L**ked],https://pic.javct.net/poster/01202026/1772244328.jpg,https://javct.net/v/aka-067-rm,125,2026-02-28
ADN-764-RM,"""There's No Way She'll Ever Like Me..."" The Day I Ejaculated, Completely Showing My Shame To A Beautiful Woman Who Accepted Me With Complete Affirmation, Even Though I Distrust Women. Shiramine Miu [Uncensored L**ked]",https://pic.javct.net/poster/01202026/1772127300.jpg,https://javct.net/v/adn-764-rm,120,2026-02-28
MOND-262-RM,My Dream Female Boss And Megumi Wakatsuki [Uncensored L**ked],https://pic.javct.net/poster/20231912/1703310765.jpg,https://javct.net/v/mond-262-rm,125,2026-02-28
MIDE-669-RM,New Face Debut 19-year-old Developing J Cup 103 Cm Koume Ena [Uncensored L**ked],https://pic.javct.net/poster/01202026/1772243937.jpg,https://javct.net/v/mide-669-rm,120,2026-02-28
CEMD-451-RM,My Mother-in-law Who Seduced Me With Sex Every Day And Helped Me Recover From My Seclusion 3 Ayumi Natsukawa [Uncensored L**ked],https://pic.javct.net/poster/20231912/1703302372.jpg,https://javct.net/v/cemd-451-rm,131,2026-02-28
