code,title,image_url,page_url,views,date_scraped
OFKU-245-RM,"My Voluptuous, Big-breasted, Big-hipped Stepsister Was A Male Esthetician... Her Body And Libido Are Off The Charts! Thick, Juicy, And Incredibly Huggable. Big Breasts X Big Butt X Big Areolas. Nishimura Nina [Uncensored L**ked]",https://pic.javct.net/poster/05192026/98e6a44f77.jpg,https://javct.net/v/ofku-245-rm,120,2026-05-20
YMDD-491-RM,"My Sanity Has Completely Collapsed, This Busty Wife, Mei Mizuki, Is Totally High. [Uncensored L**ked]",https://pic.javct.net/poster/04112026/473231b73b.jpg,https://javct.net/v/ymdd-491-rm,150,2026-05-20
ZEX-420-RM,Big Boobs Heaven  Dreamy Fluffy Big Boobs Deluxe [Uncensored L**ked],https://pic.javct.net/poster/20222410/1668480539.jpg,https://javct.net/v/zex-420-rm,248,2026-05-20
VENU-870-RM,Ms. Ayaka Makimura Who Has Made A Vaginal Cum Shot To Her Mother-in-law [Uncensored L**ked],https://pic.javct.net/poster/05192026/0f8f4d0e77.jpg,https://javct.net/v/venu-870-rm,90,2026-05-20
START-579-RM,"The strict female boss was an abusive bunny pinsaro girl with the worst turnover rate in Japan and even let her cum inside her! At the store and at work, she teased me ∞ times while belittling my virgin cock! Mahiro Yui [8th anniversary work] [Uncensored L**ked]",https://pic.javct.net/poster/04112026/ec772ee01f.jpg,https://javct.net/v/start-579-rm,123,2026-05-20
START-554-RM,"I don't refuse creampie, I don't feel embarrassed, I don't get attached. Mei Miyajima, a bimbo female college student who understands the story best [Uncensored L**ked]",https://pic.javct.net/poster/04112026/ab5b7ec1db.jpg,https://javct.net/v/start-554-rm,137,2026-05-20
SOAN-037-RM,Job Hunting Student Anal Compressive Palpation Two-Hole Intense Ichiu Synthetic Sigmoidal Colon Arousal Seminar Subject Number: 007 Miyukana With Freedom [Uncensored L**ked],https://pic.javct.net/poster/05192026/cc975404f2.jpg,https://javct.net/v/soan-037-rm,110,2026-05-20
TNKD-031-RM,Amount Of Star THE LOVE STORIES (Disc 2) [Uncensored L**ked],https://pic.javct.net/poster/05192026/714fd7de08.jpg,https://javct.net/v/tnkd-031-rm,200,2026-05-20
GVG-014-RM,Mama's Real Sex Education Kanako Ioka [Uncensored L**ked],https://pic.javct.net/poster/20221904/1651452891.jpg,https://javct.net/v/gvg-014-rm,117,2026-05-20
FVMD-010-RM,"Bottom Female YouTuber ""Tempting My Younger Brother Surprise"" Planning Shooting Is Too Spear, My Brother Who Was Seriously Lusted Was Dochaso Fucked And Grass Wwwwwww [Uncensored L**ked]",https://pic.javct.net/poster/20230804/1691407054.jpg,https://javct.net/v/fvmd-010-rm,165,2026-05-20
BBTU-045-RM,Specialized Big Boobs Big Boobs Fuck Miu Arioka [Uncensored L**ked],https://pic.javct.net/poster/20221108/1663389238.jpg,https://javct.net/v/bbtu-045-rm,123,2026-05-20
AMBI-171-RM,Small Love Story Between A Runaway Girl And An Old Man Saki Sakura [Uncensored L**ked],https://pic.javct.net/poster/20230206/1687239161.jpg,https://javct.net/v/ambi-171-rm,123,2026-05-20
AKDL-018-RM,"[Verified AV] The theory that if you have sex blindfolded, you won't know even if the other person changes [Uncensored L**ked]",https://pic.javct.net/poster/06032026/1774332343.jpg,https://javct.net/v/akdl-018-rm,124,2026-05-20
259LUXU-835-RM,Luxury TV 804 [Uncensored L**ked],https://pic.javct.net/poster/20222612/1674439444.jpg,https://javct.net/v/259luxu-835-rm,62,2026-05-20
OKSN-332-RM,"New Discovery! Gallons Of Breast Milk - Gorgeous H-Cup Colossal Tits & Big Nipples Dripping Breast Milk Are Proof Of Her Pleasure - Curvy, Light-Skinned Body Quivering [Uncensored L**ked]",https://static.javct.net/poster/oksn-332.jpg,https://javct.net/v/oksn-332-rm,119,2026-05-20
SGKI-091-RM,Time is stopped for girls in school uniforms to have intense sex and become love dolls at will. [Uncensored L**ked],https://pic.javct.net/poster/04112026/0de9d26a9b.jpg,https://javct.net/v/sgki-091-rm,164,2026-05-20
HMGL-123-RM,Big Dirty Little Collection Fujisaki Elina And Aoi Yamaguchi [Uncensored L**ked],https://pic.javct.net/poster/06032026/1773983557.jpg,https://javct.net/v/hmgl-123-rm,140,2026-05-20
DVMM-005-RM,"Immediate Saddle To A Fair-skinned Deca-ass Housekeeping Aunt! A Married Woman Who Became Captivated By A Big Penis Caught Me Without Permission The Next Day, So I Gave Her A Vaginal Cum Shot Many Times Until I Was Satisfied 24 Waka Misono [Uncensored L**ked]",https://pic.javct.net/poster/20230207/1690523927.jpg,https://javct.net/v/dvmm-005-rm,145,2026-05-20
GVG-787-RM,Prison Collection Hideo Hideo [Uncensored L**ked],https://pic.javct.net/poster/05192026/9a9b44577d.jpg,https://javct.net/v/gvg-787-rm,125,2026-05-20
300MIUM-1147-RM,"[Vaginal labor of a virgin who is active as a dad] He is a pusher and has no experience as a host, and is a landmine beginner who has a nice face and good style. He says that he misses human skin and wants to debut as a dad. At first, he was confused, but his eroticism gradually accelerates. While shaking his proud G cup, he said, ""It might be fun to be a dad.'' ""I can recommend you.'' When I got used to it, I screwed my uncle's physical dick in wwww [creampie] [Uncensored L**ked]",https://pic.javct.net/poster/05192026/da191a76e0.jpg,https://javct.net/v/300mium-1147-rm,101,2026-05-20
GVG-788-RM,Roses Crazy Woman Pear Flowers [Uncensored L**ked],https://pic.javct.net/poster/05192026/5d014d1974.jpg,https://javct.net/v/gvg-788-rm,130,2026-05-20
FUNK-035-RM,Was Toyed With Until I Was Provoked By Whispering Dirty Words In A Barelyaba Situation To A Small Devil J System Of A Student Who Could Never Put Out My Hand And Blew A Man's Tide. Riena Ninomiya [Uncensored L**ked],https://pic.javct.net/poster/20230207/1690600867.jpg,https://javct.net/v/funk-035-rm,167,2026-05-20
DVAJ-625-RM,"Couldn't Stand My Niece Who Begged Me For Money Using Her Big Tits As Food, But I Couldn't Stand It And Made Her Pay Back Immediately With A Man And A Creampie For 3 Days When My Parents Were Absent Natsu Hoshino [Uncensored L**ked]",https://pic.javct.net/poster/20230804/1691209663.jpg,https://javct.net/v/dvaj-625-rm,139,2026-05-20
HFD-029-RM,4 THE Man Hunting Time Your Sister Gal M [Uncensored L**ked],https://pic.javct.net/poster/20230206/1687494573.jpg,https://javct.net/v/hfd-029-rm,240,2026-05-20
