code,title,image_url,page_url,views,date_scraped
YUJ-063-RM,"I Met My Ex-girlfriend For The First Time In Several Years, And Even Though We Both Had Boyfriends/girlfriends, We Kept Saying ""I Love You"" And Yearning For Each Other, Getting Caught Up In A Relationship That Was More Than Friends With Benefits But Less Than Lovers. [Uncensored L**ked]",https://pic.javct.net/poster/04112026/a7358cf2a7.jpg,https://javct.net/v/yuj-063-rm,160,2026-05-03
XVSR-226-RM,To What Eloy SEX Once You've Been Alive Endure The Popular AV Actress To Ultimate? Do Fountain [Uncensored L**ked],https://pic.javct.net/poster/06032026/1775523958.jpg,https://javct.net/v/xvsr-226-rm,120,2026-05-03
TPPN-027-RM,"Speechless Obscene, Prisoner Of Libido Without End. Aizaki Leila [Uncensored L**ked]",https://pic.javct.net/poster/04112026/cf99984d3d.jpg,https://javct.net/v/tppn-027-rm,120,2026-05-03
RAN-010-RM,Kiyoshi Kayama Very Turbulent [Uncensored L**ked],https://pic.javct.net/poster/04112026/50ea62a4d1.jpg,https://javct.net/v/ran-010-rm,120,2026-05-03
MGOLD-061-RM,"My Internationally Married Wife Cheated On Me, So I Started Making Love With My Dad's Big-breasted Stepc**ld! Lisa [Uncensored L**ked]",https://pic.javct.net/poster/04112026/f0880912c0.jpg,https://javct.net/v/mgold-061-rm,105,2026-05-03
DVPRN-027-RM,N Pyo's Nurse Cowgirl! Kiyoshi Kayama [Uncensored L**ked],https://pic.javct.net/poster/04112026/dbaf3690ec.jpg,https://javct.net/v/dvprn-027-rm,120,2026-05-03
CAWD-976-RM,A Hole That Wants To Be Filled By An Old Man: A Frustrated Girl Becomes Seriously Addicted To The Disgusting Sex With A Complete Stranger's Dick. - Nami Asami [Uncensored L**ked],https://pic.javct.net/poster/04112026/42247a234b.jpg,https://javct.net/v/cawd-976-rm,130,2026-05-03
300MIUM-931-RM,Beautiful constricted beauty big breasts style Super binkan beauty OL who masturbates in week 5 is undressed in front of the advent camera [Uncensored L**ked],https://pic.javct.net/poster/20230207/1689752640.jpg,https://javct.net/v/300mium-931-rm,130,2026-05-03
300MIUM-322-RM,"I'll come to your workplace Case.17 Mr. Miyazawa / 24 years old / Real estate salesman I'm seriously looking for an OL property that is too weak to push, so I called him during sales, and after seeing the inside, I immediately inserted it and did whatever I wanted.I called him again just before the end of the day and gave him a blowjob in the dark. [Uncensored L**ked]",https://pic.javct.net/poster/04112026/f7632d4018.jpg,https://javct.net/v/300mium-322-rm,73,2026-05-03
300MIUM-246-RM,"I'll visit your workplace Case.10 Secretary to the president of an IT consulting company / Anna Komori / 28 years old A huge amount of squirting shaved pussy While the president was waiting for the president in front of the company entrance, she gave me a blowjob in the car with tears in her eyes.After work, I took her to our company and thoroughly devoured her sensitive shaved pussy that couldn't stop aching... [Uncensored L**ked]",https://pic.javct.net/poster/04112026/2adbe27cd9.jpg,https://javct.net/v/300mium-246-rm,92,2026-05-03
LULU-236-RM,I Unexpectedly Had Sex With My Niece Deca-ass J Series And Uncle Dekachi ○ Po Raw Saliva Lazy Ahe Face White Eyes Gangimari Convulsions Kitsuman Vagina Spree Many Times. Yukari's [Uncensored L**ked],https://pic.javct.net/poster/20230804/1693625912.jpg,https://javct.net/v/lulu-236-rm,160,2026-05-03
HUNTB-657-RM,I'm The Only Man On Our School Trip! A School Trip That I Couldn't Go For Various Reasons (I Carry Luggage And Chores). We Desperately Wanted Memories Of School Life [Uncensored L**ked],https://pic.javct.net/poster/20230908/1694145152.jpg,https://javct.net/v/huntb-657-rm,220,2026-05-03
MIDA-628-RM,"Arching Back Like A Shrimp! 783 Orgasms, 9776 Convulsions, 4032cc Of Cum, Orgasm Special, Abstinence Orgasm, Teased For A Month, 24 Hours Straight Of Big Dick FUCK, Maria Valentine [Uncensored L**ked]",https://pic.javct.net/poster/04112026/a6d9f5ccc0.jpg,https://javct.net/v/mida-628-rm,150,2026-05-03
HONB-320-RM,CHIYU Kimesek HOWTO [Uncensored L**ked],https://pic.javct.net/poster/20230908/1694491268.jpg,https://javct.net/v/honb-320-rm,91,2026-05-03
STSK-090-RM,"Smelly, Dirty, Disgusting 3K Fo**ed To Fuck A Fat Uncle Who Weighs Over 100 Kilograms 4 Beautiful Girls In Super Slim Uniforms 2 [Uncensored L**ked]",https://pic.javct.net/poster/20230804/1694059572.jpg,https://javct.net/v/stsk-090-rm,182,2026-05-03
FOCS-045-RM,"Fake Picking Up Girls Variety Special! Will This Office Lady Be In A Video While At Work? After Abruptly Asking Her This, This Heartbroken Beautiful Woman Gets Her Masochistic Side Coaxed Out ""I'm A Pretty Lewd... So Just Give Me More Even Harder"". Yui Tenma [Uncensored L**ked]",https://pic.javct.net/poster/20212011/1642159571.jpg,https://javct.net/v/focs-045-rm,122,2026-05-03
NAMH-005-RM,First real creampie 13 shots NTR with the worst ex-boyfriend Suzu (university student) [Uncensored L**ked],https://pic.javct.net/poster/20241901/1707067226.jpg,https://javct.net/v/namh-005-rm,106,2026-05-03
EBOD-409-RM,Curiosity Inoue Miwa E-BODY Exclusive Debut Honor Student [Uncensored L**ked],https://pic.javct.net/poster/01202026/1772510299.jpg,https://javct.net/v/ebod-409-rm,120,2026-05-03
GVG-770-RM,A Sexy Weather Girl And Naughty Brats. Akari Mitani [Uncensored L**ked],https://pic.javct.net/poster/20212011/1643623940.jpg,https://javct.net/v/gvg-770-rm,137,2026-05-03
DIC-048-RM,"Actress Name, Undecided. AV Debut Document More Than Shouts, Less Than An Actress. Vol.01 Beautiful Breast C Cup × Experience In Experience 0 Person × Shyness SEX [Uncensored L**ked]",https://pic.javct.net/poster/04112026/e57997a7b3.jpg,https://javct.net/v/dic-048-rm,135,2026-05-03
CAWD-977-RM,"Too Erotic, It's Deadly! A Truly Beautiful Girl With An Overwhelming 55cm Waist And Miraculous Natural G-cup Breasts Awakens To A Massive Orgasm In This Pornographic Film Featuring 16 Facial Cumshots. Honma Asami [Uncensored L**ked]",https://pic.javct.net/poster/04112026/8f9b6b8322.jpg,https://javct.net/v/cawd-977-rm,130,2026-05-03
CEMD-252-RM,A Female Boss Who Eats Her Subordinates At The Woman On Top Posture With Sexual Desire Processing! Mio Nozaki [Uncensored L**ked],https://pic.javct.net/poster/20222109/1666415194.jpg,https://javct.net/v/cemd-252-rm,118,2026-05-03
567BEAF-017-RM,"Aki-chan, a 24-year-old bitch dental hygienist who gets excited about her miserable self and sprees in dating [Uncensored L**ked]",https://pic.javct.net/poster/20221904/1653718611.jpg,https://javct.net/v/567beaf-017-rm,74,2026-05-03
BACJ-072-RM,Reverse Seeding M Man Training Waka Ninomiya [Uncensored L**ked],https://pic.javct.net/poster/20230908/1694232728.jpg,https://javct.net/v/bacj-072-rm,107,2026-05-03
