code,title,image_url,page_url,views,date_scraped
HZ-3813,Beauty Collection Vol.114 - Mirai Minano,https://pic.javct.net/poster/06032026/1774942526.jpg,https://javct.net/v/hz-3813,55,2026-03-31
1P-033126-001,Welcome To Luxury Spa: Erika Shiomi,https://pic.javct.net/poster/06032026/1774942407.jpg,https://javct.net/v/1p-033126-001,59,2026-03-31
CR-033126-001,Wednesday Caribbeancom: The theory that actresses who are consulted about big penises are easily able to do it because their curiosity and maternal instincts are stimulated,https://pic.javct.net/poster/06032026/1774942511.jpg,https://javct.net/v/cr-033126-001,26,2026-03-31
XVSR-113-RM,Super! !Rebirth Exploding Breasts Capitalize Deviation 150 Barrage Nagase Asami [Uncensored L**ked],https://pic.javct.net/poster/06032026/1774922079.jpg,https://javct.net/v/xvsr-113-rm,240,2026-03-31
SKMJ-734-RM,Congratulations! Graduation! 30 Innocent Female Students With Almost No Experience With Men In One Class - First-Time Creampie Sex Footage Released 300 Minutes Special [Uncensored L**ked],https://pic.javct.net/poster/06032026/1774548359.jpg,https://javct.net/v/skmj-734-rm,300,2026-03-31
MAQQ-011-RM,"He Was The Most Beautiful Femboy I've Ever Met In The Reiwa Era, A Truly Exceptional Man Who Could Squirt From His Anus. [Uncensored L**ked]",https://pic.javct.net/poster/06032026/1774638065.jpg,https://javct.net/v/maqq-011-rm,120,2026-03-31
MAAN-1159-RM,"[This woman will do anything for her job] An unlucky model who is about to get fired, a big-breasted slim beauty who cannot resist the pressure of a manet, becomes a delivery health girl. Wanting a big project, she turns around with a handsome man in power. Case.10_Sakura (24) [Uncensored L**ked]",https://pic.javct.net/poster/06032026/1774588459765.jpg,https://javct.net/v/maan-1159-rm,68,2026-03-31
865URKN-01701-RM,Ultra-subjective video [A video of sex with the most erotic girl with beautiful breasts and a beautiful ass] [A lewd girl who is more erotic with hotein to relieve her sexual desire in the present than in the future... The best theory] [I was squeezed twice by a beautiful girl with beautiful breasts who feels it with raw insertion] Yui Tenma [Uncensored L**ked],https://pic.javct.net/poster/06032026/1774922454709.jpg,https://javct.net/v/865urkn-01701-rm,93,2026-03-31
483TMG-001-RM,[Newcomer (Akane: 24 years old)] ~ Amateur trial shooting ~ A neat and clean fair-skinned F-cup big breasted beauty nervously has sex for the first time in front of the camera and has her first climax [Uncensored L**ked],https://pic.javct.net/poster/06032026/1774588326270.jpg,https://javct.net/v/483tmg-001-rm,68,2026-03-31
420ERK-098-RM,"Nanami (26) Amateur Hoihoi, Erokyun, Amateur, Married Woman, Housewife, Beautiful Breasts, Short Hair, Slender, Cosplay, Facial, Gonzo, Documentary [Uncensored L**ked]",https://pic.javct.net/poster/06032026/1774691132440.jpg,https://javct.net/v/420erk-098-rm,89,2026-03-31
200GANA-3317-RM,"[Panties interview] Mysterious girl who is too happy even though she just got a boyfriend. She is a college girl who is too happy, and the conversation went in a strange direction lol. Seriously soft, first shoot 2274 [Uncensored L**ked]",https://pic.javct.net/poster/06032026/1774691272515.jpg,https://javct.net/v/200gana-3317-rm,69,2026-03-31
NNPJ-309-RM,A Pure Lady's College Student Miki-chan (19 Years Old) Is The First Time A Masochist Is Savored By A Giant Nampa Muscle And Sexually Shoots Into SEX Until It Shoots AV Shooting 57 Days Nampa JAPAN EXPRESS Vol. 86 [Uncensored L**ked],https://pic.javct.net/poster/20250606/1750031317.jpg,https://javct.net/v/nnpj-309-rm,160,2026-03-31
NHDTC-181-RM,"The Innocent Girl I Stalked Was A Semen-drinking Maniac. When I Woke Up, I Was Unable To Move And Was Under House Arrest In A High School Girl's House... From Then On, I Was Milked And Swallowed In Secret From My Parents. This Is The Best And Worst Story. [Uncensored L**ked]",https://pic.javct.net/poster/06032026/1774637701.jpg,https://javct.net/v/nhdtc-181-rm,120,2026-03-31
NASK-370-RM,Female Captive Restraint Prison And Fo**ed Deep Throat Training 2 [Uncensored L**ked],https://pic.javct.net/poster/06032026/1774637886.jpg,https://javct.net/v/nask-370-rm,96,2026-03-31
MOOR-003-RM,"I Brought In A Cute Girl I Met Through A Dating App And Thought I Would Train Her To Be A Dedicated Maid Of My Choice, But Instead She Slutted Me All Night And Made Me Cum Repeatedly. Riena Ninomiya [Uncensored L**ked]",https://pic.javct.net/poster/20231011/1697858699.jpg,https://javct.net/v/moor-003-rm,120,2026-03-31
PA-033126-100,Let me buy the underwear that you're wearing right now! : A slender married woman who gets turned on when her nipples are tweaked,https://pic.javct.net/poster/06032026/1774942482.jpg,https://javct.net/v/pa-033126-100,60,2026-03-31
MMUS-028-RM,Little Devil Provocative Pretty Girl Yashino Tsubasa [Uncensored L**ked],https://pic.javct.net/poster/06032026/1774922134.jpg,https://javct.net/v/mmus-028-rm,163,2026-03-31
MILD-293-RM,Hitomi Hayasaka Teacher Full Version 2 Mine [Uncensored L**ked],https://pic.javct.net/poster/06032026/1774943165.jpg,https://javct.net/v/mild-293-rm,120,2026-03-31
MARA-004-RM,Seven Herbs Chitose Tits Theater Jcup!110cm [Uncensored L**ked],https://pic.javct.net/poster/06032026/1774922324.jpg,https://javct.net/v/mara-004-rm,164,2026-03-31
10-033126-01,Pussy tug of war : Ai Nakano,https://pic.javct.net/poster/06032026/1774942459.jpg,https://javct.net/v/10-033126-01,16,2026-03-31
LOCK-006-RM,"LOCK-ON@Ruka I Was Creampied By A Kind Teacher. A Betrayal Of A Student Who Had Been So Kind To Me, With A Brutal Raw Fuck. Beautiful Girl With Beautiful F-cup Breasts, Ruka Itoi [Uncensored L**ked]",https://pic.javct.net/poster/06032026/1774638127.jpg,https://javct.net/v/lock-006-rm,114,2026-03-31
GRMO-294-RM,"Amateur boy's real SEX 43 NAOTO, 30 years old [Uncensored L**ked]",https://pic.javct.net/poster/06032026/1774757800280.jpg,https://javct.net/v/grmo-294-rm,60,2026-03-31
SAN-094-RM,Sex 7 250 Minutes Of 6 Married Women Cuckolded By Other People's Sticks Other Than Husband [Uncensored L**ked],https://pic.javct.net/poster/20222612/1673924710.jpg,https://javct.net/v/san-094-rm,250,2026-03-31
FNS-186-RM,Beautiful busty wife Goddess Jun who was cuckolded by the perverted old man who lives next door's nipple kneading development [Uncensored L**ked],https://pic.javct.net/poster/06032026/1774842347551.jpg,https://javct.net/v/fns-186-rm,124,2026-03-31
