code,title,image_url,page_url,views,date_scraped
GOV-003-RM,"[Ranking at the resort pool] Drinking and having sex with a sexy big-breasted girl with a facial deviation value of over 80, creampie bukkake, paco-paco party in Okinawa [Uncensored L**ked]",https://pic.javct.net/poster/01202026/1771629114476.jpg,https://javct.net/v/gov-003-rm,232,2026-02-27
VNDS-3436-RM,Onahole Door-to-Door Saleswoman Aunt 26 [Uncensored L**ked],https://pic.javct.net/poster/01202026/1771865762.jpg,https://javct.net/v/vnds-3436-rm,120,2026-02-27
NEO-847-RM,"Whenever I Cum, I Always Pin My Legs Misaki [Uncensored L**ked]",https://pic.javct.net/poster/01202026/1771698549.jpg,https://javct.net/v/neo-847-rm,120,2026-02-27
812MMC-023-RM,"[Authorized by my husband] [Creampie feels the best when it comes to sex] Minami Wakazuma, a cheating M who loves big dicks, Tokyo Wakazuma Biyori vol.023 [Uncensored L**ked]",https://pic.javct.net/poster/01202026/1772006234537.jpg,https://javct.net/v/812mmc-023-rm,76,2026-02-27
SHXT-001-RM,"Sickly Cute Cheerleader With Sexy Boobs, Sakura Shino [Uncensored L**ked]",https://pic.javct.net/poster/01202026/1771865823.jpg,https://javct.net/v/shxt-001-rm,112,2026-02-27
SMOM-003-RM,"New Abnormal Sexual Intercourse: Forty-Something Mother And Son, Part 3: Kyoko Ichikawa, A Lewd Busty Mother Who Can't Control Her Lust For Her Son's Magnificent Cock [Uncensored L**ked]",https://pic.javct.net/poster/01202026/1771869686.jpg,https://javct.net/v/smom-003-rm,120,2026-02-27
RCKK-001-RM,Nose And Mouth R**e Execution Schoolgirl Nostril Virgin Graduation [Uncensored L**ked],https://pic.javct.net/poster/01202026/1771698361.jpg,https://javct.net/v/rckk-001-rm,122,2026-02-27
MGNL-152-RM,"""Friends Of A Man And Woman Get Closer In Mind And Body Through Mutual Body Measurements!?"" A Neat JD With A Sparkling Smile Deepens Their Bond By Touching Their Bodies With A Male Friend ☆ Unable To Suppress Their Growing Feelings For Each Other, They Forget About Their Boyfriends And Have Forbidden Creampie Sex ♪ [Street Corner Amateur Monitoring #Seira] [Uncensored L**ked]",https://pic.javct.net/poster/01202026/1772158000742.jpg,https://javct.net/v/mgnl-152-rm,104,2026-02-27
RMER-053-RM,Female Body Fluid Lesbians: Breasts And Squirts [Uncensored L**ked],https://pic.javct.net/poster/01202026/1771865887.jpg,https://javct.net/v/rmer-053-rm,128,2026-02-27
MFC-355-RM,"A neat bitch with hidden big breasts escapes from a club's drinking party and looks at the hotel camera, giving her a rich blowjob. She can't stop being excited by the three-dimensional swaying breasts and tight vaginal pressure. Young and energetic sex [Sawayan (university student)] [Uncensored L**ked]",https://pic.javct.net/poster/01202026/1772006301267.jpg,https://javct.net/v/mfc-355-rm,70,2026-02-27
JUY-262-RM,Kissing Sex So Intense She Forgets Her Husband Ryoko Furusawa [Uncensored L**ked],https://pic.javct.net/poster/20220707/1659839079.jpg,https://javct.net/v/juy-262-rm,135,2026-02-27
SDAM-159-RM,New DJ Rana Sengen (20) AV debut [New individual shooting] [Uncensored L**ked],https://pic.javct.net/poster/01202026/1771869254465.jpg,https://javct.net/v/sdam-159-rm,169,2026-02-27
JUBE-038-RM,"I Asked Her If She Wanted To Come Over To My House, And She Actually Did. Arima Mizuki [Uncensored L**ked]",https://pic.javct.net/poster/01202026/1771954014.jpg,https://javct.net/v/jube-038-rm,143,2026-02-27
JYMA-099-RM,"A Lewd Wife Who Has Sex With Her Husband's Boss And Coworkers. A Voluptuous, Busty, Ass-filled Masochistic Wife Who Gets Fucked Hard By Her Big Breasts And Ass. Nina Nishimura. [Uncensored L**ked]",https://pic.javct.net/poster/01202026/1771698921.jpg,https://javct.net/v/jyma-099-rm,120,2026-02-27
FSDSS-295-RM,This Horny Slut Will Whisper Polite Dirty Talk Into Your Ear While Slowly Toying With Your Nipples And Ejaculating Your Cock Over And Over Again At This Men's Massage Parlor Until You're Hopelessly Hooked Momo Honda [Uncensored L**ked],https://pic.javct.net/poster/20212308/1631158206.jpg,https://javct.net/v/fsdss-295-rm,151,2026-02-27
CMF-093-RM,Enema Young Wife Sadistic Uniform M Slave Battle Wakana Hachimori [Uncensored L**ked],https://pic.javct.net/poster/01202026/1771645279.jpg,https://javct.net/v/cmf-093-rm,115,2026-02-27
KUSE-005-RM,"""Premature Ejaculation Can Be Cured By Muscle Training!"" Gachinko SEX 4 Production Without Script * Cum Swallowing On Parade Of Muscular Sk**ls Against Amateur Opponents # Chanyota Slut [Uncensored L**ked]",https://pic.javct.net/poster/01202026/1772157947.jpg,https://javct.net/v/kuse-005-rm,140,2026-02-27
APAK-325-RM,"Creampie Innocent G-cup Gravure Body Hina A Kind Older Sister Type Beautiful Girl Has Sex! ""My Pussy Is Going To Break!"" A Voluptuous, Jiggly Screaming Orgasm! Pounding And Pounding Cowgirl! Lewd Climax Student Guidance Yui Hina [Uncensored L**ked]",https://pic.javct.net/poster/01202026/1771954079.jpg,https://javct.net/v/apak-325-rm,138,2026-02-27
PIYO-014-RM,New Chapter.It Is Taught That Anal Is Another One.~ Anal Also And Ma ○ Ko 2 Holes Perfect Real Inside Out Editing ~ [Uncensored L**ked],https://pic.javct.net/poster/01202026/1772156796.jpg,https://javct.net/v/piyo-014-rm,200,2026-02-27
AEGE-057-RM,"Miyu Hirose, A Perverted Busty Woman Who Blossomed In Outdoor Bondage [Uncensored L**ked]",https://pic.javct.net/poster/01202026/1771699640.jpg,https://javct.net/v/aege-057-rm,155,2026-02-27
MIDE-665-RM,The First Blush Pleasure Feeling Pleasure Sakino Koharu [Uncensored L**ked],https://pic.javct.net/poster/01202026/1772157830.jpg,https://javct.net/v/mide-665-rm,120,2026-02-27
FSDSS-293-RM,"She's Engaging In Deep And Rich Sex, Comparing Her Stepfather With Her Boyfriend Yui Shirasaka [Uncensored L**ked]",https://pic.javct.net/poster/20212308/1632405101.jpg,https://javct.net/v/fsdss-293-rm,121,2026-02-27
393OTIM-633-RM,Secretly from my husband... An affair day trip here. [Uncensored L**ked],https://pic.javct.net/poster/01202026/1772157701724.jpg,https://javct.net/v/393otim-633-rm,80,2026-02-27
SCOP-708-RM,"A Married Woman Wearing No Underwear And No Bra In A Defenseless Manner And Taking Out Trash Noticed My Virgin Gaze, And She Deliberately Flickered Her Breasts And Ma ● Ko! Not Only Does It Flickering, But It Also Tempts Me To Say, ""I Was Excited ...? I Want To See More ...?"" ... 3 [Uncensored L**ked]",https://pic.javct.net/poster/01202026/1772157521.jpg,https://javct.net/v/scop-708-rm,145,2026-02-27
