code,title,image_url,page_url,views,date_scraped
NHDTA-716-RM,Special Out CA Airplane Molester 2 Deluxe Edition In [Uncensored L**ked],https://pic.javct.net/poster/20231011/1697385211.jpg,https://javct.net/v/nhdta-716-rm,200,2026-05-06
APAA-415-RM,Naughty Life Of A Naive Girl With Beautiful Breasts Sumire Uchida [Uncensored L**ked],https://pic.javct.net/poster/20230804/1692419251.jpg,https://javct.net/v/apaa-415-rm,136,2026-05-06
VIPR-069-RM,FetishXXXXX! Erika Sato [Uncensored L**ked],https://pic.javct.net/poster/04112026/adbb74f409.jpg,https://javct.net/v/vipr-069-rm,59,2026-05-06
NHDTB-818-RM,School Intrusion Conceived Group R**e [Uncensored L**ked],https://pic.javct.net/poster/20230804/1694057098.jpg,https://javct.net/v/nhdtb-818-rm,145,2026-05-06
GDRD-015-RM,Red Dragon Erika Ozaki [Uncensored L**ked],https://pic.javct.net/poster/20231912/1705116633.jpg,https://javct.net/v/gdrd-015-rm,133,2026-05-06
DVMM-012-RM,General Men's And Women's Monitoring AV X Magic Mirror Flight Collaboration Project Amateur College Student Couple NTR On The Street! Proud Girlfriend Is Cuckolded With A Big Cock And Inserted Raw With Intercrural Sex! Continuous Vaginal Cum Shot In Front Of My Boyfriend! ! 11 Shots In Total [Uncensored L**ked],https://pic.javct.net/poster/20230804/1693543097.jpg,https://javct.net/v/dvmm-012-rm,220,2026-05-06
CHN-205-RM,I Will Lend You A New Amateur Girl. 101 Pseudonym) Kanna Sugawara (Sales Position) 22 Years Old. [Uncensored L**ked],https://static.javct.net/poster/chn-205.jpg,https://javct.net/v/chn-205-rm,130,2026-05-06
BKD-134-RM,Maternal Copulation - Back **do Road  Shinobu Oishi [Uncensored L**ked],https://pic.javct.net/poster/20222410/1667174951.jpg,https://javct.net/v/bkd-134-rm,110,2026-05-06
AVSA-253-RM,SUPER FISHEYE FETISHISM Powerful Excitement Honey Photo Tall Body Voluptuous Sensual Erotic BODY Yuina Taki [Uncensored L**ked],https://pic.javct.net/poster/20230207/1688788557.jpg,https://javct.net/v/avsa-253-rm,128,2026-05-06
200GANA-3363-RM,"Nice body and busty tits Mitanku [Aki, 32 years old, office worker] A big-breasted beauty who is weak against pressure feels pleasure for the first time in about a year. She shakes her proud H cup and feels it. A real softie, first shot 2291 [Uncensored L**ked]",https://pic.javct.net/poster/04112026/4ba733c0f6.jpg,https://javct.net/v/200gana-3363-rm,0,2026-05-06
AOZ-322Z-RM,A Group Of Robbers Who Push Into The Dark Part-time Job And Aim At The Daughter Of A Wealthy Family With Big Breasts. [Uncensored L**ked],https://pic.javct.net/poster/20230804/1692938674.jpg,https://javct.net/v/aoz-322z-rm,150,2026-05-06
259LUXU-1792-RM,Luxury TV 1778 A lady who hides a burning passion and mysterious charm deep within her calmness. What do you think about her eyes with a sensual expression of ecstasy? [Uncensored L**ked],https://pic.javct.net/poster/20242108/1724313707.jpg,https://javct.net/v/259luxu-1792-rm,75,2026-05-06
NHDTA-498-RM,Aphrodisiac Enema Molester 2 [Uncensored L**ked],https://pic.javct.net/poster/20222311/1671612281.jpg,https://javct.net/v/nhdta-498-rm,230,2026-05-06
JUR-705-RM,"One Day, I Was Suddenly Fired. With A Secret I Can't Tell My Wife, I've Been Hanging Out At My Wife's Best Friend's House Nearby, Indulging In Regular, Unprotected Sex From 9 Am To 5 Pm. Nia [Uncensored L**ked]",https://pic.javct.net/poster/06032026/1775760581.jpg,https://javct.net/v/jur-705-rm,140,2026-05-06
SDAM-169-RM,"A young lady I found at Hakone Onsen.Would you like to enter the men's bath with just a towel? 63 7 beautiful women enjoying a trip get licked and sucked by an old man.The nape, the bulge, the anus, and the face are all wetter than in the bath. [Uncensored L**ked]",https://pic.javct.net/poster/04112026/3aceb79d04.jpg,https://javct.net/v/sdam-169-rm,298,2026-05-06
SAMA-322-RM,38 Bytes Behind The OL Active [Uncensored L**ked],https://pic.javct.net/poster/04112026/e9a4092de0.jpg,https://javct.net/v/sama-322-rm,120,2026-05-06
EUUD-41-RM,Yuko Shiraki Stays At M Man's House And Smiles With A Smile [Uncensored L**ked],https://pic.javct.net/poster/20230804/1692848149.jpg,https://javct.net/v/euud-41-rm,135,2026-05-06
SKMJ-426-RM,"Have A Boyfriend, But A Man And A Woman Who Are Good Friends Are Sticking To The Oil Esthetic Slimy Intercrural Sex Experience! ? A Pounding Oil Massage With A Female Friend Who Has A Girlfriend... Growing Awareness Of The Opposite Sex & Libido WW Oma Kotochi Do Friends Men And Women Who Rub Each Other Can't Keep Their Reason And Insert It Nullly As They Desire? ? 2 [Uncensored L**ked]",https://pic.javct.net/poster/20230908/1694177417.jpg,https://javct.net/v/skmj-426-rm,236,2026-05-06
SUN-096-RM,Beautiful Girl Drinking Record Of Drinking Cum Shot And Sperm On Exposure Date [Uncensored L**ked],https://pic.javct.net/poster/20230804/1693711247.jpg,https://javct.net/v/sun-096-rm,221,2026-05-06
GDRD-014-RM,Red Dragon Nagi Mamiya [Uncensored L**ked],https://pic.javct.net/poster/20231912/1705118723.jpg,https://javct.net/v/gdrd-014-rm,141,2026-05-06
EBOD-417-RM,Bus Tour Guide With Bare Naked Colossal Tits Sakura Kirishima [Uncensored L**ked],https://pic.javct.net/poster/20221108/1661697281.jpg,https://javct.net/v/ebod-417-rm,147,2026-05-06
HUNTB-718-RM,[Made Into AV Without Permission] [Beware Of Too Erotic Big-breasted Office Lady] [Extreme King Game] My Handsome Friend Brought A Big-breasted Office Lady To My House Who Looked Like She Was Going To Have Sex With Me... [Uncensored L**ked],https://pic.javct.net/poster/20231011/1697773134.jpg,https://javct.net/v/huntb-718-rm,210,2026-05-06
DIC-053-RM,"Camera Follows Closely Until This Normal Girl Turns Into A Porn Star! Sensitive Nipple Orgasms Super Anime Voice Currently Working At A Day Care, Rio-Chan's Porn Debut!! [Uncensored L**ked]",https://pic.javct.net/poster/04112026/6caf01a88a.jpg,https://javct.net/v/dic-053-rm,135,2026-05-06
HODV-21547-RM,Personal Training NTR Beautiful Wife Who Fallen In Love With A Trainer In A Private Lesson Mizukawa Miri [Uncensored L**ked],https://pic.javct.net/poster/09052025/1760026948.jpg,https://javct.net/v/hodv-21547-rm,146,2026-05-06
