code,title,image_url,page_url,views,date_scraped
PKPD-050-RM,Completely Private Picture 'pure' Hentai Girl Norizumi Arimura And The First Time Of Two People Alone Drunk Love Hohashigo Stay Arimura Nozomi [Uncensored L**ked],https://pic.javct.net/poster/06032026/1773212841.jpg,https://javct.net/v/pkpd-050-rm,120,2026-04-09
HUNTB-736-RM,"I Spied On The Lesbian Acts Of Two Female Bosses With Big Breasts And Big Butts! Instead Of A Dildo, The Erect Penis Is Pulled Out With A Double Piston Of Big Breasts And Big Ass Sandwich! [Uncensored L**ked]",https://pic.javct.net/poster/20231011/1698379093.jpg,https://javct.net/v/huntb-736-rm,110,2026-04-09
HODV-21505-RM,Beautiful Constricted Body H Cup Intimate Intimate With Mistress Of Ultimate Body Cum Inside 3 SEX Yuria Kano [Uncensored L**ked],https://pic.javct.net/poster/06032026/1775702441.jpg,https://javct.net/v/hodv-21505-rm,124,2026-04-09
SCPX-479-RM,"Even Though It's The First To**ure Experience, The Best Female College Students Get Chained To M Man's Reaction And Wake Up As A Lewd Slut! ! After Stimulating The Erogenous Zones Of The Whole Body And Thoroughly Erotic Playing Down With The Cock, Insert It In A Woman On Top Posture And Rub The Glans In A Good Place And Rub It Into A Good Place Raw Fucking SEX That Does Not End Until You Cum Inside [Uncensored L**ked]",https://pic.javct.net/poster/20230908/1696653733.jpg,https://javct.net/v/scpx-479-rm,200,2026-04-09
HBAD-682-RM,A Beautiful Older Sister Of A Relative Who Used To Be Innocent And Pretty Has Grown Into A Big-assed Slut Who Loves Cock Jun Suehiro Jun Suehiro [Uncensored L**ked],https://pic.javct.net/poster/20241902/1709744805.jpg,https://javct.net/v/hbad-682-rm,131,2026-04-09
SDAM-047-RM,Beautiful Busty Mountain Girls Found At Oze Kogen Onsen Why Don't You Take A Towel With A Men's Bath? Special Mission 13 Spouts Of Oral Ejaculation Licking Each Other's Lower Body Water Drops! [Uncensored L**ked],https://pic.javct.net/poster/06032026/1775701249.jpg,https://javct.net/v/sdam-047-rm,240,2026-04-09
FUNK-048-RM,"During A Nursing Class, I Was Seduced By A Big-assed Gal J○ With Her Plump Body, And I Was Squeezed And Pressed In Cowgirl Position, And Every Last Cum Was Sucked Out. [Uncensored L**ked]",https://pic.javct.net/poster/20231011/1697254457.jpg,https://javct.net/v/funk-048-rm,188,2026-04-09
ESK-290-RM,Doshiro And Daughter To Escalate 290 [Uncensored L**ked],https://pic.javct.net/poster/06032026/1775702576.jpg,https://javct.net/v/esk-290-rm,105,2026-04-09
XRW-594-RM,Demkeba Woman's Appeal Training For Having A Binge Feeling In A Harsh Eyeglass C**ld's Habit! Mako [Uncensored L**ked],https://pic.javct.net/poster/20222612/1672828163.jpg,https://javct.net/v/xrw-594-rm,153,2026-04-09
NGOD-194-RM,"I Was Excited By The Unconscious Butt Meat Provocation Of The Married Woman Next Door, And I Got A Demon With A Big Cock With A Full Erection Until My Husband Was Away... Kanna Misaki [Uncensored L**ked]",https://pic.javct.net/poster/20230207/1691127572.jpg,https://javct.net/v/ngod-194-rm,140,2026-04-09
SCOP-823-RM,"There Is A Rumor That In A Less Popular Alley In Tokyo, There Is A Girl With Big Breasts Who Forces You To Have Endless Sex That Doesn't End Even If You Pull Out! ! Just When I Thought It Was Over, The Climax Loop Continues To Be Fucked With Strings Of Beads. [Uncensored L**ked]",https://pic.javct.net/poster/20230908/1696653870.jpg,https://javct.net/v/scop-823-rm,150,2026-04-09
MIST-350-RM,Strike Her Down On Her Danger Day!! A Babymaking Soapland 32 Kanon Kanade [Uncensored L**ked],https://pic.javct.net/poster/20212709/1633598097.jpg,https://javct.net/v/mist-350-rm,161,2026-04-09
NACR-688-RM,The Ideal Bride Who Fulfills Her Husband's Cuckold Desire Minaho Ariga [Uncensored L**ked],https://pic.javct.net/poster/20230207/1689823617.jpg,https://javct.net/v/nacr-688-rm,120,2026-04-09
MMUS-072-RM,Little Devil Provocation Beautiful Girl Kotone Hana [Uncensored L**ked],https://pic.javct.net/poster/20233001/1676689649.jpg,https://javct.net/v/mmus-072-rm,131,2026-04-09
MARA-022-RM,Mio Hazuki Tits Theater Icup!98cm [Uncensored L**ked],https://pic.javct.net/poster/06032026/1775702229.jpg,https://javct.net/v/mara-022-rm,129,2026-04-09
LULU-147-RM,[R-Shitei] Yurufuwa Nice Bottom Licking Ma Musume Hiizumi Maika Who Cums Uncle's Dobadoba Sperm Whose Concentration Has Increased With Icharab Whole Body Lip At The Store Manager's Home [Uncensored L**ked],https://pic.javct.net/poster/20221904/1654319813.jpg,https://javct.net/v/lulu-147-rm,160,2026-04-09
MIST-348-RM,"A Private Titty Pub The Pub Suddenly Closed Its Doors One Of The Girls There Contacted Me, Saying She Wanted To Meet With Me Privately ... So I Fondled Her Titties In Private, And Creampie Fucked Her, Privately. Monami Takarada [Uncensored L**ked]",https://pic.javct.net/poster/20212308/1631314953.jpg,https://javct.net/v/mist-348-rm,164,2026-04-09
MARA-021-RM,Sayaka Kujo Tits Theater Lcup!120cm [Uncensored L**ked],https://pic.javct.net/poster/06032026/1775702301.jpg,https://javct.net/v/mara-021-rm,121,2026-04-09
HODV-21506-RM,"Hey, Haven't We Had A Break Together For The First Time In A While, So Why Don't We Have Sex All Day Long? Rika Aimi [Uncensored L**ked]",https://pic.javct.net/poster/06032026/1775702367.jpg,https://javct.net/v/hodv-21506-rm,150,2026-04-09
HBAD-683-RM,"I Can't Stand The Defenseless Body Of My Caring Neighbor's Calm, Big-breasted Wife Anymore... Reika Takeda [Uncensored L**ked]",https://pic.javct.net/poster/20241703/1712767676.jpg,https://javct.net/v/hbad-683-rm,126,2026-04-09
TPIN-063-RM,My Room Has Become A 100% All-you-can-eat Room Where I Can't Escape The Temptation Of The Double Big Ass. Nonoka Yukari Rin Amemiya [Uncensored L**ked],https://pic.javct.net/poster/20230908/1696653602.jpg,https://javct.net/v/tpin-063-rm,133,2026-04-09
GVG-711-RM,Naughty Nurses Yu Kawakami () [Uncensored L**ked],https://pic.javct.net/poster/20212011/1644311146.jpg,https://javct.net/v/gvg-711-rm,124,2026-04-09
TENN-013-RM,Outdoor Exposure Training Ring Pleasure Acme Heaven Riko Hashimoto [Uncensored L**ked],https://pic.javct.net/poster/20231011/1697091141.jpg,https://javct.net/v/tenn-013-rm,126,2026-04-09
SOE-542-RM,Saya Tachibana Blow Housecleaning [Uncensored L**ked],https://pic.javct.net/poster/06032026/1775702078.jpg,https://javct.net/v/soe-542-rm,120,2026-04-09
